기사날짜,기사제목,네이버 뉴스 url,기사내용
2021.10.18.,"네이버·카카오 제평위, 올 상반기 뉴스콘텐츠 제휴 통과 매체 '0곳'",https://n.news.naver.com/mnews/article/003/0010776980?sid=101,"기사내용 요약뉴스제휴평가위원회, 올 상반기 뉴스 제휴 평가 결과 발표[서울=뉴시스] 이진영 기자 = 올 상반기 네이버·카카오 포털의 '뉴스콘텐츠 제휴'를 통과한 매체는 없는 것으로 나타났다.네이버와 카카오의 뉴스 제휴 심사를 담당하는 '네이버·카카오 뉴스제휴평가위원회 심의위원회'는 지난 15일 전원회의에서 의결한 2021년 상반기 뉴스 제휴 평가 결과에 대해 뉴스스탠드 제휴 2개, 검색 제휴 13개 등 총 15개 매체가 통과했다고 18일 발표했다. 가장 높은 등급의 제휴인 뉴스콘텐츠 제휴를 통과한 매체는 없었다. 뉴스 제휴 평가는 위원들의 심사 점수 중 최고점수와 최저점수를 제외한 평균 점수를 기준으로 CP는 80점, 뉴스스탠드 제휴는 70점, 뉴스 검색 제휴는 60점 이상이면 통과다.올 하반기 뉴스 제휴 신청은 오는 25일부터 11월 7일까지 네이버와 카카오 양사 온라인 페이지를 통해 진행되며, 서류 검토를 거쳐 12월 중 평가가 시작된다.신청 자격은 신문사업자, 정기간행물사업자, 방송사업자, 인터넷신문사업자, 뉴스통신사업자, 인터넷뉴스서비스사업자로 인·허가를 받은 후 1년이 지난 매체 혹은 등록한 이후 1년이 지난 매체다. 뉴스콘텐츠 제휴는 '포털사'에 '뉴스검색 제휴'로 등록된 후 6개월이 지난 매체만 신청 가능하다.정량평가 20%, 정성평가 80%로 배점으로, 정성평가의 상위 평가항목인 저널리즘 품질요소, 윤리적 요소 중 1개 항목 이상 영역에서 평가위원 과반수로부터 최저 점수 이하를 받게 되면 총점과 상관 없이 제휴 대상에서 제외된다. 평가항목별 최저 점수는 저널리즘 품질 요소 16점, 윤리적 요소 12점이다.뉴스제휴평가위원회 심의위원회 이상민 제1소위 위원장은 ""정성평가에서 상당한 점수를 얻었지만, 자체 기사 검증과 같은 검증 절차에서 탈락하는 매체들이 적지 않았다""며 ""자료에 대해 매체에서 더 꼼꼼하게 확인하고 제출하면 좋겠다""고 말했다.아울러 위원회는 뉴스제휴 입점 및 제재 전반에 대한 문제점을 파악하고 이를 개선하기 위해 태스크포스(TF)팀을 구성하고 이에 대한 논의를 진행했다. 입점 TF는 입점 평가표에 대한 개선, 매체의 인수, 양도에 의한 재평가 프로세스 논의, 자체기사 검증 프로세스 등에 대해 논의하고 제재 TF는 '제휴매체' 기사 이외 기사 전송 벌점 체계 개선, 벌점 과다 매체에 대한 처리 방안 등에 대해 논의한다. 입점 및 제재 TF는 12월까지 논의, 규정 개정 작업을 거쳐 내년 적용을 목표로 하고 있다．"
2021.10.18.,"카카오브레인, 국제 AI 학회에서 영상 부문 챌린지 우승",https://n.news.naver.com/mnews/article/014/0004724633?sid=105,"[파이낸셜뉴스] 카카오브레인의 AI 기술 역량이 세계적인 학회 챌린지에서 높은 점수를 받았다.   카카오브레인은 'ICCV(International Conference on Computer Vision) 2021'의 벨류 챌린지에서 우승했다고 18일 밝혔다. ICCV는 매해 1600개 이상의 논문이 제출되는 세계적인 컴퓨터 비전 학회로, 개최 전 경쟁 챌린지를 진행한다.   카카오브레인이 참여한 벨류 챌린지는 AI의 영상 인식·이해 능력을 평가하는 대회다. 영상을 실시간으로 이해하고 판단하는 AI 기술 수준 등이 중요한 평가 요소다.    카카오브레인 CI. 카카오 제공.카카오브레인은 3개의 평가 과목 중 '영상 내 비디오 정보와 문자 정보를 가지고 AI가 앞뒤 맥락을 유추해 문제에 대한 답을 해결하는 과제'에서 1등에 오르며 종합 우승을 차지했다.   신민철 카카오브레인 Video Understanding팀 AI 리서처는 ""카카오브레인이 AI 기술의 높은 성과를 증명하고 이를 인정받아 영광""이라며 ""카카오브레인은 향후 비디오 인식 분야에서 새로운 방법론을 개발하는 등 영상 관련 혁신 기술을 선보이기 위해 매진할 것""이라고 했다. #카카오 #인공지능 #AI #카카오브레인"
2021.10.18.,"지키려는 카카오, 뺏으려는 우티·타다…연말 ‘플랫폼 택시’ 삼파전",https://n.news.naver.com/mnews/article/366/0000767275?sid=105,"우티, 티맵 내비 역량에 우버 기술력으로 무장 타다, 토스 업고 널찍한 이동경험 재현해 승부  “이미 카카오에 락인… 큰 균열 없을 것” 전망도서울 시내를 운행 중인 카카오택시. /연합뉴스        매달 1000만명 이상이 쓰는 택시호출 애플리케이션(앱) 카카오T가 최근 택시기사와 이를 이용하는 승객을 대상으로 과도하게 수수료 장사를 하고 있다는 비판이 거세지면서 우티 등 경쟁 앱으로 넘어갔다는 사례가 속속 나오고 있다. 연말 우티·타다 등 택시호출 앱 후발주자의 본격적인 행보가 예고되고 있어 카카오가 장악하고 있는 현재 시장에 균열이 생길지 주목된다.18일 모바일인덱스에 따르면, 현재 택시호출 앱의 월간 활성 사용자 수는 카카오T가 1016만명(2021년 8월 기준)으로 가장 많다. 우티(86만명), 타다(9만명)가 그 뒤를 잇고 있으나 격차가 큰 상황이다. ‘우버’ 색깔 입는 우티… ‘옛 영광 재현’ 타다        지난 4월 SK텔레콤의 자회사 티맵모빌리티와 글로벌 모빌리티 회사 우버가 합작법인으로 만든 우티는 오는 11월 1일 신규 서비스 출시를 목표로 현재 베타 테스트 중이다. 현재 운행 중인 티맵택시, 내비게이션 데이터에 우버의 글로벌 기술력, 노하우를 응집하겠다는 계산이다.그래픽=손민균        최근 간편 송금 등 금융 플랫폼 ‘토스’를 운영하는 비바리퍼블리카에 전격 인수된 타다는 지난해 3월 이른바 ‘타다 금지법(개정 여객자동차법)’ 통과로 사라진 ‘타다 베이직’을 오는 12월 부활시키겠다는 계획을 세웠다. 현재 서비스 중인 가맹택시 ‘타다 라이트’, 준고급 택시 ‘타다 플러스’의 존재감이 미미한 만큼 이전에 소비자들의 좋은 반응을 얻었던 대형 택시 모델을 재현해내겠다는 것이다. 이를 위해 타다는 스타리아 9인승, 4세대 카니발 등 대형 차량 1000대 정도 운행하는 것을 목표로 기사를 모집하고 있다.토스 관계자는 “타다 베이직과의 차이는 법적 문제가 없도록 렌터카가 아닌 택시 면허를 기반으로 하고 있는 것”이라면서 “승객들이 과거 타다 베이직에서 이동경험이 좋다고 느꼈던 이유 중 하나였던 공간적 여유를 다시 제공하겠다”라고 했다. “카카오 독점 계속” vs “균열 가능성”        전문가들은 이미 ‘카카오T’에 익숙해진 소비자들이 타 서비스로 넘어가기가 쉽지 않을 것이라고 내다봤다.안기정 서울연구원 연구위원은 “연말 회식 등으로 택시를 잡기 힘들어지거나 호출비 무료, 택시비 할인쿠폰 등의 마케팅이 있을 경우 우티, 타다 등으로 일부 사용자가 넘어갈 가능성은 있다”라면서도 “플랫폼은 한 번 쓰면 옮기기 힘든 락인(lock in·고객 가두기) 효과가 있기 때문에 전체적인 시장 상황은 큰 변동이 없을 것”이라고 했다.신민수 한양대 경영학부 교수는 “사용자들이 카카오T를 쓰는 이유는 카카오페이 등 카카오의 다른 서비스와 결합돼 있는 것도 큰 영향을 미치고 있다”라면서 “후발주자가 존재감을 발휘하기 위해서는 얼마나 다양한 서비스와 결합해 소비자들에게 편익을 주고 인지도를 끌어올리느냐에 달려있다”라고 했다.또 다른 관전 포인트는 정부·정치권에서 이어지고 있는 ‘카카오 때리기’가 어떤 강도로, 얼마만큼 이어질 것인가다. 플랫폼 독점 폐해에 대한 사회 우려가 커지면서 최근 소상공인연합회가 산하에 ‘온라인 플랫폼 공정화위원회’를 가동했고, 정치권에서 이와 관련한 규제 움직임이 이어질 것으로 예상된다. 후발주자로선 자연스레 경쟁에 유리한 환경이 조성될 수 있다.모빌리티 업계 관계자는 다만 “카카오모빌리티는 상생에 대한 정치권의 요구를 받고 있는데, 단순히 기금으로 해결될 수 있는 것이라면 택시호출 앱 시장은 카카오 독주라는 큰 틀이 흔들리지 않을 것”이라고 했다."
2021.10.18.,"또·또 국감 가는 카카오 김범수, '상생' 도돌이표 되나",https://n.news.naver.com/mnews/article/003/0010777066?sid=101,"기사내용 요약21일 과방위 종합국감에 네이버 이해진과 증인 채택'뉴스 알고리즘' 검증 보다는 '카카오 국감' 재연 우려김범수 의장 '추가 상생안' 발표 가능성 기대[서울=뉴시스] 최동준 기자 = 김범수 카카오 의장이 7일 서울 여의도 국회에서 열린 산업통상자원중소벤처기업위원회의 중소벤처기업부 등에 대한 국정감사에서 잠시 생각에 잠겨 있다. (공동취재사진) 2021.10.07. photo@newsis.com[서울=뉴시스] 오동현 기자 = 카카오 김범수 의장이 올해만 세 번째 국정감사 증인으로 출석하게 된다. 앞선 국감에서 플랫폼 기업의 '사회적 책임'을 요구받았던 김 의장이 어떤 후속 대책을 들고 나올지 주목된다.김 의장은 지난 5일 정무위원회(정무위), 7일 산업통상자원중소벤처기업위원회(산자위)에 이어 오는 21일 과학기술정보방송통신위원회(과방위)에서도 부름을 받았다.18일 국회와 IT업계에 따르면 과방위는 방송통신위원회 종합국감 증인으로 김 의장과 함께 네이버 창업자 이해진 글로벌투자책임자(GIO) 등을 채택했다. 현재까지 카카오와 네이버 모두 불출석 사유서를 제출하지 않은 만큼, 두 수장의 출석 가능성이 높아 보인다. 성사될 경우 두 회사의 창업자가 한 국감에 동반 출석하는 첫 사례가 된다. 다만 앞선 국감에 출석했던 김 의장과 달리 이 GIO는 해외출장 등의 사유로 불출석하거나 다른 임원이 대리 출석할 가능성도 제기된다. 이 경우 카카오와 네이버 두 수장을 모두 불러 '뉴스 알고리즘'을 검증하겠다는 과방위의 명분은 약해질 수밖에 없다.과방위는 내년 대선을 앞두고 카카오와 네이버의 '뉴스 편집 인공지능(AI) 알고리즘' 중립성 문제를 다룰 전망이다. 이 문제는 매년 국감 단골 소재였다. 여야 의원들은 알고리즘 공개를 요구해왔고, 네이버와 카카오는 영업기밀이나 다름 없는 알고리즘을 공개하기 보단 뉴스 배열이나 댓글 정책을 개선하는데 힘썼다. 올해 과방위 국감은 '뉴스 알고리즘' 못지 않게 플랫폼 기업의 독과점 및 골목상권 침해 문제에도 큰 비중을 실을 것으로 보인다. 문제는 이미 앞선 국감에서 김 의장을 비롯한 플랫폼 기업인들을 소환해 유사한 질문을 되풀이한 만큼 이번에도 기업인 망신주기식 국감에 그칠 것이란 우려다. 국정감사가 아닌 기업감사가 아니냐는 목소리도 나온다.반면 이번 종합국감이 김 의장이 약속했던 상생 이행안을 구체적으로 설명하는 자리가 될 수도 있다는 점은 긍정적이다. 최근 김 의장을 비롯해 카카오 주요 계열사 대표들이 상생안 이행을 위해 비공개 전체회의를 가진 것으로 전해졌다. 지난달 발표한 상생안을 보다 강화하고 구체적으로 이행하기 위해 논의하는 자리였다.  [서울=뉴시스] 전신 기자 = 김범수 카카오 의장이 5일 서울 여의도 국회에서 열린 정무위원회의 공정거래위원회 등에 대한 국정감사에 출석해 있다. (공동취재사진) 2021.10.05. photo@newsis.com카카오와 주요 계열사 대표들은 국감을 앞둔 지난달 13일과 14일에도 전체회의를 열고 ▲골목상권 논란 사업 철수 및 혁신 사업 중심으로 재편 ▲파트너 지원 확대를 위한 기금 5년간 3천억 원 조성 ▲케이큐브홀딩스 사회적 가치 창출 집중 등 사회적 책임을 강화하기로 결정했다. 김 의장은 지난 두 차례의 국감에서 ""논란을 일으킨 점 사과드린다"", ""명심하겠다""는 말을 반복하며 ""골목상권을 절대 침해하지 않겠다""고 밝혔다. 또 ""성장에 취해 사회적 책임을 다하지 못한 것에 통렬히 반성한다. 초심으로 돌아가는 노력을 뼈를 깎는 심정으로 하겠다""며 추가 상생안을 마련, 이행하겠다고 약속했다. 특히 이번 과방위 종합국감에서 짚고 넘어가야 할 문제도 있다. 카카오모빌리티가 공식적으로 철수하겠다고 밝혔던 '꽃·간식·샐러드 배달' 중개 서비스와 '택시 유료 호출 서비스'와 달리 카카오헤어샵, 문구·완구 사업, 스크린골프 사업 등은 김 의장이 국감 현장에서 즉흥적으로 사업 철수 검토를 언급했던 만큼 투자사나 관계사들과 풀어야할 숙제가 적지 않다.  카카오 관계자는 ""아직 국감이 진행되고 있어 구체적인 상생 이행안을 밝히긴 어렵다""면서도 ""김 의장이 약속했던 바를 이행하기 위해 내부에서도 논의 중""이라고 전했다."
2021.10.18.,플랫폼 때리기에도…네이버·카카오 실적은 활짝,https://n.news.naver.com/mnews/article/277/0004984680?sid=105,"정부·여당이 플랫폼 기업들을 겨냥하면서 IT업계에는 칼바람이 불고 있지만 네이버·카카오는 3분기에도 호실적을 기록할 전망이다. 카카오는 올해 국정감사에서 문어발식 사업 확장이 도마에 올라 뭇매를 맞았다. 카카오는 광고 사업 덕에 3분기 높은 성장률을 이어가지만 카카오모빌리티 등 기존 사업 모델에 대한 고민은 깊어진 상황이다.18일 금융정보분석업체 에프앤가이드에 따르면 네이버의 3분기 매출 추정치는 1조7840억원으로 전망됐다. 이는 전년 대비 31% 증가한 수치다. 영업이익은 26% 성장한 3670억원으로 예상됐다. 네이버는 검색·디스플레이 광고 부문의 성장세가 지속되고 있다. 또 온라인 쇼핑 등이 코로나19 특수를 누리면서 커머스 사업 부문 역시 지난해에 비해 40%가량 성장하며 호실적을 견인했다. 콘텐츠 매출 역시 네이버 웹툰이 라인업을 확충하면서 신성장 동력으로 자리매김하고 있다는 평가다.카카오는 3분기 매출액은 1조6000억원, 영업이익은 1925억원으로 전년 대비 각각 47.7%, 60.1% 증가할 것으로 추정됐다. 카카오톡 광고인 ‘톡비즈’의 매출이 성장하면서 광고사업이 효자 노릇을 했다. 핀테크, 모빌리티도 매출이 성장했고 특히 콘텐츠 매출액이 8079억원 규모로 큰 폭으로 성장할 것으로 분석됐다. 카카오게임즈의 다중접속역할수행게임(MMORPG) ‘오딘:발할라 라이징’이 역대급 흥행에 성공하면서 큰 기여를 했다. 모바일인덱스에 따르면 ‘오딘’은 3개월 연속 구글 플레이·애플 앱스토어 통합 매출 순위 1위를 기록하고 있다.다만 정부·여당의 규제로 국내 시장의 혁신 분위기가 위축되면서 네이버·카카오는 글로벌 사업으로 눈을 돌려야 하는 상황이 됐다. 올해 글로벌 사업에 박차를 가한 네이버는 점차 성과를 나타내고 있다. 네이버제트의 메타버스 플랫폼 제페토는 전세계 이용자가 2억명을 돌파했다. 제페토의 글로벌 결제액도 전년 대비 99%가량 증가한 것으로 예상됐다. 네이버웹툰 역시 글로벌 결제액이 지속적으로 늘고 있다. 네이버는 지난 1월 세계 최대 웹소설 플랫폼 ‘왓패드’를 인수하고 북미 시장 확대에도 적극적으로 나선 상황이다. 올해는 일본 국민메신저인 ‘라인’을 통해 스마트스토어 사업도 본격화할 전망이다.반면 카카오의 경우 웹툰 사업을 제외하고는 여전히 해외에서 두각을 드러내지 못하고 있다. 게다가 카카오의 기존 사업방식이 여론의 뭇매를 맞으면서 새로운 성장모델에 대한 고민이 깊어졌다. 전문가들은 카카오가 해외에서도 인수합병(M&A) 등 비슷한 패턴을 보일 것이라고 관측했다. 위정현 중앙대 경영학과 교수는 ""국내에서 M&A로 성장했던 카카오는 해외 사업에도 같은 방식을 적용할 것""이라며 ""국내에서는 중소플랫폼과 공존하는 오픈마켓 형태를 취할 가능성이 높다""고 말했다."
