기사날짜,기사제목,네이버 뉴스 url,기사내용
2021.10.31.,"'공산당에 충성, 이효리에 분노, 나이키는 불매'…中 '애국청년'을 아시나요",https://n.news.naver.com/mnews/article/008/0004663960?sid=104,"[""국가가 최고의 아이돌"" 중국 찬양, 외국은 무차별 비난·배척…인터넷 장악한 '21세기 홍위병', '국뽕' 취해 애국 부르짖어]지난 7월 중국 공산당 100주년 기념식에서 공개적으로 충성 맹세를 한 펑린/ 펑린 웨이보 캡처""(공산)당이여 안심하라, 강국에는 내가 있다."" 지난 7월 베이징 톈안먼광장에서 열린 중국 공산당 100주년 기념식에서 공개적으로 충성 맹세를 한 여대생 펑린은 유명한 애국 인사다. 아나운서를 꿈꾸는 펑린은 중국판 트위터인 웨이보에서 중국 우주비행사에 대한 찬사를 전하는가 하면 한국 6.25 전쟁을 배경으로 한 영화 '장진호'에 대한 경의를 표한다. ""유럽연합(EU)은 미국의 목줄에 끌려다니는 개다."" ""미국에서 신종 코로나바이러스 감염증(코로나19) 확진자가 늘어나는 것은 미국 정부가 자국민을 죽이려는 생물학전 증거다."" 이 과격한 문구들은 사회관계망서비스(SNS) 팔로어 640만명을 거느린 파워 인플루언서 슈창(필명 구옌무찬)이 자신의 웨이보와 트위터 등에 올린 것이다. 슈창은 주로 중국을 찬양하고 서구에 대해 무차별적 비난을 쏟아낸다. ━애국심+국수주의 똘똘 뭉친 '자간오' 급증━시진핑 중국 국가주석/AP=뉴시스중국에서 '국뽕(국가에 대한 지나친 자부심)'에 취해 애국주의를 부르짖는 젊은 극우 청년들이 늘고 있다. 교육·문화·경제 등 사회 전반에서 글로벌 색채를 지우고 중국을 강조하는 이른바 '시진핑 사상'이 불러온 '제2의 홍위병'이라는 해석이 나온다. 홍위병은 중국의 문화대혁명(1966~1976년) 시절 준군사적인 조직을 이뤄 투쟁한 대학생과 고교생 집단이다. 지난 21일(현지시간) 영국 BBC방송은 애국심과 국수주의로 똘똘 뭉친 소셜미디어 게시물을 쏟아내는 젊은이들을 뜻하는 '자간오'가 급증하고 있다고 보도했다. 중국에는 과거에도 정부를 찬양하는 글을 올리는 인터넷 댓글부대가 있었다. 게시물당 5마오(약 90원)를 받는다고 해서 '우마오'로 불렸다. 그런데 몇 년 전부터 정부의 지원 없이도 옹호 댓글이나 게시물을 올리는 젊은 애국 청년들이 등장한 것이다.  자간오는 '스스로 나서서 활동하는 우마오'의 줄임말이다. 스스로 원해서 중국 공산당과 정부를 위해 일한다는 의미도 있다. 중국 정부 관리와 그 가족들로 구성돼 있다는 점이 특징이다. 원래 중국에서 정치적으로 민감하거나 거짓 정보가 담긴 게시글은 웨이보나 위챗(중국판 카카오톡)에서 정기적으로 삭제된다. 하지만 자간오의 글들은 예외다. 심지어 이들의 검증되지 않은 주장이 관영매체에 소개돼 파급력이 더욱 커진다고 BBC는 지적했다. 또 페미니즘, 인권, 다문화, 민주주의 등이 중국 사회를 부패시킨다며 무차별 공격한다. '어린이들이 오전에 우유를 한잔씩 마시면 성장에 도움이 된다'는 상식에 대해서도 ""중국 전통 아침식사와 가치를 무시하냐""며 비난을 퍼붓는다. 중국 우한의 코로나19 실상을 밝힌 작가 팡팡에 대해서는 ""조국의 등을 찌른 배신자""라며 맹공격했다. ━외국 배척하는 '분노청년·소분홍'도…한국 관련 가짜뉴스도 만들어━지난 7월 중국 공산당 100주년 기념식에서 학생들이 국기를 흔들고 있다. /사진=AFP자간오 외에 '분노청년', '소분홍' 등 맹목적으로 국가에 충성하며 외국을 배척하는 중국 극우 청년집단을 일컫는 용어도 있다. '21세기 홍위병'으로 불리는 분노청년 인터넷을 통해 극단적인 분노를 표출하는 집단을 의미한다. 분노청년 중에서도 1990년대 이후 태어난 급진적 애국주의 네티즌을 작은 분홍색이라는 의미의 소분홍이라고 부른다. 이들이 모여 애국주의 성향을 표출하는 사이트의 색상이 분홍색이어서 붙여진 이름이다. 아이돌과 팬덤 문화에 익숙한 이들은 ""국가보다 중요한 아이돌은 없다""며 중국에 대한 무한 애정을 드러낸다. 나이키·아디다스·버버리·H&M 등 글로벌 브랜드 불매운동을 이끄는 것도 이들이다. 소분홍은 SNS 등에 ""외국 제품을 쓰는 사람은 매국노"", ""중국 제품을 쓰지 않는 사람은 중국인이 아니다"" 등 자극적인 문구로 공격한다. 한국에 대한 잘못된 정보를 퍼뜨리고 특정 연예인에 대한 공격도 서슴지 않는다. ""명성황후는 중화민국 초대대통령인 위안스카이의 첩"", ""김치와 한복은 중국 것"", ""한국인은 단오 등 중국 문화를 도용한 도둑"" 등이 대표적인 가짜 뉴스다. 방탄소년단(BTS)의 수상소감이 친미 성향이라고 문제 삼는가 하면, 이효리가 예능 프로그램에서 언급한 예명 '마오'가 중국 공산혁명을 이끈 마오쩌둥 전 국가주석을 모욕했다며 달려든다. ━'젊은 극우' 왜 생겼나 …지나친 공격성에 中 비호감도 높아져━한국 6.25전쟁을 중국 관점에서 해석한 영화 '장진호' 영화 포스터/중국에서 극단적인 젊은 애국세력이 급증한 배경에는 시진핑 국가주석의 강력한 정체성 홍보 의지가 깔려 있다고 BBC는 분석했다. 중국 정부가 별도의 비용을 지불하지 않아도 국가의 목소리를 홍보하고 지지하는 자간오·소분홍 등 애국 청년들의 게시물이 퍼져나갈 수 있는 시스템을 만들어 놨다는 것이다. 또 애국 게시물에 광고와 유료 콘텐츠를 통해 상당한 수익을 얻는 구조가 형성되면서 국가와 이들 세력 사이에 일종의 공생관계가 맺어졌다는 해석도 덧붙였다. 이들이 톈안먼사태 직후인 1990년대 이후 애국주의 주입식 교육을 받고 자란 세대라는 점도 한 요인이다. 중국이 외세에 당한 수모를 집중적으로 가르친 것이 서구에 대한 무차별 비난을 쏟아내는 밑거름이 됐다. 영화 '장진호'를 보고 오열하는가 하면 영화 속 장면을 따라하는 등 깊이 몰입하는 것도 같은 이유다. 영화 장진호 상영이 끝난 뒤 자리를 뜨지 않고 거수경례를 하는 젊은 관람객들/ 웨이보 캡처 애국 청년들의 공격성이 국제사회에서 중국의 비호감도를 더 높이는 요소라는 지적도 나온다. 지난해 미국 여론조사기관인 퓨리서치센터가 14개국을 대상으로 조사한 결과 한국·호주·영국·미국 등 9개국에서 중국에 대한 부정평가가 역대 최고치를 기록했다. 대다수 나라에서 4명 중 3명 이상이 중국에 대해 부정적인 반응을 보였다. 중국 내에서도 지나친 애국주의에 대한 우려가 있다. 베이징대 국제문제연구소의 위안난성 부소장은 ""중국은 개방 확대를 지속하고 국내 포퓰리즘 상승을 막아야 한다""고 지적했다. 최근 중국공산주의청년단(공청단)은 공식 계정을 통해 ""사람을 끌어모으려는 목적의 애국 발언과 조작은 안된다""며 ""애국 관련 콘텐츠를 상업적으로 활용하는 것은 국가에 대한 모독""이라는 입장을 내놓기도 했다."
2021.10.31.,1일 오전 5시부터 '위드코로나'…사적모임 10∼12명까지·24시간 영업·유흥시설 밤 12시까지,url없음,<네이버 기사 없음>
2021.10.31.,"포르쉐코리아, 국내 아티스트 지원 ‘드리머스 온’ 캠페인 성료",https://n.news.naver.com/mnews/article/029/0002703614?sid=103,"포르쉐코리아는 지난 29일 서울 강남구 파르나스 타워에 위치한 포르쉐코리아 오피스에서 국내 신진 디자이너 및 아티스트를 지원하는 '드리머스 온' 캠페인 어워드 시상식을 진행했다고 31일 밝혔다.이번 캠페인은 지난 6월 '드리븐 바이 드림, 드리븐 바이 포르쉐'를 주제로 참가자를 모집하고 페인팅(회화 등), 그래픽스(일러스트 등), 모션그래픽스 등 3개 부문에서 20팀의 본선 진출자를 선정했다.본선 작품들은 지난달부터 두 달간 '제9회 광주디자인비엔날레'에서 전시됐으며, 전시 기간 중 마스터 2차 심사와 온라인 투표 및 브랜드 심사를 통해 각 부문 별 최종 우승자를 선정했다. 특히 카카오톡 투표로 진행된 대국민 대상 온라인 투표에는 약 1만명의 시민들이 참여했다.최종 우승자에는 최주림, 이현준, 노비스르프 3인이 선정됐다. 페인팅 부문 우승자 최주림 작가의 작품은 살아 움직이며 질주하는 '꿈'의 자동차 포르쉐 911을 강렬한 색채로 표현했으며, 그래픽스 부문의 이현준 작가는 아들과 함께 포르쉐 911 GT3의 데칼을 실제 비율로 제작해 순수한 이상을 현실로 바꿔보는 시도를 선보였다. 모션그래픽스 부문의 노비스르프(박준식) 작가는 불을 이용해 그림을 그리는 회화 방식을 통해 브랜드 창업자 페르디난트 포르쉐의 초상화와, 그 과정을 영상에 담아 회화와 영상이 어우러지는 전시를 구성했다.최종 우승 작품들은 다음달 개최 예정인 '2021 서울모빌리티쇼'의 포르쉐코리아 부스를 포함해 다양한 전시 기회가 주어진다. 또 본선에 진출한 아티스트들과의 다양한 협업도 이루어질 예정이다.포르쉐 AG는 뉴욕 타임스퀘어와 같은 전 세계 유명 빌보드를 디지털 캔버스로 활용해 디지털 아트를 선보이는 '글로벌 갤러리'를 통해 글로벌 아티스트들의 다양한 작품을 선보이고 있다.북미, 유럽, 아시아 5개 주요 도시가 참여하는 이번 '글로벌 갤러리' 전시에는 '드리머스 온' 아트 어워드의 모션그래픽스 부문에 참가했던 국내 아티스트 '주누와나(박윤주, 정준우)'가 전 세계 11개 팀 중 하나로 선정됐다. 이들의 자율동력에 대한 건축적 서사가 담긴 작품 '뿔과 바람'은 서울 강남-삼성역 일대 및 이태원의 옥외매체를 통해 전시된다.최영환(왼쪽부터) 포르쉐코리아 마케팅 전무, 수상자 노비스르프, 홀가 게어만 대표, 수상자 최주림, 크리스찬 나타 대표 및 최고CFO. 수상자 이현준이 지난달 29일 서울 강남구 파르나스 타워에 위치한 포르쉐코리아 오피스에서 시상식 후 기념사진을 찍고 있다. 포르쉐코리아 제공"
2021.10.31.,"""보험, 편하게 비교하고, 알뜰하게 가입하세요!""",url없음,<네이버 기사 없음>
2021.10.31.,코로나19 이후 미래상은?...2022 트렌드 주목,https://n.news.naver.com/mnews/article/052/0001659251?sid=103,"[앵커]우리 삶에 엄청난 영향을 주고 있는 코로나19 이후의 미래상을 그려보는 전망서들이 관심을 끕니다.많은 준비를 하고 사회에 뛰어들었지만 취업난의 고통에 시달리는 미국의 20∼30대를 분석한 책도 있습니다.새로 나온 책, 박석원 앵커가 소개합니다.[기자]<세계미래보고서 2022> 박영숙.제롬 글렌 / 비즈니스북스""코로나19 팬데믹 이후 생존을 위한 대변화를 맞은 인류는 앞으로 어떤 준비를 해야 할까요?""지난해 펴낸 <세계미래보고서> 포스트 코로나 특별판에서 각 분야의 변화와 전망을 담은 데 이어 지구촌이 겪은 지각변동이 만들어내는 미래상을 그렸습니다.저자들은 코로나 이후의 세상에서 살아갈 신인류를 메타 사피엔스(Meta Sapiens)라고 지칭하고 새로운 축이 될 6대 트렌드를 제시합니다.우주 개발 경쟁과 로봇과의 동거, 인공지능(AI)  메타버스, 노화의 종말, 기후 위기 대응, ESG 경영이 그것입니다.< 라이프 트렌드 2022 > 김용섭 / 부키꼬박 2년간 코로나19로 혹독한 변화를 겪은 뒤 더 나은 일상과 행복을 추구하는 가운데 2022년은 뉴 노멀이 아니라 베터 노멀의 해가 될 것입니다.일상 속 사례와 스토리텔링을 활용해 10년째 내년 트렌드를 소개해온 저자는 집에서 식물을 가꾸는 홈 가드닝과 완전한 채식주의, 디지털 자산의 확대 등 12가지를 제시합니다.저자는 특히 우리나라의 공동체 지수가 OECD 국가 중 최하위이며, 남성, 저소득층, 고령자일수록 낮다는 점을 지적합니다.<요즘 애들> 앤 헬렌 피터슨 / RHK(알에이치코리아)밀레니얼 세대인 20-30대는 부모의 권유대로 좋은 대학에 들어가기 위해 노력했지만 최악의 취업난과 높은 실업률에 봉착합니다.30대 후반인 저자는 부모처럼 살기 싫지만 부모만큼 되기도 어렵고, 최고의 학력을 쌓고 가장 많이 일하지만 제일 적게 버는 것이 밀레니얼 세대라고 말합니다.'번아웃' 상태에 놓인 20-30대가 왜 불안한지 물음을 던지면서, 부모뻘인 베이비붐 세대를 향해 ""3루에서 태어났으면서 3루타를 쳤다고 착각하고 있다""고 비판합니다.<새로운 시대의 부, 디지털 자산이 온다> 정구태 / 미래의창심각한 찬반 논란에도 불구하고 가상화폐를 비롯한 디지털 자산은 다양한 모습으로 우리 삶 가까이에 와있습니다.저자는 우리 생활에 큰 영향을 미친 인터넷과 마찬가지로 2008년 비트코인을 필두로 한 디지털 자산은 이제 거스를 수 없는 물결이라고 진단하고 미래상을 그리고 있습니다.다양한 디지털 자산의 개념을 정리하고 스타벅스와 테슬라, 네이버, 카카오 등 국내외 기업의 대응 사례를 소개합니다.지금까지 새로 나온 책이었습니다."
2021.10.31.,"하나은행, 소상공인 사이버금융범죄 피해보상보험 무상가입 지원",url없음,<네이버 기사 없음>
2021.10.31.,"포르쉐코리아, 국내 아티스트 지원 ‘드리머스 온’ 캠페인 성료",https://n.news.naver.com/mnews/article/029/0002703614?sid=103,"포르쉐코리아는 지난 29일 서울 강남구 파르나스 타워에 위치한 포르쉐코리아 오피스에서 국내 신진 디자이너 및 아티스트를 지원하는 '드리머스 온' 캠페인 어워드 시상식을 진행했다고 31일 밝혔다.이번 캠페인은 지난 6월 '드리븐 바이 드림, 드리븐 바이 포르쉐'를 주제로 참가자를 모집하고 페인팅(회화 등), 그래픽스(일러스트 등), 모션그래픽스 등 3개 부문에서 20팀의 본선 진출자를 선정했다.본선 작품들은 지난달부터 두 달간 '제9회 광주디자인비엔날레'에서 전시됐으며, 전시 기간 중 마스터 2차 심사와 온라인 투표 및 브랜드 심사를 통해 각 부문 별 최종 우승자를 선정했다. 특히 카카오톡 투표로 진행된 대국민 대상 온라인 투표에는 약 1만명의 시민들이 참여했다.최종 우승자에는 최주림, 이현준, 노비스르프 3인이 선정됐다. 페인팅 부문 우승자 최주림 작가의 작품은 살아 움직이며 질주하는 '꿈'의 자동차 포르쉐 911을 강렬한 색채로 표현했으며, 그래픽스 부문의 이현준 작가는 아들과 함께 포르쉐 911 GT3의 데칼을 실제 비율로 제작해 순수한 이상을 현실로 바꿔보는 시도를 선보였다. 모션그래픽스 부문의 노비스르프(박준식) 작가는 불을 이용해 그림을 그리는 회화 방식을 통해 브랜드 창업자 페르디난트 포르쉐의 초상화와, 그 과정을 영상에 담아 회화와 영상이 어우러지는 전시를 구성했다.최종 우승 작품들은 다음달 개최 예정인 '2021 서울모빌리티쇼'의 포르쉐코리아 부스를 포함해 다양한 전시 기회가 주어진다. 또 본선에 진출한 아티스트들과의 다양한 협업도 이루어질 예정이다.포르쉐 AG는 뉴욕 타임스퀘어와 같은 전 세계 유명 빌보드를 디지털 캔버스로 활용해 디지털 아트를 선보이는 '글로벌 갤러리'를 통해 글로벌 아티스트들의 다양한 작품을 선보이고 있다.북미, 유럽, 아시아 5개 주요 도시가 참여하는 이번 '글로벌 갤러리' 전시에는 '드리머스 온' 아트 어워드의 모션그래픽스 부문에 참가했던 국내 아티스트 '주누와나(박윤주, 정준우)'가 전 세계 11개 팀 중 하나로 선정됐다. 이들의 자율동력에 대한 건축적 서사가 담긴 작품 '뿔과 바람'은 서울 강남-삼성역 일대 및 이태원의 옥외매체를 통해 전시된다.최영환(왼쪽부터) 포르쉐코리아 마케팅 전무, 수상자 노비스르프, 홀가 게어만 대표, 수상자 최주림, 크리스찬 나타 대표 및 최고CFO. 수상자 이현준이 지난달 29일 서울 강남구 파르나스 타워에 위치한 포르쉐코리아 오피스에서 시상식 후 기념사진을 찍고 있다. 포르쉐코리아 제공"
2021.10.31.,1일부터 '위드 코로나'···식당·카페 24시간 영업,url없음,<네이버 기사 없음>
2021.10.31.,"""보험, 편하게 비교하고, 알뜰하게 가입하세요!""",url없음,<네이버 기사 없음>
2021.10.31.,코로나19 이후 미래상은?...2022 트렌드 주목,https://n.news.naver.com/mnews/article/052/0001659251?sid=103,"[앵커]우리 삶에 엄청난 영향을 주고 있는 코로나19 이후의 미래상을 그려보는 전망서들이 관심을 끕니다.많은 준비를 하고 사회에 뛰어들었지만 취업난의 고통에 시달리는 미국의 20∼30대를 분석한 책도 있습니다.새로 나온 책, 박석원 앵커가 소개합니다.[기자]<세계미래보고서 2022> 박영숙.제롬 글렌 / 비즈니스북스""코로나19 팬데믹 이후 생존을 위한 대변화를 맞은 인류는 앞으로 어떤 준비를 해야 할까요?""지난해 펴낸 <세계미래보고서> 포스트 코로나 특별판에서 각 분야의 변화와 전망을 담은 데 이어 지구촌이 겪은 지각변동이 만들어내는 미래상을 그렸습니다.저자들은 코로나 이후의 세상에서 살아갈 신인류를 메타 사피엔스(Meta Sapiens)라고 지칭하고 새로운 축이 될 6대 트렌드를 제시합니다.우주 개발 경쟁과 로봇과의 동거, 인공지능(AI)  메타버스, 노화의 종말, 기후 위기 대응, ESG 경영이 그것입니다.< 라이프 트렌드 2022 > 김용섭 / 부키꼬박 2년간 코로나19로 혹독한 변화를 겪은 뒤 더 나은 일상과 행복을 추구하는 가운데 2022년은 뉴 노멀이 아니라 베터 노멀의 해가 될 것입니다.일상 속 사례와 스토리텔링을 활용해 10년째 내년 트렌드를 소개해온 저자는 집에서 식물을 가꾸는 홈 가드닝과 완전한 채식주의, 디지털 자산의 확대 등 12가지를 제시합니다.저자는 특히 우리나라의 공동체 지수가 OECD 국가 중 최하위이며, 남성, 저소득층, 고령자일수록 낮다는 점을 지적합니다.<요즘 애들> 앤 헬렌 피터슨 / RHK(알에이치코리아)밀레니얼 세대인 20-30대는 부모의 권유대로 좋은 대학에 들어가기 위해 노력했지만 최악의 취업난과 높은 실업률에 봉착합니다.30대 후반인 저자는 부모처럼 살기 싫지만 부모만큼 되기도 어렵고, 최고의 학력을 쌓고 가장 많이 일하지만 제일 적게 버는 것이 밀레니얼 세대라고 말합니다.'번아웃' 상태에 놓인 20-30대가 왜 불안한지 물음을 던지면서, 부모뻘인 베이비붐 세대를 향해 ""3루에서 태어났으면서 3루타를 쳤다고 착각하고 있다""고 비판합니다.<새로운 시대의 부, 디지털 자산이 온다> 정구태 / 미래의창심각한 찬반 논란에도 불구하고 가상화폐를 비롯한 디지털 자산은 다양한 모습으로 우리 삶 가까이에 와있습니다.저자는 우리 생활에 큰 영향을 미친 인터넷과 마찬가지로 2008년 비트코인을 필두로 한 디지털 자산은 이제 거스를 수 없는 물결이라고 진단하고 미래상을 그리고 있습니다.다양한 디지털 자산의 개념을 정리하고 스타벅스와 테슬라, 네이버, 카카오 등 국내외 기업의 대응 사례를 소개합니다.지금까지 새로 나온 책이었습니다."
2021.10.31.,"[OK!제보] 분실한 적 없는데…""전기차 충전카드 번호 도용당했다""",https://n.news.naver.com/mnews/article/001/0012758848?sid=103,"편집자 주 = 이 기사는 대구시에 사는 정태훈(가명·39)씨 제보를 토대로 취재해 작성했습니다.(서울=연합뉴스) 최경림 인턴기자 = ""전기차 충전기는 많이 늘었는데 결제 방식은 너무 취약합니다.""    3년째 전기차를 몰고 있는 정태훈(가명·39)씨는 추가 인증 없이 카드번호만을 입력해 바로 결제할 수 있는 환경부 전기차 충전기에 대한 불만을 토로했다.    지난 11일 새벽 12시에서 4시 사이 정씨는 총 두 차례에 걸쳐 거주하는 대구시와 200㎞ 이상 떨어진 전라북도 진안군과 군산시에서 전기차 충전이 완료됐다는 카카오톡 알림을 받았다. 타인이 정씨의 카드번호를 이용해 환경부 전기차 충전기에서 충전을 완료한 것이다.전기차 충전소. 기사와 직접적 관련 없음.[촬영 이상학. 재판매 및 DB 금지]    현재 환경부의 전기차 충전기는 별도로 비밀번호를 인증할 필요 없이 카드번호만을 입력해도 결제할 수 있다.    정씨는 ""가장 흔하게 쓰는 환경부나 A전기차 충전 사업자(이하 A사업자)의 멤버십 카드는 카드번호가 너무 단순하다""며 ""타인이 임의로 번호를 넣어 도둑 충전이 가능하다""고 주장했다.    정씨가 도용당했다고 주장하는 A사업자의 멤버십 카드는 카드번호 16자리 중 앞 8자리가 10100101 혹은 10100100으로 동일하고 뒷자리만 다르게 배정되고 있다.환경부와 A전기차 충전 사업자의 멤버십 카드. 카드 앞번호가 10100101로 같다.[독자 제공. 재판매 및 DB 금지]    이러한 결제 과정과 카드번호 배정 방식을 악용하는 사례가 발생하며 정씨와 같이 멤버십 카드번호를 도용당했다는 차주가 나타나고 있다.     한 전기차 온라인 카페의 회원 '캐***'씨는 지난 18일 본인의 이용요금 현황을 밝히며 환경부 멤버십 카드 소지자들에게 카드 이용 내용을 확인할 것을 당부했다.    '캐***'씨는 ""카드번호를 다른 사람에게 알려준 적 없고 카드를 분실한 적도 없다""며 ""모르는 누군가가 그냥 도용한 상황""이라고 주장했다. ""올해 카드번호 입력해 결제하는 서비스 종료…익년부터 스마트 결제 시행""    현재 A사업자는 당월 이용 요금을 그다음 달에 후 청구하고 있어 피해 사실을 당월에 접수하면 피해액에 대한 요금을 부과하지 않도록 처리하고 있다.    카드번호 도용에 대처하기 위해 A사업자 관계자는 ""QR 결제, 비밀번호 인증 등 (결제 시) 인증 수단을 다양화할 계획""이라며 ""일부 충전기를 대상으로 QR 결제를 도입해 시험하고 있다""고 말했다.    환경부도 카드번호 도용 방지를 위해 올해까지만 카드번호 입력을 통한 결제 방식을 유지할 계획이다. 익년부터는 스마트 결제 서비스(QR 페이)와 실물 카드를 통해서 결제할 수 있다.kyoungrim22@yna.co.kr    기사 문의나 제보는 카카오톡 okjebo"
