기사날짜,기사제목,네이버 뉴스 url,기사내용
2021.10.31.,코로나19 백신 접종완료율 75.3%…12∼15세 예약률 27.0%(종합),https://n.news.naver.com/mnews/article/001/0012759644?sid=102,"1차 접종률은 80.1%…어제 1차 접종자 3만6천103명·완료자 35만7천137명 늘어운영종료 앞둔 마포구 백신예방접종센터(서울=연합뉴스) 류영석 기자 = 28일 오후 운영 종료를 하루 앞둔 서울 마포구민센터 코로나19 예방접종센터에서 시민들이 백신 접종 후 이상반응 모니터링을 위해 대기하고 있다. 2021.10.28    ondol@yna.co.kr(서울=연합뉴스) 김서영 기자 = 국내 신종 코로나바이러스 감염증(코로나19) 백신 접종이 순조롭게 진행되면서 31일 0시 기준 접종 완료율이 75%를 넘어섰다.     코로나19 예방접종대응추진단(추진단)에 따르면 코로나19 백신을 권고 횟수대로 모두 맞아 접종 완료자가 된 사람은 이날 0시 기준으로 총 3천866만478명이다.    우리나라 인구(작년 12월 기준 5천134만9천116명) 대비 접종 완료율은 75.3%, 18세 이상 인구 대비로는 87.6%다.    접종 완료율은 여성(75.9%)이 남성(74.7%)보다 높다. 연령대별로는 60대가 93.5%로 가장 높은 가운데 50대 92.8%, 70대 92.3%, 80대 81.7% 순이다.    상대적으로 접종이 늦게 시작된 청·장년층 연령대에서는 40대가 86.1%, 18∼29세가 82.8%, 30대가 80.9%를 기록했고 17세 이하는 0.6%다.    전날 접종을 완료한 사람은 35만7천137명이다.    일일 신규 접종 완료자 수는 이번 주 들어 20만명대∼60만명대를 기록하고 있다.    전날 신규 접종 완료자 수를 백신 종류별로 구분하면 모더나 20만6천602명, 화이자 14만8천505명, 아스트라제네카(AZ) 1천529명이고 나머지는 얀센 접종자다.    아스트라제네카 신규 접종 완료자는 2천946명으로 발표됐으나 이 가운데 1천417명은 1차 접종 때 아스트라제네카 백신을 맞은 뒤 2차 접종을 화이자 백신으로 교차 접종한 이들이다.    백신별 누적 접종 완료자는 화이자 2천59만3천295명, 아스트라제네카 1천98만1천672명(교차 접종 175만2천574명 포함), 모더나 524만4천112명, 얀센 148만4천262명이다.1차 접종도 이어지면서 전날 3만6천103명이 새로 접종을 받았다.    백신별로 보면 화이자 3만188명, 모더나 5천357명, 얀센 501명, 아스트라제네카 57명이다.    얀센 접종자는 1차 접종자와 2차 접종자 수에 모두 포함된다.    1차 접종자는 누적 4천113만5천997명으로 인구의 80.1% 수준이며, 18세 이상 인구를 기준으로 하면 92.2%에 달한다.    국내에서는 아스트라제네카, 화이자, 얀센, 모더나 등 4가지 백신으로 예방접종이 이뤄지고 있다. 얀센 백신은 1회로 접종이 완료되고 나머지 백신은 2회 접종이 필요하다.    각 의료기관에서 관리하는 예비명단이나 네이버·카카오 등 사회관계망서비스(SNS) 애플리케이션(앱)을 통해 '잔여 백신'을 접종한 사람은 1차 접종 기준 1만9천568명, 2차 접종 기준 1만8천519명 늘었다.    잔여백신 누적 접종자는 1차 접종자가 560만6천418명, 접종 완료자가 204만9천753명이다.    얀센 접종자는 지난 28일부터 총 60만7천528명이 추가접종을 예약했다.    지난 18일부터 접종이 이뤄지고 있는 16∼17세는 이날 0시까지 38만1천759명이 접종을 받았고, 임신부는 총 1천54명이 접종했다.    지난 18일부터 예약을 시작한 12∼15세의 경우 대상자의 27.0%(50만3천333명)가 예약을 마쳤다. 12∼15세 접종 예약은 다음달 12일 마무리된다.    sykim@yna.co.kr"
2021.10.31.,[단독] “골목상권 침해하면 기업 쪼갠다”···與 '이재명표 온플법' 추진,https://n.news.naver.com/mnews/article/011/0003979676?sid=101,"‘중개자 겸 판매자’ 이중적 지위 금지플랫폼 기업 '문어발 확장' 막겠다지만IT혁신 저해·소비자 피해 양산 우려국내 환경과 맞지 않고 미국서도 논란이재명 경기도지사가 20일 경기도청에서 열린 국회 국토위의 경기도청에 대한 국정감사에서 업무 보고하고 있다. /국회사진기자단[서울경제] 더불어민주당이 이재명 대선 후보의 정책으로 ‘온라인 플랫폼 공정화에 관한 법률안(온플법)’을 발의한다. 해당 법안에는 온라인 플랫폼 기업이 사업을 확장해 골목 상권을 침해할 경우 해당 사업을 분할할 수 있다는 급진적인 내용까지 담긴다. 전문가들은 미국의 ‘플랫폼 독점 종식 법률(Ending Platform Monopolies Act)’을 본뜬 이 법안이 국내 온라인 플랫폼 환경과는 맞지 않아 정보기술(IT) 혁신을 저해할 수 있다는 우려를 제기한다.31일 여권에 따르면 민주당은 공정거래위원회와 여야 의원들이 기존에 발의한 내용과 차별화된 새로운 온플법 발의를 준비하고 있다. 거대 플랫폼 기업으로부터 골목 상권을 보호한다는 이 후보의 정책 의지에 따라 대선 정국에서 해당 법안을 ‘이재명표’ 정책으로 추진한다는 계획이다. 앞서 이 후보는 “수수료, 광고료, 부가 서비스 등을 강요하는 플랫폼의 횡포에 소상공인은 속수무책으로 당하고만 있다”며 “플랫폼 중개 사업자가 골목 시장 영역까지 문어발 식으로 확장하는 것을 방지해 상생과 협력의 질서를 만들고 시장 독과점을 막겠다”고 밝힌 바 있다.이 법안은 플랫폼 기업의 ‘이중적 지위 금지’와 ‘기업분할명령제도’를 핵심으로 한다. 이중적 지위는 플랫폼 기업이 단순히 거래를 중개하는 역할을 넘어서 판매자 역할까지 수행하는 것을 말한다. 국내에서 이러한 이중적 지위를 누리는 대표적 플랫폼 기업으로는 ‘쿠팡’과 ‘야놀자’ 등이 있다. 쿠팡은 자체브랜드(PB) 상품을 판매하고 야놀자 역시 전국에서 237개 숙박 업체를 운영 중인데 법안은 이러한 행위를 금지하겠다는 것이다.기업분할명령제도는 플랫폼 기업의 ‘문어발 확장’을 막는 강력한 수단이다. 플랫폼 기업이 새로운 사업에 진출해 이해 상충을 일으킬 경우 사업을 구조적으로 분리하도록 하기 때문이다. 플랫폼 기업이 본 플랫폼 사업 외에 다른 사업을 소유·지배하면서 자사 상품을 우대하거나 경쟁사 상품을 불리하게 만드는 경우가 이해 상충에 해당한다. 카카오(035720)가 모빌리티 사업에 진출하면서 가맹 택시에 ‘콜(승객호출) 몰아주기’를 했다는 의혹은 이해 상충 논란을 불러일으키기도 했다.문제는 여당이 추진하는 이른바 ‘이재명표 온플법’이 미국과 다른 국내 플랫폼 환경을 고려하지 않았다는 점이다. 한국개발연구원(KDI)에 따르면 구글·애플·페이스북·아마존 등 일명 ‘GAFA’로 불리는 미국 글로벌 빅테크 기업의 시가총액 합은 미국 국내총생산(GDP)의 28%에 달하는 반면 국내 거대 플랫폼인 네이버·카카오의 시가총액 합은 아직 우리나라 GDP 대비 약 7%에 그치고 있다. 더욱이 네이버·카카오는 유통, 배달 음식, 지도 및 내비게이션 등 각종 분야에서 다양한 플랫폼 기업들과 경쟁하고 있다.특히 기업분할명령제도는 미국에서조차 급진적인 제도로 논란을 빚고 있다. 이호영 한양대 법학전문대학원 교수는 “우리나라의 경우 이제까지 단 한 차례도 기업분할 명령을 내린 적이 없는 상황에서 이런 입법이 가능할지 의구심이 든다”며 “온라인 플랫폼이 혁신 경제의 중추로서 활약해야 한다는 점에서 바람직한지도 의문”이라고 지적했다.인위적인 사업 분할이 오히려 소비자 후생을 저해할 수 있다는 관측도 있다. 양용현 KDI 연구위원은 “무료로 음악을 듣는 대신 광고를 보는 경우 이용자들은 돈이 아닌 자기 관심을 지불하고 음악을 소비하지만 플랫폼의 음악 스트리밍 사업과 광고 사업을 분리하면 이것이 불가능해진다”면서 “결국 소득이 낮은(가격 탄력성이 큰) 소비자일수록 더 큰 피해를 입을 우려가 있다”고 말했다.민주당은 플랫폼 규제와 관련해 공정위와 방송통신위원회의 갈등을 먼저 조율한 뒤 새로운 온플법과 기존 법안을 병합해 통과시킬 것으로 보인다. 오는 11월 4일 열리는 비공개 당정회의는 공정위의 온플법안과 방통위의 온라인플랫폼 이용자 보호에 관한 법안 간 중복 규제를 조정하기 위한 것이다. 민주당 관계자는 “두 법안이 워낙 오래 계류돼 있었던데다 심사 완료까지 상당한 시간이 소요될 것”이라며 “나중에 병합하더라도 우선은 조정이 필요한 상황”이라고 설명했다."
2021.10.31.,"수기명부 썼더니…""친구 되고 싶다"" 문자 보낸 식당 주인",https://n.news.naver.com/mnews/article/055/0000930559?sid=102,"<앵커>식당에 있는 수기명부를 적고 난 뒤, 좋은 친구로 지내자며 식당 주인으로부터 황당한 연락을 받았다는 제보가 왔습니다. 계속된 연락에 여성이 경찰에 고소하자, 식당 주인은 오히려 여성이 자신에게 접근한 거라며 태도를 바꿨습니다.조윤하 기자가 취재했습니다.<기자>지난 7월, 자녀 2명과 함께 쇼핑몰 식당에 들른 A 씨.식당에는 QR코드는 없고 수기명부만 작성하게 돼 있어 휴대전화 번호를 적었습니다.그런데 그날 밤, 모르는 전화번호로 '좋은 친구가 되고 싶다'는 문자 메시지를 받았습니다.[A 씨/피해자 : 자기 이름 얘기하고, 좋은 친구가 되고 싶다. 제가 안 보니까 카카오톡으로도 '혹시 제가 뭐 실수했냐' 그리고 그 다음 날 '잘 출근했냐' 이런 식으로 왔었어요.]문자를 보낸 사람은 수기명부를 작성했던 식당의 주인이었습니다.A 씨가 '명부에 적힌 번호로 연락하는 건 불법'이라고 경고하자, 식당 주인은 '그저 좋은 뜻으로 얘기했다'며 '편한 친구로 지내자는 것'이었다고 답했습니다.이런 불쾌한 연락은 A 씨가 문자 수신을 차단한 뒤에도 카카오톡 등으로 계속됐다고 합니다.[A 씨/피해자 : 소름 끼치는 게 사실 나이도 아빠뻘 정도 되고, 아빠보다 나이가 많으세요. 자기 딸뻘 정도 되는데, 아니 조카뻘 정도 되는데… 너무 태연하게 말씀하셔서 깜짝 놀랐어요.]견디다 못해 A 씨는 경찰에 고소했는데, 이후 더 힘든 일을 겪었습니다.식당 주인이 갑자기 태도를 바꿔 A 씨 탓으로 몰고 간 겁니다.그는 ""A 씨가 자신에게 의도적으로 접근해 휴대전화 번호를 줬고, 자신은 워킹맘인 A 씨를 돕고 싶어 연락했을 뿐""이라고 주장했습니다.[A 씨/피해자 : (사람들이) '저 아가씨다!' 이렇게 하면서 수군거리는 소리가 다 들리니까, 집에 와서 한동안은 매일 울고 그랬어요.]하지만 경찰은 문자 메시지 등 증거를 확인한 결과 식당 주인의 주장에 근거가 없다고 보고 식당 주인을 개인정보보호법 위반 혐의 등으로 입건해 검찰에 넘겼습니다.(영상취재 : 하 륭, 영상편집 : 김준희)"
2021.10.31.,온플법 처리 내주 윤곽…공정위·방통위 법안 모두 통과시킬 듯,https://n.news.naver.com/mnews/article/001/0012758882?sid=101,"중복규제 조정 후 각 상임위서 처리…주무 부처 놓고 1년간 혼선 네이버·카카오 플랫폼 규제 (CG)[연합뉴스TV 제공]    (세종=연합뉴스) 이보배 기자 = 공정거래위원회와 방송통신위원회가 주도권 싸움을 벌여온 온라인 플랫폼 규제 관련 법안(온플법)의 처리 방향이 내주(11.1∼5) 정리될 전망이다.    31일 정치권에 따르면 정부와 여당은 내주 국회에서 비공개 당정을 통해 온라인 플랫폼 규제 관련 법안의 처리 방향을 논의한다.    국회 정무위원회에 계류된 공정위의 '온라인 플랫폼 공정화법 제정안'과 과학기술정보방송통신위에서 심사 중인 방통위 안(더불어민주당 전혜숙 의원 발의)을 각각 통과시키되, 각 법안에서 중복 규제 우려가 있는 조항을 조정하는 방안이 유력하다.    민주당 관계자는 ""각 법안에서 규제가 겹치는 부분이 있으니, 중복 규제를 피하는 방안을 마련하고 법안 2개를 각 상임위에서 처리하는 방향이 될 것""이라고 말했다.    플랫폼에 대한 일반적인 규제는 공정위가 하고, 방송·통신 영역처럼 특수성이 필요한 부분의 경우 방통위가 맡는 방안 등이 거론된다.    현재 국회에는 플랫폼 기업의 불공정행위를 제대로 규율하기 위한 새로운 법체계가 필요하다는 공감대 아래 관련 법안이 다수 발의돼 있다.    신종 코로나바이러스 감염증(코로나19) 사태로 비대면 거래가 증가하면서 네이버, 카카오 등 플랫폼 기업이 '문어발식'으로 사업 영역을 확장했고, 이들이 거래상 우월적 지위를 바탕으로 중소기업 및 소상공인에 과다한 판매수수료 부과 등 불공정 행위를 할 수 있다는 우려가 커졌기 때문이다.민변 민생경제위원회, 전국가맹점주협의회, 참여연대 민생희망본부 관계자들이 지난 20일 서울 여의도 국회 앞에서 열린 온라인 플랫폼 공정화법 제정 발목 잡는 방통위·과기부 규탄 기자회견에서 온라인 플랫폼 공정화법 제정을 촉구하며 구호를 외치고 있는 모습. [연합뉴스 자료사진]하지만 각 부처가 서로 플랫폼 기업 규제를 관할할 주체가 돼야 한다고 나서며 법안은 장기간 표류하고 있다.     공정위가 지난 1월 제출한 법안은 플랫폼 기업이 입점 업체에 중개거래 계약 기간, 변경 및 해지 등에 관한 사항이 포함된 플랫폼 중개거래계약서를 교부하도록 하는 것이 골자다. 매출액 100억원 또는 중개거래액 1천억원 이상 업체가 규제 대상이다.    불공정거래행위 금지, 보복 조치행위 금지 규정 등을 위반한 온라인 플랫폼 중개사업자에 대해서는 과징금을 부과할 수 있는 근거 규정도 담겼다.    그보다 앞서 발의된 전혜숙 의원의 '온라인플랫폼 이용자 보호법' 제정안의 경우 방통위를 주무 부처로 하고 플랫폼과 입점업체는 물론 소비자와의 관계도 규율했다. 법 적용 대상을 일반적인 '온라인 플랫폼 사업자'와 '대규모 온라인 플랫폼 사업자'로 구분해 의무를 차등 부과한 것이 특징이다.    플랫폼 규제 관할을 놓고 양 기관의 힘겨루기가 계속되면서 당정은 여러 차례 교통정리에 나섰지만, 상임위 간 대리전으로 번지며 온플법 논의는 계속 표류했다.    급기야 지난 21일 국회 기획재정위 국정감사에서는 경제정책 총괄 부서인 기획재정부로 불똥이 튀었고, 홍남기 부총리 겸 기재부 장관은 ""온플법은 정부 내에서도 조율하려고 했는데, 정말 어려웠다""며 ""국회에서 (법안) 두 개를 합해서 한 개의 법으로 해줬으면 좋겠다""고 말하기도 했다.조성욱 공정거래위원장사진은 조성욱 공정거래위원장이 지난 27일 정부세종청사 공정거래위원회에서 열린 기자간담회에 참석해 발언하고 있는 모습. [연합뉴스 자료사진]한편 공정위는 온플법은 180만 영세 플랫폼 입점업체를 위한 민생법안이라며 조속한 입법 필요성을 다시금 강조했다.    조성욱 공정위원장은 지난 27일 ""시간이 지연되면 영세 상공인들의 어려움과 실망감이 클 것""이라며 ""최근 국정감사에서 의원들이 입점업체의 어려움을 느꼈을 것이기 때문에 조속히 입법될 것 같다""고 말했다.    bobae@yna.co.kr"
2021.10.31.,금리인하요구권 거절 땐 사유 자세하게 설명해야,https://n.news.naver.com/mnews/article/029/0002703694?sid=101,"금융위원회 제공    앞으로 금융사는 금리인하 요구권 신청에 대한 거절 사유를 명확히 안내하고, 매년 금리인하요구권 존재 사실을 널리 알려야 한다. 반기별로 금리인하요구권 신청 건수와 수용률 등을 공시해야 하는 의무도 부여했다.31일 금융위원회는 금융소비자의 금리인하요구권 행사를 돕기 위해 운영을 개선한다고 밝혔다. 금리인하요구권은 은행법 30조2항 등에 따라 신용상태가 개선된 소비자는 금융회사에 금리인하를 요구할 수 있는 권리다. 금융사는 소비자의 요구를 받은 뒤 10영업일 내에 수용여부와 사유를 통지해야 한다. 2017년 제도 도입 당시 소비자의 금리인하 신청건수는 20만건에 그쳤지만 지난해 91만건으로 3년간 4.5배 증가했다. 특히 2019년 1월 인터넷과 모바일뱅킹 등 비대면 신청이, 같은해 11월 비대면 금리인하 약정까지 가능해지면서 신청건수가 크게 늘었다. 작년 기준 감면이자액은 1600억원가량으로, 가계대출 0.38%포인트, 기업대출 0.52%포인트 수준으로 금리가 줄었다. 다만 금융위 측은 ""시장금리 하락으로 은행대출금리가 전반적으로 하락함에 따라 금리인하 폭도 축소되는 추세""라고 설명했다. 하지만 금융당국이 국내 16개 은행을 대상으로 미스터리쇼핑을 진행한 결과 지점과 콜센터 모두 종합평가등급 '저조'를 받을 정도로 소비자 안내가 불충분했다. 금리인하요구권의 정의, 행사요건, 신청방법, 제출류 뿐만 아니라 안내자료 제공 등 전반적인 사안을 검토한 결과다.금융당국은 금융회사가 금리인하요구권 안내장에 반드시 기재해야하는 핵심항목으로 '개념·대상 대출상품 범위·신청요건·신청방법 및 결과통지·유의사항'을 규정하고 고객 안내와 설명 기준을 마련해 운영키로 했다. 이를테면 차주의 신용상태 개선 시 신청횟수, 신청시점 등에 관계없이 권리 행사가 가능하다는 유의사항 등을 정확히 안내하다는 방침이다. 대출 계약시 상품설명서에도 관련 내용을 첨부하기로 했다.또 적용대상 차주에게 대출기간 중 연 2회 정기적으로 주요사항을 안내한다. 실제로 카카오뱅크는 신용평점 상승 고객 등 금리인하 가능성이 높은 고객에 대해 수시로 안내해오기도 했다. 또 전 금융권이 협업해 연 1회 '집중 홍보주간'을 운영해 모바일 앱과 ATM기기, 방송매체 등을 통해 홍보를 강화한다.소비자의 신청사유도 △소득·재산 증가 △신용도 상승 △기타 항목으로 구분된다. 소취업이나 승진, 이직, 전면자격 취득 등으로 소득이 증가했거나, 자산이 늘고 부채가 줄어 재산이 증가한 경우 등 개인의 재무상태가 개선됐을 시 신청 대상이다. 신용평가회사의 개인신용평점 상승뿐만 아니라 은행이 선정한 우수고객 등 금융사가 정하는 사항도 해당할 수 있다. 금리인하요구권 신청이 거절될 경우 금융사로부터 불수용 사유를 명확히 안내받을 수도 있다. 이를테면 '귀하의 대출은 신용상태가 금리산정에 영향을 주지 않는 대출로 금리인하요구 대상에 해당하지 않는다', '대출상품의 금리를 인하할 정도로 은행 내부신용등급이 개선되지 않았다'는 구체적인 인하 거절 근거를 알 수 있는 셈이다.금융사는 이런 금리인하요구권 관련 신청·수용건수, 수용률, 1년기준 이자감면액 등을 반기별로 공시해 소비자의 선택권을 보장해야 하는 의무도 생긴다. 나아가 변경전후 금리내역, 수용여부와 거절사유 등에 대한 우수사례는 기록·보관을 통해 전반적인 관리시스템이 개선된다.금융위 관계자는 "" 대부분의 세부 조치사항을 금년부터 내년 상반기까지 신속하게 완료해 나가겠다""며 ""소비자 안내·홍보 강화, 신청·심사기준 표준화 등 과제는 내년 1분기부터 시행하겠다""고 밝혔다."
2021.10.31.,"신세계푸드, 조선시대 카스텔라 재현한 ‘가수저라’ 출시",https://n.news.naver.com/mnews/article/366/0000770531?sid=103,"조선시대 카스텔라를 재현한 가수저라. /신세계푸드 신세계푸드(031440)는 조선시대 카스텔라를 재현한 가수저라(加須底羅)를 출시했다고 31일 밝혔다. 가수저라는 카스텔라를 한자로 음차(音借)해 부르던 말로 복고에서 새로운 즐거움을 찾는 MZ세대(1980~2000년대생)를 겨냥한 제품이다.가수저라는 달걀 노른자와 흰자를 따로 분리한 뒤 직화로 가열하는 전통 가마 방식으로 빵을 구웠다. 식감을 좌우하는 달걀 함량을 2배로 높였고 팽창제, 계량제, 유화제 등 혼합제재를 사용하지 않았다. 설탕 대신 꿀을 넣어 건강하고 은은한 단맛이 난다.신세계푸드는 한복 브랜드 단하와 협엽해 다음 달 5일까지 서울 종로구 팔판동에서 단하 티룸이라는 콘셉트 스토어를 운영한다. 가수저라를 전통 잎차와 곁들여 즐길 수 있으며 단하의 한복도 체험할 수 있다. 쓱닷컴과 카카오톡 선물하기에서도 구매 가능하다. 신세계푸드 관계자는 “이색 경험을 위해 카스텔라에 조선시대 이야기를 바탕으로 가수저라를 기획했다”고 했다."
2021.10.31.,제천 청소년자립지원금 대상 소득기준 대폭 완화,https://n.news.naver.com/mnews/article/003/0010802326?sid=102,"[제천=뉴시스]제천시청. (사진=제천시 제공) photo@newsis.com *재판매 및 DB 금지[제천=뉴시스] 이병찬 기자 = 충북 제천시는 청소년자립지원금 지원 대상자 소득기준을 대폭 완화했다고 31일 밝혔다.청소년 자립지원금은 저소득층 가정 청소년에게 학자금이나 직업훈련비 등을 지원하는 것으로, 대상자는 연간 300만원 범위 내에서 지원금을 받을 수 있다.종전까지는 기준 중위소득 70% 이하만 지원 자격을 부여했으나 시는 이번에 조례를 고쳐 기준 중위소득 100% 이하로 범위를 확대했다.그동안 지원하지 않았던 국민기초생활보장법에 따른 수급자도 지원 대상에 포함했다. 청소년자립지원금 신청은 9~24세 청소년이 할 수 있다. 거주지 읍면동에 신청하면 시 청소년 육성위원회가 심의를 거쳐 지원 대상자를 선발한다.읍면동장의 추천을 받은 청소년 중 소득수준이 낮은 사람을 우선 선발하고 있다.올해 하반기 자립지원금 지원을 희망하는 청소년은 내달 26일까지 거주지 읍면동 행정복지센터를 방문해 신청해야 한다. 카카오톡 오픈채팅방 '제천시 청소년자립지원금 신청 안내' 검색해 입장하면 담당 공무원에게 직접 문의할 수 있다."
