기사날짜,기사제목,네이버 뉴스 url,기사내용
2021.10.18.,'4거래일 연속' 사들인 연기금…'삼천피 방어'엔 우군될까,https://n.news.naver.com/mnews/article/421/0005662565?sid=101,"올해 22조원 넘게 팔아치운 연기금 최근 4거래일간 1650억 순매수 '눈길'삼천피 붕괴후 우량주 사들여…强달러로 국내주식 비중 하락도 영향한국주식투자자연합회 관계자들이 전북 전주시 국민연금공단 기금운용본부 앞에서 '국내주식 과매도 규탄' 피켓 시위를 하고 있다.  2021.3.4/뉴스1 © News1 유경석 기자(서울=뉴스1) 강은성 기자 = 올해들어 코스피 시장에서 무려 22조원을 팔아치운 연기금이 최근 4거래일 연속 국내 주식을 사들여 눈길을 끌고 있다. 코스피 지수가 8거래일만에 '삼천피(코스피 3000)'를 회복하는데 연기금도 일정부분 역할을 했다고 볼 수 있다.  연기금의 최근 순매수는 '삼천피 붕괴'에 따른 기계적 반발매수가 이행된데다 달러 강세로 해외주식 비중이 늘어남에 따라 상대적으로 국내주식 비중이 줄면서 순매수 여력이 생긴데 따른 것으로 파악된다. 증권가에선 증시 부진과 달러 강세 등 최근의 추세가 이어진다면 당분간 연기금의 순매수가 순매도 보다는 우위에 놓일 것이라는 분석이 나온다. 그러나 연기금이 국내 주식 비중을 계속 줄여간다는 계획을 갖고 있기 때문에 대규모 매수세를 기대하기는 어려운 상황이다.    18일 한국거래소에 따르면 '맏형' 국민연금을 위시한 연기금은 지난 12일부터 15일까지 4거래일간 코스피 시장에서 누적 1650억원 어치의 주식을 사들였다. 앞서 9월24일부터 10월8일까지 9거래일 연속 3713억원(누적)을 순매도한 것과 확 달라진 모습이다. 최근 4거래일간 연기금은 배터리 대장주 LG화학(481억원)을 가장 많이 순매수했다. 이어 현대차(352억원), 두산중공업(286억원), 현대글로비스(262억원)가 뒤를 이었다. 반면 연기금은 SK텔레콤(-753억원)을 가장 많이 순매도했다. 그 다음은 SK하이닉스(-478억원), 삼성전기(-469억원), 삼성전자(-361억원) 순이었다.연기금은 올해 국민연금을 필두로 강한 순매도 우위를 유지했다. 올해들어 10월15일까지 연기금은 코스피 시장에서 무려 22조6872억원 어치를 내다팔았다. 지난해 연기금이 1년동안 2조8131억원을 순매도한 것과 비교해 열배 가까이 많은 규모다. 올해 상반기에는 52일 연속 순매도하며 투자자들의 원성을 사고 청와대 국민청원까지 등장하기도 했다. 이에 국민연금 기금운용위원회는 지난 4월 국내주식 보유비중 전략적자산배분(SAA) 허용범위를 ±2%p에서 ±3%p로 1%p 상향 조정했다. 국민연금의 올해말 국내주식 목표비중은 16.8%이고, 여기에 SAA 허용범위 ±3%를 적용하면 최대 19.8%까지 국내주식을 보유할 수 있게 된다. 7월말 기준 국민연금의 국내 주식비중은 19.5%로 내려왔다. 8월을 지나 9월과 10월 들어서는 국내 증시가 조정을 거치면서 '삼천피'(코스피 3000선)까지 무너졌기 때문에 이 비중은 더 줄었을 것으로 추정된다. 금융투자업계 관계자는 ""7월 코스피가 3300선을 오르내릴때와 비교해 현재는 300포인트 가까이 지수가 하락한 상태""라면서 ""연기금의 매매 기준에 따른 기계적 반발 매수세가 최근 유입된 것으로 보인다""고 말했다. 이 관계자는 특히 ""연기금이 최근 하락장에서 순매수한 종목을 보면 주로 리오프닝(경기재개) 중심의 대형주가 있고, 시계열을 9월과 10월 전체로 확대하면 낙폭이 과도했던 카카오, 크래프톤, LG화학 등 성장주의 순매수도 강했다""면서 ""우량 대형주의 낙폭이 커졌을 때 연기금이 소위 '줍줍'을 한 것인데, 이같은 방식이 주가 하락장에서 지수 방어선을 구축하는 효과도 내고 있다""고 말했다.  해외 증시가 오르고 달러 강세가 이어지면서 해외주식비중이 증가해 국내 주식 매입에 상대적으로 여유가 생겼을 것이라는 분석도 나온다. 이 관계자는 ""최근 달러·원 환율이 1200원선을 오르내릴 정도로 달러 강세가 이어지고 있는데, 11월 미국 연방준비제도의 테이퍼링 가시화와 금리 인상 등의 기조로 강달러 기세는 당분간 이어질 전망""이라면서 ""이렇게 되면 연기금의 주식 자산이 환율만으로도 해외 비중이 증가하고 국내 비중에 여유가 생기는 셈이어서 연기금의 국내 주식 순매수가 이어질 가능성도 있다""고 설명했다."
2021.10.18.,"엔씨소프트 리니지W, 글로벌 사전예약 1300만 돌파 外",url없음,<네이버 기사 없음>
2021.10.18.,서울 관광명소와 체험상품 할인 ‘서울관광할인패스’ 출시,https://n.news.naver.com/mnews/article/382/0000939137?sid=101,"-서울관광재단 관광업계 지원차 온라인 패스 7만장 무료 배포-서울 관광시설 및 체험서비스 121개소 최대 50% 할인 혜택-서울관광할인패스 홈페이지와 서울시민카드앱에서 다운로드서울관광재단(대표이사 길기연)은 서울 주요 관광시설과 체험 서비스를 최대 50%  할인받을 수 있는 온라인 ‘서울관광할인패스’ 7만 장을 18일부터 12월31일까지 선착순 무료 배포한다.2020년에 이어 올해 2회째인 서울관광할인패스(구 서울ONE 패스)는 코로나19로  어려운 관광업계를 돕기위해 기획했다. 18일 오전 10시부터 서울관광할인패스 홈페이지와 서울시민카드앱에서 각각 6만 장, 1만 장을 선착순으로 무료 배포한다. 서울시민이 아니어도 내외국인 누구나 이메일 혹은 카카오톡으로 다운로드 가능하다.‘서울관광할인패스’는 N서울타워, 롯데월드 등 서울의 대형 관광명소 입장권부터  소상공인 관광업체와 제휴한 90여 종의 공예와 DIY 클래스, 액티비티, 투어 상품을 할인받을 수 있다.  N서울타워 전망대 2인 입장권 패키지 상품 55%할인을 비롯해 아쿠아플라넷 63 입장권 50%할인, 이크루즈 한강유람선 50%할인, 코엑스 아쿠아리움 입장권 30%할인을 제공한다. 카약, 패들보드와 같은 한강 수상레저체험(쥬티인서울, 50%할인), 궁 야경 투어(한국자전거나라, 50%할인), 수제 맥주 만들기(아이홉 맥주공방, 30%할인) 등도 있다. 특히 올해는 코로나19 상황 속에서 출시되는 만큼 비대면 상품 카테고리를 신설해 민화 그리기 DIY세트, 실버링 DIY클래스, BTS 큐빅 페인팅 DIY 등 13개의 할인 체험을 담았다. 패스는 다운로드일로부터 12월31일까지 사용 가능하다.(제휴시설 운영 따라 만료 기간 달라 확인 필요) 공식 홈페이지에서 세부 제휴시설 정보를 확인할 수 있다. 일부 체험상품은 웹페이지를 통해 방문 전 사전 예약을 해야 한다.패스를 다운로드 받은 후 카카오톡 채널(채널명: 서울관광재단 관광할인패스)을 추가하면 다양한 경품 이벤트 참여와 서울관광할인패스참여업체의 다양한 정보를 확인할 수 있다. 박진혁 서울관광재단 관광서비스팀장은 “서울관광할인패스는 침체된 관광업계를  지원하기 위한 취지로 시작했으며 위드코로나를 앞두고 서울관광할인패스가 관광업계 회복의 시작점이 되기 위해 노력할 것”이라고 밝혔다.스포츠동아 김재범 기자 oldfield@donga.com"
2021.10.18.,코로나 위기 때 사회공헌 줄인 은행은,https://n.news.naver.com/mnews/article/241/0003162361?sid=101,"[일간스포츠 권오용] 시중은행들이 호실적에 현금배당을 늘렸지만 사회공헌 활동은 현상 유지하는 데 그친 것으로 나타났다. 특히 도움의 손길이 가장 필요했던 작년 코로나19 위기 때는 사회공헌 활동을 줄인 은행이 대부분이었다.   17일 윤관석 더불어민주당 의원이 금융감독원에서 받은 '은행별 사회공헌금액 및 영업이익·현금배당 현황' 자료에 따르면, 국내 17개 은행의 현금배당 비율은 매년 확대돼 영업이익의 3분의 1 수준까지 높아졌지만, 사회공헌 금액은 5~6% 수준에 머물렀다.      국내 은행들의 최근 4년간 현금배당금 총액은 21조6887억원이었다. 연도별 '영업이익 대비 현금배당 비율'을 보면 2017년 4조43억원(26.66%), 2018년 5조4795억원(29.10%), 2019년 6조5394억원(32.96%), 2020년 5조6655억원(33.38%)이다.      코로나19팬데믹이 강타한 2020년 현금배당을 가장 많이 한 곳은 국민은행(1조5164억원)으로 시중은행 중 유일하게 조 단위를 넘었다.     은행들의 2017년 대비 2020년 현금배당률은 26.66%에서 33.38%로 총 6.72%포인트 늘었다. 케이뱅크와 카카오뱅크는 상장 전이어서 별도의 현금배당은 없었다.      .     최근 4년간 17개 은행의 사회공헌금액 총합은 3조9350억원이었다. 영업이익 대비 사회공헌 금액은 2017년 7357억원(4.9%), 2018년 9839억원(5.22%), 2019년 1조1289억원(5.69%), 2020년 1조865억원(6.4%)으로 나타났다.      ​2017년 대비 2020년 사회공헌금액 비율은 4.9%에서 6.4%로 1.5%포인트 늘어나는 데 그쳤다.      사회공헌 상위 3개 은행은 국민(6589억원), 신한(5954억원), 농협(5811억원) 순이었다. 사회공헌 참여 하위 3개 은행은 케이뱅크(1억5000만원) 카카오뱅크(4억5000만원), 제주은행(75억원) 순이었다.      최근 4년간 사회공헌 금액이 전체적으로는 늘었지만 코로나19팬데믹이 한창이었던 2020년에는 대부분의 은행이 줄였다. 특히 지방은행들은 늘리거나 전년도 수준을 유지한 반면, 대형 은행들은 줄이기에 급급했다.     4대 시중은행 중 가장 많이 줄인 곳은 하나은행으로, 2019년보다 15.36%포인트 감소했다. 다음으로 신한은행(11.93%), 우리은행(4.92%) 순이었다. 이들과 달리 KB국민은행은 11.81%포인트 늘었다.      일부 대형 은행들은 코로나19팬데믹으로 평소 때보다 절실했던 도움의 손길을 내미는 데 소극적이었다는 지적을 받기에 충분하다.      윤관석 의원은 ""최근 ESG(환경·사회·지배구조) 경영의 중요성이 높아지면서 사회공헌에 관한 투자도 중요한 지속 성장 지표로 자리매김하고 있다""며 ""국민이 시중은행의 이익 창출에 많은 기여를 하고 있는 만큼 은행사들이 금융의 사회적 책임 정신 아래 사회공헌활동을 선도해나갈 필요가 있다""고 말했다.    권오용 기자 kwon.ohyong@joongang.co.kr"
2021.10.18.,"광주과학기술원, 사측 근로기준법 위반·직원들 스톡옵션 부당취득 '모럴 해저드'",https://n.news.naver.com/mnews/article/003/0010776140?sid=102,"기사내용 요약18일 과방위 국감서 '뭇매'정필모 ""부당 스톡옵션 취득 은폐시도""[서울=뉴시스] 더불어민주당 한준호 의원.[대전=뉴시스] 김양수 기자 = 광주과학기술원(GIST)이 사측의 근로기준법 위반과 직원들의  교원창업기업으로부터 스톡옵션(주식매수선택권)을 불법  취득하는 등 기관 운영의 난맥상을 드러내 국정감사에서 뭇매를 맞았다.18일 대전 KAIST에서 열린 국회 과학기술정보방송통신위원회의 과기부 산하 출연연구원에 대한 국정감사에서 더불어민주당 한준호(경기 고양시을) 의원은 ""최근 수년간 광주과학기술원의 근로기준법 56조를 위반한 사례가 수십건에 이른다""며 ""이를 금액으로 환산하면 2000만원 가량 된다""고 밝혔다.한 의원에 따르면 광주과학기술원은 휴일 연장·야간 및 휴일에 근로자가 근무할 경우 가산한 금액을 지급해야 한다. 하지만 기술원은 1만6000여 시간의 임금을 지불하지 않고 체불했다.또 정규직과 기간제의 초과근무 정산시스템이 달라 계약직의 경우 연장·야간 및 휴일 근로에 대한 정보가 취합되지 않고 있다.기술이전 심사 기업으로부터 스톡옵션을 부당취득하고 이를 은폐하려던 직원들이 추적에 나선 국감 위원에 들통나기도 했다.더불어민주당 정필모 의원은 ""광주과학기술원 과학기술응용연구단 기술사업화센터 직원들이 교원창업기업으로부터 스톡옵션을 불법적으로 취득한 것으로 드러났다""며 ""전 연구단장(교수)를 비롯해 연구단 교직원들이 이 같은 사실을 숨기기 위해 허위자료를 작성하는 등 은폐까지 시도했다""고 주장했다.정 의원의 국감자료에 따르면 광주과학기술원 기술사업화센터 직원 A씨는 지난 2017년 9월 교원창업기업 Q사의 기술이전 협상을 주도한 뒤 기술이전 후 2개월 후에 Q사로부터 스톡옵션 1만6300주를 받았다.【서울=뉴시스】 더불어민주당 정필모 의원.특히 당시 Q사 대표는 기술사업화와 창업기업 지원을 총괄했던 과학기술응용연구단 단장인 B교수로 확인됐다. 여기에 또다른 직원은 스톡옵션을 받고 본인이 심사한 기업으로 이직하기도 했다.정 의원은 ""A씨에게 스톡옵션을 부여한 B교수는 내부 스톡옵션 거래를 들키지 않기 위해 의원실에 허위자료를 작성해 제출했다""며 ""현재 B교수는 과학기술응용연구단장 자리에서 보직 해임된 상태다""고 강조했다.그는 ""지난 5월 A씨는 의원실에 스톡옵션이 없다는 확약서를 제출했지만 며칠 뒤 A씨는 카카오톡으로 회사 측에 스톡옵션 포기 각서 처리를 종용한 것으로 밝혀졌다""며 ""학교 측도 기술이전 담당자의 스톡옵션 취득 사실을 알면서도 묵인해온 것""이라고 질타했다.정필모 의원은 ""교내 기술이전 담당자들이 이전기업으로부터 스톡옵션을 받아오고 있었지만 이를 점검할 수 있는 관리지침이나 금지규정이 없고 문제를 알면서도 묵인하는 등 광주과학기술원의 내부 관리·감독시스템이 전혀 작동하지 않았다""며 ""과기부는 전면 감사를 통해 위법성이 밝혀지면 관련자들을 엄중 문책해야 한다""고 감사를 촉구했다."
2021.10.18.,"광주과학기술원, 사측 근로기준법 위반·직원들 스톡옵션 부당취득 '모럴 해저드'",https://n.news.naver.com/mnews/article/003/0010776140?sid=102,"기사내용 요약18일 과방위 국감서 '뭇매'정필모 ""부당 스톡옵션 취득 은폐시도""[서울=뉴시스] 더불어민주당 한준호 의원.[대전=뉴시스] 김양수 기자 = 광주과학기술원(GIST)이 사측의 근로기준법 위반과 직원들의  교원창업기업으로부터 스톡옵션(주식매수선택권)을 불법  취득하는 등 기관 운영의 난맥상을 드러내 국정감사에서 뭇매를 맞았다.18일 대전 KAIST에서 열린 국회 과학기술정보방송통신위원회의 과기부 산하 출연연구원에 대한 국정감사에서 더불어민주당 한준호(경기 고양시을) 의원은 ""최근 수년간 광주과학기술원의 근로기준법 56조를 위반한 사례가 수십건에 이른다""며 ""이를 금액으로 환산하면 2000만원 가량 된다""고 밝혔다.한 의원에 따르면 광주과학기술원은 휴일 연장·야간 및 휴일에 근로자가 근무할 경우 가산한 금액을 지급해야 한다. 하지만 기술원은 1만6000여 시간의 임금을 지불하지 않고 체불했다.또 정규직과 기간제의 초과근무 정산시스템이 달라 계약직의 경우 연장·야간 및 휴일 근로에 대한 정보가 취합되지 않고 있다.기술이전 심사 기업으로부터 스톡옵션을 부당취득하고 이를 은폐하려던 직원들이 추적에 나선 국감 위원에 들통나기도 했다.더불어민주당 정필모 의원은 ""광주과학기술원 과학기술응용연구단 기술사업화센터 직원들이 교원창업기업으로부터 스톡옵션을 불법적으로 취득한 것으로 드러났다""며 ""전 연구단장(교수)를 비롯해 연구단 교직원들이 이 같은 사실을 숨기기 위해 허위자료를 작성하는 등 은폐까지 시도했다""고 주장했다.정 의원의 국감자료에 따르면 광주과학기술원 기술사업화센터 직원 A씨는 지난 2017년 9월 교원창업기업 Q사의 기술이전 협상을 주도한 뒤 기술이전 후 2개월 후에 Q사로부터 스톡옵션 1만6300주를 받았다.【서울=뉴시스】 더불어민주당 정필모 의원.특히 당시 Q사 대표는 기술사업화와 창업기업 지원을 총괄했던 과학기술응용연구단 단장인 B교수로 확인됐다. 여기에 또다른 직원은 스톡옵션을 받고 본인이 심사한 기업으로 이직하기도 했다.정 의원은 ""A씨에게 스톡옵션을 부여한 B교수는 내부 스톡옵션 거래를 들키지 않기 위해 의원실에 허위자료를 작성해 제출했다""며 ""현재 B교수는 과학기술응용연구단장 자리에서 보직 해임된 상태다""고 강조했다.그는 ""지난 5월 A씨는 의원실에 스톡옵션이 없다는 확약서를 제출했지만 며칠 뒤 A씨는 카카오톡으로 회사 측에 스톡옵션 포기 각서 처리를 종용한 것으로 밝혀졌다""며 ""학교 측도 기술이전 담당자의 스톡옵션 취득 사실을 알면서도 묵인해온 것""이라고 질타했다.정필모 의원은 ""교내 기술이전 담당자들이 이전기업으로부터 스톡옵션을 받아오고 있었지만 이를 점검할 수 있는 관리지침이나 금지규정이 없고 문제를 알면서도 묵인하는 등 광주과학기술원의 내부 관리·감독시스템이 전혀 작동하지 않았다""며 ""과기부는 전면 감사를 통해 위법성이 밝혀지면 관련자들을 엄중 문책해야 한다""고 감사를 촉구했다."
2021.10.18.,"BAT로스만스, 글로 프로 기기 90% 할인",url없음,<네이버 기사 없음>
2021.10.18.,임산부·16~17세 청소년 코로나19 백신 접종 시작,url없음,<네이버 기사 없음>
