기사날짜,기사제목,네이버 뉴스 url,기사내용
2021.12.09.,'송해 1927' 오늘(9일)부터 안방서 만난다,https://n.news.naver.com/mnews/article/009/0004891275?sid=106,<구조 다름>
2021.12.09.,"데브시스터즈, 2021 대한민국콘텐츠대상 해외진출유공 표창",https://n.news.naver.com/mnews/article/031/0000641300?sid=105,"'쿠키런: 킹덤'으로 국내 콘텐츠 위상 높여'쿠키런: 킹덤' [사진=데브시스터즈]데브시스터즈(공동대표 이지훈, 김종흔)가 '2021 대한민국콘텐츠대상'에서 해외진출유공 부문 문화체육관광부장관 표창을 받았다고 9일 발표했다.2021 대한민국콘텐츠대상은 올 한해 대한민국을 빛낸 우수 콘텐츠와 해당 산업 발전에 기여한 공로자를 발굴 및 시상하기 위해 문화체육관광부에서 주최하고 한국콘텐츠진흥원이 주관하는 행사로, 지난 8일 서울 강남구 코엑스에서 시상식이 열렸다.데브시스터즈는 모바일 게임 쿠키런: 킹덤을 중심으로 국내 게임 콘텐츠의 위상을 높이고 산업 성장 및 발전을 이끈 공로를 인정받으며 수상의 영예를 안았다.쿠키런: 킹덤은 올 1월 글로벌 론칭 이후 현재까지 전세계 누적 이용자수 3천만명을 넘어서며 전세계적 인기를 얻고 있는 작품이다. 출시 직후 국내 주요 앱 마켓에서 인기순위 1위에 등극했고, 매출 순위에서도 애플 앱스토어 및 원스토어 1위, 구글플레이 2위를 차지했다.미국에서도 애플 게임 인기순위 2위 및 매출순위 3위에 올랐고 일본과 대만, 태국에서도 구글 및 애플 게임 인기순위 1위를 기록하면서 글로벌 시장에서 괄목할 만한 성적을 내왔다.쿠키런: 킹덤의 흥행과 더불어 쿠키런 지식재산권(IP)의 글로벌 인지도 및 저변 역시 확대되고 있다. 2013년 쿠키런 포 카카오(for kakao)부터 지금의 쿠키런: 킹덤까지 꾸준히 성장을 이어온 쿠키런 IP는 시리즈 통합 전세계 1억 5000만 다운로드를 넘어선다. 인종과 문화, 배경 등을 아우르는 다양성과 서사를 담고 있는 쿠키 캐릭터가 친숙하면서도 독창적인 대상으로서 글로벌 팬들의 시선을 사로잡고 있는 설명이다.또한 쿠키런은 굿즈, OST, 캐릭터 영상 등 다양한 자체 콘텐츠와 상품들을 선보이고, 식음료나 유통, 패션 등 타 브랜드와의 협업을 통해 활동 반경을 넓히면서 IP 영향력 및 팬층을 확대해나가고 있다.데브시스터즈는 ""쿠키런은 세상 모든 사람들의 다양한 모습을 쿠키 안에 담아보자는 생각에서부터 출발한 IP""라며, ""이 쿠키들이 즐거움을 선사하는 매력적인 캐릭터이자 따뜻한 위로와 행복을 전하는 좋은 친구로서 꾸준히 성장해온 덕에 많은 사랑과 지지를 받을 수 있었다""고 소감을 전했다. 이어 ""앞으로도 게임을 비롯한 좋은 콘텐츠를 통해 이용자분들에게 더욱 새롭고 다채로운 경험을 제공할 수 있도록 노력하겠다""고 말했다.한편, 데브시스터즈는 지난달 '2021 대한민국 게임대상'과 '구글플레이 2021 올해를 빛낸 앱·게임'에서도 수상 소식을 전한 바 있다.회사 측은 내년 쿠키런: 킹덤의 유럽 캠페인과 그 뒤를 이을 쿠키런 게임 차기작, 쿠키런 글로벌 팬 플랫폼 등을 준비 중이다. 여기에 신규 IP 프로젝트 가시화도 예고된다."
2021.12.09.,"버핏 투자한 인터넷은행 누뱅크, 올해 美증시 IPO 규모 5위",https://n.news.naver.com/mnews/article/001/0012825140?sid=104,"현지시간 9일 뉴욕증시 데뷔…브라질 최대 '몸값' 은행(서울=연합뉴스) 구정모 기자 = 브라질의 인터넷 전문은행 누뱅크(Nubank)가 미국 증시에서 기업공개(IPO)를 통해 26억 달러(약 3조758억원)를 조달, 올해 5번째로 규모가 큰 IPO로 기록됐다.     8일(현지시간) 로이터통신과 미 월스트리트저널(WSJ)에 따르면 누뱅크는 이번 IPO에서 2억8천920만주를 주당 9달러에 공모, 이런 자금을 확보했다.     이번 공모가는 공모 희망가 범위(주당 8∼9달러)의 상단으로 결정됐다. 누뱅크는 수요가 예상보다 약하자 지난달 공모 희망가를 기존 주당 10∼11달러에서 20% 하향 조정했다.     공모가 기준으로 누뱅크의 기업가치는 415억 달러(약 49조945억원)로, 기존 브라질 최대 은행인 '이타우 우니방쿠'를 제치고 가장 몸값이 비싼 은행 반열에 오르게 됐다.    한국에서도 인터넷은행 카카오뱅크가 시가총액(9일 종가 기준)이 30조5천52억원으로 KB금융(23조9천505억원)을 앞서 은행주 시총 1위를 달리고 있다.    누뱅크는 9일 미국 뉴욕증권거래소(NYSE)에서 종목 코드 'NU'로 거래를 시작한다.     이번 IPO에는 소프트뱅크 그룹과 기존 투자자인 유명 벤처캐피탈 세쿼이아 캐피털, 헤지펀드인 타이거 글로벌 매니지먼트 등이 참여했다.     다른 기존 투자자로는 워런 버핏이 이끄는 버크셔해서웨이, 중국의 텐센트(騰迅·텅쉰) 홀딩스 등이 있다. 버크셔해서웨이는 지난 6월 누뱅크에 5억 달러를 투자했다.    누뱅크는 이번 IPO 자금을 운전자본, 영업비, 자본적 지출, 인수·합병(M&A) 등에 쓸 계획이라고 밝혔다.    누뱅크는 2013년 브라질에서 설립된 인터넷 전문은행으로, 현재 브라질과 멕시코, 콜롬비아에서 고객이 4천800만명에 달한다.     당초 신용카드로 시작해 예금계좌, 투자플랫폼, 대출, 보험 등으로 서비스를 늘려나갔다.     올해 매출액은 10억 달러(약 1조3천300억원)로 지난해 5억3천500만 달러의 2배 가까이로 늘었다. 그동안 적자를 지속하다가 올 상반기 처음으로 흑자로 돌아섰다.     누뱅크의 이번 IPO는 시장집중도가 높은 남미 은행업에서 핀테크가 어떻게 기존 오프라인 은행들의 아성에 도전하는지를 보여주는 사례라고 로이터통신은 전했다.     2018년 12월 현재 브라질 5개 은행이 이 나라 전체 예금의 84%를 차지할 정도로 브라질 은행업은 집중도가 높다.     게다가 브라질 은행업의 순이자마진(NIM)이 세계 최고 수준이어서 지난해 상반기 남미 상장사 582개사 중 가장 수익이 좋은 3개사가 브라질 은행일 정도였다고 저널은 전했다.상파울루시에 있는 누뱅크 본사[누뱅크 제공, 재판매 및 DB 금지]     pseudojm@yna.co.kr"
2021.12.09.,대학교 기숙사서 20대 대학생 숨진 채 발견...시신 부패,url없음,<네이버 기사 없음>
2021.12.09.,스포츠토토&경륜경정 '도박중독 예방 캠페인' 마감 임박,https://sports.news.naver.com/news.nhn?oid=018&aid=0005103270,<구조 다름>
2021.12.09.,"서울 중구, 2021년 하반기 자동차세 부과",https://n.news.naver.com/mnews/article/011/0003994941?sid=102,"서울 중구 청사 전경. /사진 제공=중구[서울경제] 서울 중구가 이달 관내 등록 차량 2만 9,778대를 대상으로 2021년 하반기 자동차세를 부과한다고 9일 밝혔다.납세 의무자는 12월 1일 기준 자동차등록원부상 소유자며 올해 1·3·6월 자동차세를 연납한 차량과 비과세·감면 차량은 제외된다. 납부기한은 이달 31일까지며 기한 내 납부하지 못한 경우 3%의 가산금이 부과된다. 체납 시에는 번호판 영치 등 불이익을 받을 수 있다. 서울시 지방세 납부시스템 인터넷 사이트에서 인터넷뱅킹 또는 신용카드로 납부가 가능하다. 고지서 없이 전국 모든 은행의 무인공과금기와 현금인출기에서 본인 명의 통장·현금카드·신용카드로 지방세 조회 후 납부하는 방법도 있다. 주요 시중 은행의 전용 가상 계좌나 카카오페이를 통해서도 납부 가능하다."
2021.12.09.,"제일제면소, 추위 달랠 겨울 별미국수 3종 출시",https://n.news.naver.com/mnews/article/018/0005103087?sid=101,"[이데일리 전재욱 기자] CJ푸드빌이 운영하는 제일제면소가 추운 날씨에 제격인 겨울 별미국수 3종을 출시한다고 9일 밝혔다.제일제면소의 이번 콘셉트는 ‘추운 겨울 따뜻하게 스며든 별미국수’로 추위를 이겨낼 수 있는 겨울 별미로 구성한 것이 특징이다.‘겨울바다 문어우동’은 깊고 진한 육수와 쫄깃한 면발이 조화를 이루는 겨울 별미로 탱탱한 문어다리를 통째로 올려 시각적인 재미까지 더했다.‘육개장 칼국수’는 얼큰하고 개운한 국물에 칼국수와 소고기가 더해져 진한 맛을 낸다.‘스키야키 전골’은 달콤 짭쪼름한 육수에 소고기, 구운 두부, 각종 채소를 넣고 익혀먹는 전골 요리로 2인이 푸짐하게 즐길 수 있다.‘겨울바다 문어우동’과 ‘육개장 칼국수’는 사이드 메뉴와 함께 차림상으로도 판매한다.신메뉴는 전국 제일제면소 매장에서 만나볼 수 있으며 양재하나로마트점, 용산역사점, 청량리역사점, 코엑스점, N서울타워점, 인천공항점은 육개장 칼국수만 판매한다.신메뉴 출시를 기념해 제일제면소 카카오톡 플러스친구 추가 시 ‘씨앗닭강정(대)’ 무료 쿠폰을 증정하는 이벤트도 진행한다.해당 쿠폰은 내년 1월 31일까지 증정 메뉴를 제외하고 2만 원 이상 주문 시 테이블당 1매 사용 가능하다. 타 쿠폰, 행사 및 제휴 할인카드는 중복 적용되지 않는다. 코엑스몰점, N서울타워점, 푸드월드 인천공항점은 이벤트 제외 매장이다. 상세 내용은 제일제면소 카카오톡 플러스친구 채널에서 확인할 수 있다."
2021.12.09.,게임 업체가 만화영화 만드는 이유는? MZ세대 겨냥…롤·배그 잇따라 애니로,https://n.news.naver.com/mnews/article/024/0000071997?sid=101,"# 46일 연속 전 세계 넷플릭스 1위를 기록하며 신드롬을 일으킨 ‘오징어 게임’. 끝나지 않을 것 같던 오징어 게임의 질주를 막아선 것은 할리우드의 내로라하는 콘텐츠가 아니었다. 게임 회사 ‘라이엇게임즈’가 만든 애니메이션 ‘아케인’이다. 11월 7일 넷플릭스에 공개된 아케인은 하루 만에 넷플릭스 시청 1위를 기록하며 오징어 게임의 독주를 끝냈다. 새로운 인기 드라마 ‘지옥’의 등장에도 인기는 식을 줄 모른다. 인기 콘텐츠들이 연달아 등장하는 와중에도 아케인은 넷플릭스 인기 콘텐츠 순위 5위권 안에 꾸준히 이름을 올린다. 성과에 힘입어 라이엇게임즈는 아케인 시즌2 제작을 예고했다. 넷플릭스 오리지널 콘텐츠 ‘아케인’이 화제다. 인기 게임 ‘리그 오브 레전드(이하 롤)’를 기반으로 제작한 애니메이션으로 공개 첫날부터 ‘오징어 게임’의 독주를 막아내며 주목을 받았다. 인지도가 높은 ‘롤’ IP 효과로 얻은 반짝 인기가 아니다. 공개 직후 11월 내내 넷플릭스 콘텐츠 순위에서 상위권을 기록했다.  11월 둘째 주에만 넷플릭스 시청 시간(글로벌 기준)이 3417만시간에 달한다. 전 세계 총 83개국에서 TV쇼 부문 10위권 안에 들었다. 3막이 공개된 11월 21일에는 글로벌 시청 수 1위에 다시 오르는 기염을 토했다.   ▶롤 아케인이 뭐길래 ▷높은 작품성으로 연일 호평 세례 아케인은 롤의 세계관을 바탕으로 제작한 단편 만화다. 롤의 챔피언(등장 캐릭터)이 등장해 이야기를 끌어간다. 게임 내에 등장하는 가상 도시 ‘필트오버’와 ‘자운’에서 벌어지는 이야기를 총 9편에 걸쳐 담았다. 시리즈는 부유한 도시 ‘필트오버’와 지저분한 지하 도시 ‘자운’이 아슬아슬하게 공존하는 배경에서 시작한다. 두 도시에서 각자 파괴적인 에너지가 탄생하면서 긴장이 더욱 고조된다. 필트오버에서는 마법 에너지를 통제하는 방법인 마법공학이 탄생하고, 자운에서는 인간을 괴물로 변신시키는 ‘시머’라는 약물이 나오면서 두 도시 국가 사이에 줄다리기가 팽팽해진다. 두 도시 국가의 긴장된 관계 속 롤의 유명 게임 캐릭터 바이, 징크스, 케이틀린, 제이스, 빅토르 등의 사연이 차례로 그려진다.‘게임’이라는 마니아 장르에도 불구하고 아케인이 열풍에 가까운 인기를 끄는 이유는 ‘쉬운 이해도’와 ‘작품성’이다.우선 진입장벽을 낮췄다. 게임 IP를 콘텐츠화하는 과정에서 가장 많이 범하는 실수가 ‘게임’의 배경 이야기를 모두 설명하려 하는 것이다. 방대한 이야기를 만화 하나에 모두 넣으려다 보니 이야기 전개는 느려지고 세계관을 알려주는 콘텐츠를 추가로 제작해야 한다. 이 과정에서 게임에 관심이 없던 시청자는 떨어져 나가며 인기가 자연스레 하락한다. 과거 엔씨소프트가 제작한 ‘블레이드&소울’ 애니메이션이 대표적인 예다. 당시 엔씨소프트는 일본 시장에 진출하기 위해 ‘블레이드&소울’ 세계관을 바탕으로 일본 애니메이션을 만들었다. 하지만 주목을 받지 못하고 실패로 끝났다. 게임 내 설정을 무리하게 만화 내용에 넣다 보니 애니메이션 자체 완성도가 크게 하락한 탓이다. 혹평을 받으며 시청률 부진 끝에 조용히 사라졌다. 원작 게임의 인기도 같이 하락하며 일본 시장 공략에 실패했다. 반면 아케인은 굳이 ‘롤’을 하지 않더라도 애니메이션만 봐도 내용을 이해할 수 있도록 제작했다. 게임을 하면 누구나 한 번쯤 생각해봤을 법한 이야기를 만들어냈다. 덕분에 롤을 접해보지 않은 중년세대나 여성 시청자 거부감이 적었다.콘텐츠 자체의 뛰어난 작품성도 인기 요인이다. 라이엇게임즈는 아케인을 제작하면서 단순히 만화 한두 편을 내는 수준이 아니라 제대로 된 ‘브랜드’로 만든다는 목표를 세웠다. 콘텐츠 하나에 투자하는 시간을 늘렸다. 아케인의 경우 제작에만 6년이 걸렸다. 수준 높은 작품이 나오면서 많은 시청자로부터 호평을 받았다. 성과에 힘입어 아케인은 시즌2 제작이 확정됐다. 라이엇게임즈 관계자는 “현재 시즌2를 제작하고 있다. 시즌1을 만든 프랑스 3D 애니메이션 스튜디오 포티셰프로덕션과 협업으로 진행한다. 이미 제작 노하우가 쌓인 만큼 시즌2는 시즌1보다 제작 기간이 짧을 것”이라고 설명했다.  라이엇게임즈가 제작한 애니메이션 ‘아케인’이 인기를 끈다. 넷플릭스에서 높은 순위를 자랑한다. (라이엇게임즈 제공)  ▶IP 확장 뛰어드는 국내 게임사 ▷성공하면 대박, 열풍 앞으로도 계속‘아케인’ 성공에 자극받은 국내 게임사들도 IP 확장에 적극 뛰어든다. 가장 눈에 띄는 행보를 보이는 곳은 크래프톤이다. 게임 ‘배틀그라운드’를 기반으로 한 웹툰 3편 ‘100’ ‘침묵의 밤’ ‘리트리츠’를 11월에 공개했다. 유명 웹툰 제작사 ‘와이랩’과 협업했다. 크래프톤 관계자는 “배틀그라운드 IP를 기반으로 개발한 세계관 펍지 유니버스를 게임 이용자뿐 아니라 일반 대중에게도 각인시키는 게 목표다. 게임보다 많은 사람이 즐길 수 있는 콘텐츠로 제작하고자 했고 그 노력의 일환으로 웹툰을 만들었다”고 제작 배경을 전했다.넷마블 자회사 넷마블에프앤씨는 신규 세계관에 입각한 웹툰·웹소설 12종을 내년 초 글로벌 콘텐츠 플랫폼을 통해 공개하기로 했다. 연재될 플랫폼은 카카오페이지(한국), 타파스미디어(미국), 픽코마(일본) 등이다.컴투스는 올해 5월 콘텐츠 제작사 ‘정글스튜디오’를 설립하며 웹툰·스토리텔링 콘텐츠 사업에 본격 진출했다. 정글스튜디오는 웹툰 제작사 케나즈와 공동으로 세운 합작투자 회사다. 컴투스의 인기 게임 ‘서머너즈 워’를 기반으로 한 다양한 장르의 만화를 2022년 1분기에 선보일 예정이다.넥슨은 2020년부터 콘텐츠 사업 관련 인사를 영입하며 사업 확장을 추진 중이다. 지난해에는 월트디즈니 최고전략책임자(CSO)를 역임한 케빈 메이어를 신임 사외이사로 임명했으며, 최근에는 디즈니 출신의 엔터테인먼트 전문가 닉 반 다이크를 수석부사장 겸 최고전략책임자로 임명했다.게임 업계 관계자와 전문가들은 향후 국내외 게임 회사의 IP 콘텐츠 확장 전략이 대세가 될 것이라 내다본다. 아케인을 비롯한 성공 사례가 속속 등장하는 데다 게임에 거부감이 적은 MZ세대가 주요 콘텐츠 소비층으로 떠오른 덕분이다. 배틀그라운드 웹툰을 제작한 와이랩 관계자는 “게임·웹소설 IP를 기반으로 제작한 드라마·영화·웹툰의 성공 사례가 늘어나고 있다. IP 확장에 성공하면 막대한 수익은 물론, 홍보 효과까지 거둘 수 있다. 드라마나 만화로 작품을 접한 소비자들이 원작을 다시 찾아오는 등 선순환 현상이 일어나기 때문이다. 두 마리 토끼를 다 잡을 수 있는 만큼 이 추세는 당분간 계속되리라 본다”고 전망했다.“과거에도 게임사가 IP를 활용해 콘텐츠를 만드는 사례가 많았다. 다만 대다수가 일부 유명 게임의 이용자를 위해 만든 ‘팬 서비스’ 성향이 강했다. 수익과는 거리가 멀었다. 최근의 융·복합 현상은 게임 산업계 전반적으로 확대되고 있다는 점에서 예전과 다르다. 게임에 거부감이 적은 MZ세대가 주요 문화 소비층으로 떠오르면서 게임 IP의 영향력이 커졌다. 성공 확률이 높은 만큼 게임 회사들의 게임 파생 콘텐츠 제작은 앞으로도 확대될 것이다.”김영진 청강대 게임학과 교수의 분석이다.[본 기사는 매경이코노미 제2137호 (2021.12.08~2021.12.14일자) 기사입니다]"
2021.12.09.,"바디프랜드, 우리은행 '마이데이터'서 구독 서비스 시작",https://n.news.naver.com/mnews/article/119/0002555864?sid=101,"ⓒ바디프랜드[데일리안 = 이나영 기자] 바디프랜드는 우리은행 ‘마이데이터’에서 구독 서비스를 시작했다고 9일 밝혔다.지난 1일 오픈된 우리은행 마이데이터는 은행, 보험사, 카드사 등 기존 금융 회사에 흩어진 개인신용정보를 기반으로 금융 업무를 통합 관리하는 플랫폼이다. 바디프랜드를 비롯한 제휴 상품의 렌탈, 구독 현황을 조회하고 가입할 수 있는 구독 서비스를 제공한다.우리은행 마이데이터 가입 고객에게 제공되는 바디프랜드 구독 서비스는 합리적인 소비와 건강 관리를 원하는 소비자들이 금융 정보를 통합 관리함과 동시에 렌털 기간, 월 납부액, 결제일 등 바디프랜드의 렌털 현황까지 한번에 파악할 수 있도록 했다.우리은행 마이데이터 고객은 바디프랜드의 대표 모델이자 스테디셀러인 ‘팬텀Ⅱ 브레인’ 카카오블랙과 골드를 비롯해 신제품 쇼파형 안마의자 ‘아미고’, 가성비 모델로 꼽히는 ‘셀레네Ⅱ’, ‘크루즈’, ‘코닉’ 등 안마의자 6종을 최대 19% 혜택으로 구매할 수 있다.바디프랜드 관계자는 “똑똑한 소비를 원하는 소비자들의 니즈에 맞춰 통합 자산 운영과 동시에 안마의자 렌털 현황을 한 눈에 파악해 관리할 수 있는 서비스를 제공하기로 했다”며 “특히 구독 서비스 개시를 기념해 안마의자를 특가에 구매할 수 있는 기회도 마련했으니 많은 고객이 혜택을 누리시기 바란다”고 말했다."
2021.12.09.,전자지갑 시대…목걸이 사원증 사라지고 주민증 모바일 확인,https://n.news.naver.com/mnews/article/001/0012826069?sid=101,"실물과 효력 같은 모바일 운전면허증 내년 시험 출시라온화이트햇 본인인증 앱 '옴니원'[라온화이트햇 제공]    (서울=연합뉴스) 한혜원 기자 = 내년에는 지갑에 주민등록증, 운전면허증 등을 들고 다니지 않아도 웬만한 신분 확인이 가능할 전망이다.     정보기술(IT) 기업들의 탈중앙화 신원증명(DID·Decentralized Identifiers) 사업이 발전하면서 스마트폰에 백신 접종 정보는 물론 사원증, 학생증, 운전면허증, 주민등록증까지도 담아 다닐 수 있기 때문이다.    9일 IT업계에 따르면 통합보안·인증 기업 라온시큐어와 LG CNS는 이달 안에 모바일 운전면허증 서비스 구축을 완료하고, 내년 초 세종 등 일부 지역에서 시험 운영할 예정이다.     통신 3사는 작년 6월부터 본인인증 애플리케이션(앱) '패스'(PASS)에서 모바일 운전면허증 확인서비스를 운영해 왔다.     하지만 이는 확인서비스로, 카드 면허증을 100% 대체하지는 못한 채 편의점, 운전면허시험장, 영문 운전면허증 발급 등 일부에만 사용됐다.     이보다 한 걸음 더 나아간 모바일 운전면허증은 기존 플라스틱형 운전면허증과 100% 동일한 효력을 지닌다. 따라서 은행, 관공서 등 운전면허증이 활용되는 모든 곳에서 사용할 수 있다.     라온시큐어 관계자는 ""시범운영 경과를 확인한 뒤 내년 안에 전국에서 모바일 운전면허증을 사용할 수 있게 될 것""이라고 밝혔다. 모바일 운전면허증 (PG)[장현경 제작] 일러스트모바일 운전면허증은 블록체인 기반 DID 기술이 적용돼 위·변조가 불가능하다.    이용자가 서비스 앱에 접속해 본인인증을 하고, QR코드를 불러오면 인증을 요구한 기관이 QR코드를 스캔해 신분을 확인할 수 있다.     이런 서비스는 주민등록증으로도 확대될 예정이다.     행정안전부 관계자는 ""내년 3월부터 '정부24' 앱에서 주민등록증 모바일 확인 서비스를 시범 운영하기 위해 준비 중""이라고 밝혔다.     DID 서비스 개발은 신종 코로나바이러스 감염증(코로나19) 백신 접종 정보 확인과 맞물려 속도를 냈다.     라온시큐어 자회사 라온화이트햇은 자체 앱 '옴니원'에 코로나19 예방접종 정보를 보관하고 제출할 수 있는 서비스를 출시했다.     앱에 예방접종 정보와 함께 사원증, 학생증 등 모바일 신분증 서비스를 추가하면 사무실이나 강의실에 들어갈 때 신분 확인과 접종 확인을 동시에 하는 등 인증 절차가 간소화된다.     양대 포털기업 네이버와 카카오도 DID 서비스를 확대하고 있다.     네이버는 이달 7일부터 네이버 앱으로 연세대학교에서 오프라인 도서관 출입, 도서 대여 등을 할 수 있는 모바일 학생·동문인증 서비스를 시작했다.     카카오는 한국산업인력공단이 발급하는 국가기술자격증 495종, 카카오프렌즈 상품 보증서, 한국야구위원회(KBO) 구단 멤버십을 디지털 카드로 제공하고 있다.     카카오는 자격 증명과 사무실 출입, 보안기기 접근이 가능한 디지털 사원증 서비스를 내년 상반기 외부 기업 대상으로 출시할 예정이다.     hye1@yna.co.kr"
