기사날짜,기사제목,네이버 뉴스 url,기사내용
2021.12.30.,"김진욱 공수처장 “왜 저희만 사찰이라 하나···검찰 59만건, 경찰 187만건, 저희는 135건”",https://n.news.naver.com/mnews/article/032/0003119598?sid=100,"[경향신문]  국회 법제사법위원회 출석 국민의힘 사찰 주장에 반박 “검찰·경찰도 통신자료 조회”김진욱 공수처장이 30일 오후 서울 여의도 국회 법사위 회의장 앞에서 국민의힘 의원들에게 인사하기 위해 이동하고 있다. 국회사진기자단김진욱 고위공직자범죄수사처장은 30일 공수처 통신자료 조회와 관련한 국민의힘의 사찰 주장에 대해 “사찰이 아니라는 점에 대해 분명히 말씀드린다”라고 말했다.김 처장은 이날 오후 국회 법제사법위원회 현안질의에 출석해 “인력이 부족해 일을 못한다는데 최소 40여개 언론사의 120명 기자, 제1야당 대선 후보와 그 부인, 이성윤 서울중앙지검 황제의전 보도 기자, 기자의 가족을 무분별하게 조회했다”는 조수진 국민의힘 의원 주장에 이같이 답했다.조 의원은 “이전 정권들을 적폐로 몰아붙여서 청산하겠다고 했으면 좀 달라져야 되지 않겠나”라고 지적했다. 그러자 김 처장은 “제가 법조인으로 솔직히 느끼는 건 여야가 바뀔 때마다 야당에서는 통신자료 조회를 사찰로 보시는 경향들이 있으신 것 같다”며 최근 논란이 정치적으로 비화됐다는 취지로 답했다. 김 처장은 재차 “사찰은 아니다. 될 수가 없다”라고 강조했다.김 처장은 “우리나라 국민 어느 누구도 수사기관에서 야당의 대통령 후보와 그 가족에 대해 무차별적인 사찰을 자행하는 것을 동의하지 않을 것”이라는 권성동 국민의힘 의원 지적에는 “왜 저희만 가지고 사찰이라고 그러시나”라며 억울함을 토로했다.김 처장은 “야당 국회의원님들 통신자료 조회를 말씀하시는데, 저희가 윤석열 후보님에 대해 (통신자료를 조회)한 것이 3회, 중앙지검에서 한 게 3회, 배우자님(윤 후보 부인 김건희씨)에 대해 한 게 저희가 1회, 검찰이 5회”라고 말했다.김 처장은 “지난주 과학기술정보통신부에서 발표된 통계를 봤는데, 검찰에서 통신자료를 조회한 게 59만7000건, 경찰에서 한 게 187만7000건이고 저희가 135건”이라며 “저희가 통신사찰을 했다고 하는 건 좀 과하신 말씀”이라고 강조했다.권 의원은 “윤석열 후보도 3회, 부인 김건희 대표도 1회 (통신자료 조회), 이것도 고발사주 의혹 사건인가”라는 질문에 김 처장은 “아마 그렇게 알고 있다”고 말했다. 김 처장은 “그러면 제보사주 의혹과 관련해서 박지원 국정원장과 지인들 통신기록도 조회했나”라는 권 의원 질의에 “그 부분도 했다”고 말했다. 김 처장은 “몇명 했나”라는 질문에 “구체적인 숫자는 기억하지 못한다”고 답했다.권 의원은 “단톡방(단체 카카오톡방)에 들어와서 고발사주 사건과 아무 관련 없는 의원들 신상을 (공수처가) 다 털었다”고 주장했다. 이에 대해 김 처장은 “신상은 아니다”라며 “가입자 정보”라고 선을 그었다.권 의원은 “정치검찰 없앤다고 공수처 만들어놓고 공수처가 제2의 정치검찰 역할을 하는 것”이라며 “문재인 대통령이 공수처장에 임명해줘서 ‘야권 후보 탄압하자. 대선에 개입해 공을 한번 세워보겠다’는 의도가 맞나”라고 주장했다. 김 처장은 “지나친 말씀”이라고 반박했다. 김 처장은 “통신자료 조회는 통신수사의 한 수단인가”라는 박성준 민주당 의원 질의에 “제가 수사하는 검경(검찰·경찰)에 물어보면 수사의 기본이라고 한다”며 “이걸 하지 말라고 하면 수사하지 말라는 얘기하고 똑같다고 다들 얘기한다”고 말했다.김 처장은 “제가 지금 법조인으로 (경력이) 25년인데, 이렇게 수사기관이 어떤 수사를 하는 도중에 통신자료를 조회한 게 문제가 돼서 기관장이 답변한 전례가 없는 것 같다”며 “전기통신사업법 제84조3항에 맞게 (통신자료를) 청구해서 받은 것이기 때문에 전혀 법적인 문제가 없다”고 강조했다."
2021.12.30.,강명원 서울청 홍보협력계장 등 87명 총경 승진(종합2보),https://n.news.naver.com/mnews/article/001/0012869176?sid=102,"이지은 서울 화양지구대장 등 여성 경찰관 8명도 총경 계급장경찰청[연합뉴스TV 제공](서울=연합뉴스) 이정현 기자 = 경찰청은 30일 강명원 서울경찰청 홍보협력계장과 장현덕 경찰청 홍보협력계장 등 경정 87명의 총경 승진임용 내정 인사를 발표했다.    '경찰의 꽃'으로 불리는 총경은 치안총감·치안정감·치안감·경무관 다음 계급으로, 일선 경찰서장과 본청·시도경찰청 과장급에 해당한다.    경찰은 이번 인사에 대해 ""책임수사 체계 안착과 현장 대응능력 강화를 위해 수사, 생활안전, 112상황실, 교통 등 민생 치안 분야의 전문가를 우선적으로 선발했다""고 설명했다.    수사 분야에서는 17명, 사이버수사는 2명, 과학수사는 1명, 안보수사는 3명, 생활안전과 여성청소년, 112상황실은 11명, 교통은 4명이 승진했다.    서울 광진경찰서 화양지구대장 이지은 경정 등 여성 경찰관 8명도 총경 계급장을 달았다. 이 경정은 치안 수요가 많은 홍익지구대, 연신내지구대, 화양지구대에서 지구대장을 연이어 했다.    여성으로서 이번 승진 명단에 포함된 서울 성동경찰서의 김재미 경정은 이른바 버닝썬 사건에서 사건 관련자들의 카카오톡 대화방에서 '경찰총장'으로 불려 사건 연루 의혹이 일었던 윤규근 총경의 배우자이기도 하다.    경찰청에서는 총 19명이 총경으로 승진했고 지역별로는 서울이 26명으로 가장 많았다. 이어 경기남부와 부산이 각 6명으로 뒤를 이었다. 인천·대구·전북·경남은 각 3명, 강원·대전·충북·충남·경북·광주·전남은 각 2명, 경기북부·인재개발원·제주·울산은 각 1명이었다.    경찰청은 다음 달 초까지 이번 승진자를 포함한 총경급 전보인사를 마무리할 계획이다.    lisa@yna.co.kr"
2021.12.30.,"생일 지난 2010년생 1월부터 백신 접종, 방역패스 미적용(종합)",https://n.news.naver.com/mnews/article/421/0005815388?sid=102,"2010년생, 1월 4일부터 예약…2004년생은 3차접종 예약 가능서울 중랑구의 한 중학교에서 열린 '찾아가는 청소년 코로나19 예방접종'에서 한 학생이 접종을 하고 있다. (서울시교육청 제공)/뉴스1(서울=뉴스1) 음상준 기자,이형진 기자,김규빈 기자,강승지 기자 = 2022년에 만 12세가 되는 2010년생 소아청소년은 신종 코로나바이러스 감염증(코로나19) 백신을 맞는다. 접종 일은 2022년 1월부터다. 만 18세가 되는 2004년생 청소년은 접종 완료 후 3개월이 지났다면, 3차 접종을 받을 수 있다.김기남 코로나19예방접종대응추진단(이하 추진단) 접종기획반장은 30일 정례브리핑에서 이 같은 내용을 담은 '2022년 신규 백신 접종 계획'을 공개했다. 현재 코로나19 1·2차 예방접종은 만 12세 이상을 대상으로 진행 중이다. 2022년 만 12세가 되는 2010년생은 생일이 지난 시점부터 접종할 수 있다.사전예약은 새해 1월 4일 오전 0시부터 사전예약 누리집을 통해 예약을 받는다. 백신 배송 일정을 고려해 예약일 기준 7일 후부터 접종일을 선택할 수 있다. 예방접종은 위탁의료기관에서 화이자 백신으로 실시하고, 1차 접종 3주일 후 2차 접종을 받는다. 2022년 1월에는 2010년 1월·2월생이 예약할 수 있으며, 월별 예약 가능 대상을 순차적으로 확대할 예정이다.질병관리청 중앙방역대책본부(이하 방대본)는 현장 혼란을 예방하기 위해 2022년에는 2010년생 청소년에게 방역패스(접종증명·음성확인제)를 적용하지 않는다.2022년 만 18세가 되는 2004년생은 2차 접종 후 3개월이 지나면 3차 접종을 받을 수 있게 된다. 백신 종류는 메신저 리보핵산(mRNA) 플랫폼으로 만든 백신이며, 위탁의료기관에서 접종이 이뤄진다.2004년생 3차 접종 예약은 1월 1일 0시 이후 사전예약 누리집을 통해 신청하면 된다. 예약일부터 7일 이후 백신을 맞을 수 있다. 추진단은 접종 대상자에게 개별적으로 안내 문자를 발송할 예정이다.◇0~9세 확진 한달새 약 3배 급증…""어린이집 집단감염 영향""방역당국이 최근 0~9세 확진자가 급증하는 원인으로 어린이집 및 유치원에서 집단감염이 발생한 것을 꼽았다.김기남 접종기획반장은 ""0~9세 확진자는 최근 10만명당 일평균 발생률이 11월 4주에 7.6명이었으나, 한 달 뒤인 12월 4주에는 19.6명으로 늘었다""며 ""이는 지역사회에서 접촉에 의한 감염이 늘고 있고, 어린이집이나 유치원 같은 집단감염이 증가하고 있기 때문""이라고 밝혔다.이어 ""오미크론 변이의 빠른 전파력으로 인해 가정에서도 추가적인 전파가 가능하다""며 ""(아동) 보호자나 (보육기관) 관련 종사자 등은 예방접종을 꼭 받아달라""고 강조했다.김기남 접종기획반장은 ""특히 면역 감소 시점이 도래하는 18~59세는 3차접종(부스터샷) 시점이 본격적으로 오고 있다""며 ""적극적으로 백신을 맞고 아이들에게 추가로 전파되지 않도록 해야 한다""고 당부했다.통신 3사는 코로나19 접종증명(방역패스) 도입에 맞춰 PASS(패스)앱 내 QR출입증의 증명 기능을 강화했다고 30일 밝혔다. 기존 QR출입증으로는 전자출입명부와 백신 접종 증명만 가능했으나, PASS는 이번 업데이트로 확진 후 완치자, 기타 접종 예외자 등에 대한 증명도 제공해 완벽하게 방역패스의 역할을 수행할 수 있게 됐다. (SKT 제공) 2021.12.30/뉴스1◇ 전자출입명부에서도 2차접종 경과일 확인 가능정부가 만든 전자 예방접종증명 애플리케이션(앱) '쿠브(COOV)'에서만 확인할 수 있던 3차접종력과 2차접종 후 경과일을 네이버·카카오 등 전자출입명부 플랫폼에서도 확인할 수 있게 됐다.김기남 접종기획반장은 2022년 1월 3일 코로나19 방역패스(접종증명·음성확인제) 유효기간 6개월 적용에 맞춰 이날 전자증명서·출입명부 시스템을 개선했다고 밝혔다.이번 조치로 네이버와 카카오 등 국민이 흔히 이용하는 전자출입명부 플랫폼에서도 3차접종력과 2차접종 후 경과일을 확인할 수 있다. 종이 증명서로만 발급한 완치 확인서와 예외 확인서는 쿠브 앱과 전자출입명부에서 전자적 형태로 발급받을 수 있다.접종증명 유효기간이 적용되는 1월 3일부터는 2차접종 후 180일 이내 또는 3차접종(부스터)을 받은 경우, 시설 이용을 위해 QR스캔 시 '접종완료자입니다'라고 음성 안내된다.코로나19 감염력이 있는 2차접종자(얀센은 1차접종자)는 유효기간 만료일이 없으며, 접종 후 180일이 지나도 ""접종완료자입니다"" 음성 안내가 이뤄진다.미접종자(또는 1차접종자)이거나 2차접종 후 180일이 지난 경우엔 '딩동' 소리가 나온다. 이 경우 시설관리자는 이용자의 PCR 음성 결과 또는 코로나19 완치, 18세 이하, 의학적 사유로 인한 적용 예외 여부를 확인해야 한다.방대본은 접종 정보 갱신 등 협조도 요청했다. 카카오와 네이버, 토스, 통신사 3사(SKT, KT, LG)의 패스(PASS) 등 주로 사용하는 전자출입명부 플랫폼 앱을 미리 업데이트해놓으면 1월 3일 동시간대 접속 혼란 방지에 큰 도움이 될 것으로 봤다.◇백신 맞은 16세 첫 사망…""역학조사·인과성 검토 중""코로나19 백신 접종을 받은 16세 청소년 중 이상반응 의심사례로 1명이 사망한 것으로 나타났다. 이에 따라 12~18세 소아청소년 의심사례 중 사망자는 누적 3명으로 늘었다. 연령별로 보면 18세 2명, 16세 1명이다. 16세 연령에서는 첫 사망 사례다.앞서 지난 8월 27일 코로나19 백신을 맞은 고등학교 3학년 남학생이 접종 이후 75일이 지난 10월 27일 숨지는 사례가 발생했다. 다만 이 사례는 백혈병으로 인한 사망이 확인돼 백신 인과성은 없는 것으로 판정됐다. 지난 11월 17일에도 백신을 접종한 후 24일 지난 10대가 추가로 숨졌다.고재영 중앙방역대책본부 위기소통팀장(질병관리청 대변인)은 ""이상반응이 신고되면 투명하게 정보를 공개하고 있다. 공개한 사례는 역학조사를 진행하고, 신속대응팀 검토 결과가 보고되면 피해조사반에서 신고 사례와 백신 접종 간 인과성을 검토한다""고 설명했다.이어 ""다만 해당 사례는 개인정보 보호법, 가족들의 의견 등이 있어 개별 사례 정보는 공개드리지 못하고 있다""며 ""인과관계가 검토된 이후 발표하겠다""고 덧붙였다."
2021.12.30.,"CJ올리브네트웍스, 쿠콘과 API 플랫폼 사업 MOU 체결",https://n.news.naver.com/mnews/article/092/0002243596?sid=105,"CJ올리브네트웍스(대표 차인혁)가 쿠콘(대표 김종현)과 API 플랫폼 경쟁력 확보를 위한 업무협약(MOU)을 체결했다고 30일 밝혔다.API는 운영체제 및 프로그래밍 언어가 제공하는 기능을 제어하는 인터페이스를 뜻한다. API 이용하면 표준화된 코드 작성이 가능하고, 빠른 프로세스 처리와 개발자들과의 협업을 용이하게 만들어 준다.CJ올리브네트웍스는 API를 활용하여 기존 메시징 서비스 중심에서 API 기반 서비스형 커뮤니케이션 플랫폼으로 사업 범위를 확대해 경쟁력을 강화한다는 계획이다.차인혁 CJ올리브네트웍스 대표(왼쪽), 김종현 쿠콘 대표(이미지=CJ올리브네트웍스)협약식은 29일 용산구 트윈시티 본사에서 진행됐으며 김종현 쿠콘 대표, 박성용 부사장, 차인혁 CJ올리브네트웍스 대표, 이주영 NEXT사업 1담당 등을 비롯한 주요 관계자들이 참석한 가운데 열렸다.코로나 19 장기화로 재택 근무가 강화되고 비대면 활동이 확대되면서 음성, 영상, 문자, 채팅, 파일 공유 등 통합 서비스가 가능한 클라우드 기반 통신 플랫폼의 중요성이 더해지고 있다.이러한 추세를 반영하여 CJ올리브네트웍스는 내년 상반기 중 클라우드 인프라 기반통신 플랫폼 ‘API 플렉스(가칭)’ 출시를 앞두고 있으며, 쿠콘과의 협약을 통해 ▲API 플랫폼 기술 개발 ▲비즈니스 모델 발굴 ▲서비스 교차 공급 등을 상호 협력할 예정이다.CJ올리브네트웍스가 제공하는 문자, 카카오톡, 푸쉬 등 커뮤니케이션 관련 API 서비스 상품 외에도 쿠콘의 기업및 금융 API 상품 탑재해 종합 API 플랫폼을 선보일 예정이다.이 외에도 쿠콘의 비즈니스 데이터 플랫폼인 ‘쿠콘닷넷’에서도 CJ올리브네트웍스의 API기반 메시징 서비스를 만나볼 수 있다.차인혁 CJ올리브네트웍스 대표는 “뉴노멀시대를 맞아 대부분의 기업 비즈니스가 비대면방식으로 이뤄지고 있어 API 기반 IT서비스 시장은 지속적으로 성장할 것으로 예상한다” 며 “이번 협약을 통해 CJ올리브네트웍스가 보유한 메시징 API 역량과 쿠콘의 기술을 결합해 차별화된 API 플랫폼을 구현하겠다”고 말했다.김종현 쿠콘 대표는 “전문 IT 기술력을 기반으로 종합 API 서비스를 제공하는 CJ올리브네트웍스와의 이번 제휴로 다양한 시너지를 도모할 수 있을 것”이라며, “쿠콘이 보유한 역량과 자원을 적극 활용하여 최상의 서비스를 선보일 수 있도록 노력하겠다”고 말했다."
2021.12.30.,"김진욱 공수처장 “왜 저희만 사찰이라 하나···검찰 59만건, 경찰 187만건, 저희는 135건”",https://n.news.naver.com/mnews/article/032/0003119598?sid=100,"[경향신문]  국회 법제사법위원회 출석 국민의힘 사찰 주장에 반박 “검찰·경찰도 통신자료 조회”김진욱 공수처장이 30일 오후 서울 여의도 국회 법사위 회의장 앞에서 국민의힘 의원들에게 인사하기 위해 이동하고 있다. 국회사진기자단김진욱 고위공직자범죄수사처장은 30일 공수처 통신자료 조회와 관련한 국민의힘의 사찰 주장에 대해 “사찰이 아니라는 점에 대해 분명히 말씀드린다”라고 말했다.김 처장은 이날 오후 국회 법제사법위원회 현안질의에 출석해 “인력이 부족해 일을 못한다는데 최소 40여개 언론사의 120명 기자, 제1야당 대선 후보와 그 부인, 이성윤 서울중앙지검 황제의전 보도 기자, 기자의 가족을 무분별하게 조회했다”는 조수진 국민의힘 의원 주장에 이같이 답했다.조 의원은 “이전 정권들을 적폐로 몰아붙여서 청산하겠다고 했으면 좀 달라져야 되지 않겠나”라고 지적했다. 그러자 김 처장은 “제가 법조인으로 솔직히 느끼는 건 여야가 바뀔 때마다 야당에서는 통신자료 조회를 사찰로 보시는 경향들이 있으신 것 같다”며 최근 논란이 정치적으로 비화됐다는 취지로 답했다. 김 처장은 재차 “사찰은 아니다. 될 수가 없다”라고 강조했다.김 처장은 “우리나라 국민 어느 누구도 수사기관에서 야당의 대통령 후보와 그 가족에 대해 무차별적인 사찰을 자행하는 것을 동의하지 않을 것”이라는 권성동 국민의힘 의원 지적에는 “왜 저희만 가지고 사찰이라고 그러시나”라며 억울함을 토로했다.김 처장은 “야당 국회의원님들 통신자료 조회를 말씀하시는데, 저희가 윤석열 후보님에 대해 (통신자료를 조회)한 것이 3회, 중앙지검에서 한 게 3회, 배우자님(윤 후보 부인 김건희씨)에 대해 한 게 저희가 1회, 검찰이 5회”라고 말했다.김 처장은 “지난주 과학기술정보통신부에서 발표된 통계를 봤는데, 검찰에서 통신자료를 조회한 게 59만7000건, 경찰에서 한 게 187만7000건이고 저희가 135건”이라며 “저희가 통신사찰을 했다고 하는 건 좀 과하신 말씀”이라고 강조했다.권 의원은 “윤석열 후보도 3회, 부인 김건희 대표도 1회 (통신자료 조회), 이것도 고발사주 의혹 사건인가”라는 질문에 김 처장은 “아마 그렇게 알고 있다”고 말했다. 김 처장은 “그러면 제보사주 의혹과 관련해서 박지원 국정원장과 지인들 통신기록도 조회했나”라는 권 의원 질의에 “그 부분도 했다”고 말했다. 김 처장은 “몇명 했나”라는 질문에 “구체적인 숫자는 기억하지 못한다”고 답했다.권 의원은 “단톡방(단체 카카오톡방)에 들어와서 고발사주 사건과 아무 관련 없는 의원들 신상을 (공수처가) 다 털었다”고 주장했다. 이에 대해 김 처장은 “신상은 아니다”라며 “가입자 정보”라고 선을 그었다.권 의원은 “정치검찰 없앤다고 공수처 만들어놓고 공수처가 제2의 정치검찰 역할을 하는 것”이라며 “문재인 대통령이 공수처장에 임명해줘서 ‘야권 후보 탄압하자. 대선에 개입해 공을 한번 세워보겠다’는 의도가 맞나”라고 주장했다. 김 처장은 “지나친 말씀”이라고 반박했다. 김 처장은 “통신자료 조회는 통신수사의 한 수단인가”라는 박성준 민주당 의원 질의에 “제가 수사하는 검경(검찰·경찰)에 물어보면 수사의 기본이라고 한다”며 “이걸 하지 말라고 하면 수사하지 말라는 얘기하고 똑같다고 다들 얘기한다”고 말했다.김 처장은 “제가 지금 법조인으로 (경력이) 25년인데, 이렇게 수사기관이 어떤 수사를 하는 도중에 통신자료를 조회한 게 문제가 돼서 기관장이 답변한 전례가 없는 것 같다”며 “전기통신사업법 제84조3항에 맞게 (통신자료를) 청구해서 받은 것이기 때문에 전혀 법적인 문제가 없다”고 강조했다."
