기사날짜,기사제목,네이버 뉴스 url,기사내용
2021.12.16.,"북한, 탈북 가족과 연락 단속… 中위챗 사용시 간첩 체포",https://n.news.naver.com/mnews/article/081/0003237979?sid=100,"북한, 국경 지역 단속 강화남한 거주 탈북자 명단 입수중국 메신저 위챗. AFP 연합뉴스중국의 모바일 메신저 위챗 사용을 단속하는 북한의 감시망이 더욱 치밀해지고 있다. 북중 국경지역에서는 중국 휴대폰에 카카오톡과 위챗을 깔고 한국과 중국에 있는 사람들과 연락하는 북한 주민들이 꽤 있는 것으로 알려졌다. 비싼 국제전화 요금을 내지 않아도 되기 때문에 한국에 정착한 탈북자들도 같은 방법으로 북한에 있는 가족들과 연락을 주고 받고 있다고 RFA 방송은 보도했다.북한 당국이 휴대폰을 도감청하기 때문에 북한 주민들은 위챗 사용으로 단속을 피하고 있다. 결국 북한은 국경지역 주민들의 해외 통화를 단속하기 위해 감청 장비를 수입한 것으로 알려졌다. 15일 대북전문매체 데일리NK에 따르면 최근 북한 당국은 “중국 손전화(휴대폰) 사용자 마지막 한 사람까지 뿌리 뽑으라”며 소탕 작전을 지시했고, 위챗 사용 적발시 이유 불문 간첩 혐의를 적용하고 있다.압수한 휴대폰을 이용해 동조자까지 색출하는 바람에 수십 명의 남한 거주 탈북민 명단도 보위부에 들어갔다는 전언이다. 중국 휴대폰을 사용하다 걸리면 벌금이나 단련대 정도로 끝나지 않을 거라는 분위기가 형성되면서 주민들 역시 긴장하고 있다.소식통은 “최근 중국 손전화 사용자 및 동조자 색출 방식이 보다 다양해졌다. 주민들도 위챗을 지우고 바싹 긴장하고 있다”고  말했다."
2021.12.16.,"시간도 NFT로 판다...프렌즈게임즈, '타임슬롯' 서비스 출시",https://n.news.naver.com/mnews/article/092/0002242443?sid=105,"카카오톡 내 클립과 서비스 연동...보라 코인으로 NFT 거래프렌즈게임즈(공동대표 정욱·송계한)는 대체불가토큰(NFT)을 활용한 블록체인 서비스인 '투데이이즈'를 소프트 론칭한다고 16일 밝혔다.투데이이즈는 하루를 10분 단위로 나눈 타임슬롯을 NFT로 만들어 판매하는 '타임슬롯 NFT' 서비스다. 카카오톡 내 디지털 자산 지갑 클립과 연동해 이용할 수 있다. 개인 간 자유로운 거래도 가능하다.보통 NFT는 한번 발행되면 콘텐츠 내용에 변화를 줄 수 없지만, 투데이즈는 NFT 소유자가 입력 내용을 자유롭게 수정할 수 있는 것이 특징이다.프렌즈게임즈가 NFT 타임슬롯 서비스 투데이즈를 소프트 론칭했다.NFT 거래 수단으로는 보라(BORA) 코인이 활용된다. 투데이이즈 출시를 기념해 최초 NFT 판매가를 90% 할인하는 이벤트도 함께 진행된다.프렌즈게임즈 이이구 플랫폼본부장은 ""누구에게나 간직하고 싶은 추억, 기념하고 싶은 날이 있다. '투데이이즈'는 그 시간들을 블록체인 NFT를 활용해 소장할 수 있게 해 주는 새로운 개념의 서비스다""고 설명했다.이어 ""소유한 시간에 소중한 사람들과의 추억을 넣을 수도 있고, 팬덤을 실어 선물할 수도 있으며, 다가오는 시간에 맞춰 사전예고나 출시 등을 알리는 등 다양한 방법으로 활용하는 것이 가능한 만큼 자유롭게 투데이이즈를 즐기시길 바란다""고 전했다."
2021.12.16.,"'며느라기2' 이번엔 K-임산부 성장일기 담는다, 티저포스터 공개",url없음,<네이버 기사 없음>
2021.12.16.,"'그림자미녀' 심달기 ""미워하는 것도 용서도 내가 판단해"" 묵직한 한방",https://n.news.naver.com/mnews/article/109/0004527526?sid=106,<구조 다름>
2021.12.16.,"FTSE 올라타는 크래프톤·카뱅, 외국인 자금 몰린다",https://n.news.naver.com/mnews/article/023/0003659917?sid=101,"SK IET와 HK이노엔도내일 FTSE지수에 신규 편입파이낸셜타임스스톡익스체인지(FTSE)지수 변경(17일)을 앞두고 크래프톤 등 신규 편입 및 격상이 확정된 종목들로 외국인 자금이 모이고 있다. /뉴시스										파이낸셜타임스스톡익스체인지(FTSE)지수 변경(17일)을 앞두고 신규 편입 및 격상이 확정된 종목들로 외국인 자금이 모이고 있다.지난달 19일 FTSE는 크래프톤·카카오뱅크·SK아이이테크놀로지(SKIET)·HK이노엔을 지수에 새로 추가한다고 발표했다. 크래프톤·카카오뱅크·SKIET는 대형주 지수에, HK이노엔은 소형주 지수에 포함된다. 편입은 17일 장 마감 후 진행된다.FTSE는 영국 파이낸셜타임스(FT)와 런던증권거래소(LSE)가 공동으로 설립한 FTSE인터내셔널이 발표하는 글로벌 주가 지수다. 모건스탠리캐피털인터내셔널(MSCI)지수와 함께 글로벌 대형 펀드들이 수익률 기준(벤치마크)으로 삼는 양대 지수다. 이 지수들에 편입될 경우 해당 지수에 수익률이 연동된 글로벌 패시브 펀드 자금이 유입될 것이라는 기대감에 통상 외국인 자금이 몰린다. 하지만 실제 지수 편입 이후 해당 주가들이 떨어질 가능성이 적지 않아 투자에 주의해야 한다는 지적이다.										15일 한국거래소에 따르면 크래프톤은 FTSE지수 편입이 발표된 지난달 19일부터 지난 14일까지 삼성전자·SK하이닉스에 이어 외국인 순매수 3위(3900억원)에 올랐다. 같은 기간 외국인들은 카카오뱅크를 3040억원, HK이노엔을 120억원어치 순매수했다. 소형주 지수에서 대형주 지수로 격상된 F&F도 외국인 순매수(370억원) 대상이 됐다.유안타증권에 따르면 이번 지수 편입으로 크래프톤으로는 1703억원의 글로벌 펀드 자금 신규 유입 효과가 생길 것으로 추산됐다. 카카오뱅크(1015억원), SKIET(485억원), F&F(109억원), HK이노엔(41억원)으로도 신규 자금이 투자될 것으로 예상됐다.하지만 막상 지수에 편입된 직후에는 주가가 불안해질 가능성이 큰 것으로 전망된다. 삼성증권은 “리밸런싱(편입 조정)이 끝난 직후 월 초에는 항상 편입 종목들의 주가 단기 하락 반전이 반복해서 나타났다”며 “편입 종목들에 대해서는 12월 중순까지 단기적으로 투자하는 전략이 유효하다”고 조언했다. 이미 보유 중인 경우라면 12월 중순 이후 매도해 차익을 실현하고, 신규 투자는 주가 하락 후 저가 매수 전략을 취하라는 뜻이다.실제 과거 MSCI한국지수에 편입됐던 종목들 사례를 보면 이 같은 현상이 확인된다. 지수 편입 발표 직후 10거래일간 수익률은 대체로 양호했지만 실제 편입 실행 후 10거래일은 대부분 종목들이 떨어진 것이다. 예를 들어 2018년 5월 MSCI한국지수에 편입된 셀트리온제약은 지수 편입 후 10거래일간 8.6% 하락했고, 에이치엘비(-31.2%), 삼성엔지니어링(-16.2%), 바이로메드(-15.6%) 등도 하락폭이 컸다."
2021.12.16.,"??????엔터테인먼트, 세계 ???? ?????? ??????? ???랫폼 美 우시아월드 ?????",url없음,<네이버 기사 없음>
2021.12.16.,"고승범 ""빅테크의 독점, 영업행위 규제로 감독할 것""",https://n.news.naver.com/mnews/article/011/0003997424?sid=101,"고승범 금융위원장, 빅테크사와 간담회 개최대형 플랫폼의 네트워크 락인효과 우려손해 전가·이익 제공 강요 등 금지 규정디지털 혁신금융 발전전략 수립 계획고승범(앞줄 왼쪽 네번째) 금융위원장이 15일 서울 마포 프론트원에서 열린 금융플랫폼 혁신 활성화를 위한 간담회에서 참석자들과 박수를 치고 있다./사진 제공=금융위원회[서울경제] 고승범 금융위원장이 네이버파이낸셜, 카카오페이, 토스 등 빅테크의 데이터 독점을 영업행위 규제로 철저히 감시하겠다고 밝혔다. 금융 당국이 기존 금융권, 빅·핀테크 사이에서 편향적으로 규제하지 않되 동일기능 동일규제 원칙을 세우겠다는 취지다. ‘기울어진 운동장’에 대한 업권별 의견을 바탕으로 디지털 혁신금융 발전전략을 세우겠다는 방침이다.고 위원장은 15일 서울 마포 프론트원에서 진행된 ‘금융플랫폼 혁신 활성화를 위한 간담회’에서 “빅테크 기업의 금융업 진출은 동일기능·동일규제 및 소비자보호 원칙이 지켜지는 가운데 이뤄지도록 하겠다”며 이같이 말했다. 이날 간담회에는 네이버파이낸셜, 카카오페이, 토스, 뱅크샐러드 등 빅테크 기업과 KB금융지주, 신한은행, 현대카드 등 기존 금융사들이 참석했다. 고 위원장은 “(금융의) 종합 플랫폼화 과정에서 동일기능·동일규제 적용 문제와 소비자 보호 및 데이터 독점 등에 대한 우려도 함께 커지고 있다”며 “네트워크 효과·락인 효과가 커짐에 따라 빅테크는 물론 금융회사의 대형 플랫폼에서 나타날 수 있는 데이터 독점, 편향적 서비스 제공 등에 대해서는 영업행위 규제 등을 통해 철저히 감독해 나가겠다”고 언급했다.구체적인 규제 방안으로 금융 플랫폼이 금융사에 손해를 전가하거나 경제상 이익 제공을 강요하는 등 우월적 지위의 남용을 금지하는 규정이 명시된 전자금융법 개정안을 꼽을 수 있다. 이와 관련해 고 위원장은 “금융소비자보호법도 적용되고 공정거래위원회에서 보는 부분도 있어 조화롭게 하려고 한다”고 덧붙였다.이날 간담회에서 고 위원장은 데이터, 신기술, 플랫폼, 디지털 보안, 디지털 자산 등 5대 핵심 분야를 중심으로 한 ‘디지털 혁신금융 발전전략’을 수립하겠다고 밝혔다. 전략에는 초개인화된 맞춤형 정보가 제공될 수 있도록 마이데이터 서비스의 참여기관, 정보제공 범위를 점차 확대하고 업권별·금융서비스별 인공지능(AI) 가이드라인 세부지침이 포함됐다. 개인화된 금융, 생활서비스를 제공받는 나만의 공간 개념의 마이플랫폼 도입도 추진된다. 이 과정에서 기울어진 운동장을 해소하기 위해 기존 금융회사들의 정보공유, 업무위수탁, 부수·겸영업무, 핀테크 기업과 제휴 등에서 합리적 대안도 모색할 예정이다.고 위원장은 “금융안정, 금융소비자보호, 공정경쟁 등의 측면에서 서로 같이 발전해나갈 수 있는 걸 찾자는 의미”라며 “빅테크, 핀테크를 어떻게 구분해서 볼지, 빅테크와 금융회사의 관계를 어떻게 할지 등을 종합적으로 검토할 것”이라고 강조했다."
2021.12.16.,"[뱅크룸] KB국민은행, 과기부 공인전자문서중계자 인증 획득 外",url없음,<네이버 기사 없음>
2021.12.16.,"카카오뱅크, 기대 현실화에 따라 변동성 확대될 수도-KB",https://n.news.naver.com/mnews/article/008/0004684094?sid=101,"KB증권은 16일 카카오뱅크에 대해 투자자들의 기대 현실화에 따라 변동성이 확대될 가능성이 있다고 진단했다. 투자의견은 '매수', 목표주가는 7만5000원으로 제시했다. 전일 종가는 6만3000원이다. 강승건 KB증권 연구원은 ""내년 말 BVPS(주당장부가치) 대비 5.1배, EPS(주당순이익) 대비 92.6배에서 거래되고 있다""며 ""은행업종과 비교할 수 없을 정도로 매우 높은 수준이며 2022~2023년 예상되는 ROE(자기자본이익률)를 감안해도 매우 높은 수준""이라고 진단했다. 현 주가는 투자자들의 기대가 반영된 결과로 판단된다. KB증권은 투자자들의 기대를 △구조적으로 높은 비용 효율성의 여신 성장을 통한 확대 및 수수료 수익 기여도가 증가할 경우 그 효과는 배가 된다는 점 △금융환경의 빠른 변화에 대한 선제적 대응으로 시장 지위 확대 △중금리대출에서의 경쟁력 확보 및 CSS(신용평가모형) 고도화를 통한 신용평가 경쟁력 확보 △카카오 에코시스템에서의 카카오뱅크의 역할 등으로 정리했다. 강 연구원은 ""카카오뱅크의 수익 구조적 측면, 지금까지의 혁신적 상품 출시 경험, 높은 MAU(월간활성이용자) 등을 감안할 때 투자자들의 기대감에 동의한다""면서도 ""투자자들의 기대가 현실화되는 정도에 따라 변동성이 확대될 수 있을 것""이라고 전망했다. 그는 ""카카오뱅크에 대한 기대들이 현실화되는 과정 속에서 카카오뱅크의 밸류에이션(기업가치평가) 기준은 좀 더 명확해질 것""이라며 ""주요  이슈에 대한 성공 여부에 따라 밸류에이션의 기준과 주가의 변동성은 확대될 가능성이 존재한다""고 덧붙였다."
2021.12.16.,"롯데, 라이징스타 온택트 팬미팅 성료",https://sports.news.naver.com/news.nhn?oid=410&aid=0000838130,<구조 다름>
2021.12.16.,"카카오뱅크, 기대 현실화에 따라 변동성 확대될 수도-KB",https://n.news.naver.com/mnews/article/008/0004684094?sid=101,"KB증권은 16일 카카오뱅크에 대해 투자자들의 기대 현실화에 따라 변동성이 확대될 가능성이 있다고 진단했다. 투자의견은 '매수', 목표주가는 7만5000원으로 제시했다. 전일 종가는 6만3000원이다. 강승건 KB증권 연구원은 ""내년 말 BVPS(주당장부가치) 대비 5.1배, EPS(주당순이익) 대비 92.6배에서 거래되고 있다""며 ""은행업종과 비교할 수 없을 정도로 매우 높은 수준이며 2022~2023년 예상되는 ROE(자기자본이익률)를 감안해도 매우 높은 수준""이라고 진단했다. 현 주가는 투자자들의 기대가 반영된 결과로 판단된다. KB증권은 투자자들의 기대를 △구조적으로 높은 비용 효율성의 여신 성장을 통한 확대 및 수수료 수익 기여도가 증가할 경우 그 효과는 배가 된다는 점 △금융환경의 빠른 변화에 대한 선제적 대응으로 시장 지위 확대 △중금리대출에서의 경쟁력 확보 및 CSS(신용평가모형) 고도화를 통한 신용평가 경쟁력 확보 △카카오 에코시스템에서의 카카오뱅크의 역할 등으로 정리했다. 강 연구원은 ""카카오뱅크의 수익 구조적 측면, 지금까지의 혁신적 상품 출시 경험, 높은 MAU(월간활성이용자) 등을 감안할 때 투자자들의 기대감에 동의한다""면서도 ""투자자들의 기대가 현실화되는 정도에 따라 변동성이 확대될 수 있을 것""이라고 전망했다. 그는 ""카카오뱅크에 대한 기대들이 현실화되는 과정 속에서 카카오뱅크의 밸류에이션(기업가치평가) 기준은 좀 더 명확해질 것""이라며 ""주요  이슈에 대한 성공 여부에 따라 밸류에이션의 기준과 주가의 변동성은 확대될 가능성이 존재한다""고 덧붙였다."
2021.12.16.,"롯데, 라이징스타 온택트 팬미팅 성료",https://sports.news.naver.com/news.nhn?oid=410&aid=0000838130,<구조 다름>
