기사날짜,기사제목,네이버 뉴스 url,기사내용
2021.12.02.,내 안엔 '아이'가 산다,https://n.news.naver.com/mnews/article/015/0004635895?sid=103,"Cover Story 인형·장난감 모으기에 빠진 '키덜트'“귀여운 건 최강이다.”키덜트(Kidult·어린이 취향을 가진 성인)에게 통하는 명언이다. 귀여운 캐릭터와 장난감 앞에 모두 복종하고 항복한다. 그리고 지갑을 연다. 유명 애니메이션 주인공처럼 지폐 다발을 흔들며 외친다. “셧 업 앤드 테이크 마이 머니(Shut up and take my money).” 일단 조용히 하고 내 돈이나 가져가라는 뜻이다.한국콘텐츠진흥원의 캐릭터 이용자 실태 조사에 따르면 작년 20~30대의 캐릭터 상품 소비 규모는 1조9100억원이다. 2015년 4800억원에서 네 배 증가했다. 한국 캐릭터 상품 시장 전체 규모는 12조원에 달한다.조사에 응한 한 20대 여성은 카카오프렌즈의 분홍색 복숭아를 닮은 캐릭터 ‘어피치’로 폰 케이스부터 인형, 쿠션, 칫솔, 컵, 밥그릇, 잠옷, 에코백, 가습기, 선풍기, 스피커까지 구매했다. 캐릭터 상품 구매 이유에 대해 그는 “나에겐 명품은 필요 없고 캐릭터가 더 중요하다”며 “나한테 어떤 게 더 가치 있는지 따져서 사는 것”이라고 답했다.키덜트는 한국만의 현상이 아니다. 코로나 팬데믹(대유행) 이후 집에서 보내는 시간이 많아진 성인의 캐릭터 상품과 장난감 구매 비율이 높아지고 있기 때문이다. 시장조사기관 NPD그룹 조사 결과 작년 미국 완구업계의 전체 매출은 251억달러로, 전년 대비 16.1% 증가했다. NPD그룹은 “성인 사이에서 ‘포켓몬’ ‘매직: 더개더링’ 같은 향수를 자극하는 콘텐츠 관련 제품의 판매 증가가 매출을 견인했다”고 설명했다.실제로 덴마크의 레고그룹은 작년 매출이 전년 대비 13% 증가했다. 역대급 실적에 레고는 전 세계 40개국에 근무 중인 직원 2만 명에게 추가 휴가 3일과 특별 보너스를 지급했다. 영국 최대 모형 기차 업체 혼비는 9년 만에 흑자로 전환했다. 플레이모빌 제조사인 독일의 브란트슈테터그룹도 작년 매출 7억6000만유로로 사상 최대 실적을 기록했다.5월 5일은 ‘어른이의 날’이 된 지 오래다. SNS 인스타그램에 ‘#어른이’를 검색하면 23만4000건이 넘게 나온다. 조카나 자녀가 아니라 자신이 갖고 놀 장난감을 사고 인증한 게시물이다. 이달 25일 연말 상여금을 털어 구매할 귀여운 크리스마스 선물을 손꼽아 기다리는 우리는 모두 키덜트다."
2021.12.02.,"광주, 홈 폐막전서 '유종의 미' 도전",url없음,<네이버 기사 없음>
2021.12.02.,"이마트, 채식 확산 따라 대체육 판매 본격화",url없음,<네이버 기사 없음>
2021.12.02.,'2021년 대한민국패션대상' 개최,url없음,<네이버 기사 없음>
2021.12.02.,"H2O호스피탈리티, 코오롱LSI와 호텔 ‘통합DT’ 서비스 계약 체결",https://n.news.naver.com/mnews/article/009/0004887705?sid=105,"통합 예약부터 체크아웃까지 전 과정 디지털화 실현향후 용평리조트, 오크밸리 등 주요 호텔 리조트에 서비스 제공 계획 호텔산업 디지털전환 기업 H2O호스피탈리티 (대표: 이웅희)는 코오롱 산하 레저 및 부동산 종합서비스 전문기업 코오롱LSI와 호텔 운영 시스템을 디지털화하는 호텔 통합 DT(Digital Transformation, 디지털 전환) 서비스 (이하 ‘통합DT 서비스’) 계약을 체결했다고 2일 밝혔다.양사는 호텔 운영에 필요한 고정비 절감과 고객 편의성 증대를 위해 통합DT 서비스 도입을 결정했다. 통합DT 서비스는 온오프라인 판매 채널에서 발생하는 예약의 관리와 객실 분배, 객실 청소 및 시설 관리 인력 배치 등을 한 플랫폼에 모은 호텔통합운영 서비스로, 기존 수기로 운영해온 호텔 업무들을 디지털로 전환해 호텔 운영의 자동화를 실현한다. 또한, 통합DT 서비스는 고객의 쾌적한 호텔 이용을 위해 체크인/체크아웃 과정 전반을 비대면 무인화한다. 프론트 방문이나 키오스크 이용 없이, H2O가 자체 생산한 스마트 도어락을 통해 객실에서 곧바로 체크인과 체크아웃을 진행할 수 있다.H2O호스피탈리티는 코오롱LSI가 지난 2020년부터 위탁 운영하는 성수동의 호텔 포코 런칭을 시작으로 국내 코오롱 계열 호텔들 및 그 외 추가적인 대형 리조트 및 호텔에 통합DT 서비스 도입을 본격화한다. 2021년 하반기에도 다수의 고객사와 서비스 런칭을 준비하고 있으며, 2022년 상반기에는 용평리조트, 오크밸리리조트, 호반, 엘리시안 등에 통합DT 서비스를 제공할 계획이다.이웅희 H2O호스피탈리티 대표는 “인력 중심으로 이루어진 현 호텔 시스템은 높은 고정비로 매출 변동에 취약하다”며, “팬데믹 전후로 고전해온 숙박업계에게 국내 유일한 호텔통합운영시스템을 제공해 업계와 함께 상생하는 기업이 되겠다”고 말했다.문명한 코오롱 LSI 상무는 “세계적으로 호텔 운영의 디지털화에 대한 시도가 이뤄지고 있지만, 그 중에서도 H2O호스피탈리티의 통합DT 서비스가 프론트엔드부터 백엔드까지 모두 디지털화한 서비스로 경쟁력이 높다 판단해 협업을 결정하게 됐다”며, “앞으로 통합 DT서비스를 적극적으로 활용해 고객 중심 서비스를 강화해 나갈 계획”이라고 말했다. H2O는 2021년 포브스 아시아 ‘100대 유망기업’으로 선정되었으며, 최근 300억 규모의 시리즈 C 투자 유치에 성공했다. 카카오인베스트먼트, KDB산업은행, 고릴라PE, 인터베스트, NICE투자파트너스, 케조라-인터베스트 그로쓰 펀드 등 유수 투자사가 참여했으며, 현재까지 누적투자금액은 480억원 규모이다."
2021.12.02.,"포시에스, 소프트웨이브 2021 참가",https://n.news.naver.com/mnews/article/092/0002240964?sid=105,"포시에스(대표 박미경)가 코엑스에서 진행된 ‘대한민국 소프트웨어 대전 소프트웨이브 2021(이하 소프트웨이브 2021)’에 참가했다고 2일 밝혔다.소프트웨이브 2021은 지난해 기준 250여 개사 500부스 기업이 참가하고, 약 2만 명 참관객이 방문한 국내 최대 규모의 소프트웨어 전문 전시회다.포시에스는 코로나19 이후 처음으로 참가한 이번 오프라인 전시회에서 ‘이폼사인’을 단독으로 소개하며, 전자계약 시장 공략에 본격적으로 돌입했다.소프트웨이브 2021 포시에스 이폼사인 부스(이미지=포시에스)포시에스는 ‘일 잘하는 사람들의 전자계약, 이폼사인’을 테마로, 부서별 또는 업무별로 전자계약 서비스를 체험할 수 있는 체험존과 실제 업무에서 사용하고 있는 서식을 현장에서 바로 전자계약으로 활용해 볼 수 있는 데모 시연존 등으로 부스를 꾸몄다. 또한 전자계약 서비스를 처음 접하거나 아직 익숙하지 않은 고객들의 이해를 돕기 위해 실제 업무에서 접할 수 있는 다양한 상황을 그래픽으로 쉽게 표현했다.부스를 방문한 고객은 평소 종이로 사용하던 근로계약서, 개인정보동의서 등을 바로 전자문서로 전환해 간편하게 카카오톡이나 이메일로 서명 요청하는 체험을 통해 이폼사인의 쉽고 편리한 기능을 경험했다.특히 엑셀, 워드 등 기존에 사용 중인 MS 오피스 문서에서 바로 전자문서를 만들 수 있는 폼빌더 기능과 실물 도장 스캔 및 신분증 촬영 등 이폼사인만의 차별화된 기능에 대해서는 매우 긍정적인 반응을 보였다.포시에스는 이번 전시회에서 QR코드를 통해 무료체험에 가입한 고객에 한해 전자계약 1:1 맞춤 컨설팅 혜택을 제공하는 것은 물론, 부스 방문 고객을 대상으로 유료 결제 금액의 10%를 특별 크레딧으로 지급하는 이벤트를 진행했다.전시회 첫날에는 전시장 내 특설무대에서 ‘고객 사례로 보는 부서별 전자계약 활용 방법’을 발표하며, 디지털 전환 및 비대면 업무 환경에 관심을 가지고 있는 참관객들을 대상으로 이폼사인을 소개하는 시간을 별도로 가졌다.이폼사인은 국내 금융권에서 70% 이상의 디지털 창구 시스템 구축 레퍼런스를 보유한 오즈 이폼의 전자문서 엔진 기술을 기반으로 개발된 안정적인 서비스로, 별도의 시스템 구축 없이 매월 합리적인 비용으로 계약서, 신청서, 동의서를 간편하게 전자문서로 만들어 사용할 수 있다.최근에는 중소기업 및 기관은 물론, 현대자동차, LG화학, GS칼텍스 등 국내 굴지의 대기업에서도 이폼사인을 도입하는 등 서비스 안정성과 기술력을 모든 기업군에서 인정받고 있다.박미경 포시에스 대표이사는 “코로나19 이후 국내에서는 처음으로 참가한 오프라인 행사에서 이폼사인을 소개하고 고객들의 긍정적인 반응을 직접 느낄 수 있어서 매우 의미가 있다.”라며, “이번 전시회를 통해 디지털 전환, 비대면 업무 환경 도입에 여전히 어려움을 겪고 있는 중소기업들이 쉽고 빠르게 전자계약 서비스를 사용할 수 있도록 적극적으로 지원하겠다.”라고 말했다.이번 전시회는 코엑스 A홀에서 3일까지 진행되며, 포시에스 ‘이폼사인’ 부스는 D02에서 만날 수 있다."
2021.12.02.,"이마트, 채식 확산 따라 식물성 대체육 ‘언리미트’ 4종 판매",url없음,<네이버 기사 없음>
2021.12.02.,"H2O호스피탈리티, 코오롱LSI와 호텔 ‘통합DT’ 서비스 계약 체결",https://n.news.naver.com/mnews/article/009/0004887705?sid=105,"통합 예약부터 체크아웃까지 전 과정 디지털화 실현향후 용평리조트, 오크밸리 등 주요 호텔 리조트에 서비스 제공 계획 호텔산업 디지털전환 기업 H2O호스피탈리티 (대표: 이웅희)는 코오롱 산하 레저 및 부동산 종합서비스 전문기업 코오롱LSI와 호텔 운영 시스템을 디지털화하는 호텔 통합 DT(Digital Transformation, 디지털 전환) 서비스 (이하 ‘통합DT 서비스’) 계약을 체결했다고 2일 밝혔다.양사는 호텔 운영에 필요한 고정비 절감과 고객 편의성 증대를 위해 통합DT 서비스 도입을 결정했다. 통합DT 서비스는 온오프라인 판매 채널에서 발생하는 예약의 관리와 객실 분배, 객실 청소 및 시설 관리 인력 배치 등을 한 플랫폼에 모은 호텔통합운영 서비스로, 기존 수기로 운영해온 호텔 업무들을 디지털로 전환해 호텔 운영의 자동화를 실현한다. 또한, 통합DT 서비스는 고객의 쾌적한 호텔 이용을 위해 체크인/체크아웃 과정 전반을 비대면 무인화한다. 프론트 방문이나 키오스크 이용 없이, H2O가 자체 생산한 스마트 도어락을 통해 객실에서 곧바로 체크인과 체크아웃을 진행할 수 있다.H2O호스피탈리티는 코오롱LSI가 지난 2020년부터 위탁 운영하는 성수동의 호텔 포코 런칭을 시작으로 국내 코오롱 계열 호텔들 및 그 외 추가적인 대형 리조트 및 호텔에 통합DT 서비스 도입을 본격화한다. 2021년 하반기에도 다수의 고객사와 서비스 런칭을 준비하고 있으며, 2022년 상반기에는 용평리조트, 오크밸리리조트, 호반, 엘리시안 등에 통합DT 서비스를 제공할 계획이다.이웅희 H2O호스피탈리티 대표는 “인력 중심으로 이루어진 현 호텔 시스템은 높은 고정비로 매출 변동에 취약하다”며, “팬데믹 전후로 고전해온 숙박업계에게 국내 유일한 호텔통합운영시스템을 제공해 업계와 함께 상생하는 기업이 되겠다”고 말했다.문명한 코오롱 LSI 상무는 “세계적으로 호텔 운영의 디지털화에 대한 시도가 이뤄지고 있지만, 그 중에서도 H2O호스피탈리티의 통합DT 서비스가 프론트엔드부터 백엔드까지 모두 디지털화한 서비스로 경쟁력이 높다 판단해 협업을 결정하게 됐다”며, “앞으로 통합 DT서비스를 적극적으로 활용해 고객 중심 서비스를 강화해 나갈 계획”이라고 말했다. H2O는 2021년 포브스 아시아 ‘100대 유망기업’으로 선정되었으며, 최근 300억 규모의 시리즈 C 투자 유치에 성공했다. 카카오인베스트먼트, KDB산업은행, 고릴라PE, 인터베스트, NICE투자파트너스, 케조라-인터베스트 그로쓰 펀드 등 유수 투자사가 참여했으며, 현재까지 누적투자금액은 480억원 규모이다."
2021.12.02.,"포시에스, 소프트웨이브 2021 참가",https://n.news.naver.com/mnews/article/092/0002240964?sid=105,"포시에스(대표 박미경)가 코엑스에서 진행된 ‘대한민국 소프트웨어 대전 소프트웨이브 2021(이하 소프트웨이브 2021)’에 참가했다고 2일 밝혔다.소프트웨이브 2021은 지난해 기준 250여 개사 500부스 기업이 참가하고, 약 2만 명 참관객이 방문한 국내 최대 규모의 소프트웨어 전문 전시회다.포시에스는 코로나19 이후 처음으로 참가한 이번 오프라인 전시회에서 ‘이폼사인’을 단독으로 소개하며, 전자계약 시장 공략에 본격적으로 돌입했다.소프트웨이브 2021 포시에스 이폼사인 부스(이미지=포시에스)포시에스는 ‘일 잘하는 사람들의 전자계약, 이폼사인’을 테마로, 부서별 또는 업무별로 전자계약 서비스를 체험할 수 있는 체험존과 실제 업무에서 사용하고 있는 서식을 현장에서 바로 전자계약으로 활용해 볼 수 있는 데모 시연존 등으로 부스를 꾸몄다. 또한 전자계약 서비스를 처음 접하거나 아직 익숙하지 않은 고객들의 이해를 돕기 위해 실제 업무에서 접할 수 있는 다양한 상황을 그래픽으로 쉽게 표현했다.부스를 방문한 고객은 평소 종이로 사용하던 근로계약서, 개인정보동의서 등을 바로 전자문서로 전환해 간편하게 카카오톡이나 이메일로 서명 요청하는 체험을 통해 이폼사인의 쉽고 편리한 기능을 경험했다.특히 엑셀, 워드 등 기존에 사용 중인 MS 오피스 문서에서 바로 전자문서를 만들 수 있는 폼빌더 기능과 실물 도장 스캔 및 신분증 촬영 등 이폼사인만의 차별화된 기능에 대해서는 매우 긍정적인 반응을 보였다.포시에스는 이번 전시회에서 QR코드를 통해 무료체험에 가입한 고객에 한해 전자계약 1:1 맞춤 컨설팅 혜택을 제공하는 것은 물론, 부스 방문 고객을 대상으로 유료 결제 금액의 10%를 특별 크레딧으로 지급하는 이벤트를 진행했다.전시회 첫날에는 전시장 내 특설무대에서 ‘고객 사례로 보는 부서별 전자계약 활용 방법’을 발표하며, 디지털 전환 및 비대면 업무 환경에 관심을 가지고 있는 참관객들을 대상으로 이폼사인을 소개하는 시간을 별도로 가졌다.이폼사인은 국내 금융권에서 70% 이상의 디지털 창구 시스템 구축 레퍼런스를 보유한 오즈 이폼의 전자문서 엔진 기술을 기반으로 개발된 안정적인 서비스로, 별도의 시스템 구축 없이 매월 합리적인 비용으로 계약서, 신청서, 동의서를 간편하게 전자문서로 만들어 사용할 수 있다.최근에는 중소기업 및 기관은 물론, 현대자동차, LG화학, GS칼텍스 등 국내 굴지의 대기업에서도 이폼사인을 도입하는 등 서비스 안정성과 기술력을 모든 기업군에서 인정받고 있다.박미경 포시에스 대표이사는 “코로나19 이후 국내에서는 처음으로 참가한 오프라인 행사에서 이폼사인을 소개하고 고객들의 긍정적인 반응을 직접 느낄 수 있어서 매우 의미가 있다.”라며, “이번 전시회를 통해 디지털 전환, 비대면 업무 환경 도입에 여전히 어려움을 겪고 있는 중소기업들이 쉽고 빠르게 전자계약 서비스를 사용할 수 있도록 적극적으로 지원하겠다.”라고 말했다.이번 전시회는 코엑스 A홀에서 3일까지 진행되며, 포시에스 ‘이폼사인’ 부스는 D02에서 만날 수 있다."
2021.12.02.,"코스피 연중 최저치 떨어진 날, 공매도 1조 폭탄… 크래프톤 가장 많아",https://n.news.naver.com/mnews/article/417/0000760287?sid=101,"코스피가 연중 최저치로 주저 앉았던 지난달 30일 국내 증시에서 공매도 거래대금이 1조원을 넘어선 것으로 나타났다./사진=뉴스1코스피가 연중 최저치로 주저 앉았던 지난달 30일 국내 증시에서 하루만에 공매도 거래대금이 1조원을 넘어선 것으로 나타났다.2일 한국거래소에 따르면 지난달 30일 코스피 시장의 공매도 거래대금은 8184억원을 기록했다. 이는 대형주 공매도가 재개된 지난 5월3일(8299억원) 이후 가장 많은 수준이다. 외국인이 6875억원, 기관과 개인이 각각 1160억원, 149억원을 각각 공매도했다.코스닥 시장의 공매도 거래대금 역시 2767억원으로 지난 5월3일(2795억원) 이후 가장 많았다.종목별로는 코스피 시장에서 크래프톤(651억원)이 가장 많은 공매도를 맞았다. 카카오뱅크(517억원), 삼성전자(495억원), 일진머티리얼즈(460억원), SK스퀘어(339억원) 등이 뒤를 이었다.코스닥 시장에서는 카카오게임즈(547억원), 씨젠(259억원), 엘앤에프(246억원) 등에서 가장 공매도가 많았다.공매도 거래가 크게 늘자 과열종목으로 지정된 종목도 씨젠, 일진머티리얼즈, 코미팜, 티씨케이 등 4개 종목에 달했다. 5개 종목이 과열종목으로 지정됐던 지난 9월30일 이후 가장 많았다.업계에서는 당분간 오미크론 변이 우려로 인한 변동성 장세가 지속되면서 공매도 거래도 크게 늘어날 수 있다고 보고 있다.김용구 삼성증권 연구원은 ""그간 글로벌 매크로 스태그플레이션 논쟁과 매파적인 연준 우려라는 이중고에 집중됐던 시장 초점은 오미크론 변이 돌출과 함께 삼중고 형태로 재편될 공산이 크다""며 ""코스피는 2750선, 코스닥은 930선 수준에서 언더슈팅의 극단이 형성될 가능성이 크다""고 설명했다."
2021.12.02.,"안테나 캐럴 ‘다음 겨울에도 여기서 만나’, 음원 차트 1위",url없음,<네이버 기사 없음>
2021.12.02.,"광주FC, 시즌 최종전서 '유종의 미' 도전",https://sports.news.naver.com/news.nhn?oid=417&aid=0000760557,<구조 다름>
