기사날짜,기사제목,네이버 뉴스 url,기사내용
2021.12.16.,"카페24, 개발자 세미나서 '글로벌 앱 개발 팁' 공유",https://n.news.naver.com/mnews/article/092/0002242398?sid=105,"제3회 개발자 세미나 성료...""카페24 API 덕에 개발 과정 수월""해외로부터 투자를 받거나 글로벌 기업과 손잡고 일하는 유망 국내 IT기업은 물론, '글로벌 첨단 IT산업 중심지' 이스라엘에서 온 개발사의 생생한 이커머스 앱 개발 노하우가 공개됐다.카페24(대표 이재석)는 개발자 생태계 확대를 위한 '제3회 개발자 세미나'를 온라인으로 16일 오후 2시에 진행했다고 밝혔다. 이날 행사에는 카페24 스토어에서 주목받은 앱을 선보인 개발사의 대표와 전문가가 연사로 참여해 자사 주요 서비스를 소개하고, 이커머스 기능을 개발할 때 유용한 정보와 비결을 공유했다.이스라엘 유수의 IT 스타트업을 연계하는 기업 '마인드애드'의 길릿 세게브 부사장은 글로벌 플랫폼인 카페24 스토어에 앱을 출시할 때는 현지화를 중시해야 한다고 조언했다. 그는 ""앱이 다양한 신규 시장의 상황에 맞는 현지화 서비스를 제공할 수 있어야 한다""며 ""현지 고객의 성향을 이해하고 모든 문화권에서 받아들일 수 있도록 앱을 디자인했는지, 가격·결제 수단·고객 지원 등 요소를 현지화했는지 등을 체크해야 한다""고 말했다.길릿 세게브 마인드애드 부사장이 글로벌 앱 개발시 체크포인트를 소개하고 있다특히 다양한 쇼핑몰 기능을 제공하는 앱을 개발할 때 '카페24 API(application Programming Interface)'의 도움을 받았다고 입을 모았다. API는 서로 각종 제품·서비스의 구현 방식을 모르는 개발자도 손쉽게 소통할 수 있도록 하는 도구다. 개발 과정을 간소화해 개발자의 비용과 시간을 절약하도록 돕는다.이스라엘 텔아비브에 본사를 둔 '다이얼로그'는 카페24 스토어에서 인공지능(AI) 기반 마케팅 개인화 플랫폼 앱을 서비스하는 개발사다. 다이얼로그 앱은 각 쇼핑몰 데이터와 AI 기술을 바탕으로 소비자 선호도를 분석한 이후 소비자의 쇼핑몰 방문 시간과 구매 전환율을 개선할 수 있는 다양한 콘텐츠를 제공한다. 고객의 탐색 기록을 기반으로 알맞은 상품을 추천하는 기능, 상품 사용법을 소개하는 동영상이나 SNS 스토리처럼 짧은 사진·영상 콘텐츠를 노출하는 기능 등이 대표적이다.오어 라비 다이얼로그 CTO가 카페24 API로 앱을 제작한 경험을 공유하고 있다오어 라비 다이얼로그 최고기술책임자(CTO)는 앱을 카페24 플랫폼에 연동할 때 유용한 조언을 건넸다. 그는 ""우선 필요한 기능을 구현하기 위해서는 어떤 API가 필요할지 파악하고 테스트해야 한다""면서 ""이 과정에서 오류·요구사항이 있다면 카페24의 전문가들과 논의하면 훨씬 수월하게 개발할 수 있다""고 말했다.그는 또 ""개발 과정에서는 아주 작은 로직을 짜는 것부터 시작하면 조금 더 빠르게 원하는 목표를 이룰 수 있다""며 ""다이얼로그의 경우, 상품 데이터를 추출할 때 필요한 액세스 토큰을 자동으로 갱신하는 로직을 짜는 일부터 시작했다""고 설명했다.정연준 유니드컴즈 이사가 카페24 API를 활용한 앱 개발 과정에 대해 설명하고 있다페이스북 공식 파트너 '유니드컴즈'는 자사 플랫폼 '킵그로우'를 통해 다양한 업무 자동화 서비스를 제공하는 기업이다. 회사는 회원가입 과정을 간소화해 고객 이탈을 막는 '카카오 1초 회원가입', 상품 관련 인스타그램 게시물을 자동으로 게시하는 '인스타그램 포스팅 부스터' 등 킵그로우의 주요 기능 다수를 카페24 스토어에서 서비스 중이다. 발표에 따르면 현재 스토어에서 1천400개가 넘는 고객사가 유료로 앱을 사용 중이고, 유료 구독을 유지하는 비율이 91%에 달한다.정연준 유니드컴즈 킵그로우 총괄이사는 '카카오 첫구매 마케팅' 서비스를 개발하기 위해 카페24 API를 활용했던 경험을 소개했다. 카카오 첫구매 마케팅은 가입 이후 1·3·6·9일째 상품을 구매하지 않은 고객에게 자사몰의 최신 상품 정보를 담은 카카오톡 광고 메시지를 전하는 서비스다.정 총괄이사는 ""카카오 첫구매 마케팅을 구현하기 위해서는 쇼핑몰의 회원, 상품 정보 등이 필요한데, 카페24 API를 통해 이러한 정보를 연결하고 민감한 정보는 암호화할 수 있다""며 ""인스타그램에 상품 정보를 게시하는 서비스를 구현하기 위해서는 API를 통해 진열된 순서와 등록된 상품 상세 이미지중에 해상도가 가장 높은 이미지 정보를 가져오도록 설계했다""고 말했다.김정태 오드컨셉 대표가 PXL AI 앱을 소개하고 있다국내외 특허 35개를 보유한 '오드컨셉'은 AI가 각종 데이터를 픽셀 단위로 분석해 고객이 원하는 상품은 물론, 해당 상품에 어울리는 아이템을 자동으로 추천하는 'PXL(픽셀) AI'를 서비스하는 기업이다. 회사는 앱 개발 과정에서 카페24의 개발 환경을 적극적으로 활용했다.김정태 오드컨셉 대표는 ""개발 전 API 리스트를 확인하고 프로젝트 진행 여부를 결정짓기까지 10분도 걸리지 않을 정도로 다양한 API가 마련돼 있었다""면서 ""개발 이후에는 카페24 플랫폼 기반 테스트몰을 세 가지 형태로 운용해 실사용 환경에서 각종 기능을 시험했고, 앱을 공식 출시한 이후에는 각기 다른 환경에 처한 실제 사용자의 문의·피드백을 통해 앱을 보완했다""고 설명했다.김국진 로로젬 부대표가 AR 가상피팅 앱 개발 경험을 소개하는 모습로로젬은 증강현실(AR) 기술로 귀걸이, 선글라스 등 각종 패션 아이템을 직접 착용한 것 같은 이미지를 구현하는 가상 착용 서비스 '로로룩스', '로로젬 AR'을 서비스하는 기업이다. AR 기술력을 검증받아 미국에서 투자 유치에 성공하기도 했다.김국진 로로젬 부대표는 앱 개발에 활용한 주요 API를 소개했다. 그는 ""가상착용 상품과 실제 상품을 연결하고, 컬러 등 옵션을 관리하거나 가상 착용한 제품을 장바구니에 담는 등 다양한 기능을 API 덕에 손쉽게 구현했다""며 ""쇼핑몰에 앱을 연동해 실제로 라이브 상태에 들어가기까지 걸리는 시간도 30분이 채 걸리지 않을 정도로 빠르다""고 말했다.노동우 카페24 CTO가 인사말을 전하는 모습노동우 카페24 CTO는 ""온라인 쇼핑몰의 기능을 확장하는 것이 이커머스의 주요 승부처로 떠오르는 상황에서, 창의적 기술을 갖춘 개발사는 좋은 기회를 잡을 수 있을 것으로 본다""면서 ""카페24는 이미 진출한 일본, 동남아에 더해 미국, 유럽, 인도 등 글로벌 시장으로 확장하고 있으므로, 글로벌 시장의 고객이 곧 카페24 파트너 개발사의 고객이라고 할 수 있다""고 말했다.김재은 카페24 팀장이 카페24 스토어 생태계를 소개하는 모습김재은 카페24 스토어 팀장은 이번 행사에서 카페24 스토어에 대해 소개했다. 카페24 스토어는 온라인 비즈니스에 필요한 기능을 쉽게 사고팔 수 있는 플랫폼으로 누구나 개발에 참여할 수 있다. 카페24는 개발자 생태계 확장을 위해 지난 2019년 API를 오픈하고 카페24 스토어를 마련했다. 현재 6천500여 개의 개발사가 참여하고 있으며, 3년간 앱 누적 다운로드 수는 45만 건에 달한다."
2021.12.16.,“안전벨트 안 맸네?” 제주 오픈카 사망 사건...살인 혐의 ‘무죄’,url없음,<네이버 기사 없음>
2021.12.16.,"한컴, 전자계약 솔루션 '한컴싸인' 베타 버전 출시",https://n.news.naver.com/mnews/article/014/0004757239?sid=105,"한글과컴퓨터가 전자서명 시장으로 사업영역을 확대한다. 한컴은 웹상에서 문서 작성부터 전자서명까지 가능한 올인원 전자계약 솔루션 '한컴싸인' 베타 버전을 출시했다고 16일 밝혔다. 정식 버전은 2022년 1분기에 출시될 예정이다.   한컴싸인은 별도 오피스 소프트웨어를 구입하거나 설치할 필요가 없이 웹상에서 한컴오피스를 사용해 문서 작성과 전자서명이 가능하다.   글로벌 시장조사 업체 마켓앤드마켓에 따르면, 글로벌 전자서명 시장 규모는 2021년 37억 달러에서 2026년 141억 달러로 4배 가까이 성장하고, 연평균 성장률이 31%에 이를 것으로 예상된다.   김연수 한컴 대표는 ""한컴싸인은 한컴이 그동안 축적한 오피스 소프트웨어 기술력을 바탕으로 사용자에게 전자서명에 최적화된 서비스를 제공할 것""이라며 ""우선 B2B 고객을 중심으로 서비스를 전개하고, 금융, 통신 등 파트너사 확보를 통해 B2G, B2C로 점차 확대할 계획""이라고 밝혔다.   한컴싸인은 문서 작성 및 변환, 전달부터 서명 요청, 서명자 인증, 문서 보관까지 전자계약에 필요한 다양한 기능을 제공한다. 계약 상대방에게 카카오톡과 이메일 등을 통해 전자 서명을 요청할 수 있으며, 별도의 회원 가입 없이도 PC와 모바일 등 다양한 환경에서 비대면 계약 체결이 가능해 이용 편의성을 높였다. 또한, 부동산, 재무, 영업, 금융 등 산업 및 분야별 전자계약에 필요한 다양한 표준 문서 서식을 제공해 사용자가 필요에 맞게 편집 및 수정이 가능하다."
2021.12.16.,3년 버텨야 청년공제 받는데..직장 내 괴롭힘 참아야 하나,https://n.news.naver.com/mnews/article/023/0003660103?sid=101,"[WEEKLY BIZ] Biz & Law청년채움공제										Q. 최근 한 중소기업에 취직해 청년내일채움공제를 신청한 사회 초년생입니다. 이 제도를 통해 지원금을 받으려면, 어떻게든 만기일(최장 3년)까지 회사를 다녀야 합니다. 문제는 회사 사장이 이를 이용해 온갖 직장 내 괴롭힘을 벌이고 있다는 점입니다. 폭언부터 사적 심부름, 성희롱을 일상적으로 저지르고 있습니다. 이런 상황에서도 제가 끝까지 참고 버텨야만 지원금을 받을 수 있는 건지, 퇴사했다가 다른 기업에서 재가입할 수는 없는지 궁금합니다.A. 청년내일채움공제는 생애 1회만 참여 가능하여, 퇴사 이후에는 원칙적으로 재가입이 불가능합니다. 다만 청년내일채움공제 가입 후 직장 내 괴롭힘을 당한 경우 등 기업에 귀책 사유가 있다면 예외적으로 재가입이 가능합니다. 임금 체불, 부당한 임금 조정, 불공정 계약 파기, 권고 사직 등 기업 사유에 따른 퇴직을 당한 경우 등에도 마찬가지입니다.회사에서 사적 심부름, 성희롱, 폭언 등 직장 내 괴롭힘으로 추정되는 피해를 보는 상황이라면 재가입이 가능한 예외 사유에 해당할 수 있습니다. 직장 내 괴롭힘을 인정받으려면 반드시 증거를 확보해야 합니다. 우선 녹음 파일, 카카오톡 대화 내용, 이메일 등 직접적인 괴롭힘 사실을 입증할 자료를 준비해야 합니다. 또한 직장 내 괴롭힘을 목격한 동료들의 목격담을 녹음하거나 진술서를 받고, 카카오톡, 문자 메시지, 이메일 등 관련 자료를 수집하는 것도 큰 도움이 됩니다.입증 자료를 준비한 후에는 직장 내 괴롭힘 담당 부서에 신고해 직장 내 괴롭힘으로 인정받아야 합니다. 회사 규모가 작은 경우엔 대표인 사용자에게 신고하면 되고, 규모가 큰 경우엔 보통 인사팀이 담당 부서입니다. 다만 대표이사 등 사용자가 직장 내 괴롭힘 장본인이면 실질적 조치나 처리가 미비할 수 있습니다. 이때는 관할 지방고용노동관서에 진정을 제기하면 됩니다.직장 내 괴롭힘으로 인정받았다면, 퇴사 후 6개월 안에 다른 기업에 재취업 후 다시 청년내일채움공제를 신청하면 됩니다. 이때 해지 시 지급받았던 중도 해지 환급금 중 정부 지원금을 전부 반환해야 하며, 가입 기간은 재가입일을 기준으로 다시 계산합니다.WEEKLY BIZ를 이메일로 보내드립니다.Newsletter 구독하기 ☞ https://page.stibee.com/subscriptions/77676"
2021.12.16.,"롯데, 라이징 스타 온택트 팬미팅 성황리에 종료",https://sports.news.naver.com/news.nhn?oid=109&aid=0004527278,<구조 다름>
2021.12.16.,"국세청, 체납자·포탈범 등 7천126명 명단공개",url없음,<네이버 기사 없음>
2021.12.16.,“안전벨트 안 맸네?” 제주 오픈카 사망 사건...살인 혐의 ‘무죄’,url없음,<네이버 기사 없음>
2021.12.16.,"하나은행, 하나원큐 '신차 견적 서비스' 복지몰로 확대",url없음,<네이버 기사 없음>
2021.12.16.,"한컴, 전자계약 솔루션 '한컴싸인' 베타 버전 출시",https://n.news.naver.com/mnews/article/014/0004757239?sid=105,"한글과컴퓨터가 전자서명 시장으로 사업영역을 확대한다. 한컴은 웹상에서 문서 작성부터 전자서명까지 가능한 올인원 전자계약 솔루션 '한컴싸인' 베타 버전을 출시했다고 16일 밝혔다. 정식 버전은 2022년 1분기에 출시될 예정이다.   한컴싸인은 별도 오피스 소프트웨어를 구입하거나 설치할 필요가 없이 웹상에서 한컴오피스를 사용해 문서 작성과 전자서명이 가능하다.   글로벌 시장조사 업체 마켓앤드마켓에 따르면, 글로벌 전자서명 시장 규모는 2021년 37억 달러에서 2026년 141억 달러로 4배 가까이 성장하고, 연평균 성장률이 31%에 이를 것으로 예상된다.   김연수 한컴 대표는 ""한컴싸인은 한컴이 그동안 축적한 오피스 소프트웨어 기술력을 바탕으로 사용자에게 전자서명에 최적화된 서비스를 제공할 것""이라며 ""우선 B2B 고객을 중심으로 서비스를 전개하고, 금융, 통신 등 파트너사 확보를 통해 B2G, B2C로 점차 확대할 계획""이라고 밝혔다.   한컴싸인은 문서 작성 및 변환, 전달부터 서명 요청, 서명자 인증, 문서 보관까지 전자계약에 필요한 다양한 기능을 제공한다. 계약 상대방에게 카카오톡과 이메일 등을 통해 전자 서명을 요청할 수 있으며, 별도의 회원 가입 없이도 PC와 모바일 등 다양한 환경에서 비대면 계약 체결이 가능해 이용 편의성을 높였다. 또한, 부동산, 재무, 영업, 금융 등 산업 및 분야별 전자계약에 필요한 다양한 표준 문서 서식을 제공해 사용자가 필요에 맞게 편집 및 수정이 가능하다."
2021.12.16.,3년 버텨야 청년공제 받는데..직장 내 괴롭힘 참아야 하나,https://n.news.naver.com/mnews/article/023/0003660103?sid=101,"[WEEKLY BIZ] Biz & Law청년채움공제										Q. 최근 한 중소기업에 취직해 청년내일채움공제를 신청한 사회 초년생입니다. 이 제도를 통해 지원금을 받으려면, 어떻게든 만기일(최장 3년)까지 회사를 다녀야 합니다. 문제는 회사 사장이 이를 이용해 온갖 직장 내 괴롭힘을 벌이고 있다는 점입니다. 폭언부터 사적 심부름, 성희롱을 일상적으로 저지르고 있습니다. 이런 상황에서도 제가 끝까지 참고 버텨야만 지원금을 받을 수 있는 건지, 퇴사했다가 다른 기업에서 재가입할 수는 없는지 궁금합니다.A. 청년내일채움공제는 생애 1회만 참여 가능하여, 퇴사 이후에는 원칙적으로 재가입이 불가능합니다. 다만 청년내일채움공제 가입 후 직장 내 괴롭힘을 당한 경우 등 기업에 귀책 사유가 있다면 예외적으로 재가입이 가능합니다. 임금 체불, 부당한 임금 조정, 불공정 계약 파기, 권고 사직 등 기업 사유에 따른 퇴직을 당한 경우 등에도 마찬가지입니다.회사에서 사적 심부름, 성희롱, 폭언 등 직장 내 괴롭힘으로 추정되는 피해를 보는 상황이라면 재가입이 가능한 예외 사유에 해당할 수 있습니다. 직장 내 괴롭힘을 인정받으려면 반드시 증거를 확보해야 합니다. 우선 녹음 파일, 카카오톡 대화 내용, 이메일 등 직접적인 괴롭힘 사실을 입증할 자료를 준비해야 합니다. 또한 직장 내 괴롭힘을 목격한 동료들의 목격담을 녹음하거나 진술서를 받고, 카카오톡, 문자 메시지, 이메일 등 관련 자료를 수집하는 것도 큰 도움이 됩니다.입증 자료를 준비한 후에는 직장 내 괴롭힘 담당 부서에 신고해 직장 내 괴롭힘으로 인정받아야 합니다. 회사 규모가 작은 경우엔 대표인 사용자에게 신고하면 되고, 규모가 큰 경우엔 보통 인사팀이 담당 부서입니다. 다만 대표이사 등 사용자가 직장 내 괴롭힘 장본인이면 실질적 조치나 처리가 미비할 수 있습니다. 이때는 관할 지방고용노동관서에 진정을 제기하면 됩니다.직장 내 괴롭힘으로 인정받았다면, 퇴사 후 6개월 안에 다른 기업에 재취업 후 다시 청년내일채움공제를 신청하면 됩니다. 이때 해지 시 지급받았던 중도 해지 환급금 중 정부 지원금을 전부 반환해야 하며, 가입 기간은 재가입일을 기준으로 다시 계산합니다.WEEKLY BIZ를 이메일로 보내드립니다.Newsletter 구독하기 ☞ https://page.stibee.com/subscriptions/77676"
2021.12.16.,"롯데, 라이징 스타 온택트 팬미팅 성황리에 종료",https://sports.news.naver.com/news.nhn?oid=109&aid=0004527278,<구조 다름>
2021.12.16.,오픈카 음주 사고로 여친 숨지게 한 30대 '살인' 혐의 무죄,https://n.news.naver.com/mnews/article/001/0012819049?sid=102,"(제주=연합뉴스) 백나용 기자 = 제주에서 렌터카로 음주운전을 하다 여자친구를 사망에 이르게 한 30대 남성이 살인 혐의에 대해 무죄를 선고받았다. 제주지방법원[제주지방법원 홈페이지 캡처. 재판매 및 DB 금지]    제주지법 형사2부(장찬수 부장판사)는 16일 살인과 음주운전 혐의로 불구속기소 된 A(34)씨에 대해 징역 1년에 집행유예 2년을 선고했다.    재판부는 A씨의 살인 혐의는 무죄로 보고, 음주운전에 관해서만 판단했다.    A씨는 2019년 11월 10일 오전 1시께 제주시 한림읍에서 술에 취한 상태로 렌터카를 물고 가다 사고를 내 조수석에 타고 있던 여자친구 B씨를 사망에 이르게 한 혐의(살인 및 음주운전)로 불구속기소 됐다.    사고 당시 A씨의 혈중알코올농도는 0.118%였던 것으로 확인됐다.     A씨는 시속 114㎞로 질주하다 왼쪽으로 굽은 도로에서 연석을 들이받은 뒤 도롯가에 세워져 있던 경운기를 들이받았다.     사고 차는 일명 '오픈카'라고 불리는 컨버터블형 차량으로 당시 안전벨트를 하지 않은 B씨는 차 밖으로 튕겨 나갔다.     B씨는 이 사고로 크게 다쳐 수술을 받았지만, 의식불명 상태로 지내다 이듬해 8월 결국 숨졌다.     경찰은 살인 의도는 없었다고 보고 A씨를 특가법상 위험 운전 등 치상 혐의로 검찰에 넘겼으나 검찰은 카카오톡 문자와 블랙박스 녹음 파일 내용 등을 바탕으로 A씨가 고의로 사고를 일으킨 것으로 봤다.    검찰은 ""블랙박스 파일을 확인해보니 A씨는 차에서 안전벨트 미착용 경고음이 울리자 B씨에게 '안전벨트 안 맸네?'라고 했고, 이후 곧바로 차 속도를 올려 고의로 사고를 일으켰다""며 살인 혐의로 기소한 이유를 설명한 바 있다.    재판부는 ""대법원 판례를 보면 살인죄도 직접 증거 없이 간접 증거만으로도 유무죄 판결을 내릴 수 있다""면서도 ""다만 범행 동기와 방법, 범행에 이르는 과정 등 여러 간접 증거가 충분할 정도로 압도적이여 하지만 이번 사건에서 나타난 간접 증거들은 불충분한 면이 있다""고 무죄 판결 이유를 밝혔다.    dragon.me@yna.co.kr"
