기사날짜,기사제목,네이버 뉴스 url,기사내용
2021.12.10.,"이준석 ""n번방 방지법 재개정 추진""…허은아 ""후속 조치할 것""(종합)",https://n.news.naver.com/mnews/article/421/0005776727?sid=100,"'n번방 방지법' 첫날 '사전 검열' 논란李 ""텔레그램 미적용 실효성 적어""이준석 국민의힘 대표가 15일 서울 여의도 한 카페에서 열린 국민의힘 초선의원 공부모임 '명불허전 보수다 시즌5' 강연에 허은아 의원과 대화를 나누며 참석하고 있다. 2021.9.15/뉴스1 © News1 오대일 기자(서울=뉴스1) 김일창 기자 = 국민의힘은 네이버·카카오 등의 디지털 성범죄물 유통 방지를 위한 'n번방 방지법'(전기통신사업법 및 정보통신망법 개정안) 시행 첫날인 10일 법 개정에 나서겠다고 밝혔다.이준석 대표는 이날 페이스북에 ""n번방 사건 때 분노한 여론을 타고 통과돼 이슈가 되고 있는 n번방 방지법은 기준의 모호함에 더해 헌법 제18조가 보장하는 통신의 자유를 심각하게 침해할 소지가 있다""며 ""당 차원에서 적극적으로 재개정을 추진해 나가도록 하겠다""고 말했다.지난해 5월 20대 국회 마지막 본회의에서 통과된 해당 법안은 네이버, 카카오 등 부가통신사업자에 불법 음란물을 삭제하고 접속을 차단하는 등 유통 방지 조치 의무, 기술적·관리적 조치 의무를 부과하는 내용이 골자다.그러나 사용자들은 개정안이 시행되면 디지털 성범죄물 외에 다른 '유해한' 콘텐츠의 유통도 일방적으로 차단될 수 있다고 우려하는 상황이다. '유해한' 콘텐츠를 정의하기가 애매하고 불법 영상물을 정확하게 걸러내는 필터링 기술이 아직 완전한 상태가 아니라서 '사전 검열'이 확대하는 것 아니냐는 논란이 불거지는 상황이다. 실제 이날부터 필터링 기능이 적용된 카카오톡에선 사용자들이 '단순 동물 영상인데도 불법 영상물로 인식돼 필터링에 걸렸다'는 등 불만의 목소리가 나오고 있다.또 서버가 해외에 있는 외국 사업자들에 대한 직접적인 규제도 사실상 어렵다는 문제가 있다. 이 대표는 이에 대해 ""실질적으로 n번방 사건에서 유통경로가 됐던 텔레그램 등에는 적용이 어려워 실효성이 떨어지는 조치""라고 지적했다.당 수석대변인이자 국회 소관 상임위인 과학기술정보방송통신위원회 소속 허은아 의원은 ""처벌 강화 위주의 기존 'n번방 방지법'만으로는 실질적인 피해자 구제가 어렵기 때문에 법령 자체의 문제와 후속 조치 과정에서 과잉대응이 없는지 살피도록 하겠다""고 했다.허 의원은 ""제가 발의해 통과된 'n번방 대응 국제협력 강화법'은 방심위에서 이미 불법으로 판정한 성범죄물 등 각종 불법정보의 절대다수가 해외 서버에 소재해 국내로의 '접속차단'에 그치는 문제가 있어 방송통신심의위원회로 하여금 해외 당국, 사업자와 협력을 공조할 수 있도록 직무항목을 신설한 법안""이라며 ""피해자 일상 회복을 위해 가장 필수적인 '범죄물의 즉각적이고 완전한 삭제'를 위해 국제적 협력을 강화하는 내용""이라고 말했다."
2021.12.10.,불법촬영물 사전필터링 첫날…“고양이 영상도 걸려” “수위 높은 이미지는 통과”,https://n.news.naver.com/mnews/article/028/0002571257?sid=102,"오픈채팅방 등에 각종 영상 필터링 후기 올라와10일 카카오톡 오픈채팅방에 한 사용자가 올린 게재 제한 알림 사진. 카카오톡 오픈채팅방 갈무리10일 네이버·카카오·구글 등이 디지털성범죄물 유통을 막기 위한 ‘사전 필터링 기술’을 적용하기 시작했다.이날 시행된 ‘사전 필터링’(식별 및 게재 제한)은 텔레그램으로 성착취물을 공유해 공분을 일으킨 ‘엔(n)번방’ 사건 후속 조처다. 이용자가 동영상 또는 움직이는 이미지(움짤) 등을 보내기 전에 디지털성범죄 영상물을 모은 데이터베이스와 비교해 불법촬영물을 식별하는 기술이다. 세계에서 처음 시행되는 제도다. 사업자들은 정부가 개발해 제공하는 관련 기술 등을 활용해 불법촬영물 여부를 식별하고, 불법촬영물로 판명되면 게시를 제한하게 된다. 이에 따라 카카오는 지난 3일 “정보통신망에서 불법촬영물등을 유통할 경우 삭제 등 유통방지에 필요한 조치가 취해진다. 관련 법률에 따라 형사처벌을 받을 수 있으니 서비스 이용 시 유의해달라”는 공지를 올리기도 했다.지난해 12월 ‘엔번방 방지법’으로 불린 개정 전기통신사업법은 매출액 10억원 이상 또는 일평균이용자 10만명 이상인 에스엔에스(SNS) 및 포털 사업자 등을 대상으로 불법촬영물에 대한 기술적·관리적 조치 의무를 부과했다. 네이버·카카오·디시인사이드·아프리카TV 등 국내 인터넷 사업자는 87곳, 구글·메타·트위터·위챗·틱톡 등 해외 인터넷 사업자 8곳이 대상이다.이번 조처가 시행되자 서비스 이용자들은 카카오톡 오픈채팅 등에 각종 영상 등을 올린 후 “‘전기통신사업법에 따라 방심위에서 불법촬영물 등으로 심의·의결한 정보에 해당하는지 검토중’이라는 알림을 받았다”며 화면 갈무리를 올렸다. “고양이 영상을 올려도 걸린다” “수위가 높아도 영상이 아닌 이미지는 가능하다” 등 후기도 공유했다.일각에서 ‘검열’이라는 반발이 거세자 정치권에서도 반응이 나왔다. 이준석 국민의힘 대표는 이날 페이스북에 “헌법 18조가 보장하는 통신의 자유를 심하게 침해할 소지가 있고 실질적으로 ‘엔(n)번방’ 사건에서 유통경로가 됐던 텔레그램 등에는 적용이 어려워 결국 실효성이 떨어지는 조처”라고 했다. 방송통신위원회 관계자는 “불법촬영물에 대해 표현의 자유가 운운되는 것이 당황스럽다. 검열은 콘텐츠 게재에 앞서 공개 여부를 결정하는 것인데, 이번 경우는 불법촬영물과 같은 정보값을 찾는 것이고 시간이 걸릴 뿐”이라고 말했다. 이어 “(텔레그램 등) 사적인 대화방은 해당 법 적용을 받지 않는다. 카카오톡 오픈채팅은 게시판 성격이어서 포함됐다”고 덧붙였다. 텔레그램 등 사적인 대화방이나 이메일 등으로 유통되는 불법촬영물의 경우엔 여전히 별도 수사의 영역이라는 얘기다."
2021.12.10.,삼성화재 새 대표에 홍원학...그 앞에 '만만찮은 바윗덩이' 수두룩,url없음,<네이버 기사 없음>
2021.12.10.,"카카오페이, 5% 급락에 20만원선 무너져…공매도 수량 1만8000주대로 늘어나",url없음,<네이버 기사 없음>
2021.12.10.,"안철수 ""n번방 방지법은 전 국민 감시법…즉시 폐지 추진""",https://n.news.naver.com/mnews/article/003/0010882680?sid=100,"기사내용 요약""헌법 제18조가 추구하는 통신의 비밀 침해""[서울=뉴시스] 최진석 기자 = 안철수 국민의당 대선후보가 10일 국회에서 코로나19 대응 긴급제안 기자회견을 하고 있다. (공동취재사진) 2021.12.10. photo@newsis.com[서울=뉴시스] 박준호 기자 = 카카오톡 오픈(익명) 채팅방, 인터넷 커뮤니티 등에 이용자가 동영상을 올릴 경우 사전에 불법 촬영 여부를 확인하도록 한 이른바 'n번방 방지법(개정 전기통신사업법 및 정보통신망법)'이 10일 시행에 들어간 가운데 안철수 국민의당 대선 후보는 ""전 국민의 모든 영상물을 검열하는 전 국민 감시법""이라고 비판하며 반대했다.안 후보는 이날 페이스북에 ""이번 '메신저, 커뮤니티 검열제도'를 '국민감시법'(개정 전기통신사업법 및 정보통신망법)이라 생각하고 있으며 헌법 제18조가 추구하는 통신의 비밀을 침해한다고 생각한다""며 ""제가 국민의 선택을 받게 된다면 즉시 검열제도의 폐지를 추진하겠다""고 밝혔다.또 ""인터넷산업뿐만 아니라 대한민국 산업 전반에 걸쳐 온갖 규제의 그물로 숨이 막히게 만들고 산업의 발전을 가로막는 역차별을 한다는 현실을 잘 알고 있다""며 ""이것들 역시 대부분을 싹 폐기하여 사업자들이 자신들의 아이디어를 자유롭게 펼쳐 나갈 수 있도록 하겠다는 것이 저의 소신""이라고 했다. 다만 ""이 법의 구실이 된 제2, 제3의 N번방에 대해서는 형량 강화, 제도 정비, 전문 수사 인력 확충 등 진짜 해결책을 시행해서 끔찍한 성착취 범죄를 진짜로 잡아내고 뿌리 뽑는 제대로 된 정책을 펴겠다""고 제안했다．"
2021.12.10.,"안철수 ""n번방 방지법은 전 국민 감시법…즉시 폐지 추진""",https://n.news.naver.com/mnews/article/003/0010882680?sid=100,"기사내용 요약""헌법 제18조가 추구하는 통신의 비밀 침해""[서울=뉴시스] 최진석 기자 = 안철수 국민의당 대선후보가 10일 국회에서 코로나19 대응 긴급제안 기자회견을 하고 있다. (공동취재사진) 2021.12.10. photo@newsis.com[서울=뉴시스] 박준호 기자 = 카카오톡 오픈(익명) 채팅방, 인터넷 커뮤니티 등에 이용자가 동영상을 올릴 경우 사전에 불법 촬영 여부를 확인하도록 한 이른바 'n번방 방지법(개정 전기통신사업법 및 정보통신망법)'이 10일 시행에 들어간 가운데 안철수 국민의당 대선 후보는 ""전 국민의 모든 영상물을 검열하는 전 국민 감시법""이라고 비판하며 반대했다.안 후보는 이날 페이스북에 ""이번 '메신저, 커뮤니티 검열제도'를 '국민감시법'(개정 전기통신사업법 및 정보통신망법)이라 생각하고 있으며 헌법 제18조가 추구하는 통신의 비밀을 침해한다고 생각한다""며 ""제가 국민의 선택을 받게 된다면 즉시 검열제도의 폐지를 추진하겠다""고 밝혔다.또 ""인터넷산업뿐만 아니라 대한민국 산업 전반에 걸쳐 온갖 규제의 그물로 숨이 막히게 만들고 산업의 발전을 가로막는 역차별을 한다는 현실을 잘 알고 있다""며 ""이것들 역시 대부분을 싹 폐기하여 사업자들이 자신들의 아이디어를 자유롭게 펼쳐 나갈 수 있도록 하겠다는 것이 저의 소신""이라고 했다. 다만 ""이 법의 구실이 된 제2, 제3의 N번방에 대해서는 형량 강화, 제도 정비, 전문 수사 인력 확충 등 진짜 해결책을 시행해서 끔찍한 성착취 범죄를 진짜로 잡아내고 뿌리 뽑는 제대로 된 정책을 펴겠다""고 제안했다．"
2021.12.10.,"'n번방 방지법' 적용…포털들 ""불법촬영물 필터링·이용제한""",https://n.news.naver.com/mnews/article/015/0004638993?sid=105,"'n번방 방지법' 첫날 불법촬영물 필터링 기술 적용카카오톡을 통해 공지된 불법촬영물 식별 및 게재 제한 조치 안내 [사진=카톡 캡처]네이버와 카카오가 10일 디지털 성범죄물 유통 방지를 위한 'n번방 방지법'(전기통신사업법 및 정보통신망법 개정안) 시행에 따라 불법촬영물 필터링 기능을 적용했다.이날 네이버는 불법촬영물 등에 대한 유통 방지를 위한 기술적·관리적 조치가 적용된다고 밝혔다. 네이버 서비스에 등록되는 콘텐츠 특징을 추출해 방송통신심의위원회에서 제공하는 불법촬영물 데이터베이스(DB)와 비교하고, 일치할 경우 해당 콘텐츠를 제한하는 방식이다.이는 지난해 12월 불법 성착취물 문제로 제정된 'n번방 방지법'의 후속 조치다. 디지털 성범죄물 유통 방지를 위한 개정 전기통신사업법을 통해 웹하드사업자와 일정 규모 이상의 부가통신사업자에 불법촬영물에 대한 기술적·관리적 조치 의무가 부과됐으며 1년간 유예기간을 거쳐 이날부터 시행됐다.'n번방 방지법'에 따르면 국내에서 사업을 하는 연 매출 10억원 이상 또는 일평균 이용자 10만명 이상 인터넷 사업자에 해당 조치 의무가 부여된다. 구글·메타(페이스북)·트위터 등 8개 해외 인터넷 사업자와 국내 포털, 소셜네트워크서비스(SNS), 인터넷개인방송 등 90여개 사업자가 여기에 포함된다.디시인사이드, 뽐뿌, 루리웹 등 국내 대형 인터넷 커뮤니티에도 이 같은 조치가 적용된다. 카톡, 이메일 등에서 벌어지는 사적인 대화는 법 적용 대상이 아니며 공개돼 유통되는 정보에 한정해 기술적인 조치가 적용된다.불법촬영물등 기술적 식별 조치인 'DNA 필터링'에 대한 설명 [자료=네이버 제공]앞서 네이버는 불법 촬영물 등의 유통을 차단하기 위해 지난해 12월부터 불법 촬영물 등에 대한 이용자 신고·삭제 요청 기능 운영, 불법촬영물 등의 검색 결과 차단 등 다양한 조치를 시행해 왔다. 특히 불법 촬영물 등을 등록한 이용자에 대해서는 게시물 삭제와 함께 전 서비스 이용 제한 등의 강력한 조치를 시행 중이다.카카오도 이날부터 카카오톡 '오픈채팅 그룹채팅방'에 불법촬영물 식별 및 전송 제한 조치를 적용한다고 공지했다. 이 같은 조치는 오픈채팅 그룹채팅방에서 오가는 동영상 및 움직이는 이미지, 압축파일에 적용되며, 일반 채팅 및 1:1 오픈 채팅방은 대상에 포함되지 않는다.카카오 측은 ""이용자의 프라이버시 보호를 우선해 서비스를 제공하고 있지만 불법촬영물 등에 대한 관계 법령 준수와 이용자 보호를 위해 불특정 다수가 참여할 수 있는 채팅서비스인 '오픈채팅 그룹채팅방'에 대해 법령상 조치를 적용하게 됐다""며 ""불법촬영물을 유통할 경우 삭제 등 유통방지에 필요한 조치가 취해지며 관련 법률에 따라 형사처벌 받을 수 있다""고 알렸다."
2021.12.10.,"허은아 ""'n번방 대응 국제협력 강화법'은 'n번방 방지법'과 달라""",https://n.news.naver.com/mnews/article/015/0004639002?sid=100,"허은아 국민의힘 의원은 10일 ""'n번방 방지법'과 제가 발의한 'n번방 대응 국제협력 강화법'은 완전히 다른 법""이라고 밝혔다. 앞서 국회는 카카오톡 오픈채팅방 동영상 메시지 사전검열 등을 골자로 한 전기사업통신법을 통과시켰고 이날부터 시행됐다.허 의원은 이날 자신의 페이스북을 통해 ""최근 'n번방 방지법' 후속 조치에 따른 검열 논란과 함께 사무실로 문의가 많이 온다""며 ""현재 논란이 되고 있는 'n번방 방지법'은 지난 20대 국회 말미에 통과된 법안으로, 이날부터 스트리밍 필터링 등 후속 조치가 적용되는 사안""이라고 했다.그러면서 ""이와 달리 제가 발의해 통과된 'n번방 대응 국제협력 강화법'은 방심위에서 이미 불법으로 판정한 성범죄물 등 각종 불법정보의 절대 다수가 해외서버에 있어 국내로의 접속 차단에 그치는 문제가 있어, 방심위로 하여금 해외 당국과 사업자의 협력 공조를 할 수 있도록 직무 항목을 신설한 법안""이라고 설명했다.허 의원은 ""지금 조치되고 있는 스트리밍 필터링과는 무관하다""고 강조했다.허 의원은 또 ""저는 처벌 강화 위주의 기존 'n번방 방지법'만으로 실질적 피해자 구제가 이뤄지기 어렵다고 판단했다""며 ""(이에 따라)피해자 일상 회복을 위해 가장 필수적인 '범죄물의 즉각적이고 완전한 삭제'를 위해 국제적 협력을 강화하는 법안을 발의하고 통과시켰다""고 했다.이어 ""최근 이 업무를 추진하기 위한 국제공조단 운영을 위한 예산을 확보하는 등 실질적 피해자 구제를 위한 노력을 추진하고 있다""고 했다. 그러면서 ""20대 국회에서 통과된 이 법령 자체의 문제와 후속 조치 과정에서 과잉 대응이 없는지 철저히 살피겠다""고 덧붙였다."
2021.12.10.,무르익는 카카오표 웹 3.0...메타버스에 '콘텐츠+코인' 얹어 글로벌 간다,url없음,<네이버 기사 없음>
2021.12.10.,[코스피 마감]12월 첫 하락…오미크론 확산에 美 지표 경계,https://n.news.naver.com/mnews/article/018/0005104385?sid=101,"외인 팔자에 하락 마감…3010선철강·금속, 섬유·의복, 전기·전자 등 내림세시총 상위 하락 우위…카카오페이 6%↓[이데일리 박정수 기자] 코스피 지수가 12월 들어 처음으로 하락했다. 오미크론 바이러스 확산 우려와 미국 물가지표 발표에 대한 경계감이 투자심리를 악화시켰다. 10일 마켓포인트에 따르면 코스피 지수는 전 거래일보다 19.34포인트(0.64%) 내린 3010.23에 거래를 마쳤다. 이날 코스피는 3008.70으로 전 거래일(3029.57)보다 하락 출발했다. 김석환 미래에셋증권 연구원은 “오미크론 바이러스의 높은 전염성에 대한 우려에 따른 미 증시 하락에 동조했다”며 “또 미국 물가지표 발표에 대한 경계감도 작용하며 코스피는 12월 들어 첫 하락”이라고 분석했다.  유가증권시장에서 개인과 기관이 각각 1193억원, 1323억원어치 샀으나 외국인이 2813억원의 매도 우위를 보이면서 지수 하락을 이끌었다. 기관 중에는 금융투자(704억원), 보험(107억원), 사모펀드(55억원) 등이 매도세를 보였다. 프로그램 매매는 차익과 비차익을 합쳐 3018억원 순매도 우위다. 대부분 업종이 하락한 가운데 철강·금속, 섬유·의복, 전기·전자, 의약품, 은행 등이 1% 이상 빠졌고 전기가스업, 금융업, 제조업, 운수창고, 의료정밀, 기계 등이 하락했다. 반면 유통업, 운송장비, 건설업, 보험, 서비스업 등은 상승했다. 시가총액 상위 종목도 하락이 우위인 가운데 카카오페이(377300)가 코스피200 지수 편입 첫날 6% 이상 빠지며 약세를 보였다. POSCO(005490)는 4% 이상 밀렸고 SK하이닉스(000660)는 2%대 하락했다. 삼성전자(005930), 삼성바이오로직스(207940), 셀트리온(068270), 카카오뱅크(323410), NAVER(035420) 등은 1%대 밀렸다. 반면 기아(000270)는 1% 이상 올랐고 KB금융(105560)(0.52%), 현대차(005380)(0.24%), 삼성SDI(006400)(0.14%) 등은 상승 마감했다. 개별종목별로는 성신양회우(004985)가 가격제한폭까지 올랐고 성신양회(004980)(26.54%), 동양3우B(001529)(22.20%), 대상홀딩스우(084695)(21.05%), 동양2우B(001527)(18.30%), 노루페인트(090350)(17.21%) 등이 급등세를 보였다. 이날 거래량은 4억4372만주, 거래대금은 8조710억원으로 집계됐다. 상한가 1개를 비롯해 417개 종목이 올랐다. 하한가는 없었고 414개 종목이 내렸다. 102개 종목은 보합권에 머물렀다."
2021.12.10.,3분기 게임사 남녀 임금 격차 1900만원↑... 급여 1위는 카카오게임즈,url없음,<네이버 기사 없음>
2021.12.10.,"남궁훈 카카오게임즈 대표 사임…""그룹 미래 역량 강화에 집중""",url없음,<네이버 기사 없음>
2021.12.10.,'압구정 날라리' 들어본 유재석 심사평은…'우당테나',https://n.news.naver.com/mnews/article/003/0010882051?sid=106,<구조 다름>
2021.12.10.,"카카오메이커스, 강원도 농가 돕기 '철원 오대쌀' 주문판매",url없음,<네이버 기사 없음>
2021.12.10.,[방송소식] tvN 드라마 '지리산' OST 앨범 예약 판매,https://n.news.naver.com/mnews/article/001/0012824103?sid=106,<구조 다름>
2021.12.10.,[방송소식] tvN 드라마 '지리산' OST 앨범 예약 판매,https://n.news.naver.com/mnews/article/001/0012824103?sid=106,<구조 다름>
2021.12.10.,카카오페이 경영진 보유지분 전량 매각…주가 6% 급락,url없음,<네이버 기사 없음>
2021.12.10.,지역농산물 유통플랫폼 입점…기회? 위기?,https://n.news.naver.com/mnews/article/056/0011173718?sid=101,"[KBS 대전] [앵커] 충남의 농산물들이 쿠팡과 카카오 등 대형 유통 플랫폼으로 속속 입점하면서  유통 플랫폼 간 경쟁이 치열해지고 있습니다. 판로가 더 확대되는 건데, 대형 유통 플랫폼의 영향력이 큰 만큼 지역 농산물의 품질 관리를 더 철저히 해야한다는 지적이  나오고 있습니다. 서영준 기자입니다. [리포트] 금산인삼협동조합은 최근 카카오메이커스를 통해 열흘 만에 수삼 만 천 세트를 팔았습니다. 당초 인삼농가를 돕기 위해 천 세트 정도만 팔 계획이었는데, 첫날 주문만 3천 건이 넘자  물량을 급히 10배 이상 늘렸습니다. [손원석/금산인삼협동조합장 : ""앞으로는 10만 세트, 100만 세트 충분히 가능성이 있다는 걸 온라인시장에서 정말 감동했습니다. 큰 경험했어요.""] 이같은 대형 유통플랫폼의 영향력에 충남지역 자치단체들이 잇따라 해당기업과 손을 잡고 있습니다. 충청남도는 카카오커머스와 부여군은 쿠팡, 논산시는 신세계푸드와 각각 업무협약을 맺었습니다. [양승조/충남도지사 : ""카카오커머스와 충청남도,충남농민들이 상호이익이 되는 그야말로 윈윈하는 업무협약이 아닌가….""] 극심한 경쟁속에서 시장을 선점하려는 플랫폼 기업들의 이해관계와도 맞아 떨어졌습니다. [홍은택/카카오커머스 대표 : ""(충남이)우리나라의 중심이기 때문에 어디든 쉽게 빠른 시간에 배송할 수 있는 전략적인 요충지이기도 하구요.""] 이를 통해 부여만 해도 연간 100억 원 이상의 매출을 기대하는 등 판로 확대엔 좋은 기회지만, 그만큼 위험도 적지 않습니다. 품질관리가 부실할 경우 지역농산물 전체의 이미지가 손상되는  심각한 타격을 입을 수 있는 겁니다. [김성훈/충남대 농경제학과 교수 : ""인터넷은 급격하게 팔렸다가 급격하게 가라앉거나 불만이 인터넷에 쫙 퍼질 수도 있기 때문에 조심스런 면이 있다.""] 또 플랫폼 의존도가 커질수록 기업과 갑을관계에 놓여  농민이 피해를 볼 수 있다는 것도  경계할 점입니다. KBS 뉴스 서영준입니다. 촬영기자:강욱현"
2021.12.10.,"[특징주] 카카오페이, 넷마블 매도에 '급락' 지속",url없음,<네이버 기사 없음>
2021.12.10.,"n번방 방지법 시행...""여캠 짤 올리면 카톡 정지""",url없음,<네이버 기사 없음>
