기사날짜,기사제목,네이버 뉴스 url,기사내용
2021.12.10.,"[마켓뷰] 코스피, 3010선 마감…12월 첫 하락",https://n.news.naver.com/mnews/article/366/0000779668?sid=101,"코스피지수, 이달 들어 첫 하락 마감 2차전지 관련주 일제히 하락미 FOMC 앞두고 투자심리 위축        코스피지수가 8거래일 만에 하락 마감했다. 3000선은 지켰지만 외국인이 ‘팔자’에 나서며 장중 지수가 1% 가까이 하락하기도 했다. 코스닥시장에서는 최근 고공행진했던 2차전지 관련주들이 일제히 하락하면서 지수 하락폭이 커졌다. 다음주 예정된 미국 연방준비제도(Fed·연준)의 연방공개시장위원회(FOMC)를 앞두고 투자 심리가 위축된 영향으로 풀이된다.10일 코스피는 전날보다 19.34포인트(0.64%) 내린 3,010.23에 마감하며 8거래일 만에 하락했다. /연합뉴스         간밤 뉴욕 증시는 나흘 만에 하락했다. 9일(현지 시각) 뉴욕증권거래소(NYSE)에서 다우존스30산업평균지수는 전장보다 0.06포인트(0.00%) 하락한 3만5754.69로 장을 마쳤다. 스탠더드앤드푸어스(S&P)500지수는 전장보다 0.72% 떨어졌고, 나스닥지수는 전날보다 1.71% 하락했다.이날 발표된 미국의 주간 실업보험 청구자 수는 1969년 이후 최저치를 경신했다. 미 노동부는 지난 4일까지 한 주 간 실업보험 청구자 수가 계절 조정 기준으로 전 주보다 4만3000명 줄어든 18만4000명으로 집계됐다고 발표했다.김대준 한국투자증권 수석연구원은 “미국 내에서 실업보험 청구자 수가 줄어들면서 경제가 살아나고, 그에 따라 인플레이션 압력이 늘어나 연방준비제도(연준.Fed)의 긴축 속도가 빨라질 가능성도 점쳐졌다”면서 “여기에 테슬라, 리비안 등 나스닥 성장주가 크게 흔들리면서 국내 증시에 영향을 줬다”고 분석했다.9일(현지 시각) 뉴욕증권거래소에서 전기차 대장주인 테슬라는 전 거래일 보다 6.10% 급락한 1003.80 달러에 거래를 마쳤다. 리비안은 5.50% 하락했고, 루시드는 18.34% 급락했다.10일 코스피지수는 전날보다 19.34포인트(0.64%) 하락한 3010.23에 거래를 마쳤다. 이날 3008.70에 하락 출발한 지수는 장중에는 1% 가까이 하락 폭을 키우다가 점차 낙폭을 줄였다.유가증권시장에서 외국인 홀로 2813억원 어치를 순매도 했다. 개인과 기관은 각각 1193억원, 1323억원을 순매수하며 지수 방어에 나섰다.코스피 시총 상위 10개 종목은 엇갈렸다. 삼성전자(005930)와 SK하이닉스(000660)는 각각 1.66%, 2.43% 하락하며 반도체 약세를 나타냈다. NAVER(035420)도 1.13% 하락 마감했다. 반면, 삼성SDI(006400)는 0.14% 상승했고, 현대차(005380)와 기아(000270)도 각각 0.24%, 1.55% 오르며 거래를 마쳤다.코스닥지수는 전날보다 11.30포인트(1.10%) 하락한 1011.57에 거래를 마쳤다. 4거래일 만에 하락 마감했다. 이날 1016.34에 하락 출발한 코스닥지수는 외국인과 기관의 ‘팔자’에 낙폭을 점차 키웠다.코스닥시장에서는 개인 홀로 6277억원 어치를 순매수 했다. 외국인과 기관은 각각 2923억원, 3197억원를 순매도 했다.코스닥 시가총액 상위 10개 종목은 대체로 하락 마감했다. 특히 간밤에 미국 증시에서 테슬라와 루시드 등 전기차 3인방이 일제히 급락함에 따라 2차전지 관련주도 하락했다. 코스피 시총 2위인 에코프로비엠(247540)은 4.73% 떨어졌고, 엘앤에프(066970)도 4.72% 하락했다. 게임주도 약세였다. 펄어비스(263750)와 카카오게임즈(293490)는 각각 4.88%, 3.91% 떨어지며 거래를 마쳤다.이경민 대신증권 연구원은 “코스피지수가 어제까지 7거래일 연속 상승하면서 단기 피로감을 형성했다”면서 “오늘 밤 미국 소비자물가 지표 발표를 앞두고 연준의 통화정책 정상화 속도에 대한 부담이 부각되면서 매물이 출회됐다”고 평가했다.이 연구원은 “경기는 불안한데 통화정책은 긴축의 강도와 속도를 높여가는 상황”이라면서 “오는 16일 예정된 FOMC 회의 결과에 따라 증시 방향이 결정될 것”이라고 평가했다.비트코인을 비롯한 주요 가상화폐 가격은 대체로 내리고 있다. 10일 오후 4시 32분 기준 코인마켓캡에서 비트코인의 가격은 24시간 전보다 4.39% 떨어진 5660만원 대에 거래되고 있다. 이더리움과 바이낸스 코인도 24시간 전보다 각각 7.61%, 4.92% 떨어진 가격에 거래됐다."
2021.12.10.,"'n번방 방지법' 시행 첫날, 이준석 ""당 차원 재개정 추진""",https://n.news.naver.com/mnews/article/009/0004891942?sid=100,"안철수 ""국민 사전 검열 제도는 전면 폐지돼야"" 주장국민의힘 이준석 공동선거대책위원장이 제20대 대통령선거 D-90일인 9일 국회에서 열린 중앙선거대책위원회의에서 발언하고 있다. [사진 출처 = 연합뉴스] 소위 'n번방 방지법'으로 불리는 전기통신사업법 및 정보통신망법 개정안이 시행된 첫날인 10일 '사전 검열' 논란이 제기되자 야당 대표들이 법 개정에 나서겠단 입장을 나타냈다.이날 이준석 국민의힘 대표는 자신의 페이스북에 ""n번방 사건때 분노한 여론을 타고 통과된 이번에 이슈가 되고 있는 소위 'n번방 방지법'이라고 하는 전기통신사업법 개정안은 기준의 모호함에 더해 헌법 18조가 보장하는 '통신의 자유'를 심하게 침해할 소지가 있다""고 지적했다. 이어 이 대표는 ""실질적으로 n번방 사건에서 유통경로가 되었던 텔레그램 등에는 적용이 어려워 결국 실효성이 떨어지는 조치""라며 ""당 차원에서 적극적으로 재개정을 추진해 나가도록 하겠다""고 덧붙였다.업계에 따르면 이날부터는 웹하드사업자와 일정 규모 이상의 부가통신사업자에 디지털 성범죄물에 대한 삭제 및 기술적·관리적 조치 의무가 부과됐다. 국내에서 사업하는 연매출 10억원 이상 또는 일평균 이용자 10만명 이상의 인터넷 사업자들이 대상이다. 구글·페이스북·트위터 등 8개 해외 인터넷 사업자와 네이버, 카카오 등 국내 대형 포털과 디시인사이드, 뽐뿌, 루리웹 등 인터넷 커뮤니티에도 이 조치가 적용된다. 하지만 사전 검열 우려가 제기되고 있으며 불법영상물을 걸러내는 필터링 기술이 완전하지 않아 실효성 논란이 커진 상태다.국민의힘 수석대변인이자 과학기술정보방송통신위원회에 소속된 허은아 의원도 페이스북에 ""처벌 강화 위주의 기존 'n번방 방지법'만으로는 실질적인 피해자 구제가 어렵기 때문에 법령 자체의 문제와 후속 조치 과정에서 과잉대응이 없는지 살피도록 하겠다""고 적었다.안철수 국민의당 대선후보도 이날 ""이번 '메신저, 커뮤니티 검열제도'를 '국민감시법'이라 생각하고 있으며 헌법 제18조가 추구하는 통신의 비밀을 침해한다고 생각한다""고 힘을 보탰다. 안 후보는 ""전 국민을 사전 검열하는 제도는 즉시 전면 폐지돼야 한다""며 ""통신 사업자들에게 이용자를 감시하라고 부추기는 조항이고 국제 인권 기준에 어긋나는 법이라는 전문가들의 지적에 공감한다""고 적었다. 다만 그는 ""이 법의 구실이 된 제2, 제3의 n번방에 대해서는 형량 강화, 제도 정비, 전문 수사 인력 확충 등 해결책을 시행해서 끔찍한 성착취 범죄를 잡아내고 뿌리 뽑는 제대로 된 정책을 펴겠다""고 강조했다."
2021.12.10.,[콘텐츠 핫&뉴] 넷마블 '리니지2 레볼루션' 서비스 5주년 기념 업데이트 실시,https://n.news.naver.com/mnews/article/009/0004892007?sid=105,"넷마블(대표 권영식, 이승원)은 모바일 MMORPG ‘리니지2 레볼루션’(개발사 넷마블네오)에 ▲3차 각성 ▲신규 영지 '혼돈의 디온' ▲신규 서버 마프르를 추가하는 업데이트를 실시했다고 10일 밝혔다.이번 업데이트의 가장 큰 특징 중 하나는 3차 각성이다. 이를 통해 이용자들은 배틀 마스터리 확장, 스킬 연계, 스킬 업그레이드 시스템을 사용할 수 있게 돼, 캐릭터의 전투 스타일을 다양하게 만들 수 있다. 신규 영지 '혼돈의 디온'은 '목초지', '봉우리', '정규의 땅'으로 구성되며, 새로운 정예던전 '카이저 연구소 상층과 하층을 포함하고 있다. 신규 영지 추가로, 최고 레벨은 560에서 600으로 확장됐다.신규 서버 '마프르'에서 캐릭터를 생성하면 500레벨부터 시작할 수 있고, 560레벨까지 빠른 성장을 할 수 있는 성장 부스팅 시스템이 제공된다. 또, 넷마블은 사냥 타입에 따른 LR등급 무기 5종, UR 등급 방어구를 지급하고, 34종 SR등급 아가시온과 각종 펫을 제공한다. 이외에도 신규 서버 이용자는 매일 혜택 3종을 받고, 14일 출석부 이벤트를 통해 각종 보상을 얻을 수 있다. 넷마블은 리니지2 레볼루션 서비스 5주년을 맞아, 공식포럼을 통해 '변신체 복구권' 쿠폰을 공개한다. 해당 쿠폰은 파괴된 변신체를 등급이나 종류 관계없이 가장 높은 강화도 기준으로 1종을 택해 복구할 수 있는 아이템으로, 오는 1월 31일까지 사용할 수 있다. ◆ 카카오게임즈, ‘프렌즈팝’ 겨울맞이 특별 이벤트 진행 카카오게임즈(각자 대표 남궁훈, 조계현)는 10일, 자사가 서비스하고 NHN픽셀큐브(대표 정우진)가 개발한 인기 모바일 퍼즐게임 ‘프렌즈팝’의 겨울맞이 특별 이벤트를 진행한다. 먼저, ‘프렌즈팝’에서는 신규 이벤트 모드인 ‘충전! 프렌즈 배터리’를 추가, 이용자가 보유한 6종의 카카오프렌즈 캐릭터 중 이벤트에 제시된 캐릭터를 장착하고 플레이하면 배터리가 충전되며, 이를 통해 다양한 게임 아이템을 받을 수 있다.더불어, 오는 1월 8일까지, 스테이지 5회를 플레이하는 모든 이용자에게 ‘집사 강아지 쇼팽이의 평범한 일상’ 이모티콘을 지급하며, ‘제이지의 누적 결제 경품 이벤트’를 진행해 12월 15일까지 누적 결제 이벤트에 참여한 이용자 중 추첨을 통해 ‘경품을 제공한다. 이 외에도, ‘프렌즈팝’에서는 최상위 레벨 이용자를 위한 콘텐츠인 ‘마스터 라운지’가 대대적으로 개편됐다. 100개의 스테이지를 순서대로 클리어하면 랭킹 포인트 획득이 가능하며, ‘튜브의 신발’ 아이템도 사용 가능하게 하는 등 게임의 재미를 더했다.  ◆ 컴투스 ‘서머너즈 워: 백년전쟁’, 신규 몬스터 ‘알리시아’ 업데이트 실시모바일 게임 기업 컴투스(대표 송재준, 이주환)는 서머너즈 워: 백년전쟁(이하 백년전쟁)에 신규 몬스터 ‘알리시아’를 추가하는 업데이트를 실시했다.이번에 추가되는 물 속성 전설 등급의 ‘알리시아’는 상대와 아군의 모든 이로운 효과를 제거한 후, 상대에게 피해와 함께 동결 상태를 부여하는 공격형 몬스터다. 동결 효과에 걸린 몬스터는 일반 공격 속도가 느려지고 지속 피해를 입으며 지속시간이 끝날 시에 빙결 상태가 된다.스킬석에 따라 빙결에 걸린 적이 스킬 피해로 죽을 때 적 전체를 빙결시키거나 스킬 피해량 증가, 적중률 증가 등의 효과를 얻을 수 있다.유저들은 8시즌 동안 특별소환 이벤트를 통해 ‘알리시아’를 동일 등급 내 다른 몬스터 보다 더 높은 확률로 획득 가능하며, 일정 확률로 전설 스킬석도 얻을 수 있다. 해당 기간 동안에는 레벨 부스팅도 적용돼, ‘일반전’ 모드에서 ‘알리시아’의 레벨이 소환사 레벨로 조정된다.◆ 넥슨, ‘트리 오브 세이비어’ 6주년 기념 ‘에피소드 14 혼돈의 재림’ 업데이트넥슨(대표 이정헌)은 IMC게임즈(대표 김학규)가 개발하고 자사가 서비스하는 ‘트리 오브 세이비어’에 6주년 기념 콘텐츠 ‘에피소드 14 혼돈의 재림’을 업데이트했다고 10일 밝혔다.먼저, 이번 업데이트로 델무어 소작촌, 델무어 장원, 델무어 외성 등 신규 지역 5곳과, 대장군 라민, 센츄리온 마스터 등 주요 등장인물, 그리고 메인 퀘스트를 추가했다. 또, 기존 최고 레벨을 460에서 470까지 확장했다.이 밖에 빠른 성장을 지원하고자 신규 튜토리얼 지역 ‘왕국령 모로스 공관’을 선보였다. 이 지역에서 440레벨 캐릭터를 생성해 튜토리얼을 완료할 경우 즉시 450레벨로 에피소드 13-1 및 오르샤 지역에서 플레이할 수 있다.한편, 넥슨은 서비스 6주년을 기념해 내년 1월 6일까지 게임에 접속하는 모든 이용자에게 기념 코스튬을 지급한다. ◆ 컴프야, 유저 설문 통해 올해 KBO리그 골든글러브 수상자 예측모바일 게임 기업 컴투스(대표 송재준, 이주환)가 서비스하는 인기 모바일 야구 게임 ‘컴투스프로야구2021(이하 컴프야2021)이 올해의 KBO리그 골든글러브 수상자를 예측하는 설문을 진행하고 그 결과를 공개했다. 먼저, 가장 치열한 경쟁을 예고하는 외야수 부문에서 컴프야 유저들은 키움 히어로즈의 이정후와 삼성 라이온즈의 구자욱, LG트윈스의 홍창기 선수가 수상할 것으로 예측했다. 최종 3인의 수상자 예측에 이름을 올리지는 못했지만 롯데 자이언츠의 전준우와 NC 다이노스의 나성범 역시 팬들로부터 높은 지지를 받았다. 아울러, 투수와 포수 부문에는 한 시즌 최다 탈삼진 신기록을 기록한 두산 베어스의 외국인 투수 아리엘 미란다와 삼성 라이온스의 정규시즌 2위를 견인한 강민호가 수상할 것으로 내다봤으며, 유격수와 지명타자에는 키움 히어로즈의 김혜성과 NC다이노스의 양의지가 각각 이름을 올렸다. 내야수 부문의 1루수에는 우승팀 KT 위즈의 간판타자 강백호가 가장 높은 지지를 받았으며, 2루수와 3루수에는 한화 이글스의 정은원과 SSG의 최정이 각각 수상자로 예측했다. 특히, 이번 컴프야 유저들의 골든글러브 수상자 예측에 따르면, 총 10명의 수상 후보가 KBO리그 10개 구단 중9개 구단에서 고르게 배출될 것으로 전망된 만큼 순위와 상관없이 모든 구단이 고른 활약을 펼친 시즌으로 짐작해 볼 수 있다."
2021.12.10.,꿈쩍 않는 주가…포스코 '지주사' 카드 꺼냈다,https://n.news.naver.com/mnews/article/018/0005104439?sid=101,"'철강기업' 인식에 재평가 못받는 사업가치지주사 전환으로 신성장사업 재평가 기대지주사 신속 결정으로 미래 성장성도 강화[이데일리 경계영 기자] 배터리(이차전지) 소재와 원료, 수소 등 신사업 포트폴리오를 확대하던 포스코엔 고민이 있었다. 시장에서 이들 신사업 가치를 제대로 평가 받지 못한다는 점이었다. 포스코(005490)의 시가총액은 10일 종가 기준 24조5431억원으로 유가증권시장에서 14번째로 크다. 다른 업종과 단순 비교하긴 어렵지만 지난해 영업이익 규모가 비슷한 9위 현대차, 10위 기아보다 시총 순위가 낮다. 올해 상장한 11위 카카오뱅크나 13위 카카오페이에도 밀렸다. 잇단 신사업 추진에도 주가가 제자리를 맴돌자 철강 중심 기업이라는 인식 때문에 신성장 사업 가치 등이 적절하게 평가 받지 못한다는 의견이 그룹 안팎으로 대두됐다. 포스코는 지금의 상황을 반전시킬 계기가 지주회사 체제 전환이라고 판단했다. 지주회사로 전환함으로써 철강 사업이 자회사로 포함되고, 철강 외 자회사 등이 추진하는 신성장 사업 가치가 재평가 받을 수 있으리라는 이유에서다. 포스코는 10일 이사회를 열고 지주사 ‘포스코홀딩스’를 상장사로 유지하고, 철강 사업회사 ‘포스코’를 물적 분할해 지주사가 100% 소유하는 구조로 지주회사 체제 전환을 의결했다. 지주회사 체제가 미래 성장성을 강화하는 데도 제격이라고 포스코는 봤다. 최근 그린·디지털·바이오 기술이 시시각각 혁신을 거듭하고 전기차, 신재생에너지 등 친환경 비즈니스가 빠르게 성장하는 상황에서 지주사를 통한 신속한 의사결정이 필요하기 때문이다. 각 사업의 전문성을 고루 강화할 수 있다고도 덧붙였다. 포스코홀딩스는 지주사로서 △미래 사업 포트폴리오 개발 △그룹 사업 개편 및 시너지 확보 △그룹 연구개발(R&D) 전략 수립 △ESG(환경·사회·지배구조) 경영 선도 등을 담당한다. 포스코는 철강사업에선 친환경 전환과 글로벌 성장에 매진하고 배터리 소재와 수소 등 신성장 분야를 전략적으로 육성해 균형 있는 그룹 성장을 꾀하겠다는 목표다. 포스코그룹은 “종전에도 수차례 지주사 전환을 논의했지만 과거 경험하지 못한 혁명적 변화가 일어나고 있는 지금 시점이야말로 경영구조 재편에 최적기라는 이사회의 공감대가 있었다”며 “지주사 체제 전환으로 사업별 전문성을 강화하고 미래 신사업 기회를 발굴하고 육성함은 물론, 그룹 사업간 시너지 창출을 통해 기업가치를 제고하고 그룹의 지속가능한 성장 발판을 마련할 것”이라고 강조했다."
2021.12.10.,"'대장동 뒷돈 의혹' 유한기, 자택 인근서 숨진채 발견",https://n.news.naver.com/mnews/article/421/0005776334?sid=102,"(고양=뉴스1) 박정호 기자 = 경기 성남시 대장동 개발과 관련해 뒷돈을 챙긴 혐의로 구속영장이 청구된 유한기 전 성남도시개발공사 개발사업본부장(현 포천도시공사 사장)이 자택 인근에서 숨진 채 발견된 10일 오전 경기도 고양시 일산서구 주엽동의 한 아파트 단지에서 경찰 등이 시신을 수습하고 있다. 일산서부경찰서 등에 따르면 이날 오전 4시 10분쯤 유 전 본부장이 유서를 남기고 사라졌다는 가족의 신고가 접수, 수색에 나선 경찰은 오전 7시 40분쯤 자택 인근 아파트단지 화단에서 숨져 있는 유 전 본부장을 발견했다. ※ 우울감 등 말하기 어려운 고민이 있거나 주변에 이런 어려움을 겪는 가족ㆍ지인이 있을 경우 자살 예방 상담전화 ☎ 1393, 정신건강 상담전화 ☎1577-0199, 희망의 전화 ☎ 129, 생명의 전화 ☎ 1588-9191, 청소년 전화 ☎ 1388, 청소년 모바일 상담 ‘다 들어줄 개’ 어플, 카카오톡 등에서 24시간 전문가의 상담을 받을 수 있습니다. 2021.12.10/뉴스1"
