기사날짜,기사제목,네이버 뉴스 url,기사내용
2021.12.11.,"[주말쇼핑포인트]""올해도 홈파티"" 크리스마스 케이크 미리 준비해볼까",https://n.news.naver.com/mnews/article/421/0005777990?sid=101,"유통업체, 경품과 할인 혜택으로 고객 잡기 나서베이커리·카페 브랜드 MZ세대 겨냥한 이색 제품 봇물크리스마스 케이크 참고 사진.(사진제공=홈플러스)© 뉴스1(서울=뉴스1) 김종윤 기자 = # 30대 직장인 A씨는 지난해 코로나19 확산으로 친구들과 집에서 크리스마스 홈파티를 즐겼다. 당시에는 국내 유명 프랜차이즈에서 케이크를 저렴한 가격으로 사전 구매했다. 올해는 외부 식당에서 즐길 예정이었으나 이달 들어 확진자가 다시 급증하자 호텔을 예약하고 연말을 즐기기로 했다. 그는 ""지난달 위드코로나 이후 외부 모임을 고민했지만 포기하고 홈파티로 연말을 보낼 것""이라며 ""크리스마스 케이크는 사전 예약을 하면 원하는 날짜에 제품을 받을 수 있어 매장을 돌아다니는 걱정을 덜 수 있다""고 말했다. 유통업계가 연말 크리스마스 케이크 사전 판매에 돌입했다. 올해 역시 야외 모임 대신 홈파티족이 증가할 것으로 예상돼 업계의 움직임이 빨라졌다. 이들은 차별화 전략으로 인기 게임 캐릭터 협업뿐 아니라 겨울 대표 과일 딸기를 활용한 제품을 꺼내 들었다. MZ세대 취향을 반영한 제품으로 소비자를 끌어모으기 위한 전략이다. ◇ 오프라인 대형 유통업체 연말 특수 겨냥11일 업계에 따르면 홈플러스는 오는 15일까지 자사 브랜드 '몽 블랑제'의 크리스마스 케이크를 예약 판매한다.홈플러스의 케이크는 생크림·초콜릿·고구마·티라미수·치즈 등으로 구성됐다. 대표 제품은 부드러운 생크림 케이크 위에 딸기로 만든 트리가 돋보이는 시그니처 케이크 '눈 내린 딸기 생크림'이다. 달콤한 초콜릿 시트와 부드러운 쿠키 크림이 조화를 이룬 '쿠키 앤 크림 퐁당 산타'도 눈길을 끈다. 이마트24는 백화점 입점 브랜드 '루시카토'에서 제조한 케이크 4종을 판매한다. 오는 25일까지 제휴 카드로 결제하는 고객에게 할인 혜택을 제공한다. 케이크 사전 구매 고객 중 추첨을 통해 명품 티파니 목걸이도 증정한다. 사전 구매 고객 전원에겐 카카오 캐릭터 니니즈 머그컵을 제공하기로 했다. 미니스톱 역시 유명 브랜드 나뚜루·베즐리와 손을 잡고 크리스마스 케이크 11종을 판매한다. 그동안 고객 반응이 좋았던 케이크의 특징을 반영해 제품을 꾸렸다. 대표 제품으로 꼽히는 초코포레누아케이크는 다코 초콜릿과 밀크 초콜릿의 최적 배합으로 맛을 살렸다. 티라미수케이크는 이탈리아의 대표 디저트인 티라미수의 본연의 맛을 살려 부드러운 크림치즈의 맛과 은은한 커피 향을 살렸다. 미니스톱은 네이버페이 포인트로 결제하는 고객에게 페이백을 제공한다. 또 미니스톱 멤버십을 통해 결제하면 할인 혜택을 준다. 홈플러스 관계자는 ""고객에게 재미있는 이야기를 담은 케이크로 위로의 메시지를 전하고 싶었다""며 ""가성비 높은 크리스마스 케이크를 저렴한 가격으로 미리 준비할 수 있을 것""이라고 말했다.뚜레쥬르의 크리스마스 케이크(사진제공=CJ푸드빌)© 뉴스1◇ 베이커리 브랜드 파리바게뜨·뚜레쥬르 MZ세대 겨냥베이커리와 브랜드 역시 연말 크리스마스 수요를 잡기 위해 다양한 신제품을 내놨다. 파리바게뜨는 '크리스마스, 대반전을 시작하자'를 캠페인을 열고 케이크 사전 판매를 시작했다. 2단 케이크부터 화려한 입체케이크·산타·루돌프· 트리 등 케이크 40여종의 제품을 내놨다. 특히 해피오더·카카오주문하기·배달의민족·요기요 애플리케이션을 통해 원하는 케이크를 할인된 가격으로 제공한다. 해피오더를 통해 사전 예약한 고객을 대상으로 크리스마스 홈파티용 굿즈 2종도 판매한다. 굿즈는 대형 풍선으로 화려한 홈파티를 완성할 수 있는 용품이다. 뚜레쥬르 역시 지난달부터 인기 모바일 게임 '쿠키런: 킹덤'과 협업해 만든 크리스마스 케이크를 판매 중이다. 알록달록한 쿠키 주인공의 이미지를 살린 제품으로 인기를 얻고 있다. 게임 속 이미지와 쿠키 캐릭터의 맛을 그대로 제품에 소비자 호응이 이어지고 있다. 파리바게뜨 관계자는 ""따뜻하고 행복한 크리스마스로 즐기자는 주제를 담은 제품과 캠페인을 기획했다""며 ""사전예약을 통해 케이크와 홈파티 굿즈까지 한번에 준비할 수 있을 것""이라고 말했다. (사진제공=SPC)© 뉴스1◇ 카페업계, MZ세대 저격할 신제품…겨울 대표 과일 딸기 활용할리스는 MZ세대 취향을 반영한 크리스마스 홀케이크를 내놨다. 멤버십 앱을 통해 간편하게 케이크를 예약할 수 있는 시스템과 배송 서비스까지 제공한다.이번 신제품은 Δ티아라 딸기 생크림 케이크 Δ촉촉한 당근 케이크 Δ트리플 초코 케이크 Δ뉴욕 치즈 케이크다. 이중 티아라 딸기 생크림 케이크는 부드러운 생크림과 달콤한 딸기를 더한 제품이다. 화이트 크리스마스를 연상하는 새하얀 생크림 위에 반짝반짝한 장식을 얹어 크리스마스 분위기를 살렸다. 할리스 관계자는 ""파티와 모임이 많아지는 연말을 맞아 색다른 매력을 지닌 홀케이크를 준비했다""며 ""할리스 앱을 통해 원하는 날짜에 홀케이크를 픽업하거나 집에서 받아볼 수 있다""고 설명했다. 설빙은 겨울 대표 과일 딸기를 활용한 한정 메뉴 '생딸기가득 생크림케이크'를 내놨다. 제철을 맞아 무르익은 딸기를 가득 토핑해 신선함과 상큼함이 돋보이는 메뉴다. 촉촉한 시트에 순우유생크림의 부드러움이 조화를 이룬다. 여기에 연유를 뿌려 즐긴다면 달콤한 디저트가 완성된다.파스쿠찌 역시 크리스마스를 맞아 케이크 4종을 내놨다. 크리스마스를 상징하는 하얀색과 붉은색으로 제품을 완성했다. 신제품은 Δ윈터 라이팅 케이크 Δ스트로베리 원더 케이크 Δ하프 벨벳 케이크 Δ크리스마스 리스 케이크다.파스쿠찌 관계자는 ""올해 크리스마스엔 홈파티 문화에 발맞춰 화려한 디자인의 케이크를 출시했다""며 ""소비자들의 요청에 귀 기울여 개성 있는 제품을 지속해서 선보일 것""이라고 말했다."
2021.12.11.,유희열·최시원 등 코로나19 확진 잇따라…연말 방송가 긴장,url없음,<네이버 기사 없음>
2021.12.11.,[위클리中企]상도가구·밀워키·엑스페론,https://n.news.naver.com/mnews/article/277/0005013747?sid=101,"상도가구 연말 고객감사제 안내 이미지. [사진제공=상도가구]상도가구가 오는 27일까지 공식몰 단독 고객감사제를 진행하고, 프리미엄 전동공구 밀워키는 소비자들에게 가장 많은 사랑을 받아온 제품 중 하나인 'M12 하이스피드 임팩트 라쳇 1/4인치(M12 FHIR14)'를 출시했다. 골프 플랫폼 기업 엑스페론은 스크린골프장에 무인밴딩머신 '큐빙'을 무상 설치해주는 캠페인을 시작했다.상도가구, 연말 맞이 고객감사제 진행…최대 78% 할인상도가구가 오는 27일까지 공식몰 단독 고객감사제를 진행한다. 올 한해 고객의 성원에 보답하기 위해 기획된 상도가구 고객감사제는 2021년 한 해 가장 사랑받았던 제품들을 모아 할인 및 이벤트 등 다양한 혜택이 제공될 계획이다.상도가구의 대표 캠핑 브랜드인 몬스터캠핑 가구와 몬스터랙, 모던하임 시스템행거 등의 수납가구, 1인용 좌식소파, 주방가구 등 총 43종의 가구를 최대 78% 할인된 가격으로 판매한다. 또 공식몰 회원을 대상으로 최대 1만원의 무제한 할인쿠폰을 발급하며, 첫 가입 시에도 3만원 쿠폰을 발급하는 등 다양한 추가 할인 혜택을 제공할 예정이다.고객감사제 행사 상품 구매시 기존 3% 적립금을 10%로 지급받을 수 있으며, 구매 후 포토리뷰를 남기는 고객 중 추첨을 통해 상도가구 캠핑 브랜드 '몬스터캠핑'의 폴딩박스를 증정하는 이벤트도 함께 진행한다.상도가구 담당자는 ""올 한해 상도가구에 보내주신 고객 성원에 감사드리며, 힘들었던 2021년 위로의 마음을 담아 이번 고객감사제를 열게 됐다""면서 ""몬스터캠핑 우드롤테이블, 케렌시아 이동식 트롤리, 1인 좌식소파 등 2021년 사랑받았던 인기 품목이 많이 준비된 만큼 이번 행사를 통해 합리적인 가격으로 다양한 가구 제품을 구매하시길 바란다""고 전했다.밀워키의 'M12 하이스피드 임팩트 라쳇 1/4인치(M12 FHIR14)'. [사진제공=밀워키코리아]밀워키, 초강력 하이스피드 전동 라쳇 출시프리미엄 전동공구 브랜드 밀워키는 소비자들에게 가장 많은 사랑을 받아온 제품 중 하나인 M12 임팩트 라쳇(M12 IR)의 후속 모델로 강력한 힘과 빠른 회전 속도로 무장된 'M12 하이스피드 임팩트 라쳇 1/4인치(M12 FHIR14)'와 '3/8인치(M12 FHIR38)'를 출시했다.라쳇은 볼트, 너트를 연속으로 조이거나 푸는 공구를 말한다. 임팩트 라쳇은 자동차 정비부터 태양관 판넬 작업까지 다양한 분야에서 너트를 체결하거나 해체하는데 필수적인 전동공구다. 직각으로 꺾인 머리 부분은 드릴과 같은 일반 전동공구로 작업하기 협소한 부분도 쉽게 진입해 작업이 가능하다. 한 손으로 작업할 수 있어 양손 작업이 필수인 수공구보다 한결 편리하다.이번에 출시한 M12 하이스피드 임팩트 라쳇 1/4인치(M12 FHIR14)와 3/8인치(M12 FHIR38)은 동일한 몸체를 사용해 머리 규격만 차이가 나는 제품으로 최대 450 RPM(회전수)의 강력한 힘을 자랑하며 유사제품 대비 최대 약 2배 빠른 체결 속도를 뽐낸다. 2㎝가 채 안 되는 머리 길이와 1㎏의 가벼운 무게로 협소한 공간에서의 작업 편의성을 극대화했다.한단계 발전한 내구성도 눈에 띈다. 우선 모터에 적용된 파워스테이트 브러쉬리스는 밀워키만의 기술로 일반 브러쉬리스 대비 2배 이상 긴 모터 수명을 자랑한다. 또 강철 요크를 활용해 머리 부분의 강도를 높이고 모터를 보호하며, 가장 빠르게 마모되는 손잡이 부분에 프리미엄 고무를 덧댔다.밀워키 관계자는 ""신제품 M12 하이스피드 임팩트 라쳇은 기존 제품에 비해 스피드를 한층 더 개선했다""면서 ""특히 반경이 좁아 힘든 작업환경에서 제 몫을 다해 소비자들을 도울 것""이라고 설명했다.엑스페론, 스크린골프장 '큐빙' 무상 설치 상생 캠페인 소개 이미지. [사진제공=엑스페론]엑스페론, 무인밴딩머신 '큐빙' 무상설치 선착순 캠페인골프 플랫폼 기업 엑스페론이 코로나19사태로 어려움을 겪고 있는 스크린골프장을 위해 무인밴딩머신 '큐빙'을 무상 설치해주는 상생 캠페인을 시작했다.큐빙 무상 설치 이벤트는 현재 1000여곳의 가맹점을 가지고 있는 골프용품 무인 밴딩머신 큐빙의 시스템을 스크린골프장에 무상으로 설치해주는 캠페인이며, 선착순으로 100곳의 가맹점만 진행을 한다.큐빙에 들어있는 제품의 경우에는 엑스페론의 프리미엄 제품을 가장 합리적인 가격으로 소비자들에게 판매하며, 스크린 매장에서 많이 찾는 인기상품으로 구성돼 있다. 관리도 엑스페론에서 진행하기 때문에 가맹점이 폭팔적으로 늘어나는 추세다.박진홍 엑스페론 이사는 ""엑스페론은 이번 이벤트를 통해 스크린골프 업주님들과 새로운 파트너쉽을 맺고 함께 어려운 시국을 헤쳐나가는 발판을 만들고 싶다""면서 ""골퍼들과의 소통을 활성화하기 위해 전국 스크린골프장과 엑스페론이 함께 다양한 행사를 진행할 예정""이라고 전했다. 큐빙 무상설치 이벤트 참여는 카카오톡 '엑스페론'이나 엑스페론 고객센터, 엑스페론 앱을 통해 신청할 수 있다."
2021.12.11.,스타벅스·이마트 다 이렇다…매출 10배 올려주는 '색의 비밀'[폴인인사이트],https://n.news.naver.com/mnews/article/025/0003157866?sid=101,"Editor's Note '그냥 구경만 하러 가는 거야'라며 들른 백화점에서, 나도 모르게 양손 가득 쇼핑한 경험, 한 번쯤 있으시죠?   어찌된 영문일까요? 백화점에 창문과 시계가 없다는 건 잘 알려져 있습니다. 쇼핑객이 시간이 흐르는 걸 인지하지 못하도록 하기 위해서라죠. 하지만 백화점 매장에는 그보다 훨씬 더 많은 '쇼핑의 비밀'이 숨겨져 있다고 합니다    백화점 매장기획자(VMD) 출신인 이랑주 VMD연구소장은 빛과 색 그리고 고객과의 커뮤니케이션을 그 핵심으로 꼽습니다. '그냥 환하면 좋은 거 아닌가?' 싶은 조명, '눈에 띄는 색을 쓰면 좋은 거 아닌가?' 싶은 색에도, 다 전략이 숨어있다는 겁니다. 백화점의 옷이 유독 예뻐 보이고, 백화점 식품 코너의 소고기가 유난히 신선해 보이는 이유도 그 때문이라는 거죠. 이 소장이 말하는 '매출을 10배 늘려주는 빛과 색의 비밀'을 전해드립니다.   ※ 이 기사는 ‘콘텐트 구독 서비스’ 폴인(folin)의 “월간서른의 대책토크”의 7화 중 일부입니다. 이 콘텐트는 30대를 위한 콘텐트 플랫폼  ‘월간서른’에서 진행한 ‘대책토크(대놓고 책을 이야기하는 토크)’ 인터뷰를 폴인이 강연록 형태로 각색한 것입니다.     마켓컬리의 보라색, 비중은 5%뿐?     브랜드 비주얼을 생각할 때는 주제 색상을 정하는 게 가장 중요합니다. 예를 들어 '스타벅스' 하면 '초록색'이 바로 떠오르잖아요. '티파니' 하면 '티파니 블루', '이마트' 하면 '노란색'이 떠올라요. 반면 동네에서 자주 가는 슈퍼마켓의 간판 색은 기억이 나지 않을 확률이 높죠.      이처럼 고객들 눈에는 글보다 이미지가 빠르게 인지됩니다. 이미지에서 가장 중요한 건 색이에요. 색에는 저마다 가지고 있는 특유의 이미지와 느낌이 있습니다.      주제 색은 당장 눈에 잘 띄는 색이나 유행하는 색보다, 브랜드 속성에 맞춰 정하는 게 좋아요. 저는 흰색 옷을 즐겨 입지만, 남색 옷은 피하는 편이에요. 남색 옷을 입으면 저와 어울리지 않고 얼굴이 칙칙해 보이기 때문이죠. 갑자기 남색이 유행한다고 해도 남색 옷을 입으면 종일 칙칙한 얼굴로 다녀야 하는 거예요. 이처럼 속성과 맞지 않는 색을 정하면 브랜드는 오래 갈 수 없습니다.      주제 색을 정해 노출하라고 했더니, 간판부터 내부까지 전부 한 가지 색으로 가득 칠하는 분이 있었어요. 이때 주의할 게 있습니다. 특정 색상을 공간의 80% 이상 칠하면 처음에는 주목성이 높아지지만, 나중에는 금방 싫증 나게 돼요.      그래서 '70:25:5의 비율'을 기억하는 게 중요합니다.        70%는 베이지, 화이트, 연한 그레이 같은 무채색을 사용하는 게 좋습니다. 그리고 25%의 보조 색상은 주제 색을 빛낼, 5%의 주제 색과 대비되는 색을 사용해야 합니다.      스타벅스를 생각해보세요. 70%가 베이지 톤이고, 25%가 갈색, 5%만 초록색이에요. 이마트도 매장의 70%가 베이지나 화이트 톤이고, 25%가 짙은 회색, 5%만 노란색이죠. 이마트 전체 공간이 노란색으로 돼 있는 게 아니라, 노란 간판, 직원들의 노란 티셔츠, 노란 쇼핑백, 카트의 손잡이 등의 포인트에만 노란색을 사용하죠.      인테리어와 더불어 온라인 홈페이지나 앱을 만들 때도 이 비율을 생각하시면 좋아요. 마켓컬리 앱을 생각하면 우리는 가장 먼저 보라색을 떠올리잖아요. 실제로 앱 아이콘도 보라색이죠. 그런데 클릭해서 내부로 들어가면 전체 화면은 화이트 톤으로 돼 있고, 보라색은 세일, 클릭 유도 등의 포인트에만 5% 정도 사용되고 있어요.      마켓컬리 앱 화면 캡처 ⓒ마켓컬리       제가 많이 듣는 질문 중 하나는 브랜드 색상을 노란색으로 하고 싶은데 카카오톡, 이마트가 선점했다는 겁니다. 또 분홍색을 하고 싶은데 배스킨라빈스가 이미 썼다는 말씀을 하세요. 그때는 25%의 보조 색상을 생각하시면 돼요.예를 들어 같은 파란색을 써도 화이트·블랙·옐로와 각각 쓰는 게 다 다릅니다. 삼성과 이케아는 같은 파란색이지만 느낌이 다르잖아요. 25%의 보조 색상을 어떻게 맞추느냐에 따라 감성이 완전히 달라지기 때문에 만들 수 있는 색상의 조합은 무궁무진합니다. (중략)      호텔 화장실, 식당 조명에 숨은 '비주얼'     호텔 화장실에 가면 셀카를 찍고 싶어진 적 한 번쯤 있으실 겁니다. 비밀은 조명에 있어요. 호텔 화장실의 조명은 거의 3500캘빈(k)*으로 되어 있어요. 이 조명은 여성의 피부 결을 제일 좋아 보이게 하죠. 이는 앞서 소상공인 매장의 조명을 바꾼 경험과 연결됩니다. 백화점 1층에 입점한 매장들의 조명도 대부분 3500k로 돼 있습니다.    *캘빈(Kelvin): 빛의 파장을 표준 비교 측정을 통해 수치로 나타낸 색온도    캘빈은 색의 온도를 설명하는 값이에요. 2500k는 촛불을 생각하시면 됩니다. 3500k가 카페, 호텔 화장실 빛의 온도고, 강의장은 보통 5000k입니다. 사람을 긴장케 하고, 집중력을 높이는 빛의 색이 5000k죠.      생선회를 판매하는 식당에서 생선을 신선하게 보이게 하려고 높은 캘빈의 푸른빛 형광등을 사용하는 가게가 있었어요. 하지만 그런 조명 아래에선 아무리 먹어도 생선회가 맛이 없습니다. 사람이 블루라이트에 노출되면 부교감 신경이 활성화하고, 기력이 없어져서 자고 싶다는 생각이 들기 때문입니다.      식당 조명과 관련한 팁이 한 가지 더 있어요. 음식이 가장 맛있어지는 조명의 높이는 테이블 위 76cm입니다. 음식점에서 조명을 어둡게 하면 사람들이 조명이 비추는 테이블 가운데로 몸을 기울이게 됩니다. 음식이 도착하면 자연스레 음식의 냄새를 잘 맡을 확률이 높아지겠죠.      냄새를 맡는 순간 우리 몸에 교감신경이 활발히 움직이면서 어서 음식을 먹으라고 명령합니다. 그렇게 향을 먼저 맡고, 음식을 먹으면 2배로 맛있어지죠. 오감 중 제일 기억에 오래 남는 게 후각이기에, 풍부한 향과 함께한 식사는 고객에게 좋은 기억으로 저장될 겁니다.     ⓒUnsplash         그런데 제가 조명은 3500k가 좋다고 하니 공간 전체를 다 3500k로 하시는 사장님들이 있습니다. 이분들이 간과한 게 있어요.  조명도 색상과 마찬가지로 강약이 있어야 합니다. 그래야 공간이 더욱 입체적으로 완성되죠.     카페에서 커피를 만들고 음식을 제조하는 공간의 조명이 3500k면 약간 어둡다는 느낌이 들 겁니다. 작업공간은 5000k 정도가 돼야 작업 효율이 올라가요. 대신 고객이 앉는 자리는 조명이 라떼에 내려올 정도로 낮춰서 3500k로 하면 좋습니다.      그리고 카운터와 테이블 사이의 동선은 밝게 하면 안 돼요. 카운터에 메뉴를 볼 수 있는 곳이 밝고, 내가 앉아 있는 곳이 상대적으로 밝으면 좋아요. 이동하는 동선은 조금 더 어둡게 하고, 화장실이 있는 안쪽은 입구를 빨리 찾을 수 있도록 조금 더 밝게 하는 식으로 조명을 넣으면 좋습니다.      캘빈이 조명의 색이라면, 룩스(lux)*라는 밝기를 측정하는 단위도 있어요. 백화점에서 근무할 때는 '룩스계'를 차고 다니면서 조명의 밝기를 체크했었는데요. 요즘에는 스마트폰에 '조도계'라고 검색하면 앱을 이용해 손쉽게 룩스를 확인할 수 있습니다.    *룩스: 빛의 밝기를 나타내는 단위. 1 룩스 = 촛불 1개 정도의 밝기    독서하는 곳은 보통 400lux예요. 백화점이나 마트에서 제품을 진열하는 곳은 1000lux 정도죠. 반면 백화점의 복도는 50~100lux밖에 안 돼요. 사람은 자연스럽게 밝은 곳을 쳐다보기에 이를 이용한 겁니다.      내가 집중해서 팔고 싶은 물건이 있다면 그 물건을 비추는 조명을 밝게 해주세요. 그러면 주목도가 올라갑니다.      예를 들어 카페에서 텀블러를 판매하고 있다면, 제품을 핀 조명으로 동선보다 밝게 비춰주면 좋습니다. 또 옷가게에서 안쪽으로 고객을 불러들이고 싶다면 안쪽을 입구보다 밝게 하는 방법이 있습니다.      베이킹 코너에서도 조명의 역할이 중요해요. 최근 제가 컨설팅을 진행한 카페의 경우에는, 같은 진열장 안에 놓인 샌드위치와 일반 빵의 조명을 서로 다르게 한 적이 있습니다. 샌드위치는 신선해 보여야 하니 4500~5000k를 쓰는 반면, 크루아상 같은 일반 빵은 3000~3500k로 은은하게 예뻐 보이는 조명을 사용했죠. 업계에선 이 정도까지 디테일하게 조명을 쓰는 중이에요.     갤러리아 백화점 홈페이지 화면 캡처 ⓒ갤러리아 백화점       이런 조명을 잘 활용하는 공간의 대표적인 사례로 갤러리아 백화점이 있습니다. 여기는 기성품 조명을 쓰지 않고, 배색을 통해 자체적으로 조명을 만들어요. 패션, 뷰티 브랜드가 모여있는 공간뿐 아니라, 식품관도 예외가 아니죠. 자체적으로 만든 조명으로 소고기를 비추게 되면, 과장을 조금 보태 마치 마블링이 살아 움직이는 것처럼 보일 정도죠.    ※ 이 기사는 ‘콘텐트 구독 서비스’ 폴인(folin)의 “월간서른의 대책토크”의 7화 중 일부입니다. 이랑주 소장과 독자와의 Q&A는 폴인에서 직접 확인해 보세요.    더 많은 콘텐트를 보고 싶다면?          30대를 위한 자기성장 플랫폼 '월간서른'이 '책은 읽고 싶지만, 읽을 시간이 없는' 분들을 위한 강연 시리즈 '대책토크'를 진행했습니다. 저자들의 강연과 Q&A를 폴인이 글로 각색해 공개합니다.   ▶ 지금 ‘폴인’에서 확인해 보세요"
2021.12.11.,"'류수영♥' 박하선 ""머리 언제 길러""…확 달리진 스타일",https://n.news.naver.com/mnews/article/311/0001384043?sid=106,<구조 다름>
