기사날짜,기사제목,네이버 뉴스 url,기사내용
2021.12.09.,조선·중앙일보 이벤트 통한 로그인 '충성 독자' 유입 결과는,https://n.news.naver.com/mnews/article/006/0000110848?sid=102,"지난 8월부터 로그인 독자 모집한 중앙, 지난달 말 연내 목표치 도달조선일보도 지난 5월부터 ‘로그인 월’ 시행부터 카톡 이모티콘 이벤트까지조선일보가 충성 독자 확보를 위해 '조선일보 앱'을 설치 후 로그인하고 이벤트에 참여하는 1만명에게 카카오톡 새해 이모티콘을 제공한다. 지난 9월 카카오톡 이모티콘 제공 이벤트에 이어 두 번째다. 한편 지난 8월 홈페이지를 개편한 중앙일보는 연내 '30만 로그인 독자'를 확보하겠다는 목표를 달성했다. 지난 8일자 조선일보는 1면에 ""조선일보가 본지 스마트폰 앱을 사랑해주시는 독자들을 위해 '카카오톡 이모티콘을 쏜다' 2탄을 준비했다. 본지를 대표하는 삽화가 이철원 화백이 특유의 따뜻한 화풍으로 그린 연말연시 이모티콘을 앱 독자분들에게 나눠 드린다""고 알렸다. 이철원 화백은 1998년 조선일보에 입사해 24년째 조선일보 그래픽과 일러스트를 맡아왔다. ▲지난 8일자 조선일보 1면.▲지난 8일자 조선일보 2면.조선일보는 이어지는 2면 기사에서 ""새해 소원 이모티콘은 조선일보 앱 독자만 받을 수 있다. 조선일보 앱은 빠른 속도와 유려한 페이지 넘김, 풍성한 오디오 콘텐츠와 가장 빠른 미국 증시인 서학개미봇을 갖추고 있어 독자들이 편리하게 뉴스 서비스를 즐길 수 있다""고 설명한 뒤 ""이벤트에 참여한 모든 분께는 2명이 사용 가능한 1+1 이모티콘 패키지를 드린다. 또 추첨을 통해 200분께는 5명이 사용할 수 있는 이모티콘 패키지를 드린다""고 알렸다. 앞서 조선일보는 지난 9월15일자 1면에 ""조선일보의 인기 코너 '리빙 포인트'의 삽화가 카카오톡 이모티콘으로 재탄생했다""며 앱을 설치하고 회원가입을 한 후 이모티콘 받기를 누르고 댓글란에 '이모티콘 이벤트에 참여합니다'라고 쓰면 선착순 1만명에게 이모티콘을 제공한다고 설명했다. 당시 카카오톡 이모티콘 제공 이벤트는 1만명 모두에게 지급되면서 성공적으로 끝났다. '유료 구독'으로 나아가기 위해 올해부터 본격적인 로그인 독자 확보에 나선 언론은 조선일보와 중앙일보다. 조선일보는 지난 5월부터 조선일보 홈페이지 내에서 10개 이상의 기사를 보려면 로그인을 요청하는 '로그인 월' 시행을 시작으로, 지난 9월에는 조선일보 앱을 설치해 로그인하는 독자 1만명에게 카카오톡 이모티콘을 제공했다. 조선일보는 앱을 설치해 로그인하는 구독자를 충성 독자로 봤다. 지난 8월21일 새롭게 홈페이지를 연 중앙일보는 기존 홈페이지 가입자 데이터를 모두 포기하고, 새로운 구독자 모집에 나섰다. 홈페이지를 개편하는 데 20억원 안팎의 예산이 들었고, 중앙일보는 사내에 '30만 로그인 독자'를 확보할 방침이라고 밝혔다. 로그인 독자를 확보하는 과정에서 중앙일보도 '성향판별' 이벤트와 함께 지난달에는 제네시스 G80까지 경품으로 내거는 등 각종 이벤트를 선보이며 구독자를 모집했다. ▲지난달 진행된 중앙일보 구독자 모집 경품 이벤트.중앙일보는 지난달 11월1일부터 22일까지 '20만 로그인 독자'를 확보한 기념으로 회원가입한 로그인 독자 중 1등으로 당첨된 사람에게 현대자동차 제네시스 G80을 제공하는 이벤트를 진행했다. 이외에도 LG OLED EVO TV, SK매직 트리플 케어 식기세척기, 이엠이코리아 전기 자전거, 전동 킥보드, 애플 아이패드 에어, 가민 아웃도어 시계, 골프거리 측정기, BBQ 치킨 모바일 금액권(500명) 등을 경품으로 내걸었다. 미디어오늘 취재를 종합하면 지난 5월 '로그인 월' 시행 이후부터 조선일보의 새로운 로그인 독자는 20만명 넘게 늘어난 것으로 알려졌다. 또 중앙일보는 지난 8월 새 홈페이지를 개편한 후 새로운 로그인 독자를 약 32만명 정도 확보한 것으로 전해졌다. [관련 기사 : 중앙일보, 30만 독자모집 경품에 제네시스까지 내건 까닭] [관련 기사 : 조선·중앙 카톡 이모티콘·성향 테스트 얼마나 통했나] [관련 기사 : 기존 도메인 버리면서 수십억 투입 홈피 만든 중앙의 '큰 그림'] [관련 기사 : 홈페이지 개편 중앙일보, 로그인 독자 확보 페이지도 개설]"
2021.12.09.,조선·중앙일보 이벤트 통한 로그인 '충성 독자' 유입 결과는,https://n.news.naver.com/mnews/article/006/0000110848?sid=102,"지난 8월부터 로그인 독자 모집한 중앙, 지난달 말 연내 목표치 도달조선일보도 지난 5월부터 ‘로그인 월’ 시행부터 카톡 이모티콘 이벤트까지조선일보가 충성 독자 확보를 위해 '조선일보 앱'을 설치 후 로그인하고 이벤트에 참여하는 1만명에게 카카오톡 새해 이모티콘을 제공한다. 지난 9월 카카오톡 이모티콘 제공 이벤트에 이어 두 번째다. 한편 지난 8월 홈페이지를 개편한 중앙일보는 연내 '30만 로그인 독자'를 확보하겠다는 목표를 달성했다. 지난 8일자 조선일보는 1면에 ""조선일보가 본지 스마트폰 앱을 사랑해주시는 독자들을 위해 '카카오톡 이모티콘을 쏜다' 2탄을 준비했다. 본지를 대표하는 삽화가 이철원 화백이 특유의 따뜻한 화풍으로 그린 연말연시 이모티콘을 앱 독자분들에게 나눠 드린다""고 알렸다. 이철원 화백은 1998년 조선일보에 입사해 24년째 조선일보 그래픽과 일러스트를 맡아왔다. ▲지난 8일자 조선일보 1면.▲지난 8일자 조선일보 2면.조선일보는 이어지는 2면 기사에서 ""새해 소원 이모티콘은 조선일보 앱 독자만 받을 수 있다. 조선일보 앱은 빠른 속도와 유려한 페이지 넘김, 풍성한 오디오 콘텐츠와 가장 빠른 미국 증시인 서학개미봇을 갖추고 있어 독자들이 편리하게 뉴스 서비스를 즐길 수 있다""고 설명한 뒤 ""이벤트에 참여한 모든 분께는 2명이 사용 가능한 1+1 이모티콘 패키지를 드린다. 또 추첨을 통해 200분께는 5명이 사용할 수 있는 이모티콘 패키지를 드린다""고 알렸다. 앞서 조선일보는 지난 9월15일자 1면에 ""조선일보의 인기 코너 '리빙 포인트'의 삽화가 카카오톡 이모티콘으로 재탄생했다""며 앱을 설치하고 회원가입을 한 후 이모티콘 받기를 누르고 댓글란에 '이모티콘 이벤트에 참여합니다'라고 쓰면 선착순 1만명에게 이모티콘을 제공한다고 설명했다. 당시 카카오톡 이모티콘 제공 이벤트는 1만명 모두에게 지급되면서 성공적으로 끝났다. '유료 구독'으로 나아가기 위해 올해부터 본격적인 로그인 독자 확보에 나선 언론은 조선일보와 중앙일보다. 조선일보는 지난 5월부터 조선일보 홈페이지 내에서 10개 이상의 기사를 보려면 로그인을 요청하는 '로그인 월' 시행을 시작으로, 지난 9월에는 조선일보 앱을 설치해 로그인하는 독자 1만명에게 카카오톡 이모티콘을 제공했다. 조선일보는 앱을 설치해 로그인하는 구독자를 충성 독자로 봤다. 지난 8월21일 새롭게 홈페이지를 연 중앙일보는 기존 홈페이지 가입자 데이터를 모두 포기하고, 새로운 구독자 모집에 나섰다. 홈페이지를 개편하는 데 20억원 안팎의 예산이 들었고, 중앙일보는 사내에 '30만 로그인 독자'를 확보할 방침이라고 밝혔다. 로그인 독자를 확보하는 과정에서 중앙일보도 '성향판별' 이벤트와 함께 지난달에는 제네시스 G80까지 경품으로 내거는 등 각종 이벤트를 선보이며 구독자를 모집했다. ▲지난달 진행된 중앙일보 구독자 모집 경품 이벤트.중앙일보는 지난달 11월1일부터 22일까지 '20만 로그인 독자'를 확보한 기념으로 회원가입한 로그인 독자 중 1등으로 당첨된 사람에게 현대자동차 제네시스 G80을 제공하는 이벤트를 진행했다. 이외에도 LG OLED EVO TV, SK매직 트리플 케어 식기세척기, 이엠이코리아 전기 자전거, 전동 킥보드, 애플 아이패드 에어, 가민 아웃도어 시계, 골프거리 측정기, BBQ 치킨 모바일 금액권(500명) 등을 경품으로 내걸었다. 미디어오늘 취재를 종합하면 지난 5월 '로그인 월' 시행 이후부터 조선일보의 새로운 로그인 독자는 20만명 넘게 늘어난 것으로 알려졌다. 또 중앙일보는 지난 8월 새 홈페이지를 개편한 후 새로운 로그인 독자를 약 32만명 정도 확보한 것으로 전해졌다. [관련 기사 : 중앙일보, 30만 독자모집 경품에 제네시스까지 내건 까닭] [관련 기사 : 조선·중앙 카톡 이모티콘·성향 테스트 얼마나 통했나] [관련 기사 : 기존 도메인 버리면서 수십억 투입 홈피 만든 중앙의 '큰 그림'] [관련 기사 : 홈페이지 개편 중앙일보, 로그인 독자 확보 페이지도 개설]"
2021.12.09.,"코스피, 상승 기조 유지‥카카오뱅크 5% 넘게 하락",https://n.news.naver.com/mnews/article/214/0001164951?sid=004,"[930MBC뉴스]백신을 오미크론에 대응할 수 있을 것이라는 안도감이 투자 심리에 긍정적인 영향을 미치면서 간밤 뉴욕증시는 상승으로 마감했습니다.이에 오늘 우리 시장도 상승 기조를 유지하며 강보합권으로 거래되고 있습니다.현재 코스피 지수는 전일 대비 13.83포인트 상승한 3015.63에 거래되고 있고, 코스닥 지수는 9.09포인트 상승한 1015.13에 거래되고 있습니다. 현재 투자 주체별 매매 동향을 살펴보면 기관 홀로 매수세를 보여주고 있고 개인과 외국인은 매도세를 보여 주고 있습니다.지난밤 뉴욕 증시는 오미크론 변이바이러스의 위협이 예상보다 강하지 않을 것이라는 기대감 속에 3대 지수 모두 상승으로 마감됐습니다.시가 총액 상위 종목 살펴보면 LG화학과 삼성물산은 1%대 상승세를 보이고 있고 현대차와 네이버는 소폭 오르며 거래되고 있습니다.반면 삼성전자는 오늘 하락으로 출발한 가운데 카카오뱅크는 5% 넘게 내리고 있고 카카오페이, 카카오도 하락세를 보이고 있습니다.업종별로는 코스피 시장에서 섬유 의복업종의 상승 출발이 눈에 띄는 가운데 화학과 건설 업종도 오르고 있습니다.이 시각 현재 일본 증시는 오르면서 거래되고 있습니다.MBC 뉴스는 24시간 여러분의 제보를 기다립니다. ▷ 전화 02-784-4000▷ 이메일 mbcjebo@mbc.co.kr▷ 카카오톡 @mbc제보"
2021.12.09.,"'찐경규' 딸·예비사위 진솔 토크…""제2 메시 만들자""",https://n.news.naver.com/mnews/article/003/0010879244?sid=106,<구조 다름>
2021.12.09.,"""'네카오'와 어깨 나란히 한다""…스타트업 급성장 자신감 급상승",https://n.news.naver.com/mnews/article/031/0000641531?sid=105,"구글, '2021 창구 프로그램 데모데이' 개최…14개 스타트업 '피칭' 나서""경쟁사(그립)가 카카오에 인수되면서 라이브커머스에서는 네이버·카카오와 '보고'의 3자 구도가 되지 않았나 생각한다. 네이버·카카오와 어깨를 나란히 하는 (라이브커머스) 기업이 되겠다."" (류승태 보고플레이 대표)""저희 '동네알바'와 같은 하이퍼로컬 서비스인 당근마켓과의 차이를 많이 여쭤보는데, 토스가 카카오와의 차별점을 통해 송금을 중심으로 입지를 굳힌 것처럼 저희 역시 명확한 차별화 전략을 가지고 있다."" (이정희 라라잡 대표)류승태 보고플레이 대표가 9일 열린 데모데이에 참석해 발표하고 있다. 코로나19 관계로 발표 자체는 본행사 1주일 전에 진행됐다. [사진=창구 프로그램 데모데이 화면 갈무리]9일 경기 판교 창업존에서 개최된 '2021 창구 프로그램 데모데이'에서는 스타트업 대표들의 강한 자신감을 담은 발언이 이어졌다. 신종 코로나 바이러스 감염증(코로나19) 국면 속에서도 '고속 성장'으로 인기를 얻은 데 따른 자신감이었다.이날 열린 데모데이에는 창구 프로그램 3기를 이수 중인 앱·게임 개발사 14곳이 참석해 벤처캐피탈 등을 대상으로 기업의 성과와 앞으로의 계획 등을 설명했다. 신종 코로나 바이러스 감염증(코로나19) 여파로 발표는 데모데이 1주일 전에 별도로 사전 녹화했고, 행사 당일에는 질의응답 세션만이 진행됐다.참가 기업은 ▲하이퍼리티(블러리) ▲플랫가든(학학이) ▲보고플레이(VOGO) ▲와드(캐치테이블) ▲칼라프로젝트(오색중국어) ▲ 트이다(Teuida) ▲플래닛350(메모핏 시니어 홀트) ▲라라잡(동네알바) ▲제제미미(쑥쑥찰칵) 등 앱 개발사 9곳과 ▲집연구소(잡캐 키우기 온라인) ▲하루엔터테인먼트(아기상어 버블퐁 프렌즈) ▲이오에이지(얼음땡 온라인) ▲스타터(데빌북) ▲밋앤그릿(신도 야근을 하나요) 등 게임 개발사 5곳이다.창구 프로그램은 중기부와 구글이 공동으로 진행하는 스타트업 지원 프로그램이다. '창업'과 '구글플레이'의 앞자를 따 이름을 지었다. 2019년부터 시작해 현재 3기까지 진행됐다. 중기부는 선정된 스타트업에 사업화 자금을 주고 구글은 앱·게임 개선, 글로벌 진출·마케팅 지원, 수익화 전략 컨설팅, 국내외 벤처캐피탈(VC) 대상 데모데이 등 다양한 성장 패키지를 제공한다.데모데이에 나선 기업들은 일제히 빠른 성장세를 강점으로 내세웠다. 라이브커머스 플랫폼인 'VOGO'를 운영하는 보고플레이의 류승태 대표는 ""현재까지 누적 다운로드 수는 70만에 달하고, MAU(월간 활성 이용자 수)는 47만명이며 일일 최대 방송 조회수는 67만뷰""라며 ""지난 9월에만 거래액 150억원을 달성하며 국내 라이브커머스 스타트업 1위에 자리했다""고 말했다.지역 기반 아르바이트 플랫폼 '동네알바' 운영사인 이정희 라라잡 대표는 ""출시 11개월 만에 40만 다운로드를 달성했고 구직 회원 수도 35만명에 이른다""며 ""특히 올해 하반기 들어 다운로드 수가 크게 늘고 있는데 이를 토대로 아르바이트 플랫폼의 세대교체를 이루려고 한다""는 포부를 나타냈다.레스토랑 예약 앱 '캐치테이블' 운영사인 용태순 와드 대표는 ""입소문 등을 통해 성장 속도가 점점 빨라지고 있으며 특히 10월 이후 'J커브'를 그리며 빠르게 성장하고 있다""며 ""가장 최근 UV(평균 순방문자수)가 20만이 늘어나는데 고작 21일밖에 걸리지 않았다""고 강조했다. 블라인드 데이팅 앱 '블러리' 운영사인 전광하 하이퍼리티 대표 역시 ""현재 5개 언어로 번역돼 이미 글로벌 론칭했고, 40만 다운로드를 달성했으며 올해 손익분기점에도 다다랐다""고 설명했다.[사진=구글]이날 참가한 업체들 외에도 이번 창구 프로그램에는 총 80개 개발사가 선정됐다. 참여 개발사에는 중기부가 지원하는 최대 3억원의 사업화자금뿐 아니라 구글 플레이가 제공하는 다양한 주제의 세미나·교육에 참여할 기회가 주어진다.또 ▲매출 확대, 해외시장 진출·리더십 향상을 위한 성장 지원 세미나 진행 ▲매월 구글플레이 및 벤처캐피탈(VC) 3개사 관계자와의 질의응답을 위한 오피스아워 운영 ▲창구 프로그램 1기·2기 개발사와의 네트워킹을 위한 홈커밍파티 개최 등 전폭적인 지원에 나선다. 톱10 개발사에는 ▲1:1 맞춤형 비즈니스 컨설팅 ▲국내외 벤처캐피탈(VC) 대상 투자 피칭을 위한 창구 데모데이 참여 기회 ▲퍼포먼스 마케팅 지원 등이 추가로 제공된다.구글코리아에 따르면 창구 1~2기 참여 스타트업들은 평균 21%의 매출 증대와 함께 고용이 50% 늘었다. 총 835명의 신규 일자리를 창출한 것으로 나타났다. 앱 다운로드는 195% 늘었고 글로벌 시장에 진출한 기업도 51% 증가한 것으로 조사됐다. 3기 스타트업들 역시 창구 프로그램 이수 이후 빠른 속도로 성장하는 모습이다.권칠승 중소벤처기업부 장관은 이날 축사에서 ""창구 프로그램은 2019년 프로그램 발족 이래 혁신 스타트업 지원하는 대표적인 민관 협력 프로그램으로 자리매김했다""며 ""스타트업의 노력, 정부의 지원과 함께 창구 프로그램의 한 축을 맡은 구글의 한국 창업 생태계에 대한 상생 노력이 더해진 것""이라고 말했다.구글의 독립 스타트업 투자회사 '캐피털G'의 제레미 주 부대표는 한국 시장에 대해 ""한국은 아시아에서 1인당 국민소득이 가장 높은 국가 중 하나이며 모바일, 인터넷, 이커머스 등이 가장 활발한 국가이기도 하다""며 ""고학력 인재들이 많아 인재풀도 훌륭하고, 정부도 디지털화를 추진하며 기술 생태계를 끌어올리고 있기 때문에 한국의 생태계를 굉장히 특별하다고 보고 있다""고 언급했다.주 부대표는 다만 ""최근 아시아태평양 스타트업 분야에 나타나는 인재 부족 현상이 앞으로 심화할 우려가 있다""며 ""앞으로 다른 지역 인재들이 지역을 넘어서 모이기를 바란다""고 말했다."
2021.12.09.,"쿠콘, 카카오페이 신규 서비스에 핵심 데이터 담당",https://n.news.naver.com/mnews/article/138/0002114990?sid=105,"[디지털데일리 이상일기자] 쿠콘(대표 김종현)은 카카오페이(대표 류영준) ‘가맹점 매출관리 서비스’에 핵심 데이터를 제공한다고 9일 밝혔다.카카오페이가 리뉴얼한 ‘카카오 비즈니스’ 앱은 매출 관리와 멤버십 서비스를 제공한다. 특히 배달 서비스를 제공하는 소상공인에게 특화한 서비스로 11월 22일 오픈을 완료했다. 소상공인은 해당 서비스로 오프라인 매출 외에도 배민, 요기요, 쿠팡이츠 등 배달 앱에서 발생한 매출 내역까지 통합 조회할 수 있다.카카오페이 비즈니스 앱에는 △카드 매출, 입금 내역 조회 △현금 영수증 매출 내역 조회 △e-커머스 매출 내역 조회 (배달 앱 주문 내역) 등의 쿠콘 API가 탑재됐다.쿠콘과 카카오페이는 2017년 ‘신분증 진위 확인’을 시작으로 ‘대출 한도 및 금리 조회’, ‘소유자 검증 차량 정보 조회’ 등 쿠콘의 여러 데이터 API를 활용해 협력하고 있으며, 기업 정보 API 추가 도입으로 또 한 번 새로운 혁신 서비스를 구현했다. 아울러 이번 쿠콘과 협력에 이어 해당 서비스의 고도화를 위해 앞으로 더 많은 쿠콘 데이터 API를 활용할 계획이다.김종현 쿠콘 대표는 “이전부터 다양한 서비스로 협력해온 카카오페이와 신사업을 함께 추진할 수 있게 돼 뜻깊게 생각한다”며 “카카오페이가 성공적으로 서비스를 운영할 수 있도록 고품질의 데이터를 제공하는 데 최선을 다하겠다”고 말했다."
2021.12.09.,"'그림자 미녀' 이나경 VS 이나경, 틀린 그림 찾기급 싱크로율",https://n.news.naver.com/mnews/article/241/0003176709?sid=106,<구조 다름>
2021.12.09.,"역시 택진이형, 승부수 통했다...엔씨 '리니지W'로 화려한 복귀",https://n.news.naver.com/mnews/article/008/0004681028?sid=105,"/그래픽=김지영 디자인 기자엔씨소프트가 국내 모바일게임 왕좌에 화려하게 복귀했다. 올해 신작이 연달아 부진하며 벼랑 끝에 몰렸지만, '마지막 리니지를 만든다'는 심정으로 개발한 '리니지W'가 역대 최고 실적을 내며 매출 1위를 탈환한 것이다. 카카오게임즈의 '오딘: 발할라 라이징'에 1위를 내준 후 넉 달 만이다. 이에 힘입어 올 4분기 역대 최고 분기 매출이 기대된다.8일 아이지에이웍스의 빅데이터분석솔루션 '모바일인덱스'에 따르면 엔씨소프트의 신작 리니지W는 출시 첫 달인 11월 국내 앱마켓(구글·애플·원스토어 합산) 매출 1위를 기록했다. 지난 7~10월 1위를 차지했던 카카오게임즈 오딘은 2위로 밀려났다. 3, 4위엔 '리니지M'과 '리니지2M'이 올라 리니지 IP(지식재산권)의 저력을 나타냈다.엔씨소프트는 지난달 매출이 2000억원을 돌파한 것으로 추정된다. 이는 국내 앱마켓 인앱(In app·앱 내) 결제 매출의 34.3%를 차지하는 수치다. 작년보다 저조했던 실적에도 청신호가 켜졌다. 금융정보업체 에프앤가이드에 따르면 엔씨소프트 4분기 매출 예상치는 전년 동기 대비 43.02% 증가한 8028억원이다. 이는 분기 기준 역대 최고 수준이다. ━리니지W 잇단 신기록…매주 새 콘텐츠로 '린저씨' 발길 잡아━/사진=엔씨소프트글로벌 시장을 겨냥한 리니지W는 각종 신기록을 쓰고 있다. 일주일간 일평균 매출이 120억원을 기록, 창사 이래 최고성과를 거뒀다. 경쟁작 오딘의 첫날 매출이 70억원 내외였던 점을 고려하면 엄청난 수준이다. BJ(개인방송진행자) 마케팅비로 초기 매출을 끌어올렸다는 의혹도 제기됐지만, 이를 고려하더라도 4분기 일평균 매출 80억원을 유지할 것으로 분석된다.엔씨소프트는 리니지W 흥행에 전력투구 중이다. 9개 월드·180개 서버로 시작한 리니지W는 한 달만에 15개 월드·180개 서버로 확대됐다. 매주 이용자들이 새롭게 즐길 수 있는 콘텐츠를 내놓은 셈이다. 엔씨소프트 관계자는 ""오는 10일에도 신규월드를 열고 192개 서버로 증설할 예정""이라며 ""이용자 호응이 이어지면서 매주 새로운 콘텐츠를 선보이고 있다""고 말했다.국내 모바일게임 시장에서 리니지 시리즈는 늘 흥행 가도를 달렸지만, 이번 성공의 의미가 남다르다. 올 초 '확률형 아이템'(뽑기형 상품) 논란 이후 돈을 써야 이기는 '페이투윈'(P2W) 게임에 대한 반발이 커졌기 때문이다. 리니지는 물론 그와 비슷한 수익모델(BM)을 차용한 '트릭스터M', '블레이드&소울2' 등이 줄줄이 린저씨(리니지를 즐기는 아저씨)의 외면을 받으면서 실적도 고꾸라졌다.이에 김택진 엔씨소프트 대표는 ""그동안 당연히 여겨왔던 방식과 과정에 의문을 품고 냉정히 재점검하겠다""라며 ""고객이 기대하는 모습으로 변화하도록 총력을 기울이겠다""고 약속했다. 실제 리니지W는 과금·무과금 이용자 간 격차를 확대해 과도한 과금을 유도한다고 비판받았던 핵심 BM들을 축소했다. BM을 줄였는데도 역대급 매출을 기록한 것이다.━리니지W에 P2E 요소 더할까…증권가 주가 100만원 베팅 ━증권가에서도 엔씨소프트 목표주가를 잇달아 상향했다. 100만원을 돌파할 것이란 전망도 나온다. 엔씨소프트 주가는 지난 2월 16일(101만5000원)을 마지막으로 90만원대로 떨어져 55만8000원까지 추락했었다. 이날 주가는 전일 대비 2.09% 오른 73만2000원에 장을 마쳤다. 리니지W 출시 당일(59만5000원)보다 23% 오른 상태다.리니지W는 내년 아시아를 넘어 북미·유럽·남미 2권역에도 출시될 예정이다. 여기에 '플레이투언'(P2E·돈 버는 게임) 요소가 더해질 수 있다는 분석이 나온다. 앞서 홍원준 엔씨소프트 CFO(최고재무책임자)는 실적 컨퍼런스콜에서 ""MMORPG(다중접속역할수행게임)는 NFT(대체불가능토큰)를 적용하기에 가장 적합한 장르""라며 ""P2E 게임을 위한 기술적 준비는 끝났다""고 말한 바 있다.이에 대해 최용현 KB증권 연구원은 ""P2E게임은 엔씨소프트의 차세대 성장동력이 될 전망""이라며 ""리니지W에서 P2E 모델이 탑재되면 P2W 성향을 낮춰 엔씨소프트가 약점을 보였던 서구권 시장에서 좋은 성과를 기록할 여지가 있다""라고 분석했다."
2021.12.09.,"티몬, ‘산타랜드’ 기획전…최대 10% 할인 쿠폰",url없음,<네이버 기사 없음>
2021.12.09.,"이터널 리턴, 43번째 신규 캐릭터 '셀린' 출시",https://sports.news.naver.com/news.nhn?oid=442&aid=0000143645,<구조 다름>
