기사날짜,기사제목,네이버 뉴스 url,기사내용
2021.12.02.,"[소프트웨이브 2021]한소협 등 공동관, 강소 SW 기업 한자리에",https://n.news.naver.com/mnews/article/030/0002985632?sid=105,"소프트웨어(SW)산업 동향을 조망하는 국내 최대 SW 전시회 소프트웨이브 2021이 2일 서울 강남구 코엑스에서 열렸다. 한국SW산업협회 공동관이 참관객으로 북적이고 있다. 이동근기자 foto@etnews.com한국소프트웨어산업협회와 한국상용소프트웨어산업협회, 한국지식재산서비스협회 공동관에는 총 34개 기업이 참가했다.보안, 메시지 관리, 영상편집, 클라우드, 빅데이터 등 기업용(B2B)와 개인용(B2C)을 아우르는 제품과 서비스는 물론, 정부 아이디어 사업화 지원 과제에 참여했던 독창성 있는 아이디어 제품이 공개됐다.◇한국SW산업협회 14개 회원사 참여, 내년엔 더 늘린다한국SW산업협회 공동관에는 14개 회원사가 참여했다. 지난해보다 2배 늘었다. 내년에는 더 늘릴 방침이다.유라클은 메시지 제작과 발송, 뷰어, 열람, 확인 등 한 번에 처리하는 메시지 마케팅 올인원 플랫폼 '모피어스 푸시'로 눈길을 끌었다.모피어스 푸시는 문자, 카카오톡, 리치 커뮤니케이션 스위트(RCS) 등 많은 채널을 통해 따로따로 발송되는 기업 메시지를 관리하는 플랫폼이다. 동일 내용이 여러 채널로 발송되는 메시지를 가장 저렴한 채널로 먼저 보내고 도달을 확인하는 식으로 관리한다.기업은 중복 발송을 줄여 비용을 절감하고 메시지 수신자는 동일 메시지를 여러 채널로 수신하는 불편함을 줄일 수 있다.유라클 관계자는 “기존 방식 대비 최대 80% 비용을 절감할 수 있다”고 설명했다.센스톤이 선보인 OTAC(One-Time Authentication Code)는 1회용 사용자 1차인증 코드다. 보완 수단(2차 인증)으로 사용하는 OTP와 달리 사용자 식별이 가능해 1차 인증에 사용할 수 있다. 코드가 유출돼도 재사용이 불가능하다. 글로벌 특허를 받은 것도 이 같은 기술력 덕분이다.국내 토스뱅크 인증에 사용되며 군 밀리패스에도 적용될 예정이다. 이달 일부 부대에서 시범사업이 시작된다. 군 장병 휴가, 외출 등 인증이 필요한 곳에 폭넓게 활용될 예정이다.김운동 센스톤 이사는 “OTAC는 국내뿐만 아니라 영국 카드사, 유로패스 등 글로벌 시장에서 주목을 받는 서비스”라고 말했다.곰 플레이어로 잘 알려진 곰앤컴퍼니는 올해 출시한 영상편집 프로그램 '곰 믹스 맥스'를 선보였다. 고도화된 편집 툴로 풍부한 영상 제작이 가능한 전문가용 영상편집 프로그램이다.이 외에도 초보자를 위한 '콤 믹스 프로', 녹화 솔루션 '곰 캠', 동영상 플레이어 '곰 플레이어 플러스'도 주목을 받았다.◇한국상용SW산업협회 공동관, 기업·공공기관 디지털 전환에 방점한국상용SW협회관에는 인프라닉스, 데이터스트림즈 등 국산 상용SW 기업 7곳이 참여했다.멀티 클라우드 관리서비스 제공사(MSP) 인프라닉스는 가상화 전산실 플랫폼 'ICT 웍스'를 소개했다. 클라우드 전환과 컨설팅. 관리 등 3단계 맞춤형 멀티 클라우드 서비스를 지원한다. 공공영역에서는 KT, 네이버, NHN, 가비아, 삼성SDS 클라우드 컨설팅을 제공한다.서비스형 소프트웨어(SaaS) 'M-콘솔'로 클라우드 인프라 통합관리도 지원한다.인프라닉스 관계자는 “M-콘솔은 클라우드 인프라 현황 모니터링과 리소스 관리는 물론 인프라 구성정보를 자유롭게 표현하는 인프라 맵, 컨테이너 기반 서비스형 플랫폼(PaaS) 통합관리를 지원한다”고 말했다.데이터스트림즈는 빅데이터 플랫폼 '테라원'을 소개했다. 테라원은 정형·비정형 실시간 사물인터넷(IoT) 데이터 등 다양한 형태 데이터와 기준정보관리, 데이터 표준화, 품질관리, 흐름 관리 등 각 기능을 통합한 원스톱 빅데이터 플랫폼이다.빅데이터 기반 데이터 가상화 솔루션 '테라원 수퍼 쿼리'도 소개했다. 수퍼 쿼리는 이기종 데이터베이스관리시스템(DBMS) 가상화와 데이터 통합 자동화, 다양한 분석 환경 지원, 고속 SQL 기능 지원, 빅데이터 연계 등을 지원한다.이외에도 비아이매트릭스가 코딩자동화기술 기반 통합 사용자환경(UI) 개발 플랫폼, H2O시스템테크놀로지가 실시간 메시지 처리 미들웨어 'TiTAN', 크리니티가 공공기관 전용 SaaS 클라우드 메일 서비스, 피씨엔이 빅데이터 관리 솔루션 등을 전시했다.◇한국지식재산서비스협회, 미래 SW 혁신기업 출전한국지식재산서비스협회 공동관에는 향후 국내 SW 산업을 이끌 스타트업이 자리했다.비센스바움은 온라인 원격 평가과정에서 나올 수 있는 부정행위를 방지하는 솔루션을 개발하고 있다. 카메라를 이용해 신분증 영상 이미지와 수험자의 얼굴 이미지를 추출해 신분을 확인한다. 눈 영역 이미지를 추출해 시선 추적이 가능하다.서주원 비센스바움 수석연구원은 “실시간 영상에서 스켈레톤(인체관절뼈대) 추출을 위한 객체 인식 알고리즘을 개발했다”며 “수험자 영상에서 객체 이동형태를 추출하고 알고리즘을 통해 정상이나 부정 행위를 판별한다”고 말했다.이모션웨이브는 AI 음악 플랫폼 '리마AI'를 선보였다. 리마AI를 이용해 작곡 지식이 없어도 사용자 요구사항에 맞춰 AI가 직접 음악을 만든 뒤 실제 인간처럼 연주하는 악기 자동연주 시스템으로 녹음, 디지털 음원으로 발매할 수 있다.우디는 외화관리 생활금융 서비스 '버디코인'으로 눈길을 끌었다. 모바일앱과 비대면 키오스크 기반 온·오프라인을 연계계했다. 환전과 국내외 소액 동전·지폐 적립, 적립된 포인트를 통한 디지털 상품 구매, 기부, 투자, 보험 가입 등에 활용하는 서비스를 제공한다.한국지식재산보호원에 서비스 특허도 출원했다."
2021.12.02.,“너 때문에 돌겠다” 교사 정서적 학대…눈 감은 학교,https://n.news.naver.com/mnews/article/005/0001488434?sid=102,"인천의 한 중학교 교사가 학생에게 지속적인 폭언을 일삼아 정서적 학대라는 판단이 나온 가운데 학교 측이 늑장 조치를 했다는 주장이 제기됐다.1일 인천시교육청 등에 따르면 인천의 모 중학교 국어 교사 A씨는 1학년 학생 B양에게 지난 3∼4월 지속적으로 폭언을 했다.A씨는 당시 성대결절 치료를 받고 있던 B양이 인사 구령을 제대로 하지 못한다는 이유로 “인사가 장난이냐”며 소리를 질렀다. 또 질문에 답을 제대로 하지 못했다는 이유로 “너 때문에 돌아버리겠다”는 등의 폭언을 한 것으로 파악됐다.A씨는 또 다른 학생들 앞에서 “×× 것들이 정신 나갔느냐”라거나 “말도 더럽게 안 듣는다”는 등의 발언도 한 것으로 전해졌다.B양의 부모는 지난 4월 말 학교에 이 같은 사실을 알렸으나 학교 측이 별다른 조치를 하지 않자 6월 시교육청에 민원을 제기했다.학교 측은 이후에야 관할 지자체인 연수구에 아동학대 의심 신고를 접수했으며, 구는 조사를 거쳐 지난달 말 A씨의 행위가 정서적 학대에 해당한다는 판단을 내렸다.이 과정에서 단체 카카오톡 채팅방에서 B양에 대해 욕설을 한 학생 4명이 학교폭력대책심의위원회에서 봉사 처분을 받기도 했다.그러나 상담 치료를 받고 있는 B양은 지난 5월 10일 학업 유예 서류를 제출, 현재 정원외 관리 학생으로 분류된 상태다.B양 부모는 “학교 측은 시교육청에 민원이 들어가고 나서야 학대 의심 신고를 구에 접수했다”며 “학교 측에 유예를 신청하면서 사과 편지를 요청하자 ‘이제 그만 좀 하시면 안 되겠느냐’고도 답했다”고 토로했다.이들은 앞서 청와대 국민청원 게시판에도 관련 내용을 올리고 “너무 억울하고 분해서 하루하루가 너무 가슴이 아프다. 아이는 근육경련과 마음의 상처로 매주 상담센터와 병원을 오가며 수개월간 치료 중에 있다”고 토로하며 교사와 학교 관련자들에 대한 처벌을 호소했다.이와 관련, 인천시교육청 관계자는 “당시 학교에서는 교사가 지도 과정에서 한 발언으로 판단해 학대라고 인지하지는 않았던 것으로 파악됐다”며 “구에서 정서적 학대라는 판단이 나온 만큼 아동학대 여부에 대해 감사를 진행하고 있다”고 전했다."
2021.12.02.,"[소프트웨이브 2021]포시에스, 전자계약 '이폼사인' 호평…코로나19 후 국내 첫 오프라인 전시참가",https://n.news.naver.com/mnews/article/030/0002985554?sid=105,"포시에스 이폼사인 부스에서 참관객들이 전자계약 서비스의 장점 설명을 듣고 있다.전자문서·포팅 솔루션 기업 포시에스(대표 박미경)가 1일부터 코엑스에서 진행된 '대한민국 SW대전 소프트웨이브 2021)'에서 클라우드 기반 전자계약 서비스 '이폼사인(eformsign)'을 소개하며 참관객들의 호평을 받고 있다.포시에스는 코로나19 이후 처음으로 참가한 이번 오프라인 전시회에서 '이폼사인'을 단독으로 소개하며, 전자계약 시장 공략에 본격적으로 돌입했다.포시에스는 '일 잘하는 사람들의 전자계약, 이폼사인'을 테마로 부서별 또는 업무별로 전자계약 서비스를 체험할 수 있는 체험존과 실제 업무에서 사용하고 있는 서식을 현장에서 바로 전자계약으로 활용해 볼 수 있는 데모 시연존 등으로 부스를 꾸몄다.회사는 또 전자계약 서비스를 처음 접하거나 아직 익숙하지 않은 고객들의 이해를 돕기 위해 실제 업무에서 접할 수 있는 다양한 상황을 그래픽으로 쉽게 표현했다.부스를 방문한 고객들은 평소에 종이로 사용하던 근로계약서, 개인정보 동의서 등을 바로 전자문서로 전환해 간편하게 카카오톡이나 이메일로 서명 요청하는 체험을 통해 이폼사인의 쉽고 편리한 기능을 경험했다.특히 엑셀, 워드 등 기존에 사용 중인 MS 오피스 문서에서 바로 전자문서를 만들 수 있는 폼빌더 기능과 실물 도장 스캔·신분증 촬영 등 이폼사인만의 차별화된 기능에 대해서는 매우 긍정적인 반응을 보였다.포시에스는 이번 전시회에서 QR코드를 통해 무료체험에 가입한 고객에 한해 전자계약 1:1 맞춤 컨설팅 혜택을 제공하는 것은 물론, 부스 방문 고객을 대상으로 유료 결제 금액의 10%를 특별 크레딧으로 지급하는 이벤트를 진행했다.전시회 첫날 전시장 내 특설무대에서 '고객 사례로 보는 부서별 전자계약 활용 방법'을 발표하며, 디지털 전환·비대면 업무 환경에 관심을 보인 참관객들을 대상으로 이폼사인을 소개하는 시간을 별도로 가졌다.이폼사인은 국내 금융권에서 70% 이상의 디지털 창구 시스템 구축 레퍼런스를 보유한 오즈 이폼의 전자문서 엔진 기술을 기반으로 개발된 안정적인 서비스이다. 별도의 시스템 구축 없이 매월 합리적인 비용으로 계약서, 신청서, 동의서를 간편하게 전자문서로 만들어 사용할 수 있다.최근에는 중소기업 및 기관은 물론, 현대자동차, LG화학, GS칼텍스 등 국내 굴지의 대기업에서도 이폼사인을 도입하는 등 서비스 안정성과 기술력을 모든 기업군에서 인정받고 있다.박미경 포시에스 대표는 “코로나19 이후 국내에서는 처음으로 참가한 오프라인 행사에서 이폼사인을 소개하고 고객들의 긍정적인 반응을 직접 느낄 수 있었다”면서 “이번 전시회를 통해 디지털 전환, 비대면 업무 환경 도입에 여전히 어려움을 겪고 있는 중소기업들이 쉽고 빠르게 전자계약 서비스를 사용할 수 있도록 적극적으로 지원하겠다.”라고 말했다.이번 전시회는 코엑스 A홀에서 3일까지 진행되며, 포시에스 '이폼사인' 부스는 D02에서 만날 수 있다. 부스 방문객 전원에게 다양한 기념품도 제공한다."
2021.12.02.,"슈나이더일렉트릭, 글로벌 아이디어 공모전 '고그린 2022' 개최",url없음,<네이버 기사 없음>
2021.12.02.,[재테크 단신],https://n.news.naver.com/mnews/article/081/0003234521?sid=101,"●하나, 모든 고객 대상 자산관리 서비스 출시하나은행은 마이데이터 기반 개인 자산관리 서비스 ‘하나 합’을 출시했다. 하나은행은 이 서비스를 통해 기존 소수의 고액 자산가에게만 제공되던 자산관리와 외환 투자 전문 컨설팅을 모든 비대면 고객에게 제공한다. 소비자들은 자산 진단에서 처방까지 한 번에 해결해 주는 자산관리 스타일 서비스, 지출을 분석·제공하는 라이프스타일 분석, 외화 자산을 불려 주는 ‘환테크 챌린지’ 등을 경험할 수 있다.●신한금융투자, 신규 고객에 주식 쿠폰 증정신한금융투자는 이달 30일까지 신규 고객에게 주식 쿠폰을 증정하는 ‘Good Buy 2021’ 이벤트를 진행한다. 지난달 22일 이후 신한금융투자에서 최초로 계좌를 개설한 고객이 대상이다. 비대면 종합자산관리계좌(CMA), 은행제휴 S-Lite, 비대면 S-Lite+ 등의 계좌를 개설한 고객이 이벤트를 신청하면 주식 쿠폰 2만 5000원을 받을 수 있다. 국내 주식을 2만 5000원 이상 매수할 때 쿠폰을 선택해 주식을 매수하면 쿠폰 금액만큼 현금으로 입금된다.●KB국민, 메타버스 자산 상담 시스템 구축KB국민은행은 가상현실(VR) 기술을 활용한 금융서비스 실험을 위해 ‘KB 메타버스 VR브랜치’ 테스트베드를 구축했다. VR브랜치는 가상공간에 영업점을 구축하고 아바타를 이용한 고객과 직원 간 일대일 자산상담을 지원하기 위해 마련됐다. 소비자들이 개인종합 창구를 통해 송금 등 간단한 금융거래를 하고 VIP라운지에서는 투자성향 분석과 포트폴리오 설계 등을 체험할 수 있도록 설계된다.●카뱅, ATM 수수료 면제 내년 6월까지 연장인터넷전문은행 카카오뱅크는 현금자동입출금기(ATM) 수수료 면제 정책을 내년 6월 30일까지 연장한다. 카카오뱅크 계좌개설 고객과 카카오뱅크 미니 고객은 전국 편의점, 은행 등에 설치된 모든 ATM에서 출금·입금·이체 서비스를 수수료 없이 이용할 수 있다. 카카오뱅크는 2017년 7월 서비스를 시작한 이래 ATM 이용 수수료 면제 정책을 줄곧 이어 오고 있다."
2021.12.02.,"'기울어진 운동장' 해소…""금융지주도 계열사 간 정보 공유 활성화 필요""",https://n.news.naver.com/mnews/article/277/0005009327?sid=101,"은행연, 디지털 시대의 금융 겸업주의 세미나 개최서울 중구 명동에 위치한 은행연합회 건물.금융지수와 빅테크(대형 정보기술기업) 간 존재하는 '기울어진 운동장' 논란을 해소하기 위해 금융지주 계열사를 통한 정보공유를 활성화해야 한다는 주장이 제기됐다. 국내 금융사들의 글로벌 경쟁력 제고를 위해서라도 해외 선진국과 동일한 수준의 규제 환경을 조성해야 한다는 지적이다.박성현 신한금융지주 부사장은 2일 서울 명동 은행회관에서 열린 '디지털 시대의 금융 겸업주의 세미나'에서 '금융지주회사 계열사간 정보공유 확대 필요성' 주제발표를 통해 이같이 밝혔다.박 부사장은 ""활발한 정보공유를 통해 데이터를 집적해 '데이터 플랫폼'을 구축할 수 있고 이를 통해 국내 금융산업 경쟁력 강화에 일조할 수 있다""고 말했다. 이어 ""데이터 플랫폼은 고객맞춤형 상품 공급을 가능케하고 데이터 유관 금융 신산업을 지탱하고 사회적 효율성을 높이는 ESG 첨병 역할도 맡게될 것""이라고 강조했다.데이터 정보공유의 중요성을 강조하기 위해 '넷플릭스' 사례를 들었다. 그는 ""넷플릭스의 성공요인은 고객데이터 축적→분석·활용/축적의 선순환으로 사용자가 좋아하는 것을 누구보다 잘 알았다는 점에 있다""며 ""금융지주 역시 계열사간 정보를 결합·분석한다면 넷플릭스처럼 고객 라이프 스타일을 파악할 수 있다""고 설명했다.특히 금융·비금융 사업을 자유롭게 영위하며 다양한 데이터를 활용하고 있는 빅테크와의 공정한 경쟁을 위해서라도 금융지주내에서 데이터를 공유할 수 있는 정책적 환경을 조성해야 한다고 강조했다. 박 부사장은 ""카카오와 금융지주는 지배구조 측면에서 동일하나 영위할 수 있는 사업 범위나 수집 가능한 데이터에서 큰 차이가 난다""며 ""동일업무 동일규제 원칙에 따라 형평성을 제고해야 한다""고 지적했다.현재 국내 금융지주사는 정보 공유 시 고객 동의와 겸영 신고를 필요로 하는 등 데이터 플랫폼 등 활발한 고객 데이터 활용에 있어 제한을 받고 있는 현실이다. 반면 미국·영국·일본 등 주요 선진국은 고객의 동의가 없더라도 계열사간 마케팅 목적의 정보공유가 가능하다.박 부사장은 ""계열사 정보공유 대상을 경영관리에서 마케팅 목적으로 확대할 필요가 있다""며 ""문제점 보완을 위해선 사후거부권 등을 부여해 개인정보의 자기결정권을 보호하면 된다""고 말했다.한편 금융당국은 금융지주사 계열사 간 정보공유 활성화를 위한 방안을 검토하는 중이다. 고승범 금융위원회 위원장은 지난 10월 ""디지털화된 금융환경에서 핵심자산인 데이터를 보다 자유롭게 활용할 수 있도록 금융·비금융간 정보공유를 활성화 할 수 있는 기반을 강화하겠다""고 말했다. 정은보 금감원장 역시 지난달 ""시너지 제고를 위해 금융지주그룹 내 정보 공유가 원활하게 이루어질 수 있는 방안을 검토하겠다""고 언급한 바 있다."
2021.12.02.,"예산군, 2021년산 은행 수매…환경정비·농가소득",url없음,<네이버 기사 없음>
2021.12.02.,"KB국민은행, ISA 신탁형 국내 상장주식 투자 시행",https://n.news.naver.com/mnews/article/366/0000777664?sid=101,"KB국민은행은 은행권 최초로 ISA(개인종합자산관리계좌) 신탁형을 통해 국내 상장주식에 투자할 수 있는 서비스를 시행한다고 2일 밝혔다.서울 여의도 KB국민은행 본점. /국민은행 제공        기존 ISA 신탁형에서는 운용할 수 없었던 국내 상장주식을 새로운 운용자산으로 추가한 것이다. ISA 신탁형 계좌에서 투자 가능한 주식은 ▲삼성전자 ▲카카오 ▲삼성바이오로직스 등 KOSPI 200 구성 종목 중 시가총액 기준 상위 20개 종목으로 구성된다. 운용지시 금액은 50만원부터 200만원까지다.ISA 신탁형은 다양한 금융상품을 하나의 계좌에서 통합관리 하며 3년 보유 시 비과세 혜택이 있는 상품이다. 기존에는 예·적금, 펀드, 파생상품, ETF(상장지수펀드)만 운용할 수 있었으나 국내 상장주식도 함께 운용 가능해져 절세 혜택과 함께 다양한 금융상품을 한 번에 운용할 수 있게 됐다. 2023년 변경 예정인 세제 개편으로 ISA 신탁형에서 발생한 상장주식 매매 이익은 한도 없이 전액 비과세 될 예정이다."
2021.12.02.,"디즈니 매지컬 월드 2: 인챈티드 에디션, 오늘 발매",url없음,<네이버 기사 없음>
2021.12.02.,'게임+메타버스' 조합은 불패…ETF 수익률 1위는 뭘 담았나,url없음,<네이버 기사 없음>
2021.12.02.,[패션뉴스] ‘휠라X포스트 아카이브 팩션(PAF)’ 콜라보 컬렉션 공개 외,https://n.news.naver.com/mnews/article/415/0000006374?sid=103,"사진 1[앳스타일 박승현 기자] ▲ ‘휠라X포스트 아카이브 팩션(PAF)’ 콜라보 컬렉션 공개휠라는 ‘포스트 아카이브 팩션(POST ARCHIVE FACTION, 이하 파프(PAF))’과의 협업 컬렉션 ‘휠라 아카이브 바이 포스트 아카이브 팩션’ 3차 드롭 제품을 3일 공개한다고 2일 밝혔다. ‘드롭(Drop)’이란 주로 협업 한정판이나 캡슐 컬렉션을 특정 요일이나 시간대에 한정 수량으로 공개, 판매하는 방식을 일컫는다. 휠라와 이번 협업 컬렉션을 선보인 파프(PAF)는 임동준 크리에이티브 디렉터가 주축이 돼 패턴의 과감한 해체와 전위적 실험을 근간으로 의복의 구조적 진화를 연구하는 스트리트 패션 브랜드다. 이번 협업 제품은 110년 역사 속 휠라가 선보인 소재, 실루엣을 파프(PAF)만의 관점과 방식으로 재구성해 지금까지 볼 수 없었던 신선한 비주얼로 재탄생했다. 함께 공개된 캠페인 이미지 역시 한국 전통 무예인 택견 동작을 테마로 해, 구조적이고 형태감 있는 의류의 특징을 고스란히 담아냈다. 이번 컬렉션은 휠라의 기존 로고를 파프의 이미지와 가장 잘 맞는 각도로 새롭게 디자인하고 색다르게 변형해 컬렉션 전반에 적용한 것이 특징이다. 오는 3일에는 다운 재킷과 후디, 테크니컬 팬츠 등 다양한 의류를 공개하며 이번 콜라보의 대미를 장식한다. 휠라와 파프(PAF)의 협업 컬렉션 3차 드롭 제품은 휠라 공식 온라인 스토어와 포스트 아카이브 팩션 온라인 스토어에서 3일 오후 7시부터 구매 가능하며, 4일부터는 휠라 더현대 서울점에서도 만나볼 수 있다.사진 2▲ 로저 비비에 X 신세계백화점 콜라보레이션 프로젝트사진 3로저 비비에와 신세계백화점이 특별한 프로젝트를 위해 만났다. 이번 프로젝트는 신세계백화점이 대표 캐릭터인 푸빌라와 친구들을 활용하여 진행해온 겨울 캠페인과 로저 비비에의 콜라보레이션이다. 지난 11월 19일 푸빌라와 친구들 그리고 ‘로저(Roger)’를 주인공으로 하는 카카오톡 이모티콘을 공개하며 두 브랜드가 함께하는 콜라보레이션의 시작을 알렸다. 전국 13개 신세계백화점에서는 12월 26일까지 스페셜 디스플레이와 쇼핑백을 비롯해 캠페인 비주얼과 캐릭터가 활용된 다양한 아이템을 만나볼 수 있다. 오는 14일에는 회전목마를 메인 컨셉으로 신세계백화점 강남점 1층 더 스테이지에 팝업 스토어를 오픈할 예정이며, 핸드백 3종과 스니커즈 4종으로 이루어진 신세계백화점 리미티드 에디션도 함께 런칭한다. 오직 한국과 신세계백화점에서만 선보이는 리미티드 에디션에는 박스 슬리브와 참 등 로저 비비에의 유니크한 감성이 담긴 패키지도 함께 제공될 예정이다. 로저 비비에 X 신세계백화점 콜라보레이션의 다양한 컨텐츠와 함께 올 연말을 그 어느때보다 다채롭고 풍성하게 보낼 수 있는 좋은 기회가 될 것이다. 리미티드 에디션의 주인공은 로저 비비에를 대표하는 비브 스케이트 스니커즈와 이번 시즌 새롭게 등장한 RV 나이트릴리 미니백으로, 제품에 사용된 컬러와 소재의 조합은 오직 한국의 신세계백화점에서만 만나볼 수 있다. 이번 리미티드 에디션은 14일부터 신세계백화점 강남점 팝업스토어와 전국 신세계백화점에 입점한 로저 비비에 매장에서 만나볼 수 있다.(사진 2=휠라, 사진 3=로저비비에, 신세계백화점 제공)"
2021.12.02.,"서울디지털대, 양주시청과 제휴협약 체결",url없음,<네이버 기사 없음>
2021.12.02.,"문재인 대통령, 청년들과 디지털 혁신 대화…""사람 중심 디지털 강국 실현""",url없음,<네이버 기사 없음>
2021.12.02.,"KGC인삼공사, 창업 122주년 기념 프로모션",url없음,<네이버 기사 없음>
2021.12.02.,충남 학교 비정규직 파업…53곳 돌봄·급식 차질,url없음,<네이버 기사 없음>
