기사날짜,기사제목,네이버 뉴스 url,기사내용
2021.12.30.,"CJ올리브네트웍스, 쿠콘과 API 플랫폼 사업 협력",https://n.news.naver.com/mnews/article/138/0002116232?sid=105,"[디지털데일리 이상일기자] CJ올리브네트웍스(대표이사 차인혁)가 비즈니스 데이터 제공 전문기업 쿠콘(대표이사 김종현)과 API 플랫폼 경쟁력 확보를 위한 업무협약(MOU)을 체결했다. API(Application Programming Interface)란 운영체제 및 프로그래밍 언어가 제공하는 기능을 제어하는 인터페이스를 뜻한다. API 이용하면 표준화된 코드 작성이 가능하고, 빠른 프로세스 처리와 개발자들과의 협업을 용이하게 만들어 준다. CJ올리브네트웍스는 API를 활용하여 기존 메시징 서비스 중심에서 API 기반 서비스형 커뮤니케이션 플랫폼으로 사업 범위를 확대해 경쟁력을 강화한다는 계획이다. 협약식은 29일) 용산구 트윈시티 본사에서 진행됐으며 김종현 쿠콘 대표, 박성용 부사장, 차인혁 CJ올리브네트웍스 대표, 이주영 NEXT사업 1담당 등을 비롯한 주요 관계자들이 참석한 가운데 열렸다. 코로나 19 장기화로 재택 근무가 강화되고 비대면 활동이 확대되면서 음성, 영상, 문자, 채팅, 파일 공유 등 통합 서비스가 가능한 클라우드 기반 통신 플랫폼(CPaaS_Communications Platform-as-a-Service)의 중요성이 더해지고 있다.이러한 추세를 반영하여 CJ올리브네트웍스는 내년 상반기 중 클라우드 인프라 기반통신 플랫폼 ‘API 플렉스(가칭)’ 출시를 앞두고 있으며, 쿠콘과의 협약을 통해 ▲API 플랫폼 기술 개발 ▲비즈니스 모델 발굴 ▲서비스 교차 공급 등을 상호 협력할 예정이다. 특히 CJ올리브네트웍스가 제공하는 문자, 카카오톡, 푸쉬 등 커뮤니케이션 관련 API 서비스 상품 외에도 쿠콘의 기업및 금융 API 상품 탑재해 종합 API 플랫폼을 선보일 예정이다. 이 외에도 쿠콘의 비즈니스 데이터 플랫폼인 ‘쿠콘닷넷’에서도 CJ올리브네트웍스의 API기반 메시징 서비스를 만나볼 수 있다. 차인혁 CJ올리브네트웍스 대표는 “뉴노멀시대를 맞아 대부분의 기업 비즈니스가 비대면방식으로 이뤄지고 있어 API 기반 IT서비스 시장은 지속적으로 성장할 것으로 예상한다” 며 “이번 협약을 통해 CJ올리브네트웍스가 보유한 메시징 API 역량과 쿠콘의 기술을 결합해 차별화된 API 플랫폼을 구현하겠다”고 말했다. 김종현 쿠콘 대표는 “전문 IT 기술력을 기반으로 종합 API 서비스를 제공하는 CJ올리브네트웍스와의 이번 제휴로 다양한 시너지를 도모할 수 있을 것”이라며, “쿠콘이 보유한 역량과 자원을 적극 활용하여 최상의 서비스를 선보일 수 있도록 노력하겠다”고 말했다."
2021.12.30.,"CJ올리브네트웍스, 쿠콘과 API 플랫폼 사업 협력",https://n.news.naver.com/mnews/article/138/0002116232?sid=105,"[디지털데일리 이상일기자] CJ올리브네트웍스(대표이사 차인혁)가 비즈니스 데이터 제공 전문기업 쿠콘(대표이사 김종현)과 API 플랫폼 경쟁력 확보를 위한 업무협약(MOU)을 체결했다. API(Application Programming Interface)란 운영체제 및 프로그래밍 언어가 제공하는 기능을 제어하는 인터페이스를 뜻한다. API 이용하면 표준화된 코드 작성이 가능하고, 빠른 프로세스 처리와 개발자들과의 협업을 용이하게 만들어 준다. CJ올리브네트웍스는 API를 활용하여 기존 메시징 서비스 중심에서 API 기반 서비스형 커뮤니케이션 플랫폼으로 사업 범위를 확대해 경쟁력을 강화한다는 계획이다. 협약식은 29일) 용산구 트윈시티 본사에서 진행됐으며 김종현 쿠콘 대표, 박성용 부사장, 차인혁 CJ올리브네트웍스 대표, 이주영 NEXT사업 1담당 등을 비롯한 주요 관계자들이 참석한 가운데 열렸다. 코로나 19 장기화로 재택 근무가 강화되고 비대면 활동이 확대되면서 음성, 영상, 문자, 채팅, 파일 공유 등 통합 서비스가 가능한 클라우드 기반 통신 플랫폼(CPaaS_Communications Platform-as-a-Service)의 중요성이 더해지고 있다.이러한 추세를 반영하여 CJ올리브네트웍스는 내년 상반기 중 클라우드 인프라 기반통신 플랫폼 ‘API 플렉스(가칭)’ 출시를 앞두고 있으며, 쿠콘과의 협약을 통해 ▲API 플랫폼 기술 개발 ▲비즈니스 모델 발굴 ▲서비스 교차 공급 등을 상호 협력할 예정이다. 특히 CJ올리브네트웍스가 제공하는 문자, 카카오톡, 푸쉬 등 커뮤니케이션 관련 API 서비스 상품 외에도 쿠콘의 기업및 금융 API 상품 탑재해 종합 API 플랫폼을 선보일 예정이다. 이 외에도 쿠콘의 비즈니스 데이터 플랫폼인 ‘쿠콘닷넷’에서도 CJ올리브네트웍스의 API기반 메시징 서비스를 만나볼 수 있다. 차인혁 CJ올리브네트웍스 대표는 “뉴노멀시대를 맞아 대부분의 기업 비즈니스가 비대면방식으로 이뤄지고 있어 API 기반 IT서비스 시장은 지속적으로 성장할 것으로 예상한다” 며 “이번 협약을 통해 CJ올리브네트웍스가 보유한 메시징 API 역량과 쿠콘의 기술을 결합해 차별화된 API 플랫폼을 구현하겠다”고 말했다. 김종현 쿠콘 대표는 “전문 IT 기술력을 기반으로 종합 API 서비스를 제공하는 CJ올리브네트웍스와의 이번 제휴로 다양한 시너지를 도모할 수 있을 것”이라며, “쿠콘이 보유한 역량과 자원을 적극 활용하여 최상의 서비스를 선보일 수 있도록 노력하겠다”고 말했다."
2021.12.30.,"연말 성과급 받은 김과장, 내년 대출 이자 덜 낸다…왜?",https://n.news.naver.com/mnews/article/015/0004646707?sid=101,"금리인하요구권, 신용점수 오르거나 소득 늘었다면 신청 가능""대출금리 0.4%포인트 낮춰""…연간 이자 20만원 절약내년부터 수협 등 상호금융권 대출도 금리인하요구권 행사(사진 = 한경DB)#. 중소기업에 재직 중인 임정혁(가명)씨는 올해 연말 성과급으로 1000만원을 받았다. 기쁨도 잠시, 올해 4.6%로 빌렸던 신용대출이 떠올랐다. 올해 4월 NH농협은행에서 신용대출 3000만원을 4.6%로 빌렸기 때문이다. 연봉이 낮아서 상대적으로 비싼 금리로 빌렸는데, 내년부터는 원리금까지 매월 30만원 가량 내야하기 때문에 부담이었다. 금리인하요구권을 적용할 수 있을 지 은행에 문의한 결과, 긍정적인 답변을 받았다. 은행 측은 ""현재 요건은 되지만 우대금리 적용되는 게 없다""며 ""1월 중순에 앱으로 신청하는 게 좋겠다""고 추천했다. 대출금리가 가파르게 올라가면서 금리인하요구권을 통해 금리를 낮추려는 차주들이 늘고 있다. 은행권에서도 성과급을 많이 받았다면 '소득 증가' 요인인 만큼, 적극적으로 금리인하요구권을 신청할 것을 추천하고 있다. 30일 금융권에 따르면 현재 시중은행들의 일반 신용대출 금리(900점대 기준)는 3.45~ 4.55% 수준이다. 지난해 신용대출이 2%대였다는 점을 감안하면 1년새 큰 폭으로 오른 셈이다. 최근 대출금리가 오르면서 금리인하요구권을 통해 이자 부담을 줄이려는 차주들이 늘고 있다. 금리인하요구권은 신용점수가 오르거나 소득 및 재산 증가 등 긍정적 변화가 있다면 금융사에 대출금리를 내려달라고 요구할 수 있는 제도다.직장인 강 모씨는 ""지난 9월 신용대출로 3500만원을 금리 4.6%로 대출받았는데, 최근 인센티브가 들어와서 금리인하 요구권을 신청했다""며 ""금리가 4.2%로 내려갔다""고 말했다.  강 씨는 금리인하요구권을 써서 강 씨는 연간 이자 15만원을 아낄 수 있게 됐다.BNK경남은행에서 마이너스통장 5000만원짜리를 사용 중인 김 모씨는 5000만원을 다 사용한다고 가정했을 때 연간 내는 이자는 20만원 가량 줄어들게 됐다. 그는 ""공모주 청약에 사용하려고 만들어둔 통장인데 최근 금리인하요구가 가능하다는 문자를 받았다""며 ""모바일 앱으로 신청했더니 금리가 3.54%에서 3.14%로 인하됐다""고 전했다.사진=연합뉴스인터넷은행을 이용하는 차주들도 금리인하요구권을 적극 활용하고 있는 것으로 나타났다. 카카오뱅크에서 4000만원 한도로 마이너스 통장을 사용 중인 박 모씨는 ""최근 신용점수가 크게 올라서 금리인하요구권을 신청해봤다""며 ""그 결과 대출 금리가 4.495%에서 4.473%로 인하됐다. 생각보다 큰 폭은 아니지만 이자를 연간 2만원 가량 아낄 수 있게 된 셈""이라고 밝혔다.   금융당국, 금리인하요구권 활성화…내년엔 상호금융권도 적용돼 올해 들어 대출금리가 가파르게 오르면서 금융당국은 '금리인하 요구권 활성화'를 강조했다. 지난 10월 금융위원회는 관련 제도 개선 계획을 밝혔고, 금융감독원은 은행권과 보험·저축은행 등 금융권에도 금리인하요구권을 활성화를 주문한 바 있다. 실제로 카카오뱅크는 신용점수가 상승한 고객들을 대상으로 수시로 금리인하요구권 신청에 대한 안내문을 발송하고 있다. 하나은행은 금리 변동 시나 이자 납부일에, NH농협은행의 경우 금리인하요구권 대상 상품 보유 고객에게 신규 대출 실행 이후 5개월마다 문자로 안내하고 있다. 시중은행 관계자는 ""정기 상여금에 반영되는 성과급이 대폭 늘었다면 소득 증가 요인으로 금리인하요구권 시행 조건에 해당된다""며 ""내년 갑종근로소득세(갑근세)를 따로 직장에서 떼서 제출하거나, 연말정산 이후 금리를 낮춰줄 것을 요청하면 된다""고 말했다. 앞으로 금리인하요구권을 신청해 금리 인하 효과를 볼 차주들은 더 늘어날 전망이다. 농협이나 수협 등 상호금융권에서 받은 대출도 내년 6월부터 금리인하요구권 행사가 가능하다. 이달 초 국회는 상호금융업권 조합과 중앙회에 대한 금리인하 요구권을 법제화하는 내용의 '신용협동조합법' 개정안을 의결했다. 상호금융조합과 중앙회는 대출 계약 체결 시 소비자에게 금리인하를 요구할 권리가 있다는 점을 알려줘야 한다. 금융위는 내년 1~2분기를 목표로 추가적인 제도 개선 작업을 진행하고 있다. 공통 신청 요건과 불수용 사유 등을 포함한 통지 서식을 표준화하는 작업과 함께 전금융업권이 관련 실적을 공시하도록 하는 시스템을 구축할 계획이다."
2021.12.30.,"김진욱 ""검찰·경찰도 많이 하는데 왜 공수처만 사찰인가""",https://n.news.naver.com/mnews/article/029/0002713613?sid=100,"권성동 향해 """"표적으로 통신조회 했다는 건 지나치다""김진욱 공수처장이 30일 서울 여의도 국회에서 열린 법제사법위원회 전체회의에 참석해 '통신자료조회' 논란에 대해 입장을 밝히고 있다. <연합뉴스>    김진욱 고위공직자범죄수사처(공수처)장은 30일 '통신자료조회' 논란에 대해 ""검찰과 경찰도 많이 하는데 왜 공수처만 가지고 사찰이라고 하나""고 토로했다.김 처장은 이날 오후 국회 법제사법위원회 현안 질의에서 권성동 국민의힘 의원이 공수처의 광범위한 통신자료조회가 ""야당 탄압""이라고 비판하자 이같이 말했다.김 처장은 윤석열 국민의힘 대선후보 부인 김건희 씨 통신자료조회를 놓고 ""윤 후보에 대해 저희가 3회, 서울중앙지검에서는 4회였고 배우자에 대해 저희가 1회, 검찰이 5회였다""며 ""왜 저희만 가지고 사찰이라고 하느냐""라고 반박했다.또 ""지난주 과학기술정보통신부 발표를 보면 검찰은 59만7천건, 경찰은 187만7천이었지만 저희는 135건""이라며 ""우리 보고 통신사찰을 했다는 건 과한 말씀""이라고 거듭 강조했다.김 처장은 ""공수처가 사찰 기관이라고 한다면 가입자 정보를 통해 야당 의원들의 동향을 조직과 인력을 동원해 파악해야 성립되는 것이 아니냐""며 ""(통화내역 조회 결과에 따라 확보한) 전화번호만으로는 누군지 알 수 없기 때문에 조회를 한 것뿐으로, 사찰이 될 수 없다""고 했다.이어 ""이번에 확인을 해보니, 조회 대상에는 공수처 검사나 수사관도 있고, 여당 의원들도 있었다""며 ""표적으로 이것을 했다는 것은 지나치다""고 말했다.김 처장은 국민의힘 의원들 대상 통신조회에 대해 ""원칙적으로 말씀드릴 순 없지만 국민적 관심사이기에 말한다""며 ""현재 수사 중인 '고발사주' 의혹 사건 관련으로 알고 있다""고 했다.윤 후보와 배우자에 대한 조회도 같은 건이냐는 질문에 ""그렇게 알고 있다""고 부연했다.다만 윤한홍 국민의힘 의원이 ""고위공직자도, 피의자도 아닌 기자뿐 아니라 그 가족까지 조회한 것을 어떻게 설명할 것이냐""고 지적하자 ""직종별로 정확한 숫자를 가지고 있지 않으며, 수사 중인 사안에 대해서는 구체적으로 말할 수 없다""고 말을 아꼈다.김 처장은 광범위한 조회에 대한 야당 의원들의 비판에 ""통신조회를 요청하면 전화 착발신뿐만 아니라 문자메시지, 카카오톡 등도 조회할 수 있다""며 ""언론에서 '통신 내역 조회'라는 말을 쓰는데 이는 누구와 얼마나 통화했는지를 말하는 것으로 영장이 필요한 것""이라고 말했다.김 처장은 더불어민주당이 야당 시절이었던 2016년 수사기관의 통신조회를 문제 삼으며 사찰이라고 주장했던 전례와 관련해서는 ""여야가 바뀔 때마다 야당에서는 통신조회를 사찰로 보는 경향이 있는 것 같다""며 ""(해당 사례도) 사찰이 될 수 없다""고 강조했다.그러면서 ""법조인으로서 26년 동안 일했는데, 수사 중에 통신조회가 문제가 돼 기관장이 이렇게 (국회에) 나와서 답변한 전례가 없는 것 같다""며 ""억울해서 수사 내용을 밝히고 싶지만, 수사 도중에 밝히는 것은 피의사실공표나 공무상 비밀누설이 될 수 있다""고 호소했다.김 처장은 ""저희도 범위가 너무 넓지 않았는지 성찰을 하겠다""며 ""(현재) 위법 문제는 없지만, 앞으로 수사를 할 때 범위를 최소한도로 줄여서 하겠다""고 말했다."
2021.12.30.,"MZ세대 오너 3,4세 경영 일선 전진배치",https://n.news.naver.com/mnews/article/382/0000953667?sid=101,"세대교체 속도내는 식품업계 CJ 이선호 경영리더, 신사업 주도농심 신상열 부장도 구매담당 상무로매일유업 장남, 신세계 근무하다 복귀“능력 입증되면 승계 작업 속도↑”이선호 CJ제일제당 경영리더(왼쪽 세 번째)와 팀 해리스 LA레이커스 CEO(네 번째) 등 관계자들이 ‘CJ비비고XLA레이커스 파트너십’ 행사에서 비비고 로고가 적용된 새로운 저지를 공개하고 있다. 사진제공 l CJ제일제당식품업계가 2030 MZ세대인 오너 3·4세들을 경영 일선에 배치하며, 세대교체에 속도를 내고 있다. 크게 임원 승진과 외부에서 경영 수업을 받다가 본가로 복귀한 경우로 나뉜다. 향후 안정적 승계 작업이 핵심 화두가 될 것으로 예상되는 가운데, 이들이 맡은 직책에서 리더십과 성과를 보이느냐가 관건이 될 것으로 보인다.● CJ·농심, 임원 승진 통해 경영 일선 배치 먼저 이재현 CJ그룹 회장의 장남 이선호(31) CJ제일제당 부장이 28일 신임 임원(경영리더)으로 승진했다. 1990년생인 이 경영리더는 미국 컬럼비아대 금융경제학과를 졸업한 후 2013년 CJ제일제당에 입사했다.  올해 1월부터 글로벌 비즈니스 담당을 맡아 K푸드 사업에서 좋은 성과를 거뒀다는 평가를 받고 있다. 9월 비비고와 미국프로농구(NBA) LA레이커스 간 글로벌 마케팅 계약 체결을 주도한 데 이어, 최근 비건 브랜드 ‘플랜테이블’을 론칭하는 등 CJ제일제당의 신사업 전략에 주도적 역할을 하며 활동 보폭을 넓히고 있다. 이번 인사는 CJ그룹의 승계 작업을 위한 포석이라는 해석이 지배적이다. 앞서 장녀 이경후 CJENM 부사장이 지난해 12월 정기 임원인사에서 승진한 데다, 이번에 이 경영리더까지 임원에 오르며 승계 작업을 위한 밑그림이 완성됐다는 분석이다.  CJ그룹은 내년 CJ올리브영의 상장을 추진 중이다. 이 경영리더는 자신이 보유한 CJ올리브영 지분 11.09%를 현금화해 핵심 지주사 CJ 지분을 매수하는 데 활용할 것으로 보인다.신상열 농심 구매담당 상무 농심도 1일 신동원 농심 회장의 장남인 신상열(28) 부장을 구매담당 상무로 승진시키며 3세 경영 시대를 열었다. 1993년생인 신 상무는 미국 컬럼비아대를 졸업하고 2019년 농심에 평사원으로 입사했다. 그간 경영기획팀 및 기획과 예산 관련 업무를 맡다가, 이번에 구매담당으로 자리를 옮기게 됐다. 식품기업에서 구매 담당은 산업 구조 전반을 이해하는 핵심 업무로 꼽힌다.  마침 신동원 농심 회장이 대표이사직에서 물러나고 그룹회장직만 맡으면서, 신 상무의 경영권 승계가 더 빨라질 것으로 예상된다. ● 매일유업·오리온, 외부에서 본가로 복귀 외부에서 경영 수업을 받다가 본가로 복귀한 케이스도 있다. 김정완 매일유업 회장의 장남 김오영(34)씨는 10월 매일유업에 입사해 생산물류 혁신 담당 임원으로 근무 중이다. 그는 신세계그룹에 입사해 7년간 재무 담당으로 근무하며 유통 사업에 대한 경험을 쌓은 바 있다.  담철곤 오리온그룹 회장의 아들 담서원(32)씨는 7월 오리온에 입사해 경영지원팀 수석부장으로 근무하고 있다. 1989년생인 담 부장은 미국 뉴욕대를 졸업하고 중국 유학 경험을 살려 회사 전체 경영 전략을 수집하고 국내·외 법인 관리를 담당하는 업무를 수행하고 있다. 그는 지난해 카카오엔터프라이즈에 일반 평직원으로 입사해 경력을 쌓기도 했다.  이밖에도 함영준 오뚜기그룹 회장의 장남 함윤식(30)씨는 오뚜기 경영지원팀에서 사원으로 근무하고 있다. 함씨의 오뚜기 지분율은 2.17%수준으로 알려졌다. 또 삼양식품의 경우, 전인장 전 삼양식품 회장의 아들인 전병우(27) 이사를 중심으로 3세 경영에 속도를 내고 있다. 1994년생인 전 이사는 미국 컬럼비아대를 졸업하고 2019년 해외사업본부 소속 부장으로 입사했다.  지난해 임원으로 승진하며 삼양식품 전략기획부문장을 맡아 회사의 중장기 전략을 수립하고 있다. 업계 관계자는 “오너 3·4세들이 중책을 맡아 경영 일선에서 존재감을 키우고 있다. 포스트 코로나 시대를 대비해 새로운 먹거리 창출에 앞장서는 만큼, 향후 이들에게 더욱 중요한 역할을 맡길 가능성도 있다”며 “오너 3·4세들의 경영능력이 입증된 기업일수록 경영 승계 작업이 빨라질 것”이라고 전망했다. 정정욱 기자 jjay@donga.com"
2021.12.30.,"[MBC 연기대상] '옷소매' 홍덕로 강훈, 신인상 ""치열하게 연기할 것""",https://n.news.naver.com/mnews/article/009/0004901924?sid=106,<구조 다름>
2021.12.30.,우주소녀 ‘이루리’ 역주행으로 시작한 2021년…팔색조 그룹 입증,https://n.news.naver.com/mnews/article/609/0000527838?sid=106,<구조 다름>
2021.12.30.,‘4인·9시 거리 두기’ 2주 더…2010년생은 내년 방역패스 면제,https://n.news.naver.com/mnews/article/032/0003119675?sid=102,"[경향신문] 방역패스 조정안 31일 발표47만명 화이자 접종 대상에1월4일부터 순차 사전예약2004년생은 ‘부스터샷’ 가능완치자들, 집으로 서울 중랑구 서울의료원에서 30일 오전 의료진과 병원 관계자가 퇴원하는 코로나19 완치자들을 안내하고 있다. 우철훈 선임기자내년부터 2010년생 청소년 중 생일이 지난 만 12세 청소년도 코로나19 예방접종에 참여할 수 있게 된다. 단, 내년 한 해에는 방역패스를 적용받지 않는다. 정부는 다음달 3일부터 적용할 거리 두기를 현행 수준으로 2주 연장키로 결정한 것으로 알려졌다. 정부는 31일 거리 두기 연장 여부와 함께 청소년 방역패스 조정안을 발표한다. 당초 내년 2월부터 시행하기로 한 청소년 방역패스 도입 시기를 미루는 방안이 검토되는 것으로 전해졌다.코로나19 예방접종대응추진단은 “2022년 만 12세(2010년생 중 생일 경과자)가 되어 새롭게 접종 대상으로 들어오는 청소년에 대한 백신 접종을 내년 1월부터 시행한다”고 30일 밝혔다. 내년에 신규 접종 대상자가 되는 2010년생은 47만5936명이다. 위탁의료기관에서 3주 간격으로 화이자 백신 1·2차 접종을 하게 된다. 2010년생 청소년 대상 사전예약은 내년 1월4일 0시부터 시작한다. 백신 배송 일정을 고려해 예약일 기준 7일 후부터 접종일을 선택할 수 있다.  잔여백신 예약을 통한 당일접종은 1월3일부터 가능하다. 2010년생 청소년에게는 내년 중 방역패스를 적용하지 않는다.  내년 18세가 되는 2004년 출생자 중 2차 접종 후 3개월이 지난 사람은 3차 접종에 참여할 수 있다. 사전예약은 내년 1월1일 0시부터, 잔여백신 접종은 3일부터다. 내년 1월에만 18세 이상 3차 접종 대상이 1100만명 늘어난다.지난 1일 0시 기준 14.7%(193만명)에 불과하던 60세 이상 고령층 3차 접종률은 30일 74.7%(982만명)까지 올랐다. 12월 한 달 동안 예약 없이도 당일 3차 접종이 가능하도록 ‘고령층 3차 접종 집중 실시기간’을 운영한 결과다. 예약자까지 포함하면 12월 말까지 2차 접종 후 3개월이 도래하는 고령층 가운데 90.3%가 접종에 참여했다. 전체 확진자 중 고령층 비중은 지난 1일 35.4%에서 30일 20.2%까지 떨어졌다. 중앙방역대책본부는 60세 이상 3차 미접종군은 3차 접종 완료군보다 감염 위험이 2.4배 높고, 3차 접종 완료군의 감염예방 효과는 82.8%라고 밝혔다.내년 1월3일 방역패스 유효기간 6개월 적용에 맞춰 전자증명서·출입명부 시스템도 개선했다. 질병관리청의 ‘쿠브’ 앱에서만 확인할 수 있었던 3차 접종력 및 2차 접종 후 경과일을 앞으로는 네이버·카카오·토스·PASS 앱 등 전자출입명부 플랫폼에서도 확인 가능하다. 종이증명서로만 발급했던 완치확인서와 접종증명 예외확인서도 쿠브 앱과 전자출입명부에서 전자적 형태로 제공한다. 이날 0시 기준 코로나19 신규 확진자는 5037명으로 이틀 연속 5000명대를 기록하며 감소세를 이어갔다. 추가 병상 확보로 수도권 중환자 병상 가동률은 전날보다 10%포인트 떨어진 68.8%, 전국 가동률은 67.4%를 보였다.하지만 위중증 환자가 1145명에 이르고, 전날 하루 사망자는 73명으로 여전히 많은 수준이다. 정부는 위중증 환자 수가 확진자 감소 추세에 1~2주의 시차를 두고 줄어들 것으로 내다보고 있다. 오미크론 변이 확진자는 67명 늘어 누적 625명이다. 이날부터 오미크론 변이를 3~4시간 만에 신속히 판별할 수 있는 유전자증폭(PCR) 시약이 지자체 단위 방역 현장에 도입되면서 향후 확진자 규모가 불어날 것으로 보인다. 정부는 31일 오전 중앙재난안전대책본부 회의를 열고 현행 거리 두기 조치의 2주 연장 여부를 최종 확정한 뒤 발표할 예정이다. 정부는 오미크론 확산세를 고려해 다음달 2일 끝나는 거리 두기를 현행(사적모임 4인, 영업시간 오후 9~10시 제한) 수준으로 2주 연장키로 결정한 것으로 알려졌다."
