기사날짜,기사제목,네이버 뉴스 url,기사내용
2023.01.26.,"이복현 금감원장 ""다양한 투자 방식으로 유동성 공급해달라""",https://n.news.naver.com/mnews/article/079/0003730891?sid=101,"새해 보험사 CEO 간담회 개최…""외형확장보다 시장안정""""경기 어려울수록 보험 역할 중요""생보·손보사 대표 14명 참석금융감독원 제공이복현 금융감독원장은 26일 보험업계 최고경영자(CEO)들을 만나 ""무리한 외형확장보다는 시장 안정에 힘써주시길 부탁드린다""고 말했다.이 원장은 이날 서울 종로구 생명보험교육문화센터에서 보험회사 CEO 간담회를 열고 ""새해에도 금리 관련 불확실성이 여전한 가운데 실물경제 위축이 우려되고 있어 경계의 끈을 놓기는 어려운 상황""이라며 이같이 밝혔다.이날 간담회에는 전영묵 삼성생명 대표이사 등 생명보험사, 손해보험사 대표이사 14명이 참석했다.이 원장은 모두발언을 통해 ""보험업계는 2008년 금융위기, 코로나19로 인한 금융시장 불안 때도 장기자금을 제공해 자본시장을 안정시키는 데 큰 역할을 해왔다""고 평가했다.또 ""올해도 일시적 유동성 부족에 따른 정상기업의 부실화가 금융산업내 시스템 리스크를 촉발시키지 않도록 회사별로 투자적격 기업을 적극 발굴해 채권을 매입하는 등 다양한 투자 방식으로 유동성을 공급하는 기관투자자로서의 역할을 충실히 이행해달라""고 요청했다.이어 ""금융당국도 보험업계의 노력을 지원할 수 있는 방안을 계속해서 고민해 나가겠다""고 덧붙였다.부동산 경기 하강과 관련한 위험관리 강화도 주문했다.이 원장은 ""금리 인상 및 경기침체 우려 등이 계속되면서 부동산 등 경기 민감성 자산의 손실 위험이 커지고 있다""며 ""보험회사 자체적으로 부동산 프로젝트파이낸싱(PF) 및 해외 대체투자 등에 대한 철저한 심사와 사후관리 등을 부탁드린다""고 말했다.또 ""금융당국도 부동산 PF 점검 결과를 공유하고 해외 대체투자 모니터링 지표를 개발하는 등 감독 측면의 지원 방안을 마련할 것""이라고 강조했다.보험업계 새 회계제도(IFRS17)와 새 지급여력제도가 새해부터 시행된 것과 관련해 시행 초기 혼란이 발생하지 않도록 회계시스템과 회계결산 산출 결과를 잘 점검해 달라는 당부도 이어갔다.이 원장은 ""IFRS17 및 신(新)지급여력제도 시행으로 인해 12년만에 규제 이행 리스크가 부각되고 있다""며 ""회계 결산 결과 등에 오류가 발생할 경우 회사뿐 아니라 산업에 대한 신뢰성이 저하될 수 있으므로 회계시스템 및 산출 결과 등을 다시 한번 살펴주시기를 바란다""고 주문했다.이밖에도 생계형 대리운전자가 사고 이력 때문에 보험 가입이 거절되지 않도록 대리운전 보험을 개선하고, 고령자가 중대 질병 진단 때도 요양원 입소 등을 보장받을 수 있는 상품 도입방안을 마련하겠다고 설명했다.이 원장은 ""경기가 어려워질수록 사적 안전망으로서 보험의 역할이 중요해진다""며 ""민생안정을 위한 보험 본연의 역할에 충실해 달라""고 말했다.※CBS노컷뉴스는 여러분의 제보로 함께 세상을 바꿉니다. 각종 비리와 부당대우, 사건사고와 미담 등 모든 얘깃거리를 알려주세요.이메일 : jebo@cbs.co.kr카카오톡 : @노컷뉴스사이트 : https://url.kr/b71afn"
2023.01.26.,"LG에너지솔루션, 전자투표제 도입…3월 주주총회부터 적용",https://n.news.naver.com/mnews/article/079/0003731186?sid=101,"핵심요약""주주 편의 제고 위해 전자투표제 도입 시행""LG에너지솔루션 제공LG에너지솔루션이 전자투표제를 도입한다.LG에너지솔루션은 26일 ""의결권 행사에 있어 주주 편의를 제고하기 위해 전자투표제를 도입·시행하기로 이사회에서 결의했다""고 공시했다.전자투표제는 주주가 주주총회에 출석하지 않고 컴퓨터나 스마트폰 등을 통해 의결권을 행사하는 온라인 투표 제도다.LG에너지솔루션은 오는 3월 주주총회를 앞두고 있다. 제3기 주주총회지만, 1회 주총이 창립총회로 이뤄졌고 2회 주총은 상장 이전인 2021년 12월 31일 주주명부 기준으로 이뤄져 주주가 LG화학뿐으로 사실상 첫 주주총회인 셈이다.LG에너지솔루션은 전자투표와 관련해 구체적인 절차와 방법은 추후 주주총회 소집공고 등을 통해 안내하겠다고 밝혔다.※CBS노컷뉴스는 여러분의 제보로 함께 세상을 바꿉니다. 각종 비리와 부당대우, 사건사고와 미담 등 모든 얘깃거리를 알려주세요.이메일 : jebo@cbs.co.kr카카오톡 : @노컷뉴스사이트 : https://url.kr/b71afn"
2023.01.26.,'갈 곳 잃은 아이들' 폐원 앞둔 장애아동 어린이집…해법 고심,https://n.news.naver.com/mnews/article/079/0003731083?sid=102,"부산 사상구 유일의 장애아 전문 어린이집…대표 보조금 횡령으로 폐쇄 위기구청, 법인으로부터 건물 기부채납 받아 계속 운영하는 방안 검토 중폐쇄 처분 1년 연기하거나 취소하는 등 어린이집 유지 위해 대책 고심부산시 ""보조금 받은 건물이라 보건복지부 승인 먼저 받아야…절차 복잡해""부산 사상구의 유일한 장애아 전문 어린이집이 대표의 횡령으로 폐원 위기에 처했다. 사진은 기사 내용과 무관함. 이미지 비트 제공시설 대표의 보조금 횡령 의혹이 불거진 부산 사상구 유일의 장애인 전문 어린이집이 폐쇄를 한 달가량 앞두고 있지만, 여전히 뾰족한 대책이 나오지 않아 불안이 커지고 있다. 해당 지자체는 법인으로부터 건물을 기부채납 받거나 폐쇄 처분을 연기하는 방안까지 검토하는 등 어린이집을 계속 운영하기 위한 대책 마련에 고심하고 있다. 부산 사상구청은 지역 내 A장애인 전문 어린이집의 폐쇄를 앞두고 기부채납과 처분 명령 변경 등을 검토 중이라고 26일 밝혔다. 사상구청에 따르면 A어린이집 대표 B씨는 지난해 국가보조금 3억원을 횡령한 혐의로 재판에 넘겨져 최근 1심에서 징역형 집행유예를 선고받았다. 영유아보육법은 어린이집의 부정 수령 보조금이 1천만원을 넘을 경우 문을 닫도록 규정하고 있다. 이에 따라 구청은 지난해 6월 A어린이집에 대해 즉시 폐쇄 행정 처분을 내렸다. 이후 행정 이의 신청기간과 어린이집의 교육 과정 등의 이유로 2월 말까지 폐쇄하는 것으로 처분이 변경됐다. B씨는 어린이집 폐쇄 처분을 취소해달라는 소송을 제기했지만 지난해 12월 패소했다. B씨는 이 판결에 불복해 현재 항소한 상태다. 문제는 A어린이집이 사상지역에서 유일한 장애인 보육 전문 기관이라는 점이다. A어린이집이 예정대로 문을 닫을 경우 원생인 장애 아동 32명은 당장 갈 곳을 잃게 된다. 사상구는 지난해부터 원생들의 보육을 위한 대책 마련에 나섰지만, 폐쇄를 불과 한 달가량 앞둔 지금까지 뚜렷한 대책을 찾지 못하고 있다.부산 사상구는 유일한 장애아 전문 어린이집이 계속 운영할 수 있도록 기부채납과 처분 명령 연장 등 대책을 고심하고 있다. 부산 사상구청 제공구청은 먼저 A어린이집을 소유·운영하는 법인으로부터 건물을 기부채납 받아 어린이집을 계속 운영하는 방안을 적극적으로 추진하고 있다. 하지만 현재 A어린이집 건물에 근저당이 설정된 상태라, 이마저도 규정에 맞지 않다는 지적이 나온다. 현행 공유재산법에 따르면 사권이 설정된 건물은 기부채납이 불가능하다. 이에 구청은 근저당권 수천만원을 구 예산으로 해소해서라도 기부채납을 받겠다며 의지를 보이고 있다. 또 기부채납의 형식을 빌리지만 지자체가 건축 보조금을 지원했기 때문에 이를 '반납'받는 개념이라며 문제가 없다는 입장을 보이고 있다.이런 계획에도 불구하고 현재 상황에서 시설을 기부채납 받는 행위에는 문제의 소지가 있다는 해석이 많아 난항이 예상된다. 특히 부산시는 A어린이집을 운영하는 법인이 해산하지 않고 운영권을 계속 소유한 상황에서 기부채납을 받는 것은 적절하지 않다며 부정적인 입장을 고수하고 있다. 또 국비와 시비, 구비가 모두 투입되는 기관인 만큼, 기부채납을 위한 절차도 매우 복잡하다는 게 부산시 설명이다. 부산시 관계자는 ""국가 보조금이 50% 투입된 만큼 먼저 건물의 사용 용도를 변경하는데 보건복지부의 승인이 선행되어야 한다""며 ""이후 법인 해산 절차를 거치고 재산 처분을 검토해야 하는데, 적법한 목적과 절차의 기부채납이 가능할지 판단은 또 다른 문제""라고 설명했다. 사상구청은 폐쇄 기한인 2월 말까지 문제 해결이 어려울 것으로 보고 어린이집 폐쇄 명령 처분 기한을 1년 더 연장하는 방안도 고려하고 있다. 뾰족한 대책이 나오지 않을 경우에는 폐쇄 처분 명령을 취소해 우선 어린이집을 계속 운영할 수 있도록 하겠다는 입장도 밝혔다. 조병길 사상구청장은 ""장애아동들의 특수성을 고려해서 보육사업이 계속될 수 있도록 해야 한다""며 ""정해진 행정 절차와 규정대로만 처리할 문제가 아니라 실질적으로 도움이 되는 해법을 찾기 위해 폭넓게 생각해야 할 것""이라고 말했다.※CBS노컷뉴스는 여러분의 제보로 함께 세상을 바꿉니다. 각종 비리와 부당대우, 사건사고와 미담 등 모든 얘깃거리를 알려주세요.이메일 : jebo@cbs.co.kr카카오톡 : @노컷뉴스사이트 : https://url.kr/b71afn"
2023.01.26.,"울산시, 청년정책 계획 수립…5개 분야에 899억 원 투입",https://n.news.naver.com/mnews/article/079/0003730817?sid=102,"울산시청. 이상록 기자울산시는 올해 청년정책 시행계획을 세우고, 사업비 899억 원을 투입한다고 26일 밝혔다.청년정책 시행계획은 '청년 울산, 열정과 도전이 넘치는 도시'를 비전으로 일자리, 주거, 교육, 복지·문화, 참여·권리 등 5개 분야, 75개 세부사업으로 구성됐다.사업비는 총 899억 원이 투입된다.분야별 사업을 보면 일자리 분야는 청년인턴 채용사업 등 20개 사업에 120억 원, 주거 분야는 태화동 청년희망주택 건립사업 등 11개 사업 323억 원이 투입된다.교육 분야는 직업교육혁신지구 지원사업 등 13개 사업 360억 원, 복지·문화 분야는 울산글로벌게임센터 운영 등 18개 사업 90억 원, 참여·권리 분야는 청년거점공간운영 등 13개 사업 6억 원 등으로 구성됐다.한편 시는 이날 오후 시청에서 '2023년 제1회 청년정책조정위원회'를 개최한다.위원회는 올해 울산시 청년정책 시행계획과 청년 위촉대상 위원회 선정 등 2개 사업 안건을 심의하고, 청년정책에 대한 다양한 의견을 수렴한다.울산시 관계자는 ""청년의 시정 참여를 확대하고, 이를 통해 시정 전반에 청년의 시각을 적극 반영하겠다""며 ""열정과 도전이 넘치는 청년 울산을 육성하는데 행정력을 집중하겠다""고 말했다.※CBS노컷뉴스는 여러분의 제보로 함께 세상을 바꿉니다. 각종 비리와 부당대우, 사건사고와 미담 등 모든 얘깃거리를 알려주세요.이메일 : jebo@cbs.co.kr카카오톡 : @노컷뉴스사이트 : https://url.kr/b71afn"
2023.01.26.,한국가스공사 신입직원 61명 채용,https://n.news.naver.com/mnews/article/079/0003730790?sid=102,"가스공사 제공한국가스공사가 신입 직원 61명을 채용했다.이들은 본사와 사업소에 배치돼 3개월간 수습 과정을 거친다.최연혜 가스공사 사장은 25일 본사 국제회의장에서 연 임용식에서 ""국가적 사명을 완수한다는 자부심과 열정을 가지고 가스공사에 희망을 주는 인재로 성장해 나가길 응원한다""고 말했다.한편 가스공사는 2014년 본사를 대구로 이전한 후 '지역 인재 목표제'를 최대 수준인 30%로 유지하고 있다.또 2020년 이후 취업 지원 대상자, 북한 이탈 주민, 다문화 가족 등에 대해 우대 점수를 부여하는 등 열린 채용 정책을 지속하고 있다.※CBS노컷뉴스는 여러분의 제보로 함께 세상을 바꿉니다. 각종 비리와 부당대우, 사건사고와 미담 등 모든 얘깃거리를 알려주세요.이메일 : jebo@cbs.co.kr카카오톡 : @노컷뉴스사이트 : https://url.kr/b71afn"
2023.01.26.,"'존경받는 공무원' 이병진 부산시 부시장, 28년 공직생활 마무리",https://n.news.naver.com/mnews/article/079/0003731158?sid=102,"핵심요약베스트 공무원 3번 뽑힌 부산시 공무원 대표 얼굴26일 명예퇴직 행사로 28년 공직 생활 매듭이병진 행정부시장. 부산시 제공 ""가장 어려울 때 시민들의 응원이 가장 큰 위로와 힘이 됐습니다. 이제 한 시민으로 돌아가 지역 사회에서 필요한 일을 하겠습니다""부산시 공무원들로부터 역대 가장 존경받는 공무원 중 한명으로 꼽히는 이병진(59) 부산시 행정부시장이 26일, 28년간 공직 생활을 마무리하고 명예퇴직한다.당초 그는 공무원의 한 사람일 뿐이라고 퇴임식을 별도로 열지 말아 달라고 당부했지만, 박형준 부산시장이 ""퇴임식도 의미가 있으니 꼭 열자""고 제안해 직원들과 마지막으로 만났다.이 부시장은 부산동고와 부산대 불어불문학과를 졸업하고 1995년 지방고시 1기로 공직에 입문했다.이후 부산시 유시티정보담당관 국제협력과장, 예산담당관, 대변인, 문화관광국장, 기획조정실장 등 주요 보직을 거쳤다.2021년 1월 행정부시장으로 임명돼 2년간 시의 행정 업무 전반을 관장하고 조율하는 등 조직을 안정적으로 이끌었다는 평가를 받고 있다.이 부시장은 오거돈 전 부산시장이 여성공무원 성추문 사태로 갑작스레 사퇴하자 100일간 시장 직무대행을 맡았다.박형준 시장이 지방선거 출마를 위해 자리를 비웠을 때도 한 달간 시장 직무대행을 맡는 등 2차례 시장 대행을 지내는 기록을 세웠다.이병진 행정부시장. 부산시 제공 그는 부산시 하위직 공무원 여론의 바로미터라고 할 수 있는 '베스트 공무원'에 3번이나 선출돼 명예의 전당에 오르는 등 '가장 함께 일하고 싶은 상사'로 꼽힌다.시 전반의 업무와 사정에 밝아 사업 추진과 조율, 위기관리에 능하다는 평가를 받았고 외유내강, 온화한 성품으로 시 안팎에서 큰 신뢰를 얻어왔다.또, 이 부시장은 부산시 청렴공무원의 상징이기도 하다. 행정부시장 임명을 앞두고 정부의 고위공직자 신원조회 때 조회할 재산이 많지 않아 역대급으로 빨리 끝났다는 일화는 유명하다.그는 퇴임 전 기자들과 만난 자리에서 ""28년간 공직생활이 마무리된다고 생각하니 감회가 새롭다""며 ""우여곡절이 많았지만, 직원들이 잘 따라주고, 어려울 때 시민들이 큰 힘이 됐다""고 말했다.공직 생활 중 가장 기억에 남는 일로 이 부시장은 시장 권한대행 당시 가덕신공항 특별법이 통과된 일을 꼽았다.이 부시장은 ""당시 문재인 대통령에게 가덕신공항 특별법 통과 필요성과 2030세계박람회 부산 유치의 중요성 등 두가지에 대해 선상 브리핑을 가졌다. 부산의 절박함이 전달됐고, 지금 큰 무리 없이 정부 주도로 진행되고 있어 다행이라고 생각한다""고 말했다.이어 그는 ""행정부시장에 부임하자마자 코로나19 대유행이 시작돼 임기의 절반을 민방위복을 입고 지냈다""며 ""시민들의 이해와 협조로 전국 시도 중 부산시가 코로나19에 가장 잘 대응했다고 자평한다""고 시민들에게 고마움을 전했다.이 부시장의 퇴임은 부산시를 지탱하는 하나의 큰 대들보가 사라진 것과 마찬가지라며 후배 공무원들이 아쉬움을 표하고 있는 상황.  이 부시장은 후배들에게 '지속적인 소통'을 당부했다.그는 ""공무원들은 칸막이를 없애고 소통하는게 제일 중요하다""며 ""소통과 공감으로 시작하고, 서로 이해해야 존중과 신뢰가 생긴다는 점을 생각했으면 좋겠다""고 말했다.이병진 행정부시장. 부산시 제공 이 부시장은 기획조정실장으로 지낸 2년 간을 공직 생활 중 가장 힘든 시기로 회상하며, 이제 다 털고 갈 수 있어 다행이라고 말하기도 했다.이 부시장은 ""매일 일반직 공무원들이 퇴임하고 있고, 나라고 특별한 퇴임을 하는 건 아니다""라며 ""퇴임식이 공직에서 열심히 일하고 퇴임하는 모든 공무원을 대신해 열어주는 것이라고 생각한다""고 겸손한 모습을 보였다.또, ""올해는 2030세계박람회 개최지가 결정되는 중요한 해인 만큼, 직원들에게 한마음으로 힘을 합치자고 말하고 싶다""며 ""이제 일반 시민으로 돌아가 지역사회에 필요한 역할이 있으면 무엇이든 하겠다""고 말했다.그동안 두 자녀의 입학식과 졸업식을 단 한 번도 참석하지 못했다는 그는 다음달 큰 딸의 대학 졸업식에 처음으로 참석하고, 가족들과 여행도 다녀올 것이라며 가족들에게 미안한 마음을 전하기도 했다.이 부시장은 당분간 휴식을 취한 뒤 부산지역 대학 강단에 올라 자신의 행정경험을 지역 청년들과 공유할 예정이다.※CBS노컷뉴스는 여러분의 제보로 함께 세상을 바꿉니다. 각종 비리와 부당대우, 사건사고와 미담 등 모든 얘깃거리를 알려주세요.이메일 : jebo@cbs.co.kr카카오톡 : @노컷뉴스사이트 : https://url.kr/b71afn"
2023.01.26.,"LB인베스트먼트, 증권신고서 제출…코스닥 상장 절차 돌입",url없음,<네이버 기사 없음>
2023.01.26.,"'벤투의 추천' 수비수 박지수, 포르투갈 포르티모넨스 이적",https://sports.news.naver.com/news.nhn?oid=079&aid=0003730762,<구조 다름>
2023.01.26.,"이마트24, 점주들의 ‘나만의 레시피’로 ‘히트상품’ 만든다",https://n.news.naver.com/mnews/article/016/0002094909?sid=101,"가맹점주 대상 ‘딜리셔스 레시피 콘테스트’이마트24는 슬로건 ‘딜리셔스 아이디어’ 구체화의 일환으로 가맹점 경영주 대상으로 ‘딜리셔스 레시피 콘테스트’를 진행한다. [이마트24 제공][헤럴드경제=신주희 기자] 이마트24가 가맹점주들과 함께 편의점 히트 상품 개발을 위해 머리를 맞댄다.이마트24는 슬로건 ‘딜리셔스 아이디어’ 구체화의 일환으로 가맹점 경영주 대상으로 ‘딜리셔스 레시피 콘테스트’를 진행한다고 26일 밝혔다.이마트24 가맹점 경영주라면 누구나 참여할 수 있으며, 자신만의 요리 레시피를 응모한 경영주 모두에게 참가상부터 100만원까지 상금이 지급된다.특히, 1등부터 3등에 선발된 레시피는 상금(1등 100만원·2등 60만원·3등 40만원)과 함께 실제 상품으로 출시될 계획이며, 출시된 상품의 매출에 따른 로열티(최대 1억원)를 해당 경영주에게 제공할 예정이다.이번 레시피 콘테스트에는 각 가맹점당 1회 참여 가능하며, 참여를 원하는 경영주는 카카오톡 ‘이마트24 레시피 콘테스트 챗봇’ 추가 후, 이달 말일(31일 밤 12시)까지 레시피 내용과 실제 음식 사진을 챗봇에 업로드 하면 응모가 완료된다.경영주들이 응모한 레시피는 본사 임직원들의 투표를 통해 본선에 진출 할 레시피가 선정되고, 2월 중순께, 지역 사무소별로 선발된 2~6개점의 경영주들이 직접 만든 요리를 지역사무소 임직원들이 블라인드 현장 평가를 진행한 후 최종 3개의 레시피를 결정하는 방식이다.최종 결선에 오른 3개의 레시피는 전국 경영주들의 투표를 통해 1~3등까지 정해지며, 해당 경영주에게는 상금이 제공된다. 1~3등으로 선정된 레시피로 만든 상품은 상반기 중 출시 예정이다.이마트24는 맛있는 상품과 기분 좋은 서비스를 제공하겠다는 ‘딜리셔스 아이디어’의 가치를 경영주와 공감하고, 상품 개발에 직접 참여하는 활동을 통해 본사 임직원들과 소통하는 기회를 마련하기 위해 이번 레시피 콘테스트를 기획하게 됐다.이마트24는 경영주들이 점포를 운영하면서 ‘고객들이 많이 찾았던 상품’ 이나 ‘이런 상품이 있으면 좋겠다’ 등 고객 접점에서 얻은 아이디어와 개인의 요리 노하우가 상품으로까지 출시 될 수 있는 좋은 기회가 될 것으로 기대하고 있다.최은용 이마트24 MD담당 상무는 “이번 레시피 콘테스트를 통해 경영주들은 자신의 아이디어로 상품 개발에 적극 참여할 수 있고, 본사는 고객과 현장의 목소리를 상품에 반영할 수 있는 계기가 될 것이다”며 “이번 콘테스트를 통해 스토리가 있는 차별화된 상품이 출시될 수 있을 것으로 기대하고 있다”고 했다."
