기사날짜,기사제목,네이버 뉴스 url,기사내용
2023.01.10.,"하동군, '귀농·귀촌 메카 만들기' 팔 걷었다",https://n.news.naver.com/mnews/article/001/0013691217?sid=102,"귀농·귀촌인 안정 정착 지원사업·예산 확대하동군, 귀농·귀촌 지원사업 확대[하동군 제공. 재판매 및 DB 금지](하동=연합뉴스) 지성호 기자 = 경남 하동군이 귀농·귀촌 사업을 대폭 늘리고 귀농·귀촌인 안정정착을 위해 다양한 맞춤형 시책을 편다고 10일 밝혔다.     이를 위해 하동군은 원주민과 귀농·귀촌인의 화합을 위한 '귀농인 주민초청행사지원' 사업, 귀농인 주거 안정을 위한 '귀농인 주택수리비 지원사업', 농촌 빈집을 활용한 '귀농인의 집 조성사업' 등을 추진한다.    특히 하동군은 지방소멸대응기금으로 귀농인 주택수리비 지원사업과 귀농인의 집 조성사업을 작년 대비 각각 15개 이상 확대한다.    귀농·귀촌인에게 영농기술 및 경영·마케팅 창업 등에 필요한 단계별 실습교육 기회를 제공하는 귀농·귀촌 사관학교 운영, 귀농 초기 농촌 현장에서 겪는 다양한 애로사항을 해결하도록 도와주는 1대 1 밀착관리 귀농헬퍼 사업 등 새로운 시책도 벌인다.    귀농·귀촌 홍보 활성화를 위해 통합플랫폼 구축을 위한 홈페이지 개편, 슬기로운 농촌 생활을 담은 가이드북 제작, 귀농·귀촌 지원센터 카카오톡 채널 운영 등을 통해 도시민 유치에 더욱 박차를 가할 계획이다.    하동군은 오는 13일까지 13개 읍·면사무소 또는 귀농·귀촌 지원센터에서 귀농인 주택수리비 지원사업 등 7개 사업에 대한 신청을 받는다.    하승철 하동군수는 ""지역소멸 위기를 극복해 지속가능한 발전을 위해 더 많은 귀농·귀촌인이 인생 2막을 펼칠 수 있는 '귀농·귀촌의 메카' 하동이 될 수 있도록 지원을 아끼지 않겠다""고 말했다.    shchi@yna.co.kr"
2023.01.10.,"운동계도, 연예계도…'검은 손 유혹' 병역비리, 뇌전증이 뭐길래",https://n.news.naver.com/mnews/article/018/0005403720?sid=102,"'뇌전증' 발작 증세 등 증상 파악 어려워환자·보호자 설명에 의한 진단 대부분병역면탈 중 정신질환위장 4년간 증가""처벌 솜방망이…복무기간 연장 등 수위 높여야""[이데일리 조민정 기자] ‘병역의 신’을 자처한 브로커가 최소 수십여 명의 병역 문제를 해결하는 데 쓴 ‘묘안’은 뇌전증 악용이었다. 이름도 생소한 뇌전증은 과거 ‘간질’로 불렸던 정신질환이다. 갑자기 정신을 잃고 일정 기간 발작 증세를 보이는 질환으로 증상을 진단하기 힘들다는 특성이 있다. 질병 이름인 간질이 속된 말로 ‘지랄병’으로 불리며 비속어로 사용되자 낙인찍기 행태를 지우기 위해 용어를 바꿔 사용한 것이다. ‘병역의 신’으로 불리는 병역브로커 구씨와 계약을 맺은 고객이 후기를 남긴 카카오톡 대화 내용.(사진=병역브로커 구씨 블로그 캡처)뇌전증은 유전적 요인보다 뇌 손상 등 후천적 요인으로 발생한다. 단순히 반짝거리는 오락을 하다가 뇌에 시각적 자극이 가해지면서 갑자기 발작 증세가 나타나는 등 원인도 다양하다. 다른 질환과 달리 수치를 측정하거나 직접 증상을 눈으로 보기 힘들다는 점에서 주로 환자와 보호자의 증상 설명을 기반으로 진단이 이뤄진다.병역 브로커들은 이러한 정신질환 특성을 병역면탈 수법으로 악용했다. 10일 법조계에 따르면 지난달 21일 재판에 넘겨진 병역 브로커 구씨는 인터넷에서 ‘병역의 신’으로 활동하며 자신을 홍보해왔다. 서울 강남구에 사무실을 차린 그는 고객들에게 병원에서 뇌전증 등 정신질환 허위 진단서를 발급받는 방법을 알려주고 건당 수천만 원을 건네받은 것으로 나타났다. 그의 행정사 사무소 블로그엔 “가족 군 문제가 해결됐습니다. 병역판정 최고의 신입니다” 등 실제로 계약을 맺은 고객의 후기도 올라와 있었다.검찰 수사망은 프로배구 OK금융그룹 소속 조재성(28)을 비롯해 축구, 승마, 볼링 등 스포츠 선수들 외에도 래퍼, 헬스트레이너, 의사, 법조인 등 고위공직자 자녀까지 뻗어가고 있다. 이번 검찰 수사를 계기로 병역면탈 범죄가 무더기로 드러났을 뿐, 정신질환을 이용해 병역을 기피한 사례는 2018년부터 꾸준히 증가했다. 병무청의 2021년 통계연보에 따르면 특별사법경찰 병역면탈 적발 유형 중 ‘정신질환위장’은 △2018년 7건(10.14%) △2019년 11건(14.66%) △2020년 26건(37.68%) △2021년 60건(48.33%)으로 증가세다. 그러나 2021년 병역면탈로 적발된 60건 중 징역형은 0건, 집행유예는 7건에 그쳐 처벌은 미미했다.전문가들은 병역면탈 범죄가 계속되는 데엔 솜방망이 처벌도 한몫하고 있다고 지적했다. 임현택 대한소아청소년과의사회장은 “뇌전증 특성상 환자가 발작 증세가 있었다고 하면 환자의 이야기를 믿어야 하는 의사 입장에선 병역면탈 목적이라고 의심하기 쉽지 않다”며 “병역면탈 범죄는 잊을만하면 터지는데, (병역기피자들의) 복무 기간을 연장하거나 최전방으로 배치하는 등 범죄자 처벌을 강화할 법 개정을 국회가 방관해왔다는 증거”라고 꼬집었다."
2023.01.10.,전 남편 가게서 불 지르려 한 40대 여성 붙잡혀,https://n.news.naver.com/mnews/article/079/0003726032?sid=102,"청주상당경찰서 제공전 남편의 가게에 불을 지르려 한 40대 여성이 경찰에 붙잡혔다. 충북 청주상당경찰서는 A(40대·여)씨를 현주건조물방화 예비 혐의로 붙잡아 조사하고 있다고 10일 밝혔다. A씨는 지난 8일 새벽 3시 20분쯤 청주시 서원구 분평동 전 남편 B씨가 운영하는 가게에 찾아가 휘발유를 뿌려 불을 지르려 한 혐의를 받고 있다. B씨가 A씨를 막아 불이 붙지는 않았다. A씨는 이전에도 B씨의 가게에서 소동을 벌인 적이 있는 것으로 전해졌다. 경찰은 정확한 사건 경위를 조사하는 한편 A씨에 대해 구속영장을 신청했다. ※CBS노컷뉴스는 여러분의 제보로 함께 세상을 바꿉니다. 각종 비리와 부당대우, 사건사고와 미담 등 모든 얘깃거리를 알려주세요.이메일 : jebo@cbs.co.kr카카오톡 : @노컷뉴스사이트 : https://url.kr/b71afn"
2023.01.10.,"최정원, 불륜의혹 반박 “일방적 주장…오히려 협박당해”",https://n.news.naver.com/mnews/article/144/0000860467?sid=106,<구조 다름>
2023.01.10.,"'K패션 리더' 김창수 F&F 대표, '글로벌 K팝 스타 육성' 도전나선 까닭",https://n.news.naver.com/mnews/article/003/0011635993?sid=101,"기사내용 요약F&F, 콘텐츠 사업 새로운 먹거리로 낙점...F&F 엔터테인먼트 설립MLB 등 글로벌 브랜드 육성 노하우, 엔터 사업에 접목 예정[서울=뉴시스]에프앤에프(F&F) 김창수 대표이사[서울=뉴시스]박미선 기자 = K패션의 세계화를 선도해 온 것으로 평가 받는 김창수 F&F 대표가 패션을 넘어 콘텐츠 사업을 새로운 먹거리로 본격 낙점해 배경에 관심이 쏠린다.10일 패션 업계에 따르면 F&F는 글로벌 K팝 스타를 육성하기 위해 ‘F&F 엔터테인먼트’를 설립했다. 지난해부터 엔터테인먼트 사업 구상을 구체화한 F&F는 K팝 분야 전문가인 기획형 프로듀서 겸 작곡가 최재우 씨를 법인 대표로 선임했다.그간 패션업계는 'FW(가을·겨울) 장사'라고 할 만큼 사계절 매출이 고르지 못하고, 고물가·고금리 속 경기 영향을 많이 받는 탓에 꾸준한 매출을 올릴 수 있는 신사업 진출에 활발했다. 대표적인 것이 패션과 유통망·소비자가 상당 부분 겹치는 화장품이다. 신세계인터내셔날·한섬·LF 등은 일찌감치 미래 먹거리로 화장품 사업을 택해 활발히 전개 중이다.MLB·디스커버리 등 라이선스 패션 사업을 중심으로 전개하는 F&F는 기존 사업 분야에서 접근하기 편한 신사업보다 '콘텐츠'를 선택해 눈길을 끈다. 김 대표는 김봉규 삼성출판사 창업주의 차남으로 그동안에도 문화 콘텐츠 사업에 대한 관심이 높았다는 평가다.국내 패션 브랜드를 글로벌 브랜드로 육성할 수 있었던 성공 공식을 K팝 아이돌 육성에 그대로 접목시킨다는 계획이다. F&F는 엔터테인먼트 사업에서도 두각을 드러내 종합 라이프스타일 기업으로 도약하겠다는 복안이다.최재우 대표는 카카오엔터테인먼트에서 방송 음원, 드라마 OST 등 다양한 글로벌 음악 콘텐츠 투자 유통을 진행해 온 인물이다.F&F의 이번 신사업은 어느 정도 예고된 수순이라는 평가도 있다. F&F는 웹드라마 제작사 '와이낫 미디어', 애플TV 닥터 브레인의 제작사 '바운드 엔터테인먼트'에 투자하는 등 콘텐츠 사업에 간접적으로 참여해 왔다.여기서 나아가 지난해 3월에는 드라마 제작사 ‘빅토리 콘텐츠’의 지분 50.77%를 사들여 사업 영역을 확장했다. F&F 측은 ""엔터테인먼트 사업과 패션뷰티 사업의 연관성이 높다고 보고 꾸준히 관심을 가지고 있었다""며 ""K팝의 붐업과 F&F가 글로벌 브랜드로 인정받기 시작한 시기가 겹치며 F&F의 브랜딩 노하우, 글로벌 유통망에 엔터테인먼트 사업을 접목시키면 큰 시너지를 낼 수 있을 것으로 보고 사업을 추진한 것""이라고 말했다. F&F는 패션 업체지만, 디지털 전환으로 브랜드를 육성한 경험이 있는 만큼 이 성공 공식을 K팝 스타 육성에 접목시킨다는 계획이다. 앞서 김 회장은 2017년 '롱패딩'이 실시간 검색어에 오르자 디스커버리의 롱패딩 제품 판매가 급격히 증가하는 것을 보고 일찌감치 디지털 전환에 착수했다.소비자들이 SNS(소셜네트워크서비스), 동영상 플랫폼 등 다양한 디지털 매체의 영향을 받아 패션 성향 또한 다양화, 세분화하고 있다는 점에 주목한 것이다. F&F는 상품기획, 생산, 물류, 디자인, 마케팅 등 패션 사업 전 과정을 디지털로 전환하고 소비자 커뮤니케이션부터 공장 커뮤니케이션까지 모든 데이터가 파이프라인처럼 연결돼 함께 공유하는 구조다. 디지털 전환으로 수요를 예측하고 재고를 관리해 선순환 수익 구조를 만든 결과, F&F의 대표 브랜드인 MLB는 중국 등 해외 판매액 1조원을 넘어섰다. 국내 패션기업이 단일 브랜드로 해외 판매액 1조원을 넘어선 것은 이번이 처음이다. 국내 중심으로 전개하는 디스커버리 역시 지난해 5000억 이상의 매출을 올린 것으로 추정된다. F&F는 이처럼 패션에서 쌓은 브랜드 육성 전략, 마케팅 노하우를 K팝 산업에 접목시켜 세계적인 영향력을 가진 스타로 만든다는 계획이다. 장기적으로 아이돌 음악에 한정되지 않는 다양한 장르의 아티스트로 육성할 방침이다.F&F엔터테인먼트 첫 프로젝트는 대형 글로벌 오디션이다. 세계 각국에서 K팝 스타를 꿈꾸는 우수한 지원자를 받아, 대중의 투표를 기반으로 최종 데뷔그룹을 선정하는 K팝 걸그룹 선발 프로젝트다. 오디션은 지상파 방송과 함께 올해 하반기 진행될 예정이다."
2023.01.10.,"금융위 '손태승 중징계' 의사록…위원들, CEO 책임 '공감대'",https://n.news.naver.com/mnews/article/079/0003726073?sid=101,"라임펀드 환매 중단 관련 중징계 의사록 공개일부 수정 의견·법률적 우려 표명 있었지만반대 없이 '원안 의결'손태승 우리금융지주 회장,. 박종민 기자금융위원회가 라임자산운용 사모펀드 환매 중단 사태와 관련해 손태승 우리금융지주 회장에 '문책경고' 상당의 중징계 결정을 내릴 당시 대규모 투자자 피해가 발생한 사안인 만큼 최고경영자(CEO)가 책임을 져야 한다는 금융위원들의 공감대가 있었던 것으로 나타났다. 의결 과정에서 일부 수정 제안과 법률적 우려 표명이 있긴 했지만, 중징계 결정에 대한 명확한 반대 의견은 없었던 것으로 파악됐다. 10일 공개된 제 20차 금융위원회 정례회의(작년 11월 9일) 의사록을 보면 금융위는 해당 회의에서 우리은행 부문 검사 결과 조치안을 상정해 손 회장에 대해 문책경고 상당의 중징계 결정을 내렸다. 또 불완전판매에 대한 제재에 따라 우리은행의 사모펀드 신규판매를 3개월 간 정지(업무 일부정지)하기로 했다. 원안대로 의결된 것이다. 앞서 2009년 10월 판매 중단된 라임펀드는 코스닥 기업들의 전환사채 등 편법 거래를 통해 수익률을 관리했다. 이 과정에서 운용하던 펀드에 들어있던 주식 가격이 폭락해 환매 중단이 벌어지면서 1조 6천억 원의 피해액이 발생했다. 우리은행의 라임펀드 판매액은 3577억원으로 은행권 가운데 가장 많았다. 금융감독원. 연합뉴스중징계 의결 과정상 발언을 살펴보면, 한 금융위원은 ""사모펀드 사태가 매우 심각했고 여전히 지금도 엄중한 상황""이라며 ""금융감독원의 안에 대해 변경할 만한 특별한 법률적인 이유나 사정을 찾기 어렵기 때문에 원안에 동의한다는 말씀을 드리고 싶다""고 했다. 다른 위원도 ""대규모 투자자 피해 발생 이후 금융감독 당국에 의한 검사 제재 이전에 우리은행 차원의 내부 감사, 이사회나 주주총회를 통한 자체 책임규명이나 처벌이 충분히 이뤄지지 않았다는 점도 감안해야 된다고 생각한다""고 힘을 실었다. 또 다른 위원은 법률적 우려가 있다는 점을 짚으면서도 손 회장 징계에 대해선 찬성 취지의 의견을 냈다. 이 위원은 ""자본시장법 제 49조가 부당권유에 대한 조항인데, 입법취지상 부작위를 규율하는 것에 대해 의문이 있고 이에 대한 판례나 행정제재 선례, 학설 등이 없는 상태""라고 언급했다.  다만 그는 ""사회적 파장도 굉장히 컸고 매우 조직적이고 반복적으로 일어난 사안""이라며 CEO 제재에 찬성했다. 해당 위원은 ""향후 불완전판매와 관련해 (이번 제재가) 굉장히 좋은 선례가 될 것이고, 앞으로는 CEO들도 제재를 하는 것이 맞다""고 밝혔다. 다른 금융위원은 ""(이번 사안과 관련해) B금융회사보다 (우리은행)이 더 위험했다고 판단하는 것은 아닌 것 같다. 우리은행은 최소한 리스크를 파악하기 위해 많은 노력을 했고 그것이 문서로 남았다. B금융회사는 문서가 없었다""며 ""사안의 성격과 사건의 특징상 행장에 대해서는 문책경고 아니면 주의경고로 가야 되는 것 아니냐는 판단을 한다""고 말하기도 했다. 수정 제안을 한 것이지만, 다수 의견을 반영한 원안 의결 과정에서 반대 의사를 표명하진 않았다.※CBS노컷뉴스는 여러분의 제보로 함께 세상을 바꿉니다. 각종 비리와 부당대우, 사건사고와 미담 등 모든 얘깃거리를 알려주세요.이메일 : jebo@cbs.co.kr카카오톡 : @노컷뉴스사이트 : https://url.kr/b71afn"
2023.01.10.,美 긴축 효과 '솔솔'…한은 이번주 '금리 동결'이냐 '베이비스텝'이냐,https://n.news.naver.com/mnews/article/079/0003725648?sid=101,"현재 연 3.25%, 최종금리 수준 3.5% 제시했지만미국발 대외변수 여전…한미금리 격차 확대에 한국은행도 부담부동산 규제 완화 맞춰 금리인상 속도 조절할까?시장은 0.25%포인트 인상 가능성에 무게이창용 한국은행 총재가 지난해 11월 서울 중구 한국은행에서 열린 금융통화위원회 본회의에 참석하고 있다. 사진공동취재단올해 들어 첫 번째 금융통화위원회(금통위) 정례회의가 이번주 13일 열린다.현재의 물가상승세를 감안하면 기준금리를 0.25%포인트 추가로 올리는 '베이비스텝' 전망이 우세하다.하지만 금융시장 불안정과 부동산 시장 냉각, 기업들의 실적 부진 등 경기 침체 징후가 곳곳에서 나타나면서 금리 동결을 통한 '한숨 돌리기' 가능성도 조심스레 제기된다.한은의 고민은 이번 달에도 계속된다지난 2021년 8월부터 오르기 시작한 기준금리가 올해 첫 금통위를 기점으로 상승세를 멈출지에 비상한 관심이 쏠린다.현재 기준금리는 연 3.25%. 2020년 5월부터 2021년 7월까지 연 0.50% 수준이었던 기준금리는 같은 해 8월부터 오르기 시작해 지난해 11월까지 총 9차례에 걸쳐 2.75%포인트나 훌쩍 뛰었다.물가상승 압력을 제거하기 위한 한국은행의 공격적인 기준금리 인상에 따라 시중금리도 크게 올라 최근 은행권의 주택담보대출 변동금리 상단은 연 8%를 넘어섰다.우리나라의 경우 부동산에서 파생된 가계대출 비중이 상대적으로 높다는 점에서 급격한 시중금리 인상은 대출 부실과 금융 안정성에 큰 위협이 된다.이에 따라 기준금리를 마냥 올릴 수 만은 없다는 게 한은의 고민이다.쉬지 않고 달려온 기준금리, 부동산 규제완화 맞춰 동결할까?지난해 마지막 금리인상이 단행됐던 11월 금통위 직후 이창용 한은 총재는 최종금리 수준에 대해 많은 금통위원들이 3.5% 수준을 지목했다고 소개했다.올해 첫 금통위에서 0.25%포인트를 인상해 연 3.5% 수준이 되면 사실상 최종금리에 도달한다는 얘기다.하지만 올해 경기침체가 가속화되고 부동산 시장 상황도 심상찮은 만큼, 일부 금통위원이 기준금리 동결 의견을 낼 것이란 전망도 제기된다.최근 정부가 각종 부동산 규제 완화 정책을 쏟아냈기에 1월 금통위에서 기준금리를 동결할 가능성이 크다는 분석이다.하나증권 김상훈 연구원은 과거 주택담보대출비율(LTV) 또는 총부채상환비율(DTI)이 완화된 6차례 상황을 토대로 1월 금퉁위에서 금리 동결 및 인상 소수의견이 나올 가능성이 높다고 예상했다.김 연구원은 ""부동산 정책 기조가 규제에서 완화로 선회한 2008년 6월 이명박 정부의 부동산 대책에 LTV 비율 완화가 포함돼 있었다""며 ""당시 금통위는 만장일치 동결이었다""고 분석했다.시장은 0.25%포인트 '베이비스텝' 예상 우세제롬 파월 미 연준 의장. 연합뉴스반대로 1월 금통위에서 기존에 언급한 최종금리 수준을 맞추기 위해 0.25%포인트를 올린 뒤, 물가상승 압박 상황에 따라 추가로 3.75%까지 올려야 한다는 매파적 의견도 예상된다.당장 시장은 1월 금통위에서 0.25%포인트 '베이비스텝' 가능성을 높게 보고 있다.한미금리 격차에 대한 부담도 한은으로서는 고민이기 때문이다.미국의 기준금리는 현재 연 4.25~4.5% 수준으로 한미금리 상단차가 1.25%포인트까지 벌어진 상태다.미 연준 위원들이 지난해 말 최종금리 수준이 5%를 넘을 수도 있다고 엄포를 놓은 만큼, 긴축기조가 당장 누그러지기도 쉽지 않다.NH투자증권 강승원, 박윤정 연구원은 9일 보고서를 통해 ""추가 인상 가능성을 열어 두겠지만 1월 한국은행 금통위에서 기준금리를 0.25%포인트 인상할 것""이라고 예상했다.두 연구원은 ""12월 물가 상승률이 5%를 기록했고, 한은 총재가 충분히 추가 인상에 대한 메시지를 보낸 만큼, 동결의 실익이 없다""고 강조했다.또 ""한은 총재가 통화정책방향 결정문과 기자회견에서는 과도한 시장 쏠림을 억제하고 기대인플레이션 관리를 위해 추가 금리인상의 여지는 열어 둘 것""이라고 분석했다.한화투자증권 김성수 연구원 역시 ""1월 금통위에서 0.25%포인트 인상과 동결 소수의견을 예상한다""며 ""살얼음판 같은 자금 시장 분위기는 여전하지만, 연초 발행 실적을 보면 고비는 넘어가는 모습이고, 물가는 여전히 높고, 연준은 긴축을 이어나갈 것임을 명확히 한 상황이어서 한은도 연속 인상을 단행할 것""이라고 예상했다.미국 긴축 효과 '솔솔'…시장 오판 경계 나선 연준연합뉴스1월 금통위를 앞두고 미국발(發) 대외 변수는 여전히 진행 중이다.당장 금통위 바로 전날인 12일(현지시간) 예정된 미국의 12월 소비자물가지수(CPI) 발표가 주목된다.이날 발표되는 전년대비 12월 CPI와 전달 대비 근원 CPI가 시장 예상치를 밑돌 경우, 향후 인플레이션 압력이 낮아질 수 있다는 판단에 시장은 미 연방공개시장위원회(FOMC)가 긴축 기조를 완화할 것으로 기대할 수 있다.올해 FOMC 첫 회의에서 동결 가능성은 매우 적지만, 금리인상 폭을 0.25%포인트로 대폭 줄일 수 있을 것이란 기대감도 한미금리 격차 확대를 우려하는 한은 입장에서는 안도할 수 있는 지점이다.이와 함께 지난 6일(현지시간) 나온 미국의 12월 고용보고서에서 임금상승률이 시장의 예상보다 둔화됐다는 소식에 미국의 긴축 효과가 서서히 나타나면서 향후 미 연준의 금리 인상 보폭도 좁아질 것이란 기대도 나왔다.하지만 래피얼 보스틱 미국 애틀랜타연방준비은행 총재는 바로 다음날 ""(미국) 인플레이션이 정점에 달했다고 선언하는 것은 시기상조""라며 금리 인상 지속 필요성을 분명히 했다.리사 쿡 연준 이사는 역시 ""일부 고무적인 신호가 나타났지만 물가상승률이 여전히 너무 높아 걱정거리""라며 시장의 잘못된 판단을 경계하고 나섰다.미 연준 인사들 사이에서는 여전히 높은 기준금리를 유지할 필요성이 더 크다는 메시지로 풀이된다.금융권 관계자는 ""지금 당장 한미금리 격차가 우리 금융시장에 부담이 안된다해도 현재 격차보다 더 벌어지면 투자금 유출 등의 문제가 도드라질 수 있기 때문에 한은 입장에서도 미 연준의 판단을 예의주시하지 않을 수 없다""고 말했다.※CBS노컷뉴스는 여러분의 제보로 함께 세상을 바꿉니다. 각종 비리와 부당대우, 사건사고와 미담 등 모든 얘깃거리를 알려주세요.이메일 : jebo@cbs.co.kr카카오톡 : @노컷뉴스사이트 : https://url.kr/b71afn"
2023.01.10.,"하이트진로 제로슈거 '진로', 오늘 첫 출고",https://n.news.naver.com/mnews/article/079/0003725680?sid=101,"하이트진로의 제로슈거 진로가 10일 이천공장에서 첫 출고를 앞두고 있다. 하이트진로 제공 하이트진로는 경기도 이천공장에서 제로슈거 '진로'를 첫 출고했다고 10일 밝혔다. 진로는 수도권을 시작으로 전국 주요 상권의 업소 및 대형마트, 편의점 등에서 판매될 예정이다.하이트진로는 건강을 중시하는 소비자 트렌드를 반영해 진로를 리뉴얼 출시했다. '제로 슈거' 콘셉트를 적용해 당류를 사용하지 않고 하이트진로의 99년 양조 기술로 진로 본연의 맛을 유지했다. 특히, 깔끔하고 부드러운 목넘김을 한층 강화한 것이 특징이다.하이트진로 마케팅실 오성택 상무는 ""진로는 깔끔한 맛과 젊고 트렌디한 이미지로 출시 이후 소비자들에게 많은 사랑을 받았으며, 두꺼비 캐릭터를 활용, MZ세대들과 소통할 수 있는 다양한 마케팅을 진행했다""며 ""앞으로도 국내 소주 시장을 선도하는 브랜드로 발돋움할 수 있도록 노력하겠다""고 밝혔다.한편, 2019년 4월 출시한 진로는 누적 14억병(지난해 12/26 기준)이 판매되며 국내 대표 소주 브랜드로 성장 중이다. 지난해 1월~11월 누적 판매량은 전년동기 대비 약 5% 증가했다.※CBS노컷뉴스는 여러분의 제보로 함께 세상을 바꿉니다. 각종 비리와 부당대우, 사건사고와 미담 등 모든 얘깃거리를 알려주세요.이메일 : jebo@cbs.co.kr카카오톡 : @노컷뉴스사이트 : https://url.kr/b71afn"
