기사날짜,기사제목,네이버 뉴스 url,기사내용
2023.01.26.,끈끈한 NH證-MBK…오스템임플란트 1조대 인수금융 배경은,https://n.news.naver.com/mnews/article/015/0004803330?sid=101,"공개매수 주선 NH證, 인수금융 전환조건 담보계약인수금융 대출계약에 1조 대출확약서(LOC) 발급이 기사는 01월 25일 10:26 마켓인사이트에 게재된 기사입니다.정영채 NH투자증권 사장.(사진=NH투자증권)사모펀드(PEF) 운용사 연합의 오스템임플란트 경영권 인수에 NH투자증권이 인수금융을 제공하는 우군으로 나선다. 25일 투자은행(IB) 업계에 따르면 NH투자증권은 MBK파트너스와 유니슨캐피탈코리아(UCK)가 추진하는 오스템임플란트 경영권 인수에 인수금융 대출을 확약했다. 이들 연합이 목표한 규모 모두 공개매수에 성공할 경우 1조원 규모 조달을 책임지게 된다.MBK-UCK 연합은 오스템임플란트 지분 확보를 위한 공개매수에 나서있다. 최소 239만4782주에서 최대 1117만7003주를 대상으로 1주당 19만원에 매입하겠다는 입장이다. 이에 따르면 매입규모는 최소 4550억원에서 최대 2조1236억원에 이를 예정이다. 공개매수에 나설 때 대금 전부를 사전에 예치해야 한다는 점에서 금융사 우군 사전 확보는 필수적이었을 것이란 평가다. MBK·유니슨은 펀드 자금 일부를 포함해 주선금융기관 및 대리금융기관인 NH투자증권과 대출과 출자를 포함한 자금조달 확약을 체결해 공개매수 대금을 예치했다. 공개매수 자금 조달을 위한 브릿지론 형태다. 공개매수 자금 총 2조1250억원은 자기자금 4250억원에 더해 1조7000억원은 NH투자증권으로부터 차입으로 조달했다.이를 위해 인수금융 대출계약의 대출확약서(LOC)도 발급받았다. 주식매매계약 자금 총 2조5000억원은 자기자금 1조5000억원에 차입으로 1조원을 끌어올 계획이다. 향후 별도 인수금융 대출 계약서를 체결한 후 주식매매계약 거래 종결 전 차입금을 인출할 예정이다. 한 달 뒤 공개매수 성과에 따라 NH투자증권 인수금융 규모도 조정될 가능성이 있다. NH투자증권은 인수금융 담보로 이들 연합이 소유하게 되는 주식 전체에 대한 1순위 질권을 부여받았다. NH투자증권은 대표적인 국내 대형 바이아웃 펀드 운용사들을 주요 고객으로 삼아 굵직한 M&A 딜에서 인수금융 주선사로 실적을 쌓아왔다. UCK에는 지난 2019년 메디트 인수 당시 600억원을 조달해줬다.MBK파트너스와 정영채 NH투자증권 사장 간의 두터운 친분 관계는 공공연하다. 이들 인연은 2013년으로 거슬러 올라간다. MBK파트너스는 그 전까지 신한금융투자와 하나증권(당시 하나대투증권)과 M&A 딜을 협력했지만 네파와 웅진코웨이 M&A를 계기로 정영채 사장과 연이 닿았다. 당시 우리투자증권 IB부문 대표로 있던 정영채 사장의 적극성과 거래 성과에 김병주 MBK 회장으로부터 큰 신임을 얻었다는 일화가 회자된다. 네파의 경우 기존에 인수금융을 협의했던 곳으로부터 조달이 어려워진 찰나 2대주주와 인수 경쟁까지 발발할 위기에 놓였을 때 대출금 전액 확약서를 써줬고, 웅진코웨이는 당시 윤석금 웅진그룹 회장을 직접 만나 매각을 설득할 정도로 사태 해결에 적극적이었던 것으로 알려졌다.작년엔 결국 좌초했지만 카카오모빌리티 인수를 추진하면서 NH투자증권이 KB증권과 함께 주도해 인수금융을 검토했던 바 있다."
2023.01.26.,"정선군, 어르신 목욕, 이·미용 서비스 확대 지원",url없음,<네이버 기사 없음>
2023.01.26.,공정위 또 빅테크 소환…집중 감시 예고,https://n.news.naver.com/mnews/article/277/0005209566?sid=101,"독점력을 남용하는 빅테크 기업에 대한 공정위의 감시가 강화된다. 빅테크 특유의 문어발식 인수합병에도 제동이 걸린다. 다른 사업자의 진입을 방해하거나, 입점업체를 대상으로 불공정행위를 한 빅테크에 대한 집중 점검도 진행된다. 빅테크 특유의 독점력 남용을 견제하기 위한 ‘맞춤형 입법안’ 마련도 추진된다. 공정위는 올 한해 국내외 빅테크 기업에  대한 면밀한 감시를 예고했다.26일 공정거래위원회는 이같은 내용이 담긴 2023년 주요 업무 추진 계획을 윤석열 대통령에게 보고했다. 한기정 공정거래위원장 취임 이후 지속적으로 부각해온 ‘빅테크 플랫폼 견제’ 의지를 다시 한번 구체화한 것이다.반도체, 앱마켓, 모빌리티, 오픈마켓이 올 한해 공정위의 집중적인 감시대상으로 지목됐다. 해당 시장에서 경쟁사업자 진입을 막고 사업활동을 방해하거나, 자사상품을 우대해 부당하게 지배력을 전이하는 식의 행위를 차단한다는 계획이다. 예를 들어 앱마켓 회사가 앱개발사의 경쟁 앱마켓 출시를 방해하는 행위 등이 집중 감시 대상이 된다. 특히 카카오엔터테인먼트와 같은 콘텐츠 플랫폼의 공정한 거래환경 파괴 행위는 면밀한 감시대상이 된다. 공정위는 웹소설 분야의 2차 저작물(드라마, 게임 등) 작성권 제공 강요, 음악 저작권 시장에서 신규 사업자 진입 방해 등 불공정행위를 적극 감시하기로 했다.빅테크 기업의 인수합병(M&A)에 대한 심사는 강화된다. 시장 혁신을 가로막는 M&A를 막기 위한 취지로, 지배력 확장 우려가 큰 빅테크 기업에 대해서는 면밀한 심사를 진행한다. 또 스타트업 인수를 통해 시장 경쟁을 차단하는 빅테크식 특유의 ‘문어발식 인수합병’ 전략에 대한 실태파악 조사를 진행한 뒤 M&A 신고기준을 보완한다. 아울러 내외부 전문가 TF를 구성해 빅테크의 독점력 남용행위를 ‘맞춤형’으로 견제하기 위한 추가 입법안 마련 여부도 검토하기로 했다.온라인 플랫폼 내에서 발생하는 소비자 기만행위에 대한 집중 점검도 이뤄진다. 트래픽 어뷰징(키워드 집중검색)을 통해 상품 검색 순위를 조작하거나, 게임업체의 ‘확률형 아이템’ 조작 행위 등을 점검한다. 중소 입점업체를 중심으로 발생하는 뒷광고나 이용후기 조작에 대한 점검도 진행될 예정이다. 최근 사기피해가 늘어나고 있는 중고거래, 리셀 플랫폼에 대해서는 판매자 대상 전자상거래법을 적극 집행한다는 계획이다. 아울러 소비자 피해 확산을 사전에 최소화하기 위한 취지로 전자상거래법 개정과 소비자기본법 시행령 개정이 이뤄진다. 모빌리티, 라이브커머스, 구독서비스 등 플랫폼에 대해서는 불공정약관 조항이 집중적으로 점검될 예정이다.또 중소기업과 소상공인의 공정한 거래기반을 강화하기 위해 하도급법 개정을 통해 ‘납품단가 연동제’의 법적 근거를 마련하고 세부기준을 시행령 등을 통해 명확하게 제시하기로 했다. 드라마와 영화 등 콘텐츠, 클라우드와 게임 등 소프트웨어 분야에서 일어나는 불공정 관행에 대한 집중 점검도 이뤄진다. 외식업을 중심으로 가맹점주에 구입강제 행위 등을 집중점검할 계획이다. 또 공정위 현장조사시 조사공문에 법위반 혐의 관련 내용과 조사기간과 범위를 명확하게 기재해 고지하기로 하는 등 사건처리 기준과 절차를 개선한다는 계획이다. 윤수현 부위원장은 “법집행 시스템 개선안은 1년 전부터 추진한 내용으로 최근 화물연대 조사와는 직접적 관련이 없다”고 말했다."
2023.01.26.,"공정위, 연예계·OTT 불공정관행 집중점검…리셀금지 약관 제동",https://n.news.naver.com/mnews/article/001/0013719858?sid=101,"플랫폼 자율규제안 1분기 발표…그린워싱 판단 기준 마련아파트 유지보수비 담합 집중 감시…휴대전화 보조금 상한 확대한기정 공정거래위원장[연합뉴스 자료사진](세종=연합뉴스) 김다혜 기자 = 공정거래위원회가 연예인과 연예기획사 간 불공정 계약, 드라마·영화 콘텐츠 외주 제작 과정에서의 구두계약 관행, 넷플릭스 등 온라인 동영상 서비스(OTT·Over the Top) 사업자의 경쟁 제한·불공정 행위를 집중적으로 점검한다.    한기정 공정거래위원장은 26일 이런 내용을 담은 2023년 주요 업무 추진계획을 윤석열 대통령에 보고했다. 연예·콘텐츠 '갑질', 아파트 유지비 등 민생 담합 집중 감시    공정위는 '원칙이 바로 선 공정한 시장경제'를 조성하기 위해 반도체·플랫폼 등 디지털 시장의 독점력 남용 행위를 제재하고 콘텐츠, 여가·건강 업종을 중심으로 불공정 거래행위를 집중적으로 점검하겠다고 밝혔다.    이승기 사태로 불거진 연예인과 연예기획사 간 불공정 거래 관행에 대해서는 문화체육관광부가 주관하는 실태조사, 표준계약서 작성에 협조하고 불공정 계약 강요 행위 등을 적발해 제재할 방침이다.    OTT 시장 거래구조 등에 대한 실태조사를 통해 OTT 사업자 간 경쟁 제한, 콘텐츠 제작사 등에 대한 갑질 여부도 살펴본다.    웹소설 2차 저작물 작성권 제공 강요, 음악 저작권 협회 등의 시장 신규 사업자 진입 방해, SNS를 통한 부당한 고객 유인 행위 등도 감시·제재한다.    공정위는 이미 카카오엔터테인먼트가 웹소설 공모전 참가자의 2차 저작물 작성권을 제한한 혐의에 대한 조사를 마치고 심의를 앞두고 있다.    드라마·영화 등 콘텐츠와 광고, 게임·클라우드 등 소프트웨어 업종의 불공정한 용역 하도급 거래 관행도 점검한다.    외주 제작 과정에서의 구두계약, 부당 특약, 검수·대금 지급 지연 등이 주요 점검 대상이다.    공정위 관계자는 ""하도급 계약 사항은 서면으로 교부해야 한다. 구두로 '이런 거 한번 해봐라' 해놓고 퇴짜를 놓는 식의 관행이 만악의 근원이 되고 있다""며 ""콘텐츠 등 서비스 업종은 우리 경제에서 차지하는 비중이 크고, 앞으로 경쟁력을 강화해야 할 분야""라고 말했다.    공정위는 납품단가 연동제의 시장 안착을 유도하고 제조업 뿌리산업의 불공정 하도급 관행도 점검할 예정이다.    레저용품 병행수입 방해, 숙박앱의 불이익한 거래조건 설정, 제약·의료기기 불법 리베이트 등도 집중적으로 감시한다.    에너지, 아파트 유지보수, 가정용품, 통신장비 등 국민 부담으로 직결되는 민생 분야 담합 행위도 주요 감시 대상으로 꼽았다.배우 이승기(서울=연합뉴스) 강민지 기자 = 배우 이승기가 작년 5월 4일 오전 서울 종로구 서울지방국세청에서 열린 2022 국세청 홍보대사 위촉식에 참석해 손인사하고 있다. mjkang@yna.co.kr 휴대전화 유통 경쟁 촉진…플랫폼 자율규제 1분기 도출    경쟁 제한적 규제 개선과 관련해서는 휴대전화(이동통신 단말기)에 대한 대리점·판매점의 추가 지원금을 공시지원금의 15%에서 30%로 늘리는 방안을 추진한다.    방송통신위원회는 재작년 12월 이런 내용을 담은 단말기유통법 개정안을 국회에 제출했으나 논의가 지지부진했는데, 이를 공정위도 측면 지원하겠다는 것이다.    공정위 관계자는 ""보조금 상한 외에도 2014년 단말기유통법 시행 이후 경제 변화를 제도 개선 방안을 전반적으로 살펴볼 계획""이라고 말했다.    농수산물 도매시장법인의 재지정 요건을 법제화하는 방안도 추진한다. 자격 미달인 도매시장 법인이 시장에서 퇴출될 수 있도록 하기 위한 조치다.    오픈마켓·배달앱 분야 플랫폼 자율규제안은 1분기 중으로 도출할 예정이다. 표준입점계약서 마련, 수수료 결정 과정의 투명성 확보, 분쟁조정 기구 설치 등의 내용이 담긴다.    또 반도체, 앱마켓, 모빌리티를 중심으로 독점력 남용행위를 감시하고 기업결합(M&A) 심사기준을 개정해 빅테크의 무분별한 사업 확장을 막는다.    게임, 클라우드 등 4차 산업 M&A는 전후방산업 파급효과와 소비자 후생 등을 종합적으로 고려해 심사할 예정이다.    독과점 규제를 위한 법 제·개정이 필요한지는 내외부 태스크포스(TF)에서 검토한다.공정거래위원회[연합뉴스TV 제공] 그린워싱 방지 지침 만든다…나이키 등 '리셀 금지' 약관 제동    아울러 공정위는 그린워싱(친환경적이지 않은 제품을 친환경적인 것처럼 표시·광고하는 행위)을 방지하기 위해 세부 판단 기준을 마련하기로 했다.    사업자가 '인체 무해', '안전성 입증' 등의 광고에 대해 더 엄밀한 증명 책임을 지도록 표시광고법상 실증 제도 개선 방안을 연내 마련한다.    눈속임 상술(다크패턴), 트래픽 어뷰징(키워드 집중검색)을 통한 상품 검색 순위 조작, 게임 아이템 확률 조작 등 소비자 기만행위도 집중적으로 감시·제재할 예정이다.    샤넬, 에르메스, 나이키 등 유명 브랜드의 '리셀(재판매) 금지' 방침에도 제동을 건다.    공정위 관계자는 ""유명 브랜드 리셀 관련 약관의 불공정성을 점검할 예정""이라며 ""불공정 여부를 예단하고 있는 것은 아니다""라고 말했다.    공정위는 중고거래·리셀 등 개인 간 거래(C2C) 사업자와 함께 자율적인 소비자 피해, 분쟁 해결방안을 마련할 예정이다.    공정위는 올해 조사·정책 부서 분리를 골자로 하는 조직 개편을 단행하고 조사 공문 구체화, 피조사 기업의 자료 반환 청구 절차 도입 등을 골자로 하는 법 집행 시스템 개선 방안을 확정·이행할 예정이다.    moment@yna.co.kr"
2023.01.26.,MS가 12조 투자하는 '초거대 AI'...K-플랫폼도 뛴다,url없음,<네이버 기사 없음>
