기사날짜,기사제목,네이버 뉴스 url,기사내용
2023.01.26.,자동차 2550만대 돌파…친환경차 150만대 넘어섰다,https://n.news.naver.com/mnews/article/079/0003730860?sid=101,"'22년말 기준 국내 자동차 누적 등록대수 2550만3천대제주 인구 1명당 1.02대…경기 0.47대, 부산 0.45대, 서울 0.34대국산차 87.5%, 수입차 12.5%…친환경차 매년 급등하며 6.2% 차지자동차 누적등록현황. 국토교통부 제공국내 자동차 누적등록 대수가 2550만대를 넘어섰다. 국토교통부가 26일 공개한 자동차 등록현황에 따르면 지난해 말 기준 자동차 누적등록 대수는 2550만3천대로 전년 대비 2.4%, 59만2천대 증가했다. 인구 대비로는 한 사람이 자동차 0.5대를 보유한 셈이다. 제주가 인구 1명당 1.02대로 가장 높았고, 경기가 0.47대, 부산이 0.45대, 서울은 0.34대를 기록했다. 차종별로는 전년 대비 승용차가 2.7%, 화물차는 1.8%, 특수차는 9.7% 각각 증가한 반면, 승합차는 3.5%가 줄어들었다. 원산지별로는 국산차가 87.5%, 수입차가 12.5%를 차지한 것으로 나타났다. 수입차 점유율은 2019년 10.2%로 10%대에 진입한 후 2020년 11.0%, 2021년 11.8%로 꾸준히 증가하고 있다. 친환경차 연료별 비중. 국토교통부 제공전기차와 수소차, 하이브리드차와 같은 친환경차는 1년 새 37.2%나 늘어나면서 159만대로 전체의 6.2%를 차지했다. 하이브리드차가 117만대로 전년 대비 28.9%의 증가율을 기록하며 가장 높은 비중을 차지했지만, 증가율은 전기차가 68.4%, 수소차가 52.7%로 더 높은 것으로 나타났다. 휘발유차는 2.6% 증가했지만, 경유차와 LPG차는 각각 1.2%, 2.1% 감소했다. 신규등록은 169만2천대로 지난해의 174만3천대 보다 2.9% 줄어들었다. 국산차는 신규등록이 3.7% 줄어든 반면, 수입차는 0.5% 증가했다. 국토부는 ""전기차 및 수소차 등 친환경차량은 내연기관차 대비 높은 증가세를 기록하고 있다""며 ""시대변화에 부합하는 자동차 정책의 수립·시행이 가능하도록 자동차 등록현황을 세분화해 맞춤형 통계를 지속적으로 제공해 나가겠다""고 말했다.※CBS노컷뉴스는 여러분의 제보로 함께 세상을 바꿉니다. 각종 비리와 부당대우, 사건사고와 미담 등 모든 얘깃거리를 알려주세요.이메일 : jebo@cbs.co.kr카카오톡 : @노컷뉴스사이트 : https://url.kr/b71afn"
2023.01.26.,"尹, 대공수사권 경찰 이관에 ""경찰이 수사 전담? 살필 여지 있다""",https://n.news.naver.com/mnews/article/079/0003731125?sid=100,"핵심요약與 지도부 ""내년 대공수사권 이관 문제 대책 필요…해외에서 北 접촉 많아"" 건의尹 ""국내 경찰이 수사 전담하는 부분 살펴봐야 할 여지 있다""3.8 전당대회에 ""당원 많이 모이는 축제이니 꼭 참석하고 인사"" 나경원 언급은 無연합뉴스윤석열 대통령과 국민의힘 지도부는 26일 대공수사권을 경찰청 국가수사본부에 이관하는 것을 재검토해야 한다는 데 공감대를 모은 것으로 확인됐다.국민의힘 양금희 수석대변인은 이날 윤 대통령과 국민의힘 지도부의 오찬 이후 기자들과 만나 ""저희의 건의사항 중 하나가 대공수사권이 내년에 이관되는 문제에 대해 대책 필요하지 않겠냐는 것""이라며 이같이 밝혔다.양 수석대변인은 ""대공수사는 국내에서만 일어나는 것이 아니고 이번 간첩단 사건에서 보듯 캄보디아 등 해외에 나가 북한과 접촉이 이뤄지는 경우 많다""며 ""그러니 해외수사가 같이 이뤄져야하기에 대공수사권 이양에 대한 여러 검토 필요하다는 데 의견을 같이 모았다""고 언급했다.윤석열 대통령도 ""(대공수사는) 해외 수사와 연결돼 있기 때문에 국내에 있는 경찰이 수사를 전담하는 부분에 대해서는 살펴봐야 할 여지가 있다""는 취지의 말을 했다고 양 수석대변인은 전했다.국정원의 대공수사권은 문재인 정부 당시 처리된 국정원법 개정안에 따라 내년 1월 경찰로 이관된다. 하지만 국민의힘은 최근 국정원과 경찰이 이른바 '간첩단' 사건과 관련해 수사범위를 넓히자 국정원의 대공수사권을 유지해야 한다는 목소리를 높이고 있다. 해외에서도 북한 공작원과의 접촉이 있었다는 의혹이 제기된 상황에서 해외 네트워크가 부족한 경찰이 전담할 수는 없다는 것이다. 윤 대통령도 힘을 실어준 것인데, 이관 백지화를 위해서는 국정원법의 재개정이 필요한 상황이다.한편, 윤 대통령은 오는 3월 8일 치러질 국민의힘 전당대회에 참석할 것으로 보인다. 정진석 비상대책위원장이 이날 오찬에서 ""후보가 몇 명 등록할지 모르겠지만 전부 다를 선거를 할 수가 없어 컷오프 제도가 신설됐다""며 ""3·8 전당대회 때 대통령께서 참석해주면 좋겠다""고 요청하자, 윤 대통령은 ""당원들이 많이 모이고 전당대회라는 좋은 축제이니, 가서 꼭 참석하고 인사하겠다""고 말한 것으로 전해졌다.나경원 전 의원과 관련해서는 오찬 자리에서 일절 언급이 없었다고 한다.또 이날 오찬에서는 아랍에미리트 방문 성과와 관련된 내용이 주로 논의됐다고 한다. 양 수석대변인은 ""UAE 대통령이 윤 대통령께 한 이야기가 '300억달러 투자 유치는 이제 시작이다. 앞으로 더 많은 투자를 크게 하겠다'고 말씀하셨다""며 ""현재 용산과 부총리를 중심으로 하는 UAE 투자 관련 TF(태스크포스)를 만들어 진행을 준비하고 있다고 말씀하셨다""고 설명했다.이번 오찬에는 정진석 비상대책위원장과 주호영 원내대표, 성일종 정책위의장, 김석기 사무총장, 양금희 수석대변인, 김미애 원내대변인이 참석했다. 대통령실에서는 김대기 비서실장, 김성한 안보실장, 이진복 정무수석이 함께했다. 윤 대통령과 국민의힘 지도부가 오찬을 가진 것은 이번이 두번째로 오찬 일정은 설 연휴 이전에 확정됐다고 한다.※CBS노컷뉴스는 여러분의 제보로 함께 세상을 바꿉니다. 각종 비리와 부당대우, 사건사고와 미담 등 모든 얘깃거리를 알려주세요.이메일 : jebo@cbs.co.kr카카오톡 : @노컷뉴스사이트 : https://url.kr/b71afn"
2023.01.26.,"이마트24, 경영주 대상 '레시피 경연 대회' 진행",https://n.news.naver.com/mnews/article/003/0011658623?sid=101,"(제공 = 이마트24) 2023.01.26. *재판매 및 DB 금지[서울=뉴시스] 이혜원 기자 = 이마트24는 가맹점 경영주를 대상으로 '딜리셔스 레시피 경연 대회'를 진행한다고 26일 밝혔다. 이마트24의 슬로건 '딜리셔스 아이디어' 구체화의 일환이다. 이마트24 가맹점 경영주라면 누구나 참여할 수 있으며, 자신만의 요리 레시피를 응모한 경영주 모두에게 참가상(1만원)부터 100만원 까지 상금이 지급된다.특히, 1등부터 3등에 선발된 레시피는 상금과 함께 실제 상품으로 출시될 계획이며, 출시된 상품의 매출에 따른 로열티(최대 1억)를 해당 경영주에게 제공할 예정이다.이번 레시피 콘테스트에는 각 가맹점당 1회 참여할 수 있다. 참여를 원하는 경영주는 카카오톡 ‘이마트24 레시피 콘테스트 챗봇’ 추가 후, 오는 31일까지 레시피 내용과 실제 음식 사진을 챗봇에 업로드 하면 응모가 완료된다.경영주들이 응모한 레시피는 본사 임직원들의 투표를 통해 본선에 진출 할 레시피가 선정되고, 2월 중순 경, 각 지역 사무소별로 선발된 2~6개점의 경영주들이 직접 만든 요리를 지역사무소 임직원들이 블라인드 현장 평가를 진행한 후 최종 3개의 레시피를 결정하는 방식이다.최종 결선에 오른 3개의 레시피는 전국 경영주들의 투표를 통해 1등부터 3등까지 정해지며, 해당 경영주에게는 상금이 제공된다. 1등~3등으로 선정된 레시피로 만든 상품은 상반기 중 출시 예정이다.이번 레시피 콘테스트는 실제 상품으로 개발하는 것을 목표로 하기 때문에, 심사 기준에서도 상품화 가능성(40%)에 가장 높은 비중을 두고 평가하며, 창의성(20%)과 스토리(20%), 맛·비주얼(20%)을 토대로 심사를 진행한다."
2023.01.26.,천안시 종합청렴도 평가 '1등급' 달성,https://n.news.naver.com/mnews/article/079/0003730980?sid=102,"2021년 3등급에서 두 계단 상승…신뢰받는 공직문화 조성 위한 청렴시책 성과천안시 제공충남 천안시는 국민권익위원회 주관 '2022년 공공기관 종합청렴도 평가'에서 역대 최고 성적인 '1등급'을 달성했다고 26일 밝혔다.천안시에 따르면 지난 2002년 국민권익위가 공공기관 청렴도 평가를 시작한 이래 처음으로 1등급을 달성했다. 지난 3년간 3~4등급에 머물며 답보상태였던 종합청렴도 등급을 1년 안에 2등급이나 끌어올렸다는 점에서 큰 의미가 있다는게 시의 설명이다. 매년 국민권익위는 전국 501개 공공기관을 대상으로 청렴수준과 부패요인 등 공공기관 종합청렴도를 측정해 평가 결과를 발표한다. 지난해 청렴체감도(외·내부의 설문조사)와 청렴노력도(시책추진 평가), 부패실태(감점)을 합친 종합청렴도 모형을 최초로 적용해 종합청렴도 등급을 결정했다.시는 2021년 종합청렴도 3등급을 받은 후, 외부체감도 측정 분야 향상을 위해 민원인에게 청렴모니터링을 실시해 취약 분야에 대한 개선방안을 마련했다. 이해충돌방지법 시행에 따라 전 직원 청렴교육을 3월 등 3차례에 걸쳐 실시하고 청렴서약서 작성 등 종합청렴도 1등급을 받기 위해 노력해왔다. 전 부서를 대상으로 청렴실무추진단을 구성·운영했으며, 온라인 청렴골든벨과 청탁금지법 위반신고 모의훈련, 세계 반부패의 날 기념 청렴문화 확산 SNS 이벤트 등 다양한 시책을 실시해 시민에게 신뢰받는 청렴한 공직문화를 조성했다. 박상돈 천안시장은 ""종합청렴도 1등급은 기본과 원칙이 통하는 청렴문화를 정착시키기 위해 공통의 방향과 목표를 가지고 천안시민들과 공직자 모두가 함께 일궈낸 노력의 결과""라며 ""이번 측정 결과에 안주하지 않고 '시민과 함께 다시 뛰는 청렴한 천안'을 위해 맞춤형 청렴정책을 펼치겠다""고 말했다.※CBS노컷뉴스는 여러분의 제보로 함께 세상을 바꿉니다. 각종 비리와 부당대우, 사건사고와 미담 등 모든 얘깃거리를 알려주세요.이메일 : jebo@cbs.co.kr카카오톡 : @노컷뉴스사이트 : https://url.kr/b71afn"
2023.01.26.,"전국 아파트 매수심리, 4주 연속 개선…전세 심리도 상승",https://n.news.naver.com/mnews/article/079/0003731009?sid=101,"아파트값 하락폭도 4주 연속 줄고 전세값 하락폭도 축소연합뉴스정부가 부동산 경착륙을 막기 위해 전방위적인 규제완화를 이어가고 있는 가운데 전국 아파트값 하락폭과 매수심리가 4주 연속 개선됐다. 지난주까지 하락폭을 키워왔던 전셋값도 하락세가 다소 진정됐고, 전세수급지수 역시 개선됐다.한국부동산원은 이번주(23일 기준) 전국 주간 아파트가격 동향을 조사한 결과 이같이 나타났다고 26일 밝혔다.이번주 전국 아파트 매매가격은 0.42% 하락, 전세가격은 0.75% 하락했다. 다만 수도권(-0.59%→-0.48%), 서울(-0.35%→-0.31%) 및 지방(-0.39%→-0.35%) 모두 하락폭이 축소(5대광역시(-0.49%→-0.43%), 8개도(-0.28%→-0.26%), 세종(-1.12%→-1.00%))됐다.서울은 마지막까지 규제지역으로 남아있는 △용산(-0.37%→-0.29%) △강남(-0.25%→-0.11%) △서초(-0.12%→-0.06%)의 하락폭 감소가 두드러졌다. 다만 송파(-0.25%→-0.26%)는 하락폭이 소폭 늘었고, △강서(-0.65%→-0.66%) △금천(-0.54%→-0.55%) △관악(-0.37%→-0.45%) 등 서울 외곽지역 역시 하락폭이 확대되며 차이를 보였다.지난 3일 서울과 함께 규제지역에서 벗어난 경기 지역의 하락세도 진정되는 모양새다. △과천(-1.03%→-0.87%) △성남 수정(-0.80%→-0.79%) △광명(-0.92%→-0.74%) △하남(-0.89%→-0.87%) 등은 하락폭이 줄어들었고, 성남 분당(-0.43%→-0.55%)만 하락폭이 확대됐다.매수심리를 의미하는 매매수급지수도 4주 연속 개선됐다. 이번주 전국 아파트 매매수급지수는 72.7로 전주(72.1)보다 소폭 개선됐다. 서울 역시 매매수급지수가 66.0으로 집계되며 전주(65.8)보다 지수가 소폭 올랐다.매매수급지수는 100을 기준으로 이보다 낮을수록 시장에 집을 사려는 사람보다 팔려는 사람이 많다는 것을 의미한다. 매수심리가 소폭 개선되긴 했지만 지수가 60대 중반인 것은 집을 사려는 사람보다 팔려는 사람이 더 많다는 의미다. 다만 전주와 비교하면 집을 사려는 사람이 소폭 늘어난 것으로 해석된다.황진환 기자서울을 권역별로 살펴보면 전반적으로 수급지수가 지난주보다 오른 가운데 양천·강서·구로·금천이 포함된 서남권은 매매수급지수가 제자리걸음(60.3)을 했고 서초·강남·송파·강동이 포함된 동남권은 수급지수가 악화(73.5→72.7)됐다.전주까지 하락폭을 키워온 전셋값은 하락폭이 소폭 줄고 심리도 다소 개선됐다.이번주 전국 주간 아파트 전세가격은 0.75% 내리며 지난주(-0.84%) 대비 하락폭 축소됐다. 수도권(-1.16%→-1.04%), 서울(-1.11%→-1.01%) 및  지방(-0.53%→-0.47%) 모두 하락폭이 축소(5대광역시(-0.67%→-0.64%), 8개도(-0.38%→-0.31%), 세종(-1.11%→-1.05%))됐다.서울은 학군지로 꼽히는 △강남(-1.33%→-1.03%) △양천(-1.59%→-1.53%) △노원(-1.14%→-0.78%) 등의 전셋값 하락폭이 축소된 가운데 △중랑(-0.91%→-0.94%) △성북(-1.07%→-1.24%) △영등포(-0.87%→-1.02%) 등은 하락폭을 키우며 혼조세를 보였다.이번주 전국 주간 아파트 전세수급지수는 70.7로 전주(70.4)보다 소폭 개선됐다. 서울 역시 60.6으로 집계되며 전주(60.1)보다 소폭 올랐다.권역별로는 전반적으로 수급지수가 전주보다 오른 가운데 양천·강서·구로·금천이 포함된 서남권역(54.7→54.5)만 지수가 소폭 하락했다.※CBS노컷뉴스는 여러분의 제보로 함께 세상을 바꿉니다. 각종 비리와 부당대우, 사건사고와 미담 등 모든 얘깃거리를 알려주세요.이메일 : jebo@cbs.co.kr카카오톡 : @노컷뉴스사이트 : https://url.kr/b71afn"
2023.01.26.,이모티콘·도슨트·관광안내서까지…“보이는 언어로 말해요”,https://n.news.naver.com/mnews/article/056/0011416529?sid=102,"BTS PERMISSION TO DANCE 뮤직비디오 수어 안무 부분 캡처방탄소년단 BTS의 노래 Permission to Dance 뮤직비디오의 한 장면입니다. 이 노래 안무 중에는 왼손을 펼쳐 만든 '무대' 위에 검지와 중지를 펼쳐 만든 거꾸로 된 V자 모양의 오른손을 좌우로 흔드는 특이한 동작이 나옵니다. 살짝 구부린 두 손을 몸 위아래를 긁듯이 움직이기도 하고 두 손으로 V자를 만들기도 합니다. 사실 이 동작들은 춤이 아니라 청각장애인과 언어 장애인 다시 말해 농인들이 사용하는 '보이는 언어', 바로 수어입니다. 순서대로 '춤추다', '즐겁다', '평화'를 말하고 있습니다. 그런데 어떤 사람은 수화라고 하고 또 어떤 사람은 수어라고도 말하는데, 둘 중 뭐가 맞는 표현일까요?  ■ 수어는 '독립된 언어'…한국어와 영어와 마찬가지 우리나라는 '한국수화언어(한국수어)'를 한국어와 동등한 자격의 '국어'이자 '공용어'로 인정하고 있습니다. 그래서 수화보다는 수어라고 부르는 것이 조금 더 적절하다고 볼 수 있습니다. 한국어 영어와 마찬가지로 독립된 동등한 언어라는 의미입니다. 수어는 손과 손가락의 모양인 수형, 손바닥의 방향인 수향, 손의 위치인 수위, 손의 움직임인 수동과 얼굴 표정 등의 요소로 이뤄져 있습니다. 이 중 하나라도 달라지면 의미가 완전히 달라지는 아주 섬세한 언어입니다.수어는 나라별로 다릅니다. 서로 영향을 받은 나라의 수어는 일정 부분 비슷한 점도 있지만, 그 나라의 수어를 배우지 않은 경우 우리나라 수어를 사용하는 사람과 미국 수어, 일본 수어, 중국 수어를 사용하는 사람은 서로 소통하기 어렵습니다. 우리가 영어를 배워야 영어를 쓰는 사람과 의사소통을 할 수 있는 것과 마찬가지입니다. 또 한국어와 한국수어는 문법 체계도 달라서 한국어와 다른 우리나라의 또 다른 언어로 보는 것이 정확합니다. 그래서 국제 행사에서 다른 나라의 말을 우리나라 말로 바꿔주는 통역 또는 번역을 하는 것과 마찬가지로 수어끼리도 통역과 번역이 필요합니다. 그래서 국제 수어도 생겨났습니다.■ 이모티콘, 도슨트, 관광안내서까지…""보이는 말로 이야기 나눠요""지난 2016년 「한국수화언어법」이 제정된 2월 3일로부터 7년째인 올해, 우리나라 공용어로 인정 받은 수어는 우리의 일상에 얼마나 가까워졌을까요?수어, 수화 이모티콘 / 카카오톡 캡처먼저, 카카오톡을 사용하면서 한 번쯤은 써봤을 이모티콘은 어떨까요? 검색해보니 '수어', '수화' 이모티콘이 여러 개 나옵니다. 눌러보면 움직이는 캐릭터들이 손과 얼굴을 이용해 다양한 말을 건넵니다.서울시립미술관 《영원한 나르시시스트, 천경자》 전시 수어 해설 유튜브 영상 캡처박물관이나 미술관, 유명 관광지에서도 작품 해설사인 도슨트 서비스를 수화로 제공하는 곳이 조금씩 늘고 있습니다. 지난해 6월 서울시립미술관에서는 《영원한 나르시시스트, 천경자》의 전시 소개와 주요 작품 설명을 수어와 자막으로 전하는 도슨트 영상을 제공했습니다.제주 관광 정보를 담은 ‘탐나는 수어’ 애플리케이션도 출시됐습니다. 관광지에 마련된 QR코드와 AR 마커를 인식하면 주변 관광지 정보를 동영상 수어해설로 볼 수 있습니다. 제주를 찾는 외국 농인들을 위해 국제 수어도 함께 제공됩니다.  서울 종로구도 수어 관광안내서를 만들었습니다. 우리나라 한복, 한식, 한옥, 한글, 한지 등에 관해 설명하고 종로구 문화재와 지명, 행사, 관광명소도 수어로 소개합니다. 물론 종로구 수어 통역센터와 관광안내소에 대한 내용도 들어가 있습니다. 외국 농인들을 위한 국제수화도 함께 제공됩니다.   질문 : 한국음식 중에 유명한 음식은 어떤 것이 있나요?답변 : 대표적으로 김치, 비빔밥, 불고기 등이 있어요.▲ 오른쪽 : 국제 수어 / 왼쪽 : 우리나라 수어 - 종로구 제공  이 영상 속 두 사람은 같은 질문과 답변을 국제수어와 우리나라 수어로 각각 이야기하고 있습니다. 한국의 유명한 음식에 관해 묻고 김치 등이 유명하다고 대답합니다. 하지만 이런 정보 없이 영상만 보면, 두 사람의 보이는 모습은 서로 매우 다릅니다. 같은 말을 하고 있다고 알아차리기도 어렵습니다. 마치 우리가 각각 영어와 한국어로 대화할 때처럼 말입니다. 수어는 단순한 보디랭귀지나 수신호가 아닙니다. 우리나라의 또 다른 완전한 언어입니다. 이 수어 영상을 시작으로, 우리나라의 공용어에 관심을 가져보면 어떨까요?■ 제보하기▷ 카카오톡 : 'KBS제보' 검색▷ 전화 : 02-781-1234▷ 이메일 : kbs1234@kbs.co.kr▷ 뉴스홈페이지 : https://goo.gl/4bWbkG"
2023.01.26.,"LB인베스트먼트, 증권신고서 제출…3월 코스닥 상장 추진",https://n.news.naver.com/mnews/article/001/0013720096?sid=101,"[IR큐더스 제공. 재판매 및 DB 금지]    (서울=연합뉴스) 송은경 기자 = 범LG 계열의 벤처캐피탈(VC) LB인베스트먼트가 코스닥시장 상장을 추진한다.    LB인베스트먼트는 26일 금융위원회에 증권신고서를 제출하고 오는 3월 코스닥 상장을 위한 기업공개(IPO)에 돌입한다고 밝혔다.    LB인베스트먼트는 1996년 LG전자, LG전선 등의 출자로 설립된 LG창업투자의 후신으로, 계열분리에 따라 2008년 LB인베스트먼트로 사명을 변경했다.    지난 27년간 540여개 유망 기업에 투자해왔으며, 누적 투자 규모는 1조7천억원이다. 최근에는 약 2천400억원 규모의 펀드를 결성해 회사의 운용자산(AUM) 규모는 약 1조2천억원에 이른다.    회사는 하이브, 펄어비스, 카카오게임즈 등에 초기부터 투자해 10배 이상의 수익을 거뒀으며 현재는 무신사, 에이블리, 뮤직카우 등으로 구성된 포트폴리오를 보유한 것으로 전해졌다.    박기호 LB인베스트먼트 대표는 ""이번 상장으로 마련한 재원을 실력 있는 스타트업이 유니콘으로 성장하도록 돕는 벤처펀드 조성에 적극적으로 활용할 예정""이라고 말했다.    총 공모 주식 수는 461만8천47주이며, 주당 공모 희망가 범위(밴드)는 4천400∼5천100원이다. 이를 통해 203억2천만∼235억5천만원을 조달해 상장 후 시가총액은 1천22억∼1천184억원에 이를 전망이다.    기관투자자 대상 수요예측은 다음 달 23∼24일 진행하며 3월 2∼3일 일반투자자 청약을 받는다. 상장 주관사는 미래에셋증권이다.    norae@yna.co.kr"
2023.01.26.,"이마트24, 경영주 레시피로 히트 상품 만든다",https://n.news.naver.com/mnews/article/421/0006594702?sid=101,"가맹점주 대상 '딜리셔스 레시피 콘테스트' 진행이마트24 레시피 콘테스트(이마트24 제공).(서울=뉴스1) 배지윤 기자 = 이마트24가 가맹점과 함께 슬로건 '딜리셔스 아이디어' 실행을 위해 머리를 맞댄다.이마트24는 슬로건 딜리셔스 아이디어 구체화의 일환으로 가맹점 경영주 대상으로 '딜리셔스 레시피 콘테스트'를 진행한다고 26일 밝혔다.이마트24 가맹점 경영주라면 누구나 참여할 수 있으며 자신만의 요리 레시피를 응모한 경영주 모두에게 참가상(1만원)부터 100만원까지 상금이 지급된다.특히 1등부터 3등에 선발된 레시피는 상금(1등 100만원, 2등 60만원, 3등 40만원)과 함께 실제 상품으로 출시될 계획이다. 출시된 상품의 매출에 따른 로열티(최대 1억)를 해당 경영주에게 제공할 예정이다.이번 레시피 콘테스트에는 각 가맹점당 1회 참여가능하며 참여를 원하는 경영주는 카카오톡 '이마트24 레시피 콘테스트 챗봇' 추가 후 이달 말일(31일 24시)까지 레시피 내용과 실제 음식 사진을 챗봇에 업로드 하면 응모가 완료된다.경영주들이 응모한 레시피는 본사 임직원들의 투표를 통해 본선에 진출 할 레시피가 선정되고 2월 중순 경, 각 지역 사무소별로 선발된 2~6개점의 경영주들이 직접 만든 요리를 지역사무소 임직원들이 블라인드 현장 평가를 진행한 후 최종 3개의 레시피를 결정하는 방식이다.최종 결선에 오른 3개의 레시피는 전국 경영주들의 투표를 통해 1등부터 3등까지 정해지며, 해당 경영주에게는 상금이 제공된다. 1등~3등으로 선정된 레시피로 만든 상품은 상반기 중 출시 예정이다.이번 레시피 콘테스트는 실제 상품으로 개발하는 것을 목표로 하기 때문에 심사 기준에서도 상품화 가능성(40%)에 가장 높은 비중을 두고 평가한다. 창의성(20%)과 스토리(20%), 맛/비주얼(20%)을 토대로 심사를 진행한다.     최은용 이마트24 MD담당 상무는 ""이번 레시피 콘테스트를 통해 경영주들은 자신의 아이디어로 상품 개발에 적극 참여할 수 있고, 본사는 고객과 현장의 목소리를 상품에 반영할 수 있는 계기가 될 것이다""고 말했다."
