기사날짜,기사제목,네이버 뉴스 url,기사내용
2023.01.25.,"굿피플, 몽골 발달장애인 학교 학습환경 개선 나서",https://n.news.naver.com/mnews/article/079/0003730702?sid=103,"몽골 울란바토르 항올(Khan Uul) 구에 위치한 63번 학교. 발달장애인을 위한 공립학교로 발달장애인 학생 300여 명이 재학하고 있다. 사진 굿피플.기독NGO 굿피플이 최근 몽골 울란바토르 소재 발달장애인 공립학교인 '63번 학교' 학습환경 개선에 나선다고 밝혔다.굿피플은 ""낙후된 시설은 학생들의 학업에 큰 지장을 주고 있다""며 ""교실 전등은 95% 이상이 형광등이고, 온수를 공급하는 물탱크는 고장 난 상태로 오랜 시간 방치되고 있어 학생들에게 적절한 온수가 공급되지 못하고 있다""고 전했다.굿피플은 하나금융나눔재단과 협력해 교실 전등을 저전력 고효율의 LED 전등으로 교체하고, 파손된 물탱크를 학교 규모에 맞는 크기의 물탱크로 새롭게 설치할 계획이다.굿피플 최경배 회장은 ""어려운 상황에 놓인 학생들이 쾌적한 환경에서 마음껏 미래를 꿈꿀 수 있도록 지원을 아끼지 않겠다""고 말했다.※CBS노컷뉴스는 여러분의 제보로 함께 세상을 바꿉니다. 각종 비리와 부당대우, 사건사고와 미담 등 모든 얘깃거리를 알려주세요.이메일 : jebo@cbs.co.kr카카오톡 : @노컷뉴스사이트 : https://url.kr/b71afn"
2023.01.25.,"컴패션, 세계 식량위기 대응 '마지막까지' 캠페인 전개",https://n.news.naver.com/mnews/article/079/0003730703?sid=103,"컴패션 식량위기 캠페인에 함께한 류준열 후원자의 모습. 사진 한국컴패션.국제어린이양육기구 컴패션이 전 세계 가난으로 고통받는 어린이를 위한 모금 캠페인, <식량위기, 컴패션의 응답 '마지막까지'>를 진행한다.이번 캠페인은 최근 세계 식량위기 속에서 영양실조를 비롯해 아동노동과 조혼 등 심각한 위협에 내몰린 가난 속 어린이들을 지원하기 위해 마련됐다.컴패션은 ""'2021년 기준 전세계 기아 인구는 8억2800만명으로, 전년 대비 4600만명 늘었다""며 아프리카 인구 5명 중 1명(20.2%)은 굶주림 상태에 놓여있는 것으로 조사됐다""고 밝혔다.이어 ""전 세계 5세 미만 어린이 5명 중 1명 이상(22%)은 여전히 영양실조 인한 발육부진으로 고통받고 있다""며 ""생계 유지가 힘들어지면서 아동노동과, 조혼 등으로 내몰리는 어린이들도 늘었다""고 덧붙였다.컴패션은 ""당장의 식량난을 해소하는 데에 그치지 않고, 어린이 가정이 스스로의 힘으로 현 식량위기를 이겨낼 수 있도록 끝까지 책임지고 지원하겠다""고 밝혔다.이번 캠페인 후원금은 각 어린이 가정에 필요한 영양식 제공과 종자·가축 지원, 농업·직업 기술 교육 등을 위해 사용될 예정이다.※CBS노컷뉴스는 여러분의 제보로 함께 세상을 바꿉니다. 각종 비리와 부당대우, 사건사고와 미담 등 모든 얘깃거리를 알려주세요.이메일 : jebo@cbs.co.kr카카오톡 : @노컷뉴스사이트 : https://url.kr/b71afn"
2023.01.25.,"청년신학아카데미, '실천 성경해석학과 설교' 집중훈련",https://n.news.naver.com/mnews/article/079/0003730704?sid=103,"청년신학아카데미의 <실천성경해석학과 설교> 집중훈련 포스터. 청년신학아카데미는 '실천성경해석학'과 '콘텍스트가 작동하는 하나님 나라 신학'을 두 축으로 이 시대의 대안적 신학을 추구하는 단체이다.대안신학운동단체, 청년신학아카데미(청신아)가 다음달 6일부터 3박 4일 일정으로 '실천성경해석학과 설교'를 주제로 말씀사역 집중훈련을 진행한다.이번 집중훈련은 '하나님 말씀'에 대한 목회자들의 연구와 묵상이 본문석의를 거쳐 설교의 단계까지 나아가도록 돕기 위한 실효적 과정이다.청신아는 ""그동안 한국교회는 초보적인 보급형 교육훈련만 반복했을 뿐, 시대변화와 한국교회의 성숙을 이끌 심화사역훈련을 제공하지 못했다""며 ""이번 훈련은 묵상에서 설교에 이르기까지 성서 텍스트와 제대로 씨름할 줄 아는 말씀사역자를 양성하기 위해 준비됐다""고 밝혔다.청신아는 특히, ""교회의 생명력은 설교 운동을 통해 회복됐다""며 ""인본주의적 감성주의로부터 벗어난 예배의 진정성을 회복하는 것 역시 성경적이며 창의적인 설교의 능력으로만 가능하다""고 강조했다.이어 ""설교자는 공허하고 맹목적인 말장수가 돼선 안된다""며 ""오늘날 사역현장의 질문과 필요에 응답하는 통찰력과, 성경과 인문학, 텍스트와 콘텍스트를 융합시키는 해석학적 안목을 키워야 한다""고 덧붙였다. 집중훈련과정은 <실천성경해석학의 이해>와 <본문과의 씨름 교실>, <설교자를 위한 4중 주석 방법>, <청년목회와 설교>, <예언자적 설교>, <공동선 관점의 성서해석>, <생태신학 관점의 성서해석과 설교>등의 강의로 진행된다.청신아는 ""이번 훈련은 해석학 이론에 대한 설명이 아니라, 성경본문 예시와 실습 중심으로 진행한다""며 ""오직 '말씀사역'으로 승부하려는 목회자, 선교사, 신앙운동가들의 많은 참여를 바란다""고 전했다.※CBS노컷뉴스는 여러분의 제보로 함께 세상을 바꿉니다. 각종 비리와 부당대우, 사건사고와 미담 등 모든 얘깃거리를 알려주세요.이메일 : jebo@cbs.co.kr카카오톡 : @노컷뉴스사이트 : https://url.kr/b71afn"
2023.01.25.,순천~여수 고속도로 논란에 지역 여론은 '와글와글',https://n.news.naver.com/mnews/article/079/0003730621?sid=102,"각종 포털과 인터넷 커뮤니티서 네티즌 갑론을박동순천IC에서 용전IC까지 약 8.04km 구간에 고속도로를 신설하는 안을 검토한 자료. 여수시 제공전남 순천~여수 간 고속도로 건설 추진과 관련한 팩트체크 기사가 지난 설 명절 연휴 기간 네티즌들 사이에서 찬반 논쟁이 이어지면서 큰 화제를 모았다. 설 연휴 첫날인 지난 21일 오전 '순천~여수 자동차전용도로, 고속도로처럼 통행료 낸다고?'란 제목의 CBS노컷뉴스 기사가 보도되자 다음과 네이버 등 포털사이트에 100여 개의 댓글이 달리고 전남 동부지역 인터넷 커뮤니티에 해당 기사가 공유되는 등 반응이 뜨거웠다. 댓글 상당수는 순천~여수 간 자동차전용도로를 고속도로로 승격시키는 것에 대해 부정적인 의견을 냈다. 아이디 '새디**'는 ""여수 순천 출퇴근하시는 분이 어마어마하고 저도 그 중에 한 명인데 통행료만 하루에 3600원이면 한달 십만원은 그냥 날아가네요""라고 했고, 아이디 '뇌려**'는 ""저는 처음부터 자동차전용도로의 고속도로 승격은 현실성 없는 바보 같은 주장이라고 생각했습니다""라고 썼다. 반면 기존 도로를 그대로 두고 순천~여수 간 고속도로를 신설하는 것에 대해서는 긍정적인 의견도 눈에 뛰었다. 아이디 '두꺼비하**'는 ""고속도로 그냥 새로 만들었으면 좋겠네요. 그게 순천과 여수 모두 윈원하는 전략일텐데""라고 했고, 아이디 'mirr****'는 ""고속도로 신설로 만드는 건 뭐라 안하는데 자동차 전용도로를 고속도로로 바꾸려는 생각에 문제를 지적하는 것""이라며 ""기존 자동차 전용도로를 유로화 하는 거랑 고속도로 신설은 전혀 다른 문제""라고 지적했다. 아이디 '비즈**'는 ""여수 순천 고속도로 반드시 설치해야 합니다. 1800원 통행료 내도 30분 시간 단축이면 경제효과 큽니다""라며 경제효과를 언급한 네티즌도 있었다. 전남 여수 도심을 빠져나온 차들이 순천 방향으로 가기 위해 자동차전용도로에 진입하고 있다. 오른쪽은 율촌을 통과해 순천으로 가는 구 도로다. 최창민 기자더불어민주당 김회재 의원(전남 여수을)은 21일 오후 해당 기사를 자신의 페이스북에 공유하기도 했다. 한 시민은 김 의원이 공유한 기사에 댓글을 통해 ""과거 김충조 의원이 이 문제로 심사숙고해 시민들이 경제적 부담을 가지지 않는 자동차전용도로로 결정한 것""이라며 ""고속도로와 자동차전용도로의 효율성과 경제성을 비교 평가해야 한다. 여수시만 고속도로가 없다는 건 설득력이 부족하다""고 비판했다.※CBS노컷뉴스는 여러분의 제보로 함께 세상을 바꿉니다. 각종 비리와 부당대우, 사건사고와 미담 등 모든 얘깃거리를 알려주세요.이메일 : jebo@cbs.co.kr카카오톡 : @노컷뉴스사이트 : https://url.kr/b71afn"
2023.01.25.,수원시의 11가지 주거지원사업 소개 합니다,url없음,<네이버 기사 없음>
2023.01.25.,"SK텔레콤, 새학기 맞아 키즈 브랜드 '잼' 프로모션",url없음,<네이버 기사 없음>
2023.01.25.,"‘좋아하면 울리는’ 자스민-백장미, 도파민 폭발 女女 커플 온다",https://n.news.naver.com/mnews/article/609/0000681291?sid=106,<구조 다름>
2023.01.25.,"SKT, '잼 새학기 프로모션' 시행",url없음,<네이버 기사 없음>
2023.01.25.,헤어진 연인 스토킹·폭행했지만 처벌 불가…반의사불벌죄 '공소 기각',https://n.news.naver.com/mnews/article/079/0003730628?sid=102,"류연정 기자헤어진 연인을 스토킹하고 폭행까지 한 40대 남성이 1심에서 공소 기각 판결을 받았다.대구지방법원 제1형사단독 배관진 부장판사는 스토킹범죄의 처벌 등에 관한 법률 위반, 폭행 혐의로 재판에 넘겨진 A(47)씨에 대해 검찰의 공소를 기각했다고 25일 밝혔다.A씨는 지난해 1월부터 9월까지 약 800회에 걸쳐 헤어진 연인 B씨에게 문자를 발송하거나 전화를 하는 등 스토킹처벌법을 위반한 혐의로 기소됐다.A씨는 두 차례 B씨의 집에 찾아가 기다리는 등 B씨에게 불안감과 공포심을 주는 행위를 지속적으로 반복한 혐의를 받았다.지난해 9월 B씨와 만난 A씨는 '더이상 연락하지 말자'는 B씨의 말에 격분해 B씨의 얼굴을 세 차례 폭행하기도 했다.하지만 스토킹처벌법은 현재 반의사불벌죄로 규정돼 있어 A씨는 처벌을 면했다. 반의사불벌죄는 피해자가 원하지 않으면 피의자를 처벌할 수 없는 죄다. 배 판사는 A씨가 피해자와 합의함에 따라 A씨에 대한 검찰의 공소를 기각했다.다만 배 판사는 특수공무집행방해, 도로교통법 위반 혐의로 A씨에게 벌금 700만원을 선고했다.A씨는 지난해 10월 음주운전을 하며 약 2시간 동안 B씨를 미행했다. 이를 알아차린 B씨가 경찰에 신고했는데 A씨는 출동한 경찰관 2명을 차로 들이받아 다치게 했다.배 판사는 ""위험한 물건을 이용해 경찰관들을 폭행해 정당한 공권력 행사를 방해한 것으로 죄책이 가볍지 않다. 다만 피고인이 우발적으로 사건 범행을 저지른 것으로 보이는 점, 피해 경찰관들이 A씨의 처벌을 원하지 않는 점 등을 종합했다""고 양형 이유를 밝혔다.※CBS노컷뉴스는 여러분의 제보로 함께 세상을 바꿉니다. 각종 비리와 부당대우, 사건사고와 미담 등 모든 얘깃거리를 알려주세요.이메일 : jebo@cbs.co.kr카카오톡 : @노컷뉴스사이트 : https://url.kr/b71afn"
2023.01.25.,"""삼성전자 4740억원 담았다""…돌아온 외국인 폭풍매수한 종목들",https://n.news.naver.com/mnews/article/008/0004843612?sid=101,"[내일의 전략] /사진=임종철 디자인기자설 연휴 기간 이후 코스피에 훈풍이 불었다. 외국인의 강한 순매수에 코스피가 1% 넘게 올랐다. 코스닥도 2% 상승했다. 대부분의 시가총액 상위 종목들엔 '빨간불'이 켜졌다.25일 코스피지수는 전 거래일 보다 33.31포인트(1.39%) 오른 2428.57로 장을 마감했다. 설 연휴 기간 동안 전세계 주요국의 금리인상 조기 동결과 경기 연착륙 기대감이 유입된 게 코스피에도 긍정적 영향을 준 것으로 보인다.외국인 순매수세가 강했다. 외국인은 코스피 주식 7652억원 어치를 순매수했다. 올 들어 최대치다. 기관도 289억원 순매수했지만 개인은 7918억원 순매도했다. 그중 코스피 시가총액 상위 종목들 위주로 매수세가 몰렸다. 외국인들은 삼성전자(4740억원), SK하이닉스(1200억원), 삼성SDI(460억원), LG화학(390원), NAVER(290억원), 신한지주(170억원), SK이노베이션(170억원), LG에너지솔루션(160억원), 삼성전기(140억원), KB금융(140억원) 순으로 코스피 주식을 샀다.그간 큰 폭으로 하락해왔던 업종들이 강세를 보였다. 전기전자, 섬유의복은 2%대, 제조업, 서비스업, 화학 등이 1%대 상승 마감했다. 반면 통신업, 철강및금속, 건설업 등은 1%대 하락 마감했다.시총 상위 종목들은 대부분 상승하며 거래를 마쳤다. 시총 1위인 삼성전자는 전 거래일 보다 1600원(2.59%) 오른 6만3400원으로 장을 마감했다.이와 함께 삼성SDI(4.85%), SK하이닉스(4.34%), LG화학(4.32%)F&F(4.3%), 삼성에스디에스(3.84%), HMM(3.75%), SK이노베이션(3.19%), LG에너지솔루션(3.09%), NAVER(3.06%) 등도 상승 마감했다.반면 LG생활건강(-2.92%), 롯데케미칼(-1.97%), 아모레퍼시픽(-1.95%), POSCO홀딩스(-1.78%), SK텔레콤(-1.71%) 등은 하락 마감했다.이경민 대신증권 투자전략팀장은 ""설 연휴 기간 동안 글로벌 증시가 강세를 보인 가운데 코스피도 키 맞추기에 들어갔다""며 ""반도체, 2차전지, 인터넷 등 기술주를 중심으로 코스피 강세를 주도했다""고 분석했다. /사진=임종철 디자인기자━코스닥 상승 마감…오스템임플란트 시총 10위권 내 진입━코스닥도 상승 마감했다. 코스닥지수는 전 거래일 보다 14.38포인트(2%) 오른 732.35를기록하며 장을 마감했다. 개인은 3376억원 순매도한 반면 외국인과 기관은 각각 1509억원, 2028억원 순매수했다.코스닥에선 소프트웨어 5%대, IT 소프트웨어, 인터넷 4%대, 반도체, 디지털컨텐츠, 기계장비, IT 하드웨어, 의료정밀기기, 컴퓨터서비스 등이 3%대 상승하며 장을 마쳤다. 오락문화, 방송서비스, 금속, 건설 등은 약보합세였다.경영권 지분 경쟁 이슈가 있는 오스템임플란트는 큰 폭으로 상승하며 코스닥 시총 11위에서 3계단 뛴 8위를 기록했다. 오스템임플란트는 전 거래일 보다 2만3800원(14.65%) 오른 18만6300원을 기록하며 장을 마감했다.로봇주의 대장주로 꼽히는 레인보우로보틱스는 상한가를 기록하며 장을 마감했다. 레인보우로보틱스는 전 거래일 보다 9600원(29.96%) 오른 8만7200원을 기록하며 거래를 마쳤다.이 외에도 에코프로비엠(2.31%), 셀트리온헬스케어(0.69%), 엘앤에프(6.21%), 카카오게임즈(3.87%), HLB(0.32%), 에코프로(3.99%), 펄어비스(2.36%), 리노공업(4.84%), 셀트리온제약(0.92%) 등도 상승 마감했다."
2023.01.25.,"경남소방, 설 연휴 하루 554번 출동해 도민 안전 지켰다",https://n.news.naver.com/mnews/article/079/0003730672?sid=102,"경남소방, 설 연휴 화재 진압 등 2769회 출동경남소방본부 제공경남의 설 연휴 동안 도민을 지킨 소방의 구급 출동이 지난해보다 증가했지만, 생활안전 출동 건수는 감소했다.경남소방본부는 설 연휴인 지난 20일부터 24일까지 소방공무원·의용소방대 등 1만 3800여 명의 인력과 함께 682대 소방차량, 소방정 2대, 헬기 1대 등 685대의 장비가 동원돼 도민의 안전을 살폈다고 25일 밝혔다.이 기간 8835건의 신고가 접수돼 출동횟수는 2769건으로 집계됐다. 연휴 5일 동안 하루 평균 554번이나 출동했다.이 중 화재출동은 168건, 구조출동 201건, 구급출동 2,248건, 생활안전출동 152건, 의료상담 1843건이다. 특히, 생활안전 출동 건수는 지난해보다 42% 감소했지만, 구급 출동은 33% 증가했다. 김종근 경남소방본부장은 ""도민 안전의 책임을 강화하고 높은 재난 예방 전문성과 대응력을 가질 수 있도록 최선을 다하겠다""고 말했다.※CBS노컷뉴스는 여러분의 제보로 함께 세상을 바꿉니다. 각종 비리와 부당대우, 사건사고와 미담 등 모든 얘깃거리를 알려주세요.이메일 : jebo@cbs.co.kr카카오톡 : @노컷뉴스사이트 : https://url.kr/b71afn"
2023.01.25.,고흥 분청박물관 올해도 기획전시 풍성,https://n.news.naver.com/mnews/article/079/0003730435?sid=102,"도예 작가들의 성과품 소개 기획전시 '만발' 현장. 고흥군 제공고흥 분청문화박물관이 올해도 풍성한 기획전시를 마련했다.올해 첫 기획전시는 분청박물관에 입주한 도예 작가들의 성과품을 소개하는 '만발(滿發)-2022년 고흥분청문화박물관 입주작가 성과 기획전시'로 지난 해 11월에 이어 진행되고 있다.오는 3월에는 충남 태안 분청사기와 고흥 분청사기를 비교하면서 공납체계를 소개하는 전시회를 개최한다.8월에는 경북 울릉도에 고흥 사람들이 어떻게 진출해 해양문화를 전파할 수 있는지를 소개하는 특별 교류전시를 열 예정이다.10월에는 전국에서 창의적인 도예작가들의 작품을 대상으로 엄격한 심사를 거쳐 선정된 ""고흥분청사기 전국 공모전 수상작품전""을 개최해 전통과 현대 사이에서 재해석된 분청사기를 선보인다. 11월에는 '2023년도 박물관 입주작가 성과품' 전시를 개최해 입주작가들의 시선에서 운대리 분청사기의 아름다움과 창의적인 작품, 감미로운 색감을 담은 작품들을 소개한다.※CBS노컷뉴스는 여러분의 제보로 함께 세상을 바꿉니다. 각종 비리와 부당대우, 사건사고와 미담 등 모든 얘깃거리를 알려주세요.이메일 : jebo@cbs.co.kr카카오톡 : @노컷뉴스사이트 : https://url.kr/b71afn"
2023.01.25.,"국내 증시, 외국인 매수세에 ‘상승세’",https://n.news.naver.com/mnews/article/277/0005208826?sid=101,"개인·기관 매도 속 외인 매수 호재코스피·코스닥, 시총 상위 종목 상승 뚜렷 국내 증시가 외국인 순매수에 힘입어 상승세를 이어가고 있다. 코스피와 코스닥은 1%대 상승 출발한 뒤 계속 좋은 흐름을 보인다. 시가총액 상위 종목들도 대부분 상승 중이다.25일 오전 9시3분 코스피지수는 전 거래일 보다 28.71포인트(1.2%) 오른 2423.97을 기록 중이다. 코스피는 1%대 상승 출발해 2420선에서 등락하고 있다. 개인과 기관은 각각 1184억원, 181억원 순매도 중이나 외국인은 1386억원 순매수하고 있다.코스피가 전 거래일보다 12.22포인트(0.54%) 상승한 2268.20에 개장한 5일 서울 중구 하나은행 딜링룸에서 직원들이 업무하고 있다. 원·달러 환율은 전 거래일보다 0.7원 내린 1271.0원에 출발했다./김현민 기자 kimhyun81@코스피 업종 상승세가 주목된다. 의료정밀, 전기전자가 2%대, 제조업, 화학, 서비스업 등이 1%대 상승 중이다. 아울러 통신업, 의약품, 보험, 유통업, 종이목재, 비금속광물 등은 강보합세다.코스피 시총 1위인 삼성전자는 전 거래일 보다 1400원(2.27%) 오른 6만3200원을 기록 중이다. 이와 함께 LG에너지솔루션(0.53%), SK하이닉스(4%), LG화학(3.2%), 삼성SDI(3.07%), 현대차(0.85%), NAVER(1.99%) 등도 상승 중이다. 반면 LG생활건강(-0.93%), 아모레퍼시픽(-1.01%), 하이브(-0.11%) 등은 하락세다.코스닥도 나란히 상승세다. 같은 시각 코스닥지수는 전 거래일 보다 9.24포인트(1.29%) 오른 727.21을 기록 중이다. 개인과 외국인은 각각 228억원, 75억원 순매도 중이나 기관은 331억원 순매수 중이다.의료정밀기기가 3.07%로 가장 높은 상승률을 기록 중이다. 금융, 반도체, 소프트웨어 등은 2%대, IT 하드웨어, IT 소프트웨어, 비금속, 컴퓨터서비스 등은 1%대 상승 중이다.코스닥 시총 상위 종목들도 대부분 상승세다. 시총 1위인 에코프로비엠은 전 거래일 보다 1300원(1.31%) 오른 10만700원에 거래되고 있다. 셀트리온헬스케어(1.2%), 엘앤에프(2.5%), 카카오게임즈(1.88%), HLB(1.77%), 에코프로(2.39%), 펄어비스(0.9%), 리노공업(3.97%) 등도 상승 중이다.한편 원·달러 환율은 전 거래일보다 2.5원 내린 1233원으로 출발했다."
2023.01.25.,최강한파에 부담 커지는 난방비…이달 요금 더 많이 나올 듯,url없음,<네이버 기사 없음>
2023.01.25.,"‘비싼 그녀들, 메이브’가 온다…몸값만 수십억",url없음,<네이버 기사 없음>
