기사날짜,기사제목,네이버 뉴스 url,기사내용
2023.01.25.,"'난방비 폭등' 동해시, 차상위계층 450가구 동절기 40만원 지원",https://n.news.naver.com/mnews/article/079/0003730601?sid=102,"핵심요약4개월 동안 월 10만 원씩 난방비 지급주택가에 설치된 도시가스 계량기. 황진환 기자최근 난방비 폭등과 관련해 여·야간 공방까지 이어지고 있는 가운데 강원 동해시가 동절기 차상위계층 난방비 지원 사업을 추진한다고 25일 밝혔다.동해시에 따르면 차상위계층 난방비 지원사업 수혜대상은 '국민기초생활보장법' 규정에 의거해 차상위 계층으로 책정된 시민 중 시장이 정한다. 다만 대상자는 '에너지법', '에너지 및 자원사업 특별회계법', '긴급복지지원법' 등 다른 법률에 따라 지원을 받지 않아야 한다.이에 따라 시는 동행정복지센터에서 받은 대상자 명단을 검토한 뒤 450가구를 선정해 동절기 4개월간 가구당 월 10만 원씩 지원할 계획이다. 동절기 차상위계층 난방비 지원사업은 생활이 어려운 이웃들의 따뜻한 겨울나기를 위해 지난 2007년부터 실시해오고 있다.이기선 복지과장은 ""코로나19 장기화로 생활에 어려움을 겪고 있는 저소득 주민들에게 난방비 지원을 통해 경제적 부담을 줄이고 생활안정에 도움이 되기를 바란다""고 말했다. ※CBS노컷뉴스는 여러분의 제보로 함께 세상을 바꿉니다. 각종 비리와 부당대우, 사건사고와 미담 등 모든 얘깃거리를 알려주세요.이메일 : jebo@cbs.co.kr카카오톡 : @노컷뉴스사이트 : https://url.kr/b71afn"
2023.01.25.,"여수관광협의회·여수공항, 관광객 유치 업무협약 체결",https://n.news.naver.com/mnews/article/079/0003730599?sid=102,"항공 연계 관광 활성화관광 상품 공동 개발, 관광객 유치 등 합동 마케팅여수시관광협의회와 여수공항이 지역 관광산업 발전과 공항 활성화를 위한 업무협약을 체결했다. 여수시 제공전남 여수시는 여수시관광협의회와 여수공항이 지난 19일 지역 관광산업 발전과 공항 활성화를 위한 업무협약을 체결했다고 25일 밝혔다. 이번 협약은 국내외 관광객 유치와 지역 관광 발전을 위해 항공연계 관광 활성화에 양 기관이 함께 노력하기 위해 마련됐다. 협약에는 관광산업 활성화를 위한 정보 공유, 항공교통 연계 관광상품 공동 개발 및 홍보, 관광객 유치 합동 마케팅 추진, 지역 관광산업 육성을 위한 협력 방안 모색 등의 내용이 담겼다. 이를 위해 두 기관은 실무협의회를 구성하고 양 기관의 관광 인프라와 노하우를 공유하여 지속 가능한 관광사업 발굴에 유기적으로 협력할 계획이다. 정재호 수산관광국장은 ""최근 여행에 대한 수요가 다시 증가하면서 새로운 관광콘텐츠 개발이 무엇보다 중요하다""면서 ""이번 협약으로 다양하고 차별화된 관광상품 개발로 관광객을 적극 유치하여 지역경제 활성화를 도모할 수 있도록 최선을 다하겠다""고 말했다.※CBS노컷뉴스는 여러분의 제보로 함께 세상을 바꿉니다. 각종 비리와 부당대우, 사건사고와 미담 등 모든 얘깃거리를 알려주세요.이메일 : jebo@cbs.co.kr카카오톡 : @노컷뉴스사이트 : https://url.kr/b71afn"
2023.01.25.,“아이들은 휴대폰 이거 써야죠”…‘키즈대전’ 돌입 통신 3사,https://n.news.naver.com/mnews/article/009/0005078894?sid=105,"등교하는 학생들. [사진 출처 = 연합뉴스]이동통신3사(SK텔레콤·KT·LG유플러스)가 새학기를 앞두고 어린이 고객을 유치하기 위해 팔을 걷어붙였다.SK텔레콤은 25일 ‘ZEM(잼) 새학기 프로모션’을 시행한다고 밝혔다. 잼은 만 12세 이하 아이들을 위한 SKT와 SK브로드밴드의 통합 키즈(Kids) 서비스 브랜드다.SKT는 이날부터 오는 3월 31일까지 잼 앱에 자녀를 등록한 부모 고객들 중 추첨을 통해 경품을 제공하는 ‘두근두근 새학기 선물 아이♥ZEM’ 이벤트를 진행한다.잼 앱은 스마트폰을 처음 이용하는 만 12세 이하 아이들이 올바른 사용 습관을 가질 수 있도록 돕는 서비스다.경품은 태블릿 PC, 시디즈 링고의자, 마이크로 킥보드 등으로 약 1200명에게 제공된다.잼 앱을 내려받고 가입하기만 해도 20만원 상당의 1 대 1 영어 화상수업 체험권을 받을 수 있다. 체험권은 SKT와 제휴를 맺은 유아·초등 영어교육 전문 플랫폼 ‘튼튼영어’에서 사용할 수 있다. SK텔레콤이 25일 2023년 새학기를 맞아 아이와 부모에게 다양한 혜택을 제공하는 ‘ZEM(잼) 새학기 프로모션’을 시행한다고 밝혔다. [사진 출처 = SKT]부모는 잼 앱을 통해 다양한 안심·편의 기능을 무료로 이용할 수 있다. 자녀의 스마트폰 사용 시간과 사용 앱을 관리하고 미세먼지 농도와 급식정보 등을 확인할 수 있다.자녀 위치를 실시간으로 조회하고 유해사이트를 차단하는 기능도 이용 가능하다. 스마트폰을 보느라 고개를 숙이고 걷는 이른바 ‘스몸비’(스마트폰과 좀비의 합성어) 방지 기능도 활용할 수 있다.B tv ZEM이 독점 제공하는 튼튼영어, 초등 학습만화 ‘와이’(WHy) 시리즈 등을 올 12월까지 데이터 걱정 없이 볼 수 있는 ‘모비데이터팩’ 무료 제공 프로모션도 진행한다. 모비데이터팩은 월 5500원을 내면 3Mbps로 모바일 데이터를 하루 1GB씩 사용할 수 있는 서비스다.프로모션은 이날부터 오는 3월 31일까지 어린이 전용 휴대전화 요금제인 잼 플랜 요금제에 신규 가입하는 고객을 대상으로 진행된다. KT 모델이 ‘KT 신비 키즈폰3’을 소개하고 있다. [사진 출처 = KT]KT와 LG유플러스는 새로운 키즈폰 출시를 통해 고객 유치에 나섰다.KT는 지난 12일 LTE 기반의 어린이 전용 스마트폰 ‘KT 신비 키즈폰3’를 출시한다고 밝혔다. 신비 키즈폰3는 지난 13일부터 공식 온라인몰 KT샵과 전국 오프라인 매장에서 판매됐다.신비 키즈폰3는 삼성 갤럭시 엑스커버5 단말기로 ▲신비스쿨 케이스 ▲신비 목걸이 스트랩 ▲신비 네임택 ▲신비 필통꾸미기 세트 등의 패키지를 포함하고 있다.출고가는 30만8000원이다. ▲5.3인치 HD+ 디스플레이 ▲전면 500만·후면 1600만 화소 카메라 ▲3000mAh 탈착형 배터리를 탑재했다.KT는 초등학생부터 키덜트까지 두터운 팬덤을 보유한 국내 대표 인기 애니메이션 ‘신비아파트’와 협업해 키즈폰 라인업을 출시해 왔다.신비 키즈폰3는 신비 아파트 캐릭터들이 학교에 가는 컨셉의 ‘신비스쿨’ 테마를 적용했다. 주 사용자인 초등학생들이 친근하게 단말을 사용할 수 있도록 했다는 설명이다.부모가 KT의 10만원 이상 5G 요금제를 사용하면 ‘우리 아이 할인’ 적용한다. 할인이 적용되면 자녀는 1만원대로 통화와 문자를 무제한으로 쓸 수 있다. LG유플러스가 오는 27일 출시 예정인 키즈폰 혜택 설명 이미지. [사진 출처 = LG유플러스]LG유플러스는 ‘U+키즈폰 with 춘식이’를 사전 판매하고 있다. 사전 판매 기간은 지난 18일부터 오는 26일까지다. 공식 출시일은 이달 27일이다. 단말기는 KT와 마찬가지로 갤럭시 엑스커버5 시리즈다.LG유플러스는 카카오 리틀 프렌즈 시리즈 키즈폰을 매년 출시하고 있다. 새 키즈폰은 카카오 캐릭터인 춘식이를 활용한 캐릭터 케이스와 스트랩, 열쇠고리, 컬러링 페이퍼 등의 패키지로 구성된다.아이의 실시간 위치를 확인할 수 있고 안심지역을 벗어날 경우 알림을 받을 수도 있다. 일간·주간 단위뿐만 아니라 시간대별로도 스마트폰 사용시간을 파악해 제공한다.통신업계는 새학기마다 어린이 사용자들의 이용성향 등을 토대로 맞춤형 서비스를 꾸준히 내놓고 있다.김지형 SKT 통합마케팅전략담당은 “새학기를 맞아 부모와 아이 모두에게 설렘 가득한 새 출발이 되기를 바라는 마음으로 다양한 프로그램을 준비했다”고 말했다."
2023.01.25.,"우리은행, 최대 1.4兆 특별금융지원…지역경제 활성화 나선다 [은행오늘]",url없음,<네이버 기사 없음>
2023.01.25.,"경북교육청, '맞춤형 체험식 학생안전교육'지원",https://n.news.naver.com/mnews/article/079/0003730530?sid=102,"경북교육청 제공경북교육청은 학생들이 안전사고와 각종 재난 및 위험 상황 대처 능력을 높이고자 도내 모든 학교에 학생안전교육 용품 구입비 30억 원을 지원한다고 밝혔다. 이번 사업은 모든 학교가 학교 실정에 맞는 맞춤형 체험 학생안전교육을 실시할 수 있도록 학교 규모에 따라 100만 원에서 1천만 원까지 추가 지원한다. 각급 학교는 연간 51차 시 이상의 7대 영역 안전교육인 △생활안전교육 △교통안전교육 △폭력 예방 및 신변보호교육 △약물 및 사이버 중독 예방교육 △재난안전교육 △직업안전교육 △응급처치 교육을 실시한다.다중이용시설 안전사고 및 개인형 이동장치( PM) 이용 등 안전사고에 대한 예방에 필요한 학생안전 교육용품을 자율적으로 구입해 체험형 수업이 될 수 있도록 적극 활용한다. 지난해까지는 수요 조사를 통해 선별적으로 지원했으나, 올해는 모든 학교에 학생안전 교육용품 구입비를 지원해 전면등교 및 대면 수업에 따른 안전하고 쾌적한 교육환경 조성을 목표로 한다. 지역 범위가 넓고 소규모 학교가 많은 경북교육 환경의 특성을 고려해 (가칭) S.O.S(School Of Safety) 모바일 콘텐츠를 자체 개발, 올해 하반기 제공한다. 임종식 교육감은 ""지능형 CCTV 등의 인프라 확충과 체험 중심의 안전교육을 통해 학생과 학부모들이 신뢰할 수 있는 안전하고 믿음직한 교육환경 조성을 위해 최선을 다하겠다""고 말했다.※CBS노컷뉴스는 여러분의 제보로 함께 세상을 바꿉니다. 각종 비리와 부당대우, 사건사고와 미담 등 모든 얘깃거리를 알려주세요.이메일 : jebo@cbs.co.kr카카오톡 : @노컷뉴스사이트 : https://url.kr/b71afn"
2023.01.25.,서울 청소년과 동행할 '서울런 멘토단' 모집…인센티브·지원금 확대,https://n.news.naver.com/mnews/article/079/0003730476?sid=004,"서울시 제공서울시는 교육 사각지대 해소를 위해 확대 운영되는 '서울런 2.0' 추진에 발맞춰 초·중·고교생의 학습격차 해소 지원에 나설 '서울런 멘토단' 700여 명을 모집한다고 25일 밝혔다.만 39세 이하의 전국 대학(원)생이라면 누구나 신청 가능하며, 내달 8일까지 소속 대학의 장학담당 부서를 통해 모집한다.서울런 멘토단은 서울런 참여자들이 다양한 학습 콘텐츠를 충분히 활용할 수 있도록 학생들의 체계적인 학습을 지도하는 '코치'와 학교생활, 진로, 진학 등의 고민을 함께 나누는 '상담자' 역할을 수행하게 된다.시는 서울런 멘토로 장기 활동(9주 이상)하는 경우 가산금에 더해 고등학생 멘토링에는 인센티브 제공, 취약계층 대학생 대상 지원금으로 활동비를 확대 지급할 예정이다.아울러 멘토단 대상 정기 교육을 확대·강화해 역량 강화를 지원하고, 학습효과 향상을 위해 멘토링 시간을 기존 주 1시간에서 주 2시간 이내로 확대한다.시는 이번 1차 정기모집 이후로도 정기·수시모집을 진행하고, 지난해 연간 총 1천 명에서 올해 1500명으로 멘토단을 확대 운영한다. 멘토‧멘티의 동반 성장을 위한 대학 탐방 및 다양한 친화 프로그램 등도 확대 지원할 계획이다.서울런 멘토단 정기모집 지원을 원하는 대학(원)생은 소속 대학 장학담당 부서에 신청서 등 관련 서류를 제출하면 된다. 는 대학별로 추천받은 학생들을 대상으로 전문가 심사를 거쳐 최종 선발할 예정이다.이회승 서울시 평생교육국장은 ""아동·청소년들이 더 나은 미래를 꿈꾸고 도전할 수 있도록, 서울런 멘토단이 먼저 그 길을 경험한 선배로서 든든한 지원군이 되어줄 것""이라며 ""새로워진 서울런 2.0은 멘토와 멘티가 가르치고 배우며 서로를 성장시킬 수 있도록 서울시도 지원을 아끼지 않겠다""고 말했다.※CBS노컷뉴스는 여러분의 제보로 함께 세상을 바꿉니다. 각종 비리와 부당대우, 사건사고와 미담 등 모든 얘깃거리를 알려주세요.이메일 : jebo@cbs.co.kr카카오톡 : @노컷뉴스사이트 : https://url.kr/b71afn"
2023.01.25.,"SKT, ‘ZEM 새학기 프로모션’ 시행",url없음,<네이버 기사 없음>
2023.01.25.,설 연휴 부산지역 5대 범죄·교통사고 감소,https://n.news.naver.com/mnews/article/079/0003730519?sid=102,"112 신고 늘었지만 5대 범죄 발생 건수는 7.1% 감소교통량 증가에도 교통사고 지난해보다 줄어…사망자 '0'부산경찰청 ""선제적 치안·교통관리 효과"" 분석부산경찰청은 설 명절 특별 치안·교통 대책을 시행한 결과 5대 범죄와 교통 사고가 지난해보다 줄었다고 밝혔다. 송호재 기자부산경찰청은 지난 11일부터 2주 동안 '설 명절 종합치안대책'을 추진한 결과 5대 범죄 발생 건수가 지난해보다 7.1% 감소했다고 25일 밝혔다.경찰에 따르면 이 기간 귀성객과 교통량 증가로 교통불편 등 112 신고는 하루 평균 3173.3건으로 지난해 보다 19.2% 늘었다. 하지만 5대 범죄 발생 건수는 하루 평균 29.9건으로 지난해 32.2건에 비해 7.1% 감소했다.또 부산지역 설 연휴 교통량이 전반적으로 증가한 반면, 사고 발생 건수는 93건으로 지난해보다 17% 줄었다. 부상자도 128명으로 20% 감소했고, 사망자는 발생하지 않은 것으로 집계됐다. 지난해 설 연휴에는 112건의 사고가 발생해 4명이 숨지고 161명이 다친 바 있다.경찰은 이같은 결과가 선제적인 종합 치안 · 교통 대책을 시행한 결과라고 평가했다. 경찰은 종합 치안 대책 추진 기간에 범죄 위험 요인 분석 등에 기반한 선제적 치안 활동과 가정폭력 재발 우려 가정 전수 모니터링 등을 실시했다. 설 연휴에는 하루 평균 454명의 인력과 116대의 차량을 투입해 교통 혼잡 관리에 나섰다.우철문 부산경찰청장은 ""앞으로도 범죄 취약지 등 범죄 발생 현황을 면밀하게 분석해 민생 침해 범죄를 막기 위해 최선을 다하겠다""고 말했다.※CBS노컷뉴스는 여러분의 제보로 함께 세상을 바꿉니다. 각종 비리와 부당대우, 사건사고와 미담 등 모든 얘깃거리를 알려주세요.이메일 : jebo@cbs.co.kr카카오톡 : @노컷뉴스사이트 : https://url.kr/b71afn"
2023.01.25.,창작뮤지컬 '다윈 영의 악의 기원' 6월 日라이선스 초연,https://n.news.naver.com/mnews/article/079/0003730563?sid=103,"핵심요약6월 7~15일 일본 도쿄 히비야 '시어터 크리에'서 공연서울예술단 제공 창작 뮤지컬 '다윈 영의 악의 기원'이 오는 6월 일본 무대에 선다.서울예술단은 뮤지컬 '다윈 영의 악의 기원'이 6월 7~15일 일본 도쿄 히비야 '시어터 크리에'에서 일본 라이선스 초연한다. 일본 토호 주식회사와 라이선스 계약을 체결했다고 25일 밝혔다.'다윈 영의 악의 기원'은 박지리 작가의 동명 소설(2016)이 원작으로 인간의 욕망과 죄의 대물림에 대해 이야기한다. 2018년 초연 이후 2019년, 2021년 재공연되며 폭넓은 관객층을 확보했다.일본 최고 극작가 겸 연출가 스에미츠 켄이치가 연출을 맡았다. 무대연출, 작가, 배우 등 다방면으로 활동하는 스에미츠 켄이치는 연극 '트럼프'(TRUMP) 시리즈로 유명하다.가혹한 운명의 수레바퀴 속에서 무거운 진실을 마주한 16살 소년 '다윈 영' 역은 오오히가시 리츠키와 와타나베 아오가 더블 캐스팅됐다. 오오히가시 리츠키는 연기 스펙트럼이 폭넓고, 와타나베 아오는 노래와 댄스에 특기가 있다.이번 일본 라이선스 초연은 서울예술단의 '넥스트' 사업 프로그램의 일환이다.서울예술단 이유리 단장 겸 예술감독은 ""일본 뮤지컬 시장 규모는 한국의 2배 이상으로 아시아 중심 시장이다. 한국 창작 뮤지컬의 일본 진출이 활발해지면 한국 뮤지컬이 일본 시장을 넘어 아시아 중심 시장으로 발돋움하게 된다는 점에서 의미가 크다""고 전했다.서울예술단 제공 ※CBS노컷뉴스는 여러분의 제보로 함께 세상을 바꿉니다. 각종 비리와 부당대우, 사건사고와 미담 등 모든 얘깃거리를 알려주세요.이메일 : jebo@cbs.co.kr카카오톡 : @노컷뉴스사이트 : https://url.kr/b71afn"
2023.01.25.,"""이용객 안전 지켜라"" 부산지하철 모든 열차에 CCTV 설치",https://n.news.naver.com/mnews/article/079/0003730624?sid=102,"부산교통공사, 부산지하철 전동차 객실당 CCTV 3~4개 설치 완료200만화소 이상 고화질로 피사체 선명하게 식별열차 내 범죄·화재 발생 등에 신속 대처 가능해져부산교통공사는 운행 중인 부산지역 모든 지하철 객실에 CCTV를 설치했다고 밝혔다. 부산교통공사 제공부산교통공사는 현재 운행 중인 부산도시철도 전동차 객실 458칸 전체에 CCTV 설치를 완료했다고 25일 밝혔다.공사는 객실 한 칸에 3~4대의 CCTV를 설치해 사실상 사각지대를 없앴다고 강조했다. 설치한 CCTV는 모두 200만화소 이상의 고화질로 승객 등 피사체를 선명하게 식별할 수 있다고 덧붙였다.이번 CCTV 설치로 열차 내 범죄를 선제적으로 예방해 승객 안전을 확보하는 데 큰 도움이 될 것으로 공사는 기대하고 있다.또 열차 객실에 화재감지기가 작동하거나 승객이 비상통화장치를 이용하면 운전실에 해당 객실의 CCTV 화면이 나타나 비상상황에 대한 신속한 인지와 대처도 가능하다는 게 공사 측 설명이다.CCTV 영상은 관련법에 따라 범죄 수사 등의 목적으로만 사용할 예정이다.한문희 부산교통공사 사장은 ""열차 내 CCTV를 통해 시민들이 더욱 믿고 이용할 수 있는 도시철도 환경을 조성했다""며 ""승객 안전을 최우선으로 생각하며 안전한 도시철도를 조성하기 위해 노력하겠다""고 말했다.※CBS노컷뉴스는 여러분의 제보로 함께 세상을 바꿉니다. 각종 비리와 부당대우, 사건사고와 미담 등 모든 얘깃거리를 알려주세요.이메일 : jebo@cbs.co.kr카카오톡 : @노컷뉴스사이트 : https://url.kr/b71afn"
2023.01.25.,동북아시아지역자치단체연합 신임 사무총장에 임병진씨,https://n.news.naver.com/mnews/article/079/0003730431?sid=102,"임병진 동북아시아지역자치단체연합 사무총장. 울산시 제공울산시는 25일 오후 시청에서 동북아시아지역자치단체연합(NEAR) 제6대 사무총장에 임병진 전 주선양 한국총영사관 총영사를 임명한다고 밝혔다.시는 NEAR의 제14대(2021년~2023년) 의장단체며, 김두겸 시장은 이날 14대 의장 자격으로 사무총장에게 임명장을 수여한다.임 사무총장은 주인도네시아 한국대사관 공사, 주중 한국대사관 공사, 주선양 한국총영사관 총영사 등을 지내며 동북아시아 정세에 능통한 전문가다.시는 올 하반기 제14차 NEAR 총회를 개최할 예정이다. NEAR는 회원 단체 초청을 통한 분야별 분과위원회 개최, 차기 의장 단체 선출 등으로 진행된다.김두겸 시장은 ""이번 신임 사무총장 임명을 통해 총회 개최 준비 등 다양한 활발할 역할을 수행할 수 있을 것""이라고 밝혔다. NEAR은 동북아시아지역 자치단체 교류 협력증진과 공동발전을 위해 지난 1996년 창설됐다.현재 6개국나라, 79개 광역단체가 가입돼 있다.※CBS노컷뉴스는 여러분의 제보로 함께 세상을 바꿉니다. 각종 비리와 부당대우, 사건사고와 미담 등 모든 얘깃거리를 알려주세요.이메일 : jebo@cbs.co.kr카카오톡 : @노컷뉴스사이트 : https://url.kr/b71afn"
2023.01.25.,"광주시, 시민과 함께 대설·한파 피해 최소화",https://n.news.naver.com/mnews/article/079/0003730641?sid=102,"눈 오기 전 상황판단회의 개최··분야별 대책 점검결빙구간 제설, 상수도계량기 동파 처리반 운영 등공무원과 시민 눈 치우기. 광주광역시 제공광주광역시는 설 연휴 마지막날인 24일부터 광주에 대설주의보와 한파경보가 발효되면서 최대 12.2㎝의 눈이 내리고 한낮에도 영하의 추위가 지속되는 상황에서 공직자와 시민이 힘을 모아 대설과 한파로 인한 피해를 최소화하고 있다고 25일 밝혔다. 광주시는 설 연휴 귀경길과 25일 출근길 교통소통이 원활하게 이뤄지도록 눈이 내리기 전인 24일 새벽부터 자치구와 함께 상습결빙지역에 대한 제설제 사전 살포를 시작으로 눈이 그친 25일 오전까지 민간 제설장비를 동원해 주요도로에 대한 제설작업을 실시했다. 또 설 연휴기간 중 눈 소식이 있었던 지난 20일 시민안전실장 주재로 상황판단회의를 열어 기상상황을 공유하고, 분야별 대책을 점검하는 한편 눈 치우기 시민참여 활성화 대책을 추진했다. 더불어 민간 제설장비가 신속하게 동원될 수 있도록 사전 연락체계를 구축했다. 지난 23일에는 자연재난과장 주재로 2차 상황판단회의를 개최해 △제설자재 비축 상황 △제설장비 가동 준비상황 △제설작업 담당직원 비상근무 발령계획 등 제설대책을 사전에 점검하며 철저하게 대비했다. 이 밖에 광주시는 대설, 한파 기상특보 발표 시 재난안전대책본부 비상 1단계를 가동하고 종합적인 대책을 추진하고, 시민안전 확보를 위해 시민을 대상으로 실시간 기상상황과 행동요령 안전안내문자를 송출했다. 제설작업은 광주시와 자치구의 가용한 전 제설장비와 자동염수분사장치를 운용하고 영하의 기온으로 밀어내기 제설작업이 필요한 구간은 민간장비 6대를 동원해 실시했다. 앞으로도 상습결빙구간, 응달지, 경사지, 제설작업 요청 구간에 대한 후속 제설작업을 실시할 계획이다. 한파에 취약한 홀몸어르신 1만9900여 명에 대한 안부 확인을 실시하고, 노숙인 응급잠자리 지원, 구호물품 지급 등 6건의 지원도 이뤄졌다. 광주시는 현재까지 접수된 교통사고, 낙상사고 등 17건의 피해상황에 대해서는 즉시 조치하고, 강추위에 따른 상수도계량기 동파에 대비해 기동처리반을 운영한다. 박남주 시 시민안전실장은 ""이상기후로 인해 광주지역에 대설, 한파가 빈번하게 발생하고 있다""며 ""시민 모두가 안전한 광주를 만들기 위해 눈과 추위가 예상될 때에는 개인 방한용품을 착용해 체온을 유지하고, 눈 치우기 활동에도 적극적으로 동참해주기 바란다""고 말했다.※CBS노컷뉴스는 여러분의 제보로 함께 세상을 바꿉니다. 각종 비리와 부당대우, 사건사고와 미담 등 모든 얘깃거리를 알려주세요.이메일 : jebo@cbs.co.kr카카오톡 : @노컷뉴스사이트 : https://url.kr/b71afn"
