기사날짜,기사제목,네이버 뉴스 url,기사내용
2023.01.25.,실내마스크 곧 풀리지만 '격리의무 조정' 논의 이른 이유,https://n.news.naver.com/mnews/article/079/0003730355?sid=102,"당국 ""WHO 비상사태 풀리고 국내 위기경보 하향하면 논의""오미크론 유입後 단축 당시엔 '짧아진 전파기'란 과학적 근거 ""지금은 방역적 근거 딱히 없어…완화 시 유행여파 더 클 것""'아프면 쉬는' 문화 정착도 의문…상병수당은 시범사업 단계황진환 기자오는 30일부터 실내마스크 착용의무가 권고로 전환되면서, 정부 차원에서 유지하는 방역조치는 사실상 '확진자의 7일 격리'가 유일해졌다. 당국이 코로나19 유행 이후 3년 내내 감염 확산을 방지하기 위한 최후의 보루로 강조했던 실내 마스크가 풀림에 따라, 확진자의 격리의무 단축 또는 해제 논의도 서서히 본격화될 것으로 보인다. 하지만 많은 전문가들은 아직 '확진자 격리의무' 관련 논의를 하기 이른 시점이라 보고 있다. 앞서 기간을 줄였을 때는 바이러스의 전파특성 등 그에 상응하는 과학적 근거가 있었지만, 지금은 이를 딱히 뒷받침할 변화가 없다는 것이다. 코로나19 사태 초기, 14일이었던 확진자의 격리일수는 현재 7일까지 줄어든 상태다. 정부도 상황 상 논의할 만한 주제라면서도, 구체적인 시기에 대한 언급은 꺼리는 모양새다.국민 99% 항체 얻었다지만…확산 방지 위한 '격리 필요성' 유효25일 중앙방역대책본부에 따르면, 코로나19 확진자에 대한 격리는 지난 2020년 1월 20일 국내 첫 확진자가 발생하면서부터 시작됐다. 양성 판정을 받으면, 당국이 지정한 감염병 전담병원의 격리병상 또는 경증 치료자를 수용하기 위해 고안된 생활치료센터로 이송돼 14일 동안 격리 조치됐다. 정부가 '단계적 일상회복'을 추진하기 전인 2021년 10월 31일까지는 해외입국자 및 밀접접촉자도 확진 여부와 관계없이 2주 간의 격리가 의무적으로 적용됐다. 같은 해 11월 1일부터는 격리기간이 14일에서 열흘로 줄었다. 일상회복 이후 자택에서 격리하는 '재택치료'란 개념이 생기면서, 기준이 다소 완화됐다. 자가에서 지내거나 생활치료센터에 입소한 무증상·경증 환자에 대한 건강 모니터링도 1주일로 단축됐다. 지난해 1월 26일, 전파력이 압도적인 오미크론 변이가 유행하면서 예방접종 여부에 따라, 차등을 두기도 했다. 기초접종을 완료한 재택치료자는 1주일, 미완료인 경우는 열흘 격리가 실시됐다. 2월 9일부터는 증상 유무를 따지지 않고 확진되면 '7일 격리'가 일괄 시행됐다. 확진자에 대한 격리는 추가 확산을 막기 위해 역학적으로 불가피한 조치였다. 코로나19가 대면 접촉을 통해 전파되고, 공기 중에 퍼진 비말(침방울)이 감염경로가 되는 호흡기바이러스인 탓이다. 특히 감염 초기인 무증상기에도 전파력이 유효한 코로나19의 특성상 바이러스 배출이 이뤄지는 동안은 확진자를 외부로부터 확실히 차단할 필요가 있었다. 황진환 기자다만, 7차에 걸친 유행을 거치면서 국민 대부분이 백신 접종 또는 자연 감염으로 항체를 보유하고 있단 점(항체양성률 98.6%)과 더불어 '위드(with) 코로나' 기조가 가속화되면서 확진자의 격리의무 역시 완화 수순으로 가야 한다는 목소리가 나오고 있는 것이다. 물론 99%에 가까운 국민이 항체를 얻었다는 사실이 '집단 면역'을 의미하는 것은 아니다. 바이러스에 대한 방어력도 시간 경과에 비례해 감소하기 때문이다. 실내마스크 지침 조정을 두고 당국에서 더 이상 착용 여부를 일일이 단속하지 않겠다는 것일 뿐, 스스로와 고위험군을 보호하기 위해서는 자율적 착용이 필요하다는 점을 정부가 강조한 것도 같은 맥락이다.당국 '위기경보·감염병등급 하향' 전제…마스크 해제보다 신중이같은 점을 잘 알고 있는 방역당국도 격리의무 완화에 대해서는 보다 신중한 모습이다. 지영미 질병관리청장은 지난 20일 중앙재난안전대책본부 브리핑에서 관련 질의에 ""한국도 이제 1단계 (실내)마스크 의무 해제가 진행되면서 그런 논의를 시작할 단계가 되었다고 생각한다""고 밝혔다. 그러면서 ""WHO(세계보건기구)에서 지금 코로나19 비상사태를 아직 유지하고 있는 상황이기 때문에 저희는 비상사태가 해제되고, 이후 국내의 (감염병 위기경보) '심각' 단계가 '경계'나 '주의' 단계로 변경되면 격리의무 해제를 전문가들과 같이 논의해서 결정해나갈 예정""이라고 설명했다. 작년 말 정치권에서 먼저 흘러나온 격리일수 단축 제안을 일축했던 것과는 미묘하게 다른 뉘앙스지만, 당장은 논의를 시작할 계획이 없다는 취지다. 여당인 국민의힘은 지난해 12월 전문가 초청 토론회를 통해 코로나 감염 시 격리기간을 1주일에서 사흘로 줄이자는 의견을 정부에 전달한 바 있다. 당시 지 청장은 이에 대해 ""바이러스가 배출되는 기간은 평균 1주일 정도로 보고 있다. 그 정도 격리는 필요하다고 본다""며 선을 그었다. 조규홍 보건복지부 장관 또한 확진자 격리의무 조정은 겨울철 재유행이 안정화된 이후, 현행 2급인 코로나19의 감염병 등급이 인플루엔자(계절독감)와 같은 4급으로 하향되면 검토해볼 수 있다는 입장을 밝혔다. 즉, 코로나19가 그간 당국이 수차례 비교대상으로 삼아온 '독감'과 같은 정도의 위험성이라고 공식화되기 전까지는 격리의무의 실질적 조정이 어렵다고 볼 수 있다.""단축, 해제할 만한 과학적 근거 없어""…'아프면 쉬는' 문화 아직황진환 기자무엇보다 전문가들은 현 시점에서 확진자의 격리일수를 줄이거나 의무 자체를 해제할 만한 '과학적 근거'가 없다고 입을 모은다.   오미크론 유행 당시 확진자의 격리일수를 단축했을 때는 분명한 근거가 있었다. 평균적으로 오미크론에 최초 노출된 후 진단까지 걸리는 시간이 3.7일이었다는 질병청의 데이터 등이 활용된 것이다. 한 사람이 다른 감염을 감염시키는 데 걸리는 시간인 세대기가 앞선 우세종인 델타 변이(2.9~6.3일) 등에 비해 짧은 평균 2.8~3.4일로 조사되기도 했다.대체로 감염되고 1주일이 지나면, 추가 감염이 이뤄질 가능성은 현저히 적다는 게 임상적으로 확인됐기에 기간을 줄일 수 있었다.   가천대길병원 감염내과 엄중식 교수는 CBS노컷뉴스와의 통화에서 ""(확진자의) 격리일수를 줄이는 게 의미가 있는지 잘 모르겠다. 격리의무를 유지한 상태에서 (일수를) 줄인다는 건 과학적 근거가 없는 편의적 발상""이라고 말했다. 이어 ""바이러스 배출기간이 줄었다는 근거도 없고, 뒤로 갈수록 전파력이 없어진다고 볼 수도 없는 상황""이라고 부연했다. 엄 교수는 ""(실내)마스크 착용의무를 해제했을 때 영향을 보고 결정을 해야 한다. (적어도) 한 4주 정도는 추이를 봐야 할 것""이라면서도 ""(격리의무를 해제하게 되면) 실제 유행에 미치는 영향은 더 클 것""이라고 강조했다. 코로나19로 화두가 된 '아프면 쉬는' 문화가 정착되지 않았다는 점도 문제다. 이미 적지 않은 일반 사기업에서는 확진 판정을 받아도 개인 연차 등을 써서 격리기간을 보내고 있는 것으로 알려져 있다. 유급 병가를 주는 회사들도 감염병예방법 상 확진자의 격리가 '의무'인 점을 근거로 삼아왔는데, 의무가 폐지되면 굳이 이같은 혜택을 제공할 이유가 있겠냐는 우려도 나온다.아픈 노동자가 부득이하게 쉬는 기간 소득을 보전해주는 상병수당은 작년 7월에 시작된 '시범사업'이 진행 중인 단계다.엄 교수는 ""확진자 격리가 의무가 아니어도 1주일 격리를 할 수 있는 사회적 분위기가 돼야 한다. 직장 근로자들의 업무 공백이 생겨 심각한 문제가 생기는 것도 아닌데 무슨 근거로 (격리일수 단축이나 해제를) 추진할 건가""라며 ""이 부분은 의학적 문제가 아니라 사회적인 문제고 노동의 문제다. (정부가) 보완책을 충분히 고민하지 않으면 (일터에서) 불편한 상황이 계속 생길 것""이라고 말했다.※CBS노컷뉴스는 여러분의 제보로 함께 세상을 바꿉니다. 각종 비리와 부당대우, 사건사고와 미담 등 모든 얘깃거리를 알려주세요.이메일 : jebo@cbs.co.kr카카오톡 : @노컷뉴스사이트 : https://url.kr/b71afn"
2023.01.25.,"광주시, 올해 도시숲 38곳 조성한다",https://n.news.naver.com/mnews/article/079/0003730592?sid=102,"국비 등 113억원 투입…기후대응도시숲 조성 등 9개 사업 추진2023년 도시숲 조성사업 대상지인 광주 북구 첨단2지구 임방울대로 도시바람길숲. 광주광역시 제공광주광역시(시장 강기정)는 올해 113억 원을 투입해 기후대응도시숲과 초록이 넘치는 녹도 조성 등 9개 사업을 추진, 도시숲 38곳을 조성한다. 25일 광주시에 따르면 광주시는 산림청 기후대응기금 등 국비 33억 원을 포함해 모두 82억 원을 들여 기후대응도시숲 사업 등 국비보조사업 4개를 추진한다. 4개 사업은 △서구 빛고을대로 등 기후대응도시숲 사업 5곳 △광산구 금구초교 등 자녀안심 그린숲 조성사업 3곳 △남구청사 생활밀착형 숲 조성사업 1곳 △북구 앰코로 등 도시바람길숲 조성사업 4곳 등으로 연말까지 조성하게 된다. 올해 처음 시행되는 '기후대응도시숲 사업'은 빛고을대로에는 미세먼지 발생원 주변 및 생활권에 숲을 조성하고, 상무시민공원 포장공간을 활용해 숲을 조성하는 방식으로 도심 온도를 낮춘다. 더불어 시비 31억 원을 투입해 25곳에서 녹지 한평 늘리기 조성 등 5개 사업을 추진한다. 광주시는 앞서 지난해 12월 15일 '도시숲 등의 조성·관리 소위원회'를 열고 자치구에서 제출한 올해 5개 사업 대상지 31곳 중 25곳을 선정했다. 전문가·시민단체·주민위원으로 구성된 '도시숲 등의 조성·관리 소위원회'는 대상지별 녹화사업 효과, 사업규모 적정성, 사후관리 편의성 등을 종합 평가해 대상지를 최종 확정했다. 선정된 대상지는 △학동 250-7번지 등 녹지한평늘리기사업 12곳 △임방울대로800번길 등 녹도조성사업 5곳 △상무자유로 등 가로숲길 조성사업 4곳 △신동성당 담장허물어 나무심기사업 1곳 △석산고교 등 학교 내 미래숲 조성사업 3곳 등으로, 올해 상반기 중 추진한다. 광주시 정강욱 녹지정책과장은 ""기후 변화에 따른 도시열섬과 폭염으로 더워지는 광주를 시원하게 만들기 위해 도시숲 조성을 확대할 계획이다""며 ""시민이 생활권에서 쉽게 쉼 공간을 접할 수 있도록 도시숲 조성에 최선을 다하겠다""고 말했다.※CBS노컷뉴스는 여러분의 제보로 함께 세상을 바꿉니다. 각종 비리와 부당대우, 사건사고와 미담 등 모든 얘깃거리를 알려주세요.이메일 : jebo@cbs.co.kr카카오톡 : @노컷뉴스사이트 : https://url.kr/b71afn"
2023.01.25.,"코레일, 설 명절 5일 동안 212만명 열차 이용",https://n.news.naver.com/mnews/article/079/0003730594?sid=102,"연휴 시작 전날 20일 '44만명' 최다코레일 제공한국철도공사(코레일)는 지난 20~24일 설 특별수송 기간 동안 모두 212만 명, 하루 평균 42만 명이 열차를 이용했다고 25일 밝혔다. 코로나19로 인해 창측 좌석만 판매했던 지난해 설 129만 명의 2배 가까운 수준으로 가장 많은 승객이 몰린 날은 연휴 시작 전날인 20일로 모두 44만 명이 기차역을 찾은 것으로 집계됐다.  KTX는 131만 명(일평균 26만 명), 일반열차는 81만 명(일 평균 16만명)이 이용했다.  구혁서 여객마케팅처장은 ""열차 내 마스크 착용 등 방역 수칙 준수에 협조해준 이용객에게 감사하다""며 ""앞으로도 안심하고 열차를 이용할 수 있도록 안전 운행에 만전을 기하겠다""고 말했다. ※CBS노컷뉴스는 여러분의 제보로 함께 세상을 바꿉니다. 각종 비리와 부당대우, 사건사고와 미담 등 모든 얘깃거리를 알려주세요.이메일 : jebo@cbs.co.kr카카오톡 : @노컷뉴스사이트 : https://url.kr/b71afn"
2023.01.25.,"광주시, 2022 안전한국훈련 '우수기관' 선정",https://n.news.naver.com/mnews/article/079/0003730591?sid=102,"다중밀집시설 복합재난 설정…현실감 있는 대규모 입체훈련 진행광주광역시청. 광주광역시 제공광주광역시(시장 강기정)는 행정안전부가 주관한 '2022 재난대응 안전한국훈련' 평가에서 우수기관으로 선정됐다. 25일 광주시에 따르면 '재난대응 안전한국훈련'은 범국가적 재난대응체계 확립을 위해 모든 재난 유형에 대비하는 국가종합훈련으로 중앙정부, 지자체, 공공기관 뿐만 아니라 일반 국민이 참여하는 대규모 전국 단위 훈련이다. 광주시는 광주롯데아울렛·마트에서 화재·폭발·붕괴로 인한 복합재난을 가정해 서구, 유관기관·단체 및 시민 등 500여 명이 참여한 가운데 민·군·경의 드론, 재난안전통신망(PS-LTE) 등 재난발생 구호 장비 40여 대를 동원해 재난 대응단계별로 체계적이고 생동감 있게 훈련을 실시해 시민과 평가자로부터 호응을 얻었다. 특히 행정안전부 지침서(메뉴얼)를 훈련 기획·설계 단계부터 반영해 국민체험단 훈련 참관 및 평가, 불시·돌발 메시지를 전달해 예상치 못한 상황에 대한 기관·부서의 신속하고 유기적 대응체계를 점검했다. 또 기관장을 비롯한 훈련 참여자가 임무와 역할을 명확히 숙지하고, 유관기관·민간단체의 적극적인 참여로 비상 기구별 실전 대응능력을 높였다. 평가단은 대규모 인력·장비를 동원한 훈련에도 안전관리를 철저히해 무사고 훈련이 시행된 점을 높이 평가했다. 이번 평가에서는 서구와 남구도 우수기관으로 선정됐다. 안전문화 의식 확산을 위한 안전시책 수립과 체계적인 재난대비 훈련 등 재난대응역량 강화를 위한 노력이 성과로 이어졌다. 광주시 관계자는 ""이번 우수기관 선정은 안전에 대한 시민들의 폭넓은 공감대와 함께 재난에 대한 경각심으로 시민과 유관기관의 협치가 일궈낸 성과다""며 ""최고의 안전은 훈련인 만큼 올해 상반기 중 안전한국훈련을 실시하는 등 지속적으로 훈련하며 '안전 컨트롤타워 광주'를 만들겠다""고 말했다.※CBS노컷뉴스는 여러분의 제보로 함께 세상을 바꿉니다. 각종 비리와 부당대우, 사건사고와 미담 등 모든 얘깃거리를 알려주세요.이메일 : jebo@cbs.co.kr카카오톡 : @노컷뉴스사이트 : https://url.kr/b71afn"
2023.01.25.,"코레일, 설 명절 5일 동안 212만명 열차 이용",https://n.news.naver.com/mnews/article/079/0003730594?sid=102,"연휴 시작 전날 20일 '44만명' 최다코레일 제공한국철도공사(코레일)는 지난 20~24일 설 특별수송 기간 동안 모두 212만 명, 하루 평균 42만 명이 열차를 이용했다고 25일 밝혔다. 코로나19로 인해 창측 좌석만 판매했던 지난해 설 129만 명의 2배 가까운 수준으로 가장 많은 승객이 몰린 날은 연휴 시작 전날인 20일로 모두 44만 명이 기차역을 찾은 것으로 집계됐다.  KTX는 131만 명(일평균 26만 명), 일반열차는 81만 명(일 평균 16만명)이 이용했다.  구혁서 여객마케팅처장은 ""열차 내 마스크 착용 등 방역 수칙 준수에 협조해준 이용객에게 감사하다""며 ""앞으로도 안심하고 열차를 이용할 수 있도록 안전 운행에 만전을 기하겠다""고 말했다. ※CBS노컷뉴스는 여러분의 제보로 함께 세상을 바꿉니다. 각종 비리와 부당대우, 사건사고와 미담 등 모든 얘깃거리를 알려주세요.이메일 : jebo@cbs.co.kr카카오톡 : @노컷뉴스사이트 : https://url.kr/b71afn"
2023.01.25.,"광주시, 2022 안전한국훈련 '우수기관' 선정",https://n.news.naver.com/mnews/article/079/0003730591?sid=102,"다중밀집시설 복합재난 설정…현실감 있는 대규모 입체훈련 진행광주광역시청. 광주광역시 제공광주광역시(시장 강기정)는 행정안전부가 주관한 '2022 재난대응 안전한국훈련' 평가에서 우수기관으로 선정됐다. 25일 광주시에 따르면 '재난대응 안전한국훈련'은 범국가적 재난대응체계 확립을 위해 모든 재난 유형에 대비하는 국가종합훈련으로 중앙정부, 지자체, 공공기관 뿐만 아니라 일반 국민이 참여하는 대규모 전국 단위 훈련이다. 광주시는 광주롯데아울렛·마트에서 화재·폭발·붕괴로 인한 복합재난을 가정해 서구, 유관기관·단체 및 시민 등 500여 명이 참여한 가운데 민·군·경의 드론, 재난안전통신망(PS-LTE) 등 재난발생 구호 장비 40여 대를 동원해 재난 대응단계별로 체계적이고 생동감 있게 훈련을 실시해 시민과 평가자로부터 호응을 얻었다. 특히 행정안전부 지침서(메뉴얼)를 훈련 기획·설계 단계부터 반영해 국민체험단 훈련 참관 및 평가, 불시·돌발 메시지를 전달해 예상치 못한 상황에 대한 기관·부서의 신속하고 유기적 대응체계를 점검했다. 또 기관장을 비롯한 훈련 참여자가 임무와 역할을 명확히 숙지하고, 유관기관·민간단체의 적극적인 참여로 비상 기구별 실전 대응능력을 높였다. 평가단은 대규모 인력·장비를 동원한 훈련에도 안전관리를 철저히해 무사고 훈련이 시행된 점을 높이 평가했다. 이번 평가에서는 서구와 남구도 우수기관으로 선정됐다. 안전문화 의식 확산을 위한 안전시책 수립과 체계적인 재난대비 훈련 등 재난대응역량 강화를 위한 노력이 성과로 이어졌다. 광주시 관계자는 ""이번 우수기관 선정은 안전에 대한 시민들의 폭넓은 공감대와 함께 재난에 대한 경각심으로 시민과 유관기관의 협치가 일궈낸 성과다""며 ""최고의 안전은 훈련인 만큼 올해 상반기 중 안전한국훈련을 실시하는 등 지속적으로 훈련하며 '안전 컨트롤타워 광주'를 만들겠다""고 말했다.※CBS노컷뉴스는 여러분의 제보로 함께 세상을 바꿉니다. 각종 비리와 부당대우, 사건사고와 미담 등 모든 얘깃거리를 알려주세요.이메일 : jebo@cbs.co.kr카카오톡 : @노컷뉴스사이트 : https://url.kr/b71afn"
2023.01.25.,"홍준표 ""재선 이상 TK의원 다음 총선 모두 물갈이 해야""",https://n.news.naver.com/mnews/article/079/0003730408?sid=102,"윤창원 기자홍준표 대구시장이 중앙 정치에서 영향력을 발휘하지 못하는 대구경북 국회의원들의 물갈이를 주장하고 나섰다.홍준표 시장은 25일 자신의 페이스북에 올린 글에서 ""TK지역은 총선때마다 언제나 절반의 교체율을 기록한 것은 전국 교체율 35%내외를 맞출려고 하다보니 지지세가 강한 TK지역이 언제나 희생양이 되는 관계로 그렇다""며 ""그 때문에 인재를 키우지 못하고 눈치만 늘어가는 정치인들만 양산 해 국회의원다운 국회의원을 찾아보기 힘들어 졌다""고 밝혔다.특히,""최근 당내 최고위원 선거에서도 또다시 서로 눈치만 보고 출마예정자도 찾아보기 힘들다보니이미 한물간 정치 낭인들만 설치는 형국이 되었다""며 비판했다.그러면서 ""만약 이번에도 또 출마자를 조정하지 못하고 서로 눈치나 보면서 그런 현상이 계속 일어나면 재선 이상 TK의원들은 이참에 다음 총선에서 모두 물갈이를 해야 할 것""이라며 목소리를 높였다.홍 시장은 ""중앙정치에서는 힘도 못쓰고 동네 국회의원이나 할려면 시의원,구의원을 할것 이지뭐 할라고 국회의원 합니까? ""라며 지역 국회의원들의 분발을 촉구했다.※CBS노컷뉴스는 여러분의 제보로 함께 세상을 바꿉니다. 각종 비리와 부당대우, 사건사고와 미담 등 모든 얘깃거리를 알려주세요.이메일 : jebo@cbs.co.kr카카오톡 : @노컷뉴스사이트 : https://url.kr/b71afn"
2023.01.25.,"기보, 올해 탄소가치평가보증 5천억 이상 공급",https://n.news.naver.com/mnews/article/079/0003730463?sid=102,"핵심요약온실가스 감축 효과를 화폐가치로 환산해 중소기업 지원기술보증기금 본점. 기보 제공기술보증기금(이하 '기보')은 중소기업의 탄소감축 경영 전환을 지원하고자 올해 탄소가치평가보증 5천억 원 이상을 공급하기로 했다고 25일 밝혔다.탄소가치평가보증은 기후대응기금을 재원으로 하는 보증상품이다. 기보가 개발한 '탄소가치평가모델'을 적용해 온실가스 감축 효과를 화폐가치로 환산하고 이를 보증지원 금액에 추가 반영함으로써 탄소감축 중소기업들의 원활한 자금조달을 목적으로 한다. 기보는 지난해 탄소가치평가보증을 처음 도입해 5007억 원을 공급했으며 올해도 5천억 원 이상 공급 목표와 지원제도를 담은 '2023년 탄소가치평가보증 사업 계획'을 수립해 적극 시행하기로 했다.지원 대상은 온실가스 감축 성과가 있거나 예상되는 기업으로 △신재생에너지 발전기업(태양광, 풍력 등) △신재생에너지 관련 산업기업(설비생산, 기술개발 기업 등) △자체 감축기업(시설도입, 연료전환 등) △외부 감축기업(제품, 부품 등 생산 판매) 등 4가지 유형의 탄소감축기업이다.기보는 자금지원과정에서 기업들의 탄소배출 현황 등 데이터를 확보해 기업 탄소감축 방안 수립에 필요한 정보 제공과 연계 사업을 올해 본격적으로 추진할 예정이다.김종호 이사장은 ""탄소중립 대응에 어려움을 겪고 있는 중소기업들의 자금난 해소와 탄소중립 혁신을 위해 관련 상품을 지속해서 개발하고 지원을 강화하겠다""고 말했다.※CBS노컷뉴스는 여러분의 제보로 함께 세상을 바꿉니다. 각종 비리와 부당대우, 사건사고와 미담 등 모든 얘깃거리를 알려주세요.이메일 : jebo@cbs.co.kr카카오톡 : @노컷뉴스사이트 : https://url.kr/b71afn"
2023.01.25.,"""양식장 환경을 한눈에""…부산 기장군, 모니터링 알림서비스",https://n.news.naver.com/mnews/article/001/0013718127?sid=102,"양식장 어장환경 모니터링 서비스[부산 기장군 제공. 재판매 및 DB 금지](부산=연합뉴스) 손형주 기자 = 부산 기장군 양식 어민들은 휴대전화기로 양식장 수심별 수온과 염분, 용존산소, 일조량 등 어장환경을 확인해 기후변화와 비상 상황에 대처할 수 있게 됐다.    부산 기장군 수산자원연구센터는 기장·일광·장안 등 연안 해역 3개소에 해상관측 부이를 설치해 어장환경 모니터링 알림서비스를 운영한다고 25일 밝혔다.     이번 사업은 해양수산부 수산 u-IT 융합 모델화 공모 사업에 선정되면서 국비 2억원을 지원받아 진행됐다.     관측 부이는 기장군 대표 양식장이 있는 기장·일광·장안 해역 3곳에 수심별(1·3·5·9ｍ) 수온, 염분, 용존산소, 일조량 등 데이터를 제공한다.    국립수산과학원이나 기상청 등지에서 제공하는 정보보다 세부적이고, 실제 양식장과 가까운 해역의 정보를 확인할 수 있다.    특히 신청자가 원하는 시간대에 편리하게 해당 정보를 카카오톡으로 받아볼 수 있도록 설정할 수 있다.    서비스 신청 방법은 QR코드 또는 홈페이지(www.gijangseaweed.or.kr) 접속 후 오른쪽 하단에 해양환경정보 SMS 신청 메뉴를 클릭하면 되고, 관리자 승인 후 다음 날부터 이용이 가능하다.    기장군 수산자원연구센터 관계자는 ""최근 수온 변화 등 기장 해양환경 변화가 과거와 달리 예측이 어려운 만큼 기후변화에 실시간으로 대응하기 위한 해양환경정보 수집은 지역 수산업에서 매우 중요하다""며 ""고품질의 해양환경정보를 신속하게 제공하자는 취지로 시스템을 구축했다""고 말했다.     handbrother@yna.co.kr"
