기사날짜,기사제목,네이버 뉴스 url,기사내용
2023.01.10.,"기시다 만난 마크롱 ""北, 명백한 국제법 위반…日 지지""",https://n.news.naver.com/mnews/article/079/0003725749?sid=104,"기시다 후미오 일본 총리(왼쪽)와 엠마뉘엘 마크롱 프랑스 대통령. 연합뉴스주요 7개국(G7) 중 5개국 순방에 나선 기시다 후미오 일본 총리는 첫 방문국인 프랑스를 찾아 북핵 문제를 비롯한 우크라이나 전쟁, 미국의 IRA법 등에 대해 논의했다고 AP통신이 9일(현지시간) 보도했다. 이에 따르면 이날 오후 파리에 도착한 기시다 총리는 업무 만찬을 위해 대통령궁으로 향하기 전 마크롱 대통령과 공동성명을 발표했다. 이 자리에서 마크롱 대통령은 ""북한의 명백한 국제법 위반에 직면해 있는 일본은 우리의 변함없는 지지를 기대할 수 있을 것""이라고 말했고, 이에 기시다 총리는 ""중국의 군사적 주장이 커지는 가운데 자유롭고 개방적인 인도·태평양을 만드는 데 프랑스는 중요한 파트너""라고 화답했다.  양국 정상은 우크라이나 전쟁과 관련해 양국이 경제적, 인도적 지원을 한 것을 평가하는 한편 원자력, 신재생 에너지, 자동차, 방위 산업 분야 등에서 양자 협력을 강화해 나가겠다고 말했다.  특히 양국 정상은 이날 업무 만찬에서는 미국이 시행하는 인플레이션 감축법(Inflation Reduction Act·IRA)이 자국 경제에 미치는 여파를 최소화할 방안도 논의했다. 앞서 마크롱 대통령은 지난달 1일 미국을 방문했을 때 ""북미산 전기차에만 혜택을 주는 인플레 감축법에 프랑스를 비롯해 유럽 국가들이 반대하고 있다""고 강조한 바 있다.  올해 G7 의장국을 맡은 일본은 오는 5월 일본 히로시마에서 열리는 G7 정상회의를 앞두고 총리가 직접 회원국 순방에 나섰다.  기시다 총리는 프랑스에 이어 이탈리아, 영국, 캐나다 방문이 예정돼 있으며, 오는 23일에는 워싱턴에서 바이든 대통령을 만난다. ※CBS노컷뉴스는 여러분의 제보로 함께 세상을 바꿉니다. 각종 비리와 부당대우, 사건사고와 미담 등 모든 얘깃거리를 알려주세요.이메일 : jebo@cbs.co.kr카카오톡 : @노컷뉴스사이트 : https://url.kr/b71afn"
2023.01.10.,충북 전세가율 높고 전세보증사고 이어져,https://n.news.naver.com/mnews/article/079/0003726033?sid=102,"국토부의 전세보증금피해 설명회.  류영주 기자급속한 주택매매가 하락속에 깡통전세 위험이 높은 충북도내 시군이 속출하고 전세보증금을 돌려받지 못하는 전세보증사고도 이어지고 있다.한국부동산원의 임대차시장 사이렌에 따르면 지난해 11월 기준 충북의 최근 1년 아파트 전세가율은 82.3% ,서민입주가 많은 연립,다세대 주택의 전세가율은 80.5%로 나타났다.특히 청주시 상당구는 아파트와 연립,다세대주택 전세가율이 각각 87% 수준을 보였고 청원구는 86%와 89%, 충주시는 82%와 90%로 깡통전세 위험을 넘어섰다.전세가율은 주택매매가격 대비 전세가격의 비율로,보통 전세가율이 80%가 넘으면 전세보증금을 돌려받지 못하는 깡통전세의 위험이 큰 것으로 보고 있다.이런 영향으로 전세보증금을 돌려받지 못하는 보증사고가 지난해 11월 청주 흥덕구에서 2건, 상당구에서 1건 등 3건이 발생했고 사고금액은 5억 9000만 원에 달했다.또 지난해 10월에는 서원구에서 1건, 2억 6000만 원, 지난해 8월에는 청주 서원구와 충주시,음성군에서 각각 1건의 보증사고가 발생해 4억 5500만 원을 돌려받지 못했다.하지만 충북의 아파트 매매가가 가파르게 떨어지고 있어 사고 확률은 계속 커지고 있다.금리인상과 매매가 하락의 여파로 충북의 지난해 11월 주택매매는 지난해보다 43% 떨어지고 미분양주택은 8.6배 늘어나는가 하면 경매건수는 한달에 600여 건에 이르는 등 부동산 경기 위축이 가속화되고 있다.아파트 거래절벽에 아파트 가격 하락이 계속되면서 마이너스 프리미엄의 아파트 매물이 청주와 오송 지역 등에서 나오고 있다.충북의 아파트 매매가격 변동률은 지난달 3주에 -0.39%에서 1월 첫주에는 -0.26%로 하락률이 약간 줄어 들었다.하지만 전세가 하락률은 지난달 2주차에 -0.62, 3주차에는 -0.48%, 1월 첫주에는 -0.36%로 하락폭이 줄고는 있지만 아파트 하락률보다 하락폭이 헐씬 가파르다.※CBS노컷뉴스는 여러분의 제보로 함께 세상을 바꿉니다. 각종 비리와 부당대우, 사건사고와 미담 등 모든 얘깃거리를 알려주세요.이메일 : jebo@cbs.co.kr카카오톡 : @노컷뉴스사이트 : https://url.kr/b71afn"
2023.01.10.,"""술 마시고 집에 데려가""…아이돌 출신 A씨, 불륜 의혹에 SNS 비공개 전환 [종합]",https://n.news.naver.com/mnews/article/117/0003686287?sid=106,<구조 다름>
2023.01.10.,"충남도, 특별 경영안정자금 50억 원 지원",url없음,<네이버 기사 없음>
2023.01.10.,"""세종스마트국가산단 전면 재검토하라"" 서명운동 전개",https://n.news.naver.com/mnews/article/079/0003726047?sid=102,"시민 3천 명 이상 연서명 목표…새해 첫 주 800여 명 동참세종스마트국가산단 공대위는 새해 첫날 시작한 산단 조성 전면 재검토를 촉구하는 서명운동에 시민 800여 명이 참여했다고 10일 밝혔다. 공대위 제공세종스마트국가산단(이하 산단) 공동대책위원회는 산단 조성 사업 전면 재검토를 촉구하는 대시민 서명운동을 시작했다고 10일 밝혔다.공대위에 따르면, 지난 2일 시작된 서명운동에는 현재까지 시민 800여 명이 참여했다. 공대위 측은 시민 3천 명 이상 연서명을 목표로 조치원읍과 정부청사, 등산로, 대형마트 등 시민들이 많이 오가는 길목에서 진행 중이다.시민들이 서명한 문서는 세종시와 세종시의회에 각각 전달해 산단 조성 사업이 전면 재검토를 촉구할 계획이다.서명운동 참여 시민 3천 명 이상 목표는 시민 발의 조례 제정을 위한 요건이다.공대위 관계자는 ""주민뿐만 아니라 세종시민 대다수도 세종시 중심 생태녹지축을 훼손하고 마을공동체를 해체하는 산단 조성은 전면 재검토해야 한다는 목소리를 내고 있다는 것을 최민호 시장에게 분명히 전달하기 위해 서명운동을 시작했다""고 밝혔다.이어 ""세종시의회에도 시민들의 목소리를 전달해 산단 조성 사업 전면 재검토를 위한 결의안이 제정되고 채택될 수 있게 상병헌 시의회 의장과 시의원들을 설득할 예정""이라고 덧붙였다.공대위는 지난해 11월 산단 조성 예정지인 와촌리‧부동리 주민들과 가톨릭 대전교육 생태위원회, 세종환경운동연합, 정의당 세종시당 등이 산단 전면 재검토를 촉구하며 구성됐다.이들은 산단 조성 사업 전면 재검토를 해야 하는 이유로 △연서면 와촌리‧부동리 자연마을 7곳이 사라진다는 점 △7개 국가산단 후보지 중 다수 마을이 포함된 곳은 세종이 유일하다는 점 △마을주민 500여 명의 주거권, 경제권 등 생존권이 박탈되고 마을공동체가 해체돼 사실상 세종시를 떠나야 한다는 점 △세종시 '녹색' 중심부를 난개발로 훼손하는 제조업 산업단지 조성은 재고돼야 한다는 점 △산단 조성은 '사람'이 없는 이윤 추구만을 위한 도시개발사업이라는 점 △산단 조성 발표 전부터 부동산 투기가 이어져 '농지' 지가 폭등과 부동산 시장을 교란시킨다는 점 △인근 시도 국가산단과 지근거리에 인접해 있고 기존 산단도 비활성화 돼 있어 경제성이 불확실하다는 점 △현 경제상황으로는 비싼 용지비 등 국가예산 낭비와 산단 과잉개발 등 중복투자와 비효율성이 우려된다는 점을 들고 있다.※CBS노컷뉴스는 여러분의 제보로 함께 세상을 바꿉니다. 각종 비리와 부당대우, 사건사고와 미담 등 모든 얘깃거리를 알려주세요.이메일 : jebo@cbs.co.kr카카오톡 : @노컷뉴스사이트 : https://url.kr/b71afn"
2023.01.10.,[생활경제 이슈] 롯데온 ‘스포츠웨어 할인전’ 진행 外,url없음,<네이버 기사 없음>
2023.01.10.,"경남도, 2028년까지 지방하천 홍수방어율 50%까지 끌어올린다",https://n.news.naver.com/mnews/article/079/0003726015?sid=102,"하천재해 예방사업·일반하천 정비사업 추진하천재해예방사업. 경남도청 제공경상남도가 2028년까지 지방하천 홍수방어율을 50%까지 끌어올린다.도는 올해 자연재해에 안전하고 환경친화적인 지방하천 조성에 집중하겠다고 10일 밝혔다.이를 위해 올해 160억 원 규모의 신규사업 10곳을 포함해 모두 63곳 235.17km 구간에 1332억 원을 투입해 재해 예방사업을 추진한다. 또, 일반하천 33곳 12.48km에는 80억 원을 투입해 하천 제방을 정비한다.도는 지난해까지 지방하천 종합정비계획에 따라 모두 671곳의 지방하천 중 240곳에 1조 7390억 원을 들여 하천재해 예방사업을 추진해 728.42km를 정비했다. 재해예방과 소규모 하천 405곳 370.92km에는 984억 원을 들여 정비를 마무리했다.이와 함께 환경부의 '지역맞춤형 통합하천사업' 공모에 선정된 '밀양강 모례~가곡지구'에는 내년부터 10년에 걸쳐 국비 1175억 원을 포함해 2350억 원을 들여 도시하천 재자연화 및 친환경 수변공간 조성사업을 추진한다.경남도 정석원 환경산림국장은 ""자연재해에도 안전하고 환경친화적인 우수한 하천을 조성하도록 최선을 다하겠다""고 말했다.※CBS노컷뉴스는 여러분의 제보로 함께 세상을 바꿉니다. 각종 비리와 부당대우, 사건사고와 미담 등 모든 얘깃거리를 알려주세요.이메일 : jebo@cbs.co.kr카카오톡 : @노컷뉴스사이트 : https://url.kr/b71afn"
2023.01.10.,"""증권업종, 올해 투자의견 '중립'…PF·수익성 악화 전망""",https://n.news.naver.com/mnews/article/018/0005403135?sid=101,"KB증권 보고서[이데일리 이은정 기자] 지난해 코스피 지수 대비 약세를 보인 증권 업종이 새해 들어서는 강세를 보였다. 다만 올해 프로젝트 파이낸싱(PF) 리스크와 수익원 역성장에 투자의견 ‘중립’이 제시됐다. KB증권은 10일 지난해 증권 업종이 29.0% 하락하면서 코스피(-24.9%) 대비 약세를 보인 점을 짚었다. 은행의 예금금리 상승 등 안전자산의 기대수익률이 상승하고 개인투자자들의 이탈, 채권금리 상승과 주식시장 하락에 따른 트레이딩 및 상품 손익 악화 등이 영업환경 악화 요인으로 반영되면서다. 지난해 삼성증권, 미래에셋증권, NH투자증권, 한국금융지주, 키움증권의 합산 순이익은 2조7000억원으로 전년 대비 52.2% 감소할 것으로 전망했다. 강승건 연구원은 “2022년 3분기 확대된 부동산PF에 대한 우려는 4분기 증권사들의 유동성 리스크로 확산됐다”며 “정부의 증권사 및 증권사·건설사 보증 PF대출에 대한 유동성 공급 대책 발표에도 불구하고 CP금리는 높은 수준을 유지했다”고 전했다.새해 들어서는 한 주간 증권 업종이 4.2% 오르며 코스피(1.3%)보다 강세를 보였다. 국토부의 PF 시장 연착륙 지원 방안 발표와 2) 주거용 부동산 청약 관련 규제 완화가 발표되며 부동산PF 부실화에 대한 우려가 일부 완화된 영향이라는 판단이다. 다만 증권업종에 대한 투자의견은 ‘중립’을 유지했다. 잠재 Risk 완화로 증권사의 실적 변동성이 축소될 가능성이 존재하지만 지난 3~4년 동안 급증한 PF 사업장 모두가 정상화되기는 어려울 것이라고 봤다. 강 연구원은 “지금 경색돼 있는 유동성 문제가 완화된다면 PF 사업장의 옥석 가리기가 당연히 진행될 것으로 생각된다”며 “따라서 신용 리스크는 완화됐지만 해소된 것은 아니라고 판단된다”고 설명했다.2023년 증권사의 대부분의 수익원이 역성장 할 것으로 예상되고 트레이딩 및 상품 손익은 지난해의 낮은 기저로 인해 증가하겠지만 악화된 스프레드를 감안할 때 수익성은 과거 대비 악화된 흐름이 지속될 것으로 전망했다. 증권사 영업의 수익성 회복은 시간이 좀 더 필요하다고 판단했다.증권업종 최선호 종목으로 키움증권을 유지하고 한국금융지주를 관심종목으로 신규 편입했다. 키움증권은 부동산PF나 보유 투자자산의 손상 이슈에서 상대적으로 자유롭다는 평이다. 한국금융지주는 경쟁사 대비 부동산PF 관련 익스포저가 크다는 점 때문에 지난해 약세를 시현하였지만 정부의 부동산PF 연착륙 대책 발표로 우려감이 완화됐고 금융지주와 밸류자산운용이 보유한 카카오뱅크 지분을 한국투자증권으로 매각함에 따라 한국투자증권의 자본은 8조4000억원 수준으로 약 2조원 확대될 것으로 전망된다. 이는 발행어음 발행한도 확대, 레버리지 비율 부담 완화, IB 및 트레이딩 부문의 투자한도 확대로 이어질 수 있다고 봤다. 커버리지 5개 증권사의 2022년 4분기 합산 연결 지배주주 기준 순이익은 6036억원으로 전분기 대비 14.3% 증가, 전년동기대비 41.2% 감소할 것으로 전망했다. 4분기 실적의 특징은 △일평균거래대금이 5.8% (거래대금 기준 -7.3%) 감소하고 신용잔고가 감소하며 브로커리지 관련 이익 감소가 이어지고 △부동산 금융 위축과 주식시장 부진, 채권발행 부진 등으로 3분기 큰 폭의 이익 감소를 시현했던 IB 실적이 4분기에도 감소 흐름을 이어갈 것으로 전망했다.강 연구원은 “다만 4분기 주식시장 반등과 11~12월 채권금리 하락의 영향으로 트레이딩 및 상품 손익이 전분기대비 회복될 것으로 전망했다”며 “4분기 5개사 합산 자기자본이익률(ROE)는 6.5%로 여전히 부진한 수준을 유지할 것으로 전망된다”고 전했다."
