기사날짜,기사제목,네이버 뉴스 url,기사내용
2023.01.10.,"김관영 전북지사, 노인복지시설 위문",https://n.news.naver.com/mnews/article/079/0003725990?sid=102,"전주 신성양로원 찾아 종사자 격려노숙인 자립 돕는 전주다시서기 지원센터도 찾아김관영 전북도지사가 10일 전주다시서기 지원센터를 찾아 시설 종사자들을 격려하고 있다. 전북도 제공김관영 전북도지사가 10일 설 명절을 앞두고 노인복지시설 등을 찾아 이용자와 관계자를 위로했다.김 지사는 이날 전주 신성양로원을 방문해 ""경기 침체와 코로나19 등으로 봉사활동이 줄면서 노인들의 외로움이 깊어지고 있다""며 ""노인에게 따뜻한 보금자리가 돼 달라""고 시설 관계자를 독려했다.이어 노숙인의 사회복귀를 지원하는 전주다시서기 지원센터를 찾아 시설 종사원을 격려했다.김 지사는 ""힘들게 살아온 노숙인들이 소외되지 않고 가족의 정을 느낄 수 있도록 더 따뜻하게 돌봐 달라""고 당부했다.또한 위문품을 전달하면서 ""사회적 약자를 위한 나눔과 배려문화가 더 확산되도록 노력하겠다""고 했다.전주 평화동에 자리한 다시서기 지원센터는 노숙인의 자활을 돕고 있다.※CBS노컷뉴스는 여러분의 제보로 함께 세상을 바꿉니다. 각종 비리와 부당대우, 사건사고와 미담 등 모든 얘깃거리를 알려주세요.이메일 : jebo@cbs.co.kr카카오톡 : @노컷뉴스사이트 : https://url.kr/b71afn"
2023.01.10.,"SK-KGC, 亞 농구 정상을 향해…EASL 챔피언스 위크 일정 발표",https://sports.news.naver.com/news.nhn?oid=079&aid=0003725856,<구조 다름>
2023.01.10.,부산이 만든 아세안 영화 인재 양성소 'FLY' 3년만에 재가동,https://n.news.naver.com/mnews/article/079/0003725725?sid=102,"부산영상위원회, 코로나19로 중단된 '한-아세안 영화공동체 프로그램' 올해부터 재개'한아세안협력기금' 33억원 지원 확정돼 사업 탄력차세대 영화인재 육성사업 'FLY', 영화 영상기술 워크숍, 아세안문화원 협업사업 등 진행2025년까지 베트남, 라오스, 한국서 순차적 개최2018년 싱가포르에서 진행한 차세대영화인재육성사업(FLY) 워크숍 모습. 부산영상위 제공부산시가 주최하고 부산영상위원회와 부산아시아영화학교, 아시아영상위원회네트워크가 공동 주관하는 '한-ASEAN 영화공동체 프로그램'이 '한-ASEAN 협력사업'에 선정돼 33억 원의 한아세안협력기금을 지원받는다.'한-ASEAN 영화공동체 프로그램'은 영화·영상도시 부산이 축적한 영상산업과 인프라 구축 역량을 아세안 나라에 공유하고, 협력 시스템을 마련해 장기적인 동반성장을 이루기 위해 진행하는 사업이다. 지난 2012년부터 매년 진행하던 '한-아세안 차세대영화인재육성사업(FLY)'은 코로나19 대유행으로 인해 2020년부터 잠정 중단된 바 있다.2년 만에 재개되는 사업인 만큼, 부산영상위원회는 이번 협력사업 선정을 계기로 올해부터 2025년까지 '한-아세안 영화・영상문화 교류 확대를 통한 동반성장, 산업적・문화적 경쟁력 강화'라는 목표 아래 지금까지 1~2년 단위로 기획했던 프로그램을 3개년 단위로 확장해 사업 시너지를 극대화할 계획이다.구체적으로는 차세대영화인재육성사업 'FLY' 3회, 한-ASEAN 차세대영화·영상기술워크숍 3회, 아세안문화원 협업 사업(전시 3회, 작품 상영 2회), FLY영화제 1회 개최 등을 준비하고 있다.먼저, FLY는 아시아영화산업을 선도할 인재를 발굴·육성해 영화 인력 기반을 다지고 공동제작 네트워크를 활성화하는 것이 목표다. 아세안 10개국을 순회하며 2편의 단편영화를 제작하는 교육 프로그램을 진행하고, 2023년 베트남, 2024년 라오스, 2025년 한국 순으로 개최할 예정이다. 한-ASEAN 차세대 영화·영상기술 워크숍 역시 FLY 기간 중 개최지에서 열리는데, 여기서는 후반작업 인력을 대상으로 OTT 플랫폼용 작품 프로듀싱 전략부터 후반작업 워크플로우 등 기술 트렌드와 노하우를 공유한다.아세안문화원과의 협력 사업도 시도된다. 매년 아세안 구성국 내 공통적으로 존재하는 문화요소를 선정해 기획전시를 공동으로 개최하고, 해당 전시를 통해 FLY 졸업생들의 장·단편 영화를 상영하는 문화 교류 플랫폼을 마련할 예정이다. 이 외에도 FLY 사업의 성과로 만들어진 FLY 영화제를 개최해 FLY 졸업생들의 활약상과 사업 성과를 공유한다.강성규 부산영상위 운영위원장은 ""한-ASEAN 영화공동체 프로그램은 일종의 '영상 분야 부산형 공적개발원조(ODA)' 사업으로, 한-아세안협력사업의 문화부문에서 우수사업으로 평가받아왔다""고 전했다.이어 ""올해 FLY 개최지인 베트남은 BIE 회원국으로 2030 엑스포 유치를 위한 교섭 활동에 한 몫을 할 수 있으리라 본다""며 ""앞으로도 FLY를 중심으로 영화·영상도시 부산의 글로벌 경쟁력을 세계 무대로 옮겨 나가는 역할을 성실하게 수행하겠다""고 밝혔다.한편, FLY는 2019년까지 필리핀, 태국, 미얀마, 말레이시아, 캄보디아, 인도네시아, 싱가포르, 브루나이를 매년 순방하며 개최해, 한국을 포함한 14개국 178명의 차세대 아시아 영화 인재들을 육성했다.특히, 이들 졸업생이 다양한 국제영화제에 초청되거나 수상을 영광을 안으면서 FLY는 동남아시아 영화 인재 발굴의 요람으로 자리 잡고 있다.※CBS노컷뉴스는 여러분의 제보로 함께 세상을 바꿉니다. 각종 비리와 부당대우, 사건사고와 미담 등 모든 얘깃거리를 알려주세요.이메일 : jebo@cbs.co.kr카카오톡 : @노컷뉴스사이트 : https://url.kr/b71afn"
2023.01.10.,농산물 도매도 온라인으로…산지 유통은 규모·거점화,url없음,<네이버 기사 없음>
2023.01.10.,"하나카드, 새해 맞아 '원더카드' 선봬",url없음,<네이버 기사 없음>
2023.01.10.,"LF 하프클럽∙보리보리, 설 앞두고 '혜택 대잔치' 연다",https://n.news.naver.com/mnews/article/421/0006567364?sid=101,"설 선물SET 인기 브랜드 할인LF 트라이씨클은 설 연휴를 앞두고 '혜택 대잔치'를 통해 인기 브랜드의 상품을 특별 할인가로 판매한다.(하프클럽제공)(서울=뉴스1) 김진희 기자 = LF 트라이씨클은 설 연휴를 앞두고 '혜택 대잔치'를 통해 인기 브랜드의 상품을 특별 할인가로 판매한다고 10일 밝혔다.이번 행사는 프리미엄 패션 브랜드 아울렛 하프클럽과 유아동 쇼핑몰 보리보리에서 오는 12일까지 진행된다. 양 사이트는 명절을 맞아 차례 용품, 선물 등을 마련하는 회원들의 쇼핑을 지원하기 위해 최대 10%까지 할인되는 장바구니 쿠폰 2종을 증정한다.하프클럽에서는 독점 브랜드 12% 중복할인쿠폰을, 보리보리에서는 독점 브랜드 10% 중복할인쿠폰을 추가로 받을 수 있다. 사조, 동원 등 명절 시즌 인기 식품 브랜드부터 정관장, 정원삼 등 선물세트, 닥스 등 패션 브랜드가 대상이다. 최대 80% 할인율로 구성해 고물가에도 부담 없이 지인 간 마음을 나눌 수 있도록 선보인다.하프클럽과 보리보리는 행사 기간 각각 기획전 페이지에 댓글이벤트를 열고 새해 소망을 작성한 회원 중 2023명을 추첨해 1000원의 추가 적립금 혜택도 제공한다.LF 트라이씨클은 카카오페이와의 제휴를 통해 하프클럽과 보리보리에서 각각 8000원, 5000원 즉시할인 혜택을 제공한다. 사주닷컴, 휘닉스 호텔앤드리조트, 놀이의발견 등과 제휴해 양 사이트의 회원을 대상으로 신년 운세 서비스, 결제·숙박·여행 할인 등 다채로운 혜택을 선보인다.김도운 LF 트라이씨클 서비스마케팅본부 상무는 ""민족 최대 명절인 설을 지내기 위해 쇼핑에 나선 회원들에게 가정 경제의 부담을 덜어주고 양질의 상품을 공급할 수 있도록 이번 이벤트를 기획했다""고 말했다."
2023.01.10.,"홍준표 ""이재명 성남 FC모금 부적절 행위 분명…원망은 문재인 전 대통령에게""",https://n.news.naver.com/mnews/article/079/0003725788?sid=102,"윤창원 기자홍준표 대구시장이 이재명 더불어민주당 대표의 제3자 뇌물 수수죄 가능성을 직접 언급하고 나섰다.홍준표 시장은 10일 자신의 페이스북에 올린 글을 통해 ""제3자 뇌물수수죄는 박근혜 전대통령의 K스포츠, 미르재단 사건에서도 적용된 범죄인데 이미 대법원에서도 판례로 확정된 범죄 유형""이라며 ""성남시장 때 있었던 이재명 대표의 이번 사건도 집행기관인 시장의 업무에 속하는 인,허가권을 미끼로 성남 FC 지원금을  모금했느냐가 쟁점으로 까다로운 사건이 아니고 인,허가 서류만 수사하면 간단하다""고 밝혔다.또 ""이재명 대표 개인의 사욕이 아닌 자신이 구단주로 있던 성남 FC의 선전을 위해 모금했다는 정상이 있긴 하나 모금 방법은 부적절한 행위임은 분명하다""고 지적했다.그러면서 ""자신은 경남지사 시절부터 그 법리를 알고 있었고 또 지사는 시장과는 달리 집행기관이 아니고 지원기관이기 때문에 대가성있는 보답을 해 줄 수 있는 행정적 수단이 없어서 사법적 제재를 피해 갈수 있었다""고 말했다.홍 시장은 ""지금은 대구 FC를 운영하는 구단주로서 집행기관이기 때문에 이런 유형의 오해를 피하기 위해  대구FC 지원금 모금에는 일체 관여하지 않는다""며 ""전국의 지자체 단체장들, 특히 집행기관들은 이점을 유의해야 한다""고 주의를 당부했다.홍준표 시장은 ""과거에는 별 문제가 안되던 사건 유형이 박근혜 전대통령 사건을 계기로 주목을 받으면서 집행기관들의 행정 재량 폭을 훨씬 축소시킨 범죄가 된 것으로 법치주의의 엄격한 적용이라는 긍정적인 면도 있으나 지금 이재명 대표는 문재인 정권의 이른바 적폐청산의 부메랑을 맞고 있는 것""이라며 ""원망은 문재인 전 대통령에게 해야 할 것""이라고 밝혔다.※CBS노컷뉴스는 여러분의 제보로 함께 세상을 바꿉니다. 각종 비리와 부당대우, 사건사고와 미담 등 모든 얘깃거리를 알려주세요.이메일 : jebo@cbs.co.kr카카오톡 : @노컷뉴스사이트 : https://url.kr/b71afn"
2023.01.10.,"CJ제일제당, 티몬에서 ‘올인데이’로 고객 맞이",url없음,<네이버 기사 없음>
2023.01.10.,십년지기 축의금 '5천원 3장'…뭐가 그렇게 서운했니,https://n.news.naver.com/mnews/article/277/0005203366?sid=102,"""나한텐 모바일 청첩장 보냈더라""축의금 관련 누리꾼들의 갑론을박이 계속되는 가운데 최근 결혼한 한 직장인이 십년지기 친구로부터 축의금으로 5000원짜리 3장을 받았다는 사연이 올라와 온라인 커뮤니티를 뜨겁게 달구고 있다.지난 8일 직장인 익명 커뮤니티 '블라인드'에는 '축의금 5000원짜리 3장 넣은 친구'라는 제목의 게시물이 올라왔다. 자신을 호텔리어라고 밝힌 작성자 A씨는 ""식을 마치고 명부 확인과 함께 봉투를 살펴보니 평소 장난기 많고 친한 십년지기 친구가 5000원짜리 3장을 봉투에 넣었더라""는 내용을 작성했다.'5만원짜리 3장 넣는다는 걸 실수했나'라고 생각한 A씨는 ""그런데 5000원짜리 3장을 가지고 있기도 조금 어려운 일이고 이걸 친구에게 이야기해야 할지 말아야 할지 고민""이라고 토로했다.A씨는 그러면서 자신은 그 친구가 결혼할 때 축의금으로 30만원 냈다고 적었다. 이 사연을 접한 누리꾼들은 대부분 설마 장난이겠지라는 생각했다.  그러나 장난이 아니었다. A씨는 ""청첩장을 만들다보니 회사에 돌릴 수량이 많아져서 몇 몇 지인들에게 모바일 청첩장으로 보냈는데 그게 화근이었다""고 말했다. 그러면서 십년지기 친구와 나눈 카카오톡 대화 캡처 사진을 공개했다.지난 8일 직장인 익명 커뮤니티 ‘블라인드’에는 ‘축의금 5000원짜리 3장 넣은 친구’라는 제목의 글이 게재됐다. 사진=블라인드 캡처공개된 사진에서 A씨는 친구에게 5000원짜리 3장에 대해 실수냐고 조심스럽게 물었다. 그러자 친구는 ""실수 아니다. 누구는 종이로 청첩장 받았다던데, 나한테는 모바일 청첩장 보냈더라? 서운하더라""라고 답했다. 하지만 A씨는 이 친구도 자신에게 똑같이 모바일 청첩장을 보냈다고 했다.친하게 지낸 지 10년 넘은 친구인데 유독 이 친구만 이렇게 반응을 보이니 뭐라고 말할지 모르겠다고 호소했다. 이에 대해 누리꾼들은 ""손절해라"" ""그렇다고 그런식으로 축의금을 내는 건 아닌 것 같다"" ""사연이 있긴 하겠지만 그래도 좀 심했다"" 등 해당 친구에 대한 힐난했다. 한편 최근 축의금관련 논쟁이 잇따르고 있다. 앞서 블라인드에는 ""축의금 10만원 내고 아내랑 밥먹었냐""고 면박 준 선배에 대한 사연이 올라와 눈길을 끌었다. 이어 ""밥값만 8만8000원인데 5만원 냈네""라는 글 또한 최근 논란이 됐다. 또 지난 8일에는 “입사 4주만에 결혼하고 축의 챙기고 퇴사했다”는 글이 누리꾼들의 입방아에 오르기도 했다."
2023.01.10.,"하동군, 귀농·귀촌인 지원 맞춤형 시책 추진…귀농인의 집 조성 등",https://n.news.naver.com/mnews/article/421/0006567438?sid=102,"하동군청 전경.(하동=뉴스1) 한송학 기자 = 경남 하동군은 귀농·귀촌 분야 지원사업을 대폭 늘리고 안정적 정착을 위해 다양한 맞춤형 시책을 펼친다고 10일 밝혔다.주요 사업은 원주민과 귀농·귀촌인의 화합을 위한 '귀농인 주민초청행사지원', 귀농인 주거안정을 위한 '귀농인 주택수리비 지원', 농촌 빈집을 활용한 '귀농인의 집 조성' 등이다.지방소멸대응기금을 확보해 귀농인 주택수리비 지원과 귀농인의 집 조성사업은 지난해 대비 사업량이 15개 이상씩 늘었다.올해 새롭게 추진되는 사업은 귀농·귀촌인에게 영농기술 및 경영·마케팅 창업 등에 필요한 단계별 실습교육의 기회를 제공하는 귀농귀촌 사관학교 운영, 귀농 초기 농촌현장에서 겪는 다양한 애로사항을 해결하도록 도와주는 1대 1 밀착관리 귀농헬퍼다.귀농·귀촌 홍보 활성화를 위해 통합플랫폼 구축을 위한 홈페이지 개편과 슬기로운 농촌생활을 담은 가이드북 제작, 귀농귀촌지원센터 카카오톡 채널 운영 등으로 도시민 유치 사업도 추진한다.지난해에 이어 초기 정착을 지원하는 귀농인 영농정착 지원, 안정 정착지원, 귀농인 주택 건축설계비 지원, 귀농인의 자가 농산물을 활용한 창업지원 사업인 귀농인 창업농 육성지원사업도 계속 한다.하승철 군수는 “지역소멸 위기를 극복해 지속가능한 발전을 위해 더 많은 귀농·귀촌인이 인생 2막을 펼칠 수 있는 ‘귀농귀촌의 메카’ 하동이 될 수 있도록 지원을 아끼지 않겠다”고 말했다."
2023.01.10.,"이재명, 檢 출석…""소환조사는 정치검사의 함정, 당당히 맞설 것""[영상]",https://n.news.naver.com/mnews/article/079/0003725756?sid=102,"오전 10시 20분 검찰 출석 ""대한민국 헌정사 초유의 현장""""프로축구 고사, 지방자치 망가져도 상관없다는 태도에 분노""""檢, 답 정해놓은 '답정기소'…법정서 진실 가릴 수밖에""'성남FC 후원금 의혹' 사건과 관련해 더불어민주당 이재명 대표가 10일 오전 경기도 성남시 수원지방검찰청 성남지청에 피의자 신분으로 조사를 받기 위해 출석하고 있다. 연합뉴스더불어민주당 이재명 대표가 '성남FC 후원금 의혹'의 피의자 신분으로 10일 수원지검 성남지청에 출석해 ""특권을 바란 바도 없고 잘못한 것도 없고 피할 이유도 없으니 당당하게 맞서겠다""고 말했다.이 대표는 이날 오전 10시 20분쯤 정장 차림으로 수원지검 성남지청에 출석했다.검찰 포토라인 앞에 선 이 대표는 ""지금 우리는 대한민국 헌정사 초유의 현장, 그 자리에 서 있다""며 ""불의한 정권의 역주행을 이겨내고 역사는 전진한다는 명백한 진리를 증명한 역사의 변곡점으로 기록되기를 바란다""고 말문을 열었다.이어 ""불가침의 성벽을 쌓고 달콤한 기득권을 누리는 이들이 오직 이재명 제거에만 혈안이 됐다""며 ""프로축구가 고사를 해도, 지방자치가 망가져도, 적극행정이 무너져도 상관없다는 그들의 태도에 분노한다""고 덧붙였다.'성남FC 후원금 의혹' 사건과 관련해 더불어민주당 이재명 대표가 10일 오전 경기도 성남시 수원지방검찰청 성남지청에 피의자 신분으로 조사를 받기 위해 출석하며 입장 발표를 하고 있다. 연합뉴스이 대표는 또 ""'소환조사는 정치검사가 파논 함정'이라는 것을 잘 알고 있다""며 ""특권 바란 바도 없고 잘못한 것도 없고 피할 이유도 없으니 당당하게 맞서겠다""고 강조했다.그는 특히 ""검찰이 기소에 목표를 두고 수사를 맞춰가는 '답정기소'는 누구나 다 아는 사실""이라며 ""결국 진실은 법정에서 가릴 수밖에 없다""고 말했다.이후 이 대표는 함께 성남지청을 찾은 민주당 의원들과 인사를 나눈 뒤 조사실로 들어갔다.이날 검찰청사 밖에서는 진보(1500명)와 보수(500명) 성향 단체의 장외전이 열렸다.'성남FC 후원금 의혹' 사건과 관련해 더불어민주당 이재명 대표가 10일 오전 경기도 성남시 수원지방검찰청 성남지청에 피의자 신분으로 조사를 받기 위해 출석하며 입장발표를 하고 있다. 연합뉴스성남FC 의혹은 이 대표가 성남FC 구단주이던 2014~2018년 당시 6개 기업(두산건설·네이버·농협·분당차병원·알파돔시티·현대백화점)들로부터 약 160억원 상당의 후원금을 받고 인허가 편의 등을 제공했다는 내용이다.검찰은 이 대표가 직접 뇌물을 수수하진 않았지만, 각 기업들로부터 후원금(뇌물)을 받고 그 대가로 용도변경 등 특혜를 제공했다며 제3자 뇌물 혐의를 적용했다.검찰은 이날 이 대표를 상대로 기업 6곳으로부터 후원금·광고비를 받게 된 경위와 과정을 하나씩 확인할 것으로 보인다. 특히 각 기업들이 성남FC에 후원금을 낸 시기와 용도변경 등 인허가를 따낸 시점이 맞물리는 이유 등을 캐물을 것으로 보인다.두산건설은 2015년 성남시와 분당구 정자동 병원부지(3천여평) 용도를 상업시설로 변경하고, 용적률을 높이는(250%→960%) 협약을 맺었다. 이후 2017년까지 광고비 명목으로 42억원을 분할 지급했다.'성남FC 후원금 의혹' 사건과 관련해 더불어민주당 이재명 대표가 10일 오전 경기도 성남시 수원지방검찰청 성남지청에 피의자 신분으로 조사를 받기 위해 출석하고 있다. 연합뉴스2015년 판교역 개발업체인 알파돔시티도 5억 5천만원을 후원했다. 성남시가 판교지구 주차장 관련 지구단위계획 지침을 변경한 지 11일만이었다.네이버는 2015년과 이듬해 사단법인 희망살림을 통해 40억원을 우회 지원했다. 그 무렵 네이버 제2사옥의 용적률은 상승했다. 또 사옥 바로 옆을 지나는 분당수서간 고속화도로 쪽으로 주차장 입구도 변경됐다. 사유지에서 고속도로로 곧바로 진출입이 가능해진 것이다.'성남FC 후원금 의혹' 사건과 관련해 더불어민주당 이재명 대표가 10일 오전 경기도 성남시 수원지방검찰청 성남지청에 피의자 신분으로 조사를 받기 위해 출석하며 마스크를 쓰고 있다. 연합뉴스결국 검찰은 기업들이 이같은 현안들을 해결하는 대가로 후원금을 냈다고 보고 있다. 그 배경에는 이 대표가 자신의 정치적 업적을 쌓기 위해 성남FC 후원금을 모금했다고 판단하고 있다.하지만 이 대표는 줄곧 성남FC 구단뿐 아니라 성남시민에게 도움이 된 모범 사례라고 주장해 왔다. 이 대표 측은 ""성남FC 광고를 유치하면 그만큼 세수가 늘어나고 결국 시민들에게도 이익이 됐다""며 ""그러나 검찰은 마구잡이식 수사를 하고 있다""고 밝혔다.이처럼 양측의 입장이 첨예하게 대립하면서 이 대표에 대한 조사는 장시간 이어질 전망이다.※CBS노컷뉴스는 여러분의 제보로 함께 세상을 바꿉니다. 각종 비리와 부당대우, 사건사고와 미담 등 모든 얘깃거리를 알려주세요.이메일 : jebo@cbs.co.kr카카오톡 : @노컷뉴스사이트 : https://url.kr/b71afn"
2023.01.10.,"부산대, 차량용 반도체 분야 전문가 7인 특임교수 임명",https://n.news.naver.com/mnews/article/079/0003725907?sid=102,"핵심요약차량용 반도체 연구 주도권 확보 위해차량용 반도체, 2030년까지 100조 원 이상의 시장으로 성장할 듯부산대학교 제공부산대학교가 차량용 반도체 분야 연구를 위해 기업과 연구소 등의 전문가 7명을 특임교수로 임명하고 반도체 산업 연구를 주도해 가기로 했다.부산대학교는 10일 우리나라 차세대 유망 반도체 분야인 차량용 반도체 교육 혁신을 위한 산·학·연 협력의 토대를 마련하기 위해 '차량용 반도체 산업체 및 연구소 전문가 7명에 대한 특임교수 임명식'을 9일 오후 개최했다고 밝혔다. 이번 임명식에서는 △ 황철주 주성엔지니어링㈜ 회장 △ 김영삼 KEI Consulting 대표이사(전 한국전자기술연구원장, 전 산자부 무역투자실장) △ 원제형 도쿄일렉트론코리아㈜ 대표이사 △ 미요시 케이타 히타치하이테크코리아㈜ 회장 △ 박재홍 ㈜보스반도체 대표이사 △ 정태경 세메즈㈜ 대표이사 △ 방욱 한국전기연구원 전력반도체연구단장 등 모두 7명이 특임교수로 임명됐다.이날 임명된 전문가 특임교수들은 앞으로 부산대의 반도체 교육 방향 및 전략 설정에 자신들의 연구 경험을 적극 활용해 부산대의 반도체 분야 대내외 교류·협력 및 학술·연구 관련 활동을 수행하게 된다. 차량용 반도체는 메모리 반도체 등과 함께 3대 반도체 분야로 급성장 중인 우리나라 차세대 먹거리 분야이며, 최근 매킨지 보고서에 따르면 2030년 100조 원 이상의 시장으로 크게 성장할 것으로 전망된다. 이와 관련해 부산시도 2013년부터 부·울·경 지역을 차량용 반도체(파워반도체 포함) 특화지역으로 발전시키기 위해 노력하고 있다.※CBS노컷뉴스는 여러분의 제보로 함께 세상을 바꿉니다. 각종 비리와 부당대우, 사건사고와 미담 등 모든 얘깃거리를 알려주세요.이메일 : jebo@cbs.co.kr카카오톡 : @노컷뉴스사이트 : https://url.kr/b71afn"
