기사날짜,기사제목,네이버 뉴스 url,기사내용
2023.01.26.,"""서울시 심야할증요금 조정과 카카오T 탄력호출료..택시난 완화""",https://n.news.naver.com/mnews/article/014/0004960155?sid=105,"지난해 국토부 ‘심야 택시난 완화 대책’ 등 플랫폼에 적용연말 수요 급증에도 수도권 심야 승차난 전반적으로 완화플랫폼도 기술력으로 불필요한 호출료 부담 최소화 노력 오늘 밤 10시부터 카카오T 심야호출료 인상 (서울=연합뉴스) 신현우 기자 = 밤 10시부터 카카오T의 택시 심야 호출료가 인상되는 3일 오후 서울역 택시 승강장에 카카오 택시가 대기하고 있다. 국토교통부는 이날 오후 10시부터 서울을 비롯한 수도권 지역에서 카카오T를 운영하는 카카오모빌리티가 심야 탄력 호출료를 적용한다고 밝혔다. 밤 10시부터 새벽 3시 사이 택시를 부르면 카카오T블루 같은 가맹택시는 최대 5천원, 카카오T 같은 중개택시는 최대 4천원의 호출료를 붙일 수 있다. 2022.11.3 nowwego@yna.co.kr (끝)   [파이낸셜뉴스] 정부가 지난해 추진한 '심야 택시난 완화 대책'이 승차난 해소에 일부 효과가 있었던 것으로 조사됐다. 서울시의 심야 할증 요금 조정과 택시 플랫폼사들의 빅데이터 기반 탄력호출료 부과 등이 영향을 미친 것으로 분석됐다.   26일 업계에 따르면 지난해 연말 서울을 포함한 수도권 심야시간 택시 배차성공률이 크게 개선된 것으로 나타났다.   카카오모빌리티가 카카오T 애플리케이션(앱)에서 발생한 중형택시 호출수 및 출근 기사수를 조사한 결과에 따르면, 지난해 12월 수도권 심야 시간대(오후 10시~익일 새벽 3시) 배차성공률은 지난 6월 대비 16.2%p 개선됐다. 지난해 6월은 사회적 거리두기에 이어 실외 마스크 착용 의무가 해제되면서 심야 택시 수요가 가장 높았던 시기다. 12월도 심야 택시난 완화 대책 시행 이후 연말 택시 수요가 높았던 기간이다.   수도권 심야시간 택시 배차성공률이 개선된 배경에는 '심야 택시난 완화 대책'이 있다. 국토교통부는 지난해 10월 수도권에서 심야시간 일반택시 호출료를 탄력적으로 적용하는 등의 방침을 담은 대책을 발표한 바 있다.   카카오T 등 택시 플랫폼 역시 심야 탄력호출료를 각 지역 수요공급 분포, 요일, 기상상황 등에 맞춰 최적화해 적용했다. 지난해 12월 기준 서울지역 심야 시간대 탄력호출료(일반부스터호출료)는 택시 호출 승객이 밀집된 마포구, 영등포구, 강남구 등과 서울 외곽 지역 차이가 뚜렷했다.   카카오모빌리티 측은 ""플랫폼의 빅데이터 분석 및 최적화 기술을 통해 꼭 필요한 만큼만 탄력호출료가 부과되도록 했다""며 ""불필요한 호출료 부담은 줄이고 배차성공률은 높이는 효과를 낳을 수 있었다""고 설명했다. #카카오모빌리티 #심야택시 #중형택시"
2023.01.26.,"공정위, 네이버·카카오 ‘문어발 확장’ 막는다…빅테크 플랫폼 담합 감시 강화",https://n.news.naver.com/mnews/article/366/0000872258?sid=101,"공정위 2023년 주요 업무계획 보고        공정거래위원회가 올해 ‘네카라쿠배’(네이버·카카오·라인·쿠팡·배달의민족)로 대표되는 거대 온라인플랫폼을 정조준하고 나섰다. 지배력 확장 우려가 큰 인수·합병(M&A) 심사를 더욱 강화하고, 플랫폼 분야를 따로 떼내어 담합 등 시장 반칙행위를 중점적으로 감시하겠다고 나서면서다. 쇼핑, 모빌리티 사업 등을 통해 골목상권까지 파고드는 빅테크 기업들의 문어발 확장을 막는 데 역량을 집중하겠다는 것이다.더불어 외국인을 국내 대기업집단 총수(동일인)로 지정할 수 있도록 구체적인 기준을 만들기로도 했다. 사실상 플랫폼 기업인 쿠팡의 김범석 의장을 대기업 총수를 의미하는 동일인으로 지정하기 위한 위한 초석을 마련하는 것이라는 해석이 나온다. 당근마켓 같은 중고 거래 C2C(개인 간 거래) 플랫폼에서 발생하는 소비자 피해를 막기 위해서도 공정위가 역할을 하기로 했다.공정거래위원회는 26일 서울 용산 대통령실에서 윤석열 대통령에게 이런 내용을 담은 올해 공정위 주요 과제를 업무 보고 했다. 공정위는 ▲경쟁 촉진 ▲공정한 거래 기반 ▲대기업집단 정책 ▲소비자 보호 등 4대 핵심과제를 뼈대로 제시했는데, 곳곳에 플랫폼 기업들을 겨냥한 조치들이 다수 포함됐다. 공정위의 올해 역점 업무가 온라인플랫폼 공정 경쟁 질서 구축이라는 점을 보여주는 대목이다.한기정 공정거래위원장이 26일 정부서울청사에서 새해 업무보고 내용을 브리핑하고 있다. /공정위 제공  빅테크 M&A 심사·신고 엄격하게…플랫폼 ‘눈속임 상술’ 단속        공정위 업무보고에 따르면, 공정위는 올해 특히 디지털 시장에 대한 점검을 강화할 방침이다. 반도체·애플리케이션(앱)마켓 등 디지털 기반 산업과 모빌리티·오픈마켓 등 핵심 플랫폼 분야에서 독점력을 남용하는 행위를 중점적으로 점검한다는 계획이다.빅테크는 지배력 확장을 우려해 M&A 심사·신고 기준 보완을 검토하는 한편, 빅테크 기업 독점력 남용을 효과적으로 제어할 규율 체계도 마련한다. 내·외부 전문가 태스크포스(TF)팀을 구성해 현행법이 플랫폼 특유의 독점력 남용 행위 유형을 규제하는데 충분한지 등을 두루 살피겠다는 방침이다.경기도 성남시 카카오 판교오피스의 모습. /뉴스1        담합 행위도 중점적으로 조사한다. 특히나 서비스 혁신 플랫폼 분야의 경우 기존 사업자단체의 신규 플랫폼 진입이나 사업 활동을 방해하는 행위가 없는지를 들여다볼 방침이다. 온라인동영상서비스(OTT) 시장의 실태조사를 통해 거래구조나 불공정 거래 관행도 점검하겠다는 계획이다.담합행위 3대 주요 감시대상 분야. /공정거래위원회 제공        공정위가 추진해 온 플랫폼과 입점업체 간 자율규제 원칙 역시 그대로 유지하되, 그 영역을 점차 확장할 방침이다. 1분기 중 오픈마켓·배달앱 분야에서 현행법으로 규율하기 어려운 계약 관행을 개선하기 위해 자율규제를 유도하고, 표준입점 계약서 마련, 수수료 결정 과정의 투명성 확보, 분쟁조정 기구 설치 등 소상공인의 협상력을 높일 수 있는 장치를 도출할 방침이다. 이후 숙박앱·앱마켓 등 주요 업종으로 자율규제 논의를 확산할 예정이다.온라인 소비 공간에서 나타나는 새로운 소비자 이슈에 대해서도 공정위는 적극적으로 대응한다. 별도의 추가 고지 없이 서비스를 자동 갱신·결제하거나 가입 해지를 어렵게 만드는 대형 플랫폼의 눈속임 상술, 이른바 ‘다크패턴’에 대한 실효적인 규율을 만들고, 화장품·건강기능식품 등 중소 입점업체를 중심으로 발생하는 뒷광고·이용후기 조작에 대한 점검도 강화한다.최근 수요가 증가한 분야의 점검 대상이 되는 불공정약관 내용. /공정거래위원회 제공        중고거래·리셀(resell)을 중개하는 C2C 플랫폼 사업자와 함께 이용자 사기 피해 예방책, 분쟁 해결 방안도 마련한다. 단 사업자 성격의 판매자에 대해서는 전자상거래법을 적극적으로 집행할 예정이다. 동시다발적인 소비자 피해 확산을 신속히 막게끔 ‘임시중지명령’의 발동 요건을 ‘법 위반이 현저히 의심되는 경우’로 바꾸고, 집단 분쟁조정 신청 요건도 ‘피해 소비자가 50명 이상임이 명백히 예상될 때’로 완화하는 등 제도 개선에도 나선다.김범석 쿠팡 의장이 미국 뉴욕증권거래소(NYSE) 앞에서 포즈를 취하고 있다. /NYSE 제공  외국인 총수 지정 기준 마련…대기업집단 기준 GDP 연동으로        이번 업무보고에는 대기업집단 제도를 합리적으로 운영하기 위한 방안도 담겼다. 외국인을 국내 대기업집단 동일인으로 지정할 수 있는 기준을 명확히 마련하겠다는 방침이 포함됐다. 쿠팡 등 일부 기업을 중심으로 한국계 외국인이 지배하는 기업집단이 속속 등장하는 가운데, 외국인이나 이중국적자인 동일인 배우자 혹은 2·3세 사례가 증가해 향후 대기업집단 제도와 관련해 불거질 형평성 문제를 대비하기 위해서다.공정위 관계자는 “배우자나 동일인 2·3세가 외국인이거나 이중국적자인 대기업집단이 10여개로 잠정 파악되고 있다”고 했다.또 현행 자산총액 5조원 이상으로 설정된 공시대상기업집단 기준을 국내총생산(GDP)과 연동하거나 아예 기준 금액을 상향 조정하는 방안도 추진된다. 관련 법이 마련된 2009년 이후 위 기준은 변함이 없는데 경제 규모는 증가해온 데다가, 내년부터 기존 10조원 이상에서 명목 GDP의 0.5% 이상으로 변경되는 상호출자제한기업집단 기준과의 정합성을 고려한 조치다.부당내부거래에 대해선 엄정한 법 집행 원칙을 강조했다. ▲경영권 승계를 위한 편법적 부의 이전 ▲독립·중소기업의 경쟁력을 잠식하는 부당 지원 ▲부실 계열사 부당 지원 등을 살펴보는 한편, TRS(총수익스와프)처럼 부당 지원이나 채무 보증 금지의 우회 수단으로 활용될 우려가 있는 금융상품 실태를 점검할 예정이다. ‘사익편취 심사 지침’을 조만간 개정해 부당 내부 거래에 대한 법 적용 기준도 명확히 한다.소속사와 정산 등 불공정 계약 문제로 갈등을 빚은 가수 츄(왼쪽·본명 김지우)와 이승기. /뉴스1        이 밖에 소비자안전기본법을 제정하고, 사업자의 안전 책임 강화를 위해 표시·광고 제도를 개선할 계획이다. 최근 수요가 증가한 오디오북 등 구독 서비스, 라이브커머스, 모빌리티, 여행·숙박, 공유오피스·청년주택 임대차, 리셀 관련해 불공정약관을 점검하고, 스마트폰·오픈마켓, 아이돌 굿즈·완구 온라인 시장, 유사 투자자문업 분야 미신고 전화 권유 판매 등 소비자 피해 빈발 업종에의 불공정 행위도 집중 점검 대상이다.또 ▲웹소설 분야 2차 저작물 작성권 제공 강요 ▲음악 저작권 시장 신규 사업자 진입 방해 ▲소셜미디어(SNS)를 통한 부당고객유인 등 콘텐츠 분야를 비롯해, 최근 이승기·츄 등 사태로 조명된 연예기획사와 연예인 간 거래 관행에 대한 실태조사를 바탕으로 한 표준계약서 개정 및 불공정 계약 강요 행위 등 감시도 이뤄질 전망이다.공정위는 이런 경쟁 정책 외에도, 공정위 자체 법 집행 시스템도 개선하기로 했다. 현장 조사 시 조사 공문에 법 위반 혐의 관련 거래 분야·유형, 중점 조사 대상 기간의 범위를 명확하게 기재해 고지하는 등 불투명한 조사 관행을 개선하고, 장기·시효 임박 사건은 단계를 부여해 체계적으로 관리한다는 방침이다. 조사와 심판 부서를 분리 운영하고 해당 부서 간 인사이동도 제한하기로 했다."
2023.01.26.,"닥터나우, 네이버·카카오 이끌던 김상헌·여민수 사외이사로 선임",url없음,<네이버 기사 없음>
2023.01.26.,"LG유플러스, 카카오 최고 인기 캐릭터 ‘춘식이’ 키즈폰 단독 출시",https://n.news.naver.com/mnews/article/243/0000038778?sid=105,"춘식이 캐릭터 바탕화면 및 테마 적용한 키즈폰으로 미취학 아동, 초등학생 공략‘U+키즈폰 with 춘식이’ [사진 LG유플러스][이코노미스트 원태영 기자]LG유플러스는 자녀의 올바른 금융습관과 스마트폰 사용습관 형성을 도와주는 아동 전용 디바이스 ‘U+키즈폰 with 춘식이’를 27일 단독 출시한다.U+키즈폰 with 춘식이는 지난해 1월 출시된 ‘U+키즈폰 with 리틀카카오프렌즈’에 이어 LG유플러스가 6번째로 내놓은 미취학 아동 및 초등학생 전용 스마트폰이다. 삼성전자의 ‘갤럭시 XCover 5’ 모델을 기반으로 제작된 이번 키즈폰은 카카오 최고 인기 캐릭터 춘식이가 바탕화면 및 테마에 적용됐다.상품 패키지는 ▶전용 케이스 2종(캐릭터 케이스/투명 카드 케이스) ▶숄더 스트랩 ▶액정보호필름 ▶색칠놀이용 컬러링 페이퍼 2장 ▶키링 등으로 구성됐다. 색상은 화이트와 민트 2종이며, 출고가는 32만2000원이다.이번 키즈폰은 전작과 대비해 자녀의 금융습관 형성을 위한 하나은행의 금융 앱 ‘아이부자’를 탑재하고, 올바른 스마트폰 사용 습관을 기를 수 있도록 도와주는 앱 ‘U+키위플레이’의 기능을 개선한 것이 특징이다.하나은행의 아이부자 앱은 아이 스스로 금융 생활을 경험하고 올바른 습관을 기를 수 있도록 도와주는 앱이다. 아이부자와 함께 선탑재된 U+키위플레이는 LG유플러스가 ‘키위플러스’와 협업해 제작한 자녀 보호 앱이다. 이번에 새롭게 업데이트된 U+키위플레이는 UI/UX를 직관적으로 개선해 이용 편의성을 높였으며, 자녀의 스마트폰 사용 이력과 학교 소식 등을 쉽게 확인할 수 있다.아울러 ▶자녀의 이동 경로 표시 ▶앱 사용 시간대 모니터링 ▶유해 콘텐츠 차단 기능 개선을 통해 자녀 보호 기능을 강화했다. 이외에도 자녀가 습관을 설정하고 인증샷을 남기면 부모가 보상을 해주는 ‘찰칵, 습관기르기’를 비롯 소리/진동 원격 제어 기능, 스마트폰 과의존 방지 콘텐츠 등을 추가해 자녀가 올바른 스마트폰 사용 습관을 형성할 수 있도록 도와준다.한편 LG유플러스 공식 온라인 몰인 ‘유플러스닷컴’에서는 키즈폰 출시를 기념해 이달 말까지 온라인으로 구매한 고객 중 자사가 제공한 별도 양식을 통해 구매 후기를 남기는 고객에게 카카오페이 머니 4만원을 증정하는 이벤트를 다음달 7일까지 실시한다.또 LG유플러스 무너카드를 신청한 LG유플러스 모바일 고객 전원에게 용돈 5000원을 제공하는 이벤트를 오는 2월 6일부터 6월 30일까지 진행한다."
2023.01.26.,모두가 기여한 네이버·카카오 데이터…나눠 쓸 길 열릴까,https://n.news.naver.com/mnews/article/028/0002624809?sid=105,"과기정통부 제1차 데이터산업진흥 기본계획“공정한 데이터 접근 원칙 마련…실행안 찾을 것”게티이미지뱅크정부가 네이버·카카오 등 대형 플랫폼 기업들이 서비스를 운영하며 축적한 데이터를 플랫폼 입점 기업과 개인 회원들도 활용할 수 있도록 데이터 접근 원칙을 만들기로 했다.정부는 26일 서울 강남구에 위치한 인공지능·영상기술 스타트업 ‘하이퍼커넥트’ 본사에서 한덕수 국무총리 주재로 제2차 국가데이터정책위원회를 열어, 지난해 9월 발표된 국가 디지털 비전 ‘대한민국 디지털 전략’의 데이터·인공지능 분야 후속 계획으로 준비된 ‘제1차 데이터산업 진흥 기본계획’과 ‘인공지능 일상화 및 산업 고도화 계획’을 논의·심의했다.과학기술정보통신부는 데이터산업 진흥 기본계획에서 “데이터에 대한 공정한 접근 원칙을 세우고 구체적 실행 방안을 찾겠다”고 밝혔다. 네이버·카카오 등 대형 플랫폼 기업이 서비스를 운영하는 과정에서 축적한 고객 데이터를 플랫폼 운영사뿐 아니라 입점 기업과 개인 회원들도 접근해 활용할 수 있도록 하겠다는 것이다.김보경 과기정통부 데이터진흥과장은 “플랫폼 입점 기업들이 기여한 데이터에 대해 접근성을 가질 수 있어야 한다는 원칙 아래, 접근 허용 범위와 방식 등을 논의해가려 한다”고 설명했다. 이어 “플랫폼 기업들이 적지 않은 투자를 해 가며 축적·관리해 온 데이터가 부정적으로 활용되는 걸 막기 위한 방안도 함께 논의할 것”이라고 말했다.민간·공공 보유 데이터를 쉽게 검색하고, 그 데이터의 품질과 가치 등을 함께 확인할 수 있는 ‘원(One)-윈도우’ 데이터 플랫폼도 연내에 구축한다. 또 분야별 데이터의 융합 활용을 촉진하기 위한 ‘국가 표준화 맵’도 만든다. 이를 통해 누구나 필요한 데이터를 편하게 찾고 활용할 수 있는 환경을 조성한다는 구상이다.데이터의 자유로운 활용을 저해하는 규제도 정비할 계획이다. 과기정통부는 이를 위해 ‘민·관 합동 법제 정비단’을 운영하겠다고 밝혔다. 또 마이데이터 전송방식 표준화 적용 범위를 기존 금융 분야에서 의료·통신 등 다른 분야로 넓혀갈 계획이다. 공공 분야에서는 행정뿐 아니라 입법 분야로도 데이터 개방 범위를 넓히겠다고 밝혔다.엄열 과기정통부 인공지능기반정책관은 “데이터는 인공지능 기술 발전을 좌우하고 경제·사회 전반의 혁신을 가속화하는 디지털 시대의 원동력이지만 여전히 양질의 데이터가 부족하고 민간의 시장 참여가 더디다”며 “민·관 협력을 통해 전향적인 데이터 공유·개방, 과감한 제도 혁신, 선제적 투자 등을 추진하겠다”고 말했다.인공지능 일상화 및 산업 고도화 계획에는 행정 업무를 넘어 입법·사법 영역에도 인공지능 기술을 활용하는 등 공공 분야의 인공지능 활용 범위를 넓혀 대규모 수요를 창출하겠다는 내용 등이 담겼다.이날 국가데이터정책위 회의에선 고용노동부의 고용 데이터 개방·확대 방안, 통계청의 통계등록부를 이용한 데이터 융합 활용 활성화 방안 등도 함께 논의됐다."
2023.01.26.,카카오 '춘식이' 키즈폰 나온다…LGU+ 27일 출시,https://n.news.naver.com/mnews/article/003/0011658688?sid=105,"기사내용 요약춘식이 캐릭터 바탕화면·테마 적용아이부자 앱으로 자녀의 올바른 금융습관 형성출고가 32만2000원[서울=뉴시스] LG유플러스는 '유플러스 키즈폰 위드 춘식이'를 27일 단독 출시한다고 26일 밝혔다. 사진은 LG유플러스 키즈 모델이 '유플러스 키즈폰 위드 춘식이'를 소개하는 모습. (사진=LG유플러스 제공) *재판매 및 DB 금지[서울=뉴시스]윤정민 기자 = LG유플러스는 26일 카카오 캐릭터 '춘식이'를 모델로 한 '유플러스 키즈폰 위드 춘식이'를 27일 출시한다고 밝혔다.이 키즈폰은 지난해 1월 출시한 '유플러스 키즈폰 위드 리틀카카오프렌즈'에 이어 LG유플러스가 6번째로 내놓은 미취학 아동 및 초등학생 전용 스마트폰이다.상품 패키지는 전용 케이스 2종(캐릭터 케이스·투명 카드 케이스), 숄더 스트랩, 액정보호필름, 색칠놀이용 컬러링 페이퍼 2장, 열쇠고리 등으로 구성했다. 색상은 화이트와 민트 2종이며, 출고가는 32만2000원이다.이 키즈폰은 자녀의 금융습관 형성을 위한 하나은행 금융 앱 '아이부자'를 탑재했다. 올바른 스마트폰 사용 습관을 기를 수 있도록 도와주는 앱 '유플러스 키위플레이' 기능도 개선한 것도 특징이다.아이부자 앱에는 모으기(용돈·미션·저축), 쓰기(결제·송금·출금), 불리기(주식투자체험), 나누기(기부) 4가지 기능이 있다. 부모도 함께 사용하며 자녀와 소통할 수 있다.아이부자 이용 고객은 앱과 연결된 충전형 선불카드 'LG유플러스 무너카드'도 발급받을 수 있다. LG유플러스 대표 캐릭터 '무너'가 그려진 이 카드는 자녀 본인의 이름으로 발급받을 수 있다. 일 5만원·월 50만원 결제 한도로 계획적인 소비를 돕는다. LG유플러스 모바일 고객은 앱을 통해 비대면으로 카드를 발급받을 수 있다.유플러스 키위플레이는 사용자 환경(UI)·경험(UX)을 직관적으로 개선해 이용 편의성을 높였으며, 자녀 스마트폰 사용 이력과 학교 소식 등을 쉽게 확인할 수 있다.또한 자녀 이동 경로 표시, 앱 사용 시간대 모니터링, 유해 콘텐츠 차단 기능 개선을 통해 자녀 보호 기능도 강화했다. 이외에도 자녀가 습관을 설정하고 인증사진을 남기면 부모가 보상해주는 '찰칵, 습관기르기'를 비롯해 소리·진동 원격 제어 기능, 스마트폰 과의존 방지 콘텐츠 등을 추가해 자녀가 올바른 스마트폰 사용 습관을 형성할 수 있도록 했다.LG유플러스 공식 온라인몰인 '유플러스닷컴'에서는 키즈폰 출시를 기념해 이달 말까지 온라인으로 구매한 고객 중 자사가 제공한 별도 양식을 통해 구매 후기를 남기는 고객에게 카카오페이 머니 4만원을 증정하는 이벤트를 다음 달 7일까지 실시한다.또 LG유플러스 무너카드를 신청한 고객 전원에게 용돈 5000원을 제공하는 이벤트를 오는 2월6일부터 6월30일까지 진행한다."
2023.01.26.,"카카오뱅크, 전·월세보증금 대출금리 인하",https://n.news.naver.com/mnews/article/215/0001079123?sid=101,"카카오뱅크는 전·월세보증금 대출 상품의 금리를 최대 0.67%포인트(p) 인하한다고 26일 밝혔다.이에 따라 전·월세보증금 대출금리는 연 4.891∼5.963%에서 연 4.418∼5.303%로 낮아진다.청년 전·월세보증금 대출금리는 최대 0.30%포인트 내렸다.청년 전·월세보증금 대출은 만 19∼34세, 연 소득 7천만원 이하 무주택 청년을 대상으로 한 상품이다.이번 인하로 청년 전·월세보증금 대출상품 최저 금리는 기존 연 4.71%에서 연 4.408%로 내렸다.변경된 금리는 이날부터 시행되며 시행일 이후 약정한 대출에 적용된다.아울러 카카오뱅크는 청년 전·월세보증금 대출의 최대 가능 한도를 상향했다.기존에는 임차보증금의 90% 이내, 최대 1억원을 대출할 수 있었으나 한도 상향에 따라 임차보증금의 90% 이내, 최대 2억원까지 대출이 가능해진다.(사진=연합뉴스)"
2023.01.26.,"카카오뱅크, 전·월세보증금 대출금리 최대 0.67%p 인하",https://n.news.naver.com/mnews/article/421/0006594895?sid=101,"청년 전·월세보증금 대출한도도 1억원→2억원 상향서울 영등포구 여의도 카카오뱅크 오피스 모습. 2022.2.22/뉴스1 ⓒ News1 민경석 기자(서울=뉴스1) 서상혁 기자 = 카카오뱅크는 전·월세보증금 대출 상품의 금리를 최대 0.67%포인트(p) 인하했다고 26일 밝혔다.이에 따라 카카오뱅크의 전·월세보증금 대출 적용금리는 연 4.89~5.92%에서 4.42~5.25%로 낮아진다.청년 전·월세보증금 대출금리는 최대 0.30%p 내렸다. 청년 전·월세보증금 대출은 만 19~34세이면서 연소득 7000만원 이하 무주택 청년을 대상으로 한 상품이다.카카오뱅크는 청년 전·월세보증금 대출의 최대 가능한도도 기존 1억원에서 2억원으로 상향했다. 보증한도 1억원까지는 기존과 동일하게 무소득자인 경우에도 보증한도를 부여하며, 1억원을 초과하는 경우에는 소득과 부채 등을 감안해 상환능력별로 차등화된 보증한도가 적용된다.카카오뱅크 관계자는 ""금리인상 시기에 고객님들의 주거 비용 부담을 덜어드리기 위해 대출금리를 인하하고, 한도를 상향했다""며 ""앞으로도 더욱 경쟁력 있는 금리와 편의성을 바탕으로 고객님의 주거 문제에 도움이 되기 위해 힘쓸 것""이라고 말했다."
