기사날짜,기사제목,네이버 뉴스 url,기사내용
2023.05.06.,카드사 1분기 실적악화에…소비자 혜택 ‘뚝’,https://n.news.naver.com/mnews/article/005/0001606449?sid=101,"연합뉴스.고금리 기조에 조달비용이 늘면서 주요 카드사들의 1분기 실적이 급감했다. 카드사들의 경영 악화가 소비자 혜택 축소로 이어진다는 우려가 나온다.5일 여신업계에 따르면 올해 1분기 실적을 발표한 주요 카드사(신한·삼성·KB국민·우리·하나카드)의 총 당기순이익은 4602억원으로 지난해 같은 기간과(5962억원) 비교해 약 22.8% 감소했다. 가장 큰 감소 폭을 기록한 곳은 하나카드로 전년대비 63% 감소한 202억원을 기록했다. 우리카드, KB국민카드 역시 전년동기대비 각각 46.74%, 31.03% 줄어든 458억원, 820억원으로 집계됐다. 업계 1,2위인 신한카드(-5.23%), 삼성카드(9.51%)는 순익 감소 폭이 한 자릿수대로 상대적으로 적었으나 각각 1667억원, 1455억원을 기록하며 실적이 줄어들었다.지난해부터 이어진 금리인상 여파로 조달비용이 늘어난 점이 실적둔화의 원인으로 지목된다. 카드사는 은행과 달리 고객으로부터 예금을 받아 운용하는 수신기능이 없어 여신전문금융회사채(채권)를 발행해 영업에 필요한 자금을 조달한다. 채권금리가 오르면 영업비용이 늘 수밖에 없다. 실제 지난해 초 약 2%대였던 여전채 금리는 지난해 말 약 6% 뛰었다. 올해 들어 3%대까지 다시 낮아졌지만, 지난해 늘어난 조달비용이 올 1분기까지 실적급감에 영향을 미쳤다는 분석이다.고금리에 채무자들의 상환능력이 나빠진 점도 카드사들의 수익성을 끌어내렸다. 카드사들이 채무자로부터 대출을 회수할 수 없을 경우를 대비해 쌓는 대손충당금이 대폭 늘어났기 때문이다. 올해 1분기 5개 카드사의 평균 연체율은 1.23%로 전년동기대비 0.4%포인트 오르며 전부 1%대로 진입했다. 신한카드가 1.37%로 가장 높았고 우리카드(1.35%), 국민카드(1.19%), 삼성카드(1.1%) 등 순이다. 이에 따라 1분기 충당금 전입액을 공시한 신한·삼성·KB국민·하나카드의 총 충당금은 6965억원으로 전년대비 62.7% 크게 늘었다.수익성이 악화하자 카드사들은 소비자 혜택축소로 대응하는 모양새다. 신한카드는 전월실적 조건 없이 사용횟수별 최대 5만원을 캐시백으로 돌려주는 ‘카카오뱅크 신한카드’를 이달 들어 단종시켰다. 우수고객 ‘탑스클럽’(Tops Club) 대상으로 일시불 거래 분할 납부시 제공하던 무이자 할부혜택 역시 지난달 종료시켰다. KB국민카드는 지난해 말까지 백화점, 항공사 등에 제공하던 최대 6개월 무이자 할부혜택을 올해부터 2~3개월로 줄였다. 비씨카드는 지난달 강형욱, 오은영 등 인플루언서를 내세운 특화 혜택카드 ‘인디비주얼 카드’를 단종했다.업계 관계자는 “금리 인상, 연체율 상승으로 대손비용 규모가 계속 커지면서 2분기 업황 개선도 요원해 보인다”라면서 “판관비 등 여타비용을 보수적으로 관리하고 내실 다질 것”이라고 말했다."
2023.05.06.,"[이주의 카드] ""MBTI 따라 선택""",url없음,<네이버 기사 없음>
2023.05.06.,이중직 목회 관심 담은 '사회적목회 컨퍼런스' 12일 개최,https://n.news.naver.com/mnews/article/079/0003766914?sid=103,"오는 12일 서울 성수동 성락성결교회서 열리는 '사회적목회 컨퍼런스' 직업 소개하는 30개 부스, 6개 세미나 선보일 예정지난 2021년 11월 열린 사회적목회 컨퍼런스. [앵커]코로나 팬데믹 3년을 지나는 동안 작은 교회 목회자들의 어려움이 더 커지면서 목회자에게 이중직을 허용하자는 목소리가 높아졌습니다.단순히 경제적 차원을 넘어 선교적 관점에서도 필요하다는 의견이 많은데요, 목회자 이중직의 세계를 폭넓게 소개하는 사회적목회 컨퍼런스가 오는 12일 열립니다.  천수연 기자가 소개합니다.[기자]지난 2월 신대원을 졸업한 박신일씨.주일엔 유년부를 담당하는 전도사이지만 평일엔 취업 준비생입니다.[박신일 전도사]""먼저 스페셜티 커피 브랜드에 입사해서 깊이 배운 후에 나중에 창업하고 창업을 통해서 이중직과 함께 교회개척도 생각하고 있습니다.""코로나19와 함께 신대원 생활 3년을 보내면서 박 전도사는 취업과 창업에 관심을 기울였습니다.교회 안으로는 경제적 어려움이, 교회 밖으로는 교회에 대한 부정적 인식들이 확산되는 등 급변한 목회 환경 속에서 새로운 길을 고민하게 됐습니다.[박신일 전도사]""윗 세대 선배님들, 부목사님들이 교회에서 나오시게 된 경우를 너무 많이 봤거든요. 그런 걸 보면서 경제적 고민도 당연히 있었고요 크게 왔었고 (동시에) 우리 세대의 목회가 과연 이렇게 했을 때 지속할 수 있을까…""은퇴를 앞둔 목회자들도 경제활동이 가능한 직업에 관심을 보이고 있습니다.지난 해 예장통합총회 부산지역 노회들이 공동으로 마련한 자비량목회 컨퍼런스,이중직 목회를 알리고 다양한 직업을 소개하는 자리였는데,고연령의 목회자들이 적지 않았습니다.[조성돈 소장 / 목회사회학연구소]""나이가 드신 목회자들의 반응이 뜨거웠습니다. 은퇴 후에 내가 뭘 할 수 있을지에 대한 고민을 갖고 계세요. 보통 예전 같으면 교회가 많은 서포트(노후지원)을 했지만 요즘 그게 어려우니까 노후가 많이 걱정되시는 거 같습니다.""이같은 관심 속에서 목회사회학연구소와 일터개발원 등이 공동으로 이중직 목회를 주제로 사회적목회 컨펀런스를 개최합니다.2년 전 처음 열린 컨퍼런스에 비해 규모가 2배 가량 커졌습니다.컨퍼런스는 박람회와 세미나 두 축으로 진행됩니다.9개 직종 30여개 단체와 개인이 참여해 이중직의 실사례를 살펴볼 수 있는 박람회를 구성합니다.또 6개의 세미나를 통해서 이중직 목회를 지지하고 인식을 개선하는 자리를 마련합니다.이번 컨퍼런스에서는 이중직 목회에 대한 확산 등 변화하는 목회환경 속에서 교단의 역할과 책임성을 강조할 계획입니다.[조성돈 소장 / 목회사회학연구소]""목회자를 부를 때만 교단이 역할을 할 게 아니라 목회자로서 지속될 수 있도록 하는 것에도 교단이 책임져주시고 목회를 관두어야 하는 사람이 있다면 그들에 대해서도 교단이 책임져 달라(는 요구입니다.)""사회적목회 컨퍼런스는 오는 12일 서울 성수동 성락성결교회에서 열립니다. CBS뉴스 천수연입니다.[영상 정용현 최내호 편집 서원익]※CBS노컷뉴스는 여러분의 제보로 함께 세상을 바꿉니다. 각종 비리와 부당대우, 사건사고와 미담 등 모든 얘깃거리를 알려주세요.이메일 : jebo@cbs.co.kr카카오톡 : @노컷뉴스사이트 : https://url.kr/b71afn"
2023.05.06.,전주한옥마을 관광 인기 '여전'…2달간 305만명,https://n.news.naver.com/mnews/article/014/0005007811?sid=102,"전북 전주 한옥마을 자료사진. /사진=뉴시스  【파이낸셜뉴스 전주=강인 기자】 전북 전주 한옥마을에 지난 1월과 2월 두 달 동안 관광객 300만명 이상이 다녀간 것으로 나타났다.   지난해 같은 기간 대비 2배 이상 증가한 수치로 관광객 1500만명 시대를 여는 신호탄이 될 것으로 기대된다.   6일 전주시에 따르면 이동통신기록을 활용한 빅데이터 분석 결과 지난 1월과 2월 두 달간 전주한옥마을에 305만3939명이 다녀갔다.   지난해 같은 기간 올해 절반 수준인 130만8159명이 다녀갔고, 한 해 동안 1129만4916명이 찾으며 사상 최고치를 기록했다.   전주시는 이런 수치를 토대로 올해 전주한옥마을이 1500만명 관광객을 유치할 수 있을 것으로 조심스럽게 예상하고 있다.   전주한옥마을은 올해 문화체육관광부·한국관광공사가 주관하는 ‘한국관광 100선’에 6회 연속 선정된 대한민국 대표 여행지로 손꼽힌다. ‘한국관광 100선’은 내국인은 물론 외국인들이 꼭 가볼만한 대표 관광지 100개소를 2년에 한 번씩 선정하는 문체부 대표사업으로, 전주한옥마을은 12년째 국내 대표 여행지로 인정을 받은 셈이다.   여기에 대한민국 관광거점도시이자 지난달 26일 동아시아 문화도시 전주 개막, 27일 전주국제영화제 개막 등을 통해 아시아를 넘어 세계적으로 주목을 받고 있다.   전주시는 더 많은 관광객이 전주한옥마을을 방문할 수 있도록 유도하기 위해 지난달 말 경기전 인근에 관광객에게 휴식공간과 관광정보를 제공할 ‘여행자 라운지’를 열었고, 올 연말에는 태조로 초입에 ‘한옥마을 국제관광안내소’도 만든다. 한옥마을을 방문하는 관광객 편의를 위해 다국어 공식 누리집과 SNS(블로그, 인스타그램, 카카오톡 채널), 카카오톡 여행정보 상담 채널 등을 운영하고 있으며 한옥마을 체험 안내지도 제작 배부 등을 통해 여행에 필요한 정보를 제공하고 있다.   전주시 관계자는 “전주한옥마을을 찾은 관광객이 편안하게 여행할 수 있는 환경을 조성하고, 다양한 공연과 체험 프로그램을 준비해 한옥마을의 구석구석을 체험하고 알아갈 수 있도록 할 것”이라며 “오랫동안 머물고 싶은 체류형 관광지 전주한옥마을이 될 수 있도록 노력하겠다”고 전했다."
2023.05.06.,저축은행-네파 맞손...신규 대출비교 수수료도 낮아지나,https://n.news.naver.com/mnews/article/008/0004883754?sid=101,"[이슈속으로]저축은행중앙회와 네이버파이낸셜이 업무협약을 맺고 비대면 대환대출 중개수수료율을 낮추기로 했다. 양측은 이미 서비스중인 신규대출 비교 중개수수료율의 인하 논의 가능성도 열어놓은 것으로 알려졌다. 중개수수료율을 내리는 만큼 고객에게 돌아갈 금리 혜택이 커질 수 있어서다. 금융업권에서는 중개수수료율 인하 분위기가 플랫폼사 전체로 확대될지 주목하고 있다.6일 금융업권에 따르면 저축은행중앙회와 네이버파이낸셜은 지난 2일 '상생 금융 실천을 위한 포괄적 업무 협약'을 맺었다. 네이버파이낸셜이 오는 5월말 시작하는 비대면 대환대출 서비스에서 자체적으로 책정한 중개수수료율을 낮춘다는 내용이다. 저축은행중앙회는 중개수수료가 낮아진 만큼 이를 금융소비자의 부담 완화에 쓰겠다는 방침이다.나아가 양측은 비대면 대환대출 외 신규대출 비교 중개수수료율 인하 논의 가능성도 열어뒀다. 신규대출 비교는 2019년 금융위원회가 인정한 혁신금융서비스다. 토스, 카카오페이, 핀다 등 플랫폼 등이 중심이 돼 서비스를 영위하고 있다. 고객이 새 대출을 받을 때 플랫폼에서 한눈에 여러 대출상품을 비교한 뒤 간편하게 대출을 받을 수 있다. 고객이 보유하고 있는 기존 대출을 비대면 방식을 통해 새 대출로 갈아타는 대환대출 서비스는 이달말 시작 예정이다. 기존에는 대환대출을 하려면 영업점 창구를 직접 방문해야 하는 등 번거로움이 많았는데 앞으로는 한 앱에서 다양한 대환대출 상품 비교와 실행까지 한 번에 가능할 전망이다. 저축은행중앙회와 네이버파이낸셜은 신규대출 비교 중개수수료율 인하를 통해 고객 혜택을 늘릴 수 있다고 보고 있다. 현재 저축은행이 플랫폼사에 내는 신규대출 비교 중개수수료율은 1.7% 수준인데, 이를 1% 수준으로 낮춘다면 저축은행들은 그만큼 줄어드는 비용을 고객에게 돌려줄 수 있다고 설명했다. 앞서 저축은행들은 올 초 카카오페이, 토스 등 플랫폼사에 신규대출 비교 중개수수료율을 낮춰달라고 요구했지만 거절당했다. 저축은행들은 대출비교 서비스에서 은행은 0.2~0.5%의 중개수수료율 적용받는데 본인들은 1.7%에 달하는 수수료율을 내야 하는 게 부당하다고 주장했다. 이에 대해 플랫폼사들은 ""지금까지 오프라인 대출모집인 시장에서 평균적으로 2.5%포인트(p)나 차이가 나던 은행-2금융권 간 중개수수료 차이가 플랫폼 등장 이후 1.3p% 수준으로 줄어들었다""며 ""기존에 형성된 2금융권의 중개수수료율을 더 낮춘 플랫폼들의 노력을 간과해서는 안 된다""고 반박했다.저축은행과 네이버파이낸셜이 신규대출 비교 중개수수료율 인하도 논의를 시작하면 분위기는 다른 플랫폼사까지 확대될 가능성이 있다. 네이버파이낸셜은 네이버라는 거대 플랫폼을 등에 업고 있다. 상대적으로 낮은 금리로 공격적인 영업을 한다면 신규 대출비교 시장의 판도가 흔들릴 수도 있다는 뜻이다. 현재 신규 대출비교 시장에서는 토스·카카오페이·핀다 등 3사의 점유율이 90%를 넘는 것으로 알려졌다.  대출비교 시장의 후발주자인 네이버파이낸셜 입장에서도 저축은행과의 협업을 통해 시장 점유율을 확대할 수 있다는 이점이 있다. 2019년부터 신규대출 비교를 시작했던 다른 플랫폼사와 달리 네이버파이낸셜은 지난해 11월 서비스를 선보였다. 다른 플랫폼사의 고객을 뺏어오기 위해서는 그들보다 낮은 금리를 제공하는 등 공격적인 전략이 필수적인 상황이다."
2023.05.06.,가정의달 맞아 가족·어린이와 함께 볼 수 있는 웹툰 3선,https://n.news.naver.com/mnews/article/022/0003809852?sid=103,"5일 어린이날은 비롯해 8일 어버이날 등 가족 구성원이 함께 모여 추억을 쌓을 수 있는 가정의 달, 5월을 맞아 가족 구성원이 함께 볼 수 있는 웹툰을 소개한다. 가족이 함께 함으로서 느낄 수 있는 따스함이 있는 웹툰, 그리고 자극적인 소재와 이야기가 아니어서 어린이들도 볼 수 있는 웹툰들이다.       ◆꽃봉오리서 태어난 ‘고양이 타타’로 함께 하게 된 가족     시골 고롱리에서 살다 도시로 이사를 간 중학생 수연은 여름방학을 맞아 할머니 댁에 내려간다. 그대로일 것이라 생각했던 고롱리가 조금씩 변한 것이 느껴지자 실망한 수연. 다음날 그는 꽃봉오리에서 피어난 고양이 ‘타타’를 만나고 할머니로부터 타타가 30년 전 이곳에서 살았던 고양이라는 이야기를 듣게 된다. 타타와 마법 같은 일들을 경험하던 수연은 즐거움도 잠시, 다시 만난 친구들이 달라 보이고 타타 역시 30년 전과 달라진 풍경에 혼란스러움을 느끼는데….     네이버 웹툰 ‘고양이 타타’는 지난 1월 14일 연재를 시작한 힐링 웹툰이다, 현실에 바빠 뿔뿔히 흩어져 살았던 가족 구성원들이 별똥별이 떨어져 생겨난 꽃봉오리에서 태어난, 과거 키웠던 고양이 ‘타타’가 나타나며 할머니집으로 모여 과거를 이야기하며 추억을 공유하는 작품이다. 여름 시골을 배경으로 시원한 계절감과 아련한 향수를 느끼게 해준다. 더불어 밝은 계열의 색감과 간결하면서 깔끔한 캐릭터 묘사는 이러한 감정을 배가시킨다.     오늘을 바쁘게 산 현대인, 가족의 소중함을 잠시 잊었던 현대인이라면 ‘고양이 타타’를 추천한다. 잠시 숨을 돌릴 시간을 갖게 될 것이다.       ◆음식과 온가족이 함께 하는 맛있는 ‘오무라이스 잼잼’     몇 개라도 먹을 수 있을 것 같은 ‘메추리알 조림’, 빙글빙글 돌아가는 ‘회전초밥’, 지구 반 바퀴 돌아 포르투갈에서 맛본 ‘에그타르트’, 매콤상콤하게 볶아 입맛 도는 ‘마라샹궈’, 짭짤한 밥도둑 ‘간장게장’ 등. 우리가 사랑하는 모든 음식들에 얽힌 흥미진진한 비화와 따스한 이야기가 펼쳐진다. 엄마, 아빠, 딸, 그리고 아들로 구성된 작가의 가족이 전하는 음식의 알찬 정보 이야기.     카카오 웹툰 ‘오무라이스 잼잼’은 ‘음식’과 ‘가족’의 이야기를 담은 에세이 웹툰이다. 다음 웹툰에서 2010년 4월 19일 연재를 시작, 현재까지 시즌 14를 맞았다. 10여년 동안 3억회 이상의 조회 수로 많은 사랑을 받고 있다. 샌드위치, 자장면, 피자, 설렁탕, 닭백숙, 훠궈 같은 식사부터 팥빙수, 타코야끼, 녹차라떼, 에그타르트 같은 디저트까지. 다양한 음식의 조리법과 음식에 얽힌 역사 등 알찬 내용을 작가의 개인적인 사연과 작가의 아내와 딸, 아들 등 가족 이야기와 함께 버무려 풀어낸다. 뛰어난 색감과 작화로 식욕을 돋우는 작품이면서 캐주얼하고 귀여운 그림체 역시 이야기와 조화를 이룬다. 무엇보다 독자들에게 ‘치유물’로 불릴 만큼 따뜻한 정서가 주를 이루며 가족 구성원들의 정감 가는 이야기로 어버이날 가족들과 함께 보기에 매우 좋은 작품이다.     ◆강아지가 인간이 된다면? ‘마루는 강쥐’     우리 집 강아지 마루가 사람이 됐다. 그것도 5살 아이로! 강아지 + 어린아이의 무한 에너지와 호기심을 지닌 사고뭉치 강쥐 탄생! 마루야~! 또 어디가!!! 유쾌한 이웃들과 우당탕탕 즐거운 마루의 나날들.     네이버웹툰 ‘마루는 강쥐’는 유쾌한 일상물로 호평을 받았던 웹툰 ‘모죠의 일지’의 모죠 작가의 작품으로, 주인공 최우리가 키우는 강아지(푸들) 마루가 5살 사람이 돼 펼쳐지는 에피소드를 담고 있다. 사람이 된 ‘마루’는 직립 보행을 하며 인간의 모습을 하고 있지만 아직 강아지의 습관을 버리지 못해 웃지 못할 해프닝과 함께 애견인들이 공감할 수 있는 사건·사고를 만든다. 실생활에서 펼쳐지는 강아지와의 에피소드는 물론이고 남녀노소 누구나 쉽게 접할 수 있는 부담 없는 그림체, 웹툰 곳곳에 보이는 유머러스한 요소들로 보는 내내 미소를 절로 불러일으킨다."
2023.05.06.,"""사과·반성부터"" 기시다 방한 앞두고 도심 집회…시청·광화문 혼잡",https://n.news.naver.com/mnews/article/421/0006789622?sid=102,"평화나비 네트워크 회원이 4일 서울 용산구 숙명여자대학교 정문 앞에서 기시다 후미오 일본 총리의 방한을 규탄하는 대학 학내 동시다발 1인 피케팅 시위를 하고 있다. 2023.5.4/뉴스1 ⓒ News1 이동해 기자(서울=뉴스1) 조현기 기자 = 기시다 후미오 일본 총리의 방한을 앞두고 토요일인 6일 서울 도심 곳곳에서 집회가 열린다. 기시다 총리는 7, 8일 방한해 윤석열 대통령과 정상회담을 한다. 경찰에 따르면 촛불전환행동은 6일 오후 5시부터 숭례문 일대를 행진할 예정이다. 한일역사정의행동은 오후 6시30분 청계천 근처 파이낸스 빌딩 앞 인도에서 한일정상회담 규탄 집회를 연다. 이에 맞서 보수 성향의 자유통일당이 오후 1시 동화면세점 앞에서, 신자유연대가 오후 5시 삼각지역 근처에서 각각 맞대응 집회를 연다. 이에 따라 서울시청과 광화문 일대 등이 혼잡할 것으로 예상된다.이날 교통상황은 △서울경찰청 교통정보 안내전화 △종합교통정보센터 홈페이지 △카카오톡 '서울경찰교통정보'에서 확인할 수 있다."
2023.05.06.,이번 주 종합 베스트셀러 순위 [인포그래픽],url없음,<네이버 기사 없음>
2023.05.06.,"여전히 어색한 '님'문화…LGU+ 직원 38% ""OO님 호칭 불편""",https://n.news.naver.com/mnews/article/277/0005255163?sid=105,"2주간 온·오프라인 투표 진행40% 가까이 '님' 제대로 못써기존 호칭체제로 돌아간 기업도“‘님’에 대한 솔직한 생각을 묻습니다!’”지난달 28일 서울 용산구 LG유플러스 본사 로비에 설치된 판넬에 스티커가 빼곡했다. LG유플러스가 17일부터 이날까지 ‘와글와글 토론문화 정착캠페인’이라는 주제로 실시한 익명 투표였다. ‘우리는 어떻게 님 문화를 사용하고 있는지 옆에 있는 스티커로 투표해달라’는 것이었다. ‘나는 님 호칭을 적극 활용하고 있다’, ‘나는 님 호칭을 쓰고 싶어도 못 쓰는 중이다’ 2가지 선택지가 있었다.206명 집계 결과 ‘님’ 호칭을 사용하는 직원이 127명(61.6%), 사용하지 않는 직원이 79명(38.4%)이었다. 10명 중 4명은 ‘님’ 호칭을 사용하지 않는다고 응답한 것이다. LG유플러스는 판넬 투표뿐만 아니라 사내게시판 ‘와글와글’을 통해 온라인 설문도 병행했다. 결과는 오프라인과 크게 다르지 않았다. ‘님’ 문화를 적극적으로 활용한다는 의견이 절반을 조금 넘는 수준이었다.LG유플러스는 2018년 호칭을 ‘님’으로 통일했다. 조직의 수평문화 확산과 구성원의 ‘심리적 안정감’을 형성하기 위한 것이었다. 5년이나 지났지만, 상당수가 ‘님’ 호칭에 대해 불편함을 느끼고 있었다. LG유플러스 관계자는 “동료와 후배에게는 적극 사용하고 있지만 선배에게는 아직 다소 어렵다는 의견도 일부 있다”고 했다.통신3사 가운데 호칭 변경을 주도한 것은 SK텔레콤이었다. 2006년 ‘매니저’로 통일했고 2018년부터 ‘님’으로 바꿨다. KT도 2009년부터 매니저 호칭을 사용했으나 제도 정착에 실패했다. 5년 만에 사대과차부(사원·대리·과장·차장·부장)의 기존 직급 체제로 돌아갔다. 조직문화의 근본적인 변화는 일어나지 않고 오히려 혼란만 가중시켰다는 자체평가가 나왔다.전체 기업으로 눈을 넓혀보면 수평적 호칭을 처음 도입한 곳은 CJ그룹이다. 2000년부터 모든 직원을 ‘님’으로 부르기 시작했다. 이후 삼성·현대차·SK·LG 등 4대 그룹을 중심으로 수평적 호칭이 퍼졌다. 카카오처럼 영어 이름으로 호칭하는 기업도 나타났다. 그러나 ‘매니저’ 호칭을 썼다가 기존 직급 호칭으로 돌아간 포스코·한화 같은 기업도 있다. 와글와글을 통해 관련 의견도 받은 LG유플러스는 “수평적이고 적극적으로 의사소통할 수 있는 '님' 문화 정착을 위해 노력하겠다”고 했다."
