기사날짜,기사제목,네이버 뉴스 url,기사내용
2023.05.06.,왕관의 무게를 견뎌라…英 찰스3세의 과제,https://n.news.naver.com/mnews/article/079/0003766886?sid=104,"6일 대관식서 '영국, 영연방 군주' 공식 선포왕실 여론 악화…젊은층 지지 끌어내기 관건 英연방 분리 해제 움직임…구심점 가능할까?연합뉴스영국이 6일(현지시간) 본격적인 찰스3세 시대를 맞는다. 지난해 9월 8일 엘리자베스 2세 여왕이 서거하면서 찰스 3세는 자동 즉위했지만, 대관식이라는 화려하고 격식있는 의례를 치름으로써 만천하에 영국과 14개 영연방 왕국의 군주임을 공식 선포하게 된다. 찰스 3세의 왕위 계승은 순조롭게 진행됐다. 찰스 3세가 9살이던 1958년 왕세자로 책봉된 이후 무려 65년간 왕위 계승을 준비해온 셈이다. 그러나 그가 마주한 현실은 결코 녹록치 않다. BBC는 찰스 3세의 즉위 이후 역사가들의 인터뷰를 통해 새 국왕이 '전례없는 도전'에 직면해있으며 그의 앞길에 많은 시험대가 기다리고 있다고 분석했다. 영국 왕실, 국민의 신뢰  회복 급선무연합뉴스찰스 3세가 앞으로 풀어야할 가장 큰 숙제는 왕실에 대한 영국 국민들의 지지와 성원을 회복하는 것이다. 왕실 역사가 리처드 피츠윌리엄스는 BBC에 ""찰스 3세 국왕의 당면 과제 중 하나는 젊은 세대가 왕실에 매력을 느끼게 하는 것""이라고 말했다. 영국 여론조사 업체 유고브가 지난 2021년 영국인 4870명을 대상으로 입헌군주제에 대한 선호도를 물은 조사에서 18~24세 젊은 응답자 중 31%와 25~49세 응답자의 53%만이 ""왕이나 여왕이 있어야 한다""고 답했다. 이는 65세 이상의 81%에 비해 훨씬 낮다. 시간이 흐르고 세대가 바뀔수록 왕실에 대한 여론이 나빠지고 있다는 이야기다. 실제 대관식이 코앞으로 다가왔지만 다수 영국인들은 별다른 관심이 없다. 유고브가 최근 영국 거주 성인 3천70명을 대상으로 실시한 설문조사에서 응답자의 64%는 대관식에 관심이 '거의 없다'라거나 '전혀 없다'고 했다. 사실 찰스 3세는 인기 없는 왕세자였다. 다이애나빈과의 이혼, 카밀라 파커 볼스와의 불륜, 정치개입 논란, 사우디 자금 수수 등으로 그는 영국 국민의 '비호감'이었다. 해리 왕자 부부와의 갈등은 여전히 진행형이다. 이런 상황에서 왕실 유지에 막대한 비용이 든다는 점도 국민적 반감을 일으키는 요인이다. 역사학자 에드 오언스는 뉴욕타임스에 ""과거 엘리자베스 2세 여왕의 대관식은 국가와 왕실의 새 출발을 상징했지만, 이번 찰스 3세의 대관식은 가족 간 불화로 윈저 가문이 분열되고 쇠퇴한 이후에 이뤄진다는 점이 다르다""고 평가했다. 영국 왕실도 여론의 향배에 민감하게 반응하고 있다. 우선 고물가로 어려운 상황 등을 감안해 대관식 규모를 크게 줄이기로 했다. 다문화, 다종교로 변화하는 영국 사회에 맞춰 다양성을 강조할 예정이다. 일각에서는 대중적 인기가 좀 더 있는 윌리엄 왕자가 향후 자주 등장할 가능성을 제기한다. 흔들리는 英연방…새로운 관계 설정 시급연합뉴스찰스 3세 시대, 영국 왕실의 위기는 왕실 일가만의 문제가 아니다. 갈수록 구심점이 약해지는 영연방(Commonwealth)의 앞날이 걸려있다. 엘리자베스 2세는 영국과 영국의 식민지였던 독립국 56개국으로 구성된 영연방의 강력한 구심점이 돼왔다. 그러나 과거 화려했던 제국주의 군주국의 모습은 퇴색됐고 국제사회에서 영국의 영향력도 크게 위축됐다. 찰스 3세는 즉위와 함께 영연방의 수장이 됐지만, 상황은 어머니 때와 다르다. 일부 영연방 국가는 최근 몇 년간 영국 왕실과의 관계 정립에 나서고 있다. 지난 2021년 카리브해 섬나라이자 노예 무역의 중계지였던 바베이도스는 독립 55년만에 처음으로 대통령을 선출했다. 이로써 더 이상 여왕을 국가원수로 섬기지 않고 영국의 영향력에서 벗어났다. 군주제에서 벗어나 공화제를 추진하려는 움직임은 자메이카, 바하마, 벨리즈 등 다른 카리브해 국가에서도 진행중이다. 윌리엄 왕세자 부부가 지난해 이들 국가를 방문했을 때 식민지배에 대한 배상과 노예제 사과를 요구 받기도 했다. 영연방을 구성하는 호주와 캐나다에서도 공화제를 지지하는 여론이 높은 편이다. BBC는 영연방 국가와의 관계를 보다 현재적으로 재정의하는 것이 찰스 3세의 주요 과제가 될 것이라고 내다봤다. 영국내에서도 군주제에 대한 관심과 애정이 식어가고 있다. 아예 군주제를 폐지하자는 공화주의자들의 주장도 계속되고 있다. 스코틀랜드와 북아일랜드, 웨일스의 분리 독립 조짐도 눈여겨볼 일이다. 특히 브랙시트 이후 경제적 타격이 큰 스코틀랜드는 독립을 재추진하려는 움직임을 보이고 있다. 찰스 3세는 이처럼 흔들리는 군주제와 영연방 체제를 어떻게 조율하고 통합할 수 있을까. 드디어 65년만에 왕관을 쓰는 찰스 3세 앞에는 왕실과 국왕의 존재 이유를 설명하고 설득해야 하는 과제가 놓여있다는 지적이다. ※CBS노컷뉴스는 여러분의 제보로 함께 세상을 바꿉니다. 각종 비리와 부당대우, 사건사고와 미담 등 모든 얘깃거리를 알려주세요.이메일 : jebo@cbs.co.kr카카오톡 : @노컷뉴스사이트 : https://url.kr/b71afn"
2023.05.06.,[여랑야랑]김남국 방지법 / 어린이날 메시지?,https://n.news.naver.com/mnews/article/449/0000249070?sid=100,"[앵커]Q1. 여랑야랑, 정치부 최수연 기자와 함께합니다. 첫 번째 주제 보겠습니다. 이번엔 누구 방지법이 나왔나요. 김남국 민주당 의원입니다.  앞에서 보셨듯 60억 원 규모의 코인 보유자였다는 사실이 알려지며 논란이 뜨겁죠.  정치권에서는 이른바 '김남국 방지법'을 만들자는 주장이 나왔습니다. 장예찬 국민의힘 최고위원은 ""가상화폐 투자가 정치인의 재산 은닉을 위해 쓰이는 걸 용납할 수 없다""며 ""고위공직자, 국회의원의 가상화폐 재산신고를 의무화하는 '김남국 방지법'을 제안한다""고 했습니다. Q2. 가상화폐 그러니까 코인도 재산신고 대상에 포함시키자는 내용이네요. 민주당에서도 호응이 있다고요.카카오뱅크 대표이사를 지낸 이용우 의원이 김 의원 기사를 공유하며 이런 글을 올렸습니다. ""재작년 5월, 가상재산 신고 의무화 법안을 발의했지만 아직 계류중""이라며 ""시대적 요구에 부응해 신속히 통과되도록 노력하겠다""고 밝혔습니다.  이 의원 외에도 21대 국회에서는 이미 비슷한 법안들이 여야를 막론하고 꾸준히 발의됐는데요.  아직 상임위 문턱은 넘지 못하고 있습니다. Q3. 그런데 민주당 강성 지지층인 이른바 '개딸'들의 반응은 좀 다르다고요. 네, 민주당 강성 지지층은 불법은 아니지 않냐며 김 의원을 옹호했습니다. 이재명 대표 팬카페에는 ""투자 성공 사례다"" ""종목 보는 눈이 있다""라는 반응과 함께, ""민주당은 돈 많으면 안되냐"" 는 주장이 나왔습니다. 국민의힘은 김 의원의 이중성에 실망이라며 비판을 이어갔습니다. [김남국 / 더불어민주당 의원(지난 2021년 6월, 유튜브 정치왓수다)] ""제가 돈을 번 건 비트코인으로 번 게 아니고 진짜 아끼고 편의점에서 아이스크림 하나 안 사 먹고 차도 지금까지 안 샀거든요."" [윤희석 / 국민의힘 대변인] ""후원금에 목말라하던 그가 정작 거액의 코인 보유자였다는 사실은 팍팍한 일상을 살아가는 국민 모두를 맥 빠지게 한다. 개딸들의 'Young & Rich'라는 찬사에 취할 때가 아니다. 억울하면 소명해라""Q4. 리포트에서 보니 한동훈 장관까지 가세했던데, 논란이 한동안 이어질 것 같습니다. 다음 주제 보겠습니다. 어제 어린이날을 맞아 정치권에서 메시지를 내놨어요? 네, 101회 어린이날을 맞아 여야 대표들이 SNS에 메시지를 남겼는데요. 그 내용이 일반적인 어린이날 메시지와는 사뭇 달랐습니다. 먼저 이재명 민주당 대표는 ""현실은 생각보다 냉정하다""며 ""배신당하는 삶을 살다 보면 순수한 마음은 사라지고, 때 묻은 어른의 마음이 차지한다""고 적었습니다.  여기서 이 대표가 언급한 '배신'이 무엇을 의미하는지를 두고 '최근 재판 상황을 염두에 둔 것""이다, '일반론적으로 한 발언'이라는 등 해석이 분분합니다. Q5. 어린이날 관련 행사에서도 의미심장한 발언이 나왔어요? 그제 국회에서 열린 어린이날 행사에서의 이 대표 발언, 들어보시죠. [이재명 / 더불어민주당 대표(그제)] ""어린이 여러분 반갑습니다"" ""안녕하세요~"" ""우리 어린이들 미리 연습시킨 것도 아닌 거 같은데 너무 해맑은 모습이어서 보기 너무 좋습니다. 생명보다 돈을, 안전보다 이익을 더 중시하는 그런 사회에 살고 있습니다."" 돈과 이익을 중시하는 사회, 냉정한 현실을 만들어 어른으로서 미안하다는 취지로 보입니다. Q6. 일상적인 어린이날 메시지와는 좀 차이가 있네요. 그럼 국민의힘은 어떤 메시지를 내놨나요?네, 김기현 대표는 ""표가 아쉬운 정치인들은 퍼주기 포퓰리즘에 경도되는 경우가 많다""며 ""그 계산서는 결국 미래 세대인 아이들이 감당한다""고 했습니다.  내년 총선을 겨냥한 듯한 메시지였는데요.  여야 대표 메시지 모두 어린이날과는 다소 어울리지 않아 보입니다.  때와 장소에 적절한 말일수록 그 진심이 느껴지지 않을까 싶습니다. (적절하게) 지금까지 여랑야랑이었습니다."
2023.05.06.,"방탄소년단 RM 10주년·군 입대 심경 ""솔직히 두려워""",https://n.news.naver.com/mnews/article/079/0003766924?sid=106,<구조 다름>
2023.05.06.,이재명 '대장동 재판' 11일 시작…'사법리스크' 치솟는다,https://n.news.naver.com/mnews/article/079/0003766887?sid=102,"이재명, '대장동 의혹' 관련 첫 재판 11일에 열려 법정공방 예고…""4895억 배임"" vs ""4583억 환수""이재명 사법리스크는 더욱 커질 듯이미 공직선거법 위반 혐의로 법원 출석 중대장동 재판 본격 시작되면 매주 출석 가능성더불어민주당 이재명 대표. 윤창원 기자더불어민주당 이재명 대표의 대장동·위례신도시 개발 특혜 비리와 성남FC 후원금 의혹 재판이 오는 11일 시작된다. 양측의 법정 공방은 그 어느 때보다 치열할 것으로 보인다. 대장동 개발사업과 관련해 검찰은 '4895억 원의 배임'이라고 판단한 반면, 이재명 대표 측은 '4583억 원의 공익 환수 사업'이라고 맞서고 있다.대장동 개발 특혜에서 파생된 공직선거법 위반 혐의로 기소돼 법원에 출석하고 있는 이재명 대표는 대장동 본류 사건에서 적극적으로 방어권을 행사해야 하는 처지가 된 만큼 사법리스크는 한층 고조된 상황이다.이재명 '대장동 배임' 재판 11일 시작6일 법조계에 따르면 서울중앙지법 형사합의33부(김동현 부장판사)는 11일 이재명 대표의 특정경제범죄가중처벌법상 배임과 이해충돌방지법 위반, 부패방지법 위반, 특정범죄가중처벌법상 뇌물 혐의 재판의 첫 공판준비기일을 진행한다.공판준비기일에는 피고인의 출석 의무가 없어 이날 재판에 이 대표가 모습을 드러내지는 않을 것으로 보인다.앞서 검찰은 지난 3월 22일 이 대표가 과거 성남시장 재직 시절 대장동 민간 개발업자들에게 유리한 사업 구조를 승인해 성남도시개발공사(성남도개공)에 4895억 원의 손해를 끼쳤다며 배임 혐의를 적용해 불구속 기소했다. 또 대장동과 위례신도시 개발 사업 과정에서 직무상 비밀을 개발업자들에게 흘려 각각 7886억 원, 211억 원의 이익을 얻게 했다고도 봤다.여기에다 성남FC 후원금 명목으로 두산건설과 네이버 등 성남시 내 4개 기업으로부터 133억 5000만 원을 받았고, 그 대가로 건축 인허가, 토지 용도 변경 등 사업 편의를 제공했다며 뇌물 혐의도 적용했다.檢 ""4895억 배임"" vs 李 ""4583억 공익환수""… 법정 공방 예고대장동 개발 비리 의혹 사건과 관련해 이재명 대표가 처음 기소된 사건으로 검찰과 이 대표 측의 법정 공방은 그 어느 때보다 치열할 것으로 예상된다.류영주 기자특히 대장동 개발 사업과 관련해 검찰은 성남시가 얻을 수 있었던 4895억 원을 포기한 배임 범죄로 판단한 반면, 이 대표 측은 개발업자들의 돈으로 성남시가 수익을 챙기고 공원까지 조성해 4895억 원을 환수한 공익 사업이라고 정반대의 주장을 내놓은 상황이다.검찰은 대장동 개발 사업으로 성남도개공이 챙겼어야 할 돈은 6725억 원인데 성남시가 확정 이익 방식을 택해 1830억 원만 챙겼다며, 총 4895억 원의 배임 범죄로 보고 있다.검찰이 이렇게 판단한 근거로는 성남도개공이 지난 2015년 작성한 '대장동 개발사업 공모지침서'가 꼽힌다. CBS노컷뉴스 취재를 종합하면 성남도개공 개발본부 소속 A팀장은 지난 2015년 1월 ""확정이익이 아닌 일정 비율대로 이익을 배분하는 방안을 채택해야 한다""는 의견을 제시하며 '이익 배분은 공공 70%, 민간 30%'의 방안을 냈지만, 성남시는 확정이익 방식을 선택했다.관련기사[단독]""대장동 수익 공공 70%·민간 30%"" 실무진 건의도 배제이 대표 측의 해석은 검찰과 정반대다. 성남시와 성남도개공의 사업 위험은 최소화하면서 위험 부담은 개발업자들에게 넘긴 행정이었고, 그 결과 4583억 원의 공익을 환수한 사업이라는 것이다. 확정이익을 택한 것에 대해서도 부동산 시장 불안정 등으로 부동산 개발 사업의 성패가 불투명한 상황에서 성남시는 확정이익을 챙기는 것이 안전한 방식이었다고도 주장한다.이 대표는 이 사건으로 지난 1월과 2월에 검찰에 소환됐을 때도 이 같은 주장을 앞세웠다. 당시 이 대표는 ""2015년 2월 민간사업자를 경쟁 공모해 3개 컨소시엄 중 하나은행 컨소시엄이 선정됐다""라며 ""성남도개공은 25억 원만 부담하고 일체의 위험 부담을 하지 않았다. 그리고 1조 3000억 원에 이르는 개발자금 조달과 사업 시행, 사업 실패나 손실 발생 위험을 모두 민간 사업자가 떠안았다""라고 밝혔다.그러면서 ""민간투자자가 2561억 원으로 신흥동 1공단 부지를 공원화했고, 공사에는 임대아파트 부지나 1822억 원을 우선 배당하기로 했다""라며 ""총 4583억 원의 공익 환수를 확정했다""라고 주장했다. 성남도개공에 배당된 임대 아파트 부지 이익(1822억 원), 1공단 공원화 비용(2561억 원), 터널 건설 비용(200억 원)이 4583억 원 환수 결과물이라는 것이다.공직선거법 위반 재판은 이미 진행 중… '李 사법리스크' 커진다경기도 성남시 분당구 대장동 개발사업 현장의 모습.이 대표는 이미 대장동 개발 특혜 의혹에서 비롯된 공직선거법 위반 혐의로 격주 금요일마다 서울중앙지법에 출석하고 있다.앞서 검찰은 이 대표가 △故 김문기 전 성남도시개발공사 처장을 모른다고 말한 점 △백현동 한국식품연구원 부지 용도 변경이 국토교통부의 요청으로 이뤄졌다고 말한 점에 대해서 허위 사실을 공표한 것이라며 이 대표를 공직선거법 위반 혐의로 불구속 기소했다.이 대표는 지난 3월 3일 열린 첫 공판기일부터 격주 금요일 재판에 출석하고 있다. 재판 역시 오전 10시 30분부터 오후 6시까지 사실상 하루 종일 진행 열리고 있다.이런 상황에서 대장동 배임 관련 본류 재판이 시작되면서 이 대표의 법원 출석은 더 잦아지게 됐다. 대장동 관련 재판으로 기소된 이 대표의 측근 정진상 전 정무조정실장과 김용 전 민주연구원 부원장 재판이 매주 진행되고 있는 점을 고려하면 이 대표도 매주 한번 이상 법원에 출석할 가능성이 높다.※CBS노컷뉴스는 여러분의 제보로 함께 세상을 바꿉니다. 각종 비리와 부당대우, 사건사고와 미담 등 모든 얘깃거리를 알려주세요.이메일 : jebo@cbs.co.kr카카오톡 : @노컷뉴스사이트 : https://url.kr/b71afn"
2023.05.06.,경북에 최대 150㎜ 폭우 쏟아져…피해신고 27건 접수,https://n.news.naver.com/mnews/article/079/0003766928?sid=102,"6일 오후 5시 기준 봉화 석포 150㎜, 울릉 천부 147㎜경북 동해안 내려진 강풍특보 7일까지 이어져 '시설물 주의' 요구소방관들이 영주시 단산면 축대붕괴 사고 현장에서 구조활동을 벌이고 있다. 경북소방본부 제공경북에 최대 150㎜의 폭우가 쏟아지면서 도내 곳곳에서 피해 신고가 잇따르고 있다.   경상북도소방본부는 지난 5일 오후 5시부터 6일 오후 5시까지 도내 23개 시군에서 접수된 호우·강풍관련 피해신고는 모두 27건이라고 밝혔다.    피해 유형별로는 도로장애가 17건으로 가장 많고, 축대붕괴와 침수, 인명구조가 각각 1건씩, 기타 7건이다.    지역별로는 포항과 경주, 고령이 3건씩, 안동과 영주, 상주, 문경, 성주, 울진, 구미 2건씩, 군위와 청도, 봉화, 영양이 1건씩 접수됐다.    6일 오전 1시 52분쯤 울진군 기성면에서는 나무 쓰러짐으로 도로 통행이 어렵다는 신고가 접수돼 당국이 안전조치를 취했다.    오전 4시 57분에는 영주시 단산면 구구리에서 길이 30m 축대가 무너져 주택을 덮쳤다. 다행히 인명피해는 발생하지 않았지만, 소방 당국은 주민 6명을 인근 마을회관으로 대피시키고 주택의 가스 밸브를 차단했다.    오전 8시 33분쯤에는 봉화군 석포면 승부리에서 도로에 토사가 유입돼 차량이 이동할 수 없다는 신고가 접수돼 포크레인 1대를 동원해 처리작업을 벌였다.    또 오전 7시 16분에는 청도군 풍각면에서 하수구가 역류해 일대 도로가 침수됐다는 신고가 접수됐고, 오전 8시 13분에는 영주시 가흥동에서 상수도 공사를 했던 도로 주위로 지반이 침하했다는 신고가 들어와 당국이 안전조치를 했다.   오전 10시 10분에는 경주시 산내면에서 나무가 도로에 쓰러져 안전조치를 취했고, 10시 22분에는 포항시 북구 두호동이 한 건설 공사현장 자재가 넘어져 긴급조치를 마무리했다.    소방관들이 문경시 영순면 하천에서 낚시하다 불어난 물에 고립됐던 남성을 구조하고 있다. 경북소방본부 제공 오전 11시 39분에는 문경시 영순면 하천에서 낚시하던 40대가 불어난 물에 고립됐다가 1시간 만에 구조하기도 했다.    이날 오후 3시 43분에는 경주시 진현동에서 지반이 침하됐다는 신고가, 오후 4시 53분에는 고령군 대가야읍에서 나무·전신주가 쓰러졌다는 신고가 접수돼 안전조치를 마쳤다.    대구지방기상청에 따르면 이날 오후 5시 기준 누적 강우량은 봉화 석포 150㎜를 비롯해 울릉 천부 147㎜, 고령 141.5㎜, 상주 은척 129㎜를 기록했다. 또 청도 121.5㎜, 경주 토함산 96.5㎜, 포항 죽장 77.5㎜, 영덕읍 58㎜, 울진 평해 82.5㎜가 내렸다.   기상청은 비는 이날 저녁까지 5㎜ 가량 더 내린 뒤 차츰 그칠 것으로 전망했다.    하지만 동해안과 울릉도·독도에 내려진 강풍특보는 7일 오후까지도 이어질 것으로 예상했다.    대구기상청 관계자는 ""많은 비를 뿌리는 비구름은 대부분 지나간 것으로 보인다""면서 ""내일까지는 해안지역을 중심으로 강한 바람이 불 수 있어 시설물 관리에 주의가 요구된다""고 말했다.※CBS노컷뉴스는 여러분의 제보로 함께 세상을 바꿉니다. 각종 비리와 부당대우, 사건사고와 미담 등 모든 얘깃거리를 알려주세요.이메일 : jebo@cbs.co.kr카카오톡 : @노컷뉴스사이트 : https://url.kr/b71afn"
2023.05.06.,"""故 서세원 사랑 아냐""…서정희, 오은영 조언에 눈물",https://n.news.naver.com/mnews/article/079/0003766927?sid=106,<구조 다름>
