기사날짜,기사제목,네이버 뉴스 url,기사내용
2021.01.14.,[단독] 군사 기밀·외도 사실까지…개인정보 '줄줄' 카카오맵,https://n.news.naver.com/mnews/article/214/0001093062?sid=101,"[뉴스데스크]◀ 앵커 ▶요즘 스마트폰으로 지도 어플 많이들 사용하시죠. 혹시 카카오 맵 쓰시는 분들, 이번 소식 눈 여겨 보셔야겠습니다.500만 명 이상이 사용 중인 카카오 맵을 통해서, 민감한 개인 정보들이 줄줄 새고 있다는 사실을 저희가 확인했습니다.내가 어디 사는지, 직장은 어딘지, 가족에 대한 정보는 물론 이고, 군사 관련 기밀까지 아무런 제약 없이 누구나 볼 수 있다고 합니다.먼저 김세진 기자의 단독 보도 보시고 자세한 내용 짚어 보겠습니다.◀ 리포트 ▶카카오맵을 사용 중인 김 모 씨는 최근 자신이 방문한 음식점에 리뷰를 달다가 깜짝 놀랐습니다. 다른 사람들이 쓴 리뷰를 클릭해봤는데, 그 사람 집 주소는 물론 친구와 부모님 아파트 동 호수까지 줄줄이 나왔기 때문입니다.[김 모 씨/회사원 (카카오맵 이용자)]""(리뷰 작성자의) 댓글로 실명하고 집 주소 같은 것도 나오고요. 그 다음에 뭐 친척집 아니면 자기가 병원 다녔던 곳 이런 것도 나오고, 애들 유치원 같은 것도 나와 가지고, 아, 이건 애들한테 위험하지 않나…""카카오맵에서 음식점 리뷰들을 눌러봤습니다. 리뷰를 쓴 사람이 저장한 주소 목록이 뜨고, 그 사람 집 주소는 물론, 지인들 이름과 몇 동 몇 호까지 다 나옵니다.또 다른 사용자의 경우는, 직장 동료와 상사 수십 명의 상세 주소는 물론, 본인의 출장내용을 적어둔 메모까지 보입니다. 이들의 이름과 주소 등을 조합해 검색하니, 5분도 안 돼 회사는 물론 근무부서까지 알아낼 수 있었습니다.그렇다면 이들은 본인 정보가 이렇게 공개되는 걸 알고 있을까.[개인정보 노출 이용자의 직장 동료]""그 정보 공개 허용 버튼이 있는지도 몰랐다고 하시고요. 어떤 경로로 유출됐는지 기억도 안 난다고 하시고요. 많이 당황하신 것 같고 놀라신 것 같아요.""이번엔 한 병원 리뷰를 클릭했더니, 리뷰 쓴 사람의 즐겨찾기에 군사기밀로 보이는 내용들이 들어 있습니다. 작전부대 이름과 위치, 훈련진지의 위치도 있습니다.얼마나 정확한 정보인지 확인하기 위해 카카오맵을 작동시키니, 깊은 산속으로 안내합니다.산 앞에는 푯말도 없지만 이렇게 산으로 올라오니 카카오맵에 나온 군 진지와 실제 진지가 일치함을 확인할 수 있었습니다.[군인](길 좀 여쭐게요. 여기가 3** 대대예요?)""여기가 3** 대대예요.""국방부에 확인한 결과, 이 정보를 저장한 사람은 현직 군 간부였습니다.[김대영/한국국가전략연구원 연구위원]""부대진지 같은 경우에는 실제 상황이 되면 가장 먼저 거기로 이동을 해서 대형을 해야 되는 상황인데요. 그 위치나 상황이 적이나 누구나 볼 수 있는 거라면, 사실상 군 작전이라는 게 무용지물이나 다름없는…""내밀한 개인정보도 공개돼 있습니다.식당 리뷰를 쓴 사람의 폴더를 누르니, 불륜을 저질렀던 장소, 심지어 성행위를 어디서 어떻게 했는지가 빼곡하게 적혀 있습니다.이 사람은 자녀들 학교나 직장까지 함께 올려놔, 누군가 마음먹으면 얼마든지 악용이 가능해 보입니다.또 다른 사용자는 전국의 집창촌 주소를 저장해뒀는데, 본인 실명은 물론 자녀로 보이는 아이 사진까지 함께 볼 수 있습니다.취재팀이, 카카오맵 장소 리뷰 400개를 무작위로 골라 확인해보니, 10% 넘는 42명의 사생활 정보가 훤히 공개돼 있었습니다. 그렇다면 카카오맵은 이들로부터 개인정보 공개 동의를 제대로 받았을까?카카오맵에 장소를 저장하려면 반드시 폴더에 넣게 돼 있는데, 폴더 제목을 입력하려고 화면을 누르자 자판 창이 튀어 올라, 정보 공개에 동의하는지 묻는 질문을 가려버립니다.그런데 이 질문은 처음부터 기본 설정이 '공개'로 돼 있어, 가려진 질문을 못 보고 확인을 누르면, 자신도 모르게 동의한 걸로 처리돼 모든 정보가 공개되는 겁니다.[김 모 씨/회사원 (카카오맵 이용자)]""몰랐어요. 이게 다 공개되는 거는. 공개 비공개를 전혀 볼 수가 없게끔 되어 있더라고요. (자판에) 가려져가지고 바로 올라가버리더라고요.""현재 정부 가이드 라인에는, 정보 수집 동의를 받을 때 기본 설정을 '동의'로 해놓지 말라고 명시돼있습니다.이에 대해 카카오는, 사용자들이 카카오맵에 저장하는 정보는 장소일 뿐, 개인 정보가 아니기 때문에, 기본 설정을 공개로 해놓은 거라고 해명했습니다.전문가들은, 카카오로서는, 사용자들이 서로의 장소 정보를 많이 읽고 공유할수록 맵 이용률이 높아져 이득이라고 말합니다.[오병일/진보네트워크센터 소장]""소셜 네트워크 사업자들은 기본적으로 가입자들이 자신의 개인정보를 최대한 공개하도록 시스템을 설계하려는 유인을 가지고 있는 거죠. 그래야 그 플랫폼 자체의 어떤 정보가 많아지고, 그것이 또 다른 어떤 이용자들의 가입을 이끌 수가 있기 때문에…""카카오가 보완책을 약속한 가운데, 전문가들은 카카오 측이 의도적으로 정보수집 절차를 이렇게 설계했는지 조사가 필요하다고 지적했습니다. MBC뉴스 김세진입니다.◀ 앵커 ▶카카오맵 이용하시는 분들 기사 보시고 많이 놀라셨을 텐데 바로 이어서 관련 내용 취재한 경제팀 김세진 기자에게 궁금한 점들 몇 가지 더 물어보겠습니다.자 김 기자, 요즘 이런 지도 어플 사용하시는 분들 많으신데, 이런 개인정보 노출, 카카오맵만 그런 겁니까?◀ 기자 ▶네, 음식점 리뷰를 달고, 장소를 저장하는 기능은 네이버나 구글에도 있습니다. 하지만 그게 다거든요.그런데 유독 카카오는 이 장소들을 폴더에 저장하도록 한 겁니다. 예를 들면 '상암동 맛집'이라든가 이런 식으로요.그리고 이 폴더들을 남들이 열어볼 수 있게 한 겁니다.공유나 구독을 통해서요.사실 이 분야에서 카카오가 경쟁사인 네이버에 뒤처진 상황이다 보니, 폴더 식으로 해서 정보량을 늘리고, 사용자들 간 공유도 쉽게 해서 카카오맵 이용률을 높이려는 전략으로 보입니다.◀ 앵커 ▶저 같은 경우엔 카카오 맵은 안 써봤는데, 카카오 내비게이션은 가끔 쓰거든요?이 카카오 내비는 어떻습니까?카카오 맵이랑 정보가 공유가 되는 건가요?◀ 기자 ▶그건 아닙니다. 두 서비스 정보는 서로 분리가 돼 있습니다.◀ 앵커 ▶알겠습니다. 어쨌든 뉴스 보고 놀란 분들 많으실 텐데, 카카오 측의 반응은, 이용자들이 스스로 정보 공개에 동의를 한 거다, 이런 입장인 거죠?◀ 기자 ▶네. 하지만 취재 과정에서 만난 분들 가운데, 이게 공개되는 걸 알고 있는 분은 없었습니다.심지어 저희 기자들도 오늘 제 기사를 보고 놀라서, 카카오맵에 들어가 비공개로 많이들 바꿨습니다. 문제의 과정을 보여드리면요.카카오맵에서 정보를 저장하려면 폴더명부터 입력해야 하는데, 화면을 누르는 순간, 이렇게 자판이 나오면서 비공개냐 공개냐 질문을 가려버리고요.제가 폴더 이름을 치고 확인을 누르면 그냥 동의한 걸로 처리되는 겁니다.사실 이런 가입 절차가 귀찮고 다들 바빠서, 대충대충 체크 하고 넘어가기 일쑤라, 이렇게 질문을 숨겨놓으면, 자신이 동의했단 사실도 알기 어려운 겁니다.◀ 앵커 ▶그러면 카카오맵에 가입을 해서 이미 쓰고 있는 분들은 어떻게 하면 되는 겁니까?◀ 기자 ▶여기 보시면 폴더 옆에 점이 3개 있는데 이걸 누르면 삭제나 비공개 전환이 가능합니다.그런데 위에 보시면 내 폴더 접속 횟수가 뜨는데요. 만약 이 접속 횟수가 너무 높다 싶으면 남들이 열어봤을 가능성이 크니까, 빨리 삭제하시는 게 좋겠습니다.◀ 앵커 ▶카카오 측은 보완책을 검토하겠다고 했는데, 어쨌든 개인의 정보를 마구 노출 시킨 거잖아요? 법적인 책임은 없습니까?◀ 기자 ▶유럽 연합의 경우, 개인정보를 유출하지 않아도, 개인정보 유출이 쉽도록 시스템을 만들었다는 이유만으로, 그 기업 전체 매출의 4% 과징금을 물립니다.우리도 이런 방향으로 제도 개선을 하고 있는데요.하지만, 지금으로선 이런 개인정보 유출에 대해 해당 기업에게 크게 책임을 물리거나, 피해자 보상을 해주지는 않고 있습니다.◀ 앵커 ▶이제 와서 보완책을 내놓겠다곤 했지만 보상 문제를 떠나서 이미 개인 정보 유출 피해를 보신 분들이 너무 많아서 걱정입니다.계속 관련 소식 지켜보도록 하겠습니다. 지금까지 경제팀 김세진 기자였습니다.잘 들었습니다.(영상취재: 이향진, 나준영, 이준하 / 영상편집: 김하은)MBC 뉴스는 24시간 여러분의 제보를 기다립니다. ▷ 전화 02-784-4000▷ 이메일 mbcjebo@mbc.co.kr▷ 카카오톡 @mbc제보김세진 기자(blue32@mbc.co.kr)[저작권자(c) MBC (https://imnews.imbc.com) 무단복제-재배포 금지]▶ 네이버 홈에서 [MBC뉴스] 채널 구독하기▶ 새로움을 탐험하다. ""엠빅뉴스""▶ [M라운지] 편안한데 찰진 수다의 공간Copyright(c) Since 1996, MBC&iMBC All rights reserved."
2021.01.14.,"카카오맵 일부 이용자 신상 노출…카카오 ""보완하겠다""(종합)",https://n.news.naver.com/mnews/article/001/0012141473?sid=105,"즐겨찾는 장소 '공개' 기본설정 탓…카카오 ""비공개로 변경""카카오맵 화면[카카오 제공. 재판매 및 DB 금지]    (서울=연합뉴스) 이효석 기자 = 카카오의 지도 앱 '카카오맵'을 통해 이용자들 신상을 파악할 수 있다는 문제가 제기됐다.    14일 IT업계에 따르면 일부 카카오맵 이용자가 자신의 신상정보를 즐겨찾기로 설정해놓고 이를 전체 공개로 둔 것이 다른 이용자들에게 노출되는 것으로 확인됐다.    군부대 이름과 위치를 드러낸 이용자도 있었고, 성매매 업소 리스트를 누구나 볼 수 있는 즐겨찾기 목록으로 해둔 이용자도 있었다.    카카오맵에서 즐겨 찾는 장소를 저장하면 폴더 이름을 입력하도록 돼 있는데, 이때 정보 공개 여부를 묻는 항목이 휴대전화 자판에 가려지는 데다가 기본 설정이 '공개'로 돼 있기 때문이었다.    카카오 측은 ""즐겨 찾는 장소는 개인을 식별할 수 있는 개인정보가 아니어서 기본값을 '비공개'로 할 이유가 없었다""고 설명했다.    이용자들이 실명으로 서비스를 쓰면서 민감한 정보를 올려두고는 전체 공개로 저장해뒀으니 카카오가 개인정보보호법을 위반한 것은 아니라는 것이다.    다만 카카오 측은 ""즐겨찾기 폴더 설정 기본값을 '비공개'로 변경하기로 결정하고 현재 작업 중""이라며 ""추가로 보완할 부분이 있는지도 살펴볼 예정""이라고 밝혔다.    hyo@yna.co.kr▶네이버에서도 뉴스는 연합뉴스[구독 클릭]▶[팩트체크]김학의 출금 절차 위법이면 무죄?▶제보하기<저작권자(c) 연합뉴스(https://www.yna.co.kr/), 무단 전재-재배포 금지>"
2021.01.14.,네이버-카카오 '라이브 e커머스' 성장세 뜨겁다,https://n.news.naver.com/mnews/article/014/0004565330?sid=105,"TV홈쇼핑과 e커머스 장점 결합.. MZ세대 지갑 공략쌍방향 소통으로 구매 전환율 높고, 콘텐츠 경쟁력 갖춰   [파이낸셜뉴스] 네이버와 카카오가 뛰어든 실시간 전자상거래(라이브 e커머스) 성장세가 뜨겁다. 기존에 TV홈쇼핑과 e커머스 장점만 결합, 상대적으로 구매 전환율이 높은 라이브 e커머스를 통해 20~30대 지갑을 열고 있는 것이다. 특히 이들 MZ세대(20~30대를 뜻하는 밀레니얼과 Z세대 통칭)는 유튜브를 보듯이 라이브 e커머스를 즐기고, 쌍뱡향 소통을 이어간다는 점에서 예능요소 결합 등 콘텐츠 경쟁력도 강화될 전망이다.  네이버 쇼핑라이브, '대한민국농수산' 스토어 이미지. 네이버 제공  ■비대면 쇼핑 날개 달다  14일 관련 업계에 따르면 지난해 7월과 10월 각각 정식 출시된 ‘네이버쇼핑라이브’와 ‘카카오쇼핑라이브’가 비대면 쇼핑 흐름을 타고 빠르게 성장하고 있다. 소비자는 물론 판매자 역시 라이브 e커머스 채널을 선호하는 현상이 반영된 결과다.   우선 네이버쇼핑라이브는 지난해 12월 말 기준으로 누적 시청 횟수 7000만을 달성했다. 또 지난해 12월 한 달 거래액도 전월대비 64% 증가한 것으로 집계됐다. 특히 네이버 쇼핑라이브는 스마트폰 하나로 누구나 라이브 e커머스에 참여할 수 있는 게 강점이다. 즉 네이버 스마트스토어 등 중소형업체(SME)들이 원할 때 언제든지 라이브 e커머스를 할 수 있다. 일례로 한 가전업체는 네이버쇼핑라이브 진행 1시간 동안 거래액 10억 원을 돌파했으며, 또 다른 농수산업체는 직접 바다에서 잡아 올린 대게 싱싱함을 네이버쇼핑라이브로 전달하면서 자체 스마트 스토어 단골 소비자(스토어찜)가 22만을 넘어섰다. 네이버는 또 최근 예능을 접목한 라이브 e커머스 ‘리코의 도전’ 하나로 30만 시청 회수를 달성, 예능형 쇼핑 콘텐츠 가능성을 열었다.    카카오쇼핑라이브 생중계 화면. 카카오커머스 제공  ■카톡으로 쌍방향 소통  카카오커머스가 운영하는 카카오쇼핑라이브 누적 시청 횟수도 전날 기준 2000만 회를 넘었다. 또 지난해 12월 말 기준 카카오쇼핑라이브 거래액 역시 정식오픈 달인 10월 대비 2배 증가한 것으로 나타났다.   카카오커머스 측은 “카카오쇼핑라이브의 경우 카카오톡이라는 국민 플랫폼을 바탕으로 누구나 쉽게 접근해 쌍방향 소통이 가능하다”며 “전용 스튜디오와 라이브커머스 전담팀 구성 등 방송 퀄리티를 높이는 노력을 통해 차별화된 쇼핑 콘텐츠를 제공하고 있는 것이 성장 요인”이라고 전했다.   카카오쇼핑라이브는 현재 하루 1~2회 방송 진행으로 브랜드, 제조사와 사전 커뮤니케이션을 통해 라이브를 기획하고 있지만, 향후 자체 제작 환경이 없는 브랜드, 제조사, 유통사를 지원하기 위한 추가 스튜디오 등 라이브 시스템을 보완할 계획이다.   카카오커머스 관계자는 “카카오쇼핑라이브 서비스가 정식 출범한 후 뜨거운 호응 속에 누적 시청 횟수가 빠르게 증가하고 있다”며 “차별화되는 콘텐츠를 지속 개발하고, 방송제작 환경을 개선해 앞으로도 고객들을 위한 다양한 라이브 커머스를 선보일 계획”이라고 말했다.  #언택트 #카카오쇼핑라이브 #네이버쇼핑라이브   elikim@fnnews.com 김미희 기자   ▶ 헉! 소리나는 스!토리 뉴스 [헉스]▶ '아는 척'하고 싶은 당신을 위한 [두유노우]▶ 날로먹고 구워먹는 금융이슈 [파인애플]  ※ 저작권자 ⓒ 파이낸셜뉴스. 무단 전재-재배포 금지"
2021.01.14.,"카카오, GS건설에 챗봇 제공…""톡으로 아파트분양 신청부터 입주 절차까지 OK""",https://n.news.naver.com/mnews/article/003/0010293600?sid=101,"'카카오 i 커넥트 톡', 오는 4월부터 아파트 분양 주요 과정 카톡으로 제공[서울=뉴시스] 이진영 기자 = 카카오의 국민 메신저 '카카오톡'으로 분양 상담, 중도금 납부, 입주 안내 등 아파트 분양의 전 과정을 원스톱으로 해결할 수 있게 된다.카카오엔터프라이즈가 GS건설과 협력해 아파트 분양의 주요 과정을 카카오톡으로 제공하는 '카카오 i 커넥트 톡'(Kakao i Connect Talk) 사용 계약을 체결했다고 14일 밝혔다.카카오 i 커넥트 톡은 카카오톡 채널, 챗봇 등을 결합한 인공지능(AI) 기반 비즈니스 플랫폼이다. GS건설은 카카오톡으로 분양 고객들에게 분양/계약/납부/입주/고객문의(A/S) 서비스까지 한 번에 제공할 수 있다. 익숙하고 편리한 카카오톡으로 분양 서비스를 이용할 수 있고, 복잡한 절차를 최소화하여 보다 쉽고 빠르게 이용할 수 있는 것이 강점이다. 챗봇 서비스는 오는 4월 개시할 예정이다. 이용자는 카카오톡으로 분양 위치, 평면 안내 등 정보를 확인하고 분양 상담, 계약일 사전 예약 등 예약 서비스를 이용할 수 있다. 분양 후에는 입주 안내, 입주 예약 등의 서비스를 비롯해 분양금 납부 확인서, 입주 예정 확인서, 중도금 납부 조회 등 발급 및 조회 서비스까지 이용 가능하다. 입주 후에는 AS 신청/ AS 접수 내역 확인 등도 할 수 있다.기존 챗봇보다 월등히 똑똑해졌다는 점도 특징이다. 이용자의 의도를 정확하게 파악하고 그에 맞는 답을 보여준다. 카카오 i 커넥트 톡에는 고급 머신러닝 기술이 적용돼 기존 챗봇보다 월등한 문장 인식/이해 능력을 갖췄다. 따라서 고객의 질문을 명확히 파악할 수 있고 자주하는 질문이 아니더라도 문맥을 파악해 효율적인 답변을 제공한다.예를 들어 챗봇 내 '분양 안내', '입주 안내' 등의 메뉴를 눌러 정보를 확인하는 것뿐만 아니라 “요즘 어떤 아파트 분양하는지 정보 좀 알려줄래?”와 같은 자연스러운 발화도 응대할 수 있다.카카오엔터프라이즈 백상엽 대표는 ""고객은 카카오톡으로 편리하게 서비스를 이용할 수 있고 기업은 고객 사용 패턴 등을 용이하게 분석해 더 좋은 대 고객 서비스를 제공할 수 있다""며 ""카카오 i 커넥트 톡으로 가능한 서비스를 지속 확대할 것""이라고 전했다.☞공감언론 뉴시스 mint@newsis.com▶ 네이버에서 뉴시스 구독하기▶ K-Artprice, 유명 미술작품 가격 공개▶ 뉴시스 빅데이터 MSI 주가시세표 바로가기<ⓒ 공감언론 뉴시스통신사. 무단전재-재배포 금지>"
2021.01.14.,카카오 첫 구독 서비스…딩동~ 이모티콘 왔어요,https://n.news.naver.com/mnews/article/028/0002528530?sid=105,"이모티콘 15만개 구독 '플러스' 출시한달 4900원에 무제한 이용월 990원 대화내용 저장 서비스도상반기 콘텐츠 플랫폼도 내놓을듯작년 글로벌 구독경제 600조 육박카카오 이모티콘 플러스. 카카오 제공카카오가 첫 번째 구독 서비스를 내놓았다. 카카오톡 이모티콘 무제한 사용 상품과 대화내용 유료 저장 서비스다. 올 상반기엔 유료와 후원 모델을 포함한 새로운 콘텐츠 구독 플랫폼을 내놓는다. 성장 잠재력이 큰 구독 시장 진출에 카카오가 속도를 내고 있다.  ■월 정액으로 이모티콘 무제한 이용 카카오가 13일 출시한 ‘이모티콘 플러스’는 카카오톡 이모티콘을 월 정액으로 무제한 사용할 수 있는 상품이다. 이모티콘 뭉치인 이모티콘 세트를 5개까지 내려받을 수도 있다. 대화창에 입력된 단어나 문장을 토대로 알고리즘이 이모티콘을 자동 추천하는 방식이다. 지난 2011년 11월 처음 선보인 카카오톡 이모티콘은 현재 15만개의 이모트(메시지 단위의 개별 이모티콘)가 있다. 한달 요금은 4900원이지만 서비스 오픈 기념으로 한시적으로 3900원만 받는다. 첫 한 달은 무료다. 오는 10월 구글이 인앱결제 강제 정책을 확정하면 결제 방법이나 가격이 변경될 수 있다. 결제는 지난해 말 구독 서비스 강화 방향을 밝히면서 내놓은 ‘카카오톡 지갑’을 통해 정기적으로 이뤄진다. 카카오 쪽은 “지난 9년간 이모티콘 생태계 성장을 이끌며 수많은 창작자 및 이용자들의 의견에 귀를 기울여왔으며, 이를 바탕으로 새로운 월 정액 상품을 선보이게 됐다”고 밝혔다. 다만 카카오 쪽은 구체적인 이모티콘 추천 방식이나 이모티콘 작가와의 수익 배분 방식 등은 공개하지 않았다. 지난 1년 동안 베타서비스를 진행했던 ‘톡서랍 플러스’도 이날 정식 출시됐다. 그동안은 카톡 기록을 백업하면 대화 내역만 저장할 수 있었지만 이 상품을 이용하면 사진, 동영상, 파일, 링크, 연락처 등도 보관할 수 있다. 월 990원에 100기가바이트(GB)가 제공된다. ■세계적으로 성장 중인 구독경제 카카오는 지난해부터 구독 시장 진입을 모색해왔다. 지난해 11월 카카오톡 채널을 개편한 것도 이런 흐름 중 하나다. 소비자는 카카오톡 채널을 통해 위니아에이드의 딤채 김치냉장고와 바디프랜드 안마 의자, 아모레퍼시픽 화장품 등을 월 사용료를 내고 이용할 수 있다. 카카오톡 이모티콘 구독 상품은 카카오가 직접 정액 요금을 받고 제작자에게 수익을 배분하는 것이라면, 카카오톡 채널을 통해서는 제조사의 구독 상품을 중개하는 역할에만 머무른다. 이에 이날 ‘이모티콘 플러스’와 ‘톡서랍 플러스’ 출시는 카카오가 구독 시장에 본격적으로 뛰어든다는 것을 의미한다. 올 상반기엔 뉴스·음악·글·동영상 등 콘텐츠 구독 상품 출시도 예고하고 있다. 카카오가 ‘구독 시장’을 차세대 먹거리로 삼아 빠른 속도로 뛰어들고 있는 셈이다. 조혜정 중소기업연구원 연구위원은 13일 <한겨레>와의 통화에서 “소비자들의 소비 패턴이 소유에서 공유, 나아가 구독의 형태로 진화하고 있다”며 “기술 발전에 따라 제품·서비스 구독에 대한 접근과 유통이 단순해지면서 구독경제 기반 비즈니스가 크게 늘고 있다. 국내에서도 구독경제 모델을 활용한 비즈니스를 하는 기업이 많아지고 소비자의 관심도 커지고 있으나 아직은 초기 단계”이라고 말했다. 글로벌 투자은행(IB) 크레딧스위스 자료를 보면, 구독경제의 시장 규모는 2015년 4200억달러(460조원)에서 지난해 5300억달러(580조원)로 불어나고 있다. 최민영 기자 mymy@hani.co.kr▶더불어 행복한 세상을 만드는 언론, 한겨레 구독하세요!▶코로나19 기사 보기▶전세 대란 기사 보기[ⓒ한겨레신문 : 무단전재 및 재배포 금지]"
2021.01.14.,"인권위 ""카카오, 혐오표현 강경대응 환영…동참 기대""",https://n.news.naver.com/mnews/article/421/0005107802?sid=102,"""부분적 금지보다 자율규범이 혐오표현 근절""30일 서울 중구 저동 국가인권위원회 모습. 2015.11.30/뉴스1 © News1 박정호 기자(서울=뉴스1) 박종홍 기자 = 국가인권위원회가 카카오의 증오발언 대응 원칙 발표를 두고 환영한다는 입장을 밝혔다.인권위는 14일 성명을 통해 ""이번 원칙 발표가 온라인 혐오 대응의 한 획을 긋는 모범적 사례라 본다""며 이 같이 밝혔다.앞서 카카오는 13일 '증오발언 근절을 위한 카카오의 원칙'을 발표하며 출신국가, 지역, 인종, 외양, 장애, 종교, 성별, 성 정체성을 이유로 특정대상을 차별하거나 배척하는 행위에 반대하고 이런 발언에 강경하게 대응한다는 원칙을 발표했다.인권위는 ""과거 온라인 포털의 뉴스댓글 폐지 같은 부분적이고 일괄적인 금지 정책을 넘어 자율규범을 만들어 이를 준수해야 혐오표현이 근절될 것""이라며 ""자율규범을 마련하려는 온라인 포털의 노력을 높이 평가한다""고 말했다.다른 온라인 사업자들의 동참도 촉구했다. 인권위는 ""온라인에서 혐오표현 대응에 실패하면 소수민족 등 많은 사람들의 생명권 침해로 이어지는 참혹한 상황을 낳을 수 있다""며 ""정보통신기술 부문의 모든 사업자가 제 역할을 해야 한다""고 촉구했다.구체적으로는 ""혐오표현 피해집단과 인권활동가와의 협력, 해로운 발언 규제에 관한 국제규범 준수, 혐오표현 대응에 대한 투명한 이행과 직원·이용자 교육이 그 역할""이라고 강조했다.그러면서 ""여러 온라인 포털과 커뮤니티들도 자율규범 마련에 동참해 혐오표현을 용납하지 않는 문화를 만들어 가기를 기대한다""고 밝혔다.1096pages@news1.kr▶ 네이버 메인에서 [뉴스1] 구독하기!▶  뉴스1&BBC 한글 뉴스 ▶  터닝포인트 2021 © 뉴스1코리아(news1.kr), 무단 전재 및 재배포 금지"
