기사날짜,기사제목,네이버 뉴스 url,기사내용
2021.01.13.,"11번가, '삼양라면 주방용 굿즈' 한정판매",https://n.news.naver.com/mnews/article/030/0002923111?sid=101,"11번가 삼양라면 주방용 굿즈11번가(대표 이상호)가 삼양식품, 나라홈데코와 협업한 주방용 굿즈 '삼양라면 혼밥 컬렉션'을 13일부터 오픈마켓 단독으로 판매한다.사회적 거리두기에 연일 늘고 있는 '집콕족'과 '혼밥족'을 겨냥, 음식 조리나 식사 등에 활용도가 높은 제품들로 구성한 것이 특징이다. 주방 장갑과 다용도 앞치마, 테이블 매트 등 총 8가지 제품으로 출시됐으며, 삼양라면의 대표 컬러인 주황색과 더불어 분말스프, 후레이크, 컵라면 용기 등 친근하고 유머러스한 디자인이 더해졌다.제품 가격은 '삼양라면 주방장갑'(로고, 분말스프, 후레이크형)은 6000원, '삼양라면 테이블 매트'(오렌지, 블루) 6000원, '삼양라면 맘편히 앞치마'(오렌지, 블루)는 1만원, '삼양라면 쇼퍼백'은 1만2000원이다. 새해 '이색 선물'을 찾고 있는 고객이라면 11번가 '선물하기' 서비스를 통해 해당 제품들을 휴대폰 문자 메시지나 카카오톡으로 주변 지인에게 손쉽게 선물할 수 있다.이번 컬렉션은 11번가가 지난해 9월 분말스프 베개, 차렵이불, 슬리퍼 등을 한정 수량 판매해 인기를 끌었던 '삼양라면 홈컬렉션'의 후속제품이다. 당시 '삼양라면 차렵이불'의 경우 라면 봉지가 그려진 독특한 디자인으로 고객들의 관심을 모아 준비된 물량이 하루만에 완판됐다.김정희기자 jhakim@etnews.com▶ “2021년, 꼭 알아야할 클라우드 기술과 비즈니스” 21일 방송▶ 네이버 홈에서 [전자신문] 구독하기 [Copyright ⓒ 전자신문 & 전자신문인터넷, 무단전재 및 재배포 금지]"
2021.01.13.,"""작년 국내 상위 5대 주식투자거래 앱 사용시간 120% 증가""",https://n.news.naver.com/mnews/article/001/0012137452?sid=105,"""지난해 국내 모바일 이용자 하루 4.4시간 써…금융 앱 이용 급증""앱애니 집계…국내 앱 지출 6조1천724억원[앱애니 제공. 재판매 및 DB 금지]    (서울=연합뉴스) 홍지인 기자 = 지난해 국내 모바일 앱 사용이 금융 부문을 중심으로 크게 늘었다는 조사 결과가 나왔다.    글로벌 앱 분석 업체 앱애니는 작년 국내 1인당 하루 평균 모바일 기기 사용시간이 4.4시간으로 2019년(3.7시간)보다 19% 증가한 것으로 집계됐다고 13일 밝혔다.    전 세계 평균은 4.2시간으로 20% 증가했다.     국내 앱 지출 금액은 56억4천만 달러(6조1천724억원)로, 2019년 50억 달러보다 약간 늘었다. 총 다운로드 횟수는 20억5천만건으로 집계됐다.     앱 중에서는 금융 부문이 다운로드 횟수는 전년보다 10%, 사용시간은 45% 각각 증가하는 등 이용이 크게 늘었다.     특히 상위 5대 주식 투자 거래 앱 사용 시간은 120% 급증하며 조사 대상국 중에 미국에 이어 두 번째 증가율을 기록했다.    사회관계망서비스(SNS) 부문에서는 월평균 사용시간 기준으로 '틱톡'이 2019년 7.2시간의 두 배 가까운 13.8시간으로 늘며 1위를 기록했다. 카카오톡은 11.1시간, 페이스북은 8.7시간, 네이버 카페는 6.2시간, 인스타그램은 4.8시간 등이었다.    동영상 스트리밍 앱 중에서는 유튜브의 월평균 사용시간이 37.8시간으로 작년보다(31.5시간) 20% 증가했다. 아프리카TV는 13.9시간, 트위치는 11.1시간, 웨이브는 9.1시간, 넷플릭스는 8.4시간으로 나타났다.    생방송 쇼핑인 라이브 커머스와 음식 배달 앱 등의 사용도 눈에 띄게 들었다.     앱애니 관계자는 ""코로나19로 전 세계 사람들이 집에 머무는 동안 모바일 사용 습관이 2~3년 앞당겨졌다""고 말했다.     ljungberg@yna.co.kr▶네이버에서도 뉴스는 연합뉴스[구독 클릭]▶[팩트체크]""코로나백신 접종 말라"" 진실은?▶제보하기<저작권자(c) 연합뉴스(https://www.yna.co.kr/), 무단 전재-재배포 금지>"
2021.01.13.,연말정산 간소화 15일 개통...민간인증서는 PC에서만 가능,https://n.news.naver.com/mnews/article/215/0000929389?sid=004,"[한국경제TV 조현석 기자]국세청은 연말정산 소득·세액공제에 필요한 증명자료를 조회할 수 있는 홈택스 연말정산 간소화 서비스를 15일 개통한다고 밝혔다.영수증 발급기관의 추가·수정 자료를 반영한 확정자료는 20일부터 제공된다.운영 시간은 매일 오전 6시부터 24시까지로 이용이 집중되는 15일부터 25일까지는 시스템 과부하를 방지하기 위해 1회 접속에 30분간 연속 사용할 수 있다.접속종료 예고 창이 뜨면 작업을 저장했다가 접속이 끊긴 후 재접속해서 이용할 수 있다.이번 연말정산 간소화 서비스에는 의료비 자료 중 실손의료보험 보험금과 신용카드(현금영수증)로 결제한 안경구입비, 공공임대주택사업자에게 지급한 월세액, 긴급재난지원금 관련 기부금 자료가 추가됐다.공제항목이지만 사업자에게 자료 제출 의무가 없거나 자료 제출 의무기관이 제출하지 않아서 조회되지 않는 자료는 근로자가 영수증 발급기관에서 직접 증명자료를 받아 회사에 제출해야 한다.보청기, 장애인 보장구, 현금 결제한 안경 구입비, 취학 전 학원비 등이다.의료비 자료가 간소화 서비스에서 조회되지 않거나 사실과 다르면 '조회되지 않는 의료비 신고센터'에 신고할 수 있다.2020년 귀속 연말정산 간소화 서비스는 민간 인증서(카카오톡, 페이코, KB국민은행, 통신 3사 PASS, 삼성 PASS)로도 자료를 조회하거나부양가족의 자료제공 동의 신청·취소를 할 수 있다.다만 민간 인증서로는 PC에서만 이용할 수 있고 모바일 홈택스 애플리케이션, 즉 손택스를 이용할 수 없다.공동인증서(구 공인인증서/금융인증서), 행정전자서명(GPKI), 교육기관전자서명(EPKI)은 PC와 모바일 서비스를 모두 이용할 수 있다.부양가족의 간소화 자료는 부양가족이 자료 제공에 동의하는 절차를 거쳐야 근로자가 조회할 수 있다.2002년 1월 1일 이후 출생한 미성년 자녀의 자료는 근로자 본인이 '미성년 자녀 자료 조회 신청'을 거쳐 조회할 수 있다.자료제공 동의는 홈택스 또는 손택스에 접속해 본인인증 후 신청할 수 있고, 팩스·방문 신청도 가능하다.회사의 전산 시스템 여건에 따라 홈택스에서 공제신고서 작성(근로자)과 지급명세서 작성·제출(회사)까지 처리할 수 있는 '편리한 연말정산 서비스'는 18일부터 운영된다.올해분 연말정산에서는 카드 소득공제가 소비 시기에 따라 대폭 확대 적용된다.카드 종류와 사용처에 따라 1∼2월에 15∼40%인 공제율이 3월에는 사용처별로 2배로 상향되고, 4∼7월에는 일괄 80%로 오른다.8∼12월 사용분은 1∼2월과 같은 공제율이 적용된다.신용카드 소득공제 한도액도 총급여 구간에 따라 200만원, 250만원, 300만원에서 30만원씩 올랐다.전통시장, 대중교통, 도서·공연·박물관·미술관 사용액은 이 한도액과 무관하게 각 100만원까지 소득공제를 받을 수 있다.따라서 연말정산 간소화 서비스에서 조회된 자료가 실제 카드 소비와 다르다면 카드사에 사용금액 확인서 재발급을 요구하거나 거래 사실을 증명하는 자료를 회사에 따로 제출하면 된다.이 밖에도 이번 연말정산부터 ▲ 배우자 출산휴가 급여 비과세 신설 ▲ 국내 복귀 우수 인력 소득세 감면 ▲ 벤처기업 스톡옵션 행사이익 비과세 한도 3천만원으로 확대 등을 절세에 활용할 수 있다.긴급재난지원금 기부금은 수령액만큼은 법정기부금으로, 수령액보다 더 많이 기부한 금액은 지정지부금으로 각각 분류해 세액공제가 적용된다.세대구성원 중 근로소득자가 2명 이상이라면 세대주나 세대원 가운데 1명이 전액에 대해 공제받을 수 있다.작년에 지출한 의료비 중 실손보험금 수령액은 의료비 세액공제 신청에서 제외해야 한다.2019년 귀속분 연말정산(작년 1월)에서 의료비세액공제를 받은 후 작년에 실손보험금을 받았다면, 올해 5월 종합소득세 신고 때 수정신고를 해야 한다.수정신고를 하지 않으면 미납 세금과 가산세를 물게 될 수도 있다.누락 없이 공제를 받는 것만큼이나 '부당공제'로 가산세를 물지 않는 데에도 주의해야 한다.근로자들이 연말정산에서 자주 틀리는 항목은 '소득금액' 100만원 초과 부양가족 인적공제, 맞벌이 근로자의 자녀 중복공제, 형제자매의부모 중복 공제, 주택자금 또는 월세액 부당공제 등이다.여기서 소득금액이란 총급여, 총수입금액, 총연금액, 양도차액 등에서 근로소득공제, 필요경비, 연금소득공제 등을 차감한 금액을 가리킨다.특히 부양가족 인적공제에 오류가 있으면 기본·추가공제에 더해 인적공제를 잘못 적용한 가족의 특별공제(보험료, 교육비, 신용카드, 기부금 등)까지도 배제되므로 추가로 납부해야 할 세액과 가산세가 많이 늘어난다.조현석기자 hscho@wowtv.co.kr▶ 네이버 홈에서 [한국경제TV] 채널 구독하기 [생방송보기]▶ 대한민국 재테크 총집결! - [증권 / 주식상담 / 부동산]ⓒ 한국경제TV, 무단 전재 및 재배포 금지"
2021.01.13.,"이마트24, 보조배터리 공유 서비스 도입",https://n.news.naver.com/mnews/article/030/0002923077?sid=101,"한 고객이 이마트24에서 충전돼지를 이용하고 있다.이마트24는 스타트업 백퍼센트와 손잡고 보조배터리 공유경제 서비스 '충전돼지'를 오피스상권, 대학가 등 수도권 소재 50개 매장에 도입한다고 13일 밝혔다.이마트24는 고객 편익을 높이기 위해 보조배터리 공유 서비스를 선보이게 됐다. 충전돼지는 보조배터리 대여 및 반납을 손쉽게 할 수 있는 것이 장점이다. 보조배터리 대여 후 이마트24뿐만 아니라 영화관, 카페, 식당 등 충전돼지가 있는 곳이라면 어디든지 반납이 가능하다.반대로 다른 곳에서 대여한 충전돼지를 이마트24에 들러 반납하는 것도 가능하다. 충전돼지 기기는 서울에서 제주까지 전국 주요 상권에 설치돼 있으며, 충전돼지 모바일 애플리케이션을 통해 위치를 확인할 수 있다.이마트24는 고객이 쉽게 보조배터리 대여 서비스를 이용할 수 있도록 절차를 간소화했다. 고객이 충전돼지 기기에 있는 QR 코드를 카메라로 스캔하면 별도의 회원 가입 절차 없이 네이버, 구글 등의 아이디로 접속이 가능하며, 신용카드 또는 카카오페이 등으로 간편하게 결제할 수 있다. 결제가 완료되면 충전돼지 슬롯에서 5000mAh 용량의 초고속 충전 보조배터리가 나온다.충전돼지 보조배터리에는 마이크로5핀, 라이트닝8핀(아이폰), C타입(갤럭시) 등 3개의 케이블이 있어 스마트폰을 비롯해 무선이어폰, 태블릿, 전자담배 등 다양한 전자기기의 충전을 동시에 할 수 있다. 최초 30분까지 무료 사용이 가능하며, 30분 이후부터는 1시간당 1000원의 사용료가 부과된다.사용 후 반납 시 충전돼지 기기 슬롯에 보조배터리를 밀어 넣으면 자동으로 결제된다. 최대 이용 시간은 24시간이다.백지호 이마트24 MD담당 상무는 “충전돼지는 스마트폰를 비롯해 각종 전자기기 충전을 위해 보조배터리를 구매하거나 한 공간에 머물 필요 없이 시간을 유연하게 활용할 수 있다는 점에서 고객의 수요가 높을 것으로 예상된다“며 “올 상반기 내 보조배터리 공유 서비스 제공 매장을 전국 1000점으로 확대할 계획”이라고 말했다.박준호기자 junho@etnews.com▶ “2021년, 꼭 알아야할 클라우드 기술과 비즈니스” 21일 방송▶ 네이버 홈에서 [전자신문] 구독하기 [Copyright ⓒ 전자신문 & 전자신문인터넷, 무단전재 및 재배포 금지]"
2021.01.13.,펀드매니저가 뽑은 최고의 애널리스트는 ①,https://n.news.naver.com/mnews/article/050/0000056345?sid=101,"[커버스토리=2020 하반기 베스트 증권사·애널리스트]-펀드매니저가 뽑은 최고의 애널리스트는?-하나금투, 18개 부문 ‘석권’, 메리츠증권 6명 ‘베스트’ 배출…‘생애 첫 1위’ 5명, 2관왕 4명 탄생[한경비즈니스=이명지, 김영은 기자] 2020 하반기 베스트 애널리스트 조사에서는 팀(스몰캡) 1곳과 개인 31명(2관왕 4명)이 타이틀을 차지했다. 총 36개 부문 중 5개 부문에서 샛별이 탄생했다. 김동희(인터넷·소프트웨어)·박형렬(건설·시멘트) 메리츠증권 애널리스트, 김민정(신용 분석) 한화투자증권 애널리스트, 서상영(데일리 시황) 키움증권 애널리스트, 이민재(유틸리티) NH투자증권 애널리스트가 처음 왕좌를 차지했다.하나금융투자 리서치센터는 이번 조사에서 가장 많은 베스트 애널리스트를 배출했다. 총 14명(2관왕 3명)과 코스닥벤처 파트가 타이틀을 거머쥐었다. 36개 부문 중 18개 부문을 석권했다. 이어 메리츠증권 6명, 신한금융투자 3명, KB증권 2명(2관왕 1명), 현대차증권·NH투자증권 각 2명, 키움증권·한화투자증권 각 1명 순이다.◆반도체 - 김경민 하나금융투자반도체 부문 베스트 애널리스트는 김경민 하나금융투자 애널리스트가 차지했다. 김 애널리스트는 반도체 업종 전망에 대해 “메모리 반도체 업종보다 비메모리 반도체 업종이 양호할 것”이라고 말했다. 신종 코로나바이러스 감염증(코로나19)의 발발과 무역 분쟁의 영향으로 유례없는 제조 설비 부족과 제품 가격 인플레이션 전개라는 장밋빛 전망이 나온다. 하지만 원화의 약세 전환과 비트코인 등 위험 자산 가격이 정점에 도달했다는 것은 리스크로 작용할 수 있다. 김 애널리스트가 뽑은 반도체 업종의 최선호주는 대형주 ‘삼성전자’, 중소형주 ‘DB하이텍’이다.◆통신 - 김홍식 하나금융투자김홍식 하나금융투자 애널리스트는 ‘통신’ 부문에서 13회 연속 베스트 애널리스트로 선정됐다. 애널리스트 경력만 22년 차의 ‘베테랑’이다. 김 애널리스트는 선정 비결에 대해 “통신 서비스에 한정하기보다 포괄적으로 5세대 이동통신(5G) 관련 종목을 다룬 것”이라고 말했다. 김 애널리스트가 전망하는 2021년 통신 업종의 주가 전망은 그 어느 때보다 밝다. 5G 가입자 증가로 이동전화 가입자당 평균 수익(ARPU)이 의미 있는 상승세로 전환하기 때문이다. 규제 상황도 그 어느 때보다 양호하며 5G로의 전환이 본격적으로 이뤄질 것으로 전망된다. 김 애널리스트가 꼽는 최선호주는 ‘SK텔레콤’이다.◆네트워크 장비 - 김록호 하나금융투자통신 및 네트워크 장비·단말기 부문의 베스트 애널리스트는 김록호 하나금융투자 애널리스트가 차지했다. 김 애널리스트는 한국뿐만 아니라 글로벌 업체들에 주목했던 것이 베스트 애널리스트 선정에 도움이 됐다고 말했다. 또 업황 회복 구간에서 국내외 업체들의 실적과 부품 수요·공급에 초점을 맞춰 업데이트한 것이 주효했다. 김 애널리스트는 2021년 최선호주로 ‘삼성전기’를 꼽았다. 적층세라믹콘덴서(MLCC) 수요가 2018년 하반기를 넘어서고 있고 가격 상승 없이도 수익성을 향상시킬 수 있기 때문이다. 또 든든한 가전과 함께 전장향 사업부가 흑자 전환하며 중·장기 성장 동력이 건재함을 증명할 ‘LG전자’도 함께 선정했다.◆전기전자/디스플레이 - 김동원 KB증권(2관왕)김동원 KB증권 애널리스트는 전기전자·가전과 디스플레이 부문에서 ‘2관왕’을 차지했다. 2021년 김 애널리스트가 꼽은 최선호주는 전기전자·가전과 디스플레이 모두 ‘삼성전자’다. 애플 아이폰 유기발광다이오드(OLED) 탑재 확대로 플렉서블 OLED 가동률이 큰 폭으로 개선될 것으로 보이기 때문이다. TV 시장에서는 삼성전자 미니 발광다이오드(LED) TV 등의 등장으로 신규 프리미엄 TV의 본격적 경쟁이 예상된다. 삼성전자는 프리미엄 제품이었던 QLED TV를 중저가 라인업까지 확대하는 동시에 미니 LED TV를 하이엔드 제품군으로 추가하며 원가 구조 개선을 통한 가격 경쟁력 확보가 예상된다. ◆인터넷 - 김동희 메리츠증권(최초)인터넷·소프트웨어에서는 김동희 메리츠증권 애널리스트가 처음으로 베스트 애널리스트에 선정됐다. 김 애널리스트는 2021년 인터넷 산업은 ‘온택트’로 진화할 것이라고 예상했다. 비대면을 일컫는 ‘언택트’와 온라인을 통한 외부 연결(On)을 더한 개념이다. 주문과 결제 등 한정적 영역에서 이뤄지던 언택트가 코로나19를 계기로 ‘연결’의 의미를 띤다는 것이다. 최선호주는 ‘카카오’와 ‘엔씨소프트’다. 카카오는 2021년 광고·커머스·모빌리티·페이 등 모든 사업부의 매출이 성장하며 이익이 극대화될 것으로 전망된다. 또 엔씨소프트는 PC와 모바일에서 ‘프로젝트TL’, ‘블레이드앤소울2’, ‘아이온2’ 등 최소 2개 이상의 신작을 출시하게 된다. ◆엔터테인먼트- 이기훈 하나금융투자이기훈 하나금융투자 애널리스트는 엔터테인먼트·레저에서 베스트 애널리스트에 선정됐다. 이 애널리스트는 2021년 엔터테인먼트·레저 분야에서는 코로나19 백신 이후 긍정적인 흐름이 나올 것이라고 전망했다. 특히 가장 큰 변화는 중소형 드라마 제작사에서 나타날 것으로 내다봤다. 코로나19로 글로벌 온라인 동영상 서비스(OTT) 가입자가 폭증하며 콘텐츠 투자 여력이 크게 확장된 상황에서 특히 한국 시장의 가입자가 크게 늘고 있다. 이미 스튜디오드래곤·제이콘텐트리 등 대형 제작사들은 넷플릭스와 장기 공급 계약을 했다. 이에 따라 아직 장기 공급 계약을 하지 않은 중소형사들의 콘텐츠 성장이 기대된다. ◆미디어 - 홍세종 신한금융투자(탈환)경력 8년 차의 홍세종 신한금융투자 애널리스트는 미디어·광고 분야에서 베스트 애널리스트를 탈환했다. 홍 애널리스트는 올해 상반기 신종 코로나바이러스 감염증(코로나19)으로 인한 광고비용 감소가 있었던 제일기획·이노션과 같은 광고 대행사, TV 광고 매출 감소를 경험한 SBS·CJ ENM 등 방송사들의 이익이 증가할 것이라고 예상했다. 콘텐츠는 플랫폼 경쟁 심화에 따른 수혜가 지속될 것으로 보인다. 홍 애널리스트는 “기존 오리지널 드라마 수주의 가속화는 물론 중국의 문이 열릴 경우 급격한 이익 증가도 가능하다”고 말했다. 최선호주는 ‘SBS’, ‘스튜디오드래곤’, ‘인크로스’를 꼽았다.◆유통/소비재 - 박종대 하나금융투자(2관왕)박종대 하나금융투자 애널리스트는 유통과 생활소비재·교육 부문에서 ‘2관왕’에 올랐다. 유통 부문을 16회 연속 석권했고 생활소비재·교육 부문에서는 12회 연속 1위다. 박 애널리스트는 “백신 접종을 시작으로 내수 회복은 빠르게 이어질 것으로 보이지만 해외여행이 재개되는 것은 2022년은 돼야 한다”고 말했다. 이에 따라 면세점이나 화장품 업체들의 실적 개선 폭은 제한적일 수밖에 없다. 또 유통가에서는 백화점과 편의점 업체들의 실적 회복세가 클 것이라고 전망했다. 이에 따라 식품 온라인 시장의 확대로 최선호주는 ‘이마트’, 차선호주는 ‘현대백화점’이다. 화장품 업종에서는 대중국 브랜드 인지도가 확대되는 ‘LG생활건강’을 기대해 볼 수 있다. mjlee@hankyung.com, kye0218@hankyung.com[2020 하반기 베스트 증권사·애널리스트 커버스토리 기사 인덱스]-하나금융투자, ‘베스트 증권사’ 1위…3회 연속 베스트 리서치·법인영업 동시 석권-황승택 하나금융투자 리서치센터장 “2021년 코스피 3200 이상 오른다”-40대 센터장·유튜브 구독자 10만…‘코스피 3000 시대’ 달라진 리서치센터-펀드매니저가 뽑은 최고의 애널리스트는?-2020 하반기 베스트 애널리스트 부문별 순위표[본 기사는 한경비즈니스 제 1311호(2021.01.04 ~ 2021.01.10) 기사입니다.]▶ 한경비즈니스 네이버 뉴스에서 [구독 클릭]▶ 요즘 핫한 유튜버&기업 다 있다! 뉴니콘 유튜브 확인▶ 잡지 정기구독 신청 ⓒ 한경비즈니스, 무단전재 및 재배포 금지"
2021.01.13.,토스·SK플래닛 등 7개사 마이데이터 예비허가,url없음,<네이버 기사 없음>
