기사날짜,기사제목,네이버 뉴스 url,기사내용
2021.01.20.,"은행권 수장, 줄줄이 임기 만료… 변화보단 안정에 ‘무게’",https://n.news.naver.com/mnews/article/366/0000655958?sid=101,"은행권 최고경영자(CEO)들이 대거 임기 만료를 맞이하면서 향후 거취에 관심이 쏠리고 있다. 신종 코로나 바이러스 감염증(코로나19) 사태 장기화와 빅테크(대형 기술 기업) 위협 등으로 인해 ‘안정’이 주요 키워드로 떠오르면서 대체로 연임에 무게가 쏠리는 분위기지만, ‘변화와 쇄신’을 위해 연임을 포기하는 사례도 나왔다. 20일 금융권에 따르면 김정태(69) 하나금융지주(086790)회장의 임기가 오는 3월 만료된다. 김 회장은 지난 2012년 하나금융 회장에 오른 뒤 현재까지 3연임에 성공한 금융권 대표 장수 CEO다. 1981년 서울은행 입행 이후 1992년 하나은행으로 옮겨 현재까지 하나금융 부사장, 하나대투증권 사장, 하나은행장 등을 역임했다. 3연임 성공 이후 김 회장은 ‘더이상 연임에 연연하지 않겠다’는 의사를 직간접적으로 내비쳐왔지만, 최근 급변하는 금융환경 등을 고려하면 김 회장의 역할이 아직 남아있다는 의견이 이사진에서 나오고 있는 것으로 전해졌다. 시중은행 중에선 지성규 하나은행장과 권광석 우리은행장이 오는 3월 임기가 만료된다. 각각 2019년 3월, 지난해 3월 취임한 이들 행장은 모두 연임이 유력하다. 첫 임기 이후 특별한 사유가 없으면 한 차례 더 신임하는 것이 은행업계 관행이다. 은행권 관계자는 ""각종 사모펀드 사태를 겪은 이후 이들 행장이 추진한 혁신 작업이 현재진행형인 만큼, 효과 극대화를 위해선 리더십의 연속성이 필요할 것""이라고 내다봤다. 인터넷전문은행 중에선 케이뱅크 수장이 바뀐다. 이문환 전 케이뱅크 행장이 최근 돌연 사임하면서 서호성 한국타이어앤테크놀로지 부사장이 3대 행장에 내정됐다. 지난 2019년 한 차례 연임한 윤호영 카카오뱅크 대표는 지난 2일 이미 임기가 만료됐지만, 3월 주주총회까지 임기가 연장된 상태다. 윤 대표 역시 재연임에 성공할 가능성이 높다. 실적 등이 양호한데다 상반기 기업공개(IPO)를 앞두고 있는 상황에서 수장을 바꾸긴 어렵다는 관측이 지배적이다.지방은행 중에선 대구은행을 제외하고 빈대인 부산은행장, 황윤철 경남은행장, 임용택 전북은행장, 송종욱 광주은행장, 서현주 제주은행장 모두 3월 말에 임기가 만료된다. 이중 송 행장은 최근 차기 행장으로 단독 추천돼 연임이 결정됐다. 빈 행장과 황 행장 역시 연임에 무게가 쏠리고 있다. 다만 4연임 고지를 앞두고 있던 임 행장은 최근 ""지금 우리에게 가장 필요한 것은 변화""라며 차기 행장 후보에서 사퇴했다. 현재 전북은행 내 임원급이 행장 후보로 선정된 것으로 알려졌다. [이윤정 기자 fact@chosunbiz.com] ▶네이버에서 '명품 경제뉴스' 조선비즈를 구독하세요▶사재기까지 등장한 종이박스… 인쇄업체는 비대면에 울상▶탈유황장치 장착률 1위 HMM, 저·고유황유 가격에 경쟁력 ↑ 	저작권자 ⓒ 조선비즈, 무단 전재 및 재배포 금지"
2021.01.20.,"박지윤, 직접 전한 출산 소식 ""예쁜 딸아이, 하루하루 기쁨으로""",url없음,<네이버 기사 없음>
2021.01.20.,"'무증상 해외입국자 전용숙소' 마련 고양시 ""지역사회 전파 차단""",url없음,<네이버 기사 없음>
2021.01.20.,"은행권 수장, 줄줄이 임기 만료… 변화보단 안정에 ‘무게’",https://n.news.naver.com/mnews/article/366/0000655958?sid=101,"은행권 최고경영자(CEO)들이 대거 임기 만료를 맞이하면서 향후 거취에 관심이 쏠리고 있다. 신종 코로나 바이러스 감염증(코로나19) 사태 장기화와 빅테크(대형 기술 기업) 위협 등으로 인해 ‘안정’이 주요 키워드로 떠오르면서 대체로 연임에 무게가 쏠리는 분위기지만, ‘변화와 쇄신’을 위해 연임을 포기하는 사례도 나왔다. 20일 금융권에 따르면 김정태(69) 하나금융지주(086790)회장의 임기가 오는 3월 만료된다. 김 회장은 지난 2012년 하나금융 회장에 오른 뒤 현재까지 3연임에 성공한 금융권 대표 장수 CEO다. 1981년 서울은행 입행 이후 1992년 하나은행으로 옮겨 현재까지 하나금융 부사장, 하나대투증권 사장, 하나은행장 등을 역임했다. 3연임 성공 이후 김 회장은 ‘더이상 연임에 연연하지 않겠다’는 의사를 직간접적으로 내비쳐왔지만, 최근 급변하는 금융환경 등을 고려하면 김 회장의 역할이 아직 남아있다는 의견이 이사진에서 나오고 있는 것으로 전해졌다. 시중은행 중에선 지성규 하나은행장과 권광석 우리은행장이 오는 3월 임기가 만료된다. 각각 2019년 3월, 지난해 3월 취임한 이들 행장은 모두 연임이 유력하다. 첫 임기 이후 특별한 사유가 없으면 한 차례 더 신임하는 것이 은행업계 관행이다. 은행권 관계자는 ""각종 사모펀드 사태를 겪은 이후 이들 행장이 추진한 혁신 작업이 현재진행형인 만큼, 효과 극대화를 위해선 리더십의 연속성이 필요할 것""이라고 내다봤다. 인터넷전문은행 중에선 케이뱅크 수장이 바뀐다. 이문환 전 케이뱅크 행장이 최근 돌연 사임하면서 서호성 한국타이어앤테크놀로지 부사장이 3대 행장에 내정됐다. 지난 2019년 한 차례 연임한 윤호영 카카오뱅크 대표는 지난 2일 이미 임기가 만료됐지만, 3월 주주총회까지 임기가 연장된 상태다. 윤 대표 역시 재연임에 성공할 가능성이 높다. 실적 등이 양호한데다 상반기 기업공개(IPO)를 앞두고 있는 상황에서 수장을 바꾸긴 어렵다는 관측이 지배적이다.지방은행 중에선 대구은행을 제외하고 빈대인 부산은행장, 황윤철 경남은행장, 임용택 전북은행장, 송종욱 광주은행장, 서현주 제주은행장 모두 3월 말에 임기가 만료된다. 이중 송 행장은 최근 차기 행장으로 단독 추천돼 연임이 결정됐다. 빈 행장과 황 행장 역시 연임에 무게가 쏠리고 있다. 다만 4연임 고지를 앞두고 있던 임 행장은 최근 ""지금 우리에게 가장 필요한 것은 변화""라며 차기 행장 후보에서 사퇴했다. 현재 전북은행 내 임원급이 행장 후보로 선정된 것으로 알려졌다. [이윤정 기자 fact@chosunbiz.com] ▶네이버에서 '명품 경제뉴스' 조선비즈를 구독하세요▶사재기까지 등장한 종이박스… 인쇄업체는 비대면에 울상▶탈유황장치 장착률 1위 HMM, 저·고유황유 가격에 경쟁력 ↑ 	저작권자 ⓒ 조선비즈, 무단 전재 및 재배포 금지"
2021.01.20.,"현대홈쇼핑, 현대H몰서 설 선물세트 판매",url없음,<네이버 기사 없음>
2021.01.20.,"온통대전으로 설맞이 준비, 다양한 혜택",url없음,<네이버 기사 없음>
2021.01.20.,CJ올리브영 기프트카드 누적 판매액 700억원 돌파,url없음,<네이버 기사 없음>
2021.01.20.,'IPO 흥행' 올해도?… 첫 주자는 '캐시슬라이드' 엔비티,https://n.news.naver.com/mnews/article/417/0000646975?sid=101,"지난해 10월 진행된 빅히트의 일반공모청약 모습./사진=뉴스1지난해 '공모주 열풍'이 불며 올해 IPO(기업공개)시장에 대한 기대감이 커지는 가운데 역대 코스닥 공모 청약 1위를 자치한 엔비티(NBT)가 21일 상장한다. 엔비티는 지난 12~13일 공모 주식의 20%인 16만6400주에 대한 일반 공모 청약을 실시한 결과, 7억3177만3470주가 접수돼 4397.68대 1의 경쟁률을 기록했다고 밝혔다. 이에 따라 모인 청약 증거금은 6조9518억원에 이르렀다.엔비티가 기록한 청약 경쟁률은 코스닥 공모 청약 역대 1위다. 기존 역대 1위는 지난해 8월 상장한 이루다의 3039.56대 1이었다. 앞서 엔비티는 수요예측을 통해 공모가를 희망 범위(1만3200∼1만7600원)의 상단을 웃도는 1만9000원으로 결정한 바 있다.지난해 IPO시장은 카카오게임, 빅히트엔터테인먼트 등이 엄청난 청약경쟁률을 선보이며 뜨겁게 달아올랐다. 금융투자업계에 따르면 지난해 신규 상장한 기업은 총 76곳으로 공모금액 5조7000억원에 청약 증거금은 총 295조5000억원이 몰렸다.이는 100조원이 되지 않던 지난해와 비교해 3배가 넘는 수준이다. 증거금에 대한 공식 통계는 없지만 역대 가장 많은 규모라는 평가가 나온다. 이런 상황에서 올해 IPO 첫주자인 엔비티가 지난해부터 이어진 공모주 흥행 열풍을 이어갈 수 있을 지 관심이 쏠린다.박수근 엔비티 대표는 “투자자들께서 보여주신 관심과 성원에 감사드린다”며 “코스닥 상장을 기반으로 지속적인 성장을 통해 국내를 넘어 글로벌 모바일 포인트 플랫폼 시장을 선도하는 기업으로 도약하겠다”고 말했다.2012년 설립된 엔비티는 ‘캐시슬라이드’, ‘캐시피드’, ‘노랑브라우저’ 등 B2C(기업과 소비자 간 거래) 모바일 포인트 앱과 ‘애디슨 오퍼월’ 등 B2B(기업 간 거래) 모바일 포인트 네트워크를 운영하는 기업이다. 김정훈 기자 kjhnpce1@mt.co.kr▶뜨거운 증시, 오늘의 특징주는?  ▶거품 뺀 솔직 시승기▶머니S, 네이버 메인에서 보세요 <저작권자 ⓒ '성공을 꿈꾸는 사람들의 경제 뉴스' 머니S, 무단전재 및 재배포 금지>"
2021.01.20.,전주시 “지방세 모바일로 받고 간편 납부하세요”,https://n.news.naver.com/mnews/article/421/0005119147?sid=102,"전주시청 전경 /뉴스1 DB(전북=뉴스1) 임충식 기자 = 전북 전주시가 모바일 전자고지 제도의 적극적인 이용을 당부하고 나섰다.20일 전주시에 따르면 모바일 전자고지 제도는 등록면허세와 자동차세, 재산세 등 지방세 고지서를 알림톡 등 스마트폰을 통해 받아 모바일로 간편하게 납부까지 할 수 있는 제도다.기존 종이 고지서의 분실 및 배달사고에 따른 개인정보 유출 위험을 줄일 수 있고 고지서 1장 당 150원, 자동이체 신청 시에는 300원까지 세액공제 혜택도 제공된다.여기에 연간 130만 건, 7억원에 달하는 고지서 우편발송 예산과 발송에 드는 노동력도 줄일 수 있으며, 환경보호 측면에서도 도움을 준다.  모바일 전자고지를 신청하면 신청 다음 달부터 송달이 가능하고, 고지서가 앱에 저장(도달)된 때 송달효력이 발생한다. 신청 가능한 모바일 앱으로는 간편결제 앱(카카오페이, 네이버, 페이코 앱)과 금융 앱(광주, 경남, 국민, 금융결제원, 기업, 농협, 대구, 부산, 새마을금고, 신한, 전북, 케이뱅크, 하나, 삼성카드, 신한카드) 등 총 18종이다. 조현숙 전주시 세정과장은 “모바일 전자고지 제도는 납세자에게 편리한 제도일 뿐만 아니라 인력과 예산도 절감할 수 있는 획기적인 효과가 있다”면서 “종이고지서 절감을 통해 환경까지 보호할 수 있는 이 제도에 시민 여러분들의 많은 참여를 바란다”고 당부했다.시는 모바일 전자고지 신청률을 끌어올리기 위해 홍보 전단지를 배포하고 공공기관과 유관기관, 자생단체 등에도 신청을 독려할 방침이다.94chung@news1.kr▶ 네이버 메인에서 [뉴스1] 구독하기!▶  뉴스1&BBC 한글 뉴스 ▶  터닝포인트 2021 © 뉴스1코리아(news1.kr), 무단 전재 및 재배포 금지"
2021.01.20.,"제주항공, 초특가 항공권 '찜 이벤트' 2월 3일부터 실시",url없음,<네이버 기사 없음>
2021.01.20.,전북은행 “플러스영 체크카드로 넷플릭스 자동이체 시 커피 쿠폰”,https://n.news.naver.com/mnews/article/417/0000647045?sid=101,"JB금융그룹 전북은행은 20~30대 고객을 위한 플러스영(Plus Young) 체크카드 출시를 기념해 ‘인싸 이벤트’를 오는 2월28일까지 시행한다./사진=전북은행JB금융그룹 전북은행은 20~30대 고객을 위한 플러스영(Plus Young) 체크카드 출시를 기념해 ‘인싸 이벤트’를 오는 2월28일까지 시행한다고 20일 밝혔다. 플러스 영 체크카드로 넷플릭스, 유튜브 프리미엄 서비스 카드 자동이체 신청 고객 중 100명을 추첨해 투썸플레이스 모바일 커피쿠폰 5000원을 제공한다.전북은행이 출시한 플러스영 체크카드는 넷플릭스·유튜브 프리미엄 서비스에서 건당 5000원 이상, 편의점에서 건당 1만원 이상, 카페(스타벅스, 할리스, 탐앤탐스, 투썸플레이스, 엔젤리너스, 카페베네)에서 건당 1만원 이상, 독서실·스터디카페 건당 5000원 이상, 렌터카·철도·고속버스·후불교통, 간편결제(카카오페이·네이버페이) 건당 1만원 이상 결제시 5% 캐시백을 지급한다.전북은행 JB카드 관계자는 “실용적인 소비를 중시하는 젊은 고객들의 소비 패턴을 반영한 카드 출시로 젊은 고객들과의 소비적 상생을 바란다”고 말했다.박슬기 기자 seul6@mt.co.kr▶뜨거운 증시, 오늘의 특징주는?  ▶거품 뺀 솔직 시승기▶머니S, 네이버 메인에서 보세요 <저작권자 ⓒ '성공을 꿈꾸는 사람들의 경제 뉴스' 머니S, 무단전재 및 재배포 금지>"
2021.01.20.,대전지역화폐 온통대전 설맞이 이벤트,url없음,<네이버 기사 없음>
2021.01.20.,전주시 “지방세 모바일로 받고 간편 납부하세요”,https://n.news.naver.com/mnews/article/421/0005119147?sid=102,"전주시청 전경 /뉴스1 DB(전북=뉴스1) 임충식 기자 = 전북 전주시가 모바일 전자고지 제도의 적극적인 이용을 당부하고 나섰다.20일 전주시에 따르면 모바일 전자고지 제도는 등록면허세와 자동차세, 재산세 등 지방세 고지서를 알림톡 등 스마트폰을 통해 받아 모바일로 간편하게 납부까지 할 수 있는 제도다.기존 종이 고지서의 분실 및 배달사고에 따른 개인정보 유출 위험을 줄일 수 있고 고지서 1장 당 150원, 자동이체 신청 시에는 300원까지 세액공제 혜택도 제공된다.여기에 연간 130만 건, 7억원에 달하는 고지서 우편발송 예산과 발송에 드는 노동력도 줄일 수 있으며, 환경보호 측면에서도 도움을 준다.  모바일 전자고지를 신청하면 신청 다음 달부터 송달이 가능하고, 고지서가 앱에 저장(도달)된 때 송달효력이 발생한다. 신청 가능한 모바일 앱으로는 간편결제 앱(카카오페이, 네이버, 페이코 앱)과 금융 앱(광주, 경남, 국민, 금융결제원, 기업, 농협, 대구, 부산, 새마을금고, 신한, 전북, 케이뱅크, 하나, 삼성카드, 신한카드) 등 총 18종이다. 조현숙 전주시 세정과장은 “모바일 전자고지 제도는 납세자에게 편리한 제도일 뿐만 아니라 인력과 예산도 절감할 수 있는 획기적인 효과가 있다”면서 “종이고지서 절감을 통해 환경까지 보호할 수 있는 이 제도에 시민 여러분들의 많은 참여를 바란다”고 당부했다.시는 모바일 전자고지 신청률을 끌어올리기 위해 홍보 전단지를 배포하고 공공기관과 유관기관, 자생단체 등에도 신청을 독려할 방침이다.94chung@news1.kr▶ 네이버 메인에서 [뉴스1] 구독하기!▶  뉴스1&BBC 한글 뉴스 ▶  터닝포인트 2021 © 뉴스1코리아(news1.kr), 무단 전재 및 재배포 금지"
2021.01.20.,"제주항공, 초특가 항공권 '찜 이벤트' 2월 3일부터 실시",url없음,<네이버 기사 없음>
2021.01.20.,전북은행 “플러스영 체크카드로 넷플릭스 자동이체 시 커피 쿠폰”,https://n.news.naver.com/mnews/article/417/0000647045?sid=101,"JB금융그룹 전북은행은 20~30대 고객을 위한 플러스영(Plus Young) 체크카드 출시를 기념해 ‘인싸 이벤트’를 오는 2월28일까지 시행한다./사진=전북은행JB금융그룹 전북은행은 20~30대 고객을 위한 플러스영(Plus Young) 체크카드 출시를 기념해 ‘인싸 이벤트’를 오는 2월28일까지 시행한다고 20일 밝혔다. 플러스 영 체크카드로 넷플릭스, 유튜브 프리미엄 서비스 카드 자동이체 신청 고객 중 100명을 추첨해 투썸플레이스 모바일 커피쿠폰 5000원을 제공한다.전북은행이 출시한 플러스영 체크카드는 넷플릭스·유튜브 프리미엄 서비스에서 건당 5000원 이상, 편의점에서 건당 1만원 이상, 카페(스타벅스, 할리스, 탐앤탐스, 투썸플레이스, 엔젤리너스, 카페베네)에서 건당 1만원 이상, 독서실·스터디카페 건당 5000원 이상, 렌터카·철도·고속버스·후불교통, 간편결제(카카오페이·네이버페이) 건당 1만원 이상 결제시 5% 캐시백을 지급한다.전북은행 JB카드 관계자는 “실용적인 소비를 중시하는 젊은 고객들의 소비 패턴을 반영한 카드 출시로 젊은 고객들과의 소비적 상생을 바란다”고 말했다.박슬기 기자 seul6@mt.co.kr▶뜨거운 증시, 오늘의 특징주는?  ▶거품 뺀 솔직 시승기▶머니S, 네이버 메인에서 보세요 <저작권자 ⓒ '성공을 꿈꾸는 사람들의 경제 뉴스' 머니S, 무단전재 및 재배포 금지>"
2021.01.20.,"김요한, 모찌피부+맑은 눈망울…만찢남의 표본",https://n.news.naver.com/mnews/article/112/0003390937?sid=106,<구조 다름>
2021.01.20.,"[프리뷰] 귀여운 쿠키들의 왕국 건설, 쿠키런: 킹덤",https://sports.news.naver.com/news.nhn?oid=442&aid=0000128694,<구조 다름>
2021.01.20.,"[코로나19]고양시, '해외입국자 전용 안심숙소' 21일부터 운영",url없음,<네이버 기사 없음>
2021.01.20.,"대성에너지, 도시가스 전자청구서 신청자 경품 추첨",url없음,<네이버 기사 없음>
