기사날짜,기사제목,네이버 뉴스 url,기사내용
2021.01.05.,"[DD퇴근길] 갤S21울트라 S펜, 갤노트 S펜하고는 딴판이네",https://n.news.naver.com/mnews/article/138/0002097073?sid=105,"디지털데일리가 퇴근 즈음해서 읽을 수 있는 [DD퇴근길] 코너를 마련했습니다. 혹시 오늘 디지털데일리 기사를 놓치지는 않으셨나요? 퇴근 앞두고 저희가 요약 정리한 주요 기사를 가벼운 마음으로 읽어주시기 바랍니다. 전체 기사는 ‘디지털데일리 관련뉴스(아웃링크)’에서 확인할 수 있습니다.   다음주 갤럭시S21가 정식 공개될 예정인 가운데 이번에는 갤럭시S21울트라에 사용될 스타일러스펜(S펜)과 전용 케이스 이미지가 등장했습니다. 독일 정보기술 전문매체인 윈퓨처는 갤럭시S21울트라 모델에 쓰일 S펜과 펜 수납이 가능한 스마트폰 케이스 이미지를 공개했는데요. 이미지를 보면 울트라용 S펜 디자인은 기존 갤럭시노트에서 쓰이던 펜 모습과는 사뭇 다른 모습입니다. 오히려 태블릿 ‘갤럭시탭’ 전용 S펜과 유사한 디자인이네요. 갤럭시노트용 S펜은 기기 슬롯에 넣어 보관해야했기 때문에 얇고 작았지만 태블릿용 S펜은 기기에 부착하는 형식이어서 두께가 두꺼운 것 같습니다.    기기에 직접 탑재되지 않는 만큼 펜 상단에 수납을 위한 노크식 버튼은 생략됐습니다. 앞쪽엔 슬라이드 자료를 넘기기나 촬영 등 다양한 작업을 위한 측면 버튼이 들어갔습니다. 필기감은 노트 펜보다 좋을 것으로 예상됩니다. 삼성전자가 출시할 공식 갤럭시S21용 커버 케이스를 살펴보면 내부 중앙에 펜을 수납할 수 있도록 공간이 움푹 파여있습니다. 커버를 열면 스마트폰 왼쪽에 위치하게 됩니다. 아무래도 내부 탑재가 아니다보니 휴대성은 다소 떨어질 수 밖에 없을 전망입니다.      LGU+, 중저가 5G 요금제 출시…혜택늘린 5만원대-애매한 4만원대   5G 요금경쟁이 본격화되나요. LG유프러스가 4~5만원대 5G 요금제를 선보였습니다. 4만87000원인 ‘5G 슬림+’과 5만5000원인 ‘5G 라이트+’가 주인공입니다. ‘5G 라이트+’는 기존의 ‘5G 라이트’ 요금제에서 기본 제공 데이터를 33% 늘렸습니다. 12GB를 사용할 수 있고 다 쓰면 1Mbps의 속도로 계속 데이터를 이용할 수 있습니다. 비슷한 수준의 LTE 요금제와 비교해도 혜택이 더 많습니다. 나름 경쟁력을 갖춘 것으로 평가할 수 있겠습니다.    다만, ‘5G 슬림+’ 요금제는 다소 애매한 포지션이어서 아쉬움이 남습니다. 데이터 6GB를 다 쓰면 400kbps로 속도가 제한됩니다. 영상이나 게임을 하기에는 어려운 수준이네요. LTE 대비 비슷한 가격대 요금제와 비교해도 딱히 경쟁력 있다고 보기는 어렵습니다. 아무래도 4만원대는 아직 본격적인 경쟁을 기대하기는 어려워 보입니다.    카카오TV, 콘텐츠 유료화 수순?   카카오TV가 일부 콘텐츠 유료화에 나섰습니다. 콘텐츠 첫 공개 이후 일주일은 무료로, 이후에는 회차당 500원을 결제하고 일주일간 광고 없이 시청할 수 있는 방식인데요. 추후 유료화 대상을 확대할지 확정된 바는 없지만, 앞으로 카카오TV가 어떤 과금모델을 꾀할지 관심이 높습니다.   당초 카카오TV는 월정액을 내고 보는 SVOD 형태의 넷플릭스나 웨이브와 달리, 콘텐츠에 5초 분량의 광고를 포함시켜 무료로 제공하는 AVOD 서비스를 해왔습니다. 이번에는 일부 콘텐츠에 한해 무료 선공개 후 유료로 전환하는 방식인데, 카카오페이지와 같이 일정 시간이 지나 유료 콘텐츠를 무료화하는 것과는 또 반대 양상입니다.   표면적으로는 건당결제(TVOD)를 도입한 것이지만, 사실은 AVOD 기반 광고 수익을 강화하는 것으로 보여집니다. 초반에만 무료로 하면 선공개 콘텐츠에 조회수를 더 집중시킬 수 있고, 자연히 그에 따른 광고 수익도 커지니까요. 유튜브 프리미엄과 같이 별도의 구독형 서비스를 출시하는 방안도 가능성이 있습니다.     “갤럭시 살 사람 모여라”…’갤럭시 캠퍼스 스토어‘ 개설   삼성전자가 대학생과 대학원생 전용 온라인 쇼핑몰을 운영한다고 합니다. 갤럭시 캠퍼스 스토어를 개설했는데요. 만 18세에서 29세까지 대학생이나 대학원생이면 이용할 수 있습니다. 스마트폰이나 노트북, 태블릿, 웨어러블 기기 등을 판매하는데 삼성전자 홈페이지보다 10~20% 할인된 가격에 판매한다고 합니다.    학생 등 특정 타깃을 공략하는 마케팅은 장기적인 포석입니다. 어렸을때 이용자 경험을 쌓게 하면 나이들어서도 해당 브랜드를 이용할 확률이 높기 때문이죠. 다만 각 품목별 구매 횟수는 연 1회라고 합니다. 주변 대학생 형, 동생에게 구매 대행을 시키기는 쉽지 않겠네요.      CJ ENM과 만난 엔씨소프트   엔씨소프트가 CJ ENM과 연내 합작법인을 설립합니다. 콘텐츠·디지털 플랫폼 분야 사업 협력을 위한 양해각서(MOU)를 체결했는데요. 합작법인에서는 엔씨의 IT 기술력과 CJ ENM의 엔터테인먼트 비즈니스 노하우를 접목해 다양한 콘텐츠 사업을 전개할 예정입니다. 구체적인 사업 내용이 밝혀지진 않았지만, CJ ENM이 보유한 글로벌 산업 경험과 역량을 '유니버스'에 적용시킬 것으로 예상됩니다.   유니버스는 엔씨가 지난해 11월 발표한 K-POP 엔터테인먼트 플랫폼인데요. 자회사 클렙을 통해 올해 초 출시 예정으로, 모바일에서 다양한 온·오프라인 팬덤 활동을 즐길 수 있는 것이 특징입니다. 현재 출시 전 공개된 참여 아티스트는 강다니엘, 아이즈원 등입니다. 엔터테인먼트 사업에 공을 들이고 있는 엔씨의 향후 사업 윤곽에 관심이 모아지고 있습니다.▶ 네이버에서 디지털데일리 채널 구독하기▶ IT정보의 즐거운 업그레이드 [딜라이트닷넷]<저작권자 © 디지털데일리 무단전재-재배포금지>"
2021.01.05.,"오리온 '마켓오 네이처', 간편대용식 인기에 2020년 34% 성장",url없음,<네이버 기사 없음>
2021.01.05.,"박하선, '하이킥' 인연 이적과 재회 ""오랜만에 즐거운 수다""",https://n.news.naver.com/mnews/article/241/0003082969?sid=106,<구조 다름>
2021.01.05.,"[DD퇴근길] 갤S21울트라 S펜, 갤노트 S펜하고는 딴판이네",https://n.news.naver.com/mnews/article/138/0002097073?sid=105,"디지털데일리가 퇴근 즈음해서 읽을 수 있는 [DD퇴근길] 코너를 마련했습니다. 혹시 오늘 디지털데일리 기사를 놓치지는 않으셨나요? 퇴근 앞두고 저희가 요약 정리한 주요 기사를 가벼운 마음으로 읽어주시기 바랍니다. 전체 기사는 ‘디지털데일리 관련뉴스(아웃링크)’에서 확인할 수 있습니다.   다음주 갤럭시S21가 정식 공개될 예정인 가운데 이번에는 갤럭시S21울트라에 사용될 스타일러스펜(S펜)과 전용 케이스 이미지가 등장했습니다. 독일 정보기술 전문매체인 윈퓨처는 갤럭시S21울트라 모델에 쓰일 S펜과 펜 수납이 가능한 스마트폰 케이스 이미지를 공개했는데요. 이미지를 보면 울트라용 S펜 디자인은 기존 갤럭시노트에서 쓰이던 펜 모습과는 사뭇 다른 모습입니다. 오히려 태블릿 ‘갤럭시탭’ 전용 S펜과 유사한 디자인이네요. 갤럭시노트용 S펜은 기기 슬롯에 넣어 보관해야했기 때문에 얇고 작았지만 태블릿용 S펜은 기기에 부착하는 형식이어서 두께가 두꺼운 것 같습니다.    기기에 직접 탑재되지 않는 만큼 펜 상단에 수납을 위한 노크식 버튼은 생략됐습니다. 앞쪽엔 슬라이드 자료를 넘기기나 촬영 등 다양한 작업을 위한 측면 버튼이 들어갔습니다. 필기감은 노트 펜보다 좋을 것으로 예상됩니다. 삼성전자가 출시할 공식 갤럭시S21용 커버 케이스를 살펴보면 내부 중앙에 펜을 수납할 수 있도록 공간이 움푹 파여있습니다. 커버를 열면 스마트폰 왼쪽에 위치하게 됩니다. 아무래도 내부 탑재가 아니다보니 휴대성은 다소 떨어질 수 밖에 없을 전망입니다.      LGU+, 중저가 5G 요금제 출시…혜택늘린 5만원대-애매한 4만원대   5G 요금경쟁이 본격화되나요. LG유프러스가 4~5만원대 5G 요금제를 선보였습니다. 4만87000원인 ‘5G 슬림+’과 5만5000원인 ‘5G 라이트+’가 주인공입니다. ‘5G 라이트+’는 기존의 ‘5G 라이트’ 요금제에서 기본 제공 데이터를 33% 늘렸습니다. 12GB를 사용할 수 있고 다 쓰면 1Mbps의 속도로 계속 데이터를 이용할 수 있습니다. 비슷한 수준의 LTE 요금제와 비교해도 혜택이 더 많습니다. 나름 경쟁력을 갖춘 것으로 평가할 수 있겠습니다.    다만, ‘5G 슬림+’ 요금제는 다소 애매한 포지션이어서 아쉬움이 남습니다. 데이터 6GB를 다 쓰면 400kbps로 속도가 제한됩니다. 영상이나 게임을 하기에는 어려운 수준이네요. LTE 대비 비슷한 가격대 요금제와 비교해도 딱히 경쟁력 있다고 보기는 어렵습니다. 아무래도 4만원대는 아직 본격적인 경쟁을 기대하기는 어려워 보입니다.    카카오TV, 콘텐츠 유료화 수순?   카카오TV가 일부 콘텐츠 유료화에 나섰습니다. 콘텐츠 첫 공개 이후 일주일은 무료로, 이후에는 회차당 500원을 결제하고 일주일간 광고 없이 시청할 수 있는 방식인데요. 추후 유료화 대상을 확대할지 확정된 바는 없지만, 앞으로 카카오TV가 어떤 과금모델을 꾀할지 관심이 높습니다.   당초 카카오TV는 월정액을 내고 보는 SVOD 형태의 넷플릭스나 웨이브와 달리, 콘텐츠에 5초 분량의 광고를 포함시켜 무료로 제공하는 AVOD 서비스를 해왔습니다. 이번에는 일부 콘텐츠에 한해 무료 선공개 후 유료로 전환하는 방식인데, 카카오페이지와 같이 일정 시간이 지나 유료 콘텐츠를 무료화하는 것과는 또 반대 양상입니다.   표면적으로는 건당결제(TVOD)를 도입한 것이지만, 사실은 AVOD 기반 광고 수익을 강화하는 것으로 보여집니다. 초반에만 무료로 하면 선공개 콘텐츠에 조회수를 더 집중시킬 수 있고, 자연히 그에 따른 광고 수익도 커지니까요. 유튜브 프리미엄과 같이 별도의 구독형 서비스를 출시하는 방안도 가능성이 있습니다.     “갤럭시 살 사람 모여라”…’갤럭시 캠퍼스 스토어‘ 개설   삼성전자가 대학생과 대학원생 전용 온라인 쇼핑몰을 운영한다고 합니다. 갤럭시 캠퍼스 스토어를 개설했는데요. 만 18세에서 29세까지 대학생이나 대학원생이면 이용할 수 있습니다. 스마트폰이나 노트북, 태블릿, 웨어러블 기기 등을 판매하는데 삼성전자 홈페이지보다 10~20% 할인된 가격에 판매한다고 합니다.    학생 등 특정 타깃을 공략하는 마케팅은 장기적인 포석입니다. 어렸을때 이용자 경험을 쌓게 하면 나이들어서도 해당 브랜드를 이용할 확률이 높기 때문이죠. 다만 각 품목별 구매 횟수는 연 1회라고 합니다. 주변 대학생 형, 동생에게 구매 대행을 시키기는 쉽지 않겠네요.      CJ ENM과 만난 엔씨소프트   엔씨소프트가 CJ ENM과 연내 합작법인을 설립합니다. 콘텐츠·디지털 플랫폼 분야 사업 협력을 위한 양해각서(MOU)를 체결했는데요. 합작법인에서는 엔씨의 IT 기술력과 CJ ENM의 엔터테인먼트 비즈니스 노하우를 접목해 다양한 콘텐츠 사업을 전개할 예정입니다. 구체적인 사업 내용이 밝혀지진 않았지만, CJ ENM이 보유한 글로벌 산업 경험과 역량을 '유니버스'에 적용시킬 것으로 예상됩니다.   유니버스는 엔씨가 지난해 11월 발표한 K-POP 엔터테인먼트 플랫폼인데요. 자회사 클렙을 통해 올해 초 출시 예정으로, 모바일에서 다양한 온·오프라인 팬덤 활동을 즐길 수 있는 것이 특징입니다. 현재 출시 전 공개된 참여 아티스트는 강다니엘, 아이즈원 등입니다. 엔터테인먼트 사업에 공을 들이고 있는 엔씨의 향후 사업 윤곽에 관심이 모아지고 있습니다.▶ 네이버에서 디지털데일리 채널 구독하기▶ IT정보의 즐거운 업그레이드 [딜라이트닷넷]<저작권자 © 디지털데일리 무단전재-재배포금지>"
2021.01.05.,"스포츠토토코리아, 2020년 하반기 온라인 도박중독 예방 캠페인 성료",https://sports.news.naver.com/news.nhn?oid=629&aid=0000061139,<구조 다름>
2021.01.05.,"지프, 오너 대상 커뮤니티 '지프 웨이브'로 유대감 강화",url없음,<네이버 기사 없음>
2021.01.05.,"우리 동네 성범죄자 신상정보, 카톡으로 받아본다",https://n.news.naver.com/mnews/article/310/0000082920?sid=102,"성범죄자 인근 아동청소년 보호 세대주 대상모바일 고지서 미열람자는 우편 송부19세 미만 아동·청소년 보호 세대주에게 인근 거주하는 성범죄자의 신상정보를 모바일로 고지하는 서비스가 시작된 5일 오후 서울 시내에서 한 시민이 모바일로 도착한 성범죄자 신상정보 고지 메시지를 확인하고 있다. ⓒ뉴시스·여성신문5일부터 19세 미만 아동·청소년 보호 세대주는 가까이에 사는 성범죄자의 신상 정보를 모바일로 확인할 수 있다.여성가족부는 ""5일부터 모바일 고지서를 우선 송부하고, 모바일 고지서 미열람자에 한해 우편 고지서를 송부한다""고 밝혔다.세대주는 '카카오페이'에 가입해 본인을 인증하고 고지서를 열람하면 된다. 모바일 고지를 받기 위한 별도의 신청은 필요 없다.세대원은 '성범죄자알림e' 누리집(www.sexoffender.go.kr) 또는 앱에서 별도로 신청하면 고지 내용을 확인할 수 있다. 정부는 세대원도 성범죄자 신상정보를 모바일로 확인할 수 있도록 열람 신청 웹페이지 링크를 세대주에게 발송할 예정이다.황윤정 여가부 권익증진국장은 ""성범죄자 신상정보 모바일 고지 제도 본격 시행으로, 성범죄자 정보에 대한 접근성이 더 높아질 것으로 기대한다""며 ""앞으로도 시행과정에서 제기되는 수요자 의견을 적극 반영하여 제도를 개선해 나가겠다""라고 말했다.김규희 수습기자 gyu@womennews.co.kr ▶ 여성신문 후원하기 ▶ 기사제보/투고하기 ▶ 네이버에서 [여성신문] 채널 구독하기							<Copyright ⓒ 여성신문. 무단전재 및 재배포 금지>"
2021.01.05.,"더보이즈, 연말 퍼포먼스 영상 공개…'대세돌' 활약 이어간다",https://n.news.naver.com/mnews/article/311/0001249038?sid=106,<구조 다름>
2021.01.05.,"반도 일본 1위, '원더우먼 1984' 눌렀다…'부산행' 보다 높아",url없음,<네이버 기사 없음>
2021.01.05.,[영화 '족벌' 포인트] 조선·동아 '누가누가 잘하나' ③ : 전두환 찬양,https://n.news.naver.com/mnews/article/607/0000000694?sid=102,"우리 사회가 당면한 핵심 과제가 '언론개혁'임을 보여주는 뉴스타파의 신작 영화 '족벌-두 신문 이야기'가 지난해 12월 31일 개봉해 현재 절찬 상영 중입니다.뉴스타파는 '족벌-두 신문 이야기' 개봉을 전후해 영화를 더 흥미롭게 볼 수 있는 '족벌 관람 길잡이'를 연재합니다. 오늘은 두 신문의 치열했던 '전두환 찬양' 경쟁을 소개합니다.1980년 8월 6일, 국가보위비상대책위원회 위원장 자격으로 대장 계급장을 수여받는 전두환의 모습. 전두환은 같은 달 27일 대통령이 됐다.'전두환 열풍'을 만든 조선과 동아1979년 10월 26일 박정희가 사망한 뒤 그 빈 자리를 전두환이 차지했습니다. 1979년 12·12 군사쿠데타로 권력을 찬탈한 전두환은 이듬해 8월 대통령 출마를 선언합니다. 그러자 조선일보와 동아일보는 일제히 전두환 찬양 기사를 실었습니다. 미국이 전두환을 지지하고, 전국에서 전두환을 대통령으로 추대하는 열풍이 불고 있다는 기사가 대표적이었습니다. 1980년 8월 9일자 조선일보 기사. 익명의 주한미군 당국자가 '미국 정부는 전두환을 지지한다'고 밝혔다고 썼다.1980년 8월 21일 조선일보 기사. 영화인, 연예인 등 예술인 수만 명이 '전두환 지지' 궐기대회를 열었다고 보도했다.1980년 8월 19일 동아일보 기사. 서울·강원도, 경기도, 제주도 등 전국에서 전두환에 대한 대통령 추대 열풍이 불고 있다고 썼다.8월 22일 전두환이 대통령 출마를 위해 군에서 전역하자 두 신문을 일제히 '아부 경쟁'을 벌였습니다. 전두환의 전역식을 1면에 싣고, 전두환을 '새 시대의 새 역군'으로 치켜세운 것입니다.1980년 8월 22일 전두환의 군 전역식 당일 나온 동아일보 기사. 대통령 출마 선언이나 다름없는 전두환의 전역사를 고스란히 실어줬다.1980년 8월 23일 조선일보 기사.조선·동아, 전두환 '신격화'에도 앞장섰다조선과 동아는 아예 전두환을 '영웅화', '신격화'하는 기사까지 내기에 이르렀습니다. 조선일보가 내보낸 '인간 전두환'이라는 제목의 기사가 대표적입니다.1980년 8월 23일 조선일보 기사. 전두환을 '육사의 혼이 키워낸 신념과 의지'의 인물이라고 표현했다.""영관 장교 시절 매일 새벽처럼 집을 나갔다가 밤늦게 돌아오는 그(전두환)를 붙잡고 칭얼대는 어린 자식들에겐 '군인이란 나라를 위해 죽는거고 나랏일에 밤낮이 어디있느냐'고 달랜 적도 있다. 그는 매사에 있어 사(私)에 앞서 공(公)이고, 나에 앞서 나라 걱정이다. 그의 이러한 사고는 어려서부터 '의(義)가 생명보다 중하니라'고 조상대대로 구전돼 내려오고 있는 가훈에 영향을 받은 때문이라 할 수 있겠다.""- 1980년 8월 23일 조선일보 '인간 전두환' 기사 일부 - 전두환이 체육관 선거를 통해 대통령이 되자 동아일보가 내놓은 기사의 수위도 만만치 않았습니다.  제목은 '새 시대의 기수 전두환 대통령'이었습니다. 1980년 8월 29일 동아일보 기사. 전두환을 '새로운 개혁 세대의 주역'이라고 썼다.""전 대통령을 아는 많은 사람들은 그를 신념과 의지의 인물이라고 부른다. 29년 동안 군 생활을 통해 공사 생활을 막론하고 전 대통령은 신념과 의지로써 일관해왔다고 한다. 가장 평범한 진리를 가장 철저히 지킴으로써 '평범 속의 비범'을 실천해 왔다...(중략)... 전 대통령의 또 다른 성품으로는 도덕적인 엄격성을 빼놓을 수 없다. 육사 선후배 사이에서 ""앞에 가면 떨리는 무서운 분""이라는 소문도 있었지만 직접 대면하면 부드러운 태도와 화술에 되레 놀란다고 한다.""- 1980년 8월 29일 동아일보 '새 시대의 기수 전두환 대통령' 기사 일부 - 동아일보는 이 기사에서 전두환이 '운동에는 거의 만능'이고, '권력 주변에서도 물욕을 초월해 청렴결백했다', '육사 생도 시절 취침시간 후 방 안에 불이 꺼지면 화장실에 가서 늦도록 책을 봤다'며 그를 신격화했습니다. 또, 전두환의 서민적인 모습도 과장·부각했습니다. '부인의 된장찌개를 즐기고 김삿갓 노래가 18번'이고, '호텔 일류 식당보다는 갈비탕이나 곰탕집, 빈대쩍집을 즐겨 찾는다'고 쓴 겁니다.'전두환 찬양 보도' 수두룩 한데...민주주의 위해 싸웠다?전두환 정권이 끝난 지 30년이 넘게 흘렀지만, 조선일보와 동아일보는 아직도 전두환 찬양 보도에 대해 반성이나 사과를 하지 않고 있습니다. 찬양 기사를 쓴 기자들도 마찬가지였습니다. 아래는 '인간 전두환' 기사를 썼던 김명규 전 조선일보 기자와 영화 '족벌-두 신문 이야기' 취재기자의 전화 통화 내용 일부입니다.○ 뉴스타파 기자 : 혹시 전 조선일보 기자셨던 김명규 선생님 맞으신가요.● 김명규 전 조선일보 기자 : 네.○ 뉴스타파 기자 : 1980년에 기자 하셨을 때 ‘인간 전두환’이라는 기사를 쓰신 걸로 알고 있는데 기억 나시나요?""● 김명규 전 조선일보 기자 : 뭘 물어보려고 그러는 거에요? 지금.'새 시대의 기수 전두환 대통령'이라는 희대의 전두환 찬양 기사를 쓴 최규철 전 동아일보 기자는 아예 모르쇠로 일관했습니다.○ 뉴스타파 기자 : 전 동아일보 기자셨던 최규철 선생님 맞으신가요?● 최규철 전 동아일보 기자 : 네.○ 뉴스타파 기자 : 1980년 8월 29일에 선생님께서 '새 시대의 기수 전두환 대통령'이라는 기사를 쓰셨더라고요. 혹시 그 기사 쓴 거 기억나시나요.● 최규철 전 동아일보 기자 : 기억이 없는데요, 지금. ○ 뉴스타파 기자 : 혹시 당시 기사에 대해 기억 나시는 게 없으신가요.● 최규철 전 동아일보 기자 : 없어요. 그런 거 묻지 마세요.조선과 동아는 아직도 독재 시절 자사가 시민의 편에 서서 민주주의를 위해 싸워 왔다고 주장하고 있습니다. 독재자 전두환을 이렇게 옹호해온 두 신문이 과연 그럴 얘기를 할 자격이 있을까요.영화 '족벌-두 신문 이야기'는 IPTV 3사(KT Olleh TV, SK Btv, LG U+ TV)와 홈초이스(케이블TV VOD), 그리고 Seezn, U+모바일tv, 네이버시리즈, CJ TVING, WAVVE, 구글플레이, 곰TV, 카카오페이지, 씨네폭스 등을 통해 만나볼 수 있습니다.아래의 오프라인 상영관을 통해서도 볼 수 있습니다.1월 6일- 대한극장 10:50/14:05, 서울극장 10:30/15:50, 아트나인 14:10, 인디스페이스 17:50- 영화공간 주안 14:00- 안동 중앙시네마 11:30- 광주독립영화관 17:301월 7일- 대한극장 10:50 / 14:00 / 17:10, 서울극장 10:20 / 15:20, 아트나인 16:10, 에무시네마 12:20- 강릉독립예술극장 신영 20:15, 영화공간 주안 18:00- 안동 중앙시네마 13:001월 8일- 대한극장 10:50 / 14:00 / 17:10, 아트나인 17:50- 강릉독립예술극장 신영 13:00, 영화공간 주안 18:00- 안동 중앙시네마 15:30 - 대전 아트시네마 16:10- 광주극장 15:20 1월 9일- 아트나인 15:40- 강릉독립예술극장 신영 20:15, 영화공간 주안 18:00- 오오극장 13:15, 안동 중앙시네마 17:30- 광주독립영화관 18:001월 10일- 아트나인 15:40, 에무시네마 12:20, 인디스페이스 17:30- 영화공간 주안 18:00- 오오극장 15:40, 안동 중앙시네마 15:00- 대전 아트시네마 12:00*영화 관련 상세 정보는 다음의 링크를 통해 확인할 수 있습니다. (영화 페이지 링크 : https://film.newstapa.org/chodong100)*뉴스타파의 장편 다큐멘터리 영화 '족벌-두 신문 이야기'는 뉴스타파 회원님들의 소중한 회비로 제작했습니다. (후원 페이지 링크 : https://newstapa.org/donate_info)    뉴스타파 홍주환 thehong@newstapa.org한국탐사저널리즘센터 | 뉴스타파'진실'을 함께 지켜주세요 | ▶️ 후원여러분의 제보가 세상을 바꿉니다 | ▶️ 제보"
