기사날짜,기사제목,네이버 뉴스 url,기사내용
2021.01.12.,스타워즈·마블·백종원…OTT 전쟁에 구독자는 즐겁다 [테크리뷰],https://n.news.naver.com/mnews/article/009/0004731961?sid=105,"K드라마에 꽂힌 넷플릭스올해도 블록버스터급 제작유튜브, 백종원과 손잡고요리 관련 다큐멘터리 내놔웨이브도 드라마·예능 등오리지널 콘텐츠 제작 총력유튜브 `백종원의 요리비책` 그야말로 '오리지널 콘텐츠' 확보 총력전이다. 올해 디즈니플러스가 한국 진출을 선언한 가운데 국내외 온라인동영상서비스(OTT) 업체들 사이에서 나오는 말이다. 자사 플랫폼이 아니면 볼 수 없는 콘텐츠로 고객들의 눈길을 사로잡겠다는 전략이다. 그래야 자사 플랫폼에 묶어두는 '록인 효과'를 높일 수 있기 때문이다. 글로벌 1위 OTT 서비스 넷플릭스와 전 세계 최대 동영상 업체 유튜브처럼 이미 한국에 진출한 국외 기업은 물론 웨이브, 카카오 같은 토종 기업까지 고객을 모으기 위한 콘텐츠 독점 유통과 생산 채비를 서두르고 있다. 디즈니플러스는 '콘텐츠 왕국' 월트디즈니가 오랜 기간 쌓아온 방대한 양의 독점 콘텐츠를 앞세운다. 국내에 최대 팬덤을 거느린 '아이언맨' '어벤져스' 같은 마블 콘텐츠를 비롯해 SF 영화의 전설 '스타워즈' 시리즈, 다큐멘터리 명가 내셔널지오그래픽까지 디즈니 계열사 콘텐츠만 8000여 편에 이른다. 디즈니는 지난달 투자자 데이에서 ""향후 (디즈니플러스에) 마블 시리즈와 스타워즈 시리즈를 10편씩 공개하고, 디즈니·픽사 시리즈와 영화도 총 30편 공개할 예정""이라고 밝혔다.디즈니는 그동안 넷플릭스를 비롯한 타사 OTT 서비스에서 제공하던 자사 주요 콘텐츠를 디즈니플러스에만 독점 공개하면서 구독자를 늘려왔다. 당초 국내에서 넷플릭스를 통해 공개됐던 '아이언맨' '어벤져스' 시리즈도 지난해 9월부터 제공되지 않고 있다. 이들 시리즈는 신작 혹은 과거작의 독점 공개만으로 구독자를 끌어모을 가능성이 크다.  넷플릭스 드라마 `스위트홈` 넷플릭스는 전 세계적으로 인기를 끈 스페인 드라마 '종이의 집' 한국판을 제작하기 위해 최근 경기도에 있는 스튜디오 2곳과 임대 계약을 체결했다. 넷플리스는 작년 말에 독점 공개한 네이버웹툰 지식재산권(IP) 기반 콘텐츠 '스위트홈'으로 쏠쏠한 재미를 봤다. 지난달 콘텐츠를 공개하자마자 54개국에서 10위권 내에 진입했다. 지난달 27일 기준으로 미국(6위), 캐나다(8위), 프랑스(5위), 독일(6위), 멕시코(4위) 등에서도 흥행을 이어갔다. 특히 지난해 6월 넷플릭스 독점 공개작인 유아인 주연의 '#살아있다'는 작년에 넷플릭스를 통해 스트리밍된 비영어 콘텐츠 중 제작 국가 외 타 지역에서 가장 많은 사랑을 받은 작품 4위를 기록하기도 했다.올해도 넷플릭스는 한국 오리지널 콘텐츠를 늘려 갈 예정이다. K드라마 열풍의 시작으로 꼽히는 킹덤의 후속편 '킹덤: 아신전'과 제작비 250억원을 들인 송중기·김태리 주연 영화 '승리호'의 독점 공개도 앞두고 있다.전 세계 최대 동영상 플랫폼 유튜브도 오리지널 시리즈를 제작하고 공개 중이다. 지난달 유튜브는 '크리에이터 스포트라이트: 백종원의 요리비책 편'을 국내 첫 오리지널 시리즈로 공개했다. 유튜브가 선보이는 오리지널 시리즈인 '크리에이터 스포트라이트(Creator Spotlight)'는 창의적인 콘텐츠로 전 세계 팬들과 커뮤니티로 영향력을 넓혀 가는 유튜브 크리에이터들의 얘기를 조명한 다큐멘터리다.  웨이브 `녹두전` 국내 토종 OTT 업체 웨이브는 올해 오리지널 콘텐츠 투자 규모를 900억원까지 확대한다. 출범 첫해 100억원의 투자에서 9배나 많은 예산이다. 2023년까지 오리지널 콘텐츠 제작에 3000억원을 투자할 계획이다. 웨이브는 2019년 첫 자체 제작 드라마 '녹두전'을 시작으로 올해 'SF8' '거짓말의 거짓말' '앨리스' '좀비탐정' '날아라 개천용' '바람피면 죽는다' 등 지금까지 오리지널 콘텐츠 제작에 680억원 이상 쏟아부었다. 카카오는 지난해 9월부터 자체 제작한 영상 콘텐츠를 카카오톡 '샵(#)탭'과 '카카오TV채널' '다음포털' 등을 통해 무료 제공하고 있다. 최근에는 카카오TV 오리지널 드라마 '아름다웠던 우리에게' '며느라기' '도시남녀의 사랑법' '아만자'는 최신 회차를 제외하고 유료 전환하면서 '부분 유료화' 정책도 도입했다. 카카오TV 채널 구독자가 370만명에 육박하면서 부분 유료 정책을 통해 수익화 모델을 실험하는 한편 질 좋은 오리지널 콘텐츠를 더욱 확대하겠다는 포석으로 읽힌다. [홍성용 기자]▶ 네이버 메인에서 '매일경제'를 받아보세요▶ 궁금한 제조과정 영상으로 보세요. '이렇게 만들죠'▶ 아파트 살까 청약할까. 여기서 확인하세요. '매부리tv'[ⓒ 매일경제 & mk.co.kr, 무단전재 및 재배포 금지]"
2021.01.12.,"""일하기 좋은 중소기업, '참 괜찮은 중소기업 플랫폼'에 다있네""",url없음,<네이버 기사 없음>
2021.01.12.,"개인정보보호위, AI봇 '이루다' 개인정보 유출 조사 착수",https://n.news.naver.com/mnews/article/092/0002210476?sid=105,"서면조사 내부 판단 후 본조사 계획(지디넷코리아=김민선  기자)개인정보보호위원회가 최근 개인정보 유출 논란이 일고 있는 인공지능(AI) 챗봇 ‘이루다’의 개발사 스캐터랩을 조사한다.스캐터랩은 지난달 22일 정식 출시한 챗봇 이루다를 약 2주간 운영하던 과정에서, 이루다가 말하는 대화에 개인정보로 의심되는 정보들이 섞여있어 논란을 촉발했다.스캐터랩은 11일 입장문을 통해 회사가 운영하는 또다른 서비스인 '연애의 과학'을 통해 수집된 이용자들의 카카오톡 대화를 챗봇 개발에 활용한 것이 맞으며, 이용자에게 따로 고지하지 않은 점에 대해 사과했다. 회사는 이루다 서비스를 12일 중 전면 중단한다.이루다 서비스 중단이에 조사당국도 문제를 인지했으며 사전 조사에 착수할 예정이다. 12일 개인정보보호위 대변인실 관계자는 ""언론보도를 통해 스캐터랩에서 발생한 논란에 인지했으며, 본격적인 조사에 들어가려면 사전에 자료를 파악해야 한다“며 ”서면조사를 통해 기초 자료를 보고 문제가 있다고 내부적으로 판단하면 실제 조사에 들어갈 예정“이라고 밝혔다.연애의 과학은 연인간 카카오톡 대화 내용을 기반으로 애정도를 분석해주는 유료 서비스를 제공 중이다. 이때 이용자로부터 개인정보 수집 및 활용에 대한 동의를 받으면서, AI 챗봇 개발에 활용할 것이란 점은 따로 표시하지 않았다. 연애의과학 개인정보취급방침 상 메시지 텍스트 파일을 제공받으며 정보 활용 목적에 '신규 서비스 개발 및 맞춤 서비스 제공'이라고만 명시했다.스캐터랩 개인정보취급방침개인정보 수집 및 활용 목적에 대해 구체적으로 명시하지 않은 점 외에도 스캐터랩이 이들 데이터를 제대로 정제하지 않은 채 사용한 정황이 의심되는 점이 추가로 문제 제기됐다. 타 매체 보도에 따르면 주소 동, 호수 등 개인정보가 그대로 노출된 사례도 발견됐다.이에 대해 사측은 구체적인 주소가 포함될 수 있었던 경위에 대해 뚜렷이 답하지 못했다. 숫자 정보와 이메일에 포함될 수 있는 영문 데이터는 사전에 삭제했다는 입장이다. 즉 이루다 대화 노출에 앞서 사전에 비식별화가 진행된 것이 분명하고 강조했다.만약 해당 주소가 실제 카카오톡 대화에서 제대로 필터링 되지 않은 정보라면 개인정보 유출에 해당할 가능성이 높다.가천대 최경진 법과대학 교수는 “개인정보보호법 17조에 따라 정보 제공에는 동의 하면서도 주소에 대해선 동의하지 않았던 케이스라면 법 위반”이라며 “만일 카카오톡 대화가 아닌 다른 곳에서 정보를 수집하다 실제 있는 주소가 포함된 경우라면 개인정보보호법 15조 위반”이라고 설명했다.애초에 연애의 과학 카카오톡 대화 제공자로부터 개인정보 수집 및 활용 동의를 받았고, 납득 가능한 범주 내에서 이뤄진 서비스였다 하더라도 비식별화 과정에서 실수가 발생한다면 이는 개인정보 유출에 해당한다. 개인정보보호책임자는 법적 책임을 질 수밖에 없다. 스캐터랩의 경우 김종윤 대표다.최 교수는 ""인공지능이란 것이 처음부터 완벽할 순 없고 고쳐가면서 해야 한다""면서도 ""AI 챗봇을 대중에 서비스 하면서 철저히 비식별화와 마스킹 작업을 했어야 하는 것이 맞다""고 강조했다.연애의 과학 이용자 카카오톡 대화 제공자들은 이번 사건에 반발해 카카오톡 오픈채팅방을 통해 개인정보 유출 사례를 공유하며 소송을 준비 중인 것으로 알려졌다.김민선 기자(yoyoma@zdnet.co.kr) ▶ 지디넷코리아 '홈페이지' ▶ 네이버 채널 구독하기© 메가뉴스 & ZDNET, A RED VENTURES COMPANY, 무단전재-재배포 금지"
2021.01.12.,"3차 재난지원금 '카톡' 상담은 안해…""스미싱 주의""",https://n.news.naver.com/mnews/article/422/0000466215?sid=161,"[뉴스리뷰][앵커]어제(11일)부터 시작된 정부의 3차 재난지원금 지급과 관련해 문자를 이용한 해킹, 이른바 스미싱 사기가 퍼지고 있어 주의가 요구됩니다.코로나 피해 지원이 다양해지면서 이런 스미싱은 끊이지 않고 있는데요.김민혜 기자입니다.[기자]한 소상공인이 받은 문자 메시지입니다. 3차 재난지원금 지원대상이라며 카카오톡으로 문의하라고 유도합니다. 자신을 담당자라고 소개하고, 어떤 업종인지 등을 묻더니 지원자가 너무 많다며 예치금을 내면 지원금을 먼저 받아볼 수 있게 하겠다고 안내합니다. 그러면서 신청서류를 제시하는데, 신청서 하단에 '재난동부장관'이라는 문구가 눈에 띕니다. 현존하지 않는 직함입니다.< A 지자체 관계자 > ""민원인이 카톡으로 이런 내용을 문자로 받으셨다고 해서 저희에게 확인 전화를 하셨어요. 확인해보니 당시에는 재난지원금 접수를 받는 때도 아니었고 카톡으로 연락 달라 이런 내용은 없어서…""사실과 다른 안내로, 문자를 이용한 해킹인 스미싱이 의심되는데, 개인정보를 넘겼다면 자칫 범죄에 악용될 수도 있는 것입니다. 실제 인터넷 카페에서는 3차 재난지원금이 지급되기 전후로 이런 비슷한 류의 사기 문자를 목격했다는 글이 잇따르고 있습니다. 피해가 우려되자 각 지자체들이 주의를 당부하고 나섰습니다. <박유미 / 서울시 시민건강국장> ""도움이 절실한 소상공인 및 자영업자분들이 피해를 입을 수 있으므로 각별한 주의가 필요합니다. 재난지원금 접수는 카카오톡 등의 메신저를 통해서는 신청받지 않습니다.""지원금 정책이 나올 때마다 비슷한 류의 사기 문자는 빈발했습니다. 지난해 4월 서울에서는 코로나 지원금이 도착했다는 내용을 빙자한 스미싱 의심 문자가 보름이 채 안 돼 130여 건 접수되기도 했습니다. 연합뉴스TV 김민혜입니다. (makereal@yna.co.kr)연합뉴스TV 기사문의 및 제보 : 카톡/라인 jebo23 ▶ 네이버에서 연합뉴스TV를 구독하세요 ▶ 연합뉴스TV 생방송 만나보기  ▶ 균형있는 뉴스, 연합뉴스TV 앱 다운받기"
2021.01.12.,'이루다' 개발에 개인정보 유출…청와대 청원 등장,https://n.news.naver.com/mnews/article/214/0001092396?sid=101,"인공지능 챗봇 '이루다' 개발 과정에서 개인정보 침해 피해를 겪었다고 주장하는 이용자들이 국민 청원에 나섰습니다.오늘 청와대 국민청원 게시판에는 ""이용자들 개인정보를 무단 활용·유출한 스캐터랩에 데이터 폐기 및 서비스 종료를 요구합니다""라는 글이 올라왔습니다.게시글 작성자는 ""'이루다' 개발사인 스캐터랩은 '연애의 과학' 이용자들의 데이터를 어떤 고지와 동의 없이 플랫폼 외부로 반출해 '이루다 AI'로 사업화 했으며, 개인정보 보호 작업도 제대로 하지 않았다""고 주장했습니다.'연애의 과학'은 연인과 나눈 카카오톡 대화를 입력하면 답장 시간 등의 대화 패턴을 분석해 애정도 수치를 보여주는 앱으로, 스캐터랩이 2016년 출시했습니다.스캐터랩은 연애의 과학으로 수집한 카톡 대화 약 100억건을 데이터로 삼아 이루다를 개발했다고 밝힌 바 있습니다.한편, 연애의 과학 이용자 300여명은 자신들의 사적인 대화 내용이 무단 유출됐다며 집단소송을 준비하고 있습니다.현영준 기자(yjun@mbc.co.kr)[저작권자(c) MBC (https://imnews.imbc.com) 무단복제-재배포 금지]▶ 네이버 홈에서 [MBC뉴스] 채널 구독하기▶ 새로움을 탐험하다. ""엠빅뉴스""▶ [M라운지] 편안한데 찰진 수다의 공간Copyright(c) Since 1996, MBC&iMBC All rights reserved."
