기사날짜,기사제목,네이버 뉴스 url,기사내용
2021.01.13.,"토스·SC제일은행 등 7개사, 마이데이터 예비허가 받아",https://n.news.naver.com/mnews/article/003/0010292455?sid=101,"[서울=뉴시스] 정옥주 기자 = 비바리퍼블리카(토스) 등 7개사가 마이데이터(MyData·본인신용정보관리업) 예비허가를 추가로 받았다. 다만 카카오페이는 외국법인인 대주주에 대한 적격성 문제로 이번에도 예비허가를 받지 못했다금융위원회는 13일 정례회의에서 지난 예비허가 심사에서 허가가 보류된 8개사와 추가 신청업체 2개사 등 총 10개 업체에 대한 심사를 진행, 7개사에 예비허가를 내줬다고 밝혔다. 이번에 허가를 받은 7개사는 비바리퍼블리카, 민앤지, 쿠콘, 핀테크, 해빗팩토리, SC제일은행, SK플래닛 등이다. 이에 따라 현재까지 마이데이터 예비허가를 신청한 총 37개사 중 28개사가 마이데이터 예비허가를 받게 됐다.남은 9개사 중 삼성카드, 하나은행, 하나카드, 하나금융투자 등 6개사는 대주주에 대한 형사소송·제재절차가 진행 중이어 심사가 보류된 상태다. 금융위는 심사보류 사유가 해소되는 즉시 허가심사를 재개한다는 방침이다.카카오페이는 2대 주주인 앤트파이낸셜의 형사처벌·제재여부 확인과 관련해 중국 금융당국으로부터 아직 답변을 받지 못해 심사가 보류됐다. 금융위는 ""카카오페이의 경우 허가요건 중 일부에 대한 증빙자료 제출이 지연돼 심사가 계속 진행 중""이라고 설명했다.또 뱅큐와 아이지넷 등 2개사는 외부평가위원회 심사결과 등에 따른 허가요건 미흡으로 예비허가를 받지 못했다. 금융위는 ""이날 예비허가를 받은 7개사는 본허가 신청기업 20개사와 함께 이달 말 마이데이터 본허가 심사가 이뤄질 예정""이라며 ""37개 신청기업 중 예비허가를 받지 못한 9개사의 경우 다음달 4일까지 본허가를 받지 못하는 경우에도 소비자 불편 및 피해가 최소화될 수 있도록 노력할 계획""이라고 말했다.☞공감언론 뉴시스 channa224@newsis.com▶ 네이버에서 뉴시스 구독하기▶ K-Artprice, 유명 미술작품 가격 공개▶ 뉴시스 빅데이터 MSI 주가시세표 바로가기<ⓒ 공감언론 뉴시스통신사. 무단전재-재배포 금지>"
2021.01.13.,"카카오·케이뱅크, 올해 상반기까지 ATM 수수료 무료 유지",url없음,<네이버 기사 없음>
2021.01.13.,"폭스바겐코리아, 카카오TV 오리지널 드라마 '도시남녀의 사랑법'에 차량 지원",https://n.news.naver.com/mnews/article/076/0003681412?sid=101,"폭스바겐코리아가 연일 화제를 모으고 있는 카카오 TV 오리지널 드라마 '도시남녀의 사랑법'에 차량 협찬을 진행한다.지난달 22일 카카오TV를 통해 첫 공개된 후 큰 인기를 누리고 있는 '도시남녀의 사랑법'은 복잡한 도시 속 치열하게 살아가는 청춘들의 리얼 로맨스를 그린 드라마다. '로맨스 드림팀'이라 불리는 박신우 감독과 정현정 작가의 만남으로 만들어진 탄탄한 스토리라인 및 연출력을 기반으로, 탁월한 캐릭터 소화력을 선보이는 배우 지창욱과 김지원 등 대세 청춘 배우들의 시너지까지 더해져 국내외 팬들의 관심을 한 몸에 받고 있다.폭스바겐코리아는 극 중 등장 인물들의 개성에 부합하는 투아렉과 티구안 올스페이스 모델을 지원해 폭스바겐만의 다채로운 매력을 시청자들에게 전하고 있다.폭스바겐의 럭셔리 SUV 투아렉은 열정 넘치는 건축가이자 로맨티스트인 박재원(지창욱 분)의 차량으로 등장한다. 투아렉의 세련된 스타일과 감각적인 이미지는 극 중 캐릭터의 분위기를 돋보이게 해준다.7인승 SUV 티구안 올스페이스는 현실적이고 이성적이지만 여자친구에게만은 사랑꾼인 최경준(김민석 분)의 차량으로 등장하며 눈길을 끈다.플래그십 SUV 3세대 신형 투아렉은 폭스바겐 그룹의 선도적인 첨단 기술의 집약체로, 프리미엄한 디자인과 다이내믹한 성능까지 갖춰 럭셔리 SUV 시장에 새로운 기준을 제시한 모델이다. 최근 상품성을 강화한 2021년형 모델이 출시되며 국내 럭셔리 SUV 시장에서의 입지를 더욱 공고히 다지고 있다.티구안 올스페이스는 독보적 베스트셀러 티구안의 공간 활용성을 극대화해 한층 강화된 실용성을 자랑하며, 일상생활뿐 아니라 아웃도어 활동까지 다양한 라이프스타일에 최적화된 모델이다.이정혁 기자 jjangga@sportschosun.com▶2021 신축년(辛丑年) 신년 운세 보러가기- Copyrightsⓒ 스포츠조선(http://sports.chosun.com/), 무단 전재 및 재배포 금지"
2021.01.13.,"""전동화 원년"" 현대·기아차, '전기차 대중화' 드라이브",https://n.news.naver.com/mnews/article/629/0000062553?sid=101,"현대차는 자사 전기차 고객 만족도 제고를 위해 '찾아가는 충전 서비스'를 확대 운영한다고 13일 밝혔다. /현대차 제공현대차 '찾아가는 충전 서비스' 확대하고, 기아차 카카오모빌리티 '맞손'[더팩트 | 서재근 기자] 올해를 전동화 전략 실행 및 전기차 대중화 원년으로 삼은 현대·기아자동차가 전기차 인프라 구축에 속도를 높이고 있다.현대자동차(현대차)는 13일 전기차 고객 만족도 제고를 위해 '찾아가는 충전 서비스'를 확대 운영한다고 밝혔다.해당 서비스는 전기차 운행 중 방전이 되거나 충전소까지 이동이 어려울 경우 고객이 원하는 시간과 장소를 정해 서비스를 요청하면 전담 직원이 고객에게 직접 찾아가 무료로 차량 배터리를 충전해주는 프로그램이다.1회 이용 시 약 44km를 주행할 수 있는 충전량(7kWh, 충전 소요 시간 약 15분)을 제공하며, △룸미러에 있는 '블루링크 SOS' 버튼 △현대차 고객센터 △모바일 애플리케이션 '마이현대'를 통해 신청할 수 있다.먼저 현대차는 최대 5년 동안 '연 4회' 제공했던 무상 충전 서비스 제공 횟수를 '연 10회'(현대차 홈페이지 회원가입 또는 블루멤버스 회원가입 시기에 따라 서비스 제공 횟수는 상이)로 늘린다.특히, 렌터카 등의 용도로 전기차 보급이 활성화된 제주도 지역에서는 고객이 충전소 고장으로 전기차 이용에 불편을 느끼지 않도록 추가적인 특화 서비스를 운영할 예정이다.제주도에서 충전소 고장으로 충전이 어려울 경우, 해당 충전소에서 '찾아가는 충전 서비스'를 요청하면 충전 용량을 기존 7kWh에서 최대 20kWh(약 120km 주행 가능, 충전 소요 시간 약 45분)로 대폭 늘려서 제공한다. 충전소 고장 외 일반적인 경우에는 타지역과 동일한 용량으로 충전해준다.현대차 관계자는 ""이번 '찾아가는 충전 서비스' 확대 운영을 통해 고객분들께서 전기차에 대해 긍정적인 경험을 하실 수 있기를 바란다""며 ""전기차 시대를 선도하는 브랜드로서 앞으로도 전기차 이용 고객의 편의 증진을 위해 노력할 것""이라고 말했다.기아차와 카카오모빌리티는 12일 서울 압구정 기아차 사옥에서 친환경 전기차 보급 활성화를 위한 업무협약을 체결했다. /기아차 제공기아자동차(기아차)는 전기차 산업 생태계 구축 작업의 일환으로 카카오모빌리티와 협력에 나선다. 기아차는 전날(12일) 카카오모빌리티와 친환경 전기차 보급 활성화를 위한 업무협약(MOU)을 체결했다.이번 협약은 기아차의 전기차 기술 및 관련 인프라와 카카오모빌리티의 모빌리티 플랫폼을 접목하여 택시를 포함한 운수 업계 종사자 및 승객, 일반 자동차 운전자 모두의 편의와 만족도를 제고하고, 온실가스 배출 저감 및 대기환경 개선을 도모한다는 데 목표를 두고 있다.기아차는 전기차와 전기차 관련 기술, 충전 인프라, 배터리 및 차량 보증, 정비 지원 등의 분야에서 역할을 수행하고, 카카오모빌리티는 플랫폼을 활용한 인프라와 솔루션을 제공함으로써 전기차 산업 생태계를 구축해 나가기 위한 다양한 방안을 모색, 전기차 대중화에 이바지한다는 계획이다. 권혁호 기아차 국내사업본부장은 ""전기차 생태계를 공동으로 조성하는 카카오모빌리티와의 협력은 플랫폼 업계의 전기차 도입을 가속화하고, 기아차의 중장기 미래전략 Plan S의 핵심인 전기차 사업확대에 기여할 것""이라며 ""향후 브랜드 리런칭과도 연계해 전기차 기반 모빌리티 서비스 분야를 성장 모멘텀으로 활용하고자 한다""고 말했다.likehyo85@tf.co.kr - BTS 공연 비하인드 사진 얻는 방법? [팬버십 가입하기▶]   - 내 아이돌 순위는 내가 정한다! [팬앤스타 투표하기] 저작권자 ⓒ 특종에 강한 더팩트 & tf.co.kr 무단 전재 및 재배포 금지"
2021.01.13.,"토스, 마이데이터 예비인가‥카카오페이는 일단 보류",https://n.news.naver.com/mnews/article/018/0004827883?sid=101,"[이데일리 장순원 기자] 13일 금융위 정례회의장순원 (crew@edaily.co.kr)▶ #24시간 빠른 #미리보는 뉴스 #eNews+▶ 네이버에서 '이데일리 뉴스'를 만나보세요▶ 빡침해소, 청춘뉘우스 '스냅타임'＜ⓒ종합 경제정보 미디어 이데일리 - 무단전재 & 재배포 금지＞"
2021.01.13.,"폭스바겐코리아, 카카오TV 오리지널 드라마 '도시남녀의 사랑법'에 차량 지원",https://n.news.naver.com/mnews/article/076/0003681412?sid=101,"폭스바겐코리아가 연일 화제를 모으고 있는 카카오 TV 오리지널 드라마 '도시남녀의 사랑법'에 차량 협찬을 진행한다.지난달 22일 카카오TV를 통해 첫 공개된 후 큰 인기를 누리고 있는 '도시남녀의 사랑법'은 복잡한 도시 속 치열하게 살아가는 청춘들의 리얼 로맨스를 그린 드라마다. '로맨스 드림팀'이라 불리는 박신우 감독과 정현정 작가의 만남으로 만들어진 탄탄한 스토리라인 및 연출력을 기반으로, 탁월한 캐릭터 소화력을 선보이는 배우 지창욱과 김지원 등 대세 청춘 배우들의 시너지까지 더해져 국내외 팬들의 관심을 한 몸에 받고 있다.폭스바겐코리아는 극 중 등장 인물들의 개성에 부합하는 투아렉과 티구안 올스페이스 모델을 지원해 폭스바겐만의 다채로운 매력을 시청자들에게 전하고 있다.폭스바겐의 럭셔리 SUV 투아렉은 열정 넘치는 건축가이자 로맨티스트인 박재원(지창욱 분)의 차량으로 등장한다. 투아렉의 세련된 스타일과 감각적인 이미지는 극 중 캐릭터의 분위기를 돋보이게 해준다.7인승 SUV 티구안 올스페이스는 현실적이고 이성적이지만 여자친구에게만은 사랑꾼인 최경준(김민석 분)의 차량으로 등장하며 눈길을 끈다.플래그십 SUV 3세대 신형 투아렉은 폭스바겐 그룹의 선도적인 첨단 기술의 집약체로, 프리미엄한 디자인과 다이내믹한 성능까지 갖춰 럭셔리 SUV 시장에 새로운 기준을 제시한 모델이다. 최근 상품성을 강화한 2021년형 모델이 출시되며 국내 럭셔리 SUV 시장에서의 입지를 더욱 공고히 다지고 있다.티구안 올스페이스는 독보적 베스트셀러 티구안의 공간 활용성을 극대화해 한층 강화된 실용성을 자랑하며, 일상생활뿐 아니라 아웃도어 활동까지 다양한 라이프스타일에 최적화된 모델이다.이정혁 기자 jjangga@sportschosun.com▶2021 신축년(辛丑年) 신년 운세 보러가기- Copyrightsⓒ 스포츠조선(http://sports.chosun.com/), 무단 전재 및 재배포 금지"
2021.01.13.,월 3천900원에 이모티콘 15만개 이용…카톡 첫 구독 서비스 나와,https://n.news.naver.com/mnews/article/009/0004732399?sid=101,"[사진출처 = 연합뉴스]카카오톡 이모티콘을 월정액으로 마음대로 사용할 수 있는 구독 서비스가 나와 화제다.카카오가 13일 선보인 '이모티콘 플러스'는 월 3900원만 내면 이모티콘을 구독할 수 있는 서비스다.이전까지는 각 이모티콘을 단품으로 사서 사용했어야 했다. 하지만 이제는 월정액을 내면 카카오가 선별한 '이모티콘 모음'을 이용할 수 있게 됐다.카카오는 ""현재 확보된 이모티콘은 약 15만개로 기존 이모티콘은 대부분 계약됐다""면서 ""앞으로도 신규 입점하는 이모티콘을 추가할 예정""이라고 말했다.'이모티콘 플러스'에는 대화나 상황을 분석해 이모티콘을 자동으로 추천해주는 기능이 있다. 또한 상황·감정별 키워드로 이모티콘이 정리돼 대화에 알맞게 쓸 수 있고 '랜덤 이모티콘' 기능도 생겼다.[이상규 매경닷컴 기자 boyondal@mk.co.kr]▶ 네이버 메인에서 '매일경제'를 받아보세요▶ 궁금한 제조과정 영상으로 보세요. '이렇게 만들죠'▶ 아파트 살까 청약할까. 여기서 확인하세요. '매부리tv'[ⓒ 매일경제 & mk.co.kr, 무단전재 및 재배포 금지]"
2021.01.13.,"""전동화 원년"" 현대·기아차, '전기차 대중화' 드라이브",https://n.news.naver.com/mnews/article/629/0000062553?sid=101,"현대차는 자사 전기차 고객 만족도 제고를 위해 '찾아가는 충전 서비스'를 확대 운영한다고 13일 밝혔다. /현대차 제공현대차 '찾아가는 충전 서비스' 확대하고, 기아차 카카오모빌리티 '맞손'[더팩트 | 서재근 기자] 올해를 전동화 전략 실행 및 전기차 대중화 원년으로 삼은 현대·기아자동차가 전기차 인프라 구축에 속도를 높이고 있다.현대자동차(현대차)는 13일 전기차 고객 만족도 제고를 위해 '찾아가는 충전 서비스'를 확대 운영한다고 밝혔다.해당 서비스는 전기차 운행 중 방전이 되거나 충전소까지 이동이 어려울 경우 고객이 원하는 시간과 장소를 정해 서비스를 요청하면 전담 직원이 고객에게 직접 찾아가 무료로 차량 배터리를 충전해주는 프로그램이다.1회 이용 시 약 44km를 주행할 수 있는 충전량(7kWh, 충전 소요 시간 약 15분)을 제공하며, △룸미러에 있는 '블루링크 SOS' 버튼 △현대차 고객센터 △모바일 애플리케이션 '마이현대'를 통해 신청할 수 있다.먼저 현대차는 최대 5년 동안 '연 4회' 제공했던 무상 충전 서비스 제공 횟수를 '연 10회'(현대차 홈페이지 회원가입 또는 블루멤버스 회원가입 시기에 따라 서비스 제공 횟수는 상이)로 늘린다.특히, 렌터카 등의 용도로 전기차 보급이 활성화된 제주도 지역에서는 고객이 충전소 고장으로 전기차 이용에 불편을 느끼지 않도록 추가적인 특화 서비스를 운영할 예정이다.제주도에서 충전소 고장으로 충전이 어려울 경우, 해당 충전소에서 '찾아가는 충전 서비스'를 요청하면 충전 용량을 기존 7kWh에서 최대 20kWh(약 120km 주행 가능, 충전 소요 시간 약 45분)로 대폭 늘려서 제공한다. 충전소 고장 외 일반적인 경우에는 타지역과 동일한 용량으로 충전해준다.현대차 관계자는 ""이번 '찾아가는 충전 서비스' 확대 운영을 통해 고객분들께서 전기차에 대해 긍정적인 경험을 하실 수 있기를 바란다""며 ""전기차 시대를 선도하는 브랜드로서 앞으로도 전기차 이용 고객의 편의 증진을 위해 노력할 것""이라고 말했다.기아차와 카카오모빌리티는 12일 서울 압구정 기아차 사옥에서 친환경 전기차 보급 활성화를 위한 업무협약을 체결했다. /기아차 제공기아자동차(기아차)는 전기차 산업 생태계 구축 작업의 일환으로 카카오모빌리티와 협력에 나선다. 기아차는 전날(12일) 카카오모빌리티와 친환경 전기차 보급 활성화를 위한 업무협약(MOU)을 체결했다.이번 협약은 기아차의 전기차 기술 및 관련 인프라와 카카오모빌리티의 모빌리티 플랫폼을 접목하여 택시를 포함한 운수 업계 종사자 및 승객, 일반 자동차 운전자 모두의 편의와 만족도를 제고하고, 온실가스 배출 저감 및 대기환경 개선을 도모한다는 데 목표를 두고 있다.기아차는 전기차와 전기차 관련 기술, 충전 인프라, 배터리 및 차량 보증, 정비 지원 등의 분야에서 역할을 수행하고, 카카오모빌리티는 플랫폼을 활용한 인프라와 솔루션을 제공함으로써 전기차 산업 생태계를 구축해 나가기 위한 다양한 방안을 모색, 전기차 대중화에 이바지한다는 계획이다. 권혁호 기아차 국내사업본부장은 ""전기차 생태계를 공동으로 조성하는 카카오모빌리티와의 협력은 플랫폼 업계의 전기차 도입을 가속화하고, 기아차의 중장기 미래전략 Plan S의 핵심인 전기차 사업확대에 기여할 것""이라며 ""향후 브랜드 리런칭과도 연계해 전기차 기반 모빌리티 서비스 분야를 성장 모멘텀으로 활용하고자 한다""고 말했다.likehyo85@tf.co.kr - BTS 공연 비하인드 사진 얻는 방법? [팬버십 가입하기▶]   - 내 아이돌 순위는 내가 정한다! [팬앤스타 투표하기] 저작권자 ⓒ 특종에 강한 더팩트 & tf.co.kr 무단 전재 및 재배포 금지"
2021.01.13.,"토스, 마이데이터 예비인가‥카카오페이는 일단 보류",https://n.news.naver.com/mnews/article/018/0004827883?sid=101,"[이데일리 장순원 기자] 13일 금융위 정례회의장순원 (crew@edaily.co.kr)▶ #24시간 빠른 #미리보는 뉴스 #eNews+▶ 네이버에서 '이데일리 뉴스'를 만나보세요▶ 빡침해소, 청춘뉘우스 '스냅타임'＜ⓒ종합 경제정보 미디어 이데일리 - 무단전재 & 재배포 금지＞"
2021.01.13.,中 앤트그룹에 발목 잡힌 카카오페이...마이데이터 심사 '딜레이',url없음,<네이버 기사 없음>
2021.01.13.,"'이루다' 개발사, 실명 노출된 카톡 1700건 온라인에 공유했다",https://n.news.naver.com/mnews/article/421/0005106532?sid=105,"텍스트 1700줄 분량 100여건 대화 묶음 비식별화 없이 공개대화 상대방과 관계·기저 질환·생활반경 유추 가능한 정보스캐터랩 측은 지난해 12월 이루다를 출시하며 이루다를 '가수 블랙핑크를 좋아하고, 일상을 기록하는 것을 취미가 있는 20살 여대생''으로 소개했다. (이루다 인스타그램)© 뉴스1(서울=뉴스1) 손인해 기자,김승준 기자 = 인공지능(AI) 챗봇 '이루다' 개발업체 스캐터랩이 비식별화 과정을 제대로 거치지 않은 카카오톡 대화 묶음 100건(1700건)을 오픈소스 플랫폼에 올려 논란이 일고 있다.개인정보 수집·활용 목적을 명확히 고지하지 않았다는 비판과 함께 개인정보 유출 문제가 본격 도마에 오를 것으로 보인다.13일 업계에 따르면 스캐터랩은 지난 2019년10월부터 오픈소스 플랫폼 '깃허브'에 자사가 구현한 '문장 생성 모듈' 프로젝트를 오픈소스로 공개했다.깃허브는 IT 개발자들이 컴퓨터 프로그램 소스를 공유하고 협업할 수 있는 공간이다.문제는 해당 프로젝트 데이터셋으로 자사 애플리케이션(앱) '연애의 과학'에서 가져온 카카오톡 대화 내용을 비식별화 과정 없이 공개했다는 점이다.100여건의 대화 묶음이 담긴 이 데이터에는 실명이 20여번 이상 필터링되지 않고, 대화 상대방과의 관계가 그대로 나온다. 해당 대화 묶음은 1700줄짜리 텍스트 분량이다.스캐터랩이 지난해 오픈소스 플랫폼 '깃허브'에 공개한 '문장 생성 모듈' 프로젝트. 데이터셋으로 '연애의과학'에서 추출된 대화 데이터를 활용했다고 적시했다. © 뉴스1뉴스1이 데이터셋 일부를 확인한 결과 ""OO아, 오늘 몇시까지 놀 수 있어??"" ,""OO씨~~비행기잘탔어요?"" 처럼 실명이 그대로 노출된 사례가 발견됐다.또 특정 커플의 대화가 15건 이상 수록돼 있었고, 개인 기저 질환을 유추할 수 있는 대화 내용이나 생활반경, 직장 관련 정보가 등장하기도 했다. 해당 데이터셋은 이날 오전 한 개발자가 페이스북 텐서플로우 커뮤니티에 관련 사실을 폭로한 지 15분 만에 삭제했다.이 개발자는 ""모두가 접근할 수 있는 곳에 고객의 사적인 대화 100건을 올리는 건 문제의 소지가 있는 듯 하다""며 ""또 비식별화가 제대로 이뤄지지 않았다""고 말했다.'이루다' 개발업체 스캐터랩이 오픈소스 플랫폼 '깃허브'에 올린 데이터셋 일부. 실명과 함께 ""혈당을 뽑아서 측정한다""는 사실로 개인 기저 질환을 유추할 수 있다. 사진에서 등장하는 이름은 이름은 가명 처리했다. © 뉴스1앞서 스캐터랩은 전날 개인정보 유출과 관련해 ""개별 문장 필터링 조치에도 문맥에 따라 인물의 이름이 남아 있다거나 하는 부분이 발생한 점에 대해 사과드린다""고 밝힌 바 있다.연애의 과학 이용자들은 스캐터랩이 명확한 고지 없이 연인 간 사적 대화를 AI 챗봇을 통해 공개되도록 했다며 집단 소송 움직임을 보이고 있다. 연애의 과학은 연인이나 호감 가는 사람과 나눈 카톡 대화 내용을 집어넣고 3000~5000원 비용을 지불하면 애정도 수치를 분석해주는 서비스다.성희롱에 이어 혐오표현, 부적절한 개인정보 수집 과정 및 유출 논란을 겪은 이루다는 지난 12일 출시 3주 만에 서비스를 잠정 중단했다.son@news1.kr▶ 네이버 메인에서 [뉴스1] 구독하기!▶  뉴스1&BBC 한글 뉴스 ▶  터닝포인트 2021 © 뉴스1코리아(news1.kr), 무단 전재 및 재배포 금지"
