기사날짜,기사제목,네이버 뉴스 url,기사내용
2021.01.05.,국내 자율주행 서비스 大戰…카카오 vs 쏘카 한판 붙는다,https://n.news.naver.com/mnews/article/366/0000646598?sid=105,"쏘카, 상반기 제주서 자율주행 유상 서비스 출시카카오, 작년 12월 세종서 자율주행 순환셔틀 운영돈 받고 서비스할 만큼 한 단계 올랐다는 평가아직은 정해진 경로만…사고 시 책임, 보험 등 과제국내 자율주행 유상 서비스 경쟁이 치열해지고 있다. 카카오모빌리티가 지난해 12월 세종시에서 국내 첫 자율주행 서비스를 선보인데 이어 쏘카가 올해 상반기 중 자율주행 서비스를 내놓는다. 지난해 5월 자율주행차법 시행에 이어 11월 ‘자율주행차 시범 운행 지구’ 지정으로 여객 유상 운송의 길이 열리면서 기존 무상 시범 운행에 국한됐던 자율주행 서비스가 상용화 단계에 접어든 것이다. 쏘카가 라이드플럭스와 함께 개발, 출시한 자율주행차량. /쏘카모빌리티 플랫폼 쏘카는 자율주행 솔루션기업 라이드플럭스와 함께 올해 상반기 제주도에서 유상 자율주행 서비스를 출시한다고 5일 밝혔다. 지난해 12월 세종시에서 국내 첫 자율주행 서비스를 선보인 카카오모빌리티에 이어 두 번째 유상 서비스다. 쏘카 애플리케이션(앱)이나 카카오T 앱을 통해 차량을 호출하고 비용을 지불하면 해당 승객을 태워 목적지까지 이동하는 방식이다. 승객 호출에 따라 앱을 통해 자동 운행되며 안전을 위해 운전석이나 조수석에 자율주행 전문 지식을 갖춘 드라이버가 동승한다. 쏘카는 지난해 이른바 ‘타다금지법’으로 핵심 사업이 막히며 한 차례 부침을 겪었지만 이후 차량공유와 자율주행, 중고차매매 등 각종 모빌리티 서비스를 공격적으로 확대하며 다시 두각을 나타내고 있다.쏘카는 제주공항부터 중문단지까지 편도 38㎞를 오가는 구간에서 미니밴(크라이슬러 퍼시피카)을 이용해 서비스한다. 최대 5명까지(캐리어 2개 포함) 태울 수 있다. 이 구간은 국토교통부가 선정한 자율주행차 시범 운행 지구 6곳 가운데 가장 긴 구간이다. 카카오모빌리티가 서비스하는 세종시는 약 23㎞ 구간에 대해 시범 운행이 허용됐다. 카카오는 이 중 4㎞(승객 최대 2명)를 서비스하고 있다.백승근 국토교통부 교통물류실장(왼쪽 두 번째), 이춘희 세종특별자치시장(조수석), 홍성국 더불어민주당 의원(왼쪽 첫 번째) 등이 카카오모빌리티의 자율주행차량을 시승하고 있다. /카카오모빌리티쏘카는 자사 서비스가 ""국내 최초로 민간이 주도하는 승객 수요응답형 자율주행이다""라는 점을 강조한다. 기존 자율주행 서비스가 통제된 교통 상황에서 정해진 인원만 태워 운행한 반면, 쏘카는 불특정 승객이 탑승하고 여러 변수가 열린 일반 도로에서 서비스한다는 것이다. 이는 또 카카오 자율주행이 세종시에서 선발한 ‘얼리 라이더’만 탑승할 수 있다는 점과 비교되는 부분이다. 쏘카는 지난해 5월 무상 시범 서비스를 시작할 때부터 이같은 방식으로 자율주행을 운영해 왔다.쏘카 관계자는 ""우리 서비스는 운행시간, 횟수, 도로의 복잡도 측면에서도 독보적이다""라고 설명했다. 쏘카에 따르면 라이드플럭스는 지난해 5월부터 제주공항에서 왕복 5㎞ 구간으로 5400회 이상 무료 자율주행 서비스를 제공했다. 또 제주도가 다른 지역보다 날씨 변화가 잦기 때문에 다양한 환경에서 자율주행 관련 기술과 데이터, 운영노하우를 쌓아왔다는 게 쏘카에서 내세우는 강점이다. 쏘카 측은 ""서비스 기간 탑승객 평점이 5점 만점에 4.9점에 달하는 등 좋은 평가를 받았다""고 했다.카카오는 국민 모빌리티 플랫폼으로 자리 잡은 카카오T 앱과의 시너지를 이번 유상 자율주행 서비스의 장점으로 꼽는다. 카카오모빌리티 관계자는 ""별도 앱 설치 필요 없이 편하게 이용할 수 있다""며 ""또 지금까지 택시나 내비게이션 서비스 등을 통해 축적한 노하우를 통해 배차나 승하차 지점, 경로 등을 최적으로 안내할 수 있다""고 했다. 이 관계자는 ""우리가 불특정 다수를 대상으로 서비스하지 않는 이유는 기술적인 문제보다는 아직 차량 대수가 한정적이기 때문이다""라며 ""많은 이용자가 몰렸다가 쓰지 못하면 사용성 측면에서 만족도가 낮아질 수 있지 않느냐. 앞으로 공급이 충분해지면 누구든지 이용할 수 있도록 열어 놓을 수 있다""고 했다.   쏘카 자율주행 시범 운행. /쏘카, 라이드플럭스카카오와 쏘카 모두 점차 운행 지역과 이용 대상을 확대할 계획이다. 카카오는 올해 상반기 중으로 자체 제작한 자율주행 차량으로 서비스를 선보일 준비를 하고 있다. 쏘카는 지속적인 기술개발을 통해 자율주행 운영 지역을 제주뿐만 아니라 다른 도시로도 확대해 나간다는 목표다. 먼저 올해 안으로 제주 전역 주요도로(왕복 400㎞)와 세종시에서도 서비스를 출시하려 하고 있다. 쏘카가 세종시까지 진출하면 앞서 자리 잡은 카카오와 한판 붙게 되는 셈이다.김현명 명지대 교통공학과 교수(스마트모빌리티 연구센터장)는 ""아직 자율주행차 시장은 승객 수요에 따라 시시각각 경로가 바뀔 경우의 기술적 완성도나, 사고 등 법률상 문제가 발생했을 때의 책임소재, 보험사의 보험 적용 범위 등 아직 풀어야 할 숙제가 많다""고 말했다. 김 교수는 ""다만 이번에 무료에서 유상으로 확대된 것은 이제 돈 받고 서비스를 할 만큼 질적으로 자신이 있다는 것""이라면서 ""우리 자율주행차 기술이 한 단계 올라갔다는 의의가 있다""고 했다.   카카오모빌리티 자율주행 시범 운행. /카카오모빌리티[박현익 기자 beepark@chosunbiz.com] ▶네이버에서 '명품 경제뉴스' 조선비즈를 구독하세요▶[단독] 우리은행, 라임펀드 돌려막기 시도… 他 금융사 유인전략 논의▶新기술 '고도화' 경쟁… 자율주행차·플라잉카 상용화 성큼 	저작권자 ⓒ 조선비즈, 무단 전재 및 재배포 금지"
2021.01.05.,4월부터 카카오 택시요금 사업자가 정한다,https://n.news.naver.com/mnews/article/469/0000568657?sid=102,"서울시, 택시업계 규제 대폭 완화플랫폼 사업자 택시요금 신고제 전환무사고 5년이면 개인택시 운행 가능도택시잡기 전쟁 해소 기대… 안전 우려도4일 서울역 인근에서 택시들이 손님을 태우기 위해 길게 줄지어 대기하고 있다. 뉴시스카카오ㆍ타다ㆍ마카롱 등 플랫폼가맹택시 사업자들이 오는 4월부터 요금을 스스로 정할 수 있게 된다. 가격경쟁에 따른 요금 인하를 기대해 볼 수 있지만 '고급 대중교통'과는 거리가 멀어지고 있는 국내 택시의 서비스 질 개선으로 이어질지 주목된다. 일반인도 5년간 무사고 운전경력만 있으면 개인택시를 운행할 수 있게 된 점도 이 같은 기대에 힘을 싣는다.서울시는 4일 ""개정된 여객자동차운수사업법 시행(4월 1일)에 앞서 택시업계 규제를 대폭 완화한다""고 밝혔다. 이에 따라 올해부턴 법인택시 운전경력이 없어도 무사고 운전경력 5년에 한국교통안전공단에서 실시하는 40시간의 교통안전교육을 이수하면 개인택시 면허를 얻을 수 있다. 이전까진 법인택시를 3년간 무사고로 몰아야 개인택시 면허 양수자격을 얻을 수 있었다. 다만 과거에 1년 이상 서울에서 운전했거나, 1년 이상 서울에 계속해서 거주해야 한다.개인택시 면허취득 문턱이 낮아지면 '택시잡기 전쟁'은 일정 부분 해소될 것으로 기대된다. 개인택시 기사들의 평균 연령은 62.2세로, 고령의  개인택시 운전기사들이 심야운행을 피하면서 불거진 문제다.일각에선 서울시의 이번 조치로 택시의 안전성이 우려된다고 지적한다. 지난해 개정안 공포 당시 전국택시노동조합연맹 등 택시단체는 “숙련도와 전문성 없는 운전자가 자격을 취득하면 사고 위험이 높아진다”며 반발한 바 있다. 서울시 관계자는 이에 대해 “교통안전공단 교육을 받기 때문에 안전도 담보될 것으로 본다”고 말했다.가장 큰 변화는 요금 자율화다. 현재 플랫폼가맹택시 사업자는 일반 택시요금에 카시트 설치ㆍ자전거 운송 등에 따라 별도의 부가서비스료를 받고 있는데, 자율신고 요금제가 적용되는 4월부터는 사업자가 운행요금을 정하고 서울시나 국토교통부에 신고하면 된다. 서울시 관계자는 “현재 자율신고 요금제가 도입된 고급택시나 대형승합택시는 탄력요금제를 운영하고 있다”며 “플랫폼가맹 중대형 택시에 적용된 해당 요금제는 ‘메기’ 역할을 해서 택시 서비스 향상과 요금 하락을 이끌 것”이라고 전망했다. 미꾸라지 논에 메기를 한 마리 풀어 놓으면 미꾸라지들의 생존율과 품질이 좋아진다. 현재 서울에선 6개의 플랫폼가맹 사업자가 1만2,000여대의 가맹택시를 운행 중이다.서울시는 또 법인택시에 대해서도 개인택시와 동일하게 흰색, 회색, 꽃담황토색 중 한 가지 색깔을 차량 외관에 칠할 수 있도록 했다. 2010년 당시 오세훈 시장이 도입했지만, 개인택시사업자의 반발로 전체 택시로 확대되지 못하고 법인택시만 의무 적용해 사업자간 형평성 논란이 제기돼왔다. 법인택시 사업자가 중형택시에서 대형이나 고급택시로 면허를 전환할 때 필요했던 법인택시 사업경력 3년 기준도 폐지된다.김기봉 서울시 택시물류과장은 “불필요한 규제를 완화해 시민들은 편안하고 다양한 서비스를 이용하고, 택시사업자는 비용을 줄일 수 있게 했다”며 “침체된 택시산업이 활성화할 수 있도록 앞으로도 적극 지원할 계획”이라고 말했다.변태섭 기자 libertas@hankookilbo.com▶ [독자 참여] 엄마의 이야기 보내주세요▶ [코로나 1년] 아이들 두고 의료봉사 갔다 확진 ""노모의 눈빛이...""▶ 한국일보닷컴 바로가기"
2021.01.05.,"카카오 보험, 게임체인저? 찻잔 속 태풍?",https://n.news.naver.com/mnews/article/374/0000229759?sid=101,"[앵커]카카오페이가 '디지털 손해보험사' 설립을 위한 본격적인 행보에 나섰습니다.올 하반기 출범을 목표로 담금질하고 있는데, 고객 수와 기술력을 갖춘 IT 공룡의 등장에 보험업계가 바짝 긴장하고 있습니다.김성훈 기자의 보도입니다.[기자]카카오페이가 팔려는 '디지털 보험'은 온라인과 모바일에 특화된 보험입니다.카카오페이는 ""국내 최초 핀테크 기업이 만드는 보험인 만큼, 합리적이고 차별화된 보험상품을 선보이겠다""고 밝혔습니다.디지털 보험은 보험 가입을 돕는 보험 설계사가 없다 보니 보험 구성이 단순하고 보험료도 저렴한 '미니보험'이 주를 이뤄왔습니다.실제로 앞서 시장에 진출한 디지털 손해보험사들은 가입 시 고려사항이 많지 않은 펫보험이나, 낚시와 등산 등 레저활동에 맞춰 일별로 가입이 가능한 단기 상해보험 등을 선보였습니다.소액 보험 판매에 그치다 보니, 보험업계 전반에 미친 영향도 미미했다는 평가입니다.[A 보험업계 관계자 : (디지털 보험사가) 대부분 판매하는 상품이 가볍게 접근할 수 있는 보험들이거든요. 전통적인 암 보험, 건강보험 그런 건 많이 판매되고 그렇지는 않아요.]하지만, 고객 수와 인지도, IT 기술력을 갖춘 카카오페이는 얘기가 다릅니다.축적한 데이터를 바탕으로 개개인이 필요로 하는 맞춤형 보험을 내놓을 수 있는 위협적인 경쟁자이기 때문입니다.[B 보험업계 관계자 : 가지고 있는 고객들이라든지 규모를 봤을 때는 저희도 긴장 안 할 수 없죠. 전국민이 하는 카카오고, 플랫폼이 워낙 좋으니까 (고객을) 뺏길까 봐….]우려와 기대를 받으며 카카오뱅크를 '메기'로 성공시킨 카카오가 보험으로 새로운 시험대에 올랐습니다.SBS Biz 김성훈입니다. 김성훈 기자(here@sbs.co.kr) ▶ 돈 세는 남자의 기업분석 '카운트머니' [네이버TV]▶ 경제를 실험한다~ '머니랩' [네이버TV]저작권자 SBS미디어넷 & SBS I&M 무단전재-재배포 금지"
2021.01.05.,2040 여성 공감 얻은 카카오TV '며느라기' 1천만뷰 돌파,https://n.news.naver.com/mnews/article/001/0012119828?sid=106,<구조 다름>
2021.01.05.,"카카오, 높은 日 디지털만화 성장성…목표가↑-유안타",https://n.news.naver.com/mnews/article/018/0004821208?sid=101,"[이데일리 양희동 기자] 유안타증권은 5일 카카오(035720)가 ‘기다리면 무료’ 모델로 국내는 물론 일본시장에서도 큰 성공을 거뒀다고 평가했다. 투자의견은 ‘매수’(BUY)를 유지하고 목표주가는 42만원에서 44만 6000원으로 6.2% 상향했다. 카카오의 현재 주가는 지난 4일 종가 기준 39만 6000원이다.카카오는 2013년 3월 카카오페이지란 이름으로 모바일 컨텐츠 플랫폼을 출시했지만, 직원의 50%를 구조 조정할 정도로 트래픽과 수익화에 실패했다. 하지만 2014년 11월 ‘기다리면 무료’ 모델이 대성공을 이루며, 한달 만에 DAU는 20만명에서 90만명으로, 월 거래금액은 13억원에서 75억원으로 급증했다. 일본시장(픽코마)에도 ‘기다리면 무료’ 도입, 단행본 위주의 일본 디지털 만화시장에서 연재형 웹툰이 크게 성공했다. 지난해 3분기 기준 거래액은 1300억원으로 전분기 대비 44%, 전년동기 대비 247% 성장했다.이창영 유안타증권 연구원은 “픽코마에서 공급하는 만화 중 국내IP는 작품수 기준 전체의 1.3% 밖에 되지 않지만 이 작품들이 매출의 35~40%를 차지한다”며 “국내에서 검증된 스토리가 일본에서 흥행했다”고 설명했다.픽코마의 총 4만여 개 연재작 중 웹툰은 400개, 전체의 1%에 불과하고, 나머지는 모두 일본의 기존 출판물을 스캔한 ‘디지털코믹’ 작품들이다. 반면 픽코마 전체 거래액에서 웹툰이 차지하는 비중은 45%에 달하고 있다. 일본 디지털 만화는 종이 만화를 스캔한 형태를 모바일에서 필요시 손으로 화면 확장해 가며 구독하는 형태여서 가독성이 낮은 반면, 국내 업체들의 웹툰은 한 화면에 꽉 찬 컬러풀한 화면을 자동 스크롤 형태로 구독하는 편리한 방식이다.이 연구원은 “일본 디지털만화 시장에서 웹툰이 차지하는 비중이 여전히 5% 미만이어서 향후 성장 가능성은 매우 크다”며 “일본 만화시장은 5000억엔 (약 5조 7000억원 규모)인데 이 중 디지털만화 앱(App)시장 697억엔, 디지털만화 웹 시장 1896억엔으로 일본 디지털만화 시장이 전체 일본 만화시장에서 차지하는 비중은 52%”라고 전했다. 이어 “픽코마의 일본 만화 시장 내 점유율이 아직 8%에 불과하기 때문에 성장 가능성이 매우 높다는 판단한다”고 덧붙였다.이 연구원은 “픽코마와 카카오페이지의 국내·외 높은 성장성, 2차 컨텐츠로의 확장가능성을 감안해 2021년 예상거래액에 글로벌 컨텐츠 기업 2021년 평균 PSR 4.8배를 적용(픽코마는 벨류에이션 프리미엄 50% 부여)하고 기업가치를 각각 5조원, 1.9조원으로 산정했다”고 말했다.양희동 (eastsun@edaily.co.kr)▶ #24시간 빠른 #미리보는 뉴스 #eNews+▶ 네이버에서 '이데일리 뉴스'를 만나보세요▶ 빡침해소, 청춘뉘우스 '스냅타임'＜ⓒ종합 경제정보 미디어 이데일리 - 무단전재 & 재배포 금지＞"
2021.01.05.,"카카오·토스의 진격… 보험사들 ""나 떨고 있니?""",https://n.news.naver.com/mnews/article/417/0000640005?sid=101,"빅테크의 보험시장 진출에 기존 보험사들이 긴장하고 있다./사진=뉴스1 “긴장된다.” 카카오페이와 토스의 보험업 진출에 대한 한 대형 보험사 관계자의 토로다. 최근 카카오페이와 토스가 각각 플랫폼을 활용한 손해보험사 설립, 보험 법인대리점 설립 등 각기 다른 경로로 보험시장 공략에 나섰다. 보험업계에선 “보험권도 빅테크와 크게 부딪히는 것 아니냐”는 우려가 나오고 있다.  최근 가장 큰 이슈는 카카오페이의 손해보험사 설립이다. 지난해 상반기 삼성화재와 합작이 무산된 이후 카카오페이는 단독 보험사 설립을 추진해 왔다.  실제 카카오페이는 지난 4일 금융당국에 디지털 손해보험사 설립 예비인가를 신청하면서 첫 발을 내딛었다. 카카오페이의 디지털 손해보험사는 올해 하반기 최종 승인과 출범을 목표로 예비인가 승인·법인 설립·본허가 승인 등 행정 절차를 밟을 계획이다.  이 보험사는 국내 최초 핀테크 주도 디지털 손해보험사를 표방하고 일상 속 위험으로부터 사용자를 보호하는 '인슈어테크'(InsurTech·보험과 첨단기술의 접목)로 보험에 대한 인식 개선 및 보험 사각지대 해소에 주력할 계획이다. 카카오페이의 경쟁력은 카카오톡을 통해 유입된 2030세대 고객이다. 보험연구원에 따르면 2019년 12월까지 손해보험에 가입한 2030세대 비율은 평균 70%대로 4050세대에 비해 10%포인트 이상 낮았다. 보험업계에서는 차후 카카오페이가 소비자 맞춤형 미니보험 등 독특한 비대면 보험 상품으로 젊은 세대를 공략할 것이란 관측이 나온다.  토스는 보험 법인대리점(GA) 성격의 자회사인 ‘토스인슈어런스’ 법인을 이미 공식 출범시켰다.  토스인슈어런스는 비대면 맞춤 보장분석과 상담 서비스를 제공하는 TM(텔레마케팅) 보험설계 조직이다. 고객이 토스 애플리케이션의 ‘내 보험 조회’ 서비스에서 이미 가입된 보험내역을 확인하고 설계사 상담을 받고 싶은 경우 ‘분석받기’를 누르면 토스인슈어런스 보험분석매니저에게 연결되는 구조다. 보험분석매니저는 토스 애플리케이션(앱)을 통해 보험 상담을 신청한 고객에게 맞춤 보장 분석 및 상담을 제공하는 직군이다. 경력직 위촉 계약이 일반적인 보험 법인대리점(GA)과 달리 토스인슈어런스는 보험업계 관련 경력이 없어도 누구나 지원할 수 있다. 토스가 추구하는 보험업의 가장 큰 특징은 ‘전문적인 설계사’ 채용이다. 이를 위해 토스는 지난해 7월 업계 최초로 보험설계사를 정규직으로 공개 채용한 데 이어 30여명을 추가 채용했다. 토스인슈어런스 측은 ""대기업 인사팀, 해외 금융사, 게임회사 디자이너 출신 등 다양한 배경과 경력을 가진 20~30대 밀레니얼 세대가 대거 합류했다""며 ""지난 10월부터 실무에 투입된 이들은 판매 위주의 보험 설계 관행에서 탈피해 다양한 연령대의 고객들에게 각자의 상황에 맞는 깊이 있는 상담 경험을 제공하고 있다""고 했다. 카카오페이와 토스는 향후 정보 주체의 동의 하 한 금융 앱에서 흩어져 있는 모든 금융정보를 불러올 수 있는 ‘마이데이터’ 사업 진출을 목표로 한다.  이들의 보험업 진출은 단순히 보험영업이익뿐 아니라 고객 의료·보험 데이터를 수집해 더 고도화한 마이데이터 서비스를 내놓기 위한 발판으로 보인다. 보험업계 관계자는 “이미 고객 수가 상당한 빅테크 플랫폼에 보험업계가 종속될 가능성도 있다”고 말했다.  전민준 기자 minjun84@mt.co.kr▶뜨거운 증시, 오늘의 특징주는?  ▶거품 뺀 솔직 시승기▶머니S, 네이버 메인에서 보세요 <저작권자 ⓒ '성공을 꿈꾸는 사람들의 경제 뉴스' 머니S, 무단전재 및 재배포 금지>"
2021.01.05.,"카카오TV, 구독료 대신 ‘시간차 유료’ 방식 택한 이유",https://n.news.naver.com/mnews/article/138/0002097052?sid=105,"[디지털데일리 권하영기자] “카카오TV 경쟁자는 유튜브?”카카오TV가 본격적인 과금모델 구상에 나섰다. 현재 일부 콘텐츠를 대상으로 무료 선공개 후 일정 시간이 지나면 유료로 전환하는 방식을 택하고 있다. 넷플릭스 등 구독료(SVOD) 기반의 경쟁 온라인동영상서비스(OTT)들과 달리, 구글 유튜브와 유사한 광고(AVOD) 기반의 새로운 비즈니스모델을 구체화할 것으로 보인다.5일 관련업계에 따르면 카카오TV는 최근 ‘며느라기’ ‘도시남녀의사랑법’ 등 일부 오리지널 콘텐츠의 다시보기(VOD) 서비스를 유료화했다. 콘텐츠 첫 공개 이후 일주일간은 무료로, 그 이후에는 회차당 500원을 결제하고 일주일간 시청할 수 있다.카카오 관계자는 “이용자들이 양질의 콘텐츠를 지속적으로 즐길 수 있도록 하기 위함”이라며 “추후 유료화 대상을 확대할 것인지는 확정된 바 없다”고 밝혔다.그동안 카카오TV가 어떤 수익모델을 꾀할 것인지 OTT업계 안팎으로는 의견이 분분했다. 웨이브를 운영하는 콘텐츠웨이브의 이희주 실장은 “웨이브가 넷플릭스 대항마를 자처하고 있다면 카카오TV는 유튜브 대항마로 커줬으면 하는 바람이 있다”며 카카오TV가 유튜브와 같은 AVOD 형태 서비스가 될 것이라고 봤다. 박태훈 왓챠 대표는 그러나 “카카오TV도 웨이브처럼 SVOD를 고려 안했을 리 없다”며 “앞으로 카카오가 어떤 형태로 SVOD를 론칭할지 지켜봐야 한다”고 언급하기도 했다.카카오TV의 이번 유료화 정책은 표면적으로 건당결제(TVOD)를 도입한 것이지만, 궁극적으로는 AVOD 기반의 광고 수익을 강화하는 것으로 보여진다.당초 카카오TV는 월정액을 내고 보는 SVOD 형태의 넷플릭스나 웨이브와 달리, 콘텐츠에 5초 분량의 광고를 포함시켜 무료로 제공하는 AVOD 서비스를 해왔다. 이번에는 일부 콘텐츠에 한해 무료 선공개 후 유료로 전환하는 방식을 택했다. 하지만 카카오페이지와 같이 일정 시간이 지나 유료 콘텐츠를 무료화하는 것과는 반대 양상이다. 이는 초반 시청 유입을 극대화하기 위함으로 업계는 풀이하고 있다. 콘텐츠업계 한 관계자는 “초반에만 무료로 하면 선공개 콘텐츠에 조회수를 더 집중시킬 수 있고, 자연히 그에 따른 광고 수익도 커진다”고 분석했다.유튜브 프리미엄과 같이 별도의 구독형 서비스를 출시하는 방안도 고려된다. 또 다른 업계 관계자는 “카카오TV는 카카오라는 플랫폼 경쟁력을 바탕으로 AVOD 서비스를 하기에 가장 적합하고, 나중에 미디어 커머스 사업으로도 영역을 확장할 수 있다”면서 “따라서 SVOD로 전환하기보다는 지금처럼 유료 콘텐츠를 점차 확대해 SVOD와 투트랙으로 갈 가능성도 있다”고 말했다.실제, 카카오TV는 추가 수익원 발굴에 고심하고 있다. 신종수 카카오M 디지털콘텐츠사업본부장은 카카오TV 론칭 당시 “넷플릭스나 유튜브와 맞짱 뜨려고 하는 게 아니라 고객과 시장의 니즈를 보고 새로운 영역을 개척하려고 한다”며 ▲광고 ▲커머스 ▲지적재산권(IP) 세일즈 등 다양화된 수익화 모델을 검토하겠다고 밝힌 바 있다.<권하영 기자>kwonhy@ddaily.co.kr▶ 네이버에서 디지털데일리 채널 구독하기▶ IT정보의 즐거운 업그레이드 [딜라이트닷넷]<저작권자 © 디지털데일리 무단전재-재배포금지>"
2021.01.05.,카카오 보험 진출에 들썩이는 보험업계,url없음,<네이버 기사 없음>
