기사날짜,기사제목,네이버 뉴스 url,기사내용
2021.01.14.,"열방센터의 치밀한 은폐…""제주도에 있는 것처럼""",https://n.news.naver.com/mnews/article/214/0001093054?sid=102,"[뉴스데스크]◀ 앵커 ▶그런데 열방센터를 운영하는 인터콥이 당국의 연락을 피하는 정도가 아니라 아예 행적을 조작하도록 지시한 정황이 확인됐습니다.바로, 제주의 관광지에서 사용하는 제주 안심 코드의 사진을 조직적으로 사용하게 했다는 건데요.김찬년 기자가 취재했습니다.◀ 리포트 ▶연말연시 특별방역대책이 시작된 지난달 24일.개신교 선교단체인 인터콥 신도들에게 이메일 한통이 도착합니다.발신인은 '인터콥 서울', BTJ 열방센터를 운영하는 인터콥 서울본부 관계자로 추정됩니다. 'BTJ 열방센터 참석시 필독'이라는 지시 사항 1번은 '제주안심코드'라는 어플리케이션을 다운받으라는 겁니다. 확진자의 동선을 추적하기 위해 제주도에서 운영하는 전자출입명부인데, 관광지 같은 특정 장소의 QR코드를 찍으면 방문 사실이 인증되는 방식입니다. 이 앱을 이용해 실제로는 경북 상주 열방센터에 있으면서, 그 기간 제주도에 방문한 것처럼 휴대전화 위치 정보를 조작하라는 겁니다.제가 서 있는 곳은 제주공항 근처로 성산일출봉에서 40km 이상 떨어진 곳인데요.하지만 사진으로 찍어둔 성산일출봉 QR코드를 이렇게 안심코드 앱으로 촬영하면 성산일출봉을 방문한 것으로 기록에 남습니다.실제 하루 평균 2천 건 안팎이던 제주안심코드 다운로드 건 수는 메일이 발송된 지 나흘 뒤 2만 5천 건으로 10배 이상 증가했습니다.조작에 사용할 제주 지역 QR코드는 인터콥 제주지부에서 제공하고, 카카오톡 비밀채팅방을 통해 공유된 걸로 추정됩니다.열방센터에 방문할 때 미리 휴대전화를 끄고, 집에 돌아갈 때까지 절대 휴대폰을 켜지 말 것.사진 촬영과 외부인 접촉 금지도 방문자들이 지켜야 할 필수사항이었습니다. [임태봉/제주도 재난안전대책본부 통제관]""장소를 이동했을 때 문제점이 있는 건 사실입니다. 그 문제점을 보완하기 위해 GPS 기능을 보완할 예정이고요.""상주 열방센터에 직접 방문했던 제주도민 39명 가운데 아직 확진 판정 받은 사람은 없지만, 6명은 연락이 닿지 않고 있습니다. 정부는 열방센터 측의 진단검사 거부 등 방역법 위반 행위를 절대 용납하지 않겠다고 강조했습니다. MBC뉴스 김찬년입니다.(영상취재: 김승범(제주)  / CG : 강한)MBC 뉴스는 24시간 여러분의 제보를 기다립니다. ▷ 전화 02-784-4000▷ 이메일 mbcjebo@mbc.co.kr▷ 카카오톡 @mbc제보[연관기사]1. ""휴대전화 꺼라""…금속탐지기로 소지품 검사도2. 열방센터의 치밀한 은폐…""제주도에 있는 것처럼""김찬년 기자[저작권자(c) MBC (https://imnews.imbc.com) 무단복제-재배포 금지]▶ 네이버 홈에서 [MBC뉴스] 채널 구독하기▶ 새로움을 탐험하다. ""엠빅뉴스""▶ [M라운지] 편안한데 찰진 수다의 공간Copyright(c) Since 1996, MBC&iMBC All rights reserved."
2021.01.14.,"정인이가 다녔던 키즈카페 사장 “양모, 입양축하금 짜다고…”",https://n.news.naver.com/mnews/article/018/0004828189?sid=102,"[이데일리 김소정 기자] 16개월 된 입양아 정인이를 학대해 숨지게 한 혐의를 받는 양모 장모씨에게 불리한 증거와 증언들이 이어지고 있다.   키즈카페 운영자 A씨가 네이버 지식인에 올린 글 (사진=네이버 지식인)누리꾼 A씨는 13일 네이버 지식인을 통해 “장씨가 자주 왔었던 키즈카페 운영자다”라며 “오늘 재판을 보고 너무나 가슴이 답답하고 마음이 아파서 어디에 글을 올려야 할지 몰라 일단 쓴다”라고 입을 열었다. 이어 “코로나로 작년 5월에 폐업해 CCTV를 폐기한 게 너무 한이 된다. (장씨가) 친딸을 데리고 오픈 후 1년 내내 일주일에 한 번, 2주에 한 번씩은 늘 왔었다. 정인이 입양 후에는 지인들과 입양파티도 했다”라고 덧붙였다. A씨는 “장씨는 케이크 사 온다며 나갔다. 들어올 때 보니 5~6000원짜리 초코 케이크였다. 정인이는 테이블과 멀리 떨어진 곳에 양부 안모씨와 있었고 입양 축하 노래 부른다며 친딸만 여러 차례 불렀다. 친딸이 자리에 앉자 ‘생일축하합니다’를 ‘입양축하합니다’라고 개사해서 불렀다. ‘사랑하는 우리 안XX 언니된 걸 축하합니다’라고 하고선 자기들끼리 음식 먹고 놀았다”라고 주장했다. 16개월 된 입양 딸 정인 양을 학대해 숨지게 한 혐의를 받는 양부모의 첫 재판이 열린 13일 서울남부지법에서 양모가 탄 호송차가 법원을 빠져나가고 있다. (사진=이데일리 이영훈 기자)이어 “정인이는 9개월 때 소파를 잡고 걸을 줄 알았다. 호기심이 많았는지 소파 잡고 걸으며 여기저기 다니며 놀았다. 그런데 장씨는 자기 일행과 먹거나 폰만 들여다보고 정인이는 그 자리에 없는 아이처럼 전혀 케어하지 않았다”라고 지적했다. 그러면서 “(정인이가) 이것저것 만지다 자기 머리를 만지면 장씨는 ‘이거 만지는 거 아니야!’라고 버럭 소리를 지르기도 했다”고 말했다.또 “정인이가 걷다가 휘청거리고 앞으로 고꾸라져 크게 운적이 있는데 같이 온 친구 엄마가 놀라서 ‘애기가 엎어졌다’고 했는데 장씨는 ‘쟤 원래 잘 울어요. 놔두면 알아서 그쳐요’라고 말하며 그대로 냅뒀다”라고 전했다. A씨는 “장씨가 일행과 밥 먹는 동안 정인이가 쇼파에서 자다 바닥으로 쿵 떨어져 자지러지게 운 적도 있다. 울길래 가보니 두꺼운 패딩 점퍼 모자로 정인이 얼굴을 푹 뒤집어 씌워놓고 모자 안에는 가재손수건으로 또 덮어놨길래 ‘왜 이렇게 얼굴을 씌우냐’고 하니 ‘빛을 보면 애가 잠을 못 잔다’고 했다”고 말했다. 정인이 양모 장모씨 (사진=연합뉴스)이어 “다른 엄마들이 정인이를 보고 ‘몇 개월 됐냐’고 물어보면 ‘제가 입양한 둘째다’라고 늘 입양을 강조했다. 입양하고 일주일쯤 정인이를 데리고 와서는 ‘강서구는 입양 축하금을 200만원 밖에 안 준다. 너무 짜게 준다’고 했다. 입양 축하금이 있는지도 몰랐다”라고 덧붙였다. 그러면서 “2019년 11월에 제가 장씨 살고 있는 신월도 A아파트로 이사했고 12월에 같이 망년회를 했다. 장씨랑. 그때 A아파트는 얼마냐라고 하길래 제가 얼마라고 하니 ‘우리 사는 전세가 기한이 다 되어서 이사가야 되는데 우리는 거기로 이사할 돈이 없다’고 했다. 그러더니 2020년 1월 정인이 입양되고 2월에 A아파트를 매매했다면서 ‘남편이 돈이 된대요’라고 엄청 좋아했다”라고 말했다. A씨는 “(키즈카페) 폐업 후에는 종종 아파트 앞 놀이터에서 봤었다. 그때마다 정인이는 유모차에 인형처럼 움직임도 별로 없고 표정도 없고 옹알이도 별로 없어서 얌전하다고 생각했다. ‘아이가 순하다’ ‘’유모차에 어떻게 이렇게 얌전히 잘 있냐‘라고 물으니 장씨가 ’자기가 이렇게 되게끔 훈련시켰죠‘라고 웃으며 말했다”라고 말했다. A씨는 지난 2일 방송된 SBS ’그것이 알고 싶다‘ 제작진과도 인터뷰를 진행했었다. 하지만 장씨와 관련된 CCTV가 폐기된 상태고, 장씨와 주고받은 카카오톡 내용도 A씨가 휴대전화를 초기화하면서 사라졌다. A씨는 “목격담 외에 증거물로 제출할 수 있는 게 없어서 너무나 안타깝다”라며 “정인이의 고통스러웠던 짧은 생에 너무 마음이 아프고 죄스럽다. 증거물은 없지만 저의 목격담이 제대로 된 처벌을 받을 수 있게 되는데 아주 작은 보탬이 됐으면 하는 간절한 마음뿐”이라고 말했다. 전날에는 장씨가 정인이가 탄 유모차를 거세게 미는 CCTV 영상이 공개돼 충격을 줬다. 해당 영상은 양부 회사 직원이 정인이 사망 소식을 듣고 경찰에 제보한 것으로 알려졌다. TV조선 뉴스 영상 캡처.지난해 8월에 찍힌 영상에서 장씨는 정인이가 탄 유모차를 세게 밀었고, 이 충격으로 정인이의 목이 꺾였다. 유모차는 그대로 벽에 부딪혔다. 정인이는 불안한 듯 유모차 손잡이를 꼭 붙잡았다. 한편 13일 첫 재판에서 양부모는 정인이를 방치하거나 학대할 의도는 없었다고 주장하며 검찰이 적용한 혐의를 대부분 부인했다. 이날 검찰은 아동학대치사 등의 혐의로 기소된 장씨에게 살인 혐의를 추가 적용했다.양부모 측 변호인은 “(사망 당일) 정인양이 밥을 먹지 않아 그날따라 더 화가 나서 평상시보다 좀 더 세게 누워 있는 정인양의 배와 등을 손으로 때리거나 떨어뜨린 사실이 있지만, 췌장이 끊어질 정도로 강한 근력을 행사한 사실은 없다”고 말했다.이어 “장씨가 정인양을 떨어뜨린 이후 곧바로 안아 올려 다독였고 괜찮은 것으로 보여 자리를 비웠지만, 돌아와 보니 정인양 상태가 심각해 보여 병원으로 이동했으나 사망했다”며 “일부 폭행 또는 과실로 인한 행위와 사망에 인과관계가 있을 순 있지만, 고의적으로 사망에 이르게 한 건 아니었다”고 강조했다.김소정 (toystory@edaily.co.kr)▶ #24시간 빠른 #미리보는 뉴스 #eNews+▶ 네이버에서 '이데일리 뉴스'를 만나보세요▶ 빡침해소, 청춘뉘우스 '스냅타임'＜ⓒ종합 경제정보 미디어 이데일리 - 무단전재 & 재배포 금지＞"
2021.01.14.,"NS홈쇼핑, '라방' 키운다…라이브커머스사업부 신설",https://n.news.naver.com/mnews/article/008/0004528697?sid=101,"[머니투데이 이재은 기자]  NS홈쇼핑 라이브커머스사업부 정유찬 이사NS홈쇼핑이 라이브커머스 사업에 본격 뛰어든다. NS홈쇼핑은 지난 1일자로 조직개편을 통해 라이브커머스사업부 조직을 신설하고 정유찬 이사를 사업부장으로 임명했다고 14일 밝혔다.이번 라이브커머스사업부는 기존 별도로 운영되던 '해라'와 '비머스' 조직을 한데 모아 사업부로 격상한 조직이다. 초대 라이브커머스사업부장에는 NS홈쇼핑 개국부터 PD로 근무하고 건강식품부터 무형상품까지 다양한 카테고리의 영상팀장을 역임한 정유찬 이사를 임명했다.이번 조직 개편과 임명은 라이브 커머스 사업 강화뿐만 아니라, TV홈쇼핑과 T커머스, 모바일 등 기존 채널과의 시너지를 높이기 위한 조치다. 2030 맞춤형 콘텐츠와 영상 제작을 통해 MZ(밀레니얼 세대와 Z세대의 합성어)세대의 소통과 공감을 강화하고, 기존 채널 소싱력을 활용해 맞춤형 상품을 개발함으로써 4050세대까지 만족할 수 있는 경쟁력을 확보한다. 여기에 NS홈쇼핑의 식품 노하우를 활용해 자체브랜드(PB) 및 공동기획제품(NPB) 가정간편식 상품을 출시하고 라이브 커머스를 통해 판매할 계획이다.여기에 NS홈쇼핑의 모바일 어플리케이션과 사회연결망서비스(SNS) 커머스 등 다양한 판매 채널과 융합한 방송을 선보일 계획이다. 예컨대 온라인몰의 '투데이 특가' 행사 등에 맞춰 라이브 방송을 진행한다. 상품 소개는 물론 추가 할인을 제공해 다양한 연령대 고객을 확보하고 기존 사업과의 시너지를 높일 것으로 회사는 기대하고 있다. 장기적으로는 누구나 손쉽게 1인 미디어 커머스 방송을 진행할 수 있는 자체 솔루션까지 구축한다는 계획이다.정유찬 NS홈쇼핑 라이브커머스사업 이사는 ""회사가 2021년 핵심성공요소로 제시한 소통, 상품, 디지털 트랜스포메이션을 백분 활용해 라이브 커머스의 경쟁력을 갖출 것""이라며 ""변화와 혁신을 통해 기존 채널과 시너지를 발휘하며, 미래 NS홈쇼핑의 주력 유통채널로 발전하도록 만들겠다""고 말했다.한편, NS홈쇼핑은 2019년 4월 MZ세대를 겨냥한 라이브방송 '띵라이브'를 개국했다. NS홈쇼핑 앱과 카카오TV, 유튜브, 인스타그램을 통해 방송하고 있다. 개국 당시 주 1회 방송에서 최근 주 4회로 확대했는데, 협력사 요청으로 지난해 12월 24회 진행했다. 이에 '띵라이브'의 매출은 지난해 기준 전년 대비 2배 이상 성장했다.이재은 기자 jennylee11@▶부동산 투자는 [부릿지]▶조 변호사의 가정상담소▶줄리아 투자노트 <저작권자 ⓒ '돈이 보이는 리얼타임 뉴스' 머니투데이, 무단전재 및 재배포 금지>"
2021.01.14.,"박성훈, 보궐선거 출마선언 ""세대교체, 경제시장""",https://n.news.naver.com/mnews/article/047/0002298880?sid=100,"부산시 경제부시장 사퇴하고 국민의힘 경선 가세[김보성 기자 kimbsv1@ohmynews.com]        ▲ ""젊고 강한 경제 시장"" 박성훈 전 부산시 경제부시장이 14일 전포동 카페거리에서 부산시장 보궐선거 출마를 공식 선언하고 있다.            ⓒ 김보성  국민의힘에 입당한 박성훈 부산시 전 경제부시장이 4.7 부산시장 보궐선거 당내 경선에 가세했다. 14일 출마를 공식 선언한 그는 ""강한 경제시장이 되겠다""고 밝혔다. 박 전 경제부시장은 이날 전포동 카페거리에서 출마선언문을 발표했다. 지난 3일 사퇴한 그는 하루 전인 13일 예비후보 등록을 거쳐 다음 날 바로 부산시장 도전을 공식화했다. 출마선언 장소로 전포동 카페거리를 선택한 이유로는 '변화'를 들었다. 전포동은 박 전 경제부시장이 태어나 자란 곳으로 낙후한 공구상가가 있는 곳이다. 그러나 최근 곳곳에 카페가 들어서고 청년들이 몰리면서 대표적 도시재생 공간으로 자리잡았다. 박 전 경제부시장은 과거에서 미래로 나아가기 위한 상징적 장소라고 했다. 박 전 경제부시장은 출마선언에서도 '경제', '세대교체', '변화' 등을 주요한 슬로건으로 내세웠다. 특히 자신의 이력을 살려 경제적 비전 제시에 상당 부분 공을 들였다. 1971년생으로 40대인 그는 기획재정부 공무원, 이명박·박근혜 정부 청와대 행정관, 더불어민주당 예산결산특별위원회 수석전문위원 등에 이어 이번 부산시 경제부시장까지 27년을 경제 관련 업무를 맡아왔다. 핵심공약으로는 ▲ 세계 최고의 스마트 시티(가칭 '카카오시티') ▲ 첨단·신성장 산업 중심의 실리콘비치 구축 ▲ 대기업과 글로벌 기업 유치를 통한 일자리 창출 ▲ 가덕도 신공항 건설 등 4가지 과제를 제시했다. 박 전 경제부시장은 ""부산 시민들은 고통받고, 어려운 부산 경제는 코로나19 사태로 앞이 보이지 않는다""면서 ""소득주도성장과 이념에 매달린 경제정책이 부산 경제를 무너뜨리고 있다""고 했다. 발표 형태로 진행한 출마선언 무대 뒤로는 '지금의 1년이 부산의 10년을 좌우한다'는 글귀가 걸렸다. 그는 ""지금은 젊은 힘과 과감한 도전, 뿌리부터의 변화가 필요하다""고 강조했다. 가덕도 신공항의 조속한 건설 또한 ""타당성을 입증해낸 주역으로 가장 빠른 패스트트랙에 올라타게 하겠다""고 약속했다. 여의도 정치와는 선을 그었다. 그는 ""경제는 전문가지만, 정치는 초보""라며 ""여의도의 언어도, 생리도, 저에게는 맞지 않는다. 낡은 정치의 시대와 과감하게 결별하겠다""고 말했다. 대신 '새로운 시민정치', '경제중심 정치의 새 시대'를 앞세워 ""젊고 강한 경제시장으로 승리하고, 내년 정권 교체의 교두보 만들겠다""고 밝혔다. 국민의힘 입당 배경을 묻는 질문에는 ""국민의힘은 새로운 부산을 만들 수 있는 원동력이라고 생각한다""고 의견을 말했다. 박 전 경제부시장의 출마로 국민의힘 부산시장 예비후보자는 박민식 전 의원, 오승철 대한인성학회 이사장, 유재중 전 의원, 이진복 전 의원, 전성하 LF에너지 대표, 박형준 동아대 교수, 김귀순 부산외대 명예교수, 이언주 전 의원(선관위 표기 순) 등 10명으로 늘어났다.              ▲ ""젊고 강한 경제 시장"" 박성훈 전 부산시 경제부시장이 14일 전포동 카페거리에서 부산시장 보궐선거 출마를 공식 선언하고 있다.            ⓒ 김보성  저작권자(c) 오마이뉴스(시민기자), 무단 전재 및 재배포 금지▶오마이뉴스 '시리즈'에서 연재하세요!▶교사·학부모 필독서 《삶을 위한 수업》▶오마이뉴스 취재 후원하기"
2021.01.14.,"버팀목자금 사흘간 236만 명, 85%에 지급",https://n.news.naver.com/mnews/article/055/0000867770?sid=101,"3차 재난지원금인 소상공인 버팀목자금이 지난 11일부터 어제(13일)까지 사흘간 전체 지원 대상의 약 85%인 236만 명에게 3조2천909억 원 지급됐습니다.버팀목자금은 내일(15일)까지 신청해야 지원받을 수 있습니다.중소벤처기업부는 아직 신청하지 않은 약 40만 명의 지원 대상자들에게 오늘 오후부터 카카오 알림톡으로 다시 안내할 예정이라고 밝혔습니다.실외 겨울 스포츠시설과 숙박시설, 지방자치단체가 추가한 집합금지와 영업제한 업체 등은 오는 25일부터 버팀목자금을 받을 수 있습니다.(사진=연합뉴스)김도식 기자(doskim@sbs.co.kr)▶ 코로나19 현황 속보▶ 네이버에서 SBS뉴스 구독하기※ ⓒ SBS & SBS Digital News Lab. : 무단복제 및 재배포 금지"
2021.01.14.,"카운터사이드 1주년, ""어려움 딛고 시즌2 시작""",https://sports.news.naver.com/news.nhn?oid=442&aid=0000128444,<구조 다름>
2021.01.14.,"여수시, 민원서비스 종합 평가 ‘최우수 기관’ 선정 쾌거",https://n.news.naver.com/mnews/article/081/0003155938?sid=102,"전남도 유일 최우수 등급…기관 표창 수상, 특별교부세 확보신속민원 쿨 기동처리반 운영, 민원조정위원회 설치 등 높은 평가여수시가 행정안전부 및 국민권익위원회 주관 2020 민원서비스 종합 평가에서 전남도에서 유일하게 최우수 기관에 선정됐다. 사진은 여수시청 청사.전남 여수시가 14일 행정안전부 및 국민권익위원회 주관 2020 민원서비스 종합 평가에서 전라남도에서 유일하게 최우수 기관에 선정되는 쾌거를 올렸다. 시는 이번 성과로 장관 기관 표창을 수상하고 특별교부세를 확보했다.행안부와 권익위는 선제적 민원서비스 제공을 위해 지난해 8월부터 12월까지 전국 304개 지자체 등을 대상으로 서면·현장·민원 만족도 등을 평가했다. 항목은 민원행정 관리기반, 민원행정 활동, 민원처리 성과 등 3개 분야, 5개 항목, 18개 지표로 구성됐다.시는 민원제도 운영, 고충민원 처리, 민원 만족도 등에서 높은 점수를 받았다. 특히 민원관련 부서 간 적극적인 협업을 통해 현장에 출동해 고충민원을 해결하는 ‘신속민원 쿨(Cool) 기동처리반’과 ‘카카오톡 민원 채널’을 운영해 시민으로부터 큰 호응을 받았다.‘민원조정위원회 설치 운영’, ‘행정정보 공동이용을 통한 서류제출 최소화’, ‘사회적 약자 배려 시설 마련’, ‘행복민원실 운영’ 등도 우수 시책으로 꼽혔다.시 관계자는 “시민중심 행정을 목표로 변화와 혁신을 지속적으로 추진하고 있다”며 “앞으로도 최고의 민원서비스 제공으로 시민 만족도를 높이겠다”고 말했다.여수 최종필 기자 choijp@seoul.co.kr▶ 네이버에서 서울신문 구독하기 클릭! ▶ 세상에 이런 일이 ▶ [연예계 뒷얘기] 클릭!ⓒ 서울신문(www.seoul.co.kr), 무단전재 및 재배포금지"
2021.01.14.,"버팀목자금 사흘간 236만 명, 85%에 지급",https://n.news.naver.com/mnews/article/055/0000867770?sid=101,"3차 재난지원금인 소상공인 버팀목자금이 지난 11일부터 어제(13일)까지 사흘간 전체 지원 대상의 약 85%인 236만 명에게 3조2천909억 원 지급됐습니다.버팀목자금은 내일(15일)까지 신청해야 지원받을 수 있습니다.중소벤처기업부는 아직 신청하지 않은 약 40만 명의 지원 대상자들에게 오늘 오후부터 카카오 알림톡으로 다시 안내할 예정이라고 밝혔습니다.실외 겨울 스포츠시설과 숙박시설, 지방자치단체가 추가한 집합금지와 영업제한 업체 등은 오는 25일부터 버팀목자금을 받을 수 있습니다.(사진=연합뉴스)김도식 기자(doskim@sbs.co.kr)▶ 코로나19 현황 속보▶ 네이버에서 SBS뉴스 구독하기※ ⓒ SBS & SBS Digital News Lab. : 무단복제 및 재배포 금지"
2021.01.14.,"카운터사이드 1주년, ""어려움 딛고 시즌2 시작""",https://sports.news.naver.com/news.nhn?oid=442&aid=0000128444,<구조 다름>
2021.01.14.,"여수시, 민원서비스 종합 평가 ‘최우수 기관’ 선정 쾌거",https://n.news.naver.com/mnews/article/081/0003155938?sid=102,"전남도 유일 최우수 등급…기관 표창 수상, 특별교부세 확보신속민원 쿨 기동처리반 운영, 민원조정위원회 설치 등 높은 평가여수시가 행정안전부 및 국민권익위원회 주관 2020 민원서비스 종합 평가에서 전남도에서 유일하게 최우수 기관에 선정됐다. 사진은 여수시청 청사.전남 여수시가 14일 행정안전부 및 국민권익위원회 주관 2020 민원서비스 종합 평가에서 전라남도에서 유일하게 최우수 기관에 선정되는 쾌거를 올렸다. 시는 이번 성과로 장관 기관 표창을 수상하고 특별교부세를 확보했다.행안부와 권익위는 선제적 민원서비스 제공을 위해 지난해 8월부터 12월까지 전국 304개 지자체 등을 대상으로 서면·현장·민원 만족도 등을 평가했다. 항목은 민원행정 관리기반, 민원행정 활동, 민원처리 성과 등 3개 분야, 5개 항목, 18개 지표로 구성됐다.시는 민원제도 운영, 고충민원 처리, 민원 만족도 등에서 높은 점수를 받았다. 특히 민원관련 부서 간 적극적인 협업을 통해 현장에 출동해 고충민원을 해결하는 ‘신속민원 쿨(Cool) 기동처리반’과 ‘카카오톡 민원 채널’을 운영해 시민으로부터 큰 호응을 받았다.‘민원조정위원회 설치 운영’, ‘행정정보 공동이용을 통한 서류제출 최소화’, ‘사회적 약자 배려 시설 마련’, ‘행복민원실 운영’ 등도 우수 시책으로 꼽혔다.시 관계자는 “시민중심 행정을 목표로 변화와 혁신을 지속적으로 추진하고 있다”며 “앞으로도 최고의 민원서비스 제공으로 시민 만족도를 높이겠다”고 말했다.여수 최종필 기자 choijp@seoul.co.kr▶ 네이버에서 서울신문 구독하기 클릭! ▶ 세상에 이런 일이 ▶ [연예계 뒷얘기] 클릭!ⓒ 서울신문(www.seoul.co.kr), 무단전재 및 재배포금지"
