기사날짜,기사제목,네이버 뉴스 url,기사내용
2021.01.20.,"3개월째 멈춘 박지윤 SNS, 조수용과 출산설… JYP 불화설에 ""성형수술 권유""",url없음,<네이버 기사 없음>
2021.01.20.,"‘개미는 오늘도 뚠뚠’ 강방천, 수익률 20000% 주인공…'국가부도의 날' 실제 인물",url없음,<네이버 기사 없음>
2021.01.20.,올해 해양수산분야 연구개발비 7825억원,url없음,<네이버 기사 없음>
2021.01.20.,동학개미 순매수에 시총 상위주 일제히 '빨간 불',https://n.news.naver.com/mnews/article/008/0004531184?sid=101,"[머니투데이 김소연 기자] 개인 순매수세에 시총 상위주들이 일제히 상승하고 있다. 20일 오전 9시18분 삼성전자는 전일대비 1400원(1.61%) 상승한 8만8400원을 나타내고 있다.SK하이닉스와 카카오, 현대모비스가 1%대 상승하고 있고 현대차, SK이노베이션은 2%대 강세다. '애플카'를 생산하게 될 것으로 알려진 기아차는 13%대 강세를 나타내면서 시가총액 10위권에 진입했다. 현대모비스가 11위로 물러났다. 이밖에 셀트리온도 3%대 상승하고 있고 LG화학, 삼성바이오로직스, NAVER는 강보합세다.이 시각 현재 개인이 코스피 시장에서 6389억원 사들이고 있다. 전날 대규모 순매수에 나섰던 외국인과 기관은 이날 2219억원, 4330억원 순매도하고 있다.  김소연 기자 nicksy@▶부동산 투자는 [부릿지]▶조 변호사의 가정상담소▶줄리아 투자노트 <저작권자 ⓒ '돈이 보이는 리얼타임 뉴스' 머니투데이, 무단전재 및 재배포 금지>"
2021.01.20.,"'라이브커머스 원조' 홈쇼핑, 라이브 방송 쟁탈전 시작됐다",url없음,<네이버 기사 없음>
2021.01.20.,"코스피, 개인 사자에 상승 마감…삼성전자, 기아차, LG화학, 삼성전자우, 삼성SDI, 카카오 등 상승 vs 현대차, 삼성바이오로직스, 셀트리온 등 하락 vs SK하이닉스, 네이버 보합",url없음,<네이버 기사 없음>
2021.01.20.,국민은행 극적 노사합의 배경은 ...,url없음,<네이버 기사 없음>
2021.01.20.,국민은행 극적 노사합의 배경은 ...,url없음,<네이버 기사 없음>
2021.01.20.,"스스로 진화하는 연결의 힘! '네이버, 구글, 페이스북'의 성공 요인",url없음,<네이버 기사 없음>
2021.01.20.,"조수용♥박지윤, 임신설과 출산설 동시에...'뭐가 진실일까' 나이차+재혼 관심↑",url없음,<네이버 기사 없음>
2021.01.20.,"군사법원, '박사방 공범' 이원호에 징역 12년 선고",https://n.news.naver.com/mnews/article/366/0000656116?sid=102,"텔레그램 '박사방 공범' 이원호가 지난해 8월 서울 관악구 수도방위사령부 보통군사법원에서 열린 1심 1차 공판에 출석하고 있다. /연합뉴스여성 성 착취물을 제작·유포한 텔레그램 '박사방' 공범인 육군 일병 이원호(21)가 1심에서 징역 12년을 선고받았다.20일 육군에 따르면 수도방위사령부 보통군사법원은 이날 아동 청소년성보호법 위반 등의 혐의로 구속기소된 이 일병에게 징역 12년, 신상정보 공개명령 7년 등을 선고했다. 항소 여부는 확인되지 않았다.이원호는 2019년 10∼12월 미성년자를 비롯한 여성을 대상으로 한 성 착취물을 텔레그램으로 배포한 혐의로 재판에 넘겨졌다.이외에 아동·청소년 음란물 4천911개를 다운로드해 자신의 휴대전화와 하드디스크 등에 저장했고, 카카오톡을 통해 음란물을 45회 배포한 혐의 등도 받았다.조주빈은 지난해 11월 1심에서 징역 40년을 선고받고 항소심을 앞두고 있다.[오유신 기자 run2u@chosunbiz.com] ▶네이버에서 '명품 경제뉴스' 조선비즈를 구독하세요▶사재기까지 등장한 종이박스… 인쇄업체는 비대면에 울상▶탈유황장치 장착률 1위 HMM, 저·고유황유 가격에 경쟁력 ↑	저작권자 ⓒ 조선비즈, 무단 전재 및 재배포 금지"
2021.01.20.,"""공항부터 감염전파 차단"" 고양시, 해외입국자 전용 숙소 운영",https://n.news.naver.com/mnews/article/003/0010303094?sid=102,"입국에서 검사, 입소까지 하루 만에 처리인천공항에서 숙소까지 입국자 전용 버스 이동 무증상 입국자 즉시 1~2일 간 격리방식 채택[고양=뉴시스]송주현 기자 = 경기 고양시는 증상이 없는 해외입국자가 입국할 경우 신종 코로나바이러스 감염증(코로나19) 선별검사 결과를 통보받을 때까지 머무를 수 있도록 기존 ‘안심숙소’를 활용, 해외입국자 전용 격리 생활시설로 운영한다고 20일 밝혔다. 고양시는 지난해 12월 29일부터 전국 지자체로는 처음으로 대학교(중부대) 기숙사를 활용, 가족 간 감염차단을 목적으로 안심숙소로 활용하고 있으며 ‘해외입국자 전용 안심숙소’는 일반 시민들과 구분된 격리 시설로 운영된다.최근 영국·남아공발 변이바이러스가 전 세계적으로 전파되고 있는 시점에서 무증상 해외입국자의 가족·지인간의 지역 내 감염확산을 선제적으로 차단하기 위한 강도 높은 방역조치다.고양시민 중 무증상 해외입국자는 코로나19 진단검사 결과가 나올 때까지 1~2일 동안 가족·지인 간 접촉을 멀리하고 안전하게 머무르는 안심숙소를 이용할 수 있다.시는 현재 덕양구 중부대학교 기숙사 101실 중 40실을 무증상 해외입국자를 위한 전용 숙소공간으로 확보했다.특히 시는 해외입국자가 인천공항에서 하루 4회 운행하는 논스톱 안심픽업 버스(매일 오전 10시, 오후 1시, 오후 4시10분, 오후 7시30분)에 탑승해 중부대 기숙사에 도착 후 검체검사를 마치고 곧바로 입소하는 ‘1Day FAST TRACK’ 방식으로 입국에서 검사·입소까지 하루에 마칠 수 있는 신속한 방역 표준모델도 함께 제시했다.  경기 고양시 안심숙소로 사용되는 중부대학교 기숙사.(사진=고양시 제공)이재준 고양시장은 ""수도권의 사회적 거리두기 연장조치와 설 연휴 특별방역대책을 앞두고, 해외입국자의 지역 내 감염을 최대한 차단하는 안전하고 신속한 정책이 필요했다”며 “모든 해외입국자는 증상이 없더라도 타인과의 접촉을 완전히 차단하면서 서로의 안전을 지켜 달라”고 당부했다.한편, 고양시 안심숙소 입소를 희망하는 입국 예정자와 동의를 받은 그 가족 또는 지인은 고양시 민원콜센터의 전화상담(031-909-9000)과 고양시 민원콜센터 카카오채널상담, 문자 상담 등을 통해 사전 예약신청을 할 수 있다．☞공감언론 뉴시스 atia@newsis.com▶ 네이버에서 뉴시스 구독하기▶ K-Artprice, 유명 미술작품 가격 공개▶ 뉴시스 빅데이터 MSI 주가시세표 바로가기<ⓒ 공감언론 뉴시스통신사. 무단전재-재배포 금지>"
2021.01.20.,"'기승전겜' 원스토어, 10분기 연속 거래액↑ '약진'",https://n.news.naver.com/mnews/article/031/0000580030?sid=105,"국내 3위 사업자 입지 다져…수수료 대폭 할인해 차별화 성공원스토어가 10분기 연속 거래액이 성장한 것으로 나타났다. [사진=원스토어][아이뉴스24 문영수 기자] 국산 앱마켓인 원스토어가 게임 콘텐츠의 약진에 힘입어 실적이 급등했다. 구글, 애플 등 과도한 수수료 요구로 논란을 빚고 있는 글로벌 사업자에 맞선 대안 플랫폼으로 확고히 자리매김한 모습이다.원스토어(대표 이재환)는 20일 지난해 4분기 역대 최대 실적을 재경신하며 10분기 연속 거래액 성장을 달성했다고 발표했다. 또한 2016년 창립 이후 5년만인 2020년 당기순이익 흑자를 기록했다고 덧붙였다. 다만, 구체적인 매출과 영업이익 수치를 밝히지는 않았다.신종 코로나 바이러스 감염증(코로나19) 영향으로 앱마켓들의 매출이 전반적으로 상승하는 와중에도 원스토어가 돋보이는 성장률을 기록했다는 점도 눈여겨볼 대목이다.앱마켓 3사의 거래액을 추정한 아이지에이웍스의 '모바일인덱스' 기준 2020년 원스토어는 전년 대비 34.4% 성장했으며 기타 글로벌 앱마켓의 동기 성장률 18.9% 대비 약 2배에 가까운 성장을 기록했다는 게 회사 측 설명이다.원스토어는 지난해 게임을 비롯해 앱, 스토리콘텐츠, 쇼핑 등 원스토어가 주력하고 있는 4개 분야 모두에서 성과를 냈다고 강조했다.먼저 핵심 동력인 게임은 2020년 한 해 동안 전년대비 약 36% 상승한 거래액을 기록했다. 출시 게임과 사용자의 증가와 더불어 국내 유명 게임들의 원스토어 동시 출시도 눈에 띄게 늘었다.지난해 위메이드의 기대작 '미르4'를 비롯해 넥슨의 '바람의 나라: 연'과 선데이토즈의 '애니팡4'가 동시 출시돼 성과를 냈으며 그라비티의 '라그나로크 오리진', 유주게임즈코리아의 '그랑삼국', 엑스엔게임즈의 '카오스모바일' 등 인기작들도 성적을 견인했다.원스토어 북스로 서비스 중인 스토리 콘텐츠 분야도 성장했다. 2020년 거래액이 전년 대비 40% 이상 증가하는 가파른 성장세를 기록했을 정도. 특히 일반도서는 물론 웹툰, 만화, 판타지 및 로맨스 소설까지 무제한으로 이용 가능한 구독형 상품인 '북패스'를 선보여 반응을 이끌었다. 또한 판타지·무협 웹소설 공모전을 개최하고 다양한 장르에서 콘텐츠 투자를 확대하는 등 오리지널 콘텐츠 확보에 적극 나서기도 했다.이외에도 비게임 앱 분야에서도 웨이브, 플로 등 유명 콘텐츠 앱들이 입점을 마쳤으며 IT 및 게이밍 기기를 중점으로 하는 쇼핑 영역도 '품절대란'을 일으키는 상품들을 잇따라 선보였다.구글플레이, 앱스토어, 원스토어 매출액 현황. 2019년 기준 원스토어가 3위 입지를 굳혔다. [자료=한국모바일산업연합회]원스토어는 구글플레이와 애플 앱스토어 등에 대항하기 위해 SKT, KT, LG유플러스 이동통신 3사의 안드로이드 운영체제(OS) 기반 오픈마켓 및 네이버 앱스토어가 합쳐 만들어진 오픈마켓이다.30%의 수수료를 떼어가는 해외 마켓과 달리 지난 2018년부터 수수료를 20%로 낮췄다. 여기에 카카오페이, 페이코 등 외부 결제 모델을 자체 도입할 경우 수수료를 5%까지 낮추는 파격적인 정책을 내세우며 차별화를 꾀했다.이같은 전략에 힘입어 원스토어는 국내 3위 사업자 입지를 확고히 다진 상태다. 한국모바일산업연합회가 지난해 발표한 '2019 모바일 콘텐츠 산업' 보고서에 따르면 원스토어는 2019년 기준 1조561억원의 매출을 올리며 구글(5조9천996억원), 애플(2조3천86억원)의 뒤를 이은 것으로 나타났다.증가율의 경우 12.3%로 같은 기간 구글(11.1%), 애플(9.6%)보다 높게 집계된 점도 눈에 띈다. 보고서는 ""국내 앱스토어인 원스토어도 외국계 앱마켓의 영향력 속에서도 다양한 마케팅과 외연 확대에 주력하며 매출액 비중이 소폭 증가했다""고 분석한 바 있다.이재환 원스토어 대표는 ""원스토어는 콘텐츠 개발사와 플랫폼의 상생과 성장이 동시에 가능하고 글로벌 기업의 독점을 견제하는 시장 조정자로서의 역할을 할 수 있다는 것을 증명하고 있다""며 ""이번 성과를 계기로 향후에도 업계와 상생하며 이용자들에게도 더 큰 혜택을 제공할 수 있도록 성장에 박차를 가하겠다""고 말했다.문영수기자 mj@inews24.com▶네이버 채널에서 '아이뉴스24'를 구독해주세요.▶재밌는 아이뉴스TV 영상보기 ▶아이뉴스24 바로가기[ⓒ 아이뉴스24 무단전재 및 재배포 금지]"
2021.01.20.,"제주항공, 내달 3일 '찜(JJiM) 특가' 이벤트",https://n.news.naver.com/mnews/article/003/0010303431?sid=101,"우수고객, J 패스 구매 고객은 내달 3일 10시부터 구매 가능 편도 총액운임 기준 국내선 8100원, 국제선 3만6000원부터 판매[서울=뉴시스] [서울=뉴시스] 최희정 기자 = 제주항공이 1년에 두 차례만 진행하는 초특가 항공권 정기 할인행사인 ‘찜(JJiM) 항공권’ 예매를 오는 2월 3일 오후3시부터 10일 오후 5시까지 진행한다고 20일 밝혔다.이번 프로모션에서는 제주항공의 우수고객인 VIP, 골드, 실버플러스 회원과 유료멤버십인 J 패스 구매 고객에게 우선 예매 혜택을 준다. 프로모션 행사 당일인 2월3일 오전 10시부터 찜 항공권 예매를 할 수 있다. 찜 항공권은 탑승일 기준으로 국내선은 4월1일부터 9월30일까지 이용할 수 있으며, 국제선은 6월1일부터 9월30일까지 이용할 수 있다. 해외 여행일정을 세우기 어려운 고객을 고려해 5월31일까지 국제선 일정변경 및 취소수수료가 1회 면제된다.찜 항공권의 최저운임은 편도 총액운임(유류할증료+세금 등) 기준 국내선 8100원부터, 국제선은 3만6000원부터 판매된다. 예매는 제주항공 홈페이지 및 모바일 앱과 웹에서 할 수 있다.단, 유류할증료와 해외 공항시설사용료는 발권일, 환율 등에 따라 변동되며 특가 이벤트 항공권은 무료 위탁수하물 서비스가 포함되지 않은 점도 유의해야 한다. 제주항공은 내년 찜 프로모션을 맞아 20일 낮 12시부터 모바일을 통한사전 이벤트를 진행한다. 네이버 모바일에서 ‘제주항공 MTBI’를 검색하면 제주항공의 여행성향 테스트페이지로 연결돼 자신의 여행성향과 비슷한 ‘여행 부캐’를 찾아주는 이벤트에 참여할 수 있다. 찜 MBTI를 완료한 고객에게는 제주항공 리프레시 포인트 1000P를 제공하며, 카카오플러스 친구 추가시 최대 3000원의 할인쿠폰도 받을 수 있다. 제주항공 찜 MBTI 테스트는 네이버 모바일 검색이나 제주항공 SNS채널을 통해 참여할 수 있다.이밖에 유튜브 ‘찜 홍보영상’에 댓글을 단 고객 중 총 10명에게 국내선 왕복 항공권을 제공하는 이벤트도 진행한다. 자세한 내용은 제주항공 홈페이지에서 확인할 수 있다.☞공감언론 뉴시스 dazzling@newsis.com▶ 네이버에서 뉴시스 구독하기▶ K-Artprice, 유명 미술작품 가격 공개▶ 뉴시스 빅데이터 MSI 주가시세표 바로가기<ⓒ 공감언론 뉴시스통신사. 무단전재-재배포 금지>"
2021.01.20.,"박지윤, 조수용 대표와 결혼 2년 만에 엄마 된다",https://n.news.naver.com/mnews/article/144/0000712635?sid=106,<구조 다름>
2021.01.20.,"""선물 대신 기프트카드"" 올리브영 700억 판매",https://n.news.naver.com/mnews/article/009/0004736420?sid=103,"기프트카드 매출 128% 증가2년 반만에 누적판매 700억1만원부터 50만원까지 충전스마트폰으로 편하게 사용20대 중심 젊은층 주로 구매CJ올리브영이 선보인 `온라인 기프트카드` 선물하기 서비스. [사진 제공 = CJ올리브영] CJ올리브영이 2018년 출시한 '올리브영 기프트카드'가 누적 판매액 700억원을 돌파했다. 코로나19에 따라 비대면으로 마음을 전하는 일이 늘었기 때문이다.CJ올리브영은 지난해 비대면 소비 트렌드에 힘입어 올리브영 기프트카드 매출이 전년 대비 128%가량 신장했다고 20일 밝혔다. 코로나19로 비대면 소비가 증가하고 밀레니얼 세대 소비 패턴 변화를 신규 서비스에 빠르게 반영해 모바일 상품권 시장을 선점한 것이 주효했다는 평가다.연령대를 기준으로 했을 때 기프트카드를 구매한 소비자 10명 중 6명은 20대였다. 기프트카드가 가장 많이 팔린 달은 5월이었으며 이어 2월, 9월 순으로 판매가 많이 이뤄졌다. CJ올리브영 관계자는 ""성년의 날, 어버이날 등이 몰려 있는 '가정의 달' 5월에 판매가 많이 이뤄졌다""며 ""5월에 이어 새 학기가 시작되고 설과 추석 등 명절이 있는 2월과 9월에도 기프트카드를 찾는 소비자가 많았다""고 설명했다. 이어 ""입학 시즌을 앞두고는 중·고등학생 입학 선물로 기프트카드를 찾는 수요가 많았다""고 덧붙였다.CJ올리브영은 2018년 8월 헬스앤드뷰티 업계 최초로 온·오프라인 매장에서 사용 가능한 충전식 선불카드인 올리브영 기프트카드를 선보였다. 선물로 상품권을 주고받듯 충전식 기프트카드를 선물하는 수요가 있을 것으로 판단했기 때문이다. 올리브영 기프트카드는 카드형 상품권으로 원하는 금액만큼 충전해 현금처럼 온·오프라인 매장에서 사용할 수 있다. 올리브영 온라인몰에서 카드 번호와 스크래치 번호를 등록하면 실물 카드를 들고 다니지 않아도 사용할 수 있어 편리하다. 신규 기프트카드에 한해 매장에서 1만원부터 최대 50만원까지 1만원 단위로 자유롭게 충전도 가능하다. CJ올리브영은 2019년 카카오톡 선물하기 서비스에 기프트카드를 입점시켰다. 메신저로 간편히 주고받을 수 있는 모바일 상품권 시장이 급속도로 성장하고 있기 때문이다. 올리브영 기프트카드는 카카오톡 선물하기에 입점한 이래 줄곧 '생활편의·기타' 부문에서 인기 선물로 자리매김해 왔다.또 CJ올리브영은 지난해 4월엔 젊은 층에서 모바일 상품권이 주요 선물 아이템으로 떠오르고 있다는 점에 착안해 올리브영 온라인몰과 모바일 애플리케이션(앱)에도 기프트카드 선물하기 서비스를 론칭했다. 온라인 기프트카드는 온라인몰 기프트관 또는 검색창을 통해 구입해 올리브영 알림톡이나 멀티미디어메시지(MMS)로 상대방에게 선물할 수 있다. 선물하고자 하는 지인에게 결제와 동시에 기프트카드 전송이 가능하다. 온라인 기프트카드 선물하기 서비스를 이용하면 시간과 장소에 구애받지 않고 온라인에서 구매해 선물할 수 있다. 상대방 전화번호를 통해 언제 어디서나 간편하게 선물할 수 있어 소비자 사용 편의성을 높였다는 평가를 받는다. 사용 방법은 기존 실물 기프트카드와 동일하다. 선물을 받은 고객은 공식 온라인몰 내 '나의 기프트카드' 섹션에 카드 번호와 스크래치 번호를 등록하면 전국 올리브영 매장과 온라인몰에서 현금처럼 사용 가능하다.온라인 기프트카드 선물하기의 특징은 100자 이내 메시지 카드와 함께 상대방에게 선물할 수 있다는 점이다. 지난해 추석과 연말연시엔 시즌별로 차별화된 디자인과 함께 '이제 막 빛나기 시작한 너에게' '세상 유일한 내 편에게' 등과 같은 응원 문구를 기프트카드에 담아 소비자에게 큰 호응을 얻었다. CJ올리브영은 밀레니얼 세대의 대표 선물 아이템으로서 입지를 공고히 하기 위해 올해 기프트카드 디자인 개발을 통해 차별화를 지속하고 가정의 달과 연말 등 주요 선물 시즌에 맞춘 프로모션을 강화할 방침이다. [이영욱 기자]▶ 네이버 메인에서 '매일경제'를 받아보세요▶ 궁금한 제조과정 영상으로 보세요. '이렇게 만들죠'▶ 아파트 살까 청약할까. 여기서 확인하세요. '매부리tv'[ⓒ 매일경제 & mk.co.kr, 무단전재 및 재배포 금지]"
2021.01.20.,"작년 항공업계 관심도 1위는 대한항공, 호감도는 진에어",https://n.news.naver.com/mnews/article/003/0010303189?sid=101,"지난해 1~12월 22만개 사이트 대상 9개 항공사 빅데이터 분석 정보량 '대한항공'·'아시아나'·'제주항공' 순…호감도 '진에어'·'플라이강원' 순[서울=뉴시스] 항공업계 2020년 관심도 순위 (제공=글로벌빅데이터연구소)[서울=뉴시스] 최희정 기자 = 항공업계가 지난해 코로나19로 고전을 면치 못한 가운데에서도 국민들의 가장 많은 관심을 받은 항공사는 '대한항공'인 것으로 나타났다. 호감도는 대한항공 계열사인 '진에어'가 가장 높았다.20일 글로벌빅데이터연구소는 뉴스·커뮤니티·카페·유튜브·블로그·트위터·인스타그램·페이스북·카카오스토리·지식인·기업/조직·정부/공공 등 12개 채널 22만개 사이트를 대상으로 지난해 국내 주요 9개 항공사에 대한 빅데이터 분석을 실시했다고 밝혔다.분석 대상 항공사는 '정보량 순'으로 ▲대한항공 ▲아시아나항공 ▲제주항공 ▲진에어 ▲이스타항공 ▲에어부산 ▲티웨이항공 ▲에어서울 ▲플라이강원 등이다.조사 결과 '대한항공'의 포스팅 수가 총 66만 6776건으로 압도적인 1위를 기록했다. 이는 2019년 포스팅 수 70만 510건에 비해 3만3734건 5.05% 감소한 수치다.이어 '아시아나항공' 30만 6331건, '제주항공' 21만 1118건, '진에어' 13만 7306건, '이스타항공' 12만 4339건, '에어부산' 9만 5837건, '티웨이항공' 8만 3937건, '에어서울' 4만 9593건 순이다.첫 취항 직후 2개월만에 코로나19 직격탄을 맞아 제대로 나래를 펼쳐보지도 못한 '플라이강원'이 1만 6634건으로 가장 적었다.연구소는 이들 항공사들에 대한 감성어를 분석했다.긍정률에서 부정률을 뺀 값인 순호감도의 경우 관심도 4위였던 '진에어'가 15.54%로 가장 높았다. 이는 지난해 순호감도 18.8%에 비해 3.26%P 낮아진데 그쳐 코로나19에도 선방한 것으로 평가된다.[서울=뉴시스] 항공업계 2020년 호감도 순위 (제공=글로벌빅데이터연구소)대한항공 계열 '진에어'는 아시아나항공 계열 '에어부산'·'에어서울'과의 통합을 통한 '초대형 LCC' 탄생의 기대를 모으고 있다.2위는 관심도 최하위였던 '플라이강원'으로 취항후 양양을 비롯한 지역사회에 활력소를 불어넣음으로써 11.98%를 기록했다.이어 ‘티웨이항공' 9.46%, ‘에어부산’ 8.59%, ‘제주항공' 4.95%, ‘아시아나항공' 3.14%, ‘대한항공' 2.49%, '에어서울' 1.55% 순이었다.'이스타항공'이 -16.79%로 최하위를 기록했다. '이스타항공'의 최종구 사장은 최근 대표이사직에서 물러났으며 법원에 기업 회생을 신청한 상태다.연구소 한 관계자는 ""관심도 1위인 대한항공의 순호감도가 한진칼 경영권 분쟁 속에서도 플러스 수치를 기록한 것은 화물 사업 확대로 흑자경영을 일궜기 때문으로 보인다""면서 ""빅데이터 분석 결과 감염병 사태에도 불구하고 항공업계의 자구 노력이 빛을 발한 한해였다""고 말했다．☞공감언론 뉴시스 dazzling@newsis.com▶ 네이버에서 뉴시스 구독하기▶ K-Artprice, 유명 미술작품 가격 공개▶ 뉴시스 빅데이터 MSI 주가시세표 바로가기<ⓒ 공감언론 뉴시스통신사. 무단전재-재배포 금지>"
