기사날짜,기사제목,네이버 뉴스 url,기사내용
2021.01.14.,"현대오토에버, IT서비스 기업 관심도 증가율 1위",https://n.news.naver.com/mnews/article/092/0002210676?sid=105,"전체 관심도 1위는 삼성SDS, 호감도 1위는 SK㈜ C&C(지디넷코리아=남혁우  기자)소비자 관심도 조사결과 현대오토에버가 국내 7개 대기업 IT서비스 기업 중 가장 높은 성장률을 보인것으로 나타났다. 실제 관심도는 '삼성SDS'가 가장 높았으며 소비자 호감도는 SK(주) C&C가 가장 높은 것으로 확인됐다.14일 글로벌빅데이터연구소는 12개 채널 22만개 사이트를 대상으로 국내 7개 대기업 IT서비스 회사들에 대한 빅데이터 분석을 실시했다고 밝혔다.분석에 포함된 채널은 뉴스, 커뮤니티, 블로그, 카페, 유튜브, 트위터, 인스타그램, 페이스북, 카카오스토리. 지식인, 기업/조직, 정부/공공 등이다.IT서비스기업 관심도 현황(이미지=글로벌빅데이터연구소)이번 조사는 2020년 1~12월 간 진행됐다. 관심도의 경우 2019년 같은 기간과 비교 분석도 함께 실시했다.분석 대상 브랜드는 2020년 '정보량 순'으로 ▲삼성SDS(대표 홍원표) ▲LG CNS(대표 김영섭) ▲포스코ICT(대표 손건재) ▲현대오토에버(대표 오일석) ▲SK㈜ C&C(대표 박성하) ▲롯데정보통신(대표 노준형) ▲신세계I&C(대표 김장욱) 등 7개사다.분석 결과 온라인 게시물 수(총정보량)를 의미하는 '소비자 관심도'는 삼성SDS가 올해 총 8만3천826건을 기록했다. 지난해 같은 기간 6만 8천45건에 비해 1만5천781건(23.19%) 증가하며 1위를 차지했다.관심도 2위는 총 4만3천943건을 기록한 LGCNS였다. 지난해 같은 기간 4만2천304건 대비 1천639건 감소해 3.73% 하락한 것으로 나타났다.포스코ICT는 지난해 5만3천212건에서 올해 3만8천664건으로 1만 4천548건(27.34%) 줄며 가장 높은 감소세를 보이고 LGCNS에 2위 자리를 내줬다.현대오토에버는 올해 총 2만3천886건으로 지난해 1만6천595건에 비해 7292건(43.93%) 늘어나며 증가율 1위를 기록했다.SK㈜ C&C는 지난해 1만6천405건에서 올해 1만7천724건으로 1319건(8.04%) 증가했다. 롯데정보통신은 지난해 1만6천239건에서 1만6천768건으로 529건(3.26%) 늘었다.신세계I&C는 지난해 1만756건 올해 1만5천309건으로 두 해 모두 하위에 머물렀다. 전년비 올해 4천553건(42.33%)를 기록하며 현대오토에버에 이어 증가율면에서는 2위였다.연구소는 대기업 IT서비스 회사들에 대한 호감도를 분석했다. 긍정률에서 부정률을 뺀 값인 순호감도의 경우 관심도 5위였던 SK㈜ C&C가 49.74%로 가장 높았다.정보량 최저인 '신세계I&C'는 순호감도 48.77%로 두번째로 높았다.'롯데정보통신'이 48.20%로 3위였으며, 관심도 2위였던 'LGCNS'가 44.75%로 4위를 기록했다.이어 관심도 증가율 1위였던 '현대오토에버'가 41.81%를 기록했으며 '포스코ICT'는 34.74%였다.관심도 1위인 '삼성SDS'는 34.55%를 기록, 호감도는 가장 낮았으나 타업종에 비해서는 낮지 않은 호감도를 보이고 있다.참고로 해당 게시물 내용에 '예쁘다 좋다 만족한다 최고 웃다 잘한다' 등의 단어가 더 많으면 긍정글로 분류되고 '나쁘다 화난다 불만족 울다 짜증 못한다' 등의 부정적 의미의 단어가 더 많으면 부정글로 분류된다. 이들 감성어가 IT서비스회사를 직접 지칭하지 않거나 관련이 없는 경우도 포함될 수 있다.글로벌빅데이터연구소 김희정 이사는 ""IT서비스사의 경우 4차산업을 주도하면서 정보량이 늘고 있는데다 전반적으로 호감도도 좋다""면서 ""SK㈜ C&C의 경우 최태원 SK그룹 회장의 남다른 ESG경영과 사회공헌 마인드, 인재와 현장을 챙기는 경영기조가 뿌리내리면서 가장 높은 호감도를 기록했다""고 밝혔다.남혁우 기자(firstblood@zdnet.co.kr) ▶ 지디넷코리아 '홈페이지' ▶ 네이버 채널 구독하기© 메가뉴스 & ZDNET, A RED VENTURES COMPANY, 무단전재-재배포 금지"
2021.01.14.,"'젊고 강한 부산' 박성훈, 부산시장 공식 출마선언",url없음,<네이버 기사 없음>
2021.01.14.,"현대오토에버, IT서비스 기업 관심도 증가율 1위",https://n.news.naver.com/mnews/article/092/0002210676?sid=105,"전체 관심도 1위는 삼성SDS, 호감도 1위는 SK㈜ C&C(지디넷코리아=남혁우  기자)소비자 관심도 조사결과 현대오토에버가 국내 7개 대기업 IT서비스 기업 중 가장 높은 성장률을 보인것으로 나타났다. 실제 관심도는 '삼성SDS'가 가장 높았으며 소비자 호감도는 SK(주) C&C가 가장 높은 것으로 확인됐다.14일 글로벌빅데이터연구소는 12개 채널 22만개 사이트를 대상으로 국내 7개 대기업 IT서비스 회사들에 대한 빅데이터 분석을 실시했다고 밝혔다.분석에 포함된 채널은 뉴스, 커뮤니티, 블로그, 카페, 유튜브, 트위터, 인스타그램, 페이스북, 카카오스토리. 지식인, 기업/조직, 정부/공공 등이다.IT서비스기업 관심도 현황(이미지=글로벌빅데이터연구소)이번 조사는 2020년 1~12월 간 진행됐다. 관심도의 경우 2019년 같은 기간과 비교 분석도 함께 실시했다.분석 대상 브랜드는 2020년 '정보량 순'으로 ▲삼성SDS(대표 홍원표) ▲LG CNS(대표 김영섭) ▲포스코ICT(대표 손건재) ▲현대오토에버(대표 오일석) ▲SK㈜ C&C(대표 박성하) ▲롯데정보통신(대표 노준형) ▲신세계I&C(대표 김장욱) 등 7개사다.분석 결과 온라인 게시물 수(총정보량)를 의미하는 '소비자 관심도'는 삼성SDS가 올해 총 8만3천826건을 기록했다. 지난해 같은 기간 6만 8천45건에 비해 1만5천781건(23.19%) 증가하며 1위를 차지했다.관심도 2위는 총 4만3천943건을 기록한 LGCNS였다. 지난해 같은 기간 4만2천304건 대비 1천639건 감소해 3.73% 하락한 것으로 나타났다.포스코ICT는 지난해 5만3천212건에서 올해 3만8천664건으로 1만 4천548건(27.34%) 줄며 가장 높은 감소세를 보이고 LGCNS에 2위 자리를 내줬다.현대오토에버는 올해 총 2만3천886건으로 지난해 1만6천595건에 비해 7292건(43.93%) 늘어나며 증가율 1위를 기록했다.SK㈜ C&C는 지난해 1만6천405건에서 올해 1만7천724건으로 1319건(8.04%) 증가했다. 롯데정보통신은 지난해 1만6천239건에서 1만6천768건으로 529건(3.26%) 늘었다.신세계I&C는 지난해 1만756건 올해 1만5천309건으로 두 해 모두 하위에 머물렀다. 전년비 올해 4천553건(42.33%)를 기록하며 현대오토에버에 이어 증가율면에서는 2위였다.연구소는 대기업 IT서비스 회사들에 대한 호감도를 분석했다. 긍정률에서 부정률을 뺀 값인 순호감도의 경우 관심도 5위였던 SK㈜ C&C가 49.74%로 가장 높았다.정보량 최저인 '신세계I&C'는 순호감도 48.77%로 두번째로 높았다.'롯데정보통신'이 48.20%로 3위였으며, 관심도 2위였던 'LGCNS'가 44.75%로 4위를 기록했다.이어 관심도 증가율 1위였던 '현대오토에버'가 41.81%를 기록했으며 '포스코ICT'는 34.74%였다.관심도 1위인 '삼성SDS'는 34.55%를 기록, 호감도는 가장 낮았으나 타업종에 비해서는 낮지 않은 호감도를 보이고 있다.참고로 해당 게시물 내용에 '예쁘다 좋다 만족한다 최고 웃다 잘한다' 등의 단어가 더 많으면 긍정글로 분류되고 '나쁘다 화난다 불만족 울다 짜증 못한다' 등의 부정적 의미의 단어가 더 많으면 부정글로 분류된다. 이들 감성어가 IT서비스회사를 직접 지칭하지 않거나 관련이 없는 경우도 포함될 수 있다.글로벌빅데이터연구소 김희정 이사는 ""IT서비스사의 경우 4차산업을 주도하면서 정보량이 늘고 있는데다 전반적으로 호감도도 좋다""면서 ""SK㈜ C&C의 경우 최태원 SK그룹 회장의 남다른 ESG경영과 사회공헌 마인드, 인재와 현장을 챙기는 경영기조가 뿌리내리면서 가장 높은 호감도를 기록했다""고 밝혔다.남혁우 기자(firstblood@zdnet.co.kr) ▶ 지디넷코리아 '홈페이지' ▶ 네이버 채널 구독하기© 메가뉴스 & ZDNET, A RED VENTURES COMPANY, 무단전재-재배포 금지"
2021.01.14.,"""내 돈 내고 내 카톡 3자까지 돌려진 셈""…이루다 개발사 사과에 이용자 부글부글",https://n.news.naver.com/mnews/article/079/0003455109?sid=101,"'이루다' 개발사 민감정보 노출 사과…""개인정보 보호 체계 구축해 재발 방지""실명 유출 인정, 조사 성실히 임할 것…""원하는 이용자는 개인정보 삭제""이용자들 ""카톡 대화는 2인 이상의 대화, 상대방은 모를텐데 계좌정보 등은 어쩌나""""사과할 게 아니라 데이터 전량 폐기해야""…집단 소송 준비[CBS노컷뉴스 김연지 기자]'AI 이루다' 개발한 스타트업 스캐터랩. 연합뉴스인공지능(AI) 챗봇 '이루다' 개발사 스캐터랩이 개인정보 유출 의혹에 대해 ""정부 조사에 성실히 임하겠다""면서 사과했다. '이루다'를 둘러싼 여러 논란이 불거진 지 닷새 만이다. 개인정보는 비식별화 처리를 주장도 사실이 아닌 것으로 드러난 데다, 민감 정보가 포함된 대화 패턴이 오픈소스 플랫폼을 통해 노출된 사실이 알려지면서 여론이 거세지자 결국 고개를 숙였다. 스캐터랩은 13일 사과문을 배포하면서 ""개인정보 처리 관련 관계 기관 조사에 성실하게 임하고 있다. 서비스를 이용해주신 모든 이용자분들께 진심으로 사과드린다""고 밝혔다.이어 ""논란이 되는 모든 사항에 대해 진상조사위원회를 구성해 철저히 조사하는 한편, 외부 전문가를 포함한 상시 개인정보 보호 체계를 구축하고 재발 방지를 위한 강화된 보안 교육을 실시하는 등 노력하겠다""고 강조했다.그러면서 ""이번 사안으로 인해 인공지능 산업계에 계신 여러 동료 기업들, 연구자분들, 파트너들께도 누를 끼치지 않기를 바란다""며 ""AI 윤리에 관한 사회적 합의에 부합할 수 있도록 노력하겠다""고 덧붙였다.실명과 지역명 등으로 추정되는 정보를 비식별화 처리한 대화내용. 연합뉴스성희롱에 이어 장애인·성소수자 혐오 발언으로 논란이 된 스캐터랩은, 연애 분석 앱 '연애의 과학'으로 이용자 카카오톡 데이터를 수집, 이루다 개발에 활용하는 과정에서 개인정보보호법을 어겼다는 의혹을 받고 있다. 연애의 과학 앱 이용자와 이용자의 연인에게 개인정보 이용·활용 동의를 제대로 받지 않은 점, 데이터를 이루다 재료로 쓰는 과정에 익명화(비식별화)를 제대로 하지 않은 점 등이 핵심이다.스캐터랩은 연인들 대화 데이터를 사내 메신저에 부적절하게 공유했다는 의혹도 받고 있다. 스캐터랩은 이루다 관련 개발 기록을 오픈소스 공유 플랫폼 '깃허브'에 공유했는데 여기서도 익명화를 제대로 하지 않은 것이다.100여건의 대화 묶음(개별 문장 환산시 1700여건)이 담긴 해당 데이터셋에선 실명이 20여번 이상 필터링 되지 않고 대화 상대방과 관계가 그대로 나온다. 개인 기저 질환을 유추할 수 있는 대화 내용이나 생활 반경, 직장 관련 정보가 등장하기도 한다.이 데이터셋은 전날 개발자 커뮤니티에서 논란이 되자 삭제됐다.인공지능 챗봇 이루다. 이루다 홈페이지 캡처스캐터랩은 사과문과 함께 배포한 자료에서 ""깃허브에 공개한 오픈소스에 내부 테스트 샘플이 포함된 사실이 확인됐다""며 ""실명을 자동화 비식별 처리했는데, 필터링 과정에 걸러지지 않은 부분이 일부 존재했다""고 인정했다.스캐터랩은 ""데이터 관리에 신중하지 못했다. 민감할 수 있는 정보가 노출된 점에 진심으로 사과드린다""며 ""해당 깃허브 게시물은 즉시 비공개 처리했다. 대화를 나눈 사람들의 관계나 생활 반경이 추정될 여지는 전혀 없다""고 해명했다.'사내 대화방에서 수집된 대화를 직원들끼리 돌려봤다'는 증언에 대해서는 ""스캐터랩 전원이 참여하고 있는 카카오톡 대화 당해년도 단체방에서는 해당 내용이 없음을 확인했다""며 ""또 다른 사내 메신저 채널인 슬랙에 대해선 다수 대화 채널이 있는 관계로 현재 조사를 진행 중""이라고 했다.개인정보 이용 동의를 소홀히 받았다는 의혹에 관해서는 ""연애의 과학이 동의를 받은 절차가 법적으로 문제가 없을 것이라고 판단했다""며 ""이용자분들과 충분히 소통하지 못한 점은 깊이 반성한다""고 거듭 사과했다.스캐터랩은 ""데이터가 AI에 활용되기를 원하지 않는 분들은 DB에서 삭제하실 수 있다""는 입장이다.그러나 이용자들은 스캐터랩이 사과할 게 아니라 ""카톡 데이터를 전량 파기해야 한다""고 목소리를 높이고 있다.한 이용자는 ""카톡 대화는 2인 이상 대화인데 한쪽의 제공 동의만 받았고 심지어 '가입하면 개인정보 활용에 동의하는 것으로 간주'한다는 방식의 명시적 동의는 개인정보 보호법 위반""이라면서 ""빅데이터 개인정보 가이드라인에 따르면 수집할때 비식별화 조치해야되는데 하지않고 저장해 제3자에게 제공까지 했다""고 항의했다. 그는 ""제3자에게 제공하려면 개인정보 제공자의 동의를 받아야 하고 왜 제3자에게 줘야하는지 누구에게 주는지를 알려야 한다""면서 ""원하는 사람만 삭제해준다는 것은 오히려 비식별 조치하지 않았고 누구의 발화인지 알수있게 저장했다는 말""이라며 덧붙였다.또다른 이용자는 연과 심리 상담 중에 상대방과의 카톡 빈도 수를 측정 하는 유료 서비스를 언급하며, ""문제는 그 안에 상대방과 누가 더 많이 연락 하는지 퍼센테이지를 측정하면서 개인정보는 물론 서로 나눈 19금 대화 등이 있고 결국 이런 대화에서 루다가 학습한 것""이라고 주장했다.이어 ""다시 말해 수십만명이 이용하는 이 어플에 자기 정보가 3 자한테 마구 돌려지고 쓰여졌다는 것은 정말 심각한 문제인데 연과 측에선 우린 이미 개인정보 수집에 동의를 했다 문제 없다 식인건 말도 안된다""고 지적했다.이외에도 ""돈은 돈대로 받고 카톡 상담 문자 내용 분석 한다더니 전부다 개인정보 수집한 셈이다"", ""상대방은 알지도 못하는데 이건 너무 한거 아니냐"", ""계좌정보같은 민감정보가 많을텐데 그런 것들 다 어떻게 할 것이냐, 전량 폐기해야 한다""며 비난이 쏟아지고 있다.연애의 과학 이용자들은 스캐터랩이 개인정보를 유출했다면서 집단소송을 준비 중이다.한편, 이날 개인정보보호위원회와 한국인터넷진흥원(KISA)은 서울 성동구 스캐터랩 사무실을 방문해 개인정보 유출 의혹에 관한 본격적인 조사에 착수했다.▶ 확 달라진 노컷뉴스▶ 클릭 한 번이면 노컷뉴스 구독!▶ 보다 나은 세상, 노컷브이와 함께anc.kyj@gmail.com저작권자 © CBS 노컷뉴스 무단전재 및 재배포 금지"
2021.01.14.,김장훈 “끔찍한 일이 있었다” SNS 중단 선언…이유는?,https://n.news.naver.com/mnews/article/396/0000570594?sid=106,<구조 다름>
2021.01.14.,"이경규, 이수근→펭수 '파격 컬래버'…시청자 ""역시 경규옹"" (찐경규)",https://n.news.naver.com/mnews/article/311/0001252988?sid=106,<구조 다름>
2021.01.14.,"한문고전번역원·천문연, AI 기반 한문고전 번역 서비스 시작",https://n.news.naver.com/mnews/article/030/0002923408?sid=102,"한국고전번역원(원장 신승운)과 한국천문연구원(원장 이형목)은 승정원일기와 천문고전 원문을 한글로 자동 번역해주는 인공지능(AI) 기술 기반 한문고전 자동번역 서비스를 시작했다고 14일 밝혔다.AI 기반 한문고전 번역 서비스 화면. 사진출처=한국천문연구원번역원은 구글이나 네이버 등 주요 포털이 제공하는 자동번역 서비스에 사용된 인공신경망 기반번역(NMT) 기술을 한문고전 자동번역서비스에 적용해 번역모델을 개발했다. NMT 기술은 기존 단어와 구문을 쪼개 번역했던 통계 기반번역(SMT)과 달리 문장을 통째로 파악해 번역하는 기술이다.이번 서비스는 번역원이 2017~2019년 개발한 승정원일기 자동번역 모델과 2019년 승정원일기 모델을 기반으로 한국천문연구원과 공동 개발한 천문고전 모델이 탑재됐다.신승운 원장은 “이번 서비스는 베타버전으로 공개했지만 학습데이터 확충과 자동번역 성능 고도화 등 자동번역 품질을 제고하고 한국문집, 지리, 외교, 의궤, 의학 등 다양한 고전문헌에 대한 번역모델 확장에 힘서 국민들이 한문고전에 쉬게 접근할 수 있도록 노력할 예정”이라고 밝혔다.한문고전 자동번역 서비스는 웹과 모바일에서 이용할 수 있으며, 승정원일기 자동번역의 경우 카카오톡 채널을 통해서도 이용이 가능하다.충청=강우성기자 kws9240@etnews.com▶ “2021년, 꼭 알아야할 클라우드 기술과 비즈니스” 21일 방송▶ 네이버 홈에서 [전자신문] 구독하기 [Copyright ⓒ 전자신문 & 전자신문인터넷, 무단전재 및 재배포 금지]"
2021.01.14.,또 털린 故구하라 트위터…이번엔 ‘성인광고’ 올라와,https://n.news.naver.com/mnews/article/005/0001400892?sid=105,"뉴시스악플로 세상을 떠난 걸그룹 카라 출신 고(故) 구하라의 SNS에 불법 성인광고가 게시돼 팬들의 분노를 사고 있다. 해당 계정은 해킹된 것으로 추정된다.13일 구하라 트위터엔 “언니들에게 남친 소개해 주려고 솔로이고 착한 오빠들 추가해 주세요”라는 문구와 함께 불법 성인광고가 게시됐다. 이 광고엔 각종 카카오톡 아이디가 첨부됐다.해당 트위터 계정이 고인의 추모 공간으로 이용돼왔던 만큼 팬들은 불쾌감을 드러내고 있다.구하라의 트위터가 해킹 피해를 본 것은 처음이 아니다. 지난해 12월에도 ‘123 9ld9c’라는 의문의 메시지가 게재돼 팬들의 우려를 자아냈다.구하라는 2019년 11월 서울 강남구 자택에서 숨진 채 발견됐다. 생전 고인과 절친했던 설리가 세상을 떠난 지 약 한 달 만에 이어진 비보에 연예계는 큰 충격에 빠졌다.트위터와 달리 구하라 인스타그램 계정은 로그인할 수 없는 ‘기념 계정’으로 전환됐다. 생전 고인이 공유했던 게시물은 그대로 남고 기존 게시물과 정보 모두 변경할 수 없다.이홍근 인턴기자▶ 네이버에서 국민일보를 구독하세요(클릭)▶ 국민일보 홈페이지 바로가기GoodNews paper ⓒ 국민일보(www.kmib.co.kr), 무단전재 및 수집, 재배포금지"
2021.01.14.,"박하선, 레드립+시크룩으로 완성한 고혹美",https://n.news.naver.com/mnews/article/241/0003086361?sid=106,<구조 다름>
2021.01.14.,"투썸플레이스, 시즌 한정 딸기 음료 3종 출시",https://n.news.naver.com/mnews/article/123/0002238193?sid=101,"프리미엄 디저트 카페 투썸플레이스가 스트로베리 시즌을 맞아 딸기를 듬뿍 넣은 시즌 한정 음료 3종을 출시한다고 14일 밝혔다.투썸은 본격적인 딸기철을 맞아 다양한 딸기 제품을 선보이는 '스트로베리 시즌'을 운영하고 있다. 올해는 '설렘 가득한 봄딸기를 즐기는 순간(Berry Good Moment)'을 테마로 다채로운 시즌 제품을 선보일 계획이다.가장 먼저 선보이는 제품은 시즌 음료로, 투썸의 시그니처 딸기 음료 1종과 MZ세대 트렌드를 반영한 '재미있는' 딸기 음료 2종으로 구성됐다. 국내산 생딸기와 딸기 베이스를 사용해 상큼 달콤한 향과 풍부한 식감을 살리고, 궁합이 좋은 유제품을 함께 조합해 딸기를 더 맛있고 건강하게 즐길 수 있도록 했다. 딸기는 비타민C와 구연산이 풍부해 유제품의 칼슘 흡수를 돕는 것으로 알려져 있다.시즌 음료 △스트로베리 라떼는 달콤한 딸기와 부드러운 우유가 잘 어우러진 제품이다. 부드러운 식감을 살린 딸기 과육을 풍성하게 넣은 음료로 2012년 처음 선보인 이래 매년 딸기 시즌에 출시되어 큰 사랑을 받고 있다.지난해 처음 선보여 큰 사랑을 받은 △스트로베리 요거 프라페도 재출시된다. 상큼한 딸기와 요거트가 섞인 프라페 위에 달콤한 바닐라 아이스크림이 올라가 있어 '맛있는 거 위에 맛있는 거'라는 호평을 받으며 출시와 동시에 인기를 끌었던 제품이다.이번 시즌 새롭게 선보이는 △스트로베리 애플 비안코 프라페는 상큼한 애플 셔벗에 달콤한 딸기 베이스를 레이어하고 소프트 아이스크림을 토핑해 눈과 입이 모두 즐거운 음료다. 두터운 마니아층을 확보한 애플 셔벗을 풍부하게 넣어 기대감을 높인다.투썸의 스트로베리 시즌 음료는 모바일투썸 앱의 사전 주문 기능 '투썸오더'를 통해 더 편리하게 이용할 수 있으며, 카카오톡 선물하기를 통해서도 만나볼 수 있다.▶ 조세일보 홈페이지 / 정회원 가입▶ 조세일보 네이버 뉴스스탠드 구독(종합/경제)박병우(pabw@joseilbo.com)저작권자 ⓒ 조세일보(http://www.joseilbo.com). 무단전재 및 재배포 금지"
