기사날짜,기사제목,네이버 뉴스 url,기사내용
2021.01.05.,"[친절한 경제] ""3억까지"" vs ""거품""…비트코인 진실은?",https://n.news.naver.com/mnews/article/055/0000865544?sid=101,"<앵커>알찬 정보가 가득한 코너입니다. 친절한 경제 시간입니다. 오늘(5일)도 김혜민 기자가 나와 있습니다. 김 기자 혹시 비트코인 투자해보신 적 있으세요?<기자>제가 한 3년 전에는 해봤는데요, 지금은 하지 않고 있습니다.<앵커>요즘에 많이 오른다고 하던데 약간 좀 속상하시겠네요?<기자>그런데 이미 너무 많이 올라서 지금 들어가기는 좀 위험하고요, 지금 아시는 대로 비트코인은 많이 올랐습니다.그렇기 때문에 요즘 다시 비트코인에 관심을 가져주시는 분들 많습니다.이 암호화폐의 대장주라고 불리는 비트코인, 최근 흐름을 먼저 설명드리겠습니다.작년 초반만 해도 1비트 당 800만 원 정도였는데요, 이것이 작년 말에 3천만 원까지 넘었고요, 그제는 4천만 원에 거의 근접을 했습니다.그러니까 1년 사이에 5배 가까이 뛴 것이죠, 이때 비트코인 시가총액이 코스피 1위인 삼성전자를 뛰어넘었고요, 테슬라 시총에도 거의 근접했었습니다.이렇게 비트코인 가격이 갑자기 뛰게 된 것은 여러 가지 요인이 한꺼번에 결합이 돼 있습니다.우선 미국이 경기 부양을 위해서 천문학적인 규모의 달러를 시중에 풀고 있죠. 이 투자 자금을 흡수할 수 있는 자산으로 비트코인이나 금이 주목을 받고 있습니다.또 미국의 결제서비스 회사인 페이팔, 아시는 분들 많으실 텐데요, 우리나라 토스나 카카오페이 같은 곳이죠. 이곳의 최근 발표도 큰 영향을 끼쳤습니다.이 기업이 내년부터는 암호화폐로 결제를 할 수 있게 하겠다는 계획을 내놓은 것이죠. 그러면 전 세계 대부분의 인터넷 쇼핑몰에서 앞으로는 암호화폐로 결제를 할 수 있게 됩니다.<앵커>진짜 많이 올랐네요, 그런데 왜 비트코인이라는 것이 예전에도 한 번 많이 올랐다가, 2018년이죠, 그때 또 갑자기 급락했잖아요? 그렇게 비슷한 상황이 연출될 수 있지 않습니까?<기자>맞습니다. 그것을 많이 지금 걱정을 하고 계십니다.하지만 2018년과 이번 상승은 좀 다르다, 이렇게 주장하는 쪽은요, 당시에 비트코인 가격을 끌어올린 주체가 개인들의 '묻지마 투자'였다면 지금은 기관 투자자들이 훨씬 더 많다는 점을 꼽고 있습니다.각국이 돈을 풀어서 전 세계적으로 유동성이 풍부해졌죠. 그래서 기관들이 포트폴리오 분산 차원에서 이런 비트코인에 투자를 한다는 것인데요, 그리고 2017년 비트코인을 '사기'라고까지 평가를 했던 JP모건 회장은 이번에는 ""내 취향이 아닐 뿐 블록체인은 지지한다""며 좀 다른 평가를 내놨습니다.자산운용사들도 비트코인 투자에 뛰어들기 시작했습니다.씨티은행의 한 글로벌 수석전문가는 올해 말에 비트코인이 무려 3억 원까지 갈 수 있다, 이런 파격적인 전망을 내놓기도 했습니다.반면 비트코인 가격에 거품이 끼었다는 주장도 만만치 않은데요, 미 연준이 언젠가 금리를 올리면 2018년의 악몽이 반복될 수 있다는 이런 우려도 나옵니다.또 ""비트코인은 통화도, 자산도 아니다"", ""비트코인 가격은 큰손 투자자들이 조작을 하고 있고, 이 거품은 곧 꺼질 것"" 이런 지적도 여전히 있습니다.<앵커>비트코인 참 많이 오르고 많이 또 그만큼 떨어지지 않을까 걱정되기도 하고, 역시 투자라는 것은 쉽지 않을 것 같은데, 그래도 이렇게 많이 올랐으니까 관심 갖는 분들이 많을 것 같은데 안전하게 투자하는 방법이 좀 있을까요?<기자>비트코인의 특징이 있죠. 수시로 가격이 크게 변한다는 것인데요, 블룸버그 집계를 보면 비트코인의 평균 일일 변동률 2.7%나 됩니다.금 가격 변동폭인 0.9%에 비하면 매우 높은 편이죠. 어제도 비트코인은 갑자기 10% 넘게 하락을 했고요, 지금도 떨어지고 있는 중이기는 합니다.게다가 비트코인은 이렇게 갑자기 오르고 내리는 이유를 투자자들이 알기가 어렵고요, 주식처럼 성장 가능성을 분석하는 데도, 일반 사람들은 이런 정보에 접근하는 데 한계가 있을 수 있습니다.전문가들은 대표적으로 이름이 알려진 암호화폐를 중심으로 주식처럼 공부를 한 뒤에 투자에 접근하라고 권하고 있습니다.[박성준 교수/동국대 블록체인연구센터장 : 암호화폐들은 프로젝트를 설명하는 백서라는 게 있습니다. 백서를 보시면서 이 프로젝트의 성장성이나 안정성, 실현 가능성을 보고 판단해주신다면 큰 무리는 없을 것 같습니다.]또 단타로 사고팔기를 반복하기보다는요, 장기적인 관점에서 신중하게 구매하고 오래 보유해야 한다고 조언을 했습니다.김혜민 기자(khm@sbs.co.kr)▶ 코로나19 현황 속보▶ 네이버에서 SBS뉴스 구독하기※ ⓒ SBS & SBS Digital News Lab. : 무단복제 및 재배포 금지"
2021.01.05.,“회비내고 보안유지” BTJ열방센터 방문…전국 곳곳 확진,https://n.news.naver.com/mnews/article/081/0003153194?sid=102,"뒤늦게 역학조사 과정에서 나타나경북 상주시 위치 기독교선교단체 방역당국 열방센터 대표 고발조치경북 상주시 화서면에 있는 기독교 선교시설 BTJ열방센터에 차량이 세워져 있는 모습. 연합뉴스경북 상주 종교시설을 매개로 한 신종 코로나바이러스 감염증(코로나19) 확진이 이어지고 있다.4일 방역 당국에 따르면 BTJ 열방센터 발 코로나19 확진자는 서울, 대구, 울산, 대전, 광주 등 전국으로 확산한 것으로 나타났다.각 시·도 방역 당국이 확진자를 역학조사하는 과정에서 뒤늦게 상주 BTJ 열방센터를 방문한 것으로 확인해 관련성이 높은 것으로 판단했다.상주시 화서면에 있는 BTJ 열방센터는 2014년 경북도로부터 ‘전문인 국제선교단’이란 명칭으로 설립 허가를 받은 교육기관이자 일반법인으로 2003년 서울 중구에 설립된 인터콥선교회와 협조해 선교 전문인을 양성하고 있다.BTJ 열방센터는 선교에 관심 있는 교인들을 모아 1박 2일간 교육을 한다. BTJ(back to the Jesus) 열방(列邦·여러 나라)센터는 외국인들도 불러 모아 선교에 관한 교육을 한다.지난 10월 9∼10일 약 3000명이, 11월 27∼28일 약 500명이 참석한 선교행사를 열어 코로나19가 확산한 것으로 추정한다. 참석자들은 전국에서 몰려온다고 한다.지난 10월 한 참석자는 “단체 카카오톡방에서 참가 확인을 한 뒤 회비를 내고 참석했는데, 모든 상황이 보안 유지를 전제로 진행됐다”고 말했다.상주시 방역 당국은 BTJ 열방센터 대표를 감염병예방법 위반 혐의로 고발했고, 검찰은 불구속기소 했다. 방역 당국은 이어 BTJ 열방센터 정문 차단기에 부착한 집합금지 명령서를 훼손한 혐의로 열방센터 대표를 고발하고, BTJ열방센터 방문자에게 코로나19 검사를 받도록 행정명령을 했다.김유민 기자 planet@seoul.co.kr▶ 네이버에서 서울신문 구독하기 클릭! ▶ 세상에 이런 일이 ▶ [연예계 뒷얘기] 클릭!ⓒ 서울신문(www.seoul.co.kr), 무단전재 및 재배포금지"
2021.01.05.,'박원순 피소 유출' 의혹 6일째 침묵하는 남인순 의원,https://n.news.naver.com/mnews/article/469/0000568705?sid=100,"국민의힘 초선 ""의원직 사퇴해 명예 회복하라""남인순 더불어민주당 의원. 연합뉴스 자료사진고(故) 박원순 전 서울시장의 성추행 피소에 관한 내용을 가해자 측에 유출했다는 의혹을 받는 남인순 더불어민주당 의원이 6일째 묵묵부답이다. 유출의 첫 진원지였던 여성단체가 곧바로 입장문을 내고 사과한 것과 대조된다. 여성인권운동가를 자임해 온 남 의원의 침묵이 길어질수록 비판도 고조되고 있다. 한국일보는 서울북부지검이 박 전 시장 피소 사실 유출 의혹 수사 결과를 처음 발표한 지난달 30일부터 이달 4일까지 남 의원에게 전화와 문자, 카카오톡, 텔레그램 등 여러 경로를 통해 검찰 발표에 대한 입장을 물었으나, 남 의원은 아무런 답을 하지 않았다. '권력형 성범죄 의혹을 받는 유력 정치인인 박 시장을 비호했다는 의혹에 대한 사실관계는 명확히 밝혀야 하지 않겠느냐'는 물음에도 답이 없었다. 남 의원실 관계자는 4일 ""제가 알기론 의원님께서 그런 계획은 아직 없는 걸로 알고 있다""고만 답했다. ""피소 사실 몰랐다""고 부인하더니 검찰 발표 후에도 침묵  검찰은 박 전 시장의 성추행 피소 관련 사실이 여성단체에서 유출돼 남 의원과 임순영 서울시 젠더특보에게 전달됐다고 지난달 30일 발표했다. 피해자 측이 도움을 요청하기 위해 A여성단체 대표와 전화한 내용이 한국여성단체연합 측에 흘러 들어갔고, 이 단체 상임대표 출신인 남 의원도 해당 정보를 알게 됐다. 이후 남 의원이 보좌관으로 일했던 임 특보에게 이를 전달했다는 게 검찰 조사 결과다. 앞서 박 전 시장이 극단적 선택을 한 직후에도 같은 의혹이 제기된 적 있으나 남 의원은 ""피소 사실을 몰랐다""며 부인했다. 당시 민주당의 젠더폭력TF 위원장을 맡고 있던 남 의원은 당이 피해자를 '피해 호소인'으로 규정하는 데도 핵심적 역할을 한 것으로 드러났다. 그동안 각종 성폭력 사건의 진실을 밝히는 데 앞장서왔던 남 의원이 정작 박 전 시장 사건에 대해선 '가해자 감싸기'에 급급했고 거짓말까지 했다는 비판을 받게 됐다.30여년간 여성운동을 해 오면서 '여성계 대모'로 불린 남 의원은 19대 국회에 비례대표로 입성한 후 서울 송파병에서 내리 2선을 한 3선 의원이다. 국회에서도 주로 보건복지·여성 정책 입법을 통해 활약해왔다. 현재도 민주당의 여성정치참여확대위원회 위원장을 맡고 있다. 국민의힘 초선 여성의원들 ""의원직 사퇴"" 요구논란이 커지자 국민의힘 초선 여성의원들은 4일 기자회견을 열고 ""남 의원이 성범죄 고발 사실을 유출한 것은  본인의 존재를 부인한 중대한 사안임에도 사과는커녕 어떠한 입장도 밝히지 않고 있어 배경이 의심스럽다""며 ""즉시 피해자에게 사과하고 의원직을 사퇴해 우리나라 여성운동의 명예를 지켜주길 요구한다""고 비판했다. 또 ""남 의원이 박 전 시장 피소 내용을 서울시뿐 아니라  청와대에도 알렸는지 사실을 밝혀야 한다""고 촉구했다. 반면 남 의원과 가까운 한 여당의원은 ""남 의원이 당시 '뭔가 있다'는 정도만 들었을 뿐 피소사실 자체는 몰랐던 것으로 안다""며 ""야당 의원들의 비판은 정치공세에 불과하다""고 주장했다.김지현 기자 hyun1620@hankookilbo.com조소진 기자 sojin@hankookilbo.com▶ [뉴잼] 이슈 쏙쏙, 이주의 브리프▶ [주변부 세대] ""고용한파에 서울대 졸업장도 무용지물""▶ 한국일보닷컴 바로가기"
2021.01.05.,"간편식 수요 늘자… 오리온 ‘마켓오 네이처’ 매출, 지난해 34% 성장",https://n.news.naver.com/mnews/article/018/0004821234?sid=101,"매출액 150억원, 역대 최대… 누적 판매량 3500만개국내 그레놀라 시장 매년 15% 이상 성장세[이데일리 김무연 기자] 오리온은 간편대용식 브랜드 ‘마켓오 네이처’의 ‘오!그래놀라’와 ‘오!그래놀라바’ 지난해 매출이 전년 대비 34% 성장했다고 5일 밝혔다. 마켓오 네이처는 간편대용식 수요의 증가 트렌드에 힘입어 지난해 매출액 150억 원을 돌파하며 2018년 출시 이후 최대 매출을 기록했다. 누적 판매량은 3500만 개를 넘어섰다.오!그래놀라, 오!그래놀라바 제품 이미지(사진=오리온)마켓오 네이처는 맛있고 영양가 있는 양질의 간편한 식사를 선호하는 ‘스낵킹’ 문화 확산하면서 직장인과 학생에게 인기를 끌고 있다. 최근에는 휴교, 재택근무 등 코로나19로 집에 머무는 시간이 길어짐에 따라 ‘홈족(Home+族)’들 사이에서 간편하게 건강까지 챙길 수 있는 제품으로 각광받고 있다. 이에 국내 그래놀라 시장은 지난해 9월 기준 670억 원 규모로 전년 동기 대비 15% 이상 성장했다. 또한 ‘착한 포장 프로젝트’의 일환으로 2019년과 지난해 오!그래놀라와 오!그래놀라바를 가격변동 없이 각각10%, 16.7%씩 증량해 가성비를 높인 것도 마켓오 네이처의 인기에 기여했단 분석이다.사회관계망서비스(SNS)에서는 ‘든든한 한 끼’, ‘딸기, 사과, 단호박 등 원물이 큼지막하게 들어있어 씹는 식감이 좋고 훨씬 든든하다’ 등의 긍정적인 후기와 함께 ‘요거트, 수프, 샐러드, 아이스크림 등과 함께 먹으면 더욱 맛있다’는 추천 조리법들이 공유되면서 높은 호응을 얻고 있다.오리온은 2018년 7월 간편대용식 브랜드 ‘마켓오 네이처’를 론칭하고 ‘오!그래놀라’와 ‘오!그래놀라바’ 제품을 출시했다. 오!그래놀라는 시간과 장소의 제약 없이 간편하게 한 끼 식사를 할 수 있도록 선보인 간편대용식 제품이다.마켓오 네이처는 ‘오!그래놀라’ 8종(검은콩, 과일, 야채, 카카오, 딸기, 단백질, 오!그래놀라팝 크랜베리 아몬드, 오!그래놀라팝 초코 아몬드)과 ‘오!그래놀라바’ 4종(검은콩, 무화과베리, 단호박고구마, 카카오&유산균볼) 등 소비자 취향과 라이프 스타일에 맞춰 다양한 제품 라인업을 갖추고 있다.오리온 관계자는 “국내 그래놀라 시장은 간편하게 즐기면서 맛있고 건강한 한끼를 추구하는 소비자가 늘어남에 따라 매년 15% 이상 성장하고 있다”라며 “소비자들이 그래놀라를 더 맛있고 간편하게 즐길 수 있도록 보다 더 대중적인 맛과 식감을 갖춘 새로운 제형과 종류의 신제품을 2021년에도 지속 출시할 예정”이라고 말했다.김무연 (nosmoke@edaily.co.kr)▶ #24시간 빠른 #미리보는 뉴스 #eNews+▶ 네이버에서 '이데일리 뉴스'를 만나보세요▶ 빡침해소, 청춘뉘우스 '스냅타임'＜ⓒ종합 경제정보 미디어 이데일리 - 무단전재 & 재배포 금지＞"
2021.01.05.,"[친절한 경제] ""3억까지"" vs ""거품""…비트코인 진실은?",https://n.news.naver.com/mnews/article/055/0000865544?sid=101,"<앵커>알찬 정보가 가득한 코너입니다. 친절한 경제 시간입니다. 오늘(5일)도 김혜민 기자가 나와 있습니다. 김 기자 혹시 비트코인 투자해보신 적 있으세요?<기자>제가 한 3년 전에는 해봤는데요, 지금은 하지 않고 있습니다.<앵커>요즘에 많이 오른다고 하던데 약간 좀 속상하시겠네요?<기자>그런데 이미 너무 많이 올라서 지금 들어가기는 좀 위험하고요, 지금 아시는 대로 비트코인은 많이 올랐습니다.그렇기 때문에 요즘 다시 비트코인에 관심을 가져주시는 분들 많습니다.이 암호화폐의 대장주라고 불리는 비트코인, 최근 흐름을 먼저 설명드리겠습니다.작년 초반만 해도 1비트 당 800만 원 정도였는데요, 이것이 작년 말에 3천만 원까지 넘었고요, 그제는 4천만 원에 거의 근접을 했습니다.그러니까 1년 사이에 5배 가까이 뛴 것이죠, 이때 비트코인 시가총액이 코스피 1위인 삼성전자를 뛰어넘었고요, 테슬라 시총에도 거의 근접했었습니다.이렇게 비트코인 가격이 갑자기 뛰게 된 것은 여러 가지 요인이 한꺼번에 결합이 돼 있습니다.우선 미국이 경기 부양을 위해서 천문학적인 규모의 달러를 시중에 풀고 있죠. 이 투자 자금을 흡수할 수 있는 자산으로 비트코인이나 금이 주목을 받고 있습니다.또 미국의 결제서비스 회사인 페이팔, 아시는 분들 많으실 텐데요, 우리나라 토스나 카카오페이 같은 곳이죠. 이곳의 최근 발표도 큰 영향을 끼쳤습니다.이 기업이 내년부터는 암호화폐로 결제를 할 수 있게 하겠다는 계획을 내놓은 것이죠. 그러면 전 세계 대부분의 인터넷 쇼핑몰에서 앞으로는 암호화폐로 결제를 할 수 있게 됩니다.<앵커>진짜 많이 올랐네요, 그런데 왜 비트코인이라는 것이 예전에도 한 번 많이 올랐다가, 2018년이죠, 그때 또 갑자기 급락했잖아요? 그렇게 비슷한 상황이 연출될 수 있지 않습니까?<기자>맞습니다. 그것을 많이 지금 걱정을 하고 계십니다.하지만 2018년과 이번 상승은 좀 다르다, 이렇게 주장하는 쪽은요, 당시에 비트코인 가격을 끌어올린 주체가 개인들의 '묻지마 투자'였다면 지금은 기관 투자자들이 훨씬 더 많다는 점을 꼽고 있습니다.각국이 돈을 풀어서 전 세계적으로 유동성이 풍부해졌죠. 그래서 기관들이 포트폴리오 분산 차원에서 이런 비트코인에 투자를 한다는 것인데요, 그리고 2017년 비트코인을 '사기'라고까지 평가를 했던 JP모건 회장은 이번에는 ""내 취향이 아닐 뿐 블록체인은 지지한다""며 좀 다른 평가를 내놨습니다.자산운용사들도 비트코인 투자에 뛰어들기 시작했습니다.씨티은행의 한 글로벌 수석전문가는 올해 말에 비트코인이 무려 3억 원까지 갈 수 있다, 이런 파격적인 전망을 내놓기도 했습니다.반면 비트코인 가격에 거품이 끼었다는 주장도 만만치 않은데요, 미 연준이 언젠가 금리를 올리면 2018년의 악몽이 반복될 수 있다는 이런 우려도 나옵니다.또 ""비트코인은 통화도, 자산도 아니다"", ""비트코인 가격은 큰손 투자자들이 조작을 하고 있고, 이 거품은 곧 꺼질 것"" 이런 지적도 여전히 있습니다.<앵커>비트코인 참 많이 오르고 많이 또 그만큼 떨어지지 않을까 걱정되기도 하고, 역시 투자라는 것은 쉽지 않을 것 같은데, 그래도 이렇게 많이 올랐으니까 관심 갖는 분들이 많을 것 같은데 안전하게 투자하는 방법이 좀 있을까요?<기자>비트코인의 특징이 있죠. 수시로 가격이 크게 변한다는 것인데요, 블룸버그 집계를 보면 비트코인의 평균 일일 변동률 2.7%나 됩니다.금 가격 변동폭인 0.9%에 비하면 매우 높은 편이죠. 어제도 비트코인은 갑자기 10% 넘게 하락을 했고요, 지금도 떨어지고 있는 중이기는 합니다.게다가 비트코인은 이렇게 갑자기 오르고 내리는 이유를 투자자들이 알기가 어렵고요, 주식처럼 성장 가능성을 분석하는 데도, 일반 사람들은 이런 정보에 접근하는 데 한계가 있을 수 있습니다.전문가들은 대표적으로 이름이 알려진 암호화폐를 중심으로 주식처럼 공부를 한 뒤에 투자에 접근하라고 권하고 있습니다.[박성준 교수/동국대 블록체인연구센터장 : 암호화폐들은 프로젝트를 설명하는 백서라는 게 있습니다. 백서를 보시면서 이 프로젝트의 성장성이나 안정성, 실현 가능성을 보고 판단해주신다면 큰 무리는 없을 것 같습니다.]또 단타로 사고팔기를 반복하기보다는요, 장기적인 관점에서 신중하게 구매하고 오래 보유해야 한다고 조언을 했습니다.김혜민 기자(khm@sbs.co.kr)▶ 코로나19 현황 속보▶ 네이버에서 SBS뉴스 구독하기※ ⓒ SBS & SBS Digital News Lab. : 무단복제 및 재배포 금지"
2021.01.05.,"'반도', '원더우먼 1984' 제치고 日 박스오피스 외화 1위(공식)",https://n.news.naver.com/mnews/article/241/0003082975?sid=106,<구조 다름>
2021.01.05.,“회비내고 보안유지” BTJ열방센터 방문…전국 곳곳 확진,https://n.news.naver.com/mnews/article/081/0003153194?sid=102,"뒤늦게 역학조사 과정에서 나타나경북 상주시 위치 기독교선교단체 방역당국 열방센터 대표 고발조치경북 상주시 화서면에 있는 기독교 선교시설 BTJ열방센터에 차량이 세워져 있는 모습. 연합뉴스경북 상주 종교시설을 매개로 한 신종 코로나바이러스 감염증(코로나19) 확진이 이어지고 있다.4일 방역 당국에 따르면 BTJ 열방센터 발 코로나19 확진자는 서울, 대구, 울산, 대전, 광주 등 전국으로 확산한 것으로 나타났다.각 시·도 방역 당국이 확진자를 역학조사하는 과정에서 뒤늦게 상주 BTJ 열방센터를 방문한 것으로 확인해 관련성이 높은 것으로 판단했다.상주시 화서면에 있는 BTJ 열방센터는 2014년 경북도로부터 ‘전문인 국제선교단’이란 명칭으로 설립 허가를 받은 교육기관이자 일반법인으로 2003년 서울 중구에 설립된 인터콥선교회와 협조해 선교 전문인을 양성하고 있다.BTJ 열방센터는 선교에 관심 있는 교인들을 모아 1박 2일간 교육을 한다. BTJ(back to the Jesus) 열방(列邦·여러 나라)센터는 외국인들도 불러 모아 선교에 관한 교육을 한다.지난 10월 9∼10일 약 3000명이, 11월 27∼28일 약 500명이 참석한 선교행사를 열어 코로나19가 확산한 것으로 추정한다. 참석자들은 전국에서 몰려온다고 한다.지난 10월 한 참석자는 “단체 카카오톡방에서 참가 확인을 한 뒤 회비를 내고 참석했는데, 모든 상황이 보안 유지를 전제로 진행됐다”고 말했다.상주시 방역 당국은 BTJ 열방센터 대표를 감염병예방법 위반 혐의로 고발했고, 검찰은 불구속기소 했다. 방역 당국은 이어 BTJ 열방센터 정문 차단기에 부착한 집합금지 명령서를 훼손한 혐의로 열방센터 대표를 고발하고, BTJ열방센터 방문자에게 코로나19 검사를 받도록 행정명령을 했다.김유민 기자 planet@seoul.co.kr▶ 네이버에서 서울신문 구독하기 클릭! ▶ 세상에 이런 일이 ▶ [연예계 뒷얘기] 클릭!ⓒ 서울신문(www.seoul.co.kr), 무단전재 및 재배포금지"
