기사날짜,기사제목,네이버 뉴스 url,기사내용
2021.01.13.,"""어제의 고객은 사라졌다""…유통·소비시장 '온라인 대격변'",https://n.news.naver.com/mnews/article/015/0004483007?sid=101,"비대면 소비…틈새에서 대세로정용진 부회장 ""고객의 요구에집착하지 않는 기업은 결국 도태""온라인쇼핑 비중…전체의 30% 넘어온·오프라인 통합…옴니 채널에 집중Getty Images Bank“우리의 고객은 영구적으로 변했다.” 정용진 신세계 부회장은 올해 신년사에서 이렇게 단언했다. 코로나19가 글로벌 리테일(소매)산업에 ‘뉴 노멀(새로운 기준)’을 만들었다는 것이다. 비대면 소비로 인해 과거 ‘틈새’였던 ‘클릭 쇼핑’은 이제 ‘대세’가 됐다.유통, 식품, 뷰티 등 올해 국내 리테일산업은 그 어느 해보다 격변을 겪을 전망이다. 위기와 기회가 공존한다는 게 전문가들의 진단이다. 정 부회장의 표현을 빌리면 “변화한 고객의 요구에 광적으로 집착”하지 않는 기업은 도태할 수밖에 없다. 반대로 코로나19 이후 보복성 소비의 등에 올라탄 기업엔 전례없는 기회가 찾아올 가능성이 높다. 대세가 된 온라인 쇼핑올해 유통업계의 최대 화두는 ‘클릭 쇼핑’이다. 정 부회장은 이를 “시도가 축적되면 경험이 되고, 경험은 일상이 된다”고 표현했다.코로나19 사태가 이런 추세를 가속화시켰다. 통계청에 따르면 지난해 11월 온라인 쇼핑 거래액은 1년 전(12조8521억원)보다 17.2% 증가한 15조631억원이었다. 온라인 쇼핑 거래액이 15조원을 넘어선 것은 2001년 관련 통계가 작성된 이후 처음이다.전체 소매 판매액에서 온라인 쇼핑이 차지하는 비중도 30%에 육박한 29.2%로 역대 최고치다. 유통업계에서 자체 추정한 ‘온라인 침투율’은 35% 수준이다. 이 수치가 얼마나 더 상승할지에 대해선 견해가 엇갈린다. 일각에선 온라인 쇼핑에 대한 싫증 현상이 나타날 것이란 전망도 나온다. 온라인 ‘온리(only)’ 전략으로는 경쟁에서 살아남을 수 없다는 얘기다. 유통업계 전문가들은 온·오프라인 통합을 통한 ‘옴니 채널’ 구현이 핵심 경쟁력이 될 것으로 보고 있다. ‘온라인 장보기’ 선점 위한 혈투옴니 채널 구현엔 대형마트 3사가 가장 적극적이다. 150개 안팎에 달하는 전국 오프라인 점포를 빠른 배송을 위한 물류 거점으로 변신시키고 있다. 작년까지만 해도 각자 움직였던 이마트와 SSG닷컴은 올해 다양한 ‘통합 실험’에 나설 전망이다. 신선식품 경쟁력 강화가 핵심이다. ‘쓱’에서 주문하면 전국 이마트에서 배송해주는 방식이다.롯데쇼핑의 행보에도 관심이 집중되고 있다. 롯데마트 장보기 상품을 중심으로 주문 후 2시간 내 배송받는 서비스를 비롯해 롯데슈퍼에선 퇴근길 1시간 배송 실험도 진행 중이다. 유통업계 관계자는 “비신선식품 분야에서 쿠팡 등 전자상거래 플랫폼과 정면승부할 수 있는 시대는 끝났다”며 “대형마트가 특유의 소싱 능력을 발휘한다면 신선식품 분야에서 활로를 찾을 수 있을 것”이라고 전망했다.홈플러스가 12일 산지직송관을 연 것도 이런 맥락이다. 소비자가 주문하면 생산자가 산지에서 직접 택배 발송하는 서비스다. 홈플러스는 품질 관리를 위해 오프라인 바이어와 온라인 상품기획자(MD)로 구성한 ‘산지직송 태스크포스팀’을 만들었다. 올해 전국 200개 농가와 협업할 계획이다.전문가들은 유통의 개념이 바뀌고 있다고 진단한다. 생산자와 판매자가 중간 유통 단계 없이 직접 소비자와 접촉하는 DTC(direct to consumer) 시장이 커지고 있다. 거래액 기준으로 네이버 쇼핑이 20조원을 훌쩍 넘어선 것이 대표적이다. 네이버는 중소상인이 쉽게 입점할 수 있는 스마트스토어를 확대하고 ‘라이브방송’ 등 새로운 마케팅 수단을 제공해 ‘쇼핑 플랫폼’으로서의 위력을 강화하고 있다. ‘선물하기’로 출발한 카카오커머스는 제조사들의 DTC를 지원하는 플랫폼으로 진화하고 있다. “소비자 변화에 천착”한 기업만 생존식품, 뷰티산업도 코로나19로 대전환기를 맞고 있다. 몇 년에 걸쳐 일어날 법한 변화가 단 몇 개월 만에 압축 전개됐다. 식품산업에선 가정간편식(HMR)이 폭풍 성장 중이다. 밀키트(반조리 식재료)를 비롯해 조리 과정을 대폭 줄인 ‘레디밀’ 시장이 각광받고 있다. 가정용 에어프라이어 보급 확대가 식품업체들이 냉동식품 제조 기술력에 투자하는 계기가 됐다는 게 전문가들의 평가다.문정훈 서울대 농경제사회학부 교수가 이끄는 서울대 푸드비즈니스랩은 올해 식품 트렌드를 ‘집밥 2.0’ 시대로 규정했다. 1.0 시대 간편식은 ‘간편하고 맛있는 것’이면 충분했지만 2.0 시대 소비자는 ‘간편하면서도 신선하고 건강한 것’을 요구할 것으로 내다봤다.코로나19 확산으로 타격이 컸던 화장품업계는 급변하는 경영 환경 변화 속에서 새로운 성장 기회를 모색하고 있다. 아모레퍼시픽그룹은 디지털 전환에 역점을 두고 있다. 세계 최대 IT·가전 전시회 ‘CES 2021’에서 선보인 맞춤형 화장품 서비스가 대표적인 사례다. 인공지능(AI)을 활용해 소비자의 피부 색상에 어울리는 입술 색상을 추천하고, 현장에서 바로 립 제품을 제조하는 ‘립 팩토리 바이 컬러 테일러’ 등을 선보였다.LG생활건강은 해외시장에서 활로를 찾고 있다. 올해 ‘후’ ‘숨’ ‘오휘’ 등 럭셔리 화장품 브랜드 경쟁력을 키워 국내외 시장에서 입지를 더 공고히 하겠다는 계획이다. 특히 중국, 일본, 미주 지역의 비대면 사업 비중을 확대한다는 전략이다. 차석용 LG생활건강 부회장은 “위기가 왔을 땐 변화의 속도가 더 빨라야 한다”고 강조했다.박동휘 기자 donghuip@hankyung.com▶ 경제지 네이버 구독 첫 400만, 한국경제 받아보세요▶ 한경 고품격 뉴스레터, 원클릭으로 구독하세요▶ 한국경제신문과 WSJ, 모바일한경으로 보세요 ⓒ 한국경제 & hankyung.com, 무단전재 및 재배포 금지"
2021.01.13.,‘빚투’ 20조 역대 최고…빌려줄 돈도 바닥난 증권사 금고,https://n.news.naver.com/mnews/article/449/0000203081?sid=101,"이렇게 대통령까지 개인 투자를 독려하며, 주식시장은 뜨거워질 대로 뜨거워지고 있습니다.  코로나 이후 다섯 명 중 한 명이 처음 주식을 시작하거나 재개했다는 조사결과가 나왔습니다.  문제는 빚을 내서 주식을 사는 투자자가 많아진다는 것입니다.  빌려줄 돈이 바닥난 증권사들이 금고 문을 걸어잠그고 있습니다.  홍유라 기자입니다. [리포트]삼성증권은 오늘 신규 신용융자를 당분간 중단한다고 공지했습니다.  빌려줄 돈이 바닥났기 때문입니다. 오늘부터 중단되는데 거래가 언제 다시 재개될지는 알 수 없습니다.신용 거래는 투자자가 갖고있는 돈과 주식을 담보로 증권사에서 돈을 빌려, 더 많은 주식을 사는 겁니다.  통상 은행 대출보다 높은 이자를 감당해야 합니다. 최근 코스피가 급등하자 주식 투자로 수익을 기대하며, 신용거래를 이용하는 투자자가 늘고 있습니다. 금융투자협회에 따르면 신용 융자 잔고는 지난 7일 20조 원을 돌파했고, 어제는 20조 7871억 원까지 불어났습니다. 사상 최고치입니다.[김민기 / 자본시장연구원 연구위원] ""단기간에 주가 지수가 다른 나라 비해 많이 상승했기 때문에 하방 위험 노출될 가능성 있으니까 (빚내서 투자는) 지양할 필요가 있지 않을까 생각합니다.""  이런 가운데 올해 기업공개의 첫 주자로 나선 모바일 광고 플랫폼 기업 엔비티가 4397대 1의 청약경쟁률을 기록했습니다.  지난해 SK바이오팜, 카카오게임즈의 경쟁률을 뛰어넘은 역대 최고 기록입니다. 올해는 SK바이오사이언스 카카오뱅크, LG에너지솔루션 등 대어들이 줄줄이 기업공개를 앞두고 있습니다. 투자처를 찾아 빚투 열기는 쉽게 줄지 않을 거란 전망이 나오는 가운데, 오늘 한국은행은 올해 1분기엔 시중 은행이 대출을 더 조일 거라는 조사 결과를 발표했습니다.  영상취재 : 정기섭 영상편집 : 정다은▶ '채널A' LIVE 무료 보기▶ 네이버에서 '채널A' 구독하기▶[기사보기][단독]‘145억 증발’ 공범은 중국계 남성…국내 체류 추적 중꿈을 담는 캔버스 채널A  ⓒCHANNEL A(www.ichannela.com), 무단 전재 및 재배포 금지"
2021.01.13.,현대제철 당진제철소 노조 총파업 돌입,url없음,<네이버 기사 없음>
2021.01.13.,"""이자보다 쿠폰·굿즈""…경품 주는 은행 예적금 상품 인기",https://n.news.naver.com/mnews/article/009/0004732630?sid=101,"저금리로 높은 이자를 기대할 수 없게 되자 은행들이 상품 관련 혜택에 집중하는 예·적금 상품을 출시하고 있다. 소비자들은 쿠폰이나 굿즈를 얻을 수 있어서 좋고, 금융권 입장에서는 관련 상품을 통해 다른 상품 이용을 권유하는 등 다른 활동을 유도할 수 있다.13일 금융권에 따르면 카카오뱅크가 출시한 이마트, 마켓컬리 제휴적금은 2주만에 각각 56만좌, 23만좌가 판매된 것으로 알려졌다. 카카오뱅크 '26주적금 with 마켓컬리' 상품은 마켓컬리에서 사용할 수 있는 각종 할인 쿠폰의 혜택을 담았다. 적금 계좌를 개설하고 매주 납입하면 총 7회에 걸쳐 마켓컬리 무료배송, 5% 할인, 10% 할인, 5000원 할인 등의 쿠폰을 받을 수 있다. 추첨을 통해 카카오프렌즈 캐릭터로 제작된 마켓컬리 머그컵 등 한정판 굿즈도 증정했다. 특히 이 상품의 경우 최소 1000원부터 가입이 가능한데 이 경우 26주를 다 채워도 이자가 600원밖에 되지 않았지만, 다양한 혜택 등으로 소비자들의 반응이 좋았다.  신한은행은 GS리테일과 함께 '쏠XGS 백만원 챌린지' 상품을 출시했다. 출시 한달도 되지 않아 3만2000좌가 판매됐다. 상품에 가입하고 100만원 이상의 목돈 마련을 달성하는 고객에게 GS리테일 쿠폰을 제공하는 행사도 내달 14일까지 진행된다. 이 상품에 가입한 고객들은 GS25 편의점 2000원 쿠폰을 받을 수 있으며, 적금을 통해 백만원 모으기 챌린지에 성공하는 고객에게는 GS프레시몰 1만원 쿠폰도 얻을 수 있다. 중도에 포기하지 않고 목돈 마련을 달성할 수 있도록 고객이 설정한 자동이체를 완료하면 주1회 완료도장을 찍어준다. 이 도장을 5개 모을 때마다 GS프레시몰 3000원 쿠폰을 제공해 총 2만4000원 상당의 GS리테일 쿠폰을 받을 수 있다.   우리은행은 지난해 인기 네이버 웹툰 '유미의 세포들'과 같이 '우리 200일 적금'을 출시했다. 출시 이후 10만좌 조기 완판된 것에 힘입어 10만좌를 추가로 판매하고 있다. 우리은행은 유미의 세포들 캐릭터 등과 콜라보레이션해 우리WON뱅킹에서 웹툰 방식의 새로운 인터페이스를 도입하기도 했다. 이 상품은 우리WON뱅킹에서 가입이 가능하며, 일일 3만원 이내 금액으로 나에게 맞는 플랜을 정해 다양한 방법으로 입금할 수 있다. 적금 가입자를 대상으로 캐릭터 인형, 파우치, 모바일 링을 증정하기도 했다.카카오뱅크 관계자는 ""올해도 고객들께 저축할 때마다 소비 생활에서 할인 혜택을 받아볼 수 있는 파트너 상품을 꾸준히 기획해 나갈 계획""이라고 밝혔다.[한상헌 기자]▶ 네이버 메인에서 '매일경제'를 받아보세요▶ 궁금한 제조과정 영상으로 보세요. '이렇게 만들죠'▶ 아파트 살까 청약할까. 여기서 확인하세요. '매부리tv'[ⓒ 매일경제 & mk.co.kr, 무단전재 및 재배포 금지]"
2021.01.13.,‘빚투’ 20조 역대 최고…빌려줄 돈도 바닥난 증권사 금고,https://n.news.naver.com/mnews/article/449/0000203081?sid=101,"이렇게 대통령까지 개인 투자를 독려하며, 주식시장은 뜨거워질 대로 뜨거워지고 있습니다.  코로나 이후 다섯 명 중 한 명이 처음 주식을 시작하거나 재개했다는 조사결과가 나왔습니다.  문제는 빚을 내서 주식을 사는 투자자가 많아진다는 것입니다.  빌려줄 돈이 바닥난 증권사들이 금고 문을 걸어잠그고 있습니다.  홍유라 기자입니다. [리포트]삼성증권은 오늘 신규 신용융자를 당분간 중단한다고 공지했습니다.  빌려줄 돈이 바닥났기 때문입니다. 오늘부터 중단되는데 거래가 언제 다시 재개될지는 알 수 없습니다.신용 거래는 투자자가 갖고있는 돈과 주식을 담보로 증권사에서 돈을 빌려, 더 많은 주식을 사는 겁니다.  통상 은행 대출보다 높은 이자를 감당해야 합니다. 최근 코스피가 급등하자 주식 투자로 수익을 기대하며, 신용거래를 이용하는 투자자가 늘고 있습니다. 금융투자협회에 따르면 신용 융자 잔고는 지난 7일 20조 원을 돌파했고, 어제는 20조 7871억 원까지 불어났습니다. 사상 최고치입니다.[김민기 / 자본시장연구원 연구위원] ""단기간에 주가 지수가 다른 나라 비해 많이 상승했기 때문에 하방 위험 노출될 가능성 있으니까 (빚내서 투자는) 지양할 필요가 있지 않을까 생각합니다.""  이런 가운데 올해 기업공개의 첫 주자로 나선 모바일 광고 플랫폼 기업 엔비티가 4397대 1의 청약경쟁률을 기록했습니다.  지난해 SK바이오팜, 카카오게임즈의 경쟁률을 뛰어넘은 역대 최고 기록입니다. 올해는 SK바이오사이언스 카카오뱅크, LG에너지솔루션 등 대어들이 줄줄이 기업공개를 앞두고 있습니다. 투자처를 찾아 빚투 열기는 쉽게 줄지 않을 거란 전망이 나오는 가운데, 오늘 한국은행은 올해 1분기엔 시중 은행이 대출을 더 조일 거라는 조사 결과를 발표했습니다.  영상취재 : 정기섭 영상편집 : 정다은▶ '채널A' LIVE 무료 보기▶ 네이버에서 '채널A' 구독하기▶[기사보기][단독]‘145억 증발’ 공범은 중국계 남성…국내 체류 추적 중꿈을 담는 캔버스 채널A  ⓒCHANNEL A(www.ichannela.com), 무단 전재 및 재배포 금지"
2021.01.13.,현대제철 당진제철소 노조 총파업 돌입,url없음,<네이버 기사 없음>
2021.01.13.,"""이자보다 쿠폰·굿즈""…경품 주는 은행 예적금 상품 인기",https://n.news.naver.com/mnews/article/009/0004732630?sid=101,"저금리로 높은 이자를 기대할 수 없게 되자 은행들이 상품 관련 혜택에 집중하는 예·적금 상품을 출시하고 있다. 소비자들은 쿠폰이나 굿즈를 얻을 수 있어서 좋고, 금융권 입장에서는 관련 상품을 통해 다른 상품 이용을 권유하는 등 다른 활동을 유도할 수 있다.13일 금융권에 따르면 카카오뱅크가 출시한 이마트, 마켓컬리 제휴적금은 2주만에 각각 56만좌, 23만좌가 판매된 것으로 알려졌다. 카카오뱅크 '26주적금 with 마켓컬리' 상품은 마켓컬리에서 사용할 수 있는 각종 할인 쿠폰의 혜택을 담았다. 적금 계좌를 개설하고 매주 납입하면 총 7회에 걸쳐 마켓컬리 무료배송, 5% 할인, 10% 할인, 5000원 할인 등의 쿠폰을 받을 수 있다. 추첨을 통해 카카오프렌즈 캐릭터로 제작된 마켓컬리 머그컵 등 한정판 굿즈도 증정했다. 특히 이 상품의 경우 최소 1000원부터 가입이 가능한데 이 경우 26주를 다 채워도 이자가 600원밖에 되지 않았지만, 다양한 혜택 등으로 소비자들의 반응이 좋았다.  신한은행은 GS리테일과 함께 '쏠XGS 백만원 챌린지' 상품을 출시했다. 출시 한달도 되지 않아 3만2000좌가 판매됐다. 상품에 가입하고 100만원 이상의 목돈 마련을 달성하는 고객에게 GS리테일 쿠폰을 제공하는 행사도 내달 14일까지 진행된다. 이 상품에 가입한 고객들은 GS25 편의점 2000원 쿠폰을 받을 수 있으며, 적금을 통해 백만원 모으기 챌린지에 성공하는 고객에게는 GS프레시몰 1만원 쿠폰도 얻을 수 있다. 중도에 포기하지 않고 목돈 마련을 달성할 수 있도록 고객이 설정한 자동이체를 완료하면 주1회 완료도장을 찍어준다. 이 도장을 5개 모을 때마다 GS프레시몰 3000원 쿠폰을 제공해 총 2만4000원 상당의 GS리테일 쿠폰을 받을 수 있다.   우리은행은 지난해 인기 네이버 웹툰 '유미의 세포들'과 같이 '우리 200일 적금'을 출시했다. 출시 이후 10만좌 조기 완판된 것에 힘입어 10만좌를 추가로 판매하고 있다. 우리은행은 유미의 세포들 캐릭터 등과 콜라보레이션해 우리WON뱅킹에서 웹툰 방식의 새로운 인터페이스를 도입하기도 했다. 이 상품은 우리WON뱅킹에서 가입이 가능하며, 일일 3만원 이내 금액으로 나에게 맞는 플랜을 정해 다양한 방법으로 입금할 수 있다. 적금 가입자를 대상으로 캐릭터 인형, 파우치, 모바일 링을 증정하기도 했다.카카오뱅크 관계자는 ""올해도 고객들께 저축할 때마다 소비 생활에서 할인 혜택을 받아볼 수 있는 파트너 상품을 꾸준히 기획해 나갈 계획""이라고 밝혔다.[한상헌 기자]▶ 네이버 메인에서 '매일경제'를 받아보세요▶ 궁금한 제조과정 영상으로 보세요. '이렇게 만들죠'▶ 아파트 살까 청약할까. 여기서 확인하세요. '매부리tv'[ⓒ 매일경제 & mk.co.kr, 무단전재 및 재배포 금지]"
2021.01.13.,"금융위, 비바리퍼블리카 포함 7곳에 마이데이터 추가 예비허가 내줘",url없음,<네이버 기사 없음>
2021.01.13.,"권중순 대전시의회의장, 마음톡톡버스 시승식 참석",url없음,<네이버 기사 없음>
