기사날짜,기사제목,네이버 뉴스 url,기사내용
2021.01.14.,넥슨 게임에 카카오게임즈 소셜 기능 더한다…전략적 파트너십 체결,https://n.news.naver.com/mnews/article/629/0000062874?sid=105,"넥슨과 카카오게임즈가 손을 잡았다. 넥슨 인기 게임에 '카카오 플랫폼'이 적용된다. /양사 제공[더팩트 | 최승진 기자] 카카오게임즈와 넥슨은 14일 넥슨 인기 게임에 카카오게임즈 '소셜마케팅모델'을 적용하는 전략적 파트너십을 체결했다.양사는 이번 제휴로 카카오게임즈의 '카카오 플랫폼' 소셜 기능에 바탕을 둔 맞춤형 솔루션 '소셜마케팅모델'을 넥슨 인기 라이브 게임에 적용해 '톡 채널 매시지' 게임 광고 등 최적화된 마케팅 활동을 해나갈 계획이다.이용자들은 게임 내 카카오 계정을 연동 시켜 카카오톡 친구의 상태를 실시간으로 확인하고 랭킹 경쟁을 펼치거나 오프라인 상태인 친구에게 초대 메시지를 발송해 함께 게임을 즐길 수 있다. 길드원들의 실시간 '길드 채팅'도 지원해 커뮤니티 활성화를 돕는다.이정헌 넥슨 대표는 ""이번 파트너십을 계기로 카카오게임즈가 갖춘 뛰어난 플랫폼 마케팅 기술을 넥슨 라이브 게임에 접목해 시너지가 날 것으로 기대한다""며 ""게임뿐 아니라 카카오 공동체와 연계한 다양한 서비스로 이용자에게 더 나은 플레이 경험을 제공하겠다""고 밝혔다.남궁훈 카카오게임즈 대표는 ""카카오게임즈만의 차별화된 소셜마케팅모델을 많은 게임 이용자 풀을 보유한 넥슨과 함께 선보이게 돼 기쁘다""며 ""이용자들이 보다 손쉽게 친구들과 소통하고 친밀하게 즐길 수 있는 환경을 제공할 수 있도록 전폭적으로 지원하겠다""고 전했다.shaii@tf.co.kr - BTS 공연 비하인드 사진 얻는 방법? [팬버십 가입하기▶]   - 내 아이돌 순위는 내가 정한다! [팬앤스타 투표하기] 저작권자 ⓒ 특종에 강한 더팩트 & tf.co.kr 무단 전재 및 재배포 금지"
2021.01.14.,"카카오맵, 집창촌부터 성생활 장소까지 유출… 카카오네비는 안전?",url없음,<네이버 기사 없음>
2021.01.14.,"""이모티콘도 구독으로"" 카카오, 월정액 상품 '이모티콘 플러스' 출시",url없음,<네이버 기사 없음>
2021.01.14.,"""GS건설 아파트 분양, 처음부터 끝까지 카톡으로 해결하세요""",https://n.news.naver.com/mnews/article/001/0012139227?sid=105,"카카오엔터프라이즈-GS건설, 카톡 기반 챗봇 서비스 계약카카오엔터프라이즈[카카오 제공. 재판매 및 DB 금지]    (서울=연합뉴스) 이효석 기자 = 카카오엔터프라이즈는 GS건설과 아파트 분양 주요 과정을 카카오톡으로 해결할 수 있는 '카카오 i 커넥트 톡' 계약을 체결했다고 14일 밝혔다.    카카오 i 커넥트 톡은 카카오톡의 채널과 챗봇 등을 결합한 인공지능(AI) 기반 비즈니스 플랫폼이다.    앞으로 GS건설 아파트를 분양받은 고객들은 카톡으로 분양·계약·납부·입주·고객 문의 등을 해결할 수 있다.    분양 과정에는 분양 위치와 아파트 평면도 확인, 분양 상담, 계약일 사전 예약 등도 가능하다.    분양 후에는 입주 안내 및 예약, 분양금 납부 확인서 발급, 입주 예정 확인서 발급, 중도금 납부 조회 등도 카톡으로 할 수 있다.    카카오엔터프라이즈는 카카오 i 커넥트 톡이 발달한 머신러닝(기계학습) 기술을 갖고 있어 우수한 문장 인식·이해 능력을 갖췄다고 설명했다.    ""요즘 어떤 아파트 분양하는지 정보 좀 알려줄래?"" 등 자연스러운 질문도 이해한다는 게 회사 측의 설명이다.    GS건설 챗봇 서비스는 올해 4월 개설 예정이다.    카카오엔터프라이즈 백상엽 대표는 ""고객은 카톡으로 편리하게 서비스를 이용할 수 있고, 기업은 고객 사용 패턴 등을 분석해 더 나은 고객 서비스를 제공할 수 있다""고 말했다.    hyo@yna.co.kr▶네이버에서도 뉴스는 연합뉴스[구독 클릭]▶[팩트체크]""코로나백신 접종 말라"" 진실은?▶제보하기<저작권자(c) 연합뉴스(https://www.yna.co.kr/), 무단 전재-재배포 금지>"
2021.01.14.,"쉽고 간단하게 연말정산 준비…카카오뱅크, 연말정산 금융 가이드 제공",url없음,<네이버 기사 없음>
2021.01.14.,"카카오모빌리티, 기아차와 손잡고 친환경 전기차 보급 나선다",url없음,<네이버 기사 없음>
2021.01.14.,"[금융권인싸] 카카오뱅크, 카카오·한투 출신 '절묘한 균형'",url없음,<네이버 기사 없음>
2021.01.14.,"수지, 23일 언택트 팬서트로 돌아온다 [공식]",https://n.news.naver.com/mnews/article/144/0000711501?sid=106,<구조 다름>
2021.01.14.,"카카오메이커스, 친환경 프로젝트 '프라임 피플' 진행",url없음,<네이버 기사 없음>
2021.01.14.,기아자동차 카카오모빌리티와 친환경 전기차 보급 활성화 위해 맞손,url없음,<네이버 기사 없음>
2021.01.14.,"[금융권인싸] 카카오뱅크, 카카오·한투 출신 '절묘한 균형'",url없음,<네이버 기사 없음>
2021.01.14.,"수지, 23일 언택트 팬서트로 돌아온다 [공식]",https://n.news.naver.com/mnews/article/144/0000711501?sid=106,<구조 다름>
2021.01.14.,"카카오메이커스, 친환경 프로젝트 '프라임 피플' 진행",url없음,<네이버 기사 없음>
2021.01.14.,"카카오게임즈-넥슨, 소셜마케팅 위해 전략적 파트너십 체결",url없음,<네이버 기사 없음>
2021.01.14.,"GS건설, 자이 아파트에 '카톡 챗봇 서비스' 제공",https://n.news.naver.com/mnews/article/079/0003455390?sid=101,"[CBS노컷뉴스 양승진 기자]카카오톡 챗봇 서비스 구현 이미지. GS건설 제공앞으로 GS건설의 자이 아파트 분양 상담, 중도금 납부, 입주 안내 등 아파트 분양 전 과정을 카카오톡으로 쉽게 해결할 수 있게 된다.GS건설은 카카오엔터프라이즈(대표 백상엽)과 아파트 분양 주요 과정을 카카오톡으로 제공하는 '카카오 i 커넥트 톡(Kakao I Connect Talk)' 사용 계약을 체결했다고 14일 밝혔다. '카카오 i 커넥트 톡'은 카카오톡 채널, 챗봇 등을 결합한 인공지능(AI) 기반 비즈니스 플랫폼이다. 익숙하고 편리한 카카오톡으로 분양 서비스를 이용할 수 있고, 복잡한 가입 절차 없이 카카오톡 본인 인증만으로 쉽게 이용할 수 있도록 한 것이 특징이다. 4월 중 오픈 예정이다.이용자는 카카오톡으로 분양 전 분양 위치, 분양 평면 안내 등 안내서비스와 분양 상담, 계약일 사전 예약 등 예약 서비스를 이용할 수 있다. 분양 후에는 입주 안내, 입주 예약 등의 서비스를 비롯해 분양금 납부 확인서, 입주 예정 확인서, 중도금 납부 조회 등 발급 및 조회 서비스까지 이용 가능하다. 입주 후에는 AS 신청·접수 내역 확인 등도 할 수 있다.기존 챗봇보다 월등히 똑똑해 졌다는 점도 특징이다. 이용자의 의도를 정확하게 파악하고 그에 맞는 답을 보여준다. 카카오 i 커넥트 톡에는 진일보한 머신러닝(Advanced ML) 기술이 적용돼 기존 챗봇보다 문장 인식·이해능력이 월등하다는 평가다. 고객의 질문을 명확히 파악할 수 있고 자주 묻는 질문이 아니더라도 문맥을 파악해 효율적인 답변을 제공한다는 것. 예를 들어 ""요즘 어떤 아파트 분양하는 지 정보 좀 알려줄래?""와 같은 물음에도 답변이 가능하다.GS건설 관계자는 ""카카오톡과 협업해 보다 쉽고 편리하게 분양정보를 고객들에게 전달할 수 있게 됐다""며 ""다양한 고객과의 소통 채널을 지속적으로 강화할 것""이라고 말했다.▶ 확 달라진 노컷뉴스▶ 클릭 한 번이면 노컷뉴스 구독!▶ 보다 나은 세상, 노컷브이와 함께broady01@naver.com저작권자 © CBS 노컷뉴스 무단전재 및 재배포 금지"
2021.01.14.,"ESG 힘 싣는 네이버·카카오, 친환경 핵심은 '데이터센터'",url없음,<네이버 기사 없음>
2021.01.14.,카톡에 넥슨 게임 올라탄다…카카오게임즈·넥슨 소셜마케팅 협약,https://n.news.naver.com/mnews/article/008/0004528496?sid=105,"[머니투데이 이진욱 기자] [넥슨 인기 게임에 '카카오 플랫폼' 적용…커뮤니티 활성화 지원 협력] 카카오게임즈.카카오게임즈와 넥슨은 14일 넥슨 인기 게임에 카카오게임즈의 '소셜 마케팅 모델'을 적용하는 전략적 파트너십을 체결했다.이번 제휴에 따라 넥슨은 카카오게임즈의 카카오 플랫폼 소셜 기능에 기반한 맞춤형 솔루션 '소셜마케팅모델'을 자사 인기 라이브 게임에 적용한다. 양사는 '톡 채널 메시지' 게임 광고 등 최적화된 마케팅 활동을 전개해 나간다는 계획이다.넥슨 이용자는 이용중인 게임을 자신의 카카오 계정과 연동할 수 있게 된다. 이용자는 카카오톡 친구의 상태를 실시간으로 확인하고 랭킹 경쟁을 펼치거나 오프라인 상태인 친구에게 초대 메시지를 발송해 함께 게임을 즐길 수 있다. 또 길드원들의 실시간 '길드 채팅'을 지원해 커뮤니티의 활성화를 돕는다.이정헌 넥슨 대표는 ""이번 파트너십을 계기로 카카오게임즈가 갖춘 뛰어난 플랫폼 마케팅 기술을 넥슨 라이브 게임에 접목해 시너지가 날 것으로 기대한다""며 ""게임뿐 아니라 카카오 공동체와 연계한 다양한 서비스로 이용자에게 더 나은 플레이 경험을 제공하겠다""고 말했다.남궁훈 카카오게임즈 대표는 ""카카오게임즈만의 차별화된 소셜마케팅모델을 많은 게임 이용자 풀을 보유한 넥슨과 함께 선보이게 돼 기쁘다""며 ""이용자들이 보다 손쉽게 친구들과 소통하고 친밀하게 즐길 수 있는 환경을 제공할 수 있도록 전폭적으로 지원하겠다""고 말했다. 이진욱 기자 showgun@mt.co.kr▶부동산 투자는 [부릿지]▶조 변호사의 가정상담소▶줄리아 투자노트 <저작권자 ⓒ '돈이 보이는 리얼타임 뉴스' 머니투데이, 무단전재 및 재배포 금지>"
2021.01.14.,토스 등 7개사 마이데이터 예비허가 획득…카카오페이는 심사 중,url없음,<네이버 기사 없음>
2021.01.14.,소상공인 버팀목자금 사흘간 236만명에 3.3조 지급,https://n.news.naver.com/mnews/article/001/0012139668?sid=101,"오후부터 미신청 40만명에 카카오 알림톡 발송 소상공인 버팀목자금 관련 상담지난 11일 오전 소상공인시장진흥공단 서울중부센터에서 한 시민이 '버팀목자금'(3차 재난지원금) 관련 상담을 받고 있다. [연합뉴스 자료사진]    (서울=연합뉴스) 박상돈 기자 = 3차 재난지원금인 소상공인 버팀목자금이 지난 11일부터 사흘간 236만 명에게 3조2천909억 원 지급됐다고 중소벤처기업부가 14일 밝혔다.    이중 일반업종 153만 명에게 100만 원씩 1조5천303억 원, 영업제한 업종 71만3천 명에게 200만 원씩 1조4천264억 원이 지급됐다. 집합금지 업종 11만2천 명에게는 300만 원씩 3천342억 원이 지급됐다.    사흘간 버팀목자금을 받은 인원은 전체 신청 대상자 276만 명의 85%에 달하는 것이다.     오전에 신청하면 오후에 지급하는 지급하는 방식은 오는 15일 신청분까지 유지된다.    중기부는 14일 오후부터는 버팀목자금을 아직 신청하지 않은 40만 명에게 카카오 알림톡으로 다시 안내할 계획이다.    이은청 중기부 소상공인정책과장은 ""온라인을 통한 신속지급 대상자의 신청은 평일, 공휴일 구분 없이 24시간 어느 때나 가능하다""며 ""알림톡을 받으면 '버팀목자금.kr'에 접속해 지원금을 신청해달라""고 말했다.    실외 겨울 스포츠시설과 부대 업체, 숙박시설, 지방자치단체가 추가한 집합금지·영업제한 업체, 지난해 1~11월 개업하고 12월 매출액이 9~11월 평균보다 감소한 소상공인은 오는 25일부터 버팀목자금을 받을 수 있다.    kaka@yna.co.kr▶네이버에서도 뉴스는 연합뉴스[구독 클릭]▶[팩트체크]주식 공매도, '개미'는 못한다?▶제보하기<저작권자(c) 연합뉴스(https://www.yna.co.kr/), 무단 전재-재배포 금지>"
2021.01.14.,"카카오게임즈, 넥슨과 전략적 파트너십 체결…유저 커뮤니티 활성화 지원",https://sports.news.naver.com/news.nhn?oid=311&aid=0001253003,<구조 다름>
2021.01.14.,"수지, 23일 데뷔 10주년 팬서트 'A Tempo' 개최",https://n.news.naver.com/mnews/article/011/0003856686?sid=106,<구조 다름>
2021.01.14.,카톡에 넥슨 게임 올라탄다…카카오게임즈·넥슨 소셜마케팅 협약,https://n.news.naver.com/mnews/article/008/0004528496?sid=105,"[머니투데이 이진욱 기자] [넥슨 인기 게임에 '카카오 플랫폼' 적용…커뮤니티 활성화 지원 협력] 카카오게임즈.카카오게임즈와 넥슨은 14일 넥슨 인기 게임에 카카오게임즈의 '소셜 마케팅 모델'을 적용하는 전략적 파트너십을 체결했다.이번 제휴에 따라 넥슨은 카카오게임즈의 카카오 플랫폼 소셜 기능에 기반한 맞춤형 솔루션 '소셜마케팅모델'을 자사 인기 라이브 게임에 적용한다. 양사는 '톡 채널 메시지' 게임 광고 등 최적화된 마케팅 활동을 전개해 나간다는 계획이다.넥슨 이용자는 이용중인 게임을 자신의 카카오 계정과 연동할 수 있게 된다. 이용자는 카카오톡 친구의 상태를 실시간으로 확인하고 랭킹 경쟁을 펼치거나 오프라인 상태인 친구에게 초대 메시지를 발송해 함께 게임을 즐길 수 있다. 또 길드원들의 실시간 '길드 채팅'을 지원해 커뮤니티의 활성화를 돕는다.이정헌 넥슨 대표는 ""이번 파트너십을 계기로 카카오게임즈가 갖춘 뛰어난 플랫폼 마케팅 기술을 넥슨 라이브 게임에 접목해 시너지가 날 것으로 기대한다""며 ""게임뿐 아니라 카카오 공동체와 연계한 다양한 서비스로 이용자에게 더 나은 플레이 경험을 제공하겠다""고 말했다.남궁훈 카카오게임즈 대표는 ""카카오게임즈만의 차별화된 소셜마케팅모델을 많은 게임 이용자 풀을 보유한 넥슨과 함께 선보이게 돼 기쁘다""며 ""이용자들이 보다 손쉽게 친구들과 소통하고 친밀하게 즐길 수 있는 환경을 제공할 수 있도록 전폭적으로 지원하겠다""고 말했다. 이진욱 기자 showgun@mt.co.kr▶부동산 투자는 [부릿지]▶조 변호사의 가정상담소▶줄리아 투자노트 <저작권자 ⓒ '돈이 보이는 리얼타임 뉴스' 머니투데이, 무단전재 및 재배포 금지>"
2021.01.14.,토스 등 7개사 마이데이터 예비허가 획득…카카오페이는 심사 중,url없음,<네이버 기사 없음>
2021.01.14.,소상공인 버팀목자금 사흘간 236만명에 3.3조 지급,https://n.news.naver.com/mnews/article/001/0012139668?sid=101,"오후부터 미신청 40만명에 카카오 알림톡 발송 소상공인 버팀목자금 관련 상담지난 11일 오전 소상공인시장진흥공단 서울중부센터에서 한 시민이 '버팀목자금'(3차 재난지원금) 관련 상담을 받고 있다. [연합뉴스 자료사진]    (서울=연합뉴스) 박상돈 기자 = 3차 재난지원금인 소상공인 버팀목자금이 지난 11일부터 사흘간 236만 명에게 3조2천909억 원 지급됐다고 중소벤처기업부가 14일 밝혔다.    이중 일반업종 153만 명에게 100만 원씩 1조5천303억 원, 영업제한 업종 71만3천 명에게 200만 원씩 1조4천264억 원이 지급됐다. 집합금지 업종 11만2천 명에게는 300만 원씩 3천342억 원이 지급됐다.    사흘간 버팀목자금을 받은 인원은 전체 신청 대상자 276만 명의 85%에 달하는 것이다.     오전에 신청하면 오후에 지급하는 지급하는 방식은 오는 15일 신청분까지 유지된다.    중기부는 14일 오후부터는 버팀목자금을 아직 신청하지 않은 40만 명에게 카카오 알림톡으로 다시 안내할 계획이다.    이은청 중기부 소상공인정책과장은 ""온라인을 통한 신속지급 대상자의 신청은 평일, 공휴일 구분 없이 24시간 어느 때나 가능하다""며 ""알림톡을 받으면 '버팀목자금.kr'에 접속해 지원금을 신청해달라""고 말했다.    실외 겨울 스포츠시설과 부대 업체, 숙박시설, 지방자치단체가 추가한 집합금지·영업제한 업체, 지난해 1~11월 개업하고 12월 매출액이 9~11월 평균보다 감소한 소상공인은 오는 25일부터 버팀목자금을 받을 수 있다.    kaka@yna.co.kr▶네이버에서도 뉴스는 연합뉴스[구독 클릭]▶[팩트체크]주식 공매도, '개미'는 못한다?▶제보하기<저작권자(c) 연합뉴스(https://www.yna.co.kr/), 무단 전재-재배포 금지>"
2021.01.14.,"""분양 전 과정 카톡으로 쉽게""…GS건설, 업계 최초 챗봇 서비스 도입",https://n.news.naver.com/mnews/article/009/0004733235?sid=101,"`카카오 i커넥트 톡`으로 분양·계약·납부·입주·고객문의 등 이용카카오톡 챗봇 서비스 예상 이미지 [사진 = GS건설] 앞으로 자이(Xi) 브랜드 아파트의 분양 상담과 중도금 납부, 입주 안내 등 분양 전 과정을 카카오톡으로 쉽게 해결할 수 있게 된다.GS건설은 카카오엔터프라이즈와 아파트 분양 주요 과정을 카카오톡으로 제공하는 '카카오 i 커넥트 톡(Kakao I Connect Talk)' 사용 계약을 체결했다고 14일 밝혔다.'카카오 i 커넥트 톡'은 카카오톡 채널, 챗봇 등을 결합한 인공지능(AI) 기반 비즈니스 플랫폼으로, 복잡한 가입 절차 없이 카카오톡 본인 인증만으로 쉽게 이용할 수 있는 것이 장점이다.이용자의 의도를 정확하게 파악하고 그에 맞는 답을 보여주는 등 기존 챗봇보다 월등히 똑똑해 졌다는 점도 특징이다. 일례로 챗봇 내 '분양 안내', '입주 안내' 등의 메뉴를 눌러 정보를 확인하는 것 뿐만 아니라 ""요즘 어떤 아파트 분양하는 지 정보 좀 알려줄래?""와 같은 자연스러운 발화도 응대할 수 있다.GS건설은 오는 4월 중 '카카오 i 커넥트 톡'를 통한 분양·계약·납부·입주·고객문의(A/S) 서비스를 제공할 예정이다. GS건설 관계자는 ""카카오톡과의 협업을 통해 보다 쉽고 편리하게 분양정보를 고객들에게 전달할 수 있게 됐다""며, ""유튜브 채널을 포함한 여러 SNS채널과 브랜드 매거진 등 다양한 고객과의 소통 채널을 지속적으로 개발해 나가겠다""고 말했다.[조성신 매경닷컴 기자 robgud@mk.co.kr]▶ 네이버 메인에서 '매일경제'를 받아보세요▶ 궁금한 제조과정 영상으로 보세요. '이렇게 만들죠'▶ 아파트 살까 청약할까. 여기서 확인하세요. '매부리tv'[ⓒ 매일경제 & mk.co.kr, 무단전재 및 재배포 금지]"
2021.01.14.,GS아파트 분양상담부터 입주안내까지 카톡으로,https://n.news.naver.com/mnews/article/366/0000652096?sid=105,"카카오톡으로 분양 상담, 중도금 납부, 입주 안내 등 아파트 분양의 전 과정을 원스톱으로 해결할 수 있게 된다.카카오엔터프라이즈는 GS건설과 아파트 분양의 주요 과정을 카카오톡으로 제공하는 ‘카카오 i 커넥트 톡’ 사용 계약을 체결했다고 14일 밝혔다.‘카카오 i 커넥트 톡’은 카카오톡 채널, 챗봇 등을 결합한 인공지능(AI) 기반 비즈니스 플랫폼이다.GS건설은 카카오톡으로 분양 고객들에게 분양/계약/납부/입주/고객문의(A/S) 서비스를 한번에 제공할 수 있다.카카오 i 커넥트 톡에는 AI 기술인 머신러닝을 적용해 고객 질문을 명확히 파악하고 자주 묻는 질문이 아니더라도 문맥을 파악해 답변을 제공할 수 있도록 설계됐다.예를 들어 챗봇 내 ‘분양 안내’, ‘입주 안내’ 등의 메뉴를 눌러 정보를 확인하는 것뿐만 아니라 ""요즘 어떤 아파트 분양하는 지 정보 좀 알려줄래?""와 같은 질문에도 응대할 수 있다.챗봇 서비스는 올 4월 중 오픈 예정이다.백상엽 카카오엔터프라이즈 대표는 ""카카오엔터프라이즈의 IT 기술을 활용해 카카오 i 커넥트 톡으로 가능한 서비스를 지속 확대할 것""이라고 했다[박현익 기자 beepark@chosunbiz.com] ▶네이버에서 '명품 경제뉴스' 조선비즈를 구독하세요▶""잔돈은 계좌로"" 편의점, 거스름돈 계좌입금서비스 시작▶선박 수주 늘었지만, 가격은 하락세… 마냥 못 웃는 조선사	저작권자 ⓒ 조선비즈, 무단 전재 및 재배포 금지"
