기사날짜,기사제목,네이버 뉴스 url,기사내용
2021.01.12.,[이루다가 남긴 것③]왜 '20대·여자'였을까…자충수 된 마케팅 전략,https://n.news.naver.com/mnews/article/421/0005104171?sid=101,"'20살 여성 대화상대' 캐릭터 전략, 남녀갈등으로 번져개발사도 성적 발화 대응전략 준비했지만…그 전에 '서비스 종료'[편집자주]""안녕, 난 너의 첫 AI 친구 이루다야."" 지난해말 돌연 등장한 대화형 인공지능(AI) 챗봇 이루다. ""너한테 많이 고마워, 알지?"" 불과 20일 만에 '만남의 안녕'이 '이별의 안녕'으로 바뀌었다. '인간의 대화'로 태어난 이루다는 소수자 차별, 혐오 발언, 성희롱 논란 등 '인간의 민낯'을 고스란히 드러내고 사라졌다. 이루다가 남긴 쟁점과 화두를 짚어봤다.스캐터랩 측은 지난해 12월 이루다를 출시하며 이루다를 '가수 블랙핑크를 좋아하고, 일상을 기록하는 것을 취미가 있는 20살 여대생'으로 소개했다. (이루다 인스타그램)© 뉴스1(서울=뉴스1) 김정현 기자 = 100억개의 카카오톡 대화를 데이터셋으로 학습해 만들어진 인공지능(AI) 챗봇 '이루다'가 논란 끝에 12일 서비스를 잠정 중단했다. 이루다를 둘러싼 논란 중 가장 여파가 컸던 사안은 '개인정보 무단 이용' 문제였지만, 애초에 논란을 촉발한 것은 이루다에 부여된 '20대 여성'이라는 캐릭터를 향해 가해진 성적인 발언이었다.◇'여성형 AI' 전략, 이루다 초반 흥행에는 도움됐지만…이루다의 개발사 스캐터랩 측은 지난해 12월 이루다를 출시하며 이루다를 '가수 블랙핑크를 좋아하고, 일상을 기록하는 것에 취미가 있는 20살 여대생'으로 소개했다. 김종윤 대표는 자사 블로그를 통해 이루다를 20살 여대생이라는 캐릭터로 설정한 이유에 대해 ""주 사용자층을 좁게는 10대 중반∼20대 중반으로 생각했기 때문에 20살 정도가 사용자들이 친근감을 느낄 나이라고 봤다""고 설명했다. 여성으로 설정한 이유에 대해서도 ""개발일정 때문""이라며 ""남자버전도 올해 중 출시하려고 했다""고 밝혔다.이처럼 '10~20대 또래 남성'을 핵심 이용자층으로 삼은 스캐터랩의 전략 자체는 초반 이루다의 인기몰이에 큰 도움이 된 것으로 분석된다. 이루다는 지난해 말 출시된 이후 10대와 20대를 중심으로 인기를 끌며 출시 2주만에 75만명의 이용자를 끌어모았다.이루다 프로필(스캐터랩 제공) © 뉴스1◇여성학계 ""AI에 성희롱 가해진 것""…AI 산·학계 ""AI는 인격아냐""그러나 이같은 전략이 결국 이루다의 발목을 잡았다.이루다는 데이터셋이 연인들 간의 대화로 구성된 AI 챗봇이다. 사용자가 입력하는 내용에 따라 성적인 발화를 할 가능성이 있었다. 실제로 일부 이용자가 이루다를 향해 음담패설을 자행했고, 이같은 대화시도가 필터링되지 않으면서 이루다와 성적인 대화를 대화를 나눈 결과가 온라인에 게시됐다.결국 일각에서는 이같은 행태를 두고 ""AI에 '성희롱'이 가해졌다""며 문제를 제기했다. 기술적으로 접근하면 현재 AI 업계·학계에서는 AI를 인격으로 여겨 '성희롱'이라고 칭하는 자체가 잘못된 인식이라는 시각도 있다. 그러나 여성형 일러스트를 프로필 사진에 걸어두고 여성스러운 말투를 쓰는 이루다를 둘러싼 논란은 결국 사회에 만연한 남녀갈등의 기폭제가 됐다. 더 많은 사용자에게 어필하기 위한 개발사의 선택이 '자승자박'으로 이어진 셈이다.© 뉴스1◇스캐터랩도 성적 발화 대책 준비했지만…""안일했다"" 지적도이루다 사태는 사실 이미 예견된 부분도 있다. 김종윤 스캐터랩 대표는 자사 블로그를 통해 ""이루다에 대한 성희롱은 이미 예상했다""며 ""인간이 성별과 상관없이 사회적으로 용인되지 않는 인터랙션(의사소통)을 한다는 건 너무 자명한 사실""이라고 설명했다.스캐터랩 측은 이에 대해 ""특정 키워드·표현에 대해 받아주지 않도록 했지만 모든 부적절한 대화를 키워드로 막을 수 있는 것은 아니라는 것이 언어의 어려운 점""이라며 ""출시 이후 사용자의 (부적절한 대화 등) 적대적(adversarial) 공격을 학습의 재료로 삼아 그 결과물을 1분기 내로 적용할 수 있을 것으로 예상 중""이라고 밝혔다.그러나 결국 남녀갈등 논란이 개인정보 무단 이용 문제로까지 번지며 1분기가 되기 전에 이루다 서비스는 잠정 중단됐다.업계 관계자는 ""남녀갈등이나 성과 관련된 문제는 어떤 서비스에서든 큰 문제로 비화될 수 있는 예민한 이슈였는데, 스캐터랩 측의 대책이 안일했던 것으로 보인다""고 지적했다.욜란데 스트렌저스와 제니 케네디의 '영리한 아내'(The Smart Wife)와 UN이 발행한 '나는 할 수 있다면 얼굴을 붉힐 것입니다'(I'd Blush If I Could) 보고서. © 뉴스1◇해외 여성학자 ""가상의 여성 대하는 방식, 진짜 여성 대하는 태도로 이어져""현재 해외 AI업계에도 일부 여성학자를 중심으로 AI가 여성 인권을 침해할 가능성이 있다는 주장이 제기되고 있다.욜란데 스트레인저스(Yolande Strangers) 호주 모나쉬 대학 조교수와 제니 케네디(Jenny Kennedy) 로열 멜버른 공과대학교 커뮤니케이션 대학 연구원은 공저인 '영리한 아내'(The Smart Wife)를 통해 ""아마존 알렉사나 구글 어시스턴트, 애플 시리 등 음성 AI 비서들은 여성의 음성이 기본으로 설정돼 있다""며 ""특히 이들은 남성 사용자들의 성희롱 등 부적절한 상황이 발생하더라도 제한적으로만 반응할 뿐""이라고 비판했다.이들은 ""가상의 여성을 대하는 방식은 진짜 여성을 대하는 태도를 반영하고 강화하며, 그 반대의 경우도 마찬가지""라고 주장했다.Kris@news1.kr▶ 네이버 메인에서 [뉴스1] 구독하기!▶  뉴스1&BBC 한글 뉴스 ▶  터닝포인트 2021 © 뉴스1코리아(news1.kr), 무단 전재 및 재배포 금지"
2021.01.12.,서해안고속도로에서 추돌사고 후 불...7천만 원 피해,https://n.news.naver.com/mnews/article/052/0001537283?sid=102,"오늘(12일) 새벽 2시쯤 충남 홍성군 서해안고속도로 목포 방향 홍성휴게소 인근에서 25톤 화물차가 앞서가던 화물차를 들이받고 불이 났습니다.불은 1시간 만에 꺼졌지만, 화물차 엔진룸이 모두 타 소방서 추산 7천만 원의 재산피해가 났습니다.경찰은 화물차 운전자가 전방 주시를 제대로 하지 않아 사고가 난 것으로 보고 있습니다.이상곤 [sklee1@ytn.co.kr]※ '당신의 제보가 뉴스가 됩니다' YTN은 여러분의 소중한 제보를 기다립니다.[카카오톡] YTN을 검색해 채널 추가 [전화] 02-398-8585 [메일] social@ytn.co.kr [온라인 제보] www.ytn.co.kr[저작권자(c) YTN & YTN plus 무단전재 및 재배포 금지] ▶ 이 시각 코로나19 확진자 현황을 확인하세요.  ▶ 대한민국 대표 뉴스 채널 YTN 생방송보기  ▶ 네이버에서 YTN 뉴스 채널 구독하기"
2021.01.12.,화살로 쏴 죽이고 '낄낄'…'고양이 N번방' 신원 파악 나섰다,https://n.news.naver.com/mnews/article/055/0000867135?sid=102,"<앵커>길 고양이를 잔혹하게 학대하고 그 사진과 영상을 퍼트린 익명 채팅방을 상대로 고발장이 접수됐습니다. 이른바 '고양이 N번방'이라고 불리는 이 채팅방에는 더 심한 학대를 부추기는 글까지 올라왔는데, 이런 행위만으로도 처벌받을 수 있습니다.신정은 기자입니다.<기자>비좁은 포획틀을 발로 차자 고양이가 괴로운 듯 몸부림칩니다.화살을 맞은 고양이는 피를 흘리며 쓰러져 있습니다.이른바 '고양이 N번방'이라고 불리는 카카오톡 익명 채팅방에 올라온 사진과 영상입니다.이 채팅방을 규탄하는 국민청원에는 엿새 만에 수십만 명이 동의했습니다.[조희경/동물자유연대 대표 : 조직적으로 학대를 아무렇지도 않게 묘사하면서 서로 주거니 받거니 하는 다른 사례에 비해 '굉장히 위험하고 너무 끔찍했다'라는 표현 외에는 할 수 없을 정도로….]경찰은 영장을 신청하고 채팅방 참여자들의 신원 파악에 나섰습니다.참여자들은 ""채팅 기록이 다 지워졌다"" ""처벌 안 받을 테니 짜릿하다""며 으스대기도 했는데, 채팅방을 없애거나 계정을 탈퇴하더라도 추적이 가능하다는 게 수사기관의 설명입니다.직접 학대한 행위뿐만 아니라 학대 영상을 올리고 공유한 것도 동물보호법 위반입니다.학대를 부추겼다면 방조 혐의로 처벌받을 수 있습니다.채팅방 내에서는 야생동물을 사냥한 것뿐이라는 주장도 나왔는데, 수렵 가능 동물은 법으로 엄격히 제한돼 있고 야생동물 학대 역시 처벌 대상입니다. 신정은 기자(silver@sbs.co.kr)▶ 코로나19 현황 속보▶ 네이버에서 SBS뉴스 구독하기※ ⓒ SBS & SBS Digital News Lab. : 무단복제 및 재배포 금지"
2021.01.12.,코스피 대형주 쏠림 현상 심화…거래대금 74.2% 차지,url없음,<네이버 기사 없음>
2021.01.12.,"'신축년엔 더 맛있어진 도넛과' 던킨, 1월 이달의 도넛 선봬",url없음,<네이버 기사 없음>
2021.01.12.,위닉스 “필터 바꾸소”..필터 할인 행사 진행,https://n.news.naver.com/mnews/article/030/0002922993?sid=105,"위닉스 핕터바꾸소 할인 프로모션위닉스는 이달 22일까지 공기청정기 필터를 할인하는 '2021 필터바꾸소' 행사를 진행한다고 12일 밝혔다.공식 홈페이지에서 진행되는 이번 행사는 43㎡ 제로 S 공기청정기, 85.8㎡ 타워프라임 공기청정기, 49.5㎡ 타워 엑스까지 전 모델 필터가 대상이다. 행사기간 동안 21% 할인된 가격으로 필터 구매가 가능하다. 위닉스 카카오톡 채널 추가 시 5000원 할인코드를 발송한다.정용철기자 jungyc@etnews.com▶ “2021년, 꼭 알아야할 클라우드 기술과 비즈니스” 21일 방송▶ 네이버 홈에서 [전자신문] 구독하기 [Copyright ⓒ 전자신문 & 전자신문인터넷, 무단전재 및 재배포 금지]"
2021.01.12.,위닉스 “필터 바꾸소”..필터 할인 행사 진행,https://n.news.naver.com/mnews/article/030/0002922993?sid=105,"위닉스 핕터바꾸소 할인 프로모션위닉스는 이달 22일까지 공기청정기 필터를 할인하는 '2021 필터바꾸소' 행사를 진행한다고 12일 밝혔다.공식 홈페이지에서 진행되는 이번 행사는 43㎡ 제로 S 공기청정기, 85.8㎡ 타워프라임 공기청정기, 49.5㎡ 타워 엑스까지 전 모델 필터가 대상이다. 행사기간 동안 21% 할인된 가격으로 필터 구매가 가능하다. 위닉스 카카오톡 채널 추가 시 5000원 할인코드를 발송한다.정용철기자 jungyc@etnews.com▶ “2021년, 꼭 알아야할 클라우드 기술과 비즈니스” 21일 방송▶ 네이버 홈에서 [전자신문] 구독하기 [Copyright ⓒ 전자신문 & 전자신문인터넷, 무단전재 및 재배포 금지]"
2021.01.12.,"'철파엠' 위아이 김요한, 입담→존재감까지 만능돌",url없음,<네이버 기사 없음>
2021.01.12.,"IT 업종, 韓 시총 30위 내 비중 63% 돌파",url없음,<네이버 기사 없음>
2021.01.12.,삼성전자·셀트리온·삼바…공매도 대기물량 47조 단기조정 우려 [전문가 전망],https://n.news.naver.com/mnews/article/009/0004732189?sid=101,"공매도 재개 전문가 진단공매도 대기자금 47조원 달해재개 땐 급등종목 조정 불가피바이오 등 중소형주 타격예고대형주, 1~2개월 후 반등할듯2008·2011년에도 같은 패턴유동성 장세는 계속 이어질것외국인 유입 상승발판 될수도◆ 숨고르는 코스피 ◆ 코스피, 0.7% 상승한 3,148 마감코스피가 상승 마감한 13일 오후 서울 여의도 한국거래소 로비  전광판에 코스피·코스닥 지수가 표시돼있다.코스피는 전 거래일보다 22.34포인트(0.71%) 오른 3,148.29, 코스닥지수는 전장보다 5.41포인트(0.56%) 오른 979.13으로 마감했다. 2021.1.13.한주형기자 금융위원회가 오는 3월 예정대로 공매도를 재개하겠다는 방침을 밝히면서 '공매도 이슈'가 증시의 주요 변수로 떠올랐다. 동학개미의 집중 매수로 증시 3000 시대를 열었는데 공매도가 부활하면 이 같은 분위기가 한풀 꺾일 것인지가 증시 참가자들의 관심사로 부각된 것이다. 전문가들은 공매도 금지 기간 중에 밸류에이션(내재가치) 대비 주가가 급등한 종목들 위주로 조정이 불가피하겠지만, 중장기적으로 보면 영향은 크지 않을 것이라고 내다봤다.12일 금융투자협회에 따르면 전일 기준으로 대차잔액은 47조7640억원을 기록하고 있다. 정부는 코로나19 대유행으로 금융시장 변동성이 심화되자 지난해 3월 16일부터 공매도를 금지했다. 당시 대차잔액은 66조9011억원이었는데, 공매도 금지 기간에 28.61% 줄었다. 대차잔액은 투자자가 빌린 뒤 갚지 않고 있는 주식을 말한다. 이는 공매도 대기 물량을 말하는데, 여전히 47조원 넘게 대차잔액이 쌓여 있는 만큼 공매도 부활 이후 단기간 조정은 불가피할 것으로 보인다. 공매도를 금지한 기간 코스피가 77.7% 급등했기 때문이다. 당시 주식을 빌린 투자자는 주가가 떨어질 것으로 예상했지만 공매도 금지 기간 주가가 급등한 상황이라 손절을 위해 청산하는 매물이 시장에 나올 수 있다.서범진 삼성자산운용 그로스본부장은 ""3월에 공매도 금지 조치를 해제하면 내재가치 대비 주가가 높은 종목을 대상으로 매도 물량이 속출해 증시가 조정을 받을 수 있다""고 밝혔다. 특히 공매도에 취약한 바이오·헬스케어 및 중소형주가 조정을 받을 가능성이 높다고 전문가들은 예상한다. 노동길 NH투자증권 연구원은 ""지난해 공매도를 금지한 뒤로 코스피200과 코스닥150 현물은 고평가가 심화됐다""면서 ""코스피200은 현재 정상화 단계로 접어들었는데 코스닥150 현물가는 고평가 추세가 더욱 강화됐다""고 밝혔다. 노 연구원은 이어 ""포괄적으로 공매도 금지 조치를 해제하면 대형주보다 중소형주에 영향이 클 것으로 보인다""고 덧붙였다.  중소형주와 달리 대형주는 조정을 거친 뒤 1~2개월 뒤면 주가가 반등할 것으로 전문가들은 예상한다. 2008년과 2011년 정부가 공매도를 한시적으로 금지했는데, 당시 코스피는 조정을 거치고 1개월 뒤 반등했던 전력이 있다. 금융투자협회에 따르면 지난해 공매도를 금지하기 직전 대차잔액이 가장 많았던 종목은 삼성전자다. 삼성전자 뒤를 이어 셀트리온, SK하이닉스, 삼성바이오로직스, LG화학, 카카오, 네이버 등이 대차잔액을 많이 쌓아뒀다. 이들은 시가총액 상위 종목인 만큼 공매도를 재개해 단기간 조정을 거쳐도 주가가 금세 반등할 것으로 전문가들은 예상한다. 서 본부장은 ""조정이 오더라도 1~2개월 안에 다시 반등할 여력이 크다""며 ""연내 경기 개선에 따라 금리가 조금씩 오르면 채권에 대한 투자 심리가 약화되면서 증시로 자금 유입이 이어질 것이기 때문""이라고 설명했다. 그는 이어 ""미국 조 바이든 행정부가 들어서면 경기부양책을 통해 시장에 유동성을 더 공급할 것이기 때문에 달러 약세가 이어질 것""이라며 ""미국이 기준금리 인상으로 기조를 바꾸지 않는 이상 유동성 장세는 이어질 가능성이 높다""고 덧붙였다. 정용택 IBK투자증권 리서치센터장은 ""공매도를 재개해도 단기간 주가가 하락할 수 있지만 다시 반등할 가능성이 높다""면서 ""최근 대형주 위주로 주가가 급등했기 때문에 공매도를 재개해도 주가 급락을 야기할 가능성은 높지 않다고 본다""고 전망했다.한편 코스피가 12일 조정을 받은 배경에 공매도 재개 조치가 깔려 있다는 분석도 나온다. 심효섭 KB자산운용 상무는 ""금융위가 3월 공매도 재개를 공식화한 것도 증시 조정에 영향을 미쳤을 수 있다""면서도 ""두 달간 코스피가 30% 이상 오르는 등 단기 급등에 따른 피로감과 차익실현 매물이 겹치면서 단기적인 조정을 받은 것으로 풀이된다""고 밝혔다. 그는 이어 ""올해 글로벌 경제지표가 전반적으로 상향될 가능성이 높아 위험자산의 전망이 긍정적인 만큼 국내 증시 역시 단기 조정 후 반등 여력이 충분할 것으로 보인다""며 ""특히 단기 조정이 이루어질 경우 외국인 자금이 새로 유입되면서 추가 상승을 위한 발판으로 작용할 수 있다""고 전망했다. 공매도(short-selling)는 주식이나 채권을 보유하고 있지 않은 상태에서 매도 주문을 내는 것을 말한다. 주식을 빌리지 않고 매도하는 '무차입공매도'와 빌려서 매도하는 '차입공매도'가 있다. 무차입공매도는 현행법상 불법이다. 차입공매도는 주식을 빌려서 매도 주문을 내고 실제로 주가가 떨어지면 주식을 싸게 사들여 상환하기 때문에 공매도 주문을 낸 투자자는 수익을 거둘 수 있다. 물론 공매도 주문을 냈는데도 주가가 오히려 상승하면 투자자는 손해를 본다. [김규식 기자 / 문가영 기자]▶ 네이버 메인에서 '매일경제'를 받아보세요▶ 궁금한 제조과정 영상으로 보세요. '이렇게 만들죠'▶ 아파트 살까 청약할까. 여기서 확인하세요. '매부리tv'[ⓒ 매일경제 & mk.co.kr, 무단전재 및 재배포 금지]"
2021.01.12.,경남 진주 국제기도원에서 34명 확진...미등록 종교시설,https://n.news.naver.com/mnews/article/052/0001537216?sid=102,경남 진주에 있는 기도원에서 코로나19 확진자가 무더기로 나와 시설이 폐쇄됐습니다.경상남도와 진주시는 어제(11일) 진주시 상봉동에 있는 국제기도원에서 확진자 29명이 발생했다고 밝혔습니다.또 최근 경남 진주 일가족 4명과 특수학교 보조교사 1명 등 5명도 기도원 관련 확진 환자로 분류되면서 관련 확진자는 모두 34명으로 늘었습니다.방역 당국은 최근 확진 판정받은 경기 남양주 확진자가 지난 3일부터 8일까지 기도원을 방문해 강의했고 참석자 가운데 부산에서도 확진 판정을 받은 사례가 있다고 설명했습니다.또 기도원이 대면 예배를 하는 등 방역수칙을 지키지 않아 수차례 지도와 과태료 처분을 했지만 지난 5일에도 대면 예배를 강행해 경찰과 함께 강제 해산 조치를 했다고 덧붙였습니다.특히 기도원은 등록되지 않은 종교시설로 신도 수는 80명이고 지난 3일부터 8일까지 외부인 180명이 출입했다고 밝혔습니다.방역 당국은 감염 확산을 막기 위해 사회적 거리두기를 2.5단계로 높였고 모든 방문자에게 검사를 받으라는 행정 명령을 내렸습니다.오태인 [otaein@ytn.co.kr]※ '당신의 제보가 뉴스가 됩니다' YTN은 여러분의 소중한 제보를 기다립니다.[카카오톡] YTN을 검색해 채널 추가 [전화] 02-398-8585 [메일] social@ytn.co.kr [온라인 제보] www.ytn.co.kr[저작권자(c) YTN & YTN plus 무단전재 및 재배포 금지] ▶ 이 시각 코로나19 확진자 현황을 확인하세요.  ▶ 대한민국 대표 뉴스 채널 YTN 생방송보기  ▶ 네이버에서 YTN 뉴스 채널 구독하기
2021.01.12.,"대한상의, 경제단체 관심도 '톱'… 호감도 1위는 무역협회",url없음,<네이버 기사 없음>
2021.01.12.,'참 괜찮은 중소기업 플랫폼' 시범 운영,url없음,<네이버 기사 없음>
