기사날짜,기사제목,네이버 뉴스 url,기사내용
2021.02.11.,소래포구 다녀간 문 대통령… 설 연휴 '민생 행보' 이어간다,https://n.news.naver.com/mnews/article/417/0000656773?sid=100,"문재인 대통령과 부인 김정숙 여사가 지난 10일 오전 인천 남동구 소래포구 전통어시장을 방문해 각종 수산물을 구입했다. /사진=뉴시스문재인 대통령이 설 연휴 기간 민생 행보를 이어간다. 연휴 전날인 지난 10일 인천 소래포구 어시장을 방문해 상인들을 격려한 것을 시작으로 국민과 직접 소통면을 넓힌다는 계획. 문 대통령은 연휴 기간 청와대에 머물며 임기 후반기 국정운영 구상에도 몰두할 것으로 예상된다.11일 청와대에 따르면 문 대통령은 이날 관저에서 국민 8명과 영상통화를 가질 예정이다. 카카오톡의 페이스톡 기능을 이용하며 통화 상대는 안광훈 신부와 여자축구 국가대표 지소연씨 등이다. 안 신부는 뉴질랜드 출신으로 50여년 전 한국에 와 철거민 등 소외계층을 위해 힘써왔다. 지씨는 한국 여자축구의 '에이스'로 평가받는다.문 대통령은 이번 통화에서 신종 코로나바이러스 감염증(코로나19)으로 어려운 시기를 보내는 국민들에게 위로와 감사의 마음을 전할 계획이다. 강민석 청와대 대변인은 ""회복·포용·도약의 한 해가 되기를 염원하며 진솔한 대화를 나눌 것""이라고 설명했다.설 당일인 오는 12일에는 국민에게 보내는 설 인사 영상을 통해 메시지를 전할 계획이다. 문 대통령은 설 연휴 전날부터 소통행보를 펼쳤다. 지난 10일 부인 김정숙 여사와 함께 소래포구 어시장을 찾아 가게 6곳에서 젓갈과 꽃게, 건어물 등을 구매했다. 소래포구 어시장은 2017년 화재로 전소됐다가 이달 초 재개장했다.문 대통령은 이번 설 연휴에 경남 양산 사저에 가지 않고 관저에 머물 것으로 전해졌다. 관저에서 별도의 가족모임도 하지 않는다. 코로나19 방역을 위한 '5인 이상 집합금지' 조치를 솔선수범해 지키는 차원이다.문 대통령은 경내에서 설 연휴를 보내면서 집권 5년차 국정운영 구상을 가다듬는데 집중할 것으로 전망된다. 우선 코로나19 3차 대유행을 조속히 안정화시키는 동시에 코로나 사태 장기화에 따라 어려움이 가중되고 있는 민생경제의 활력을 되찾는 방안을 마련하는 데 주력할 것으로 보인다.당장 시급한 현안들도 많다. 4차 재난지원금 지급과 관련해 지급 시기 및 범위 등을 놓고 당정간 갈등 양상을 빚고 있는 만큼 이에 대한 입장을 정리할 것으로 보인다. 오는 26일부터 시작되는 코로나19 백신 접종도 당면 현안이다.지난달 조 바이든 미국 행정부가 출범한 만큼 한반도 평화프로세스를 어떻게 재가동할지에 대해서도 고심할 것으로 전망된다. 문 대통령은 바이든 정부와의 소통 채널을 확보하고 조기에 한미정상회담 개최를 추진하는데 방점을 둘 것으로 보인다.김경은 기자 silver@mt.co.kr▶뜨거운 증시, 오늘의 특징주는?  ▶여론확인 '머니S설문' ▶머니S, 네이버 메인에서 보세요 <저작권자 ⓒ '성공을 꿈꾸는 사람들의 경제 뉴스' 머니S, 무단전재 및 재배포 금지>"
2021.02.11.,센스만점 언택트 '설렌타인데이' 선물은?,https://n.news.naver.com/mnews/article/003/0010341058?sid=101,"거리 두기 연장으로 인해 변경된 명절 분위기로 언택트 선물 주목식품업계, 집콕 라이프 완성할 다양한 비대면 선물 서비스 선보여[서울=뉴시스] 김동현 기자 = 사회적 거리 두기가 연장되면서 명절 선물 대표 주자인 식품업계의 선물 트렌드도 변하고 있다. 양손 가득 보따리 대신, 클릭 한 번으로 그리운 마음을 전할 수 있는 '언택트 선물'이 쏟아진다. 특히 이번 명절 연휴 마지막 날은 밸런타인데이 이기도 해 손쉽게 감사의 마음을 전할 수 있는 비대면 선물하기가 더욱 주목받고 있다. 달콤한 집콕 라이프를 완성해 줄 언택트 선물 4가지를 추천한다. ◇달콤한 집콕 디저트로 제격…'밴앤제리스'벤앤제리스는 밀도 높은 진한 맛이 특징인 아이스크림이다. 초콜릿 아이스크림에 브라우니가 들어간 '초콜릿 퍼지 브라우니', 바나나 아이스크림과 호두, 초콜릿을 한 입에 맛볼 수 있는 '청키 몽키' 등 이색적인 맛으로 유명하다.벤앤제리스는 오프라인 판매처 외에도 마켓컬리, 쿠팡 등의 새벽 배송 서비스는 물론 카카오톡 선물하기와 네이버 스마트스토어에서도 구매 가능해 만나지 못하는 가족과 연인에게 달콤한 연휴를 선물하기에 제격이다. 뿐 만 아니라 최근 서울 잠실, 홍대, 수원 인계 등에 배달 전문 매장인 DV점을 추가 오픈해 서울 및 수도권을 중심으로 총 16곳의 DV점을 운영 중이다.DV점에서는 파인트와 미니컵 제품 외에도 레몬에이드 소르베, 민트 초콜릿 청크 등 12가지 맛의 아이스크림을 스쿱으로 판매 중으로 보다 다양한 맛의 아이스크림을 선물할 수 있다. ◇고마운 마음에 아날로그 감성 한 스푼…오리온 '효정 선물세트'오리온은 이번 구정 연휴를 맞아 만나지 못하는 부모님이나 감사한 지인들에게 부담없이 마음을 전할 수있도록 온라인 한정판 '효정 선물세트' 2종을 기획했다. 효정 선물세트는 '효드림 선물세트'와 '정나눔 선물세트'로 구성됐다. 효드림 선물세트에는 초코파이情, 오징어땅콩, 땅콩강정 등 5종의 오리온 인기 과자를, 정나눔 선물세트에는 초코파이情, 초코파이情 바나나, 찰 초코파이 3종을 담았다. 선물세트 케이스에는 언택트 명절로 만나지 못하는 아쉬움을 달래줄 '효', '정' 글씨를 더해 따뜻한 마음과 아날로그 감성까지 담았다. 오리온 효정 선물세트는 주요 온라인 쇼핑몰과 카카오톡 선물하기 서비스를 통해서도 선물 가능하다.◇소고기도 언택트로…엑셀컷 소고기 선물세트명절 선물계의 스테디셀러 소고기도 올해는 언택트로 선물할 수 있다. 프리미엄 소고기를 부담 없는 가격으로 선물하고 싶다면 육가공업체 IPC에서 선보인 '엑셀컷(Excel Cut) 설 선물 세트'를 추천한다. 이번 엑셀컷 설 선물세트는 총 2종으로, 명절 선물로 선호도가 높은 '엑셀컷 LA 꽃갈비 선물세트'와 '인기 부위 4종 모듬팩 선물세트'로 구성됐다. 최상의 신선도를 유지할 수 있는 '진공 스킨 포장'과 '트레이 실링' 공법을 적용해 이중으로 포장되어 배송된다 공기를 효과적으로 차단해 미생물 번식을 막고, 장기간 위생적으로 보관할 수 있는 것이 장점이다. 배송 날짜 지정 서비스도 제공해 배송일로 지정된 날짜 3일 중 원하는 날짜를 선택하면 지정된 날짜에 배송해 일정에 맞춰 선물하기에 용이하다. 온라인몰 '미트포유'에서 구매 가능하다. ◇'혼설족' 친구를 위한 센스만점 선물…'배민 상품권'매년 명절이면 기차표를 구하기 위해 바빴지만 올해는 고향에 내려가지 못해 혼자서 집콕중인 친구가 있다면 배달의 민족의 '배민 상품권'을 선물해보는 것은 어떨까. '배민 상품권'은 배달의민족 어플리케이션 '선물하기'를 통해 최소 5,000원권부터 최대 5만원권까지 총 6종의 상품권을 구매해 선물할 수 있다. 선물하기를 통해 주고받은 상품권은 배달의민족 어플리케이션에 입점된 모든 음식점 뿐 만 아니라 배민라이더스, 배민오더, 생필품 즉시배달 서비스인 B마트에서도 이용할 수 있다☞공감언론 뉴시스 oj1001@newsis.com▶ 네이버에서 뉴시스 구독하기▶ K-Artprice, 유명 미술작품 가격 공개▶ 뉴시스 빅데이터 MSI 주가시세표 바로가기<ⓒ 공감언론 뉴시스통신사. 무단전재-재배포 금지>"
2021.02.11.,설 연휴 집콕이 답답할 때 즐겁고 안전한 롯데월드,https://n.news.naver.com/mnews/article/003/0010341109?sid=101,"어드벤처, 신축년 인생샷  명소 변신민속박물관, 전통 문화 콘텐츠 온·오프 운영아쿠아리움·서울스카이 특별 이벤트 진행[서울=뉴시스]롯데월드 민속박물관 '서낭당 알밤 소원지 체험'[서울=뉴시스]김정환 기자 = 롯데월드(대표 최홍훈)가 민족 대명절 '설'을 기념해 서울 송파구 롯데월드 어드벤처 등 사업장에서 다양한 온·오프라인 이벤트를 펼친다. 사회적 거리 두기 장기화로 모두 지친 상황에서 온 가족이 안심하고 즐길 수 있는 콘텐츠를 준비한다. 방역 활동 강화, 철저한 거리 두기 시행 등을 기반으로 파크 내 포토 스폿들을 더욱더 풍성하게 마련해 오프라인 이용 즐거움을 더하고, 온택트 활동을 다채롭게 마련해 집에서도 마음껏 즐길 수 있게 한다.  [서울=뉴시스]롯데월드 어드벤처 '루미나리에'◇인생샷 명소 재탄생 롯데월드 어드벤처는 화려한 조명들로 여느 때보다 따뜻한 분위기를 연출한다. 2021년 희망차고 따뜻한 메시지를 담아 준비한 빛의 축제 '루미나리에'다. 화이트, 네온, 은하수 세 가지 컬러가 조화를 이루는 조명 장식이 파크 곳곳을 화려하게 수놓으며 롯데월드를 동화나 애니메이션 속 배경으로 만든다.관람객은 어느 곳에 서든 삼아도 '인생 사진'을 남기기에 충분하다. [서울=뉴시스]롯데월드 어드벤처 '루미나리에'야외 공간 '매직 아일랜드'에는 별빛이 쏟아지는 '스노우 브릿지'와 '스노우 캐슬'이 있다. 화려한 조명들이 마치 은하수 속을 걷는 것 같은 느낌을 준다. 매일 오후 6시가 되면 리얼한 3D 맵핑 영상으로 '매직 캐슬'이 꽁꽁 얼어가며 새하얀 얼음 성, 스노우 캐슬로 변신하는 마법 같은 장면이 펼쳐진다.[서울=뉴시스]롯데월드 민속박물관 '겨울 동화 체험존'◇온·오프라인으로 즐기는 롯데월드 민속박물관민족의 역사와 문화유산을 미니어처로 재현한 '롯데월드 민속박물관'이 설을 맞이해 더욱더 풍성해졌다.'집콕! 랜선 박물관'에 참여했다. 송파구 소재 9개 박물관이 협력해 방학마다 운영하는 문화예술 체험 프로그램이다. 이들 박물관에서 5개 이상 프로그램에 참여하면 송파구 문화체육과 인스타그램을 통해 공식 수료증을 받을 수 있다. 학교 방학 과제로 제출 가능하다.롯데월드 민속박물관이 준비한 콘텐츠는 '겨울 세시풍속 알아보기' '미니 윷과 뜨끈뜨끈 팥 주머니 만들기' 등이다. 미니 윷과 뜨끈뜨끈 팥 주머니 만들기도 집에서 교육 영상을 보면서 연계 키트를 활용해 손쉽게 따라할 수 있다. 팥 주머니를 만들며 붉은 팥이 귀신을 쫓는다'는 전통 풍습을 자연스럽게 체득하고, 팥 주머니를 추운 겨울 보온용으로 활용하며 조상의 지혜를 깨달을 수 있다. 매일 오후 1~3시 민속박물관 입구 체험교실에서 오프라인 이용도 가능하다. '집콕! 랜선 박물관' 참여 인증 시 어린이는 박물관 관람, 팥 주머니 만들기 등을 2000원에 이용할 수 있다.롯데월드 민속박물관은 '이달의 주인공' 찾기로 2월에는 '강화도령 이원범' 이야기를 다룬다. 평민으로 살다 하루아침에 왕(조선 제25대 철종)이 된 남자로 알려진 이원범을 민속박물관에서 찾는 미션을 진행한다. 강화도에서 나무꾼으로 자란 주인공의 숨겨진 사랑 이야기를 배울 기회다. 어려운 역사를 단순하고 재미있게 접근할 수 있다.'겨울 동화 체험존'에서는 전래동화 '팥죽 할머니와 호랑이' 속으로 들어갈 수 있다. 동화 속 장면을 재현할 수 있는 포토 존, 지게·절구·맷돌 등 체험 활동이 준비돼 겨울방학 숙제를 해결하는 데 알맞다.출구에 있는 민속 신앙 구역의 '서낭당 알밤 소원지 체험'도 놓칠 수 없다. 옛날 마을을 수호하는 서낭신을 모신 곳으로 여겨진 서낭당  유래를 알아보고 선조들처럼 서낭당 나무에 신년 소원을 달며 설날을 맞이할 수 있다. 28일까지 운영한다.[서울=뉴시스]롯데월드 아쿠아리움 훔볼트 아기 펭귄◇롯데월드 아쿠아리움의 깜짝 새해 인사설 연휴 기간 롯데월드 아쿠아리움은 관람객을 위한 깜짝 설날 인사를 마련한다. 지난해 12월 태어나 생후 갓 2개월이 지난 훔볼트(Humboldt) 아기 펭귄이 주인공이다.11~14일 오전 11시50분, 오후 4시20분 등 하루 2회 극지방존 펭귄 전시 수조에서 아기 펭귄을 깜짝 공개한다. 15~24일에는 아기 펭귄의 이름 응모 이벤트를 연다. 자세한 내용은 해당 기간 롯데월드 아쿠아리움 인스타그램 확인.[서울=뉴시스]롯데월드 아쿠아리움 한복 입은 다이버 설날 인사한복 입은 다이버들도 설날 인사에 나선다. 코로나19 극복 메시지와 함께 새해 인사를 전달하는 포토 타임을 진행한다. 11~14일 오후 2시 30분, 5시 30분 등 하루 2회 메인 수조에서 이색적인 수중 퍼포먼스가 펼쳐진다.[서울=뉴시스]서울스카이 밸런타인데이 데이트◇롯데월드 서울스카이에서 복된 설, 로맨틱 밸런타인데이국내 최고 높이의 롯데월드타워 전망대 '서울스카이'는 공식 인스타그램을 통해 '설!프라이즈'를 연다. 설날을 맞이해 특별한 인사를 전하는 언택트 댓글 이벤트다. 13일까지 서울스카이 공식 인스타그램에 댓글로 지인에게 설날 인사를 남기면 추첨을 통해 '엔제리너스 커피 디저트 쿠폰'을 증정한다.  설 연휴 마지막 날이기도 한 '밸런타인데이'를 기념해 사랑하는 사람과의 잊지 못할 추억 만들기도 지원한다. 14일까지 서울스카이 인스타그램에서 연인과의 특별한 사연 댓글 이벤트를 진행한다. 추첨을 통해 국내에서 가장 높은 곳에 있는 레스토랑 '서울스카이 123라운지'(500m)에서 특별한 밸런타인데이 데이트 기회를 선물한다. 서울 야경을 조망하며 와인과 함께 프라이빗한 만찬을 마치고 서울스카이 투어도 즐길 수 있다.◇더도 말고 덜도 말고 설날 같기만 어린이의 특별한 설날을 위해  21일까지 '어린이 설날 해피위크'를 진행한다. 어린이 입장객에게 롯데월드 어드벤처 50% 할인 혜택을 지원한다.2월 한 달간 롯데월드 어드벤처(오후), 아쿠아리움 관람 등을 모두 이용할 수 있게 한 '롯데월드 완전정복 패키지'를 판매한다. 성인과 청소년 3만3000원, 어린이 2만9000원.카카오페이로 온라인 예매 고객에게 2월 말까지 롯데월드 어드벤처 50%, 롯데월드 아쿠아리움과 서울스카이 30% 할인 혜택을 준다.  특히 16~18일 '화수목' 특별 할인 기간에는 롯데월드 사업장 모두 10% 할인하는데 추가 할인도 된다. [서울=뉴시스]롯데월드 어드벤처 입장 전 체온 측정 모습◇코로나19 안전지대, 롯데월드롯데월드는 코로나19 상황에도 고객이 안심하고 시설을 이용할 수 있도록 거리 두기 단계와 관계없이 전 사업장에서 철저한 방역, 소독 활동을 전개한다. 영업 전후 전 구역 방역 소독을 차례로 진행하고, 영업 중에도 수시로 관람객 접촉이 많은 대기 라인, 에스컬레이터, 엘리베이터 등을 철저히 소독한다.입장부터 퇴장까지 관람객에게 방역 수칙을 적극적으로 안내한다. 전 사업장에서 마스크 착용은 필수다. 열화상 감지 카메라를 통한 체온 측정, 전자출입명부 체크인 또는 수기출입명부 작성 등을 마쳐야 입장 가능하다. 거리 두기와 마스크 착용을 직원들이 수시로 안내한다. 안내 방송 송출, 손 소독제 비치 확대 등을 통해 관람객이 철저히 방역 수칙을 준수할 수 있도록 유도한다.롯데월드의 방역 활동과 설 연휴·2월 나들이를 지원하는 우대 세부 내용은 홈페이지와 대표전화 확인.☞공감언론 뉴시스 ace@newsis.com▶ 네이버에서 뉴시스 구독하기▶ K-Artprice, 유명 미술작품 가격 공개▶ 뉴시스 빅데이터 MSI 주가시세표 바로가기<ⓒ 공감언론 뉴시스통신사. 무단전재-재배포 금지>"
2021.02.11.,"유튜브 전성시대, 전문가 채널 10개 | 전문가들은 왜 유튜브에 뛰어들었나",url없음,<네이버 기사 없음>
2021.02.11.,세뱃돈도 ‘언택트 송금’ 신권 교환 작년 반토막,https://n.news.naver.com/mnews/article/020/0003338256?sid=101,"비대면 설 명절 신풍속도현금 대신 주식으로 주기도시중 풀린 돈 8년만에 가장 적어회사원 전모 씨(42)는 올 설엔 빳빳한 신권 대신 ‘언택트(비대면) 세뱃돈’을 생각하고 있다. 신종 코로나바이러스 감염증(코로나19) 확산을 막기 위해 5인 이상 모임이 금지돼 만날 수 없는 고향의 조카들에게 간편송금 플랫폼 카카오페이로 5만 원씩 세뱃돈을 보낼 생각이다. 전 씨는 “중학교에 입학하는 조카를 만날 수 없어 아쉽다. 전화 덕담과 ‘랜선 세뱃돈’으로 대신해야 할 것 같다”고 말했다.  전 씨처럼 ‘비대면 설’을 준비하는 사람이 많다는 건 설 명절 전 한국은행 신권 교환 건수에서도 확인된다. 10일 한국은행에 따르면 지난달 28일부터 이달 10일까지 10영업일간 시민들이 한은 발권국 창구에서 지폐를 새 돈으로 바꿔간 건수는 약 3879건으로 지난해 같은 기간 교환실적(7090건)의 54.7%로 조사됐다. 설을 앞두고 시중에 풀린 돈도 8년 만에 가장 적었다. 같은 기간 화폐공급실적은 4조7475억 원으로 작년보다 8814억 원(15.7%) 줄었다. 현금을 찾는 수요가 그만큼 감소했다는 의미다.  최근 주식시장이 급등하면서 자녀들에게 현금 세뱃돈 대신 ‘주식 세뱃돈’을 주거나 모은 세뱃돈을 주식 계좌에 넣어주려는 부모들도 있다. 주부 한수영 씨(39·여)는 5세 아들 앞으로 들어올 세뱃돈을 지난해 만들어둔 아들 명의의 증권계좌에 넣어줄 생각이다. 한 씨는 “아들에게 줄 세뱃돈도 현금 대신 삼성전자 등 우량주 1주를 사서 넣어줄 생각”이라고 말했다.  금융권도 ‘비대면 설’ 이벤트에 들어갔다. 카카오페이는 14일까지 송금서비스로 세뱃돈을 보낼 경우 설날 메시지가 담긴 특별 송금봉투를 제공한다. 카카오페이 관계자는 “명절 이동이 제한됐던 지난해 추석 때도 ‘한가위’ 송금봉투 이용량이 2019년 대비 약 37.4% 증가했다”고 전했다. 우리은행은 14일까지 모바일뱅킹앱 WON뱅킹을 이용해 세뱃돈을 보내면 500명을 추첨해 던킨도너츠 먼치킨 10개 팩 모바일 쿠폰을 제공한다. 하나은행도 세뱃돈과 입학, 졸업 축하금 명목으로 외화적금이나 주택청약종합저축 등에 가입하면 상품 수에 따라 CU모바일 상품권 등을 경품으로 준다. 신나리 기자 journari@donga.com ▶ 네이버에서 [동아일보] 채널 구독하기▶ 영원한 이별 앞에서 ‘환생’의 문을 열다▶ 멀티미디어 스토리텔링 ‘The Original’ⓒ 동아일보 & donga.com, 무단 전재 및 재배포 금지"
2021.02.11.,임영웅×브리스톤 비하인드 화보집 발행,url없음,<네이버 기사 없음>
