기사날짜,기사제목,네이버 뉴스 url,기사내용
2021.02.25.,우수 농산물 인증브랜드 개발해 브랜드 마케팅에 박차,https://n.news.naver.com/mnews/article/005/0001414642?sid=102,"경북도, “모든 소비자 층에 호감을 이끄는 브랜드로 각인될 수 있도록 노력할 방침”경상북도 ‘우수 농산물 인증 브랜드’는 기존 범람하는 공동 브랜드와 차별화된 인증 브랜드 디자인 개발을 위해 ‘경북의 이니셜GB(Good&Best)를 모티브한 네이밍’과 ‘Good 경북, Best 농산물이란 슬로건’도 함께 마련했다.  경북도 제공경북도 우수 농산물 인증 브랜드를 새롭게 개발해 브랜드 마케팅에 박차를 가한다.경북도는 급속한 시장 개방과 외국 농산물의 수입 급증으로 농·식품의 안정성을 강조하는 소비자 요구에 적극적으로 대응하고 시대적 트렌트를 반영한 ‘우수 농산물 인증 브랜드’를 새롭게 개발해 브랜드 마케팅에 박차를 가할 계획이라고 25일 밝혔다.경북도는 소비자들에게 신뢰감을 주는 우수 농산물의 선택 기준 마련을 위해 ‘경상북도 우수 농산물 표시제’를 지난 1997년부터 전국 최초 도(道)단위로 인증·육성해 왔다.하지만 최근 들어 소비자들의 브랜드 선호와 욕구가 다양화 되고 있어 이에 발맞추기 위한 차별화 전략 차원에서 ‘경상북도 우수 농산물 인증 브랜드’를 새롭게 개발했다.최근 개발한 경상북도 ‘우수 농산물 인증 브랜드’는 기존 범람하는 공동 브랜드와 차별화된 인증 브랜드 디자인 개발을 위해 ‘경북의 이니셜GB(Good&Best)를 모티브한 네이밍’과 ‘Good 경북, Best 농산물이란 슬로건’도 함께 마련했다.도는 우리나라 대표 플랫폼 기업인 ‘카카오’에서 캐릭터와 이모티콘을 활용해 기업 홍보에 큰 성과를 내는 데 주목했다.캐릭터 2종 가운데 ‘구띠’는 좋은 품질의 농산물만 추천하는 캐릭터의 성격을 담아 Good을 모티브한 이름이며 ‘베스티’는 야무진 성격과 최고만을 고집하는 특성을 담아 Best를 모티브로 한 이름이다.  경북도 제공인증 브랜드 이외에 캐릭터(구띠, 베스티) 개발을 통해 소비자와 친근한 소통은 물론 경북 우수 농산물을 알릴 수 있는 좋은 매개체로 인식하고 다양한 채널을 통한 홍보·마케팅이나 스토리텔링을 통해 브랜드 마케팅에 적극 활용할 계획이다.캐릭터 2종 가운데 ‘구띠’는 좋은 품질의 농산물만 추천하는 캐릭터의 성격을 담아 Good을 모티브한 이름이며 ‘베스티’는 야무진 성격과 최고만을 고집하는 특성을 담아 Best를 모티브로 한 이름이다.도는 농산물에 대한 고유성과 차별성을 확보해 부가가치를 높이고 브랜드 마케팅을 핵심 전략으로 활용, 2월말 현재 총 65개 품목, 163개 조직에 대해 우수 농산물 상표 사용자로 선정·육성 중이다.도는 새로운 인증브랜드가 개발됨에 따라 시·군을 통해 매뉴얼을 배포할 계획이다.또 개발된 인증 상표에 따라 노후화된 입간판 등 교체·보수, 조례 개정(상표, 신청 자격, 인증 유효기간 등)을 통한 제도 마련과 SNS와 전광판 등 온·오프라인 홍보에도 힘쓰기로 했다.특히 사이소몰에 우수농산물 전용관을 구축해 대한민국을 대표하는 농산물 러브마크(Lovemark)로 위상을 높여 나갈 계획이다.이철우 지사는 “상품이나 브랜드 자체의 우수성도 중요하지만 감성을 소비하는 시대인 만큼 상품에 스토리를 담아야 하고 친근한 소통으로 모든 소비자층에 호감을 이끄는 브랜드로 각인될 수 있도록 노력해 나가자”고 말했다.안동=김재산 기자 jskimkb@kmib.co.kr▶ 네이버에서 국민일보를 구독하세요(클릭)▶ 국민일보 홈페이지 바로가기GoodNews paper ⓒ 국민일보(www.kmib.co.kr), 무단전재 및 수집, 재배포금지"
2021.02.25.,윤관석 정무위원장 “전금법 논쟁 과열… 이주열 ‘빅브라더’ 여론전 유감”,https://n.news.naver.com/mnews/article/417/0000662178?sid=101,"윤관석 정무위원장이 25일 서울 여의도 국회 정무위원회에서 열린 전자금융거래법 개정안에 관한 공청회에서 발언하고 있다./사진=윤관석 의원실국회 정무위원장 윤관석 의원(더불어민주당·인천 남동구 을)이 ‘전자금융거래법’(전금법) 개정안이 ‘빅브라더(사회통제권력)법’이라고 지적한 이주열 한국은행 총재에 대해 지나친 여론전을 펼치고 있다며 비난했다.윤 위원장은 25일 국회 정무위원회가 개최한 전금법 개정안 공청회에서 “빅테크 사업자의 외부청산을 둘러싼 논쟁이 기관 간의 이해관계 다툼으로 지나치게 과열되고 있다”며 “특히 공적 국가기관인 한국은행의 장이 공식적인 법안 심의과정을 통한 의견 개진이 아닌 ‘빅브라더’라는 용어까지 써가며 여론작업을 한다고 오해될 수 있는 행태를 보여 유감을 표하지 않을 수 없다”고 지적했다.윤 위원장은 “이번 개정안은 전자금융거래 사업의 혁신과 이용자 보호, 금융보안 강화를 규정함으로써 혁신금융거래서비스의 제도화는 물론 미래금융으로 나아가기 위한 가교이자 주춧돌로 볼 수 있다는 점에서 중요한 의미를 담고 있다”고 설명했다.앞서 한은과 금융위는 전금법 개정안을 놓고 갈등을 보이고 있다. 전금법 개정안은 금융위가 핀테크·빅테크에 대한 관리를 위해 전자지급거래 청산업을 신설하고 금융위가 전자지급거래청산기관인 금융결제원에 대한 감독 권한을 갖도록 하는 것이다.개정안이 통과되면 네이버·카카오페이 등 빅테크 업체들은 고객의 모든 전자지급거래 정보를 금융결제원에 의무적으로 제공해야 하고 금융위는 별다른 제한없이 해당 정보에 접근할 수 있다.금융위는 소비자 보호 차원에서 전금법 개정이 필요하다고 보는 반면 한은은 중앙은행 역할인 지급결제 업무에 금융위가 과도하게 관여하고 있다고 반발하고 있다. 또 이주열 총재는 지난 23일 국회 기획재정위원회 업무보고에서 “전금법 개정안은 빅테크 업체의 고객 거래정보를 한 곳에 모아놓고 볼수 있다는 점에서 빅브라더 문제에서 피할 수 없다""고 강조했다.박슬기 기자 seul6@mt.co.kr▶뜨거운 증시, 오늘의 특징주는?  ▶여론확인 '머니S설문' ▶머니S, 네이버 메인에서 보세요 <저작권자 ⓒ '성공을 꿈꾸는 사람들의 경제 뉴스' 머니S, 무단전재 및 재배포 금지>"
2021.02.25.,"대신증권, 리테일 호조로 실적 개선…올해는 IPO 시장에 집중",https://n.news.naver.com/mnews/article/366/0000675824?sid=101,"대신증권(003540)이 주식 거래대금 증가 등으로 인한 리테일 부문 호조에 힘입어 우수한 실적을 기록했다. 지난해 당기순이익이 큰 폭으로 개선된 가운데, 올해는 기업공개(IPO), 리츠와 대체투자, 계열사 간 협업 등에 힘을 쏟는다는 계획이다. 대신증권 제공25일 대신증권에 따르면 올해 연결기준 영업이익은 2490억원으로 전년대비 149.8% 증가했다. 같은 기간 당기순이익은 1643억원으로 74.8% 늘었다. 라임펀드 선보상, 계열사 보유세 등으로 발생한 일시적 비용(938억원)을 감안하면 큰 폭의 실적 개선세다. 대신증권 관계자는 ""일평균 주식 거래대금 증가, 홈 트레이딩 시스템(HTS), 모바일 트레이딩 시스템(MTS)를 기반으로 수익이 크게 증가했다""며 ""랩어카운트 등 금융상품 판매가 증가했고, 거액자산가(HNW) 비중도 70% 정도 늘어났다""고 말했다.주주가치 제고 측면에서도 긍정적인 평가를 받았다. 대신증권은 22년 연속 현금배당을 실시했고, 주가 안정을 위해 지난해 4분기에 300만주 자사주 매입에 나섰다. 에프앤아이, 저축은행, 자산신탁 등 자회사도 안정적으로 성장했다.올해는기업공개(IPO) 부문에서 영향력을 확대할 예정이다. 틈새시장 딜을 비롯해 대기업 계열사 상장 등에 참여해 IPO 점유율을 높인다는 것이다. 이미 한화종합화학(4~5조원), 카카오페이(10조원), LG에너지솔루션(100조원) 등 공동주관사로 선정된 상태다. 이 밖에도 리츠와 대체투자상품 부문에서는 전문성을 강화해 중장적으로 업계를 선도하겠다는 방침이다. 계열사들과 협업을 통해 종합자산관리 서비스도 선보일 계획이다.한편, 대신증권은 금융소비자 보호 강화를 위해 지난해 6월 말 조직 개편을 단행했다. 금융소비자보호총괄(CCO)과 상품내부통제부를 신설하고, 리테일 고객을 대상으로 판매한 금융상품을 점검했다. 고객들의 민원 및 구제절차, 사전예방 등을 종합적으로 관리하는 ‘대신민원관리시스템’도 도입했다.[권유정 기자 yoo@chosunbiz.com] ▶네이버에서 '명품 경제뉴스' 조선비즈를 구독하세요▶재택근무에 실내용 방향제 수출 역대 최대… ""中·日 시장 유망""▶한전, 신재생에너지 발전 진출 초읽기… 민간사업자는 반발	저작권자 ⓒ 조선비즈, 무단 전재 및 재배포 금지"
2021.02.25.,"[뉴시스 일자리대상]이재갑 고용장관 ""수상기업, 고용 확대·질도 개선""",https://n.news.naver.com/mnews/article/003/0010363817?sid=102,"""기업들 값진 노력 감사…타 기업에 전파되길""[서울=뉴시스] 이예슬 기자 = 뉴시스 주최 '제3회 대한민국 일자리대상'에서 이재갑 고용노동부 장관은 인사말을 통해 ""더 좋은 일자리를 만들기 위한 기업들의 값진 노력에 진심으로 감사드린다""고 밝혔다.이 장관은 ""신종 코로나바이러스 감염증(코로나19)으로 일자리의 어려움과 불확실성이 지속되고 있다""며 ""유례없는 위기 극복을 위해 우리 모두가 고군분투를 계속하고 있는 상황""이라고 했다.이 장관은 ""이번 수상기업들은 이미 그 선봉에 서 계신 것으로 알고 있다""며 ""고용을 크게 늘리면서도 정규직 고용, 유연근무 확대, 모성보호 등 고용의 질도 대폭 개선했다. 그러한 성과들이 다른 기업에도 전파될 수 있기를 바란다""고 말했다.이어 ""정부 역시 일자리를 하나라도 더 지키고 만들기 위해 일자리 예산을 지난해보다 20% 증액한 30조5000억원으로 편성, 조기 집행하고 있다""며 ""한국형 실업부조인 국민취업지원제도를 시행하는 등 고용위기 극복에 역량을 집중하고 있다""고 덧붙였다.[서울=뉴시스]홍효식 기자 = 김형기 뉴시스 대표이사가 25일 오후 서울 중구 플라자호텔에서 열린 2021 대한민국 일자리 대상 시상식에서 인사말을 하고 있다. 2021.02.25. yesphoto@newsis.com이날 행사에서는 카카오가 종합대상인 경제부총리상을 수상했다. 한국투자증권이 특별대상인 대통령 직속 일자리위원회 부위원장상을 받았다. 고용노동부 장관상에 컬리와 KB국민카드, 국토교통부 장관상에 LH한국토지주택공사, 산업통상자원부 장관상에 기아자동차, 과학기술정보통신부 장관상에 우아한형제들, 여성가족부 장관상에 CJ제일제당, 해양수산부 장관상에 HMM, 환경부 장관상에 GC녹십자, 중소벤처기업부 장관상에 썸비스, 농림축산식품부 장관상에 한국농어촌공사, 국회 정부위원장상에 미래에셋대우와 하나금융투자, 국회 환경노동위원장상에 한국야쿠르트와 SR이 선정됐다．☞공감언론 뉴시스 ashley85@newsis.com▶ 네이버에서 뉴시스 구독하기▶ K-Artprice, 유명 미술작품 가격 공개▶ 뉴시스 빅데이터 MSI 주가시세표 바로가기<ⓒ 공감언론 뉴시스통신사. 무단전재-재배포 금지>"
2021.02.25.,내달 가맹종합지원센터 개소…가맹점주 상담부터 소송까지 지원,https://n.news.naver.com/mnews/article/421/0005187510?sid=101,"공정거래조정원, 올해 처음으로 업무계획 브리핑조정원→진흥원 개편해 업무확대…정부입법으로 추진신동권 한국공정거래조정원장. 2020.10.8/뉴스1 © News1 박세연 기자(세종=뉴스1) 서미선 기자 = 한국공정거래조정원이 가맹분야 종사자의 분쟁 단계별 고충과 애로를 해소하기 위해 오는 3월 가맹종합지원센터를 정식 개소해 본격적인 운영에 들어간다. 조정원은 25일 이같은 내용을 담은 2021년 주요업무 추진계획을 발표했다. 조정원은 업무홍보 강화 차원에서 이번에 업무계획을 처음으로 공식 브리핑했다.센터는 최초 분쟁 발생 시 가맹사업거래 관련 분쟁조정 데이터 등을 활용해 전문 고충상담 서비스를 상시 제공한다.분쟁조정으로 구제받지 못한 가맹점사업자에겐 공정거래위원회 신고나 소송대리, 소장 작성 등 소송 진행까지 지원한다.분쟁을 사전 예방하고 불공정거래행위에 효과적으로 대응하기 위한 가맹점사업자 피해예방 교육, 가맹본부 법준수 교육도 한다.조정원 관계자는 ""작년 하반기엔 예산 확보가 안 된 상태에서 시범사업 센터를 운영했고 올해는 4억원 규모 사업비가 배정됐다""며 ""25만명 점주에 특화해 분쟁 발생부터 소송 지원까지 종합 지원한다""고 설명했다. 센터는 정규직 6명에 인력을 추가 채용한다.더불어 사업자 대상 공정거래 교육 시스템을 완비해 향후 공정위 교육이수명령과 연계한 법위반 사업자 대상 법준수 교육 수행을 추진한다.현재 분쟁조정·공정거래 연구에 한정돼있는 조정원의 업무범위를 넓히기 위해 '공정거래진흥원'으로 개편도 추진한다. 이를 위해선 공정거래법 개정이 필요하다. 지난 20대 국회에선 의원입법으로 개정안이 발의됐으나 폐기됐다.신동권 조정원장은 ""공정위가 (진흥원 개편 추진을) 올해 업무계획에서 밝힌 만큼 정부안으로 (개정을) 추진하지 않을까 한다""고 부연했다.조정원은 공정거래협약 이행평가 신뢰성 제고와 함께, 자율준수프로그램(CP) 등급평가 수행을 통해 자율준수 문화 확산에도 기여할 방침이다.공정위의 효과적 법 집행을 위해 연구기능은 강화한다.디지털경제에 대비해 온라인플랫폼 사업자의 불공정거래 행위 관련 연구, 온·오프라인 유통시장의 공정거래 관련 연구를 수행하고 디지털 시장 독과점 현황 및 경쟁 저해 요인도 분석한다.국내외 동의의결 사례 조사·분석 등을 통해 동의의결 이행점검 실효성을 높일 방안을 연구하고, 공정거래 법령 제·개정 관련 연구를 통해 사회·경제적 환경변화에 발맞춘 입법조치를 지원한다.신종 코로나바이러스 감염증(코로나19)으로 조정원 방문이 어려운 당사자에겐 '찾아가는 분쟁조정서비스' 제공을 강화한다. 작년엔 53건이 이뤄졌고 올해 더 확대할 계획이다.카카오톡, 누리집 상담 등 비대면 민원상담 비중을 늘리고 중소사업자 대상 피해구제·예방을 위한 온라인 교육을 확대하며, 디지털 회의 등 비대면 분쟁조정 협의회 시스템 구축·운영도 추진한다.또 최초 민원상담시 분쟁유형별 조정사례와 대처방안 등 전문적 서비스를 통해 당사자 간 자율해결을 촉진(1단계)하고, 어려울 경우 분쟁조정 절차로 바로 이어져 피해구제를 받도록 안내하는 원스톱 서비스 제공(2단계)을 강화한다.새로 수행하게 될 동의의결 이행관리 업무를 조기 안착시키는 것도 목표다. 조정원은 상시적인 팀을 만들어 운영할 계획이다. 대리점, 온라인플랫폼 등 분야별 거래특성을 반영한 이행점검 방안도 마련한다.동의의결은 제재 대상이 된 기업이 공정위에 먼저 자진시정 계획을 내고 공정위가 이를 인정하면 법 위반 여부를 따지지 않고 사건을 종결하는 제도다.최근 공정위가 애플이 신청한 동의의결안을 수용하기로 결정한 건은 이행감시인이 회계법인으로 지정돼 조정원의 점검 대상은 아니다.smith@news1.kr▶ 네이버 메인에서 [뉴스1] 구독하기!▶  뉴스1&BBC 한글 뉴스 ▶  터닝포인트 2021 © 뉴스1코리아(news1.kr), 무단 전재 및 재배포 금지"
2021.02.25.,온라인 매출 타고 훨훨…역대급 실적에 웃는 가구업계,https://n.news.naver.com/mnews/article/025/0003080550?sid=101,"까사미아는 25일 온라인 전용 가구 브랜드 ‘어니언’의 최근 5개월간 매출이 직전 대비 약 110% 늘었다고 밝혔다 [사진 까사미아]            신종 코로나바이러스 감염증(코로나19)의 여파로 비대면 소비가 일상화하며 가구업계의 온라인 매출이 급증하고 있다. 재택근무와 원격수업으로 집에 머무는 시간이 길어지자 홈 인테리어를 위해 가구를 온라인으로 주문하는 경우가 늘어서다. 이 같은 분위기에 힘입어 가구업계는 코로나19 상황에서도 역대급 실적을 이어가고 있다.      신세계그룹의 가구업체 까사미아는 25일 온라인 전용 브랜드 ‘어니언’의 최근 5개월(2020년 10월~ 2021년 2월) 매출이 직전 5개월 대비 110% 성장했다고 밝혔다. 어니언은 실용성과 가성비에 중점을 둔 중저가 제품군으로 온라인을 통해서만 판매 중이다. 까사미아의 온라인 쇼핑몰은 지난해 7월 ‘굳닷컴’으로 개편 후 전보다 매출이 153% 늘었다.       엄경미 까사미아 온라인팀장은 “비대면 소비가 확산해 온라인으로 가구를 구매하는 소비자가 많아졌다”며 “올해는 온라인 전용 가구의 품목 수를 기존보다 40%가량 늘리는 등 언택트 전략을 강화할 예정”이라고 밝혔다.      ━   가구 매출 절반은 온라인 판매      지난해 가구업계 실적. 그래픽=김현서 kim.hyeonseo12@joongang.co.kr           온라인 판매 호조는 가구업계 전체 매출을 끌어올리고 있다. 통계청에 따르면 지난해 가구 소매 판매액은 10조1865억원(잠정치)으로 전년 대비 24% 늘었다. 이 중 온라인 거래액은 4조9880억원으로 전년 대비 44% 증가하며 전체 가구 판매액의 절반 가량을 차지했다.      가구업계 관계자는 “가구의 경우 매장에서 직접 제품을 확인한 뒤 구매하는 경향이 강했지만 코로나 사태 이후 온라인으로 구매창구가 옮겨가고 있다”며 “집에 있는 시간이 길어지다보니 소파·탁자·책상·수납장 등 가정용 가구 전반에 대한 소비가 늘었다”고 말했다.      변화하는 소비패턴 덕분에 가구업체들은 지난해 역대급 실적을 올렸다. 한샘은 지난해 매출 2조674억원을 기록하며 사상 최대 실적을 기록했다. 이 회사가 매출 2조원을 넘긴 것은 지난 2017년 이후 3년 만이다. 온라인 사업 매출은 2372억원으로 전체 사업부문 중 가장 높은 증가율(40%)을 나타냈다.      현대리바트도 지난해 매출 1조3846억원으로 2018년 기록했던 역대 최대 매출(1조3517억원)을 넘어섰다. 온라인 부문 매출은 전년 대비 18% 증가했다. 까사미아도 전년보다 38% 늘어난 1633억원의 매출을 기록하며 목표였던 1600억원을 초과 달성했다. 온라인 부문 매출이 48% 성장하며 전체 실적을 끌어올렸다.     ━   “온라인 매출 호조는 계속”      현대리바트는 지난해 12월 실시간 중계를 통해 상품을 소개하고 판매하는 라이브 커머스 채널 ‘리바트LIVE’를 선보였다 [사진 현대리바트]           가구업계는 이 같은 상승 분위기가 올해도 이어질 것으로 전망하고 있다. 인터넷·모바일을 통한 가구 구매 연령대가 기존 20·30대에서 40·50대로 올라가고 있기 때문이다. 게다가 온라인 판매의 경우 매장 임대료와 인건비가 들지 않기 때문에 기존 오프라인 판매와 비교해 비용 부담이 적다. 홈 인테리어에 대한 관심이 높아지며 집 꾸미기 수요가 증가한 것도 호재다.       온라인 구매 수요를 충족시키기 위해 비대면 판로 확장에도 집중하고 있다. 현대리바트는 지난해 12월 온라인 판매처인 ‘리바트몰’에 가상현실(VR) 기술을 적용했다. 매장에 가지 않아도 제품을 자세히 확인할 수 있도록 하고 모바일 애플리케이션을 통해서도 제품 구매가 가능하도록 했다. 실시간 중계를 통해 상품을 소개하고 판매하는 라이브 커머스 채널 ‘리바트LIVE’도 선보였다.       한샘 역시 이달부터 온라인 ‘한샘몰’에 라이브 커머스 채널 ‘샘LIVE’를 개설하고, 카카오톡 채널을 통해 특정 기간 제품을 대여해 이용할 수 있는 가구 구독 서비스를 시작했다.      김경미 기자 gaem@joongang.co.kr   ▶ 네이버 구독 첫 500만 중앙일보 받아보세요▶ 넌 뉴스를 찾아봐? 난 뉴스가 찾아와!▶ 당신이 궁금한 코로나ⓒ중앙일보(https://joongang.co.kr), 무단 전재 및 재배포 금지"
2021.02.25.,하니 해명… 사랑하는 사람?,url없음,<네이버 기사 없음>
2021.02.25.,"빙그레 꽃게랑, 오뚜기 ‘꽃게랑면’으로 재탄생",url없음,<네이버 기사 없음>
2021.02.25.,"하니 해명, ""사랑하는 사람 발언? 열애 아냐"" [공식]",url없음,<네이버 기사 없음>
