기사날짜,기사제목,네이버 뉴스 url,기사내용
2021.02.25.,카카오 주식 액면분할…'제2의 네이버' 기대?(종합),https://n.news.naver.com/mnews/article/001/0012226739?sid=101,"소액주주 접근성↑카카오 사옥[카카오 제공. 재판매 및 DB 금지]    (서울=연합뉴스) 박원희 기자 = 카카오가 25일 주식을 액면분할 하기로 결정하면서 주가에 어떤 영향을 끼칠지 관심이 쏠린다.    이날 카카오는 이사회를 열고 유통주식 수 확대를 위해 보통주 1주당 가액을 500원에서 100원으로 분할하기로 했다. 이에 따라 카카오의 발행 주식 수는 8천870만4천620주에서 4억4천352만3천100주로 늘어난다.    카카오는 이번 분할에 대해 ""주당 주가를 낮춰 보다 다양한 시장 참여자들이 카카오에 투자할 수 있도록 접근성을 높이고자 한다""고 설명했다.    이와 관련해 소액주주들의 접근성이 개선되면서 주가에 긍정적 영향을 끼칠 수 있다는 분석이 나온다.    앞서 네이버 또한 2018년 10월 주식 1주를 5주로 쪼개는 액면분할을 단행한 바 있다. 이로써 70만원대에 달하던 주가는 13만원대로 낮아졌다. 네이버의 최근 종가는 38만3천원이다.    삼성전자의 경우 2018년 5월 4일 액면분할로 분할 직전 265만원이던 주가가 5만3천원으로 낮아지면서 소액주주 수도 대폭 늘었다.    삼성전자 지분을 1% 이하로 보유한 소액주주는 액면분할을 시행하기 전인 2018년 3월 31일 기준 24만1천414명에서 작년 6월 30일 145만4천373명으로 5배 늘었다.    삼성전자 주가는 액면분할을 단행한 2018년 5월 4일부터 최근까지 60.94% 상승했다.    안재민 NH투자증권 연구원은 ""액면분할로 실적 등에 있어서 달라지는 건 없다""면서도 ""개인 투자자의 입장에서 50만원에 가까운 (카카오) 주가가 부담될 수 있었는데 그런 부분을 완화할 수 있어 거래량이 늘어날 수 있다""고 설명했다.    현재 카카오의 경우 김범수 이사회 의장 등 최대주주가 지난달 19일 기준으로 약 2천2백51만여주(25.42%)를 보유하고 있다. 외국인은 지난 24일 현재 3천42만여주(34.3%)를 보유 중이다. 발행 주식 수에서 이들을 뺀 나머지 주식 수는 3천567만여주다.    카카오 신주는 오는 4월 15일 상장될 예정이다. 4월 12∼14일에는 거래가 정지된다.    카카오는 내달 29일 주주총회에서 해당 안건을 상정할 예정이다.    encounter24@yna.co.kr▶네이버에서도 뉴스는 연합뉴스[구독 클릭]▶[팩트체크]각국 정상들이 백신 접종 '1호'?▶제보하기<저작권자(c) 연합뉴스(https://www.yna.co.kr/), 무단 전재-재배포 금지>"
2021.02.25.,"카카오 김범수 ""빌 게이츠가 모델…기부금 묵히지 않고 팍팍 쓰겠다""",https://n.news.naver.com/mnews/article/003/0010364563?sid=101,"▲25일 직원 간담회 '브라이언톡 애프터'에 자리한 김범수 카카오 이사회 의장 (사진=카카오 제공) 2021.02.25[서울=뉴시스] 이진영 기자 = '5조원 기부'를 결정한 카카오 창업자 김범수 이사회 의장이 25일 롤모델로 마이크로소프트(MS) 창업자 빌 게이츠를 꼽았다. 또 기부금을 디지털 격차 해결, 미래를 준비하는 사람들과 인공지능(AI) 인재 등에 투자하고 싶다고 말했다. 그는 또 기부금을 묵히는 것이 아니라 사회문제 해결을 위해 필요한 곳에 통 크게 바로 쓸 것이라고 예고했다. 김 의장은 이날 오후 2시부터 온라인으로 개최한 '브라이언톡 애프터' 행사에서 자신의 기부에 대한 생각을 공유하고 사내 아이디어를 수렴했다. 이를 카카오 공동체 임직원 5600여명이 경청하고 의견을 공유했다. 앞서 김 의장은 지난 8일 살아가는 동안 재산의 절반을 기부한다는 계획을 밝힌 바 있다. 그는 주식 자산만 10조원이 넘는 것으로 추정된다. 그는 빌 게이츠를 자신의 기부 롤모델로 지목했다. 빌 게이츠는 MS를 설립해 컴퓨터 운영체제로 세계 최고의 부자가 된 후 아내와 함께 '빌 앤드 멀린다 게이츠 재단'을 운영하며 기부 활동을 활발히 하고 있다. 김 의장은 ""사회문제 해결·거버넌스 롤모델은 빌 게이츠다""며 ""빌 게이츠는 창업을 하고 '빌 게이츠 재단'을 만들었다. 기업이 저렇게 할 수도 있구나 라는 생각을 처음하게 됐고, 벤치마킹하게 됐다""라고 설명했다. 그는 또 '기부서약', '창조적 자본주의'라는 화두도 던졌다. 김 의장은 ""최근에 기부 서약도 빌 게이츠 재단에서 만든 것인데, 미국 사회에서 IT 기업인들은 그 서약을 하는 게 문화처럼 퍼졌다""며 ""대한민국도 퍼질 수 있는 환경, 거기까지 가보면 어떨까 하는 생각을 했다. 빌 게이츠가 역설한 '창조적 자본주의'도 우리도 적용해서 풀 수 있는 문제가 있을 것이라 생각한다""라고 언급했다. 국내서 역대급 규모의 기부를 결심한 그가 빌 게이츠와 같은 기부 리더십을 발휘해 한국의 소극적인 기부 문화에 파란을 일으킬지 주목된다. 향후 AI 캠퍼스 설립 등 중점 기부 분야에 대한 아이디어도 공유했다.▲김범수 카카오 의장김 의장은 ""미래를 준비하는 사람들, 디지털 교육 격차 등으로 기회를 얻지 못한 사람들, 인공지능(AI) 인재들에 관심이 있다""며 ""엔지니어, AI 인재 양성을 하이브리드로 할 필요가 있다. 인재 양성을 위한 AI 캠퍼스도 고민 중이다. 온라인뿐만 아니라 오프라인으로도 참여할 수 있는 구조를 만들려고 한다""라고 알렸다. 젊은이들이 스타트업에서 활발히 도전할 수 있도록 구조적인 역할을 하겠다는 뜻도 내비쳤다. 김 의장은 ""스타트업이 많으면 많을수록 좋을 거 같다""며 ""지원하는 구조는 계속 나와야한다""라고 진단했다. 이어 ""언젠가는 카카오내에서 또는 카카오의 자녀들이 스타트업에서 빨리 경영할 수 있는 구조도 나오면 좋을 거 같다""며 ""스타트업이 진로의 옵션이 됐으면 좋겠다. 좋은 대학 나와 좋은 직장 가는 것의 비중이 제일 큰데 그러지 않고 다양하게 만들어지는 구조가 됐으면 한다""라고 제시했다. 김 의장은 기부가 속도감 있게 이뤄질 것을 예고했다. 그는 ""기부금을 묵혀두는 개념이 아니라 필요한 곳에 바로 써나가고 싶다""며 ""1년이면 1년, 단위를 정해 몇천 억원 수준을 쓰는 구조로 가고 싶다. 대규모 자본을 투입해 몇 가지 사회 문제라도 풀 수 있으면 좋겠다""라고 강조했다. 향후 기부금 활용은 프로젝트 방식을 염두에 뒀다. 김 의장은 ""카카오도 기술로 더 나은 세상을 만들 수 있는 시도를 활발히 해왔지만 기업이라는 특성상 수익성을 고려해야 해 한계가 있었다. 재산 기부는 카카오가 접근하기 어려운 걸 개인적으로 풀어가보고 싶었던 것""이라며 ""제가 추구하는 방식은 프로젝트이다. 문제를 해결하기 위해  우선순위를 만들고, 전략적으로 뭘 만들고, 이런 것이 아니라 이게 문제같은데? 싶으면 그냥 해보시죠, 이거 해보시죠, 하는 식으로 풀어 보고 싶다""라고 밝혔다.▲김범수 카카오 의장 (사진=카카오 브랜드 커뮤니케이션 채널 '카카오 나우' 캡처)그의 카카오 임직원들이 기부금을 통한 변화를 이끌 주체로 나서줄 것을 주문했다. 김 의장은 ""어떠한 '문제'를 해결하는 게 카카오에겐 익숙하다""며 ""비즈니스모델에 대한 고민도 덜해서 훨씬 재미있는 게 많이 나올 것 같다. 별 검증없이 자유롭게 여러 시도를 할 수 있는 구조가 나왔으면 하는 바람이 있다. 100명의 CEO들의 역할처럼 100개의 프로젝트가 생겼으면 좋겠다. 기본적으로 여기있는 크루들은 변화의 주체자라고 생각한다""라고 말했다. 최근 불거진 직장내 괴롭힘에 대해서는 사내문화에 경고등이 켜진 것이라 파악하고 배려를 주문했다. 앞서 지난 17일 직장인 익명 커뮤니티 블라인드에 올라온 카카오 직원 추정 이용자의 유서 형식의 글을 계기로, 직장 내 괴롭힘, 인사평가제, 보상 관련 문제 등에 대한 불만이 제기된 바 있다. 김 의장은 ""직장 내 누군가에게 해를 끼치거나 해를 끼치는 의도는 없었지만 누군가에게 상처를 주거나 하는 것은 정말 조심해야한다. 이는 서로 간의 약속이고 배려다""면서 ""카카오 내에선 절대로 누군가를 무시하거나 괴롭히는 행위는 절대로 없어야 한다""라고 역설했다. 또한 ""이번 이슈는 사내 문화에 경고등이 켜진 것이라 생각한다""라며 ""실수했을 때 어떻게 반응하고 사과하느냐에서 회사 문화가 드러난다. 카카오 공동체가 건강한 조직이 됐으면 한다""고 덧붙였다.한편 카카오는 다음달 2일 인사평가제도 등 임직원들이 느끼는 문제를 공유하고 개선방향에 대해 의견을 나눌 수 있는 오픈톡을 추진할 예정이다. 오픈톡은 카카오 전 직원이 참여해서 자유롭게 의견주고 받는 내부 행사 명칭이다. 리더 중 누가 참석할지는 정해지지 않았다．☞공감언론 뉴시스 mint@newsis.com▶ 네이버에서 뉴시스 구독하기▶ K-Artprice, 유명 미술작품 가격 공개▶ 뉴시스 빅데이터 MSI 주가시세표 바로가기<ⓒ 공감언론 뉴시스통신사. 무단전재-재배포 금지>"
2021.02.25.,카카오 주식 액면분할한다…500원→100원,https://n.news.naver.com/mnews/article/081/0003166742?sid=101,"카카오카카오는 25일 이사회를 열고 유통주식 수 확대를 위해 보통주 1주당 가액을 500원에서 100원으로 분할하기로 결정했다고 공시했다.이에 따라 카카오의 발행 주식 수는 8870만 4620주에서 4억 4352만 3100주로 늘어난다.신주는 오는 4월 15일 상장될 예정이다. 4월 12∼14일에는 거래가 정지된다.카카오는 다음달 29일 주주총회에서 해당 안건을 상정할 예정이다.신진호 기자 sayho@seoul.co.kr▶ 네이버에서 서울신문 구독하기 클릭!  ▶ [인터랙티브] 코로나 청년 잔혹사   ▶ [나우뉴스] 세상에 이런 일이ⓒ 서울신문(www.seoul.co.kr), 무단전재 및 재배포금지"
2021.02.25.,"'5조 기부' 카카오 김범수 ""묵히지 않고 바로 쓰겠다""",https://n.news.naver.com/mnews/article/009/0004754941?sid=105,"카카오 직원들과 사내 간담회""묵히지 않고 필요한 곳 투입디지털 교육격차 등 해결""""스타트업 많을수록 좋아인재 양성 'AI 캠퍼스' 추진""""최고 인재에 최고 대우"" 강조 김범수 카카오 이사회 의장이 최근 발표한 5조원 이상 대규모 사회 환원 계획과 관련해 ""묵히지 않고 필요한 곳에 바로 쓰고 싶다""며 사회 문제 해결에 해마다 수천억 원씩 사재를 투입하겠다고 밝혔다. 교육 격차 극복, 인공지능(AI) 인재 양성, 창업 생태계 활성화 같은 사회 문제 해결을 위해 ""100개의 프로젝트가 생겼으면 좋겠다""고 당부했다. 카카오 공동체의 '소통'과 '화합'도 강조했다. 최근 카카오의 인사평가 방식과 보상에 대한 불만을 진화하기 위한 것으로 풀이된다.김 의장은 이날 오후 2시부터 온라인으로 열린 카카오 사내 간담회 '브라이언톡 애프터'에서 ""대규모 자본을 투입해 몇 가지 사회 문제라도 풀 수 있으면 좋겠다""며 ""100명의 CEO들의 역할처럼 100개의 프로젝트가 생겼으면 좋겠다. 여기 있는 크루(카카오 임직원)들은 변화의 주체""라고 강조했다. 그는 ""사회문제 해결 롤모델은 빌 게이츠""라며 ""대한민국도 기부 서약이 퍼질 수 있는 환경이 됐으면 좋겠다. 빌 게이츠가 역설한 '창조적 자본주의'도 우리가 적용해 풀 수 있는 문제가 있을 것""이라고 덧붙였다.이날 간담회에서는 사전 조사를 통해 140개가 넘는 직원들의 사회 환원 아이디어가 취합됐다. 문화재 환수, 아동 보호 등 사회 전반에 걸친 개선 계획이 논의됐다. 간담회는 지난 8일 김 의장이 10조원에 달하는 재산의 절반을 사회에 환원하겠다고 선언한 뒤 첫 공식 행보다. 카카오는 이날 김 의장에게 사전 질문을 전달한 직원 중 60여 명을 선발해 오프라인 간담회 현장과 원격 영상회의에 초대했다. 다른 카카오 공동체 임직원들은 '카카오TV'를 통해 2시간 동안 진행되는 실시간 생중계로 간담회에 참석했다.  특히 김 의장은 ""미래를 준비하는 사람들, 디지털 교육 격차 등으로 기회를 얻지 못한 사람들, AI 인재들에 관심이 있다""며 ""엔지니어와 AI 인재 양성을 병행하기 위해 온·오프라인으로 참여할 수 있는 'AI 캠퍼스'도 고민 중""이라고 설명했다. 이어 ""스타트업이 많으면 많을수록 좋을 거 같다. 지원하는 구조는 계속 나와야 한다""며 ""카카오 내에서 또는 카카오의 자녀들이 스타트업에서 빨리 경영할 수 있는 구조도 나왔으면 좋겠다. 좋은 대학 나와 좋은 직장 가는 비중이 제일 큰데, 그러지 않고 다양하게 만들어지는 구조가 됐으면 한다""고 했다.김 의장은 이날 사내 괴롭힘 같은 인사 문제와 평가 보상 체계를 개선하겠다고 선언했다. 카카오는 지난해 매출과 이익이 모두 최고 기록을 경신하며 급성장했지만, 이에 따른 성장통도 겪고 있다. '자신과 같이 일하고 싶지 않기를 원하는 동료의 비율'을 공개하는 인사평가 방식이 적절하지 못하다는 지적이 나왔다. 김 의장은 ""이번 이슈는 사내 문화에 경고등이 켜진 것""이라며 ""카카오 내에선 절대로 누군가 무시하거나 괴롭히는 행위는 절대 없어야 한다. 반드시 바로잡아야 한다""고 강조했다.매출과 영업이익이 급성장한 데 비해 보상이 인색한 것이 아니냐는 지적에 대해선 ""최고의 인재에겐 최고의 대우를 해줘야 한다는 생각을 한다. 카카오는 지금 당장 부족한 면은 있을 수 있지만, 우리 산업군에서는 보상이 많은 회사가 되었으면 좋겠다""며 ""경쟁사보다 보상이 적다면 빨리 개선해야 한다. 장기 변화는 시간을 좀 줬으면 좋겠다. 현재 균형을 못 맞출 수는 있으나 장기 관점으로 맞춰 나가겠다""며 양해를 구했다. [오대석 기자]▶ '경제 1위' 매일경제, 네이버에서 구독하세요▶ 이 제품은 '이렇게 만들죠' 영상으로 만나요▶ 부동산의 모든것 '매부리TV'가 펼칩니다[ⓒ 매일경제 & mk.co.kr, 무단전재 및 재배포 금지]"
2021.02.25.,카카오 김범수 5조원 기부 청사진.. 엔지니어 양성 ‘AI 캠퍼스’ 만든다,https://n.news.naver.com/mnews/article/014/0004591161?sid=105,"대규모 자본투입 사회문제 해결도 카카오 창업자 김범수 의장이 25일 '브라이언톡 애프터'를 진행하고 있다. 카카오 제공 카카오 창업자 김범수 이사회 의장이 개인자산 절반 이상인 '5조원 대 기부 프로젝트' 청사진을 제시했다. 인공지능(AI) 등 기술 엔지니어를 양성할 수 있는 'AI 캠퍼스' 설립계획을 밝힌 것이다. 또 대규모 자본을 투입해 사회문제를 해결하는 데 앞장선다는 목표도 제시했다.   김 의장은 25일 '브라이언톡 애프터'를 열고 카카오 공동체 임직원들과 온라인 간담회를 진행했다. 그는 ""사회문제 해결 관련 롤 모델은 마이크로소프트(MS) 창업자 빌 게이츠""라며 ""빌 게이츠가 빌&멜린다 게이츠 재단 등을 통해 역설한 '창조적 자본주의'를 우리 사회에 적용해서 풀 수 있는 문제가 있을 것이라 생각한다""고 밝혔다.   앞서 김 의장은 지난 8일 카카오 및 계열사 전 임직원에게 보낸 신년 카카오톡 메시지에서 ""앞으로 살아가는 동안 재산의 절반 이상을 사회문제 해결을 위해 기부하겠다는 다짐을 하게 됐다""며 ""구체적인 계획은 카카오 임직원(크루)에게 지속적으로 공유하면서 아이디어도 얻고 기회도 열어 주겠다""고 전했다. 개인 재산 기부선언 이후 첫 카카오 공동체 간담회인 이번 '브라이언톡 애프터'에는 카카오 계열사 직원 1만여명 중 절반 이상이 참여했다.   김 의장은 우선 기부 프로젝트와 관련 ""미래를 준비하는 사람들과 디지털 교육 격차 등으로 기회를 얻지 못한 사람들, AI 인재에 관심이 있다""며 ""엔지니어, AI 인재 양성을 하이브리드로 할 필요가 있기에 인재 양성을 위한 온·오프라인 참여 형태 AI 캠퍼스도 고민 중""이라고 전했다. 그는 이어 ""스타트업이 많으면 많을수록 좋기 때문에 이를 지원하는 구조는 계속 나와야 한다""며 ""카카오 내부 혹은 카카오 자녀들이 스타트업에서 경영할 수 있는 구조 등도 나오면 좋을 거 같다""고 강조했다.   김 의장은 향후 기부금 집행 계획과 관련해서는 ""기부금을 묵혀두는 개념이 아니라 필요한 곳에 바로 써나가고 싶다""며 ""1년이면 1년, 단위를 정해 몇천억원 수준으로 쓰는 구조로 가고 싶다""고 말했다.  elikim@fnnews.com 김미희 기자 ▶ 헉! 소리나는 스!토리 뉴스 [헉스]▶ '아는 척'하고 싶은 당신을 위한 [두유노우]▶ 날로먹고 구워먹는 금융이슈 [파인애플]  ※ 저작권자 ⓒ 파이낸셜뉴스. 무단 전재-재배포 금지"
2021.02.25.,"[단독]김범수 ""적군·라이벌 생긴 카카오, 대기업 되면서 책임감 감수해야""",https://n.news.naver.com/mnews/article/421/0005189070?sid=105,"[브라이언톡 애프터③]'기업' 카카오가 하기 어려운 것 개인적으로 풀고싶어""카카오 창업자 김범수 이사회 의장이 25일 오후 사내 간담회 '브라이언톡 애프터'에 참석하고 있다. © 뉴스1(성남=뉴스1) 송화연 기자,김근욱 기자,손인해 기자 = 카카오 창업자 김범수 이사회 의장이 ""카카오가 돈을 많이 벌고 진출하는 영역이 많아지면서 적군이나 라이벌도 생기고 정치권에서도 별로 좋지 않은 시선이 존재한다""며 ""이건 회사가 성장하고 대기업이 돼가면서 책임이 따라가는 것을 감수해야 한다고 생각한다""고 말했다. 김 의장은 25일 오후 2시부터 열린 사내 직원 간담회 '브라이언톡 애프터'에서 ""빛이 있고 그림자가 있듯 처음엔 카카오가 모든 대한민국 사람들의 생활을 편리하게 해주는 우군이었다""며 이같이 말했다. 그는 ""그런 의미에서 카카오가 기존과는 다른 길을 가야 하지 않나""라며 ""ESG(환경·사회·지배구조) 경영 얘기가 많이 나오는데, 기업으로 올바른 길을 가겠다는 선언이나 기술로 더 나은 세상을 만들 수 있는 시도가 있다""고 했다. 이어 ""그런 시도는 여유 있는 상태가 돼야 하더라""며 ""아무리 그래도 카카오는 기업이라 한계가 있다. 정말로 돈이 안 되는 막 해야지 하는 건 조직적으로 부담이 되는데 카카오가 적용하기 어려운 걸 개인적으로 풀어보고 싶다고 말씀드린 것""이라고 말했다. 최근 자신의 재산 절반을 사회에 환원하겠다는 계획을 밝힌 것과 관련해 카카오 '기업'이 할 수 없는 일을 개인적으로 시도하겠다는 의지를 내비친 것이다.25일 오후 카카오 사내 간담회 '브라이언톡 애프터'에 참석한 카카오 임직원들의 모습. © 뉴스1김 의장은 ""제가 추구하는 방식은 프로젝트""라며 ""어떤 사회 문제를 해결해야겠다는 우선순위를 만들고 '이 문제 괜찮은데' 하면 '한 번 해보시죠' 하는, 그렇게 해보고 싶다""고 말했다. 그러면서 ""카카오택시 얘기 나왔을 때만 해도 택시를 안 타는 부류여서 '택시를 앱으로 부르는 게 무슨 말인가'했다""면서 ""그런데 의사결정 잘할 수 있도록 위임했다. 이후 (반응이) 폭발적인 걸 보고 '역시 내가 모르는 세상도 있구나' 느꼈다""고 했다.김 의장은 ""사회문제 해결 프로젝트도 카카오에 익숙한 것""이라며 ""기술이나 기획이든 속도감도 있을 거고 비즈니스모델(BM) 고민이 없으니까 돈 쓰면서 하면 재밌는 것들이 많이 나오지 않을까 싶다""고 말했다. 그는 ""제가 카카오임팩트 재단 이사장인데, 거긴 사회문제 전문가들이 많다""며 ""여긴(프로젝트) 완전히 다르게 카카오 공동체 문제에 관심이 많은 사람들이 와서 마음껏 프로젝트를 검증 없이 자유롭게 할 수 있는 구조가 나오면 좋겠다고 생각한다""고 말했다. 이어 ""'100명의 CEO' 역할처럼 사용자 문제를 해결하는 새로운 100개의 프로젝트가 나오면 좋지 않을까 한다""며 ""기본적으로 카카오는, 크루(임직원)분들은 변화의 주체자가 아닐까 생각한다""고 말했다.son@news1.kr▶ 네이버 메인에서 [뉴스1] 구독하기!▶  뉴스1&BBC 한글 뉴스 ▶  터닝포인트 2021 © 뉴스1코리아(news1.kr), 무단 전재 및 재배포 금지"
