기사날짜,기사제목,네이버 뉴스 url,기사내용
2021.02.28.,"""카카오가 망한다면 왜일까요? 우린 전기차 안 해요?""…김범수가 답했다",https://n.news.naver.com/mnews/article/421/0005192577?sid=105,"[브라이언톡 애프터⑤]카카오의 미래먹거리 관련 질문에 답변""클럽하우스 위협된다 생각해…경쟁자 만들면 안 된다는 위기의식 있다""카카오 창업자 김범수 이사회 의장이 25일 오후 사내 간담회 '브라이언톡 애프터'에 참석하고 있다. (사진=독자 제공) © 뉴스1(성남=뉴스1) 송화연 기자,김근욱 기자 = ""브라이언에게 질문이 있는데요. 혹시 카카오가 망한다면 어떤 이유 때문일 거라고 생각하세요?""김범수 카카오 의장이 지난 25일 임직원(크루) 간담회 '브라이언톡 애프터'를 통해 임직원과 마주했다. 사는 동안 재산 절반을 사회문제 해결을 위해 환원하겠다고 공언한 그는 크루들과 '카카오다운 사회문제 해결방식'을 논의하기 위해 간담회 자리를 마련했다.총 2시간20분 동안 진행된 간담회는 직원들의 가감 없는 질문과 김 의장의 허심탄회한 답변으로 채워졌다. 김 의장은 간담회를 통해 자신이 생각하는 카카오의 미래 먹거리와 새로운 경쟁자에 대한 위기의식, 경영철학 등도 털어놨다.◇""카카오는 전기차, 로봇사업 안하나요?""카카오는 간담회 개최에 앞서 이번 행사를 '미래를 위한 카카오의 도전과 사회문제 해결을 위해 크루들과 지혜를 나누는 시간'이라고 소개했다. 간담회에서 기부뿐 아니라 로봇, 전기자동차 등 다양한 미래사업 이야기가 오간 배경이다.먼저 김 의장은 카카오의 전기차 사업 가능성 질문에 ""전기차는 카카오의 관심사가 아니다""라며 선을 그었다. 그는 ""우리는 차를 만드는 회사는 아니다""라면서도 ""다만 이동에 대한 고민은 하고있다""고 답변했다.김 의장은 ""자율주행이나 자율주행시대 자동차 서비스엔 관심을 갖고있다""며 ""카카오가 모빌리티 플랫폼은 꽤 경쟁력 있게 (사업을) 하고 있기 때문에 자율주행차 시대가 왔을 때 택시를 부르듯 자율주행차를 부르는 식의 매력적인 부분이 있을 거라고 생각한다. (카카오의 미래 자동차 사업을 묻는다면) 운영차원에서 접근하는 쪽으로 관심이 있다""고 말했다.간담회에서는 카카오의 로봇 사업에 대한 질문도 나왔다. 경쟁사인 네이버는 자회사 네이버랩스를 통해 로봇 상용화에 주력하고 있고, 현대자동차는 지난해 말 미국 로봇 개발사 보스턴다이내믹스를 인수하며 '걷는 차' 개발을 발표했다.그러나 카카오는 로봇 사업을 추진하고 있지 않은 상황이다. 김 의장은 간담회에서 로봇사업에 확신이 없다는 의사를 내비쳤다. 그는 ""로봇은 카카오벤처스가 투자하고 있는 영역으로 (카카오가) 자체적으로 로봇을 만드는 접근은 없다""며 ""저는 로봇 분야를 아예 몰라서 어떻게 접근해야할 지조차 감을 못 잡겠다""고 밝혔다.이어 김 의장은 ""정의선 현대자동차그룹 회장과 식사를 하며 '구글이 왜 보스턴다이내믹스를 팔았을까'를 물었는데 그거에 대한 답변을 못 들었다""며 ""로봇이 아니더라도 하드웨어가 어떤 역할을 해낼 수 있다면 그런 걸 찾아보고 싶다""고 덧붙였다.김 의장은 간담회 내내 카카오가 '하드웨어' 보다는 '소프트웨어'에 강점이 있는 회사임을 강조하면서도 새로운 형태로 등장할 하드웨어에 대한 기대감을 드러냈다.일례로 그는 가상현실(VR) 기기와 관련한 대화에서 가상세계를 '다가올 미래'라고 지칭하며 ""새로운 세상이 오고있다는 느낌이 든다""며 ""하드웨어가 새로 나오면 세상이 한번 바뀐다. 컴퓨터가 그랬고 스마트폰이 그렇듯 그런 게(새로운 하드웨어가) 있나를 보는 게 중요하다""고 말했다. 이어 직원들에게 '최근 접한 의미있는 하드웨어가 있냐'고 반문하기도 했다.아울러 김 의장은 ""이제는 하드웨어도 소프트웨어와 만나는 지점이 있어야 할 것으로 보고있다""며 ""LG 회장과 만나 '우리가 하드웨어는 자신없지만 소프트웨어는 잘할 수 있다'며 합작법인(JV) 등으로 협업방안을 제안하기도 했다""고 언급하기도 했다.카카오가 헬스케어사업을 영위할 계획이 있냐는 질문도 있었다. 김 의장은 ""디지털 헬스케어쪽에 관심이 많다. DNA 등이 데이터화 되는 순간 IT 영역이 된다고 생각한다""며 ""의료 쪽을 보게 된 건 1~2년 정도 됐다""고 설명했다.이어 ""2년 전에 카카오인베스트먼트와 아산병원이 합작법인(아산카카오메디컬데이터)을 만들었고, 세브란스(연세의료원)와도 협업을 이어가고 있다""며 ""사회적으로 접근하는 게 있다면 디지털로 접근해야 하는 분야가 있다(고 생각한다)""고 했다.◇""전 세계 Z세대가 '제페토'에 열광한다는데…카카오는?""간담회에서는 카카오가 Z세대(1990년대 중반에서 2000년대 초반에 걸쳐 태어난 젊은 세대를 이르는 말)를 타깃으로 하는 서비스 개발에 뒤처진 것이 아니냐는 문제도 제기됐다.네이버는 증강현실 플랫폼 '제페토'를 통해 전 세계 2억명의 이용자를 모았고, 방탄소년단(BTS) 소속사 빅히트엔터테인먼트는 자체 글로벌 팬 커뮤니티 플랫폼 '위버스' 구축해 군소조직화된 글로벌 팬 커뮤니티를 결집하고 있다.김 의장은 ""Z세대를 겨냥한 서비스는 우리가 준비를 못한 경향이 있다""며 ""몇 가지를 시도했지만 안 된 것도 있고, (카카오M) 소속 가수가 한류를 선도하고 있는데 한류를 이용하지 못한 것도 있다""고 인정했다.다만 그는 글로벌 시장에서 괄목할 성과를 내고 있는 웹툰사업을 치하하며 Z세대를 타깃으로 한 서비스의 기회가 아직 남아있음을 시사하기도 했다. 김 의장은 ""카카오페이지가 웹툰과 스토리(시장)에서 경쟁상대가 없을 만큼 생각보다 꽤 광범위하게 장악했다""며 ""(콘텐츠 분야에서) 카카오가 굉장히 성장할 것으로 생각한다""고 전망했다.그러면서 ""(라인에 밀려) 카카오톡으로 일본에선 어쩔 수 없는 상황이 됐고 결국 3년 반 전에 만화를 한번 해보자 해서 (일본 내 웹툰 사업을) 시작했는데 지난해 '라인망가'(네이버 글로벌 웹툰 서비스)를 누르고 엄청난 성장 속에서 있다""며 ""네이버가 한국과 일본에서 밀려서 미국(웹툰사업)에 올인하고 있는데 (카카오도) 미국을 쫓아가는 구조로 해서 투자도 하고 해서 기 싸움을 하고 있다. 콘텐츠쪽 분야의 미래는 밝은 것 같다""며 자신감을 드러냈다.나아가 김 의장은 ""카카오페이지와 카카오M가 소설을 기반으로 웹툰을 만들고 그 웹툰이 드라마나 영화로 만들어지기도 하면서 이태원클라쓰, 승리호 등의 성공사례가 나왔다""며 ""다만 경쟁이 심한 글로벌 OTT 강자가 많은 건 고민된다""고 털어놨다.이어 ""카카오페이지와 카카오M의 합병으로 카카오엔터테인먼트가 탄생하면서 지식재산권(IP)과 유통, 제작 플랫폼을 갖춘 회사가 탄생해 경쟁력이 생긴 것 같다""며 ""디즈니플러스 등이 여기에 관심이 많을 수밖에 없을 것""이라고 덧붙였다.카카오 창업자 김범수 이사회 의장이 25일 오후 사내 간담회 '브라이언톡 애프터'에 참석하고 있다. (사진=독자 제공) © 뉴스1◇강력한 경쟁자 '클럽하우스'의 등장…""브라이언도 클하하나요?""간담회에서는 최근 국내에서 폭발적인 인기를 끌고 있는 오디오 기반 소셜미디어 '클럽하우스'와 관련한 대화도 오갔다. 모바일 데이터 분석 플랫폼 앱애니에 따르면 ‘클럽하우스’는 지난 24일 기준 세계적으로 1050만건 다운로드 됐으며, 국내에선 32만5000건 이상 다운로드 된 것으로 나타났다.김 의장은 '클럽하우스를 해봤냐'는 직원의 질문에 ""옆 사람이 하는 걸 구경해보는 수준에서 해봤다""며 입을 열었다. 김 의장은 클럽하우스 열풍에 대해 ""음성은 인간의 자연스러운 (소통) 행위로 글자가 아닌 형태로 단체방이 형성된 걸 의미있게 본다""며 ""카카오가 이거(음성 위주의 소통공간이 인기를 끌고 있는 것)에 대한 대응을 했으면 좋겠다고 얘기를 했었는데 모르겠다""고 밝혔다.이어 ""소통의 형태는 카카오 커뮤니케이션의 큰 축인데 (클럽하우스가) 인스타그램처럼 큰 열풍이 되면 우리에게 위협이 되겠단 생각을 한다""며 ""소통이란 측면에서 적어도 커뮤니케이션은 카카오가 놓치면 안 되고 경쟁자를 만들면 안된다는 위기의식은 있다""고 역설했다.◇""카카오가 망한다면 그 원인은 내부에 있겠죠""간담회에서는 '우리가 망하면 어떤 이유일까'라는 당돌한 질문도 나왔다. 김 의장은 해당 질문에 노키아 사례를 들며 답변을 이어갔다.김 의장은 ""노키아는 무선 휴대전화를 처음 만든 회사고 유럽에서 가장 성공한 회사였다. 노키아가 성공한 후에 경영진들이 스포트라이트를 받았다""며 ""그런 상황에서 실무진들이 무선 휴대전화에 고화질 카메라 넣고 앱 마켓도 넣자고 제안했는데 경영진들이 '그건 아니다'라며 무산시킨 사례가 있다""고 소개했다.그러면서 ""그리고 얼마 후 아이폰 나오면서 (휴대전화 시장) 판도를 바꿨고, 노키아는 과거에 성공한 회사로 끝나고 침몰했다. 절실하고 뭔가 해내야 한다는 열정이 넘쳤던 시기와 달리 성공의 달콤함 속에 있었던 경영진, 즉 환경·태도가 바뀐 것이 회사를 망하게 한 작지만 큰 요소라고 생각한다""고 덧붙엿다.그는 ""어떤 경쟁자에 의해서 우리가 무너지긴 쉽지 않다""며 ""카카오는 네이버를 경쟁자로 생각하고 여기까지 왔고 (앞으로도) 많은 경쟁자가 생기며 여러 경쟁을 하겠지만 질거라 생각하지 않는다""고 강조했다.마지막으로 김 의장은 ""카카오스토리는 (출시 초기에) 성공했지만 인스타그램 등 새로운 게(소셜미디어) 나오면서 대응이 잘 안 됐다. 적절하게 준비하고 뭔가를 해야 하는데 그 정답이 있을진 모르겠다""며 ""기회를 잡기 위해선 우리가 그런(새로운 서비스를 만드는) 회사가 나오면 빨리 인수하는 능력이 있어야 할 것이다. 그래야 망하지 않을 것""이라고 답변했다.hwayeon@news1.kr▶ 네이버 메인에서 [뉴스1] 구독하기!▶  뉴스1&BBC 한글 뉴스 ▶  터닝포인트 2021 © 뉴스1코리아(news1.kr), 무단 전재 및 재배포 금지"
2021.02.28.,'함께 일하기 싫다' 카카오 인사평가 논란…핵심이 빠졌다,https://n.news.naver.com/mnews/article/008/0004550023?sid=105,"[머니투데이 이동우 기자]  이지혜 디자이너 / 사진=이지혜 디자이너카카오 로고 / 사진제공=카카오 로고""친하게 일하던 동료들이 돌연 '당신과 일하기 싫다'고 평가했다면 어떨까요. 피평가자가 이를 알게됐다면 상당한 심적 충격과 자괴감을 느낄 수 밖에 없습니다. 많은 기업들이 다면평가를 채택하지만 신중하게 접근하는 이유입니다. 최근 카카오 인사평가 논란을 보면서 이런 방식이 스타트업이나 IT 기업의 문화인가하고 의아했습니다.""최근 카카오의 인사평가 논란과 관련 한 대기업 인사평가 담당 임원은 이같이 말했다. 카카오 인사평가 논란과 관련 후폭풍은 여전하다. 다면평가 '리뷰 대상자와 다시 함께 일하시겠습니까?' 항목이 십자포화를 맞는 가운데 재계에서도 설왕설래가 이어지고 있다 28일 카카오에 따르면 내달 2일 평가제도 등 크루들이 느끼는 문제를 공유하고 개선방향에 대해 의견을 나눌 수 있는 오픈톡을 추진한다. 카카오 인사평가 논란은 지난 17일 직장인 익명 커뮤니티 블라인드에 올라온 카카오 직원 추정 이용자의 유서 형식의 글이 올라오며 불거졌다. 실제 극단적 선택은 없었지만 직원들이 글쓴이의 심경을 추측하며 카카오 인사시스템을 저격했다. 특히 함께 일한 동료들이 실시하는 '다면평가' 가운데 '리뷰 대상자와 다시 함께 일하시겠습니까?'' 항목을 두고 많은 비판이 제기됐다. '함께 일하기 싫음', '상관 없음', '함께 일하고 싶음' 으로 선택할 수 있지만 '함께 일하기 싫다'는 답변을 수집해 당사자에 공개한다는 것 자체로 고통을 준다는 것이다. ━다면평가 많은 기업에서 활용 중…""문항 자체는 문제 없어""━/사진=게티이미지뱅크한 카카오 직원은 해당 인사평가 문항을 두고 고용노동부에 근로감독 청원까지 한 것으로 알려졌다. 온라인상에서도 카카오를 두고 '비인격적인 기업', '잔인하다' 등의 비판적 반응이 쏟아졌다. 카카오 노동조합 역시 사측에 평가 문항 개선을 요구한 상태다. 이에대해 인사 전문가들은 일단 평가 문항 자체에는 문제가 없다고 본다. 다면평가는 하향식 인사평가를 보완하기 위해 많은 기업이 도입한 제도다. 가혹해 보이지만 조직 활력을 제고하는 측면에서 많은 도움을 준다는 의견도 있어서다.한 금융업계 인사 담당자는 ""'함께 일하기 싫다'는 표현은 일반적으로 많은 기업이 채택해서 쓰는 패턴""이라며 ""개인적으로는 문항 자체가 자극적이라는 의견에는 동의할 수 없다""고 말했다.  IT 업계도 비슷한 실정이다. 네이버는 '함께 일하고 싶은 동료인가요'라는 질문 항목이 있어 부서장이 이를 참고한다. NHN은 '동료에게 긍정적인 자극을 줄 정도로 열정적으로 일했나요' 등의 질문이 인사평가에 들어있다. 성과 관리 전문가인 이찬(서울대 경력개발센터장) 서울대 교수는 ""문항 자체가 이슈는 아니다""라며 ""거꾸로 생각하면 정말 같이 일하고 싶지 않을 정도의 '직장 내 괴롭힘'을 당한 사람이 있을 수도 있기 때문에 하소연할 채널이 정기적으로 있다는 것은 긍정적""이라고 말했다.  ━평가보다 피드백 중요…1대 1 면담 등 적극 활용해야 ━문제는 카카오가 이를 직원들에게 전달하는 방식에 있다. 카카오는 단순 통보식으로 다면평가 결과를 제공한 것으로 알려졌는데 이는 상당히 잘못됐다는 평가다. 이 교수는 ""(카카오는) 행정적 평가만 한 것이고 육성 차원에서 정말 중요한 피드백 과정은 엉망""이라고 지적했다. 이어 이 교수는 ""데이터는 사람마다 인식의 차이가 크기 때문에 상사들이 면담 등을 통해 피드백을 줘야 받아들일 수 있다""며 ""피평가자에 대해서도 결과를 수용하는 방법을 반드시 교육해줘야 한다""고 말했다.인사혁신처가 2019년 공직사회에 배포한 다면평가 매뉴얼에 따르면 개인의 행동 개선 효과를 극대화하기 위해서는 1대 1 면담과 집단 워크숍 등을 활용해야 한다. 통보과정에서 상당한 심적 충격을 주는 부작용이 발생한다는 점 때문에 기업에 따라서는 동료평가를 본인들에게 통보하지 않고 상급자가 참고용으로만 쓰는 경우도 많다.한 기업 인사담당 본부장은 ""대부분 인사 컨설팅 회사들이 다면평가를 회사의 옵션으로 제시하지만 최근에는 많이 권하지 않는 추세""라면서 ""특히 카카오가 채택한 것으로 보이는 '쌍방 다면평가'는 자칫 인민재판으로 흐를 수 있어 본인 모르게 하거나 당사자에게 알려주지 않는 경우가 많다""고 설명했다. 카카오 같은 IT기업들이 미국 구글, 아마존과 같은 해외 IT기업들의 인사제도를 무분별하게 좇는게 아니냐는 분석도 있다. 최근 급성장한 IT기업들은 기존에 없던 비즈니스 모델을 추구한다. 또 개발자와 비개발자간 문화차이도 있어 글로벌 인사컨설팅 기업들이 미국의 혁신기업의 사례를 앞세워 컨설팅 제안을 하는 것으로 알려졌다. 실제 구글의 경우 동료평가를 승진·해고에 적극 반영한다. 또다른 기업 인사담당자는 ""몇몇 글로벌 인사컨설팅 기업들이 미국식 인사제도를 던져주기도 하는데 일부는 비적응자의 해고를 염두에 둔 것 같아 보인다""면서 ""카카오의 인사제도를 자세히 알지 못하지만 이번 논란을 보고 좀 의아했고 혹 해외 기업의 제도를 그대로 도입해 한국적 조직문화와 충돌하는 게 아닌가 싶었다""고 말했다. 한편, 김범수 카카오 이사회 의장이 지난 25일 기부금 관련 구상을 밝히는 사내간담회에서 ""이번 이슈는 사내 문화에 경고등이 켜진 것""이라고 밝혔다. 그만큼 이번 논란을 무겁게 받아들인다는 의미다.이동우 기자 canelo@mt.co.kr▶부동산 투자는 [부릿지]▶조 변호사의 가정상담소▶줄리아 투자노트 <저작권자 ⓒ '돈이 보이는 리얼타임 뉴스' 머니투데이, 무단전재 및 재배포 금지>"
2021.02.28.,카카오 CEO 100인 시대…70년대생 '김범수 키즈'가 뛴다,https://n.news.naver.com/mnews/article/009/0004755975?sid=105,"김범수식 인재육성 전략은카카오페이·뱅크·페이지·재팬류영준 윤호영 이진수 김재용'70년대생' 모두 상장 눈앞에모빌리티 류긍선대표도 77년생내부사업 적극 분사·독립시켜""젊은 경영자 육성전략 대성공""◆ 진격하는 카카오 ◆  기업가치 100조원을 바라보는 카카오 연합군의 성장을 논할 때 빼놓을 수 없는 것이 '김범수 키즈'다. 카카오의 주요 자회사를 살펴보면 1970년대생 경영인(CEO)들의 약진이 두드러진다. 이들은 '100인의 CEO'를 양성하겠다는 김범수 카카오 이사회 의장의 경영철학을 바탕으로 일찌감치 독립경영으로 카카오의 신사업을 키워왔다. 현재 상장을 추진하고 있는 주요 자회사에 포진해 있는 만큼, 그룹 내 1970년대생 CEO들의 역할은 더욱 커질 것으로 전망된다.카카오에서 현재 상장을 코앞에 둔 자회사들 수장은 1970년대생이라는 공통점이 있다. 이들은 모두 사업 초기부터 카카오 내외부에서 주도적으로 해당 사업을 키워오며, 김 의장으로부터 CEO로 낙점을 받은 인물들이다.모바일로 금융을 혁신하는 핀테크 부문의 자회사들은 모두 올해를 목표로 상장을 추진하고 있다. 류영준 카카오페이 대표(1977년생)는 삼성SDS 출신으로, 카카오 본사에서 페이먼트사업부 본부장과 핀테크사업 총괄 부사장을 거치며 간편결제를 중심으로 한 핀테크 사업을 키워왔다. 2017년 자회사 카카오페이 설립과 함께 대표에 취임했다.윤호영 카카오뱅크 대표(1971년생)는 포털 다음 출신으로, 2014년 카카오 부사장 재임 당시 1인 태스크포스(TF)를 꾸려 카카오뱅크 설립을 준비해온 인물이다. 2017년 4월 카카오뱅크 공동대표에 올랐다. 이용우 공동대표가 총선 출마를 이유로 사퇴하면서 작년 3월부터 단독대표를 맡고 있다.  28일 경기도 성남시 카카오 판교 오피스에서 직원이 나오고 있다. 카카오는 코로나19 여파에도 지난해 연매출 4조원을 돌파했으며,기업가치도 40조원을 넘어섰다.  [한주형 기자] 국내와 글로벌 시장에서 모두 급성장하는 콘텐츠 사업에서도 1970년대생 CEO 활약이 두드러진다. 이진수 카카오페이지 대표(1973년생)는 김 의장과 인연이 깊다. 2003년 프리챌에서 NHN(현 네이버)으로 합류하며 김 의장과 인연을 맺었다. 이 대표가 2010년 카카오페이지의 전신인 '포도트리'를 창업할 때 투자와 조언을 해준 사람도 김 의장이었다. 이 대표는 2015년 포도트리가 카카오에 인수된 뒤 카카오페이지 대표로서 웹툰·웹소설·동영상 등 유료 콘텐츠 사업을 이끌어왔다. 카카오페이지는 3월부터 영상 제작과 유통에 강점이 있는 자회사 카카오M과 합병을 통해 '카카오엔터테인먼트'로 새로 출발한다. 몸집을 키운 카카오엔터테인먼트도 핀테크사업에 이어 빠르게 상장을 추진할 전망이다.김재용 카카오재팬 대표(1976년생)는 콘텐츠 플랫폼 '픽코마'를 통해 '만화 대국' 일본에서 글로벌 성공 사례를 만든 인물이다. 김 대표도 NHN 시절 김 의장과 첫 인연을 맺었다. 2006년부터 라인의 전신인 NHN재팬에서 근무한 일본 전문가다. 김 대표는 김 의장의 제의로 2015년 합류했다. 픽코마는 작년 7월 일본을 비롯한 글로벌에서 매출 1위 디지털 만화 앱이 됐다. 상장이 임박한 곳은 아니지만, 류긍선 카카오모빌리티 대표(1977년생)도 카카오의 신사업을 이끄는 젊은 CEO로 꼽힌다. 류 대표는 모바일 콘텐츠 제공업체 다날 출신으로, 2018년 카카오모빌리티 전략부문 부사장으로 합류했다. 카카오택시 성공 신화를 쓴 정주환 전 카카오모빌리티 대표 후임으로 가맹택시, 자율주행 등 모빌리티 사업을 진두지휘하고 있다.익명을 요구한 인터넷업계 관계자는 ""카카오의 급성장에는 내부사업을 독립시키고, 젊은 경영자를 육성하는 전략이 큰 영향을 미쳤다""며 ""올해와 내년까지 이어질 주요 자회사의 상장은 주도적으로 일하는 '카카오스러운' 문화가 만들어낸 상징적 사건이 될 것""이라고 진단했다.카카오그룹 내부에는 상장이 임박한 자회사 외에도 다수의 젊은 경영자들이 사업을 이끌고 있다. 김 의장이 카카오의 전신 아이위랩을 창업할 당시 선언했던 '100인의 CEO' 프로젝트는 양적 측면에선 이미 충분히 달성됐다. 공정위 발표 기준 카카오의 계열사는 지난해 11월 104곳이다. 현재 카카오 주요 자회사는 산하에 다수의 계열사를 거느리고 있다. 카카오게임즈가 9개사, 카카오페이지가 10개사, 카카오M이 23개사, 카카오모빌리티가 14개사, 카카오페이가 3개사, 카카오인베스트먼트가 10개사를 산하에 두고 있다.김 의장은 지난해 10월 고 이건희 삼성 회장 장례식 조문 뒤 ""삼성에서 배운 모든 것들이 네이버, 카카오로 이어졌다. 이해진 창업자도 삼성 입사 동기였고, '삼성 키즈'들이 한국의 새로운 사업들을 이뤄냈다""며 ""그 뒤 네이버, 카카오 출신들이 사업을 일궈내는 게 이어지고 있다""고 말하기도 했다. [오대석 기자]▶ '경제 1위' 매일경제, 네이버에서 구독하세요▶ 이 제품은 '이렇게 만들죠' 영상으로 만나요▶ 부동산의 모든것 '매부리TV'가 펼칩니다[ⓒ 매일경제 & mk.co.kr, 무단전재 및 재배포 금지]"
2021.02.28.,"‘집사부’ 양세형 “200% 오른 카카오 주식, 10만원→14만원에 팔아”",https://n.news.naver.com/mnews/article/609/0000406928?sid=106,<구조 다름>
2021.02.28.,"'맘스폰' 신비, 카카오리틀프렌즈4, ZEM 키즈폰 할인 및 요금지원 화제",url없음,<네이버 기사 없음>
