기사날짜,기사제목,네이버 뉴스 url,기사내용
2021.02.11.,명절 맞아 앱마켓 할인·이벤트에 추천 콘텐츠도,https://n.news.naver.com/mnews/article/018/0004851083?sid=105,"연휴 맞아 게임 아이템 할인 및 콘텐츠 추천퀴즈 참여하면 게임쿠폰 주고 결제 혜택도[이데일리 장영은 기자] 설 명절을 맞아 주요 구글, 애플, SKT 등은 앱스토어를 통해 즐길거리와 함께 혜택을 주는 이벤트를 진행한다. 가족, 친지들과 함께 즐길 수 있는 어플리케이션(앱)을 추천해주기도 하고 기간 한정 혜택을 제공한다. 구글  플레이스토어 ‘설날 프로모션’ 실시 구글 플레이는 오는 12일 0시부터 18일 자정까지 설날 프로모션을 진행한다. 인기 앱과 게임은 할인 혜택이나 한정판 패키지를 판매하는 등 기간한정혜택을 제공한다. △클래시 오브 클랜 △랜덤 다이스 △일루전 커넥트 △라루나 판타지 △가디언 테일즈 △라이즈 오브 킹덤즈 △용비불패M △배틀 그라운드 등의 게임은 아이템을 50% 이상 할인한다. 제페토는 ‘설맞이젬 1+1 이벤트’를, 비바 비디오는 연간 구독권 50% 할인 이벤트를 실시하며 칸바(Canva)는 30일 무료 제품 기회를 제공한다. 행사 기간 동안 모든 구매건에 대해서는 1000원당 3 구글플레이포인트를 제공하며, 일부 앱이나 게임에서는 특별 포인트를 추가로 적립해준다. 애플 앱스토어 콘텐츠 추천…카드사·간편결제 혜택애플은  설날을 맞아 ‘앱스토어에서 복 많이 받으세요!’ 프로모션을 진행한다. 애플은 13일까지 날짜별로 테마를 정해 앱을 추천한다. 11일에는 ‘당신에게 고양이가’, ‘기린처럼’, ‘카트라이더 러쉬 플러스’, ‘포켓몬고’ ‘신비아파트 고스트 헌터’ 등 설 연휴 기간 할만한 게임 10선을 추천했다.12일에는 ‘아디다스 런타스틱’, ‘요가 다운 독’, ‘해빗 마인더’ ‘메디토피아’ 등 몸과 마음을 튼튼히 할 수 있는 운동 명상앱을 사용해 볼 것을 제안한다. 13일에는 ‘틴더’ 등의 데이팅앱을 통해 새로운 만남을 도모해 볼 것을 추천하기도 했다. 간편결제 서비스와 카드사별 할인 혜택도 있다. 카카오페이, 페이코, 현대카드가 다양한 결제 이벤트를 진행한다. 현대카드는 오는 28일까지현대카드로 1원 이상 결제한 선착순 3만명을 대상으로 ‘그랑사가’의 ‘1000 다이아’를 제공한다. 카카오페이는 오는 20일까지 카카오페이로 결제시 할인이벤트를 진행할 예정이며, 같은기간 페이코는 페이코 포인트 3% 특별 적립 이벤트를 진행한다. 원스토어 연휴 기간 동안 매일 게임 쿠폰 제공  원스토어는 설 연휴를 맞아 11일부터 14일까지 원스토어와 관련된 간단한 퀴즈를 풀면 게임 쿠폰을 지급하는 ‘원스토어 능력고사’를 진행한다. 이벤트는 원스토어 이용자라면 누구나 참여 가능하며, 이벤트 기간 동안 매일 선착순으로 할인 쿠폰 등을 선물로 제공할 예정이다. 같은 기간(2.11~14) 동안 복주머니를 열면 추첨을 통해 ‘북스 포인트’가 세뱃돈으로 증정되는 ‘설맞이 복주머니’ 이벤트도 열린다. 원스토어 북스에서는 오는 18일까지 인기 로맨스 웹소설 연재작 25종을 대상으로 전체 회차의 40%를 무료로 볼 수 있는 이벤트도 진행된다.장영은 (bluerain@edaily.co.kr)▶ #24시간 빠른 #미리보는 뉴스 #eNews+▶ 네이버에서 '이데일리 뉴스'를 만나보세요▶ 빡침해소, 청춘뉘우스 '스냅타임'＜ⓒ종합 경제정보 미디어 이데일리 - 무단전재 & 재배포 금지＞"
2021.02.11.,세뱃돈 만큼 풍성한 설 연휴 금융권 혜택,https://n.news.naver.com/mnews/article/011/0003870329?sid=101,"특별 우대금리 제공, 세뱃돈 송금하면 경품직구족·집콕족 대상 카드 할인과 경품 제공도[서울경제] 올해 설 연휴는 신종 코로나바이러스 감염증(코로나19) 영향으로 명절 분위기가 반감됐다. 사회적 거리두기 영향으로 고향을 방문하거나 가족, 친척간 모임도 쉽지 않아 정서적으로 각박해지는 설 연휴에 금융권은 다양한 혜택을 제공하고 있다. 연휴 기간 상품에 가입하는 고객이나 ‘집콕’ 생활에 따른 카드 이용 고객에게 추가 이익을 제공하는 은행, 카드사의 혜택을 정리해 본다.우리은행은 설 연휴 기간 ‘반짝’ 이벤트를 실시한다. 11일부터 14일까지 모바일뱅킹 앱 ‘WON뱅킹’에서 ‘단 4일간! 설날특선’이벤트를 실시한다.WON뱅킹 즉시 예약이체 화면의 ‘연락처 이체 서비스’를 이용해 세뱃돈을 보내면 추첨을 통해 총 500명에게 던킨도너츠 먼치킨 10개팩 모바일 쿠폰을 제공한다. WON뱅킹에서 ▲우리 200일적금 ▲우리WON적금 ▲우리WON예금 중 1개 이상 가입하면 11일(파리바게뜨 빵 선물세트), 12일(BBQ 바삭칸 치킨), 13일(GS25 모바일쿠폰 3만원), 14일(스타벅스 모바일 커피교환권) 일자별로 추첨해 총 840명에게 모바일 쿠폰을 준다. 두 가지 이벤트는 자동 응모되며, 중복 당첨 가능하다.우리은행은 3월 26일까지 청약저축 신규 가입고객을 대상으로는 연령별 맞춤 경품을 제공하는 이벤트도 실시한다.주택청약종합저축’, ‘청년우대형 주택청약종합저축’ 신규가입 고객에게 ▲10대(애플 에어팟 프로) ▲20~30대(애플 맥북에어 256G(M1)) ▲40대 이상(다이슨V11 컴플리트 무선청소기) 등 연령에 따라 추첨을 통해 경품을 전달한다. 주택청약종합저축에서 청년우대형 주택청약종합저축으로 전환 가입한 고객도 이벤트 대상이다.우리WON뱅킹 또는 인터넷뱅킹을 통해 신규가입한 고객 총 2,021명을 추첨해 스타벅스 모바일 커피교환권을 제공한다. 두 가지 이벤트는 신규가입 시 자동 응모되며, 중복 당첨이 가능하다.하나은행은 오는 15일까지 하나원큐 앱을 통해 ‘새해 복 머니 받으세요’ 이벤트를 진행중이다.‘행운의 복 머니 받기’는 하나원큐 로그인 시 누구나 참여 가능하다. 일 최대 10만명, 총 50만명에게 50~5만 하나머니를 랜덤으로 제공한다. 무료로 운세, 토정비결도 볼 수 있다.‘소중한 내 마음 전하기’는 코로나19로 만나지 못하는 친지 등 소중한 사람에게 하나원큐 이벤트 페이지의 ‘내마음송금’ 또는 ‘환전선물’을 통해 원화 또는 외화를 선물하고 이벤트에 응모하면 된다. 총 1,000명을 추첨해 선물금액의 1%에 해당하는 금액을 하나머니로 돌려준다.‘설 연휴 우대금리 혜택받기’는 설 연휴 기간 중 하나원큐 앱을 통해 월 100만원까지 불입 가능한 e-플러스 적금을 가입만 하면 연 0.5%의 우대금리를 제공한다.카카오뱅크는 오는 14일까지 카카오뱅크에서 세뱃돈을 보내는 고객 총 4만3,500명에게 경품을 증정한다.카카오뱅크 앱에서 ‘이체’를 선택해 카카오톡 친구를 골라 이벤트 메시지카드와 함께 세뱃돈을 전달하고 받는 사람이 카카오뱅크 계좌로 세뱃돈을 받으면 된다. 카카오뱅크 미니 고객도 이벤트 대상에 포함된다. 추첨을 통해 파리바게트 케잌(500명), 스타벅스 모바일쿠폰(3,000명), 하리보 젤리(5,000명), 페레로로쉐 초콜릿(5,000명), 빙그레 바나나우유(3만명) 등의 모바일 쿠폰을 23~24일 카카오뱅크와 연결된 카카오톡 계정으로 전달한다.카드업계는 더 폭넓은 혜택을 제공하고 있다. 하나카드는 해외여행 및 쇼핑 관련 특화 플랫폼인 ‘글로벌 머스트 해브’의 해외직구라운지에서 다양한 해외 직구 이벤트를 진행한다. 설날은 물론 졸업·입학, 발렌타인데이 등 가족과 연인에게 선물하기 좋은 기회가 될 것으로 보인다.2월 한달 간 프리미엄 쇼핑 플랫폼 ‘캐치패션’과 ▲하나 Visa카드로 상품 결제 시 18% 캐치패션 캐시백 ▲하나카드로 상품 결제 시 16% 캐치패션 캐시백을 제공하는 이벤트를 진행한다. 구찌, 보테가베네타, 발렌시아가 등 유명 브랜드 상품을 최대 50%까지 저렴하게 구매 할 수도 있다.하나카드 해외직구라운지에서 2월 한달 간 ▲합산 30만원 이상 결제 시 추첨을 통해 시그니엘 서울 숙박권(1박)을 5명에게 증정하며 ▲합산 10만원 이상 구매 시 선착순 100명에게 스타벅스 아메리카노(T) 쿠폰 1매가 제공된다.신한카드는 28일까지 ‘신한카드 랜+설(랜선+설) 이벤트’를 통해 총 2,021명에게 2만210 마이신한포인트나 경품을 증정한다.‘집콕족’을 대상으로 배달앱과 OTT 서비스를 10만원 이상 이용하면 500명을 추첨해 2만210 마이신한포인트를 준다. 배달의민족, 요기요, 쿠팡이츠, 위메프오, 먹깨비, 배달특급, 페이코오더, 띵똥, 배달의명수, 부르심, 부르심제로 등 11개의 배달앱과 넷플릭스, 왓챠, 유튜브 프리미엄 등 OTT 서비스가 대상이다.온라인 쇼핑 관련 PG(결제대행) 및 전자상거래 업종에서 50만원 이상 이용하면 추첨을 통해 총 500명에게 2만210 마이신한포인트를 증정한다.새해를 맞아 학원이나 아웃도어·의류 업종 등에서 신한카드를 30만원 이상 결제하면 총 500명을 추첨해 2만210 마이신한포인트를 준다.특히 신한카드 설 이벤트 업종에서 이용한 고객 중 총 521명을 추첨해 아이패드 프로(1명), 다이슨 청소기 (5명), 갤럭시 버즈 라이브 (10명), 스타벅스 기프티콘(505명) 등의 경품도 증정한다. 이벤트는 신한PayFAN(신한페이판), 신한카드 홈페이지에서 응모해 참여 가능하다. 법인·선불·기프트카드와 BC카드는 제외된다.신한카드는 설 용품을 구매하고자 하는 고객을 위해 홈플러스, 이마트, 롯데마트 등과 연계한 혜택도 제공한다. 홈플러스에서는 13일까지 정육·설날 시즌 완구·가전제품 등의 설선물세트를 최대 30% 할인해준다. 홈플러스와 이마트에서 설선물세트 구매 시에는 10만원 이상 5,000원, 20만원 이상 1만원, 30만원 이상 1만5,000원, 50만원 이상 2만5,000원, 100만원 이상 1,000만원 미만일 경우 100만원 당 5만원, 1,000만원 이상일 경우 50만원 상품권을 증정한다. 롯데마트에서도 13일까지 설선물 세트 최대 40% 할인 또는 구매금액에 따라 상품권을 증정한다. 법인·선불·기프트카드와 BC카드는 제외된다./김광수 기자 bright@sedaily.com▶ 상위 1% 투자자 픽! [주식 초고수는 지금]▶ 겜알못? 이제는 겜잘알! [오지현의 하드캐리]▶ 네이버 채널에서 '서울경제' 구독해주세요!저작권자 ⓒ 서울경제, 무단 전재 및 재배포 금지"
2021.02.11.,[미리본 설풍경 下] 코로나19가 바꾼 설 선물 트렌드,url없음,<네이버 기사 없음>
2021.02.11.,올해 三電만 7조 판 外人…LG화학·언택트 3인방은 사들였다,https://n.news.naver.com/mnews/article/421/0005161344?sid=101,"올해 들어 4조8334억원 순매도…삼전 제외하면 순매수금융株도 사들여…""향후 외국인 수급, 환율에 달렸다""뉴욕증권거래소(NYSE). © 로이터=뉴스1(서울=뉴스1) 전민 기자 = 지난해에 이어 올해들어서도 외국인이 국내 코스피 시장에서 순매도를 이어가고 있다. 특히 우선주를 포함해 삼성전자만 7조원 넘게 팔아치웠다. 다만 삼성전자를 제외하면 순매수에 나선 것으로 나타났다. 이른바 '언택트(비대면) 3인방'으로 불리는 카카오·네이버·엔씨소프트와 금융주, LG화학 등을 사들였다. 11일 한국거래소에 따르면 올해들어 2월10일까지 코스피 시장에서 외국인은 총 4조8334억원을 순매도했다.외국인의 매도는 시가총액 1위 대장주 삼성전자에 집중됐다. 외국인은 반도체 슈퍼사이클 기대에 올초 급등했던 삼성전자(5조4436억원)와 삼성전자우(1조7818억원)를 합쳐 7조2254억원을 순매도하며 차익실현에 나섰다.애플카 생산 기대감에 급등한 기아차(1조885억원), 마그나와의 전기차 부품 합작사 설립 기대와 스마트폰 사업 철수 소식에 급등한 LG전자(9982억원)에 대해서도 차익실현에 나섰다. 현대모비스도 9209억원 순매도했다.반면 대규모 순매수에 나선 종목도 있었다. 외국인은 올해 들어 전기차 배터리 대장주 LG화학을 8438억원 사들였다. 특히 이달 들어서만 6127억원을 순매수했다. 언택트 3인방으로 불리는 카카오(8497억원)·NAVER(7234억원)·엔씨소프트(3754억원)도 올해 2조원 가까이 순매수했다. 대표 저평가주로 꼽히는 KB금융(2382억원)· 하나금융지주(2361억원)·신한지주(2326억원) 등 금융주도 사들였다. SK텔레콤도 2867억원 순매수했다.올해초까지 이어졌던 달러 약세-원화 강세로 외국인이 돌아올 것이라는 기대가 커졌었지만, 지난달 미국 국채금리 급등에 따른 안전선호 강화와 달러 강세로 외국인이 순매도에 나선 것으로 풀이된다. 최근 들어서는 외국인 수급에 변화 조짐이 나타나고 있다. 지난달 코스피 시장에서 5조2996억원 순매도한 것과 달리 이달 들어서는 4662억원 순매수하며 국내 증시로 돌아올 조짐도 보이고 있다. 향후 외국인 수급에는 달러/원 환율이 절대적인 영향을 미칠 것으로 보인다. 당초 시장기대와 다르게 최근 달러화 강세로 신흥시장의 투자 매력이 약화됐지만, 여전히 달러 약세-원화 강세 전망은 유효한 만큼 향후 외국인이 돌아올 가능성은 남아있다. 이승우 유진투자증권 리서치센터장은 ""당초 시장에서는 달러 약세를 전망했으나, 최근 강세를 보이면서 외국인들도 이머징 마켓(신흥국 시장)에 대한 투자를 늘리지 않고 있다""면서 ""우리나라를 비롯한 신흥국에서도 코로나19 확산세가 잡히고, 펀더멘털 개선세가 본격화돼 원화가 강세를 보인다면 다시 국내 증시 투자도 늘릴 것""이라고 전망했다.min785@news1.kr▶ 네이버 메인에서 [뉴스1] 구독하기!▶  뉴스1&BBC 한글 뉴스 ▶  터닝포인트 2021 © 뉴스1코리아(news1.kr), 무단 전재 및 재배포 금지"
2021.02.11.,"설 연휴에도 잠못자는 서학개미들, 주의해야할 점은?",https://n.news.naver.com/mnews/article/003/0010340997?sid=101,"외환시장 휴장에 환전 불가통합증거금 이용시 5% 추가액 있어야[서울=뉴시스]신항섭 기자 = 올 설 연휴에도 서학개미들의 적극적인 투자가 나타날 것으로 전망된다. 특히 국내 설 연휴 기간 미국에서는 지속적인 기업들의 실적발표가 이뤄져 상황에 따라 좋은 투자 수익을 거둘 수 있다. 다만 국내에서는 공휴일이란 점에서 환전이 되지 않는 경우가 발생할 수 있다. 미리 환전을 해두거나 통합증거금이 있는 증권사를 이용하는 것이 편리하다. 통합증거금도 매수하려는 금액보다 5%가 더 많은 여유 자금이 필요하다.11일 금융투자업계에 따르면 한국예탁결제원이 보관 중인 외화증권 규모는 592억9723만달러(약 65조9260억원)이다. 이는 지난해말 470억7665만달러(약 52조3440억원) 대비 25.95% 증가한 수준이다. 특히 2019년말 기준 보관액인 144억5305달러(약 16조84억원)대비 무려 310% 폭증했다.이 중 가장 큰 규모를 보이고 있는 곳은 미국에 투자하는 서학개미들이다. 서학개미의 미국 주식 보관 잔액은 479억931만달러(약 53조2655억원)에 달한다. 특히 테슬라 보유 주식은 약 108억달러로 무려 12조원에 달한다.이처럼 서학개미들의 투자는 이번 설 연휴에도 이어질 전망이다. 개미들의 주 활약 무대인 국내증시가 휴장하고 신종 코로나바이러스감염증(코로나19)로 5인 이상 집합 금지가 이뤄졌기 때문이다.실제로 5인 이상 집합 금지가 이뤄졌던 지난해 추석 연휴기간 9억0747만달러(약 1조63억원)의 매수가 있었다. 이는 집합금지가 없던 지난해 설 연휴 기간의 매수액 2억8432만달러(3153억원)의 3배가 넘는 수준이다.다만 서학개미가 연휴 기간에 투자할 때, 주의해야 할 점은 바로 환전이다. 공휴일에 맞춰 국내 외환시장이 문을 닫아 환전 업무가 불가능해진다. 이로 인해 외환시장이 열려있던 10일에 미리 환전을 해놓지 않았더라면 미국 주식을 살 수 없는 상황이 연출될 수 있다. 일부 증권사들은 원화로 미국 주식을 주문하는 것이 제한되기 때문이다.만약 환전을 미리 못했다면 통합증거금 제도가 도입된 증권사에서 해외주식이 가능한 계좌를 개설해 투자에 나서면 된다. 통합증거금 제도란 별도의 환전 절차 없이 국내·외 주식을 거래하고 필요 금액만큼 자동 환전하는 서비스다. 현재 국내 증권사 가운데 미래에셋대우, 한국투자증권, 삼성증권, NH투자증권, KB증권, 신한금융투자 등이 통합증거금 제도를 도입했다. 설 연휴 기간에도 증권사 대부분이 비대면 계좌 개설을 진행할 수 있다.다만 설 연휴 이후의 환율을 적용해 매수 금액보다 5% 더 많은 원화가 있어야 한다. 예를 들어 100만원짜리 주식이면 105만원이 필요하다. 적용 환율은 명절 이후인 15일로 적용된다.통합증거금 제도를 운영 중인 증권사 관계자는 ""국내 외환시장이 열리지 않아 원화증거금으로 주문으로 받는데, 100만원어치를 주문할려면 105만원이 들어가 있어야 한다""면서 ""증거금 5% 추가로 들어가 매수가 이뤄지고 15일에 환율이 계산돼 차액은 다시 돌려주는 방식으로 매매가 이뤄진다""고 설명했다.이외에도 스탁콘을 활용해 해외주식을 매수하거나 선물하는 것도 있다. 스탁콘은 카카오톡 선물하기에서 구매가 가능하다. 스탁콘 금액만큼 소수점으로 미국 주식을 매수할 수 있다. 스탁콘은 신한금융투자 계좌를 개설해야 한다.☞공감언론 뉴시스 hangseob@newsis.com▶ 네이버에서 뉴시스 구독하기▶ K-Artprice, 유명 미술작품 가격 공개▶ 뉴시스 빅데이터 MSI 주가시세표 바로가기<ⓒ 공감언론 뉴시스통신사. 무단전재-재배포 금지>"
