기사날짜,기사제목,네이버 뉴스 url,기사내용
2021.02.25.,"'5조 기부' 김범수 ""롤모델 빌게이츠…인재양성 위한 AI캠퍼스 고민중""",https://n.news.naver.com/mnews/article/092/0002214643?sid=105,"직원 간담회 '브라이언톡 애프터' 개최(지디넷코리아=안희정  기자)김범수 카카오 의장이 25일 오후 열린 사내 직원 간담회 '브라이언톡 애프터'에서 얼마전 발표한 5조원 기부 방향과 사내 평가 제도·보상 관련 생각을 공유했다.먼저 김 의장은 사회문제 해결이나 거버넌스 롤모델로 빌 게이츠를 꼽았다. 그는 ""최근에 기부서약같은 것도 빌 게이츠 재단에서 만든 것인데, 미국 사회에서 IT기업인들은 그 서약을 하는 게 문화처럼 퍼졌다""며 ""대한민국도 퍼질 수 있는 환경, 거기까지 가보면 어떨까 하는 생각을 했다. 빌 게이츠가 역설한 '창조적 자본주의'도 우리도 적용해서 풀 수 있는 문제가 있을 것이라 생각한다""고 말했다.그러면서 기부 방향에 대해서는 ""미래를 준비하는 사람들, 디지털 교육 격차 등으로 기회를 얻지 못한 사람들, AI 인재들에 관심이 있다""며 ""엔지니어, AI 인재 양성을 하이브리드로 할 필요가 있다. 인재 양성을 위한 AI 캠퍼스도 고민 중이다. 온라인뿐만 아니라 오프라인으로도 참여할 수 있는 구조를 만들려고 한다""는 계획도 밝혔다.또한 ""기부금을 묵혀두는 개념이 아니라, 필요한 곳에 바로 써나가고 싶다""며 ""1년이면 1년, 단위를 정해 몇천 억원 수준을 쓰는 구조로 가고 싶다. 대규모 자본을 투입해 몇 가지 사회 문제라도 풀 수 있었으면 좋겠다""고 덧붙였다.김범수 의장김 의장은 ""스타트업이 많으면 많을수록 좋을 거 같다. 지원하는 구조는 계속 나와야한다고 생각한다""며 ""언젠가는 카카오내에서 또는 카카오의 자녀들이 스타트업에서 빨리 경영할 수 있는 구조도 나오면 좋을 거 같다. 스타트업이 내가 가는 진로의 옵션이 됐으면 좋겠다. 좋은 대학나와 좋은 직장 가는 것의 비중이 제일 큰데 그러지 않고 다양하게 만들어지는 구조가 됐으면 한다""는 바람도 나타냈다.평가제도와 보상 관련한 이야기도 나왔다. 김 의장은 최근 카카오에서 인사 평가 제도로 인해 불거진 논란을 의식하며 ""직장 내 누군가에게 해를 끼치거나 해를 끼치는 의도는 없었지만 누군가에게 상처를 주거나 하는 것은 정말 조심해야한다. 카카오 내에선 절대로 누군가 무시하거나 괴롭히는 행위는 절대 없어야 한다""고 말했다.그러면서 ""카카오는 문제를 인식하고 해결할 마음가짐과 의지가 있는 회사라고 믿고 있다. 이번 이슈는 사내 문화에 경고등이 켜진 것이라고 생각한다""고 덧붙였다.보상에 대해서는 ""최고의 인재에겐 최고의 대우를 해줘야한다는 생각을 한다. 카카오는 지금 당장 부족한 면은 있을 수 있지만 우리 산업군에서는 보상이 많은 회사가 되었으면 좋겠고 거기로 가고 있는 중이다""라며 ""경쟁사보다 보상이 더 적다면 빨리 개선을 해야할 것이다. 장기적 변화는 시간을 좀 줬으면 좋겠다. 현재 균형을 못 맞출수는 있으나 장기적인 관점으로 맞춰나가겠다""고 강조했다.안희정 기자(hjan@zdnet.co.kr) ▶ 지디넷코리아 '홈페이지' ▶ 네이버 채널 구독하기© 메가뉴스 & ZDNET, A RED VENTURES COMPANY, 무단전재-재배포 금지"
2021.02.25.,"'찐서유기' 김계란, 자급자족 농촌생활 시작…승우아빠→공혁준 합류",https://n.news.naver.com/mnews/article/009/0004755000?sid=106,<구조 다름>
2021.02.25.,'보이소 TV' 지자체 첫 유튜브 인증 배지 획득,https://n.news.naver.com/mnews/article/079/0003472278?sid=102,"[대구CBS 김세훈 기자]경북도 제공경상북도 공식 유튜브 '보이소 TV'가 국내 지방자치단체 중 최초로 '유튜브 채널 인증 배지'를 획득했다.유튜브를 비롯해 SNS 전 채널(페이스북, 인스타그램, 트위터, 카카오스토리) 모두 인증 배지를 보유한건 경북도가 유일하다.'인증 배지'의 획득 요건은 구독자 수가 10만 명 이상이어야 한다. 여기에 유튜브 본사(구글)에서 채널 운영기간 등 다양한 요인을 검토해 진위성, 완전성 등 일정 자격을 심사해 부여한다. 유튜브 측은 채널이 인증되면 기관의 공식 채널로 공인되는 것이며 이름이 유사한 다른 유튜브 채널과 구분할 수 있다고 밝혔다. 인증 배지는 현재 PC 버전에서만 제공하고 모바일은 추후 서비스할 예정이다.2019년 운영을 시작한 '보이소 TV'는 현재 구독자 수 11만여 명을 보유하고 있으며 공공기관에서 흔히 볼 수 없는 신선한 콘텐츠를 꾸준히 선보이며 경북도 대표 홍보 채널로 자리매김했다. 2020년에는 제10회 대한민국 SNS 대상 종합대상을 비롯해 3개 분야 SNS 어워드의 대상을 석권하기도 했다. 이철우 도지사는 ""콘텐츠 제작 경쟁이 치열한 시기에 지자체 최초로 인증 배지를 받은 건 큰 의미가 있다""며 ""올해는 웹 예능 등 한 번도 시도하지 않았던 새로운 형식의 콘텐츠를 선보여 도민들에게 다양한 볼거리를 제공하겠다""고 말했다.▶ 확 달라진 노컷뉴스▶ 클릭 한 번이면 노컷뉴스 구독!▶ 보다 나은 세상, 노컷브이와 함께huni@cbs.co.kr저작권자 © CBS 노컷뉴스 무단전재 및 재배포 금지"
2021.02.25.,"'5조 기부' 김범수 ""롤모델 빌게이츠…인재양성 위한 AI캠퍼스 고민중""",https://n.news.naver.com/mnews/article/092/0002214643?sid=105,"직원 간담회 '브라이언톡 애프터' 개최(지디넷코리아=안희정  기자)김범수 카카오 의장이 25일 오후 열린 사내 직원 간담회 '브라이언톡 애프터'에서 얼마전 발표한 5조원 기부 방향과 사내 평가 제도·보상 관련 생각을 공유했다.먼저 김 의장은 사회문제 해결이나 거버넌스 롤모델로 빌 게이츠를 꼽았다. 그는 ""최근에 기부서약같은 것도 빌 게이츠 재단에서 만든 것인데, 미국 사회에서 IT기업인들은 그 서약을 하는 게 문화처럼 퍼졌다""며 ""대한민국도 퍼질 수 있는 환경, 거기까지 가보면 어떨까 하는 생각을 했다. 빌 게이츠가 역설한 '창조적 자본주의'도 우리도 적용해서 풀 수 있는 문제가 있을 것이라 생각한다""고 말했다.그러면서 기부 방향에 대해서는 ""미래를 준비하는 사람들, 디지털 교육 격차 등으로 기회를 얻지 못한 사람들, AI 인재들에 관심이 있다""며 ""엔지니어, AI 인재 양성을 하이브리드로 할 필요가 있다. 인재 양성을 위한 AI 캠퍼스도 고민 중이다. 온라인뿐만 아니라 오프라인으로도 참여할 수 있는 구조를 만들려고 한다""는 계획도 밝혔다.또한 ""기부금을 묵혀두는 개념이 아니라, 필요한 곳에 바로 써나가고 싶다""며 ""1년이면 1년, 단위를 정해 몇천 억원 수준을 쓰는 구조로 가고 싶다. 대규모 자본을 투입해 몇 가지 사회 문제라도 풀 수 있었으면 좋겠다""고 덧붙였다.김범수 의장김 의장은 ""스타트업이 많으면 많을수록 좋을 거 같다. 지원하는 구조는 계속 나와야한다고 생각한다""며 ""언젠가는 카카오내에서 또는 카카오의 자녀들이 스타트업에서 빨리 경영할 수 있는 구조도 나오면 좋을 거 같다. 스타트업이 내가 가는 진로의 옵션이 됐으면 좋겠다. 좋은 대학나와 좋은 직장 가는 것의 비중이 제일 큰데 그러지 않고 다양하게 만들어지는 구조가 됐으면 한다""는 바람도 나타냈다.평가제도와 보상 관련한 이야기도 나왔다. 김 의장은 최근 카카오에서 인사 평가 제도로 인해 불거진 논란을 의식하며 ""직장 내 누군가에게 해를 끼치거나 해를 끼치는 의도는 없었지만 누군가에게 상처를 주거나 하는 것은 정말 조심해야한다. 카카오 내에선 절대로 누군가 무시하거나 괴롭히는 행위는 절대 없어야 한다""고 말했다.그러면서 ""카카오는 문제를 인식하고 해결할 마음가짐과 의지가 있는 회사라고 믿고 있다. 이번 이슈는 사내 문화에 경고등이 켜진 것이라고 생각한다""고 덧붙였다.보상에 대해서는 ""최고의 인재에겐 최고의 대우를 해줘야한다는 생각을 한다. 카카오는 지금 당장 부족한 면은 있을 수 있지만 우리 산업군에서는 보상이 많은 회사가 되었으면 좋겠고 거기로 가고 있는 중이다""라며 ""경쟁사보다 보상이 더 적다면 빨리 개선을 해야할 것이다. 장기적 변화는 시간을 좀 줬으면 좋겠다. 현재 균형을 못 맞출수는 있으나 장기적인 관점으로 맞춰나가겠다""고 강조했다.안희정 기자(hjan@zdnet.co.kr) ▶ 지디넷코리아 '홈페이지' ▶ 네이버 채널 구독하기© 메가뉴스 & ZDNET, A RED VENTURES COMPANY, 무단전재-재배포 금지"
2021.02.25.,"'찐서유기' 김계란, 자급자족 농촌생활 시작…승우아빠→공혁준 합류",https://n.news.naver.com/mnews/article/009/0004755000?sid=106,<구조 다름>
2021.02.25.,"기업은행, 우편 대신 카톡·문자로...모바일 전자고지 실시",https://n.news.naver.com/mnews/article/030/0002930420?sid=101,"IBK기업은행(행장 윤종원)은 개인과 개인사업자에게 우편물로 발송하는 안내통지문을 카카오톡과 문자로 발송하는 '모바일 전자고지' 서비스를 실시한다고 25일 밝혔다.안내는 별도 신청 없이 카카오톡으로 자동 발송된다. 24시간 내에 수신하지 않으면 미수신 최소화를 위해 문자와 우편으로 재안내한다.서비스는 대출금 기일안내, 퇴직연금 가입자 교육자료 등을 시작으로 점차 대상을 확대할 예정이다.기업은행은 종이 사용량 감축 정책을 10년째 이어오고 있다. 전자전표와 전자문서를 도입하고 비대면 기간연장을 시행하는 등 연간 약 4200만장 종이를 절약했다.기업은행 관계자는 “해당 서비스로 연간 560만건 우편물이 감소할 것으로 예상된다”며 “앞으로도 디지털 전환으로 ESG경영을 실천하겠다”고 말했다.배옥진기자 withok@etnews.com▶ 'AI 차세대 컨택센터 컨퍼런스 2021' 30일 개최▶ 네이버 홈에서 [전자신문] 구독하기 [Copyright ⓒ 전자신문 & 전자신문인터넷, 무단전재 및 재배포 금지]"
2021.02.25.,"하나카드, 봄맞이 골프 프로모션…그린피 10% 할인",https://n.news.naver.com/mnews/article/031/0000585727?sid=101,"카카오골프예약 앱에서 할인 혜택 제공하나카드의 골프 프로모션 홍보 포스터 [이미지=하나카드][아이뉴스24 서상혁 기자] 하나카드는 봄 맞이 골프 시장 특화 프로모션을 3월 한 달 동안 진행한다고 25일 밝혔다.골프 시장은 코로나19로 인해 여가 생활의 제약이 있는 요즘 소규모 인원으로 즐길 수 있으며, 해외여행을 떠나지 못하는 이들의 대체 여가생활로 호황을 누리고 있다. 하나카드는 이러한 골프 시장의 소비 트렌드를 반영해 프로모션을 준비했다.카카오톡을 기반으로 골프서비스 '카카오골프예약' 앱에서 예약하고 싶은 골프장을 선택한 후 ▲그린피를 하나카드로 결제하면 10% 청구할인(최대 5만원)을 받을 수 있다. 더불어 선 결제 시 '모두의 건강' 카드를 사용하면 추가 5만원 캐시백도 가능해 봄 시즌 골프장 예약을 앞둔 골프 관심 고객들의 부담을 낮출 수 있을 것으로 보인다.그린피 할인 혜택 외에도 골프 종합쇼핑몰에서의 결제 할인 혜택을 제공한다. 골프존에서 운영하는 인기 골프 종합 쇼핑몰 ▲골핑에서 10만원 이상 결제 시 최대 5만원 즉시 할인 등의 혜택을 받을 수 있다.하나카드 관계자는 ""코로나19 상황에서 골프 관련 혜택 수요가 늘어나는 최근 트렌드를 반영해, 이번 골프 특화 프로모션을 준비했다""라며 ""이번 프로모션을 통해 많은 고객들이 부담 없이 골프를 즐길 수 있기를 바라며 앞으로도 트렌디한 생활 속 혜택 제공을 위해 더욱 노력하겠다""라고 말했다.서상혁기자 hyuk@inews24.com▶네이버 채널에서 '아이뉴스24'를 구독해주세요.▶재밌는 아이뉴스TV 영상보기 ▶아이뉴스24 바로가기[ⓒ 아이뉴스24 무단전재 및 재배포 금지]"
2021.02.25.,"한은-금융위, 국회 공청회 '빅브라더 법' 대리전",https://n.news.naver.com/mnews/article/214/0001102294?sid=100,"이른바 '빅브라더(Big Brother) 법' 논란이 제기된 전자금융거래법 개정안을 둘러싸고 오늘 국회 정무위원회 공청회에서 한국은행과 금융위원회의 입장을 반영한 대리전이 벌어졌습니다.  금융위가 추진 중인 전자금융거래법 개정안은 네이버·카카오페이와 같은 빅테크 기업의 지급결제를 관리·감독하는 내용을 담고 있습니다.  특히 빅테크 기업의 내부 거래가 금융결제원과 같은 외부기관을 통해야 한다는 '외부청산 의무화' 조항과 관련해 한국은행은 중앙은행 고유권한인 지급결제 관련 관리감독권을 금융위가 침범하고 있으며, 해당 법안이 개인정보 침해 가능성이 있다는 점을 들어 반대하고 있습니다.  공청회에 참석한 전북대 양기진 법학대학원 교수는 발제문에서 ""내부거래 외부의무 청산은 중국을 포함해 세계적인 전례가 없다""며 ""과도한 입법""이라고 평가했습니다.  양 교수는 ""개인정보를 한 바구니에 담는 방식으로 더 큰 사이버범죄 위험에 노출할 소지가 있다""며 ""금융결제원에 실정법상 지위를 부여하고자 한다면 통제 권한을 중앙은행인 한은에 부여하는 것이 적정하다""고 주장했습니다.  반면 서울대 안동현 경제학과 교수는 ""지급결제 안전성과 이용자 보호를 위해 구분계리와 예탁금의 외부예치, 빅테크 외부청산의 3종 세트는 반드시 필요한 제도""라고 강조했습니다.  안 교수는 ""금융 소비자 보호라는 대의는 뒷전으로 물러나고 정보집중 등 법적 기술적으로 충분히 해결할 수 있는 지엽적인 문제로 논의가 지연되는 부분이 안타깝다""고 말했습니다.이학수 기자(tchain@mbc.co.kr)[저작권자(c) MBC (https://imnews.imbc.com) 무단복제-재배포 금지]▶ 네이버 홈에서 [MBC뉴스] 채널 구독하기▶ 새로움을 탐험하다. ""엠빅뉴스""▶ [탐사보도] 일본, 로비의 기술Copyright(c) Since 1996, MBC&iMBC All rights reserved."
2021.02.25.,김동성 또 전처와 대화 공개...여교사 스폰서 의혹은 NO해명,https://n.news.naver.com/mnews/article/416/0000268322?sid=106,<구조 다름>
2021.02.25.,"이해진-김범수, 2시부터 직원 간담회…성과급·기부·인사제도 토론",https://n.news.naver.com/mnews/article/018/0004861406?sid=105,"업계 최고 수준 대우, 수평적 기업문화에도최근 성과급 기준, 인사평가제도 논란 나와일부 직원 직접 참석..다른 직원들은 원하면 온라인으로 참여[이데일리 김현아 기자]  이해진 네이버 글로벌투자책임자(GIO)와 김범수 카카오 이사회 의장 네이버(035420)와 카카오(035720)의 창업자가 같은 날 같은 시간에 직원들을 만난다.네이버 이해진 글로벌투자책임자(GIO)와 카카오 김범수 이사회 의장은 25일 오후 2시부터 2시간동안 예정된 직원 간담회에 참석해 회사 현안과 미래 비전에 대해 토론한다. 두 회사는 업계 최고 수준 대우와 수평적 기업 문화 등으로 부러움을 사지만, 최근 성과급 산정 기준과 인사 평가 제도 등을 두고 직장인 익명 커뮤니티 블라인드에서 이런저런 잡음이 불거졌다.네이버 이해진 GIO와 한성숙 대표는 이날 본사 그린팩토리에서 ‘컴패니언 데이’를 열고 임직원들에게 성과급을 비롯한 보상체계에 관해 설명하는 자리를 마련한다.  이 행사는 카카오와 달리 직원 초청 없이 전부 비대면으로 이뤄진다.인사담당자가 Q&A에 대해 설명하는 수준으로 진행할 계획이었으나, C레벨 경영리더들이 참여하는 컴패니언 데이로 규모를 확대했다.네이버 관계자는 “사전 질문을 받았는데 회사의 투자 계획에 대한 질문이 나오는 등 미래 비전에 대한 관심도 많았다”며 “총 6천여명이 대상”이라고 말했다. 카카오 김범수 이사회 의장도 이날 직원들과 간담회를 연다. 김 의장은 얼마전 살아 있는 동안 재산의 절반(5조 원 정도)을 기부하겠다고 밝혔고, 이에 대한 직원들의 아이디어를 구하기 위해 간담회를 열려 했지만 최근 카카오의 인사 평가 제도에 대한 불만이 터져 나오면서 평가 제도에 대한 언급도 있을 전망이다.일단 간담회는 미리 신청한 직원 50명은 직접 참여하고, 6천여 명에 달하는 모든 직원이 카카오TV 생중계를 보고 댓글을 달 수 있다. 카카오 관계자는 “오늘 간담회외에 3월 11일 직원 인사평가 제도 개선을 위한 간담회를 따로 열기로 했다”면서 “하지만 오늘 간담회에서도 직원들이 김 의장에게 카카오의 다면평가시스템이나 질문 문항 등에 대한 생각을 묻지 않을 까 한다”고 말했다. 카카오는 직원들의 평가시스템에 ‘(리뷰대상자와) 다시 함께 일하시겠습니까?’라는 질문이 있는데, 이 질문에 대한 결과가 리뷰 대상자에게 그대로 전달돼 왕따 논란이 제기된 바 있다.김현아 (chaos@edaily.co.kr)▶ #24시간 빠른 #미리보는 뉴스 #eNews+▶ 네이버에서 '이데일리 뉴스'를 만나보세요▶ 빡침해소, 청춘뉘우스 '스냅타임'＜ⓒ종합 경제정보 미디어 이데일리 - 무단전재 & 재배포 금지＞"
2021.02.25.,"‘아직 낫서른’ 안희연♥백성철, 키스 1초전",https://n.news.naver.com/mnews/article/382/0000893128?sid=106,<구조 다름>
2021.02.25.,"[빅뉴스] 유영민 “신현수 사표 수리될 수도, 조만간 결론”…“당신과 일하기 싫다” 카카오 인사평가 항목, 고용노동부행",https://n.news.naver.com/mnews/article/056/0010996069?sid=100,"키워드로 뉴스를 살펴보는  빅데이터 뉴스, 빅뉴습니다. 오늘자 만여 건의 기사에  가장 많이 등장한 단어들인데요. 정치면부터 분야별로 보겠습니다. '유영민' 대통령 비서실장이  오늘 국회에 나와  '신현수' 민정수석 사의 파동에 대해 설명했는데요. 유 실장은  ""신 수석이 여러 차례 구두로 사의를 표명하고 문서로 사표를 냈다""며 ""수리가 될 수도 있다""고 말했습니다. ""아직까지 이와 관련된 대통령의 결정은 없었다""면서, ""조만간 결론을 내리겠다""는 입장도 밝혔습니다.  경제면에는  '현대자동차'와  'LG에너지솔루션'이 연관 키워드로 함께 올라왔는데요.  현대차가  코나 전기차 등 3개 차종  8만 천 7백 대를 리콜하기로 했다는  뉴스 때문입니다. 앞서 국토교통부는  코나의 잇따른 화재 원인이  배터리 내부 합선일 가능성이 높다는 조사 결과를 내놨는데요. 하지만 배터리 제조사인  LG에너지솔루션은 배터리셀 불량을 화재의 직접적인 원인으로 보기 어렵다고 반박했습니다. 다음은 IT 과학면인데요. ""당신과 일하기 싫다""는  인사 평가 항목으로 논란이 불거진 '카카오'가 직원 간담회를 열어  개선 방안을 논의한다는 소식을  여러 매체가 다뤘는데요. 이런 가운데  함께 일하기 싫다는 평가항목을  수집해 공개하는 카카오의 인사 제도가 직장 내 괴롭힘에 해당하는지  조사해달라는 청원이  고용노동부에 접수됐다는 보도도 관심을 끌었습니다. 지역면에서는  '부산'의 한 보건소의  소장을 포함한 직원 11명이  단체회식을 한 것으로 확인됐다는  보도가 눈에 띄었습니다. 회식을 한 시점도 정부가 5인 이상 집합금지를  2주 연장한 때였다고 합니다.  사회면에는  '윤석열' 검찰총장과  '이성윤' 서울중앙지검장이 함께  떠있는데요. 김학의 전 법무부 차관 불법 출국금지 의혹 사건을 수사 중인 '검찰'이 수사 외압 의혹을 받는  이성윤 서울중앙지검장을  피의자 신분으로 전환했습니다. 앞서 서울중앙지검은 경찰이 불기소 의견으로 송치했던 윤석열 총장 장모의 사기 등 혐의에 대해 보완수사를 요구했고 이에 따라 경찰이 재수사에 나섰는데요. 언론은  윤 총장과 이 지검장 간 힘겨루기가 본격화했다는 관측이 나온다고  보도했습니다.  오늘 빅뉴스는 여기까지고요. 송영석 (sys@kbs.co.kr)▶ 더 빠르고 정확한 소식을 원하시면 KBS뉴스 구독!▶ ‘코로나19 3차 대유행’ 제대로 알아야 이긴다"
2021.02.25.,"이해진-김범수, 2시부터 직원 간담회…성과급·기부·인사제도 토론",https://n.news.naver.com/mnews/article/018/0004861406?sid=105,"업계 최고 수준 대우, 수평적 기업문화에도최근 성과급 기준, 인사평가제도 논란 나와일부 직원 직접 참석..다른 직원들은 원하면 온라인으로 참여[이데일리 김현아 기자]  이해진 네이버 글로벌투자책임자(GIO)와 김범수 카카오 이사회 의장 네이버(035420)와 카카오(035720)의 창업자가 같은 날 같은 시간에 직원들을 만난다.네이버 이해진 글로벌투자책임자(GIO)와 카카오 김범수 이사회 의장은 25일 오후 2시부터 2시간동안 예정된 직원 간담회에 참석해 회사 현안과 미래 비전에 대해 토론한다. 두 회사는 업계 최고 수준 대우와 수평적 기업 문화 등으로 부러움을 사지만, 최근 성과급 산정 기준과 인사 평가 제도 등을 두고 직장인 익명 커뮤니티 블라인드에서 이런저런 잡음이 불거졌다.네이버 이해진 GIO와 한성숙 대표는 이날 본사 그린팩토리에서 ‘컴패니언 데이’를 열고 임직원들에게 성과급을 비롯한 보상체계에 관해 설명하는 자리를 마련한다.  이 행사는 카카오와 달리 직원 초청 없이 전부 비대면으로 이뤄진다.인사담당자가 Q&A에 대해 설명하는 수준으로 진행할 계획이었으나, C레벨 경영리더들이 참여하는 컴패니언 데이로 규모를 확대했다.네이버 관계자는 “사전 질문을 받았는데 회사의 투자 계획에 대한 질문이 나오는 등 미래 비전에 대한 관심도 많았다”며 “총 6천여명이 대상”이라고 말했다. 카카오 김범수 이사회 의장도 이날 직원들과 간담회를 연다. 김 의장은 얼마전 살아 있는 동안 재산의 절반(5조 원 정도)을 기부하겠다고 밝혔고, 이에 대한 직원들의 아이디어를 구하기 위해 간담회를 열려 했지만 최근 카카오의 인사 평가 제도에 대한 불만이 터져 나오면서 평가 제도에 대한 언급도 있을 전망이다.일단 간담회는 미리 신청한 직원 50명은 직접 참여하고, 6천여 명에 달하는 모든 직원이 카카오TV 생중계를 보고 댓글을 달 수 있다. 카카오 관계자는 “오늘 간담회외에 3월 11일 직원 인사평가 제도 개선을 위한 간담회를 따로 열기로 했다”면서 “하지만 오늘 간담회에서도 직원들이 김 의장에게 카카오의 다면평가시스템이나 질문 문항 등에 대한 생각을 묻지 않을 까 한다”고 말했다. 카카오는 직원들의 평가시스템에 ‘(리뷰대상자와) 다시 함께 일하시겠습니까?’라는 질문이 있는데, 이 질문에 대한 결과가 리뷰 대상자에게 그대로 전달돼 왕따 논란이 제기된 바 있다.김현아 (chaos@edaily.co.kr)▶ #24시간 빠른 #미리보는 뉴스 #eNews+▶ 네이버에서 '이데일리 뉴스'를 만나보세요▶ 빡침해소, 청춘뉘우스 '스냅타임'＜ⓒ종합 경제정보 미디어 이데일리 - 무단전재 & 재배포 금지＞"
2021.02.25.,"IBK기업은행, '모바일 전자고지' 서비스 실시",url없음,<네이버 기사 없음>
2021.02.25.,"‘아직 낫서른’ 안희연♥백성철, 키스 1초전",https://n.news.naver.com/mnews/article/382/0000893128?sid=106,<구조 다름>
