기사날짜,기사제목,네이버 뉴스 url,기사내용
2021.02.28.,○○페이 선불충전금 2조원…외국은 어떻게 보호하나,https://n.news.naver.com/mnews/article/001/0012230262?sid=101,"전자금융거래법 개정안 '빅테크 외부청산' 놓고 갑론을박정무위, 전자금융거래법 공청회(서울=연합뉴스) 진성철 기자 = 지난 25일 국회 정무위원회에서 전자금융거래법 개정안에 관한 공청회가 열리고 있다. zjin@yna.co.kr    (서울=연합뉴스) 김다혜 기자 = 전자금융거래법 개정안에 담긴 빅테크(거대 정보통신업체) 외부청산 의무화 조항을 놓고 갑론을박이 이어지고 있다.    파산·분식회계 등으로부터 고객 자금을 보호할 최적의 방안이라는 의견과 국제적 흐름에 반하는 입법으로서 개인정보를 과도하게 수집한다는 비판이 맞선다.    28일 이용우 더불어민주당 의원이 금융감독원으로부터 제출받은 자료에 따르면 지난해 9월 말 기준 카카오페이 등 전자금융업체 47곳이 보유한 선불충전금 잔액은 1조9천925억원이다.    이들 사업자는 이용자가 계좌이체 등 방법으로 미리 충전해둔 자금을 보유하고 있다가 결제·송금 수단으로 제공한다.    현재 국회에 발의된 전자금융거래법 개정안에는 이러한 충전금을 고유재산과 분리해 은행 등 외부기관에 예치·신탁하고 파산 시 이용자에게 우선 변제하도록 하는 동시에, 일정 규모 이상의 빅테크에 대해서는 내부거래(같은 전자금융업체 이용자 간 거래)도 외부기관 청산을 거치도록 하는 내용이 담겼다.    청산은 지급지시를 중계하고 거래기관 간 채권·채무 관계를 계산해 서로 주고받을 금액을 확정하는 것을 뜻한다.    이용자 예탁금을 별도 관리하고 파산 시 다른 채무자에 우선해 변제받을 수 있도록 하는 것은 영국·일본 등 다른 나라도 도입하고 있는 장치로서 국내에서도 별다른 이견이 없다.    그러나 우리나라가 처음 도입하려는 빅테크 내부거래 청산 의무화를 두고는 찬반 의견이 극명하게 엇갈린다.    금융위원회 등은 빅테크가 이용자 자금을 유용하거나 자금세탁에 활용할 가능성을 사전에 차단하고 파산 시 이용자 자금을 신속히 되돌려주기 위해 외부청산이 필요하다고 보고 있다.    반면 양기진 전북대 법학전문대학원 교수는 지난 25일 국회에서 열린 공청회에서 ""내부거래에 청산 의무를 부여하는 것은 세계적으로 전례가 없어 글로벌 스탠더드에 반하고, 국민의 권익을 신장한다는 어떠한 실증도 없다""면서 ""오히려 빅브라더 이슈가 제기되고 개인정보자기결정권을 상당히 제약하거나 침해하는 입법이 될 수 있다""고 비판했다.    개정안이 통과되면 빅테크 이용자의 거래내역 등 신용정보가 외부청산기관(금융결제원)에 과도하게 집중되고 금융위원회가 관련 자료에 접근할 수 있어 문제라는 취지다.    해외 사례로는 중국이 2018년 왕롄을 도입해 알리페이 등 빅테크의 외부청산을 의무화하고 있으나 내부거래는 대상에 포함되지 않는다.    양 교수는 ""달걀을 왜 한 바구니에 넣느냐""며 ""개별 빅테크가 자기들만의 거버넌스를 통해 정보를 합리적으로 관리하고 금융위가 보고를 받는 방식이 더 좋지 않겠나""라고 말했다.    영국은 지급결제업자 및 전자화폐업자가 파산집행인이나 금융당국(FCA)이 자금의 주인이 누구인지 구분하는 데 필요한 정보를 최소 5년간 보관하고, 당국이 요구할 때 제출하도록 하고 있다. 연례 회계감사에서 기업이 이용자 보호 규정을 준수하지 않는 것으로 파악되면 감사인은 이를 당국에 보고해야 한다.    그 밖에 대만이나 홍콩처럼 빅테크에도 은행 수준의 건전성, 지배구조 규제를 적용하는 방안도 대안으로 거론된다.    하지만 개정안을 대표 발의한 윤관석 더불어민주당 의원과 금융위원회는 외부청산을 의무화하는 것이 빅테크의 혁신을 저해하지 않으면서도 이용자 예탁금을 보호할 수 있는 최적의 방법이라고 설명한다.    지난해 3분기 기준 하루 1천400만건에 달하는 빅테크 청산 대상 거래를 감독당국이 일일이 보고받아 확인하는 것은 법적·현실적으로 불가능하며, 청산과 달리 '보고'는 실제 전산처리 과정과 분리돼 있어 오류나 조작 가능성도 있다는 것이다.     독일 빅테크 지급결제사업자 '와이어카드'는 사내 보유금 19억 유로(한화 약 2조6천억원)가 사라지는 등 회계부정 의혹에 휩싸이면서 지난해 파산을 신청한 바 있다.    또 청산의 경우 평소에는 시스템 간 연계로 자동 처리하다가 도산·분식회계 등 사고 발생 시에만 내역을 확인할 수 있지만, 감독기관이 보고를 받아 일일이 감독하는 경우 오히려 개인정보가 상시로 노출되기 때문에 적절한 대안이 아니라는 게 금융위 등의 입장이다.    다른 나라에 없는 제도라고 해서 도입을 꺼릴 필요가 없다는 목소리도 있다.    안동현 서울대 경제학과 교수는 공청회에서 ""빅테크 산업은 최근에 육성돼 글로벌 스탠더드가 있을 수 없다""며 ""사실 선두주자가 중국이고 그 후발주자로 바로 뒤에 쫓아가는 게 우리나라 정도이다 보니 서로 빅테크를 어떤 식으로 규제할 것인지 고민하는 것""이라고 말했다.    전자금융거래법 개정안이 국회를 통과하려면 한국은행과의 이견 조율 등 넘어야 할 산이 많다.    한국은행은 전자지급결제청산업을 신설하고 금융위에 감독·제재 권한을 부여하는 개정안이 지급결제제도 운영·관리라는 한은의 고유 권한을 침해하고 지급결제시스템의 안전성을 저해할 우려가 있다며 반대하고 있다.    국회 기획재정위원회에는 김주영 민주당 의원이 지급결제에 관한 한은의 권한과 책임을 강화하는 내용의 한은법 개정안을 발의해둔 상태다.    개인정보보호위원회도 국민의힘 윤재옥 의원의 관련 질의에 대한 답변서에서 '전자지급거래에 관한 정보'를 청산기관에 제공하도록 한 전자금융거래법 개정안에 대해 ""범위가 명확하지 않아 건강, 성적 취향 등 개인의 내밀한 사생활에 관한 민감한 정보까지 포함될 가능성이 있다""는 견해를 밝혔다.    이와 관련해 금융위 관계자는 ""필요 최소한의 정보를 모으려는 것이고 빅테크에서 무엇을 샀는지와 같은 정보가 포함될 가능성은 전혀 없다""면서도 ""우려가 제기됨에 따라 시행령이 아닌 법안에 자료제공 항목을 열거하는 식으로 보완이 이뤄질 예정""이라고 말했다.     moment@yna.co.kr▶네이버에서도 뉴스는 연합뉴스[구독 클릭]▶[팩트체크]검찰이 직접 수사권 전면행사하는 나라 없다?▶제보하기<저작권자(c) 연합뉴스(https://www.yna.co.kr/), 무단 전재-재배포 금지>"
2021.02.28.,"김동성, 생활고+전처 갈등+여교사 카톡 공개→극단 선택 [종합]",https://n.news.naver.com/mnews/article/408/0000116229?sid=106,<구조 다름>
2021.02.28.,코로나 상황서 개인 주식 순매수 100조원…기관·외국인과 대조,https://n.news.naver.com/mnews/article/214/0001102795?sid=101,"출처: 연합뉴스코로나19 국면에서 개인 투자자의 순매수 금액이 100조원에 육박하는 것으로 나타났습니다.금융투자업계에 따르면 지난해 1월부터 올해 2월까지 개인들이 국내 주식시장에서 사들인 주식은 총 99조2천380억원으로 집계됐습니다.국내에서 코로나19 확진자가 발생했던 지난해 1월 이후 14개월간 월평균 7조원가량을 사들인 셈입니다.유가증권 시장에서는 78조2천672억원어치를 매집했고, 코스닥 시장에서도 20조9천708억원 순매수했습니다.특히 순매수액 100조원 가운데 우선주를 포함한 삼성전자 주식에 31조3천144억원이 몰렸습니다.전체 매수금액의 3분의 1에 해당하는 규모입니다.또 개인은 현대차와 기아차, 현대모비스 등 이른바 '현대차 3인방'도 7조7천940억원치를 사들였고,  네이버와 SK하이닉스, 카카오 등에도 1조원 넘게 투자했습니다.매수 대기 자금인 투자자예탁금은 지난 25일까지 65조원으로, 1년 전의 두 배에 달하고 있습니다.지난 1월 12일 74조원에 비해서는 줄었지만, 지난해 연말 수준을 유지하고 있는 겁니다.개인이 매수세를 유지하는 동안 외국인이 전체 32조7천32억원, 기관이 61조6천300억원어치를 각각 내다 팔며 대조적인 모습을 보였습니다.이문현 기자(lmh@mbc.co.kr)[저작권자(c) MBC (https://imnews.imbc.com) 무단복제-재배포 금지]▶ 네이버 홈에서 [MBC뉴스] 채널 구독하기▶ 새로움을 탐험하다. ""엠빅뉴스""▶ [탐사보도] 일본, 로비의 기술Copyright(c) Since 1996, MBC&iMBC All rights reserved."
2021.02.28.,"정용진 신세계 부회장이 클럽하우스서 ""우승반지 끼고 싶어 야구단 인수했다""고 밝혔다",url없음,<네이버 기사 없음>
2021.02.28.,"클래스101, 탈잉 등 교육 플랫폼 ‘몸값’ 고공행진",https://n.news.naver.com/mnews/article/014/0004592063?sid=105,"강사와 수강생 연결하는 온라인 교육 플랫폼 각광대형투자 유치와 IPO로 비대면 수업 생태계 확대  [파이낸셜뉴스]코로나 19로 인해 온라인 기반 교육 플랫폼이 주목을 받으면서 투자 자금도 몰리고 있다. 각자 자신의 재능을 콘텐츠로 내세워 수업을 개설할 수 있고, 수강생은 시간과 공간 제약 없이 각종 취미와 직무능력을 키울 수 있는 등 쌍방향 교육 플랫폼이 생활속에 자리잡아가고 있기 때문이다. 실제 ‘포스트 코로나’와 맞물려 비대면 수업 생태계가 커지면서 최근 온라인 교육 플랫폼 업체들이 대형투자유치와 기업공개(IPO) 행보를 이어가고 있다.  누적 투자 유치액 190억 달성한 온오프라인 클래스 플랫폼 '탈잉' 이미지. 탈잉 제공  ■탈잉, 누적 투자 유치액 190억 달성 2월28일 관련 업계에 따르면 국내외 유명 벤처캐피털(VC)들이 온라인 교육 플랫폼 △클래스101 △스터디파이 △탈잉 등에 대형 투자를 이어가고 있다.   클래스101과 스터디파이가 각각 120억 원과 33억 원 상당에 누적투자를 달성한 가운데 탈잉이 총 147억원 투자를 유치한 것. 이번에 탈잉이 진행한 ‘시리즈B(사업확장단계)’ 투자 라운드에는 메가스터디, 엔베스터, 신한대체투자운용, DSC인베스트먼트, 신한벤처투자가 참여했다. 이에 따라 탈잉의 누적 투자유치 금액은 190억 원에 이른다.   탈잉 시리즈A(첫 기관투자단계)와 시리즈B에 연달아 참여한 전형순 엔베스터 상무는 “탈잉은 시간을 더 의미 있게 보내고 싶어 하는 20~30대들 중심으로 빠른 성장세를 보이고 있다”며 “탈잉 팀의 콘텐츠 기획 및 플랫폼 운영 역량을 높게 평가했다”고 투자배경을 전했다.    야나두 사업구조. 야나두 제공  ■카카오 야나두, 1조 가치 상장 목표 클래스101, 스터디파이, 탈잉의 주된 이용자인 20~30대 ‘MZ세대(밀레니얼과 Z세대 총칭)’는 각 교육 플랫폼을 통해 주식과 부동산 등 재테크는 물론 실시간 전자상거래(라이브 e커머스) 등 디지털 전환 기술 등을 배우고 있다.   특히 클래스101은 어린이를 위한 ‘클래스101 키즈’까지 운영하면서 서비스 대상을 확대하고 있다. 클래스101 키즈는 최근 어린이 금융교육을 위한 수업까지 시작했다. 주식투자 전문가로 꼽히는 ‘미주부(김훈)’와 교육 전문가들이 ‘주식으로 이해하는 어린이 경제 클래스’를 기획한 것이다. 아이들 시선에 맞춰 주식을 중심 테마로 한 세상 경제 흐름을 알려주는 게 핵심이다.   카카오 에듀테크(교육+기술) 계열사 야나두는 지난해 초 카카오키즈와 통합한 뒤, 종합 교육 플랫폼으로 빠르게 전환하고 있다. 최근 기업공개(IPO) 절차에 들어간 야나두는 영어교육 뿐 아니라 동기부여 플랫폼 ‘유캔두’와 홈트레이닝 서비스 ‘야핏 사이클’도 서비스 중이다.   현재 누적 투자유치 규모가 400억 원을 넘어선 야나두는 원격으로 실시간 운동을 할 수 있는 홈트레이닝 서비스를 확대할 계획이다.   야나두 김정수 공동대표는 “홈트레이닝 중심 헬스케어 서비스 ‘야나두 피트니스’를 통한 사업확대에 집중하고 있다”며 “코로나19로 급성장하고 있는 비대면 산업인 e러닝과 홈트레이닝 분야를 아우르는 기업으로 성장해 1조원 기업가치로 내년에 상장하는 것이 목표”라고 전했다.  #원격교육 #야나두 #클래스101 #탈잉 #스터디파이   elikim@fnnews.com 김미희 기자   ▶ 헉! 소리나는 스!토리 뉴스 [헉스]▶ '아는 척'하고 싶은 당신을 위한 [두유노우]▶ 날로먹고 구워먹는 금융이슈 [파인애플]  ※ 저작권자 ⓒ 파이낸셜뉴스. 무단 전재-재배포 금지"
2021.02.28.,관뚜껑 덮기 전 '은전 한 닢' 행복을 알 수 있을까,https://n.news.naver.com/mnews/article/047/0002303860?sid=103,"행복감은 비축되지 않는다... 동전 한 닢 움켜 잡지말고 사용하고 베풀자【오마이뉴스의 모토는 '모든 시민은 기자다'입니다. 시민 개인의 일상을 소재로 한 '사는 이야기'도 뉴스로 싣고 있습니다. 당신의 살아가는 이야기가 오마이뉴스에 오면 뉴스가 됩니다. 당신의 이야기를 들려주세요.】[김태용 기자]              ▲  행복의 기준은 '언젠가'가 아니라 '지금'이 되어야 한다. 언제 녹을지 걱정하지 말자.            ⓒ 김태용   그동안 '행복'을 위해 달려왔다. 우리 모두 행복을 쟁취하기 위해 애면글면했을 것이다. 마흔이 돼서 그런 걸까. 요사이 부쩍 '행복은 무엇인가'라는 철학적 질문을 자신에게 한다. 아무리 생각해도 정답이 없다. '헛되고 헛되다'라는 지혜의 왕 솔로몬의 말처럼, 행복조차 헛된 건 아닐까.일본에는 이런 속담이 있다. ""사람의 행복과 불행은 관뚜껑을 덮기 전까지 모른다."" 결국, 죽어야 행복을 알 수 있나 보다. 인류 역사를 돌아보면, 수많은 철학자도 행복에 대해 명쾌한 답 하나 내놓지 못하고 조용히 관뚜껑을 덮으셨다. 행복은 갓 마흔이 된 나에게 추상적인 거대 담론이다.그간 내가 찾아 누렸던 행복을 정의하면, '은전 한 닢'이라 하겠다. 고(故) 피천득 선생 수필 속에서 늙은 거지는 벽돌 담 밑에 쪼그리고 앉아서 은전을 손바닥에 놓고 보고 또 본다. 그 은전은 거지가 여섯 달 동안 구걸하며 먹지도 않고 간신히 손에 쥔 것이다.피천득은 거지에게 묻는다. ""왜 그렇게까지 애를 써서 그 돈을 만들었단 말이오? 그 돈으로 무얼 하려오?"" 거지는 대답한다. ""(단지) 이 은전 한 개 갖고 싶었습니다."" 거지의 뺨에는 눈물이 흐른다.가끔 아내는 무언가 가지기 위해 바동거리는 내가 처량해 보이나 보다. 나에게 같은 질문을 던진다. ""왜 그토록 애를 써서 가지고 싶어 해?"" 아내에게 답한다. ""가지면 행복할 것 같아."" 한참 후, 원하던 것을 겨우 가진 나에게 아내는 묻는다. ""행복해?"" 선뜻 답하지 못한다. '은전 한 닢'을 손에 쥔 거지 모습이 나에게 보여서다.그토록 원하던 바를 이루고 나면, 행복은 잠시다. 잠시나마 만족할 뿐, 또다시 불만이 나온다. 어릴 땐 자동차가 있는 친구가 부러웠다. 겨우 저축해서 소형 중고차를 장만했다. 새 차가 눈에 들어왔다. 열심히 돈을 모았다. 공장에서 갓 나온 중형차를 받은 날 기뻤다. 그러나 곧 외제 차를 타고 다니는 사람이 행복해 보이는 이유는 뭘까.이런 나에게 정철 카피라이터는 이렇게 말해줬다. ""올림픽 은메달. 지구 위 70억 인구 중 무려 2등. 그런데 금메달 놓쳤다고 꾸중하는 기사를 봤어. 욕심은 한이 없지. 지금 내가 손에 쥔 것에 만족할 줄 알아야 비로소 행복에 가까워진다는 얘기. 행복의 반대말은 불만.""행복에 대한 정답은 아니지만, 세 가지 명확한 사실을 발견했다. 첫째, 행복은 언제나 현재진행형이다. 행복은 창고에 쌓아둔 비상식량처럼 비축할 수 없다. 행복의 기준은 '언젠가'가 아니라 '지금'이다.또 미래의 행복에 집착하면 염려가 생긴다. 내일이 불안한 사람치고 행복한 사람 보질 못했다. 그러나 우린 미래를 걱정하며 현재의 행복을 유예하는 데 익숙하다. 대입을 위해 학창 시절 재미를 미룬다. 취업을 위해 대학 생활 낭만을 유보한다. 요즘은 노후를 위해 젊은 시절 즐거움도 보류한다. 미국에서 운동을 배운 적이 있다. 가장 많이 들었던 말이 ""즐겨라(Enjoy)""다. 코치는 제대로 된 자세를 가르쳐주지 않았다. 신기한 건 즐기니까 실력이 늘었다. 실력이 느니 또 즐거웠다. 지금을 즐길 줄 아는 미국인들의 삶의 방식을 살짝 엿봤다.둘째, 행복은 '강도'보다 '빈도'가 중요하다. 어쩌다 떨어지는 벼락같은 짜릿한 행복보다는, 잔잔하게 뛰는 심장 박동 같은 행복이 훨씬 낫다. 게다가 행복감은 한계효용 체감의 법칙이 완벽하게 적용된다. 행복감이 일정 수준에 도달하면 더는 증폭되지 않는다. 오히려 감소한다.백영옥 작가는 <안녕, 나의 빨강머리 앤> 책에서 이렇게 말한다. ""우리는 행복이 '크기'가 아닌 '빈도'라는 명제를 끌어낼 수 있다. 큰 행복을 기다리느라 자잘한 행복을 놓쳐선 결코 안 되는 것이다"" 그렇다. '자잘한 행복'을 무시하면 안 된다.일본 작가 무라카미 하루키도 <랑게르한스 섬의 오후>에서 '소확행(소소하지만 확실한 행복)'을 언급했다. 서랍 안에 반듯하게 정리된 옷을 볼 때, 햇살 가득한 날 편하게 앉아 커피를 마실 때 느끼는 작은 즐거움이 바로 소확행이다. 요즘 나는 자잘하게 글을 쓰면서 '소확행'을 느낀다.행복은 이를 악물고 악착같이 이뤄야 하는 목표가 아니다. 행복은 하나의 도구다. 일상을 윤택하게 하는 수단이라고 생각하자. 소소한 일상이 모여 삶이 된다. 길에 있는 꽃을 보자. 친구들과 노닥거리자. 잠이 쏟아지면 자자. '해야 하는 것' 말고 '하고 싶은 것'을 생각해보자.마지막으로 행복은 '관계'에 의해 좌우된다. 물론 돈, 직업, 명예도 중요하다. 그러나 이것들은 바닷물과 같다. 마시면 마실수록 더욱 목이 마른다. 우리는 사회적 동물이다. 사람들과 관계를 맺고 서로 영향을 주며 살아간다. 태어날 때부터 부모와 관계를 맺는다. 살아가면서 친구, 동료, 배우자, 자녀 등 수많은 사람과 상호작용을 주고받으며 산다.사람들과 어울림 속에서 어떤 사람이 되어야 할까. 오스카 와일드 작가가 여기에 답을 줬다. ""어떤 이들은 가는 곳마다 행복이 되고, 어떤 이들은 떠날 때마다 행복이 된다"" 이왕 짧은 인생을 사는 거, 후자보다는 전자로 사는 게 낫지 않을까?워런 버핏은 54조 원 이상 기부했다. 신형 아반떼(기본 가격 1570만 원 기준)를 340만대나 기증한 셈이다. 그는 기부하는 이유를 ""행복해지기 위해서""라고 했다. 부자만 기부하는 것이 아니다. '대구의 키다리 아저씨'는 어렵게 살지만, 익명으로 기부했다. 기부의 이유는 워런 버핏과 같다.지난해 개인적으로 힘든 일을 겪었다. 내가 마음이 아프니, 주변에 힘들어하는 사람들이 보였다. 깜짝 놀랐다. 주변을 보면 겉은 멀쩡해도 마음 찢긴 사람들이 의외로 많았다. 그전에는 미처 몰랐다. 그들의 아픈 사연에 공감이 갔다.그때부터 큰 금액이 아니지만, 마음을 담아 기부를 하기 시작했다. 또 깜짝 놀랐다. 주변에 알리지 않고 기부를 하는 분들이 꽤 많았다. 기부하니 마음이 따뜻해졌다. 재산의 절반을 기부한 김범수 카카오 의장이 애송한다던 랠프 월도 에머슨 시가 마음에 와닿는다. ""당신이 살았음으로써 단 한 사람의 인생이라도 더 행복해지는 것. 이것이 진정한 성공이다.""지금 갓 마흔 된 친구들. 그리고 소싯적에 '주일학교' 다녔던 경험이 있다면 이 노래를 알 테다. '사랑은 참으로 버리는 것' 이라는 제목의 노래다. 초등학교 땐 멋모르고 불렀다. 지금에서야 알겠다. '은전 한 닢'으로 어떻게 행복해질 수 있는지.""사랑은 참으로 버리는 것. 이상하다 동전 한 닢. 움켜잡으면 없어지고. 쓰고 빌려주면 풍성해져. 땅 위에 가득 차네""저작권자(c) 오마이뉴스(시민기자), 무단 전재 및 재배포 금지▶오마이뉴스 '시리즈'에서 연재하세요!▶이재명 경기도지사 추천 《이재명과 기본소득》▶오마이뉴스 취재 후원하기"
2021.02.28.,"클럽하우스에 '용진이형' 떴다, 정용진 ""야구단 이름은…""",https://n.news.naver.com/mnews/article/025/0003081093?sid=101,"정용진 부회장. 사진 신세계그룹           프로야구 연습 경기 일정을 하루 앞둔 28일 신세계 야구단에 대한 관심이 커지고 있다. 정용진 신세계 부회장이 전날 음성채팅 소셜미디어(SNS)인 클럽하우스에 직접 등장해 관련 이야기를 풀어놓으면서다.       ━   구단명, 인천하면 떠오르는 이름으로 정해        정 부회장은 이날 야구단의 새 이름과 관련된 이야기는 물론 팀 컬러와 홈구장 운영 계획 등 다양한 이슈에 대해 직접 설명했다. 정 부회장의 이야기를 정리한 내용은 야구 커뮤니티 등에서 퍼져나가고 있다.        이에 따르면 신세계 야구단은 다음달 19일까지 유니폼과 엠블럼을 공개할 예정이다. 웨일스, 팬서스, 마린스, 부스터스 등의 명칭을 검토했지만 '인천하면 딱 떠오르는 게 있어 그걸로 정했다'고 정 부회장은 언급했다.        야구단의 색상으로는 이마트의 컬러인 노란색은 사용하지 않을 계획이다. 스타벅스와 노브랜드 버거를 문학구장에 입점시킬 계획도 밝혔다. 구단 인수 당시 이슈가 됐던 돔구장 건립 계획 역시 '청라에 테마파크를 건설하려 했지만, 현재 (돔구장 건립) 법령을 검토 중'이라고 밝히기도 했다.     ━   ""용진이형으로 불러달라""        NC다이노스를 적극적으로 벤치마킹하겠다고 했다. 야구팬들과 게임마니아들이 NC다이노스의 구단주인 김택진 대표를 '택진이형'이라고 부르는 것을 빗대 ""용진이형으로 불러도 좋다""고도 했다.      그러면서 야구단을 인수한 이유는 '우승하기 위해서'라고 공언했다. 카카오가 야구단에 관심이 많다는 이야기도 했다. 또 외국인 선수 월머 폰트, 아티 르위키의 활약에 대한 기대감을 드러내기도 했다.        이같은 소식에 신세계 관계자는 ""다양한 내용이 나와서 일일히 확인하긴 어렵지만 부회장님 본인이 직접 말씀하신 게 맞는 것으로 알고 있다""면서 ""인천을 상징하는 팀명으로 정하는 것도 맞는 방향이고 조만간 공개될 것""이라고 설명했다.        장주영 기자 jang.jooyoung@joongang.co.kr    ▶ 네이버 구독 첫 500만 중앙일보 받아보세요▶ 넌 뉴스를 찾아봐? 난 뉴스가 찾아와!▶ 당신이 궁금한 코로나ⓒ중앙일보(https://joongang.co.kr), 무단 전재 및 재배포 금지"
