기사날짜,기사제목,네이버 뉴스 url,기사내용
2021.02.23.,코스피 낙폭 일부 회복해 0.31% 하락…파월 美의회 발언 관망(종합),https://n.news.naver.com/mnews/article/001/0012220267?sid=101,"장초반 하락하는 코스피(서울=연합뉴스) 이지은 기자 = 23일 오전 서울 중구 하나은행 본점 딜링룸 전광판에 코스피가 표시돼 있다. 이날  코스피는 10.49포인트(0.34%) 내린 3,069.26에 출발했고, 코스닥은 2.06포인트(0.22%) 내린 952.23에 개장했다. 2021.2.23 jieunlee@yna.co.kr(서울=연합뉴스) 김태종 기자 = 23일 코스피가 미국 국채금리 상승에 하락 마감했다.    이날 코스피는 전날보다 9.66포인트(0.31%) 내린 3,070.09로 장을 마쳤다.    지수는 10.49포인트(0.34%) 내린 3,069.26에 출발해 하락폭을 확대하며 장중 한때 1.44% 하락한 3,035.46까지 밀렸다.     22일(현지시간) 미국 국채 10년물 금리가 1.4%까지 육박하고 뉴욕증시에서 나스닥이 2.46% 급락한 여파가 영향을 끼쳤다.     그러나 기관과 개인의 매수세에 힘입어 낙폭을 축소하며 상승으로 전환한 뒤 3,100선 회복을 시도했다. 이후 보합권에서 등락하다가 하락 마감했다.    기관이 3천4억원을 순매수하며 지수를 지지한 가운데 개인도 788억원어치 주식을 사들였다. 외국인이 3천779억원을 순매도했다.    서상영 키움증권 연구원은 ""한국 증시는 전일 나스닥의 급락으로 하락 출발한 가운데 중국 인민은행의 유동성 흡수가 없었다는 소식이 전해지면서 낙폭이 축소됐다""며 ""글로벌 주요 투자은행들이 반도체 부족 현상이 장기적으로 이어질 수 있다는 분석을 내놓자 관련 종목이 강세를 보인 점도 낙폭 축소 요인으로 작용했다""고 말했다.     이경민 대신증권 연구원은 ""제롬 파월 미 연방준비제도(연준) 의장의 반기 통화 정책 관련 의회 청문회를 앞두고 관망 심리가 유입되는 모습을 보였다""고 분석했다.     시가총액 상위 종목 가운데에는 SK하이닉스(1.47%)와 네이버[03542](1.03%), 현대차(1.24%) 등이 상승 마감했다.     삼성전자(-0.24%), LG화학(-3.38%), 삼성바이오로직스(-2.56%), 삼성SDI(-3.92%), 카카오(-0.71%) 등은 내렸다.     업종별로는 섬유·의복(4.54%)과 철강·금속(2.64%), 운송장비(0.60%), 유통업(0.55%), 은행(0.31%) 등이 올랐고, 의약품(-2.94%)과 기계(-1.89%), 전기·전자(-0.58%), 운수창고(-0.64%) 등은 내렸다.     유가증권시장 거래량은 22억1천170만주, 거래대금은 17조3천131억원이었다.     상승 종목은 300개, 하락 종목은 563개, 보합은 50개였다.     코스닥은 17.69포인트(1.85%) 내린 936.60에 장을 마쳤다.    지수는 2.06포인트(0.22%) 내린 952.23에 출발한 뒤 내림폭이 커졌다.    개인이 1천239억원을 순매수했고, 외국인과 기관이 490억원과 440억원을 각각 순매도했다.     시가총액 상위 주 가운데에는 씨젠(-15.01%)이 10% 이상 급락한 것을 비롯해 에이치엘비(-6.87%), 셀트리온헬스케어(-4.31%), 셀트리온제약(-3.97%) 등 대부분의 종목이 약세로 마감했다.     거래량은 33억5천204만주, 거래대금은 14조5천690억원이었다.     이날 서울 외환시장에서 원/달러 환율은 전날 종가보다 0.2원 오른 달러당 1,110.6원에 장을 마쳤다.    taejong75@yna.co.kr▶네이버에서도 뉴스는 연합뉴스[구독 클릭]▶[팩트체크]'금고이상'시 의사면허 박탈, 형평성 위배?▶제보하기<저작권자(c) 연합뉴스(https://www.yna.co.kr/), 무단 전재-재배포 금지>"
2021.02.23.,IT기업인 전면포진 등 달라진 대한상의…최태원 효과는,url없음,<네이버 기사 없음>
2021.02.23.,IT기업인 전면포진 등 달라진 대한상의…최태원 효과는,url없음,<네이버 기사 없음>
2021.02.23.,"코스피, 장초반 1%대 하락…美 국채 금리 급등 여파(종합)",https://n.news.naver.com/mnews/article/001/0012218678?sid=101,"코스피 하락 (GIF)[제작 남궁선. 게티이미지뱅크 제공](서울=연합뉴스) 김태종 기자 = 23일 코스피가 미국 국채 금리 급등 여파로 장 초반 큰 폭의 하락세를 보이고 있다.     이날 오전 9시 6분 현재 코스피는 전날보다 33.93포인트(1.10%) 떨어진 3,045.82를 나타냈다.     코스피는 10.49포인트(0.34%) 내린 3,069.26에 출발해 하락폭을 확대했다.     외국인이 1천132억원을 순매도하며 지수를 끌어내리고 있는 가운데 기관이 1천101억원을 순매수하고 있다. 개인은 73억원 순매수 중이다.    22일(현지시간) 뉴욕증시에서는 미국 국채금리 상승에 기술주가 타격을 받으면서 나스닥이 2% 이상 급락 마감했다.     다우존스30 산업평균지수는 전장보다 27.37포인트(0.09%) 올랐다.    그러나 스탠더드앤드푸어스(S&P) 500 지수는 전장보다 30.21포인트(0.77%) 하락했고, 기술주 중심의 나스닥 지수는 341.42포인트(2.46%) 급락 마감했다.    미 국채 10년물 금리는 이날 장중 한때 1.39% 부근까지 치솟으며 2년물 국채와 10년물 금리 차이는 약 4년 만에 최대로 확대됐다.     이에 테슬라가 8.6% 급락해 3일 연속 내림세를 탔고, 중국 드론제조업체 이항홀딩스도 11% 급락했다.    서상영 키움증권 연구원은 ""미국 증시가 비트코인 변동성 확대, 금리 상승, 재닛 옐런 재무장관의 세금 관련 발언 등으로 부진한 것은 우리 증시에도 투자심리 위축 요인으로 작용할 것으로 예상한다""며 ""특히 필라델피아 반도체 지수가 크게 하락한 점도 부담이 될 것""이라고 말했다.    시가총액 상위 종목 가운데에는 삼성전자(-0.85%)와 SK하이닉스(-1.47%), LG화학(-2.73%), 네이버(-1.16%), 현대차(-1.04%) 등 대부분의 종목이 약세다.     업종별로는 은행(1.15%)과 보험(0.13%) 등 금융업(0.16%)이 오르고 있는 반면, 철강·금속(0.98%), 기계(-1.79%), 전기·전자(-1.37%), 의약품(-1.34%), 운송장비(-0.97%) 등은 내리고 있다.    같은 시간 코스닥은 전날보다 13.61포인트(1.30%) 내린 940.68을 나타냈다.     지수는 2.06포인트(0.22%) 내린 952.23에 출발한 뒤 내림폭이 커졌다.     외국인과 기관이 각각 92억원과 39억원을 순매수하고 있고, 개인이 107억원 순매도하고 있다.     시가총액 상위주 가운데에는 펄어비스(2.22%)와 펄어비스(0.67%)가 소폭 오르고 있고, 셀트리온헬스케어(-1.51%)와 셀트레온제약(-1.07%), 카카오게임즈(-2.07%) 등은 하락하고 있다. 씨젠(-6.17%)은 큰 폭으로 내렸다.     taejong75@yna.co.kr▶네이버에서도 뉴스는 연합뉴스[구독 클릭]▶[팩트체크]'금고이상'시 의사면허 박탈, 형평성 위배?▶제보하기<저작권자(c) 연합뉴스(https://www.yna.co.kr/), 무단 전재-재배포 금지>"
2021.02.23.,"양주시 ""전세대 아우르는 '맞춤형 일자리' 창출에 총력""",https://n.news.naver.com/mnews/article/417/0000661057?sid=102,"양주시 고용복지센터 전경. / 사진제공=양주시양주시가 지속되는 경기불황으로 인한 고용불안 해소와 침체된 민생경제 조기회복을 위해 전 세대 시민을 아우르는 '맞춤형 일자리 창출'에 모든 행정역량을 집중한다고 23일 밝혔다.특히 안정적인 고용기반 조성과 일자리 관련 인프라 구축을 통해 지역 내 고용쇼크를 극복하는 등 위축된 지역경제에 활력을 불어넣을 수 있는 지역 내 양질의 일자리 확보에 나선다.통계청 자료에 따르면 지난해 상반기 양주시 고용률은 54%로, 전년 동기 57.4%보다 3.4% 하락했으며 취업자 수는 10만2800명으로 전년 동기 대비 3200명 감소한 것으로 나타났다.이에 양주시는 세대별 맞춤형 공공일자리 사업을 통해 일자리 창출을 확대하고 취업 취약계층 자립기반 마련, 청년 취·창업 능력개발 등 노동시장 경쟁력을 높일 수 있는 전략을 세웠다.또한 수요자 중심의 맞춤형 취업지원서비스 제공, 사회적경제기업 발굴·육성 등으로 질 높은 일자리 확충할 계획이다. 올해 주요 일자리 지원 정책은 ▲세대별 취업 취약계층 맞춤형 공공일자리 창출 ▲청년 취·창업 활동을 위한 통합서비스 제공 ▲감동양주 맞춤형 취업지원 서비스 제공 ▲사회적경제기업 발굴·육성 통한 일자리 확충 등 4개 분야이다. ━고용률 54%, 전년比 3.4% ↓…취업자 수 10만2800명, 전년比 3200명 ↓━양주시는 작년부터 이어진 고용감소세를 차단과 일자리 회복의 모멘텀 확보를 위해 취업 취약계층 대상 맞춤형 일자리사업을 추진한다고 밝혔다.주요 사업은 ▲공공근로사업 ▲지역공동체일자리사업 ▲지역방역일자리사업 ▲지역주도형 청년일자리사업 ▲신중년 경력형 일자리사업 등 직접 일자리사업이다. 공공근로사업은 상반기 참여자 75명을 선발, 데이터베이스 구축지원, 환경정화, 서비스지원 등 3개 분야에 배치했다. 지역공동체일자리 사업은 상‧하반기 27명씩 총 54명을 채용하며, 최종 선정된 27명의 상반기 근로자는 다음 달부터 현장에 투입한다. 하반기 근로자는 5월 중 모집할 예정이다.지역방역일자리사업은 시민안전을 위한 강화된 방역체계를 구축하기 위해 총 45명을 선발, 오는 6월말까지 운영할 계획으로 양주시청, 양주역 등 관내 공공기관 출입자 발열체크, 명부관리, 시설방역 등 생활방역 업무를 담당한다.신중년 도시농업 사업장 관리. / 사진제공=양주시시는 청년과 신중년, 노인 등 고용한파에 내몰린 취업 취약계층을 위한 일자리 사업도 마련했다고 밝혔다.우선 ‘2021년 도전! 양주 청년미래로 일자리사업’은 기업의 인건비 부담과 인력난 해소, 안정적인 청년고용을 위한 것으로 지역 내 우수 중소기업과 만 18세 이상 만 39세 이하 양주시 거주 미취업 청년을 일대일 매칭해 취업을 연계한다. 총 9억 5400만원을 투입하며 지난해 일자리를 지원받은 기존 참여청년 40명과 올해 모집할 신규 참여자 7명 등 총 47명의 청년을 지원한다.‘신중년 경력형 일자리 사업’은 경력이 단절된 신중년의 경력과 전문성을 활용해 지역사회에 필요한 서비스를 일자리로 제공, 신중년의 경제활동 재진입을 지원한다.대상은 만 50세 이상 만 70세 미만의 양주시에 주소를 둔 미취업자 중 해당 사업 관련 업무 분야 경력이 3년 이상이거나 사업별로 요구하는 자격을 갖춘 시민으로 총 5개 분야 19명이다.노인일자리·사회활동 지원사업은 어르신의 건강한 노후생활과 안정적인 소득보장을 위해 공익활동형, 사회서비스형, 시장형, 취업알선형 등 4개 분야 28개 사업에 작년보다 110명이 늘어난 총 1800명을 모집한다.양주시는 경기침체로 가장 큰 고용 타격을 입은 청년의 구직활동 활성화를 위해 양주시청년센터와 연계한 취·창업 역량개발 프로그램, 청년활동 지원, 대관·물품 공유 등을 기반으로 청년일자리 생태계 구축에 힘을 쏟는다고 밝혔다.지역경제 활력 제고와 예비·초기 청년창업가 발굴·육성을 위한 다양한 창업지원 프로그램으로 ▲창업사무실 운영 및 청년창업가 성장지원사업 ▲창업전문가 멘토링 ▲창업아카데미 ▲청년 창업경진대회 우수자 초기창업자금 지원, ▲4차산업혁명 시대 대비 특강 등을 추진한다. 또, 지역 청년들의 성공적인 취업역량 강화와 자신감 향상을 위해 ▲NCS 취업전략 특강 ▲서류·면접 컨설팅 ▲직장 적응 및 동기부여 프로그램 등 각종 취업 지원사업과 함께 면접용 정장을 대여하는 ▲청년옷장, 이력서 사진을 무료로 촬영해주는 ▲청춘사진관 등을 운영한다.NCS 대비 취업특강. / 사진제공=양주시시는 분야별 청년 소모임을 활용한 자체 역량개발을 위한 청년 성장지원 프로그램 ‘남다른 청춘클래스’와 청년의 흥미와 트랜드에 맞는 창작·문화 강좌인 ‘슬기로운 취미생활’, 심리진단과 적성검사를 통한 진로 설정을 돕는 ‘슬기로운 나 탐구생활’ 등 다양한 직업 가치관을 고려해 청년활동을 지원한다고 밝혔다.지역 청년들의 지속적인 참여 활동 거점 형성을 위해 1인 미디어실, 공동작업실, 세미나실, 프로그램실, 상담실, 오픈라운지 등 청년활동을 위한 공간을 무료로 대관하고 도서(청춘문고), 3D프린터, 컬러프린터, 생활공구 등 물품 공유 프로그램을 진행한다.비대면, 디지털 전환 등 채용방식의 변화에 대응해 구인·구직 수요자 중심의 맞춤형 일자리서비스를 제공할 계획이다. 양주시일자리센터는 지난해 언택트 일자리박람회, 맞춤형 취업지원프로그램, 현장 중심의 찾아가는 일자리서비스 등 맞춤형 일자리 알선을 통해 1169명의 취업에 성공했다. 올해는 공공일자리 사업 참여자, 실업급여 수급자 등을 대상으로 문자발송을 통한 사업 종료 전 일자리센터 이용을 안내하고 구직상담, 취업알선 서비스 등 차별화된 선도적 일자리정보를 제공한다. 비대면·디지털 채용방식에 따른 인공지능(AI)을 활용한 면접체험 프로그램과 실시간 화상면접 지원서비스 등 언택트 취업지원 서비스를 확대 운영한다.또, 시는 고용안정정보망(워크넷) 실시간 정보를 활용한 일자리 연계와 상담알선 강화, 취업자 사후관리 등 취업서비스의 질적 향상을 도모한다고 밝혔다.양주고용센터를 비롯해 8개 읍면동 행정복지센터에 직업상담사를 배치, 일자리서비스를 이용하려는 시민의 이용 편의성 접근성을 대폭 확대한다.신속·정확한 일자리소식 전달을 위해 매주 금요일 시 홈페이지와 카카오톡 공식 채널, 워크넷, 양주시 SNS주간뉴스 ‘와이제이 PICK’ 등을 활용, 온라인 홍보에 나선다. 양주고용센터 참여기관 간 원활한 연계를 통해 한 번의 방문으로 일자리와 복지상담 지원서비스를 제공, 시민 중심 원스톱 서비스를 지원한다.연 1회 채용박람회 개최, 월 1회 구인·구직 만남의 날 등을 통해 구인업체와 구직자 간 미스매치 해소에도 노력한다.특히, 관내 구인업체와 구직자의 수요를 고려해 중장년, 경력단절여성, 고령자 등을 대상으로 수요자 중심의 계층별 취업지원프로그램을 확대·운영하는 등 구직자의 취업역량을 강화하고 취업률 증대 기반을 마련한다.취업지원프로그램으로는 ▲소형지게차 면허취득과정 ▲일반경비원 양성과정 ▲회계사무원 양성과정 ▲전산사무원 양성과정 ▲취업특강 ▲찾아가는 청년 아카데미 등 6개 과정을 운영할 계획으로 대상은 총 183명이다. 이외에도 찾아가는 일자리 상담소, 찾아가는 일자리 발굴단, 동행면접·상설면접 지원 등 현장 중심의 구인·구직 서비스 제공에 집중한다.한편 올해 본격 시행하는 국민취업지원제도의 안정적인 정착과 원활한 서비스 시행을 위해 지난 1월 양주고용센터, 양주시일자리센터, 양주여성새로일하기센터 3자 간 업무협약을 체결하는 등 기관별 연계·협업체계를 구축한 바 있다.국민취업지원제도 업무협약식. / 사진제공=양주시시는 사회적경제의 저변 확대와 사회적기업에 대한 다각적인 지원을 통해 취약계층의 지속적인 일자리 창출을 도모하는 등 사회적경제 선순환 체계를 구축한다고 밝혔다.신규 고용인원 최저임금 수준의 인건비와 사업주 부담 사회보험료 일부를 연차별로 지원하는 일자리창출사업을 통해 자립기반이 취약한 사회적기업의 자생력을 강화한다.사회적기업의 지속 가능성과 대외경쟁력 향상을 위해 경력직 등 전문인력에 대한 인건비를 최대 월 250만원까지 보조하는 등 전문인력지원사업을 추진한다.인증 사회적기업 연 최대 1억원, 예비 사회적기업 연 최대 5000만원 등 기술·상품개발, 마케팅 등 사업개발비를 지원하는 등 안정적 수익구조를 마련한다.인증 사회적기업의 경우 최장 4년, 최대 50명 규모의 사회보험료 지원사업 또한 지속 추진할 계획이며 사회적기업 재정지원사업 공모를 통해 신규 사회적기업을 발굴·육성하고 마을기업 공모 지원사업 등을 연중 실시할 계획이다.이성호 양주시장은 “지난달 취업자 감소폭이 100만 명에 육박하고 실업자 수도 150만명을 넘어서는 등 위기에 빠진 고용 상황을 엄중하게 인식하고 일자리 창출을 최우선 중점 추진 과제로 삼고 있다”며 “촘촘하고 알찬 고용 지원대책을 추진해 고용안전망의 사각지대를 해소하고 시민 눈높이에 맞는 안정적인 일자리 구현에 박차를 가하겠다”고 밝혔다.양주=김동우 기자 bosun1997@mt.co.kr▶뜨거운 증시, 오늘의 특징주는?  ▶여론확인 '머니S설문' ▶머니S, 네이버 메인에서 보세요 <저작권자 ⓒ '성공을 꿈꾸는 사람들의 경제 뉴스' 머니S, 무단전재 및 재배포 금지>"
2021.02.23.,"이주열 ""금융위의 전금법 소비자 보호 주장, 근거도 관련도 없어""",https://n.news.naver.com/mnews/article/018/0004859669?sid=101,"이주열 한국은행 총재, 국회 기재위 업무보고중앙은행의 지급결제 업무는 시스템상의 생리..""밥그릇 문제 아냐""금융위의 소비자 보호 주장, 이미 한은법과 타법안에 모두 마련돼[이데일리 이윤화 기자] 이주열 한국은행 총재가 전자금융거래법(전금법) 개정안이 소비자 보호를 근거로 마련되었다는 금융위원회의 주장이 효용성이 없는 것 같다고 말했다. 이주열 한국은행 총재가 23일 국회에서 열린 기획재정위원회 업무보고에서 질의에 답변하고 있다. (사진=연합뉴스)이 총재는 23일 국회 기획재정위원회 전체회의에 참석해 박형수 국민의힘 국회의원(경북 영주·영양·봉화·울진)이 전금법의 발의 취지와 목적성에 대해 묻는 질문에 이같이 답했다. 박형수 의원은 이 총재에게 현재 발의된 전금법과 한은법의 충돌 여부와 빅테크 내부 소비자 금융 거래에 대한 정보를 금융결제원으로부터 일괄적으로 수집하고 관리하도록 하는 것에 대해 질문했다. 이에 대해 이 총재는 “한은법과 전금법이 충돌한다는 지적이 맞다. 현재 발의된 전금법은 지급결제에 대한 청산 업무는 중앙은행이 백업 할 수밖에 없는 것이 시스템적 생리”라면서 “금통위가 리스크 관리 기준을 정하고 지급 불이행이 생기면 유동성을 정하고 종합적으로 관리하고 있는데, 현재 전금법에 따르면 이런 권한을 금융위가 갖게 된다”고  말했다. 이어 이 총재는 네이버나 카카오 페이 등 빅테크 내부 거래에서 지급인과 수취인이 같은 거래의 경우 청산 개념이 성립되지 않음에도 이를 무리하게 전금법에 넣었다는 지적과 이것이 소비자 보호에 부합하지 않는다는 박 의원에 지적에 대해 동의했다. 그는 “금결원에 빅테크 내부의 소비자 거래 내역을 집중하도록 해 금융위가 이를 관리하는 것은 소비자 보호에 필수적이지 않고 관련이 없다”면서 “얼마든지 다른 수단으로 가능하고 현재 법안에도 빅테크 예치금을 외부에 위탁한다거나, 혹은 감독권을 규정하는 방식으로 이미 소비자 보호 장치가 갖춰져 있다”고 답했다. 이 총재는 한은의 ‘빅브라더’ 법안 비판에 대해 금융위가 통신사가 고객 정보를 가지고 있는 것도 빅브라더냐고 반문한 것에 대해서는 비교 대상이 적절하지 않다고 말했다. 그는 “통신사에 통신 기록이 남는 것도 빅브라더 법안이냐고 금융위가 반문했지만 이는 비교 자체가 적절치 않은 것”이라면서 “개별 통신사의 고객 정보 관리 내역을 한 곳에 모아 놓고 이를 언제든지 들여다 볼 수 있도록 한 것, 이 지점을 지적한 것이기 때문이고 이는 한은 자체 주장이 아니라 여러 로펌이나 로스쿨 등 법률 자문가의 의견을 받은 것”이라고 강조했다.  한편, 한은이 관리해왔던 금융결제원의 지급결제 기능을 금융위원회가 가져가는 내용의 전자금융거래법 개정안이 국회 정무위원회에 제출되면서 양 기관이 첨예하게 대립하고 있다. 개정안에는 빅테크 업체가 내부 거래를 금융결제원에 의무적으로 맡겨 상계 처리, 내부 청산하도록 하면서 금결원을 금융위가 관리·감독하는 방안이 담겨 있다.이윤화 (akfdl34@edaily.co.kr)▶ #24시간 빠른 #미리보는 뉴스 #eNews+▶ 네이버에서 '이데일리 뉴스'를 만나보세요▶ 빡침해소, 청춘뉘우스 '스냅타임'＜ⓒ종합 경제정보 미디어 이데일리 - 무단전재 & 재배포 금지＞"
2021.02.23.,"캐시워크, 하루 걸음 수 ‘SNS 인증샷’ 기능 도입",https://n.news.naver.com/mnews/article/018/0004859994?sid=105,"캐시워크 제공[이데일리 노재웅 기자] 건강 관리 앱 캐시워크는 하루 걸음 수를 손쉽게 기록하고 인증할 수 있는 ‘하루 걸음 수 SNS 인증샷’ 기능을 새롭게 선보인다고 23일 밝혔다.이번에 새로 도입한 하루 걸음 수 SNS 인증샷 기능을 통해 이용자들은 본인의 운동 기록을 카카오톡, 인스타그램, 페이스북 등 주요 SNS에 캐시워크 앱 내에서 바로 공유할 수 있다.이용 방법은 우선 캐시워크 앱에서 우측 상단에 나타나는 카메라 모양의 이모티콘을 선택하면 당일의 걸음 수뿐만 아니라 소모된 칼로리, 시간, 거리 등 요약된 정보가 기본 배경 위에 배치된다.이용자들은 걷던 장소에서 즉석으로 촬영한 사진 혹은 휴대폰에 저장된 사진으로 배경을 교체해 걷기 기록을 SNS으로 공유할 수 있다.마음에 드는 사진과 함께 매일의 걷기를 기록해 본인의 운동 일기처럼 활용할 수 있고, 기억에 남기고 싶은 일상을 아카이브 형식으로 모아둘 수도 있는 점이 특징이다.캐시워크 관계자는 “새롭게 선보인 하루 걸음 수 SNS 인증샷 기능을 통해 캐시워크와 함께 걷는 일상과 운동의 뿌듯함을 더 많은 사람과 공유할 수 있게 됐다”며 “캐시워크가 매일 걷는 이용자들에게 걸음을 매개체로 서로를 응원하고 동기를 부여하는, 이른바 촉진 네트워크처럼 활용될 수 있기를 바란다”고 말했다.지난 2017년 출시한 캐시워크는 누구나 할 수 있는 기본 운동인 걷기를 통해 이용자들이 일상 속 건강한 생활 습관을 형성하는 데 도움을 주기 위해 개발된 서비스다.만보기를 휴대폰 잠금화면에 최초로 도입해 사용자들의 편의성을 증대시켰으며, 동기 부여를 위한 방안으로 걸음 수에 따른 캐시를 제공한다.노재웅 (ripbird@edaily.co.kr)▶ #24시간 빠른 #미리보는 뉴스 #eNews+▶ 네이버에서 '이데일리 뉴스'를 만나보세요▶ 빡침해소, 청춘뉘우스 '스냅타임'＜ⓒ종합 경제정보 미디어 이데일리 - 무단전재 & 재배포 금지＞"
2021.02.23.,"'극장 스크린으로 즐기는 여행'…CGV, Live 랜선 투어 프로그램 진행",https://n.news.naver.com/mnews/article/311/0001267478?sid=106,<구조 다름>
