기사날짜,기사제목,네이버 뉴스 url,기사내용
2021.02.03.,[코스피 마감]사흘 연속 상승…3130선 턱밑,https://n.news.naver.com/mnews/article/018/0004845046?sid=101,"개인·외국인 쌍끌이 매수에 강세대부분 업종 상승 마감…운송장비 4% ↑현대차 그룹주 상승…기아차 9% 강세[이데일리 김소연 기자] 코스피 지수가 개인과 외국인의 순매수에 힘입어 3거래일 연속 상승 마감했다. 이날 코스피는 1% 이상 상승하면서 3130선 턱밑까지 올랐다. 3일 마켓포인트에 따르면 코스피는 전 거래일 대비 32.87포인트(1.06%) 오른 3129.68로 장을 마감했다. 이날 코스피는 3108.42로 전 거래일(3096.81)보다 0.37% 상승 출발했다. 장 초반 ‘팔자’에 나섰던 외국인이 이내 순매수로 전환하면서 코스피 지수는 상승폭을 확대했다. 외국인 매수세 유입에 힘입어 코스피는 오후 들어 상승 폭을 키웠다.이날 유가증권시장에서 개인과 외국인이 동반 사자에 나섰다. 개인은 1321억원어치, 외국인은 4276억원어치 사들였다. 외국인은 장 초반 매도 우위를 보였으나 이내 ‘사자’세로 돌아서 지수 상승을 견인했다. 미국 바이든 대통령의 코로나19 부양책에 외국인 수급이 유입되고, 경기 정상화 기대감 커져 투자심리 완화한 영향으로 해석된다. 전날 게임스톱(게임스탑·GME) 등 일부 종목의 과열 우려가 줄어든 점도 긍정적으로 작용했다. 기관만 나홀로 억5823원어치를 팔아치웠다. 기관은 금융투자(-2179억원), 연기금등(-3576억원), 보험(-435억원) 등이 매도 우위였다. 프로그램 매매는 차익과 비차익을 합쳐 1056억원 매도 우위다.대부분 업종이 오름세에 거래를 마쳤다. 운송장비가 4%대 상승으로 마감했고, 건설업이 3%대 오름세를 보였다. 이어 운수창고, 기계, 서비스업, 유통업, 화학, 의료정밀 등이 1%대 이상 상승으로 장을 마감했다. 제조업, 증권, 은행, 전기·전자 역시 강보합권에 마감했다. 이에 반해 의약품, 보험, 종이·목재 등 업종은 약보합세로 거래를 마쳤다.시가총액 상위 종목은 대부분 상승했다. 현대차 관련 그룹주가 일제히 상승했다. 애플카 협력설과 더불어 국내외 자동차 판매량이 증가했다는 점이 주가에 긍정적으로 작용했다. 기아차(000270)가 9.65% 오른 9만7700원에 거래를 마쳤다. 현대모비스(012330)도 3.89%, 현대차는 2.08% 올랐다.LG전자(066570)(4.43%), 카카오(035720)(3.70%, LG화학(051910)(3.52%), 삼성물산(028260)(3.41%)은 3%대 이상 상승 마감했다. NAVER(035420)와 삼성SDI(006400), 삼성전자(005930)도 오름세로 거래를 마쳤다. 이에 반해 셀트리온(068270)은 전 거래일 대비  2.25% 내린 34만7500원에 거래를 마감했다. 그외 SK이노베이션(096770), 삼성바이오로직스(207940)도 약보합권에 머물렀다.이날 코스피 시장 거래량은 8억7745만4000주, 거래대금은 21조6306억원을 기록했다. 상한가 종목 없이 563개 종목이 올랐고, 하한가 없이 268개 종목이 내렸다. 80개 종목은 보합권에서 장을 마쳤다.김소연 (sykim@edaily.co.kr)▶ #24시간 빠른 #미리보는 뉴스 #eNews+▶ 네이버에서 '이데일리 뉴스'를 만나보세요▶ 빡침해소, 청춘뉘우스 '스냅타임'＜ⓒ종합 경제정보 미디어 이데일리 - 무단전재 & 재배포 금지＞"
2021.02.03.,"코스피, 3일 연속 상승…외국인 매수에 1% 강세(종합)",https://n.news.naver.com/mnews/article/003/0010328359?sid=101,"현대차그룹주 상승…기아차 9.6%↑[서울=뉴시스] 류병화 기자 = 코스피가 외국인과 개인의 매수세에 힘입어 1% 상승 마감했다. 지수는 3130선을 눈앞에 두고 거래를 마쳤다.3일 한국거래소에 따르면 코스피지수는 전 거래일 대비 32.87포인트(1.06%) 오른 3129.68에 마감했다. 지수는 전일 대비 0.37% 오른 3108.42에 출발해 장 초반 혼조세를 보이다 오후께 상승폭을 늘리며 거래를 마쳤다. 지수는 이달 들어 3거래일 연속 상승해 3130선을 목전에 뒀다.유가증권시장에서는 외국인과 개인이 각각 4277억원, 1322억원어치를 사들이며 지수 상승을 이끌었다. 기관은 홀로 5823억원을 순매도했다.업종별로는 운수장비(4.15%), 비금속광물(3.19%), 건설업(3.11%), 운수창고(2.36%), 기계(2.17%), 서비스업(1.78%), 유통업(1.63%) 등이 크게 올랐다.시가총액 상위 종목들은 대부분 올랐다. 대장주 삼성전자는 전 거래일 대비 200원(0.24%) 오른 8만4600원에 거래를 마쳤다. LG화학(3.52%), 네이버(2.21%), 삼성SDI(0.80%), 카카오(3.70%) 등이 상승했다. 삼성바이오로직스(-0.12%), 셀트리온(-2.25%) 등은 내렸고 SK하이닉스는 보합 마감했다.특히 현대차그룹 종목들이 애플카 기대감에 힘입어 강세를 보였다. 기아차는 전일 대비 9.65% 오른 9만7700원에 거래를 마쳤다. 기아차는 장중 10만2000원까지 오른 뒤 상승폭을 일부 내주며 마감했다. 현대차(2.08%), 현대모비스(3.89%) 등도 강세로 마감했다.서상영 키움증권 연구원은 ""국내 증시는 미국 경제 정상화 기대감과 함께 현대차 그룹과 애플카 관련 해외 증권사의 보고서로 인해 관련 기업들이 급등하자 상승세를 보였다""며 ""특히 재닛 옐런 미국 재무장관이 주식시장 변동성을 논의하기로 했다는 소식과 중국 증시의 변화 등 아시아 주변국의 변화가 주요 변수로 작용했다""고 설명했다.간밤 뉴욕증시는 게임스톱 사태 진정 등 여파로 상승 마감했다. 뉴욕주식거래소(NYSE)에서 다우존스 30 산업평균지수는 전장 대비 475.57포인트(1.39%) 오른 3만687.48에 장을 마감했다.스탠더드앤드푸어스(S&P) 500 지수는 전장 대비 52.45포인트(1.39%) 오른 3826.31에, 기술주 중심 나스닥지수는 209.38포인트(1.56%) 상승한 1만3612.78에 장을 마무리했다.코스닥지수는 전 거래일 대비 0.71% 오른 970.69에 거래를 마쳤다. 지수는 0.23% 오른 965.99에 출발해 장중 혼조세를 보였으나 마감 전 상승하며 거래를 마쳤다.코스닥시장에서는 개인이 홀로 1507억원어치를 사들였다. 반면 기관과 외국인은 각각 958억원, 106억원을 순매도했다.코스닥 시총 상위 10개 종목은 엇갈렸다. 셀트리온헬스케어(-0.93%), 셀트리온제약(-1.49%), 펄어비스(-0.30%), 알테오젠(-1.32%) 등이 하락했다. 에이치엘비(0.63%), 씨젠(1.91%), 에코프로비엠(1.72%), CJ ENM(0.87%), SK머티리얼즈(1.72%) 등은 올랐다．☞공감언론 뉴시스 hwahwa@newsis.com▶ 네이버에서 뉴시스 구독하기▶ K-Artprice, 유명 미술작품 가격 공개▶ 뉴시스 빅데이터 MSI 주가시세표 바로가기<ⓒ 공감언론 뉴시스통신사. 무단전재-재배포 금지>"
2021.02.03.,"외국인·기관, '삼성전자'에 3800억 원 팔았다",https://n.news.naver.com/mnews/article/629/0000066223?sid=101,"코스피시장에서 개인과 외국인은 각각 1323억 원, 4258억 원을 사들이고 기관 홀로 5823억 원을 팔아치웠다. /더팩트 DB[TF매매동향] 외국인 1109억 원·기관 2739억 원 매도[더팩트ㅣ박경현 기자] 3일 코스피는 개인과 외국인의 매수에 1%가량 오르며 마감했다. 코스닥은 개인 매수에 상승하며 마감했다.코스피시장에서 개인과 외국인은 각각 1323억 원, 4258억 원을 사들이고 기관 홀로 5823억 원을 팔아치웠다. 코스닥에서는 외국인과 기관은 각각 101억 원, 961억 원을 순매도 했고, 개인 홀로 1509억 원을 순매수했다.외국인투자자의 코스피시장 최대매수는 LG화학으로 향했다. 외인은 LG화학 3014억 원에 이어 기아 1437억 원, 카카오 638억 원, 엔씨소프트 625억 원, 네이버(NAVER) 472억 원을 사들였다.반면 삼성전자는 1109억 원을 팔았다. 이어 셀트리온 740억 원, 삼성전자우 502억 원, LG전자 471억 원, 현대글로비스 192억 원 순으로 순매도했다.코스닥시장에서는 엘앤에프(410억 원), 엠씨넥스(152억 원), 씨젠(108억 원)을 사고 셀트리온헬스케어(140억 원), 녹십자랩셀(123억 원), 제넥신(100억 원)은 팔았다.외국인투자자의 코스피시장 최대매수는 LG화학으로 향했다. 외인은 LG화학 3014억 원에 이어 기아 1437억 원, 카카오 638억 원, 엔씨소프트 625억 원, 네이버(NAVER) 472억 원을 사들였다. /한국거래소 제공기관투자자는 만도에 296억 원을 사들였다. 또한 현대글로비스 281억 원, 현대모비스 207억 원, CJ대한통운 191억 원, SK케미칼 174억 원 순으로 매수했다.반면 삼성전자 2739억 원을 팔아치웠다. 또한 한올바이오파마 581억 원, 셀트리온 321억 원, 기아 318억 원, SK텔레콤 282억 원을 순매도했다.시가총액 상위 10개 종목은 엇갈린 방향을 가리켰다. 삼성전자(+0.24%), LG화학(+3.52%), 네이버(+2.21%), 현대차(+2.08%), 삼성SDI(+0.80%), 카카오(+3.70%)가 상승했다. 반면 삼성전자우(-0.40%), 삼성바이오로직스(-0.12%), 셀트리온(-2.25%)은 하락했다. SK하이닉스는 보합으로 거래를 마쳤다.pkh@tf.co.kr - BTS 공연 비하인드 사진 얻는 방법? [팬버십 가입하기▶]   - 내 아이돌 순위는 내가 정한다! [팬앤스타 투표하기] 저작권자 ⓒ 특종에 강한 더팩트 & tf.co.kr 무단 전재 및 재배포 금지"
2021.02.03.,"삼성물산 패션부문, '밸런타인데이' 선물 제안",url없음,<네이버 기사 없음>
2021.02.03.,"삼성물산 패션부문, '밸런타인데이' 선물 제안",url없음,<네이버 기사 없음>
2021.02.03.,"지어소프트, '가성비' 오아시스 꾸준한 성장세-하나",https://n.news.naver.com/mnews/article/008/0004538109?sid=101,"[머니투데이 김태현 기자] 하나금융투자는 지어소프트에 대해 자회사 오아시스의 꾸준한 성장세가 돋보인다고 설명했다. 투자의견은 '매수', 목표주가는 2만1900원을 유지했다.정민구 하나금융투자 연구원은 ""새벽배송 시장의 경쟁심화가 불가피하지만, 오아시스는 가격경쟁력을 통한 충성고객군 확보로 점유율을 지켜나가고 있다""고 설명했다.지난해 지어소프트의 4분기 매출액은 713억원으로 전년동기 대비 77.1%, 영업이익은 29억원으로 흑자전환할 것으로 기대된다. 자회사 오아시스의 매출액은 657억원으로 86.3% 성장, 영업이익 30억원으로 흑자전환을 달성할 전망이다.12월말 기준 오아시스마켓은 누적 회원 수 60만명, 일평균 매출액은 5억5000만원을 달성했다. 오아시스의 성장세가 지어소프트의 외형성장을 이끌고 있다.오아시스는 최근 카카오인베스트먼트, 한국투자파트너스 등으로부터 투자를 유치했다. 2021년에도 공격적인 오프라인 매장 증설, 신규 물류센터 확장, 새벽배송 일 수 증가 등을 통해 가파른 외형성장을 이어나갈 것으로 기대된다.올해 지어소프트의 매출액은 3851억원, 영업이익은 169억원으로 기대된다.정 연구원은 ""올해 오아시스의 신규 오프라인 매장 확장, 신규 제3 물류센터 증설, 새벽배송 일 수 증가를 통해 이룰 것""이라며 ""오아시스는 신규 오프라인 매장 확보 및 제3 물류센터 증설을 통해 수도권 내 지역 확장을 목표로 하고 있다""고 설명했다.김태현 기자 thkim124@mt.co.kr▶부동산 투자는 [부릿지]▶조 변호사의 가정상담소▶줄리아 투자노트 <저작권자 ⓒ '돈이 보이는 리얼타임 뉴스' 머니투데이, 무단전재 및 재배포 금지>"
2021.02.03.,업비트의 두나무도 '유니콘'... 미래 금융 투자로 기업가치 1조 인정,url없음,<네이버 기사 없음>
2021.02.03.,"""패딩에 흉기 숨길까 봐"" 배달원 겉옷 벗기고 화물 승강기 타게 한 '갑질 아파트'",https://n.news.naver.com/mnews/article/277/0004840760?sid=102,"배달노동자·일부 고급 아파트 입주민 간 갈등 격화오토바이 탑승 금지·헬멧 착용 금지 등 갑질 사례 다양배달업체 측, 일부 아파트 배달료 인상하기도배달노조 ""라이더 범죄자 취급하는 현대판 신분제도""지난해 9월2일 오후 서울 종로구 광화문역 인근에서 배달 라이더가 오토바이를 세운 뒤 잠시 목을 축이고 있다. / 사진=연합뉴스[아시아경제 임주형 기자] 배달원들과 고급 아파트 입주민 간 갈등이 커지고 있다. 일부 배달원의 경우 패딩 안에 흉기를 숨기고 있을 수 있다는 이유로 옷을 벗은 상황도 있었다. 또 다른 배달원은 짐을 싣는 화물용 엘리베이터를 이용할 수 밖에 없었다. 이런 상황에서 한 배달 업체는 갑질 논란이 불거진 아파트에 대해 배달료를 인상해 이른바 '고급 아파트 배달원 갑질' 논란은 일파만파 확산하고 있다.배달노동자 노동조합인 '라이더유니온'은 1일 낸 입장문에서 ""지난달부터 사진과 동영상, 배달원이 모인 오픈 카카오톡 대화방 등을 통해 (갑질) 제보를 받았다""며 ""그 결과 서울·부산·인천·광주 등에서 갑질이 가장 심한 총 103곳 아파트 명단을 추렸다""고 밝혔다.배달원들의 제보에 따르면, 이같은 갑질은 주로 고급 주상복합 아파트 주민들에게서 나왔다. 갑질 사례 또한 아파트 단지 내 오토바이 이용 금지, 헬멧 등 착용 금지, 화물용 엘리베이터 이용 강제 등 다양한 것으로 나타났다.한 배달원은 넓은 단지 내에서 오토바이 출입이 금지돼, 먼 거리를 걸어 배달할 수밖에 없었다고 밝혔다. 그는 ""오토바이 출입을 못하게 해서 보통의 배달지보다 배 이상 시간이 소요됐다""며 ""굉장한 수치심과 모멸감을 느꼈다""고 토로했다.아파트 출입 시 겉옷, 우비 등을 벗게 한 사례도 있었다. 이에 대해 일부 배달원들이 ""왜 그래야 하느냐""며 항의하자, 입주민 측에서는 ""패딩 안에 흉기를 숨길 수 있다""는 답변이 돌아온 경우도 있었다.화물승강기를 이용하게 하거나 오토바이 지상 진입을 막은 아파트들. / 사진=라이더유니온이 외에도 위압감을 준다는 이유로 헬멧 착용을 금지하는 아파트가 있는가 하면, 승객용이 아닌 화물용 엘리베이터를 이용해 출입하게 했다는 제보도 있었다.상황이 이렇다 보니 일부 배달원들은 갑질이 심한 아파트에 대해 배달료를 인상하기도 했다. 앞서 지난달 23일 사회관계망서비스(SNS), 온라인 커뮤니티 등에는 한 배달대행업체가 서울 성동구 한 아파트 단지에 보낸 배달료 인상 공지문이 공개돼 논란을 빚었다.공지문에서 해당 배달대행업체는 ""배송료 2000원을 추가할 예정""이라며 ""해당 아파트 경비업체가 단지 내로 배달 오토바이가 들어오는 것을 막고, 배달 기사에게 신분증 요구와 화물 엘리베이터를 이용하게 해 기사들이 배송을 꺼리기 때문""이라고 설명했다.지난달 한 배달대행업체는 일부 갑질 아파트에 대해 배달료를 인상하겠다는 공지문을 보내 논란이 빚어지기도 했다. / 사진=온라인 커뮤니티 캡처이같은 업체 측 결정을 두고 일부 누리꾼들은 ""갑질하는 아파트에는 아예 배달을 금지해야 한다"", ""더 인상하라""며 옹호하고 나선 반면, 일각에서는 ""특정 고객만 차별 대우를 해선 안 된다""며 반박이 나오기도 했다.한편, 배달원 노조는 갑질아파트 문제에 대한 개선 및 정책권고를 촉구하고 나섰다.'전국민주노동조합총연맹 서비스연맹 서비스일반노동조합 배달서비스지부'(배달노조)는 2일 국가인권위원회 앞에서 기자회견을 열고, 일부 갑질 아파트 문제 해결을 촉구했다.배달노조는 이날 ""배달라이더를 잠재적 범죄자로 취급하고 하찮은 노동으로 취급하는 사회적 편견은 인권침해는 고급아파트와 고급 빌딩에서 더 빈번하게 발생한다""며 ""높이 솟은 아파트와 빌딩이 만들어낸 현대판 신분제도""라고 비판했다.그러면서 ""라이더 인권을 무시하는 요구를 하지 않고 도보 배달을 요구한다면, 그에 상응하는 대가를 지불해야 한다""며 ""배달라이더의 인권을 보장하고, 라이더를 무시하는 갑질을 중단해야 한다""고 강조했다.임주형 기자 skepped@asiae.co.kr▶ 2021년 신축년(辛丑年) 신년운세와 토정비결은?▶ 발 빠른 최신 뉴스, 네이버 메인에서 바로 보기▶ 100% 무료취업교육 핀테크/AI 훈련정보(클릭)<ⓒ경제를 보는 눈, 세계를 보는 창 아시아경제 무단전재 배포금지>"
2021.02.03.,중국산 ‘식염수 백신’ 해외까지 팔려나갔다,https://n.news.naver.com/mnews/article/081/0003160988?sid=104,"中, 3000여회분 가짜 시노팜 백신 적발일부 일본 부유층 등에게 접종 가능성중국에서 가짜 코로나19 백신을 만들어 유통하던 일당이 대거 붙잡혔다. 이들은 위조 제품 일부를 해외에 팔기도 했다. 지난해 말 일본의 부유한 기업가들이 중국산 백신을 몰래 들여와 접종한 사실이 알려지자 중국 정부는 “백신 밀매는 없다”며 부인했는데, 일본인들이 ‘짝퉁 백신’을 맞았을 가능성이 제기된다.신화통신은 2일 “중국 당국이 백신 관련 범죄를 단속한 결과 80여명을 체포하고 3000여회 분량의 가짜 감염병 백신을 압수했다”고 보도했다. 베이징과 장쑤, 산둥 경찰이 합동 작전을 펼쳐 제조 공장을 찾아내 철거했다.홍콩 명보는 소식통의 말을 인용해 “압수된 백신이 중국 국유회사인 중국의약그룹(시노팜)의 코로나19 백신 ‘아이커웨이’ 위조품”이라고 전했다. 가짜 백신은 100% 생리식염수로 채워졌다고 덧붙였다. 환구시보는 “식염수를 접종받으면 백신으로서 아무런 효과가 없지만, 그렇다고 건강상 문제도 일어나지 않는다”고 소개했다.체포된 일당은 지난해 9월부터 가짜 백신을 제조했다. 중국 정부가 코로나19 백신 사용을 긴급 승인해 접종 열풍이 한창일 때다. 이들은 웨이신(중국판 카카오톡)을 통해 이를 비싼 가격으로 판매해 왔다. 중국 관영 통신사가 국가 이미지에 먹칠을 하는 뉴스를 대서특필한 것 자체가 당국이 이 사건을 얼마나 심각하게 보는지 알 수 있게 해 준다.용의자들은 위조 백신 가운데 일부를 아프리카 등 다른 나라로 빼돌렸다. 지난달 초 일본 마이니치신문은 “일본 주요 기업의 최고 경영자들과 그 가족들이 밀수한 중국산 코로나 백신을 맞고 있다”고 보도했다. 이에 주일중국대사관은 “검증되지 않은 이야기다. 오해의 소지가 있다”며 항의했다. 중국에서 코로나19 백신을 생산하면 고유의 식별코드를 부착해 유통과정이 투명하게 관리된다는 이유다. 중국의 주장이 맞다면 당시 일본 부자들이 맞은 건 이번에 검거된 일당 같은 위조업자가 만든 ‘식염수 백신’일 가능성이 크다.베이징 류지영 특파원 superryu@seoul.co.kr▶ 네이버에서 서울신문 구독하기 클릭! ▶ 세상에 이런 일이 ▶ [연예계 뒷얘기] 클릭!ⓒ 서울신문(www.seoul.co.kr), 무단전재 및 재배포금지"
2021.02.03.,"울산지역 주택과 공장, 울산색으로 입힌다",https://n.news.naver.com/mnews/article/014/0004578097?sid=102,"'2021년 색채디자인 컨설팅 지원 사업' 추진올해부터 모든 단독주택에 확대 시행 울산 10색 【파이낸셜뉴스 울산=최수상 기자】 울산시는 단독·공동주택 및 공장을 대상으로 재도색시 울산시 색채 가이드라인을 적용한 색채 시공 도안 및 적용 시뮬레이션을 지원하는 2021년 색채디자인 컨설팅 지원 사업을 추진한다.   3일 울산시에 따르면 지원은 올해부터 모든 단독주택에 확대 시행하며 공동주택(300세대 미만)과 공장(기업체)은 도장 시공업체 선정이 완료된 대상에 한해 지원한다.   신청 방법은 전화 또는 카카오채널에서(채널명 : 울산 색채디자인컨설팅) 채팅으로 접수하고 신청순으로 지원한다.   지원 대상이 되면 디자인 담당 공무원이 현장을 방문해 요구사항을 수렴하고 주변 환경, 브랜드 분석 등을 통해 색채디자인을 연구·개발해 시공토록 설계 도안을 제안한다.   자세한 사항은 시 누리집 고시공고란을 참고하거나 카카오채널 및 울산시 도시재생과로 문의하면 된다.   시 관계자는 ""이 사업은 건축물의 외관 색채가 도시경관의 시각 점유율에 큰 부분을 차지하나 건축물 특성 및 주변 경관과 어울리지 않는 단순 도장에 그치고 있는 실정을 감안했다""며 ""2005년부터 도시색채 가이드라인을 적용한 울산색 활용 유도를 위해 시행하고 있다""고 말했다.  ulsan@fnnews.com 최수상 기자   ▶ 헉! 소리나는 스!토리 뉴스 [헉스]▶ '아는 척'하고 싶은 당신을 위한 [두유노우]▶ 날로먹고 구워먹는 금융이슈 [파인애플]  ※ 저작권자 ⓒ 파이낸셜뉴스. 무단 전재-재배포 금지"
2021.02.03.,"박하선, 샤론 스톤도 울고 갈 섹시한 각선미",https://n.news.naver.com/mnews/article/009/0004744039?sid=106,<구조 다름>
2021.02.03.,"진에어, 업계 최초 '스마일페이' 간편결제 서비스 제공",url없음,<네이버 기사 없음>
2021.02.03.,"넷마블, 전세계 모바일 퍼블리셔 수익 8위...국내 1위는 엔씨",https://n.news.naver.com/mnews/article/236/0000210205?sid=105,"'넷마블' '엔씨소프트' '넥슨' '게임빌·컴투스' '더블유게임즈' 등 국내 기업이 지난해 전 세계에서 가장 많은 앱 수익을 기록한 모바일 게임 퍼블리셔 명단에 이름을 올렸다.앱애니가 '2021년 레벨업 상위 퍼블리셔 어워드'로 작년 구글 플레이와 iOS 합산 전 세계에서 가장 높은 앱스토어 수익을 이끈 52개의 모바일 앱 퍼블리셔를 공개했다.자료에 따르면 소위 3N으로 꼽히는 '넷마블'이 8위를 기록했으며 '엔씨소프트'가 18위, '넥슨'은 32위를 차지했다. 이어 '게임빌·컴투스'가 49위, '더블유게임즈'가 52위에 올랐다. '엔씨소프트'는 작년 대비 2계단 상승했으며 '더블유게임즈'는 2년 만에 차트에 재진입했다. 이 외에 매년 게임빌 라인업에는 컴투스 게임까지 모두 포함돼 이에 힘입어 상위 차트에 안착했다.  이번 상위 퍼블리셔 차트에는 아시아 태평양 지역에 본사를 둔 퍼블리셔가 31곳으로, 상위 52개 퍼블리셔 중 절반 이상을 차지했다. 국가별로는 미국이 16곳으로 가장 많은 상위 퍼블리셔를 배출했고, 그다음은 중국이 15곳으로 뒤따랐다.중국의 '텐센트'는 5년 연속 1위, '넷이즈'는 4년 연속 2위를 차지했으며, '틱톡'의 모회사 '바이트댄스'는 24위를 차지했다.국내 지역만 놓고 보면, 수익 기준으로 '엔씨소프트' '넷마블' '카카오' '웹젠' '게임빌·컴투스'가 1위부터 5위를 기록한 것으로 나타났다.  '카카오'는 다운로드와 앱 수익 상위 퍼블리셔에 모두 이름을 올린 유일한 기업으로 눈길을 끌었다. 강미화 기자 redigo@fomos.co.kr[게임&게이머, 문화를 전합니다. 포모스게임│무단 전재 및 재배포 금지]포모스"
2021.02.03.,"[특징주] 상장 첫날 레인보우로보틱스, 상한가 직행",url없음,<네이버 기사 없음>
2021.02.03.,"[특징주] 상장 첫날 레인보우로보틱스, 상한가 직행",url없음,<네이버 기사 없음>
