기사날짜,기사제목,네이버 뉴스 url,기사내용
2021.02.03.,"""돈 안 보내면 성매매 영상 뿌린다""…2억 뜯어낸 '남부장'",https://n.news.naver.com/mnews/article/008/0004538334?sid=102,"[머니투데이 김지현 기자] [5개월에 걸쳐 피해자들에게 2억1960만원 갈취법원 “범행 계획적이고 반복적으로 이뤄져” ] 임종철 디자이너 / 사진=임종철 디자이너성매매 출입기록과 성매매 동영상을 가족과 지인들에게 유포하겠다고 협박해 2억원 이상을 뜯어낸 공갈범 일당이 실형을 선고받았다.  서울동부지법 형사4단독 박준민 부장판사는 공갈 혐의로 기소된 20대 남성 A씨에게 징역 3년, 같은 혐의로 기소된 30대 남성 B씨에게 징역 2년에 집행유예 3년을 선고했다고 3일 밝혔다.  2019년 1월 필리핀에 거주하는 공갈조직 총책(일명 남부장)과 만난 A씨는 대포통장 및 대포폰 수집 방법, 성매매업소 출입기록 구매방법 등을 배웠다. 남부장은 A씨가 같은 해 2월 귀국하자 텔레그램을 통해 연락한 뒤 범행 계획을 알려주고, 범행에 가담할 사람을 모집하라고 지시했다. A씨는 평소 알고 지내던 B씨를 범행에 가담시켰다. 이들은 성매매업소 종업원들에게 성매매업소 출입기록을 구입해 사람들의 전화번호와 연계된 ‘카카오톡’, ‘카카오스토리’ 등을 검색해 개인정보를 알아낸 뒤, 이들에게 돈을 보내지 않으면 가족과 지인에게 성매매 사실을 알리겠다고 협박해 돈을 뜯어내기로 했다. 구체적으로 남부장이 범행 계획을 세우고 지시하는 총책을, A씨는 남부장의 지시에 따라 대포통장 및 대포폰을 구입하거나 불특정 다수에게 전화를 거는 행동책 역할을 맡았다. B씨는 대포통장을 관리하면서 입금된 돈을 다른 대포통장에 이체하는 자금관리를 했다.   이들은 2019년 8월 피해자 C씨에게 대포폰으로 ""불러주는 계좌로 돈을 입금하지 않으면 가족과 지인에게 영상을 유포하겠다""는 협박 전화를 걸어 3680만원을 뜯어냈다. 이외에도 지난해 2월까지 총 4회 걸쳐 피해자들로부터 2억1960만원을 뜯어냈다.  박 부장판사는 “불특정 또는 다수의 피해자를 대상으로 상당한 기간에 걸쳐 반복적으로 범행이 이뤄졌다”며 ""피고인들이 피해 회복을 위해 노력하고 있으나 범행이 계획적으로 이뤄졌던 점 등을 고려해 형량을 정했다""고 밝혔다. 김지현 기자 flow@mt.co.kr▶부동산 투자는 [부릿지]▶조 변호사의 가정상담소▶줄리아 투자노트 <저작권자 ⓒ '돈이 보이는 리얼타임 뉴스' 머니투데이, 무단전재 및 재배포 금지>"
2021.02.03.,"존박, 코로나19 최종 음성 판정…“건강한 상태로 작업 중”",https://n.news.naver.com/mnews/article/396/0000572400?sid=106,<구조 다름>
2021.02.03.,"한국투자증권, 뱅키스 누적 계좌수 400만개 돌파",url없음,<네이버 기사 없음>
2021.02.03.,"[Daily New쇼핑] 현대H몰, 마켓컬리, 홈앤쇼핑 外",url없음,<네이버 기사 없음>
2021.02.03.,"삼성화재 다이렉트, 고객편의 위해 디지털 서비스 확대",url없음,<네이버 기사 없음>
2021.02.03.,"""돈 안 보내면 성매매 영상 뿌린다""…2억 뜯어낸 '남부장'",https://n.news.naver.com/mnews/article/008/0004538334?sid=102,"[머니투데이 김지현 기자] [5개월에 걸쳐 피해자들에게 2억1960만원 갈취법원 “범행 계획적이고 반복적으로 이뤄져” ] 임종철 디자이너 / 사진=임종철 디자이너성매매 출입기록과 성매매 동영상을 가족과 지인들에게 유포하겠다고 협박해 2억원 이상을 뜯어낸 공갈범 일당이 실형을 선고받았다.  서울동부지법 형사4단독 박준민 부장판사는 공갈 혐의로 기소된 20대 남성 A씨에게 징역 3년, 같은 혐의로 기소된 30대 남성 B씨에게 징역 2년에 집행유예 3년을 선고했다고 3일 밝혔다.  2019년 1월 필리핀에 거주하는 공갈조직 총책(일명 남부장)과 만난 A씨는 대포통장 및 대포폰 수집 방법, 성매매업소 출입기록 구매방법 등을 배웠다. 남부장은 A씨가 같은 해 2월 귀국하자 텔레그램을 통해 연락한 뒤 범행 계획을 알려주고, 범행에 가담할 사람을 모집하라고 지시했다. A씨는 평소 알고 지내던 B씨를 범행에 가담시켰다. 이들은 성매매업소 종업원들에게 성매매업소 출입기록을 구입해 사람들의 전화번호와 연계된 ‘카카오톡’, ‘카카오스토리’ 등을 검색해 개인정보를 알아낸 뒤, 이들에게 돈을 보내지 않으면 가족과 지인에게 성매매 사실을 알리겠다고 협박해 돈을 뜯어내기로 했다. 구체적으로 남부장이 범행 계획을 세우고 지시하는 총책을, A씨는 남부장의 지시에 따라 대포통장 및 대포폰을 구입하거나 불특정 다수에게 전화를 거는 행동책 역할을 맡았다. B씨는 대포통장을 관리하면서 입금된 돈을 다른 대포통장에 이체하는 자금관리를 했다.   이들은 2019년 8월 피해자 C씨에게 대포폰으로 ""불러주는 계좌로 돈을 입금하지 않으면 가족과 지인에게 영상을 유포하겠다""는 협박 전화를 걸어 3680만원을 뜯어냈다. 이외에도 지난해 2월까지 총 4회 걸쳐 피해자들로부터 2억1960만원을 뜯어냈다.  박 부장판사는 “불특정 또는 다수의 피해자를 대상으로 상당한 기간에 걸쳐 반복적으로 범행이 이뤄졌다”며 ""피고인들이 피해 회복을 위해 노력하고 있으나 범행이 계획적으로 이뤄졌던 점 등을 고려해 형량을 정했다""고 밝혔다. 김지현 기자 flow@mt.co.kr▶부동산 투자는 [부릿지]▶조 변호사의 가정상담소▶줄리아 투자노트 <저작권자 ⓒ '돈이 보이는 리얼타임 뉴스' 머니투데이, 무단전재 및 재배포 금지>"
2021.02.03.,"하나카드, 디지털 신상품 ‘MULTI’ 시리즈 3종 출시",url없음,<네이버 기사 없음>
2021.02.03.,"진에어, 이베이코리아 '스마일페이' 간편결제 서비스 도입",https://n.news.naver.com/mnews/article/374/0000233131?sid=101,"진에어가 국내 항공사 최초로 이베이코리아의 '스마일페이(SmilePay)' 간편결제 서비스를 도입하기로 했습니다. 진에어는 오늘(3일)부터 자사 홈페이지와 모바일 앱에서 스마일페이 결제 서비스를 통해 항공권 예매가 가능하다고 밝혔습니다.스마일페이는 고객의 신용카드, 체크카드, 은행계좌와 연동하여 6자리 비밀번호 또는 지문 인증만으로도 간편하게 결제할 수 있는 시스템입니다. 진에어 측은 별도의 인증서 설치 없이 간단한 결제 인증만 거치면 항공권 예매가 완료되고, 항공권 예매 시 기존에 적립한 스마일캐시도 현금처럼 함께 사용이 가능하다고 설명했습니다.진에어는 이와 관련해 지난 2015년 카카오페이를 시작으로 네이버페이, 페이코, 페이북, 페이팔, 토스 등 다양한 간편결제 서비스를 도입해 국내외 고객들의 이용 편의성 확대에 나서고 있습니다.특히 지난해 간편결제 서비스 이용 건수가 2019년 대비 약 8% 이상 증가하는 등 지속적으로 이용률이 높아지고 있다고 회사 측은 설명했습니다.진에어는 ""스마일페이 등 간편결제 서비스 이용 고객들이 보다 쉽고 편리하게 항공 서비스를 이용할 수 있도록 다양한 IT 기술을 접목해 경쟁력을 강화해 나가겠다""고 전했습니다. 전서인 기자(westin@sbs.co.kr) ▶ 돈 세는 남자의 기업분석 '카운트머니' [네이버TV]▶ 경제를 실험한다~ '머니랩' [네이버TV] 저작권자 SBS미디어넷 & SBS I&M 무단전재-재배포 금지"
2021.02.03.,"대원씨아이, 웹툰 '동군' 韓·中 동시 연재",https://n.news.naver.com/mnews/article/008/0004538441?sid=101,"[머니투데이 이민하 기자] 대원미디어의 자회사인 대원씨아이는 인기 만화 '동군(東君)'을 원작으로 하는 동명의 웹툰 '동군'을 한국과 중국 웹툰 플랫폼에서 동시에 서비스한다고 3일 밝혔다.대원씨아이는 국내 최대 만화 콘텐츠 전문기업이다. 웹툰 동군은 대원씨아이의 대표 만화잡지인 '코믹 챔프'에서 연재했던 인기 만화 동군을 웹툰에 맞게 새롭게 편집한 작품이다. 이달 9일부터 한국과 중국의 주요 웹툰 플랫폼에서 동시에 연재한다. 국내 플랫폼은 카카오페이지, 네이버웹툰, 리디북스 등 10여개 이상이다. 중국 플랫폼은 텐센트, 빌리빌리, 콰이칸 등이다.중국출판그룹디지털미디어유한공사 로고중국 내 웹툰 공급은 해외 파트너사인 중국출판그룹디지털미디어유한공사(中版集团数字传媒有限公司)와 공동으로 진행한다. 중국출판그룹은 웨이보 계정으로 현지 독자들을 대상으로 웹툰 홍보 프로모션도 펼친다. 앞서 대원씨아이와 중국출판그룹은 2019년 한·중 웹툰, 만화시장 확대를 위한 전략적 업무협약을 맺었다.황민호 대원씨아이 부사장은 ""코로나19(COVID-19)로 중국 진출이 계획보다 많이 지연됐지만 올해부터는 독자들로부터 많은 인기를 받았던 유명 콘텐츠의 디지털화부터 웹소설을 원작으로 한 신규 웹툰 작품들을 세계 시장에 맞춰 하나씩 선보일 계획""이라고 했다. 이어 ""다양한 보유 콘텐츠의 ‘디지털화’와 ‘세계화’가 대원씨아이 콘텐츠 사업의 핵심요소""라며 ""앞으로 중국 시장에 구국한 유통 인프라를 활용해 글로벌 콘텐츠 공급자로 입지를 넓혀갈 것""이라고 덧붙였다. 한편 웹툰 동군은 한국의 ‘치우천왕 신화’와 중국의 ‘산해경’, 그 밖에도 다양한 동양의 창세 신화를 바탕으로 한 액션 판타지 장르의 작품이다.이민하 기자 minhari@mt.co.kr▶부동산 투자는 [부릿지]▶조 변호사의 가정상담소▶줄리아 투자노트 <저작권자 ⓒ '돈이 보이는 리얼타임 뉴스' 머니투데이, 무단전재 및 재배포 금지>"
2021.02.03.,"미래에셋생명, 변액 스마트케어 서비스·이벤트 오픈",https://n.news.naver.com/mnews/article/119/0002465718?sid=101,"미래에셋생명이 변액 스마트케어 서비스를 신설해 운영한다.ⓒ미래에셋생명미래에셋생명은 자사 변액보험 가입 고객에게 차별화된 변액보험 계약관리 서비스를 제공하고자 변액 스마트케어 서비스를 신설해 운영한다고 3일 밝혔다. 미래에셋생명은 변액 스마트케어 서비스 신규 오픈과 함께 서비스 이용 고객을 대상으로 경품 이벤트도 진행한다.미래에셋생명 변액보험 가입자를 위한 변액 스마트케어 서비스는 최신 디지털 기술을 적용해 사용자 편의에 맞춰 화면 및 서비스를 직관적으로 구성했다. 별도의 어플리케이션을 설치하지 않아도 카카오톡을 통해 변액보험의 수익률 및 투자정보 등을 조회해 볼 수 있으며, 스마트케어 알림 서비스 신청시 가입한 변액보험의 수익률 현황 및 수익률 관리 팁 등에 대한 맞춤형 알림톡을 받아 볼 수 있다.또 미래에셋생명은 변액 스마트케어 서비스 오픈을 기념해 이벤트 참여 고객에게 추첨을 통해 스타벅스 아메리카노 모바일 쿠폰을 지급하는 이벤트도 시행한다. 이벤트 참여는 카카오톡 미래에셋생명 변액 스마트케어 채널 접속을 통해 이용이 가능하다.이후민 미래에셋생명 고객서비스본부장은 ""미래에셋생명의 변액 스마트케어 서비스는 2019년부터 시행한 고객동맹자문단의 의견을 수렴해 고객과 함께 만든 시스템으로 누구나 쉽고 편리하게 변액보험을 관리할 수 있는 사용자 경험을 제공할 것""이라며 ""많은 고객이 미래에셋생명 변액보험과 함께 평안한 노후준비를 하기 바란다""고 전했다.데일리안 부광우 기자 (boo0731@dailian.co.kr)▶ 데일리안 네이버 구독하기▶ 데일리안 만평보기▶ 제보하기ⓒ (주)데일리안 - 무단전재, 변형, 무단배포 금지"
2021.02.03.,"삼성화재 다이렉트, 네이버페이 결제 도입…디지털 서비스 확대",https://n.news.naver.com/mnews/article/014/0004577661?sid=101,"생체·PIN번호 본인인증 방식 추가…2개월 만에 누적 사용량 30만건 삼성화재 직원이 다이렉트 생체인증 서비스를 시연하고 있다. [파이낸셜뉴스] 삼성화재가 다이렉트 채널에 디지털 서비스를 확대한다. 인증 방식에 생체인증과 PIN 방식을 추가했고, 네이버페이 결제도 도입한다.   3일 삼성화재에 따르면 삼성화재 다이렉트는 공동인증서(구 공인인증서), 휴대폰 인증, 카카오 인증, 토스 인증은 물론 생체 인증과 비밀번호 6자리로 이뤄진 PIN 인증 등 다양한 본인 인증 방식을 제공 중이다.   기존에는 공동인증서, 휴대폰을 이용한 본인 인증 방식이 주로 사용됐으나 고객 편의를 높이기 위해 작년 1월 카카오 및 토스 인증, 11월 생체 및 PIN 인증 방식을 추가했다. 특히 생체 인증에 대한 고객 반응이 뜨겁다. 도입 2개월 만에 누적 이용량이 30만건을 넘을 정도다. 삼성화재 다이렉트에서 이용 가능한 생체 인증 은 지문과 얼굴(Face ID) 인식이다. 삼성화재 다이렉트의 생체 인증 서비스는 다른 바이오 인증 앱을 추가로 설치할 필요 없이 자사 앱 내에서 자체적으로 인증 서비스를 제공하는 것이 특징이다. 통상적으로 보험사 앱의 생체 인증은 별도 바이오 인증 앱을 설치해 이용하는 방식을 쓴다.   2월에는 네이버페이 도입을 계획 중이다. 이를 통해 3대 금융 플랫폼인 네이버, 카카오, 토스의 제휴 서비스를 모두 제공해 고객의 편의성을 높이게 된다.   다이렉트 앱에는 다양한 상담이 가능한 채팅 상담 서비스도 추가됐다. 기존에는 간단한 문의 및 업무를 처리하는 챗봇 상담만을 운영 중이었다. 본인 인증 후 상담을 진행할 수 있으며 가입상담 뿐만 아니라 계약변경 같은 업무처리도 가능하다.   삼성화재 다이렉트 관계자는 ""삼성화재는 작년 12월 디지털본부를 신설해 변화하는 디지털 시대를 준비하고 있다""며 ""앞으로 디지털 환경에 맞는 더 좋은 상품과 서비스를 제공하기 위해 노력하겠다""고 말했다.    hsk@fnnews.com 홍석근 기자   ▶ 헉! 소리나는 스!토리 뉴스 [헉스]▶ '아는 척'하고 싶은 당신을 위한 [두유노우]▶ 날로먹고 구워먹는 금융이슈 [파인애플]  ※ 저작권자 ⓒ 파이낸셜뉴스. 무단 전재-재배포 금지"
2021.02.03.,"미래에셋생명, 변액 스마트케어 서비스·이벤트 오픈",https://n.news.naver.com/mnews/article/119/0002465718?sid=101,"미래에셋생명이 변액 스마트케어 서비스를 신설해 운영한다.ⓒ미래에셋생명미래에셋생명은 자사 변액보험 가입 고객에게 차별화된 변액보험 계약관리 서비스를 제공하고자 변액 스마트케어 서비스를 신설해 운영한다고 3일 밝혔다. 미래에셋생명은 변액 스마트케어 서비스 신규 오픈과 함께 서비스 이용 고객을 대상으로 경품 이벤트도 진행한다.미래에셋생명 변액보험 가입자를 위한 변액 스마트케어 서비스는 최신 디지털 기술을 적용해 사용자 편의에 맞춰 화면 및 서비스를 직관적으로 구성했다. 별도의 어플리케이션을 설치하지 않아도 카카오톡을 통해 변액보험의 수익률 및 투자정보 등을 조회해 볼 수 있으며, 스마트케어 알림 서비스 신청시 가입한 변액보험의 수익률 현황 및 수익률 관리 팁 등에 대한 맞춤형 알림톡을 받아 볼 수 있다.또 미래에셋생명은 변액 스마트케어 서비스 오픈을 기념해 이벤트 참여 고객에게 추첨을 통해 스타벅스 아메리카노 모바일 쿠폰을 지급하는 이벤트도 시행한다. 이벤트 참여는 카카오톡 미래에셋생명 변액 스마트케어 채널 접속을 통해 이용이 가능하다.이후민 미래에셋생명 고객서비스본부장은 ""미래에셋생명의 변액 스마트케어 서비스는 2019년부터 시행한 고객동맹자문단의 의견을 수렴해 고객과 함께 만든 시스템으로 누구나 쉽고 편리하게 변액보험을 관리할 수 있는 사용자 경험을 제공할 것""이라며 ""많은 고객이 미래에셋생명 변액보험과 함께 평안한 노후준비를 하기 바란다""고 전했다.데일리안 부광우 기자 (boo0731@dailian.co.kr)▶ 데일리안 네이버 구독하기▶ 데일리안 만평보기▶ 제보하기ⓒ (주)데일리안 - 무단전재, 변형, 무단배포 금지"
2021.02.03.,"하나카드, 멀티 시리즈 신상품 3종 출시",url없음,<네이버 기사 없음>
2021.02.03.,"삼성화재 다이렉트, 네이버페이 결제 도입…디지털 서비스 확대",https://n.news.naver.com/mnews/article/014/0004577661?sid=101,"생체·PIN번호 본인인증 방식 추가…2개월 만에 누적 사용량 30만건 삼성화재 직원이 다이렉트 생체인증 서비스를 시연하고 있다. [파이낸셜뉴스] 삼성화재가 다이렉트 채널에 디지털 서비스를 확대한다. 인증 방식에 생체인증과 PIN 방식을 추가했고, 네이버페이 결제도 도입한다.   3일 삼성화재에 따르면 삼성화재 다이렉트는 공동인증서(구 공인인증서), 휴대폰 인증, 카카오 인증, 토스 인증은 물론 생체 인증과 비밀번호 6자리로 이뤄진 PIN 인증 등 다양한 본인 인증 방식을 제공 중이다.   기존에는 공동인증서, 휴대폰을 이용한 본인 인증 방식이 주로 사용됐으나 고객 편의를 높이기 위해 작년 1월 카카오 및 토스 인증, 11월 생체 및 PIN 인증 방식을 추가했다. 특히 생체 인증에 대한 고객 반응이 뜨겁다. 도입 2개월 만에 누적 이용량이 30만건을 넘을 정도다. 삼성화재 다이렉트에서 이용 가능한 생체 인증 은 지문과 얼굴(Face ID) 인식이다. 삼성화재 다이렉트의 생체 인증 서비스는 다른 바이오 인증 앱을 추가로 설치할 필요 없이 자사 앱 내에서 자체적으로 인증 서비스를 제공하는 것이 특징이다. 통상적으로 보험사 앱의 생체 인증은 별도 바이오 인증 앱을 설치해 이용하는 방식을 쓴다.   2월에는 네이버페이 도입을 계획 중이다. 이를 통해 3대 금융 플랫폼인 네이버, 카카오, 토스의 제휴 서비스를 모두 제공해 고객의 편의성을 높이게 된다.   다이렉트 앱에는 다양한 상담이 가능한 채팅 상담 서비스도 추가됐다. 기존에는 간단한 문의 및 업무를 처리하는 챗봇 상담만을 운영 중이었다. 본인 인증 후 상담을 진행할 수 있으며 가입상담 뿐만 아니라 계약변경 같은 업무처리도 가능하다.   삼성화재 다이렉트 관계자는 ""삼성화재는 작년 12월 디지털본부를 신설해 변화하는 디지털 시대를 준비하고 있다""며 ""앞으로 디지털 환경에 맞는 더 좋은 상품과 서비스를 제공하기 위해 노력하겠다""고 말했다.    hsk@fnnews.com 홍석근 기자   ▶ 헉! 소리나는 스!토리 뉴스 [헉스]▶ '아는 척'하고 싶은 당신을 위한 [두유노우]▶ 날로먹고 구워먹는 금융이슈 [파인애플]  ※ 저작권자 ⓒ 파이낸셜뉴스. 무단 전재-재배포 금지"
2021.02.03.,"[이슈시개]""나 1천만원 벌어""…배달원 조롱한 학원관계자 '공분'",https://n.news.naver.com/mnews/article/079/0003463763?sid=102,"""공부 잘했으면 배달하나"", ""거지같다"" 조롱 이어져배달비 3천원에 항의전화…동작구 지역 맘카페 ""아이들에 뭘 가르치나""[CBS노컷뉴스 송정훈 기자]배달비가 과도하다며 배달대행업체에 ""거지같다""는 등의 폭언을 쏟아낸 서울 동작구 A어학원 관계자의 녹취록이 공개돼 논란이 일고 있다. 녹취록에서 A어학원 관계자는 ""공부 잘 했으면 배달했겠나"", ""나는 1주일에 천만원 번다"" 등의 조롱도 서슴지 않았다.2일 한 온라인커뮤니티에 '어제 너무 어이가 없고 화가 나 여기에 글을 한번 씁니다'는 제목의 게시물이 올라왔다. 배달대행업체를 운영한다고 밝힌 작성자는 ""지난 1일 우리 배달원이 한 학원으로 배달을 갔는데 학원 관계자가 아래로 내려가 기다리라고 했다""며 ""배달원은 학원 밖 1층에서 5~10분정도 기다리다가 다른 배달이 촉박해 (배달비를 받으려) 다시 학원으로 올라갔는데, 학원 관계자는 '애들을 가르치고 있어 바쁘다'면서 그냥 기다리라고 짜증을 냈다""고 당시 상황을 설명했다.이어 ""배달원도 다른 배달 때문에 바쁘다며 (배달비) 계산을 요청했는데 여러 핑계를 대다 늦게 결제를 했고, (이후) 전화 한통을 받았다""면서 ""(통화내용이) 너무 어이가 없어 녹음을 했다. 녹취록을 (누리꾼들이) 들어보고 별일이 아니라고 하면 우리도 참겠다. 가정이 있는데 저런 말까지 들어야 했나. 우리가 실수한 건지 궁금하다""며 20여분 분량의 녹취록을 첨부했다.녹취록을 들어보면, 학원 관계자는 ""본인들이 학교에서 공부 잘했으면 배달일 하겠나"", ""공부를 못하니 할 줄 아는 게 배달일 밖에 없는 것이다. 배달일은 중졸‧고졸도 다 받으니까"", ""본인들 3건 해봤자 만원 벌지 않나. 나는 가만히 있어도 만원, 2만원, 3만원이 나온다"", ""기사들이 뭔 고생을 하나. 오토바이 타고 부릉부릉 놀면서 문신하고 음악 듣고 다니지 않나"" 등의 폭언을 쏟아내고 있다.이에 폭언을 듣던 배달대행 운영자는 녹취록에서 '가정이 있고 본업을 하시는 분들도 많다'며 항의하는데, 학원 관계자는 아랑곳하지 않고 ""그런 사람 못 봤다. (있다면) 돈이 없으니 그렇겠지. 돈 많으면 하겠나""라며 ""(일반)회사에서 인정받고 돈 많이 벌었으면 '그짓' 하나""고 막말을 이어갔다.또 '배달대행이 얼마나 버는지 아느냐'는 물음엔 ""내가 1주일 만에 버는 게 천만원""이라고 큰소리쳤고, '1주일 천만원 버시는 분이 3천원이 부당하시냐고 하느냐'는 항의엔 ""거지 같아서 그랬다. 니네가 하는 꼴들이""라고 목소리를 높였다. 온라인커뮤니티·온라인카페 캡처현재 동작구 지역 맘카페, 각종 온라인커뮤니티 등에는 해당 녹취록이 빠르게 공유되고 있다.동작구 한 맘카페 회원은 ""녹취록을 들으면 더 속 터진다. (학원) 보내고 계신 분은 아셔야 할 듯 하다""면서 관련 내용을 공유했다. 이에 다른 회원들은 ""욕 나온다. 애들에게 무엇을 가르친다는 것인지 모르겠다"", ""녹취록을 듣는 내가 화나 난다"", ""듣고 있자니 정말 부끄럽다"" 등의 반응을 보였다.이외에 각종 커뮤니티에도 ""말투가 교육자가 아니다"", ""이번 사건은 공론화 시켜야 한다"", ""같은 학원업계 종사자로서 진짜 너무 부끄럽고 죄송하다"" 등의 댓글도 줄지어 달렸다.해당학원에 자녀를 보내는 것으로 보이는 학부모들의 단체 카카오채팅방 캡처도 온라인상에 공유되고 있다. 이들이 나눈 대화에 따르면 막말을 한 학원관계자는 수업을 진행하는 강사가 아닌 차량지도교사로 밝혀졌다.한편 녹취록 속 학원관계자가 학원명을 직접 밝히면서 해당 학원에는 현재 항의전화가 빗발치는 상황이다. 해당 학원의 입장을 들어보기 위해 수차례 전화통화를 시도했지만 오전 내내 '통화 중'이라는 안내와 함께 연결은 되지 않았다.스마트이미지 제공▶ 확 달라진 노컷뉴스▶ 클릭 한 번이면 노컷뉴스 구독!▶ 보다 나은 세상, 노컷브이와 함께yeswalk@cbs.co.kr저작권자 © CBS 노컷뉴스 무단전재 및 재배포 금지"
2021.02.03.,제주항공과 함께 여행을 미리 '찜'하세요,url없음,<네이버 기사 없음>
