기사날짜,기사제목,네이버 뉴스 url,기사내용
2021.02.28.,판교 연봉 순위 ‘크쿠네카라’...엔씨소프트에 쏠리는 눈,https://n.news.naver.com/mnews/article/119/0002471952?sid=101,"쿠팡·넥슨·넷마블 이어 크래프톤까지 '쩐의전쟁' 가세""집토끼 지키자"" 연봉 인상 주시...NC 내달 연봉협상 개시김택진 엔씨소프트 대표. ⓒ 엔씨소프트IT기업들의 연봉 인상 경쟁이 도미노처럼 펼쳐지고 있다. 쿠팡으로 촉발된 연봉 상승 정책은 넥슨과 넷마블을 거쳐 중견기업 컴투스·게임빌은 물론 최근 크래프톤까지 확산되고 있다.이제 업계의 시선은 ‘3N(넥슨·넷마블·엔씨소프트)’ 중 마지막 남은 엔씨소프트로 쏠리고 있다. 회사는 구체적 인상 계획을 공표하지 않았으나 인재를 확보하기 위해 최소 800만원 이상의 연봉 인상을 발표할 것이라는 기대감이 형성되고 있다.28일 관련업계에 따르면 최근 주요 기업들의 잇따른 연봉 인상 이슈로 게임사 ‘맏형’ 엔씨소프트의 고민이 깊어지고 있다.연쇄적인 임금 인상으로 판교 밸리에서 개발자 처우가 좋기로 소문난 기업 순서도 ‘네카라쿠배(네이버·카카오·라인·쿠팡·배달의민족)’에서 ‘크쿠네카라(크래프톤·쿠팡·네이버·카카오·라인)’으로 바뀌는 양상이다.이에 엔씨소프트도 좋은 개발자가 외부로 유출되지 않으려면 연봉 인상은 시간문제라는 관측이다.앞서 쿠팡은 미국 증시 상장을 앞두고 계약직을 포함한 3만명에 달하는 직원들에게 1000억원 규모의 자사주 지급을 결정했다. 쿠팡의 연봉 수준은 배송 전담 쿠팡맨이 4500만원 이상으로 지난해 하반기 2년차 경력 개발자 연봉을 6000만원대로 책정한 바 있다.이후 넥슨과 넷마블이 기존 직원들의 급여를 일괄적으로 800만원씩 인상했다. 신입 공채 초임 역시 5000만원으로 올렸다. 3N 중 2곳이 연봉을 올리자 인재 유출을 염려한 중견 게임사 컴투스와 게임빌이 평균 800만원의 연봉 상향을 결정했다.연봉 경쟁은 지난 25일 ‘배틀그라운드’를 만든 게임사 ‘크래프톤’이 정점을 찍었다. 회사는 직군을 막론하고 전직원 연봉을 최대 2000만원까지 파격 인상했다. 동시에 신입 대졸 연봉도 6000만원까지 끌어올렸다.이는 지난해 고용노동부가 조사한 대기업 대졸 사무직(직원 500명 이상) 평균 초봉 3347만원을 훌쩍 웃도는 것이다. 초 상위 대기업인 삼성전자나 SK하이닉스 초봉도 5000만원 안팎으로 알려졌다.개발자 인력난이 전 산업으로 확산되는 추세 속에서, 남은 기업들의 부담도 커진 상황이다. 지난해 호실적을 달성한 스마일게이트 등도 분위기를 주시하고 있다. 특히 오는 3월 임직원의 연봉 및 성과급 지급을 앞두고 있는 엔씨소프트의 결단이 초미의 관심사다.엔씨소프트의 직원은 4000여명으로 직원 1인당 평균 급여는 8100만원대(지난해 9월 분기보고서 기준)이다.엔씨소프트가 지난해 처음으로 연매출 2조원을 돌파한 가운데, 평소에도 직원들을 잘 챙기기로 유명한 김택진 대표의 성향상 경쟁사들 이상의 인상이 예상되고 있다. 앞서 김택진 대표는 지난해 12월 신종 코로나바이러스 감염증(코로나19)으로 인한 어려움을 이겨내자는 취지로 전 직원에 200만원의 격려금을 준 적 있다.실제 최근에는 엔씨소프트가 연봉을 일괄 1000만원 인상한다는 소문이 돌기도 했다. 회사측은 사실 무근이라고 부인했지만 회사 안팎에서 기대감은 사라지지 않고 있다.연봉 인상은 기업 입장에서 고정비가 늘어나는 리스크가 있다. 연봉이 한 번 올라가면 회사 경영이 어려워져도 사실상 낮추기 어렵기 때문이다.여기에 엔씨는 해마다 연구개발(R&D) 투자 비용을 증가하고 있다. 회사의 올해 1~3분기 누적 R&D 비용은 약 3270억원으로 전년동기 대비 49% 이상 늘었다. 게임업계서 가장 큰 폭으로 증가한 수준이다. 3분기 기준 R&D 투자 비중은 18%로 500대 국내 기업 중 5위이다.회사측은 “연봉 인상 관련 아직까지 확정된 사항은 없다”며 “내달 연봉 및 성과급 협상 시즌에 돌입하면 자세한 사안을 알 수 있을 것”이라며 신중한 입장을 견지했다.데일리안 이호연 기자 (mico911@dailian.co.kr)▶ 데일리안 네이버 구독하기▶ 데일리안 만평보기▶ 제보하기ⓒ (주)데일리안 - 무단전재, 변형, 무단배포 금지"
2021.02.28.,"전 쇼트트랙 국가대표 김동성 극단선택 시도, 생명 지장없어",https://n.news.naver.com/mnews/article/081/0003167215?sid=102,"양육비 미지급 및 과도한 사생활 노출에 대한 고통 토로김동성. 사진=TV조선 ‘우리 이혼했어요’ 방송 캡처전 쇼트트랙 국가대표 선수 김동성 씨가 27일 오후 3시쯤 용인시 상현동에 있는 자택에서 극단적 선택을 시도했다.김씨는 신고를 받고 출동한 119구급대원에 의해 병원으로 이송됐고, 생명에는 지장이 없는 것으로 확인됐다.김씨는 극단적 선택에 앞서 남긴 글을 통해 아이들에게 양육비를 지급하지 못한 미안함과 함께 과도한 사생활 노출에 대한 심적 고통을 토로한 것으로 알려졌다.김씨는 양육비를 주지 못해 전처가 양육비를 안 주는 아버지들을 공개하는 ‘배드파더스’ 명단에 올린바 있다.최근 한 예능 방송프로그램에 출연해서 양육비는 코로나로 빙상장이 문을 닫으면서 지급하지 못했다고 해명한 바 있다.게다가 유튜브 방송을 통해 김씨가 불륜 관계에 있었고, 물질적 지원을 받았다는 주장까지 제기됐다.윤창수 기자 geo@seoul.co.kr우울감 등 말하기 어려운 고민이 있거나 주변에 이런 어려움을 겪는 가족ㆍ지인이 있을 경우 자살예방 상담전화 ☎1393, 정신건강 상담전화 ☎1577-0199, 희망의 전화 ☎129, 생명의 전화 ☎1588-9191, 청소년 전화 ☎1388, 청소년 모바일 상담 ‘다 들어줄 개’ 어플, 카카오톡 등에서 24시간 전문가의 상담을 받을 수 있습니다.▶ 네이버에서 서울신문 구독하기 클릭!  ▶ [인터랙티브] 코로나 청년 잔혹사   ▶ [나우뉴스] 세상에 이런 일이ⓒ 서울신문(www.seoul.co.kr), 무단전재 및 재배포금지"
2021.02.28.,[OK!제보] 알바 교육기간엔 무급?…여전한 불법성 갑질,https://n.news.naver.com/mnews/article/001/0012230240?sid=103,"편집자 주 = 이 기사는 부산에 사는 대학생 서민아(가명·20대)씨 등 제보를 토대로 연합뉴스가 취재해 작성했습니다.(서울=연합뉴스) 이명환 인턴기자 = ""아르바이트 교육 기간에는 무급이라면서 시급을 안 주네요. 원래 이렇다는데 이게 맞는 건지 모르겠어요.""    A프랜차이즈 카페 부산지역 매장에서 아르바이트한 적 있는 대학생 서민아씨는 첫 3일 동안 9시간 근무한 데 대한 시급을 받지 못했다.    체불 금액은 당시 법정 최저임금(시간당 8천590원)을 고려하면 약 7만7천원에 달한다.    근무 개시 후 첫 3일은 음료 제조법 등을 배우는 교육 기간이어서 시급을 적용하지 않는다는 게 카페 점주의 설명이었다.    서씨는 교육 기간에도 음료 제조나 매장 청소를 했기 때문에 임금을 못 준다는 점주의 말을 이해하기 어려웠다.    서울 동대문구 B카페에서 아르바이트를 한 대학생 안은주(가명·20대)씨도 근무 초기 교육을 이유로 6시간분 임금을 받지 못했다. 안씨는 부당하다고 느꼈지만 어렵게 얻은 아르바이트 자리를 잃을까 봐 점주에게 항의하지 못했다.    일부 고용주들이 아르바이트생 교육 기간에 임금을 지급하지 않는 악습이 좀처럼 사라지지 않고 있다.아르바이트 (PG)[제작 정연주] 일러스트 사전 설명 없이 임금 미지급…사라지지 않는 악습    아르바이트 관련 온라인 커뮤니티에서 교육 기간 임금을 받지 못한 사례를 검색하니 관련된 글이 500개 이상 나타났다.    아르바이트 후기를 공유하는 게시판에는 ""사전 통보 없이 교육 기간 시급을 뺀 임금을 줬다"", ""딱히 교육받은 것도 없고 바로 일했는데 교육 기간이어서 무급이라고 한다"" 등 임금을 받지 못한 것을 하소연하는 글들이 게시됐다.    실습이 포함된 아르바이트 교육도 정상적인 근무로 봐야 한다. 고용노동부 행정해석(근로개선정책과-2570)에 따르면 교육이 고용주 지시로 이뤄졌거나, 근로에 준하는 직무교육이라면 교육 시간이라도 근로시간으로 봐 시급을 지급해야 한다.    정직원에게 적용하는 수습 시급을 아르바이트생에게 적용하는 것도 위법 소지가 있다.     고용노동부에 따르면 최저임금법 중 '3개월 이내의 수습 근로자에게는 최저 임금액의 10%를 감액하여 지급할 수 있다'는 조항은 1년 이상 근로계약을 맺은 근로자에게만 적용되기 때문이다. 단순노무직종 근로자는 수습근로자인 경우에도 최저임금을 100% 지급해야 한다.     전병옥 공인노무사는 ""교육 중 업무에서 완전히 배제하지 않는 한 임금을 줘야 한다""며 ""실습처럼 근무 지시가 조금이라도 있는 교육은 임금 지급 대상""이라고 말했다.    그러나 고용이 불안정한 아르바이트생이 이를 알더라도 항의하지 못해 교육 기간 무임금 관행이 사라지지 않고 있다.    아르바이트 노동조합(알바노조)이 2017년 서형수 당시 국회의원과 함께 내놓은 '편의점 노동환경 실태조사' 국정조사 자료집에 따르면 수습 기간(교육 기간) 시급을 전혀 받지 못했거나 적은 시급을 받았다는 응답이 118건으로 전체 응답(156건) 중 76％가량을 차지했다.    신정웅 알바노조 위원장은 ""일부 사업주가 근무 교육을 근로가 아닌 단순 교육으로 봐 무임금을 당연시한다""며 ""어렵사리 일자리를 구한 아르바이트생은 언제 잘릴지 모르는 을(乙) 입장이라 문제 제기하기 어려운 실정""이라고 지적했다.2017년 편의점 노동환경 실태조사 자료[아르바이트노동조합 제공. 재판매 및 DB 금지] 본사 수수방관…노동계 ""알바 권리 알리고 처벌 강화해야""    프랜차이즈 본사는 가맹점에 교육 기간 임금 미지급을 지시한 적 없다고 주장했다.     A프랜차이즈 본사 관계자는 ""가맹점주 교육을 통해 아르바이트 근로자 권익 준수를 안내했다""며 ""아르바이트 교육 기간 임금 미지급에 대해 파악해 해당 가맹점에 시정을 요구할 것""이라고 설명했다.    하지만 아르바이트 근무자들은 가맹점이 제대로 임금을 지급하는지를 조사하는 본사는 거의 없다고 토로했다.    아르바이트 근무자들은 임금 미지급 악습을 없애기 위해 당국이 고용주에 대한 법적 처벌을 강화해야 한다고 주장했다.    고용주가 교육 기간 주지 않은 임금을 추후 지급하더라도 처벌을 면할 수 없도록 해야 한다는 지적이다.    신 위원장은 ""대다수 프랜차이즈 본사는 아르바이트 고용 관련법 준수를 지도했다면서 책임을 회피한다""며 ""본사가 아르바이트 근로자에게도 교육 기간에도 임금을 받을 수 있다는 사실과 미지급 시 구제받을 권리가 있음을 적극 알려야 한다""고 촉구했다.    그는 ""관할 노동청에 진정을 넣더라도 대부분 중재를 거쳐 밀린 임금을 주고 끝나 형사처벌로 이어지는 경우는 거의 없다""며 ""관계당국은 근로기준법 위반 집중 단속과 함께 위반 사업주에 강력한 처벌을 해야 할 것""이라고 주문했다.    청년유니온 관계자도 ""소액 임금체불은 합의 처리를 유도해 처벌이 거의 이뤄지지 않는 것이 문제""라며 ""근로감독관이 근로기준법 위반 고용주를 보다 적극적으로 처벌하고 감독해야 재발을 막을 수 있을 것""이라고 주장했다.hwanee1026@yna.co.kr    기사제보나 문의는 카카오톡 okjebo▶네이버에서도 뉴스는 연합뉴스[구독 클릭]▶[팩트체크]검찰이 직접 수사권 전면행사하는 나라 없다?▶제보하기<저작권자(c) 연합뉴스(https://www.yna.co.kr/), 무단 전재-재배포 금지>"
2021.02.28.,"김동성, 자택서 극단적 선택 시도 '생명 지장 없어'",https://n.news.naver.com/mnews/article/119/0002472013?sid=102,"전 쇼트트랙 국가대표 김동성이 극단적 선택을 시도한 것으로 확인됐다.ⓒTV조선 '우리 이혼했어요'28일 소방당국 등에 따르면 김동성이 지난 27일 오후 3시께 경기 용인시 상현동 자택에서 극단적 선택을 시도했다는 신고가 접수됐다.당시 김동성은 의식이 있던 상태로, 신고를 받고 출동한 119구급대원에 의해 병원으로 이송됐다. 현재 생명에는 지장이 없는 것으로 알려졌다.김동성은 지난 1일 TV조선 '우리 이혼했어요'에 출연해 재혼 준비 사실을 알리며 연인 인민정을 공개한 바 있다. 그는 방송 직후 양육비 미지급 논란이 거세지자 앞서 불거진 배드파더스 등재에 대해 연인 인민정의 인스타그램에 직접 심경을 밝히기도 했다.또한 김동성은 ""#배드파더스 #양육비 노력했습니다. 노력하고 있습니다. 모든 잘못 반성하고 반성하고 있습니다""라는 글과 함께 전처, 아들과 함께 나눴던 카톡 캡처를 올리며 해명에 나서기도 했다.우울감 등 말하기 어려운 고민이 있거나 주변에 이런 어려움을 겪는 가족ㆍ지인이 있을 경우 자살예방 상담전화 ☎1393, 정신건강 상담전화 ☎1577-0199, 희망의 전화 ☎129, 생명의 전화 ☎1588-9191, 청소년 전화 ☎1388, 청소년 모바일 상담 ‘다 들어줄 개’ 어플, 카카오톡 등에서 24시간 전문가의 상담을 받을 수 있습니다.데일리안 이지희 기자 (ljh4749@dailian.co.kr)▶ 데일리안 네이버 구독하기▶ 데일리안 만평보기▶ 제보하기ⓒ (주)데일리안 - 무단전재, 변형, 무단배포 금지"
2021.02.28.,[송승섭의 금융라이트] '전금법'이 뭐길래 싸우시나요?,https://n.news.naver.com/mnews/article/277/0004856088?sid=101,"금융위·한은, 전금법 갈등 핵심은?빅테크·핀테크 내부거래 청산, 누가 감독하나""소비자 보호"" vs ""사생활 보호"" 의견차 팽팽금융은 어렵습니다. 알쏭달쏭한 용어와 복잡한 뒷이야기들이 마구 얽혀있습니다. 하나의 단어를 알기 위해 수십개의 개념을 익혀야 할 때도 있죠. 그런데도 금융은 중요합니다. 자금 운용의 철학을 이해하고, 돈의 흐름을 꾸준히 따라가려면 금융 상식이 밑바탕에 깔려있어야 합니다. 이에 아시아경제가 매주 하나씩 금융용어를 선정해 아주 쉬운 말로 풀어 전달합니다. 금융을 전혀 몰라도 곧바로 이해할 수 있는 ‘가벼운’ 이야기로 금융에 환한 ‘불’을 켜드립니다.윤관석 국회 정무위원장이 지난 25일 국회 정무위원회에서 열린 전자금융거래법 개정안에 관한 공청회 안건을 상정하고 있다. [사진=윤동주 기자][아시아경제 송승섭 기자] 정책은 종종 여러 이해관계자의 충돌을 불러일으킵니다. 때때로 정부 기관끼리 정책을 두고 논쟁이 벌어지기도 하죠. 지금 금융권에서도 비슷한 양상이 나타나고 있습니다. 바로 전자금융거래법(전금법) 때문입니다. 왜 전금법이 금융권의 뜨거운 감자로 떠오른 것일까요?논쟁의 시작은 국회 정무위원장을 맡은 윤관석 더불어민주당 의원이 지난해 11월 전금법 개정안을 대표 발의하면서 시작됐습니다. 전금법은 현금자동입출금기(ATM), 지급용단말기, 컴퓨터 등을 통해 이뤄지는 금융거래와 관련된 법입니다. 쉽게 말해 인터넷에서 옷을 사고 돈을 지불할 때 지켜야 할 규칙들이 담겨있는 겁니다.빅테크·핀테크 내부거래 청산은 누가 감독할까윤관석 의원의 개정안에는 네이버나 카카오페이 같은 빅테크 기업이 금융업에 쉽게 진출할 수 있도록 하고, 경쟁을 촉진하며, 관리·감독하는 방안이 담겨 있습니다. 그런데 ‘청산’ 업무를 두고 금융위원회와 한국은행이 각기 다른 의견을 냈습니다.청산이란 금융거래를 하면서 생기는 채권·채무 관계를 계산해 금융회사가 주고받을 금액을 확정하는 작업입니다. 가령 김씨가 A은행을 통해 B은행에 1억을 송금하고, 이씨가 B은행을 통해 A은행에 5000만원을 송금했다고 가정해보죠. 두 은행은 서로 1억과 5000만원을 주고받아야 하지만 청산을 거치면 A은행이 5000만원만 주는 식입니다. 훨씬 편리하죠.청산에 필요한 계산은 금융결제원이 대신 해줍니다. 금결원이 “A은행이 5000만원을 송금해야 한다”는 사실을 파악하는 겁니다. 관리·감독과 실제 돈을 송금하는 역할은 중앙은행인 한은에서 맡습니다. 각 은행은 한은에 계좌를 개설하고 있는데, 한국은행이 A은행 계좌에서 5000만원을 빼 B은행 계좌로 옮겨놓는 식입니다.문제는 전금법 개정안이 핀테크·빅테크 기업의 ‘내부 거래’도 외부기관(금결원)의 청산을 통해서 하고, 이를 금융위가 허가·감독하도록 했다는 겁니다. 지금까지 카카오페이로 카카오페이 계좌에 돈을 송금하는 내부 거래는 청산 과정을 거치지 않았습니다. 개정안이 통과되면 핀테크·빅테크 기업도 금결원이 청산 과정을 거치고 금융위가 관리·감독하게 되는 거죠.금융위 ""소비자 보호"" vs 한은 ""사생활 침해"" 금융위는 금융소비자 보호를 위해 내부거래 역시 청산과정을 거치고 관리·감독을 받아야 한다는 입장입니다. 빅테크 내부 거래 과정에서도 금융 사고가 발생할 수 있고, 이 경우 자료를 제출과 감사를 통해 진상을 파악할 수 있다는 거죠.한은은 독립된 중앙은행의 고유한 업무에 금융위가 개입한다며 반발했습니다. 거기다 정부 기관인 금융위가 거래내용을 볼 수 있으니 사생활 침해이며, ‘빅브러더’가 될 수 있다고 강하게 비판한 거죠.금융위는 강하게 반발했습니다. 한은의 모든 업무를 감사하는 게 아닐뿐더러, 자료 제출과 관리·감독은 금융사고가 벌어졌을 만약의 경우 법적 절차에 따라 이뤄진다는 겁니다. 최근 기자들을 만난 은성수 금융위원장은 “통신사가 통신기록을 가지고 있다고 해서 빅브러더가 될 수 있나”, “지금도 자금 이체를 하면 정보가 금결원으로 가는데 그럼 지금 한은은 스스로 빅브러더라고 얘기하는 것”이라고 맞받아쳤습니다.여기에 이주열 한은 총재가 국회 기획재정위원회 전체회의에 출석해 ""전금법 개정안은 빅브러더 법이 맞다""고 반박하며 갈등은 깊어졌습니다.정순섭 서울대 법학전문대학원 교수가 지난 25일 국회 정무위원회 전체회의에서 전자금융거래법 개정안에 관한 공청회에서 발언을 하고 있다. 정순섭 서울대 법학전문대학원 교수(왼쪽부터), 양기진 전북대 법학전문대학원 교수, 안동현 서울대 경제학부 교수, 정중호 하나금융경영연구소장, 류영준 핀테크산업협회장 [사진=윤동주 기자]전금법에 관련된 이해당사자들도 제각기 목소리를 냈습니다. 국무총리 산하기관인 개인정보보호위원회는 해당 개정안이 개인정보보호 이념과 원칙에 맞지 않다고 주장했죠. 전금법은 구체적으로 어떤 정보를 금융위에 제공할지 담겨있지 않고 대통령령에 위임하기 때문에 우려스럽다는 게 이유였습니다. 전국금융산업노동조합은 양 기관을 모두 비판했습니다. 카카오뱅크와 토스뱅크 등이 금융에 진출하면서 논의해야 할 사안이 많은데, 금융결제원의 업무를 누가 챙겨갈 것인지를 두고 밥그릇 챙기기만 몰두한다는 겁니다.논란이 커지자 한은과 금융위는 확전을 자제하는 분위기입니다. 금융위는 개인정보보호위와 협의에 나설 방침이고요. 다만 양 기관의 견해차가 뚜렷한 만큼 개정안이 국회에서 처리되기까지는 상당한 진통이 예상됩니다.송승섭 기자 tmdtjq8506@asiae.co.kr▶ 2021년 신축년(辛丑年) 신년운세와 토정비결은?▶ 발 빠른 최신 뉴스, 네이버 메인에서 바로 보기▶ 투자 성공의 핵심은 기업분석! 'CORE' 바로가기<ⓒ경제를 보는 눈, 세계를 보는 창 아시아경제 무단전재 배포금지>"
