기사날짜,기사제목,네이버 뉴스 url,기사내용
2021.02.16.,"카카오 ""더 나은 세상을 위해 '혁신가'에 투자""",https://n.news.naver.com/mnews/article/014/0004585260?sid=105,"11명에 2년간 月 200만원씩 지원 카카오임팩트 펠로우십 시즌1 카카오 제공 카카오 기업재단 카카오임팩트가 '더 나은 세상을 만들기 위해 노력하는 사회혁신가' 지원에 나섰다. 카카오임팩트 펠로우로 선정된 사회혁신가 11명에게 향후 2년 간 매월 활동비 200만원을 지원키로 한 것. 또 이들의 사회혁신 활동은 카카오 채널을 통해 널리 알려질 예정이다.   카카오는 올해 첫 카카오임팩트 프로젝트로 '카카오임팩트 펠로우십' 시즌1을 시작한다며 16일 이같이 밝혔다.   카카오임팩트 펠로우십(이하 펠로우십)은 사람에 대한 투자를 통해 '소셜임팩트'를 창출하는 것을 목표로 한다. 이를 위해 소셜벤처, 미디어, 비영리단체, 활동가, 연구자 등 다양한 '사회혁신가'를 선정해 지원한다. 펠로우십은 2019년 11월 카카오임팩트 이사회 발의로 시작돼 2020년 본격적으로 기획을 시작하고 선정 절차를 밟았다. 펠로우 선정 과정에는 추천부터 최종 선정까지 외부 전문가가 참여해 객관성과 다양성을 갖췄다는 평가다.   향후 펠로우십은 시즌제로 진행하며 카카오임팩트 핵심 사업으로 규모가 확대될 예정이다. 시즌2는 올 하반기 중 선정될 예정이며, 연간 최대 30명의 사회혁신가를 지원하는 것을 목표로 하고 있다.   카카오 측은 ""가치 있는 일을 더욱 많은 사람들에게 알릴 수 있도록 카카오 내외부의 다양한 홍보 채널을 활용할 수 있도록 할 예정""이라고 전했다. 이와 함께 다양한 전문가들 및 혁신가들이 함께 소통하며 성장할 수 있는 네트워크 형성도 지원할 방침이다.   펠로우는 추천 네트워크를 통한 추천제를 기반으로 선발된다. 카카오임팩트 이사회 및 각계 리더 30여명 이상으로 구성된 추천 네트워크를 통해 1차 후보를 추천 받으며, 이후 별도 선정위원회를 통해 최종 선발된다. 또 추천 위원이 아니더라도 카카오임팩트 홈페이지를 통해서 누구나 추천할 수 있으며 본인 추천도 가능하다.  elikim@fnnews.com 김미희 기자 ▶ 헉! 소리나는 스!토리 뉴스 [헉스]▶ '아는 척'하고 싶은 당신을 위한 [두유노우]▶ 날로먹고 구워먹는 금융이슈 [파인애플]  ※ 저작권자 ⓒ 파이낸셜뉴스. 무단 전재-재배포 금지"
2021.02.16.,‘카카오가 또!’…사회혁신가에 월 200만씩 지원금 보탠다,https://n.news.naver.com/mnews/article/081/0003164102?sid=105,"‘카카오임팩트 펠로우십 시즌1’ 개시김범수 카카오 이사회 의장카카오 제공카카오의 사회공헌재단인 ‘카카오임팩트’가 사회혁신가를 지원하는 ‘카카오임팩트 펠로우십 시즌1’을 시작한다고 16일 밝혔다. 카카오임팩트는 이번에 선정된 11명의 사회혁신가 각각에게 2년간 매달 200만원씩 지원해 활동을 도울 예정이다. 또한 이들의 사회혁신 활동을 카카오가 지닌 창구를 통해 홍보함으로써 보다 많은 사람들에게 ‘선한 영향력’이 미칠 수 있도록 할 계획이다. ‘카카오임팩트 펠로우십 시즌2’는 하반기 중에 선정해 연간 최대 30명의 사회혁신가를 지원하는 것을 목표로 삼고 있다.카카오임팩트 펠로우십 시즌1카카오 제공이번에 선정된 사회혁신가는 고금숙(환경운동가)·정다운(보틀팩토리 대표)·정정윤(핸드스피크 대표)·변재원(소수자정책연구자)·홍윤희(협동조합 무의 이사장)·김승일(모두의연구소 대표)·김자유(누구나데이터 대표)·김재순(유스보이스 대표)·조소담(닷페이스 대표)·최서희(리셋 대표)·유명상(협동조합 청풍 대표) 등 11명이다. 이들은 각자 환경·기술·장애·교육·미디어·디지털 성폭력·지역 등의 분야에서 활동하고 있다. 카카오임팩트 이사회 및 각계 리더 30여명 이상으로 구성된 네트워크를 통해 1차 후보를 추천받은 뒤 별도 선정위원회를 거쳐 최종 선발했다.카카오임팩트는 카카오가 지닌 기술적 기반과 영향력을 활용해 사회문제 해결에 기여하고자 2018년 4월에 설립한 재단이다. 최근 전재산의 절반을 사회에 기부하겠다고 밝힌 김범수 카카오 창업자(카카오 이사회 의장)가 이사장을 맡고 있다. 김 의장은 카카오임팩트 홈페이지를 통해 “기업가적 사고로 풀 수 있는 사회적 문제가 무엇인지에 관심, 그걸 풀어보고 싶은거죠”라고 알리며 재단의 활동 방향을 밝혔다.카카오톡카카오임팩트는 카카오와 계열사들의 자금을 모아 만든 회사 차원의 재단이기 때문에 김 의장이 기부하기로 밝힌 것과는 별도로 운영되고 있다. 5조원이 훌쩍 넘을 것으로 예상되는 김 의장의 개인재산 기부 방식이나 사용처 등은 이달말 열리는 카카오 공동체 구성원 간담회를 시작으로 구체적으로 논의하게 될 예정이다. 그동안 김 의장은 학교, 교육재단, 스타트업·벤처 등에 224억원 상당을 사재로 지원해왔는데 이번에도 교육·창업 분야에 기부금이 쓰일 것으로 업계는 전망하고 있다.한재희 기자 jh@seoul.co.kr▶ 네이버에서 서울신문 구독하기 클릭!  ▶ <1회> ""기자 아저씨, 배가 너무 고파요""   ▶ [나우뉴스] 세상에 이런 일이ⓒ 서울신문(www.seoul.co.kr), 무단전재 및 재배포금지"
2021.02.16.,"카카오 김범수·NC 김택진, 서울상의 부회장단 합류…“SK 최태원 제안”",https://n.news.naver.com/mnews/article/366/0000670172?sid=105,"김범수 카카오 이사회 의장과 김택진 엔씨소프트 대표이사. /카카오, 연합뉴스카카오 창업자인 김범수 이사회 의장과 김택진 엔씨소프트 대표이사가 최태원 SK회장과 함께 서울상공회의소에 합류하기로 했다.16일 대한상공회의소에 따르면 서울상의는 오는 23일 의원총회를 열고 김범수 의장과 김택진 대표를 서울상의 부회장으로 새로 임명할 예정이다. 카카오와 엔씨소프트 모두 기존 서울상의 회원사로 있었던 것은 맞지만 IT 기업인이 서울상의 부회장단에 합류하는 것은 이번이 처음이다. 이들은 차기 서울상의 회장으로 추대된 최태원 회장의 제안에 따라 서울상의 회장단 합류를 결정한 것으로 알려졌다. 최 회장도 같은 날 서울상의 의원총회에서 서울상의 회장으로 최종 선출될 예정이다. 서울상의 회장이 대한상의 회장까지 겸하는 관례에 따라 최 회장이 서울상의 회장으로 최종 선출되면 국내 4대 그룹 총수 중 처음으로 대한상의 회장을 맡게 된다.주요 대기업 인사들로 구성된 서울상의 부회장단은 서울상의 회장 추대를 비롯해 서울상의 주요 의사결정을 조율하고 결정하는 역할을 한다. 현재 서울상의 부회장단에는 이인용 삼성전자 사장, 권영수 LG 부회장, 공영운 현대자동차 사장, 현정은 현대그룹 회장, 서경배 아모레퍼시픽 회장 등이 있다.[박현익 기자 beepark@chosunbiz.com] ▶네이버에서 '명품 경제뉴스' 조선비즈를 구독하세요▶국제유가 오르자 수출입물가 2개월째 동반 상승▶환율 달러 당 1100원 밑도나	저작권자 ⓒ 조선비즈, 무단 전재 및 재배포 금지"
2021.02.16.,"카카오페이, 상반기 경력 공채…""세 자릿수 채용""",https://n.news.naver.com/mnews/article/003/0010346455?sid=101,"서류접수 22일부터 3월1일까지[서울=뉴시스] 최선윤 기자 = 카카오페이가 오는 22일부터 대규모 경력 공채를 시작한다고 16일 밝혔다.채용은 ▲서버 ▲안드로이드 ▲Front-End(웹 개발) 등 개발 직군 20개 부문과 각 서비스 PM(Product Manager)과 스태프를 비롯한 비개발 직군 12개 부문 등 총 32개 부문에서 동시 실시된다.카카오페이는 이번 경력 공채를 통해 세자릿수 채용을 목표하고 있다. 서류 접수는 22일부터 3월1일까지 총 8일이다. 카카오페이 공채 안내 페이지를 통해 지원 가능하다. 코로나19 확산 예방을 위해 전 면접은 원격으로 진행되며, 면접자는 자율적으로 원하는 장소에서 온라인으로 면접에 참여할 수 있다.카카오페이는 3년 근무 시 한 달 안식 휴가와 200만원 휴가비 지급, 영어·중국어 사내 어학교육 진행, 직장 어린이집 운영 등 다양한 복지 제도를 시행하고 있다.카카오페이 관계자는 ""올해 국내 대표 생활 금융 플랫폼인 카카오페이와 함께 성장하실 분들을 대규모로 영입할 계획""이라며 ""다양한 금융 영역에서 카카오페이와 혁신을 만들어 가고 싶은 분들의 많은 지원을 바란다""고 말했다.☞공감언론 뉴시스 csy625@newsis.com▶ 네이버에서 뉴시스 구독하기▶ K-Artprice, 유명 미술작품 가격 공개▶ 뉴시스 빅데이터 MSI 주가시세표 바로가기<ⓒ 공감언론 뉴시스통신사. 무단전재-재배포 금지>"
2021.02.16.,쿠팡 나비효과…카카오 이마트 날개,https://n.news.naver.com/mnews/article/009/0004749894?sid=101,"네이버·카카오 동반 최고가""쿠팡비해 네이버·카카오 싸다""2차전지 이어 플랫폼株 주목카카오 톡스토어 거래 4배로셀트리온 제치고 시총 8위로쓱닷컴 재평가 이마트 6%↑목표가 25만2천원 상승여력 쿠팡의 미국 뉴욕증권거래소(NYSE) 상장 나비효과로 국내 경쟁 기업인 네이버와 카카오가 모두 사상 최고가를 경신했다. 상장 예정인 쿠팡의 기업가치가 최대 55조원에 이를 것이라는 전망이 나오면서 네이버와 카카오가 싸게 느껴졌기 때문이다. 카카오는 셀트리온을 제치고 시가총액 순위(삼성전자 우선주 제외) 8위에 올랐다. 16일 네이버와 카카오는 전날에 비해 각각 2.2%, 2.39% 오른 39만4000원, 51만4000원에 마감했다. 네이버는 장중 40만원을 넘어섰고 카카오가 50만원을 넘는 등 나란히 사상 최고가를 기록했다. 국내 증시에서 삼성전자, SK하이닉스, LG화학에 이어 시총 4위 자리를 꿰찬 네이버에 이어 카카오도 이날 셀트리온을 제치며 8위 자리에 올라섰다. 네이버는 시총 3위인 LG화학을 가시권에 두게 됐다. 시가총액 10위 안에 오른 기업을 1~2년 전 시총 톱10 기업과 비교해 보면 코로나19를 계기로 산업 구조가 성장 산업을 중심으로 급속하게 재편되고 있다는 사실을 확인할 수 있다. 금융투자 업계에서는 쿠팡의 미국 상장을 계기로 국내 증시에서 관련 업종 대표주에 대한 가치 평가를 다시 해야 한다는 목소리가 힘을 얻고 있다. 대표적인 종목으로 이커머스 사업을 하는 네이버와 카카오로 대표되는 인터넷 플랫폼주가 꼽힌다.네이버와 카카오의 커머스 사업은 쿠팡의 주요 사업인 이커머스 사업과 비교해 이전보다 높은 가치를 받아야 한다는 의견이 많다. 이베스트투자증권에 따르면 네이버와 카카오의 커머스 사업 가치는 쿠팡의 상장 시 기업가치(300억~500억달러), 상장 시장의 차이 등을 감안해 각각 13조5000억원, 7조6000억원으로 추정된다. 이 경우 네이버와 카카오의 전체 기업가치는 각각 83조7743억원, 58조4502억원으로 예상된다. 성종화 이베스트투자증권 연구원은 ""쿠팡의 뉴욕증권거래소 상장이 네이버와 카카오의 커머스 부문 가치 재평가 기회를 줬다""며 ""네이버와 카카오 목표주가를 각각 51만원, 66만원으로 11%, 10% 올린다""고 말했다. 카카오의 경우 주요 사업 중 비중이 가장 큰 톡비즈니스(광고&커머스·21%)에 대한 기대감이 크다. 하이투자증권에 따르면 톡스토어 수는 올해 전년비 72% 늘고, 거래액은 292% 증가할 것으로 예상된다. 김민정 하이투자증권 연구원은 ""커머스 사업의 주요 키워드인 이용자 수, 구매 빈도, 구매 단가 모두 호조세를 보이고 있어 향후 성장 여력이 높을 것""이라며 ""톡비즈니스 매출 성장률 가이던스 50%는 무난히 달성 가능할 전망""이라고 말했다.인터넷 플랫폼주 외에 온라인 식품시장의 강자인 이마트도 재평가 종목으로 꼽힌다. 박은경 삼성증권 연구원은 ""쿠팡 시총을 이마트에 대입해보면 현재 5조원의 시총은 쓱닷컴 가치를 온전히 담지 못한다""며 ""주가 재평가가 필요하다""고 말했다. 이마트의 전체 기업가치는 7조원에 달해야 하며 이 경우 목표주가가 25만2000원으로 주가 상승 여력이 있다는 설명이다. NH투자증권도 이날 쿠팡의 상장이 이커머스 산업을 확대하는 계기가 됐다며 이마트를 주목해야 한다는 의견을 제시했다. 이지영 NH투자증권 연구원은 ""국내에서 살아남을 만한 상장 유통기업으로 이마트를 추천한다""며 ""쓱닷컴은 쿠팡과 유사한 B2C(기업·소비자 간 거래)를 기반으로 한 플랫폼으로 향후 5년 내 하루 배송 물량을 3배 확대하겠다는 계획을 갖고 있으며 쿠팡의 밸류에이션 적용 시 쓱닷컴의 적정 가치는 3조~5조원 사이로 추정된다""고 말했다. 이날 이마트는 전날에 비해 6.18% 오른 18만9000원에 마감했다. 종가 기준으로 2019년 1월 이후 가장 높은 수준이다.[김기철 기자 / 강봉진 기자]▶ '경제 1위' 매일경제, 네이버에서 구독하세요▶ 이 제품은 '이렇게 만들죠' 영상으로 만나요▶ 부동산의 모든것 '매부리TV'가 펼칩니다[ⓒ 매일경제 & mk.co.kr, 무단전재 및 재배포 금지]"
2021.02.16.,"카카오쇼핑라이브, 17일부터 이틀간 인기 가전 이벤트",https://n.news.naver.com/mnews/article/003/0010347325?sid=101,"[서울=뉴시스] 이진영 기자 = 카카오커머스의 라이브 커머스 플랫폼 ‘카카오쇼핑라이브’가 봄 신학기, 이사 철을 맞이해 인기 가전들을 활용한 라이브 커머스 방송을 진행한다고 16일 밝혔다. 이번에 준비한 라이브 커머스 상품은 총 3가지로, LG전자의 노트북과 가정용 빔프로젝터 시네빔 그리고 인기 주방 가전인 ‘발뮤다’이다. 카카오쇼핑라이브는 봄 시즌이 다가옴에 따라 신학기/이사 등으로 가전 상품에 대한 고객 수요가 늘어날 것으로 예상해 해당 상품들을 선보이게 됐다.우선 19일 19시 30분부터 21시까지 LG전자의 대표 노트북인 ‘2021년형 Gram 신제품’ 10종을 판매한다. 해당 상품들은 카카오쇼핑라이브만의 특별한 혜택이 더해진 단독 구성으로 선보여지는 것이 특징이다.방송을 통해 상품을 구매한 고객에 한해 특별한 사은품도 준비해 14인치와 17인치 모델을 구매한 고객에게는 ‘UFS 카드(128gb)’, ‘스마트폰 그립톡’ 등을 증정하며, 16인치 모델 구매 고객에게는 ‘UFS 카드’, ‘스마트폰 그립톡’, ‘카네이테이X그램 콜라보 노트북 파우치’를 제공한다.또한, 구매 고객 대상 경품 추첨 이벤트도 진행해 ‘샘소나이트 willo 백팩(2명)’, ‘블루투스 스피커(LG 엑스붐고 PK7, 3명)’, ‘MS Office H&S 2019(10명)’, ‘왓챠 3개월 구독권(30명)을 증정한다.20일 19시 30분부터 21시까지는 대화면 시청 기기인 ‘시네빔’ 상품을 활용한 라이브 커머스 방송을 진행한다. 언제 어디서나 고화질 대화면으로 영상을 시청할 수 있는 장점이 있는 ‘시네빔’은 최근 코로나로 인해 집콕족이 늘어나며 소비자들의 많은 관심을 받고 있다.이번에 판매하는 상품은 총 3가지로, 방송을 통해 상품을 구매한 고객에 한해 전 제품 8만 원 상당의 사은품을 증정하며, 방송 중 상품을 구매한 고객을 위한 경품 이벤트도 진행한다.이 밖에 17일 19시 30분부터 21시까지는 다가오는 봄 이사 철을 맞이해 발뮤다 인기 주방 가전을 활용한 방송을 진행해 발뮤다의 가전 상품들을 최대 42% 할인 판매한다. 발뮤다 토스터 구매 고객에게는 7만원 상당의 사은품(트레이/마그넷 컵)을 증정한다.카카오커머스 관계자는 ""신학기, 이사 등의 이벤트가 다가오는 봄 시즌을 맞이해 관련 상품들을 활용한 라이브 커머스 방송을 준비했다""며 ""앞으로도 시즌에 맞는 상품과 이벤트를 선보여 고객들에게 새로움을 전달할 수 있는 라이브 커머스를 선보일 것""이라고 말했다.☞공감언론 뉴시스 mint@newsis.com▶ 네이버에서 뉴시스 구독하기▶ K-Artprice, 유명 미술작품 가격 공개▶ 뉴시스 빅데이터 MSI 주가시세표 바로가기<ⓒ 공감언론 뉴시스통신사. 무단전재-재배포 금지>"
2021.02.16.,"""카카오 全가족이 연결해 함께 쓰는 '빅데이터 호수' 만들겠다""",https://n.news.naver.com/mnews/article/015/0004500003?sid=105,"한국의 AI 혁명가들 (3) 최동진 카카오엔터프라이즈 AI기술실장""AI를 더해 새로운 가치 창출""100여 자회사 데이터 한데 모아고객 정보 활용 '시너지' 기대 코딩 몰라도 되는 AI생태계 조성최동진 카카오엔터프라이즈 AI기술실장이 지난 8일 경기 판교 카카오 오피스에서 한국경제신문과 인터뷰하고 있다. 김범준 기자 bjk07@hankyung.com‘엔터프라이즈 호.’ SF영화에 관심 없는 사람이라도 들어봤을 이름이다. 미국의 유명 드라마 ‘스타트렉’ 시리즈의 우주선이다. “아무도 밟지 않은 곳을 과감히 밟아보는 것”이 엔터프라이즈 호의 임무다. 회사 구성원들이 머리를 맞대 고른 사명이 ‘엔터프라이즈’. ‘모든 것에 AI를 더해 새로운 가치를 창조한다’를 슬로건으로 정했다. 최동진 카카오엔터프라이즈 AI기술실장(부사장·46)은 이 새로운 모험의 ‘1등 항해사’다. ‘선택과 집중’으로 갈고닦은 카카오 AI“카카오가 구글을 이겼다.”지난 8일 경기 카카오 판교 사옥에서 만난 최 부사장은 나직한 말로 자랑스러운 기록 하나를 공개했다. 카카오엔터프라이즈 출범 3개월 만인 2020년 2월, 미국 예일대가 주최한 스파이더 챌린지(SPIDER Text-to-SQL Challenge)에서 60.6점을 기록하며 2등을 차지한 것이다.구글, 아마존, 세일즈포스 등 해외 유명 기업들과 텔아비브대 연구팀, 싱가포르 국립대 연구팀을 제친 결과다. 카카오프렌즈 캐릭터에서 이름을 딴 ‘라이언SQL v2’ 기술에 대해 최 부사장은 ‘선택과 집중’의 결과라고 설명했다. 그는 “카카오의 AI 기술을 얼굴 인식과 대화처리 영역 등에서 뾰족하게 갈고닦았다”고 했다.카카오가 2위를 기록한 스파이더 챌린지는 자연어의 형태로 사용자가 질문했을 때 기업 내 각종 데이터베이스를 효율적으로 검색하는(NLI2DB: natural language interface to databases) 알고리즘 대회다. 카카오는 복잡한 SQL 언어 대신 자연어의 형태로 보다 쉽게 데이터베이스를 관리할 수 있게 됐다고 설명했다.카카오는 자연어처리뿐 아니라 안면인식 분야에서도 세계 ‘톱 클래스’를 자랑한다. 미국국립표준기술연구소(NIST)가 주관한 안면인식 공급업체 테스트(FRVT: face recognition vendor test)에서 지난해 3월 세계 3위를 기록했다. 비자 사진, 상반신 사진, 실생활 환경에서 촬영된 얼굴 사진 등에서 두 사진을 놓고 동일인 여부를 판별하는 AI 기술을 인정받은 것이다.안면인식을 비롯한 지난해 연구 결과는 26건의 논문으로 엮여 최고 권위의 국제 학회지에 공개됐다. 최 부사장은 “과거에는 사람의 얼굴을 카메라가 인식하기 위해선 잠시라도 카메라 앞에 가만히 서 있는 시간이 필요했다. 그러던 것이 이제 카카오가 개발한 기술을 사용하면서 사람이 카메라를 인식하지 않고 스쳐 지나가도 인식되는 수준으로 진화했다”고 설명했다. MS 출신 등 세계적 ‘인재 뱅크’로카카오엔터프라이즈가 해외 유수 챌린지에서 잇따라 성과를 내면서 인재들의 합류도 이어졌다. 현재 카카오엔터프라이즈에 승선한 선원은 800명 정도다. 최근에는 마이크로소프트에 있던 개발자도 합류했다.해외와 비교해 부족한 데이터는 약점이다. 최 부사장은 “중국은 안면인식 기술을 정부 차원에서 중점적으로 지원한다. AI 개발에선 학습이 중요한데 중국 기업들은 한 업체에서 수십억 건의 얼굴 사진을 수집한다. 한국에서는 현실적으로 그 정도 데이터를 모을 수가 없다”고 했다.최 부사장은 ‘카카오 데이터 레이크(Lake)’를 통해 극복하겠다고 했다. 그는 “카카오 자회사가 100개가 넘는다”고 했다. 굵직한 것만 언급하면 카카오모빌리티, 카카오게임즈, 카카오페이. 카카오커머스, 카카오인베스트먼트 등이다. 대부분 온라인 기반 회사다. 데이터를 실시간으로 주고받을 수 있다는 것이 다른 회사들과의 차별점이라고 설명했다.최 부사장은 “데이터를 익명화하는 기술은 많이 발전했다. 규정과 절차를 따라 카카오에서 관리하는 데이터를 한군데로 모을 수만 있다면 다양한 활용이 가능해지고, 엄청난 시너지가 창출될 것”이라고 내다봤다.카카오엔터프라이즈가 긴 항해 도중 만나게 될 세상은 어떤 모습일까. 그는 ‘AI를 모르는 사람도 쓸 수 있는 AI’를 꼽았다.“‘AI as a Service(AIaaS)’라는 개념이 있어요. AI를 하나의 상품이나 서비스처럼 사용하는 겁니다. 코딩을 모르는 사람도, AI를 전혀 모르는 사람도 바로 쓸 수 있도록 계속 발전시키면서 AI 생태계의 저변을 넓히는 게 궁극적인 목표입니다.”■ 최동진 실장은…△1975년생△KAIST 전산학과 학·석·박사△다음커뮤니케이션 멀티미디어기술팀△카카오엔터프라이즈 AI랩 팀장△현 카카오엔터프라이즈 AI기술실장·부사장김진원 기자 jin1@hankyung.com▶ 경제지 네이버 구독 첫 400만, 한국경제 받아보세요▶ 한경 고품격 뉴스레터, 원클릭으로 구독하세요▶ 한국경제신문과 WSJ, 모바일한경으로 보세요 ⓒ 한국경제 & hankyung.com, 무단전재 및 재배포 금지"
