기사날짜,기사제목,네이버 뉴스 url,기사내용
2021.02.11.,“코로나 끝나면” 학생들 질문에…文 “마스크 벗고 ‘만세’ 외칠래요”,https://n.news.naver.com/mnews/article/022/0003551657?sid=100,"문재인 대통령, 11일 배우 류준열 등 ‘국민 8인’과 영상통화    문재인 대통령이 11일 오전 설 명절을 맞아 국민과 영상통화를 하고 있다. 연합뉴스     문재인 대통령은 11일 설을 맞아 예비 중학생들과 진행한 영상통화에서 신종 코로나바이러스 감염증(코로나19)이 종식되면 마스크를 벗고 ‘만세’를 외치고 싶다는 바람을 나타냈다.   코로나19 방역조치로 헬스장 운영에 어려움을 겪는 양치승 관장에게는 자영업자들의 어려움을 덜도록 많은 노력을 기울이겠다고 약속했다.   ‘에코브리티(에코와 셀러브리티의 합성어)’로 활동 중인 배우 류준열에게는 지명도와 인기가 있는 이들이 환경보호 활동에 앞장선다면 사회 변화에 큰 영향을 줄 수 있을 것이라고 응원했다.   청와대에 따르면 문 대통령은 이날 오전 9시55분부터 60분간 국민 8인과 카카오톡의 ‘페이스톡’ 기능을 활용한 영상통화를 진행했다. 앞서 언급한 류준열 등 외에 여자축구선수 지소연, 안광훈 신부, 배우 이소별과도 인사를 나눴다.   문 대통령은 코로나19 치료를 받은 후배의 등교에 응원 플래카드 등으로 훈훈한 감동을 선사한 강보름·신승옥·김예지 양과의 통화에서 “병에서 나은 후배들이 거리감 없이 학교생활을 할 수 있도록 배려하는 마음이 어른들에게 감동을 줬다”며 고마워 한 뒤, “코로나를 이겨내려면 어떻게 노력해야 한다고 생각하느냐”고 물었다.   그러자 강 양 등은 “방역수칙을 잘 지키고 마스크를 잘 써야 한다”고 답했다.   서로 배려하고 방역수칙 잘 지키는 게 ‘코로나를 이기는 길’이라면서, 문 대통령은 “대통령 할아버지에게 질문하고 싶은 것이 있나요”라고도 물었다.   이에 세 학생은 1년여 남은 임기를 언급하며, 어떤 일을 앞으로 더 열심히 하고 싶은지 질문을 던졌다.   이 같은 물음에 문 대통령은 “코로나를 빨리 극복하고, 어려운 경제도 회복시켜야 한다”며 “불평등을 해결하는 데 가장 큰 노력을 기울이려 한다”고 답했다.   특히 “코로나 때문에 오랫동안 놀러 다니지 못했는데, 코로나가 끝나면 무엇을 가장 하고 싶으시냐”고 묻자, 문 대통령은 “정말로 마스크 벗어던지고 ‘만세’ 하고 한 번 불러보고 싶다”고 바람을 드러냈다.   그러면서 “중학교 과정은 독립적·주체적 인간으로 성장하는데 매우 중요한 과정”이라면서 “공부뿐 아니라 친구들도 사귀고 다양한 경험을 많이 해보길 바란다”고 세 학생을 응원했다.      문재인 대통령이 11일 오전 설 명절을 맞아 국민과 영상통화를 하고 있다. 연합뉴스     문 대통령은 이어진 양 관장과의 통화에서는 “예능프로그램에서 소상공인, 자영업자들에게 희망을 많이 전해주셨는데, 고생하시는 분들에게 응원 말씀 한 마디를 해 달라”고 부탁했다.   평소 예능 프로그램에서 밝은 이미지를 전해왔던 양 관장은 “모두 다 힘들기 때문에 주변 사람 챙기면서 이걸 어떻게 이겨나가느냐를 생각해야 한다”며 “힘내서 웃으며 행복하게 살면 좋겠다”고 긍정적인 메시지를 내놨다.   양 관장의 말에 문 대통령은 “정부도 그 어려움을 덜어드릴 수 있도록 많은 노력을 할 것”이라고 약속했다.   류준열과의 통화는 ‘환경 문제’에 초점이 맞춰졌다.   문 대통령은 “그린피스 활동을 하던데 환경생태에 관심을 갖게 된 동기가 있느냐”며 물었고, 류준열은 “아프리카에서 만났던 자연에 감동을 받아 어떻게 하면 후손들에게 물려줄지 고민을 많이 했다”고 답했다.   이에 문 대통령은 “탄소중립과 플라스틱 폐기물 줄이기는 전 세계의 과제”라며 “지명도와 인기가 있는 분들이 앞장선다면 사회 변화에 영향을 줄 것”이라고 향후에도 선한 영향력의 발휘를 부탁했다.   잉글랜드 여자슈퍼리그(FAWSL)의 ‘첼시FC 레이디스’ 소속인 지소연에게는 “국민이 기뻐할 소식과 희망을 주시길 바란다”며 “몸은 떨어져 있어도 마음은 가까이 있는 설이 되길 바란다”는 메시지를 건넸고, 약자와 저소득층을 위한 헌신으로 우리나라에 온지 54년 만인 지난해 ‘한국 국적’을 취득한 뉴질랜드 출생 안광훈 신부에게는 “앞으로도 사회에 선한 일을 많이 펼쳐주시길 바란다”고 전했다.   지난해 광복절 경축식에서 수어(手語)로 애국가를 불렀던 후천성 청각장애인이자 배우 이소별과의 통화에서는 예술인들이 하루 빨리 관객들과 호흡할 수 있게 노력하겠다면서, “꿈을 펼치는데 장애가 걸림돌이 되지 않는 사회를 만들도록 노력하겠다”고 약속했다.   김동환 기자 kimcharr@segye.comⓒ 세상을 보는 눈, 세계일보"
2021.02.11.,"공정위, 우버·티맵 합작 회사 설립 승인",https://n.news.naver.com/mnews/article/005/0001410433?sid=101,"“경쟁제한 우려 없다”… 4월 서비스우버 택시 차량 모습. 우버코리아 제공공정거래위원회가 10일 미국 차량 공유서비스 ‘우버’와 SK 계열 ‘티맵모빌리티’의 합작사 설립을 승인했다. 우버는 지난해 10월 티맵모빌리티와 함께 국내에서 차량 호출 서비스를 할 회사를 지분율 51(우버)대 49(티맵모빌리티)로 설립한다는 내용의 기업결합 신고서를 공정위에 냈다.공정위는 국내 차량 호출 서비스 시장을 중심으로 기업결합의 경쟁제한 여부를 심사한 결과 경쟁제한 우려가 없다고 판단해 지난달 28일 심사결과를 회신했다고 밝혔다.공정위는 “결합 전후 국내 차량 호출 서비스 시장의 시장 집중도 변화가 크지 않고 일반 택시로부터의 경쟁 압력도 존재한다”고 판단했다. 경쟁압력이란 일정 분야에서 일정한 경쟁관계가 형성되면서 기술 개발과 가격 인하를 유도하는 선순환 구조를 말한다.또 두 회사의 결합을 통해 택시 공유서비스 시장의 강력한 1위 사업자인 카카오T에 대한 실질적인 경쟁압력이 증진될 수 있다는 점도 고려했다.새로운 합작사는 우버와 티맵모빌리티로부터 차량 호출 서비스를 이전받을 계획이다. 티맵모빌리티는 SKT로부터 이전받은 티맵 지도 서비스도 제공한다. 우버와 티맵모빌리티 합작사는 오는 4월 정식 서비스를 출시할 계획이다.세종=신재희 기자 jshin@kmib.co.kr▶ 네이버에서 국민일보를 구독하세요(클릭)▶ 국민일보 홈페이지 바로가기GoodNews paper ⓒ 국민일보(www.kmib.co.kr), 무단전재 및 수집, 재배포금지"
2021.02.11.,“코로나 끝나면” 학생들 질문에…文 “마스크 벗고 ‘만세’ 외칠래요”,https://n.news.naver.com/mnews/article/022/0003551657?sid=100,"문재인 대통령, 11일 배우 류준열 등 ‘국민 8인’과 영상통화    문재인 대통령이 11일 오전 설 명절을 맞아 국민과 영상통화를 하고 있다. 연합뉴스     문재인 대통령은 11일 설을 맞아 예비 중학생들과 진행한 영상통화에서 신종 코로나바이러스 감염증(코로나19)이 종식되면 마스크를 벗고 ‘만세’를 외치고 싶다는 바람을 나타냈다.   코로나19 방역조치로 헬스장 운영에 어려움을 겪는 양치승 관장에게는 자영업자들의 어려움을 덜도록 많은 노력을 기울이겠다고 약속했다.   ‘에코브리티(에코와 셀러브리티의 합성어)’로 활동 중인 배우 류준열에게는 지명도와 인기가 있는 이들이 환경보호 활동에 앞장선다면 사회 변화에 큰 영향을 줄 수 있을 것이라고 응원했다.   청와대에 따르면 문 대통령은 이날 오전 9시55분부터 60분간 국민 8인과 카카오톡의 ‘페이스톡’ 기능을 활용한 영상통화를 진행했다. 앞서 언급한 류준열 등 외에 여자축구선수 지소연, 안광훈 신부, 배우 이소별과도 인사를 나눴다.   문 대통령은 코로나19 치료를 받은 후배의 등교에 응원 플래카드 등으로 훈훈한 감동을 선사한 강보름·신승옥·김예지 양과의 통화에서 “병에서 나은 후배들이 거리감 없이 학교생활을 할 수 있도록 배려하는 마음이 어른들에게 감동을 줬다”며 고마워 한 뒤, “코로나를 이겨내려면 어떻게 노력해야 한다고 생각하느냐”고 물었다.   그러자 강 양 등은 “방역수칙을 잘 지키고 마스크를 잘 써야 한다”고 답했다.   서로 배려하고 방역수칙 잘 지키는 게 ‘코로나를 이기는 길’이라면서, 문 대통령은 “대통령 할아버지에게 질문하고 싶은 것이 있나요”라고도 물었다.   이에 세 학생은 1년여 남은 임기를 언급하며, 어떤 일을 앞으로 더 열심히 하고 싶은지 질문을 던졌다.   이 같은 물음에 문 대통령은 “코로나를 빨리 극복하고, 어려운 경제도 회복시켜야 한다”며 “불평등을 해결하는 데 가장 큰 노력을 기울이려 한다”고 답했다.   특히 “코로나 때문에 오랫동안 놀러 다니지 못했는데, 코로나가 끝나면 무엇을 가장 하고 싶으시냐”고 묻자, 문 대통령은 “정말로 마스크 벗어던지고 ‘만세’ 하고 한 번 불러보고 싶다”고 바람을 드러냈다.   그러면서 “중학교 과정은 독립적·주체적 인간으로 성장하는데 매우 중요한 과정”이라면서 “공부뿐 아니라 친구들도 사귀고 다양한 경험을 많이 해보길 바란다”고 세 학생을 응원했다.      문재인 대통령이 11일 오전 설 명절을 맞아 국민과 영상통화를 하고 있다. 연합뉴스     문 대통령은 이어진 양 관장과의 통화에서는 “예능프로그램에서 소상공인, 자영업자들에게 희망을 많이 전해주셨는데, 고생하시는 분들에게 응원 말씀 한 마디를 해 달라”고 부탁했다.   평소 예능 프로그램에서 밝은 이미지를 전해왔던 양 관장은 “모두 다 힘들기 때문에 주변 사람 챙기면서 이걸 어떻게 이겨나가느냐를 생각해야 한다”며 “힘내서 웃으며 행복하게 살면 좋겠다”고 긍정적인 메시지를 내놨다.   양 관장의 말에 문 대통령은 “정부도 그 어려움을 덜어드릴 수 있도록 많은 노력을 할 것”이라고 약속했다.   류준열과의 통화는 ‘환경 문제’에 초점이 맞춰졌다.   문 대통령은 “그린피스 활동을 하던데 환경생태에 관심을 갖게 된 동기가 있느냐”며 물었고, 류준열은 “아프리카에서 만났던 자연에 감동을 받아 어떻게 하면 후손들에게 물려줄지 고민을 많이 했다”고 답했다.   이에 문 대통령은 “탄소중립과 플라스틱 폐기물 줄이기는 전 세계의 과제”라며 “지명도와 인기가 있는 분들이 앞장선다면 사회 변화에 영향을 줄 것”이라고 향후에도 선한 영향력의 발휘를 부탁했다.   잉글랜드 여자슈퍼리그(FAWSL)의 ‘첼시FC 레이디스’ 소속인 지소연에게는 “국민이 기뻐할 소식과 희망을 주시길 바란다”며 “몸은 떨어져 있어도 마음은 가까이 있는 설이 되길 바란다”는 메시지를 건넸고, 약자와 저소득층을 위한 헌신으로 우리나라에 온지 54년 만인 지난해 ‘한국 국적’을 취득한 뉴질랜드 출생 안광훈 신부에게는 “앞으로도 사회에 선한 일을 많이 펼쳐주시길 바란다”고 전했다.   지난해 광복절 경축식에서 수어(手語)로 애국가를 불렀던 후천성 청각장애인이자 배우 이소별과의 통화에서는 예술인들이 하루 빨리 관객들과 호흡할 수 있게 노력하겠다면서, “꿈을 펼치는데 장애가 걸림돌이 되지 않는 사회를 만들도록 노력하겠다”고 약속했다.   김동환 기자 kimcharr@segye.comⓒ 세상을 보는 눈, 세계일보"
2021.02.11.,설연휴 ‘이 게임’ 빠지면 섭하지,https://n.news.naver.com/mnews/article/018/0004851137?sid=105,"접속만 해도 혜택…연휴 다음 주까지 이벤트 마련[이데일리 이대호 기자] 게임업계가 설 연휴를 맞아 야심 차게 이벤트를 시작했다. 게임 속 세상은 이미 연휴가 한창이다. 접속만 해도 풍성한 혜택을 받을 수 있다. 연휴가 끝난 다음 주까지 이벤트를 이어가는 게임이 적지 않다.넥슨은 모바일·온라인게임 17종 이벤트를 연다. 업계 최대 규모다. ‘바람의나라: 연’에서는 세시마을 이벤트를 진행한다. 세시마을에 위치한 설날집에서 ‘떡국을 먹고싶어요’ 임무를 통해 ‘떡국’을 받아, 칠성당에 있는 백남인 NPC에게 주면 ‘설빔’을 획득 가능하다. ‘메이플스토리’에서는 오는 15일까지 ‘2021 설 인사하기’ 이벤트를 참여할 수 있다.넷마블(251270)은 게임 8종에서 이벤트를 진행한다. ‘세븐나이츠2’에선 오는 17일까지 레이드를 조건에 맞춰 플레이하면 한복을 입은 희귀 펫 ‘설빔샤이’를 증정한다. 24일까지 ‘설날 출석 이벤트’도 개최한다. ‘모두의마블’에선 16일까지 ‘설날 기념 복주머니 모으기 이벤트’를 즐길 수 있다. 이용자들은 무작위로 등장하는 복주머니를 모아 영광의 빛, 큐브, 캐릭터 등으로 교환할 수 있다.엔씨소프트(036570)는 ‘리니지M’에 마스터 던전 시즌2를 공개했다. ▲신화 등급 무기 ‘앨리스’의 제작 재료를 획득할 수 있는 ‘욕망의 동굴’ ▲신화 등급 아이템 ‘야히 세트’의 제작 재료를 획득할 수 있는 ‘그림자 던전(야히의 거처)’이 등장한다. ▲게임 내 재화로 구매할 수 있는 ‘설 맞이 선물 상자/까치의 선물 상자’ ▲기존 푸시 보상 2배 강화 및 설날 특별 아이템을 지급하는 ‘설 맞이 특별 푸시’ 등도 마련했다.엔픽셀은 연초 화제작 ‘그랑사가’에 첫 번째 신규 캐릭터 오르타를 추가했다. 오르타는 게임 내 처음으로 선보이는 빛 속성 캐릭터로 검객 콘셉트와 마법을 활용한 원거리 공격을 활용할 수 있다. 게임 내 ‘세뱃돈 이벤트’도 진행한다. 왕국퀘스트 완료 시 세뱃돈 아이템을 받을 수 있다. 이벤트 종료 시점의 보유 개수와 추첨을 통해 1000명에게 문화상품권 5만원권을 지급한다.카카오게임즈(293490)는 17일까지 ‘엘리온(ELYON)’에서 미션 복주머니 아이템 획득 후 이벤트 상인을 통해 원하는 아이템을 교환하는 이벤트를 진행한다. 보상은 한복 의상, 세공된 무기 및 방어구 강화석, 경험치 상승 및 회복 물약 등 이용자들이 선호하는 아이템으로 구성했다. 오는 13일까지 게임에 접속하는 모든 이용자에게 ‘발그레한 송아지 모자’ 외형 아이템을 선물로 증정한다. 14일 밸런타인데이 이벤트에선 접속 이용자에게 특별 칭호와 체력 회복 물약 아이템을 제공한다.컴투스(078340)는 모바일게임 5종에서 설맞이 이벤트를 진행한다. 21일까지 ‘서머너즈 워’에서 포인트를 획득하면 매일 ‘6성 영웅 등급 룬’과 ‘영웅 등급 타입 또는 속성 아티팩트’ 등으로 교환할 수 있는 이벤트를 진행한다. ‘컴프야2021’에선 17일까지 윷놀이 미션 이벤트를 마련해 미션 달성 결과에 따라 각종 게임 아이템을 비롯 최대 ‘100% 플래티넘팩’을 제공한다.라이엇게임즈는 18일 오후5시까지 리그오브레전드(LoL) 모바일 상점과 PC웹 LoL 상점에서 게임 내 재화인 파랑정수(BE)와 주황정수(RP)로 상품을 구매하면 추가 보상을 제공한다. 전략적팀전투(TFT)에선 14일까지 TFT 공식 페이스북을 팔로우하고 신규 시너지 한 가지와 함께 새해 소망을 댓글로 작성하면 참가할 수 있다. 발로란트에서도 14일까지 발로란트 공식 페이스북 이벤트 게시물에 획득한 VAL조각 스크린샷을 댓글로 인증하면 참여자 모두에게 VAL조각 500개를 추가 지급한다.이대호 (ldhdd@edaily.co.kr)▶ #24시간 빠른 #미리보는 뉴스 #eNews+▶ 네이버에서 '이데일리 뉴스'를 만나보세요▶ 빡침해소, 청춘뉘우스 '스냅타임'＜ⓒ종합 경제정보 미디어 이데일리 - 무단전재 & 재배포 금지＞"
2021.02.11.,[단독]“선물로 에어팟프로”…대놓고 리스트 공개 232% 껑충,https://n.news.naver.com/mnews/article/025/0003077049?sid=105,"[팩플]  카카오톡 커머스, 카카오톡 선물하기 서비스 이미지. [사진 카카오커머스]       사상 첫 비대면 설 명절을 앞두고 ‘이커머스(전자 상거래) 선물하기’ 시장이 폭발적으로 성장하고 있다. 특히, '명절 인사'란 관습은 유지하되, 주는 대로 받기보단 진짜 원하는 선물을 주고받는 게 합리적 소비라고 보는 문화가 확산하고 있다. 받고 싶은 선물을 위시리스트(wishlist·구매 희망목록)에 넣어두고 지인에게 공개하는 사람들도 급증했다. 그야말로 ‘명절 선물의 트랜스포메이션(대전환)’이다.       무슨 일이야     카카오톡 선물하기에서 받고 싶은 선물을 미리 골라 놓는 ‘위시리스트’가 인기다. 카카오톡 친구들에게 보여주는 '공개 리스트'와 사용자 본인만 보는 '비공개 리스트' 두 종류다. 지인들이 알고 사줬으면 하는 선물리스트를 별도로 관리하는 셈.  · 카카오커머스에 따르면 지난해 12월 한 달간 공개 리스트 상품 등록 건수는 전년 동기 대비 232% 증가했다. 비공개 리스트도 251% 늘었다.     · 위시리스트 등록 상품이 실제 구매까지 이어진 건수는 같은 기간 112% 증가했다. 친지·지인의 위시리스트를 참조해 선물을 구매하는 이용자가 늘고 있다는 의미.       · 이번 설 명절을 앞두고 위시리스트에는 다양한 품목들이 올라오고 있다. 이용자들이 받고 싶은 선물로 가장 많이 꼽은 품목 1위(2월 1~7일 기준)는 애플의 에어팟 프로(28만 6000원)였다. 2위는 기린이 모찌 바디필로우(2만9900원), 3위는 BHC 뿌링클+치즈볼+콜라 1.25L(2만4000원)다.       김재영 카카오커머스 선물하기 운영파트장은 “예전엔 받고 싶은 선물을 골라놓는 것에 대해 겸연쩍어하는 문화가 있었지만, 비대면 상황이 지속되다 보니 합리적으로 선물 교환하려는 욕구가 커졌다”며 “똑같은 선물을 여러 개 받느니 자기가 원하는 품목을 미리 골라놓는 이용자가 늘고 있다”고 설명했다.       위시리스트 선물 랭킹 그래픽=김주원 기자 zoom@joongang.co.kr       카톡, 명절 선물 급증     위시리스트 활성화에 힘입어 카카오톡 선물하기 거래액은 급증하고 있다. 설 연휴에도 5인 이상 모일 수 없게 되자, 미리 명절 선물을 보내려는 이들이 몰린 영향이다. 지난달 20~31일(설 연휴 시작 22일 전~11일 전) 카카오톡 선물하기의 거래액은 전년 동기(2020년 1월 2~13일)보다 53% 늘었다. 특히 그간 이커머스에 적극적이지 않았던 중장년층 유입 비중이 높다. 50대의 경우 104%, 60대는 111%가 늘었다. 지난해 추석에도 50~60대 소비자 거래액은 각각 130%, 129% 증가했다.      인기 선물 품목도 달라졌다. 밀키트·레스토랑간편식(RMR) 선물이 지난해 설보다 894% 늘었다. 한우세트(390%), 과일(189%), 건강식품(121%)도 증가했다. 신종 코로나바이러스 감염증(코로나19) 확산으로 집에서 손쉽게 끼니를 해결할 수 있는 선물을 고른 이들이 많아졌다는 의미다.     숫자로 본 카카오톡 선물하기 그래픽=김주원 기자 zoom@joongang.co.kr       이원재 카이스트 문화기술대학원 교수는 “최근 글로벌 설문조사 결과를 보면 서양의 경우 코로나19 이후 직장동료와 더 가까워졌다는 사람이 많은데 한국의 경우 별 차이가 없다”며 “한국은 그만큼 기존에도 타인과 충분히 가까웠기 때문“이라고 말했다. 이어 “카카오톡으로 명절 선물하기가 늘었다는 것은 기존에 명절 때마다 해왔던 선물 교환을 코로나19로 못 만나도 계속하고 있다는 뜻”이라며 “안 하던 사람이 선물을 더 하게 됐다기보단 원래 주던 선물을 이커머스로 하는 것”이라고 설명했다.    선물하기 왜 인기야   ① 통념 깬 코로나19 : 온라인쇼핑 확산의 강력한 허들(장애물)이 무너졌다. 물건을 직접 눈앞에서 볼 수 없다는 점은 코로나19 확산 이후 오히려 온라인 쇼핑의 장점으로 재평가됐다. 통계청에 따르면 2019년 135조원이었던 온라인쇼핑 거래액은 지난해 161조원으로 늘었다. 가장 많이 늘어난 분야는 음식서비스와 음·식료품 분야다. '음식이나 식재료는 반드시 맨눈으로 보고 사야 한다'는 습관이 강한 품목들이다. 지난해 12월 음식서비스 온라인 거래액은 전년 동기 대비 109.1%, 음·식음료품은 66.3% 늘었다.      온라인 쇼핑 거래액 그래픽=김주원 기자 zoom@joongang.co.kr      ② 10년간 씨앗 뿌린 카카오 : 선물하기는 카카오가 2010년 12월 출시한 서비스. 채팅창에서 고마운 감정을 전달하기 위해 나왔다. 현재까지 카카오톡 선물하기를 이용한 사람 수는 누적 3384만명이다. 선물하려면 만나거나 전화를 걸어 주소를 묻고 이유를 설명한 다음, 잘 받았는지 확인해야 했던 번거로움을 해결했다는 게 최대 강점으로 꼽힌다. 받을 사람 지정 후 결제만 하면 끝이다. 선물 받을 사람이 주소를 직접 입력하면 된다. 초창기 카카오톡 선물하기 품목은 케이크나 커피 같은 교환권 위주였지만 점차 배송상품으로 영역을 확대했다. 현재는 8000개 제휴사, 50만 종 이상 상품으로 늘었다. 지난해 12월 기준 선물하기 월간 활성 이용자 수(MAU)는 2173만명이다.    ③ 대세가 된 선물하기 : 기존 이커머스의 성공 공식은 최저가, 빠른 배송이었다. 그러나 선물하기는 지향점이 달랐다. ‘타인을 위한 모바일 쇼핑’인 만큼 가격과 배송기간보다 원하는 상품, 취향에 맞는 상품을 갖추는 데 주력해 새로운 시장을 열었다. 기존 이커머스 강자들도 속속 합류하는 중. 지난해 쿠팡, 티몬, 11번가 등도 선물하기 기능을 도입했다.      박민제 기자 letmein@joongang.co.kr    뜨는 기업 궁금하세요?          요즘 핫한 테크기업 소식을 입체적으로 뜯어보고 싶다면 → https://url.kr/qmvPIX     QR코드를 찍으면 팩플 구독 신청을 할 수 있습니다.   ▶ 네이버 구독 첫 500만 중앙일보 받아보세요▶ 넌 뉴스를 찾아봐? 난 뉴스가 찾아와!▶ 중국·러시아 백신 온다면 접종하시겠습니까ⓒ중앙일보(https://joongang.co.kr), 무단 전재 및 재배포 금지"
