기사날짜,기사제목,네이버 뉴스 url,기사내용
2021.02.28.,'라인+야후재팬' 경영통합 'A홀딩스' 내일 출범…日 최대 인터넷사 등극,https://n.news.naver.com/mnews/article/003/0010367769?sid=101,"당일 일본 현지에서 오후 4시30분께 기자간담회 개최【서울=뉴시스】이해진(왼쪽) 네이버 글로벌투자책임자(GIO)와 손정의(오른쪽) 일본 소프트뱅크 회장[서울=뉴시스] 이진영 기자 = 일본의 국민 메신저 라인(LINE)과 최대 포털 야후재팬이 한 몸으로 내달 1일 출항한다. 일본 최대 인터넷사로서 인공지능(AI), 커머스, 테크핀, 콘텐츠 등 양사가 어떤 시너지를 낼지는 물론 향후 미국과 중국의 거대 인터넷 기업과 어떻게 맞설지 주목된다. 28일 IT 업계에 따르면 네이버(라인의 모회사)와 소프트뱅크(야후재팬을 운영하는 Z홀딩스의 모회사)가 라인과 Z홀딩스의 경영통합(신생 Z홀딩스)을 완료하고 그 지주사인 'A홀딩스'가 내달 1일 출범한다. 이에 맞춰 양사는 한국시각으로 출범 당일 오후 4시 30분께 일본 현지에서 라인과 Z홀딩스 경영통합 기자간담회를 개최한다. 양사의 구체적인 계획이 얼마나 공개될지 이목이 집중된다.   앞서 한국 최대 인터넷기업 네이버의 일본 자회사 라인은 지난 2019년 11월 야후재팬을 운영하는 소프트뱅크 소유의 Z홀딩스와 경영통합을 추진하겠다고 발표했다. 이어 두 회사의 경영통합은 지난해 8월 일본 공정거래위원회에서 합병 승인을 받았다.A홀딩스는 A부터 Z까지 그룹 전체 기업이 함께 시너지를 내고, 전 기업이 인공지능(AI) 활용에 집중하고, 초기에는 아시아(Asia)에서 사업을 전개한 후 전세계로 사업을 확장한다는 뜻을 담고 있다. A홀딩스 지분은 소프트뱅크와 네이버가 각각 50% 나눠갖는다. A홀딩스가 Z홀딩스의 지분 65%를 보유한 지주회사가 된다. 중간지주사 격인 Z홀딩스 밑에 라인과 야후재팬이 각각 100% 자회사가 되는 구조다.A홀딩스는 공동대표 체제로 네이버 창업자인 이해진 글로벌투자책임자(GIO)와 미야우치 켄 소프트뱅크 최고경영자(CEO)가 이끈다. 또 A홀딩스 회장은 이해진 GIO, 사장과 이사회 의장은 미야우치 겐 CEO이다.라인과 야후재팬 일본 내 실사용자를 단순 합산하면 1억5000만명이 넘는다. 한국으로 치면 카카오와 네이버를 합친 위력인 셈이다. 이들은 간편결제를 포함해 인공지능(AI), 커머스, 테크핀, 광고 등 일본 최대 인터넷 비즈니스 생태계를 구축할 것으로 예상된다.더 나아가 미국·중국의 거대 인터넷 기업과 맞서 글로벌 공략에도 속도를 낼 것으로 전망된다. 실제 이 GIO는 2019년 6월 5년 만의 공개 행사에서 ""세계는 지금 시가총액 천조대의 기업이 역사상 처음으로 탄생한 인터넷 제국주의 시대""라며 ""네이버가 삼별초(세계 최강의 몽골군에 맞서 싸운 고려시대 특별부대)처럼 거인들에 저항해 버텨 살아남은 회사라는 말을 우선적으로 듣고 싶다""라고 언급하기도 했다.내달 1일 경영통합 간담회에 이어 이 GIO가 2주후쯤에 글로벌 공략 계획을 구체화해 공개할 것으로 예상된다.이 GIO는 지난 25일 전 직원 대상으로 온라인으로 개최된 '컴패니언 데이'에서 향후 투자 전략에 대한 질문을 받고 ""사업을 위해 재무적 투자가 아닌 전략적 투자를 중심으로 늘 고민한다""며 ""투자 등 글로벌 도전 전략에 대해서는 우리 약 2주 후에 만나자""라고 답한 바 있다.☞공감언론 뉴시스 mint@newsis.com▶ 네이버에서 뉴시스 구독하기▶ K-Artprice, 유명 미술작품 가격 공개▶ 뉴시스 빅데이터 MSI 주가시세표 바로가기<ⓒ 공감언론 뉴시스통신사. 무단전재-재배포 금지>"
2021.02.28.,"'무료지원', 복지넷·복지로 맞춤형복지포탈 관심자의 자기계발 돕는 심리상담사자격증 제공",url없음,<네이버 기사 없음>
2021.02.28.,"강아지분양 ""미유펫 인천점"", 자체병원을 통한 건강검진 무료행사 실시",url없음,<네이버 기사 없음>
2021.02.28.,관뚜껑 덮기 전 '은전 한 닢' 행복을 알 수 있을까,https://n.news.naver.com/mnews/article/047/0002303860?sid=103,"행복감은 비축되지 않는다... 동전 한 닢 움켜 잡지말고 사용하고 베풀자【오마이뉴스의 모토는 '모든 시민은 기자다'입니다. 시민 개인의 일상을 소재로 한 '사는 이야기'도 뉴스로 싣고 있습니다. 당신의 살아가는 이야기가 오마이뉴스에 오면 뉴스가 됩니다. 당신의 이야기를 들려주세요.】[김태용 기자]              ▲  행복의 기준은 '언젠가'가 아니라 '지금'이 되어야 한다. 언제 녹을지 걱정하지 말자.            ⓒ 김태용   그동안 '행복'을 위해 달려왔다. 우리 모두 행복을 쟁취하기 위해 애면글면했을 것이다. 마흔이 돼서 그런 걸까. 요사이 부쩍 '행복은 무엇인가'라는 철학적 질문을 자신에게 한다. 아무리 생각해도 정답이 없다. '헛되고 헛되다'라는 지혜의 왕 솔로몬의 말처럼, 행복조차 헛된 건 아닐까.일본에는 이런 속담이 있다. ""사람의 행복과 불행은 관뚜껑을 덮기 전까지 모른다."" 결국, 죽어야 행복을 알 수 있나 보다. 인류 역사를 돌아보면, 수많은 철학자도 행복에 대해 명쾌한 답 하나 내놓지 못하고 조용히 관뚜껑을 덮으셨다. 행복은 갓 마흔이 된 나에게 추상적인 거대 담론이다.그간 내가 찾아 누렸던 행복을 정의하면, '은전 한 닢'이라 하겠다. 고(故) 피천득 선생 수필 속에서 늙은 거지는 벽돌 담 밑에 쪼그리고 앉아서 은전을 손바닥에 놓고 보고 또 본다. 그 은전은 거지가 여섯 달 동안 구걸하며 먹지도 않고 간신히 손에 쥔 것이다.피천득은 거지에게 묻는다. ""왜 그렇게까지 애를 써서 그 돈을 만들었단 말이오? 그 돈으로 무얼 하려오?"" 거지는 대답한다. ""(단지) 이 은전 한 개 갖고 싶었습니다."" 거지의 뺨에는 눈물이 흐른다.가끔 아내는 무언가 가지기 위해 바동거리는 내가 처량해 보이나 보다. 나에게 같은 질문을 던진다. ""왜 그토록 애를 써서 가지고 싶어 해?"" 아내에게 답한다. ""가지면 행복할 것 같아."" 한참 후, 원하던 것을 겨우 가진 나에게 아내는 묻는다. ""행복해?"" 선뜻 답하지 못한다. '은전 한 닢'을 손에 쥔 거지 모습이 나에게 보여서다.그토록 원하던 바를 이루고 나면, 행복은 잠시다. 잠시나마 만족할 뿐, 또다시 불만이 나온다. 어릴 땐 자동차가 있는 친구가 부러웠다. 겨우 저축해서 소형 중고차를 장만했다. 새 차가 눈에 들어왔다. 열심히 돈을 모았다. 공장에서 갓 나온 중형차를 받은 날 기뻤다. 그러나 곧 외제 차를 타고 다니는 사람이 행복해 보이는 이유는 뭘까.이런 나에게 정철 카피라이터는 이렇게 말해줬다. ""올림픽 은메달. 지구 위 70억 인구 중 무려 2등. 그런데 금메달 놓쳤다고 꾸중하는 기사를 봤어. 욕심은 한이 없지. 지금 내가 손에 쥔 것에 만족할 줄 알아야 비로소 행복에 가까워진다는 얘기. 행복의 반대말은 불만.""행복에 대한 정답은 아니지만, 세 가지 명확한 사실을 발견했다. 첫째, 행복은 언제나 현재진행형이다. 행복은 창고에 쌓아둔 비상식량처럼 비축할 수 없다. 행복의 기준은 '언젠가'가 아니라 '지금'이다.또 미래의 행복에 집착하면 염려가 생긴다. 내일이 불안한 사람치고 행복한 사람 보질 못했다. 그러나 우린 미래를 걱정하며 현재의 행복을 유예하는 데 익숙하다. 대입을 위해 학창 시절 재미를 미룬다. 취업을 위해 대학 생활 낭만을 유보한다. 요즘은 노후를 위해 젊은 시절 즐거움도 보류한다. 미국에서 운동을 배운 적이 있다. 가장 많이 들었던 말이 ""즐겨라(Enjoy)""다. 코치는 제대로 된 자세를 가르쳐주지 않았다. 신기한 건 즐기니까 실력이 늘었다. 실력이 느니 또 즐거웠다. 지금을 즐길 줄 아는 미국인들의 삶의 방식을 살짝 엿봤다.둘째, 행복은 '강도'보다 '빈도'가 중요하다. 어쩌다 떨어지는 벼락같은 짜릿한 행복보다는, 잔잔하게 뛰는 심장 박동 같은 행복이 훨씬 낫다. 게다가 행복감은 한계효용 체감의 법칙이 완벽하게 적용된다. 행복감이 일정 수준에 도달하면 더는 증폭되지 않는다. 오히려 감소한다.백영옥 작가는 <안녕, 나의 빨강머리 앤> 책에서 이렇게 말한다. ""우리는 행복이 '크기'가 아닌 '빈도'라는 명제를 끌어낼 수 있다. 큰 행복을 기다리느라 자잘한 행복을 놓쳐선 결코 안 되는 것이다"" 그렇다. '자잘한 행복'을 무시하면 안 된다.일본 작가 무라카미 하루키도 <랑게르한스 섬의 오후>에서 '소확행(소소하지만 확실한 행복)'을 언급했다. 서랍 안에 반듯하게 정리된 옷을 볼 때, 햇살 가득한 날 편하게 앉아 커피를 마실 때 느끼는 작은 즐거움이 바로 소확행이다. 요즘 나는 자잘하게 글을 쓰면서 '소확행'을 느낀다.행복은 이를 악물고 악착같이 이뤄야 하는 목표가 아니다. 행복은 하나의 도구다. 일상을 윤택하게 하는 수단이라고 생각하자. 소소한 일상이 모여 삶이 된다. 길에 있는 꽃을 보자. 친구들과 노닥거리자. 잠이 쏟아지면 자자. '해야 하는 것' 말고 '하고 싶은 것'을 생각해보자.마지막으로 행복은 '관계'에 의해 좌우된다. 물론 돈, 직업, 명예도 중요하다. 그러나 이것들은 바닷물과 같다. 마시면 마실수록 더욱 목이 마른다. 우리는 사회적 동물이다. 사람들과 관계를 맺고 서로 영향을 주며 살아간다. 태어날 때부터 부모와 관계를 맺는다. 살아가면서 친구, 동료, 배우자, 자녀 등 수많은 사람과 상호작용을 주고받으며 산다.사람들과 어울림 속에서 어떤 사람이 되어야 할까. 오스카 와일드 작가가 여기에 답을 줬다. ""어떤 이들은 가는 곳마다 행복이 되고, 어떤 이들은 떠날 때마다 행복이 된다"" 이왕 짧은 인생을 사는 거, 후자보다는 전자로 사는 게 낫지 않을까?워런 버핏은 54조 원 이상 기부했다. 신형 아반떼(기본 가격 1570만 원 기준)를 340만대나 기증한 셈이다. 그는 기부하는 이유를 ""행복해지기 위해서""라고 했다. 부자만 기부하는 것이 아니다. '대구의 키다리 아저씨'는 어렵게 살지만, 익명으로 기부했다. 기부의 이유는 워런 버핏과 같다.지난해 개인적으로 힘든 일을 겪었다. 내가 마음이 아프니, 주변에 힘들어하는 사람들이 보였다. 깜짝 놀랐다. 주변을 보면 겉은 멀쩡해도 마음 찢긴 사람들이 의외로 많았다. 그전에는 미처 몰랐다. 그들의 아픈 사연에 공감이 갔다.그때부터 큰 금액이 아니지만, 마음을 담아 기부를 하기 시작했다. 또 깜짝 놀랐다. 주변에 알리지 않고 기부를 하는 분들이 꽤 많았다. 기부하니 마음이 따뜻해졌다. 재산의 절반을 기부한 김범수 카카오 의장이 애송한다던 랠프 월도 에머슨 시가 마음에 와닿는다. ""당신이 살았음으로써 단 한 사람의 인생이라도 더 행복해지는 것. 이것이 진정한 성공이다.""지금 갓 마흔 된 친구들. 그리고 소싯적에 '주일학교' 다녔던 경험이 있다면 이 노래를 알 테다. '사랑은 참으로 버리는 것' 이라는 제목의 노래다. 초등학교 땐 멋모르고 불렀다. 지금에서야 알겠다. '은전 한 닢'으로 어떻게 행복해질 수 있는지.""사랑은 참으로 버리는 것. 이상하다 동전 한 닢. 움켜잡으면 없어지고. 쓰고 빌려주면 풍성해져. 땅 위에 가득 차네""저작권자(c) 오마이뉴스(시민기자), 무단 전재 및 재배포 금지▶오마이뉴스 '시리즈'에서 연재하세요!▶이재명 경기도지사 추천 《이재명과 기본소득》▶오마이뉴스 취재 후원하기"
2021.02.28.,"클럽하우스에 '용진이형' 떴다, 정용진 ""야구단 이름은…""",https://n.news.naver.com/mnews/article/025/0003081093?sid=101,"정용진 부회장. 사진 신세계그룹           프로야구 연습 경기 일정을 하루 앞둔 28일 신세계 야구단에 대한 관심이 커지고 있다. 정용진 신세계 부회장이 전날 음성채팅 소셜미디어(SNS)인 클럽하우스에 직접 등장해 관련 이야기를 풀어놓으면서다.       ━   구단명, 인천하면 떠오르는 이름으로 정해        정 부회장은 이날 야구단의 새 이름과 관련된 이야기는 물론 팀 컬러와 홈구장 운영 계획 등 다양한 이슈에 대해 직접 설명했다. 정 부회장의 이야기를 정리한 내용은 야구 커뮤니티 등에서 퍼져나가고 있다.        이에 따르면 신세계 야구단은 다음달 19일까지 유니폼과 엠블럼을 공개할 예정이다. 웨일스, 팬서스, 마린스, 부스터스 등의 명칭을 검토했지만 '인천하면 딱 떠오르는 게 있어 그걸로 정했다'고 정 부회장은 언급했다.        야구단의 색상으로는 이마트의 컬러인 노란색은 사용하지 않을 계획이다. 스타벅스와 노브랜드 버거를 문학구장에 입점시킬 계획도 밝혔다. 구단 인수 당시 이슈가 됐던 돔구장 건립 계획 역시 '청라에 테마파크를 건설하려 했지만, 현재 (돔구장 건립) 법령을 검토 중'이라고 밝히기도 했다.     ━   ""용진이형으로 불러달라""        NC다이노스를 적극적으로 벤치마킹하겠다고 했다. 야구팬들과 게임마니아들이 NC다이노스의 구단주인 김택진 대표를 '택진이형'이라고 부르는 것을 빗대 ""용진이형으로 불러도 좋다""고도 했다.      그러면서 야구단을 인수한 이유는 '우승하기 위해서'라고 공언했다. 카카오가 야구단에 관심이 많다는 이야기도 했다. 또 외국인 선수 월머 폰트, 아티 르위키의 활약에 대한 기대감을 드러내기도 했다.        이같은 소식에 신세계 관계자는 ""다양한 내용이 나와서 일일히 확인하긴 어렵지만 부회장님 본인이 직접 말씀하신 게 맞는 것으로 알고 있다""면서 ""인천을 상징하는 팀명으로 정하는 것도 맞는 방향이고 조만간 공개될 것""이라고 설명했다.        장주영 기자 jang.jooyoung@joongang.co.kr    ▶ 네이버 구독 첫 500만 중앙일보 받아보세요▶ 넌 뉴스를 찾아봐? 난 뉴스가 찾아와!▶ 당신이 궁금한 코로나ⓒ중앙일보(https://joongang.co.kr), 무단 전재 및 재배포 금지"
2021.02.28.,"이마트24, 매월 초 ‘7일장’ 할인 행사",url없음,<네이버 기사 없음>
2021.02.28.,"[뉴스IT(잇)쥬]잘나가는 IT, 성과 나누기 논란…'개발자 영입' 연봉 경쟁",https://n.news.naver.com/mnews/article/421/0005193106?sid=105,"코로나19 상황에서 성장한 IT 업계…성과급·인사 평가 적절성 논란'개발자 가뭄'으로 모시기 경쟁…연봉 인상 줄이어[편집자주]정보통신기술(ICT)은 어떤 산업보다 빠르게 변화합니다. 그 안의 다양한 이해관계가 맞물려 소용돌이 치는 분야이기도 하지요. ICT 기사는 어렵다는 편견이 있지만 '기승전ICT'로 귀결되는 4차 산업혁명 시대에 그 중요성은 날로 커지고 있습니다. 전문적인 '그들만의 뉴스'가 아닌 개개인의 일상 생활과도 밀접한 분야죠. 민영통신사 <뉴스1>은 한주간 국내 ICT 업계를 달군 '핫이슈'를 한눈에 제공합니다. 놓쳐버린 주요 뉴스, [뉴스IT(잇)쥬]와 함께 하실래요?이해진 네이버 GIO(왼쪽)과 김범수 카카오 의장 © 뉴스1(서울=뉴스1) 김승준 기자 = 직장인들의 영원한 관심사, '업무에 대한 보상'이 지난 한 주 정보통신기술(ICT) 업계의 화두였다. 지난 한 해 IT업계는 신종 코로나바이러스 감염증(코로나19)에서 성장세를 누렸다. 업계 내에서는 '성장의 과실을 어떻게 나눌지'에 대한 논의와 미래에 성장을 이끌 인재 유치를 위해 '연봉 경쟁'이 치열하게 이뤄지고 있다. 카카오와 네이버 창업자들은 25일 직원들과 가진 간담회에서 직원 처우·인사 평가에 대한 입장을 밝혔다. 그리고 이달 초 넥슨에서 시작된 '개발자 영입' 경쟁이 이번 주에도 이어졌다.한편, 업계 바깥에서 논의 중인 '이익공유제'에 대해 ICT 주무부처인 과학기술정보통신부의 최기영 장관은 신중한 입장을 표했다.◇직원 앞에선 카카오·네이버 창업자들…직원 연봉·처우 입장 밝혀김범수 카카오 이사회 의장과 이해진 네이버 글로벌투자책임자(GIO)는 25일 오후 각각 임직원들과 간담회를 가졌다.'브라이언톡 애프터'라는 이름으로 열린 카카오의 간담회는 김범수 의장의 '재산 절반 기부' 선언을 현실화할 아이디어를 모으기 위해 열렸다. 간담회에 참석한 직원들은 문화재환수, 취업난 지원, 스타트업 지원, 문화재 환수, 환경보호 등 다양한 아이디어를 내놨다.이번 간담회에서 김 의장은 최근 불거진 인사 평가 정당성 논란을 포함한 인사평가·보상 문제에 대한 입장도 밝혔다.그는 ""불편하게 억압하는 회사는 안 되게 노력해야 하고 (고충을) 외부에 알리는 게 아니라 내 동료, 내 보스, 내 CEO에게 얘기할 수 있는 환경이 돼야한다""며 ""이런 얘기를 외부에 할 수밖에 없는 환경이 되어버렸나는 경고등으로 받아들여야 하나 조심스러움이 있다. 문제를 해결할 의지와 기본 마음가짐은 있는 회사라고 아직 믿는다""고 밝혔다. 그는 임금 및 스톡옵션 등 정책에 대해서 ""카카오는 부가가치를 창출하는 능력이 강하기 때문에 우리 산업군에선 가장 보상이 많은 회사가 됐으면 좋겠다는 생각하고 있고, 그렇게 되고 있다고 생각한다. 부족한 점은 있지만 다소 차이는 있는 것 같다""며 ""단도직입적으로 네이버와 비교하면 연봉과 성과급은 네이버가 영업이익이 세다 보니 한동안 그것을 (비슷하게) 못 맞췄다. 그래도 다행인 것은 카카오가 네이버보다 스톡옵션은 더 많이 나갔다. 전체적으로 보면 누가 더 많을지 객관적인 비교를 통해 밸런스를 잡아보고 싶다""고 말했다.카카오는 3월11일 간담회를 인사 평가 등에 대한 개선 방안을 논의할 예정이다.이해진 GIO가 참석한 네이버 '컴패이언 데이' 간담회는 주요 주제가 구성원에 대한 보상이었다. 네이버는 지난해 역대 최대 실적을 달성했지만 그에 비해 저조한 임금 인상률과 전년과 비슷한 수준의 성과급이 제시돼 내부에서 문제 제기가 이뤄졌다. 간담회에서 이해진 GIO는 ""단기적 수익보다는 성장을 위한 움직임을 보여준 조직을 중심으로 보상한다""며 ""직원들도 회사와 함께 성장할 수 있도록 연봉과 인센티브 외에도 타 기업과 다르게 시총 규모가 매우 큰 상장사로서는 드문 '전직원 스톡옵션' 제도를 도입했다""고 했다.이에 민주노총 화학섬유식품산업노동조합 네이버 지회(공동성명)은 성명을 통해 ""회사는 대외적으로 창업주와 대표가 직접 소통에 나선다며 설명회에 의미를 부여했지만 회사 측의 일방적 입장 전달 외에 어떤 것도 사우들의 질문에 제대로 답을 하지 않았다""고 날선 반응을 보였다.노조 측은 Δ성과급 지급 금액과 비율 공개를 비롯해 임원 보상의 적정성 Δ성과급 비율 책정 재고 Δ직군별 보상 차등 문제 Δ'하후상박' 기준 연봉의 적정선 문제 등에 대한 경영진의 답변을 요구하고 있다.김창한 크래프톤 대표 (크래프톤 제공) © 뉴스1◇""개발자 모십니다""…IT업계에 부는 연봉 인상 바람한국산업기술진흥원의 산업기술인력 수급 실태 조사에 따르면 소프트웨어 기술 인력 일자리는 증가하는 동시에, 필요한 인력을 구하지 못하는 부족률은 4.0%로 주요 산업(평균 부족률 2.2%) 중 가장 높은 수준이다. 즉, IT 인재를 찾는 수요는 늘어나고 있지만, 일할 사람이 모자란 상황이다. 게다가 비IT 기업으로 분류되던 유통, 금융 분야에서도 IT 개발자를 채용하고 나서면서, 개발자 확보 경쟁이 치열해지고 있다. 이번 연봉 인상 경쟁이 시작된 곳은 넥슨이다. 넥슨은 1일 사내 공지문을 통해 재직자 연봉은 800만원씩 인상하고, 신입사원 연봉을 개발자 5000만원, 비(非)개발자 4500만원으로 올리겠다는 방침을 밝혔다. 이때 넥슨이 밝힌 인상 이유는 인재 확보·투자였다.이후 넷마블·컴투스·게임빌·조이시티 등 게임 업계 회사들도 인재 확보를 위한 경쟁에 동참했다. 게임업계 연봉 인상에 정점을 찍은 것은 크래프톤이다. 크래프톤의 김창한 대표는 25일 개발직군은 2000만원, 비개발직군은 1500만원의 연봉을 인상하는 임금체계를 내부에 발표했다. 게임 업계의 연봉 인상 바람은 스타트업 업계로 퍼져나가고 있다.부동산 정보 플랫폼 직방은 26일 재직자 연봉 일괄 인상(개발직군 2000만원·비개발직군 1000만원)과 개발직군 초봉 6000만원 지급 및 성과금 강화 방침을 밝혔다.중고거래 플랫폼 기업인 당근마켓도 최근 개발자 최저 연봉을 5000만원으로 책정하고 스톡옵션을 지급하고 있는 것으로 알려졌다.업계에서는 이번 인재 유치 경쟁에 대해서 Δ만성적인 전문 인력 부족 Δ서비스 개발 유경험자 선호 Δ코로나19로 인한 수요 증가 등을 원인으로 보고 있다.최기영 과학기술정보통신부 장관이 22일 오후 세종특별자치시 세종파이낸스센터 과기정통부 기자실에서 열린 '출입기자 영상간담회'에서 인사말을 하고 있다. (과학기술정보통신부 제공) 2021.2.22/뉴스1◇최기영 장관, '이익공유제'에는 신중한 태도22일 정부세종청사에서 열린 최기영 과학기술정보통신부 장관 기자 간담회에서도 장관의 입장을 묻는 질문이 나왔다. 최 장관은 ""정보통신기술(ICT) 분야는 경제 상황이 좋아 이익공유제 이야기가 당연히 나올 수 있다""면서도 ""(과기정통부 장관 입장에서) 어떻게 하면 좋겠다고 말씀드리긴 어렵다""고 명확한 답변을 피했다.최근 여당에서는 코로나19로 수혜를 본 기업들이 코로나19로 피해를 본 사회적 약자들을 위해 이익을 공유해야 한다는 취지의 '이익공유제'를 추진 중이다. ICT 분야는 코로나19 상황에서 성장한 대표적인 영역으로 손꼽히고 있어 이익공유제 대상이 될 가능성이 높은 상황이다.최 장관은 ""4차 산업혁명 시대에 디지털 대전환 등이 일어나면 일자리를 잃는 사람도 있고, 새 일자리를 얻는 사람도 있다""며 ""이같은 측면에서 어떻게든 이익의 분배가 필요하긴 할 것""이라고 설명했다.이어 ""정부가 나서든, 기업이 자율적으로 나서든 여러 길은 있겠지만, 구체적으로 어떻게 제도로 만들지에 대해서는 제가 말씀드리는 것은 적절하지 않은 것 같다""고 말을 아꼈다.seungjun241@news1.kr▶ 네이버 메인에서 [뉴스1] 구독하기!▶  뉴스1&BBC 한글 뉴스 ▶  터닝포인트 2021 © 뉴스1코리아(news1.kr), 무단 전재 및 재배포 금지"
