기사날짜,기사제목,네이버 뉴스 url,기사내용
2021.02.16.,"한은법 개정방향 세미나…""지급결제, 한은법 목적조항 둬야"" 주장도",https://n.news.naver.com/mnews/article/277/0004848748?sid=101,"김주영 더불어민주당 의원실 개최 웹세미나'지급결제제도의 안전성 제고를 위한 한은법 개정 방향'[아시아경제 김은별 기자] 네이버·카카오페이 등 빅테크 업체들의 지급결제 관리 권한을 두고 한국은행과 금융위원회 간 힘겨루기가 이어지는 가운데, 지급결제를 한은의 목적 조항에 넣어야 한다는 주장이 나왔다. 고동원 성균관대 법학전문대학원 교수는 16일 국회 기획재정위원회 소속 김주영 더불어민주당 의원실이 16일 개최한 '지급결제제도의 안전성 제고를 위한 한은법 개정 방향(지급결제 및 CBDC 논의를 중심으로)' 웹 세미나에서 ""지급결제제도의 안정성과 효율성 도모를 한은법 목적조항에 추가하면, 한은의 주요 목적 중 하나가 지급결제제도의 안정성과 효율성 도모라는 점을 확실하게 인식시킬 수 있다""고 밝혔다. 그는 지급결제제도 유형과 운영기관 지정 요건에 대한 근거 규정을 한은법에 두고, 한은의 감시업무 대상을 보다 명확히 할 필요성이 있다고도 밝혔다. 한은법에 지정 요건을 두고 이에 근거해 금융통화위원회가 지정하도록 하는 방안이 바람직하다는 것이다. 결제리스크 관리와 관련한 내용을 한은법에 규정하고, 금융기관 및 IT기업에 대한 자료제출 요청권을 신설할 필요가 있다고도 지적했다. 고 교수는 국회 정무위원회에서 추진하는 전자금융거래법 개정안을 통해 빅테크 기업을 관리하는 것은 맞지 않다며 반대하기도 했다. 금융위원회가 금융결제원을 '전자지급거래청산업'으로 허가를 내고, 금결원에 대해 규정 승인권부터 검사, 감독, 제재권까지 갖는 내용의 전금법 개정안은 한은의 지급결제 업무와 상충된다는 것이 고 교수의 주장이다. 그는 ""핀테크 기업 등의 지급결제 업무는 금결원이 운영하는 소액결제제도와 한은 금융망을 통해 청산, 결제가 이뤄져야 하므로 별도의 외부 청산 의무화 필요성은 없다""고 밝혔다. 불법 자금 의심 거래 보고 의무화 등을 추진하는 것이 낫단 얘기다. 금융위가 무자격·국외 청산업자 난립을 막기 위해 지급거래청산업 제도가 필요하다고 했지만 이에 대해서도 반박했다. 고 교수는 ""한은이 한은금융망을 통해 최종 결제를 보장해야 하기 때문에 소액결제제도 운영 기관이 무분별하게 설립될 가능성이 낮다""며 ""특히 실시간총액결제(RTGS) 방식으로 개편될 경우 향후 소액결제 제도 운영 기관 설립 필요성은 거의 없다고 봐야 한다""고 말했다. 이날 세미나에선 고 교수가 발제를 맡고, 법률 전문가와 학계·한은 관계자들의 토론이 이어졌다. 안수현 한국외대 법과대학 및 법학전문대학원 교수를 좌장으로 김홍범 경상대 경제학과 교수, 박수용 서강대 컴퓨터공학과 교수, 박기영 연세대 경제학과 교수, 강현구 법무법인 광장 변호사, 민준규 한은 법규제도실장 등이 토론했다.김홍범 경상대 경제학과 교수는 ""국제통화기금(IMF)은 지난 2014년 지급결제시스템에 대한 금융위 규제감독 권한은 충분한 반면 한은의 감시 권한은 효과적이지 않다고 진단하면서 한은법 개정을 권유한 바 있다""며 ""이를 고려했을 때 정책당국간 정책 협조와 조정이 필요하다""고 밝혔다. 박기영 연세대 교수 역시 ""금융위의 디지털금융 혁신방안은 방향성과 시의성 측면에서 적절하다""면서도 ""전자지급거래청산업에서 '전자'가 지급결제제도의 본질을 바꾸는 것은 아니고 중요한 것은 안정성이기 때문에 최종대부자 기능이 있는 한은이 담당하는 것이 바람직하다""고 말했다. 세미나에선 CBDC 관련 조항을 한은법에 넣는 방안에 대한 이야기도 나왔다. 고 교수는 CBDC 발행 가능성을 고려해 ▲전자적 형태의 한은권 발행 ▲민간과의 CBDC 거래 ▲CBDC 계좌관리 위임 ▲CBDC에 대한 이자 지급 또는 마이너스 금리 부과 등에 필요한 법적 조항을 한은법에 반영할 필요가 있다고 주장했다. 강현구 법무법인 광장 변호사는 ""CBDC 도입 시 발행근거뿐만 아니라 법화성, 민간과의 거래, 이자지급, 업무 위탁 등의 법적 근거 필요성을 한은법에 반영할 필요가 있다""고 전했다. 김홍범 교수는 다만 CBDC를 가까운 시일 내 발행 필요성이 크진 않다고 한은이 밝히고 있는 만큼, 해외 사례를 보며 대비는 하되 한은법 개정 시기에 대해선 고민이 필요하다고 말했다. 현재까지 지급결제 업무가 한은의 고유권한임을 명문화한 한은법 개정안은 김주영 의원 대표 발의안과 양경숙 의원 대표 발의안이 있다. 기재위 소속 의원들의 한은법 개정안과, 정무위의 전금법 개정안이 상충되는 부분이 있어 결국 해당 법안들을 놓고 기재위와 정무위 간 충돌히 불가피할 것으로 예상된다.김은별 기자 silverstar@asiae.co.kr▶ 2021년 신축년(辛丑年) 신년운세와 토정비결은?▶ 발 빠른 최신 뉴스, 네이버 메인에서 바로 보기▶ 100% 무료취업교육 핀테크/AI 훈련정보 보기<ⓒ경제를 보는 눈, 세계를 보는 창 아시아경제 무단전재 배포금지>"
2021.02.16.,모바일 해외송금·26주 적금···카뱅이 했던 거였네,https://n.news.naver.com/mnews/article/011/0003871433?sid=101,"[혁신금융 몰아치는 빅테크]10대 고객 겨냥 신한페이머니 등카뱅 '미투상품' 금융권 확산[서울경제] 특정 제품이 인기를 끌 때 경쟁 브랜드를 모방해 상품을 출시하는 ‘미투상품’이 금융권에도 확산되고 있다. 이들 상품의 공통점이라면 혁신의 아이콘으로 불리는 인터넷전문은행인 카카오뱅크가 내놓은 것을 시중은행이나 카드사 등 기존 금융권이 뒤따라 했다는 점이다. 고객들이 불편을 겪었던 부분을 조금만 고쳐도 편리함이 배가 될 수 있다는 점을 먼저 깨달은 카카오뱅크의 노력이 금융 전반의 편의성 증대로 이어지고 있다는 평가다.15일 금융권에 따르면 KB국민은행과 하나은행이 새해부터 해외 송금 서비스를 개편하고 있다. 해마다 1~2월은 해외 유학생의 학비나 생활비 송금이 몰리는 시기로 과거에는 시중은행에서 모바일로 해외 송금을 하려면 최초 1회는 반드시 은행 영업점을 방문해야 했다. 앞서 카카오뱅크는 거래외국환은행 지정 등록을 위한 은행 방문 절차 없이도 모바일로 간편하게 해외로 송금이 가능하게 했다.카카오뱅크의 대표 상품인 26주 적금도 이제 다른 은행들이 비슷한 형태의 챌린지 상품으로 내놓고 있다. 신한은행이 GS리테일과 선보인 ‘쏠XGS 백만원 챌린지 적금’은 카카오뱅크의 ‘26주 적금 with 이마트’와 똑닮았다. 신한은행이 출시한 6개월짜리 적금은 자동이체를 이어가면 GS프레시몰 쿠폰이 제공되는 상품이다. 지난해 8월 카카오뱅크가 이마트와 손잡고 내놓은 26주 적금(6개월)과 거의 비슷한 구조다. 카카오뱅크가 카카오프렌즈 캐릭터 상품이나 이모티콘을 선물로 제공한 것처럼 신한은행은 라바 캐릭터로 흥미를 더했다. 차이라면 카카오뱅크는 인원 제한 없이 2주간 가입을 받았고 신한은행은 선착순 5만 명을 대상으로 했다. 카카오뱅크가 이마트와 제휴한 이 상품은 무려 56만 명이나 가입했다.미투상품을 내놓은 것은 신한은행보다 SC제일은행이 앞섰다. 지난해 10월 SC제일은행은 ‘GS25와 함께하는 적금 이벤트’를 실시했다. 6개월 만기 퍼스트가계적금(정기 적립식)에 매달 10만 원 이상 가입하면 GS25 모바일 상품권과 GS프레시몰 할인 쿠폰을 제공했다. 이벤트 참여 고객이 매월 적금을 제때 입금하는 조건이나 가입 기간이 6개월인 점이 카카오뱅크와 같았다.카카오뱅크가 10대를 겨냥해 선보인 ‘카카오뱅크 미니(mini)’도 업계에서 유사한 서비스가 나왔다. 미니는 자녀가 부모에게 용돈을 달라고 요청할 때 부모가 돈을 보내주는 조르기와 보내기 기능을 도입했는데 신한카드에서 이미 같은 서비스를 실시하고 있었다. 사실 조르기와 보내기를 통한 송금 기능은 카카오뱅크에서 먼저 적용한 ‘원조’ 서비스다./김광수 기자 bright@sedaily.com▶ 상위 1% 투자자 픽! [주식 초고수는 지금]▶ 겜알못? 이제는 겜잘알! [오지현의 하드캐리]▶ 네이버 채널에서 '서울경제' 구독해주세요!저작권자 ⓒ 서울경제, 무단 전재 및 재배포 금지"
2021.02.16.,"김범수·김택진, 최태원號 서울상의 합류",url없음,<네이버 기사 없음>
2021.02.16.,[필동정담] 록인(Lock-in) 전략,https://n.news.naver.com/mnews/article/009/0004749948?sid=110,"채팅은 '카카오톡'으로, 검색은 '네이버'로만 하는 사람이 있다. 커피는 '스타벅스'에서만, 휴대전화는 '아이폰'만 쓰는 사람도 있다. 이는 특정 상품이나 서비스를 이용하기 시작하면 기존의 것을 계속 구매하게 되는 '록인(Lock-in) 효과'로 설명할 수 있다. '록인'은 해당 상품에 익숙해지거나, 기존 선택을 바꿀 때 발생하는 전환 비용이 클 때 나타난다. 또한 카카오톡처럼 남들이 다 써서 나도 쓸 수밖에 없는 상황일 때 생긴다. 고객을 가둔다는 의미로 '자물쇠 효과' '잠금 효과'라고도 한다. 고객 수는 곧 돈이다 보니 '어떻게 소비자를 묶어둘 것인가'는 기업의 최대 숙제 중 하나다. 미국 뉴욕증권거래소(NYSE) 상장을 추진 중인 쿠팡의 성공 비결도 '록인 전략'이었다. 김범석 쿠팡 이사회 의장이 제시한 쿠팡의 비전은 '쿠팡 없이 어떻게 살았을까'라고 생각하는 세상을 만드는 것이었다. 그의 비전이 실현돼 가고 있다는 것은 새벽 아파트 문앞 곳곳에 놓인 로켓배송 박스로 확인할 수 있다. 최근 3개월간 쿠팡에서 제품을 산 고객은 1485만명에 달했다. 한 번 쿠팡에서 물건을 산 고객은 계속 구매금액을 늘린다는 통계도 있다. 고객이 빠져나가지 않게 하기 위해서는 '당근'이 필요하다. 쿠팡의 온라인 최저가 전략과 로켓배송, 로켓와우, 로켓프레시 등 멤버십 혜택 등이 여기에 해당한다. 특히 로켓와우는 월 2900원을 내면 로켓 표시가 있는 상품을 무료로 배송받을 수 있는 서비스로 고객이 쿠팡에 머물도록 유도한다. 아마존이 고객을 붙잡아 두는 '프라임 서비스'(월 13달러, 연 119달러)와 유사하다. 쿠팡의 충성고객 확보 전략은 비대면 시대를 맞아 더욱 빛을 발했다.하지만 '록인 전략'은 영원할 수  없다. 가격 경쟁력이 높은 상품, 고품질 서비스를 앞세운 경쟁자가 등장하면 잠금이 스르르 풀리며 고객 이탈이 생길 수 있다. '쿠팡 록인'을 풀기 위해 국내 경쟁사들이 어떤 반격카드를 준비할지 관심이 쏠린다.[심윤희 논설위원]▶ '경제 1위' 매일경제, 네이버에서 구독하세요▶ 이 제품은 '이렇게 만들죠' 영상으로 만나요▶ 부동산의 모든것 '매부리TV'가 펼칩니다[ⓒ 매일경제 & mk.co.kr, 무단전재 및 재배포 금지]"
2021.02.16.,모바일 해외송금·26주 적금···카뱅이 했던 거였네,https://n.news.naver.com/mnews/article/011/0003871433?sid=101,"[혁신금융 몰아치는 빅테크]10대 고객 겨냥 신한페이머니 등카뱅 '미투상품' 금융권 확산[서울경제] 특정 제품이 인기를 끌 때 경쟁 브랜드를 모방해 상품을 출시하는 ‘미투상품’이 금융권에도 확산되고 있다. 이들 상품의 공통점이라면 혁신의 아이콘으로 불리는 인터넷전문은행인 카카오뱅크가 내놓은 것을 시중은행이나 카드사 등 기존 금융권이 뒤따라 했다는 점이다. 고객들이 불편을 겪었던 부분을 조금만 고쳐도 편리함이 배가 될 수 있다는 점을 먼저 깨달은 카카오뱅크의 노력이 금융 전반의 편의성 증대로 이어지고 있다는 평가다.15일 금융권에 따르면 KB국민은행과 하나은행이 새해부터 해외 송금 서비스를 개편하고 있다. 해마다 1~2월은 해외 유학생의 학비나 생활비 송금이 몰리는 시기로 과거에는 시중은행에서 모바일로 해외 송금을 하려면 최초 1회는 반드시 은행 영업점을 방문해야 했다. 앞서 카카오뱅크는 거래외국환은행 지정 등록을 위한 은행 방문 절차 없이도 모바일로 간편하게 해외로 송금이 가능하게 했다.카카오뱅크의 대표 상품인 26주 적금도 이제 다른 은행들이 비슷한 형태의 챌린지 상품으로 내놓고 있다. 신한은행이 GS리테일과 선보인 ‘쏠XGS 백만원 챌린지 적금’은 카카오뱅크의 ‘26주 적금 with 이마트’와 똑닮았다. 신한은행이 출시한 6개월짜리 적금은 자동이체를 이어가면 GS프레시몰 쿠폰이 제공되는 상품이다. 지난해 8월 카카오뱅크가 이마트와 손잡고 내놓은 26주 적금(6개월)과 거의 비슷한 구조다. 카카오뱅크가 카카오프렌즈 캐릭터 상품이나 이모티콘을 선물로 제공한 것처럼 신한은행은 라바 캐릭터로 흥미를 더했다. 차이라면 카카오뱅크는 인원 제한 없이 2주간 가입을 받았고 신한은행은 선착순 5만 명을 대상으로 했다. 카카오뱅크가 이마트와 제휴한 이 상품은 무려 56만 명이나 가입했다.미투상품을 내놓은 것은 신한은행보다 SC제일은행이 앞섰다. 지난해 10월 SC제일은행은 ‘GS25와 함께하는 적금 이벤트’를 실시했다. 6개월 만기 퍼스트가계적금(정기 적립식)에 매달 10만 원 이상 가입하면 GS25 모바일 상품권과 GS프레시몰 할인 쿠폰을 제공했다. 이벤트 참여 고객이 매월 적금을 제때 입금하는 조건이나 가입 기간이 6개월인 점이 카카오뱅크와 같았다.카카오뱅크가 10대를 겨냥해 선보인 ‘카카오뱅크 미니(mini)’도 업계에서 유사한 서비스가 나왔다. 미니는 자녀가 부모에게 용돈을 달라고 요청할 때 부모가 돈을 보내주는 조르기와 보내기 기능을 도입했는데 신한카드에서 이미 같은 서비스를 실시하고 있었다. 사실 조르기와 보내기를 통한 송금 기능은 카카오뱅크에서 먼저 적용한 ‘원조’ 서비스다./김광수 기자 bright@sedaily.com▶ 상위 1% 투자자 픽! [주식 초고수는 지금]▶ 겜알못? 이제는 겜잘알! [오지현의 하드캐리]▶ 네이버 채널에서 '서울경제' 구독해주세요!저작권자 ⓒ 서울경제, 무단 전재 및 재배포 금지"
2021.02.16.,"LGU+, 아이폰12 구매한 청소년에 최대 에어팟2 증정",url없음,<네이버 기사 없음>
2021.02.16.,"김범수·김택진, 최태원號 서울상의 합류",url없음,<네이버 기사 없음>
2021.02.16.,[필동정담] 록인(Lock-in) 전략,https://n.news.naver.com/mnews/article/009/0004749948?sid=110,"채팅은 '카카오톡'으로, 검색은 '네이버'로만 하는 사람이 있다. 커피는 '스타벅스'에서만, 휴대전화는 '아이폰'만 쓰는 사람도 있다. 이는 특정 상품이나 서비스를 이용하기 시작하면 기존의 것을 계속 구매하게 되는 '록인(Lock-in) 효과'로 설명할 수 있다. '록인'은 해당 상품에 익숙해지거나, 기존 선택을 바꿀 때 발생하는 전환 비용이 클 때 나타난다. 또한 카카오톡처럼 남들이 다 써서 나도 쓸 수밖에 없는 상황일 때 생긴다. 고객을 가둔다는 의미로 '자물쇠 효과' '잠금 효과'라고도 한다. 고객 수는 곧 돈이다 보니 '어떻게 소비자를 묶어둘 것인가'는 기업의 최대 숙제 중 하나다. 미국 뉴욕증권거래소(NYSE) 상장을 추진 중인 쿠팡의 성공 비결도 '록인 전략'이었다. 김범석 쿠팡 이사회 의장이 제시한 쿠팡의 비전은 '쿠팡 없이 어떻게 살았을까'라고 생각하는 세상을 만드는 것이었다. 그의 비전이 실현돼 가고 있다는 것은 새벽 아파트 문앞 곳곳에 놓인 로켓배송 박스로 확인할 수 있다. 최근 3개월간 쿠팡에서 제품을 산 고객은 1485만명에 달했다. 한 번 쿠팡에서 물건을 산 고객은 계속 구매금액을 늘린다는 통계도 있다. 고객이 빠져나가지 않게 하기 위해서는 '당근'이 필요하다. 쿠팡의 온라인 최저가 전략과 로켓배송, 로켓와우, 로켓프레시 등 멤버십 혜택 등이 여기에 해당한다. 특히 로켓와우는 월 2900원을 내면 로켓 표시가 있는 상품을 무료로 배송받을 수 있는 서비스로 고객이 쿠팡에 머물도록 유도한다. 아마존이 고객을 붙잡아 두는 '프라임 서비스'(월 13달러, 연 119달러)와 유사하다. 쿠팡의 충성고객 확보 전략은 비대면 시대를 맞아 더욱 빛을 발했다.하지만 '록인 전략'은 영원할 수  없다. 가격 경쟁력이 높은 상품, 고품질 서비스를 앞세운 경쟁자가 등장하면 잠금이 스르르 풀리며 고객 이탈이 생길 수 있다. '쿠팡 록인'을 풀기 위해 국내 경쟁사들이 어떤 반격카드를 준비할지 관심이 쏠린다.[심윤희 논설위원]▶ '경제 1위' 매일경제, 네이버에서 구독하세요▶ 이 제품은 '이렇게 만들죠' 영상으로 만나요▶ 부동산의 모든것 '매부리TV'가 펼칩니다[ⓒ 매일경제 & mk.co.kr, 무단전재 및 재배포 금지]"
2021.02.16.,"이충엽 헤이비트 대표 ""가상자산 시장 비효율에서 사업 기회 찾았죠""",https://n.news.naver.com/mnews/article/011/0003871757?sid=101,"이충엽 헤이비트 대표카카오·NHN에 사업 매각 후투자 플랫폼으로 세번째 창업""가상자산,결국 제도권 편입될 것""이충엽 헤이비트(업라이즈) 대표가 서울경제와 인터뷰를 하고 있다. /권욱 기자[서울경제] “지난 2017년 비트코인 열풍이 불었을 때 ‘이름이 예뻐서 투자했다’는 이가 있을 정도로 제대로 알고 투자하는 사람을 찾아보기 힘들었습니다. 문제가 많으면 그만큼 개선할 여지가 많다는 뜻이고 역설적으로 여기에 사업 기회가 있다고 생각했습니다.”이충엽(사진) 헤이비트(업라이즈) 대표는 16일 서울경제와 만나 “시장이 비효율적일수록 사업 성공 가능성이 높아진다는 게 기본적인 창업의 지론”이라며 이렇게 말했다.이 대표는 이른바 ‘연쇄 창업자’다. 2007년 한국정보통신대(ICU, 현 카이스트) 재학 시절, 콘텐츠 제작 스타트업인 아이씨유(ISEEYOU)를 창업해 2012년 카카오에 매각했다. 2014년에는 엔젤 투자를 했던 모바일 알림장 애플리케이션인 아이엠스쿨(아이엠컴퍼니)의 창업 멤버로 들어가 3년 뒤 이를 약 100억 원의 기업가치로 NHN에 넘겼다. 적지 않은 돈을 손에 쥔 이 대표는 부동산과 주식·비트코인 등 다양한 자산에 직접 투자했다.그는 2018년 가상 자산 투자를 위한 플랫폼 창업에 뛰어들었다. 넘치는 투자 수요를 흡수할 만한 제대로 된 서비스가 없다고 느꼈기 때문이다. 골든에그·KB인베스트먼트·카카오벤처스·DSC인베스트먼트·베이스인베스트먼트·신한벤처투자 등으로부터 30억 원의 투자도 유치했다. 그는 “두 번째, 세 번째 창업을 하면서 인재를 모으고 전략을 짜는 요령을 익힌 것 같다”며 “첫 창업부터 동고동락해온 멤버들과 여전히 함께하고 있어 팀워크가 단단하다는 게 큰 장점”이라고 덧붙였다.헤이비트는 고객이 맡긴 돈을 알고리즘으로 알아서 가상 자산에 투자해주는 서비스다. 로봇이 투자를 조언하고 자산을 배분하는 이른바 ‘로보어드바이저’다. 5년 전 알파고 신드롬으로 인공지능(AI) 붐이 일면서 자산 관리 시장에서도 로보어드바이저가 키워드로 떠올랐지만 열기는 생각보다 오래가지 않았다.그는 “로보어드바이저가 제대로 자리 잡지 못 했던 것은 그 의미를 제대로 몰랐기 때문”이라며 “핵심은 로봇이 사람보다 운용을 잘하고 수익을 더 잘 낸다는 게 아니라 금융 상품의 유통 과정을 줄이고 불필요한 비용을 절감해 수수료를 낮출 수 있다는 것”이라고 말했다. 가상 자산에 아직 법적 제반이 갖춰지지 않아 비대면 영업 등에 관한 규제가 없다는 것도 기회 요인이었다는 게 그의 설명이다.헤이비트는 새로운 투자 전략인 ‘포어프론트’를 지난해 11월 선보였다. 거래량이 많은 상위 20개 자산에 100개 이상의 알고리즘을 통해 투자하는 방식이다. 헤이비트에 따르면 지난해 11월 2일부터 지난달 말까지 이 전략의 누적 수익률은 52.52%다.그는 “시장을 둘러싼 우려와 문제점이 여전히 많지만 가상 자산은 결국에는 하나의 자산으로 인정받을 수밖에 없다고 확신한다”며 “우리의 목표는 안정적이면서도 매력적인 수준의 수익을 꾸준히 내 다양한 자산으로 서비스를 확장하는 것”이라고 전했다./김기정 기자 aboutkj@sedaily.com▶ 상위 1% 투자자 픽! [주식 초고수는 지금]▶ 겜알못? 이제는 겜잘알! [오지현의 하드캐리]▶ 네이버 채널에서 '서울경제' 구독해주세요!저작권자 ⓒ 서울경제, 무단 전재 및 재배포 금지"
2021.02.16.,"장성군, 상품권으로 물건 사면 상품권 돌려주는 '착한소비 이벤트' 진행",https://n.news.naver.com/mnews/article/629/0000067918?sid=102,"장성군이 지역상권 활성화를 위한 ‘착한 소비 이벤트’를 진행한다./장성군 제공장성톡에 인증하면 추첨 통해 1만원권 장성사랑상품권 증정[더팩트ㅣ장성=허지현 기자]전남 장성군이 지역상권 활성화를 위한 ‘착한 소비 이벤트’를 진행한다.16일 군에 따르면 장성사랑상품권으로 물건을 구입하면 추첨을 통해 1만원 상당의 상품권을 돌려받을 수 있다.이벤트 참여는 장성군 카카오채널 ‘장성톡’을 통해 참여 하면된다. 참여 기간은 이달 28일까지로, 누구나 응모할 수 있다.장성 지역의 전통시장 등 소규모 점포에서 2만원 이상의 물건을 장성사랑상품권으로 구입한 뒤, 구입 금액이 기재된 영수증 사진이나 구매 인증샷을 응원 메시지와 함께 장성톡으로 전송하면 된다.장성군은 무작위 추첨을 통해 총 100명을 선정, 장성사랑상품권 1만원권을 제공할 계획이다. 추첨 결과는 오는 3월 5일 장성군 SNS에 공지된다. 재난지원금 지급 등으로 상품권 수요가 부족할 경우에는 다른 상품으로 대체될 수 있다.군 관계자는 ""지역 내 영세 상점가의 경영에 도움이 될 수 있도록 폭넓게 참여를 유도할 수 있는 카카오채널 이벤트를 진행 중""이라면서 많은 참여를 당부했다.forthetrue@tf.co.kr - BTS 공연 비하인드 사진 얻는 방법? [팬버십 가입하기▶]   - 내 아이돌 순위는 내가 정한다! [팬앤스타 투표하기] 저작권자 ⓒ 특종에 강한 더팩트 & tf.co.kr 무단 전재 및 재배포 금지"
