기사날짜,기사제목,네이버 뉴스 url,기사내용
2023.04.02.,"[르포]인왕산 화재로 주민 대피…""노인정서 밥먹다 깜짝""",https://n.news.naver.com/mnews/article/079/0003754441?sid=102,"화재 현장서 떨어진 곳에서도 '매캐한 냄새'""사람은 다치지 않아서 다행…불길 빨리 잡아""소방 ""화재 80% 진화, 잔불씨 남아 완전 진화는 더 걸려""윤지나 기자 서울 인왕산에서 불이 나 소방당국이 진화중인 가운데 집을 떠나 급히 피신해야 했던 인근 주민들은 '긴급 대피령'에 놀라면서도 인명피해가 없어 다행이라고 입을 모아 말했다.2일 오후 3시 20분쯤 CBS노컷뉴스 취재진이 방문한 종로구 부암동에서는 화재 현장과 1km 이상 떨어진 곳에서도 화재로 인한 매캐한 냄새가 났다.인왕산과 가까워 '대피령'이 떨어졌던 서대문구 개미마을 쪽으로 갈수록 메케한 냄새는 진해졌다. 소방과 경찰, 군, 그리고 자원봉사자 등 현장 인력들로 매우 혼잡했다.개미마을 주민들은 집 밖으로 나와 모여 서로의 안부를 묻고 있었다. 개미마을 주민 70대 곽모씨는 ""노인정에 모여서 밥을 먹고있었는데 밑에서 전화가 와서 연기가 난다고 밖에 나와보라고 하더라""며 ""그때가 (오후) 1시가 좀 안됐을 때였는데 그때부터 대피했다""고 말했다.2일 오후 산불이 발생한 서울 종로구 인왕산에 연기가 피어오르고 있다. 박종민 기자이어 ""아까는 불이 퍼렇고 연기도 지금보다 훨씬 자욱해서 말도 못했다. 등산객들도 저쪽으로 넘어가거나 이쪽으로 다들 내려왔다""며 ""나도 중요한 것만 들고 나왔는데 (다시) 들어가지도 못했다""고 걱정을 털어놓았다.80대 주민 김모씨는 ""사람은 안 다쳐서 괜찮다. 불길을 빨리 잡은 것 같다""며 ""구청장이 와서 방송으로 다들 나오라고 안내했다""고 전했다.홍제동 주민 60대 최모씨는 ""(불이 난 사실을) 문자를 보고 알았는데, 밑에 사람들에게 어디서 불이 났냐고 물으니 다들 모른다더라""며 답답해했다.이날 오전 11시 53분쯤 인왕산 6부 능선에서 난 불은 정상 부근으로 번졌다. 소방당국은 오후 12시 51분 대응 2단계를 발령해 오후 2시 30분 기준 인력 580명, 헬기 9대를 포함한 장비 85대를 투입했다.김정록 기자 경찰과 소방당국은 입산을 통제하는 한편 홍제동 개미마을 등 인근 주택가로 연기가 확산함에 따라 주민들에게 대피를 안내하고 있다.서대문구도 이날 오후 1시 43분 ""개미마을 및 홍제동 인근 아파트 주민분들은 신속히 대피해달라""고 안내했다.이에 인근 120가구 주민이 홍제주민센터, 인왕초등학교, 홍제2동 주민센터, 경로당 등으로 대피한 것으로 파악됐다.소방당국은 ""화재는 80% 진화된 것으로 보인다""며 ""잔불씨가 남아서 완전히 진압하는데는 더 시간이 걸릴 것""이라고 설명했다.경찰과 소방당국은 불길을 잡는 대로 정확한 화재 원인을 조사할 방침이다.※CBS노컷뉴스는 여러분의 제보로 함께 세상을 바꿉니다. 각종 비리와 부당대우, 사건사고와 미담 등 모든 얘깃거리를 알려주세요.이메일 : jebo@cbs.co.kr카카오톡 : @노컷뉴스사이트 : https://url.kr/b71afn"
2023.04.02.,"경북도 수산자원연구원, 어업 대전환 청사진 발표",https://n.news.naver.com/mnews/article/079/0003754442?sid=102,"경상북도 제공 경상북도 수산자원연구원이 어업 대전환을 통한 미래 성장 동력 창출을 위한 청사진을 발표했다.2일 경상북도는 해양수산·정책 분야 산학연 전문가의 검토를 거쳐 수산 자원 연구 개발 종합계획을 발표했다. 이번 종합 계획에는 동해안 자원회복 사업 조기 실현과 순환여과양식시스템(RAS)을 활용한 완전양식기술 개발 등을 추진한다는 내용이 담겼다. 주요 전략으로는 우선 어업인 소득 증대 경제성 품종 개발 및 자원 회복이다.고부가 선호 품종의 전략적 자원 조성과 함께 동해안 살오징어, 연안 정착성 어종(전복, 해삼 등) 및 가자미류(문치가자미, 참가자미 등) 대량방류를 통한 자원회복 사업의 상용화 방안을 모색한다.내수면 수산 자원을 조성하고 멸종위기 종 보존을 통한 내수면 어업 활성화에도 나선다.또 소비자 맞춤형 품종(연어류) 및 수산 식품 개발, 수산물 요리경연대회 개최 등으로 어업 관련 산업 활성화에 나선다. 저탄소 해양환경 보존을 통한 수산자원 조성과 탄소 중립화 실천을 위해 미세조류 관련 시험연구 및 양어 수경재배(아쿠아포닉스) 등 친환경 응용 기술 개발도 추진한다. 이 밖에 스마트 순환여과양식시스템(RAS) 육성기술을 개발하고 최적의 사육관리 매뉴얼 발간 등 양어 기술 보급 사업에 초점을 맞출 계획이다.     경북도는 이번 종합계획을 통해 동해안 친환경 수산자원의 고급 브랜드화와 내수면 어업의 산업화로 소득 증대, 일자리 창출, 청년인재 유입 등 경제적 성과를 기대하고 있다.※CBS노컷뉴스는 여러분의 제보로 함께 세상을 바꿉니다. 각종 비리와 부당대우, 사건사고와 미담 등 모든 얘깃거리를 알려주세요.이메일 : jebo@cbs.co.kr카카오톡 : @노컷뉴스사이트 : https://url.kr/b71afn"
2023.04.02.,공정혁신 시뮬레이션센터 구축 사업에 대구시 선정,https://n.news.naver.com/mnews/article/079/0003754440?sid=102,"대구광역시 제공 대구시가 산업통상자원부에서 전국 12개 스마트그린산업단지를 대상으로 공고한 '공정혁신 시뮬레이션센터 구축·운영' 사업에 선정됐다고 2일 밝혔다.이번 사업 선정으로 대구시는 2025년까지 3년간 총 258억 원(국비 180억 원, 시비 51억 원, 구비(달서) 3억 원, 경북대 24억 원)을 투입해 사업 주관기관인 경북대학교 산학협력단과 사업을 추진하게 된다.이번 사업을 통해 대구성서산단 내 사업 수행 거점센터를 설립하고 시뮬레이션 소프트웨어와 고성능컴퓨터 등 장비를 구축한다.미래차, 로봇, 지능형기계 등 지역 특화산업 분야에 정보통신기술 융합 제품 설계·해석, 가상검증, 시제품 제작 서비스를 지원하고 전문 인력 양성을 통한 기술 보급·확산도 추진한다.지역 중소·중견 기업들은 대구 공정혁신 시뮬레이션센터를 활용해 제품 개발·제작·성능검증 등 전체 공정에 대한 다양한 시뮬레이션을 통해 가상으로 성능 예측과 검증을 할 수 있게 된다.이를 통해 기업의 제품 개발 기간 단축과 비용 절감 효과가 기대된다.서경현 대구시 미래ICT국장은 ""이번 사업을 통해 지역 제조 기업의 제품 생산성과 품질 향상을 돕고 지속적인 혁신을 이루는 계기가 될 것""이라고 말했다.※CBS노컷뉴스는 여러분의 제보로 함께 세상을 바꿉니다. 각종 비리와 부당대우, 사건사고와 미담 등 모든 얘깃거리를 알려주세요.이메일 : jebo@cbs.co.kr카카오톡 : @노컷뉴스사이트 : https://url.kr/b71afn"
2023.04.02.,"LG전자, '레드닷 디자인 어워드'서 최고상 1개 등 24개 수상",https://n.news.naver.com/mnews/article/079/0003754396?sid=101,"LG 올레드 플렉스 최고상·혁신상 받아…무드업 냉장고 등은 본상LG전자, '레드닷 디자인 어워드' 대거 수상. 연합뉴스LG전자가 세계 3대 디자인상인 '레드닷 디자인 어워드'에서 최고상 1개, 본상 20개, 혁신상 3개 등 총 24개의 상을 대거 받았다고 2일 밝혔다.원할 때마다 화면을 구부렸다 펼 수 있는 벤더블 게이밍 올레드 TV 'LG 올레드 플렉스'는 제품 디자인 부문 최고상과 혁신상을 동시에 받았다.사용자의 시청 환경에 따라 화면이 구부러지는 정도를 20단계로 조절해 최상의 몰입감을 제공했다는 점과 화면 뒤 무드등으로 게임의 분위기를 끌어올리는 디자인이 좋은 평가를 받았다. LG 올레드 TV는 처음 출시한 2013년부터 매년 레드닷 디자인 어워드를 수상했다.LG 씽큐 앱에서 터치 한 번으로 냉장고 색상을 원하는 대로 바꿀 수 있는 '디오스 오브제컬렉션 무드업', 기존 창문형 에어컨이 가진 돌출 현상을 최소화한 '휘센 오브제컬렉션 엣지' 등이 본상을 받았다.이와함께 차세대 프리미엄 신발관리 솔루션 '스타일러 슈케이스·슈케어', 신개념 테이블형 공기청정기 '퓨리케어 에어로퍼니처' 등이 혁신상을 받았다.'iF 디자인 어워드', 'IDEA'와 함께 세계 3대 디자인상으로 꼽히는 레드닷 디자인 어워드에는 올해 전 세계 51개국에서 총 2만여 개의 제품이 출품돼 각 부문에서 치열한 경쟁을 펼쳤다.LG전자 황성걸 디자인경영센터장(전무)은 ""고객의 목소리를 듣고 이를 반영해 만든 고객가치가 인정받았다는 점에서 더 큰 의미가 있다""며 ""앞으로도 고객에 대한 깊고 섬세한 이해를 통해 LG만의 F·U·N(First·최고의, Unique·차별화된, New·세상에 없던) 고객 경험을 계속 제공할 것""이라고 밝혔다. ※CBS노컷뉴스는 여러분의 제보로 함께 세상을 바꿉니다. 각종 비리와 부당대우, 사건사고와 미담 등 모든 얘깃거리를 알려주세요.이메일 : jebo@cbs.co.kr카카오톡 : @노컷뉴스사이트 : https://url.kr/b71afn"
2023.04.02.,"이재명 ""몰아서 일하고 몰아서 휴가…얼마나 허무맹랑""",https://n.news.naver.com/mnews/article/079/0003754410?sid=100,"핵심요약이재명 ""문제는 '권리의식' 아니라 권리 제대로 보장하는 것""더불어민주당 이재명 대표가 최고위원회의에서 모두발언을 하고 있다. 윤창원 기자더불어민주당 이재명 대표가 ""책상머리에서 탁상공론하는 정치가 국민의 삶을 위협한다""라며 정부가 추진하는 근로 시간 개편 정책을 비판했다. 이 대표는 2일 자신의 SNS에 ""을의 처지가 어떤지 잘 아는 청년 노동자들에게 '주 69시간 몰아서 일하고 몰아서 휴가 가라'는 정책이 얼마나 허무맹랑하게 다가왔을까. 요즘 청년들은 권리 의식이 뛰어나서 괜찮다는 주무 부처 장관의 말은 신박한 탁상공론처럼 들렸을 것""이라며 이같이 밝혔다. 이 대표는 ""정치하면서 무엇보다 잃지 않으려는 것이 현장 감각이다. 때론 짧은 온라인 게시물 하나가 국민 삶의 현장을 적나라하게 보여주곤 한다. 1년에 아르바이트생 채용이 169명 이루어졌다는 편의점 이야기가 그렇다""라며 관련 보도를 소개했다. 그는 이어 ""극단적인 사례이고, 노동자에 대해 합당한 처우를 하려 애쓰는 선량한 고용주가 더 많다는 점을 알고 있지만, 생계를 위해 일자리를 구해야 하는 청년들이 고용주에 비해 을의 위치에 있다는 것은 변함없는 사실""이라고 말했다. 그러면서 ""문제는 '권리의식'이 아니라 권리를 제대로 보장하는 것이다. 노동자의 권리를 퇴행시키는 노동개악을 막아내고, 국민께서 삶의 현장에서 체감할 수 있는 변화를 거듭 만들어낼 수 있도록 부단히 노력하겠다""라고 강조했다.※CBS노컷뉴스는 여러분의 제보로 함께 세상을 바꿉니다. 각종 비리와 부당대우, 사건사고와 미담 등 모든 얘깃거리를 알려주세요.이메일 : jebo@cbs.co.kr카카오톡 : @노컷뉴스사이트 : https://url.kr/b71afn"
2023.04.02.,"주총 시즌 달궜던 행동주의, 10전 7패...""올해로 끝 아니다""",https://n.news.naver.com/mnews/article/025/0003270164?sid=101,"갈 길은 아직 멀었다. 올해 3월 주주총회(주총) 시즌을 뜨겁게 달궜던 행동주의 펀드가 기대에 못 미치는 성적표를 받아들었다. 대부분의 주주제안이 주총 표 대결에서 무릎을 꿇었다.       그렇다고 행동주의 캠페인이 끝난 건 아니다. 캠페인에 실패한 곳은 내년 주총을 준비하고, 성공을 거둔 곳도 주주가치 제고를 위한 후속 절차에 나선다는 계획이다. 전문가들은 행동주의 펀드의 패배에도 '소액주주의 목소리'를 남긴 점을 높이 평가했다.   ━   주요 행동주의 펀드 10곳 중 3곳만 일부 승리       그래픽=신재민 기자 shin.jaemin@joongang.co.kr           중앙일보가 지난달 31일 기준 주요 행동주의 펀드의 주주제안 주총 결과를 분석한 결과 10건 중 7건은 표 대결에서 패배했다. 승리를 거둔 곳은 3곳에 불과했는데, 그 또한 일부 승리에 그쳤다. 주로 감사나 감사위원 선임 건이었다.       상법상 감사와 감사 선임의 경우 대주주도 의결권을 3%까지만 인정하기 때문에 소액주주가 표 대결에서 승리할 가능성이 상대적으로 높다. 31일 남양유업에 대한 차파트너스자산운용의 감사 선임안이 통과되며 일부 승리했다. 배당 확대 등 다른 안건은 부결됐다.       트러스톤자산운용(이하 트러스톤)의 한국알콜 감사위원 겸 사외이사도 통과됐다. 사측과 물밑 협상을 통해 대화가 원만하게 이뤄진 결과였다. 소수주주 측이 제안한 배당안은 부결됐다.       얼라인파트너스(이하 얼라인)는 SM엔터테인먼트를 둘러싼 하이브와 경영권 분쟁 끝에 카카오가 승기를 잡으며 이사회 구성안을 포함한 주주제안을 이날 주총에서 통과시킬 수 있었다.      이 세 곳을 제외한 다른 행동주의 펀드의 주주행동은 사실상 실패했다. 안다자산운용·플래쉬라이트캐피탈파트너스(FCP)의 KT&G에 대한 주주제안은 완패했다. 배당금 확대와 자사주 매입·소각, 사외이사 선임안 등을 두고 표 대결을 벌였지만 결과는 국민연금이 KT&G 이사회의 편을 들며 모두 부결됐다.       BYC를 상대로 주주행동에 나선 트러스톤의 안건(배당금 증액·액면분할·감사위원 선임·자사주 취득)도 모두 부결됐다. 철강제품 개발업체 KISCO홀딩스에 500억원 규모의 자사주 매입과 감사위원 선임을 요구한 밸류파트너스자산운용도 소액주주와 연대했지만 결국 표 대결에서 고배를 들었다. 배당 확대를 두고 주총에서 맞붙은 JB금융지주와 얼라인의 대결도 사측의 승리로 끝났다.      패배의 쓴잔을 든 행동주의 펀드는 국내 자본시장 환경에 대한 아쉬움을 드러냈다. 이상현 FCP 대표는 “솔직히 국민연금이 (우리가) 제안한 모든 안건에 반대표를 던질 줄 몰랐다”며 “최고경영자(CEO)를 합리적으로 견제할 평가보상위원회 정관 명문화 등도 (제안에) 있었는데 이마저 거부했다. 연금을 책임지는 국민연금 수탁위가 주가를 떨어뜨리는 방향으로 의사 결정한다는 건 이해하기 어렵다”고 말했다.태광산업에 주주제안을 한 트러스톤은 사측이 감사위원 선임과 관련해 분리선출 제도를 유리하게 바꿔가며 악용했다고 지적했다. 트러스톤 측은 “태광산업이 지난해 상법을 위배하면서까지 분리선출로 1명의 감사위원을 선임해 2명의 분리선출 감사위원을 선임했고, 이를 방패막이 삼아 이번 주총에서는 분리선출이 필요 없다며 주주제안을 거부했다""고 주장했다.         ━   펀드 측 ""내년 주총 준비 돌입"" ""감사 활동 시작""       기대한 만큼의 성과를 거두진 못했지만, 행동주의 펀드의 주주행동은 이제 시작일 수 있다. 올해 한 해로 끝나지 않는다는 말이다. 이상현 FCP 대표는 “KT&G 지분을 더 모아 다음 주총을 준비하겠다”며 “올해 경험을 통해 누가 우리와 의견을 함께하는지 등을 확인한 만큼 내년에 더 철저히 준비해 (주총에) 임할 것”이라고 말했다.       이창환 얼라인 대표도 “내년만이 아니라 JB금융 이사회가 합리적인 자본 배치와 주주환원 정책 도입으로 저평가 문제를 해소할 때까지 계속 할 것”이라며 ”JB금융 이사회는 이번 주주제안 배당 안건에 찬성표를 행사한 주주의 목소리를 엄중하게 받아들여야 한다”고 말했다. 실제로 이날 JB금융 주총에는 이례적으로 많은 소액주주가 참석해 의견을 내면서 표 집계가 늦어지기도 했다.      감사위원이나 감사 선임에 성공한 행동주의 펀드는 곧바로 주주가치 제고를 위한 활동에 나서겠다는 계획을 밝혔다. 상근 감사 선임에 성공한 차파트너스자산운용의 김형균 상무는 “상근 감사는 상근인 만큼 보통 사외이사인 감사위원보다 훨씬 많은 권한을 가지고 있다”며 “당장 월요일부터 회사 현황 파악부터 시작해 필요하다면 주주가치 회복을 위한 법적 대응에 나설 것”이라고 밝혔다.       ━   전문가 ""행동주의 많아질 것"" ""소액주주 목소리 사측이 먼저 들어야""       전문가들은 행동주의가 사측에 ‘소액주주의 목소리’란 중요한 신호를 보낸 점을 긍정적으로 평가했다. 이남우 연세대 국제대학원 객원교수는 “주주제안이 관철돼야만 의미가 있는 게 아니다”며 “경영진에게(주주의) 문제의식과 불만을 전달한 만큼 사측도 예전처럼 무시만 할 수는 없다는 점에서 행동주의 펀드의 주주행동이 국내 주식시장의 메기 역할을 했다는 점에서 의미가 있다”고 평가했다.        조명현 고려대 경영학과 교수도 “올해 주총을 통해 문제가 있는 기업은 행동주의 펀드의 타깃이 될 수 있다는 걸 기업도 주주도 알게 됐다”며 “앞으로 행동주의 캠페인이 더 많아질 수 있는 만큼 기업도 주총에서 이겼다고 끝낼 게 아니라 합리적 제안은 자발적으로 수용해 고쳐나가야 한다”고 말했다."
2023.04.02.,"CU, 고물가 소비자 부담 덜기 위해 'GET 아메리카노' 할인 행사 진행",https://n.news.naver.com/mnews/article/421/0006721473?sid=101,"식목일, 지구의 날에 텀블러 지참시 아메리카노 무료 제공 쿠폰도 선착춘 5000명 제공(CU 제공)(서울=뉴스1) 김예원 기자 = CU가 즉석원두커피 'GET 아이스아메리카노'(XL)의 가격을 2100원에서 2000원으로 상시 인하한다고 2일 밝혔다. 같은 사이즈의 라떼도 당분간 2500원에서 2000원으로 할인 판매된다.카카오페이 결제 할인 행사도 진행한다. 4월 한 달간 'GET아이스아메리카노' 2종(L, XL)을 카카오페이로 결제하면 현장에서 즉시 30%할인이 적용된다. 얼음컵을 포함한 L사이즈와 XL사이즈 아메리카노 가격은 할인 적용 시 각각 1260원, 1400원으로 결제된다. 이밖에도 5일 식목일, 22일 지구의 날에 텀블러를 지참 시 'HOT아메리카노'(L)를 무료 제공하는 쿠폰도 선착순 5000명에 제공한다. 쿠폰은 멤버십 앱 '포켓CU'에서 받을 수 있다. 자세한 내용은 CU 공식 인스타그램에 안내될 예정이다. 최정태 BGF리테일 음용식품팀 MD는 ""물가 안정에 기여하기 위해 가격을 낮추고 할인쿠폰을 발행하는 등 이번 행사를 마련했다""며 ""고물가 부담이 가중되는 상황에서 앞으로도 여러 할인 행사를 선보일 것""이라고 말했다."
2023.04.02.,"소주 한 잔 기울이며, 그라운드 누비며…‘제주 4·3’ 기억해주세요",https://n.news.naver.com/mnews/article/056/0011457212?sid=102,"제주유나이티드 선수단이 경기장 한가운데서 ‘제주 4·3 동백꽃 통천’을 펼치고 있다. 제주유나이티드 제공내일(3일)은 제주 4·3 사건이 발발한 지 75년째가 되는 날입니다. 매년 이맘때가 되면 제주에선 제주 4·3을 기억하고, 무고하게 희생된 주민들을 기리는 다채로운 추모 행사가 마련됩니다.한국 현대사 가운데 6·25 전쟁 다음으로 가장 많은 피해자를 낸 비극적인 사건이지만, 75년이 지난 지금까지도 제주 밖에서는 잘 알려지지 않은 역사이기도 합니다.제주 4·3은 1948년 제주에서 발생했습니다. 해방 이후 무력 충돌과 진압 과정에서 수많은 제주도민이 희생됐고, 그 아픔은 여전히 제주도민과 제주 전체에 남아있습니다.그리고  '동백꽃'은 제주의 아픔을 의미하는데요. 1992년 강요배 화백의 4·3 연작 '동백꽃 지다'를 시작으로 동백꽃은 제주 4·3 희생자의 상징으로 자리 잡았습니다.■ '4·3 알리기'에 기업 등  동참이러한 아픈 역사를 전국적으로 알리기 위해 제주 도내·외 기업도 그간 '4·3 알리기'에 적극적으로 동참해왔습니다.제주 4·3 70주년을 맞이했던 지난 2018년, 제주항공·티웨이항공·이스타항공 등 국내 항공사에선 1년간 항공기가 제주에 도착하면 '4·3 70주년 안내 멘트'를 내보내, 지역 사회 호응을 얻었습니다.또 삼다수를 생산하는 제주개발공사도 그해 생산분 70억 병에 '4·3 70주년 로고'를 붙여 전국 유통망을 통해 판매하는 등, 제주 4·3 알리기에 동참한 바 있습니다.제주 4·3이 73주년을 맞이했던 지난 2021년에는 제주에 본사를 둔 카카오가 자사 지도 서비스에 제주 도내 주요 '4·3 유적지'를 묶은 테마 지도를 선보이기도 했습니다.■ "" 소주 한 잔 기울이며…제주 4·3 기억해 주세요""제주에 기반을 둔 향토 주류기업 ㈜한라산은 5년째 제주 4·3을 기억하는 주제별 에디션(한정판)을 출시하고 있습니다. 올해는 다섯 번째  '동백 에디션'을 내놓았습니다.한라산 소주는 지난 2019년 '아픔'을 시작으로 해마다 제주 4·3을 향한 '위로', '기억', '희망' 등 메시지를 담은 한정 상품을 출시하고 있습니다. 국민적으로 사랑받는 제품을 통해 4·3 희생자와 유족들을 위로하고, 전국의 소비자들에게도 화해와 상생이라는 제주 4·3의 정신을 알리기 위함입니다.라벨 속 그림에도 의미가 있습니다. 이번에 담긴 작품 속 '심해'는 오랜 과거 속에 가둬진 아픈 기억을, '천해'는 가까운 기억 속에 묻힌 아픈 기억을 상징합니다. 그 속의 '해초'는 '아픔'을 정화하고, '동백'으로 승화한다는 의미를 내포하고 있습니다.한라산 소주를 찾는 전국 소비자들이 꾸준히 늘면서, 이번 '제주 4·3 라벨'이 붙여진 제품도 전국 각지의 대형마트 등에서 판매될 예정입니다.한라산 관계자는 ""4·3 희생자들을 기리고 역사를 기억하길 바라는 마음을 담았다""며 ""전 세계의 평화와 상생, 종전을 바라는 마음으로 동백의 강인한 생명력과 같은 기적이 이뤄지길 바란다""고 말했습니다.제주유나이티드 제공■ 제주유나이티드, '동백꽃 패치' 달고 뛰는 홈경기매년 4월, 서귀포월드컵경기장에는 동백꽃이 활짝 핍니다.제주에 연고지를 둔 프로축구팀 제주유나이티드 선수들이 매년 4월, 4·3을 추모하기 위해 가슴에 '동백꽃 패치'를 붙이고 경기에 나서기 때문인데요. 오늘(2일) 울산 현대를 홈으로 불러들이는 맞대결을 시작으로 한 달간, 동백꽃 패치를 붙이고 경기장을 누비는 제주 선수들을 볼 수 있습니다.제주 유일의 프로스포츠 구단인 제주유나이티드는 해마다 선수와 관중이 함께 하는 제주 4·3과 관련한 다양한 활동을 펼치고 있습니다.오늘(2일) 낮 2시  울산전을 앞두고도 제주 4·3 75주년을 기리는 다양한 추모 행사가 마련됩니다. 경기 시작 전, 오후 12시부터 12시 30분까지 제주 4·3 강연이 진행됩니다. 또 제주 4·3 홍보 부스에서는 제주 4·3 바로 알기 책자와 동백 배지를 받을 수 있습니다.이날 서귀포월드컵경기장 외부광장에서는 입장 전 추모글 쓰기 행사도 열립니다. 하프타임 시 베스트 추모글을 발표하며, 베스트 추모글 선정 작품으로 선정되면 소정의 상품도 받을 수 있습니다. 이날 홈경기 시작 전에는 제주 4·3 추념 행사가 진행됩니다.제주유나이티드 제공■ 제보하기▷ 카카오톡 : 'KBS제보' 검색▷ 전화 : 02-781-1234▷ 이메일 : kbs1234@kbs.co.kr▷ 뉴스홈페이지 : https://goo.gl/4bWbkG"
