기사날짜,기사제목,네이버 뉴스 url,기사내용
2023.04.02.,전북지역 재선거 사전 투표율 10% 밑돌아,https://n.news.naver.com/mnews/article/079/0003754473?sid=102,"전주을 국회의원 재선거 사전 투표율 10.51%군산나 시의원 재선거 6.75% 등 평균 9.81%자료 사진. 전라북도선거관리위원회 제공전북지역 재선거 사전투표율이 9.81%로 저조한 것으로 나타났다.전라북도 선거관리위원회에 따르면 지난 3월 31일부터 4월 1일까지 이틀간 실시한 사전 투표에서전주을 국회의원 재선거는 10.51%, 군산나 시의원 재선거는 6.75%를 기록했다.전북지역 사전 투표율은 전북을 포함 5개 시도의 재보궐선거 사전투표율 평균 11.01%를 밑돌았다.다른 시도의 경우 경남이 24.87%로 가장 높았고 충북은 7.7%로 가장 낮았다.한편, 제8회 전국동시지방선거 전북지역 사전 투표율은 24.41%로 기록한 바 있다.※CBS노컷뉴스는 여러분의 제보로 함께 세상을 바꿉니다. 각종 비리와 부당대우, 사건사고와 미담 등 모든 얘깃거리를 알려주세요.이메일 : jebo@cbs.co.kr카카오톡 : @노컷뉴스사이트 : https://url.kr/b71afn"
2023.04.02.,[기업기상도] 해외에서 활짝 갠 기업 vs 국내에서 흐린 기업,https://n.news.naver.com/mnews/article/422/0000591730?sid=101,"[앵커] 경제 상황이 그야말로 '시계 제로'입니다. 세계 곳곳에서 터진 뜻밖의 사태나 선을 넘은 자국 우선주의란 안개가 짙게 깔린 상황인데요. 지난 한 주 어려움 뚫고 성과 낸 기업 또 그렇지 못했던 기업들, 기업기상도로 살펴보시죠. 김종수 기자입니다.[기자] 한 주 기업뉴스 리뷰 주간 기업기상도입니다.외국 어디 금융사가 어렵다는 말에 환율이, 국내 기업 어디가 힘들다는 소문에 주가가 들썩이는 일 반복되고 있습니다. 경제가 살얼음판 같았던 한 주, 맑고 흐린 기업 찾아 기업기상도 출발합니다.진에어 필두로 한 저비용항공사들로 시작합니다. 다시 열린 하늘길 덕에 실적 전망이 쾌청합니다.주중 진에어 주가가 강세였습니다. 1분기 영업이익이 흑자 전환 넘어 사상 최대란 증권사 전망 덕이었죠. 국제선 항공편 늘고 손님 급증하며 3년여 만에 되살아난 건데,여기만이 아닙니다. 제주항공,에어부산,티웨이도 다 1분기 흑자 전환한다는 게 증권가 진단입니다.일상이 회복될수록 실적은 더 좋아지겠죠. 그 실적이 투자와 일자리로 돌아오면 좋겠습니다.다음은 원조 라면집 삼양식품입니다. 맛만큼이나 맹렬한 매운 라면 인기에 실적이 그야말로 날고 있습니다.작년 매출 9,000억 넘고 식품회사론 놀라운 10%대 영업이익률 5년 내리 달성했는데요. 각국 먹방 인기 아이템 된 매운 라면 덕에 해외 매출이 1년새 56% 불어나 매출 67% 차지하며 식품회사로는 전례없는 수출 주력기업 됐습니다. 올해는 매출 1조대 넘본답니다.K콘텐츠 덕에 라면이 외국서 인기란 건 어제오늘 이야기 아닌데요. 적어도 지금 최대 수혜자는 이 회사 같습니다.이제 흐린 기업입니다.첫 흐린 기업 하이브입니다. 인수 포기한 SM 주식 때문에 손실 입을 판입니다.SM엔터테인먼트 둘러싼 경쟁에서 하이브가 물러서며 카카오는 공개 매수로 지분 40% 확보하게 됐죠.그런데 매수신청 받아보니 경쟁률이 2.27대 1이라 15.8% 가진 하이브는 보유 SM 지분 44%만 넘길 수 있었습니다. 넘긴 주식은 12만원에 사 15만원에 팔았으니 498억 차익 났지만 주가가 자꾸 떨어져 못판 주식에선 거액 평가손 나올 형편입니다.이 거래의 최대 승자는 SM 새 주인된 카카오가 아니라 이수만 SM 설립자란 시장의 평가가 맞는 것 같습니다.다음은 토스뱅크입니다. 상품 하나 내놨다 위험하다는 소문 퍼져 홍역 치렀습니다.미국,유럽에서 급격한 자금 인출로 파산하고 팔리는 은행 속출하자 국내로 공포 바이러스 번졌습니다. 인터넷은행 토스뱅크가 돈 맡기면 바로 이자 내주는 예금 만들자, 혹시 현찰 궁한 게 아니냔 의심 퍼진 겁니다. 대표가 직접 나서 재무안정성 비율 공개하며 진정 나섰는데 하마터면 큰 위기 겪을 뻔했습니다.금융의 생명이자 핵심자산은 신뢰입니다. 이 신뢰를 얻는데 필요한 건 정직, 그리고 오얏나무 밑에서 갓끈을 고쳐쓰지 않는 겁니다. 이번엔 산업은행 보실까요? 본점 부산행 놓고 노사가 정면 충돌했습니다.윤석열 대통령 공약인 산업은행 부산 이전, 그간 큰 진전 없었는데 산은 경영진이 절차에 착수했습니다. 정부에 이전공공기관 지정방안 검토보고서 올린 겁니다. 이전 반대해온 노조는 집회 이어 절차하자 이유로 회사 결정에 대한 가처분 신청 등 강경 투쟁 나섰습니다.공약도 중요하고 산은의 기능과 경쟁력도 고려해야하는 어려운 문제입니다. 법 고쳐야하는 문제도 있습니다. 노사 어느 한쪽의 밀어붙이기로 될 사안이 아니란 이야기입니다.마지막은 시공순위 34위 신세계건설입니다. 건설 불황 타격도 큰데 사고까지 터졌습니다. 작년 적자는 건설업 사정상 그렇다쳐도 800억 채권 찍으려는데 신세계 간판 걸고도 돈이 100억밖에 안오는 일 있었죠. 미분양의 무덤 대구에 사업이 많아 부담 크다는 관측때문입니다. 이 와중에 울산에선 땅 파려고 설치한 37m 항타기가 무너져 인근 원룸 건물 3채 덮치는 대형 사고까지 났습니다.  뭔가 큰 반전 아니면 위기수습책이 필요해보입니다.문제는 유사한 상황인 건설사가 적지 않다는 점입니다.중국이 일본을 능가하는 한국의 최대 무역적자국이 됐습니다. 코로나 같은 일시적 영향도 있지만 중국의 변화를 보고도 손놓은 결과입니다. 한편으론 다시 신발끈 동여매고 다른 한편으론 빠져나가는 기술 못막으면 상황은 더 나빠질 겁니다.지금까지 주간 기업기상도였습니다.연합뉴스TV 기사문의 및 제보 : 카톡/라인 jebo23"
2023.04.02.,“장 건강 나빠졌다” 알리는 의외의 신호 4,https://n.news.naver.com/mnews/article/296/0000064538?sid=103,"피부염, 체중 증가 등장이 나빠지면 피부염이 자주 발생하는 등 뜻밖의 증상들이 나타난다. [사진=게티이미지뱅크]장내에는 수많은 미생물이 살고 있다. 이 미생물 생태계가 조화롭지 못하면 복통이 발생할 수 있다. 가스가 차거나 설사가 나기도 한다. 장의 건강 상태와 관련이 있다고 생각하기 힘든, 뜻밖의 증상도 있다. 미국 건강 정보 매체 '에브리데이헬스'가 장 건강이 나빠졌다는 뜻밖의 신호와 대처법에 대해 소개했다.  △피부염  포화 지방이 많은 음식, 정제 설탕이 들어간 음식은 장내 생태계를 왜곡한다. 그 결과 면역계가 제구실을 못하게 되고 습진, 건선, 비듬, 여드름 같은 염증성 피부 질환을 겪을 확률이 높아진다. 이럴 때는 과일과 채소를 충분히 먹어야 한다. 단백질은 붉은 고기 대신 생선을 통해 섭취하는 게 좋다. 가공 식품을 멀리하는 것도 중요하다.  △단 음식 과식  이상할 정도로 단 게 끌린다면? 장내 생태계의 균형이 무너지고 나쁜 박테리아가 우위를 점했을 가능성이 크다. 설탕에 대한 탐닉을 제어하려면 천천히 양을 줄이는 수밖에 없다. 가당 음료 대신 허브차나 레몬수를 마실 것. 사탕이나 초콜릿이 당길 때는 카카오 함량 70% 이상의 다크 초콜릿을 먹는 게 좋다.  △체중 증가  장내 박테리아는 칼로리 섭취와 에너지 소비에 영향을 미친다. 연구에 따르면 과체중인 사람은 대개 장내 생태계가 다양하지 못하다. 유해균 비율도 높다. 장내 생태계 구성을 분석하면 비만 여부를 판별할 수 있다는 연구도 있다. 이럴 때는 섬유질이 풍부한 과일과 채소를 더 챙겨 먹어야 한다. 콩류와 통곡물을 풍부하게 함유한 식단도 장을 건강하게 바꾸는 데 도움이 된다.  △우울감  장에 사는 미생물들은 신경계, 내분비계, 면역계와 소통한다. 그 결과 기분에 영향을 미친다. 우울과 불안을 다스리려면 지중해식 식단을 실천하는 게 좋다. 즉 오메가-3 지방산이 풍부한 생선과 신선한 과일, 채소, 해조류, 견과류 등을 골고루 먹어야 한다. 프로바이오틱 보충제를 먹는 것도 하나의 방법이다."
2023.04.02.,"'한 풀었다' SSG 김광현, 통산 150승만큼 값진 개막전 승리",https://sports.news.naver.com/news.nhn?oid=079&aid=0003754355,<구조 다름>
2023.04.02.,"버닝썬 게이트 저격? '모범택시2', 자체 최고 시청률 기록",https://n.news.naver.com/mnews/article/079/0003754374?sid=106,<구조 다름>
2023.04.02.,"""밥상 물가 잡는다""…롯데온, CJ 인기 먹거리 단 하루 단독 특가",url없음,<네이버 기사 없음>
2023.04.02.,"서울시, 청소년 상담인력 늘리고 학교폭력 '치유' 강화한다",url없음,<네이버 기사 없음>
2023.04.02.,누구도 환영치 않는 양곡관리법 개정안…'농민단체들 전면 개정 요구',https://n.news.naver.com/mnews/article/079/0003754352?sid=101,"핵심요약한농연, 중장기적 관점 정책 수립 촉구쌀전업농, 농가소득 보장위해 전면 재논의 해야   축단협, 농민 동의하지 않아 재검토 필요전농, 최저가격제 포함하도록 재면 개정 필요연합뉴스3월23일 양곡관리법 개정안이 야당 주도로 국회에서 통과됐다. 2021년 12월 개정안이 발의되고 1년 4개월 만이다. 통과된 개정안은 쌀 초과 생산량이 3~5% 이상이거나 가격이 5~8% 이상 떨어지면 과잉 생산된 쌀을 정부가 의무적으로 수매해 쌀값을 안정시키는 것을 주요 내용으로 하고 있다.  그동안 양곡관리법 개정을 반대해 왔던 정부와 여당은 대통령에게 거부권 행사를 건의하는 등 강하게 반발하고 나섰다. 그렇다면 농민단체들은 환영할까?  민주당이 마련한 개정안의 당초 정부 매입 요건은 '쌀 초과 생산량 3% 이상이거나 가격 5% 이상 하락'이었다. 하지만 여당의 반발이 계속되자 김진표 국회의장의 중재에 따라 매입요건을 강화한 수정안이 최종 의결된 것이다. 개정안이 통과되자 양곡관리법 개정 자체에 우려를 표해왔던 농민단체들은 잇따라 반대 성명을 냈다. 한국후계농업경영인중앙연합회는 성명을 통해 ""쌀농사는 기계화율이 높아 상대적으로 재배가 쉬운 만큼 판로에 대한 부담이 해소되면 다른 작물로 유인이 쉽지 않아 수급조절 기능이 약화될 것""이라면서, ""정부는 재의 요구권을 행사하고, 이후 중장기적인 관점에서 균형 잡힌 양곡 정책 수립에 나서야 할 것""이라고 요구했다. 연합뉴스한국쌀전업농중앙연합회도 ""농가소득 안정과 괴리된 채 농업 생산소득을 보장할 수 있는 안전장치가 필요하다는 현장의 요청이 수용되지 않았다""며 ""쌀 농가의 소득을 보장하기 위해 전면 재논의가 필요하다""고 주장했다. 축산관련단체협의회는 ""이번 법 개정에 농민들이 동의하지 않았고, 축산 분야의 예산 축소로 이어질 것이 자명하다""며 전면 재검토를 촉구했다. 그동안 양곡관리법 개정을 요구해왔던 농민단체도 우려의 목소리를 높였다.  전국농민회총연맹은 통과된 양곡관리법 수정안은 당초 안보다 크게 후퇴돼 실제 농민에게 도움이 되지 않을 것이라고 혹평했다.  이근혁 전농 정책위원장은 ""통과된 수정안을 적용하면 정부가 의무매입할 조건을 충족하기 쉽지 않아 작동이 거의 될 수 없을 것""이며, ""더욱이 기존 양곡관리법으로는 시장 격리를 요구는 할 수 있었는데 수정안은 오히려 이마저도 요구조차 할 수 없게 만들었다""고 주장했다. 이어 ""정부와 여, 야는 쌀 농사를 짓는 최소한의 생산비 보장을 요구하는 농민들의 소리에 귀를 기울여야 할 것""이라며, ""농업생산비가 보장된 최저가격제를 포함한 양곡관리법 전면 개정이 필요하다""고 강조했다.  결국 이도 저도 만족시키지 못하는 개정안이 통과되면서 양곡관리법은 대통령의 거부권 행사 여부와는 별개로 개정되자 마자 다시 전면 개정을 요구받는 셈이됐다. 한덕수 국무총리가 지난 29일 정부서울청사에서 양곡관리법 개정안과 관련한 대국민 담화를 발표하는 모습. 연합뉴스정부는 양곡관리법이 시행되면, 쌀 과잉구조가 심화되어 2030년에는 초과 생산량이 63만 톤에 이르고, 1조 4천억 원의 막대한 재정이 소요될 것이라며 반대 이유를 설명하고 있다. 결국 국민의힘과 정부가 지난달 29일 당정협의회를 갖고 윤 대통령에게 거부권 행사를 건의하며 양곡관리법 개정안은 또다시 여야 정쟁의 대상이 됐다. 한덕수 총리는 이날 ""쌀 산업의 발전과 농업의 미래를 지키기 위해 양곡관리법안에 대한 재의 요구를 대통령께 건의하겠다""고 담화했다.  이에 농해수위 소속 민주당 의원들이 ""명백한 국민 호도이고 식량안보를 포기하는 행위""라며 ""대통령이 거부권을 행사할 경우 국회에서 재표결을 추진하겠다""는 강경 입장을 밝히기도 했다.  정치권 안팎에서는 윤 대통령이 오는 4일 국무회의에서 취임 이후 첫번째 재의 요구권(거부권)을 행사할 것으로 보고 있다.※CBS노컷뉴스는 여러분의 제보로 함께 세상을 바꿉니다. 각종 비리와 부당대우, 사건사고와 미담 등 모든 얘깃거리를 알려주세요.이메일 : jebo@cbs.co.kr카카오톡 : @노컷뉴스사이트 : https://url.kr/b71afn"
2023.04.02.,'인구 4만' 작은 시골에 '산부인과'가 있어요,https://n.news.naver.com/mnews/article/079/0003754356?sid=102,"함양군 보건소 산부인과 5년째 운영으로 원정 진료 불편 해소대학병원장 출신 전문의 수준 높은 의료 서비스 제공작은 시골 함양 임신부 31명 중 22명 등록, 모든 검사·진료 비용 '무료'부인과·청소년 진료까지 공공의료 역할 '톡톡'함양군 보건소 산부인과 정두용 전문의로부터 진료받고 있는 임신부. 경남도청 제공""작은 시골 마을에 임신부가 몇 있어서 산부인과가 필요할까요?""'필요하다'가 정답이다.시골 마을에는 원정 진료의 불편함을 감수해야 하는 임신부만 있는 것이 아니라 고령화 사회로 진입하면서 여성 어르신이 훨씬 많기 때문이다. 어르신들은 부인병을 앓고 있어도 도시로 진료를 나가는 데 어려움이 있어 초기 증상이 있는 데도 참고 병을 키우는 일이 부지기수다.시골 마을은 다 이럴 것이다. 그런데 의료 취약지인 인구 약 4만의 작은 시골 경남 함양군 보건소에 외래산부인과가 벌써 5년째 운영하며 지역의 '여성 종합병원' 역할을 톡톡히 하고 있어 눈길을 끈다.2019년 8월 문을 연 이후 2021년부터는 건국대 충주병원장을 지낸 산부인과 전문의가 수준 높은 의료 서비스를 제공하고 있어 만족도가 더할 나위 없다.지난해 9월에는 함양군 휴천면 금반마을에 20여 년 만에 아기 울음소리가 들렸다. 아기 울음소리 듣기 힘든, 노인 인구가 대부분인 휴천면 마을의 대단한 경사다. 이른바 '금반둥이'를 축하하는 파티까지 열렸다.건강하게 태어난 공을 따지자면 군 보건소가 한몫했다. 금반둥이 엄마는 고혈압·당뇨로 인해 임신 고위험군에 속했다. 만약 산부인과가 없었다면 고위험군의 몸을 이끌고 장거리 원정 진료를 다닐 수밖에 없었다.그러나 풍부한 산부인과 경험을 가진 전문의의 관리를 가까운 곳에서 받으며 아이를 무사히 출산할 수 있었다. 전문의는 저출산 시대에 어려운 여건 속에서 아이를 출산한 엄마에게 손 편지까지 전하며 축하했다.이처럼 함양군 보건소에 산부인과가 생기기 전까지 임신부들은 인근 진주 또는 거창으로 원정 진료를 다녀야 했다. 시간·경제적 손실은 그렇다 치더라도 장거리 이동에 따른 발생할 수 있는 사고 위험까지 감내해야 했다. 선택지가 단 하나여서 어쩔 수 없다.산부인과 진료받고 있는 임신부. 경남도청 제공함양은 의령·고성군과 함께 산부인과가 없는 의료취약지이지만, 이제는 보건소 산부인과가 있어서 든든하다. 시골 산부인과가 얼마나 잘 진료하겠냐는 불신도 있겠지만, 웬만한 수준급 병원 못지않은 분만 경력을 가진 전문의를 믿고 도시로 원정 진료 다니던 임신부들이 이제 함양에서 진료받고 있다.실제 함양의 등록 임신부는 31명이다. 이 중 22명이 보건소 산부인과에 등록해 진료받고 있다. 요 임신 반응검사부터 임신 초기 검사, 1·2차 기형아 검사, 임신 막달 검사까지 모든 검사 비용과 진료비도 무료다.장점은 또 있다. 언제든 갑작스러운 이상 증세가 발생해 보건소를 찾으면 응급 상황 대처가 가능하다. 임신 기간 전문의의 일대일 상담으로 정신적 안정감까지 주는 것은 덤이다.""시골 보건소에 산부인과가 들어섰을 때 뜬금없는 일처럼 보였겠지만, 그 파급력은 입증되고 있어요.""임신부만 산부인과를 찾는 것은 아니다. 고령의 여성 어르신들은 부인과 질병을 꽤 앓고 있다. 교통 이동 수단이 없기 때문에 먼 거리의 병원을 찾는 것이 쉽지 않아 아파도 참고, 사소한 경우는 그냥 지나쳐 병을 키우는 일이 대부분이다. 지난해 부인과 진료 인원은 약 770명에 이른다. 요실금 진료 환자가 가장 많다. 폐경·갱년기 진료, 호르몬제 처방, 방광염 등 많은 여성이 보건소에서 치료받고 있다. 자궁경부암 검사와 자궁 내 물혹 추적 관찰 등 주기적인 건강 관리는 물론 비용도 저렴하다. 건강하고 활기찬 삶이 가능해졌다.산부인과 진료를 창피해 꺼리는 여성 청소년도 보건소를 언제든 찾는다. 월경불순, 월경통, 여성 질환 등을 진료받는데, 만 13세 이상이면 부모 동행 없이도 진료받을 수 있다. 만 11세부터 접종할 수 있는 자궁경부암 예방접종과 홍보, 피임 상담과 청소년의 건강한 성교육도 하고 있다.함양군 보건소 산부인과 정두용 전문의. 경남도청 제공지역사회의 공공의사 역할을 맡고 있는 이 전문의는 바로 37년간 대학병원 등에서 교수직과 병원장을 하다 퇴임해 시골로 온 정두용 의사다. 그는 함양 유일한 공공 전문의로서 산부인과 진료뿐만 아니라 지역사회 공공의료서비스에도 도움이 된다면 흔쾌히 앞장서고 있다.2021년 코로나19 예방 접종이 시작된 이후 그가 한 예방접종 예진 건수는 507건이다. 보건지소, 보건진료소 등 마을로 찾아가는 방문 진료에도 적극적으로 참여해 공중보건의사로는 부족했던 예진을 도맡았다.게다가 보건소에서 만성질환 위험자를 대상으로 한 모바일 헬스케어 사업에도 건강 상담 의사로 활동해 현재까지 210차례 상담을 진행했다. 그는 함양 특수교육지원센터 치료대상자 선정위원회 활동도 하고 있다.함양군 보건소 관계자는 ""시골이라도 작은 규모지만 의원급의 병원은 많이 있고 의사도 많이 있지만, 여전히 공공의료 분야의 역할은 존재한다""며 ""민간병원은 사람의 병을 치료하고 돈을 벌지만, 공공 의료기관은 모든 국민이 건강한 삶을 영위하도록 제도와 여건을 조성하며 형평과 효율이 조화를 이루고자 노력한다""고 전했다.그러면서 ""시골 함양에 살아도 여성 건강을 책임질 수 있다""며 ""건강한 출산도 할 수 있으며, 보다 높은 공공의료서비스도 받을 수 있다""고 자신했다.※CBS노컷뉴스는 여러분의 제보로 함께 세상을 바꿉니다. 각종 비리와 부당대우, 사건사고와 미담 등 모든 얘깃거리를 알려주세요.이메일 : jebo@cbs.co.kr카카오톡 : @노컷뉴스사이트 : https://url.kr/b71afn"
2023.04.02.,"창원시, 지역특화콘텐츠개발지원사업 선정…4년 연속",https://n.news.naver.com/mnews/article/079/0003754484?sid=102,"창원특례시의 이야기 담은 미디어파사드 '빛의 대장간' 구축 예정창원시 제공창원특례시가 경상남도 '2023년 지역특화콘텐츠개발지원사업' 공모에 4년 연속으로 선정돼 국비 7500만원을 확보했다. '지역특화콘텐츠개발지원사업'은 경남도가 18개 시·군을 대상으로 지역의 특화된 프로그램과 연계해 관내 기업을 지원해 경제적 부가가치 창출이 가능한 콘텐츠를 개발하는 사업이다. 이번 사업은 국비 1:1 매칭으로 총 1억 5천만원의 사업비를 투입해 '창원특례시의 스토리를 담은 미디어파사드'를 '창원아트그라운드'에서 내년에 선보이게 된다.선정된 업체는 창원시 관내 '비앤디스튜디오'(대표 박해욱)와 '스테이앳홈'(대표 소재은)이며 지난 2022년 창녕 문화재 야행 미디어아트 '술정리동 3층석탑'과 창동예술촌 특별전 '인 메타 월드'에 참여해 우수한 성과를 거뒀다. 앞서, 시는 지난 2020년에 진해 현감 이제마의 사상의학을 소재로 한 웹툰과 영상을, 2021년에 한국 최초의 어보 '우해이어보'를 애니메이션과 그림책으로 재탄생시켰으며 2022년에는 창동예술촌 메타버스를 구축했다.정현섭 문화관광체육국장은 ""현재 창원아트그라운드의 미디어파사드에 시민분들의 반응이 좋으며, 문화생활에 대한 수요가 드러나는 부분이라고 생각한다. 창원만의 고유한 스토리를 담은 미디어아트를 통해 창원의 랜드마크가 될 수 있도록 노력하겠다""고 밝혔다.※CBS노컷뉴스는 여러분의 제보로 함께 세상을 바꿉니다. 각종 비리와 부당대우, 사건사고와 미담 등 모든 얘깃거리를 알려주세요.이메일 : jebo@cbs.co.kr카카오톡 : @노컷뉴스사이트 : https://url.kr/b71afn"
2023.04.02.,"전라남도, 청명·한식 주간 산불 예방 총력 대응",https://n.news.naver.com/mnews/article/079/0003754365?sid=102,"전라남도 제공전라남도는 오는 5~6일 청명과 한식을 앞두고 성묘객과 등산객 등 입산자 증가가 예상되자 오는 9일까지 산불 방지 단속 활동을 강화한다고 2일 밝혔다. 전라남도는 22개 시·군과 함께 주요 등산로와 묘지·유원지 등 산불 취약지역에 인력을 집중 배치해 감시하고, 산불예방 캠페인 및 차량 가두방송, 기동단속도 함께 추진할 방침이다. 이를 위해 전라남도는 본청 팀장급 이상 267명을 22개 시·군 읍·면·동 책임관으로 지정해 현장 배치하고 산림 인접지역 산불 위험요소 점검과 단속을 중점 추진했다. 전라남도는 올해 산불 방지대책을 조기 수립하고 예년보다 1개월 앞당긴 지난 1월 5일부터 비상근무체계에 돌입했다. 산불 발생 시 보고 및 지휘 체계를 확립하는 등 도민 안전을 최우선으로 총력을 기울이고 있다. 특히 골든타임 30분 내 초동 대처와 조기 진화를 위해 진화헬기 14대, 전문 진화인력 1034명, 진화 장비 5만 4천 점 등 가용자원을 총동원하고 산림·소방·경찰 등 유관기관과 신속한 공조체계를 갖추고 있다. 전라남도 문미란 산림보전과장은 ""산림 인접지 소각행위가 적발되면 과태료 부과 등 무관용 원칙으로 엄격히 처벌하겠다""며 ""성묘나 산행 시 화기를 소지하지 않고, 산림 주변에서 각종 쓰레기 등을 소각하지 않도록 각별한 주의를 바란다""라고 말했다.한편 전남에서는 올해 37건의 산불로 76.52ha에서 피해가 발생했다. 전라남도는 산림 인접지 불법 소각 등 산불 방지 위반 46건에 과태료 1174만 원을 부과하는 등 산림보호법 위반에 대해 엄중 대응하고 있다.※CBS노컷뉴스는 여러분의 제보로 함께 세상을 바꿉니다. 각종 비리와 부당대우, 사건사고와 미담 등 모든 얘깃거리를 알려주세요.이메일 : jebo@cbs.co.kr카카오톡 : @노컷뉴스사이트 : https://url.kr/b71afn"
2023.04.02.,대한민국 100대 브랜드 1위 '삼성 갤럭시',url없음,<네이버 기사 없음>
2023.04.02.,"'키치'로 돌아온 아이브, 더 당당해진 다채로움 [N초점]",https://n.news.naver.com/mnews/article/421/0006721196?sid=106,<구조 다름>
