기사날짜,기사제목,네이버 뉴스 url,기사내용
2023.04.02.,"광주전남 시도경찰청, '1차 불법무기류 자진신고 기간' 운영",https://n.news.naver.com/mnews/article/079/0003754446?sid=102,"광주광역시경찰청 청사. 박요진 기자광주전남 시도경찰청이 불법무기류 단속에 앞서 4월 한 달간 불법무기류 소지 자진신고 기간을 운영한다.광주전남 시도경찰청은 불법무기류로 인한 테러 및 범죄를 미리 예방하기 위해 오는 3일부터 약 한 달간 1차 불법무기류 자진신고 기간을 운영한다고 2일 밝혔다.불법무기류 자진신고 대상은 허가 없이 소지하고 있거나 소지 허가가 취소된 총기, 화약류(화약‧폭약‧실탄‧포탄 등), 도검, 분사기, 전자충격기, 석궁 등 불법무기류 일체다.이번 자진신고 기간 내에 신고할 경우 형사책임과 행정책임이 원칙적으로 면제되며, 본인이 소지를 희망하는 경우 결격사유 등의 확인 절차를 거쳐 허가할 방침이다.신고 방법은 본인 또는 대리인이 가까운 경찰관서(경찰서‧지구대‧파출소)나 신고소가 설치된 군부대에 불법무기류를 제출하면 되고, 부득이한 사정으로 신고 기간 내에 불법무기류를 제출하기 어려울 때는 전화 또는 우편으로 사전 신고 후 실물을 제출할 수도 있다.전남경찰청은 ""자진신고 기간 종료 후 5월 한 달간 전국적으로 불법무기 소지를 집중적으로 단속할 예정이니 이번 자진신고 기간에 불법무기를 모두 가까운 경찰관서에 신고할 것을 당부한다""라고 말했다.이어 ""특히, 총포화약법에 따라 불법으로 총기를 제조·판매·소지할 경우 3년 이상 15년 이하의 징역 또는 3천만 원 이상 1억 원 이하의 벌금으로 처벌받을 수 있으니, 이번 기회를 놓치지 말고 빠짐없이 신고해 달라""라고 덧붙였다.※CBS노컷뉴스는 여러분의 제보로 함께 세상을 바꿉니다. 각종 비리와 부당대우, 사건사고와 미담 등 모든 얘깃거리를 알려주세요.이메일 : jebo@cbs.co.kr카카오톡 : @노컷뉴스사이트 : https://url.kr/b71afn"
2023.04.02.,"에스파, 올 8월 日 도쿄돔 입성…해외 가수 중 최단기간",https://n.news.naver.com/mnews/article/079/0003754370?sid=106,<구조 다름>
2023.04.02.,"만덕~센텀 대심도 토사붕괴사고, 보강작업 완료",https://n.news.naver.com/mnews/article/079/0003754438?sid=102,"만덕~센텀 대심도 대규모 토사 붕괴 사고 현장. 부산시 제공만덕~센텀 대심도 대규모 토사 붕괴사고 이후 보강작업을 한달 넘게 한 결과 지반이 안정된 것으로 나타났다.부산시는 민·관 합동 자문회의 개최 결과 만덕~센텀 대심도 토사유출사고 보강공사가 완료됐다고 2일 밝혔다시는 지난 2월 25일, 대심도 공사 토사 붕괴 사고 발생 이후 지반 전체에 시멘트를 채워 단단하게 만드는 그라우팅 작업을 벌였다.지난 27일까지, 시멘트 759㎥규모를 주입한 것으로 나타났다.대한토목학회는 지난달 30일부터 지난 1일까지 보강 상태를 점검했고, 2일 민·관 합동 자문회의를 열고 지반이 안정화됐다고 판단했다.이에따라 시는 부산교통공사와 협의해 현재 감속운행중인 도시철도 3호선 운행속도 정상화를 검토할 방침이다.사고지점을 지나는 도시철도 3호선 만덕~미남역 구간 도시철도는 추가 붕괴사고를 우려해 지난달부터 시속 70km에서 25km로 속도를 줄여 운행하고 있다.※CBS노컷뉴스는 여러분의 제보로 함께 세상을 바꿉니다. 각종 비리와 부당대우, 사건사고와 미담 등 모든 얘깃거리를 알려주세요.이메일 : jebo@cbs.co.kr카카오톡 : @노컷뉴스사이트 : https://url.kr/b71afn"
2023.04.02.,"김효주, LPGA 투어 LA 오픈 3라운드 2위…선두와 2타 차",https://sports.news.naver.com/news.nhn?oid=079&aid=0003754423,<구조 다름>
2023.04.02.,블록체인 '봄바람'…넥슨 가세한 韓 대표 게임들 글로벌 출사표,https://n.news.naver.com/mnews/article/003/0011778578?sid=105,"기사내용 요약한국 대표 블록체인 MMORPG '글로벌 정조준'넥슨 '메이플스토리'·컴투스 '크로니클' 등 주목[서울=뉴시스] 오동현 기자 = 비트코인이 3700만원대를 회복하며 블록체인 게임 시장에도 봄바람이 불고 있다. 지난해 가상자산 시장 한파를 견딘 국내 블록체인 게임 업계가 전 세계 게임 시장의 가장 큰 규모를 차지하는 아시아 시장에서 인기 장르인 MMORPG(다중접속역할수행게임)에 블록체인 기술을 접목해 새로운 성장동력 창출에 나선다. 특히 시가 총액 27조원에 달하는 국내 게임업계 맏형 '넥슨'까지 블록체인 게임 시장에 가세하며 새 바람을 예고하고 있다. 위메이드, 넷마블, 컴투스, 카카오게임즈, 네오위즈 등 국내 게임사들의 대표 게임 IP(지식재산권)과 함께 아시아를 넘어 글로벌 시장에서 블록체인 게임 대중화 시대를 열지 주목된다. 2일 가상자산 정보 플랫폼 쟁글에 따르면, 아시아 게임 시장은 전 세계에서 가장 큰 시장이다. 게임 이용자 수는 17억명을 초과해 전체의 55%에 달하고, 매출액 관점에서도 연간 720억 달러(약 94조원) 규모에 달해 전체 시장의 52%를 차지한다. 특히 액션 게임이나 전략 게임을 선호하는 서구권과 다르게 아시아 시장은 RPG 장르를 선호한다. 특히 MMORPG는 블록체인 기술을 도입하기 적합한 장르다. MMORPG는 유저가 자신의 캐릭터와 아이템을 소유하고, 가상 세계에서 다른 유저와 상호작용하며 게임 내 콘텐츠를 확장하는 구조를 가진 게임이다. 여기에 블록체인 기술을 접목하면 유저에게 디지털 자산 소유권을 부여하고, 생태계 기여도에 따른 보상을 지급할 수 있다. 이는 국내 게임사들이 가장 잘 하는 MMORPG 장르에 블록체인 기술을 접목해 게임을 출시하는 이유다. 유저들에게 장르적 재미와 함께 가상자산 보상이라는 동기부여를 제공한다. 넥슨의 NFT 생태계 첫 게임 '메이플스토리 N'…韓 기대주"
2023.04.02.,내년부터 자산 10조원 이상 코스피 상장사 영문공시 의무화,https://n.news.naver.com/mnews/article/079/0003754399?sid=101,"금융위, 한국거래소 관련 규정 개정외국인 투자자 자본시장 접근성 제고금융위원회. 연합뉴스 내년부터 자산 규모가 10조원 이상이거나 외국인 투자 비중이 높은 코스피 상장사는 중요 정보에 대한 영문 공시를 의무적으로 해야 한다.금융위원회와 한국거래소는 코스피 상장기업의 영문공시 의무화를 단계적으로 도입하는 내용을 담아 관련 규정을 개정했다고 2일 밝혔다.앞서 지난 1월 금융위는 외국인 투자자의 자본시장 접근성을 높이기 위해 영문 공시를 단계적으로 확대하겠다고 밝힌 바 있다.2024년부터 자산 10조원 이상 코스피 상장사(외국인지분율 5% 미만인 경우 제외) 또는 외국인 지분율 30% 이상(자산 2조원 이상 10조원 미만) 코스피 상장사들은 개정 규정에 따라 의무적으로 영문 공시를 해야 한다.대상 항목은 거래소 주요 경영사항 공시 가운데 결산 관련 사항, 법정공시 공통 사항, 매매거래정지 수반 사항이다.대상 기업은 국문공시 제출 후 3일 이내에 영문공시도 함께 제출해야 한다.금융위는 2단계 의무화가 적용되는 2026년부터 대상 법인을 자산 2조원 이상 코스피 상장사로 확대한다는 계획이다.2단계부터는 공시 대상 항목도 확대하고, 제출 시점도 원칙적으로 국문공시와 동시에 제출하도록 하는 방안을 검토 중이다.금융위는 ""이번 방안이 외국인 투자자들의 정보 접근 환경을 개선하고, 우리 자본시장의 글로벌 경쟁력 제고에 기여할 수 있을 것으로 기대한다""고 말했다. ※CBS노컷뉴스는 여러분의 제보로 함께 세상을 바꿉니다. 각종 비리와 부당대우, 사건사고와 미담 등 모든 얘깃거리를 알려주세요.이메일 : jebo@cbs.co.kr카카오톡 : @노컷뉴스사이트 : https://url.kr/b71afn"
2023.04.02.,양도세·법인세·종부세 감소…올해 4년 만에 세수결손 가능성,https://n.news.naver.com/mnews/article/079/0003754406?sid=101,"올해 1~2월에만 15.7조원 감소3월부터 지난해만큼 걷어도 세수 부족 직면세수 감소. 연합뉴스올해 경기 침체 우려와 자산시장 경색, 각종 감세 정책 등의 영향으로 지난 2019년 이후 4년 만에 '세수결손'이 발생할 수 있다는 우려가 나온다.이미 올해 1~2월 세수는 지난해 같은 기간보다 15조7천억원이 감소했다.3월부터 연말까지 지난해와 같은 수준의 세금이 들어오더라도 연간 세수는 정부가 짠 올해 세입예산보다 20조원 넘게 부족해질 전망이다.2일 기획재정부에 따르면 올해 1~2월 국세수입은 54조2천억원으로 1년 전보다 15조7천억원 줄었다.양도소득세와 증권거래세, 부가가치세 등이 감소한 영향을 받았다.올해 정부가 짠 세입예산 대비 국세수입이 얼마나 들어왔는지를 뜻하는 진도율도 2월 13.5%로 최근 5년 평균 2월 16.9%보다 3%포인트 넘게 빠졌다.정부는 올해 국세수입이 총 400조5천억원 들어올 것으로 예상하고 세입예산을 짰다.지난해 걷힌 세금 395조9천억원보다 4조6천억원이 증가할 것으로 본 셈이다.하지만 올해 2월까지 15조7천억원의 세수가 지난해보다 감소했다.3월 이후 지난해와 똑같이 세금이 걷힌다고 해도 올해 세수는 세입예산보다 20조3천억원이 줄어들게 된다.문제는 3월 이후에도 세수가 지난해보다 더 감소할 가능성이 크다는 점이다.올해 1~2월 세수가 지난해보다 줄어든 가장 큰 원인은 자산세수 감소 때문이다.부동산·주식시장이 침체하면서 양도세와 증권거래세 등이 5조원 넘게 줄었다.1~2월 양도세수에 영향을 미친 지난해 11~12월 주택매매량은 전년 같은 기간보다 절반 가량 줄었다.아직 발표되지 않은 3월 세수에 영향을 미칠 1월 주택매매량 역시 40% 가까이 줄어든 것으로 나타나 양도세 감소는 계속될 것으로 보인다.다만 2월부터는 주택매매량이 다소 늘어 전년 대비 감소 폭이 축소됐고, 주식 거래량도 많아져 1~2월보다는 자산세수가 회복할 가능성도 있다.법인세 감소도 우려되는 지점이다. 지난해 말부터 경기가 나빠지면서 국내 대기업들의 4분기 영업이익은 70% 가량 급감했다.지난해 중간예납으로 이미 납부한 법인세까지 고려하면 올해 들어오는 나머지 납부분은 더 크게 줄어들 것으로 보인다.주택가격이 내려가면서 공시가격이 하락한 데다 정부의 공제·세율 조정과 2주택 중과 해제 등의 효과까지 겹치면서 종합부동산세 세수도 수조 원 가까이 감소할 것으로 예상된다.정부는 올해 1분기 세수가 기저효과와 경기 하강으로 지난해보다 감소하겠지만, 하반기 경기가 살아난다면 1분기 감소 폭을 만회할 수 있을 것으로 기대하고 있다.하지만 하반기 세수가 많이 증가하지 않고 자산세·법인세수 등 감소 영향이 커진다면 세입예산 대비 '세수펑크' 규모는 20조원대보다 더 늘어날 수도 있다.이럴 경우 올해 정부는 2019년 이후 4년 만의 세수결손에 직면하게 된다.지난 2019년 세입예산은 294조8천억원이었는데 결산상 국세수입은 293조5천억원으로 1조3천억원이 모자랐다.2010년 이후 세수결손이 발생한 것은 2012년, 2013년, 2014년, 2019년 등 네 차례다. ※CBS노컷뉴스는 여러분의 제보로 함께 세상을 바꿉니다. 각종 비리와 부당대우, 사건사고와 미담 등 모든 얘깃거리를 알려주세요.이메일 : jebo@cbs.co.kr카카오톡 : @노컷뉴스사이트 : https://url.kr/b71afn"
2023.04.02.,"'대통령 멘토' 신평 ""尹정부에 등 돌리는 국민…이러면 내년 총선은 '불문가지'""",https://n.news.naver.com/mnews/article/079/0003754435?sid=100,"지난달 기시다 후미오 일본 총리와 정상회담을 위해 일본으로 출국 중인 윤석열 대통령과 김건희 여사. 황진환 기자 윤석열 대통령의 '멘토'로 알려진 신평 변호사가 ""국민은 차츰 윤 정부에 등을 돌리고 있다""며 ""이렇게 가면 내년 총선의 결과는 불문가지(不問可知, 묻지 않아도 알 수 있다)""라고 지적했다.앞서 국민의힘 당 대표 선거에서 김기현 당시 후보의 후원회장을 맡기도 했던 신 변호사는 2일 자신의 페이스북을 통해 ""윤 정부는 지금 과도하게 10분의 3을 이루는 자기 지지층을 향한 구애에 치중한다. 윤 대통령이 대구의 서문시장을 방문한 것은 그 상징적인 예""라며 이같이 밝혔다.그는 ""그 늪에서 헤어나오지 못하는 한 선거는 패배할 수밖에 없다""며 ""왜 윤 정부는 어리석게도 여기에서 빨리 벗어나지 못하는 것일까""라고 토로했다.신 변호사는 ""한국에서의 선거는 보수, 중간층, 진보의 3 : 4 : 3의 판에서 중도층의 마음을 누가 더 얻느냐에 따라 결정된다. 그리고 과반수의 유권자가 거주하는 수도권의 표심이 승패를 결정한다""며 ""그런 면에서 윤석열 정부는 지금 위험한 선택을 하고 있다""고 밝혔다.또 ""대통령실에서 검사 출신 수십 명을 총선에 공천, 당선시켜 윤 정부의 전위대로 삼는다는 말이 파다하게 퍼져있다""며 ""이 역시 지극히 근시안적이고 국민의 심정을 너무나 헤아리지 않는 발상""이라고 지적했다.그러면서 ""윤 정부의 단명을 재촉할 수 있는 새로운 시대정신이 서서히 국민의 가슴 속에 태동하기 시작한 것이 아닌가 한다""며 ""(이것이) 태풍으로 변하는 경우의 그 시대정신은 우선 분열된 국민을 통합하는 쪽으로 움직일 것이다. 그리고 국민의 가슴 속에 담긴 한(恨)과 뿌리 깊은 정서를 이해하는 정치세력의 출현을 희망할 것""이라며 이러한 성격의 태풍을 탈 수 있는 사람으로 더불어민주당 김두관 의원을 언급하기도 했다.※CBS노컷뉴스는 여러분의 제보로 함께 세상을 바꿉니다. 각종 비리와 부당대우, 사건사고와 미담 등 모든 얘깃거리를 알려주세요.이메일 : jebo@cbs.co.kr카카오톡 : @노컷뉴스사이트 : https://url.kr/b71afn"
2023.04.02.,"""요금인상 지연시 한전채 발행한도 초과…전력 공급망 위태""",https://n.news.naver.com/mnews/article/079/0003754400?sid=101,"산업부, 한전·가스공사와 긴급회의…""가스공사 미수금 이자비용 하루에 13억원 발생 예상""서울시내 주택가에 설치된 도시가스 계량기 모습. 황진환 기자정부가 전기·가스요금 인상이 지연될 경우 한국전력은 사채 발행 한도를 초과해 전력 공급망이 위태로워지고, 한국가스공사는 미수금이 올해 말 13조원까지 불어날 것이라는 분석을 내놨다.2분기 요금 조정이 유보된 가운데 한전과 가스공사의 경영 상황을 고려하면 요금 인상이 불가피함을 내비친 것이다.산업통상자원부는 2일 한전아트센터에서 정승일 한전 사장, 최연혜 가스공사 사장 등이 참석한 가운데 '에너지공기업 긴급 경영상황 점검회의'를 열고 요금 조정 지연으로 발생할 수 있는 리스크(위험성)를 점검했다고 밝혔다.한전은 전기요금을 통한 원가 회수율이 약 70%에 불과해 발전사에 지급하는 전력구입대금을 매달 4회(평균 9일 간격) 사채를 발행해 조달하고 있다고 설명했다. 문제는 올해도 적자가 5조원 이상 발생할 경우 내년에는 한전법에 규정된 사채 발행 한도(자본금과 적립금을 합한 금액의 5배) 초과가 예상된다는 점이다.한전은 사채 발행에 차질이 생기면 전력구매대금과 기자재·공사대금 지급이 어려워져 전력산업 생태계 전반이 위태로워질 가능성이 크다고 강조했다. 매년 6조~7조원 수준인 송·배전망 투자가 위축돼 발전사가 생산한 전기를 수요처에 보내지 못하게 되면 발전소의 출력제한이 확대되고 전력계통의 안정성이 취약해질 우려도 제기된다.한전은 또 전기요금 인상이 지연되면 한전채 발행 규모를 늘릴 수밖에 없어 한전채 '쏠림 현상'으로 인한 채권 시장 교란이 발생할 수 있다고 우려했다. 채권 총 발행액에서 한전채가 차지하는 비중은 지난해 4.8%(37조2천억원)에 달했고 올해는 벌써 2.6%(5조3천억원)를 차지하고 있다. 한전채 금리는 2021년 6월 1.6%에서 작년 10월 5.8%까지 올랐고 지난달에도 4.3%를 기록하며 높은 수준을 유지하고 있어 발행 규모가 확대되면 쏠림 현상이 심화할 가능성이 거론된다. 가스공사는 역시 가스요금이 인상되지 않을 경우 작년 말까지 누적된 8조6천억원의 원료비 미수금이 올해 말 12조9천억원까지 불어날 것으로 전망했다. 이렇게 되면 미수금에 대한 연간 이자 비용은 약 4700억원(하루당 13억원)에 달할 것으로 예상된다. 현재 가스요금을 통한 원가 회수율은 62.4%에 불과해 가스공사의 미수금은 계속해서 늘어날 수밖에 없는 상황이다.가스공사는 ""코로나 사태 이후 중국 리오프닝에 따른 액화천연가스(LNG) 수요 증가, 유럽 국가와의 비축용 LNG 도입 경쟁, 주요 LNG 생산 프로젝트 투자 위축으로 불확실성이 지속되는 상황""이라며 ""가스공사의 재정 악화가 LNG 물량 확보 협상에 부정적으로 작용할 수 있다""고 우려했다.산업부는 이런 한전·가스공사의 재무 상황과 물가, 국제 에너지 가격 추이를 검토해 빠른 시일 내에 전기·가스요금 조정 방안을 발표한다는 방침이다.오는 3일에는 이창양 장관이 참석하는 '에너지위원회 민간위원 긴급간담회'를 열고 에너지요금 조정 필요성을 논의한다.한전과 가스공사는 올해 각각 1조5천억원과 2조7천억원 규모의 재정 건전화 계획을 차질없이 이행하는 한편 추가적인 인건비·경비 조정 방안을 모색할 예정이다.※CBS노컷뉴스는 여러분의 제보로 함께 세상을 바꿉니다. 각종 비리와 부당대우, 사건사고와 미담 등 모든 얘깃거리를 알려주세요.이메일 : jebo@cbs.co.kr카카오톡 : @노컷뉴스사이트 : https://url.kr/b71afn"
2023.04.02.,"부산항 북항 공공시설, 3일부터 전면 개방",https://n.news.naver.com/mnews/article/079/0003754451?sid=102,"핵심요약북항 1단계 부지 중 공중보행로, 해안 조망대 등 공개부산항만공사 제공정부가 부산항 북항 재개발 혜택을 시민들에게 돌려주기 위해 1단계 항만재개발구역 내 공공시설을 3일부터 전면 개방하기로 했다.2일 해양수산부는 북항 1단계 부지 중 도로 3.1㎞(중앙역~국제여객터미널), 공원 9만 ㎡, 공중 보행로(부산역~국제여객터미널), 해안 조망대 등을 3일 부터 개방한다고 밝혔다.앞서 해수부는 지난 2008년부터 부산항 북항 1단계 항만재개발 사업을 추진해 지난해 12월 주요 기반시설 조성을 끝냈다.이번 공공시설이 개방하면 인근 충장로 지하차도 건설공사로 인한 교통난이 일정부분 해소될 전망이다.또, 시민들도 더 편하게 도시철도와 여객선 간 환승을 할 수 있을 것으로 보인다.북항 내 공원, 해안 조망대도 개방해 부산의 또다른 관광지가 될 것으로 기대된다.해수부는 국제박람회기구(BIE)의 부산 현지실사(4월 4일~4월 6일)에 맞춰 3일부터 6일까지 북항 1단계 항만재개발구역 일대에서 '2030 부산세계박람회 유치 기원 행사'를 연다.행사는 드론 불빛쇼, 소원을 비는 종이배 유등 캠페인, 박람회 유치 기원 2030 걷기대회, 반려견과 함께 즐기는 행사, 경관수로를 탐방하는 카약 체험, 북항 역사·사진 전시, 벼룩시장·먹거리 트럭, 어린이를 위한 안전 자전거 제공 등으로 다채롭게 꾸며진다.※CBS노컷뉴스는 여러분의 제보로 함께 세상을 바꿉니다. 각종 비리와 부당대우, 사건사고와 미담 등 모든 얘깃거리를 알려주세요.이메일 : jebo@cbs.co.kr카카오톡 : @노컷뉴스사이트 : https://url.kr/b71afn"
2023.04.02.,"""온라인 브랜드가 대세""…유튜브·넷플릭스 브랜드가치 '껑충'",https://n.news.naver.com/mnews/article/001/0013853435?sid=101,"브랜드스탁, 1분기 100대 브랜드 발표…삼성 갤럭시 1위(서울=연합뉴스) 장하나 기자 = 코로나를 계기로 비대면 위주의 활동이 급속하게 늘면서 온라인 기반 브랜드의 가치도 높아진 것으로 조사됐다.국내외 대형 온라인 플랫폼 (PG)[장현경 제작] 일러스트    브랜드가치 평가회사 브랜드스탁은 올해 1분기 100대 브랜드 평가 결과 동영상 플랫폼 대표 브랜드인 유튜브가 브랜드가치 평가지수 BSTI(BrandStock Top Index)에서 900.5점을 얻어 지난해 종합 순위 9위에서 1분기 7위로 상승했다고 2일 밝혔다.    유튜브는 2020년 3분기에 33위로 처음 순위에 진입한 데 이어 1년 6개월 만인 작년 1분기 10위에 올랐다. 이는 최근 10년간 가장 빠르게 10위권에 진입한 기록이다.    지난해 역대 최대 26조원대 매출을 달성한 온라인 쇼핑 브랜드 쿠팡은 이번에 4계단 오른 16위를 기록했다.    '더글로리' 등의 화제작을 지속해서 내놓고 있는 넷플릭스(65위)도 26계단 뛰어오르며 큰 폭의 상승세를 보였다.    중고 온라인마켓 브랜드인 당근마켓(62위→60위)도 꾸준히 순위가 상승하고 있다.    브랜드스탁은 ""코로나를 계기로 기존 오프라인 위주의 시장 환경이 비대면 위주로 바뀌면서 온라인 기반 브랜드들이 생활 전반을 지배하게 됐다""며 ""각 부문에서 기존 오프라인 브랜드를 넘어서는 온라인 브랜드가 속속 등장할 것""이라고 분석했다.사전판매 신기록 '갤럭시 S23' 공식 출시[연합뉴스 자료사진]    삼성전자의 스마트폰 브랜드인 삼성 갤럭시는 935.6점을 얻으며 전체 1위를 유지했다.    카카오톡이 2위 자리를 지켰고, 네이버와 KB국민은행, 신라면, 롯데월드 어드벤처, 이마트, 신한카드, 구글 등이 상위 10위권에 포함됐다.    미래에셋증권(35위→23위)과 KB증권(71위→47위), 삼성증권(53위→50위) 등 증권 빅3 브랜드 모두 상승했다.    올해 초만 해도 변동성 많은 대내외 시장 환경 등으로 하락세가 예상됐던 주식 시장이 종합주가지수 2,300∼2,400선을 견고히 유지하면서 주요 증권 브랜드의 가치가 오히려 상승한 것으로 보인다.서울 남산에서 바라본 시내 아파트 모습[연합뉴스 자료사진]    아파트 1위 브랜드인 자이가 지난 연말(23위) 대비 4계단 하락한 27위에 머문 것을 비롯해 래미안(50위→56위), 롯데캐슬(70위→72위), 힐스테이트(83위→85위) 등 아파트 브랜드 대부분이 부동산 경기 침체로 하락세를 보였다.    창고형 할인매장 브랜드인 트레이더스(84위)와 복합쇼핑몰 브랜드인 스타필드(100위)가 나란히 순위권에 처음 진입하는 등 총 7개 브랜드가 신규 진입했다.    대한민국 100대 브랜드는 BSTI 점수가 높은 브랜드를 상위 100위까지 선정해 발표하는 국내 유일의 브랜드 가치평가 인증제도다.    BSTI는 총 230여개 부문의 대표 브랜드 1천여개를 대상으로 브랜드스탁 증권거래소의 모의주식 거래를 통해 형성된 브랜드주가지수(70%)와 정기 소비자조사지수(30%)를 결합한 브랜드가치 평가모델이다. 만점은 1천점이다. 2023년 1분기 대한민국 100대 브랜드 상위 30위    hanajjang@yna.co.kr"
