기사날짜,기사제목,네이버 뉴스 url,기사내용
2021.03.19.,"상장 첫 날 상한가 친 SK바이오사이언스, '따상상' 이어질까",https://n.news.naver.com/mnews/article/011/0003885238?sid=101,"이틀 연속 상한가 기록 시 시총 17조원···삼성생명 제쳐매수 대기 물량만 1조원···시간 외 거래도 투자 수요 몰려'따상상' 성공은 SK바이오팜·카카오게임즈 유일안재용 SK바이오사이언스 대표이사가 18일 서울 여의도 한국거래소에서 열린 백신개발생산업체 SK바이오사이언스의 유가증권시장 신규상장 기념식에서 북을 치고 있다. /이호재기자[서울경제] SK바이오사이언스(302440)가 상장 첫날 상한가로 직행한 데 이어 이틀째 상한가를 기록할 지 관심이 집중되고 있다. SK바이오사이언스가 2일 연속 상한가를 기록하는 ‘따상상’을 할 경우 시가총액이 17조 원까지 불어나 삼성생명을 제치고 코스피 시총 순위 22위까지 오를 것으로 전망된다. 19일 한국거래소에 따르면 SK바이오사이언스의 상장 첫 날 주가는 시초가 대비 30%(3만 9,000원) 오른 16만 9,000원에 거래를 마쳤다. 지난 18일 SK바이오사이언스는 시초가가 공모가(6만 5,000원)의 2배로 결정된 뒤 바로 상한가로 치솟아 공모가 대비 160% 이상 올랐다. 시총은 12조 9,285억 원을 기록하며 코스피 시장 기준 28위에 올랐다. 이른바 ‘따상(공모가 두 배에 시초가를 형성한 뒤 가격 제한폭까지 오르는 것)’에 성공하며 주가 급등으로 정적·동적 변동성완화장치(VI)가 발동되기도 했다.상장 첫 날 장 개시 2분 만에 SK바이오사이언스는 상한가를 기록했다. 이어 주식을 사려는 투자자들이 집중되며 극심한 매매 정체가 벌어지기도 했다. SK바이오사이언스는 기관 물량의 85.26%에 해당하는 1,076만 주에 의무 보유 확약이 걸려 있어 유통 가능 주식이 제한적이기 때문이다. 상장일 유통 가능 주식은 889만 7,510주로 발행주식의 11.6%에 불과했다. 공모가 기준 유통 주식 규모도 5,784억 원으로 빅히트(9,045억 원)의 3분의 2 수준이었다. 상장 첫날 거래된 물량은 총 75만 8,239주로 유통 가능한 주식 대비 8.5% 수준이었다. 매도하려는 사람이 극히 적다 보니 장이 마감되기 전까지 주식을 매입하려는 매수 대기 물량은 640만 주가 넘었다. 시가로 1조 원이 넘는 금액이 쌓인 채로 장이 끝났다. 시간 외 거래에서도 매수 대기 물량이 124만주 이상이 쌓였다. SK바이오사이언스 공모주 투자자들을 비롯해 임직원들도 대박을 터뜨리게 됐다. 공모주 투자자의 경우 상장 첫 날만 하더라도 주당 10만 4,000원, 즉 2.6배의 수익률을 냈다. 이는 카카오게임즈(293490)나 빅히트엔터테인먼트 공모주 청약보다 수익금이 더 많다. 또한 우리사주로 평균 7,597주를 받은 임직원은 1인당 평가이익이 평균 7억 7,800만 원에 이를 것으로 추정된다. 안재용 대표이사 등 임원 4명이 받은 주식매수청구권(스톡옵션)의 행사 가격은 주당 9,154원으로, 주가를 반영할 경우 총 873억 원으로 계산된다. 임원별로 175억~349억 원에 해당하는 금액이다. 더불어 6,000만 주를 보유한 대주주 SK케미칼은 지분 가치가 10조 1,000억 원으로 늘었다. 증권사 관계자는 “SK바이오사이언스가 상장 다음날도 한 번 더 상한가를 기록하는 ‘따상상’에 성공할 경우 주가는 21만9,000원, 3일 연속 상한가를 내는 ‘따상상’은 34만9,500원까지 오른다""며 ""최근 ‘따상상’에 성공한 공모주는 카카오게임즈와 SK바이오팜(326030)이 유일하다”고 말했다.한편 전날 시장에서 거래된 SK바이오사이언스 상한가 물량의 약 70%를 특정 증권사가 독식하는 현상이 재연됐다. 장중 거래된 76만여 주 가운데 53만여 주가 교보증권 창구 한 곳에서만 거래된 것이다. 3만 2,000여 주를 사들여 매수 상위 2위에 이름을 올린 키움증권과 비교해 16배가 넘는 규모다. 업계는 교보증권을 이용하는 소수의 투자자가 장 시작 직후 유통 물량을 독식할 정도의 대량 주문을 한 번에 내 물량을 쓸어가는 이른바 ‘상따팀’이 가동된 것 아니냐고 지적했다. 이처럼 증권사 한 곳이 ‘따상’ 물량을 쓸어갔던 현상은 과거 SK바이오팜과 카카오게임즈의 상장 첫날에도 나타냈다. 두 회사 모두 다음날 역시 상한가 행진을 이어갔던 점을 볼 때 SK바이오사이언스 역시 비슷한 행보를 보일지 관심이다./박시진 기자 see1205@sedaily.com▶ 상위 1% 투자자 픽! [주식 초고수는 지금]▶ 지피지기 대륙 투자 공략법[니하오 중국증시]▶ 네이버 채널에서 '서울경제' 구독해주세요!저작권자 ⓒ 서울경제, 무단 전재 및 재배포 금지"
2021.03.19.,[이슈IN]게임업계 연봉킹은 김택진…그 다음은 누구?,https://n.news.naver.com/mnews/article/293/0000033888?sid=105,"지난해 게임업계에서 가장 많은 보수를 챙긴 임직원은 김택진 엔씨소프트 대표인 것으로 집계됐다. 리니지 IP를 기반으로 한 모바일 게임 흥행에 따른 성과 인센티브가 더해져 180억원이 넘는 보수를 받은 것으로 알려졌다.엔씨는 인센티브, 넷마블·카카오게임즈는?19일 게임업계에 따르면 지난해 사업보고서 기준 50억원이 넘는 보수를 챙긴 임직원은 김택진 엔씨소프트 대표와 남재관 카카오게임즈 전 최고재무관리자(CFO)다.김택진 대표는 지난해 보수총액 184억1400만원을 기록했다. 총액에는 보수, 상여, 기타 근로소득이 포함됐다. 이 중 급여는 21억1600만원이며 상여금으로만 162억7900만원을 받은 것으로 나타났다. 기타 근로소득 1900만원도 포함됐다.지난해 게임업계 임직원 보수총액. (자료=금융감독원 전자공시시스템. 그래픽=채성오 기자)특히 상여금 부분은 '리니지M'과 '리니지2M'에 따른 성과 인센티브가 대거 반영된 것으로 확인됐다. 김택진 대표는 2019년 재무목표 달성도와 모바일 사업 성공에 대한 성과를 인정받아 57억7530만원의 '단기 성과 인센티브'를 받았고, 리니지 IP 기반 모바일 게임 개발 및 상용화 추진을 선도했다는 이유로 '특별 장기 인센티브' 90억원도 수령했다. 임원으로서 종전 기여 및 향후 기대 기여도를 바탕으로 지급하는 '임원 장기 인센티브' 15억원과 설 명절 특별상여금·리니지M 3주년 축하 기념·코로나19 관련 임직원 격려금 등 특별 격려금(400만원)도 포함됐다.엔씨소프트에서는 김택진 대표 외에 이성구 전무, 윤재수 부사장, 김택헌 수석부사장, 백승욱 상무 등이 각각 30억원이 넘는 보수를 지급받았다. 특히 리니지2M을 총괄한 이성구 전무는 급여, 상여금, 기타근로소득을 포함해 총 49억원의 보수를 챙긴 것으로 나타났다.이날 사업보고서 기준 김택진 대표 다음으로 많은 보수를 챙긴 업계 임직원은 남재관 전 카카오게임즈 최고재무관리자(CFO)다. 남재관 CFO의 경우 급여는 2300만원에 불과했지만 스톡옵션 행사 이익으로 50억8400만원을 수령했다. 지난해 9월 10일 카카오게임즈가 코스닥에 상장한 직후 '따상'(공모가 2배로 시초가 형성 후 상한가)을 기록해 큰 폭의 차익을 실현한 것으로 분석된다. 박영호 신사업본부장, 김화선 계열사 등기임원, 오수영 팀장도 스톡옵션 행사를 통해 각각 10억원이 넘는 보수를 수령했다.스톡옵션을 행사하지 않은 남궁훈·조계현 공동대표는 각각 13억600만원과 9억4500만원의 보수를 받았다.넷마블의 경우 방준혁 의장보다 권영식·이승원 각자 대표의 보수가 높은 것으로 집계됐다. 방준혁 의장은 넷마블과 코웨이를 이끌면서 지난해 급여 13억8000만원을 받았고 재무성과, 글로벌 시장 확장, 신규 성장 기반 창출 등의 기준을 통해 보수월액의 850%인 9억7800만원의 상여금도 수령했다.권영식 대표는 지난해 5억3000만원의 급여와 3억100만원의 상여금을 수령했다. 총 2회에 달하는 스톡옵션 행사로 35억6100만원을 받아 총 보수총액 44억1800만원을 기록했다. 이승원 대표도 지난해 스톡옵션을 행사해 14억2500만원을 수령했다. 급여와 상여금을 더해 같은 기간 보수총액 19억7900만원을 기록한 것으로 나타났다.이 외 박관호 위메이드 의장은 16억200만원의 보수를 수령했다. 박관호 의장은 지난 2019년과 마찬가지로 급여 16억원과 기타 근로소득 200만원을 받은 것으로 알려졌다.게임업계 관계자는 ""엔씨소프트는 리니지 IP를 기반으로 한 매출 성과 등에 따라 다양한 인센티브를 지급한 것""이라며 ""지난해는 카카오게임즈 임직원들이 코스닥 상장 후 스톡옵션을 행사하며 높은 연봉을 수령한 것이 특징""이라고 말했다.채성오 기자(cso86@bloter.net)[블로터 바로가기] ▶ 네이버 메인에서 블로터 뉴스 구독하기 ▶ 블로터 아카데미에서 마케팅 역량을 키우세요 ▶ 확장 가능 애자일 조직, 디지털 성장의 핵심동력  저작권자 ⓒ(주)블로터앤미디어, 무단 전재 및 재배포 금지"
2021.03.19.,'비트코인' 수혜주? 네이버·카카오 기술경쟁에 IT기업 요동,url없음,<네이버 기사 없음>
2021.03.19.,19일째 '야동' 못지운 與맹성규 의원실 단톡방…무슨 일이,https://n.news.naver.com/mnews/article/025/0003086395?sid=100,"맹성규 더불어민주당 의원실이 '지지자 카카오톡 단체 채팅방'에 부적절한 영상이 게시됐지만, 삭제가 여의치 않아 수습에 진땀을 흘리고 있다. [사진 맹성규의원실]           맹성규 더불어민주당 의원실이 개설한 지지자 카카오톡 단체 채팅방(단톡방)에 부적절한 영상이 게시됐지만, 삭제가 여의치 않아 수습에 진땀을 흘리고 있다.      19일 맹성규 의원실에 따르면 지난 1일 낮 12시 38분쯤 한 지역 대의원 A씨가 맹 의원 지지자 단톡방에 25분 분량의 포르노 영상(야동)을 올렸다. 의원실 관계자는 곧바로 A씨에게 게시물 삭제를 요구했다.      A씨는 ""나도 모르는 사이에 계정을 해킹당해 동영상이 게시된 것 같다""고 해명했다. 하지만 영상은 아직도 남아있다. 카카오톡 기능상 자신이 보낸 메시지를 취소할 수 있는 시간인 5분이 지나 영상을 삭제할 수 없었기 때문이다.      의원실은 단톡방 참가자 100여명에게 모두 방을 나간 뒤 새로운 단톡방에 가입해달라고 요청했다. 하지만 현재까지도 30여명이 방에 남아있는 상태로, 문제의 영상도 사라지지 않고 있다.      맹 의원실 관계자는 ""게시물을 올린 후 5분이 지나면 자체 삭제가 안 되기 때문에 기존 회원들에게 방에서 나와달라고 계속 요청하고 있는 중""이라며 유사사례 재발을 막기 위해 회원 강제 탈퇴 권한과 게시물 가리기 기능이 있는 단톡방을 개설했다고 밝혔다.      고석현 기자 ko.sukhyun@joongang.co.kr  ▶ 소름돋게 잘 맞는 초간단 정치성향테스트▶ 넌 뉴스를 찾아봐? 난 뉴스가 찾아와!▶ 당신이 궁금한 코로나, 여기 다 있습니다ⓒ중앙일보(https://joongang.co.kr), 무단 전재 및 재배포 금지"
2021.03.19.,"의정부시 송산2동, 카카오톡 채널 '복지 안테나' 개설",url없음,<네이버 기사 없음>
2021.03.19.,"현대백화점, 카카오톡 쇼핑하기서 봄맞이 기획전",url없음,<네이버 기사 없음>
2021.03.19.,"무료서비스로 기반 닦은 플랫폼…""익숙해졌으니 돈 내""",https://n.news.naver.com/mnews/article/008/0004559550?sid=105,"[머니투데이 오상헌 기자] [카카오T 우선배차 콜 수수료 부과에 택시업계 반발SKT서 분사한 T맵 '제로레이팅 중단' 이용자 불만원격수업 플랫폼 '줌' 유료화 교육현장서도 혼란](대구=뉴스1) 공정식 기자 = 카카오 택시. 2019.12.4/뉴스1  ""시장지배력을 활용한 교란행위이자 횡포다"" vs ""서비스 고도화를 위해선 유료화가 불가피하다""ICT(정보통신기술) 플랫폼 서비스의 잇단 유료화로 곳곳에서 잡음이 터져나오고 있다. 모빌리티 서비스인 카카오T(배차 콜 유료 멤버십 도입)와 T맵(데이터 무료 종료)이 유료화 논란에 휩싸였고, 교육현장에서 쓰이는 화상회의 앱 줌(Zoom)의 유료 정책 도입 움직임을 두고서도 논박이 오간다. 플랫폼 업체들은 고객 서비스 확대를 위한 불가피한 조치라는 입장이지만 이용자들 사이에선 무료 가입자로  확대한 시장지배력을 활용해 플랫폼 기업들이 본격적인 돈벌이에 나섰다는 지적이 나온다.━카카오 ""우선배차 콜 수수료 부과"", 택시업계 반발━18일 ICT 업계에 따르면, 카카오 계열사인 카카오모빌리티가 '카카오T' 서비스 유료화에 나서면서 택시업계와 갈등을 빚고 있다. 카카오모빌리티는 이달 초 우버와 타다 등 가맹택시 경쟁업체에 카카오T 호출 비용으로 수수료를 내라고 통보한 데 이어 지난 16일 일반·법인택시에 '우선배차 콜' 수수료를 부과하는 월9만9000원 짜리 '프로 멤버십'을 출시했다.   택시업계는 카카오T 콜 유료화를 독점적 시장지위를 악용한 시장 교란행위로 규정하고 ""호출 거부 등 모든 수단을 강구하겠다""고 강하게 반발했다. 돈을 내지 않으면 좋은 콜을 배정받지 못 하는 만큼 사실상 강제적으로 유료 멤버십에 가입할 수밖에 없으므로 플랫폼의 횡포라는 것이다. 카카오T 택시회원은 전국 택시기사의 85%인 23만명에 달한다. 호출 시장에서도 카카오는 지난해 국내 차량 호출의 80%를 차지하는 지배적 사업자다. 2위인 티맵택시는 점유율이 20% 미만이다.택시기사들은 ""월 200만~300만원 버는데 10만원을 내라는 건 너무 과하다"", ""전면 유료화로 가려는 수순 아니냐""는 비판을 내놓았다.  ━T맵 ""SKT 고객 데이터 비과금 종료"" 이용자 불만━T맵SK텔레콤이 지난해 말 분사해 설립한 티맵모빌리티의 T맵 내비게이션 '제로레이팅(데이터 요금 비과금) 중단' 통보를 두고서도 논란이 일었다. T맵은 지난 11일 ""SK텔레콤 고객에게 제공하던 T맵 데이터 통화료 무료 혜택을 4월19일부터 종료한다""고 공지했다. 제로레이팅이 종료돼도 데이터 무제한 고객은 이용요금 과금이 없다. 다만 기본 제공량이 없다면 데이터 이용 요금을 앞으로는 내야 한다. T맵은 ""(분사로) 서비스 주체가 SK텔레콤에서 티맵모빌리티로 이관돼 공정거래법을 준수하려면 데이터 비과금을 유지할 수 없다""고 배경을 설명했다. 그러면서 혼란을 최소화하기 위해 오는 9월까지 6개월 간 매달 100MB의 데이터를 무상 제공하기로 했다.  T맵 이용자의 월평균 사용량(48MB)의 2배를 일정 기간 제공하겠다는 것이다. 그런데도 이용자들 사이에선 사실상 데이터 유료화 정책을 도입한 것이란 불만이 나왔다.  T맵은 월간 사용자 수 1300만 명, 시장점유율 70%에 육박해 '국민 내비'로 불린다. 특히 온종일 T맵을 쓰는 택시·화물기사 등의 데이터 요금 부담이 생길 것이란 예상이 있다. T맵은 자체 분석 결과 택시 기사들의 월 평균 T맵 데이터 사용량은 85MB 수준으로 일반 사용자 평균(48MB)보다 크게 높지 않다고 설명했다. GPS 기반 내비여서 데이터 소모가 크지 않아 요금제에 따라 차이는 있지만 표준요금제 기준 과금 수준을 2000원 미만으로 추산했다. ━원격수업 화상회의 '줌' 8월 유료화 교육현장 비상━신종 코로나바이러스 감염증(코로나19) 사태의 최대 수혜자로 꼽히는 비디오 회의 프로그램 '줌' 창업자 겸 최고경영자(CEO) 에릭 위안(51)/사진=로이터교육 현장에선 민간 원격수업 플랫폼인 '줌' 유료화를 앞두고 비상이 걸렸다. 줌이 오는 8월부터 학교 계정도 무료 이용시간을 제한하기로 하면서다. 줌은 3명 이상이 화상회의 등에 사용하면 40분까지 이용요금을 부과하지 않는다. 다만 운영정책에 따라 학교의 경우 40분 이상 수업도 무료로 이용할 수 있게 했다. 그래서 상당수 일선 학교가 실시간 쌍방향 원격수업에 줌을 활용한다. 교육부는 이용 요금 과금시 교사에게 비용을 지원하는 방안을 검토 중이지만 이와 별개로 ""무료 서비스로 가입자를 모은 뒤 유료를 강제화하는 글로벌 플랫폼 기업의 행태를 답습한다""는 비판이 온라인에서 이어졌다. 세계 최대 온라인동영상서비스(OTT) 플랫폼인 넷플릭스의 복수 이용자 계정 및 비밀번호 공유 금지 정책 테스트도 이용자들의 비슷한 반발을 부르고 있다.  지금은 가족과 지인 등 4명까지 비용을 분담해 동시에 스트리밍하는 게 일반적이지만 계정 공유가 금지되면 가족 외 공유가 안 돼 추가 비용 부담이 발생할 수 있어서다. 국내외 플랫폼 서비스의 잇단 유료화나 과금 강화 움직임을 두고선 입장이 갈린다. 서비스의 영속성과 고도화를 위해선 유료화가 불가피하다는 게 플랫폼 업체들의 주장이다. 일부 이용자들 사이에서는 ""배달비와 배송비 등도 내는데 어느 정도의 유료 서비스는 감수해야 한다""는 반응이 있다. 그러나  플랫폼 유료화에 비판적인 의견이 대체로 많다. 온라인 커뮤니티에선 ""무료서비스를 미끼로 고객 데이터를 수집해 유료화 기반을 닦은 뒤 사실상 강제 과금에 나서는 건 소비자 선택권을 되레 침해하는 것""이란 말이 나왔다. IT 플랫폼사들이 가입자 편익이나 서비스 강화보단 수익모델 발굴에만 매달리는 게 아니냐는 비판이다. 오상헌 기자 bborirang@mt.co.kr▶부동산 투자는 [부릿지]▶조 변호사의 가정상담소▶줄리아 투자노트 <저작권자 ⓒ '돈이 보이는 리얼타임 뉴스' 머니투데이, 무단전재 및 재배포 금지>"
2021.03.19.,"하성운, '맛집의 옆집' 출격…만두 '폭풍 먹방'",https://n.news.naver.com/mnews/article/312/0000474760?sid=106,<구조 다름>
2021.03.19.,"[더벨]카카오, 멜론 분사 타이밍의 비밀은 손상차손?",url없음,<네이버 기사 없음>
2021.03.19.,"현대百, '카카오톡 쇼핑하기'서 봄맞이 기획전 진행",https://n.news.naver.com/mnews/article/629/0000072828?sid=101,"현대백화점이 봄맞이 기획전을 온라인으로 진행한다. /현대백화점 제공오는 21일까지 게스·캘빈클라인 등 30개 브랜드 30~50% 할인[더팩트｜한예주 기자] 현대백화점은 오는 21일까지 카카오커머스의 쇼핑 플랫폼 '카카오톡 쇼핑하기'에서 '봄맞이 기획전'을 진행한다고 19일 밝혔다.이번 행사에는 게스·지프·타미힐피거 등 30여 개 브랜드가 참여하며 의류·화장품 등을 최초 판매가 대비 30~50% 할인해 판매한다. 대표 상품은 게스 티셔츠(2만8500원), 지프 맨투맨(2만6000원), 오리진스 진정 스킨 1+1(3만6500원) 등이다.행사는 카카오톡 모바일앱 내 '쇼핑하기' 메뉴의 공동구매 코너 '톡딜'에서 진행되며, 21일 밤 12시까지 진행된다.현대백화점 관계자는 ""봄시즌을 맞아 다양한 상품을 합리적인 가격에 판매하는 온라인 행사를 준비했다""고 말했다.hyj@tf.co.kr - BTS 공연 비하인드 사진 얻는 방법? [팬버십 가입하기▶]   - 내 아이돌 순위는 내가 정한다! [팬앤스타 투표하기] 저작권자 ⓒ 특종에 강한 더팩트 & tf.co.kr 무단 전재 및 재배포 금지"
2021.03.19.,"[더벨]카카오, 멜론 분사 타이밍의 비밀은 손상차손?",url없음,<네이버 기사 없음>
2021.03.19.,與 맹성규 의원실 단톡방에 포르노 영상이…삭제 못해 진땀,https://n.news.naver.com/mnews/article/366/0000687290?sid=100,"현역 여당 국회의원실에서 개설해 운영 중인 카카오톡 단체 대화방에 포르노 영상이 게시돼 물의를 빚고 있다. 19일 더불어민주당 맹성규(인천 남동갑) 의원실 등에 따르면 지난 1일 낮 12시 38분쯤 맹 의원 지지자들이 모여있는 단톡방에 한 지역 대의원 A씨가 25분 분량의 포르노 영상을 게시했다. 조선DB이 채팅방은 맹 의원 지지자와 당원들이 서로 정보를 공유하고, 맹 의원에게 건의 사항을 전달하기 위해 만들어진 것으로 알려졌다. 의원실은 단톡방에 포르노 영상이 올라온 사실을 인지하자마자, A씨에게 연락해 게시물 삭제를 요구했다. 그러나 A씨가 자체 삭제할 수 있는 시간인 5분을 넘긴 탓에 영상을 삭제할 수가 없었다. A씨는 ""계정을 해킹당해 동영상이 게시된 것 같다""고 밝혔다고 한다.의원실 측은 단톡방 참가자 100여명에게 ""해당 단톡방에서 나간 뒤 새로 만든 오픈채팅방에 가입해 달라""고 요청했다. 그러나 이날까지 여전히 30여명이 단톡방에 남아있으며 문제의 영상도 삭제되지 않은 것으로 전해졌다.맹성규 의원실 채팅방. /맹성규 의원실 제공의원실 측은 유사 사례 재발 방지를 위해 기존 방식의 단톡방 대신 회원 강제 탈퇴 권한과 게시물 가리기 기능이 있는 오픈채팅방을 개설했다고 밝혔다. [김우영 기자 young@chosunbiz.com] ▶네이버에서 '명품 경제뉴스' 조선비즈를 구독하세요▶'못난이 자동차' 놀림받던 日 스바루의 성공 비결▶계속되는 車 반도체 부족 여파… ""2분기가 더 문제""	저작권자 ⓒ 조선비즈, 무단 전재 및 재배포 금지"
2021.03.19.,'속옷만 보여주면 좋겠어…'미성년자에게 수차례 음란 카톡 보낸 20대,https://n.news.naver.com/mnews/article/082/0001076129?sid=102,"부산일보DB미성년자에게 카카오톡 메신저로 수차례 속옷과 특정 신체 부위를 찍은 사진 등을 요구한 20대 남성에 대해 검찰이 벌금형을 구형했다.19일 법원에 따르면 전날 서울북부지법 형사9단독 이진영 판사의 심리로 열린 A(20)씨의 성폭력 범죄의 처벌 등에 관한 특례법 위반 등 혐의 결심공판에서 검찰은 A씨에게 벌금 500만원을 구형했다. 아동·청소년 관련 기관 및 장애인 복지시설 각 3년 취업제한 명령도 요청했다.A씨는 지난해 3월 미성년자인 B양에게 카카오톡 메시지를 보내 수차례에 걸쳐 특정 신체 부위 사진을 요구하는 등 성적 학대 행위를 한 혐의로 재판에 넘겨졌다.A씨는 지난해 3월 3일에 B양에게 '속옷만 보여주면 좋겠지만…'이라는 메시지를, 같은 달 7일에는 '가슴을 보여주세요'라는 메시지를 보낸 것으로 전해졌다. 같은 달 9일에는 '딱 한 번만 보여주면 안 될까' 등과 같은 메시지를 보낸 것으로 알려졌다.A씨 측 변호인은 ""피해자 측에 여러 차례 사죄 의사와 편지를 전달했지만 합의할 의사가 없다고 한다""며 ""피고인이 선고 전까지 실질적인 피해 회복을 위해 노력할 의지가 있는 점을 참작해달라""고 밝혔다.이어 ""진심으로 사죄하기 위해 모든 혐의를 인정하고 반성 중""이라며 ""범죄 전력이 없는 점, 사회초년생인 점 등을 고려해 선처를 부탁드린다""고 했다.A씨는 ""피해자에게 보냈던 추악한 채팅과 어리석은 행동은 전부 제 잘못""이라며 ""1년 동안 피해자가 입은 상처가 얼마나 극심한지 이제야 느끼고 있다""고 말했다.김은지 부산닷컴 기자 sksdmswl807@busan.com▶ 네이버에서 부산일보 구독하기 클릭!▶ 부산닷컴 회원가입. 회원 전환하면 부산일보 지면보기 무료이벤트▶ 부산일보 홈 바로가기"
