기사날짜,기사제목,네이버 뉴스 url,기사내용
2021.03.19.,"""해외 챌린저뱅크, 클라우드 강화…韓금융도 변화 필요""",https://n.news.naver.com/mnews/article/018/0004880017?sid=101,"[IBFC 2021] 장호준 SC제일은행 부행장10회 국제 비즈니스·금융 콘퍼런스 연설[이데일리 김유성 기자] “챌린저뱅크가 기존 금융산업을 위협하는 정도가 됐다.” 장호준 SC제일은행 부행장장호준 SC제일은행 소매금융총괄본부 부행장은 18일 제주 서귀포시 해비치호텔앤드리조트에서 열린 ‘제10회 국제 비즈니스·금융 콘퍼런스’에서 글로벌 금융그룹인 SC그룹의 디지털 성과를 소개하면서 이같이 밝혔다. 빠르게 변화하는 금융 트렌드에 기민하게 적응하지 못하면 글로벌 대형은행도 버티지 못할 것이라는 전망이다. 특히 그는 챌린저뱅크로 불리는 인터넷은행이 게임체인저가 될 것이라고 예상했다.  실제 SC그룹은 홍콩, 싱가포르처럼 시장 영향력이 높은 곳에서는 인터넷전문은행사업에 직접 진출하고 있다. 홍콩에서는 인터넷전문은행 MOX를 지난해 9월 출범시켰고 싱가포르에서는 인터넷전문은행 인가신청을 한 상황이다. 한국이나 대만처럼 SC그룹의 현지법인 사업 규모가 상대적으로 작은 곳에서는 컨소시엄을 이뤄 인터넷은행에 참여하고 있다. 대만에는 대만라인뱅크 컨소시엄에 참여했고 토스뱅크 컨소시엄에도 주요 투자자로 나섰다. SC그룹의 아시아 내 인터넷전문은행 사업 현황빠르게 변화하는 디지털 시대에 유연하게 적응하기 위해서는 기존 은행들의 무거운 서버에서 탈피할 필요가 있다고 장 부행장은 전했다. 대표적인 게 클라우드 서비스의 강화다. 메임 프레임 기반 은행들의 서버는 안전성과 보안에 있어 우수한 편이지만 속도가 느리고 새로운 서비스 접목이 어렵다. 카카오뱅크와 같은 인터넷은행에 기존 은행들의 서비스 경쟁력이 뒤쳐지는 이유 중 하나다. 장 부행장은 SC그룹이 진행중인 디지털 혁신 작업에 대해서도 설명했다. 바로 모바일로의 전환이다. 그는 “앞으로 금융산업에서도 비대면화가 더 빨라질 것”이라면서 “기존 방식과 다르게 일하지 않으면 도태될 것”이라고 말했다.  이를 위해 SC그룹은 수십년 유지해온 기업 브랜드 이미지(BI)부터 바꿨다. 모바일에 보기 좋은 형태로 바꾼 것이다. 모바일 사용자환경(UI)도 보다 단순화했다. 모바일 전문 인터넷은행처럼 쉽고 단순하게 만든다는 노력이다.  [이데일리 방인권 기자] 장호준 SC제일은행 부행장이 18일 제주 서귀포시 해비치호텔앤드리조트에서 열린 ‘제10회 국제 비즈니스·금융 컨퍼런스’에서 급변하는 ‘해외 금융 트렌드’란 주제로 발표를 하고 있다.‘제10회 국제 비즈니스·금융 컨퍼런스’는 ‘금융의 확장, 플랫폼의 미래’를 주제로 대한민국 금융산업의 현주소를 냉정하게 진단하고, 금융과 플랫폼의 미래에 대해 논의하기 위해 마련됐다.장 부행장은 “SC그룹은 유연하게 대처하기 위해 클라우드 서비스를 강화하겠다고 선언했다”면서 “마이크로소프트(MS)와 아마존과도 전략적 제휴를 하고 국내에서는 마이데이터 승인을 받는 등 적극적으로 하고 있다”고 말했다. 국내에서는 한층 더 개선된 개인화된 솔루션을 제공하기 위하여 SK텔레콤과 제휴하고 있다.말미에 장 부행장은 빌 게이츠 전 MS 회장이 남겼던 격언을 남겼다. 그는 “뱅킹이라는 형태는 앞으로도 상당 기간 지속되겠지만 뱅크가 앞으로 지금과 같은 모습으로 남아 있을지는 살펴봐야 한다”면서 “최근 몇년 동안 이를 실감하고 체감하고 있다”고 말했다. 이어 “새로운 미래는 누구도 가보지 않은 길”이라면서 “뉴노멀과 함께 걸어가는 길을 잘 준비하겠다”고 다짐했다김유성 (kys401@edaily.co.kr)▶ #24시간 빠른 #미리보는 뉴스 #eNews+▶ 네이버에서 '이데일리 뉴스'를 만나보세요▶ 빡침해소, 청춘뉘우스 '스냅타임'＜ⓒ종합 경제정보 미디어 이데일리 - 무단전재 & 재배포 금지＞"
2021.03.19.,"""KB금융, 마진 폭 확대가 이익 증가 청신호"" -현대차",https://n.news.naver.com/mnews/article/008/0004559674?sid=101,"[머니투데이 정혜윤 기자] 현대차증권은 19일  KB금융 마진 개선 폭 확대가 이익 증가 청신호가 될 것이라며 투자의견 '매수', 목표주가는 6만원으로 상향했다. 전날 기준 KB금융 종가는 5만300원이고, 현재는 전일대비 200원(-0.40%) 내린 5만100원에 거래 중이다. 김진상 현대차증권 연구원은 ""1분기 순이익은 1조 373억원으로 컨센서스 1조 103억원을 소폭 상회할 것으로 예상된다""고 밝혔다. 분기 중 NIM(순이자마진)은 전분기대비 +4bps로 지난해 4분기 1bp에 이어 개선폭이 확대될 것으로 추정된다. 기준 금리 인하 영향에서 벗어난 점, 시중금리 여건 호전, 저원가성예금의 꾸준한 유입 등이 주효했다는 분석이다. 김 연구원은 ""예상보다 뚜렷한 1분기 NIM 회복세가 업계 전반적인 화두인 가운데, KB금융이 지난해 견조했던 대출 증가가 이자 창출로 이어지면서 올해 순이자이익은 전년대비 7% 증가할 것으로 보인다""고 전망했다. 그는 △높은 증익 가시성 △은행-비은행의 균형 잡힌 비즈 포트폴리오 △풍부한 자본력에 근거한 유연한 자본정책 등을 KB금융의 차별 투자 포인트로 꼽았다. 김 연구원은 ""카카오뱅크 상장시 주요주주(지분율 9.35%)로서 주가에 탄력을 받을 수 있고 상대적으로 적극적인 주주친화 자본정책도 기대된다""고 설명했다. 이 같은 매크로 환경과 NIM 전망을 반영해 현대차증권은 2021~22년 KB금융 이익 추정치를 평균 4% 올리고 목표주가는 6만원으로 조정했다. 정혜윤 기자 hyeyoon12@mt.co.kr▶부동산 투자는 [부릿지]▶조 변호사의 가정상담소▶줄리아 투자노트 <저작권자 ⓒ '돈이 보이는 리얼타임 뉴스' 머니투데이, 무단전재 및 재배포 금지>"
2021.03.19.,[매경데스크] '별의 순간'에 다가서는 기업인들,https://n.news.naver.com/mnews/article/009/0004765762?sid=110,"윤 전 검찰총장 '별의 순간' 회자기업에 대한 국민들 관심 역대급주식열풍에 기업인들 노력 결실韓기업인도 결정적 순간 맞은듯 지난 설 연휴에 모인 가족의 공통 화제가 LG에너지솔루션과 SK이노베이션의 배터리 전쟁이었다는 얘기를 여러 번 들었다. 한 재계 원로는 초등학생 손주가 국내외 기업의 주요 이슈를 꿰고 있어서 깜짝 놀랐다고 했다. 남녀노소가 따로 없다. 기업에 대한 관심이 그 어느 때보다 높다.요즘 '별의 순간'이 유행이다. 윤석열 전 검찰총장이 유력 대선 후보로 급부상하면서 회자됐다. 운명적·결정적 순간을 잡았다는 뜻이다. '별의 순간'이 정치판에만 있는 건 아니다. 동네북 신세였던 한국 기업인들도 절호의 기회를 맞고 있다.지난 세월, 기업이 잘되는 것과 내가 잘되는 것 사이에는 간극이 있었다. '낙수 효과'가 부정되면서 기업인은 '탐욕의 화신' 취급을 받았다. 꼬투리가 잡힌 기업인들은 묵묵히 비난과 처벌을 감수해야 했다.그런데 분위기가 달라지고 있다. 가장 큰 원인은 전 국민적인 주식 투자 열풍이다. 개인투자자가 600여 만명이다. 가족을 합하면 엄청난 숫자다. 내가 투자한 기업의 성공이 나와 내 가족의 성공과 직결되는 구도다. 여기에 기업인들의 노력이 큰 몫을 하고 있다. ESG, 상생경영을 강조하면서 기업인 이미지를 바꿔놓고 있다. 기업으로부터 혜택을 입은 사람들이 늘어나면서 여론 지형도 변화하고 있는 것이다.사실 기업인이 스타 대접을 받는 것은 전 세계적인 트렌드다. 빌 게이츠와 스티브 잡스가 정보기술(IT) 분야에서 '별의 순간'을 누렸다면 일론 머스크, 제프 베이조스 등은 우주 비즈니스 등 전혀 새로운 산업을 창조해내면서 거대한 팬덤과 기업가치를 창출하고 있다. 필자는 한국에서도 비슷한 조짐이 나타나고 있다고 본다.이미 정의선 현대자동차그룹 회장이나 정용진 신세계 부회장은 연예인급 관심을 받는다. 창의적인 미래 비전이 밑천이다. 구속 상태인 이재용 삼성전자 부회장도 마찬가지다. 그의 관련 기사에는 '해도 너무한다' '나라 먹여살리는 애국자 그만 괴롭혀라' '일 좀 하게 놔둬라'는 식의 댓글이 넘쳐 난다. 댓글을 쓴 사람 중에는 협력업체 종사자나 200만명이 넘는다는 삼성전자 투자자도 있을 것이다. 그가 자유로운 몸이었으면 반도체 격동기를 맞아 한창 동분서주하고 있었을 것이다.마침 구자열 LS 회장이 한국무역협회장으로, 최태원 SK 회장이 대한상공회의소 회장에 취임하는 것은 기가 막힌 타이밍이다. 4대 그룹 총수로서 최 회장은 사회적 가치를 유난히 강조해왔다. 구 회장은 돈 안되는 인문학 잡지를 10년째 발행하는 안목을 지녔다. 경영능력은 기본이고, 사회를 바라보는 시선도 남다르다는 의미다.최근에는 재산의 절반을 뚝 떼어내 사회 환원을 선언한 김범수 카카오 의장과 김봉진 우아한형제들 의장의 결단이 국민에게 진한 감동을 줬다. 위선 범벅이 된 우리 사회를 되돌아보게 하는 계기가 됐다.정교한 분석이 필요하겠지만, 이들 기업인이 창출해내는 유무형의 가치는 어마어마하다. 해당 기업 주가는 물론이고 매출, 회사채 금리, 영업 네트워크 등에 두루 반영돼 있다고 봐야 한다.정부는 정치에 억눌려 제 목소리를 못낸 지 오래이고, 정치는 포퓰리즘에 휘둘려 나라의 장래 따윈 관심이 없어 보인다. 그에 비해 민간기업은 자기 이익을 위해서라도 미래를 걱정하고, 탐색하고, 대비한다. 오늘날 한국에서 책임 있게 미래를 생각하는 유일한 직업군이 기업인이다. 지난 17일 '항공우주 강국'을 주제로 열린 매일경제 국민보고대회에 김동관 한화솔루션 사장이 참석했다. 최근 그룹 내 우주 태스크포스팀을 출범시켜 화제가 됐던 인물이다. 서울시장 후보들 못지않게 이목이 집중됐다. '태양광, 수소에 이어 우주에서도 뭔가 보여줄 것'이라는 기대감 때문이었을 것이다.다행히 한국은 '별의 순간'을 예감케 하는 기업인을 꽤 많이 보유하고 있다.[이진우 산업부장 겸 지식부장(부국장)]▶ '경제 1위' 매일경제, 네이버에서 구독하세요▶ 이 제품은 '이렇게 만들죠' 영상으로 만나요▶ 부동산의 모든것 '매부리TV'가 펼칩니다[ⓒ 매일경제 & mk.co.kr, 무단전재 및 재배포 금지]"
2021.03.19.,"삼척시, 4월부터 75세 이상 백신 접종",url없음,<네이버 기사 없음>
2021.03.19.,"재능문화, ‘제31회 재능시낭송대회’ 온라인 예선대회 접수",url없음,<네이버 기사 없음>
2021.03.19.,"[종합주가지수] 코스피, 미 국채금리 급등에 하락…개미 3030선 지켰다",url없음,<네이버 기사 없음>
2021.03.19.,고3 학생·담임교사 여름방학 중 백신 접종 추진,url없음,<네이버 기사 없음>
2021.03.19.,"강원농협, 도내 축산물 브랜드 특별 판매",url없음,<네이버 기사 없음>
2021.03.19.,쿠팡 미국 상장이 불러온 유통업계 ‘합종연횡’,url없음,<네이버 기사 없음>
2021.03.19.,"서민금융진흥원, 신용·부채관리 컨설팅 서비스 대상 확대",https://n.news.naver.com/mnews/article/119/0002477291?sid=101,"정책서민금융 이용 6개월 후 컨설팅 가능하도록 서비스 확대유선상담 어렵거나 불편할 경우 카톡·앱으로 리포트 제공키로ⓒ서민금융진흥원서민금융진흥원(서금원)은 정책서민금융 이용자가 제도권금융을 이용할 수 있도록 신용‧부채관리 컨설팅 대상자를 확대한다고 19일 밝혔다.서금원은 정책서민금융 이용자가 정책서민금융 상품을 이용한 지 6개월이 지난 시점부터 컨설팅 서비스를 받을 수 있도록 서비스 대상자를 확대했다. 앞서 한국개발연구원(KDI)은 지난해 9월 보고서에서 정책서민금융 이용효과가 상품 이용 6개월 지나면 줄어든다고 지적한 바 있다.서금원은 유선상담이 어렵거나 불편한 사람들을 위해서는 카카오톡과 앱을 활용해 신용부채관리 리포트를 제공한다는 계획이다.컨설팅을 필요로 하는 이용자는 서민금융진흥원 및 맞춤대출 웹·모바일 페이지에 접속하거나 ‘1397’ 콜센터로 전화하면 된다. 컨설팅은 4월 1일부터 순차적으로 진행된다.서금원은 작년 9월부터 올해 3월까지 정책서민금융 이용 1년 경과자 3382명을 대상으로 매월 신용·부채관리를 위한 유선상담 서비스를 제공해왔다. 이후 지난 1월 컨설팅 3개월 경과시점 대상자들의 신용점수를 분석한 결과 컨설팅 대상자 절반 이상(52%) 신용점수가 평균 42.8점, 최대 404점까지 상승한 것으로 나타났다.이계문 서금원장은 “생업에 쫓겨 신용‧부채관리와 금융상품 정보가 부족해 어려움을 겪고 계시는 분들이 신속하게 제도권금융으로 복귀할 수 있도록 신용·부채관리 컨설팅을 더욱 활발히 실시할 계획”이라며 “또 전북은행과 협업으로 신용·부채관리 컨설팅 이용자 금리할인 특화상품을 출시한 사례를 타 은행으로도 확대해 나갈 계획”이라고 전했다.데일리안 배근미 기자 (athena3507@dailian.co.kr)▶ 데일리안 네이버 구독하기▶ 데일리안 만평보기▶ 제보하기ⓒ (주)데일리안 - 무단전재, 변형, 무단배포 금지"
2021.03.19.,"양천구, 코로나 19 확산방지…민방위 사이버교육 진행",url없음,<네이버 기사 없음>
2021.03.19.,"SK바이오사이언스, 따상상 무리였나…장중 6%대 강세에 그쳐",https://n.news.naver.com/mnews/article/009/0004765841?sid=101,"SK바이오사이언스가 '따상상(시초가가 공모가 2배로 형성 후 2번 연속 상한가)'까지는 못 미쳤다. 상장 이틀째 강세를 나타내고 있긴 하나 따상상에는 실패한 듯한 모습이다. 19일 오전 9시 18분 현재 SK바이오사이언스는 전일 대비 1만500원(6.21%) 오른 17만9500원에 거래되고 있다. 전날 상한가에 이어 이틀 연속 강세다.기대를 모았던 '따상상'은 다소 힘에 부치는 모습이다. 지수가 1%대 급락세를 맞으면서 전일 급등에 따른 차익실현 물량이 대거 쏟아져나오고 있는 것으로 풀이된다. 실제 거래량을 보면 이날 개장 후 약 20여분만에 약 480만주가 거래됐다. 전날 전체 거래량이 87만6189주에 그쳤다는 점을 고려해보면 이날 많은 물량이 시장에서 사고 팔리고 있다는 뜻이다. 만일 SK바이오사이언스가 장중 상승폭을 확대해 따상상을 기록하게 될 경우 주가는 21만9000원까지 오른다. 앞서 따상상에 성공한 공모주는 SK바이오팜과 카카오게임즈가 유일하다.[김경택 매경닷컴 기자 kissmaycry@mk.co.kr]▶ '경제 1위' 매일경제, 네이버에서 구독하세요▶ 이 제품은 '이렇게 만들죠' 영상으로 만나요▶ 부동산의 모든것 '매부리TV'가 펼칩니다[ⓒ 매일경제 & mk.co.kr, 무단전재 및 재배포 금지]"
2021.03.19.,SK바이오사이언스 뜨자 장외주식 시장도 '들썩'···과열 우려도↑,url없음,<네이버 기사 없음>
2021.03.19.,"SK바이오사이언스 주가 초반 올라, 코스피 상장 이틀째 강세 이어가",url없음,<네이버 기사 없음>
2021.03.19.,"SK바이오사이언스 상장 이틀째, SK바이오팜 3연상 기록에 도전",url없음,<네이버 기사 없음>
2021.03.19.,[뉴스핌 뉴스레터 Today ANDA] 3월 19일,url없음,<네이버 기사 없음>
2021.03.19.,"IP유니버스시대, 콘텐츠의 변화는 무궁무진하다",url없음,<네이버 기사 없음>
2021.03.19.,"시원스쿨랩, 목표 점수 맞춤형 '처음토플 300% 환급반' 리뉴얼",url없음,<네이버 기사 없음>
2021.03.19.,"농협목우촌, 네이버 스마트스토어 오픈...할인 이벤트 실시",url없음,<네이버 기사 없음>
2021.03.19.,‘따상 데뷔’ SK바사 임직원 8억씩 대박… SK바이오팜 넘어서나,https://n.news.naver.com/mnews/article/081/0003172129?sid=101,"SK바이오사이언스 시총 28위로 입성유통물량 적어 상장 첫날에 17만원 육박직원 600명 1인당 평균 7484주 배정받아1억 청약 투자자 7주에 최대 72만원 수익18일 서울 여의도동 한국거래소에서 백신 개발·생산업체인 SK바이오사이언스의 코스피 신규 상장 기념식이 열리고 있다. SK바이오사이언스는 상장 직후 바로 ‘따상’으로 직행했다.뉴스1상반기 기업공개(IPO) 시장의 최대어로 꼽힌 SK바이오사이언스가 코스피 상장 첫날 ‘따상’(시초가가 공모가의 두 배로 결정된 후 상한가 기록)으로 직행하며 화려하게 증시에 입성했다. 이에 따라 일반 공모주 청약에 1억원을 넣은 투자자는 최대 70만원 이상의 수익을 거뒀고, 우리사주를 받은 직원들은 1인당 8억원에 가까운 평가이익이 기대된다. 지난해 공모주 시장 열풍을 주도하면서 ‘따상상’(3연상)을 기록한 SK바이오팜을 뛰어넘을 수 있을지도 관심사다.SK바이오사이언스는 18일 코스피에서 시초가 13만원 대비 가격 제한폭(30.00%)까지 오른 16만 9000원에 거래를 마쳤다. 종가 기준 시가총액은 12조 9285억원을 기록해 단숨에 코스피 시총 순위 28위에 올랐다. 각각 8조 6000억원, 8조 2000억원 규모의 SK바이오팜과 빅히트엔터테인먼트를 가뿐히 제쳤다.이번 ‘따상’은 예견된 수순이라는 평이다. 앞서 기관투자자의 수요 예측과 일반 청약에서 흥행몰이에 성공하며 상장 초기 주가 급등이 일찌감치 예상됐다. 상장일에 유통 가능한 물량이 적다는 점도 호재로 작용했다. SK바이오사이언스는 기관 물량의 85.26%에 해당하는 1076만주에 짧게는 15일에서 최장 6개월까지 주식을 매도할 수 없도록 의무 보유 확약을 걸었다. 상장일인 이날 유통 가능 주식은 전체 발행 물량의 11.63%인 889만 7510주로 한정됐다. SK바이오팜(13.1%), 카카오게임즈(20.5%), 빅히트(19.8%)보다 적은 수치다.일반 공모주 청약에 1억원을 넣은 투자자는 최대 72만 8000원의 수익을 얻게 됐다. 지난 9~10일 진행된 청약 당시 한 증권사에 1억원을 증거금으로 넣은 투자자는 5~7주의 주식을 받았다. 7주 기준으로 납입금은 45만 5000원이었으며, 주가가 모두 118만 3000원으로 뛰면서 첫날 수익금이 주당 10만 4000원씩을 기록했다.우리사주 및 주식매수청구권(스톡옵션)을 받은 임직원도 수억원대의 이익을 거두게 됐다. 우리사주 청약에 참여한 조합원은 600여명이다. 배정 물량인 449만 400주를 600명이 받았다고 하면 1인당 평균 7484주를 배정받았을 것으로 추산된다. 첫날 수익 10만 4000원 기준 1인당 평균 평가차익이 약 7억 7800만원에 달한다는 계산이 나온다. 다만 이번에 발행한 우리사주 주식은 상장 후 1년 동안 매도할 수 없다. 안재용 대표이사 등 임원 4명의 주식매수청구권 평가 이익은 873억원에 달할 것으로 추산된다. 임원별로는 175억~349억원에 이른다.이날 코스피는 17일(현지시간) 열린 미 연방공개시장위원회(FOMC)가 당분간 완화적인 통화정책을 유지할 것이라는 방침을 재확인하면서 전 거래일보다 18.51포인트(0.61%) 오른 3066.01에 거래를 마쳤다. 코스닥지수는 전장보다 6.05포인트(0.64%) 오른 949.83으로 마감됐다.김희리 기자 hitit@seoul.co.kr▶ 네이버에서 서울신문 구독하기 클릭!  ▶ [인터랙티브] 코로나 청년 잔혹사   ▶ [나우뉴스] 세상에 이런 일이ⓒ 서울신문(www.seoul.co.kr), 무단전재 및 재배포금지"
