기사날짜,기사제목,네이버 뉴스 url,기사내용
2021.03.20.,[이슈백블] 임대료 때문에 대박 꿈 접는다? 그건 옛말...'집에서도' 창업한다,https://n.news.naver.com/mnews/article/421/0005234311?sid=101,"[우리동네 찾아온 한국판 뉴딜②] 코로나에 창업 힘든 시기, 정부 지원책 활용법임대료 무료, 창업 성공 노하우까지 전수 '스마트 창업' 주목[편집자주]신종 코로나바이러스 감염증(코로나19) 백신 접종이 시작되면서 우리는 일상으로 돌아갈 꿈을 꿀 수 있게 됐다. 그러나 코로나가 남겨 놓은 수많은 문제를 해결하기 위해 우리는 전혀 다른 접근과 더 힘든 과정을 겪어야 할지 모른다. 정부가 내놓은 '한국판 뉴딜'도 코로나 이후 대한민국을 한 단계 도약시키기 위한 과감한 도전이다. 포스트코로나 시대, 새로운 일상을 살아가야 하는 국민들이 체감할 수 있는 혜택과 행복감을 주기 위해선 우선 우리 사회의 해묵은 과제들에 대한 해결의 실마리를 제시할 수 있어야 한다. 그래야 한국판 뉴딜의 존재 이유를 찾을 수 있다. 이에 '뉴스1'은 2021년 코로나 한복판에서 대한민국이 직면하고 있는 중요한 사회문제를 한국판 뉴딜이 어떻게 풀어나가는지 그 현장을 따라가 보고자 한다.모이레베 신효원 대표가 집에서 제품 사진을 찍고 있는 모습. (본인 제공)(서울=뉴스1) 문대현 기자 = #. 소형 냉장고 크기의 '플랜트 박스'는 사물인터넷 기술로 집에서 쉽게 채소를 키우는 스마트 가전제품이다. 3년전 창업, 제품을 개발한 에이아이플러스는 한때 사업 포기를 생각한 적도 있지만 2020년 3D 프린터 특화 1인 창조기업 지원센터에 입주하면서, 임대료 걱정을 덜었을 뿐만 아니라 컨설팅을 통해 도약의 기반을 마련했다. 코로나 시대들어 스마트팜에 관심이 커지자 에이아이플러스는 최근 대기업에 인수합병되며 1인 창조기업의 대표적 성공사례로 꼽힌다. #. 에너지효율을 높인 친환경 제습기술의 ㈜휴마스터는 2018년 창업년도 매출 1억2000만원에서 지난해 11억원으로 급성장했다. 홍릉 창업벤처밸리창업보육센터에 입주중인 이 업체는 센터로부터 특허분석 및 등록지원, 법률자문과 사업화자금 지원 등 집중지원을 받으며 스타트업들이 흔히 겪는 초기 성장의 고비를 넘어설수 있었다. 특히 2년간 사무실 임대료를 100% 면제 받은 것이 가장 큰 도움이 됐다. 서울시 성북구 KIST내 홍릉 창업보육센터의 경우 주변시세보다 훨씬 저렴한 임대료로 계속 입주할 수 있어 등 초기 자본 절감에 큰 도움이 되고 있다.  # 경기도 양주에 사는 신효원(19)대표는 지난해 5월 온라인 의류 쇼핑몰 '모이레베'를 창업했다. 사무실은 자신의 집. 인형옷 쇼핑몰 '티티야'의 시작도 집이었다. 허지영(46)대표는 출산 이후 취미로 인형 옷을 만들어 SNS에 올리다가 쇼핑몰을 오픈했다. 두 사람 모두 재고정리, 제품촬영, 쇼핑몰 관리 등 모든 업무를 혼자 다 한다. ""규모가 조금씩 늘어나며 일과 휴식이 구분이 안돼 스트레스를 받기 시작했다""는 허대표는 최근 집 근처 사무실을 구하려 했지만 비싼 임대료 때문에 아직 엄두를 못 내고 있다. 창업할 아이템이 있거나 중소기업을 키워 낼 기술이 있어도 제일 먼저 부딪히는 난관 중 하나가 바로 부동산 임대료다. 인건비를 제외한 고정비 중 적지 않은 비중을 차지하기 때문이다. 사무실 등에 대한 높은 임대료로 인해 창업을 엄두도 내지 못하거나 문을 닫는 소규모 기업들도 적지 않다.그러나 최근 신종 코로나바이러스 감염증(코로나19) 사태에 따른 비대면 문화 확산에 따라 창업이나 기업 운영에 있어서도 변화가 나타나고 있다. 임대료 절감을 위해 도심 속 사무 공간 대신 집이나 시골 창고 등에서 창업을 하거나 화상회의 시스템 도입 등을 통해 소규모 공간만으로 기업 운영에 나서고 있다.  이에 발맞춰 정부는 임대료 문제로 어려움을 겪는 창업자나 재택근무를 해야 하는 기업에 대한 각종 지원 사업에 적극 나서고 있다. 문재인 정부가 포스트 코로나 시대의 비전으로 본격 추진하고 있는 '한국판뉴딜'의 일환에서다.    ◇ 한국판뉴딜로 창업하는 법…임대료 Free + 경영지원 Plus아이디어와 기술을 보유했으나 초기 시설과 자금이 부족해 임대료의 첫 장벽에 부딪힌 창업자들이라면 중소벤처기업부가 운영하는 '창업보육센터'와 '창조기업 지원센터'를 적극 활용할 필요가 있다.창업보육센터는 전국 시군구에 1개꼴, 총 259개소에 마련된 스타트업의 요람이다. 저렴한 임대료로 창업기업에 공간을 제공하고 정보 교류는 물론 경영 기술 노하우와 재정 혜택을 6개월에서 최고 3년까지 지원한다. 임대료는 기본적으로 무료인 경우가 많지만 각 지역센터에 따라 소액을 받는 곳도 있다.  창업보육센터 사무실 임대는 벤처기업만 대상으로 한 것은 아니다. 소규모 창업자에게도 문이 열려 있다. 중기부 관계자는 ""창업보육센터는 입주공간 제공을 중심으로 경영 및 기술이 지원되는 공간""이라며 ""온라인 쇼핑몰 창업자 역시 이곳을 활용해 임대료를 절감 할 수 있다""고 했다.    전국 50개 도시에 있는 1인 창조기업지원센터 역시 최장 2년간 저렴한 임대료로 사무실을 쓸 수 있고 경영자문과 창업교육을 제공한다. 창업을 희망하는 누구나 정보를 얻을 수 있고, 혼자서 창업에 도전할 수 있도록 지원하는 곳이다.정부의 한국판뉴딜이 본격화되면서 창업지원과 소상공인 온라인비즈니스지원을 받을 수 있는 기회는 올해 더욱 늘어난다. 정부에 따르면 소상공인들의 온라인 판로 확보나 스마트화 지원 등 온라인 비즈니스 지원에 2025년까지 총 1조2000억원을 투자해 일자리 12만개를 창출하겠다는 목표를 세웠다.  한국판뉴딜이 포스트코로나시대의 새로운 삶을 기반으로한 비전인 만큼 중소벤처기업부의 창업 소상공인 지원책의 무게중심은 임대료 걱정이 없는 '비대면'과 누구나 쉽고 빠르게 도움을 받을 수 있는 '스마트 지원'에 있다. 대기업과는 비교할 수 없을 정도로 비대면 디지털 업무 전환에 어려움을 겪고 있는 중소기업 스타트업 소상공인들에게는 절실히 지원이 필요한 분야다. 19일 서울 노들섬 다목적홀에서 열린 글로벌창업사관학교 졸업식에서 강성천 중소벤처기업부 차관 등 참석자들이 기념 촬영을 하고 있다. (중소벤처기업부 제공) 2021.2.19/뉴스1◇한국판뉴딜 '재택근무 지원' 사업…임대료 부담 줄어코로나 19로 인한 비대면 시대가 되었으나, 자체 시스템이 없어 화상회의나 재택근무 실시가 어려웠던 중소·벤처기업들이 많다. 이러한 현실을 감안해 한국판뉴딜의  'K-비대면 바우처플랫폼' 사업은 총 16만개 중소기업에 원격·재택근무 서비스를 제공하여 근무환경의 디지털 전환을 돕고 있다. 기업이 화상회의 재택근무 등 비대면 분야 서비스 이용금액을 400만원 한도내에서 최대 90%까지 지원받을 수 있다. 그런데 이러한 재택근무 시스템 도입 활성화가 뜻밖의 효과를 거두고 있다. 바로 기업의 임대료 부담이 줄어들고 있다는 것이다.   생활용품 제조기업 '공생'의 민노아 대표는 ""그동안 카카오톡같은 일반 메신저로 업무를 해서 비효율적이었으나 비대면 바우처 플랫폼을 통해 화상회의 솔루션과 재택 협업 툴 프로그램을 쓰며 내부 협업이 원활해졌다""고 말했다. 특히 이 플랫폼을 이용해 서비스를 이용한 또 다른 중소기업의 관계자는 ""재택근무와 화상회의를 하면서 대형 강의실 등을 다른 공간으로 전환할 수 있어 그것만으로도 임대료를 줄이는 효과가 생겼다""라고 말했다.  한 창업전문가는 ""창업천국 대한민국으로 가는 길은 멀다. 그러나 임대료 부담 때문에 창업을 주저하고 있다면, 한국판뉴딜 사업들을 눈여겨 볼 필요가 있다. 도움을 받아 창업해 여러 난관을 헤쳐나가고 있는 분들의 사례는 분명 많은 도움이 될 것""이라고 말했다. 문재인 정부의 한국판뉴딜이 부동산 임대료 때문에 창업을 포기하는 분들이 없도록 더욱 다양한 방법을 제시해 줄 수 있을지 지켜볼 일이다. 한국판 뉴딜이 성공하기 위해서는 국민 모두에게 새로운 기회를 제공하는 것이 가장 분명하고 확실한 방법이라는 점을 정부는 잊지 말아야 한다.eggod6112@news1.kr▶ 네이버 메인에서 [뉴스1] 구독하기!▶  뉴스1&BBC 한글 뉴스 ▶ 뉴스1 미래포럼 2021 © 뉴스1코리아(news1.kr), 무단 전재 및 재배포 금지"
2021.03.20.,"대검 부장회의 ""한명숙 재판 모해위증 불기소"" 결론",https://n.news.naver.com/mnews/article/052/0001564846?sid=102,"대검 부장·고검장들이 한명숙 전 국무총리 재판에서 재소자들이 검찰 수사팀 강요로 위증을 했다는 의혹에 대해 혐의를 인정할 수 없다는 기존 대검찰청의 판단을 유지했습니다.대검 부장과 고검장들은 오늘 오전 10시부터 밤 11시 반까지 회의를 열고 표결을 통해 한 전 총리 모해위증 의혹을 불기소 처분해야 한다고 의결했습니다.회의에는 조남관 검찰총장 직무대행과 검사장급 대검 부장 7명, 전국 고검장 6명이 참석해 모두 표결에 참여했고 이 가운데 과반을 훨씬 넘는 10명이 불기소 의견을 낸 것으로 전해졌습니다.기소 의견을 낸 참석자는 2명에 그쳤고, 나머지 2명은 기권한 것으로 알려졌습니다.재판에서 위증한 의혹을 받는 재소자 등의 공소시효가 오는 22일 완성되는 만큼 조남관 대행도 회의 결과를 토대로 22일 전에 최종 의견을 정리할 것으로 보입니다.이번 회의는 지난 17일 박범계 법무부 장관이 한명숙 전 총리 사건에 대해 수사지휘권을 발동하면서 소집됐습니다.박 장관은 사안을 논의할 협의체로 대검 부장회의를 지목했으나, 조남관 대행이 공정성을 이유로 고검장까지 참여시키면서 회의체는 고검장·대검 부장 회의로 확대됐습니다.※ '당신의 제보가 뉴스가 됩니다' YTN은 여러분의 소중한 제보를 기다립니다.[카카오톡] YTN을 검색해 채널 추가 [전화] 02-398-8585 [메일] social@ytn.co.kr [온라인 제보] www.ytn.co.kr[저작권자(c) YTN & YTN plus 무단전재 및 재배포 금지] ▶ 이 시각 코로나19 확진자 현황을 확인하세요.  ▶ 대한민국 대표 뉴스 채널 YTN 생방송보기  ▶ 네이버에서 YTN 뉴스 채널 구독하기"
2021.03.20.,"""황어야 반갑다!"" 울산 태화강 황어 회귀",https://n.news.naver.com/mnews/article/052/0001564862?sid=102,"[앵커]울산 태화강에 회귀성 어종인 황어 떼가 돌아왔습니다.봄철 산란기를 맞아서 바다를 거슬러 태화강으로 올라온 것인데, 좋은 생태 학습의 장소가 되고 있습니다.울산 JCN 김영환 기자가 취재했습니다.[기자]울산 태화강 상류 선바위교 일대입니다.수중 카메라를 물에 넣으니 황색 바탕에 줄무늬가 선명한 물고기가 힘차게 헤엄을 칩니다.회귀성 어종인 황어입니다.황어는 바다에서 4년 이상 살다가 산란 철을 맞아 하천을 거슬러 올라옵니다.올해는 3월 13일부터 황어 회귀가 관찰됐습니다.황어는 4월까지 상류에서 머무르며 산란을 한 뒤 다시 바다로 나가는 특성을 갖고 있습니다.[윤 석 / 울산시 환경생태과 : 암컷 한 마리에 수컷 여러 마리가 붙어서 수컷이 암컷을 차지해서 알을 낳고 다시 바다로 가는 과정입니다.]울산시는 선바위교 일대에 관찰장을 설치해 시민들이 황어를 자세히 볼 수 있도록 했습니다.3월 중순부터 4월 사이에는 강 위 교량에서도 황어 떼가 무리를 지어 헤엄을 치는 모습을 쉽게 볼 수 있습니다.[윤 석 / 울산시 환경생태과 : (태화강이) 바다와 연결되어 있고 먹이가 풍부하고 알을 낳을 수 있는 자갈이 많은 곳이다 보니 많이 올라오고 해마다 계속 반복하고 있습니다.]황어는 산란 기간인 3월 15일부터 4월 14일까지 포획과 어로행위가 금지된 어종입니다.울산시는 불법포획 행위를 강력히 단속할 방침입니다.JCN뉴스 김영환입니다.※ '당신의 제보가 뉴스가 됩니다' YTN은 여러분의 소중한 제보를 기다립니다.[카카오톡] YTN을 검색해 채널 추가 [전화] 02-398-8585 [메일] social@ytn.co.kr [온라인 제보] www.ytn.co.kr[저작권자(c) YTN & YTN plus 무단전재 및 재배포 금지] ▶ 이 시각 코로나19 확진자 현황을 확인하세요.  ▶ 대한민국 대표 뉴스 채널 YTN 생방송보기  ▶ 네이버에서 YTN 뉴스 채널 구독하기"
2021.03.20.,"[사건의 재구성] ""돈 많다"" 재력가 행세 60대, 함께 땅보러 간 여성 추행 후 살해",https://n.news.naver.com/mnews/article/421/0005234277?sid=102,"금전 문제로 위장하려다 들통…동종범죄 전력도대법원 ""조금도 뉘우치지 않는다"" 무기징역 확정(서울=뉴스1) 박승주 기자 = 임모씨(65)는 경기 부천의 노래주점을 찾았다가 주인 A씨(61·여)를 알게 됐다. 임씨는 재력가처럼 행세하면서 A씨와 함께 부동산을 보러 가기도 했다. 임씨는 지난해 2월 26일 A씨를 차에 태우고 인천으로 이동해 A씨가 미리 보아 둔 땅을 둘러본 다음 식당에서 함께 점심을 먹었다. 사건은 몇 시간 지나지 않아 발생했다. 임씨는 경기 김포 대곶면을 지나던 중 갑자기 차를 도로 옆 공터에 댔고 조수석에 앉은 A씨를 강제 추행했다. A씨는 격렬히 저항했다. 그 순간 A씨가 신고하면 가중처벌을 받을 수 있다는 걱정이 임씨의 머리를 스쳤다. 그는 2014년 강간치상죄 등으로 징역 3년6월을 선고받고 2017년 9월 출소한 전력이 있었다. 결국 임씨는 A씨를 목 졸라 살해하고 인근 농로에 사체를 유기했다. A씨의 가방에서 현금과 신용카드를 훔쳐 유흥업소 등에서 마구 썼다. 임씨는 강제추행살인, 사체유기, 절도, 사기, 여신전문금융업법위반 혐의로 재판에 넘겨졌다. 재판 과정에서 임씨는 A씨 추행 사실을 부인했다. A씨에게 빌려준 돈 일부를 갚으라고 했더니 A씨가 거부하면서 모욕적인 말을 해 우발적으로 살해했다는 것이었다. 그러나 1심은 임씨의 주장을 받아들이지 않았다. 사건 당일 A씨가 임씨의 추행에 거세게 반항하자 목 졸라 제압했다고 보았다. A씨의 상반신에서 임씨의 타액이 검출된 사실도 감식으로 확인됐다. 이번 사건과 2014년 성범죄 사건의 유사성도 드러났다. 1심은 ""여성의 몸 위에 올라타 목을 조르는 행위는 임씨가 반항하는 피해자를 제압하기 위해 주로 사용하는 방법이었다""고 설명했다. 임씨는 사건의 범행 동기를 금전 문제로 인한 다툼으로 위장하려 했지만 받아들여지지 않았다. 두 사람의 카카오톡 대화를 보면 A씨가 ""좋은 부동산 매물이 있다""며 추천하는 내용만 있을 뿐 임씨가 A씨에게 돈을 투자했거나 두 사람 사이에 금전거래가 있음을 전제로 한 대화는 전혀 없었다. 임씨가 A씨에게 송금한 내역도 없었다. 임씨는 범행 전 A씨에게 투자한 사실을 누구에게도 알린 적이 없는데 사건 다음날 갑자기 지인에게 ""돈 받으러 갔다가 욱해서 사고쳤다""는 문자메시지를 보냈고 동거인에게는 ""돈 문제로 아는 여자를 죽였다""는 문자를 발송했다. 1심은 ""금전 문제로 다투다가 우발적으로 살해한 것처럼 범행 동기를 위장했다""며 ""피해자에게 조금이라도 미안한 마음이 있다면 취할 수 없는 태도로 일관하며 전혀 반성하지 않는다""고 질타했다. 임씨에겐 무기징역이 선고됐다. 10년간 신상정보 공개·고지, 5년간 아동·청소년 관련기관 및 장애인복지시설 취업 제한, 20년간 위치추적 전자장치(전자발찌) 부착도 명령받았다. 임씨와 검찰은 1심 판결에 불복해 모두 항소했지만 2심은 항소를 기각했다. 임씨는 2심 판결에도 불복해 상고했지만 대법원은 지난달 무기징역을 확정했다.parksj@news1.kr▶ 네이버 메인에서 [뉴스1] 구독하기!▶  뉴스1&BBC 한글 뉴스 ▶  터닝포인트 2021 © 뉴스1코리아(news1.kr), 무단 전재 및 재배포 금지"
2021.03.20.,"마야폰, 갤럭시S21 울트라 및 노트20 가격 10만원대 총판 할인",https://n.news.naver.com/mnews/article/468/0000752986?sid=105,"[스포츠서울 김수지기자] 삼성전자는 그간 갤럭시S21 시리즈를 비롯해 갤럭시노트20 시리즈 등 프리미엄 라인업에 국한했던 신제품 스마트폰 공개 행사를 보급형으로 확장하며 사상 처음으로 중저가 라인업인 A 시리즈를 위해 언팩 행사를 개최했다. 글로벌 시장에서 거파른 성장세를 보이는 보급형 스마트폰 시장에서 경쟁력 확보와 미국의 제재로 생겨난 중국 화웨이의 빈자리를 적극 공략하기 위한 전략으로 분석된다.삼성전자는 이번 어썸 언팩에서 갤럭시A52·A52 5G, 갤럭시A72 등 보급형 신제품을 선보였으며, 전반적인 기능을 차례로 설명했다. 이는 지난 1월 공개된 갤럭시S21의 언팩과 유사한 방식이다. 삼성전자의 각 담당자들은 갤럭시 A시리즈의 세부적인 기능을 자세히 설명하며 관련영상을 제시했다. 가령 갤럭시A 시리즈 중 처음으로 탑재된 광학식 손떨림 방지 기능을 강조하며, 댄스나 스케이드 보드 기술 장면을 촬영하는 모습을 선보였다.모든 갤럭시 시리즈 중 처음으로 탑재된 ‘펀’ 모드를 사용하는 모습도 영상에서 소개됐으며, ‘펀’모드는 스냅챗의 다양한 AR 렌즈 효과를 활용해 재미있고 독특한 사진이나 동영상 콘텐츠를 만들 수 있다. 또한 이번에 공개된 갤럭시A 시리즈 세 제품은 스마트 싱스를 통해 웨어러블, TV 등 다양한 제품과 연결해 사용할 수 있다. 삼성전자는 언팩에서 이러한 연결 기능들을 소개하며 갤럭시A 시리즈로도 S시리즈처럼 다양한 갤럭시 제품들과 연동해 사용할 수 있는 점을 강조했다.이 외에도 갤럭시A52·A52 5G, 갤럭시A72는 각각 4,500mAh, 5,000mAh 등 대용량 배터리를 갖췄으며 갤럭시S21 시리즈에 지원되지 않던 마이크로 SD(1TB) 카드 슬롯도 탑재했다. 한편 갤럭시A52·A52 5G, 갤럭시A72 등 세 제품은 유럽을 시작을 전세계 시장에 출시될 예정이며, 갤럭시A52와 갤럭시A52 5G의 가격은 각각 46만900원, 57만7000원이다. 반면 갤럭시A72의 경우 60만4000원에 책정됐다.삼성전자와 양대산맥을 이루고 있는 애플 역시 올해 차기 아이폰을 선보일 예정이다. 차기 아이폰은 전작 아이폰12 시리즈와 구성과 크기가 같을 것으로 전망되며, 아이폰12 시리즈는 기본형 라인인 아이폰12 미니와 아이폰12, 프로 라인인 아이폰12 프로와 아이폰12 프로 맥스 등 4종으로 출시될 전망이다. 상위 모델인 프로와 프로 맥스를 기준으로 차기 아이폰은 아이폰 시리즈 중 처음으로 120Hz 주사율을 지원하는 디스플레이가 탑재될 것으로 전망된다.또한 차기 아이폰은 화면 상단을 움푹 파는 노치 크기가 대폭 줄어들고 지문인식인 터치ID가 부활할 것으로 예상된다. 배터리 용량의 경우 내부 설계를 다시 하면서 여유 공간이 늘어나고, 이로 인해 배터리 용량이 더 커질 것으로 전망된다. 저조도 성능의 경우 크게 향상된 초광각 카메라를 비롯해 천체 촬영과 같은 기능이 탑재될 것으로 예상된다. 단 차기 아이폰의 제품명은 아이폰13 대신 아이폰12s가 될 것으로 보인다. 이유는 서양에서 13이란 숫자가 부정적 의미이기 때문이다.한편 애플은 현재 폴더블 아이폰을 개발하고 있다. 해당 제품은 이르면 2023년에 출시될 것으로 예상되며, 화면 크기는 7.5~8인치 수준이 될 것으로 전망된다. 가격의 경우 삼성의 갤럭시 폴드2와 같이 비슷하거나 조금 더 비싸게 책정될 것으로 예상된다. 디스플레이의 경우 삼성 디스플레이 혹은 LG 디스플레이를 채택할 것으로 보이며, 스타일러스펜인 애플펜슬을 지원할 것으로 전망된다.이런 가운데 온라인 최신 스마트폰 전문 할인점 ‘마야폰’에서는 최신 스마트폰 갤럭시S21 시리즈를 비롯해 작년에 출시된 갤럭시노트20 시리즈 등 삼성의 인기 플래그십 모델들을 한데 모아 총판 할인 행사를 실시했다. 이번 행사는 고객들의 니즈를 적극 반영해 출고가 대비 비교적 저렴한 가격대로 판매하고 있으며, 통신사와 가입유형에 따르는 차등 할인 없이 동등한 할인 혜택을 제공하고 있다.아울러 총판 할인 행사는 포털 검색 ‘마야폰’ 공식 홈페이지와 카카오톡 ‘마야폰’ 채널을 통해 자세한 정보를 확인해 볼 수 있다. 삼성 갤럭시S21, 갤럭시S21 플러스 등 두 제품의 가격은 90% 할인이 적용되어 10만원대 특가로 만나볼 수 있으며, 최상위 모델인 갤럭시S21 울트라는 추가 할인을 통해 시가 보다 저렴한 가격대로 개통할 수 있다. 또한 갤럭시노트20과 갤럭시노트20 울트라는 특별할인이 적용되어 각각 10만원대, 20만원대로 구입할 수 있다.sjsj1129@sportsseoul.com[기사제보 news@sportsseoul.com]  Copyright ⓒ 스포츠서울&sportsseoul.com"
