기사날짜,기사제목,네이버 뉴스 url,기사내용
2021.03.15.,"[단독]""카카오가 갈 길 찾자""…인사평가·보상 TF '길' 내달 출범",https://n.news.naver.com/mnews/article/421/0005221722?sid=105,"경기도 성남시 카카오 판교오피스의 모습. © News1 조태형 기자(서울=뉴스1) 손인해 기자 = '당신과 일하기 싫다'는 인사평가 항목으로 논란이 불거진 카카오가 평가제도와 보상 등 인사 전반의 문제를 논의하는 태스크포스(TF) '길'(가칭)을 내달 출범시킨다. 15일 업계에 따르면 카카오는 최근 직원들에게 인사 TF '길'을 4월 첫째 주 출범시킬 예정이라고 공지했다. 이 협의체에 참여를 원하는 직원은 이번 주까지 신청을 받는다.길은 '카카오가 갈 길을 찾아나가자'는 의미다. 앞서 카카오는 지난 2일 카카오 본사 전 직원을 대상으로 인사제도 관련 의견을 나누는 오픈톡을 진행한 뒤 향후 직원들의 의견을 반영하기 위한 논의 테이블을 운영하겠다고 밝힌 바 있다.카카오는 ""인사 제도 개선을 위해 크루(임직원)의 피드백을 받고 크루가 중심이 되는 인사제도를 새롭게 만들어가고자 관련 TF를 신설한다""며 ""현행 인사제도 중 개선이 필요한 아젠다에 대해 크루들의 의견을 모아 직접 논의과정에 참여하고 해결해 나갈 예정""이라고 했다.민주노총 전국화학섬유식품산업노동조합 소속 카카오 노조 '크루유니언'은 이달 말 진행하는 단체협약에서도 관련 논의를 진행한다는 방침이다. 카카오 인사평가 논란은 지난달 카카오 직원으로 추정되는 인물이 직장인 익명 커뮤니티 '블라인드'에 자신이 회사에서 따돌림을 당하고 있다는 토로와 함께 유서를 암시하는 글을 올린 게 발단이 됐다. 이 게시물을 계기로 카카오가 동료를 상대로 '이 사람과 함께 일하고 싶은가'를 조사하고 결과가 당사자에게도 알려져 압박과 스트레스를 준다는 내용의 후속 불만을 표출하는 글이 올라오면서 논란이 커졌다. 카카오는 지난 2일 오픈톡에서 이와 관련해 동료·상향평가의 장점은 유지하면서 표현 방식은 직원들에게 심리적 안정감과 인식을 주는 쪽으로 개선하겠다고 밝혔다. 연초 업계를 강타한 연봉인상 도미노 사태로 직원들의 처우 문제도 TF의 논의 테이블에 오를 것으로 보인다. 카카오 창업자인 김범수 이사회 의장은 지난달 25일 열린 사내 간담회에서 ""저는 카카오가 경쟁력이 있는 회사라면 보상도 많아야 한다고 본다. 다른 곳보다 (보상이) 작다면 빨리 개선해야 할 것""이라면서도 ""단기적으로는 (보상을) 못 맞추고 장기적으로는 약간의 시간을 (우리에게) 줄 수 있으면 좋을 것 같다. 어느 순간 균형을 못 맞출 가능성도 있다""고 말했다.son@news1.kr▶ 네이버 메인에서 [뉴스1] 구독하기!▶  뉴스1&BBC 한글 뉴스 ▶  터닝포인트 2021 © 뉴스1코리아(news1.kr), 무단 전재 및 재배포 금지"
2021.03.15.,‘알파고’ 뛰어넘는 AI 기술 나오나..SKT-카카오 손잡았다,https://n.news.naver.com/mnews/article/018/0004876049?sid=105,"최근 'AI·ESG·지재권 협력 MOU' 체결한국 대표하는 초거대 AI 기술 공동 개발[이데일리TV 김종호 기자] 15일 이데일리TV 빅머니 1부 ‘뉴스 in 이슈’에서는 SK텔레콤(017670)과 카카오(035720)가 ‘인공지능(AI)·ESG·지식재산권 협력 업무협약(MOU)’를 체결했다는 소식을 전했다.앞서 SKT와 카카오는 2019년 10월 3000억원 규모로 주식을 상호 교환하면서 제휴 관계를 시작했다. 지난해 1월 박정호 SKT 사장이 카카오에 AI 초협력을 제안한 뒤 같은 해 12월 AI R&D 협의체를 결성하면서 본격적인 미래 준비에 나섰다.여기에 이달 들어서 SKT와 카카오가 AI·ESG·지식재산권 협력 MOU를 체결했다. 각 분야에서 상호 협력하고 주요 자산을 사회에 나누기로 한 것이다.우선 두 기업은 이번 협력을 통해 한국을 대표하는 AI 기술을 공동으로 개발하기로 했다. 인프라부터 데이터와 같은 전 개발 영역에서 협업하고 함께 투자해서 초거대 AI 기술을 만들기로 한 것이다. 채팅이나 음성으로 사람과 자연스럽게 대화하고 공감까지 하는 고도화한 자연어처리 AI 모델 개발을 추진하는 것으로 알려졌다. 관련 기술을 개발하고 이를 기반으로 각자 사업인 통신이나 채팅, 포털 등 서비스에 적용하겠다는 방침이다.한편 SKT와 카카오는 AI 협력 외에도 ESG 공동 펀드를 조성해 중소기업이나 스타트업과 같은 혁신 기업을 지원하기로 했다. 아울러 각자 보유 중인 지재권을 공익  목적으로 개방해 혁신 기업과 공유하기로 합의했다.15일 이데일리TV 빅머니 1부 ‘뉴스 in 이슈’ 방송. SK텔레콤과 카카오가 협력한다는데.. 어떤 식으로 진행하나? - 한국 대표할 초거대 AI 기술 공동 개발키로- ESG 공동 펀드 조성·혁신 기업 지원도 협력 이번 협력은 어떤 의미를 가지는지? 일부 사업에서는 경쟁 관계 아닌가?-모빌리티·음원 플랫폼에서는 SKT와 카카오도 경쟁  멜론은 카카오에서 분사한다던데?-카카오, 멜론 분사…6월 ‘멜론컴퍼니’ 신설 예정-카카오엔터-멜론 합병 가능성? “협업 시너지 도모”김종호 (kona@edaily.co.kr)▶ #24시간 빠른 #미리보는 뉴스 #eNews+▶ 네이버에서 '이데일리 뉴스'를 만나보세요▶ 빡침해소, 청춘뉘우스 '스냅타임'＜ⓒ종합 경제정보 미디어 이데일리 - 무단전재 & 재배포 금지＞"
2021.03.15.,"[단독] 홍현희, '와썹맨' 이건영 PD와 뭉쳐.. 카카오 신규 예능 론칭",https://n.news.naver.com/mnews/article/052/0001562776?sid=106,<구조 다름>
2021.03.15.,'삼전·카카오 0.1주 매수' 못할 이유 있나요~,https://n.news.naver.com/mnews/article/024/0000067913?sid=110,"국내 주식 소수점 거래 가능해질까동학개미, 로빈후드, 청년부추의 공통점은?한국과 미국, 중국 개미투자자를 일컫는 말이다. 코로나19 발발 이후, 개인투자자가 전 세계 주식시장을 주도했다 해도 과언이 아니다. 한국 개미 목소리도 전례 없이 커졌다. 증권거래세 인상, 공매도 재개 등 정부 방침에 반기를 들어 승리(?)를 쟁취했다. 최근 새롭게 목소리를 내는 정책이 있다. 주식 소수점 거래다. 이는 주식 거래 최소 단위를 1주에서 소수점으로 낮춰 매매하는 방식이다. 예컨대 8만900원(3월 10일 종가)인 삼성전자 주식을 0.1주씩 거래한다면 8090원으로 매수·매도가 가능해진다. 금액 단위 거래도 열어뒀다. 현재 8만원으로는 삼성전자 주식을 단 한 주도 살 수 없다. 소수점 매매가 허용되면 8만원으로 삼성전자 주식 0.988주를 매수할 수 있다. 고가주에 접근하기 어려운 개미투자자가 ‘주식 쪼개기’ 거래를 원하는 이유다. 지난 3월 4일 청와대 청원 게시판에는 ‘소수점 주식 거래 제도 도입을 청원합니다’라는 제목의 글이 올라오기도 했다. 자신을 ‘샐러리맨으로 살아가는 평범한 청년’이라고 밝힌 청원인은 “소액으로 투자를 시작해보려는 투자자들이 주식시장에 쉽게 접근할 수 있도록 소수점 거래가 반드시 필요하다”고 주장했다. 이어 “황제주에 투자하려면 1주 가격이 100만원을 넘는 경우가 있기 때문에 가진 게 많지 않은 서민은 투자가 어렵다”고 덧붙였다. 이 같은 소수점 거래 서비스가 아예 없는 것은 아니다. 현재 국내에서는 신한금융투자와 한국투자증권이 혁신금융서비스 차원에서 해외 주식에 한해 주식 소수점 매매 서비스를 제공한다.  최근 국내 주식 소수점 거래를 허용해야 한다는 주장이 나온다. 개인이 자산 포트폴리오를 짜는 데 유리하다는 긍정론과 한국에 고가주가 많지 않아 실효성이 떨어진다는 부정론이 공존한다. 사진은 KB국민은행 주식 시세판. <매경DB>  ▶주가 급등으로 고가주 증가 ▷해외서도 소수점 매매 활용 최근 고가주가 늘어났다는 점도 소수점 매매가 필요한 이유로 꼽힌다. 한국거래소와 자본시장연구원에 따르면, 삼성전자부터 SK까지 2월 말 기준 코스피 시가총액 상위 20위 종목 평균 주가(종가 기준)는 40만5035원이었다. 이들 종목의 2019년 말 평균 주가는 23만6535원 수준으로, 1년 2개월 만에 71% 올랐다. 기존 투자자는 쏠쏠한 수익을 냈다. 반면 이제 새로 진입하는 ‘주린이’에게는 높아진 주가가 부담스럽게 다가올 여지가 있다. 예를 들어 LG화학(2월 말 기준 83만1000원), 삼성바이오로직스(75만원), 엔씨소프트(93만6000원) 등은 지난 1년여 기간 주가가 2배 이상 올라 100만원을 육박한다. 시총 20위권 중 주당 10만원을 넘지 않는 종목은 1년 전 7개 정도가 있었는데 지금은 단 3~4개뿐이다. 증권가도 주식 소수점 거래 도입을 반긴다. 최근 이광재 더불어민주당 의원 등의 주최로 열린 ‘주식 소수점 매매 허용 방안 토론회’에서 금융시장 업계는 국내 주식의 소수점 매매가 필요하다는 의견을 냈다. 이 자리에서 류영준 카카오페이 대표는 “자산 배분 관점에서 개인은 우량주를 직접 투자하는 데 불리한 조건에 놓였다”고 말했다. 미국·영국·캐나다 등 주요 선진국에서 ‘주식 쪼개기 매매’를 도입한 것도 이런 주장에 힘을 싣는 근거로 꼽힌다. 동전으로 투자하는 펀드가 인기를 끌었다는 점은 주식 소수점 거래의 성공 가능성을 엿보게 한다. 키움투자자산운용은 카카오페이증권을 통해 ‘키움 똑똑한 펀드(4차산업혁명ETF분할매수증권투자신탁(혼합-재간접형))’를 팔아 순자산 2000억원을 쌓았다. 이 펀드는 카카오페이 플랫폼에서 1000원부터 투자할 수 있게 고안됐다. ‘동전’이 쌓여 ‘목돈’이 된 셈이다. 정부도 소수점 매매에 대해 부정적인 것은 아니다. 이 의원실에 따르면 정세균 국무총리는 최근 대정부 질문에서 이와 관련한 질의에 “코스피 3000 수준인데 더 올라가면 주식 가격이 더 높아질 것이고 이 경우 (주식 소수점 매매가) 효용성이 있다고 본다”며 “못할 이유가 없다”고 말했다. 김상봉 한성대 경제학과 교수는 “현재 국내인이 해외 주식 살 때 소수점 거래를 허용하고 있는데, 정작 국내 주식 살 때 소수점 거래가 안 된다고 할 수는 없지 않은가”라는 입장을 밝혔다. ▶“고가주 적어 필요 없다” 주장도 ▷금융위도 제도 개편에 미온적  풀어야 할 난제가 적지 않다. 소수점 거래를 시행하려면 1주를 최소 단위를 하는 자본시장법 등 관련 법 개정이 필요하다. 현 제도에서는 예탁되는 주식의 기본 단위가 1주다. 소수점으로 쪼개 거래할 경우 이를 어떻게 처리할지 불분명하다. 의결권도 고민해봐야 하고, 증권사 시스템 구축도 선결 과제로 꼽힌다. 지난해 테슬라와 애플이 액면분할을 실시하자 당시 일부 증권사가 모바일트레이딩시스템(MTS) 오류를 낸 바 있다. 조승빈 대신증권 애널리스트는 “1주 단위에서 0.1주 단위로 변경하면 기업이 주주 명부를 관리하는 일이 쉽지 않고 서버 관리 비용도 늘어날 것으로 예상한다”고 말했다. 증권사들은 법 개정에 시간이 걸리니 ‘규제 샌드박스(규제 면제)’ 도입을 요청한다. 현재 신한금융투자와 한국투자증권이 해외 주식 소수점 매매를 할 수 있는 것도 관련법의 특례가 적용됐기 때문이다. 류영준 대표는 “본격적인 제도 도입 전, 소수점 매매에 대한 혁신금융서비스로 테스트해볼 필요가 있다”며 규제 샌드박스 적용을 요청하는 의사를 내비쳤다.소수점 거래가 필요 없다는 주장도 있다. 한국 증시에 고가 주식이 많지 않다는 이유다. 현재 국내 증시에서 1주 가격이 가장 비싼 주식은 LG생활건강(150만4000원·3월 9일 종가 기준)이다. 100만원을 넘는 종목은 LG생활건강이 유일하고, 50만원을 넘는 종목도 9개에 그친다.반면 소수점 거래가 가장 활발히 이뤄지는 미국은 고액 주식이 더 많다. 가장 비싼 버크셔해서웨이클래스A(BRK.A)는 한 주 가격이 40만달러로, 한화 4억4000만원에 달한다. 시총 3, 4위인 아마존(AMZN)과 알파벳(GOOGL)은 각각 3057달러, 2055달러 수준이다(3월 10일 현지 시간 기준). 미국에 상장된 주식 중 1000달러(약 113만원) 넘는 주식은 70개에 육박한다. 금융당국 반응도 미온적이다. 금융위원회는 지난해 8월 금융 규제 개선 과제로 해외 주식뿐 아니라 국내 주식에서도 개인투자자 소수 단위 매매를 허용하는 방안을 고려한다고 밝혔다. 2020년 말까지 규제 정비 방안을 마련할 방침이라 덧붙였다. 그러나 2021년 3월이 되도록 달라진 것은 없다. [명순영 기자  msy@mk.co.kr] [본 기사는 매경이코노미 제2100호 (2021.03.17~2021.03.23일자) 기사입니다] ▶ 네이버 메인에서 '매경이코노미'를 받아보세요▶ 고품격 자영업자 심폐소생 프로젝트 '창업직썰' 유튜브▶ 주간지 정기구독 신청[ⓒ 매일경제 & mk.co.kr, 무단전재 및 재배포 금지]"
2021.03.15.,‘카카오 그룹’ 추가 상장으로 네이버 시총 넘을까…SK 계열사도 준비중,https://n.news.naver.com/mnews/article/081/0003171089?sid=101,"IPO 거론되는 카카오 계열사만 5곳SK에서도 원스토어 등 출격 준비중카카오게임즈, 코스닥 상장 동시에 시가총액 5위 - 10일 경기 성남 분당구 카카오게임즈 본사. 카카오게임즈는 이날 코스닥 상장과 동시에 ‘따상(시초가가 공모가 대비 상한선인 2배로 결정된 뒤 상한가)’으로 직행하며 단숨에 코스닥 시가총액 5위에 올랐다. 2020.9.10/뉴스1SK와 카카오가 올해 공모주 시장을 뒤흔들 조짐이다. 국내 대기업중 계열사 수 1·2위를 차지하고 두 기업의 주력 자회사들이 줄줄이 상장을 앞두고 있어서 업계에 지각변동이 일어날지 벌써 관심이 쏠린다.15일 업계에 따르면 카카오 계열사 중에서 상장이 거론되고 있는 곳은 카카오페이, 카카오뱅크, 카카오엔터테인먼트, 카카오모빌리티, 야나두 5곳이다. 그 중에서 카카오모빌리티를 제외한 나머지 4곳은 이미 상장 절차를 주관하는 증권사까지 선정했다. 카카오페이가 올해 상반기 중에 기업공개(IPO)에 나설 것으로 보이고, 카카오뱅크와 카카오엔터테인먼트는 올해 하반기에 상장한다는 전망이 많다. 야나두와 카카오모빌리티는 내년에 상장에 돌입할 것으로 업계는 보고 있다.업계에서는 상장을 앞둔 카카오 계열사 5곳의 시총이 약 45조원에 이를 것으로 본다. 카카오페이는 10조원, 카카오뱅크 20조원, 카카오엔터테인먼트와 카카오모빌리티는 각각 7조원, 야나두 1조원으로 전망하고 있다. 앞으로 업황이 어떻게 바뀔지 모르지만 현재 예상대로 상장이 된다면 이미 주식시장에 안착한 카카오 본사(42조원)와 카카오게임즈(3조 7000억원)까지 합쳐 ‘카카오 그룹’의 시총은 약 90조원에 이를 것이라는 추산이 나온다. - 네이버 카카오카카오가 네이버 시총을 뛰어 넘을지도 관심이다. 카카오와 함께 국내 인터넷기업 ‘양대 강자’ 중 하나인 네이버는 현재 국내주식 시가총액이 62조원이다. ‘업계 대장주’라 불리는 네이버지만 앞으로는 90조원에 달할 전망인 카카오 공동체에 뒤쳐질 가능성이 높다. 네이버와 소프트뱅크가 합작해 만든 회사인 ‘Z홀딩스’의 일본 사장 주식 시가총액(48조원)에서 지분법상 실질적인 네이버의 지분(32.6%)을 더해봐도 네이버의 국내외 시총은 80조원에 못 미칠 것이란 계산이 나온다. 네이버는 48개의 계열사중 본사만 상장했지만 카카오는 계열사(105개) 숫자가 두 배 이상이고 IPO에도 적극적인 모습을 보이고 있어서 이같은 차이가 발생한 것이다.계열사 144개를 보유한 SK그룹에서는 역대 청약 증거금 중 최고액인 63조 6198억원을 모았던 최창원 SK디스커버리 부회장(최태원 SK그룹 회장의 사촌동생)의 SK바이오사이언스가 오는 18일 상장을 앞두고 있다. SK텔레콤 산하의 원스토어가 하반기쯤 상장에 돌입한 뒤 ADT캡스, 11번가, 웨이브, SK브로드밴드 등도 시동을 걸 전망이다. - 원스토어지난해 국회를 통과한 공정거래법 개정안이 내년부터 시행되는데 이를 대비하기 위해서라도 SK텔레콤은 산하 회사들의 상장을 서두를 가능성이 높다. 개정안이 시행되면 지주회사의 자회사 지분 의무 비율이 기존 20%에서 30%로 높아진다. SK하이닉스 지분을 20.1% 보유한 SK텔레콤은 현재 주가 기준으로 9조~10조원에 달하는 자금을 확보해야 30%까지 지분율을 끌어올릴 수 있다.업계 관계자는 “만약 연내 중간지주사로 전환을 마무리하면 법이 소급되지 않아 SK하이닉스 지분율을 20.1%로 유지해도 된다”면서 “다만 SK텔레콤이 ‘탈 통신’을 부르짖는 입장인 만큼 상장을 통해 계열사들의 기업가치를 끌어 올릴 필요가 있다”고 말했다.한재희 기자 jh@seoul.co.kr▶ 네이버에서 서울신문 구독하기 클릭!  ▶ [인터랙티브] 코로나 청년 잔혹사   ▶ [나우뉴스] 세상에 이런 일이ⓒ 서울신문(www.seoul.co.kr), 무단전재 및 재배포금지"
