기사날짜,기사제목,네이버 뉴스 url,기사내용
2021.03.15.,세타필 '진정 젤크림' 민감 피부 위한 착한 화장품 선정,https://n.news.naver.com/mnews/article/018/0004876179?sid=101,"(사진=갈더마코리아 세타필)[이데일리 이재길 기자] 스위스 더마 브랜드 세타필이 출시한 ‘진정 젤크림’이 디렉터파이의 성분검사를 통과해 ‘민감 피부를 위한 착한 화장품’으로 선정됐다고 15일 밝혔다.세타필 진정 젤크림은 가볍고 부드러운 사용감의 젤크림 타입의 포뮬러이다. ‘빠른 보습과 진정’ ‘피부 유수분 밸런스 유지’ ‘피부 속보습 상승’ ‘쿨링효과’ 등을 통해 외부 상황으로 민감해진 피부에 보습과 진정 처방을 선사해준다.화장품 성분을 분석하는 디렉터파이(피현정 크리에이티브 디렉터)는 “진정 젤크림은 좋은 보습제의 조건 세 가지, ‘성분 구성과 함량’, ‘효과’, ‘사용감’ 모든 부분에서 높은 점수를 준다”며 “사계절 내내 수분과 겉 수분 모두 완벽하게 채워주며, 연고와 더마 코스메틱에서 많이 사용하는 알란토인과 판테놀 성분이 높게 함유되어 진정 효과가 뛰어나다. 7가지 유해 성분을 완벽하게 배제함은 물론 동물 유래 성분이 없는 착한 화장품으로, 모두가 사용하기 적합하다”고 전했다.세타필 관계자는 “꼼꼼한 화장품 성분 분석으로 유명한 디렉터파이의 성분 분석을 통과하여 착한 화장품으로 소비자들에게 다가갈 수 있어서 기쁘다”며 “민감 피부를 위한 진정 솔루션 ‘진정 젤크림’이 진정이 필요한 모든 순간에 항상 함께 하기를 바란다”고 말했다.세타필의 진정 젤크림 영상은 세타필 공식 유튜브 채널에서 확인할 수 있다. 또 세타필 진정 젤크림은 올리브영 온오프라인 스토어, Gmarket, 11번가, 카카오톡 선물하기에서 만나볼 수 있다.이재길 (zack0217@edaily.co.kr)▶ #24시간 빠른 #미리보는 뉴스 #eNews+▶ 네이버에서 '이데일리 뉴스'를 만나보세요▶ 빡침해소, 청춘뉘우스 '스냅타임'＜ⓒ종합 경제정보 미디어 이데일리 - 무단전재 & 재배포 금지＞"
2021.03.15.,"유안타증권, 연초 이후 공모주펀드 약 5천억 원 판매",https://n.news.naver.com/mnews/article/031/0000588095?sid=101,"올해 초대형 공모주 잇따른 상장…공모주 투자 상품 인기[아이뉴스24 김종성 기자]유안타증권은 올해 들어서만 약 5천억원의 공모주펀드를 판매했다고 15일 밝혔다.공모주 청약에 지속적으로 자금이 몰리는 시장 환경에서 물량확보 측면에서 장점을 지닌 공모주펀드를 통한 투자전략을 제시하며 우량 공모주펀드를 엄선해 적극적으로 제공한 것이 주효했다. [사진=유안타증권]지난해에도 공모주 투자 수요 증가 속에 다양한 공모주펀드를 판매해 하반기에만 약 7천억 원 넘는 판매 성과를 거둔 바 있다. 또 좋은 운용 성과가 올해도 이어질 것으로 기대하는 분위기가 반영되며 이같은 판매 호조로 이어진 것으로 풀이된다.올해는 3월 상장 예정인 SK바이오사이언스를 시작으로 SK아이이테크놀로지, 카카오뱅크, 카카오페이, 크래프톤, LG에너지솔루션 등 초대형 공모주 IPO가 예정돼 있어 어느 때보다 공모주펀드에 대한 시장의 기대가 크다.그러나 인기 공모주의 경우 배정물량이 너무 적어 개인들에게는 공모주 우선 배정 혜택과 비율 등 물량확보 측면에서 청약 대비 상대적으로 유리한 공모주펀드가 투자 대안이 될 수 있다.특히 올해부터 최소 청약 주수 이상 신청한 투자자에게 공모주의 50% 이상 균등 배정하는 방식으로 청약 제도가 변경됨에 따라 청약 열기가 뜨거울수록 경쟁률은 높아지고 있는 상황에서 공모주펀드가 한층 주목받고 있다.신남석 유안타증권 리테일사업부문대표는 ""2020년 SK바이오팜, 카카오게임즈, 빅히트엔터테인먼트 등 대형 공모주들이 상장되면서 공모주 시장에 대한 관심과 투자 수요가 크게 늘었다""며 ""공모주펀드가 매력적인 금융상품으로 눈길을 끌기 시작해 이에 발맞춰 선제적으로 고객 니즈에 최적화한 공모주 투자상품을 선별 제공해 왔다""고 말했다.신 대표는 이어 ""2021년 역시 역대 최대 수준의 청약증거금 기록을 세운 SK바이오사이언스를 필두로 초대형 공모주들이 연이어 상장 예정""이라며 ""이런 시장 트렌드를 감안하면 공모주펀드가 여전히 좋은 대안으로서 꾸준히 관심 갖고 포트폴리오에 꼭 편입시켜야 할 상품""이라고 강조했다.유안타증권은 공모주펀드 투자에 적합한 시장 환경이 이어지는 만큼 고객 니즈에 맞는 경쟁력있는 상품을 지속 발굴해 제공하고 엄격한 사후 관리 등 고객 수익을 제고할 수 있는 다양한 서비스를 강화할 계획이다./김종성 기자(stare@inews24.com)▶네이버 채널에서 '아이뉴스24'를 구독해주세요.▶재밌는 아이뉴스TV 영상보기 ▶아이뉴스24 바로가기[ⓒ 아이뉴스24 무단전재 및 재배포 금지]"
2021.03.15.,세타필 '진정 젤크림' 민감 피부 위한 착한 화장품 선정,https://n.news.naver.com/mnews/article/018/0004876179?sid=101,"(사진=갈더마코리아 세타필)[이데일리 이재길 기자] 스위스 더마 브랜드 세타필이 출시한 ‘진정 젤크림’이 디렉터파이의 성분검사를 통과해 ‘민감 피부를 위한 착한 화장품’으로 선정됐다고 15일 밝혔다.세타필 진정 젤크림은 가볍고 부드러운 사용감의 젤크림 타입의 포뮬러이다. ‘빠른 보습과 진정’ ‘피부 유수분 밸런스 유지’ ‘피부 속보습 상승’ ‘쿨링효과’ 등을 통해 외부 상황으로 민감해진 피부에 보습과 진정 처방을 선사해준다.화장품 성분을 분석하는 디렉터파이(피현정 크리에이티브 디렉터)는 “진정 젤크림은 좋은 보습제의 조건 세 가지, ‘성분 구성과 함량’, ‘효과’, ‘사용감’ 모든 부분에서 높은 점수를 준다”며 “사계절 내내 수분과 겉 수분 모두 완벽하게 채워주며, 연고와 더마 코스메틱에서 많이 사용하는 알란토인과 판테놀 성분이 높게 함유되어 진정 효과가 뛰어나다. 7가지 유해 성분을 완벽하게 배제함은 물론 동물 유래 성분이 없는 착한 화장품으로, 모두가 사용하기 적합하다”고 전했다.세타필 관계자는 “꼼꼼한 화장품 성분 분석으로 유명한 디렉터파이의 성분 분석을 통과하여 착한 화장품으로 소비자들에게 다가갈 수 있어서 기쁘다”며 “민감 피부를 위한 진정 솔루션 ‘진정 젤크림’이 진정이 필요한 모든 순간에 항상 함께 하기를 바란다”고 말했다.세타필의 진정 젤크림 영상은 세타필 공식 유튜브 채널에서 확인할 수 있다. 또 세타필 진정 젤크림은 올리브영 온오프라인 스토어, Gmarket, 11번가, 카카오톡 선물하기에서 만나볼 수 있다.이재길 (zack0217@edaily.co.kr)▶ #24시간 빠른 #미리보는 뉴스 #eNews+▶ 네이버에서 '이데일리 뉴스'를 만나보세요▶ 빡침해소, 청춘뉘우스 '스냅타임'＜ⓒ종합 경제정보 미디어 이데일리 - 무단전재 & 재배포 금지＞"
2021.03.15.,"유안타증권, 연초 이후 공모주펀드 약 5천억 원 판매",https://n.news.naver.com/mnews/article/031/0000588095?sid=101,"올해 초대형 공모주 잇따른 상장…공모주 투자 상품 인기[아이뉴스24 김종성 기자]유안타증권은 올해 들어서만 약 5천억원의 공모주펀드를 판매했다고 15일 밝혔다.공모주 청약에 지속적으로 자금이 몰리는 시장 환경에서 물량확보 측면에서 장점을 지닌 공모주펀드를 통한 투자전략을 제시하며 우량 공모주펀드를 엄선해 적극적으로 제공한 것이 주효했다. [사진=유안타증권]지난해에도 공모주 투자 수요 증가 속에 다양한 공모주펀드를 판매해 하반기에만 약 7천억 원 넘는 판매 성과를 거둔 바 있다. 또 좋은 운용 성과가 올해도 이어질 것으로 기대하는 분위기가 반영되며 이같은 판매 호조로 이어진 것으로 풀이된다.올해는 3월 상장 예정인 SK바이오사이언스를 시작으로 SK아이이테크놀로지, 카카오뱅크, 카카오페이, 크래프톤, LG에너지솔루션 등 초대형 공모주 IPO가 예정돼 있어 어느 때보다 공모주펀드에 대한 시장의 기대가 크다.그러나 인기 공모주의 경우 배정물량이 너무 적어 개인들에게는 공모주 우선 배정 혜택과 비율 등 물량확보 측면에서 청약 대비 상대적으로 유리한 공모주펀드가 투자 대안이 될 수 있다.특히 올해부터 최소 청약 주수 이상 신청한 투자자에게 공모주의 50% 이상 균등 배정하는 방식으로 청약 제도가 변경됨에 따라 청약 열기가 뜨거울수록 경쟁률은 높아지고 있는 상황에서 공모주펀드가 한층 주목받고 있다.신남석 유안타증권 리테일사업부문대표는 ""2020년 SK바이오팜, 카카오게임즈, 빅히트엔터테인먼트 등 대형 공모주들이 상장되면서 공모주 시장에 대한 관심과 투자 수요가 크게 늘었다""며 ""공모주펀드가 매력적인 금융상품으로 눈길을 끌기 시작해 이에 발맞춰 선제적으로 고객 니즈에 최적화한 공모주 투자상품을 선별 제공해 왔다""고 말했다.신 대표는 이어 ""2021년 역시 역대 최대 수준의 청약증거금 기록을 세운 SK바이오사이언스를 필두로 초대형 공모주들이 연이어 상장 예정""이라며 ""이런 시장 트렌드를 감안하면 공모주펀드가 여전히 좋은 대안으로서 꾸준히 관심 갖고 포트폴리오에 꼭 편입시켜야 할 상품""이라고 강조했다.유안타증권은 공모주펀드 투자에 적합한 시장 환경이 이어지는 만큼 고객 니즈에 맞는 경쟁력있는 상품을 지속 발굴해 제공하고 엄격한 사후 관리 등 고객 수익을 제고할 수 있는 다양한 서비스를 강화할 계획이다./김종성 기자(stare@inews24.com)▶네이버 채널에서 '아이뉴스24'를 구독해주세요.▶재밌는 아이뉴스TV 영상보기 ▶아이뉴스24 바로가기[ⓒ 아이뉴스24 무단전재 및 재배포 금지]"
2021.03.15.,"윤지성, 워너원 리더→전역돌 컴백..4월에 돌아온다 [공식]",https://n.news.naver.com/mnews/article/109/0004368892?sid=106,<구조 다름>
2021.03.15.,[시그널] SK바사는 예고편...'1등 기업들' 몰려온다,https://n.news.naver.com/mnews/article/011/0003883449?sid=101,"[막오른 IPO대어들의 잔치]수요예측 신기록 '자이언트스텝'비상장 황제주 '크래프톤' 이어배터리 1위 'LG에너지솔루션' 등줄줄이 상장...청약 열풍 이어질듯[서울경제] [편집자註] 이 기사는 2021년 3월 15일 16:01 프리미엄 컨버전스 미디어  '시그널(Signal)' 에 표출된 기사입니다.크래프톤의 배틀그라운드/ 사진제공=크래프톤홈페이지SK바이오사이언스가 국내 공모주 청약의 이정표를 세운 가운데 글로벌 시장에서 경쟁력을 인정 받은 주요 기업들의 기업공개(IPO)가 이어진다. 중복 청약 금지 등 공모주 일반 청약 제도 개선이 예고돼 있지만 세계 1등 타이틀을 단 기업들에 대한 개인 투자자의 러브콜은 계속될 것이라는 분석이다.15일 관련 업계에 따르면 이달 말 자이언트스텝을 시작으로 대어(大魚)들의 기업공개가 잇따른다. 한국 기업이지만 글로벌 시장에서 혹은 국내 시장에서 압도적인 사업 경쟁력을 인정 받고 있다.첫 포문은 자이언트스텝이다. 이미 기관투자가 청약에서 역대 최고 기록인 1,691 대 1을 기록했다. 영상물의 시각효과(VFX) 기술에서 경쟁력을 갖고 있다. 지난 2008년 설립돼 광고와 영화 영상뿐 아니라 최근에는 가상현실(VR) 및 인터랙티브 디자인, 홀로그램 등 실감형 뉴미디어 콘텐츠에서 실력을 인정 받고 있다. SM엔터의 걸그룹 에스파의 아바타 제작을 비롯해 네이버·넷플릭스·구글·NBC유니버셜스튜디오 등 국내외 주요 기업들을 고객사로 두고 있다. 최근 가상현실(메타버스) 관련주로 미국 게임 업체 로블록스가 10일 뉴욕증권거래소에 상장한 후 관련 사업에 대한 재평가가 이뤄지는 만큼 일반 청약에서도 큰 인기를 끌 것으로 전망된다.1인칭 슈팅게임(FPS) ‘배틀그라운드’로 알려진 비상장 시장 황제주 크래프톤의 상장도 임박했다. 이달 말 예심을 청구하고 이르면 6월 상장될 예정이다. 2019년까지 PC와 콘솔용 판매량은 5,500만 장, 모바일용 다운로드 건수는 6억 건을 넘어선 바 있다. 모바일 데이터 분석 플랫폼인 앱애니에 따르면 배틀그라운드 모바일은 월간활성이용자수(MAU) 1위, 앱 다운로드 랭킹 4위, 소비자 지출 랭킹 7위 등 세 가지 분야 상위 10위권에 이름을 올린 유일한 기업이다. 지난해 연 매출은 약 2조 원 내외, 영업이익은 1조 원대로 추산된다. 이미 가능성을 알아본 투자자들이 몰리며 크래프톤은 장외주식(OTC) 시장에서 주당 약 170만~180만 원에 거래되고 있다. 시총 약 15조 원 규모로 이대로 상장하면 코스피 기준 26위인 삼성SDS를 넘어설 것으로 전망된다.세계적 명품 핸드백 제조사인 시몬느 역시 상장을 준비하고 있다. 글로벌 제조자개발생산(ODM) 시장점유율 10%로 업계 1위로 평가 받는다. 버버리와 코치·DKNY·마크제이콥스·토리버치 등 이름만 들으면 알 만한 명품 브랜드의 핸드백을 시몬느가 만든다. 2015년 세계적 투자사인 블랙스톤이 3,000억 원을 투자한 기업이다. 올 하반기 상장 예정인데 기업가치는 1조 4,000억~2조 원 정도로 거론되고 있다. 신종 코로나바이러스 감염증(코로나19)으로 명품 소비가 급증하는 상황에서 수혜를 볼지 주목된다.세계 1위 배터리 업체 LG에너지솔루션 역시 하반기 국내 상장 역사상 최대 규모로 기업공개에 나설 예정이다. 예상 시총만 100조 원으로 거론되고 있다. 미국 공장에 5조 원의 신규 투자뿐 아니라 그동안 악재였던 현대차 코나EV 화재 분담금 결정 등도 해소된 상황이다. 다만 테슬라를 비롯해 세계 최대 자동차 업체 폭스바겐그룹 등 주요 업체들이 전기차 생산에 있어 배터리 내재화에 나선 점은 악재다.국내 강자들도 눈에 띈다. 공모가 기준으로는 카카오뱅크와 야놀자가 기대주다. 국내 중고차 업계 1위 케이카도 상장을 앞두고 있다./강도원·강민제 기자 theone@sedaily.com▶ 상위 1% 투자자 픽! [주식 초고수는 지금]▶ 지피지기 대륙 투자 공략법[니하오 중국증시]▶ 네이버 채널에서 '서울경제' 구독해주세요!저작권자 ⓒ 서울경제, 무단 전재 및 재배포 금지"
2021.03.15.,"구글, 결국 백기 들었다…매출 11억원까지 수수료 반값 인하",https://n.news.naver.com/mnews/article/016/0001807010?sid=105,"[헤럴드경제=김민지 기자] 구글이 결국 백기를 들었다. 모든 규모의 개발사를 대상으로 연간 매출 100만달러까지 반값 수수료를 적용한다.앞서 구글은 구글플레이에서 유통되는 모든 앱에 인앱결제(IAP·In-App Payment)를 의무 적용해 수수료 30%를 걷기로 했다. 그러나 정치권과 IT업계의 반발에 부딪히자 한발 물러섰다.구글은 인앱결제를 의무화하는 대신, 모든 구글플레이 개발사에 15% 수수료를 적용하겠다고 15일 밝혔다. 기존 30% 수수료가 적용되던 '인앱결제' 수수료를 반값으로 내린 것이다. '반값' 수수료 정책은 오는 7월 1일부터 적용되며 중소 개발사 뿐 아니라 네이버, 카카오 등 대형 디지털 콘텐츠 앱도 대상이다.인앱결제란, 구글이 자체 개발한 결제 시스템을 이용하는 것으로, 앞서 구글은 오는 6월부터 인앱결제를 의무화하겠다고 밝혀 논란이 일었다.그러나 이번 결정으로 구글플레이의 30% 수수료 시대가 막을 내렸다.게임 뿐 아니라 디지털콘텐츠 앱 등 유료 콘텐츠를 판매하는 모든 개발사를 대상으로 연간 매출 100만 달러(한화 약 11억 원) 매출에 대해서는 15% 수수료를 적용한다. 100만달러를 초과된 매출에 대해서는 30% 수수료를 적용할 계획이다.예를 들어 A 개발사 연 매출이 20억원이라면 11억 원에 대해서는 15%, 초과된 9억 원의 매출에 대해서는 30%의 수수료를 내는 방식이다.구글 측은 ""이번 반값 수수료 발표로 대·중·소 기업 규모에 관계없이 사실상 구글플레이에서 유료 콘텐츠를 판매하는 거의 대부분의 국내 개발사가 수수료 인하 혜택을 받게 될 것으로 예상된다""고 밝혔다. 구글플레이에서 무료로 제공되는 앱과 실물 재화를 거래하는 앱은 기존과 동일하게 수수료가 적용되지 않는다.구글 플레이스토어(왼쪽)와 애플 앱스토어한편, 구글의 이번 수수료 인하는 애플보다 한 걸음 더 나간 것이다.지난해 11월 애플은 올해부터 연매출 100만 달러(한화 약 11억원) 이하 업체를 대상으로 수수료를 15%로 내리기로 결정했다. 그러나 연 매출 100만달러 이상인 업체는 기존과 동일하게 전체 매출의 30%를 수수료로 부과한다.jakmeen@heraldcorp.com▶환경적 대화기구 '헤럴드에코'▶밀리터리 전문 콘텐츠 ‘헤밀’▶헤럴드경제 네이버 채널 구독- Copyrights ⓒ 헤럴드경제 & heraldbiz.com, 무단 전재 및 재배포 금지 -"
2021.03.15.,"NH농협, 금리인하 요구 96% 수용 ‘최고’",https://n.news.naver.com/mnews/article/016/0001806764?sid=101,"작년 1~10월 2만9000여명 이용KB·신한 낮아...당국 “기준 정비”은행별로 ‘금리인하요구권’ 적용이 천차만별인 것으로 나타났다.15일 국회 정부위원회 소속 윤두현 의원(국민의 힘)이 금융감독원에서 제출받은 자료에 따르면, 지난해 1~10월 KB국민·신한·하나·우리·NH농협 등 5대 은행에서 금리인하요구권을 신청해 금리 인하 혜택을 받은 고객 수는 총 2만9118명이었다. 금리인하요구권으로 아낀 이자액은 모두 256억원으로 집계됐다. 금리인하 적용 시점의 대출 잔액에 대해 인하된 금리로 1년간 대출을 이용할 것을 전제로 추정한 금액이다.다만 이 기간 은행별로 금리인하 혜택을 받은 고객 수는 큰 차이가 났다. NH농협은행이 9334명으로 가장 많았고, 하나은행은 1932명에 그쳐 이보다 7000여명이 더 적었다. 신한은행 7063명, KB국민은행 5912명, 우리은행 4877명 등이었다.금리인하요구권 수용률(수용건수/신청건수)의 차이도 컸다. NH농협은행이 96.4%로 가장 높았고, 우리은행 72.7%이 뒤를 이었다. 혜택 고객수가 가장 적었던 하나은행은 절반 가량인 53.2%를 차지했고, KB국민은행 46.7%, 신한은행 43.2%이 수용률이 가장 적었다.이 같은 차이는 신청건수 통계 집계 기준이 은행마다 서로 달랐기 때문으로 알려졌다. 금감원은 KB국민·신한은행은 금리인하요구권을 신청한 모든 사람을 적용해 수용률을 계산하면서 적은 수치를 기록했다고 설명했다.하나은행은 금리인하요구권 신청 뒤 서류 접수까지 완료한 사람을 신청 건수로 쳤고, NH농협·우리은행은 금리인하요구권을 신청한 사람 중에서 아예 신청 대상 요건에 맞지 않는 사람 등을 모두 가려냈다. 금리인하권은 2019년 6월 법제화됐는데, 금융당국은 뒤늦게 은행별 신청건수를 통일하기 위한 작업도 하고 있다.당국이 기준 통일에 소홀했다는 지적 뿐 아니라, 주요 시중은행들이 여전히 고객에 대한 금리인하요구권 안내에 소극적이라는 평가가 많다.인터넷전문은행인 카카오뱅크의 경우는 2019년 3분기부터 분기마다 신용평가사의 신용등급이 변경된 고객을 대상으로 금리인하요구권 신청 알림을 모바일 앱 ‘푸시’로 보내는 등 훨씬 적극적인 안내를 하고 있다.카카오뱅크에서 금리인하요구권을 신청해 이자액 인하 혜택을 받은 고객 수는 작년 한 해 9만명으로 5대 시중은행을 합친 인원을 크게 웃돌았다. 작년에 9만명이 아낀 이자액은 총 30억원으로 나타났다. 박자연 기자▶환경적 대화기구 '헤럴드에코'▶밀리터리 전문 콘텐츠 ‘헤밀’▶헤럴드경제 네이버 채널 구독- Copyrights ⓒ 헤럴드경제 & heraldbiz.com, 무단 전재 및 재배포 금지 -"
2021.03.15.,"'나빌레라' 작가 ""박인환·나문희→송강, 캐스팅 만족도 300%"" (인터뷰)",https://n.news.naver.com/mnews/article/312/0000474149?sid=106,<구조 다름>
2021.03.15.,"동서식품, 봄 한정판 ‘핑크 오레오 샌드위치 쿠키’ 출시",url없음,<네이버 기사 없음>
2021.03.15.,"'놀면 뭐하니' 사과, 이미지 무단 사용+출처 표기 오류 논란",https://n.news.naver.com/mnews/article/629/0000071977?sid=106,<구조 다름>
2021.03.15.,"용인시 “아동학대 NO, 아동보호 YES”…예방·인식개선 나서",https://n.news.naver.com/mnews/article/421/0005221293?sid=102,"버스정류장 LCD 전광판체 게시된 아동학대 예방 홍보물 모습.(용인시 제공) © News1(용인=뉴스1) 김평석 기자 = 경기 용인시는 아동학대를 예방하고 아동학대에 대한 인식을 개선하기 위해 주민 밀착형 교육과 홍보를 진행한다고 15일 밝혔다. 시는 이를 위해 우선 읍면동 통·이장, 부녀회, 주민자치위원회, 청소년지도위원회 등 2830명을 대상으로 아동학대 예방 교육을 실시하고 이 가운데 희망자는 ‘아동안전지킴이’로 선정할 계획이다. 아동안전지킴이는 학대신고 의무자가 아니더라도 의심 사례를 발견하면 신고하는 등 피해 아동을 조기에 발견하는 안전망 역할을 하게 된다. 또 관내 750곳의 버스정류장 LCD 전광판과 시 아동시청 홈페이지에 예방 홍보물과 교육 동영상을 게시한다. 홍보물과 동영상에는 아동학대에 대한 시민들의 인식을 높일 수 있도록 관련 법령, 주요사례, 신고방법 등을 담았다. 시는 이달부터 어린이집 담당공무원의 CCTV열람이 가능해짐에 따라 관내 어린이집 860곳을 대상으로 CCTV 영상을 확인해 아동학대 의심징후가 발견되면 경찰 또는 아동보호전문기관에 신고할 예정이다. 어린이집 아동학대와 관련해 카카오톡에 ‘용인시 어린이집 아동학대 신고의 모든 것'이란 채널을 개설해 보호자들이 언제 어디서나 아동학대와 관련해 상담할 수 있도록 했다. 시 관계자는 “‘아이는 꽃으로도 때리지 말라’는 말이 있듯이 아동학대는 일어나지 말아야 하는 사건”이라며 “미래의 주역인 우리의 아이들이 마음껏 뛰어놀고 안전하게 성장할 수 있는 ‘아동학대 없는 아동친화도시 용인’을 조성하기 위해 최선을 다하겠다”고 말했다.ad2000s@news1.kr▶ 네이버 메인에서 [뉴스1] 구독하기!▶  뉴스1&BBC 한글 뉴스 ▶  터닝포인트 2021 © 뉴스1코리아(news1.kr), 무단 전재 및 재배포 금지"
