기사날짜,기사제목,네이버 뉴스 url,기사내용
2021.03.19.,[코스피 마감]美 증시 악재에 ‘휘청’…3030선 ‘턱걸이’,https://n.news.naver.com/mnews/article/018/0004880286?sid=101,"19일 3039.53 마감…전일 대비 0.86%↓외국인·기관 동반 순매도…개인만 1.6조 순매수시총 10위 모두 내림세…SK바사, 1.48% 하락 마감[이데일리 조용석 기자] 19일 코스피 지수가 하락 마감하며 하루 만에 3030선으로 내려왔다. 미국 국채 상승으로 인한 미국 증시 악재와 기관·외인의 동반 순매도가 영향을 미쳤다. 코스피 일일시황(자료 = 신한 HTS)이날 마켓포인트에 따르면 코스피 지수는 전 거래일 대비 0.86%(26.48포인트) 내린 3039.53에 거래를 마감했다. 전일 연방공개시장위원회(FOMC)의 제로금리 기조 유지 발표에 힘입어 3060선을 회복한 지 하루 만에 3030선으로 떨어졌다. 장 초반 한 때 3022.49까지 떨어졌다.간밤 미국 증시가 크게 흔들렸다. 18일(미국시간) 기술주 중심의 나스닥 지수는 3.02%(409.03포인트) 급락한 1만3116.17에 마쳤다. 다우존스 30 산업평균지수는 전장보다 0.46%(153.07포인트) 하락한 3만2862.30, 스탠더드앤드푸어스(S&P) 500 지수는 1.48%(58.66포인트) 내린 3915.46에 마감했다. 미국 10년물 국채 금리가 장중 1.754%까지 치솟는 등 요동친 탓이다.수급별로는 외국인과 기관이 각각 5839억원, 1조23억원 어치를 동반 순매도했다. 기관에서는 금융투자가 5903억원, ‘연기금 등’이 2215억원 순매도했다. 개인 투자자는 홀로 1조6060억원 어치 주식을 순매수했으나 호로 상승장을 만들긴 힘들었다. 프로그램 매매는 차익과 비차익을 더해 4880억원 순매도다. 시가총액 상위주가 크게 부진했다. 대장주인 삼성전자(005930)를 포함해 SK하이닉스(000660), NAVER(035420), LG화학(051910), 삼성전자우(005935), 현대차(005380), 삼성바이오로직스(207940), 삼성SDI(006400), 카카오(035720), 셀트리온(068270) 등 시총 10위 종목이 모두 하락 마감했다. 업종별로는 하락 우위였다. △종이, 목재 △증권 △의료정밀 △비금속광물 △운수창고 △전기가스업 △금융업 △기계 등이 상승했으나 내린 업종이 더 많았다. 특히 △철강및금속 △화학 △전기전자 △제조업 △의약품 등은 1% 넘게 내렸다. 종목별로는 현대코퍼레이션홀딩스(227840)가 가장 높은 18%대 상승세를 보였고 삼성 인버스 2X 원유선물(ETN) 등 유가 인버스 3개 종목이 두자릿수 오름세를 보였다. 간밤 4월물 서부 텍사스산 원유(WTI) 가격이 7%대 하락하는 등 국제유가가 급락한 영향으로 풀이된다. 상장 첫날인 전일 ‘따상’에 성공했던 SK바이오사이언스(302440)는 이날은 1.48% 하락 마감하며 ‘따상상’에 실패했다.이날 거래량은 10억5233만주를 기록했다. 거래대금은 15조9437억원으로 집계됐다. 상한가 없이 378개 종목이 올랐고 하한가 없이 447개 종목이 내렸다. 88개 종목은 보합권에 머물렀다.조용석 (chojuri@edaily.co.kr)▶ #24시간 빠른 #미리보는 뉴스 #eNews+▶ 네이버에서 '이데일리 뉴스'를 만나보세요▶ 빡침해소, 청춘뉘우스 '스냅타임'＜ⓒ종합 경제정보 미디어 이데일리 - 무단전재 & 재배포 금지＞"
2021.03.19.,"[투자노트] 비상장 주식, 아무리 '핫'해도 돌다리는 두드리자",https://n.news.naver.com/mnews/article/366/0000686920?sid=101,"최근 쿠팡과 SK바이오사이언스(바사)가 상반기 기업공개(IPO) 대어로서 각각 미 뉴욕증시와 국내 유가증권시장에 성공적으로 입성했다. 지난 12일 새벽 쿠팡이 나스닥시장에 데뷔하자마자 사들인 ‘서학개미’와 SK바사 공모주를 배정받기 위해 주관사에 하나씩 계좌를 만든 ‘동학개미’는 IPO 열풍을 몸소 보여줬다. 그러나 이것만으로는 부족하다고 느낀 개미(개인 투자자)들이 있었으니, 바로 비상장 주식을 노리는 이들이다.비상장 주식이란 말 그대로 유가증권시장이나 코스닥시장에 상장되지 않은 주식으로, ‘장외주식’이라고도 한다. 금융투자협회가 운영하는 ‘K-OTC’를 비롯해 비상장 주식 거래 사이트 ‘38커뮤니케이션’, 비상장 주식 플랫폼 ‘증권플러스 비상장’ ‘서울거래소 비상장’ 등에서 매매된다. 장외주식 거래 터줏대감인 38커뮤니케이션은 중고나라 카페처럼 게시판에 매매글을 올려 사고팔 수 있다. 증권플러스 비상장이나 서울거래소 비상장은 연결된 증권사 계좌를 통한 ‘안전거래’를 내세워 장외주식 매매를 중개해준다.일러스트=이철원요즘 장외시장은 ‘제2의 쿠팡’ ‘제2의 SK바사’를 꿈꾸는 이들로 붐빈다. 지난해부터 이어진 IPO 열기로 ‘따상’이 예상되는 기업의 주식 물량을 상장 전에 미리 확보하기 위함이다. 이런 니즈와 함께 비바리퍼블리카(토스)·컬리(마켓컬리)·야놀자를 비롯한 대형 스타트업, 카카오뱅크·크래프톤(배틀그라운드)과 같은 핀테크·게임 기업의 상장이 예고되면서 더욱 흥하고 있다. 이 중 야놀자와 컬리의 거래가격은 최고가 수준이다. 다만 흥행 예상 장외주식만 사면 ‘만사 오케이’라는 태도는 지양해야 한다. 장외시장의 거래가격이 100% 상장 이후 주가로 이어지는 것은 아니기 때문이다. 지난해 IPO 마지막 대어였던 빅히트는 상장 직전까지 주당 30만원대에 거래됐지만 상장 이후 20만원대에 머물고 있다. 한 증권사 관계자는 ""비상장 주식은 상장 주식보다 정보의 비대칭성과 유동성 부문에서 개인 투자자에게 불리할 수밖에 없다""고 말했다. 현재 증권플러스 비상장이나 서울거래소 비상장은 전자공시시스템, 기업 홈페이지 공고, 언론보도 중 신뢰도가 높은 정보를 재가공해 제공하고 있다. 그러나 애초에 비상장 주식은 기업 공시 의무 대상이 아닐뿐더러 외부에 공개된 신뢰도 있는 자료도 적기 때문에 ‘깜깜이 투자’가 될 가능성이 높다. 당연히 기업 밸류에이션(평가 가치)이나 재무상태를 정확히 파악하기도 어렵다. 몇 증권사가 비상장 기업의 분석 보고서(리포트)를 발간하고 있지만 이마저도 소수에 그치고 있다. 또 시중에 유통되는 물량 자체가 적기 때문에 거래가 상장 주식보다 이뤄지기 어려울 수 있다. 이 관계자는 ""물량이 없어서 한 달 내내 못 사고 못 파는 경우도 허다하다""고 말했다. 각 장외시장 업체들이 유동성 확보를 내세우는 이유도 이 때문이다. 시장에서는 지금 증시에 투자여력이 남아돌아 장외주식까지 떠오르고 있다고 보고 있다. 즉, 시장에 자금이 줄어들면 장외시장에 유입되는 이용자와 자금도 줄어들어 유동성이 더 적어질 수 있다는 얘기다. 비상장 주식 거래에서 바보가 되지 않으려면 비슷한 업종 내 상장기업 시가총액을 꼭 따져봐야 한다. 카카오뱅크 주식을 사려면 유가증권시장에 상장된 시중은행과 시총을 비교하라는 것이다.투자자들 사이에서는 장외시장에서 카카오뱅크 시총이 이미 국내 금융지주사들의 시총 합을 뛰어넘어 적정가의 5~9배에 이른다는 분석이 나오고 있다. 아울러 서울거래소 관계자는 ""공신력 있는 벤처캐피탈(VC)의 투자 여부를 확인하고 기업 발표를 100% 믿기 보다는 전문가에게 확인해야 한다""고도 조언했다.무엇보다 모든 비상장 주식이 나중에 ‘효자’가 될 것이라는 맹목적인 믿음은 금물이다. 생소한 비상장 주식은 사기의 온상일 수도 있다. 한 금융투자업계 관계자는 ""이전부터 대부분의 주식 사기의 90%는 비상장 주식을 미끼로 삼았다""고 말했다. 흔히 A라는 불법 자문업체가 B라는 비상장주식을 미리 매수한 후에 A의 회원들에게 ‘우선 매수 기회’를 주겠다며 꼬셔 이른바 높은 가격에 ‘먹튀(차익실현 후 잠적)’하는 식이다. 또 허가받지 않은 업체가 보유한 비상장 주식을 추천하고, 이 주식을 사려는 회원에게 매매를 중개하면서 거래세 등 명목으로 높은 수수료를 받는 일도 있다. [이다비 기자 dabee@chosunbiz.com] ▶네이버에서 '명품 경제뉴스' 조선비즈를 구독하세요▶'못난이 자동차' 놀림받던 日 스바루의 성공 비결▶계속되는 車 반도체 부족 여파… ""2분기가 더 문제""	저작권자 ⓒ 조선비즈, 무단 전재 및 재배포 금지"
2021.03.19.,"SK바이오사이언스, 거래량 폭발…‘따상’ 못 지켰다",https://n.news.naver.com/mnews/article/018/0004880372?sid=101,"글로벌 증시 하락에 SK바사도 힘 못 쓰고 하락2兆 사고팔고에 일부 증권사 HTS 전산장애도[이데일리 이지현 기자] 기업공개(IPO) 대어(大漁)로 꼽혀온 SK바이오사이언스(302440)가 ‘따상상’의 높은 벽을 넘지 못했다. 거래량이 폭발하며 상승폭을 줄여가더니 결국 전 거래일 기록한 ‘따상’도 지키지 못했다. 19일 마켓포인트에 따르면 SK바이오사이언스는 전 거래일보다 1.48%(2500원) 하락한 16만6500원에 거래를 마무리했다. 18일 오전 서울 영등포구 한국거래소에서 백신 개발·생산업체인 SK바이오사이언스의 코스피 신규상장 기념식이 진행됐다. (사진=노진환 기자)SK바이오사이언스는 전날까지만 해도 ‘따상상(시초가가 공모가의 2배 형성 후 이틀 연속 상한가)’ 이상의 기록을 낼 것으로 전망됐다. 15일 이상 유통제한 물량이 88.4%에 이르는 등 거래 가능물량이 11.6%에 불과한데다 아스트라제네카, 노바백스 등과 같은 코로나19 백신 위탁생산(CMO)을 맡고 있어 안정적인 성장 가능성까지 갖춘 것으로 평가됐다.하지만 미국 국채 상승으로인한 미국 증시 악재와 기관·외인의 동반 순매도가 코스피에 영향을 미치며 하락장이 펼쳐지자 SK바이오사이언스도 힘을 쓰지 못했다.마켓포인트 제공장이 열리자마자 전 거래일보다 12.43% 오른 19만원에 거래되기도 했다. 하지만, 차익실현 매물이 쏟아지며 이내 상승폭을 줄이더니 결국 전날 종가 아래에서 마감했다. 이날 거래량은 1227만주나 된다. 거래대금으로만 2조1945억원어치다. 개인은 1686억원어치를 담았지만, 외국인(1231억원어치)과 기관계(295억원)는 팔기에 바빴다. 이는 SK바이오사이언스와 비교돼온 SK바이오팜(326030)의 상장 3일차 거래량을 크게 웃도는 수준이다. ‘따상상’을 기록했던 카카오게임즈(293490)가 ‘따상상상(3연상)’에 실패하며 2021만주가 쏟아졌던 상황과 유사하다. 이같은 거래량에 일부 증권사의 홈트레이딩시스템(HTS)과 모바일트레이딩시스템(MTS)은 오류를 일으키기도 했다. 이날 오전 미래에셋대우(006800)의 HTS와 MTS에는 접속조차 되지 않아 주식 매수 매도 시기를 놓치는 사례가 속출했다.미래에셋대우 관계자는 “SK바이오사이언스등 주식을 거래하려는 고객이 일시적으로 급증해 일부 MTS, HTS에 접속 오류가 발생했다”며 “현재 정상적으로 작동 중”이라고 설명했다. 미래에셋은 피해가 있는 고객의 경우 관련 규정에 근거해 합리적 보상을 제공한다는 방침이다. 다만 △전화 또는 로그인 기록이 없는 경우 △비상주문 등 대체 수단을 활용이 가능할 때 △주문시점으로부터 장애 복구 시까지 체결이 불가능한 가격 △신규 매수주문 등에 따른 기회비용 △고객이 장애 확인 중 발생한 주가 변동 △비상주문 시도 중 발생한 주가 변동 △이익 발생 등은 보상 예외사항으로 뒀다. 미래에셋 관계자는 “고객의 로그인 시도 시점을 내부적으로 확인할 수 있다”며 “고객의 실제 매도가 로그인 시도 시점 대비 마이너스 차액이 발생했다면 그 만큼에 대한 보상을 할 계획”이라고 설명했다.이지현 (ljh423@edaily.co.kr)▶ #24시간 빠른 #미리보는 뉴스 #eNews+▶ 네이버에서 '이데일리 뉴스'를 만나보세요▶ 빡침해소, 청춘뉘우스 '스냅타임'＜ⓒ종합 경제정보 미디어 이데일리 - 무단전재 & 재배포 금지＞"
2021.03.19.,"‘맛집의 옆집’ 하성운, 만두에 ‘찐’심 폭풍 먹방",https://n.news.naver.com/mnews/article/144/0000724874?sid=106,<구조 다름>
2021.03.19.,"재능문화, 5월31일까지 시낭송대회 참가 접수",https://n.news.naver.com/mnews/article/003/0010401175?sid=101,"재능문화, 시낭송대회 참가 접수..5월31일까지 *재판매 및 DB 금지[서울=뉴시스] 표주연 기자 = 재능문화는 ‘제31회 재능시낭송대회’ 1차 온라인 예선대회 참가 접수를 오는 5월31일까지 받는다고 19일 밝혔다. 제31회 재능시낭송대회는 재능그룹의 재능문화와 한국시인협회가 공동 주최하고 문화체육관광부, 교육부, 한국문화예술위원회, 재능교육 등이 후원하는 문화행사다. 대회 진행 순서는 ▲1차 온라인 예선 대회(5월) ▲2차 지역 대회(6월~10월, 6개 권역별) ▲3차 본선 대회(11월)로 이뤄진다. 응모 부문은 학생부(초등부, 중고등부)와 성인부로 나뉜다. 최종 본선 대회의 성인부 대상 수상자에게는 300만원의 상금과 ‘문화체육관광부 장관상’이 수여 된다. 성인부 본선대회 동상 이상 수상자에게는 시낭송가증서가 추가로 수여된다.1차 온라인 예선에 응모하려면 카카오톡에서 ‘재능시낭송대회’를 검색해 채널을 추가한 후, 채팅창에 시낭송 동영상을 업로드하면 된다. 예선 응모를 하면 ‘시낭송 연습방법’, ‘대회 심사기준’ 등이 담겨있는 시낭송 대회 가이드를 받아볼 수 있다. 심사는 선정한 시의 의미를 충분히 이해하고 해석했는지, 발성/태도/표현력을 비롯한 낭송기법 등을 기준으로 평가한다.이번 대회의 지원양식 및 자세한 공모내용은 재능시낭송대회 홈페이지에서 확인할 수 있다.☞공감언론 뉴시스 pyo000@newsis.com▶ 네이버에서 뉴시스 구독하기▶ K-Artprice, 유명 미술작품 가격 공개▶ 뉴시스 빅데이터 MSI 주가시세표 바로가기<ⓒ 공감언론 뉴시스통신사. 무단전재-재배포 금지>"
2021.03.19.,"현대홈쇼핑 H몰 모바일앱 개편…""할인·방송 정보 한눈에""",https://n.news.naver.com/mnews/article/092/0002216553?sid=105,"(지디넷코리아=안희정  기자)현대홈쇼핑은 공식 온라인몰인 '현대H몰'의 모바일앱을 리뉴얼한다고 19일 밝혔다.새롭게 리뉴얼된 현대H몰 모바일 앱은 상품 할인 정보에 대한 전달 기능을 강화한 게 특징이다. 우선, 할인 행사나 이벤트 등에 대한 이미지를 리뉴얼 전보다 최대 20% 가량 키우고, 모바일 기기에 최적화된 ‘카드 뉴스’ 형태로 만들어 화면 구성을 단순화했다.또한, 현대홈쇼핑이 운영중인 TV홈쇼핑·현대홈쇼핑플러스샵(T커머스)·쇼핑라이브(라이브커머스) 등 세 가지 채널의 방송 상품을 한번에 확인할 수 있는 '온에어(On-Air)' 메뉴를 화면 하단에 중앙에 추가했다. 현대H몰 모바일앱 내 어느 화면에서나 '온에어' 버튼을 터치하면 세 가지 채널에서 방송중인 상품을 볼 수 있다.현대홈쇼핑_모바일앱리뉴얼이와 함께 '푸시알림' 받기를 동의한 고객이 상품을 장바구니에 담아놓으면 가격이 추가로 할인되거나 방송중임을 알려주는 '장바구니 할인 알림 서비스'도 새롭게 선보인다.현대홈쇼핑은 모바일앱 리뉴얼을 기념해 오는 31일까지 구매 여부와 상관없이 총 3천702명에게 추첨을 통해 현대백화점그룹 멤버십 'H포인트' 3만포인트(3명), 모바일 치킨 교환권(33명) 등을 제공하는 경품 행사를 진행한다.참여를 원하는 고객은 경품 행사 페이지에서 이번에 새롭게 선보인 기능 가운데 가장 마음에 드는 한 가지를 선정해 응모하면 된다.또한 19일 하루 동안 카카오페이로 5만원 이상 결제시 10% 즉시 할인(최대 1만포인트) 혜택을 제공하고, '불금데이적립' 표시가 된 상품을 3만원 이상 구매하면 10%를 'H포인트(최대 1만포인트)'로 돌려준다.현대홈쇼핑 관계자는 ""이번 모바일앱 리뉴얼은 방송중일 때 가장 많은 혜택을 주는 홈쇼핑의 특징을 살려, 방송 정보를 손쉽게 확인할수 있게 해 고객들의 합리적인 쇼핑을 돕기 위해 진행했다""며 ""앞으로 모바일앱 이용 고객들을 위한 다양한 행사와 이벤트를 선보일 계획""이라고 말했다.안희정 기자(hjan@zdnet.co.kr) ▶ 지디넷코리아 '홈페이지' ▶ 네이버 채널 구독하기© 메가뉴스 & ZDNET, A RED VENTURES COMPANY, 무단전재-재배포 금지"
2021.03.19.,"서금원, 신용·부채관리컨설팅 대상자 확대 나서",https://n.news.naver.com/mnews/article/277/0004868436?sid=101,"[아시아경제 송승섭 기자]서민금융진흥원은 신용·부채 관리컨설팅 대상자를 확대하고 서비스를 다양화하겠다고 19일 밝혔다.서금원에 따르면 신용·부채 관리컨설팅의 지원조건이었던 ‘정책 서민금융 이용 후 1년 경과’는 ‘6개월 경과’로 완화됐다. 한국개발연구원(KDI)이 정책 서민금융 이용 효과가 6개월부터 떨어진다고 분석한 만큼, 정책 서민금융 이용자의 빠른 제도권 금융시장 복귀를 위해 컨설팅 서비스 대상자를 확대했다는 게 서금원의 설명이다.컨설팅 대상자로 선정되면 3개월 동안 매월 신용상승에 필요한 정보가 제공되고, 신용변동 사유 및 개선방안에 대해 컨설팅이 진행된다. 협약은행과 자금연계 지원도 이뤄진다.서금원은 지난해 9월부터 6개월간 정책 서민금융 이용 1년 경과자 3382명에게 매월 신용·부채 관리를 위한 유선상담 시범사업을 진행해왔다. 지난 1월 기준 컨설팅 대상자 52%의 신용점수가 평균 42.8점 상승한 바 있다.시범사업으로 해당 서비스를 정책 서민금융 이용 1년 경과자 3,382명을 대상으로 매월 신용·부채관리를 위한 유선 상담 서비스를 제공해왔다. 지난 1월 컨설팅 3개월 경과 시점 대상자들의 신용점수를 분석한 결과, 전체의 52%의 신용점수가 평균 42.8점, 최고 404점까지 상승했다고 발표한 바 있다.이용 방법도 다양화한다. 유선 상담이 어렵거나 불편한 고객을 고려해 카카오톡 채팅을 활용해 상담을 진행하거나, 애플리케이션(앱)을 활용해 신용부채관리 리포트를 제공하는 방법으로 지원할 계획이다.이계문 서금원장은 “생업에 쫒겨 신용·부채관리와 금융상품에 대한 정보가 다소 부족해 어려움을 겪고 계시는 분들이 신속하게 제도권 금융으로 복귀하실 수 있도록 신용·부채관리 컨설팅을 더욱 활발히 시행할 계획”이라고 강조했다.송승섭 기자 tmdtjq8506@asiae.co.kr▶ 2021년 신축년(辛丑年) 신년운세와 토정비결은?▶ 발 빠른 최신 뉴스, 네이버 메인에서 바로 보기▶ 투자 성공의 핵심은 기업분석! 'CORE' 바로가기<ⓒ경제를 보는 눈, 세계를 보는 창 아시아경제 무단전재 배포금지>"
2021.03.19.,"하루새 72억 챙겼나, SK바사 물량 독식 '교보 광클팀' 누구냐",https://n.news.naver.com/mnews/article/025/0003086365?sid=101,"SK바이오사이언스 상장 첫날인 지난 18일 매수 주문 체결 물량을 거의 싹쓸이했던 이른바 '교보증권 광클팀'이 19일 대부분 팔아치운 것으로 알려졌다.      18일 코스피 상장을 한 SK바이오사이언스는 이른바 '따상'에 성공했다. 연합뉴스     ━   교보증권 ""매수, 매도 주체 알 수 없어""      한국거래소에 따르면 지난 18일 SK바이오사이언스 거래원별 매수 상위 1위 창구엔 교보증권이 이름을 올렸다. 거래량은 52만9814주(매수 금액 894억원)에 달했다. 교보증권 창구에서 전체 거래량의 70%에 가까운 물량을 쓸어간 것이다. 이날 SK바이오사이언스는 16만9000원까지 오르며 이른바 '따상'(공모가의 두 배로 시초가 형성 뒤 상한가)으로 증시에 입성했다.        통상 상장일 개장 직후 주가가 상한가로 직행하면 누가 빠르게 주문을 넣었는지가 매수 계약 체결의 성공 여부를 좌우한다. 이른바 '광클'(미치도록 빨리 클릭한다는 뜻)에 주문 성공 여부가 달린 셈이다. 이른바 '큰손 개미'가 교보증권을 이용해 주식을 대거 사들인 것으로 추정되는 대목이다. 앞서 카카오게임즈 첫 상장일에도 교보증권 창구가 매수 주문을 거의 독식한 바 있다.        상장 다음 날인 19일에도 SK바이오사이언스 매도 상위 창구에 교보증권이 5위로 올라 있다. 매도 거래량은 66만여 주다. 이날 오전 9시 30분 무렵엔 54만여 주가량의 매도가 이뤄졌다. 이 때문에 일각에선 전날 교보증권 창구를 통해 53만주를 사들인 투자자가 이날 오전 이를 다 팔아 차익을 남겼다는 이야기도 나온다.       실체를 확인할 수는 없지만 만약 '교보증권 광클팀'으로 알려진 이 투자자가 해당 물량을 모두 팔아치웠다고 하면 하루 사이에 72억원의 차익을 거둔 셈이 된다.       하지만 증권업계에선 ""추측만 무성할 뿐, 확인할 수 없는 내용""이라고 입을 모은다. 교보증권 관계자는 ""구체적으로 누가 주문을 넣었는지 확인할 권한이 없어 매수와 매도 주체가 누군지 알 수 없다""고 말했다.       익명을 원한 한 증권사 부장은 ""주체가 개인인지, 기관 투자가인지 알 수 없고 인원은 몇인지, 또 어제 주식을 샀다가 모두 팔았다는 점도 확인할 수 없다""며 ""설사 팔았다고 해도 정확한 매도 가격을 모르니 차익을 추정하는 것도 불가능하다""고 했다. 이어 ""워낙 투자자들의 관심이 많은 종목이다 보니 추측성 루머가 많이 떠도는 것 같다""고 말했다.      상장 이틀째인 이날 12시 23분 현재 SK바이오사이언스는 전날보다 2.96% 오른 17만4000원에 거래되며 '따상상'(시초가가 공모가 두 배로 형성 후 2번 연속 상한가)에는 미치지 못했다. 하지만 치열한 단타전이 벌어지며 이 시각 현재 거래량은 965만주를 넘으며 전날(87만6189주)의 11배에 달했다. 거래대금도 1조7540억원을 기록 중이다.        황의영 기자 apex@joongang.co.kr   ▶ 소름돋게 잘 맞는 초간단 정치성향테스트▶ 넌 뉴스를 찾아봐? 난 뉴스가 찾아와!▶ 당신이 궁금한 코로나, 여기 다 있습니다ⓒ중앙일보(https://joongang.co.kr), 무단 전재 및 재배포 금지"
2021.03.19.,"[게임소식] 넷마블, '리니지2 레볼루션' 확장팩 시즌2 '발라카스의 격노' 오픈 외",url없음,<네이버 기사 없음>
