기사날짜,기사제목,네이버 뉴스 url,기사내용
2021.03.15.,"하루만 맡겨도 연 1% 이자, 파킹통장에 113조 몰렸다",https://n.news.naver.com/mnews/article/025/0003084875?sid=101,"마땅한 투자처 못 찾은 뭉칫돈시중은행·인터넷은행·저축은행더 유리한 조건 내걸고 유치전  상상인저축은행이 출시한 연이자 1.6%의 파킹 통장 ‘뱅뱅뱅파킹통장 369 정기예금’.           마땅한 투자처를 찾지 못한 뭉칫돈이 ‘파킹통장’으로 몰리고 있다. 파킹통장은 잠시 차를 주차하듯이 언제든지 돈을 넣었다가 뺄 수 있는 통장을 가리킨다. 은행권에선 시장금리부 수시입출금식예금(MMDA)이 대표적인 파킹통장으로 통한다.      14일 금융계에 따르면 지난달 말 기준으로 5대 시중은행(KB국민·신한·하나·우리·NH농협)의 MMDA 잔액은 113조4378억원이었다. 1년 전과 비교하면 17조308억원(17.7%) 늘었다. MMDA에는 하루만 맡겨도 연 0.5~1%의 이자를 받을 수 있다. 일반 수시입출금 통장의 금리가 제로에 가까운 것과 대조적이다. 은행 입장에선 정기예금 같은 저축성 상품보다 낮은 금리로 자금을 조달할 수 있다는 장점이 있다.      익명을 요구한 시중은행 관계자는 “통상 연초에는 대기 자금이 늘어난다. 올해는 SK바이오사이언스 (공모주) 청약 등을 앞두고 목돈을 잠시 맡겨두려는 고객이 많았던 것으로 보인다”고 설명했다. 금융권의 다른 관계자는 “은행과 투자 시장을 관망하며 여윳돈을 잠시 맡기려는 소비자의 요구가 맞아떨어진 것”이라고 말했다.      SK바이오사이언스는 올해 1분기 공모주 청약 시장에서 가장 큰 관심을 끌었다. 대표 주관사인 NH투자증권 등이 지난 9~10일 일반 투자자 대상 공모주 청약을 마감한 결과 63조6200억원의 청약 증거금이 들어왔다. 연초 주요 대기업의 성과급과 연말정산 환급금 지급 등 계절적 요인도 MMDA 잔액 증가에 영향을 줬다고 금융권에선 보고 있다.      인터넷은행들도 단기성 자금의 유치에 나섰다. 카카오뱅크는 ‘세이프박스’, 케이뱅크는 ‘플러스박스’란 이름으로 일종의 파킹통장을 선보였다. 세이프박스의 한도는 1000만원, 플러스박스의 한도는 1억원이다. 예금금리는 플러스박스(연 0.6%)가 세이프박스(연 0.5%)보다 0.1%포인트 높다. 케이뱅크는 지난 1일부터 플러스박스의 금리를 기존(연 0.7%)보다 0.1%포인트 낮췄다. 주력 상품의 금리를 낮췄다는 건 은행이 내부적으로 설정한 수신 목표치를 어느 정도 채웠다는 의미로 해석할 수 있다.      케이뱅크의 수신액은 지난달 6조8400억원이었다. 지난해 6월(1조8500억원)과 비교하면 270%가량 늘었다. 이 중 상당액이 플러스박스로 모아들인 자금이라고 금융권에선 보고 있다.      저축은행도 파킹통장으로 자금 유치에 나섰다. 상상인저축은행은 지난 1일 ‘뱅뱅뱅파킹통장 369정기예금’이란 상품을 내놨다. 원래는 2년짜리 정기예금이지만 하루만 돈을 맡겼다가 해지해도 연 1.6%의 이자를 준다. 9개월 이상 돈을 맡기면 연 1.9%의 금리를 적용한다. 이 상품은 출시 사흘 만에 500억원을 모집했다고 상상인저축은행은 전했다. 페퍼저축은행은 지난달 초 최대 300만원까지 연 2%의 금리를 주는 ‘페퍼룰루파킹통장’을 선보였다.      홍지유 기자 hong.jiyu@joongang.co.kr  ▶ 소름돋게 잘 맞는 초간단 정치성향테스트▶ 넌 뉴스를 찾아봐? 난 뉴스가 찾아와!▶ 당신이 궁금한 코로나, 여기 다 있습니다ⓒ중앙일보(https://joongang.co.kr), 무단 전재 및 재배포 금지"
2021.03.15.,연봉 팍팍 올리는 IT업계…속 타는 네이버 이해진,https://n.news.naver.com/mnews/article/055/0000880907?sid=101,"<앵커>최근 IT업계에서 연봉 인상 바람이 불고 있습니다. 비대면 문화 확산 속에 IT업계 실적이 좋아지고 개발자 데려오기는 어려워지면서 인재 확보를 위해 경쟁적으로 연봉을 올리는 것인데, 그 후유증에 대한 우려도 나옵니다.전연남 기자의 보도입니다.<기자>지난달 넥슨이 전 직원 연봉을 800만 원 올린 것을 시작으로, 게임업계에 임금 인상 도미노 현상이 벌어졌습니다.엔씨소프트는 개발자에게 일괄적으로 1천300만 원 연봉을 인상하고 초봉 상한선도 없앴습니다.SK텔레콤 역시 전 직원에게 임금 협상 타결금으로 800만 원을 일괄 지급하는 등 IT업계가 경쟁적으로 보상 강화에 나서고 있습니다.코로나19 비대면 추세로 인한 IT업계 호황으로 개발자가 귀해지면서 인력 확보와 유출 방지를 위해 연봉 인상 경쟁이 벌어진 것입니다.성과에 대해 공정한 배분을 요구하는 MZ세대 성향도 맞물렸다는 분석입니다.네이버와 카카오 등 스톡옵션을 지급해온 IT업체들은 직원들의 반발에 난감해졌습니다.미래 성장에 초점을 맞추기 위해 주식으로 보상했다는 것인데, 직원들에게는 당장의 현금이 더 매력적일 수 있습니다.네이버 창업자 이해진 글로벌투자책임자는 ""사업의 변화와 방향에 대한 설명 없이 너무 급하게 경쟁적으로 연봉 인상이 이뤄지고 있어 후유증이 염려된다""고 밝히기도 했습니다.특히 중소 IT업체에는 더 가혹한 상황입니다.[중소 IT업체 개발자 : (연봉) 상승률은 굉장히 낮은 축에 속하고요. 상대적으로 박탈감을 느낄 수밖에 없긴 하죠. 이직을 결심하시는 분들이 좀 늘어나는 추세(인 것 같습니다.)][오정근/건국대학교 경제학과 교수 : IT업계에 전문가를 우리가 그동안 키워오지 않았기 때문에, 코로나 시대가 되면서 비대면이 급속도로 확산 되면서 없는 인력을 스카우트 하려니까 인건비가 올라가고 (있습니다.)]개발자 육성을 위한 교육 프로그램의 다양화 등 정책적 노력이 요구됩니다.(영상편집 : 이승열, VJ : 박현우)전연남 기자(yeonnam@sbs.co.kr)▶ [제보하기] LH 땅 투기 의혹 관련 제보▶ SBS뉴스를 네이버에서 편하게 받아보세요 ※ ⓒ SBS & SBS Digital News Lab. : 무단복제 및 재배포 금지"
2021.03.15.,"순천체력인증센터, ‘방구석 운동 교실’ 2기 운영",url없음,<네이버 기사 없음>
2021.03.15.,지인 사칭 SNS 사기 판친다,url없음,<네이버 기사 없음>
2021.03.15.,"[증권오늘] 한국투자증권, '한국투자글로벌스펙트럼랩7호' 모집…키움증권, 국내선물옵션 거래 이벤트 진행",url없음,<네이버 기사 없음>
2021.03.15.,쿠팡 미국 증시 입성…몸값 72조원 ‘국내 3위’,https://n.news.naver.com/mnews/article/050/0000056862?sid=101,"[위클리 이슈] 기업(사진) 김범석(왼쪽 셋째) 쿠팡 이사회 의장 등 쿠팡 경영진과 존 터틀(오른쪽 둘째) NYSE 부회장이 3월 11일 뉴욕증권거래소에서 상장 기념 '오프닝 벨'을 울리고 있다. /쿠팡 제공쿠팡이 미국 뉴욕증권거래소(NYSE)에 상장한 한국 최초 기업이 됐다. 쿠팡은 3월 11일 NYSE에 입성하며 공모가 35달러를 확정했다. 당초 제시한 희망 가격(32~34달러)보다 높은 금액이다.쿠팡은 공모가 기준 630억 달러(약 72조원)의 기업 가치를 인정받았다. 3월 11일 유가증권시장 종가 시가 총액을 기준으로 쿠팡(공모가 기준)을 앞선 한국 기업은 삼성전자(약 489조원)와 SK하이닉스(약 99조원)뿐이다.쿠팡은 이날 미국 현지에서 공모가를 공개하며 계획(1억2000만 주)보다 1000만 주 많은 1억3000만 주(클래스A 보통주)의 신주를 발행한다고 발표했다. 쿠팡은 이번 상장을 통해 45억5000만 달러(약 5조1706억원)의 신규 자금을 조달하게 됐다.쿠팡은 상장 신청 서류에서 “8억7000만 달러(약 9874억원)를 투자해 수년 내 서울을 제외한 전국 7개 지역에 풀필먼트센터(물품 보관·포장·배송·재고 통합 물류 관리 시스템)를 세우겠다”고 설명한 바 있다.미국 투자업계는 쿠팡이 아마존을 벤치마킹했지만 아마존식 물류의 한계를 극복했다는 점을 높이 평가하고 있는 것으로 알려졌다. 쿠팡은 230만㎡ 규모의 물류 시설을 운영하며 세계에서 유일한 전국 하루 배송망을 구현했다. 물류 하드웨어와 소프트웨어를 자체 개발한 기업은 아마존과 오카도(영국)·쿠팡뿐이다.쿠팡이 이날 NYSE에서 종목 코드 ‘CPNG’로 거래를 시작하면서 한국 투자자도 쿠팡 주식을 사고팔 수 있게 됐다.삼성전자, 맞춤 가전 ‘비스포크’ 제품 전체로 확대한다(사진) 이재승 삼성전자 생활가전사업부장(사장)이 '비스포크 홈 미디어데이'에서 발표하고 있다. /삼성전자 제공삼성전자가 소비자 개인의 라이프스타일과 취향을 맞춰 주는 ‘비스포크’ 콘셉트를 생활 가전 제품 전체로 확대한 ‘비스포크 홈’을 3월 9일 공개했다. 삼성전자는 이날 ‘비스포크 홈 미디어데이’를 온라인으로 열고 소비자들에게 차별화한 가치를 제공하기 위한 계획을 발표했다.이재승 삼성전자 생활가전사업부장(사장)은 “비스포크 제품은 2019년 첫 출시 이후 다양한 가전제품으로 확장하며 지난해까지 누적 출하량 100만 대를 돌파했다”며 “올해는 한국 가전의 매출 비율을 80%까지 확대하는 것이 목표”라고 말했다.비스포크 가전은 올해부터 주방·거실·침실 등 집 안 곳곳에 들어온다. 냉장고·에어컨·신발 관리기 등 상반기 출시되는 비스포크 신제품만 17가지다. 올해 초 온라인으로 열린 ‘세계 가전 전시회(CES) 2021’에서 혁신상을 받은 ‘비스포크 정수기’는 3월 말부터 판매에 돌입한다. 냉·온수, 정수 기능을 구분해 소비자가 원하는 모듈을 선택할 수 있는 제품이다.삼성전자는 또한 올해 비스포크 신제품부터 인버터 모터 등 주요 부품이 고장 나면 구매 시점에 관계없이 무상으로 수리하거나 교체해 주기로 했다. 렌털 업체들과의 협업도 진행하기로 했다.현대차, 한 라인에서 차량 5종 이상 만든다(사진) 현대차 충남 아산공장에서 노동자가 자동차를 조립하고 있다. /현대자동차 제공현대자동차가 한 생산 라인에서 1~2종의 차량을 제조하던 기존 방식에서 벗어나 5~10종의 차량을 한곳에서 조립하는 ‘혼류 생산’ 시스템을 도입하는 방안을 추진한다.자동차업계에 따르면 현대차는 최근 울산3공장에서 다차종 생산 시스템 도입 관련 설명회를 열었다. 회사 측은 한 생산 라인에서 여러 종류의 차를 만들 수 있도록 부품 공급 방식을 바꾸겠다고 설명했다. 생산성을 높이고 다품종 소량 생산 시대에 대응하기 위한 전략이다.현대차는 우선 울산3공장에 시범적으로 이 시스템을 도입할 계획이다. 이르면 내년 초부터 새 시스템을 활용한 생산에 들어가겠다는 목표다.LG전자, 중국 TCL 특허 소송 이겼다(사진) 서울 여의도 LG전자 사옥. /연합뉴스LG전자가 중국 전자회사 TCL을 상대로 낸 특허 침해 금지 소송에서 승소했다. LG전자는 독일 만하임지방법원에 TCL을 상대로 낸 롱텀에볼루션(LTE) 표준 특허 침해 금지 소송에서 최근 승소했다고 3월 9일 밝혔다.이번 소송은 TCL이 독일에서 판매하는 스마트폰에 적용된 기술이 LG전자가 보유한 LTE 표준 특허를 침해했다는 것이 핵심이다. LG전자는 TCL에 첫 경고장을 보낸 2016년 이후 수차례 특허 라이선스 협상을 요구했지만 TCL은 응하지 않았다. LG전자는 이번 판결을 기반으로 TCL 제품의 독일 내 판매 금지 절차 등을 밟을 예정이다.기아·GS칼텍스, 전기차 충전소 확대 위해 손잡았다(사진) 기아·GS칼텍스 협업 전기차 초급속 충전기 예상도. /기아 제공기아가 GS칼텍스와 손잡고 전기차 충전 인프라를 확대한다. 기아는 3월 11일 GS칼텍스와 ‘전기차 초급속 충전기 설치 투자 및 사용 계약’을 체결했다. 기아가 GS칼텍스 주유소 충전기 설치에 투자하는 것이 핵심이다. 충전기를 이용하는 기아 전기차 운전자는 해당 주유소에서 할인 혜택을 받을 수 있다.기아는 서울·인천·수원·구리 등 수도권에 있는 GS칼텍스 주유소 네 곳에 350kW급 초급속 충전기 1기, 200kW급 충전기 7기 등 총 8기의 충전기 설치에 투자한다. GS칼텍스는 운영과 관리를 맡는다. 올 상반기 중 서비스를 시작하는 것이 목표다.SK바이오사이언스, 증거금 1위 기록 새로 썼다(사진) 투자자들이 SK바이오사이언스 공모 대표주관사인 NH투자증권 영업점에서 3월 10일 상담을 받고 있다. /강은구 기자 egkang@hankyung.com 백신 전문 기업 SK바이오사이언스의 공모주 청약에 약 63조6000억원의 뭉칫돈이 몰리면서 증거금 역대 1위 기록을 새로 썼다. 3월 9일부터 이틀 동안 6개 증권사가 접수한 SK바이오사이언스 청약에 약 63조6000억원의 증거금이 몰렸다. 지난해 카카오게임즈(58조5543억원)와 빅히트엔터테인먼트(58조4237억원)의 기록을 뛰어넘었다.SK바이오사이언스는 최다 청약 건수 기록도 갈아 치웠다. 대표 주간사 회사인 NH투자증권을 비롯해 한국투자증권·미래에셋대우·삼성증권·하나금융투자·SK증권 등 6개 증권사에 약 240만 개의 계좌가 몰렸다. 평균 청약 경쟁률은 335 대 1을 기록했다.대우건설, 3년 만에 다시 매물로 나왔다대우건설이 3년여 만에 다시 매물로 나왔다. 한국의 한 사모펀드(PEF)가 인수에 적극적인 것으로 알려져 이번에는 새 주인을 찾을 수 있을지 주목된다. 대우건설 매각 작업은 이번이 셋째다.투자은행(IB)업계에 따르면 대우건설 최대 주주인 KDB인베스트먼트는 한국 PEF 운용사에 경영권을 포함한 보유 지분 전량(50.75%)을 매각하는 방안을 논의하고 있다. 이 PEF는 건설사 등 전략적 투자자(SI)와 컨소시엄 구성을 추진하고 있는 것으로 알려졌다. 거래 금액은 1조8000억원 수준으로 알려졌다. 대우건설은 지난해부터 실적 개선세를 보이고 있다.미래에셋대우, ‘미래에셋증권’으로 사명 바꾼다(사진) 서울 을지로 미래에셋센터원빌딩. /미래에셋대우 제공미래에셋대우가 대우증권을 품에 안은 지 4년 만에 사명에서 ‘대우’를 지운다. 미래에셋대우는 3월 9일 이사회를 열고 사명을 ‘미래에셋증권’으로 바꾸기로 했다. 국내외에서 쓰이는 기업 이미지(CI)를 통합해 브랜드 가치를 높이기 위해서다. 미래에셋대우는 해외에서 이미 ‘미래에셋 시큐리티즈(Mirae Asset Securities)’라는 이름을 사용하고 있다.미래에셋대우는 지난해 업계 최초로 연간 영업이익 1조원을 달성하며 한국 1위 증권사 자리를 굳혔다. 회사 관계자는 “사상 최대 실적을 기록한 지금이 브랜드 통합 작업에 나설 적기라고 판단했다”고 설명했다.최은석 기자 choies@hankyung.com▶ 한경비즈니스 네이버 뉴스에서 [구독 클릭]▶ 잡지 정기구독 신청▶ 디지털기술 투자 포트폴리오를 한눈에 알려줍니다 <한경무크 CES2021> ⓒ 한경비즈니스, 무단전재 및 재배포 금지"
2021.03.15.,SK바사 청약 환불금 63조 중 27조가 증시 주변 잔류,https://n.news.naver.com/mnews/article/009/0004763623?sid=101,"SK바이오사이언스의 일반 공모주 청약 증거금으로 납입됐다가 환불된 약 63조원 중 27조원 가량이 증시 주변에 남아 있는 것으로 나타났다. 15일 금융투자협회에 따르면 SK바이오사이언스 청약 환불금이 입금된 지난 12일 기준 투자자예탁금은 64조10014억원으로 하루 전인 11일(57조6372억원) 대비 6조4642억원 증가했다. 같은 기간 증권사 개인 고객의 종합자산관리계좌(CMA) 잔고는 39조4807억원에서 59조6483억원으로 20조1676억원 늘었다. 모두 26조6118억원이 증시 주변에 남아 있는 셈이다. 지난 10~11일 진행된 SK바이오사이언스의 일반 투자자 대상 공모주 청약에는 모두 63조6198억원이 몰렸다. 일반투자자 대상 공모 금액이 3800억원이었다는 점을 감안하면 63조원 이상의 환불금이 지난 12일 지급됐다.이중 증시 주변에 남아 있는 자금은 이후 기업공개(IPO) 절차가 예정돼 있는 카카오뱅크, LG에너지솔루션 등의 청약 증거금으로도 사용될 것으로 보인다. [한경우 매경닷컴 기자 case@mk.co.kr]▶ '경제 1위' 매일경제, 네이버에서 구독하세요▶ 이 제품은 '이렇게 만들죠' 영상으로 만나요▶ 부동산의 모든것 '매부리TV'가 펼칩니다[ⓒ 매일경제 & mk.co.kr, 무단전재 및 재배포 금지]"
2021.03.15.,"설빙, 3년만에 '딸기마카롱설빙' 리뉴얼 출시",url없음,<네이버 기사 없음>
2021.03.15.,사천관광 이모티콘 무료로 받으세요,url없음,<네이버 기사 없음>
2021.03.15.,"‘2020년 가장 사랑받은 아기물티슈’ 베베숲, 대규모 고객 감사 프로모션 열어",https://n.news.naver.com/mnews/article/032/0003064105?sid=101,"[경향신문] 영유아 토탈 기업 베베숲이 5년의 시간 동안 흔들림 없이 베베숲에 사랑을 보내주신 고객들의 신뢰에 보답하고자 감사 프로모션을 개최한다.이번 이벤트는 15일부터 다음달 15일까지 베베숲 제품을 판매하는 모든 온라인 공식 판매처에서 동시 진행되며, 베베숲 고객이라면 누구나 참여할 수 있다.5년 연속 대한민국 판매 1위에 오른 것을 기념해 베베숲이 오늘부터 진행하는 한달 동안의 대규모 고객 감사 이벤트의 참여 방법은 간단하다. 홈페이지를 비롯해 11번가, 위메프, 지마켓, 옥션 등 주요 온라인 쇼핑몰에서 베베숲 제품을 구매한 뒤 베베숲 카카오톡 채널을 추가해 구매 인증하면 참여가 완료된다.추첨을 통해 선정된 이벤트 당첨자에게는 LG 스타일러(1명), 비스포크 큐브 공기청정기(1명), 다이슨 에어랩 스타일러(1명), 네스프레소 버츄오 플러스(1명), 에어팟 프로(1명) 등 푸짐한 경품이 선물로 증정된다. 당첨자 발표는 다음달 30일 베베숲 카플친 소식란에서 확인할 수 있다.베베숲 관계자는 “”고 밝히며, “코로나19로 장시간의 집콕 생활에 지친 요즘, 풍성한 경품 이벤트에 참여해 잠시나마 즐거운 시간이 되었으면 좋겠다”고 덧붙였다.한편, 아기 물티슈 전문 기업 베베숲은 전세계 최대 규모의 전문 리서치 기업 칸타월드패널을 통해 2016~2019년 아기 물티슈 국내 판매 1위로 공식 인증 받은 데 이어, 최근 닐슨코리아의 2020년 물티슈 시장데이터 분석 결과 아기 물티슈 시장 점유율 1위를 차지하는 등 5년 연속 국내 판매 1위 자리를 지키며 대한민국 부모님들로부터 꾸준한 사랑을 얻고 있다.1995년부터 아기피부연구소를 통해 안전한 제품을 연구·개발해오고 있는 베베숲은 제품력과 안전성을 바탕으로 각종 소비자 브랜드 선호도 조사에서도 1위를 이어가며 아기 물티슈 시장에서 높은 신뢰도를 쌓아가고 있다.이 밖에도 `SAFE-B 프로젝트`라는 이름 하에 `엄마와 아기가 행복하고 안전한 세상`을 모토로 다양한 사회공헌활동들을 꾸준히 전개하며 착한 기업으로 꾸준히 호평 받고 있으며, 최근에는 자연에 생분해 되는 플라스틱 FREE 100% 레이온 원단을 사용한 네이처 물티슈의 라인업을 확장하며 사회 전반적으로 불고 있는 플라스틱 줄이기에도 적극 동참하고 있다.▶ [인터랙티브] 여성, 외치다▶ 경향신문 바로가기▶ 경향신문 구독신청하기©경향신문(www.khan.co.kr), 무단전재 및 재배포 금지"
2021.03.15.,"'나빌레라' 원작자 HUN 작가 ""박인환X나문희, 캐스팅 만족도 300%""",url없음,<네이버 기사 없음>
2021.03.15.,"[Daily New식품] 삼양식품, 롯데칠성음료, 롯데제과 外",url없음,<네이버 기사 없음>
2021.03.15.,"충남도, 농기계 임대 확대…올해 32억 투입",url없음,<네이버 기사 없음>
2021.03.15.,"[써볼까]메종 21G, ‘비스포크 홈 센트’",url없음,<네이버 기사 없음>
2021.03.15.,SK바이오사이언스 증거금 중 절반 증시에 남아,url없음,<네이버 기사 없음>
2021.03.15.,"SPC그룹 던킨, 인기 게임 ‘어몽 어스’와 협업∙∙∙ 한정 굿즈 출시",https://n.news.naver.com/mnews/article/468/0000751177?sid=103,"[스포츠서울 김수지기자]SPC그룹 계열사 비알코리아가 운영하는 던킨이 인기 모바일 게임 ‘어몽어스(Among Us)’와 협업해 ‘어몽어스 보틀’을 한정 수량으로 선보인다고 밝혔다.이와 함께 오는 12일부터 매장에서 제품 1만원 이상 구매 시 ‘어몽어스 보틀’을 3,900원에 구매할 수 있는 ‘어몽어스 보틀 프로모션’을 운영한다.SPC그룹 던킨은 최근 집안에서 즐기는 모바일 중심의 여가∙취미 활동에 대한 관심도가 높아짐에 따라, 모바일 게임 브랜드와의 협업을 기획했다. 특히, 전 세계적으로 10대와 20대 사이에서 선풍적인 인기를 끌고 있는 ‘어몽어스’와 손잡고 한정 협업 제품을 준비하게 됐다.SPC 던킨의 ‘어몽어스 보틀’은 투명하고 가벼운 트라이탄(Tritan) 소재의 물병이다. 물병 몸통에는 어몽어스 캐릭터를 패턴화해 그려 넣었고, 뚜껑은 고글을 쓴 어몽어스 캐릭터 얼굴을 그대로 재현한 독특한 디자인을 완성했다. 여기에, 물병 상단에 꽂아 쓸 수 있는 픽 2종(도넛, 캐릭터 미니어처)을 함께 제공한다. 마치 어몽어스 캐릭터가 모자를 쓴 듯한 연출이 가능해 게임 마니아와 희소성을 추구하는 소비자들의 소장 욕구를 자극한다. (일부 매장 제외, 굿즈 소진 시 프로모션 자동 종료, 자세한 내용은 홈페이지 참고)이와 함께 상큼한 딸기 필링과 부드러운 바닐라 크림을 듬뿍 넣은 어몽어스 캐릭터 모양 도넛 ‘도넛이 임포스터였다’도 시즌 한정으로 선보인다.한편, 던킨은 지난 5일부터 각종 모바일 앱(해피오더, 배달의 민족, 카카오톡 주문하기)에서 ‘어몽어스 보틀 사전 예약 행사’를 진행했는데, 당시 행사 시작 2시간 만에 준비한 물량이 모두 소진되며 뜨거운 반응을 얻기도 했다.SPC그룹 던킨 관계자는 “사전 예약부터 좋은 반응을 얻은 ‘어몽어스 보틀’의 인기가 앞으로도 계속될 것으로 보인다”며 “실용성 만점의 ‘어몽어스 보틀’은 물론, 던킨 매장에서 ‘어몽어스’ 콘셉트의 이색 도넛을 찾는 재미도 함께 느껴보시길 바란다”고 말했다.sjsj1129@sportsseoul.com[기사제보 news@sportsseoul.com]  Copyright ⓒ 스포츠서울&sportsseoul.com"
2021.03.15.,"CGV, ‘스트레스리스 시네마’ 오픈...전좌석 리클라이너 배치",url없음,<네이버 기사 없음>
2021.03.15.,한-중남미 디지털 협력 포럼 개최...우리 기업들의 중남미 진출 지원 계기될 것,url없음,<네이버 기사 없음>
2021.03.15.,"윤지성, 4월 컴백…전역 후 첫 앨범 발표(공식)",https://n.news.naver.com/mnews/article/410/0000769292?sid=106,<구조 다름>
