기사날짜,기사제목,네이버 뉴스 url,기사내용
2021.03.19.,"무료 혜택 없애는 T맵·카카오T에 ""플랫폼 횡포"" 불만 고조",https://n.news.naver.com/mnews/article/001/0012270038?sid=105,"""공짜 서비스로 시장 장악 후 과금 수순…소비자 부담 커질 것""(서울=연합뉴스) 조성흠 기자 = 국내 대표 모빌리터 플랫폼으로 꼽히는 T맵과 카카오T가 최근 새로운 정책과 요금을 내놓으면서 소비자 부담이 커지는 것 아니냐는 논란이 제기된다.    운영업체는 법령 준수를 위한 조치라거나 고객 혜택 증대가 목적이라고 하지만, 결국 플랫폼 사업자로서 우월적 지위를 내세워 수익을 극대화하려는 것이라는 불만도 커지면서다.[SK텔레콤 제공. 재판매 및 DB 금지]    19일 관련 업계에 따르면 최근 SK텔레콤에서 분사한 티맵모빌리티는 T맵의 데이터 요금 무과금 혜택(제로레이팅)을 종료하기로 하고 이를 고객들에게 공지했다.    이는 T맵 서비스의 제공 주체가 SKT에서 티맵모빌리티로 이관된 데 따른 것으로, 공정거래법상 SKT에서 T맵에 제로레이팅 혜택을 줄 수 없기 때문이다.    SKT에 따르면 사용자가 T맵으로 쓰는 월평균 데이터 사용량은 48MB 수준으로, 이는 최근 이동통신 가입자의 월평균 데이터 사용량이 10GB를 넘은 데 비하면 미미한 수준이다.     또한 SKT는 고객 불편을 방지하기 위해 앞으로 6개월간 기존 T맵 사용자에게 데이터 100MB를 추가 제공하기로 했다.    그럼에도 월간 이용자 수 1천300만명, 시장 점유율 70%에 달하는 T맵의 이번 조치에 대해 사용자들의 시선은 곱지 않다. 독점적 지위를 활용해 서비스 운영비를 절감하려는 목적이 있는 것 아니냐는 주장이다.    내비게이션을 많이 쓰는 운수업 종사자들의 부담이 더욱 커질 것이라는 우려도 나온다. 사실상 하루 종일 내비게이션을 켜놓는 이들의 경우 데이터 무제한 요금제에 가입하지 않고서는 자칫 '요금폭탄'을 맞을 수도 있기 때문이다.난항 겪는 카카오 택시 발대식[연합뉴스 자료사진]    카카오T 역시 택시 기사를 대상으로 월정액을 내면 배차 혜택을 주는 요금제를 내놓으면서 택시업계의 반발을 사고 있다.    이번에 선보인 '프로 멤버십'은 택시 기사가 월 9만9천원을 내면 원하는 목적지의 콜을 빠르게 확인해주는 기능이 있다.    이를 활용하면 기사가 특정 장소로 이동할 때 해당 장소의 호출 목록을 빠르게 확인할 수 있다. 또한 주변의 실시간 콜 수요 지도로는 콜이 많은 곳을 한눈에 파악할 수도 있다.    그러나 택시업계는 카카오가 자사 가맹 택시에 배차를 우대한다는 '콜 몰아주기' 논란을 거듭 제기하고 나섰다.    나아가 카카오가 호출 중개 서비스를 유료화기 위한 수순으로 이번 서비스를 내놨다고 주장했다. 이는 최근 카카오가 타다와 우버 등 주요 가맹택시 사업자에게 유료 제휴를 제안한 사실과 맞물려 논란을 키우고 있다.     소비자들은 이들이 무료 서비스로 고객을 끌어모아 시장을 장악한 뒤 서비스를 유료로 전환하는 등 플랫폼 업체의 지위를 남용하는 것 아니냐는 불만을 터뜨리고 있다. 눈앞의 수익에 급급해 서비스 개선보다 유료화 정책을 펼침으로써 장기적으로 시장 성장을 저해할 것이라는 지적도 나온다.    김주호 참여연대 민생희망본부 팀장은 ""플랫폼 업체들이 시장 점유율을 확보한 뒤 이를 무기로 유료화를 강행하는 사례가 끊이지 않고 있다""며 ""소비자 부담이 커지지 않도록 정부 차원의 대책과 함께 장기적으로 5G 부가 서비스 및 모빌리티 사업에 대한 심도 있는 정책적 논의가 필요하다""고 말했다.    josh@yna.co.kr▶네이버에서도 뉴스는 연합뉴스[구독 클릭]▶[팩트체크]'설탕세' 도입 논란▶제보하기<저작권자(c) 연합뉴스(https://www.yna.co.kr/), 무단 전재-재배포 금지>"
2021.03.19.,'콜 몰아주기 논란' 카카오 택시기사 멤버십 조기마감…연매출 230억↑ 효과,https://n.news.naver.com/mnews/article/366/0000687474?sid=105,"/카카오모빌리티카카오가 택시 기사를 대상으로 출시한 월정액 멤버십이 나온지 사흘 만에 조기 마감됐다.카카오모빌리티 관계자는 19일 ""이날 오전 10시 선착순 2만명 가입이 모두 끝났다""며 ""추가 모집은 현재 검토 중이다""라고 했다.월 9만9000원에 이용 가능한 ‘프로 멤버십’은 택시 기사가 원하는 목적지 콜을 빠르게 확인, 매칭해 주는 ‘목적지 부스터’ 기능을 제공한다.또 주변의 콜 수요를 실시간으로 보여주는 기능도 있는데 콜이 많은 곳을 지도에서 짙은 색으로 표시해 수요가 많은 곳을 빨리 파악할 수 있도록 했다.단골 승객이 택시를 찾으면 알려주는 ‘단골 손님 관리’ 기능도 있다. 단골이 가까이서 택시를 부르면 배차를 우선해주는 것이다.가입시 첫달 무료에 올해 6월까지 한시적으로 할인 혜택을 준다고 하지만 기사들이 이후에 멤버십을 제 가격에 이용한다고 가정하면 카카오는 월 19억8000만원, 연 237억6000만원의 수익을 추가로 거두는 셈이다. 카카오모빌리티는 지난해 매출 약 2100억원에 당기순손실 약 350억원을 기록했다. 이대로 멤버십 가입자 수를 조금 더 늘리면 적자를 상당부분 메꾸면서 흑자전환도 꾀할 수 있을 것으로 보인다.택시 업계에서는 카카오의 새 멤버십이 사실상 ‘콜 몰아주기’나 다름없다며 불만을 제기하고 있다. 유료 멤버십에 가입한 택시가 선호하는 지역을 모두 쓸어간다는 것이다. 또 기사들이 특정 목적지 콜만 받으려는 경향을 심화시켜 ""승차거부를 조장하는 것 아니냐""는 지적도 나온다.이에 대해 카카오모빌리티 측은 ""택시 호출을 먼저 보여주긴 하지만, 무조건 배차해 주거나 콜을 더 많이 주는 형태는 아니다""라고 했다.[박현익 기자 beepark@chosunbiz.com] ▶네이버에서 '명품 경제뉴스' 조선비즈를 구독하세요▶'못난이 자동차' 놀림받던 日 스바루의 성공 비결▶계속되는 車 반도체 부족 여파… ""2분기가 더 문제"" 	저작권자 ⓒ 조선비즈, 무단 전재 및 재배포 금지"
2021.03.19.,"카카오엔터테인먼트, 국내 최대 통합 스타 오디션 3월 개최(공식)",https://n.news.naver.com/mnews/article/052/0001564539?sid=106,<구조 다름>
2021.03.19.,"카카오 여민수·조수용, 작년 연봉 64억·34억…직원들은 평균 1억",https://n.news.naver.com/mnews/article/018/0004880301?sid=105,"여민수·조수용 카카오 공동대표. 카카오 제공[이데일리 노재웅 기자] 여민수·조수용 카카오 공동대표가 지난해 각각 64억8000만원, 34억7500만원의 보수를 수령했다. 카카오 직원들은 평균 연봉 1억원 대열에 합류했다.카카오(035720)가 18일 공시한 사업보고서에 따르면 여 대표는 지난해 급여 4억1000만원, 상여금 16억2400만원, 주식매수선택권(스톱옵션) 행사 이익 44억500만원, 기타 근로소득 200만원 등 총 64억8000만원을 받았다. 2019년 여 대표 연봉은 5억원 미만이어서 공개되지 않았다.조 대표는 급여 7억5000만원, 상여금은 27억2400만원, 기타 근로소득은 100만원으로 총 34억7500만원을 받았다. 이는 전년 대비 61% 증가한 수치다.카카오는 두 대표에 상여금을 지급한 이유로 “2019년 영업이익 목표달성에 대한 대표이사의 기여도를 고려해 특별성과보너스를 2020년 2월에 지급했다”고 설명했다.이어 “카카오 공동체 주력계열사의 대표이사로 취임 후 공동체 시너지와 성장에 기여한 점을 고려해 특별상여를 결정했다”며 “대표이사 직책의 역할 범위와 중요도 등을 기준으로 보상위원회 및 관리 규정에 의거해 직책수당을 지급했다”고 덧붙였다.같은 기간 김범수 카카오 의장은 같은 기간 김 의장은 급여 5억원, 상여금 3200만원, 기타 근로소득 100만원 등 총 5억3300만원을 받았다. 김 의장은 2019년 연봉이 5억원 미만이어서 공개되지 않았다.카카오 임직원들은 네이버(035420), 엔씨소프트(036570)에 이어 직원 평균 연봉이 1억원 대열에 합류했다. 주식매수청구권 행사 영향으로 평균 연봉이 크게 오른 것으로 풀이된다. 카카오 직원 2747명의 지난해 1인 평균 급여액은 전년 대비 35% 증가한 1억800만원을 기록했다.노재웅 (ripbird@edaily.co.kr)▶ #24시간 빠른 #미리보는 뉴스 #eNews+▶ 네이버에서 '이데일리 뉴스'를 만나보세요▶ 빡침해소, 청춘뉘우스 '스냅타임'＜ⓒ종합 경제정보 미디어 이데일리 - 무단전재 & 재배포 금지＞"
2021.03.19.,카카오도 '직원 평균 연봉 1억' 대열 합류,https://n.news.naver.com/mnews/article/079/0003481236?sid=101,"""1인 평균 1억800만원""…""스톡옵션 영향 커""[CBS노컷뉴스 김연지 기자]카카오 사옥. 연합뉴스네이버, 엔씨소프트(NC)에 이어 카카오도 '직원 평균 연봉 1억 원' 대열에 합류했다.18일 카카오 사업보고서에 따르면 이 회사 직원 2747명의 지난해 1인 평균 급여액은 1억 800만원을 기록했다. 이는 2019년 8천만원에서 35% 늘어난 것이다.회사 관계자는 ""연간 급여 총액에는 임직원에게 지급한 급여 및 상여, 주식매수선택권(스톡옵션) 등이 포함돼 있어 여러 변수에 따라 금액이 영향을 받는다""며 ""2020년에는 스톡옵션 행사의 영향이 컸던 것으로 보인다""고 말했다.앞서 네이버·엔씨소프트가 지난해 직원 평균 연봉 1억원을 넘겼다고 사업보고서를 통해 밝혔다.경영진 중에서는 여민수 공동대표가 총 64억 8천만원을 받았다. 스톡옵션 행사 이익이 44억 500만원, 상여금 16억 2400만원, 급여 4억 5천만원 등이었다.여 대표는 2019년 연봉이 5억원 미만이라 작년 공시 대상에 포함되지 않았다.조수용 공동대표는 34억 7500만원, 창업자인 김범수 이사회 의장은 5억 3200만원을 각각 받았다.한편 이날 방준혁 넷마블·코웨이 의장과 서정진 셀트리온 명예회장의 연봉도 공개됐다. 방 의장은 23억 6600만 원을, 서 명예회장은 31억 8600만 원을 수령했다.▶ 확 달라진 노컷뉴스▶ 클릭 한 번이면 노컷뉴스 구독!▶ 보다 나은 세상, 노컷브이와 함께anc.kyj@gmail.com저작권자 © CBS 노컷뉴스 무단전재 및 재배포 금지"
2021.03.19.,쿠팡發 인재 모시기…카카오·엔씨·네이버도 '연봉 1억' 대열에,https://n.news.naver.com/mnews/article/015/0004516274?sid=101,"개발자 부족에 몸값 급등…카카오 연봉 1년 새 35% 올라 근속 짧은 플랫폼·게임社 1억 넘게 받아…""삼성 안 부럽다""하늘길 막힌 대한항공 16%↓…'연봉킹'이던 SK에너지 8%↓코로나 직격탄 맞은 전통 대기업은 실적 악화로 연봉 줄어임직원들이 경기 성남시 분당 네이버 본사 건물로 들어가고 있다. 사진=허문찬 기자 sweat@hankyung.com쿠팡은 지난달 신입 개발자 ‘초봉 6000만원 시대’를 열었다. 5년차 이상 개발 경력직 채용에는 입사 보너스 5000만원을 제시했다. 넥슨과 넷마블은 ‘집토끼’를 지키기 위해 전 직원 연봉을 800만원씩 인상한다고 발표했다. 그러자 게임업체 크래프톤은 개발직군과 비개발직군의 연봉을 각각 2000만원, 1500만원 일괄 인상했다. 대졸 신입사원 기준으로 개발자 초봉은 6000만원이 됐다. 엔씨소프트도 가세했다. 개발직군 연봉 1300만원+α, 비개발직군은 1000만원+α 인상안을 발표했다. 김택진 최고경영자(CEO)는 ‘특별 인센티브’ 800만원도 지급했다. 대졸 신입사원 초임 상한선도 없앴다. 개발직군 초봉 5500만원 기준은 하한선이다. 게임업계의 ‘연쇄 임금 인상’은 개발자 처우가 좋은 것으로 알려진 ‘네카라쿠배’(네이버·카카오·라인·쿠팡·배달의민족)로의 이직을 막기 위한 것이라는 분석이 나왔다.○쿠팡발(發) 임금 인상 바람산업 구조의 변화에 맞물려 한국의 고용 구조가 일본식 연공급제에서 미국식 성과급제로 변화하고 있다. 이 과정에서 경영진과 직원들 사이의 의견차도 커지고 있다. 해고가 상대적으로 자유로운 대신 파격적인 인센티브를 지급하는 고용 시스템과 연공서열을 중시하고 정년을 보장하는 연공급제 사이에서 뾰족한 해답을 찾지 못하고 있기 때문이다.정보기술(IT) 제조 기업 소속 직원들의 불만이 커지고 있다. 양준모 연세대 경제학부 교수는 “게임·플랫폼 기업은 개인의 작은 아이디어도 큰 부가가치를 창출할 수 있는 사업 구조지만, 전통 제조 기업은 회사 전반의 자본 장치와 시스템에 의존하는 부분이 많다”며 “몸집이 상대적으로 작은 플랫폼·게임 업체와 비교하면 조직 규모가 크고 복잡한 제조 기업들이 연공서열과 부서 간 특성을 고려해 임금 체계를 개선하는 데 어려움을 겪고 있는 것”이라고 분석했다. ○제조기업 임금 협상에도 영향성과급 지급 체계를 두고 노사가 충돌했던 SK하이닉스에 이어 삼성전자 노사도 올해 임금 협상에 난항을 겪고 있다. 사측은 올해 임금 인상률로 3% 안팎을, 노측은 6% 안팎을 주장한 것으로 알려졌다. 지난해 삼성전자의 임금 인상률은 2.5%였다. 삼성전자 직원들의 불만은 플랫폼·게임업계의 연쇄 임금 인상에 이들 기업으로 이직하는 직원이 생기면서 느끼는 상대적 박탈감이 커졌다는 분석이 나온다. 삼성전자 무선사업부의 한 직원은 “인공지능(AI) 담당 임원이 연봉 1.5배에 스톡옵션(주식 매수 선택권)까지 받고 쿠팡으로 이직했다는 소식에 ‘삼성맨’이라는 자부심을 갖고 일하던 직원들이 적잖이 충격을 받았다”며 “신생 IT 플랫폼업계와 경쟁하게 된 마당에 보상이라도 제대로 받아야 하는 것 아니냐는 반응이 나오는 이유”라고 설명했다. 자신이 기여한 바에 대해 보상받고자 하는 욕구가 강한 밀레니얼 세대의 특성도 영향을 미쳤다.LG전자도 상황은 비슷하다. 사업보고서에 기재된 직원 1인 평균 급여액은 2019년(8600만원)에 이어 지난해에도 8600만원 수준이었다. 지난해 LG전자는 사상 최고 실적을 기록했다. LG전자와 LG전자 노동조합은 올해 임금인상률을 9%로 확정했다. 2000년 이후 가장 높은 상승률이다. 업종 간 경계가 무너지는 상황에서 우수 인력을 빼앗기지 않기 위해서는 성과에 대한 적절한 보상이 이뤄져야 한다는 판단이 반영됐다는 분석이다. ○대기업 내에서도 임금 격차 커져코로나19가 산업 패러다임 변화를 가속화함에 따라 인력 미스매치가 심화되고 있다. 이 과정에서 대기업 간에도 임금 격차가 벌어지고 있다. 코로나19로 직격탄을 맞은 기업들은 연봉 수준이 정체되거나 급감했다. 하늘길이 막히면서 장기 유·무급휴직에 들어간 대한항공 직원 평균 연봉은 전년 대비 16% 감소한 6819만원, 지난해 창사 이래 첫 적자를 기록한 호텔신라는 15% 줄어든 5000만원이었다. 성태윤 연세대 경제학부 교수는 “코로나19로 인한 셧다운 및 근로시간 단축이 코로나 피해 기업의 임금 감소에 직접적인 영향을 미쳤을 것”이라고 분석했다.고재연/한경제 기자 yeon@hankyung.com▶ 경제지 네이버 구독 첫 400만, 한국경제 받아보세요▶ 한경 고품격 뉴스레터, 원클릭으로 구독하세요▶ 한국경제신문과 WSJ, 모바일한경으로 보세요 ⓒ 한국경제 & hankyung.com, 무단전재 및 재배포 금지"
2021.03.19.,카카오도 1억…개발자 주가 상승에 코딩 학습열풍,https://n.news.naver.com/mnews/article/057/0001559575?sid=101,"지난해 카카오의 직원 평균 연봉이 처음으로 1억 원을 넘어섰습니다.어제(18일) 카카오의 사업보고서에 따르면 카카오 직원 2747명의 지난해 1인 평균 급여액은 1억800만 원으로 나타났습니다. 1년 전 수치(8천만 원)보다 35% 증가한 액수입니다. 카카오 관계자는 ""연간 급여 총액에는 임직원에게 지급한 급여와 상여, 주식매수선택권(스톡옵션) 등이 포함돼 있어 여러 변수에 따라 금액이 영향을 받는다""며 ""작년에는 스톡옵션 행사의 영향이 컸다""고 설명했습니다.앞서 사업보고서를 내놓은 네이버와 엔씨소프트의 직원 평균 연봉도 지난해 1억 원을 넘겼습니다.이같은 IT업계 평균 연봉 상승은 개발자 연봉이 대폭 오른 데 따른 것으로 풀이됩니다. 요즘 국내 IT업계에선 ""개발자가 금(金)보다 더 비싸다""는 말이 나옵니다. 코로나 이후 인터넷·게임 등 비대면 산업이 급팽창하면서 이 분야의 경쟁력 있는 기술자들 몸값이 천정부지로 치솟고 있는 것입니다.배달앱 배달의민족은 최근 내부 개발자들의 연봉을 큰 폭으로 인상해주기로 했고, 인터넷 부동산 업체 직방도 26일 개발자 연봉 2000만원 일괄 인상과 신입 사원 초봉 6000만원을 보장하기로 했습니다. 직방은 경력 개발자에게는 최대 1억원의 보너스도 줍니다. SSG닷컴·11번가 같은 전자상거래 업체들도 최근 맞춤형 서비스를 강화하면서 개발자를 공격적으로 채용하고 있습니다. 판교에 있는 게임 업체의 한 임원은 “최근 2~3년간 쿠팡·토스 등 온라인 기업뿐 아니라 연예 기획사도 막대한 인센티브를 앞세워 개발자를 대거 영입하고 있다”며 “네이버·카카오에서도 1년간 100명이 넘는 개발자가 빅히트 엔터테인먼트로 이직한 것으로 안다”고 말했습니다.개발자는 파이썬·자바·C언어 등의 개발 언어를 이용해 프로그램을 짠 뒤 IT 서비스 뒷부분(서버)에서 이뤄지는 데이터나 인공지능(AI)·빅데이터 작업들을 다루고, 이를 웹이나 앱상에서 이용자들이 편안하게 이용할 수 있도록 설계하는 일을 합니다.코로나19로 인한 '언택트(비대면) 열풍'으로 IT 기업들이 급성장하면서 연일 수요가 커지고 있지만, 온라인 서비스를 개발할 인력은 부족하다보니 개발자 처우가 좋아질 수밖에 없는 상황입니다.개발자 연봉이 천정부지로 치솟는 이유는 개발자의 절대수 부족보다도 쓸만한 개발자가 희소하기 때문이라는 말도 나옵니다.업계는 ‘개발자가 없는 것이 아니라, 쓸만한 개발자가 없는 것이 몸값 폭등의 원인’이라는 말이 나옵니다. 기업들은 혁신적인 방식으로 돌파구를 찾아내는 개발자를 원하는데, 정작 대학을 졸업한 초년생 개발자 상당수는 시키는 일도 제대로 못 해내는 경우가 많다는 것이 업계 현장 관계자들의 불만입니다. 반대로 최근 들어 AI 등 기존 코딩 방식으로만 문제를 해결할 수 없는 분야가 늘어나면서 수학·통계학 지식까지 겸비한 고급 개발자는 이직 시장에서 구하기 어려워졌습니다.조대곤 KAIST 경영대학 교수는 “IT 개발자는 프로그램의 용량이나 성능과 직결되는 코딩을 효율적으로 하는 실력이 관건인데 국내엔 직관적이고 간결하게 코딩할 수 있는 사람이 매우 적다”고 말했습니다. 페이스북의 한 개발자는 “3~4명이 나눠서 해야 할 코딩 작업을 혼자서 해내는 사람들이 있다”며 “이런 인재들은 회사도 요구하는 대로 연봉을 주고서라도 붙잡을 수밖에 없다”고 말했습니다.[ 백길종 디지털뉴스부 기자 / 100road@mbn.co.kr ]▶ 네이버에서 'MBN뉴스'를 구독하세요!▶ 김주하 앵커 'MBN 종합뉴스' 저녁 7시 20분 진행▶ MBN 무료 고화질 온에어 서비스 GO!< Copyright ⓒ MBN(www.mbn.co.kr) 무단전재 및 재배포 금지 >"
2021.03.19.,IPO 줄줄이 대기 중인 SK·카카오 계열사… 투자자 관심 집중,https://n.news.naver.com/mnews/article/417/0000671418?sid=101,"SK바이오사이언스의 일반공모주 청약 마지막날인 지난 10일 오전 NH투자증권 명동WM센터에서 투자자들이 상담을 받고 있다./사진=뉴시스 지난해 카카오게임즈, SK바이오팜에 이어 올해 SK바이오사이언스까지, SK와 카카오 계열사들의 기업공개(IPO) 돌풍이 이어지면서 향후 이들 계열사들의 상장 계획에 투자자들의 관심이 집중된다. 19일 한국거래소에 따르면 지난 18일 상장한 SK바이오사이언스는 '따상(공모가의 2배 가격으로 시초가를 형성한 뒤 상한가 직행)'에 성공했다. 공모가(6만5000원)의 2배인 13만원으로 시작한 주가는 장 초반부터 상한가인 16만9000원을 기록했다. 다만 SK바이오사이언스는 첫날 '따상' 분위기를 이어가지 못하고 상장 둘째날인 19일 전 거래일 대비 1.48%(2500원) 하락한 16만6500원에 장을 마쳤다.지난해 7월 상장한 SK바이오팜 역시 상장 대박을 기록했다. SK바이오팜은 첫날 따상을 포함해 3거래일 연속 상한가를 기록하며 코스피에서 신기록을 세웠다. 3거래일 만에 주가는 공모가(4만9000원)보다 4배 이상으로 오르며 공모가 대비 수익률은 337.7%를 기록했다.이밖에도 SK 계열사 상장 신화를 이어갈 기업들이 증시 출격을 준비 중이다. 올 상반기 중 상장이 가시화된 곳은 SK IET다. SK이노베이션의 자회사로 2차전지 소재를 생산하는 사업을 영위한다. 습식 리튬 이온 배터리 분리막(LiBS) 사업을 주력하는 곳으로 상장 밸류에이션(실적 대비 주가 수준)만 5조원 내외로 추산된다. 공모규모는 SK바이오사이언스보다 높은 약 1조5000억원으로 예상된다. 지난해 12월 상장예비심사를 청구한 상태로 심사 결과를 기다리고 있다.SK텔레콤 자회사들도 줄줄이 상장을 기다리고 있다. e커머스 자회사인 11번가는 오는 2023년 IPO를 목표로 하고 있다. 지난해 11월 세계 최대 e커머스 플랫폼인 아마존과도 전략적 제휴를 맺었다. SK텔레콤이 최근 e커머스 플랫폼 이베이코리아 인수에 나선 것도 11번가 기업가치 확대를 위한 것이라는 분석도 나온다.이외에도 SK텔레콤 계열사 원스토어는 이르면 상반기 상장 예비 심사를 청구할 계획이다. 원스토어는 한국 유일의 토종 앱스토어다. SK텔레콤의 T스토어를 주축으로 KT와 LG유플러스 등 한국의 이동통신 3사가 합작해 만들었다. 누적 회원 수 5000만명, 월 접속자 수 1900만명, 연간 거래액 7000억원 이상을 기록하고 있다. 이 회사의 기업 가치는 약 1조원 수준으로 평가된다.카카오뱅크, 카카오페이, 카카오페이지 등 카카오 3형제들도 연내 상장을 앞두고 있다. 각각 공모 규모는 2조5000억원, 2조원, 1조원 가량으로 추정된다. 카카오페이지가 6월 가장 먼저 출격하고 이어서 카카오뱅크와 카카오페이지가 순차적으로 나설 가능성이 높다. 카카오페이와 카카오페이지의 기업가치는 각각 7조∼10조원으로 예상된다. 현재 장외시장에서 7만6000원에 거래되고 있는 카카오뱅크는 발행주식 수를 곱하면 시가총액이 30조원에 달한다. 이는 신한지주의 시총(약 18조원)을 뛰어넘는 규모다.이지운 기자 lee1019@mt.co.kr▶뜨거운 증시, 오늘의 특징주는?  ▶여론확인 '머니S설문' ▶머니S, 네이버 메인에서 보세요 <저작권자 ⓒ '성공을 꿈꾸는 사람들의 경제 뉴스' 머니S, 무단전재 및 재배포 금지>"
