기사날짜,기사제목,네이버 뉴스 url,기사내용
2021.09.02.,"[투자노트] 하늘로 다니는 세상, 주도권을 쥐려는 기업들",https://n.news.naver.com/mnews/article/366/0000758596?sid=101,"지난 6월 아랍에미리트(UAE)의 샤르자(Sharjah‧아랍에미리트를 구성하는 7개의 토후국 가운데 하나)에서는 특별한 실험이 있었다. 무인으로 운행되는 전동차가 400m를 주행하는 실험이었다.벨라루스에 본사를 둔 기업인 ‘유 스카이 트랜스포트(uSky Transport)’는 자사 전동차에 ‘유 스카이 팟(uSky pod)’이라는 이름을 붙였다. 팟(pod)이라는 용어가 현재는 애플의 아이팟, 에어팟 등으로 친숙해져 음악과 깊은 연관이 있는 것처럼 보이지만 사실 사전적 뜻은 비행기 동체 밑의 연료, 장비 등을 싣는 유선형 공간이다.유 스카이 팟(uSky pod)        유 스카이 팟은 우리가 흔히 볼 수 있는 지하철처럼 평범한 전동차가 아니다. 정거장을 지상에 만들어놓고 강철 케이블로 정거장과 정거장을 연결해 공중에서 움직인다. 일종의 케이블카인 셈이다. 그러나 주로 고지대의 관광지에 설치돼 느린 속도로 움직이는 케이블카와는 좀 다르다. 개발사인 유 스카이 트랜스포트에 따르면 시속 150㎞(93마일)의 속도로 이동할 수 있고 도시 곳곳에 정거장을 세우면 시간당 1만명의 승객을 이동시킬 수 있다.화물 전용으로는 48톤(t)을 최대 시속 90㎞(56마일) 속도로 옮길 수 있다. CNN비즈니스와의 인터뷰에서 스테파니 헤이그 맥킨지 연구원은 “케이블카는 늘 같은 크기의 같은 속도로 움직이지만 유 스카이 팟은 다양한 크기의 전동차를 이용해, 짧은 거리를 이동할 수도 있고 더 긴 거리를 이동할 수도 있다”고 설명했다. 예를 들어 도심의 경우에는 짧은 구간에 정거장을 더 많이 설치하고 교외의 경우에는 긴 구간을 정거장으로 만들어 놓을 수도 있다는 얘기다.유 스카이 팟은 올해 샤르자에 2.4㎞의 노선을 만들어 운행을 시작할 계획이다. 이를 위해 올해 안에 샤르자와 정식 계약을 체결할 예정이다.UAE가 서방 테크놀로지 기업의 고속 케이블카를 도입하려는 이유는 심각한 교통체증을 해결하기 위해서다. 사막에 지하철 공사를 하는 것보다 훨씬 쉽게 설치가 가능한 공중 이동 수단이라는 점이 그들을 사로잡았을 것이다.유 스카이 트랜스포트의 최고경영자(CEO)인 올레크 자레츠키(Oleg Zaretskiy)는 “지상은 완전히 포화 상태이고 교통수단에서 나오는 배기가스로 가득 차고 있다”며 “우리가 개발한 교통수단이 교통체증과 환경문제에기여하기를 바란다”고 말했다. 자레츠키는 “UAE뿐 아니라 인구가 급증하고 있는 인도나 파키스탄 등 중동과 아시아의 다른 지역에도 진출을 추진하겠다”고 말하기도 했다.현대자동차가 CES 2020행사에서 공개한 UAM S-A1. / 현대자동차        공중(하늘)으로 다니는 시대는 사막의 나라 중동에만 해당하는 이야기는 아니다.현대자동차는 도심 항공 모빌리티 개발을 담당하는 UAM(Urban Air Mobility) 사업부를 만들어 항공 모빌리티 분야를 개척하고 있다. 도심을 가로지르는 수직 이착륙이 가능한 소형 비행기를 개발하겠다는 것이다. 15억 달러를 투자해 세계에서 가장 혼잡한 글로벌 대도시의 하늘 위를 사람들이 움직일 수 있도록 하겠다는 포부다. 현대차는 도심 항공 모빌리티 산업이 앞으로 20년 안에 1조5000억달러 규모로 커질 것으로 보고 있다.1997년 개봉한 뤽 베송 감독의 SF영화 제5원소에는 하늘을 나는 자동차들이 등장했다. 하지만 이제 머지않아 도시에서 하늘로 움직이는 것이 SF영화에서만 가능한 일은 아닌 것 같다. 모빌리티(운송) 산업이 카카오모빌리티, 쏘카 등 차량을 공유하는 플랫폼 비즈니스로 확장됐듯 이제는 지상과 지하를 넘어 하늘로 공간의 확장까지 꾀하고 있기 때문이다.항공 모빌리티의 주도권을 갖기 위해 국내외 기업들이 어떤 시도를 하는지, 어떤 투자자들이 이런 기업들에 돈을 집어넣는지를 유심히 살펴보는 것은 어떨까."
2021.09.02.,"""울고싶다"" 엔씨소프트, 또 신저가…""웃고싶다"" 크래프톤, 또 신고가",https://n.news.naver.com/mnews/article/009/0004846780?sid=101,"[사진 제공 = 엔씨소프트] 대표적인 게임주인 엔씨소프트와 크래프톤의 희비가 엇갈리고 있다. 엔씨소프트는 기대작이었던 모바일 MMORPG '블레이드앤소울2'의 흥행이 기대치에 크게 못 미치면서 신저가를 찍은 반면 새내기주인 크래프톤은 코스피200 편입 결정에 상장 이후 최고가를 경신했다.2일 엔씨소프트는 전일 대비 4000원(0.63%) 내린 63만3000원에 거래를 마쳤다. 엔씨소프트는 이날 장 초반 62만7000원까지 하락해 52주 신저가를 경신했다. 엔씨소프트는 블소2 출시일인 지난 26일 15% 급락하면서 70만6000원까지 하락해 52주 신저가를 경신했다. 이후 27일과 28일에도 연달아 신저가를 깼다. 잠시 숨고르기를 하던 주가는 이날 재차 신저가 아래로 밀렸다.반면 지난달 10일 상장한 크래프톤은 이날 장중 52만원까지 올라 사상 최고치를 경신했다. 기존 기록은 지난달 20일 기록한 51만원이었다. 크래프톤은 오는 10일부터 카카오뱅크와 함께 코스피200 지수에 특례 편입된다. 코스피200 지수 편입을 앞두고 이 지수를 추종하는 외국인, 기관 자금이 크래프톤으로 유입되고 있다. 엔씨소프트는 블소2 흥행 부진의 여파가 지속되고 있다. 블소2는 현재 구글플레이 기준 매출 4위에 올라와있다. 지난달 26일 출시된 블소2의 사전예약자수는 746만명으로 현재 매출 1~3위인 오딘의 400만명, 리니지M 550만명, 리니지2M 738만명을 웃도는 규모다. 출시되자마자 매출 1위 자리에 오를 것이란 기대와 달리 매출 11위의 부진한 성적으로 출발한 뒤 현재 4위까지 순위를 끌어올렸다. 엔씨소프트의 과도한 과금 체계에 대한 불만이 블소2 출시를 계기로 폭발하면서 매출에 직접적인 타격을 주는 모습이다. 과금 모델에 대한 유저들의 피로감을 눈으로 확인한 만큼 오는 11월 출시될 '리니지W'의 흥행 기대감도 떨어지고 있다. 증권가의 눈높이도 크게 낮아졌다. 당초 증권가에서는 블소2의 일 매출을 30억원 이상으로 예상했다. 하지만 현재는 매출 10억원선으로 기대치를 낮췄다. 블소2 출시 이후 일주일간 미래에셋증권, NH투자증권, 삼성증권 등 7개 증권사가 엔씨소프트의 목표주가를 하향 조정했다. 또 삼성증권, 한국투자증권 등 4개 증권사는 투자의견도 '중립'으로 내렸다. 김소혜 한화투자증권 연구원은 ""(블소2) 출시 이틀 만에 일부 아이템의 개편안을 발표했지만 여전히 유저 트래픽은 나아지지 않은 것으로 파악된다""라며 ""엔씨소프트는 과거 수십년간 신작에 대한 흥행비율(Hit Ratio)이 매우 높았지만 이번 흥행 부진으로 차기 신작 성과에 대한 우려감이 존재할 수 있다""고 말했다."
2021.09.02.,"김해시, 코로나 상생 국민지원금 지급",https://n.news.naver.com/mnews/article/002/0002208136?sid=102,"6일부터 10월 29일까지 약 2개월로 온라인(인터넷) 신청 가능김해시는 '코로나 상생 국민지원금'을 오는 6일부터 지급한다고 2일 밝혔다. 코로나 상생 국민지원금 지원 대상은 2021년 6월 건강보험료 기준 가구별 소득하위 80%이며 맞벌이와 1인가구 우대기준을 적용해 1인당 25만원을 지급한다. 다만 2020년 기준 재산세 과세표준 9억원 이상의 고액자산가와 금융소득 합계액 2000만원 초과자는 제외된다. ▲김해시청 본관 전경. ⓒ프레시안(조민규)코로나 상생 국민지원금 지급 대상 사전확인은 네이버앱·카카오톡·토스·국민비서 홈페이지에서 알림서비스를 사전에 신청하면 9월 5일 대상자 여부와 신청기한, 사용기한 등을 개별 안내 받을 수 있다. 따라서 6일부터는 카드사 홈페이지·콜센터·ARS·건강보험공단 홈페이지·제로페이 홈페이지 등을 통해서도 조회할 수 있다. 다만 시행 초기 접속 폭주로 인한 혼란을 방지하기 위해 시행 첫 1주일은 요일제를 적용해 출생연도 끝자리 숫자별로 조회 가능하다. 지원금은 신용카드·체크카드·김해사랑상품권·선불카드로 지급된다. 신청기간은 9월 6일부터 10월 29일까지 약 2개월로 온라인(인터넷) 신청(신용·체크카드·김해사랑상품권)은 6일부터 제로페이 홈페이지나 본인 소유의 신용·체크카드사 홈페이지를 통해 신청할 수 있다. 방문신청(신용·체크카드·선불카드)은 13일부터로 신용카드와 체크카드의 경우에는 카드사와 연계된 은행을 방문해 신청하고 선불카드로 지급 받을 경우에는 주소지 읍·면·동 행정복지센터를 방문해 신청하면 되는데 이 경우에도 첫 일주일간은 출생연도 끝자리 숫자별 요일제로 운영된다. 사용처는 소상공인 지원 강화를 위해 대형마트·백화점·온라인 쇼핑몰 등을 제외하고 김해지역 내 전통시장과 동네마트·음식점·미용실 등 김해사랑상품권 가맹점에서만 사용이 가능하며 사용기한은 올해 12월 31일까지다."
2021.09.02.,"삼성전자 대신 이 종목들…올 수익 30% 찍은 펀드, 뭘 담았나",https://n.news.naver.com/mnews/article/008/0004639933?sid=101,"[오늘의 포인트]지난해가 '뭘 사도 오르는' 장세였다면 올해는 '내 주식만 안 오르는' 장세가 지속되고 있다. 리콜, 신작 부진 등에 BBIG(배터리·바이오·인터넷·게임) 대형주들이 쉬어가고 있기 때문이다. 형님들이 부진한 모습을 보이는 동안 중형주들은 부지런히 상승하면서 올해는 액티브 펀드들이 인덱스를 이기는 상황이 되고 있다. 특히 글로벌 경기 개선 기대감과 인플레이션 수혜 기대감으로 중형가치·성장주를 위주로 담은 펀드들의 수익률이 대체로 높다.  2일 한국펀드평가에 따르면 국내 주식형 공모 펀드 중 올해 누적 수익률이 높은 상위 10위권에는 모두 대형주 편입 비중이 제한적인 펀드들이 차지했다. 1위는 한국밸류10년투자어린이1(A) 33.3%였고 2위는 에셋플러스코리아리치투게더1(A) 31.87%, 3위는 하나UBS코리아중소형 29.53% 순이었다. 하나UBS코리아중소형(A), 현대강소기업1(A), KB중소형주포커스(A), KTB VIP밸류연금저축(C), KTBVIP스타셀렉션(A), 메리츠코리아스몰캡(A), KB장기플랜(C5), 한국투자거꾸로증권1(A)도 모두 23~29%의 수익을 거두며 순항하고 있다. 이는 코스피200지수의 올해 누적 수익률인 7.87%를 훌쩍 뛰어넘는 것이다. 코스닥150지수는 오히려 올해 0.75%가 떨어졌다.  시총 상위인 삼성전자, SK하이닉스, LG화학, 현대차, 셀트리온 등도 올해 고점 대비 주가가 20~30% 하락한 상황이다. 최근 3개월 누적수익률을 기준으로 살펴봐도 KTB VIP밸류연금저축(C), KTBVIP스타셀렉션(A), 삼성뉴딜코리아(A), 삼성코스닥벤처플러스(A), KB중소형주포커스(A)가 11~15%로 상위에 올랐다. 한국투자밸류자산운용, 에셋플러스자산운용, KB자산운용, VIP자산운용, 메리츠자산운용 등 중소형주 바텀업(개별 종목을 발굴하는 상향식) 투자에 강점을 가진 운용사들의 성적이 높은 편이다. 한국밸류10년투자어린이1(A)의 6월 기준 포트폴리오를 보면 삼성전자, S-Oil, 현대차 같은 대형주도 담겨있지만 F&F, 와이지엔터테인먼트 등 시총 1조원 수준의 중형주도 높은 비중을 차지하고 있다. F&F는 의류업체로 중국 매출이 확대되면서 사상 최대 분기 실적을 경신하고 있다. 와이지엔터테인먼트는 국내외 음원, 유튜브 광고매출로 신규 활동이 거의 없는 상황에서도 호실적을 기록했다. 에셋플러스코리아리치투게더와 KB중소형포커스는 중소형주에만 투자하는 펀드는 아니지만 투자 상위 종목 10위에 삼성전자가 없다.  에셋플러스코리아리치투게더 투자 상위 종목에는 카카오, LG전자우 외에 KCC글라스, 효성티앤씨 등이 담겨있다. KB중소형포커스도 NAVER, 카카오와 함께 골프존, 노바렉스, 한솔케미칼 등에 투자하고 있다. KB중소형주포커스를 운용하는 정용현 KB자산운용 밸류운용실장은 가치주 투자에 대해 ""기존에는 현금 등 자산가치가 가치주 평가에서 큰 부분을 차지했지만 현재는 비즈니스모델 또는 기술 등 수치로 적용하기 어려운 무형자산 가치에 대한 평가가 점차 중요해지고 있다""고 설명했다. 또 지난해 많은 투자자들이 급상승장을 경험해 단기간 고수익을 노리는 경우가 많지만 펀드 투자의 경우 다양한 종목에 분산 투자로 변동성을 제한하면서 안정적으로 수익을 낼 수 있다는 장점이 있다. 정 실장은 ""미국의 테이퍼링(양적완화 축소)이 실제화 되면 중소형주를 포함해 국내 증시에 어느정도 영향이 있을 수 있다""며 ""이에 대응하기 위해 실적이 안정적이거나 구조적으로 산업이 성장하는 종목에 압축 투자할 것""이라고 덧붙였다."
2021.09.02.,"삼성전자 대신 이 종목들…올 수익 30% 찍은 펀드, 뭘 담았나",https://n.news.naver.com/mnews/article/008/0004639933?sid=101,"[오늘의 포인트]지난해가 '뭘 사도 오르는' 장세였다면 올해는 '내 주식만 안 오르는' 장세가 지속되고 있다. 리콜, 신작 부진 등에 BBIG(배터리·바이오·인터넷·게임) 대형주들이 쉬어가고 있기 때문이다. 형님들이 부진한 모습을 보이는 동안 중형주들은 부지런히 상승하면서 올해는 액티브 펀드들이 인덱스를 이기는 상황이 되고 있다. 특히 글로벌 경기 개선 기대감과 인플레이션 수혜 기대감으로 중형가치·성장주를 위주로 담은 펀드들의 수익률이 대체로 높다.  2일 한국펀드평가에 따르면 국내 주식형 공모 펀드 중 올해 누적 수익률이 높은 상위 10위권에는 모두 대형주 편입 비중이 제한적인 펀드들이 차지했다. 1위는 한국밸류10년투자어린이1(A) 33.3%였고 2위는 에셋플러스코리아리치투게더1(A) 31.87%, 3위는 하나UBS코리아중소형 29.53% 순이었다. 하나UBS코리아중소형(A), 현대강소기업1(A), KB중소형주포커스(A), KTB VIP밸류연금저축(C), KTBVIP스타셀렉션(A), 메리츠코리아스몰캡(A), KB장기플랜(C5), 한국투자거꾸로증권1(A)도 모두 23~29%의 수익을 거두며 순항하고 있다. 이는 코스피200지수의 올해 누적 수익률인 7.87%를 훌쩍 뛰어넘는 것이다. 코스닥150지수는 오히려 올해 0.75%가 떨어졌다.  시총 상위인 삼성전자, SK하이닉스, LG화학, 현대차, 셀트리온 등도 올해 고점 대비 주가가 20~30% 하락한 상황이다. 최근 3개월 누적수익률을 기준으로 살펴봐도 KTB VIP밸류연금저축(C), KTBVIP스타셀렉션(A), 삼성뉴딜코리아(A), 삼성코스닥벤처플러스(A), KB중소형주포커스(A)가 11~15%로 상위에 올랐다. 한국투자밸류자산운용, 에셋플러스자산운용, KB자산운용, VIP자산운용, 메리츠자산운용 등 중소형주 바텀업(개별 종목을 발굴하는 상향식) 투자에 강점을 가진 운용사들의 성적이 높은 편이다. 한국밸류10년투자어린이1(A)의 6월 기준 포트폴리오를 보면 삼성전자, S-Oil, 현대차 같은 대형주도 담겨있지만 F&F, 와이지엔터테인먼트 등 시총 1조원 수준의 중형주도 높은 비중을 차지하고 있다. F&F는 의류업체로 중국 매출이 확대되면서 사상 최대 분기 실적을 경신하고 있다. 와이지엔터테인먼트는 국내외 음원, 유튜브 광고매출로 신규 활동이 거의 없는 상황에서도 호실적을 기록했다. 에셋플러스코리아리치투게더와 KB중소형포커스는 중소형주에만 투자하는 펀드는 아니지만 투자 상위 종목 10위에 삼성전자가 없다.  에셋플러스코리아리치투게더 투자 상위 종목에는 카카오, LG전자우 외에 KCC글라스, 효성티앤씨 등이 담겨있다. KB중소형포커스도 NAVER, 카카오와 함께 골프존, 노바렉스, 한솔케미칼 등에 투자하고 있다. KB중소형주포커스를 운용하는 정용현 KB자산운용 밸류운용실장은 가치주 투자에 대해 ""기존에는 현금 등 자산가치가 가치주 평가에서 큰 부분을 차지했지만 현재는 비즈니스모델 또는 기술 등 수치로 적용하기 어려운 무형자산 가치에 대한 평가가 점차 중요해지고 있다""고 설명했다. 또 지난해 많은 투자자들이 급상승장을 경험해 단기간 고수익을 노리는 경우가 많지만 펀드 투자의 경우 다양한 종목에 분산 투자로 변동성을 제한하면서 안정적으로 수익을 낼 수 있다는 장점이 있다. 정 실장은 ""미국의 테이퍼링(양적완화 축소)이 실제화 되면 중소형주를 포함해 국내 증시에 어느정도 영향이 있을 수 있다""며 ""이에 대응하기 위해 실적이 안정적이거나 구조적으로 산업이 성장하는 종목에 압축 투자할 것""이라고 덧붙였다."
2021.09.02.,국민지원금 원활한 지급 위해 행안부-지자체-신용카드사 '맞손',url없음,<네이버 기사 없음>
2021.09.02.,"구글갑질방지법 통과에 콘텐츠 업계 국회 방문…""한국에 살아서 다행""",https://n.news.naver.com/mnews/article/421/0005579174?sid=105,"선제적 앱마켓 독점 규제에 콘텐츠 업계 ""한국이 진짜 선진국 역할 하고 있구나""구글·애플에 앱 생태계 공존과 상생 촉구2일 웹툰·웹소설 등 국내 콘텐츠 업계가 국회를 찾아 '구글 갑질 방지법'(인앱결제방지법) 통과를 반겼다. / 뉴스1 2021.09.02. © News1 이기범 기자(서울=뉴스1) 이기범 기자 = ""한국에서 콘텐츠 제작자로 산다는 게 이렇게 기쁘고 감격스러울 수 없다. 전 세계 최초로 관련 법안을 이끌어가는 모습을 보면서 한국이 진짜 선진국 역할을 하고 있구나 하고 굉장히 감격했다.""웹툰·웹소설 등 국내 콘텐츠 업계가 국회를 찾아 '구글 갑질 방지법'(인앱결제방지법) 통과를 반겼다. 이들은 공정한 창작 생태계에 대한 기대감을 나타내며, 전 세계 최초로 구글·애플 등 독점적 앱마켓 사업자를 규제하는 법안이 마련된 것에 대해 환호했다.2일 오전 더불어민주당 조승래 의원은 국회 과학기술정보방송통신위원회(과방위) 소회의실에서 콘텐츠 업계 창작자들과 간담회를 열었다.이날 간담회에는 콘텐츠 업계 대표로 한국인터넷기업협회 박성호 회장, 서범강 한국웹툰산업협회 회장, 전세훈 웹툰협회 회장, 신일숙 한국만화가협회 회장, 성인규 한국스토리창작협회 회장,  권혁주 한국웹툰작가협회 회장, 김병수 한국만화웹툰학회 이사 등이 참석했다.또 법안 통과를 주도했던 과방위 소속 더불어민주당 조승래, 김상희,  전혜숙, 이용빈, 한준호 의원, 안정상 수석전문위원이 참석했으며, 구글 갑질 방지법 주무 기관인 방송통신위원회 최성호 사무처장이 참여했다.이날 김병수 한국만화웹툰학회 이사는 ""코로나19 대처가 잘 될 때 한국에 살아서 참 다행이라는 생각을 했고, 아프가니스탄 미라클 작전에 성공할 때 한국인인 게 자랑스럽다는 생각이 들었는데, 이번 법안이 통과되면서 에픽게임즈 CEO가 '나는 한국 사람'이라고 하는 걸 보고 감격했다""며 ""한국에서 콘텐츠 제작자로 산다는 게 이렇게 기쁘고 감격스러울 수 없다""고 이번 법안 통과를 반겼다.앞서 '포트나이트' '언리얼엔진'으로 유명한 에픽게임즈의 팀 스위니 공동창립자 겸 CEO는 지난 31일(현지시간) 자신의 트위터를 통해 존 F. 케네디 대통령의 유명 연설 '나는 베를린 시민이다'(Ich bin ein Berliner)를 인용해 ""오늘날 전 세계 모든 개발자는 자랑스럽게 말할 수 있다. 나는 한국인이다!""라고 구글 갑질 방지법 통과 소식을 반겼다.서범강 한국웹툰산업협회 회장은 ""쉽지 않은 길이었는데 전 세계 최초로 법안을 통과시키고, 통상 문제 등 여러 고민이 있었을 텐데 마지막까지 힘써줘서 감사하다""며 이번 법안 통과에 나선 국회의원들에게 감사 인사를 전했다.신일숙 한국만화가협회 회장은 ""한국은 인터넷이 발달한 국가 중 선두 그룹이기 때문에 처음으로 겪는 일과 처음으로 법을 만들어야 하는 일이 많을 것""이라며 ""의원님들이 전례가 없었다고 생각하지 말고, 우리가 세계의 지표가 될 수 있다는 생각으로 과감하게 애써주셨으면 한다""고 말했다.김상희 의원은 ""대한민국은 지금 선진국이다. 최초로 법안이 만들어졌기 때문에 전 세계가 주목하고 있다""며 ""법이 통과되고 나서 구글이 어떻게 할 것인지 대응할 것인지 긴장하고 있는데 어떻게 나오든지 간에 국회와 협회가 함께 해서 좋은 방향으로 해결해나가겠다""고 밝혔다.과방위 간사인 조승래 의원은 ""몇 번의 고비를 거치며 1년 2개월여 만에 법이 통과됐다""며 ""국내와 해외 공조가 함께 이뤄진 결과""라고 법안 통과 소감을 밝혔다. 또 ""아직 과제도 많이 남아 있고 실제로 구글이나 애플이 어떤 정책을 들고나올지 예측하기 어려운 상황으로, 이에 따른 시장의 기술적 혼란도 있을 거로 생각한다""며 ""상생과 공존의 지혜를 앱마켓 사업, 빅테크 기업들에 촉구한다""고 강조했다.최성호 방통위 사무처장은 ""법이 통과됐지만 시행령 준비 및 실제 집행 과정 등 어떤 난관이 있을지 모르기 때문에 하나하나 살펴보며 법 효과가 나타날 수 있도록 최선을 다하겠다""고 말했다.국회 과방위 간사인 더불어민주당 조승래 의원은 플랫폼 사업자와 콘텐츠 생산자, 이용자들 간 공존의 룰을 만들어야 한다고 말했다. / 뉴스1 2021.09.02. © News1 이기범 기자한편, 이날 국내 플랫폼 사업자들을 향한 비판의 목소리도 나왔다. 권혁주 한국웹툰작가협회 회장은 ""작가 입장에서는 업체들도 갑이다. 갑 위의 갑을 막기 위해 힘을 모아드린 것""이라며 ""플랫폼 업체들의 글로벌 진출 시 작가와의 계약이 불공정하다는 지적과 우려가 있다""고 말했다.이에 대해 전혜숙 의원은 ""카카오 등 국내 플랫폼도 수수료 갑질 문제가 있다""며 ""작가들 작품이 세계로 나갈 수 있는 통로를 마련해주는 것은 고마운 건데 고마움도 독점이 되면 횡포로 바뀐다. 고마움이 고마움으로 남을 수 있도록 국회와 방통위가 제 역할을 해야 한다""고 밝혔다.조승래 의원은 ""국내에서도 플랫폼 관련 공정 이슈가 있는데 이번에 의지를 결집해 법을 통과시켰기 때문에 국내에서도 똑같은 문제 제기가 있을 것""이라며 ""국내 플랫폼 사업자도 이점에 대해 심사숙고해야 한다""고 덧붙였다."
