기사날짜,기사제목,네이버 뉴스 url,기사내용
2023.02.05.,제주 공영주차장 장기 방치車 강제 처분,https://n.news.naver.com/mnews/article/079/0003734262?sid=102,"제주시, 3월~6월 전수조사 벌여 2개월 이상 방치차량 공매처분제주 공영주차장제주시 공영주차장에 장기간 세워진 차량이 강제 처분된다.제주시는 무료 공영주차장에 장기 방치된 차량에 대해 다음달부터 6월까지 4개월간 전수 조사를 벌인다고 5일 밝혔다.대상은 읍·면 지역 공영주차장과 공한지 주차장 등 모두 886군데 노외 공영주차장에 세워진 방치 차량이다.제주시는 '자동차관리법'에 따라 방치 차량에 대해선 강제 처분을 내리기로 했다. 자동차관리법은 2개월이 지나도 같은 위치에 계속 주차하면 '방치 차량'으로 간주한다.제주시는 해당 차량의 연식, 보험 가입 여부, 체납 여부 등을 사전에 검토해 방치 차량으로 지정한 뒤 자동차 소유주가 자진 처리 명령을 이행하지 않으면 자치경찰에 고발하기로 했다.체계적인 전수조사로 방치 차량에 대해선 공매절차를 진행하는 등 공영 주차장의 기능을 회복시키는게 목적이라고 제주시는 설명했다.한편 제주시 동지역 공영주차장 328곳에 대한 전수조사 결과 지난해 말 기준 장기 방치 차량은 모두 50대로 집계됐다.※CBS노컷뉴스는 여러분의 제보로 함께 세상을 바꿉니다. 각종 비리와 부당대우, 사건사고와 미담 등 모든 얘깃거리를 알려주세요.이메일 : jebo@cbs.co.kr카카오톡 : @노컷뉴스사이트 : https://url.kr/b71afn"
2023.02.05.,"창원시, 시내버스 안전예측시스템으로 난폭운전 막는다",https://n.news.naver.com/mnews/article/079/0003734289?sid=102,"한국교통안전공단주관 창원컨벤션센터서 최종보고회 개최창원시 제공시는 지난 2일 창원컨벤션센터에서 한국교통안전공단 주관으로 '창원시 지능형 시내버스 안전 모니터링 및 예측서비스 구축 사업' 최종보고회를 개최했다. 보고회에는 과기부, 한국지능정보사회진흥원(NIA) 등 5개 기관과 시공업체인 ㈜더 아이엠씨, ㈜ 한스네트워크, 창원시 시내버스 운수회사 관계자 등 40여명이 참석했다. 사업은 과기부의 '디지털 공공서비스 혁신프로젝트'의 일환으로 한국교통안전공단에서 안전예측시스템을 연구·개발해 창원시에 접목한 사업이다. 국비 24억원이 투입돼 지난해 8월 착수해 이번에 최종보고회를 개최한 것이다.시내버스 난폭운전을 막고 차량 결함을 예방하는 형태의 이 시스템은 시내버스 운전석에 차량용 블랙박스 형태로 '데이터 로그 단말기'를 부착하게 된다.시는 이 시스템을 통해 시내버스 운행 중 발생하는 차량 데이터를 수집·분석해 차량 결함을 사전에 예지·정비하고 운전자의 운전패턴을 분석해 난폭운전을 획기적으로 개선할 수 있을 것으로 기대하고 있다. 창원시 이승룡 교통건설국장은 ""이번 국책사업을 우리 시에 접목해 주신 한국교통안전공단에 깊이 감사드린다""며 ""이 시스템이 괄목할만한 성과를 이뤄 창원시를 시작으로 전국으로 확산이 되고, 전 국민이 편안하게 시내버스를 이용할 수 있도록 하는 시스템이 되기를 바란다""고 말했다. ※CBS노컷뉴스는 여러분의 제보로 함께 세상을 바꿉니다. 각종 비리와 부당대우, 사건사고와 미담 등 모든 얘깃거리를 알려주세요.이메일 : jebo@cbs.co.kr카카오톡 : @노컷뉴스사이트 : https://url.kr/b71afn"
2023.02.05.,추모사하는 이재명 대표,https://n.news.naver.com/mnews/article/079/0003734207?sid=100,"5일 서울 여의도 국회 의원회관 대회의실에서 열린 10.29 이태원 참사 국회추모제에서 더불어민주당 이재명 대표가 추모사를 하고 있다.※CBS노컷뉴스는 여러분의 제보로 함께 세상을 바꿉니다. 각종 비리와 부당대우, 사건사고와 미담 등 모든 얘깃거리를 알려주세요.이메일 : jebo@cbs.co.kr카카오톡 : @노컷뉴스사이트 : https://url.kr/b71afn"
2023.02.05.,"김영록 전남지사, '청보호' 실종자 수색 민간어선 투입 등 총력 당부",https://n.news.naver.com/mnews/article/079/0003734230?sid=102,"목포해경 등 찾아 구조상황 살피고 실종자 가족 지원목포해양경찰서 제공김영록 전라남도지사는 5일 오전 도청 재난상황실에서 긴급 사고대책 수습회의를 열어 어선 '청보호'의 사고 수습과 실종자 구조상황을 살피고, 민간어선 투입 선조치 및 가족 지원인력 파견 등 총력대응을 당부했다. 김영록 지사는 이어 조승환 해양수산부장관 등과 함께 목포해양경찰서와 신안군수협을 방문해 현장 상황을 점검하고, 실종자 가족 등을 위로했다. 전남도에 따르면 지난 4일 밤 11시 20분쯤 신안 임자도 대비치도 서방 9해리 해상에서 인천시 선적 24톤급 근해통발어선 '청보호'가 기관실 쪽에서 물이 차오르다 뒤집혔다. 이 사고로 승선자 12명 중 3명이 구조되고 9명이 실종됐다. 이에 따라 해양수산부가 장관을 본부장으로 하는 중앙사고수습대책본부를, 인천시가 지역사고수습본부를 구성해 운영하고 있다.전라남도가 5일 전복된 어선 청보호 실종자 가족들과 면담을 진행했다. 전라남도 제공전라남도 역시 도 자체 대책본부와 신안군 지역재난안전대책본부를 운영해 업무 협조 및 사고 수습 지원을 하고 있다. 또한 구조자 이송 시 응급처치가 가능한 목포 병원을 확보해 대응하고, 광주 상급병원 이송 체계도 갖춰 운용할 방침이다. 전남소방본부와 해경, 닥터헬기 등 출동 대기 태세를 유지하고 있으며, 전남 선원 2명에 대해서는 긴급복지제도를 통해 신속 선지원에 나서기로 했다. 전남도는 특히 사고 발생 직후 어업지도선과 민간 어선을 출동시켜 수색현장에 참여하도록 하고 실종자 지원 등 적극적인 대응에 나섰다. 김영록 전라남도지사는 ""실종자 수색을 위해 신안·무안·영광지역 민간어선 250여 척을 추가 투입하도록 선조치한 후에 이를 정부에 보고하는 등 행정력을 총동원해 수색활동을 적극 지원하라""며 ""또한 실종자 등 가족 지원 인력도 파견해 지원에 부족함이 없도록 하라""라고 지시했다.한편 사고 선박 승선자는 한국인 선원이 전남 2명을 포함한 9명, 인도네시아 선원이 1명, 베트남 선원이 2명이며, 구조자는 한국인 2명(경남 거제 1․부산 1), 인도네시아인 1명으로 건강이 양호한 상태다.※CBS노컷뉴스는 여러분의 제보로 함께 세상을 바꿉니다. 각종 비리와 부당대우, 사건사고와 미담 등 모든 얘깃거리를 알려주세요.이메일 : jebo@cbs.co.kr카카오톡 : @노컷뉴스사이트 : https://url.kr/b71afn"
2023.02.05.,"글로벌 챗GPT 열풍, KT SK텔레콤 개발 한국형 챗봇 어디까지 왔나",url없음,<네이버 기사 없음>
2023.02.05.,"전주시·日시즈오카현, '동아시아문화도시' 상호 협력 논의",https://n.news.naver.com/mnews/article/079/0003734222?sid=102,"일본 야마모토 아즈마(山本 東) 지역외교국담당부장을 단장으로 한 시즈오카현 지역외교국 관계자 일행은 3일 동아시아문화도시 교류협력사업을 논의하고 상호 홍보 방안을 모색하기 위해 전주를 찾았다. 전주시 제공전북 전주시가 올해 한·중·일 3국의 문화예술 교류를 이끄는 '동아시아문화도시' 사업을 추진하는 가운데 일본의 동아시아문화도시인 시즈오카현과 상호 협력을 논의했다.3일 야마모토 아즈마(山本 東) 지역외교국담당부장을 단장으로 한 시즈오카현 지역외교국 관계자 일행은 동아시아문화도시 교류협력사업을 논의하고 상호 홍보 방안을 모색하기 위해 전주를 찾았다.전주시는 시즈오카현 방문단에게 전주한옥마을을 비롯한 전주시 주요 관광정보와 전주의 음식문화 등을 소개하고, 한·일 동아시아문화도시 간 상호 홍보 및 협력을 위한 업무협의를 진행했다.또한 전주시는 시즈오카현 방문단으로부터 '2023 동아시아문화도시' 상호 협력을 위한 전주시 홍보 계획을 전달받기도 했다.시즈오카현은 일본에 동아시아문화도시 전주를 소개하기 위해 △전주의 문화관광과 맛집 등을 소개하고 전주한지공예체험을 추진하는 '전주여행 웨비나(온라인 세미나)' 개최 △후지산 시즈오카 공항 내 전주 홍보활동 전개 △시즈오카현 동아시아문화도시 개막식(5월 2일)에 한국 미디어 초청 △주일한국문화원이 주최하는 '한국문화의 날(10월 28일)'에서 전주관광 홍보프로그램 추진 등에 나설 계획이다.이에 따라 전주시는 전주시 공식 홍보영상과 전주관광지도, 각종 공예품과 사진 등을 시즈오카현에 전달해 홍보 계획에 적극 활용될 수 있도록 적극 협조하기로 했다.전주시와 시즈오카현 방문단은 도시 간 상호 관광콘텐츠 및 홍보 계획을 논의하는 등 구체적이고 지속 가능한 교류 사업을 이어 나갈 계획이다.김인태 전주시 부시장은 ""대한민국의 천년문화도시 전주에 방문한 것을 모든 시민들을 대표해 환영한다""면서 ""전주시와 시즈오카현이 함께 동아시아문화도시로 선정된 만큼 다양한 문화를 지속해서 교류하고 아시아뿐만 아니라 세계로 뻗어나가는 문화도시로 함께 발돋움하길 바란다""고 말했다.한편 일본 중앙부 태평양 연안에 위치한 시즈오카현은 23개 시와 5군으로 구성된 363만여 명의 인구가 사는 일본 동서 문화·경제 교류 중심지로, 후지산이 자리 잡고 있고 일본 녹차 생산량의 40%를 차지하는 녹차 산지로 유명하다. 또 후지노쿠니세계연극제와 가와즈자쿠라 마츠리(벚꽃축제) 등 다양한 문화축제가 열리고 있다.※CBS노컷뉴스는 여러분의 제보로 함께 세상을 바꿉니다. 각종 비리와 부당대우, 사건사고와 미담 등 모든 얘깃거리를 알려주세요.이메일 : jebo@cbs.co.kr카카오톡 : @노컷뉴스사이트 : https://url.kr/b71afn"
2023.02.05.,군위군 자원봉사단체장 간담회 개최,url없음,<네이버 기사 없음>
2023.02.05.,365일 안전한 전북 만든다,url없음,<네이버 기사 없음>
2023.02.05.,[부고] 주진우(대통령실 법률비서관)씨 조모상,https://n.news.naver.com/mnews/article/079/0003734286?sid=100,"▲ 최필순씨 별세, 주진우(대통령실 법률비서관)씨 조모상 = 5일, 경남 진주시 경상국립대병원 장례식장 101호, 발인 7일 오전 7시, 장지 경남 진주시 정촌면 화개리 선영. (055)750-8651※CBS노컷뉴스는 여러분의 제보로 함께 세상을 바꿉니다. 각종 비리와 부당대우, 사건사고와 미담 등 모든 얘깃거리를 알려주세요.이메일 : jebo@cbs.co.kr카카오톡 : @노컷뉴스사이트 : https://url.kr/b71afn"
2023.02.05.,"용인특례시, 2023년 청년 전세보증금 반환보증 보증료 지원",url없음,<네이버 기사 없음>
2023.02.05.,"더보이즈 현재, 전범기 모자 착용…소속사 ""주의 기울이겠다""",https://n.news.naver.com/mnews/article/079/0003734183?sid=106,<구조 다름>
2023.02.05.,"삼성생명, 스마트안내장 도입 나무 6천그루 보호",https://n.news.naver.com/mnews/article/009/0005083860?sid=101,"삼성생명 디지털 혁신의 키워드는 고객편의 향상과 환경경영이다. 2019년부터 '스마트 안내 서비스'를 도입해 연간 1861만건에 달하는 고객 안내장(발송량)을 디지털 형태로 전환했다. 이렇게 절감한 A4 용지는 연간 5769만장이다. 탄소배출량으로 계산하면 약 166t을 감축했고, 30년 수령의 나무 약 5769그루를 보호하는 것과 같은 효과다. 페이퍼리스 실천에서 나아가 매년 새로운 기능을 더해가며 디지털 접근성을 강화하고 있다. 안내장을 읽다가 궁금한 사항에 빠르게 답을 찾아주는 '챗봇'이나 만 65세 이상 고객에게 AI 음성으로 보험계약을 안내하는 서비스 등이 꾸준히 업그레이드됐다.삼성생명 관계자는 ""고객이 보다 쉽고 편리하게 금융 서비스를 경험할 수 있도록 보험가입, 계약유지, 보험금 청구 등 단계별로 디지털을 접목하는 중""이라고 설명했다.가입 단계에서는 컨설턴트 상담 후 고객 본인이 직접 계약 체결을 진행할 수 있는 '모바일 청약' 시스템을 운영한다. 지난해 모바일 청약을 통한 계약 비중은 29%나 된다. 태블릿 전자서명을 포함해 전체의 90%에 달하는 개인 계약이 지류 청약서 없이 모바일 기기로 체결되고 있다고 회사 측은 밝혔다. 작년 7월에는 비대면으로 보험을 선물할 수 있는 '보험선물하기 서비스'를 오픈했다. 고객이 보험을 계약하고 지인에게 카카오톡 등을 통해 선물을 보내는 방식으로, 선물을 받은 사람이 해당 보험의 혜택을 받을 수 있다."
2023.02.05.,"“설에 만난 아들, 마지막 조업이라고 했는데”…애타는 청보호 전복 실종자 가족들",https://n.news.naver.com/mnews/article/032/0003203009?sid=102,"조승환 해양수산부 장관이 5일 오전 전남 목포시 신안군수협 회의실에서 청보호 전복 사고의 실종자 가족과 대화하고 있다. 전날 오후 신안 해상에서 24t급 통발어선 청보호가 전복돼 3명이 구조되고 9명은 실종됐다. 연합뉴스“이번까지만 배 타고 기술 배워보겠다는 아들이었는데…”5일 청보호 전복 사고 실종자 가족들이 모인 전남 목포시 신안군수협 회의실은 적막감이 가득했다.실종자 구조와 가족 지원 등 사고수습에 총력을 다하겠다는 구조 당국의 약속도 실종자 가족들에게는 조금의 위로도 되지 않는 듯했다.애타는 심정을 대변하듯 실종자 가족들의 두 눈은 퉁퉁 부어 있었고 깍지를 쥔 손의 떨림은 계속되고 있었다.이곳에서 만난 선원 이모씨(45)의 아버지 A씨(75)는 사고 소식을 접하고 이날 새벽 부랴부랴 이곳을 찾았다. 월남전 참전 용사인 A씨는 두 달 전 심장박동기 삽입 수술을 받아 안정이 필요한 상태다.A씨는 “지난 설 명절 아들이 이번을 끝으로 더는 배를 타지 않다고 약속했는데. 사고가 날 줄은 몰랐다”고 허망해했다. 이어 “큰아들은 이민을 갔고, 이제 이곳에 혈육이라곤 하나 남았다. 아들이 잘 못된다면 저는 앞으로 어떻게 살아야 하느냐”고 울먹였다.기관장 김모씨(64)의 아내 B씨(64)도 가만히 고개를 떨군 채 구조 소식을 애타게 기다렸다. 그의 곁에는 아들과 딸도 함께였다.그는 지난 1일 ‘진도에 입항했다는 남편의 전화가 마지막이었다고 했다. B씨는 “남편은 30여년 넘게 배를 타왔다. 평소와 같이 잘 다녀오겠다고 했는데 사고가 났다니 믿기질 않는다”고 눈물을 글썽였다.특히 B씨는 “남편이 내년에는 뱃일을 그만두고, 가정에 충실하겠다고 했다”며 “이제 고생 그만하고 편안한 삶을 보낼 일만 남았는데. 이처럼 청천벽력과 같은 소식이 어디있느냐”고 말했다. 그러면서 “남편이 무사히 구조돼 가족의 품으로 돌아올 수 있도록 구조 당국이 최선을 다해줬으면 좋겠다”고 당부했다.선장 이모씨(50)의 아내 C씨는 하염없이 휴대전화만 들여다보고 있었다. C씨의 카카오톡 대화방은 결혼식 때 촬영했던 사진이 배경으로 설정돼 있었다. C씨는 “남편과 4일 오후 10시24분쯤 영상 통화를 했다. 그 때까지만 해도 이상은 없었다”며 “구조 소식이 들리기만 기다리고 있다”고 말했다.전날 오후 11시 19분쯤 전남 신안군 임자면 재원리 대비치도 북서쪽 16㎞ 해상에서 24t급 근해통발어선 청보호가 전복됐다. 신고를 받고 출동한 해경은 선원 12명 중 3명을 구조했다. 유모씨(48)·손모씨(40), 인도네시아인(23) 등이다.5일 오후 전남 목포시 목포해경전용부두에 전날 전복한 어선 청보호에서 극적으로 구조된 선원 3명이 도착해 병원으로 이송되고 있다. 연합뉴스구조된 3명은 이날 오전 사고해역에서 목포해경전용부두로 들어와 병원으로 이송됐다. 이들은 부축을 받으며 하산했지만 비교적 건강한 모습이었다.부두에서 구조된 선원들을 재회한 가족들은 그제서야 안도의 한숨을 내쉬고 눈물을 쏟아냈다. 한 여성은 울음을 터뜨리며 남편에게 “괜찮냐”고 물었고, 이에 구조된 선원은 “응 괜찮아”라고 힘겹게 답하기 도 했다.구조된 선원 3명은 병원으로 옮겨져 검사와 치료를 받았다. 이후 안정을 되찾으면 사고 당시 상황에 대한 보다 정밀한 조사가 진행될 예정이다.해경 등 구조당국은 구조된 선원들의 진술을 토대로 실종자가 바다에 표류하고 있을 가능성도 있다고 보고있다. 구조 당국은 수색 영역을 사고 현장 주변 해역까지 확대하고 나머지 선원들을 찾는데 집중하고 있다."
2023.02.05.,군위군자원봉사 단체장 간담회 개최,url없음,<네이버 기사 없음>
2023.02.05.,"용인특례시, 2023년 청년 전세보증금 반환보증 보증료 지원",url없음,<네이버 기사 없음>
2023.02.05.,"경기도 특사경, 올해 국산 둔갑 해외수입 수입품(원산지 거짓 표시)까지 수사 확대",url없음,<네이버 기사 없음>
2023.02.05.,신규 확진 1만 4018명…지난 주 대비 4천여 명 감소,https://n.news.naver.com/mnews/article/079/0003734233?sid=102,"일요일 발표기준 31주 만에 최저…위중증 313명·사망 22명중국發 단기체류자 전날 양성률 1.5%…직전일은 '0명' 기록중앙방역대책본부 제공코로나19 겨울철 재유행 감소세가 뚜렷한 가운데 5일 신규 확진자는 1만 명대 중반을 기록했다. 질병관리청 중앙방역대책본부(본부장 지영미)는 이날 0시 기준으로 국내 코로나19 신규 확진자가 1만 4018명 늘어 총 3025만 7411명이 확진됐다고 밝혔다. 전날(1만 4624명)보다 606명 줄었다. 1주일 전 일요일(1월 29일·1만 8864명)에 비해 4846명 적고, 2주 전(1월 22일·1만 6615명)과 비교하면 2597명 감소했다. 일요일 발표기준으로 보면, 작년 여름 6차 유행이 본격화되기 전인 7월 3일(1만 36명) 이후 31주 만에 최저치다. 이동·모임이 많았던 설 연휴가 지난 지 2주가 되어 가지만, 이에 따른 확산 영향은 크게 없는 모양새다. 지난달 30일 코로나19 사태 3년 만에 1단계 완화에 들어간 실내마스크 지침도 마찬가지다. 정부는 병원·감염취약시설·대중교통을 제외한 모든 실내 시설에서의 마스크 착용의무를 권고로 전환했지만, 대다수 국민은 여전히 자발적으로 마스크를 쓰는 분위기다. 신규 발생과 시차가 있는 중증·사망도 안정세다. 인공호흡기 또는 에크모(ECMO·체외막산소공급장치) 등의 치료를 받는 위중증 환자는 하루 새 12명이 줄어 313명으로 집계됐다. 지난달 31일 300명대(387명)로 내려온 뒤 이달 1일 359명→2일 345명→3일 339명→4일 325명 등 연일 하락하는 추세다. 재원 중인 위중증의 9할 이상(90.1%·282명)은 고위험군에 해당하는 60세 이상 고령층이다. 전날 숨진 확진자는 22명으로 직전일과 같았다. 50대 사망자 1명을 빼면 80세 이상 16명, 70대 2명, 60대 3명 등 모두 60세 이상 고령환자다. 누적 사망자는 3만 3596명으로 치명률은 0.11%다. 신규 확진의 전파경로는 국내 발생이 1만 3984명, 해외유입이 34명으로 확인됐다. 국내 지역발생 현황을 살펴보면 △서울 2297명 △부산 996명 △대구 855명 △인천 823명 △광주 468명 △대전 353명 △울산 407명 △세종 118명 △경기 3116명 △강원 333명 △충북 392명 △충남 557명 △전북 541명 △전남 598명 △경북 879명 △경남 995명 △제주 256명 등이다.  해외유입 사례는 입국 당시 검역을 통해 12명이 확진됐고, 그 이후 지자체에서 양성 판정을 받은 환자가 22명이다. 신규 해외유입의 35.3%(12명)가 중국에서 들어온 확진자다.  방대본에 따르면, 전날 중국에서 인천국제공항으로 들어온 입국자는 총 1601명이다. 이 중 입국 즉시 공항에서 검사를 받은 단기체류 외국인은 265명으로, 4명이 코로나19 양성으로 확인됐다. 1.5%의 양성률이다. 황진환 기자앞서 직전일인 3일에는 1136명이 입국한 가운데 공항 검사센터에서 검사받은 164명 중 한 명도 확진되지 않았다. 중국발 단기체류자의 당일 양성률이 0%로 집계된 것은 약 한 달 전 중국 입국자에 대한 PCR(유전자 증폭) 검사를 의무화한 이후 처음이었다. 이에 대해 당국은 ""당일(3일) 중국발 단기체류 외국인 입국자 검사건 중 5건은 결과가 '미결정'이라 재검사 결과에 따라 추후 양성 건수가 추가될 수 있다""고 설명했다. 다만, 이날 0시 기준으로 추가된 확진자는 없었다. 중국발 방역을 강화한 지난달 2일부터 전날까지 중국에서 항공편으로 우리나라에 들어온 입국자는 4만 9630명으로 집계됐다. 이 중 90일 이내 단기체류 외국인은 9212명이고, 총 770명이 양성 판정을 받았다. 누적 양성률은 8.4% 수준이다. ※CBS노컷뉴스는 여러분의 제보로 함께 세상을 바꿉니다. 각종 비리와 부당대우, 사건사고와 미담 등 모든 얘깃거리를 알려주세요.이메일 : jebo@cbs.co.kr카카오톡 : @노컷뉴스사이트 : https://url.kr/b71afn"
2023.02.05.,추모사하는 정진석 비상대책위원장,https://n.news.naver.com/mnews/article/079/0003734203?sid=100,"5일 서울 여의도 국회 의원회관 대회의실에서 열린 10.29 이태원 참사 국회추모제에서 국민의힘 정진석 비상대책위원장이 추모사를 하고 있다.※CBS노컷뉴스는 여러분의 제보로 함께 세상을 바꿉니다. 각종 비리와 부당대우, 사건사고와 미담 등 모든 얘깃거리를 알려주세요.이메일 : jebo@cbs.co.kr카카오톡 : @노컷뉴스사이트 : https://url.kr/b71afn"
2023.02.05.,"""달콤한 밸런타인데이""… 특수 노리는 유통가",url없음,<네이버 기사 없음>
2023.02.05.,기도하는 김진표 국회의장과 여야 대표,https://n.news.naver.com/mnews/article/079/0003734200?sid=100,"5일 서울 여의도 국회 의원회관 대회의실에서 열린 10.29 이태원 참사 국회추모제에서 김진표 국회의장, 더불어민주당 이재명 대표, 국민의힘 정진석 비상대책위원장 등 여야 의원들과 유가족들이 기독교 추모의례에 맞춰 손을 잡고 기도를 하고 있다.※CBS노컷뉴스는 여러분의 제보로 함께 세상을 바꿉니다. 각종 비리와 부당대우, 사건사고와 미담 등 모든 얘깃거리를 알려주세요.이메일 : jebo@cbs.co.kr카카오톡 : @노컷뉴스사이트 : https://url.kr/b71afn"
