기사날짜,기사제목,네이버 뉴스 url,기사내용
2023.02.05.,"디저트 필수 'MZ세대' 유통가, 밸런타인데이 초콜릿 공략",https://n.news.naver.com/mnews/article/014/0004964393?sid=101,"[파이낸셜뉴스]  서울시 영등포구 더현대 서울 5층에 위치한 엠앤엠즈 팝업스토어에서 직원들이 상품을 소개하고 있다. 현대백화점 제공.  고객들이 롯데백화점 본점 고디바 매장에서 상품을 둘러보고 있다. 롯데백화점 제공. 유통가가가 발랜타인데이 기간 MZ세대 공략에 나섰다.   5일 업계에 따르면 국내 유통사들이 오는 14일 발렌타인데이를 앞두고 다양한 팝업스토어를 열 예정이다.   롯데백화점은 본점과 잠실점 등 주요 점포를 중심으로 사회관계망서비스(SNS) 인기 디저트 맛집을 확대하고 다양한 팝업스토어를 진행한다. 지난해 본점과 잠실점에서는 ‘노티드’를 포함해 타르트훌리건, 도호프로젝트, 줄리브, 요로이츠카, 뚜르띠에르 등 라이징 디저트 브랜드의 팝업스토어를 잇달아 선보이며 디저트 성지로 떠올랐다. 인기에 힘입어 지난해 롯데백화점 베이커리&디저트 상품군 매출은 30% 신장했다.   이에 롯데백화점 본점과 잠실점에서는 올해 밸런타인데이를 맞아 해외 유명 디저트 브랜드도 선보이고, 다양한 초콜릿과 디저트 상품을 판매하는 ‘밸런타인데이 디저트 팝업스토어’를 진행한다.   먼저 이번 행사에서는 유럽과 미국의 유한 초콜릿 상품들을 만나볼 수 있다. 우선 스위스 수제 초콜릿 레시피로 유명한 ‘레더라 초콜릿’ 브랜드에서는 알프스산 우유를 활용한 트러플, 초콜릿 바 등 다양한 제품을 선보인다. 초콜릿 종주국인 벨기에에서 큰 인기를 얻고 있는 초콜릿 브랜드 ‘레오니다스’에서는 메인 상품인 후레시 초콜릿 상품을 판매한다.   국내 유명 디저트 브랜드도 밸런타인데이 디저트 팝업스토어에 참여한다. 먼저 호텔 경력 30년의 셰프가 총괄 디렉팅한 압구정 유명 디저트 브랜드 메종원스이어를 본점에서 만나볼 수 있다.   현대백화점도 밸런타인데이 기간을 맞아 다양한 디저트 팝업스토어를 진행한다.   먼저, 더현대 서울 5층에서 오는 16일까지 글로벌 초콜릿 브랜드 엠앤엠즈(M&M's) 팝업스토어를 운영한다.   또한, 오는 10일부터 14일까지는 더현대 서울 지하1층 행사장에서는 프랑스 프리미엄 초콜릿 브랜드 카카오바리과 유명 셰프 6인이 협업해 다양한 디저트 상품들을 선보인다.   이밖에도, 같은 기간 무역센터점 지하1층 행사장에서는 우리 밀을 사용한 컵케이크 브랜드 이아컵케이크, 160년 전통의 벨기에 명품 수제 초콜릿 노이하우스의 팝업 행사를 운영한다. 판교점 지하1층에서는 프랑스 디저트 브랜드 브아시에의 팝업 스토어를 선보일 계획이다.   윤향내 롯데백화점 베이커리&디저트팀장은 “’디저트 상품은 이제 단순한 상품을 넘어서 MZ세대들의 라이프스타일을 공유하는 하나의 아이템으로 떠오르고 있다""며 “특히 유행에 민감한 젊은 고객들을 위해 해외 유명 디저트 브랜드뿐만 아니라 국내 라이징브랜드도 한 자리에 모았다""고 전했다."
2023.02.05.,"광주시, 수돗물 절감 효과 '톡톡'…빗물저금통 설치하세요",https://n.news.naver.com/mnews/article/079/0003734157?sid=102,"올해 1억5천만 원 들여 50기 보급…설치비 최대 90% 지원광주광역시청. 광주광역시 제공광주광역시가 버려지는 빗물을 모아 재사용하는 '빗물저금통 설치 지원 사업'을 추진한다. 5일 광주시에 따르면 빗물저금통 설치 지원 사업은 버려지는 빗물을 모아 청소용, 조경용 등 다양한 용도로 활용한다. 올해는 가뭄위기가 심각한 만큼 물 재이용률을 확대하기 위해 지난해 예산의 2배 수준인 1억 5천만 원을 투입해 빗물저금통 50기를 보급한다. 지원대상은 △지붕면적 1천㎡ 미만 건축물 △건축면적 1만㎡ 미만 공동주택 △건축면적 5천㎡ 미만 학교다. 빗물 저장시설의 용량에 따라 최대 1천만원 내에서 빗물저금통 설치비용의 최대 90%를 지원한다. 시설 설치자는 5년 동안 의무적으로 사용해야 하며, 5년 미만 사용하거나 철거할 경우에는 보조금이 환수될 수 있다. 설치를 희망하는 시민은 신청서류를 작성해 3월 13일부터 24일까지 광주시 수질개선과에 방문 또는 등기우편으로 접수하면 된다. 신청자격, 신청서 작성요령, 유의사항 등 자세한 내용은 광주시 홈페이지 고시공고란에서 확인할 수 있다. 광주시는 현지 실사 및 내부 심사를 거쳐 빗물 활용도, 집수능력, 설치여건, 홍보효과, 경제성 등을 검토해 오는 4월 중으로 보조금 지원 대상자를 확정해 통보할 예정이다. 사업을 통해 장기 가뭄으로 인한 상수원 고갈 우려 속에서 수돗물을 절약할 수 있을 것으로 기대된다. 광주시는 지난 2020년부터 빗물저금통 보급을 시작해 지금까지 75개의 빗물저금통을 설치했으며 연간 300톤 상당의 수돗물 절감 효과가 있는 것으로 나타났다. 광주시 이신 수질개선과장은 ""장기 가뭄에 따른 상수원 고갈 우려 속에서 빗물저금통을 설치하면 수돗물을 절약하는 데 동참할 수 있다""며 ""시민들의 적극적인 참여를 바란다""고 말했다.※CBS노컷뉴스는 여러분의 제보로 함께 세상을 바꿉니다. 각종 비리와 부당대우, 사건사고와 미담 등 모든 얘깃거리를 알려주세요.이메일 : jebo@cbs.co.kr카카오톡 : @노컷뉴스사이트 : https://url.kr/b71afn"
2023.02.05.,"부산시, 문화재 보수·정비 '엉망' 사례 33건 적발",https://n.news.naver.com/mnews/article/079/0003734173?sid=102,"핵심요약부산시 감사위원회 문화재 관리실태 특정감사 실시문화재 복원 전(왼쪽)과 복원 후 달라진 배면 색상. 연합뉴스 부산시가 문화재 보수를 엉망으로 하거나, 부실하게 관리한 사례를 무더기로 적발해 조치했다.부산시 감사위원회는 부산시와 16개 구·군의 문화재 보수·정비 및 관리 실태 특정감사를 한 결과 모두 위법·부당 사례 33건을 적발했다고 5일 밝혔다.시는 적발된 건에 대해서는 시정, 주의, 개선, 통보 등의 처분했다.또, 담당자 등 31명에게는 훈계 또는 주의 조치를 내렸다.구체적으로 살펴보면 부산 해운대구에서는 한 사찰의 외산문 보수공사를 하면서 실시설계에 노란색인 배면과 갈색인 처마 밑 색상을 반영하지 않는 바람에 보수공사 후 배면과 처마 밑이 흰색이 됐다.부산 기장군 기장읍성 문화재보호구역 내 토지 231㎡에서는 농작물 무단 경작이 이뤄졌다.또 부산 기장군 기장향교 내 고직사 주변 창고는 보수가 엉터리로 진행돼 담과 협문 사이에 틈이 생기고, 창고 건물 곳곳이 나무에서 갈라짐 현상이 나타난 것으로 조사됐다.시 감사위원회는 이 밖에도 부산시와 구·군이 무형문화재 전승 지원금을 부적절하게 지급하는 등 부당한 사례를 적발해 시정하도록 했다.※CBS노컷뉴스는 여러분의 제보로 함께 세상을 바꿉니다. 각종 비리와 부당대우, 사건사고와 미담 등 모든 얘깃거리를 알려주세요.이메일 : jebo@cbs.co.kr카카오톡 : @노컷뉴스사이트 : https://url.kr/b71afn"
2023.02.05.,"부산시, 문화재 보수·정비 '엉망' 사례 33건 적발",https://n.news.naver.com/mnews/article/079/0003734173?sid=102,"핵심요약부산시 감사위원회 문화재 관리실태 특정감사 실시문화재 복원 전(왼쪽)과 복원 후 달라진 배면 색상. 연합뉴스 부산시가 문화재 보수를 엉망으로 하거나, 부실하게 관리한 사례를 무더기로 적발해 조치했다.부산시 감사위원회는 부산시와 16개 구·군의 문화재 보수·정비 및 관리 실태 특정감사를 한 결과 모두 위법·부당 사례 33건을 적발했다고 5일 밝혔다.시는 적발된 건에 대해서는 시정, 주의, 개선, 통보 등의 처분했다.또, 담당자 등 31명에게는 훈계 또는 주의 조치를 내렸다.구체적으로 살펴보면 부산 해운대구에서는 한 사찰의 외산문 보수공사를 하면서 실시설계에 노란색인 배면과 갈색인 처마 밑 색상을 반영하지 않는 바람에 보수공사 후 배면과 처마 밑이 흰색이 됐다.부산 기장군 기장읍성 문화재보호구역 내 토지 231㎡에서는 농작물 무단 경작이 이뤄졌다.또 부산 기장군 기장향교 내 고직사 주변 창고는 보수가 엉터리로 진행돼 담과 협문 사이에 틈이 생기고, 창고 건물 곳곳이 나무에서 갈라짐 현상이 나타난 것으로 조사됐다.시 감사위원회는 이 밖에도 부산시와 구·군이 무형문화재 전승 지원금을 부적절하게 지급하는 등 부당한 사례를 적발해 시정하도록 했다.※CBS노컷뉴스는 여러분의 제보로 함께 세상을 바꿉니다. 각종 비리와 부당대우, 사건사고와 미담 등 모든 얘깃거리를 알려주세요.이메일 : jebo@cbs.co.kr카카오톡 : @노컷뉴스사이트 : https://url.kr/b71afn"
2023.02.05.,"유통업계, 밸런타인데이 특수 앞두고 기획전 풍성",url없음,<네이버 기사 없음>
2023.02.05.,3년 여 만에 실내 마스크 착용 의무 해제 맞은 첫 주일 표정,https://n.news.naver.com/mnews/article/079/0003734281?sid=103,"핵심요약상당수 교회, 예배 시에는 여전히 마스크  착용 권고교인도 마스크 착용에 익숙..완전 해제에는 시간 걸릴 듯목장 모임에는 마스크 착용 해제..교회 행사도 활발해질 듯이제는 현장 사역으로 무게 중심 옮겨가야 할 때경기도 파주에 있는 한소망교회. 마스크 실내 착용 의무 해제 첫 주일을 맞았지만, 여전히 마스크 착용을 권고하고 있다. 실내 마스크 착용 의무가 해제된 뒤 첫 주일을 맞은 5일 주일. 각 교회들은 3년 여 만에 실내에서 마스크를 벗을 수 있다는 기쁨을 뒤로 하고, 마스크 착용을 권고했다. 경기도 파주에 있는 한소망교회는 주일예배 시 마스크를 벗지 말도록 교인들에게 권고했다. 예배 시작 전 안내에서도 마스크를 코 위까지 올려 달라고 당부했다. 또 찬양을 인도하는 이들 역시 대표자를 제외하고는, 모두 마스크를 착용하도록 했다. 5일 주일예배부터 실내에서 마스크를 벗어도 되지만, 아직은 이르다는 판단 때문이다. 한소망교회는 설교자와 찬양 인도자, 대표기도자 등 소수만 마스크를 벗을 수 있도록 했다. 실내 마스크 의무 착용 해제 첫 주일이었지만… 한소망교회뿐만이 아니다. 상당수 교회에서는 아직 실내 마스크를 해제하기에는 부담이 있는 듯보였다. 여의도순복음교회 역시 성찬을 진행했지만, 현장에서 성찬식을 진행할지, 집으로 가서 성찬을 할지는 교인 자율에 맡겼다. 경기도 용인에 있는 새에덴교회도 실내에서 마스크를 쓰도록 권고했다. 교인들도 실내 마스크 해제에 기대감을 나타냈지만, 실제로 마스크를 벗고 예배를 드리는 교인은 찾아보기 힘들었다. 마스크 착용이 익숙해지기도 했지만, 많이 모여 예배를 드리는 장소에서 마스크를 벗기에는 부담이 되기 때문이다. 하지만 실내 마스크 의무 해제에 대해서는 기대감을 드러냈다. 한소망교회 김여호수아 장로는 ""3년 여 만에 마스크를 벗게 돼 기쁘지만, 오늘 예배에서는 마스크를 벗지 않았다""며 ""당분간 마스크를 착용할 계획""이라고 말했다. 다만, ""마스크를 벗고 마음껏 찬양하는 날이 오기를 간절히 기대한다""며 ""교회 행사도 활발해질 것 같아 기대하고 있다""고 말했다. 방역당국이 지난달 31일부터 대중교통과 병원 등을 제외하고, 실내에서는 마스크를 착용하지 않아도 된다는 방침을 내렸다. 교회 등 종교 시설도 마찬가지로, 마스크를 의무적으로 착용하지 않아도 된다. 상당수 교회는 목장 모임과 구역 모임 등 소규모 모임에서는 마스크 착용을 의무화하지 않았지만, 주일예배와 수요예배 등에서는 마스크 착용을 권고하고 있다.  마스크 착용 해제를 전면 허용하기에는 이르다는 판단 때문이다. 교회는 특히 군중이 모여, 예배하고 찬양하고 기도하기 때문에 전염이 빠를 수 있다.대부분 교회, 예배 시에는 마스크 착용 권고 한소망교회 류영모 목사는 ""3년 여 동안 마스크를 착용하고 예배를 드려 불편했지만, 이제는 벗을 수 있게 돼 기쁘다""면서도 ""전면 해제는 조금 시간이 지나야 할 것으로 보인다""고 전망했다. 그러면서 ""이제는 현장 사역으로의 전환이 필요한 시점""이라고 강조했다. 류영모 목사는 ""교회는 모이는 이들의 공동체이기 때문에 현장 사역이 매우 중요하다""며 ""하지만 그렇다고 해서 온라인 사역을 버릴 수는 없다""고 말했다. 온라인과 오프라인이 균형을 맞춰가며 사역을 해야 할 시기라는 뜻이다. 3년 여 만에 실내 마스크 착용 의무 해제를 맞은 교회. 하지만 완전한 마스크 해제는 아직 시간이 더 필요한 듯보였다.※CBS노컷뉴스는 여러분의 제보로 함께 세상을 바꿉니다. 각종 비리와 부당대우, 사건사고와 미담 등 모든 얘깃거리를 알려주세요.이메일 : jebo@cbs.co.kr카카오톡 : @노컷뉴스사이트 : https://url.kr/b71afn"
2023.02.05.,"신세계백화점, 밸런타인데이 맞아 온라인 선물하기 기획전 진행",https://n.news.naver.com/mnews/article/421/0006612127?sid=101,"신세계백화점은 밸런타인데이를 맞이해 온라인 선물하기 기획전을 펼친다.(신세계백화점제공)(서울=뉴스1) 김진희 기자 = 신세계백화점은 밸런타인데이를 맞이해 온라인 선물하기 기획전을 펼친다고 5일 밝혔다.온라인 선물하기 서비스는 간단하고 편리하게 마음을 전할 수 있어 이용자가 지속적으로 늘어나는 추세다. 2016년 처음 선보인 'SSG닷컴 신세계백화점몰 선물하기' 서비스는 매년 2배 이상 매출이 뛰는 성장을 이뤄내고 있다.SSG닷컴 신세계백화점몰에서는 6~14일 신세계 바이어가 엄선한 브랜드 200여개를 모아 밸런타인데이 선물 고민을 단숨에 해결해 줄 인기 아이템을 추천해 준다. 화장품 장르는 선물하기 매출에서 절반 가까이 차지할 정도로 인기다. 부담 없이 주고받을 수 있는 10만원 이하 가격대의 화장품 물량을 30% 늘려 고객 수요 잡기에 나선다. 실내 마스크 의무 착용이 해제되면서 색조, 립스틱 등 인기 화장품도 대거 준비했다.대표 상품으로는 YSL 엉크르 드 뽀 쿠션 NEW 한정판 에디션 세트, 록시땅 리미티드 로즈 립 밤&로즈 핸드 듀오, SW19 3pm 핸드 케어 세트 등이다.발렌타인데이 특집으로 신백 라이브방송도 진행한다. 8일 오후 7시에는 신세계 단독으로 벨기에 명품 초콜릿 고디바 상품을 만나볼수 있다. 9일 오후 8시에는 로즈몽 라이브방송을 진행한다. 10만원 이상 구매 고객에게는 로즈몽 네트백을 선착순 30명에게 증정한다.오는 6~26일에는 선물하기 댓글 이벤트도 연다. 행사기간 중 SSG닷컴 선물하기를 이용하고 선물한 사연을 이벤트 페이지에 댓글로 남기면 추첨을 통해 다양한 선물을 증정한다.SSG닷컴 신세계백화점몰 선물하기 서비스는 고객이 선물하고 싶은 상품을 구매해 카카오톡이나 문자메시지로 전송하는 방식으로 선물카드도 작성할 수 있다. 배송지 설정은 받는 사람이 입력 가능하며 3일 이내 배송지를 입력하면 배송된다.신세계백화점 관계자는 ""밸런타인데이를 맞이해 신세계가 엄선한 인기 기프트는 물론 라이브방송까지 특별한 혜택을 마련했다""며 ""앞으로도 신세계만의 차별화된 콘텐츠를 키워 나가겠다""고 말했다."
2023.02.05.,[ZD 브리핑] 이번 주 꼭 챙겨봐야 할 뉴스,https://n.news.naver.com/mnews/article/092/0002281681?sid=105,"2억 화소 갤럭시S23 시리즈 사전판매 개시...SK온 적자 지속삼성전자가 지난 1일 공개한 플래그십 스마트폰 ‘갤럭시S23’ 시리즈를 이번주 7일부터 13일까지 사전 판매합니다. 공식 출시는 17일인데요, 2억 화소 카메라 센서를 장착한 이번 갤럭시S23에 대한 초기 반응은 전작보다 호의적이어서 사전 판매율에 대해 관심이 쏠리고 있습니다.갤럭시 S23 울트라 (사진= 삼성전자)SK이노베이션이 7일 실적 발표 앞두고 있는 가운데 선전하던 정유 부문도 국제유가 하락으로 영업손실이 1천428억원에 달할 전망입니다. 배터리 부문인 SK온도 적자 행진을 지속할 것으로 보입니다.산업부가 국산화와 공급망 강화를 위해 소재·부품 기술개발 사업 R&D 신규 과제를 1차 공고합니다.통신 3사, 지난해 재무 성과 빛났다통신 3사가 이번 주부터 미국에서 발표된 갤럭시S23 시리즈의 사전판매에 나섭니다. 롯데하이마트와 같은 유통가를 비롯해 통신사 대리점과 판매점에서도 신제품 공개 이전부터 잠재 소비자를 끌어모으기 위한 마케팅에 나선 가운데, 통신 3사가 본격적인 사전판매에 나선 뒤 국내에서 갤럭시S23 시리즈의 흥행을 점칠 수 있을 전망입니다.지난주 금요일 2022년 연간 실적 발표를 마친 LG유플러스에 이어 오는 8일과 9일에 SK텔레콤과 KT가 연간 실적을 공개합니다. KT의 경우 4분기 실적은 일회적인 인건비가 반영되겠지만, 두 회사 모두 연간 단위로 보면 견고한 실적을 내놓을 것으로 보입니다.카카오 2022년 성적표 공개...올해 대응 전략 관심지난해 매출 8조2천억원을 기록한 네이버에 이어 카카오의 2022년 연간 및 4분기 실적발표가 4일 예정돼 있습니다. 네이버와 마찬가지로 카카오는 역대 최대 매출을 기록하겠지만, 영업이익은 전년에 비해 소폭 감소할 것으로 보입니다.(사진=카카오)카카오의 지난해 실적 전망치는 매출 약 7조2천300억원, 영업이익은 약 5천900억원 입니다. 전년 매출 6조1천300억원 대비 1조원 이상 성장이 예상되지만, 영업이익은 100억원 정도 감소할 전망입니다.지난해 구체적인 성적표 공개와 더불어, 카카오의 올해 글로벌 경기 침체에 따른 대응 전략과 신규 사업 발표에도 관심이 쏠립니다. 네이버의 경우 올해 목표를 ‘역성장 방어’로 정하고 비용 효율화와 수익성 개선에 주력한다는 방침이어서 카카오 역시 비슷한 전략을 펼 것으로 예상됩니다. 나아가 생성형 인공지능(Generative AI) 검색 트렌드에 대한 카카오의 대응책에도 질문이 나올 것으로 관측됩니다.실내 마스크 착용 권고 1주일... 국회 머물러 있는 보건복지 법안들실내마스크 착용이 법정 의무에서 권고로 전환된 지 일주일이 지났지만 여전히 마스크를 착용하는 우리 국민들의 모습이 외국인들에게는 생경한 가 봅니다. 주요 외신이 마스크 착용 권고 전환 후에도 마스크를 벗지 않는 우리나라 분위기를 보도하며 화제가 됐는데요. 방역당국은 “긴장을 놓아선 안된다”는 입장을 강조하고 있습니다.실내 마스크 착용 의무가 해제된 30일 서울 종로구 하나투어 본사에서 직원들이 마스크를 벗고 업무를 보고 있다.  2023.1.30/뉴스1 © News1 신웅수 기자이번주 국회 보건복지위원회에서 보건복지부, 식품의약품안전처, 질병관리청 등의 업무보고가 예정돼 있습니다. 논쟁중인 보건복지 관련 법안들이 많은 만큼 험로가 예정돼 있는데요, 특히 법제사법위원회에 멈춰 있는 간호법 등이 본회의로 직행하려는 움직임이 있는 만큼 여야 갈등은 더욱 심해질 것으로 보입니다. 이와 함께 비대면 진료 등이 담긴 법안들이 이달 중순 상임위 법안심사를 거쳐 이달 말 예정된 상임위 전체회의에서 통과될지도 관심이 모이고 있습니다.크래프톤, 엔씨소프트 등 주요 게임사 실적 발표이번 주부터 주요 게임사의 지난해 성적표가 공개됩니다. 오는 7일 크래프톤을 시작으로, 엔씨소프트와 넷마블, 넥슨 등이 2022년 4분기 및 연간 실적 공시를 할 계획이기 때문입니다. 빅3 게임사 중 넥슨은 지난해 역대 최대 매출인 3조4천억 원을 넘어섰다고 추정됩니다. 엔씨소프트와 크래프톤, 카카오게임즈 등도 신작과 기존 서비스 작의 안정적인 인기를 토대로 추가 성장에 성공 했을지도 주목받고 있습니다.크래프톤 뉴스테이트 모바일, 총기 및 차량 밸런스 업데이트.원화마켓 운영 가상자산거래소들이 모인 디지털자산거래소공동협의체(DAXA)의 '페이코인' 유의 종목 지정 기간이 오는 6일까지입니다. 다날의 결제 서비스에 쓰인 페이코인은 지난달 금융 당국으로부터 사업자 신고 불수리 통보를 받아 유의 종목으로 지정됐는데요. 이후 상장 지속 여부에 대한 거래소들의 논의 결과가 발표될 예정입니다."
