기사날짜,기사제목,네이버 뉴스 url,기사내용
2023.02.05.,"與선관위, 김기현·안철수 등 후보자 적격 심사 통과…허은아도",https://n.news.naver.com/mnews/article/079/0003734287?sid=100,"연합뉴스국민의힘 선거관리위원회가 예비경선(컷오프) 진출자 명단을 5일 확정했다. 당대표·최고위원 후보에서 김세의 유튜브 가로세로 연구소 대표, '건희사랑' 강신업 회장 등이 모두 배제됐다.이날 국민의힘 선관위는 출마 선언자들을 대상으로 적격심사를 통해 부적격 후보자들을 걸러냈다고 밝혔다. 당대표 예비경선에는 김기현·안철수·윤상현·조경태·황교안 후보 등을 선정했다. 강신업 변호사 등은 탈락했다.최고위원 예비경선에는 김병민·김용태·김재원·문병호·민영삼 등 13명의 후보가 경쟁을 벌이게 됐다. 김세의·류여해·신혜식 등 후보는 고배를 마셨다. 반면 청년 최고위원 후보는 모두 예비경선에 진출하게 됐다.청년 최고위원 후보로는 신청자 전원이 예비경선에 진출한다. 선관위 관계자는 ""제출 서류, 국민 정서, 도덕성, 인지도 등을 종합 고려했다""고 밝혔다.특히 음주운전 전력이 문제가 됐던 허은아 최고위원 후보도 진출을 확정했다. 선관위 배준영 대변인은 ""2018년 12월 이후에 한 번이라도 (음주운전을 하면) 탈락시키고, 그 이전은 세 번이면 탈락시켰던 21대 공직 후보자 선출 기준에 준해서 평가했다""고 설명했다.선관위는 당원권 정지 중인 이준석 전 대표가 최고위원직에 출마한 김용태·허은아 후보의 후원회장직을 맡은 것은 문제가 없다고 판단했다. 배 대변인은 ""당원권이 정지된 자라도 특정 후보의 후원회 회원, 회장이 될 수 있다는 결론""이라며 ""선관위에서 만장일치로 추인했다""고 말했다.※CBS노컷뉴스는 여러분의 제보로 함께 세상을 바꿉니다. 각종 비리와 부당대우, 사건사고와 미담 등 모든 얘깃거리를 알려주세요.이메일 : jebo@cbs.co.kr카카오톡 : @노컷뉴스사이트 : https://url.kr/b71afn"
2023.02.05.,"경기도 특사경, 올해 국산 둔갑 해외수입품까지 수사 확대",https://n.news.naver.com/mnews/article/003/0011675215?sid=102,"기사내용 요약위조상품·수입품 원산지 허위 표시 행위 연중 집중 수사단속 현장 모습. (사진=경기도 제공) *재판매 및 DB 금지[수원=뉴시스] 박상욱 기자 = 경기도 공정특별사법경찰단은 해외에서 불법으로 밀수한 위조상품(상표법 위반)뿐만 아니라 국산으로 둔갑한 해외 수입품의 원산지 국가 거짓 표시(대외무역법 위반)까지 수사 범위를 넓혀 '짝퉁·원산지 허위표시' 상품 유통·판매 행위를 집중 수사할 계획이라고 5일 밝혔다.도 특사경은 서민 생활용품 등의 원산지 허위표시(대외무역법) 상품 판매행위의 경우 지난해까지 수사 사례가 없었으나 민생안정을 위해 올해부터 현장 밀착형 집중 수사를 진행할 예정이라고 설명했다.상표법 위반 행위 수사 대상은 ▲온·오프라인 쇼핑몰 개설 후 타인의 등록상표와 유사한 제품의 상표 유통·판매 ▲모바일 앱 이용한 회원 모집 및 위조 상품 판매행위 ▲사설 휴대전화 수리점 개설한 뒤 위조 부품 사용을 통한 부당이득 취득 ▲서민 건강에 해로운 품질의 위조 상품 유통 행위 ▲기타 상표법 침해 행위 전반 등이다.대외무역법의 원산지표시 위반 행위는 무역거래자 또는 물품 등의 판매업자가 ▲원산지를 거짓으로 표시하는 경우 ▲원산지표시를 손상하거나 변경하는 행위 ▲원산지를 오인하게 하는 표시를 하는 행위 ▲원산지의 표시 방법을 위반한 행위 ▲무역거래자가 원산지표시를 하지 아니하는 행위 ▲위반 물품을 수입 또는 판매하거나 타인에게 수입 또는 판매하게 하는 행위 전반 등이다. 예를 들면 중국산 조명기구·미용용품 등을 들여와 단순 재포장하는 수법을 통해 국산으로 속여 판매하는 행위 등이 이에 해당한다.도 특사경은 사회초년생, 대학생, 가정주부 등 범죄 대상이 되기 쉬운 수요층을 겨냥한 온·오프라인 판매에 수사역량을 집중하고, 필요할 경우 전문가의 감정을 받아 피해 사례를 수사할 계획이다.김광덕 공정특별사법경찰단장은 ""위조·원산지 허위표시 상품 판매·유통을 포함한 부정경쟁행위 근절을 위해 계속 노력하겠다""면서 ""점조직 형태로 은밀하게 거래되는 짝퉁·원산지 허위표시 상품의 유통 구조상 피해자 제보가 결정적 단서가 되는 만큼 적극적인 피해 사례 신고를 당부드린다""고 말했다.관련 제보는 경기도 특별사법경찰단 누리집(gg.go.kr/gg_special_cop), 카카오톡 플러스친구 경기도 공정특별사법경찰단, 경기도 콜센터(031-120) 등을 통해 가능하다.한편 도 특사경은 지난해 수사관과 명품 감별 전문업체(BPS. Brand Protection Service)를 투입해 '짝퉁' 제품에 대한 유통·판매행위를 집중 수사해 총 14억 원 상당 위조상품 2000여 점을 취급한 유통·판매업자 13명을 검거한 바 있다."
2023.02.05.,[단독] 창원 재투신 사망 사건 경찰·소방 대응 논란… 문제는 ‘매뉴얼’,https://n.news.naver.com/mnews/article/022/0003780468?sid=102,"경찰, 자살예방센터 연계 생략… 초동조처 미흡소방, ‘사후관리’ 방점 보건복지부 매뉴얼 준용경남 창원에서 발생한 투신 시도 40대 여성 구조 후 재투신 사망 사건과 관련해 자살시도자 대응을 두고 경찰뿐만 아니라 소방도 논란이 일고 있다.     자살 예방을 골자로 하는 각 기관의 매뉴얼이 제대로 작동하지 않거나 부실하다는 지적이 제기되면서다.     5일 경찰·소방에 따르면 지난 2일 창원시 진해구 한 아파트에서 40대 여성 A씨가 투신했다가 구조된 후 다시 투신해 숨지는 사건이 있었다.     지난 2일 경남 창원에서 발생한 투신 시도 후 구조된 40대 여성의 재투신 사망 사건과 관련해 경찰이 사과하고 있다. 강승우 기자    이 과정에서 경찰이 자살예방센터를 통한 연계 초동조처가 미흡했다는 지적이 나온다.     경찰청의 ‘보호조치 업무 매뉴얼’의 자살시도자 조치 대응을 보면 ‘자살시도자 신고가 접수되면 자살예방센터(정신건강복지센터)에 연락해 자살시도자와 상담을 할 수 있는 전문요원의 출동을 의뢰한다’고 돼 있다.     하지만 경찰은 이를 생략했다.     신고 접수 후 진해경찰서 여성청소년과·지구대 소속 경찰관 4명만 현장에 출동했다.     진해구 지역의 자살예방센터인 ‘진해정신건강복지센터’ 관계자는 “이 사건과 관련해 당시 경찰로부터 긴급 상담이나 현장 출동 요청 연락을 받은 것은 없다”고 말했다.     경찰의 대응 논란은 사후조치에서도 드러난다.     이 업무 매뉴얼의 사후조치를 보면 ‘자살시도자에 대한 급박한 위험이 해소된 후 재발 방지를 위해 인근 자살예방센터 상담을 의뢰하거나 정신과적 치료가 필요한 경우 정신의료기관으로 이송한다’고 돼 있다.     A씨는 1차 투신 후 구조된 뒤 40여분 간 대화하며 안정을 취했다고 경찰은 판단했다.     그렇다면 이때라도 자살예방센터에 A씨 구조 사실을 알려 협조를 구했어야 하는 게 아니냐는 것이다.     경찰은 위급한 상황인 만큼 그에 따라 적절하게 조처했다는 입장이다.     진해경찰서 여성청소년과 관계자는 “보호조치 업무 매뉴얼도 있지만, 사고 위험성이 높거나 행정 입원이 불가하다고 판단한 경우 경찰관이 직권으로 72시간 동안 강제입원 시킬 수 있는 ‘응급입원’ 조처가 현장의 급박한 상황에서는 우선할 수 있다고 판단한다”고 설명했다.     그러나 경찰의 이 같은 논리라면 ‘보호조치 업무 매뉴얼’에 따른 자살예방센터 연계 협업은 사실상 무용지물 아니냐는 우려가 나온다.     이 사건과 관련해 소방도 매뉴얼 대응 논란이 일고 있다.     소방은 경찰과 달리 자체 매뉴얼이 없으며, 보건복지부의 매뉴얼을 토대로 준용하고 있다.     이 매뉴얼의 근간이 되는 ‘자살예방법’이 지난해 개정됐는데, 이에 따라 자살시도자 등의 동의가 없어도 경찰과 소방이 자살예방센터에 관련 정보를 제공 할 수 있게 됐다.     그런데 문제는 이 매뉴얼은 자살시도자의 ‘사후관리’에 방점을 찍고 있다는 데 있다.     자살시도자 사건 특성상 애초 경찰(112)보다 소방(119)에 구조 요청 신고가 먼저 접수되는 점을 감안하면 소방도 신고 접수 후 자살예방센터와 연계하는 자체 사전 대응 조처가 필요하다는 지적이다.     자살시도자 신고의 자살예방센터요원 현장 연계 여부는 경찰이 판단하는데, 이번 사건처럼 경찰이 애초 이를 누락하거나 배제하는 경우도 있어서다.     창원소방본부 관계자는 “소방은 자살시도자 대응과 관련한 자체 매뉴얼이 없는데다 경찰의 사전 대응과 달리 사후관리에 초점을 맞추는 등 법과 현실 간 괴리가 크다”며 “매뉴얼 정비 등 관련 지침 개선이 필요하다”고 강조했다.      ※ 우울감 등 말하기 어려운 고민이 있거나 주변에 이런 어려움을 겪는 가족·지인이 있을 경우 자살예방 상담전화 ☎1393, 정신건강 상담전화 ☎1577-0199, 희망의 전화 ☎129, 생명의 전화 ☎1588-9191, 청소년 전화 ☎1388, 청소년 모바일 상담 ‘다 들어줄 개’ 어플, 카카오톡 등에서 24시간 전문가의 상담을 받을 수 있습니다."
2023.02.05.,'토큰 증권' 발행·유통 허용된다…'조각투자' 활성화 전망,https://n.news.naver.com/mnews/article/079/0003734195?sid=101,"금융위, '토큰 증권' 발행·유통 허용계획 발표""다양한 권리를 편리하게 증권화 해 유통 가능""'소규모 장외 유통 플랫폼'도 제도화 추진신종 조각투자 등 다양한 거래 가능 전망""토큰 증권도 '증권'…자본시장법 규율 대상""토큰 증권 발행·유통 규율체계 정비 방안. 금융위원회 제공자본시장 제도에 기반한 투자자 보호장치 테두리 내에서 토큰 증권 발행(STO)과 유통이 허용된다. 금융당국은 내년 중 현실화를 목표로 관련 법 정비를 추진하기로 했다. 수익권을 비롯해 기존 증권으로 발행되기 어려웠던 다양한 권리가 토큰 증권 형태로 발행, 유통되면서 다양한 거래가 가능해질 것으로 보인다. 금융위원회는 5일 이 같은 내용의 '토큰 증권 발행‧유통 규율체계 정비 방안'을 내놨다. 토큰 증권이란 분산원장(블록체인) 기술을 활용해 자본시장법상 증권을 디지털화 한 증권형 디지털자산이다. 현행 제도에서는 분산원장을 활용한 증권 발행은 불가했다. 부동산, 미술품, 지식재산권, 가축 등의 수익권을 비롯한 다양한 권리를 쪼개 투자를 할 때 적합한 방식으로 거론됐지만 허용되지 않았던 것이다. 때문에 이런 조각투자 대상이었던 수익증권과 투자계약증권은 사실상 유통 시장에서도 제외돼 왔다. 금융위가 이번에 내놓은 방안의 핵심은 법적으로 분산원장 기술을 증권의 발생, 변경, 소멸 관련 정보를 기재하는 공적 장부(公簿)의 기재 방식으로 인정해 이를 활용한 토큰 증권 발행을 허용하겠다는 내용이다. 다만 발행을 위해선 분산원장의 안정성 확보는 물론, 투자자 권리를 보호하기 위한 일정한 요건이 요구될 예정이다. 예컨대 복수의 참여자가 거래 기록을 확인 검증할 수 있어야 하며, 사후적 조작‧변경 방지 장치가 마련돼야 하는 등의 조건이 붙는다는 설명이다. 이렇게 발행된 토큰 증권은 기존 전자 증권과 동일하게 전자증권법상의 투자자 보호장치가 적용된다. 한국예탁결제원의 발행 총량 관리도 받게 된다. 발행인이 일정 요건을 갖추면 증권사 등을 통하지 않고 토큰 증권을 직접 발행하는 것도 허용된다. 기존 전자증권은 증권사 등을 통해서만 발행이 가능했다. 토큰 증권 직접 발행을 위한 요건은 ""법상 공적 장부를 기재‧관리하는 이에게 필요한 신뢰성, 전문성, 안정성 등을 고려해 정할 예정""이라고 당국 관계자는 설명했다. 만약 해당 요건을 갖추지 못한 경우 증권사 등의 지원을 받아 누구나 토큰 증권 발행이 가능하다. 발행 시 소액공모도 활성화 될 수 있도록 관련 제도 개편도 이뤄진다. 연합뉴스금융위 발표안에는 토큰 증권의 유통 플랫폼을 제도화하겠다는 내용도 담겼다. 토큰 증권 형태의 발행이 용이한 투자계약증권과 수익증권의 장외거래중개업무를 허용해 일반 소액투자자 대상 다자간 상대매매 중개가 이뤄지도록 하겠다는 방침이다. 소규모 '비상장' 증권 거래 플랫폼 형식으로, 사업자 인가를 받기 위해선 일정 규모 이상의 자기자본 등이 필요한데 구체 요건은 향후 정해질 예정이다. 이해충돌 방지를 위해 발행‧인수‧주선한 증권은 유통할 수 없다는 '발행‧유통분리 원칙'이 적용된다. 투자계약증권과 수익증권의 대규모 거래 플랫폼인 '디지털증권시장'도 한국거래소에 시범 개설된다. 이는 '상장 시장'으로, 토큰 증권의 경우 기존의 전자증권 방식으로 변환해 상장되며 한국거래소 회원사인 기존 증권사를 통해 거래가 이뤄진다. 금융위는 내년 중 토큰 증권 발행‧유통 활성화를 목표로 올해 상반기 전자증권법과 자본시장법 등 관련법 개정안을 국회에 제출하기로 했다. 금융위는 ""최근 출현한 다양한 권리의 증권을 소액 발행하는 경우엔 증권사를 통해 중앙집권적으로 관리되는 기존 전자 증권이 부적합해 새로운 발행 형태가 필요하다""고 제도 개편 추진 이유를 밝혔다. 다만 ""토큰 증권은 디지털자산 형태로 발행됐을 뿐 '증권'이므로 당연히 자본시장법의 규율 대상""이라며 ""어떤 형태를 하고 있든지 증권은 투자자 보호와 시장 질서 유지를 위한 공시, 인‧허가 제도, 불공정 거래 금지 등 모든 규제가 적용된다""고 강조했다.※CBS노컷뉴스는 여러분의 제보로 함께 세상을 바꿉니다. 각종 비리와 부당대우, 사건사고와 미담 등 모든 얘깃거리를 알려주세요.이메일 : jebo@cbs.co.kr카카오톡 : @노컷뉴스사이트 : https://url.kr/b71afn"
2023.02.05.,"핼러윈참사 국회추모제…與 ""책무 다할 것"" 野 ""대통령 왔어야""",https://n.news.naver.com/mnews/article/079/0003734251?sid=100,"핵심요약국회 '10.29 이태원참사 국회추모제' 與 ""집권여당 책무를 다할 것""野 ""국가가 유족 슬픔과 고통 방치""유족 분향소 설치 요구에 박홍근 ""서울시·여당과 상의할 것""5일 서울 여의도  국회 의원회관 대회의실에서 열린 10.29 이태원 참사 국회추모제에서 김진표 국회의장과 여야 지도부 등이 종교 추모의례에 맞춰 손을 모으고 있다. 앞줄 오른쪽부터 정의당 이정미 대표, 국민의힘 정진석 비대위원장, 더불어민주당 이재명 대표, 김 의장, 이종철 10.29 이태원참사 유가족협의회 대표. 윤창원 기자'핼러윈 참사'가 발생한 지 100일째 되는 5일, 국회에서 희생자를 기리는 추모제가 열렸다. 여당은 대책 마련을 약속했고 야당은 대통령과 여당의 책임 있는 자세를 촉구했다.이날 오전 국회 의원회관에서는 국회 이태원참사 국정조사특별위원회가 주최하고 국회 연구 단체인 생명안전포럼이 주관한 '10.29 이태원참사 국회추모제'가 열렸다. 이번 추모제는 여야 지도부를 비롯해 의원들이 대거 참여했다. 핼러윈 참사 유가족과 생존자, 지역 상인 등 관련자들도 참석해 목소리를 냈다.김진표 국회의장은 ""너무 늦은 정의는 정의가 아니란 말이 있다""며 ""진상을 밝히고 책임을 규명하며 재발 방지 대책을 세우는 것은 아무리 많은 세월 흘러도 피할 수 없는 일이다""고 강조했다.김 의장은 ""이제 국정조사가 마무리됐지만 참사를 기억하고 다신 이런 불행이 되풀이되지 않도록 대책을 세우는데 시한이 따로 있을 수 없다""며 ""국회가 유가족과 국민 여러분께 드리는 다짐을 제대로 실천할 수 있도록 의장도 살피고 노력하겠다. 두 번 다시 이런 어처구니없는 참사가 일어나지 않도록 제도적 문제점 해결에 힘을 모으겠다""고 다짐했다.5일 서울 여의도 국회 의원회관 대회의실에서 열린 10.29 이태원참사 국회추모제에서 종교 추모의례가 진행되고 있다. 윤창원 기자이재명 더불어민주당 대표는 ""그날 이후 유족에게 온 세상은 까만 잿빛이지만 대통령도, 정부도, 여당도 그 이전과 조금도 달라지지 않았다. 희생자 생명을 지키지 못한 국가는 유족의 슬픔과 고통을 방치하고 있을 따름이다""며 ""국가가 그날 무엇을 했는지 밝힐 책무가 정치에 있다""고 밝혔다.이어 ""이 자리에 대통령께서 직접 오셔서 희생자를 추모하고 유족을 위로해주셨으면 어땠을까""라며 ""국가는 국민의 생명에 무한 책임을 져야 한다는 점을 대통령과 정부여당은 꼭 명심하라""고 말했다.정진석 국민의힘 비상대책위원장은 ""정부와 집권여당은 사회적 참사에 무한책임이 있다""며 ""지난 100일간 피해자와 유가족 입장에선 미흡한 점이 적지 않았다는 것으로 안다. 국민의힘은 유가족과 함께 미래를 바라보면서 집권여당의 책무를 다하겠다""고 밝혔다.그러면서 ""159명의 못다 핀 꽃송이들이 밤하늘의 별이 돼 우리 마음에 영원히 기억될 수 있도록, 저희는 모든 책임 다하겠다""고 했다.정 위원장의 발언이 끝나자 일부 유족들은 ""각성하라"", ""반성하라"" 등의 구호를 외치기도 했다.5일 서울 여의도 국회 의원회관에서 열린 10.29 이태원 참사 국회 추모제에서 헌화를 마친  한 유가족이 슬퍼하고 있다. 윤창원 기자이날 행사에 참석한 참사 유가족 측은 진상 규명을 촉구하는 동시에 합동 분향소 설치를 요구했다. 참사 희생자인 고(故) 이지한 씨의 아버지 이종철 씨는 유족이 지난 4일 서울광장에 설치한 분향소를 서울시가 6일 오후 1시까지 자진 철거하라고 통보한 데 대해 ""저희가 치울 테니 많은 국화꽃으로 단장된 합동분향소를 만들어 달라""고 요청했다.이 대표는 ""서울광장 분향소를 철거하려 하면 휘발유를 준비해 놓고 아이들을 따라갈 것""이라며 ""철거하러 오는 순간 제2의 참사를 볼 것""이라고 경고했다.이에 대해 박홍근 더불어민주당 원내대표는 추모제 후 기자들과 만나 ""김진표 국회의장이 정부나 서울시를 설득해보자고 했다""며 ""주호영 원내대표에게 서울시와 긴밀하게 한 번 소통하고 상의해달라고 얘기를 한 상태""라고 밝혔다.그는 또 이 대표가 '제2의 참사'를 언급한 것에 대해선 ""결코 그런 극단적인 상황이 발생해서는 안 된다. 그런 것을 막는 것이 정치와 행정의 역할""이라며 ""결코 저 분들이 극단적 선택을 하지 않도록 서울시가 전향적으로 이 상황을 바라보고 거기 따른 대책을 제안해주길 바란다""고 요청했다.주호영 원내대표도 행사 후 '합동 분향소 설치'에 대한 기자들의 질의에 ""서울시와 협의하고 있는 것으로 안다. 저희도 알아보도록 하겠다""고 답했다.※CBS노컷뉴스는 여러분의 제보로 함께 세상을 바꿉니다. 각종 비리와 부당대우, 사건사고와 미담 등 모든 얘깃거리를 알려주세요.이메일 : jebo@cbs.co.kr카카오톡 : @노컷뉴스사이트 : https://url.kr/b71afn"
2023.02.05.,"""새마을금고·신협, 폐쇄적·차별적 조직문화 심각""",https://n.news.naver.com/mnews/article/079/0003734197?sid=101,"노동부, '기획감독' 결과 발표…""직장 내 괴롭힘, 성희롱, 성차별 등 다수 확인""연합뉴스고용노동부가 5일 새마을금고와 신협에 대한 '기획감독' 결과를 발표했다.이번 기획감독은 지난해 구즉신협과 동남원새마을금고 등에서 갑질과 성차별, 성추행 사건이 잇따른 것과 관련해 새마을금고와 신협 전반의 조직문화 점검을 위해 시행됐다.지난해 10월부터 지난달까지 새마을금고 37개소와 신협 23개소에 대해 직장 내 괴롭힘을 비롯한 노동관계법 위반 사항 등이 집중 점검됐다.감독 결과 총 297건의 노동관계법 위반 사항이 적발됐는데 이 가운데 5건은 직장 내 괴롭힘과 성희롱이었다.직장 상사의 여직원 머리 쓰다듬기, 손 만지기, 볼 꼬집기, 회식 장소에서 '백허그' 등이 확인됐고 ""무슨 생각을 하길래 머리가 많이 길었느냐"" 등 성적 수치심 유발 발언도 있었다.욕설과 폭언 등 직장 내 괴롭힘 신고자를 오히려 해고하고 지각 사유서 작성 시 부모 확인 서명을 요구하거나 부친에게 전화해 해임하겠다고 큰소리를 지른 사례도 드러났다.비정규직 근로자를 차별하거나 여성 근로자에게 불이익한 고용상 성차별 사례도 다수 확인됐다.기간제 근로자에게는 체력단련비와 가족수당 등을 합리적 이유 없이 미지급하고 정규직 근로자에게만 복리후생 규정을 적용하는 따위다.남직원에게는 1년에 50만 원씩 주는 피복비를 여성 근로자에게는 지급하지 않은 곳도 있었다.연합뉴스또, 연장·야간·휴일근로수당과 미사용연차수당 심지어 퇴직금을 미지급하는 등 총 829명에게 지급돼야 할 임금 9억 2900만 원이 체불된 사실도 확인됐다.임신 중인 여성 근로자에게 시간 외 근로를 시키는 등 모성보호 규정도 제대로 준수되지 않고 있었다.직원 설문조사에서는 직장상사 대학원 리포트 및 논문 대필, 자녀 학교 숙제 및 기타 폭언, 개인적인 심부름, 부부 중 한 명 퇴사 종용 등 하소연이 쏟아졌다.노동부는 기획감독에서 드러난 직장 내 괴롭힘 신고자 해고 등 법 위반 사항에는 사법처리 등 즉각적으로 조치하고, 시정 요구 사항은 이행 결과를 철저하게 확인할 방침이다.한편, 노동부는 지난달 전북 장수농협에서 30대 직원이 직장 내 괴롭힘을 호소하며 극단적 선택을 한 것 등과 관련해 농협과 수협 등 다른 중소금융기관으로 기획감독을 확대한다는 계획이다.※CBS노컷뉴스는 여러분의 제보로 함께 세상을 바꿉니다. 각종 비리와 부당대우, 사건사고와 미담 등 모든 얘깃거리를 알려주세요.이메일 : jebo@cbs.co.kr카카오톡 : @노컷뉴스사이트 : https://url.kr/b71afn"
