기사날짜,기사제목,네이버 뉴스 url,기사내용
2021.06.16.,"카카오엔터, 한국문학번역원과 MOU 체결",https://n.news.naver.com/mnews/article/001/0012463172?sid=106,<구조 다름>
2021.06.16.,네이버 시총 3위 탈환…카카오와 엎치락 뒤치락,https://n.news.naver.com/mnews/article/003/0010555039?sid=101,"[서울=뉴시스] 이승주 기자 = 코스피가 3일 연속 역대 최고치를 돌파하는 가운데 네이버가 시가총액 3위 자리를 탈환했다. 카카오는 4위로 다시 내려앉았다.16일 한국거래소에 따르면 NAVER(035420)는 오후 2시43분께 39만2000에 거래되고 있다. 이는 전일 대비 1.29% 오른 수치다. 이에 따라 NAVER는 카카오를 제치고 코스피 시총 3위를 기록했다.반면 카카오(035720)는 14만3000원으로 전일 대비 1.04% 하락하면서 시총 순위 4위로 집계됐다.카카오는 전일 네이버를 제치고 시총 3위에 오르며 IT대장주에 등극했다. 증권가는 카카오가 네이버보다 더 적극적으로 주주가치 제고를 위해 움직인 것이 유효했다고 분석했는데, 하루 만에 다시 역전된 것이다.앞서 카카오는 지난 7일부터 7일 연속 상승하며 사상 최고치 행진을 이어갔지만, 숨고르기 국면에 돌입한 것으로 분석된다. 전날 네이버도 동반 상승했지만 시총 4위에 머물렀다.한편 이날 코스피는 오후 2시46분께 기준 전일 대비 0.61% 오른 3278.45에 거래되고 있다. 지수는 사상 최고치였던 전일 보다 높은 3259.06에 출발한 뒤 한때 하락 전환하기도 했지만, 다시 상승하더니 오름폭을 키워갔다. 3일 연속 역대 최고치다.☞공감언론 뉴시스 joo47@newsis.com▶ 네이버에서 뉴시스 구독하기▶ K-Artprice, 유명 미술작품 가격 공개▶ 뉴시스 빅데이터 MSI 주가시세표 바로가기<ⓒ 공감언론 뉴시스통신사. 무단전재-재배포 금지>"
2021.06.16.,"'시총 63조' 카카오, IT 대장주 오른 3대 요인은?",https://n.news.naver.com/mnews/article/014/0004658388?sid=105,"슈퍼앱 전략-카카오공동체-김범수 의장""자회사IPO 후에도 카톡+e커머스 성장""  [파이낸셜뉴스] 카카오가 IT 대장주로 자리매김한 요인은 △슈퍼앱 전략 △카카오 공동체 △김범수 의장으로 꼽힌다.   카카오톡 하나로 게임, 쇼핑, 송금 등 디지털 라이프를 지원하는 한편 카카오커머스-카카오페이-카카오모빌리티 등 자회사 및 관계사 간 시너지를 극대화한 결과로 풀이된다. 또 카카오 창업자인 김범수 이사회 의장이 주도하는 공격적인 인수합병(M&A)과 신사업 투자확대도 한몫했다는 평가다.  카카오 CI  ■카톡 광고-e커머스 수익창구 16일 한국거래소 및 관련 업계에 따르면 카카오는 전 거래일보다 1.04% 내린 14만3000원에 마감했다. 종가기준 시가총액은 63조4819억원으로 코스피 종목 중 삼성전자, SK하이닉스, 네이버에 이어 4위다.   카카오 시총은 지난해 말 34조4460억원과 비교했을 때 6개월 만에 30조원 가까이 증가했다.   카카오가 시총 상위권에 진입하며 ‘국민주’로 거듭난 이유 중 하나는 ‘톡비즈(카카오톡 기반 광고)’이다. 올 1·4분기 기준 톡비즈 매출이 전년동기대비 61% 늘어난 3615억원으로 집계된 것. 즉 월간활성이용자(MAU)가 4600만을 넘어선 카카오톡을 슈퍼앱으로 키운 결과, 모바일 광고 수익창구 역할도 커지고 있다.   카카오는 또 카카오커머스, 카카오게임즈, 카카오페이, 카카오엔터테인먼트, 카카오모빌리티 등 업종별 자회사 및 관계사 기업가치도 끌어올리고 있다. 이른바 카카오 공동체 간 서비스를 융합해 시너지를 높이는 동시에 각각 대규모 투자유치도 강행하고 있다. 현재 카카오모빌리티 누적투자 유치금액은 약 9200억원에 달한다. 카카오페이와 카카오뱅크 IPO 착수도 호재다.    김범수 카카오 의장  ■'승부사 김범수' M&A 다각화 카카오가 급격히 불어난 기업 덩치와 달리 신사업을 빠르게 확대할 수 있는 핵심 DNA는 김 의장이다. 과거 포털 다음과 전략적 M&A를 비롯해 최근 북미 지역 웹툰·웹소설 업체 인수에 1조원 이상 투입한 것도 같은 맥락이다. 이에 따라 카카오는 M&A나 신규 투자 결정과정이 경쟁사 대비 매우 신속하게 이뤄지는 것으로 전해졌다.   다만 업계 일각에서는 카카오페이, 카카오뱅크 등 일부 자회사가 상장할 경우 카카오의 기업가치가 정체될 수 있는 우려도 나온다.   이에 대해 카카오 여민수 공동대표는 “카카오톡이라는 강력한 플랫폼을 보유한 카카오 본사가 주도하는 매출과 영업이익의 고성장은 지속될 것이기 때문에 전혀 우려하지 않고 있다”며 “카카오는 파트너 비즈니스에서 광고사업의 고성장세를 이어오고 있으며 향후에도 이러한 성장세를 유지시켜 나갈 계획”이라고 강조했다.   교보증권 박지원 연구원도 관련 보고서를 통해 “카카오는 주요자회사 IPO시에도 커머스 중심 비즈니스 확대는 장기적으로 카카오 주가를 이끌어갈 동력으로 작용할 것으로 기대한다”고 전망했다.  #카카오톡 #슈퍼앱 #시총4위   elikim@fnnews.com 김미희 기자   ▶ 날로먹고 구워먹는 금융이슈 [파인애플]▶ 모(毛)아 모아 [모아시스]▶ 헉! 소리나는 스!토리 뉴스 [헉스]  ※ 저작권자 ⓒ 파이낸셜뉴스. 무단 전재-재배포 금지"
2021.06.16.,카카오 그라운드X “NFT로 K-콘텐츠 널리 알릴 것”,https://n.news.naver.com/mnews/article/009/0004810239?sid=105,"16일 클레이튼 웨비나: NFT 플레이어 개최클립 내 '클립 드롭스' 오는 7월 출시 예정""클립 드롭스 통해 한정판 NFT 디지털 작품 소개할 것"" 카카오 블록체인 기술 계열사 그라운드X가 대체불가토큰(NFT) 생태계 확장에 본격적으로 나선 가운데 NFT 기술을 통해 K-콘텐츠의 해외 진출을 돕겠다는 포부를 밝혔다.한재선 그라운드X 대표(사진)는 16일 열린 ‘클레이튼 웨비나: NFT 플레이어’에서 “NFT를 발행하고 유통할 수 있는 최적의 블록체인 환경을 클레이튼을 통해 제공하고 있다”며 “K-콘텐츠가 클레이튼 기반 NFT 기술을 통해 해외로 진출하고 해외 시장을 선점할 수 있도록 돕겠다”고 말했다. 클레이튼은 그라운드X가 자체 개발한 퍼블릭 블록체인 플랫폼이다.NFT는 최근 가상자산 시장의 키워드로 꼽히며 크게 주목받고 있는 블록체인 기술이다. 토큰 하나의 가치가 완전히 동일한 비트코인과 같은 대체가능토큰(FT)과는 달리 한 개 당 가치가 모두 다른 토큰을 말한다. 쉽게 말해 소유권이나 판매 이력 같은 대체할 수 없는 고유의 값을 부여하기 위해 발행된 토큰으로 디지털 예술 작품이나 게임 아이템 등에 주로 활용되고 있다. 특히 지난 3월 비플이라는 작가가 제작한 NFT 기반 디지털 그림이 6930만달러(한화 774억원)에 팔려 NFT 기술에 높은 관심이 쏠린 바 있다.그라운드X 역시 NFT 기술의 가능성을 높게 평가하며 국내 NFT 생태계 활성화에 주력하고 있다. 그 일환으로 지난 5월 누구나 NFT를 발행할 수 있는 서비스 ‘크래프터스페이스’를 출시했으며 이를 글로벌 NFT 마켓인 오픈씨에서 거래할 수 있도록 지원 중이다.한 대표는 “NFT는 단순히 디지털 아이템을 랩핑해서 판매하는 수단이 아닌 더 큰 개념”이라며 “기존에는 어떤 아이템이든 복제가 가능해 온라인과 모바일에서 서비스를 제공하는 것이 한정적이었으나, NFT가 나온 후에는 어떤 디지털 콘텐츠든 온라인에서도 직접 판매할 수 있는 가능성이 생겼다”고 말했다. 이어 “NFT 기술을 통해 디지털 콘텐츠의 권리관계를 명확히 추정할 수 있기 때문에 디지털에서 가치를 가질 수 있는 모든 아이템이 NFT화 될 수 있다”며 “판매 방식 역시 지금처럼 일반 소비자 간 거래(C2C)가 아닌 다양한 형태로 판매될 것”이라고 전망했다.  특히 클립을 통해 NFT 기반 디지털 작품의 접근성을 높일 방침이다. 클립은 그라운드X가 지난해 6월 출시한 블록체인 기반 가상자산 지갑 서비스로 카카오톡 내 탑재돼 일반 사용자의 접근성을 높였다는 평가를 받는다. 구체적으로는 클립 내에서 새롭게 선보일 ‘클립 드롭스’를 통해 한정판 NFT 기반 디지털 작품을 전시하고 유통할 예정이다.김태근 그라운드X 팀장은 이날 발표에서 “최근 전세계적으로 NFT 기반 디지털 작품들이 유통되는 추세”라며 “디지털 작품임에도 불구하고 NFT를 적용했기에 원본 증명이 가능해 한정판 입증이 가능하며 소유 증명 또한 할 수 있어 컬렌션이 가능하다”고 설명했다. 이어 “그라운드X는 클립을 통해 NFT 기반 디지털 작품을 제공함으로써 일반 사용자의 접근성을 높이고자 한다”며 “이미 40곳의 기업들이 클립을 통해 6만 개의 디지털 작품을 NFT로 발행한 상태”라고 덧붙였다.지난 5월 공개한 ‘크래프터스페이스’와의 차이점도 언급했다. 김 팀장은 “크래프터스페이스는 누구나 참여해 NFT를 발행할 수 있는 서비스지만, 클립 드롭스는 사전 협의해 초청받은 작가들이 발행한 한정판 디지털 작품을 큐레이션 해 소개하고 구매를 돕는 서비스”라고 구분했다. 그러면서 “정교화된 큐레이션을 통해 한정판 디지털 작품을 소개하고 이를 통해 콘텐츠 및 예술 경험의 확장과 진화를 돕고 싶다”며 “나아가 새로운 작가를 후원하거나 팬덤 채널을 구축하고, K-아트와 K-콘텐츠의 육성 및 글로벌화를 추진하겠다”고 강조했다.클립 드롭스는 오는 7월 중 출시될 예정이며 자세한 내용은 이날 공개된 티징 페이지에서 확인할 수 있다. 그라운드X는 향후 기존에 공개한 크래프터스페이스와 클립 드롭스의 연계도 추진 중이다.[이지영 디스트리트 기자]▶ '경제 1위' 매일경제, 앱으로 편하게 보세요▶ 매일경제 지식레터 '매콤달콤' 받아보세요▶ 매경이 알려주는 '취업비법' 한달간 무료[ⓒ 매일경제 & mk.co.kr, 무단전재 및 재배포 금지]"
2021.06.16.,‘플랫폼’ 네이버 vs ‘플레이어’ 카카오…빅테크 금융대전,https://n.news.naver.com/mnews/article/028/0002548803?sid=101,"카카오, 은행·보험 뛰어들어 시장 흔들어 네이버, 플랫폼기업 정체성 지키며 금융 확장네이버와 카카오 본사.  네이버와 카카오의 시가총액이 엎치락뒤치락 하고 있다. 지난 15일에는 처음으로 카카오가 네이버 시총을 앞질렀다가 16일에는 네이버가 다시 시총 3위에 올랐다. 카카오가 빠르게 덩치를 키우는 배경에는 금융 자회사들의 몸집 불리기 영향이 있다. 네이버와 카카오는 빅테크 기업의 금융 진출이라는 점에서 같지만, 접근 방식에서는 확연한 차이가 나타난다. 네이버는 기존 금융사들과 제휴하거나 혁신금융으로 지정받는 방식으로 서비스를 넓혀가지만, 카카오는 영업 허가를 받아 직접 뛰어들어 시장을 흔드는 전략을 쓴다.  금융시장 지배력을 빠르게 높이는 쪽은 카카오다. 카카오는 금융 자회사로 카카오페이(송금·결제 등)와 카카오뱅크(은행)를 뒀다. 카카오페이의 자회사로 카카오페이증권, 지난 9일 보험업 예비허가를 받은 카카오손해보험이 있다. 카카오페이와 카카오뱅크는 자본 확충을 위해 기업공개(IPO)를 추진 중이다.     카카오는 플랫폼을 통해 기존의 금융서비스를 중개·제공하는 역할로는 금융혁신에 한계가 있다고 설명한다. 카카오페이증권은 현재 동전 모으기, 소액펀드처럼 투자 경험이 적은 이들을 대상으로 한 소액투자 상품을 내놓고 있다. 카카오손해보험도 생활밀착형 보험을 판매하겠다는 계획으로 금융위원회의 예비허가를 받았다. 카카오페이 관계자는 “기존의 상품을 사용자들이 쉽고 편리하게 이용하는 것으로는 상품 간 혁신을 일으킬 수 없다”며 “우리가 라이선스를 받아 뛰어들어 기존 금융사가 소홀히 다룬 소비자들의 요구를 충족하는 역할을 할 수 있을 것으로 본다”라고 말했다. 카카오가 ‘플레이어’로서 활동 무대를 넓히는 반면 네이버는 ‘플랫폼’ 기업으로서 정체성을 유지하면서 서비스 영역을 확장한다. 기존 규제 영역에 들어오지 않고 정부의 혁신금융으로 지정받아 사업을 펼치는 방식이다.  네이버의 금융 자회사인 네이버파이낸셜은 금융위원회의 규제 샌드박스(규제 유예)에 선정돼, 스마트스토어 사업자를 대상으로 한 신용대출을 하고 있다. 네이버파이낸셜이 자사 데이터를 바탕으로 신용평가를 하면 미래에셋캐피탈이 대출을 내어주는 식으로 운영된다. 지난해 12월 신용대출 출시 이후 간이사업자 등 기존 금융회사에서 대출받기 어려웠던 중소기업·소상공인들이 평균 5.7% 금리로 대출을 받았다. 네이버는 “금융소외계층인 온라인 소상공인을 포용하는 노력으로 판매자들이 성장하고 구매자 혜택으로 이어지는 선순환 구조를 만들었다”고 설명했다.  네이버는 검색엔진에서 출발했기 때문에 자사 플랫폼 안에 방대한 데이터를 수집하고 이를 분석하는 기술이 강하다. 카카오처럼 여러 계열사를 두지 않는 것은 네이버파이낸셜을 통해 데이터를 한곳에 집적해 서비스를 고도화하려는 취지로 볼 수 있다. 은행 등 사업에 직접 뛰어들지 않고 기존 금융사와 제휴하는 방식을 쓰는 것은 ‘금융기업’보다는 ‘금융플랫폼 기업’으로서 사업 역량을 강화하려는 전략적 판단이라고 네이버는 설명한다.   카카오는 카카오톡이라는 모바일 메신저를 통해 사람 간 연결에 강점을 갖고 있다. 신사업에 빠르게 진출하면서 각 사업간 시너지 효과도 극대화할 수 있다. 정유신 서강대 교수는 “메신저 대화 참가자는 언제든지 소비자와 생산자가 될 수 있다. 카카오는 이런 연결과 융합에 능하기 때문에 다양한 비즈니스 모델을 만들 수 있고, 최근 플랫폼 경쟁이 본격화되면서 잠재적 가치를 인정받고 주가가 빠르게 올라가고 있다”고 평했다. 정 교수는 그러면서도 “네이버는 데이터 분석, 인공지능 분야에서 상당히 강하기 때문에 마이데이터 사업이 시작되면 카카오와 유사한 서비스를 제공할 수 있을 것”이라고 말했다. 이경미 기자 kmlee@hani.co.kr▶벗 덕분에 쓴 기사입니다. 후원회원 ‘벗’ 되기▶33살 한겨레 프로젝트▶‘주식 후원’으로 한겨레의 벗이 되어주세요![ⓒ한겨레신문 : 무단전재 및 재배포 금지]"
2021.06.16.,"‘쇼핑 공룡’ 네이버 몸집 더 키우는데…카카오, 텃밭 ‘선물하기’로 장기전 준비",https://n.news.naver.com/mnews/article/366/0000733957?sid=105,"네이버, 이마트와 이베이코리아 인수 유력카카오 “카톡 기반 관계형 커머스에 집중” 카카오-커머스 합병으로 카톡-쇼핑 연계 강화배송 선물·구독 등 외연 확장 움직임카카오톡 하단 탭에 배치된 카카오커머스 쇼핑 플랫폼. /카카오커머스 제공        ‘쇼핑 공룡’ 네이버가 이베이코리아 공동 인수로 몸집을 더 키우게 됐다. 이커머스(전자상거래) 시장 점유율 격차가 더 벌어진 카카오는 우선 자신의 텃밭인 선물하기 등 ‘관계형 커머스’ 시장부터 재정비한 후 장기전을 준비하겠다는 전략을 세웠다.16일 유통업계에 따르면 이마트와 네이버는 이베이 본사로부터 며칠 내 이베이코리아 인수 계약을 진행하자는 통보를 받은 것으로 알려졌다. 이미 국내 이커머스 1위인 네이버는 이마트와 연합해 점유율을 더 높이게 된다. 지난해 거래액 기준 점유율은 네이버가 18%, 쿠팡 13%, 이베이코리아 12%, 이마트(SSG닷컴)와 카카오가 각각 3%였다. 이베이코리아 인수 후 이마트-네이버 연합의 점유율은 33%가 된다.네이버와 함께 양대 빅테크로 불리지만 쇼핑에서만큼은 유독 열세였던 카카오 입장에선 안 그래도 높았던 네이버라는 산이 더 높아진 셈이다. 앞으로의 이커머스 전략에 대해 카카오는 “우리의 고유 영역인 카카오톡 기반의 관계형 커머스에 우선 집중할 계획이다”라고 답했다. 관계형 커머스는 여러 사람들이 서로 선물을 주고받거나 공동 구매하는 방식의 이커머스다. 국민 메신저 카카오톡을 앞세운 카카오가 이 시장에서만큼은 네이버보다 우위를 차지하고 있다.국내 선물하기 시장 규모는 지난해 거래액 기준 3조5000억원이었다. 이 중 카카오가 3조원을 차지하며 사실상 독점하고 있다. 비대면 선물 문화의 확산으로 시장 규모가 전년(2019년)보다 52% 성장했고, 카카오의 올해 1분기 거래액도 지난해 1분기보다 54% 늘었다.네이버의 추격도 만만치 않다. 지난달 홈페이지와 모바일 애플리케이션(앱)에 ‘선물샵’이라는 주제판을 만들어 최신 트렌드, 특정 기념일, 계절, 성별, 연령 등에 따른 맞춤 선물을 이용자들에게 추천해주기 시작했다. 이미 국내 최대 규모의 이커머스 플랫폼 네이버쇼핑에 구현돼 있지만 카카오톡에 밀렸던 선물하기 기능을 활성화하기 위함이었다. 네이버는 선물하기 거래액을 밝히지 않고 있지만, 지난달 거래액이 선물샵 론칭 직전인 전월(지난 4월)보다 2.3배 증가한 것으로 추정된다.카카오에 선물하기 시장은 급성장 중인 이커머스의 한 축이자 네이버에 맞서 이커머스 전체 시장으로 진출하기 위한 교두보인 만큼, 네이버에 우위를 빼앗겨서는 안 되는 영역이다.그래픽=정다운        이런 상황에서 최근 카카오는 3년 전 분사시켰던 이커머스 전문 자회사 카카오커머스를 이르면 3분기에 다시 본사의 사내독립기업(CIC)으로 합병하기로 했다. 카카오 관계자는 “양사의 (이커머스) 시너지를 극대화하기 위한 다양한 방안을 검토하고 있다”고 말했다. 카카오커머스는 이미 카카오톡을 통해 쇼핑 사업을 벌이고 있는 만큼, 합병을 통해 카카오톡 이용자를 쇼핑으로 유입하기 위한 새로운 전략을 마련하겠다는 취지로 풀이된다. 현재 카카오톡 이용자는 앱 하단의 쇼핑 탭, 입점 업체들이 카카오톡 채널, 모바일 교환권(기프티콘 발송) 등을 통해 추가 앱 설치 없이도 쇼핑을 할 수 있다.카카오는 선물하기 시장에서 입지를 강화하기 위해 기프티콘을 넘어 실물 배송 상품도 선물할 수 있는 기업 간 거래(B2B) 서비스 ‘선물하기 for Biz’를 최근 출시했다. 기프티콘과 달리 실물 상품은 구매 과정에서 받는 사람의 주소를 입력해야 해서 이용에 불편한 점이 있었는데, 카카오톡 채널을 가진 기업이나 개인 사업자에 한해서는 주소 입력 없이 서로의 채널 선택만으로 실물 선물을 주고받을 수 있다. 현재 선물 가능한 품목은 건강식품·리빙·뷰티·스포츠 등 분야에서 약 500여종이다.카카오는 선물하기 외, 카카오톡 친구 2명 이상이 함께 구매하면 할인 혜택을 주는 톡딜, 여러 사람이 선주문하면 제작하는 방식으로 싸게 구매할 수 있는 카카오메이커스, 카카오톡 오픈채팅과 연계한 라이브커머스(생방송 쇼핑) 등 다른 관계형 커머스도 성장세에 있다며 서비스를 확대해 나가겠다는 방침이다.카카오는 전날 ‘구독ON’이라는 구독 쇼핑 서비스를 시작했다. 식품, 가전 등 실물 상품이나 청소, 세탁 등 무형의 서비스를 정기 구독 방식으로 구매하는 이커머스 플랫폼이다. 이 역시 기존 쇼핑처럼 카카오톡 내 마련된 메뉴를 통해 접속하고 이용할 수 있다. 최근 네이버가 네이버쇼핑 이용 시 혜택을 주는 ‘네이버플러스 멤버십’을 가족·지인과 공유할 수 있게 함으로써 쇼핑 이용자 신규 유입을 꾀하자, 카카오도 구독 서비스를 들고나온 것이다.[김윤수 기자 kysme@chosunbiz.com] ▶네이버에서 '명품 경제뉴스' 조선비즈를 구독하세요▶강남권 오피스 임대료 쑥 올린 '역삼동 건물'의 정체▶""코로나 끝나면 주가 내려갈라"" 바빠진 바이오 기업들	저작권자 ⓒ 조선비즈, 무단 전재 및 재배포 금지"
2021.06.16.,"현대차證 ""카카오, 밸류에이션 높지만 당분간 상승…목표가↑""",https://n.news.naver.com/mnews/article/421/0005417234?sid=101,"© News1 최수아 디자이너(서울=뉴스1) 강은성 기자 = 현대차증권은 사상 처음으로 네이버 시가총액을 역전한 카카오가 단기간 급등에 따른 부담에도 불구하고 당분간 견조한 '우상향'을 보일 것이라고 전망했다. 김현용 현대차증권 연구원은 16일 ""카카오의 목표주가를 종전보다 28% 상향한 16만원으로 제시한다""면서 ""카카오는 이익 규모에서 네이버에 비해 여전히 체급 차이가 존재함에도 불구하고 카카오톡을 기반으로 하는 플랫폼 확장성과 이익 성장률에서의 차별화를 무기로 높은 주가를 유지하고 있다""며 ""2분기 실적 가시성이 높고, 핵심 자회사들의 기업공개(IPO)가 목전으로 다가온 만큼 높은 밸류에이션에도 불구하고 당분간은 견조한 주가 우상향을 예상한다""고 전망했다. 김 연구원은 카카오의 실적에 대해 2분기 매출 1조3252억원, 영업이익 1829억원으로 시장 기대치를 소폭 상회할 것이라고 내다봤다. 다만 당분간은 콘텐츠, 금융, 모빌리티 등 고성장 부문에 대해서는 비용지출이 다소 있더라도 외형 확대를 동반한 시장지배력 확보 전략을 우선시할 것이라고 예상했다. 카카오 금융은 간편결제, 금융서비스뿐만 아니라 증권·보험 등 종합 금융투자서비스업을 지향하고 있으며, 인터넷전문은행인 카카오뱅크까지 갖추고 있어 네이버와 비교해 확실한 경쟁우위를 갖춘 것으로 판단하며 콘텐츠도 웹툰·웹소설에서 상대적으로 약세였던 해외 진출이 6월부터 가시적인 결실을 맺고 있다고 김 연구원은 평가했다. 그는 ""목표주가 상향은 2분기 온라인 광고 업황의 성수기 진입 및 수요 회복에 따라 실적 전망치를 올렸고, 1등의 경쟁력을 확보한 금융 및 콘텐츠 사업부문에 대한 평가가치를 상향한 점에 기인한다""면서 ""카카오페이, 카카오뱅크 등 금융사업 자회사의 상장이 임박했고, 구독서비스 론칭으로 서비스 플랫폼 간 영업 시너지 및 고객 록인효과가 본격화되며, 콘텐츠 사업의 해외진출 성과가 하반기 가시화될 전망이기 때문에 당분간 주가는 견조하게 우상향할 것""이라고 했다.esther@news1.kr▶ 네이버 메인에서 [뉴스1] 구독하기!▶  뉴스1&BBC 한글 뉴스 ▶  코로나19 뉴스 © 뉴스1코리아(news1.kr), 무단 전재 및 재배포 금지"
