기사날짜,기사제목,네이버 뉴스 url,기사내용
2021.06.17.,"코스피, 美 조기 금리인상 가능성에 장 초반 하락세(종합)",https://n.news.naver.com/mnews/article/001/0012465884?sid=101,"코스피, 오늘은 하락 출발(서울=연합뉴스) 홍해인 기자 = 17일 오전 서울 중구 을지로 하나은행 본점 딜링룸 현황판에 코스피, 원/달러 환율, 코스닥 지수가 표시돼 있다. hihong@yna.co.kr    (서울=연합뉴스) 박원희 기자 = 미국의 금리 인상 시기가 앞당겨질 것으로 전망되면서 코스피는 17일 장 초반 하락세를 보였다.    이날 오전 9시 15분 현재 코스피는 전날보다 20.88포인트(0.64%) 내린 3,257.80이다.    지수는 전장보다 2.48포인트(0.08%) 낮은 3,276.20에서 출발해 하락하고 있다.    유가증권시장에서 기관이 1천482억원, 외국인이 588억원을 각각 순매도했다. 개인은 2천63억원을 순매수했다.    16일(현지시간) 뉴욕증시에서는 다우존스30 산업평균지수(-0.77%), 스탠더드앤드푸어스(S&P)500 지수(-0.54%), 나스닥 지수(-0.24%)가 연방공개시장위원회(FOMC) 정례회의 결과에 영향을 받아 일제히 내렸다.    미 연방준비제도(Fed·연준)는 16일(현지시간) FOMC 정례회의에서 기준금리를 0.00~0.25%로 동결했다.        연준은 별도로 내놓은 점도표(dot plot)에서 2023년 두 차례 금리 인상이 이뤄질 것으로 전망했다. 이는 2023년까지 제로금리 수준을 유지할 것이라는 기존 입장보다 인상 시점이 앞당겨진 것이다. 점도표는 FOMC 위원들의 향후 금리 전망을 보여주는 지표다.     제롬 파월 연준 의장은 기자회견에서 ""테이퍼링(자산매입 규모 축소) 문제를 논의할지에 대한 논의가 있었다고 볼 수 있다""며 매우 조심스럽게 언급했다.       연준은 올해 물가상승률 전망치를 지난 3월 예상한 2.4%에서 3.4%로 대폭 상향 조정했다. 또 올해 경제성장률 전망치도 6.5%에서 7%로 높였다.    이에 미국 국채 금리가 급등하고 달러화는 강세를 나타냈다.    서상영 미래에셋증권 연구원은 ""연준이 인플레이션 전망을 크게 상향 조정하고 금리 인상 시기를 조정한 점은 (국내 증시에) 부담""이라며 ""달러화 강세가 뚜렷하게 진행된 점도 외국인 수급에 부담으로 작용할 것""이라고 진단했다.    전날 종가와 장중 최고치를 갈아치운 코스피는 이날 장 초반 하락하며 전날의 상승 폭을 대부분 반납했다.    시가총액 상위권에서는 LG화학(3.34%)을 제외하고 SK하이닉스(-2.32%), 삼성전자(-1.22%), 기아(-1.12%), 카카오(-1.05%) 등 상위 10개 종목 대부분이 하락하고 있다.    업종 중에서는 전기·전자(-1.31%), 철강·금속(-1.09%), 증권(-1.02%), 운송장비(-0.84%), 유통업(-0.64%) 등의 낙폭이 상대적으로 크다.    같은 시간 코스닥지수는 전날보다 1.07포인트(0.11%) 내린 997.42다.    지수는 전장보다 0.22포인트(0.02%) 낮은 998.27로 개장해 약세 흐름을 이어가고 있다.    코스닥시장에서도 기관과 외국인이 각각 284억원, 116억원을 순매도했다. 개인은 450억원을 순매수했다.    시총 상위 종목 중에서는 카카오게임즈(-2.29%), 알테오젠(-1.70%), 펄어비스(-1.41%) 등이 내리고 에이치엘비(2.42%), SK머티리얼즈(1.42%), 에코프로비엠(1.13%) 등은 오르고 있다.    encounter24@yna.co.kr▶네이버에서도 뉴스는 연합뉴스[구독 클릭]▶[팩트체크]대법원이 김학의 뇌물죄 '무죄취지' 판결?▶제보하기<저작권자(c) 연합뉴스(https://www.yna.co.kr/), 무단 전재-재배포 금지>"
2021.06.17.,"파리바게뜨, 민초맛·쿠키맛 반반 케이크 출시",https://n.news.naver.com/mnews/article/277/0004921695?sid=101,"사진=파리바게뜨[아시아경제 문혜원 기자] 파리바게뜨는 신제품 ‘민초반 쿠키반 케이크’를 출시했다고 17일 밝혔다.케이크는 ‘민초단’(민트초코 맛을 좋아하는 사람)과 ‘반(反)민초단’(민트초코 맛을 싫어하는 사람) 모두 만족할 두 가지 맛을 반반씩 구성한 제품이다. 폭신한 초코 시트 반은 상쾌하고 시원한 맛의 ‘민트초코크림’으로, 나머지 반쪽은 달콤한 맛이 배가된 ‘쿠키앤크림’으로 구성했다.파리바게뜨는 앞서 ‘민트초코’를 활용한 디저트 제품들을 다양하게 구성한 ‘쿨 민초 컬렉션’을 선보이며 민초단으로부터 뜨거운 호응을 얻었다. 파리바게뜨 관계자는 “기존에 선보인 쿨 민초 컬렉션이 큰 인기를 얻으며 이번에는 민초단과 반민초단의 취향을 골고루 고려한 재미있는 콘셉트의 신제품을 출시하게 됐다”며 “앞으로도 MZ세대와 소통할 수 있는 제품과 마케팅을 선보이기 위해 노력할 것”이라고 말했다.한편 파리바게뜨는 오는 23일 저녁 7시30분부터 90분간 카카오커머스가 운영하는 ‘카카오쇼핑라이브’ 방송에서 쿨 민초 컬렉션을 소개하고 다양한 혜택을 제공할 예정이다.문혜원 기자 hmoon3@asiae.co.kr▶ 속 시원한 풀이! 2021년 정통사주·운세·토정비결▶ 전공 무관 '빅데이터', '인공지능' 취업 교육 모집▶ 투자 성공의 핵심은 기업분석! 'CORE' 바로가기<ⓒ경제를 보는 눈, 세계를 보는 창 아시아경제 무단전재 배포금지>"
2021.06.17.,"'간 떨어지는 동거' 한지은, 특별 출연의 좋은 예",https://n.news.naver.com/mnews/article/018/0004960100?sid=106,<구조 다름>
2021.06.17.,"통신 대장주 격돌… SKT vs KT, 반등랠리 누가 더 셀까",https://n.news.naver.com/mnews/article/014/0004659222?sid=101,"인적분할 예고한 SKT 큰폭 상승시총 28조5000억 전망도 나와IPO 앞둔 KT도 상승여력 충분하나證 “연내 4만원 돌파 가능성”  오랫동안 침묵했던 통신주가 최근 반등 랠리를 펼치고 있는 가운데 SK텔레콤과 KT가 통신 대장주 자리를 두고 격돌하고 있다. 업계에서는 최근 주가상승률과 배당 측면에서 SK텔레콤이 압도적이지만 저평가된 KT 역시 추가 주가 상승 여력이 상당하다고 예상했다.   ■신사업 확대·사업구조 재편에 SKT-KT 주가 '랠리'   17일 한국거래소에 따르면 올들어 이날까지 SK텔레콤은 연초 대비 37.60% 상승했고 KT는 36.87% 올랐다. 전날 기준 시가총액은 23조6357억원으로 KT(8조4470억원)보다 세 배 가까이 덩치가 크다.   국내 통신주는 그동안 주가 움직임이 적어 투자자들로부터 소외됐었다. 지난해 코스피지수가 30.8% 뛸 정도로 불장이 연출됐지만 SK텔레콤은 0%로 변화가 없었고, KT는 오히려 11.1% 빠졌다.   올 들어 두 업체가 경쟁적으로 신사업 확대와 사업 구조 재편을 단행하면서 그동안 짓눌렸던 주가가 날아오르기 시작했다.   SK텔레콤은 지난 10일 그간 숙원 사업이었던 인적분할 계획을 공개했다. 약 6대4 비율로 존속 회사(SK텔레콤)와 신설 회사(SKT신설투자)로 기업을 쪼개기로 했다. 통신업에 가려져 제대로 몸값을 인정받지 못했던 자회사들의 가치를 부각하기 위해서다.   기존 한 주를 5개로 나누는 액면 분할도 확정했다. 이를 통해 소액주주 비중이 크게 늘어나면 누구든지 쉽게 접근할 수 있는 '국민주'로 탈바꿈할 예정이다.   일각에서는 인적분할 이후 SK텔레콤의 시가총액이 현재 24조원에서 28조5000억원까지 불어날 수 있다는 장미빛 전망이 나온다.   KT 역시 콘텐츠 기획·제작·유통을 총괄하는 자회사 스튜디오지니를 설립해 자체 미디어 생태계를 구축하겠다는 큰 그림을 공개했다. 2023년까지 자체 지적재산권(IP)을 1000개 이상 확보해 통신업에 대한 의존도를 낮추겠다는 구상이다. 최근에는 케이뱅크 상장으로 인한 지분 가치 재평가 기대도 높아지고 있다.   ■SK텔레콤-KT 주가 누가 더 오를까   향후 어떤 기업의 주가가 더 높이 날지에 대해서는 전망이 엇갈린다. 올들어 주가 상승폭만 비교하면 SK텔레콤(38.65%)이 KT(36.45%)를 다소 앞서고 있다.   전문가들은 최근 인적분할을 발표한 SK텔레콤의 강한 상승 가능성을 점치고 있다. 인적분할을 발표한 뒤 지난 10~16일 외국인은 176억원, 개인은 361억원을 순매수하며 SK텔레콤 주가를 끌어올리고 있다.   정지수 메리츠증권 연구원은 ""존속법인이 보유한 높은 배당 수익률(4.9%)과 SK하이닉스와의 시너지가 기대되는 신설법인의 반도체 부품·장비 영역 투자 포트폴리오 매력을 감안할 때 최근의 주가 상승은 정당하다는 판단""이라며 ""시장이 주목하고 있는 구독형 서비스와 메타버스 서비스가 출시되는 오는 7월까지 주가 상승 모멘텀은 이어질 전망""이라고 밝혔다.   반면 상대적으로 저평가돼있고 기업공개(IPO) 이슈가 있는 KT의 추가 상승 여력이 더 높다는 분석도 있다.   김흥식 하나투자증권 연구원은 ""카카오뱅크가 IPO를 앞두고 있는 만큼 케이뱅크와 미디어컨트롤타워 IPO 이슈도 부각될수 있고 스튜디오지니 가치 부각을 기대한 KT 투자가 훨씬 나을 듯하다""며 ""KT는 올해 주당배당금이 1600원이 유력하고 기대배당수익률 4%까지 내려갈 수 있음을 감안하면 연내 4만원 돌파 가능성이 높다""고 전했다.  sjmary@fnnews.com 서혜진 기자 ▶ 날로먹고 구워먹는 금융이슈 [파인애플]▶ 모(毛)아 모아 [모아시스]▶ 헉! 소리나는 스!토리 뉴스 [헉스]  ※ 저작권자 ⓒ 파이낸셜뉴스. 무단 전재-재배포 금지"
2021.06.17.,"경기도, 기간제 노동자 비대면 응시원서 접수",https://n.news.naver.com/mnews/article/417/0000705209?sid=102,"코로나19 이후 ‘디지털 대전환’에 앞장서고 있는 민선7기 경기도가 올해 행정 혁신의 일환으로 경기도 일자리재단과 함께 총 1억1400만원을 투자해 ‘기간제 스마트 채용 통합 접수시스템’ 구축에 나선다. / 사진제공=경기북부청코로나19 이후 ‘디지털 대전환’에 앞장서고 있는 민선7기 경기도가 올해 행정 혁신의 일환으로 경기도 일자리재단과 함께 총 1억1400만원을 투자해 ‘기간제 스마트 채용 통합 접수시스템’ 구축에 나선다. 시스템 구축이 완료되면, 과도한 서류 제출과 복잡한 채용절차에 어려움 없이 온라인으로 손쉽게 비대면·비접촉 방식으로 응시할 수 있을 전망이다.17일 경기도에 따르면, 이번 ‘기간제 스마트 채용 통합 접수시스템’은 별도의 전산 시스템을 마련, 기간제 노동자의 응시 편의를 증진하고, 채용절차의 통일성을 제고하고자 도입된 사업이다.  도는 그간 경기도청 및 각 직속기관 등의 홈페이지 채용게시판을 통해 기간제 노동자를 채용하는 방식을 추진해왔다. 문제는 한 게시판에 모집공고와 서류합격, 최종합격 게시물이 혼재돼 있는데다가, 합격 여부를 확인하려면 일일이 해당 기관 홈페이지에서 관련 게시글을 찾아야하는 수고로움이 있었다는 것이다. 이번 시스템은 이 같은 불편 없이, 기간제 구직자가 PC 또는 모바일을 통해 해당 시스템을 접속하면 ‘마이 페이지’를 통해 본인의 응시 상태와 합격 여부를 보다 손쉽게 확인할 수 있다.  특히 시스템 내에서 바로 응시원서를 작성해 접수할 수 있어 별도의 응시원서 서류를 우편이나 이메일, 기관 방문을 통해 제출할 필요가 없다.뿐만 아니라 제출 서류 간소화를 위해 행정기관별 산재돼 있는 개인정보를 모아 본인이 활용하는 서비스인 ‘공공마이데이터’ 연동기능을 갖췄다.지원자가 시스템을 통해 간단한 인적사항만 적으면, 주민등록초본 등의 서류를 해당 기관에 제출할 필요 없이 채용 담당자가 경기도 거주여부 등을 직접 확인할 수 있게 된다. 앞으로 공공마이데이터를 통해 확인할 수 있는 공공서류를 확대할 예정이어서, 지원자가 제출해야 할 서류는 더 적어질 전망이다.이 밖에도 Q&A와 F&Q기능을 통해 지원자와 채용 담당자 간에 채용 관련 소통을 강화하고, ‘알림톡’ 기능을 통해 지원자는 합격 또는 불합격 여부를 카카오톡 또는 문자로 파악할 수 있도록 할 방침이다. 도는 6월부터 서버 구축과 테스트 운영 절차에 들어가 8월부터 본격적인 시스템 가동에 들어갈 예정이다.김규식 노동국장은 “기간제 스마트 채용 통합 접수시스템을 통해 기간제 노동자 구직 편의성·접근성이 높아질 것으로 기대된다”며 “앞으로도 비정규직 노동자들의 편의성을 위한 정책들을 지속적으로 발굴하여 노동이 존중받는 공정한 세상’ 실현에 최선을 다하겠다”고 밝혔다.경기=김동우 기자 bosun1997@mt.co.kr▶뜨거운 증시, 오늘의 특징주는?  ▶여론확인 '머니S설문' ▶머니S, 네이버 메인에서 보세요 <저작권자 ⓒ '성공을 꿈꾸는 사람들의 경제 뉴스' 머니S, 무단전재 및 재배포 금지>"
2021.06.17.,"새로 산 가방에서 냄새나는 팬티가…""왜 다들 책임 안 지려 하나""",https://n.news.naver.com/mnews/article/277/0004922208?sid=102,"카카오톡 선물하기에서 배송받은 가방 안에 누군가 착용한 듯한 속옷과 양말이 나왔다. 사진=온라인 커뮤니티 캡처[아시아경제 김초영 기자] 새로 구매한 가방에서 누군가 착용한 듯한 팬티와 양말이 나왔다는 한 누리꾼의 주장이 제기됐다. 이 누리꾼은 판매처에 항의했으나 업체는 ""구매처 문제""라며 책임을 회피한 것으로 알려졌다.16일 한 온라인 커뮤니티에는 '가방을 샀는데 입던 팬티를 받았습니다'라는 제목의 글이 올라왔다.글쓴이 A씨는 ""카카오톡 선물하기를 통해 ○○브랜드 가방을 구매해 받았는데 가방 측면 쪽 수납공간에 뭉툭한 게 들어있길래 사은품인가 하고 봤더니 착용한 양말과 팬티가 들어있었다""고 운을 뗐다.그는 ""화가 났지만 다시 교환, 환불받기가 귀찮아 판매 업체 측에 문의하니 '자기들도 모른다, 구매처 문제다'라는 식으로 얘기했다""며 ""구매처가 어디인지도 말을 해주지 않아 더욱 화가 났다""고 토로했다.이어 ""브랜드 정품 제품이라서 해당 브랜드에도 전화했더니 카카오톡 선물하기에 등록한 업체는 해당 브랜드와 연관이 없다며 책임이 없다는 식으로 이야기했다""며 ""누가 몰래 넣어놓은 것도 아니고 냄새나는 팬티랑 암모니아 양말로 소주 4병 마신 것처럼 메스꺼웠는데 왜 다들 책임은 안 져주려고 하느냐""고 분통을 터뜨렸다.A씨가 가방 판매자 측과 나눈 대화 내용. 사진=온라인 커뮤니티 캡처A씨는 판매처 측과 나눈 카카오톡 대화 내용도 공개했다.공개된 사진에 따르면 A씨가 ""누가 사용하던 걸 되파시는 건가. 어떻게 새 상품 안에 사용하던 속옷과 양말이 있을 수 있는 건가""라며 따지자 담당자는 ""죄송하다""면서도 ""저희도 이런 경우가 처음이라 당황스럽다. 우선 제품을 구매처로 보내서 저희도 환불을 받아야 하는 상황""이라고 설명했다.이에 A씨가 구매처 번호를 요구했으나 ""번호는 오픈할 수 없는 점을 양해바란다""면서 ""구매처에 해당 내용을 전달할 순 있으나, 구매처의 답변까지 고객님께 안내해 드리기 어렵다""고 답했다.이를 본 누리꾼들은 ""구매처 공개는 왜 못하냐"", ""코로나 시국에 말도 안 된다"", ""앞으로 어떻게 믿고 사냐"", ""카카오톡 선물하기 측은 업체 관리 안 하냐"" 등의 반응을 보였다.한편 카카오 관계자는 ""온라인 커뮤니티에 올라온 고객센터와의 대화본은 카카오톡 선물하기 고객센터가 아닌 판매자 측 고객센터""라며 ""상황을 인지 후 판매 일시 중단시켰고, 고객에게 직접 사과하고 상황 파악을 위해 먼저 연락을 취해 현재는 조치가 완료됐다""고 밝혔다.김초영 기자 choyoung@asiae.co.kr▶ 속 시원한 풀이! 2021년 정통사주·운세·토정비결▶ 전공 무관 '빅데이터', '인공지능' 취업 교육 모집▶ 투자 성공의 핵심은 기업분석! 'CORE' 바로가기<ⓒ경제를 보는 눈, 세계를 보는 창 아시아경제 무단전재 배포금지>"
2021.06.17.,누나 살해 유기 후 살아있는 척 부모 속인 남동생… 법정서 눈물,https://n.news.naver.com/mnews/article/469/0000611625?sid=102,"흉기로 30차례… 시신 여행용 가방에""늦은 귀가 잔소리하자 우발적으로…""첫 재판서 ""혐의 모두 인정"" 9차례 반성문누나를 살해하고 시신을 농수로에 유기한 혐의를 받는 A씨가 구속 전 피의자 심문(영장실질심사)을 받기 위해 지난 5월 2일 인천 미추홀구 인천지법으로 들어서고 있다. 뉴시스친누나를 흉기로 살해하고 시신을 농수로에 유기한 혐의로 구속 기소된 20대 남동생이 첫 재판에서 혐의를 모두 인정했다. 이날 법정에선 구체적인 범행 수법과 동기도 공개됐다.인천지법 형사12부(부장 김상우) 심리로 17일 열린 첫 공판에서 살인과 사체유기 혐의로 기소된 A(27)씨는 ""혐의를 모두 인정한다""고 밝혔다. 그는 재판부가 발언 기회를 주자 눈물을 흘리며 ""다음 기일에 의견을 밝히겠다""고 말했다. 지난달 기소된 뒤 최근까지 9차례 반성문을 써서 재판부에 제출한 A씨는 부모와 친척의 탄원서와 진정서도 내기로 했다.검찰은 이날 재판에서 A씨의 구체적 공소사실을 밝혔다. 검찰에 따르면 A씨는 지난해 12월 19일 오전 2시 50분쯤 인천 남동구 한 아파트에서 함께 사는 누나 B(30대)씨의 옆구리와 목, 가슴 부위를 흉기로 30여차례 찔러 숨지게 했다. 범행 당일 오전 1시쯤 집에 들어온 그는 B씨가 잔소리를 하면서 고등학교 재학 당시 가출과 과소비 등 평소 행실을 문제삼자 화가 나 범행한 것으로 조사됐다.A씨는 누나 시신을 아파트 옥상에 열흘 동안 숨겨 놨다가 여행용 가방에 담아 렌터카를 이용해 인천 강화군 삼산면 석모도 한 농수로에 버린 혐의도 받고 있다. 그는 시신이 담긴 가방을 페인트통과 소화기 등을 이용해 농수로에 가라앉힌 것으로 드러났다.B씨 시신은 살해된 지 4개월만인 지난달 21일 오후 2시 13분 농수로에서 주민에게 발견됐다. 경찰은 B씨 시신이 제대로 닫히지 않은 여행용 가방에서 빠져 나와 물 위로 떠오른 것으로 보고 있다. 경찰은 시신이 발견된 지 9일만인 지난달 29일 A씨 남매의 부모 집이 있는 경북 안동에서 A씨를 체포했다. A씨는 경찰 조사 당시 ""집에 늦게 들어왔다고 잔소리하는 누나와 말다툼을 하다가 우발적으로 범행했다""고 진술했다.A씨는 범행이 발각될 것을 우려해 포털사이트에 시신 유기 장소인 '석모도' 등을 주기적으로 검색해온 것으로 확인됐다. 그는 체포되기 전까지 인천 남동산업단지 소재 직장을 다니는 등 일상 생활을 해왔다. A씨는 누나의 발인 때 영정사진을 들기도 했다.A씨는 B씨의 휴대폰 유심(가입자 정보가 들어있는 카드)을 다른 휴대폰에 꽂은 뒤 카카오톡 계정에 접속해 누나 행세를 하며 B씨가 살아있는 것처럼 부모를 속이기도 했다. A씨는 누나 계정으로 접속해 '나는 남자친구랑 잘 있다. 찾으면 아예 집에 안 들어갈 것이다'는 메시지를 자신의 계정으로 보낸 뒤 이를 부모에게 보여준 것으로 파악됐다. 이에 속은 부모는 지난 2월 14일 접수한 B씨의 가출 신고를 취하했다. A씨는 누나의 은행계좌에 접속해 소액을 자신의 계좌로 보낸 뒤 생활비 등으로 사용하기도 했다.A씨의 다음 재판은 다음달 13일 열릴 예정이다."
2021.06.17.,"뉴욕 타임스퀘어 한복 영상 '공주의 꿈', 온라인 공개",https://n.news.naver.com/mnews/article/003/0010557440?sid=103,"[서울=뉴시스] 한복 홍보 영상 '공주의 꿈' (사진=한국문화재재단 제공) 2021.06.17. photo@newsis.com[서울=뉴시스] 이수지 기자 = 미국 뉴욕 타임스퀘어에 송출된 한복 영상 '공주의 꿈' 본편이 온라인에 공개된다. 문화재청이 주최하고 한국문화재재단이 주관하는 '문화유산 방문 캠페인'이 한복과 궁궐의 아름다움을 접목한 '코리아 인 패션' 두 번째 프로젝트를 진행하고, 17일 캠페인 유튜브를 통해 패션 필름 '공주의 꿈' 본편을 공개한다고 밝혔다. '코리아 인 패션'은 궁궐의 아름다운 전경과, 현대적 색채를 가미한 한복의 멋을 세련된 감각으로 담아 영상과 화보로 선보인다. 자신감 넘치는 공주 모습과 궁궐의 가을·겨울 정취를 담았던 1편 '공주의 하루'는 유튜브 조회수 122만뷰를 기록했다. 올해 선보이는 2편 '공주의 꿈'은 공주가 전 세계 공주들을 초대해 연회를 즐긴다는 내용이다. 꽃과 봄을 모티브로 뛰어난 한복 색감과 화려한 영상미를 자랑한다.'공주의 꿈'은 10대 방문코스 중 '왕가의 길'의 주요 거점이자 유네스코 세계유산으로 지정된 창덕궁과 창경궁, 복원 후 최초로 공개하는 대온실에서 촬영됐다. 2년 연속 '코리아 인 패션' 총괄디렉터를 맡은 디자이너 김영진(차이킴)은 '코리아 인 패션'을 통해 무한한 상상력을 기반으로 전통 의상을 다채롭게 풀어냈다. 이 영상에 다국적·다인종 모델과 함께 누구에게나 어울리고, 이색적이며 다채로운 맵시를 자랑하는 한복 31벌을 선보인다.[서울=뉴시스] 미국 뉴욕 타임스퀘어에 송출된 한복 홍보 영상 '공주의 꿈' (사진=한국문화재재단 제공0 2021.06.17. photo@newsis.com‘공주의 꿈'은 서경덕 성신대학교 교수와 함께 진행하는 '해외 광고 송출 프로젝트'의 첫 키워드 ‘한복’으로 소개됐다. 10일 뉴욕 타임스퀘어에선 광고를 위해 편집한 30초 분량의 영상이 공개됐다. 한 달간 1000회 송출된다. 본편은 '문화유산 방문 캠페인' 공식 유튜브를 통해 공개되며, 함께 제작된 화보는 다음 카카오 갤러리에서 살펴볼 수 있다. 추후엔 촬영현장과 '공주의 꿈' 풀버전도 공개된다.☞공감언론 뉴시스 suejeeq@newsis.com▶ 네이버에서 뉴시스 구독하기▶ K-Artprice, 유명 미술작품 가격 공개▶ 뉴시스 빅데이터 MSI 주가시세표 바로가기<ⓒ 공감언론 뉴시스통신사. 무단전재-재배포 금지>"
