기사날짜,기사제목,네이버 뉴스 url,기사내용
2023.03.06.,"하이브 공개매수 참패, 카카오는 계약해지… SM 운명은",https://n.news.naver.com/mnews/article/023/0003749980?sid=101,"하이브, 지분 1%도 못 얻어 카카오는 SM과 지분취득 계약 해제 소액주주 ‘표심’이 향방 가를듯/하이브와 SM 로고										하이브의 SM엔터테인먼트 주식 공개 매수가 실패로 끝났다. 6일 하이브는 공시를 통해 “공개 매수를 통해 SM 주식 총 23만3817주를 취득했다”고 밝혔다.지난 1일까지 진행된 주당 12만원 공개 매수를 통해 SM 지분 25%를 사들이려고 했는데 1%에도 못 미치는 0.98% 지분을 늘리는 데 그쳤다. 이로써 하이브가 가진 SM 지분은 이수만 전 총괄 프로듀서로부터 인수한 14.8%에서 15.78%로 늘어났다. 이수만 전 총괄이 보유 중인 지분(3.65%)을 합쳐도 19.43%에 그친다.인수 경쟁자인 카카오도 지분 확보 전략에 치명상을 입은 상태다. 이날 SM엔터테인먼트는 “법원의 가처분 인용 결정에 따라 카카오와의 신주(新株)·전환사채 발행 계약을 해제했다”고 공시했다. 법원이 지난 3일 “카카오가 SM의 신주 발행 등을 통해 지분 9%를 취득하는 것은 위법”이라며 하이브 진영에 선 이수만 전 총괄 측의 가처분 신청을 받아들였기 때문이다. SM과 카카오의 투자 계약은 일단 중단됐다.										공개 매수는 실패로 끝났지만, 여전히 하이브가 유리한 상태다. 하이브는 이날 SM에 서한을 보내 “9일까지 카카오 지명 이사 후보에 대한 이사회 추천 철회 등에 대한 입장을 밝히라”고 요구했다. 주식 계약 철회는 물론이고 카카오 측의 경영 개입 시도도 말끔히 씻어내겠다는 뜻이다.하이브는 공개 매수 실패, 카카오는 신주 발행 금지 가처분으로 양측 모두 결정적 승기를 잡기 못해 ‘SM 사태’의 결말은 안갯속이다. 금융투자 업계의 한 관계자는 “지난주 법원이 이 전 총괄의 가처분을 받아들이면서 ‘하이브 측 판정승’으로 흐르는 듯하지만, 카카오가 향후 높은 가격에 공개 매수를 진행해 지분을 키운다면 역전승이 나올 수도 있는 상황”이라며 “끝까지 예측불허”라고 말했다.하이브, 카카오 경쟁 이어질 듯							하이브나 카카오 어느 쪽도 경영권 확보에 필요한 안정적 지분을 거머쥐지 못한 만큼, ‘본게임’은 오는 31일 열리는 주주총회에서 소액주주들의 표 대결로 판가름 날 가능성이 커졌다. 1% 미만을 가진 소액주주들이 보유한 지분을 합치면 60%가 넘는다. 누가 주총에서 더 많은 개미를 설득해서 끌어들이느냐로 승부가 갈릴 가능성이 높아졌다.만약 이번 달 주총 싸움에서도 양측이 서로 엇비슷한 표를 얻는다면, 양측이 추천한 이사들이 불편한 동거를 하게 될 가능성도 있다. 이렇게 되면 각종 SM 경영 현안에 대해 이사들이 편을 가르고 견제하면서 의사 결정이 지연되는 등 부작용이 커질 수 있다.이날 SM 주가는 종일 등락을 거듭했다. 하이브 쪽이 승기를 잡아 싸움이 끝난 것 아니냐는 분위기 속에 오전 중에는 전 거래일 대비 3.48% 하락했다가, 오후 들어서는 ‘막대한 자금력을 가진 카카오가 이대로 물러설 리 없다’는 전망에 힘이 실리면서 4.41% 오른 역대 최고가를 찍기도 했다. 거래량은 239만여 주로 직전 거래일인 지난 3일 거래량(107만여 주)보다 배 이상 많았다. 결국 0.7% 오른 13만100원에 거래를 마쳤다. 증권가에서는 “주총 때까지 계속 큰 변동성을 보일 가능성이 있다”고 보고 있다.소액주주가 SM 운명 가를 듯							‘K팝 원조 기획사’인 SM을 놓고 뜨거운 지분 확보전이 벌어지는 가운데, 지난해 우리나라가 음원이나 TV 프로그램, 영화, 라디오, 뮤지컬 등 콘텐츠로 해외에서 벌어들인 이른바 ‘한류 수지’가 사상 최대를 기록한 것으로 집계됐다.이날 한국은행에 따르면, 지난해 우리나라가 해외에서 벌어들인 음향·영상 및 관련 서비스 수지는 12억3500만달러 흑자를 기록했다. 관련 통계가 나온 2006년 이후 최대다. 지난해 연평균 원·달러 환율(달러당 1291.9원)로 환산하면 약 1조5956억원 정도다.하이브와 카카오 양측은 소액주주들의 표심을 얻기 위해 움직이고 있다. 하이브는 지난 2일 주주 제안 캠페인 페이지 ‘SM 위드 하이브(SM with HYBE)’를 열고 소액주주들을 대상으로 의결권 위임을 권유하고 나섰다. 이수만 전 총괄도 지난 3일 공개 편지를 통해 ‘포스트 이수만은 하이브’라며 하이브를 지지해줄 것을 호소했다. SM은 소액주주들에게 서한을 보내 “하이브에 인수되면 SM의 DNA가 모두 사라질 것”이라고 호소하는 중이다."
2023.03.06.,"SM, 카카오 신주 취득 무산에도 신고가…하이브 강세(종합)",https://n.news.naver.com/mnews/article/003/0011725600?sid=101,"기사내용 요약카카오, 기술주 투심 회복에 급등 [서울=뉴시스] 신항섭 기자 = 에스엠이 카카오의 신주·전환사채 취득 실패에도 신고가를 기록했다. 장 초반 하락세를 보였으나 경영권 분쟁 기대감 다시 반영된 것으로 풀이된다. 하이브도 2%의 강세를 기록했으며 카카오는 4% 급등했다.6일 한국거래소에 따르면 에스엠은 전 거래일 대비 900원(0.7%) 오른 13만100원에 장을 마쳤다. 장중에는 13만4900원까지 오르며 신고가를 경신하기도 했다.이날 에스엠은 장 초반 하락세를 보였으며 한때 3.48%의 약세를 기록하기도 했다. 지난주 금요일 장 마감 후 발표된 법원의 판결 소식의 영향이다. 지난 3일 서울동부지법은 이수만 전 총괄프로듀서가 제기한 카카오 대상 신주 및 전환사채 발행 금지 가처분을 인용했다.앞서 에스엠은 카카오를 대상으로 제3자배정 대상 유상증자와 전환사채(CB) 발행을 발표한 바 있다.해당 유상증자와 전환사채를 지분 전환할 경우, 카카오는 에스엠의 지분 9.05%를 확보한 2대주주가 될 에정이었다. 하지만 법원의 이번 결정으로 카카오의 계획이 무산됐다.재판부는 에스엠이 충분한 현금과 현금성 자산 등을 보유하고 있었고, 급하게 갚아야 할 채무가 없었다고 판단해 이수만 전 총괄 측에 손을 들어줬다. 또 자금 조달이 필요했다는 목적이 불분명 하다고 판단했다.하지만 경영권 분쟁이 아직 끝나지 않았다는 전망에 주가가 반등에 성공했다. 특히 이날 카카오가 긴급 이사회를 진행한다는 소식이 기대감을 키운 것으로 보여진다.시장에서는 카카오가 기존 계획보다 더 많은 자금을 활용하기 위해서 이사회를 통해 동의를 얻으려 한다고 해석 중이다. 자회사 자금 등을 활용하기 위해서는 이사회 동의가 필수적이기 때문이다.법원의 판결로 승기를 잡았다는 하이브의 주가도 크게 올랐다. 하이브는 전 거래일 대비 4400원(2.35%) 오른 19만1800원에 마감했다.하이브는 가처분 결정에 따라 카카오와의 투자⋅사업협력계약 해제, 카카오 측 지명 이사 후보 추천 철회권을 행사하라고 요구하고 있다.하이브는 ""SM이 위법한 투자계약과 불리한 사업협력계약에서 구제될 수 있는 기회이므로, 이러한 후속 조치 요청을 이행하지 않거나 위반하는 것은 SM의 중대한 권리를 포기 내지 박탈하는 고의적인 배임 행위""라고 강조했다. 이와 함께 하이브는 SM 이사회, 개별 이사들의 이행 여부·계획, 일정 등의 입장을 오는 9일까지 요청했다.한편 카카오는 기술주에 대한 투자심리가 회복되면서 큰 폭의 상승을 기록했다. 전 거래일 대비 4.26% 오른 6만3600원에 장을 마쳤다. 다른 기술주인 네이버도 4.38% 급등했다．"
2023.03.06.,"SM투자 제동 카카오, 하이브에 반격하면 조단위 '쩐의전쟁'",https://n.news.naver.com/mnews/article/421/0006665883?sid=105,"이수만 총괄 신청 가처분 기각…카카오 지분 확보 계획 '원점'엔터 적자폭 키운 카카오, 공개매수 등 카드로 반격 가능성이수만 SM엔터테인먼트 전 총괄 프로듀서가 14일 서울 용산구 그랜드하얏트호텔에서 열린 한·몽 경제인 만찬에 참석해 기조연설을 하고 있다. 2023.2.14/뉴스1 ⓒ News1 장수영 기자(서울=뉴스1) 정은지 기자 = 카카오(035720)의 지분매수를 통한 에스엠엔터테인먼트(041510) 2대주주 지위 확보가 무산됐다. SM과 카카오 양사의 엔터사업 협력 체계 구축계획도 제동이 걸렸다.카카오는 강력한 IP(지식재산권)을 보유한 SM엔터와의 협력을 기반으로 한 글로벌 시장 개척이 절실하다. 하이브에게 한발 뒤처지긴 했지만 SM과의 협업이 장기생존 전략 핵심 사안이라는 점에서 막강한 유동성을 활용한 공격적 지분매수 가능성 등 카카오 대응카드에 관심이 쏠린다.  ◇하이브 기선제압…카카오 ""내부 논의""6일 관련업계에 따르면 서울동부지법 민사합의21부(부장판사 김유성)는 3일 오후 이수만 전 총괄 측이 SM을 상대로 제기한 신주 및 전환사채 발행금지 등 가처분 신청을 인용했다.법원의 가처분 신청 인용 결정 이후 카카오와 SM은 ""유상증자 및 전환사채 발행에 대한 계약 해제""를 공식화했다.카카오가 제3자 배정 유상증자 등을 통해 SM 2대 주주로 올라서겠다는 계획이 무산됐다.하이브는 이수만 총괄 SM 지분 14.8% 이외에도 공개매수 등을 통해 SM엔터 지분 총 20%를 확보한 것으로 알려진다.카카오는 내부 협의를 거쳐 후속 대응 방안을 결정하겠다는 입장이지만 하이브 공세가 만만치가않다. 하이브는 이날 SM에 △가처분결정 취지에 반하는 일체의 행위 금지 △신주인수계약, 전환사채인수계약 등 투자계약 즉시 해지 △카카오와 체결한 사업협력계약 즉시 해지 △카카오측 지명 이사후보에 대한 이사회 추천 철회 및 주주총회 선임 안건 취소 등을 요구했다.카카오엔터테인먼트 로고◇엔터 시너지 절실한 카카오, 공개매수 나서나현 상황에서 카카오가 사용할 수 있는 카드는 제한적이다. SM이 법원의 가처분 인용 결정에 대해 이의신청을 하거나, 본안소송을 진행할 수 있지만 행정소송 특성상 결과를 뒤집을 가능성은 낮다.지난해 카카오엔터테인먼트 매출액은 1조2925억원으로 전년(8772억원) 대비 약 47% 증가하며 처음으로 1조원을 돌파했다. 외형적인 성장세는 돋보이지만 같은 기간 당기순손실은 2444억원에서 4367억원으로 2배 가까이 늘었다.손실폭을 줄이고 내실을 다지려면 SM 간의 협력이 절실하다.이 때문에 카카오가 투자유치를 통해 확보한 막대한 자금력을 앞세워 지분 공개매수에 나설 수 있다는 관측이 제기된다.SM도 카카오와의 협력을 통해 △멀티 제작센터/레이블 체계 구축 통한 IP 라인업 확대 △카카오의 음원/음반 유통 플랫폼 활용 통한 SM 음악 사업 수익 극대화 △카카오의 스토리 영상 제작 역량 결합 통한 SMCU IP의 콘텐츠 영역 확대 △글로벌 핵심 지역에서의 통합 법인 운영 및 합작 법인 설립 △카카오의 글로벌 플랫폼 통한 SM의 사업적 커버리지 강화 △SM 팬플랫폼에 카카오의 기술 지원 통한 팬플랫폼 기능 고도화 진행 등을 내세우며 사업적 시너지 창출을 강조해왔다.◇실탄 보유한 카카오, 하이브와 '쩐의전쟁' 치를까하이브는 카카오가 SM의 경영권에 참여하지 않는 것을 전제로 카카오와 협력할 수 있다는 입장을 견지해왔지만 양사가 손을 잡을 가능성은 낮다. 하이브가 카카오 경쟁사로 볼 수 있는 네이버(035420)와 위버스 등과 협력 관계를 구축하고 있어서다.대신 카카오와 하이브간 '쩐의 전쟁'을 본격화할 가능성이 높아졌다.카카오는 연초 사우디 국부펀드 등으로부터 1조1500억원 규모의 자금을 조달했는데, 이 중 타법인 취득 자금으로 5800억원을 배정했다. 투자금 중 9000억원은 지난달 24일 카카오에 납입됐다.만약 카카오가 공개매수에 나선다면 하이브가 제시한 공개매수 가격인 12만원 대비 높아야 어느 정도 승산이 있을 것으로 보인다.현재 SM 주가가 13만원 안팎에서 거래되고, 하이브가 약 20%의 지분을 확보했다고 가정했을 때 카카오가 투입해야 하는 자금은 1조원대에 달할 것이라는 분석이 나온다. 일각에서는 카카오가 이달말 열리는 SM 주주총회에서 이사진 선임을 비롯한 소액주주들의 표심이 어느 쪽으로 향하는지 여부 및 공정거래위원회의 기업결함심사 추이 등을 관망한 후 향후 대응 방안을 마련할 것이라는 의견도 나온다."
2023.03.06.,어수선한 카카오...오늘 저녁 긴급이사회 돌연 취소,https://n.news.naver.com/mnews/article/009/0005097224?sid=105,"카카오가 6일 저녁 긴급 이사회를 열려고 계획했다가 오후에 돌연 취소했다.매일경제 취재 결과, 카카오는 당초 이날 저녁 긴급 이사회를 열기로 확정했지만 이에 대한 기사가 나간 이후 오후들어 일정을 전격 연기했다. 카카오 사정에 정통한 한 관계자는 “이날 이사회는 카카오의 SM 경영권 인수에 대한 타당성과 현실성 있는 실행방안 등에 대해 치열한 논의가 이뤄질 계획이었는데, 외부에 일정이 개최 전 노출되는 바람에 취소된 것으로 안다”고 전했다.카카오는 조만간 다시 이사회를 열고 관련 논의에 착수할 것으로 보인다.앞으로 카카오 이사회가 어떤 결정을 내릴지 예단하기는 어려운 상황이다. 카카오로선 ‘SM 인수전’을 쉽게 포기할 수 없는 상황이지만 부담요인도 적지 않기 때문이다. 금융감독원은 최근 하이브의 SM 주식 공개매수 기간에 발생한 대량 매집 등 위법 가능성이 있는 행위에 대해 증권사와 자산운용사 등 금융회사들의 개입 여부를 조사하고 있다.앞서 지난 3일 서울동부지법 민사합의21부(수석부장판사 김유성)는 이수만 전 SM 총괄프로듀서가 SM 현 경영진 등을 상대로 낸 신주·전환사채 발행 금지 가처분에 대해 인용 결정을 내린 바 있다. 법원이 이 전 총괄프로듀서의 손을 들어주면서 SM 지분 9.05%를 확보하려던 카카오 계획은 최종 무산됐다.이에따라 ‘코너’에 몰린 카카오가 SM 최대주주 하이브에 맞서 공개매수에 나설지가 시장의 관심사로 부상했다. 일각에선 카카오가 공개매수 외에도 우호 주주로부터 블록딜(시간 외 대량매매) 방식을 통해 단숨에 대규모 지분을 확보할 수 있다는 가능성까지 거론되고 있다.현재 하이브가 확보한 SM 지분은 20% 플러스 알파(공개매수 지분)다. 이 전 SM 총괄프로듀서로부터 넘겨받은 14.8%에 더해 이 전 총괄의 잔여 지분 3.65%와 효성그룹 계열사 갤럭시아에스엠이 보유했던 1%의 지분 등이다. 이에 덧붙여 확인되지 않은 공개매수 시장 지분을 더하면, 0%에서 시작해야 하는 카카오보다 ‘경영권 확보’ 면에서 압도적으로 유리한 위치에 있다.하지만 금감원 조사, 막대한 투자비용 등의 부담으로 카카오가 아예 SM 인수전에서 발을 빼거나 하이브와의 협력모드로 입장을 선회할 수도 있다는 의견도 나온다. 카카오 사정을 잘 아는 한 관계자는 “카카오에서 있어 SM은 놓치면 안되는 상대”라면서도 “다만 고려해야할 대외 변수가 있어 힘든 결정이 될 것으로 보인다”고 귀띔했다.  황순민 고민서기자"
2023.03.06.,"카카오, ‘서비스 장애’ 소상공인 지원금 접수 기간 연장",https://n.news.naver.com/mnews/article/056/0011439611?sid=105,"카카오가 지난해 10월 서비스 장애로 피해를 본 소상공인을 위한 지원금 지급 서류 접수 기간을 다음 달 14일까지로 연장했다고 오늘(6일) 밝혔습니다. 당초 접수 기간은 지난 1월 30일부터 지난달 27일까지였습니다. 카카오는 2월까지 접수를 진행하고 이달 중 지원금 지급을 마무리할 예정이었으나, 아직 서류를 제출하지 못한 소상공인들이 많다는 판단에 기간을 늘렸다고 설명했습니다. 피해를 본 소상공인은 소상공인 확인서, 장애로 인한 매출 피해 입증 자료, 카카오 서비스 이용 증명 자료, 상호 또는 사업장 대표자 명의의 은행 계좌 사본 등의 서류를 제출해야 합니다. 서류는 공식 채널 챗봇 ‘카카오 1015 소상공인지원센터’나 웹사이트, 우편 등으로 보내면 됩니다. 카카오는 소비자·소상공인 단체와 학계가 참여한 ‘1015 피해지원 협의체’가 세운 원칙에 따라 매출 손실 규모가 30만 원 이하인 경우 3만 원, 30만 원 초과 50만 원 이하인 경우 5만 원을 지급합니다.  50만 원 초과 피해 사례에 대해서는 피해 입증 과정을 통해 추가 지원을 검토합니다.[사진 출처 : 연합뉴스 / 카카오 1015 소상공인지원센터 카카오톡 캡처]"
2023.03.06.,"SM 인수 제동 걸린 카카오, '쩐의 전쟁' 돌입하나",https://n.news.naver.com/mnews/article/018/0005436529?sid=101,"신주 발행 불발…향후 전략은하이브에 승기 내줬지만 반전 모색공개매수·블록딜 카드 놓고 고심'8975억 사우디 실탄' 부족 부담에주총·공정위 심사 결과 내심 기대[이데일리 윤기백 유준하 기자] 카카오의 고심이 깊어지고 있다. 법원이 이수만 전 총괄 프로듀서(이하 이수만)가 에스엠엔터테인먼트(이하 SM)을 상대로 제기한 신주 및 전환사채(CB) 발행금지 가처분 신청을 받아들였기 때문이다. 카카오가 지분 확보에 실패하면서 SM 인수전의 유리한 고지를 하이브에 내주게 된 것이다. 앞으로 카카오가 어떤 선택을 내릴지에 관심이 집중되고 있다. 지난 3일 서울동부지법 민사합의21부(재판장 김유성)는 이수만의 가처분 신청을 인용했다. 이수만은 지난달 8일 SM이 카카오를 대상으로 1119억원 규모 제3자 배정 신주 및 1052억원 규모의 CB를 발행하자 이에 반발해 법원에 발행금지 가처분 신청을 낸 바 있다.법원은 SM의 카카오 대상 신주·CB 발행에 대해 자금 수요와 조달이 구체적으로 충분한 검토가 이뤄졌다고 보기 어렵다는 점을 꼬집었다. 결정문을 보면 “기존 주주들의 보유 주식 가치 하락이나 지배권 약화 등 불이익 발생을 최소화할 수 있는 다른 전략적 제휴 및 자금 조달 방안들을 구체적이고 신중하게 검토했다고 볼만한 객관적인 자료를 찾기 어렵다”고 짚었다.SM 지분 확보에 나섰던 카카오의 계획이 실패한 셈이다. 이에 카카오의 미래 사업계획에도 부정적인 영향이 불가피할 것으로 판단된다. 카카오는 자사 플랫폼과 IT 기술, SM의 IP(지식재산권)을 활용해 글로벌 엔터사업에 뛰어들겠다는 구상을 세웠다. 시장은 카카오가 SM 인수를 쉽게 포기하지 않을 것으로 보고 있다. 공개 매수나 지분을 많이 가진 주주들을 상대로 블록딜을 통해 SM의 지분을 확보에 나설 것으로 보고 있다. 일각에서는 자회사 카카오엔터테인먼트(이하 카카오엔터)가 사우디 국부펀드 등으로부터 유치한 1조 2000억원의 실탄을 꺼내들 가능성도 제기하고 있다.문제는 카카오의 상황이 녹록지 않다는 점이다. 카카오가 하이브(19.43%, 갤럭시아에스엠·이수만 풋옵션 포함)보다 우위를 차지하기 위해선 SM 지분 30% 이상을 확보해야 하는데 공개매수가(13~15만원)에 따라 적게는 9286억원에서 많게는 1조 714억원이 필요한 상황이다. 현재 카카오엔터는 사우디 국부펀드로부터 1차 납입금인 8975억원만 수중에 들어온 상태. 투자금 대부분을 SM에 쏟아붓기엔 부담이 크다는 것이 전문가들의 중론이다.카카오가 공정거래위원회(이하 공정위)의 기업결합 심사 결과에 내심 기대를 걸고 있는 이유도 이 때문이다. 하이브와 SM이 결합하면 국내 K팝 시장의 절반 이상을 독식한다는 점에서 공정위가 두 회사의 기업결합을 불허갈 가능성이 있어서다. 카카오의 향후 계획을 묻는 질문에 관계자 또한 “내부 논의를 거쳐 입장을 정리해 밝히겠다”고 말을 아끼고 있다는 점도 그만큼 카카오의 고심이 깊다는 증거다. 카카오와 손잡은 현 SM 경영진은 주주총회에 집중한다는 계획이다. 팬들과 주주들의 지지를 얻어 ‘SM 3.0’ 시대를 열겠다는 방향으로 선회할 것으로 보인다. 이성수 SM 대표가 주주총회에서 반전을 위해 추가 폭로를 이어갈 가능성도 제기되고 있지만 상황을 반전시킬 수 있을지는 미지수다.한편 이수만은 법원의 가처분 인용이 결정되자 기쁨을 감추지 못했다. 그는 SM 직원들을 대상으로 낸 메시지에서 “내게 ‘더 베스트’는 하이브였다”며 직접적인 입장을 내놨다. 하이브 역시 이에 화답하듯 “당사는 SM의 최대주주로서 이번 재판부의 결정을 존중한다”고 밝혔다.하이브 또한 이달 말 열릴 주주총회에 온 역량을 집중한다. 방시혁 하이브 의장은 지난 2일(현지시간) CNN 인터뷰에서 “지분 확보 여부는 우선순위가 아니”라며 “주주총회가 가장 중요하며 주총에서 실제로 지지를 얻어야 저희가 원하는 이사회가 구성될 수 있다”고 말한 바 있다."
