기사날짜,기사제목,네이버 뉴스 url,기사내용
2023.03.06.,"[한국형 챗GPT③]초거대 AI로 영상판독…카카오, '질병없는 세상' 꿈꾼다",https://n.news.naver.com/mnews/article/003/0011723776?sid=105,"기사내용 요약초거대AI '코GPT'…영상의학 진단 분야에 응용""올해 '헬스케어 AI 판독 서비스' 출시 목표""[서울=뉴시스] 오동현 기자 = ""카카오브레인의 종착역은 정해지지 않았다. 이제 인공지능(AI) 사업에 로켓을 만들고 있는 단계다. 올해는 AI 헬스케어 모델이 멋지게 데뷔하는 한 해가 될 것이다.""김일두 카카오브레인 대표는 자사를 ‘초거대 생성 AI 기업’이라 소개하며 ""올해 '헬스케어 AI 판독 서비스'를 출시하는 것이 도전 과제""라고 밝혔다. 이와 함께 텍스트로 이미지를 생성하는 '칼로'의 신규 시장 발굴과 초거대 언어모델 '코GPT-3.5'도 선보일 계획이다.카카오브레인은 '넥스트 카카오'가 될 무언가를 찾아 실현하는 회사다. 그 일환으로 '질병없는 세상'을 실현할 AI 헬스케어를 연구 개발하고 있다. AI 기반의 항체 신약 개발과 AI 기반의 의료영상 분야에 집중하고 있으며, AI를 통해 기존에 풀기 어려웠던 헬스케어 산업에 기여하는 것이 목표다.  일각에선 헬스케어 연구에 굳이 초거대 AI가 왜 필요한지 의문을 제기한다. 이에 대해 배웅 헬스케어최고책임자는 ""인간처럼 효율적으로 학습하는 게 초거대 AI이기 때문""이라고 설명했다. 의료 영상 분야를 예로 들면 어린아이들이 공부할 때 그림과 글자를 페어링해서 학습하는 것처럼 AI도 의료 영상과 판독문만으로 효율적으로 학습할 수 있다는 것이다.  또 ""방대한 양의 데이터가 필요하다. 인간의 기본 교육 과정도 12년이다. 정말 좋은 유전자를 갖고 있는 사람조차도 좋은 교육과 좋은 데이터가 없으면 소용이 없다""며 ""카카오브레인은 이런 문제를 속도와 비용 효율성을 극대화해 풀기 위해서는 초거대 AI 기반의 데이터 선순환이 필수라고 생각했다""고 전했다.  더 나아가 카카오브레인은 초거대 AI 모델의 파운데이션 모델을 만들기 위해서 전 세계 최대 규모의 흉부 엑스레이 데이터셋을 기반으로 국내외 11개 이상의 병원들과 공동 연구를 하고 있다.구체적으로는 초거대 AI를 활용해 유방암 등 특정 질병을 타깃으로 연구 개발을 진행하고, 나아가 일반적인 질병에 대한 판독 및 진단을 지원하는 것으로 연구 범위를 확장할 예정이다.궁극적으로는 진단 차원에서 타깃을 예측한 후, 진단에서 치료로까지 이어질 수 있도록 하는 초거대 AI 모델을 적용한 의료 서비스 개발해 '질병 없는 세상'을 만들겠다는 비전 달성이 목표다.    카카오브레인은 초거대 AI 기술을 영상의학 진단 분야에 응용할 경우, 영상의학과 저연차 전문의가 흉부 엑스레이와 같은 의료 영상을 기반으로 작성하는 판독문 수준의 서비스 제공이 가능하다고 설명했다.이는 세계 최초로 시도되는 AI CAD 분야 내 '초거대 AI 기반 초안 판독문 생성 서비스'다. GE, 필립스, 지멘스 등 기존 글로벌 의료기기 기업들의 AI CAD 개발 방식 및 서비스의 한계를 넘어설 수 있는 기술로 평가받고 있다.기술적으로 보면 챗GPT와 카카오브레인이 개발하고자 하는 초안 판독문 모델은 초거대 생성 모델이라는 공통점을 갖고 있다. 카카오브레인 관계자는 ""챗GPT는 사람이 아님에도 불구하고 사람과 유사하게 상호작용이 가능하다는 게 가장 큰 장점""이라며 ""우리는 텍스트와 엑스레이 같은 어떤 영상을 입력으로 받아서 텍스트 또는 이미지로 답변 가능한 모델 개발 계획을 가지고 있다. 이런 모델을 저희가 확보하게 되면 질병 진단의 어떤 보조 도구로서 새로운 경험을 선사할 수 있을 것""이라고 기대했다. 오픈AI의 GPT 등과의 차별점에 대해선 ""카카오브레인은 2000만 건 이상의 의료 영상 판독문 데이터를 확보하고 있다. 이는 기존의 연구 그룹이나 회사들하고 비교해 봤을 때 적어도 수십 배에서 수백 배 이상 많은 규모다. 이미 어느 정도의 격차가 벌어졌다""며 ""칼로와 언어모델 같은 경우에는 기본적으로 한국어라는 특성 때문에 카카오브레인이 굉장히 잘할 수 있다고 보고 있다""고 자신했다. 한편, 카카오브레인은 한국에 본사를 둔 AI 기반의 신약 개발 기업 '갤럭스'와 5년간 공동 연구 개발을 진행하며 'AI 기반 항체 신약 설계 플랫폼' 구축도 추진한다.카카오브레인 AI 신약 연구을 맡고 있는 이유한 리더는 “카카오브레인은 5~10년 걸리던 신약물질 발굴 프로세스를 2~3년으로 단축해 인류의 건강한 삶과 행복을 증진시키고자 한다”며 “카카오브레인 AI모델에 현재 사용되고 있는 전문 기법을 보강해 신뢰도 높은 신약 개발에 일조할 것”이라고 전했다．"
2023.03.06.,"하이브, 공개매수로 SM 지분 0.98% 확보…카카오 선택은?",url없음,<네이버 기사 없음>
2023.03.06.,"[한국형 챗GPT③]초거대 AI로 영상판독…카카오, '질병없는 세상' 꿈꾼다",https://n.news.naver.com/mnews/article/003/0011723776?sid=105,"기사내용 요약초거대AI '코GPT'…영상의학 진단 분야에 응용""올해 '헬스케어 AI 판독 서비스' 출시 목표""[서울=뉴시스] 오동현 기자 = ""카카오브레인의 종착역은 정해지지 않았다. 이제 인공지능(AI) 사업에 로켓을 만들고 있는 단계다. 올해는 AI 헬스케어 모델이 멋지게 데뷔하는 한 해가 될 것이다.""김일두 카카오브레인 대표는 자사를 ‘초거대 생성 AI 기업’이라 소개하며 ""올해 '헬스케어 AI 판독 서비스'를 출시하는 것이 도전 과제""라고 밝혔다. 이와 함께 텍스트로 이미지를 생성하는 '칼로'의 신규 시장 발굴과 초거대 언어모델 '코GPT-3.5'도 선보일 계획이다.카카오브레인은 '넥스트 카카오'가 될 무언가를 찾아 실현하는 회사다. 그 일환으로 '질병없는 세상'을 실현할 AI 헬스케어를 연구 개발하고 있다. AI 기반의 항체 신약 개발과 AI 기반의 의료영상 분야에 집중하고 있으며, AI를 통해 기존에 풀기 어려웠던 헬스케어 산업에 기여하는 것이 목표다.  일각에선 헬스케어 연구에 굳이 초거대 AI가 왜 필요한지 의문을 제기한다. 이에 대해 배웅 헬스케어최고책임자는 ""인간처럼 효율적으로 학습하는 게 초거대 AI이기 때문""이라고 설명했다. 의료 영상 분야를 예로 들면 어린아이들이 공부할 때 그림과 글자를 페어링해서 학습하는 것처럼 AI도 의료 영상과 판독문만으로 효율적으로 학습할 수 있다는 것이다.  또 ""방대한 양의 데이터가 필요하다. 인간의 기본 교육 과정도 12년이다. 정말 좋은 유전자를 갖고 있는 사람조차도 좋은 교육과 좋은 데이터가 없으면 소용이 없다""며 ""카카오브레인은 이런 문제를 속도와 비용 효율성을 극대화해 풀기 위해서는 초거대 AI 기반의 데이터 선순환이 필수라고 생각했다""고 전했다.  더 나아가 카카오브레인은 초거대 AI 모델의 파운데이션 모델을 만들기 위해서 전 세계 최대 규모의 흉부 엑스레이 데이터셋을 기반으로 국내외 11개 이상의 병원들과 공동 연구를 하고 있다.구체적으로는 초거대 AI를 활용해 유방암 등 특정 질병을 타깃으로 연구 개발을 진행하고, 나아가 일반적인 질병에 대한 판독 및 진단을 지원하는 것으로 연구 범위를 확장할 예정이다.궁극적으로는 진단 차원에서 타깃을 예측한 후, 진단에서 치료로까지 이어질 수 있도록 하는 초거대 AI 모델을 적용한 의료 서비스 개발해 '질병 없는 세상'을 만들겠다는 비전 달성이 목표다.    카카오브레인은 초거대 AI 기술을 영상의학 진단 분야에 응용할 경우, 영상의학과 저연차 전문의가 흉부 엑스레이와 같은 의료 영상을 기반으로 작성하는 판독문 수준의 서비스 제공이 가능하다고 설명했다.이는 세계 최초로 시도되는 AI CAD 분야 내 '초거대 AI 기반 초안 판독문 생성 서비스'다. GE, 필립스, 지멘스 등 기존 글로벌 의료기기 기업들의 AI CAD 개발 방식 및 서비스의 한계를 넘어설 수 있는 기술로 평가받고 있다.기술적으로 보면 챗GPT와 카카오브레인이 개발하고자 하는 초안 판독문 모델은 초거대 생성 모델이라는 공통점을 갖고 있다. 카카오브레인 관계자는 ""챗GPT는 사람이 아님에도 불구하고 사람과 유사하게 상호작용이 가능하다는 게 가장 큰 장점""이라며 ""우리는 텍스트와 엑스레이 같은 어떤 영상을 입력으로 받아서 텍스트 또는 이미지로 답변 가능한 모델 개발 계획을 가지고 있다. 이런 모델을 저희가 확보하게 되면 질병 진단의 어떤 보조 도구로서 새로운 경험을 선사할 수 있을 것""이라고 기대했다. 오픈AI의 GPT 등과의 차별점에 대해선 ""카카오브레인은 2000만 건 이상의 의료 영상 판독문 데이터를 확보하고 있다. 이는 기존의 연구 그룹이나 회사들하고 비교해 봤을 때 적어도 수십 배에서 수백 배 이상 많은 규모다. 이미 어느 정도의 격차가 벌어졌다""며 ""칼로와 언어모델 같은 경우에는 기본적으로 한국어라는 특성 때문에 카카오브레인이 굉장히 잘할 수 있다고 보고 있다""고 자신했다. 한편, 카카오브레인은 한국에 본사를 둔 AI 기반의 신약 개발 기업 '갤럭스'와 5년간 공동 연구 개발을 진행하며 'AI 기반 항체 신약 설계 플랫폼' 구축도 추진한다.카카오브레인 AI 신약 연구을 맡고 있는 이유한 리더는 “카카오브레인은 5~10년 걸리던 신약물질 발굴 프로세스를 2~3년으로 단축해 인류의 건강한 삶과 행복을 증진시키고자 한다”며 “카카오브레인 AI모델에 현재 사용되고 있는 전문 기법을 보강해 신뢰도 높은 신약 개발에 일조할 것”이라고 전했다．"
2023.03.06.,"하이브, 공개매수로 SM 지분 0.98% 확보…카카오 선택은?",url없음,<네이버 기사 없음>
2023.03.06.,"카카오페이증권, 예탁금 이자 5%에 결제 포인트 적립까지",https://n.news.naver.com/mnews/article/468/0000926017?sid=101,"사진|카카오페이[스포츠서울 | 홍성효기자] 카카오페이와 카카오페이증권이 사용자 혜택 강화에 나선다.카카오페이증권 종합계좌를 보유하고 있거나 신규 개설하면 오는 6월까지 다양한 혜택을 제공한다. 우선 최대 연 5%의 예탁금 이자다. 카카오페이증권은 종합계좌에 예탁한 30만 원까지 연 5% 예탁금 이자를 매주 제공하며 이를 초과하는 금액에 대해서는 구간별로 금리를 차등 적용해 지급한다. 이벤트 페이지 내 ‘내가 받는 이자’ 탭에서 사용자가 지금까지 받은 혜택과 종합계좌의 예탁금 구간별로 받을 수 있는 혜택을 미리 확인할 수 있다.두 번째 혜택은 최대 1% 결제 포인트 적립이다. 오는 4월까지 편의점에서 카카오페이 앱으로 카카오페이머니 충전 없이 잔액으로 결제하면 결제액의 1%를 카카오페이 포인트로 받을 수 있다. 카카오톡에서 카카오페이를 열어 결제하더라도 0.6% 포인트를 제공하며, 편의점이 아닌 여타 오프라인 매장에서는 0.3%를 제공한다.세 번째로 송금 수수료 전면 무료 혜택이다. 카카오페이증권 종합계좌를 이용하면 카톡 친구 송금은 물론 기존 월 10회 무료 제공되던 계좌 송금도 횟수 제한 없이 무료로 이용할 수 있다.이 외에도 카카오페이증권은 최근 미국 주식 온라인 거래 수수료율을 업계 최저 수준인 0.05%로 낮춰 사용자 혜택을 높였다. 오는 3월 말까지는 카카오페이증권에서 체결되는 모든 국내 주식 신용거래 매수 건에 대해 최대 90일까지 연 3.9% 이자율을 적용하는 등 다양한 혜택을 제공하고 있다.카카오페이는 “카카오페이를 사용하면 할수록 더 큰 혜택과 편의성을 체감할 수 있도록 카카오페이증권과 함께 이벤트를 기획했다”며 “앞으로도 사용자의 알뜰한 경제 생활을 위한 다양한 혜택을 설계해 효익을 극대화할 수 있도록 지속적인 노력을 기울일 것”이라고 말했다.shhong0820@sportsseoul.com"
2023.03.06.,"클레이튼재단, 카카오와 완전 독립…""자체 수익만으로 운영 목표""",url없음,<네이버 기사 없음>
2023.03.06.,"[특징주] SM, 카카오 유증 무산 약보합…카카오·하이브 강세",url없음,<네이버 기사 없음>
2023.03.06.,카카오 손 잡은 연체 상담…'보이스봇'이 해결사 될까,https://n.news.naver.com/mnews/article/015/0004817336?sid=101,"소상공인 정책자금 연체 효율 관리 차원 콜센터에서 전부 소화하기엔 역부족경기 성남시 분당구 카카오 사옥 ''카카오 판교아지트''에서 시민들이 나오고 있다. 한국경제 자료사진중소벤처기업부가 6일 카카오와 손 잡고 ‘상담 보이스봇’을 도입하기로 했다. 소상공인시장진흥공단에서 지원한 정책자금의 연체를 효율적으로 관리하기 위해서다.중기부에 따르면 이날부터 서비스하는 ‘단기연체 상담 보이스봇’은 정책자금 연체 30일 이내 소상공인을 대상으로 월평균 5만여 건의 연체금액 안내, 가상계좌 발급 등의 단순 연체 상담을 지원한다. 앞서 중기부는 2020~2022년 코로나19에 피해를 본 소상공인 회복을 지원하기 위해 소진공을 통한 정책자금 직접대출을 크게 확대했다.이러한 상황에서 소비위축으로 인해 소상공인의 경영애로가 심화하면서 생업에 바쁜 소상공인이 적기에 이자나 대출원금을 상환하지 못하고 연체할 가능성이 높아지고 있다. 소액의 이자라도 연체가 장기화되면 신용도 판단정보가 등록돼 소상공인의 추가 대출이나 만기 연장 등 금융서비스 이용에 지장이 발생할 수 있다.이 때문에 소상공인들이 적기에 상환할 수 있도록 안내하는 서비스 강화가 필요했다고 중기부는 판단했다. 중기부는 ""연체 소상공인과 직접 소통을 통한 상환안내를 위해 작년부터 연체 상담 콜센터를 운영해 성과를 달성했으나 증가하는 수요에 대응하기에는 역부족""이라고 했다. 이를 일정 부분 해소하고자 보이스봇을 도입한다.한편, 기존 연체 상담 콜센터의 전문 상담직원은 상환이 어려운 채무자의 신용상담, 채무조정 등 보다 전문적인 상담을 수행하여 차주의 재기지원과 채권 회수를 추진할 예정이다.이영 장관은 “디지털 기술을 활용하여 정책지원의 효율성과 정책고객의 편의성을 높이는 것이 정부가 나아가야 할 방향”이라며 “상담 보이스봇을 통해 생업에 바쁜 소상공인이 상환 일정을 안내받지 못해 연체하는 일이 발생하지 않도록 하겠다”라고 밝혔다.보이스봇은 전용번호로 연체 소상공인에게 상담 전화를 걸 예정이며, 소상공인시장진흥공단의 전화라는 안내메시지도 표시된다.이번 ‘단기연체 상담 보이스봇’은 카카오와 제휴하여 시범적으로 도입하며, 성과가 우수할 경우 확대 운영할 계획이다."
2023.03.06.,"카카오게임즈 '아키에이지워', 캐릭터 생성 서버 추가 증설...이용자 몰렸다",https://n.news.naver.com/mnews/article/092/0002284546?sid=105,"3월 21일 출시 앞두고 사전 캐릭터명 선점 프로모션 실시카카오게임즈(대표 조계현)는 6일 엑스엘게임즈(각자 대표 송재경, 최관호)가 개발 중인 대작 MMORPG ‘아키에이지 워’의 사전 캐릭터명 선점 서버를 추가 증설했다.회사 측은 지난 달 말 총 16개 서버에서 캐릭터명 선점 이벤트를 시작했고, 약 2시간 만에 7개 서버의 캐릭터 생성이 마감됐다. 서버 최대 인원수를 확대한 이후에도 일부 서버 생성 마감, 다른 서버도 ‘혼잡’ 상태가 되는 등 이용자들의 높은 관심이 이어졌다.이후에도 캐릭터명 선점 이벤트 참여자가 지속적으로 유입되자 신규 서버 ‘타양’을 추가로 오픈하고 2차 캐릭터명 선점 이벤트에 나섰다고 회사 측은 설명했다.카카오게임즈, 아키에이지 워 2차 캐릭명 이벤트 실시.PC모바일 크로스플랫폼 MMORPG ‘아키에이지 워’는 원작 ‘아키에이지’ 대비 전쟁과 전투 요소가 강조된 신작이다. 언리얼 엔진4로 완성된 심리스 월드와 상쾌한 전투 속도감을 강점으로 내세웠다. 또한 광활한 바다를 배경으로 한 해상전도 구현되어 한 층 다채로운 게임플레이를 즐길 수 있다.지난 1월 16일 사전 예약을 시작한 ‘아키에이지 워’는 닷새 만에 예약자 100만 명을 모집한 데 이어 지난 달 10일 사전 예약 150만 명을 돌파하며 대세감을 입증했다는 평가다. 누적 인원수 달성 보상에 따라 사전 예약에 참여한 이용자는 '희귀 직업 선택권'과 '희귀 선박 건조대 상자'를 받을 수 있고, 친구 초대 이벤트 참여 시 추가 보상을 획득 가능하다.‘아키에이지 워’는 오는 21일 국내 구글 플레이 스토어와 애플 앱스토어에 정식 출시된다. 이 게임은 라이온하트스튜디오가 개발한 ‘오딘: 발할라 라이징’에 이어 MMORPG 게임판을 바꿀 흥행 기대작으로 꼽히고 있다."
2023.03.06.,"카카오뱅크, 개인사업자 신용대출 금리 최대 0.4%p 인하",https://n.news.naver.com/mnews/article/215/0001086787?sid=101,"카카오뱅크가 오는 6월 30일까지 개인사업자 신용대출의 금리를 최대 0.4%포인트 인하하는 특별 프로모션을 진행한다.이번 특별 프로모션을 통한 금리 인하를 적용하면 카카오뱅크 개인사업자 신용대출 금리는 최저 기준 연 4.68%에서 연 4.28%까지 낮아진다.이는 6일 기준 금융권 개인사업자 신용대출 상품 중 가장 낮은 수준의 금리다.카카오뱅크 개인사업자 신용대출은 관련 서류를 별도 제출하지 않고 쉽고 빠르게 신청할 수 있도록 한 상품이다.6일 기준 약 2000억원의 공급액을 기록하며 성장하고 있다. 사업자등록 후 영업 중인 개인사업자라면 신청 가능하다. 대출 가능 최대 금액은 1억원이다.카카오뱅크는 지난달에는 신용대출, 마이너스통장대출의 금리도 인하한 바 있다.주택담보대출 대환 고객에게 금리 할인 혜택을 제공하고 전월세보증금 대출 금리 인하 특판도 진행하는 등 고객의 이자 부담 경감 방안을 추진 중이다.카카오뱅크 관계자는 “금리 인상기 개인사업자 고객의 부담을 덜어주고자 금리 인하 특판을 마련했다”며 “금리 경쟁력을 갖춘 대출 상품을 비롯해 사업 관련 편의 서비스도 지속 선보여 개인사업자 고객의 혜택 강화에 힘쓰겠다”고 전했다."
2023.03.06.,공세 고삐 쥔 하이브...장고 들어간 카카오,https://n.news.naver.com/mnews/article/215/0001086988?sid=101,"SM 분쟁 '2라운드' 시작'1조 실탄' 확보 나선 하이브입장 표명 자제…장고 들어간 카카오<앵커>법원의 결정으로 SM 경영권 분쟁이 '2라운드'에 접어든 가운데, 하이브는 오늘도 SM과 카카오를 향해 공세를 이어갔습니다.카카오는 입장 표명을 자제하며 장고에 들어갔는데요.신선미 기자입니다.<기자>법원의 가처분 인용으로 일단 승기를 잡은 하이브.오늘은 SM에 카카오와 투자계약을 아예 해지하고 이사 후보 지명을 철회 처리할 것을 요구했습니다.하이브가 추가 압박에 나선 것은 아직 변수가 남아 있다는 판단에 따른 것으로 풀이됩니다.1대 주주에 오르긴 했지만, 공개매수에 실패해 현재 지분율은 20% 남짓, 아직 안심할 수준은 아닙니다.여론전을 통한 우호지분 확보로 주총 표대결에 집중한단 전략입니다.카카오는 시장의 관심인 공개매수 여부에 대한 입장 표명을 자제한 채 장고에 들어갔습니다.카카오는 오늘 저녁 열기로 했던 긴급 이사회가 언론에 알려지자 돌연 취소할 만큼, 신중한 행보입니다.엔터 사업을 키우기 위해 SM 인수가 필요하지만, 지분율 0%에서 시작해야 하는 만큼 커지는 인수 비용이 부담입니다.사우디아라비아 국부펀드 등으로부터 조달한 1조2천억원의 실탄이 있지만,하이브도 SM 인수 '2차전'을 앞두고 최대 1조원 규모의 투자금 유치에 나선 것으로 알려지면서 '쩐의전쟁'에서 유리하다는 장담도 힘든 상황이라는 분석도 나옵니다.때문에 카카오가 국민연금과 KB자산운용 등 주요 투자자 지분을 블록딜 방식으로 사들이는 전략도 구사할 가능성도 제기되고 있습니다.한국경제TV 신선미입니다."
2023.03.06.,"카카오모빌리티, 퀵·도보 배송기사도 건강검진 무상지원",https://n.news.naver.com/mnews/article/029/0002787387?sid=105,"카카오모빌리티가 지난해 7월부터 운영해 온 '플랫폼 종사자 건강보호 지원사업' 적용 대상을 퀵·도보배송 기사까지 확대한다. 카카오모빌리티 제공    카카오모빌리티는 '플랫폼 종사자 건강보호 지원사업' 적용 대상을 확대한다고 6일 밝혔다. 이달부터 기존의 대리운전 종사자는 물론 퀵과 도보배송 기사도 건강검진 무상 지원을 받을 수 있다.카카오모빌리티는 전국대리운전노동조합의 단체교섭과 현장 목소리 경청을 통해 야간 노동자 지원 방안의 일환으로 지난해 7월부터 11월까지 총 5개월간 '대리기사 건강검진 무상지원 사업'을 진행한 바 있다. 총 860여명의 대리운전 종사자가 건강검진 수검을 완료했으며 약 400여명이 건강관련 상담을 받았다. 특히 안전보건공단의 직종별 건강진단 사업에서 대리기사의 참여인원이 전년 대비 15배 이상 증가하며 해당 사업이 건강검진 접근성 증가에 기여한 것으로 분석됐다.카카오모빌리티는 올해도 안전보건공단과 손잡고 고용노동부 주관의 '플랫폼종사자 일터개선 지원 사업'에 참여한다. 기존에 지원해왔던 대리기사에서 퀵, 도보배송기사로 대상을 확대하고 이들이 무상으로 건강검진을 받을 수 있도록 안전보건공단의 직종별 건강진단 비용 중 20%에 해당하는 자기부담금 전액을 지원한다. 건강검진은 대한산업보건협회, 한국의학연구소, 한국산업보건연구재단 등 지정 협약 병원에서 시행된다. 검진 항목에는 업무 특성에 맞는 뇌심혈관계중심으로 구성된 '직종별 건강검진'과 야간에 근무하는 대리기사들에게는 불면증 등을 검진할 수 있는 특수건강진단도 들어간다. 국가가 제공하는 '공단 일반검진' 대상자인 경우 이 역시 함께 받을 수 있다. 신청 절차도 간소화해 편의성을 높였다. 오는 11월 30일까지 카카오 T 대리 기사앱 또는 픽커앱 내 공지사항에서 예약 신청을 할 수 있으며 병원의 최종 예약 확정 안내를 받은 후 일정에 맞춰 검진을 받으면 된다. 건강검진 수검률 증대를 꾀하고자 건강검진 완료자 선착순 2000명에게 2만원 상당의 건강물품도 지급하는 프로모션도 진행한다.카카오모빌리티는 향후에도 안전보건공단과의 지속적인 협력으로 플랫폼 종사자의 일터 개선을 위한 노력을 이어나간다는 포부다. 올해 2분기 내 베테랑 기사 교육 등 대리운전 종사자들을 위한 근로자 보호 추가 사업도 운영할 예정이다.류긍선 카카오모빌리티 대표는 ""향후에도 건강 복지 혜택 사각지대에 있는 플랫폼 종사자를 대상으로 지원 프로그램을 지속적으로 확대하고 장기적인 상생과 동반성장 마련을 위해 노력할 계획""이라고 말했다."
