기사날짜,기사제목,네이버 뉴스 url,기사내용
2023.03.04.,대출금리 줄줄이 내린다던데......영끌족은 여전히 '비명',url없음,<네이버 기사 없음>
2023.03.04.,"[종합] 이수만 ""내게 '더 베스트'는 하이브…BTS 성공은 국민 모두의 자랑""",https://n.news.naver.com/mnews/article/312/0000599352?sid=106,<구조 다름>
2023.03.04.,"경남도-공군교육사령부, 우주항공산업 협력 '맞손'",https://n.news.naver.com/mnews/article/079/0003743777?sid=102,"박완수 경남지사(우)와 유재문 공군교육사령관. 경남도청 제공경상남도는 박완수 지사와 유재문 공군교육사령관이 만나 우주항공산업 발전 방안을 논의하고 협력을 약속했다고 4일 밝혔다.유 사령관은 우주산업 발전을 위한 민군 우주협력 방향과 '우주발전 협의체' 추진 현황을 설명한 뒤 정주 여건 조성과 관계 기관 유치를 위한 도의 참여와 주도적인 역할을 요청했다. 박 지사는 ""각 분야의 전문가가 참여해 산업육성과 기술개발, 인력육성과 관광 등 다방면에 걸친 우주경제 비전을 6월까지 제시할 것""이라며 ""우주항공산업에 있어 공군의 역할도 중요한 만큼 경남의 우주항공산업 육성에 공군할께 해 달라""고 당부했다.1973년 창설된 공군교육사령부는 1988년 경남 진주로 이전해 정예 공군을 양성하고 있다.현재 우주인력 양성을 위한 항공우주통제학교 창설을 추진 중으로 장교와 부사관, 병사 등을 대상으로 우주통제·관제, 우주감시·기상, 무인항공기 조종·정비 등을 교육한다.도는 우주교육 기관이자 경남 대표 군 우주기관으로서 전문인력 양성의 주도적인 임무를 수행할 것으로 기대했다.※CBS노컷뉴스는 여러분의 제보로 함께 세상을 바꿉니다. 각종 비리와 부당대우, 사건사고와 미담 등 모든 얘깃거리를 알려주세요.이메일 : jebo@cbs.co.kr카카오톡 : @노컷뉴스사이트 : https://url.kr/b71afn"
2023.03.04.,"'미스터트롯2' 전국 투어, 5월 5일 서울서 개막",https://n.news.naver.com/mnews/article/079/0003743798?sid=106,<구조 다름>
2023.03.04.,"투표 개시한 與전당대회…과반이냐 결선이냐, 2위는 누구?",https://n.news.naver.com/mnews/article/079/0003743754?sid=100,"국민의힘 지지층 여론조사, '부동산 의혹'에도 金 40%대  1위金 ""1차 과반 압도적 승리가 목표""…""과반 확신 힘들어"" 목소리도경쟁후보들 서로 ""내가 2위""…""결선서 安뽑을 것"" VS ""실버크로스""3일 서울 마포구 동아디지털미디어센터에서 열린 국민의힘 제4차 방송토론회에서 황교안, 김기현, 안철수, 천하람 당대표 후보가 기념촬영을 하고 있다. 국회사진취재단국민의힘 전당대회 선거인단 투표가 4일 시작된 가운데, 각종 여론조사에서 선두를 달리고 있는 김기현 후보가 과반 득표에 성공해 결선투표 없이 승부를 마무리 지을 수 있을지가 주목된다. 만약 김 후보가 과반에 실패한다면 안철수‧천하람‧황교안 후보 중 2위로 결선에 올라갈 후보가 누가 될지에도 관심이 집중되고 있다. '울산 땅 투기' 의혹에도 金선두 '굳건'…""목표는 1차 과반"" 최근 발표된 국민의힘 지지층 대상 여론조사를 종합하면 김기현 후보는 경쟁 후보들을 오차범위 밖으로 앞서며 '1강 3중'의 판세를 이어가고 있다. 김 후보는 '울산 땅 투기' 의혹에 대한 경쟁 후보들의 공세에도 과반에 가까운 지지율로 선두를 유지 중이다. 3일 서울 마포구 동아디지털미디어센터에서 열린 국민의힘 제4차 방송토론회에서 김기현 당대표 후보가 토론회 준비를 하고 있다. 국회사진취재단여론조사 전문기관 여론조사공정㈜이 데일리안 의뢰로 지난달 27~28일 국민의힘 지지층 485명을 대상으로 당 대표 적합도를 물은 결과, 김기현 후보는 45.9%의 지지율로 1위를 차지했다. 안 후보가 23.0%, 천 후보 12.7%, 황 후보 10.6%로 뒤를 이었다.(표본오차 95% 신뢰수준에 ±3.1%p로 응답률 2.7%) 뉴시스가 국민리서치그룹과 에이스리서치에 의뢰해 지난달 25~27일 국민의힘 지지층 538명을 대상으로 실시한 조사에서도 김 후보는 47.1% 지지를 얻어 2위 안 후보(22.6%)를 두 배 이상 앞섰다. 천 후보는 16.4%, 황 후보는 9.9%를 기록했다.(표본오차 95% 신뢰수준에 ±4.23%p로 응답률 1.6%). 김 후보는 결선을 거치지 않고 1차 투표에서 과반을 차지하는 것을 목표로 하고 있다. 윤석열 대통령의 당무개입 논란과 '친윤' 의원들의 노골적인 밀어주기에도 과반득표에 성공하지 못한다면 당 운영은 물론 대통령에게도 부담이 될 수밖에 없다. 김 후보는 3일 기자들과 만나 ""처음부터 1차 과반, 압도적 승리를 목표로 뛰어왔고 지금도 흔들림 없이 앞을 향해 나가겠다""며 ""매우 빠른 속도로 지지율이 올라가는 것을 확인할 수 있었다""고 말했다. 金과반득표 여부…""결선 배제 못 해"" VS ""과반 조금 웃돌 것"" 국민의힘 당 대표 경선 후보들. 국회사진취재단다만 결선투표 여부에 대한 당내 반응은 엇갈린다. 먼저 김 후보가 여론조사에서 선두에 있지만 '과반 확보'를 장담할 수 없는 만큼 결선투표 가능성을 배제할 수 없다는 목소리가 나온다.한 국민의힘 관계자는 ""김 후보의 최종 당선은 몰라도 당장 과반을 넘을 수 있을지는 확신하기 힘들다""며 ""전폭 지원에도 김 후보의 지지율이 40%대에 묶여있고 천하람‧황교안 후보에게 스포트라이트가 옮겨가고 있다""고 말했다. 반대로 국민의힘 지지층 여론조사보다 실제 당원투표에서는 결과가 훨씬 보수적으로 나올 것이라는 전망도 있다. 다른 관계자는 ""김 후보에게 투표하는 당원들은 윤석열 대통령의 적극적 지지층이기 때문에 일반 당원 여론조사보다는 수치가 높게 나올 것""이라며 ""과반을 조금 웃도는 수치로 1차에서 끝나지 않을까 예상한다""고 했다. 安 ""결선서 千‧黃 지지자, 저 뽑을 것"" 千 ""이미 실버크로스""안철수(왼쪽), 천하람 국민의힘 당대표 후보. 국회사진취재단경쟁 후보들은 저마다 본인이 김 후보 뒤를 잇는 2위라고 확신하며 결선투표에서의 뒤집기를 노리고 있다. 여론조사에서는 안 후보가 다른 후보들에 앞서 있지만, 천 후보는 이미 당원들 사이에서는 2위와 3위의 순위가 바뀌는 '실버크로스'가 일어났다고 주장한다. 안 후보는 대통령실과 친윤계에 대한 비판을 다시 시작하며 친윤과 비윤 사이 '낀 정체성' 타파에 주력하며 막판 뒤집기를 시도하고 있다.그는 이날 기자회견을 열고 ""유감스럽게도 단일화의 진정성과 역사적 의의를 부정하고 깎아내리려는 일부 세력이 있다""며 안 후보의 과거 이력을 지적한 친윤계를 겨냥했다. 또 본인의 결선투표 가능성을 확신하며 ""결선에서 천 후보의 개혁성과 황 후보의 도덕성을 지지하는 분들이 저를 뽑아줄 것""이라고 말했다. 반면 천 후보도 본인의 결선 가능성을 자신하고 있다. 그는 지난 2일 CBS라디오에서 ""안 후보가 막판에 대통령실의 반응을 끌어내기 위해 급발진을 하고 계신데 지금 안 후보가 천하람에게 실버크로스를 당했다는 명확한 증거""라고 말했다. 국민의힘 전당대회 선거인단 투표는 4~5일 모바일 투표와 6~7일 자동응답시스템(ARS) 투표를 거쳐 누적된 최종 순위를 오는 8일 일산 킨텍스에서 열리는 전당대회 현장에서 발표한다. 1차 투표에서 과반 이상 득표자가 없을 경우 1위와 2위가 결선투표에 진출해 양자대결을 치른다. 이 경우 오는 9일 추가 일대일 TV토론이 진행되며, 10~11일 투표를 거쳐 12일 최종 결과가 발표된다.※CBS노컷뉴스는 여러분의 제보로 함께 세상을 바꿉니다. 각종 비리와 부당대우, 사건사고와 미담 등 모든 얘깃거리를 알려주세요.이메일 : jebo@cbs.co.kr카카오톡 : @노컷뉴스사이트 : https://url.kr/b71afn"
2023.03.04.,'양회 블루' 어디에?…베이징 미세먼지 농도 기준치 30배,https://n.news.naver.com/mnews/article/079/0003743808?sid=104,"핵심요약양회 개막식 오후 초미세먼기(PM2.5) 수치 평균 147㎍/㎥상대적으로 높은 한국 기준치 보다도 10배나 높은 농도中 양회 등 중요행사 때마다 대기질 개선 노력한다는데…베이징 환경보호 관측센터 홈페이지 캡쳐중국 정부가 연례 최대 정치행사인 양회(兩會)를 맞아 개최지인 베이징의 대기질 개선에 심혈을 기울였지만 개막 첫날 부터 미세먼지 농도가 기준치의 수십배에 달하며 체면을 구겼다.베이징 환경보호 관측센터에 따르면 양회 첫 일정인 인민정치협상회의 개막식이 열린 4일 오후 3시 기준 베이징의 초미세먼기(PM2.5) 수치는 평균 147㎍/㎥를 기록했다.이에 관측센터 측은 ""어린이, 노인, 심장병 및 호흡기 질환 환자는 장기간의 고강도 야외 운동을 줄여야 한다""고 권고했다.세계보건기구(WHO)의 초미세먼지 권고치가 5㎍/㎥라는 점을 감안하면 기준치 보다 30배 가량 대기질이 나쁜 상황이다. 기준치가 상대적으로 높은 한국(15㎍/㎥)과 비교해 봐도 농도가 10배나 높다.4일 스모그 가득한 중국 베이징 하늘. 연합뉴스대기오염으로 악명이 높은 중국에서는 올림픽 같은 국제행사나 양회 등 세간의 이목이 집중되는 국가 차원의 대형 행사가 열릴 때마다 대기질 개선에 심혈을 기울인다.이에 따라 이런 행사 때는 파란 하늘을 볼수 있다는 의미에서 'OO 블루'로 불렸지만 이번 양회에서는 첫날부터 대기질이 악화되며 '양회 블루'는 멀어졌다. 이는 과거와 달리 대형 행사가 열린다고 해서 베이징 주변의 공장 가동을 강제로 멈추는 등의 행정 제재가 쉽지 않기 때문으로 보인다.앞서 베이징시 생태환경국은 지난 1월 기자회견에서 연평균 초미세먼지 농도가 1㎥당 30㎍으로, 베이징의 하늘이 관측 이래 가장 맑았다고 밝히면서 이는 공기질 개선에 노력한 결과라고 홍보한 바 있다.※CBS노컷뉴스는 여러분의 제보로 함께 세상을 바꿉니다. 각종 비리와 부당대우, 사건사고와 미담 등 모든 얘깃거리를 알려주세요.이메일 : jebo@cbs.co.kr카카오톡 : @노컷뉴스사이트 : https://url.kr/b71afn"
2023.03.04.,中 양회 개막…'대외 개방' 강조하며 해외투자자에 러브콜,https://n.news.naver.com/mnews/article/079/0003743802?sid=104,"핵심요약4일 자문기구 '정협' 개막, 5일 국회격 '전인대' 개막전인대 개막식에 공개될 올해 경제성장률 목표치에 관심 집중미국에 견제구 날리면서도 EU와는 협력 강조하며 '러브콜'신임 리창 총리 신고식도…시진핑 비서실장? 대외개방 전도사? 정협.전인대 모두 대외 개방 강조 ""결심과 의지 확고부동""시진핑 집권 3기의 공식 출정식 격인 양회(兩會·전국인민대표대회와 전국인민정치협상회의)가 개막하는 4일 회의장인 베이징의 인민대회당 앞이 참가자와 취재진으로 붐비고 있다. 연합뉴스중국 연례 최대 정치행사인 양회(兩會)가 4일 자문기구인 중국인민정치협상회의(정협) 1차 회의를 시작으로 개막한 가운데 정기국회 격인 전국인민대표대회(전인대)도 다음날 개막식을 열고 공식 일정에 돌입한다. 양회는 정협과 전인대를 통칭하는 용어다.왕차오 전인대 대변인은 이날 열린 사전 기자회견을 통해 이번 전인대가 전국에서 모인 2900여명의 대표가 참여한 가운데 다음날 오전 개막식을 시작으로 오는 13일까지 모두 9일간 일정에 돌입한다고 밝혔다.회의 의제는 모두 9개로 정부 업무보고와 예산보고, 국무원 개혁안의 심의, 그리고 국무원 등 국가기관 구성원 의결 등이 이뤄질 예정이다.이번 전인대의 하이라이트인 올해 중국의 경제성장률 목표치 발표는 다음날 열리는 개막식에서 총리 정부업무 보고때 이뤄진다. 이와 관련해 관영매체 글로벌타임즈는 전날 경제학자들의 전망을 인용해 정부가 5% 이상의 경제성장률 목표치를 제시할 것이라고 보도했다.7일에는 친강 외교부장(장관)이 내외신 기자들을 대상으로 기자회견을 연다. 올 초부터 풍선 사태와 러시아 무기지원 검토 의혹 등으로 미국 등 서방세력과 갈등을 빚고 있는 중국이 올해 어떤 외교 기조를 취할지 엿볼 수 있는 자리가 될 전망이다.이와 관련해 이날 왕 대변인은 ""일부 국가는 사익을 위해 국제법에 부합하지 않는 방식으로 국내법의 치외법권 적용을 자주 남용하고 외국 단체와 개인을 무자비하게 억압했다""며 미국에 대해 견제구를 날리면서도 ""중국과 EU 사이에는 근본적인 전략적 차이나 갈등이 없으며 오히려 광범위한 공동 이익과 장기적인 협력 기반이 있다""고 EU에 대해서는 러브콜을 보내기도 했다.지난해 전인대 개막식 입장하는 시진핑. 연합뉴스또, 13일로 예정된 폐막식 날에는 리커창 총리의 바통을 이어받을 신임 총리가 기자회견을 열고 신고식을 가진다. 시진핑 국가주석의 측근 그룹 '시자쥔(習家軍)'의 대표주자인 리창 중앙정치국 상무위원의 신임 총리 임명이 이미 예약된 가운데 그가 이번 기자회견을 통해 어떤 면모를 보여줄지 관심이 모아지고 있다.일각에서는 그가 경제정책을 총괄한 전임 총리와 달리 사실상 시 주석의 비서 역할에 그칠 것이라는 전망이 나오기도 한다. 다만, 다른 한편에서는 중국 경제의 중심지 상하이 총서기를 거치며 해외 기업들과 활발히 교류한 그가 시 주석의 총애를 바탕으로 과감한 대외 개방과 민간 중심 경제체제로의 전환을 주도할 것이라는 관측이 나오기도 한다.이런 가운데 이날 열린 기자회견에서는 중국의 대외 개방 의지가 다시 한번 강조됐다. 왕 대변인은 ""전면적으로 사회주의 현대화 국가를 건설하는 새로운 여정에서 중국의 개혁.개방 결심과 의지는 확고부동하다""고 강조했다.전날 열린 정협 사전 기자회견에서도 궈웨이민 대변인은 ""중국은 세계 정세에 상관없이 흔들리지 않고 세계를 향한 고도의 대외 개방 정책 기조를 계속 유지해나갈 것""이라고 밝혔다.이는 시진핑 1인 독주체제와 국가주도 경제 운용에 대한 우려, 지난 3년간의 강력한 봉쇄 조치로 인한 후유증, 그리고 미국 등 서방세력의 대중국 제재 등으로 중국 투자를 망설이는 해외 투자자들에 대한 러브콜로 해석된다.※CBS노컷뉴스는 여러분의 제보로 함께 세상을 바꿉니다. 각종 비리와 부당대우, 사건사고와 미담 등 모든 얘깃거리를 알려주세요.이메일 : jebo@cbs.co.kr카카오톡 : @노컷뉴스사이트 : https://url.kr/b71afn"
2023.03.04.,"티아고, K리그2 이어 K리그1도 접수 중…대전 2경기 무패",https://sports.news.naver.com/news.nhn?oid=079&aid=0003743801,<구조 다름>
2023.03.04.,이수만 “나 없는 SM 준비했어야…내게 ‘더 베스트’는 하이브”,https://n.news.naver.com/mnews/article/119/0002689103?sid=106,<구조 다름>
2023.03.04.,경남도 기획조정실장 직무대리에 김기영 지방이사관 임명,https://n.news.naver.com/mnews/article/079/0003743775?sid=102,"경남도청 제공경상남도는 오는 6일 자로 김기영 지방이사관을 기획조정실장 직무대리에 임명한다고 4일 밝혔다.신임 김 실장 직무대리는 지방행정고시에 합격해 1997년부터 공직 생활을 시작했다. 경남도 서부지역본부장, 경제통상국장, 해양수산국장, 밀양시 부시장 등을 역임했다.전임 하종목 기획조정실장은 창원시 제1부시장으로 자리를 옮겼다.※CBS노컷뉴스는 여러분의 제보로 함께 세상을 바꿉니다. 각종 비리와 부당대우, 사건사고와 미담 등 모든 얘깃거리를 알려주세요.이메일 : jebo@cbs.co.kr카카오톡 : @노컷뉴스사이트 : https://url.kr/b71afn"
2023.03.04.,순천 월등 대형 산불 날 밝자 헬기투입 잔불 정리,https://n.news.naver.com/mnews/article/079/0003743770?sid=102,"헬기가 산불 현장에 물을 투하하고 있다. 순천시 제공순천에서 발생한 대형 산불이 대부분 진화되면서 4일 날이 밝자 헬기가 다시 투입돼 잔불 정리에 나섰다.전라남도와 순천시 등은 산림청 헬기 11대와 지자체가 임차한 헬기 5를 이날 오전 7시부터 띄워 남아있는 불씨를 진화하고 있다.산에서 잔불을 진화하고 있다. 순천시 제공진화인력 250여 명과 등짐펌프 등 진화장비 400점도 동원됐다.밤 사이에 불씨가 되살아나거나 추가적인 산불 확산 우려는 없는 것으로 알려졌다.3일 오후 2시 32분 순천시 월등면 망용리에서 산불이 났다는 신고가 접수돼 저녁 7시 50분쯤 진화됐다.산불은 초속 10m 이상의 강한 바람을 타고 번져 산림 47헥타르(14만 여 평)와 비닐하우스 2동을 태웠으며 인명피해는 없다.마을에 피해가 없도록 방화선이 구축됐고 주민 90여 명이 대피 후 귀가했다.오후 4시 30분에는 예상 피해 면적 30~100ha 이상이고 진화 예상 시간 24시간 이상 등 일 때 발령되는 산불 2단계가 발동되기도 했다.노관규 순천시장이 산불 현장에서 모니터를 가리키고 있다. 순천시 제공순천소방서 등은 과수원에서 폐 농자재를 태우다 근처 산으로 불이 옮겨 붙은 것으로 추정하고 있다.산불 현장을 지휘한 노관규 순천시장은 ""영농 폐기물을 논밭에서 소각하지 말고 담뱃불도 유의해 달라""고 당부했다.※CBS노컷뉴스는 여러분의 제보로 함께 세상을 바꿉니다. 각종 비리와 부당대우, 사건사고와 미담 등 모든 얘깃거리를 알려주세요.이메일 : jebo@cbs.co.kr카카오톡 : @노컷뉴스사이트 : https://url.kr/b71afn"
2023.03.04.,"달서구 “주민 소중한 제안, 2024년도 예산 반영”",url없음,<네이버 기사 없음>
