기사날짜,기사제목,네이버 뉴스 url,기사내용
2021.11.07.,"기성노조에 반발하는 MZ노조 ""우린 위원장도 없어요""",https://n.news.naver.com/mnews/article/009/0004875411?sid=102,"'블라인드 앱'서 조합원 모집직원 인증만 하면 누구나 가입노조 내부서도 상명하복 없어◆ 목소리 커지는 MZ 노조 ◆ 지난 8월 15일 서울교통공사 MZ세대 직원이 주축이 돼 출발한 올(All)바른 노동조합이 메타버스 세계에서 노조 출범식을 하고 있다.  [서울교통공사 All바른 노동조합 유튜브 캡처] 직장인 익명 게시판인 '블라인드'로 조합원을 모집하고 'QnA'를 진행한다. 몇천 명이 모여 머리에 띠를 두르는 대대적인 행사 대신 메타버스에서 아바타들이 모여 출범식을 연다. ""위원장 명칭은 싫다""면서 '대표' 직함을 선호하고 2030세대 언어인 '음슴체'도 심심치 않게 보인다. 올 8월 출범한 MZ세대 중심의 서울교통공사 제3노조 '올(All)바른 노조' 모습이다.2030세대가 중심 구성원을 이루는 'MZ 노조'는 2018년 LG전자 '사람 중심 사무직 노조'를 시작으로 SK와 현대자동차 등 사기업에서 점차 생겨났다. 올해 8월에는 '올(All)바른 노조'가 출범하면서 공기업 분야에서도 호응을 얻기 시작했다. 분야는 같지 않지만 이들 'MZ 노조'는 익명성과 개방성, 합리와 공정을 추구한다는 점에서는 크게 다르지 않다.'MZ 노조'의 주요 소통 창구는 '블라인드' 애플리케이션(앱)과 카카오톡 오픈 채팅방이다. 익명이 보장된다는 특징을 공유한다. '올바른 노조'는 집행부를 통해 직원임을 인증하면 익명 닉네임으로 '인증방'에 들어갈 수 있다. LG전자 '사람 중심 사무직 노조' 역시 블라인드로 가입 신청을 받고 네이버 카페에서도 별명을 선택해 활동할 수 있다. '올바른 노조' 관계자는 ""영향력이 강한 기존 노조에서 노조원을 보호하기 위해 익명 운영을 실시했는데, 상명하복식 구조가 아니라 구성원이 자유롭게 의견을 표출할 수 있는 장이 됐다""고 설명했다. 익명으로 활동하는 만큼 조직의 개방성도 높아졌다. 이들이 운영하는 '인증방'에는 민주노총 소속 1노조, 한국노총 소속 2노조 조직원도 직원 인증만 하면 들어와서 의견을 나눌 수 있다. 2030세대가 주축이기 때문에 이들 노조는 우선적으로 공정의 가치를 추구한다는 점도 특징이다. 대표적인 사례가 서울교통공사의 직원 직고용 문제다. 1노조와 2노조는 직고용에 반대하는 입장을 표명한 정도라면 '올바른 노조'는 이에 더해 2018년 일반직으로 전환된 무기계약직을 다시 무기계약직으로 돌려놔야 한다는 강한 요구를 내놓고 있다. 노조 관계자는 ""2030세대 입장에서는 높은 취업 문턱을 넘어 정규직으로 취직했는데 그렇지 않은 경우까지 정규직으로 전환하는 것은 맞지 않다""면서 ""임금이나 재정 등 다른 요소보다 공정의 가치에 반한다고 생각하는 조합원이 많다""고 전했다. 파업과 투쟁이 중심인 기성 노조와 달리 합리적인 요구에 중점을 뒀다는 점 역시 차이점이다. MZ세대가 합리적인 목소리를 적극적으로 내면 회사가 움직인다는 것을 이들은 올해 초 SK하이닉스와 LG전자 경험을 통해 학습했다. SK하이닉스와 LG전자는 MZ세대 요구를 반영해 성과급 체제를 개편한 바 있다. 유준환 LG전자 사무직 노조위원장은 ""물론 노조로서 쟁의 행위는 당연히 할 수 있다""면서도 ""필요 이상으로 투쟁을 남발하는 것에 대해서는 경계하는 게 기본 입장""이라고 말했다.  '올바른 노조' 관계자 또한 ""투쟁보다는 합리적인 '딜'을 유도하는 게 MZ 노조의 특징""이라고 설명했다."
2021.11.07.,"[단독]자산가 대출도 틀어막는다…금융당국 ""금소법 엄격 적용""",https://n.news.naver.com/mnews/article/018/0005080425?sid=101,"대출자 '재산 상황' 따지라는 금소법 규정 엄정 적용불필요한 대출 줄이기 위해 관련 기준 세분화 작업 중[이데일리 서대웅 기자] 금융소비자보호법 적용을 엄격히 해 고액 자산가들의 대출 한도를 줄이는 안이 논의되고 있다. 정부가 “내년부터 가계대출 취급 시 금소법상 ‘적합성 및 적정성’ 원칙을 엄중 적용하겠다”고 밝힌 가운데 은행권이 관련 기준을 마련하는 작업에 착수했다. (사진=연합뉴스)핵심은 간단하다. 금소법에서 요구하는 대출자의 재산 기준을 엄격히 파악하고 대출 한도 측정에 활용한다는 점이다. 은행권에서는 이를 통해 고액 자산가들의 ‘이유 없는 대출’이 줄어들 것으로 전망하고 있다. 실제 재산 파악을 통해 대출 한도를 줄일 수 있고, 재산을 노출하기 싫은 자산가들이 대출을 안 받거나 한도를 축소할 수도 있기 때문이다. “금소법 엄격히 적용해 대출 제한하겠다” 7일 금융당국과 업계에 따르면 은행권은 금소법에서 적용하는 ‘적합성·적정성’ 원칙 기준을 세분화하는 작업에 착수했다. 지난달 26일 정부가 발표한 가계부채 관리방안에 대한 후속 조치다. 앞서 금융위원회는 가계부채 관리방안에서 금융회사의 가계대출 관리 체계 내실화를 위해 내년 1월부터 ‘적합성’과 ‘적정성’ 두 원칙을 엄중하게 적용한다고 밝혔다. [이데일리 이미나 기자]적합성과 적정성의 원칙은 금융사가 보장·투자·대출성 상품을 적절한 소비자에게 적법하게 판매하라는 금소법상 규율이다. 이중 적합성 원칙은 금융사가 판매 권유를 할 때 적용한다. 금융사가 올바른 금융상품 정보를 제공해 금융 소비자가 제대로 된 판단을 할 수 있게 도와야 한다는 준칙이다. 적정성 원칙은 소비자가 자발적으로 상품 계약 의사를 밝힐 때 적용된다. 금융사가 소비자의 상품 계약 의사가 적정한지 따져야 한다는 뜻이다. 이들 원칙의 세부기준은 차주의 재산 현황 파악과 그 활용법에 있다. 금소법(제17조2항3호, 18조1항3호)에 따라 대출성 상품을 판매하는 금융회사는 △금융소비자 재산상황 △신용 및 변제계획을 확인해야 한다. 지난 3월 25일 금소법 시행 후 이 원칙(적합성·적정성)이 적용되고 있지만, 대출자의 재산상황 파악은 형식적인 차원에서 이뤄졌을 뿐이다. 시중은행 관계자도 “부채 현황은 신용정보원을 통해 타 금융기관의 정보까지 가져올 수 있지만, 재산 상황은 자행 정보에서만 확인이 가능할 뿐, 소비자가 밝히는 재산 목록에 전적으로 의존해야 한다”고 말했다. 이 같은 맥락에서 금소법 적용 강화 방침은 가계부채 관리 방안과 맞닿아 있다. ‘금융사는 대출을 해줄 때 대출자들의 재산을 보다 철저히 파악하라’는 취지가 담겨 있어서다. 관건은 금융사가 파악한 대출자의 재산 상황을 어떻게 활용하는가이다. 금융 당국 관계자는 “대출 실행 시 건물, 토지가 있다면 이를 감안할 수 있을 것”이라고 말했다. 이번 가계부채 관리방안 핵심이 ‘꼭 필요한 차주에게 상환 능력만큼만 취급하라’인 만큼, 고액 자산가라면 한도를 줄이지 않겠느냐는 분석이 적지 않다. 고액 자산가 재산 파악이 일종의 대출 장애물이 될 수 있다는 뜻이다. 다만 이 관계자는 “소득은 적지만 재산이 많다면 한도를 확대하는 안도 적용될 수 있을 것”이라고 덧붙였다. 은행권 내 고위 관계자는 “관련 기준 마련 작업에 이제 착수해 논의하고 있다”면서 “아직 정해진 것은 없다”고 말했다. 금소법, 소비자를 위한 법이지만 금융사 규제로 금소법은 지난 3월 25일부터 시행됐다. 발의된 시점은 이보다 10년전인 2011년이었다. 당시는 저축은행 사태로 시끄러웠던 때다. 무분별한 금융사의 대출 혹은 금융상품 판매로 소비자들이 피해를 입자 이를 막기 위한 취지로 금소법이 나왔다.  이후 국회에서 계류되다가 해외금리연계파생상품(DLF), 사모펀드 사태 등이 잇따라 일어나자 2020년 3월 들어서야 국회에서 통과됐다. 금소법은 금융 소비자를 보호한다는 취지지만 금융사를 직접 규제할 수 있다는 특성이 있다. 지난 9월 당국은 온라인 플랫폼도 금융 상품 판매를 판매하기 위해서는 오프라인 금융사처럼 판매 라이선스가 있어야 한다고 해석하기도 했다. 카카오페이 등 온라인으로 금융상품을 판매하던 기업들은 판매 방식을 바꿔야 했다. 이 때도 금소법이 근거였다."
2021.11.07.,[인턴액티브] 쌓인 일회용 배달 용기에 죄책감 들었다면?,https://n.news.naver.com/mnews/article/001/0012774872?sid=103,"다회용기 배달로 음식 손상 막고 쓰레기 줄여요용기 크기 다양화·추가 비용 부과 개선 필요해서울시 ""오는 8일부터 한 달간 추가 비용 없이 운영""(서울=연합뉴스) 최경림 인턴기자 = ""500원 아껴서 부자가 될 수는 없지만 환경 보호에는 조금이나마 도움 되지 않을까 싶었어요.""    대학생 정한별(22)씨는 점심 메뉴를 고르기 위해 접속한 배달 플랫폼에서 배달 쓰레기를 줄이기 위해 500원을 추가해 다회용기를 선택했다.    정씨가 다회용기를 택할 수 있었던 것은 지난달 12일부터 서울시와 배달 플랫폼 요기요, 주식회사 잇그린 등이 함께 다회용 배달 용기 사용 활성화 사업을 시작했기 때문이다. 4일 기준 서울시 강남구 일대에 위치한 음식점 60곳에서 다회용 배달 용기를 제공한다. 다회용기에 담겨 배달된 샐러드[독자 제공. 재판매 및 DB 금지]    다회용기 배달 서비스를 이용한 후 정씨는 ""설거지나 분리수거가 필요하지 않고 잔반도 처리하지 않아도 돼서 더 편하게 느껴졌다""고 전했다.    다회용기는 식사 후 뚜껑을 닫고 포장 가방에 있는 QR코드를 스캔한 후 회수를 신청, 집 문 앞에 반납할 수 있다. ""다회용기 계속 사용할 의향 있어…용기 크기 다양화 필요해""    다회용기 배달 사업에 참여한 일부 점주들은 다회용기가 일회용기와 비교해 다소 고가임에도 다회용기를 계속 사용할 의향이 있다고 밝혔다.    분식집을 운영하는 남영우(가명·40대)씨는 환경 보호와 더불어 음식 손상을 방지한다는 점에서 다회용기 사용에 만족스러움을 표현했다.    남씨는 ""플라스틱은 강한 충격이 가해지면 (용기가) 손상되거나 깨지기도 한다""며 ""일회용 플라스틱 용기와 비교해 스테인리스 용기는 배달 시 음식 보관에 이점이 있다""고 말했다.서울시와 요기요, 주식회사 잇그린이 함께 다회용기 활성화 사업을 시작했다.[요기요 홈페이지 캡처. 재판매 및 DB 금지]    이와 달리 용기 종류의 다양성에 관해서는 아쉬움을 드러냈다. 남씨는 ""일회용기는 매우 다양하게 크기별로 존재한다""며 ""다회용기는 아직 다양성 면에서 부족한 것 같다""고 지적했다.    다회용기 선택에 따른 추가 비용을 소비자가 부담하는 시스템의 개선이 필요하다는 주장도 있었다.    냉면 음식점을 운영하는 김호영(29)씨는 ""현재 다회용기를 택하면 손님이 비용을 부담하고 있어 손님들이 (다회용 배달 용기를) 잘 이용하지 않는다""고 밝혔다.    다회용기 배달을 원할 시 소비자는 1천 원을 추가로 지불해야 한다. 할인 이벤트가 진행되는 7일까지는 500원을 부담한다.    다회용기를 선택할 때 부과하는 비용에 대해 잇그린 관계자는 ""고객이 지불하는 추가 비용은 다회용기 이용 시 분리배출과 음식물 처리 등을 대행하는 서비스 이용료""라고 밝혔다.    서울시는 재정을 투입해 11월 8일부터 한 달간 추가 금액 없이 다회용기를 제공할 방침이다. 같은 기간 요기요에서는 배달용 다회용기를 선택한 소비자를 대상으로 선물하기 오천 원 상품권을 지급해 다회용기 이용을 독려할 계획이다.    서울시 자원순환과 관계자는 ""시범 사업 동안의 소비자 반응을 토대로 내년 본사업 때 어떻게 지원할지 고려할 것""이라고 밝혔다.    kyoungrim22@yna.co.kr    기사 문의나 제보는 카카오톡 okjebo"
2021.11.07.,[강남시선] 여야 대선 후보 '정책 경쟁'을 희망한다,https://n.news.naver.com/mnews/article/014/0004735491?sid=004,"지난 4월, LG전자가 휴대폰 시장에 뛰어든 지 26년 만에 사업을 접는다고 공식 발표했을 때 LG폰 사용자들만큼 아쉬워한 곳이 있다. 바로 삼성전자다. 당장 LG전자의 휴대폰 철수로 삼성전자의 독점이 더욱 심해질 것이라는 지적이 제기됐다. 휴대폰 선택의 폭이 좁아지고 결국 가격 인상으로 이어질 것이라는 우려다. 어떤 산업이든 선의의 경쟁이 이어질 때 기술 발전은 물론 소비자의 주목도 역시 높아진다. 독점 구조가 지속되면 소비자의 편익이 떨어지는 것은 물론 그 기업조차 우물 안의 개구리가 될 수 있다.   올해 3·4분기 카카오의 분기 매출이 네이버를 넘어섰다. 카카오는 1조7408억원을 달성해 네이버 1조7273억원보다 135억원가량 더 많이 벌었다. 지난 2003년 1·4분기 카카오의 전신인 '다음'은 네이버의 전신인 'NHN'에 1위 자리를 내줬다. 정보기술(IT)업계 절대 아성으로 군림하던 네이버를 따라잡기 위해 카카오는 무려 18년이나 절치부심한 셈이다. 네이버 역시 무너진 자존심을 다시 세우기 위해 밤잠을 설칠 것이다. 벌써 두 회사의 플랫폼 비즈니스 경쟁은 국내를 넘어 해외무대로 확장되고 있다.   대선을 120여일 앞두고 여야 후보가 확정됐다. 대진표를 받자마자 정책 경쟁보다는 막말 경쟁을 시작한 모양새다. 이재명 더불어민주당 대선후보 측은 국민의힘 대선후보로 윤석열 전 검찰총장이 확정되자 '동네 저수지에서 뽑힌 선수'라고 비난했다. 이준석 국민의힘 대표도 이에 질세라 '이재명 후보는 당심도, 민심도 버린 후보'라고 맞받아쳤다. 이 모습을 지켜보고 있는 국민 입장에선 정책이 실종되고 정치만 남은 현 상황이 또다시 연장될까 걱정이 한가득이다.   과거 대선에선 '네거티브'로 상대를 공격한 후보는 국민의 선택을 받지 못했다. 지난 서울시장 선거에서도 '생태탕'과 '페라가모'로 야당 후보를 공격한 여당 후보는 결국 큰 표 차로 낙선했다. 국민들이 여야 유력 후보에게 보고 싶은 것은 어떻게 국민의 삶을 더 나아지게 만들지에 대한 정책 경쟁일 것이다. 정책 경쟁을 통해 기업 간 경쟁을 촉진시키는 공약들이 현실화되고 국민들은 그 편익을 누리는 선순환이 이뤄졌으면 하는 바람이다.   그런 측면에서 이재명 후보가 약속한 '네거티브 규제 방식' 도입이 눈길을 끈다. 금지된 것을 제외하고 나머지는 허용해 주겠다는 것이다. 공무원 1명이 늘어나면 1개의 규제가 새롭게 생긴다는 말이 있다. 문재인정부에서는 증가한 공무원 수만큼 늘어난 규제로 기업들의 발목을 잡았다. 윤석열 후보도 '일자리를 만드는 것은 기업의 창의와 혁신'이라며 불필요한 규제를 혁파하겠다고 약속했다. 특히 윤 후보는 언론 인터뷰에서 '과도한 규제는 그 시장에서 독과점을 유발한다'며 규제에 대한 철학을 밝혔다.   두 후보는 대통령이 된다면 이 같은 약속을 꼭 지켜주길 바란다. 한 가지 더 부탁하고 싶은 것은 '규제 철폐를 위한 위원회' 같은 것은 만들지 말았으면 한다. 위원회에 소속된 공무원들이 기업들에 '없어져야 할 규제 리스트'를 가지고 오라며 시간을 뺏을 것이기 때문이다.   courage@fnnews.com 전용기 정보미디어부장"
2021.11.07.,"일과중에도 훈련병에도…병사 휴대전화 사용 확대, 왜 논란일까",https://n.news.naver.com/mnews/article/079/0003571853?sid=100,"핵심요약국방부, 15사단에서 휴대전화 사용 확대 시범운용 착수기간병 일과 중 휴대전화 사용…훈련병도 평일과 주말에 잠깐 사용군인화 기초군사훈련 중 휴대전화 사용은 유례 찾기 힘든 방식""위험한 훈련 중엔 집중해야 하는데 사고나 사이버 공격 등 우려돼""국방부 ""시범운용 통해 순기능과 역기능 종합적으로 검토해서 결정""연합뉴스지난 2019년부터 병사들이 일과 이후와 주말에 휴대전화를 사용할 수 있게 된 데 이어 평일 일과 중에도 휴대전화를 사용하도록 하는 방안이 추진될 전망이다.다만 막 입대해 군인이 되기 위한 교육훈련을 받고 있는 훈련병들까지 대상을 확대하는 방안도 검토되고 있으며, 시범운용도 실제로 진행되고 있어 논란이 예상된다.국민의힘 강대식 의원실이 국방부로부터 제출받은 자료에 따르면, 국방부는 지난 1일부터 육군 15사단 소속 기간병과 훈련병까지 5천여명을 대상으로 일과 중 휴대전화 사용 1차 시범운용에 착수했다.민관군 합동위 ""시범운용 통해 '전면 시행 여부' 신중히 판단""먼저 기간병은 '24시간 허용', '평일 오전 점호~일과 개시 전(9시)', '평일 오전 점호~오후 9시(훈련 시엔 통제)' 등 3개 그룹으로 나눠 진행하고 있다.병사들은 평일 휴대전화 사용 시간이 평일 일과 뒤(오후 6시~9시)와 주말(오전 8시 30분~오후 9시)로 정해져 있는데, 이를 '일과 중'으로 확대해도 문제가 없는지 검토하기 위한 수순이다.훈련병들도 시범운용 대상에 포함된 점이 눈길을 끈다. 15사단 훈련병들은 '코로나19 시국 고려 입소 첫 주만 평일 30분, 토·일 1시간씩', '1~5주차 평일 30분, 토·일 1시간씩'까지 2개 그룹으로 나뉘었다.연합뉴스이번 조처는 공군 부사관 성추행 사망 사건을 계기로 출범한 병영문화 개선 기구인 민관군 합동위에서 '가족 및 사회와 소통하고 자기 개발 여건 보장을 위한 휴대전화 사용정책 개선 검토'를 권고한 데 따른 일이다.합동위는 당시 ""충분한 시범운용을 통해 병 휴대전화 사용 시간 확대의 순기능·역기능을 분석 후 '전면 시행 여부'를 신중히 판단하라""고 국방부에 제안했다.간부는 작전임무 수행 등 특별한 상황이 아니면 영내에서 휴대전화를 사용할 때 제한이 없는데, 병사만 사용시간에 제한을 두는 일이 차별에 해당한다는 견해도 있다.기초군사훈련 중 휴대전화, 유례 찾기 힘들어…일과 중 사용도 사이버 공격 등 부작용 우려다만 군인이 되기 위한 훈련을 진행하고 있는 훈련병들이 휴대전화를 사용하는 일이 적절하느냐는 비판도 나온다. 막 입대한 뒤 코로나19로 격리를 하고 있는 경우엔 어느 정도 납득될 수 있더라도, 본격적인 군사훈련을 받는 기간은 사회와 단절시키는 일이 보다 합당하다는 비판이다.실제로 우리 군은 장교와 부사관 기초군사훈련 중에도 휴대전화를 사용하지 못하게 한다. 사회에서 벗어나 군인이 되는 과정 중에는 휴대전화가 방해가 될 수 있기 때문이다. 대신 몇 달씩 걸리는 양성 과정 중 외박을 허용하곤 한다. 이는 교육훈련이 엄격한 외국 군대들도 비슷하다.병사들이 일과 중 휴대전화를 사용하는 일 또한, 작전이나 교육훈련 등에서 지장을 초래할 수 있다는 비판이 함께 나온다. 물론 이런 상황에선 간부가 일괄적으로 통제해야 하지만 그 통제가 더욱 힘들어질 수 있기 때문이다. 병과에 따라 군사기밀을 다루는 경우엔 병들도 비밀취급인가를 받게 되는데, 이로 인해 보안사고가 우려된다는 의견도 있다.국방부. 연합뉴스일단 지난해 6월 군인복무정책심의위원회 당시 국방부는 ""2019년부터 시범 기간 동안 병 휴대전화를 통한 비밀 외부 누출 등 보안사고는 1건도 발생하지 않았다""며 ""부대 내 휴대전화 사진 촬영을 통한 보안 유출을 방지하기 위해 모든 부대 위병소 2400여곳에 '보안통제체계' 구축을 완료했다""고 밝혔었다. 다만 당시엔 일과 뒤에만 휴대전화를 사용했던 만큼 상황이 달라질 수 있다.육군 27보병사단장, 특전사령관 등을 지낸 전인범 예비역 중장은 ""훈련 중에는 집중이 요구되는 경우가 많은데 휴대전화는 이를 방해할 수 있으며, 특히 사격과 폭발물 훈련 그리고 매복이나 행군 중에도 휴대전화는 주의를 분산시켜 안전에 직결되는 문제이기 때문에 신중해야 한다""며 ""지금도 많은 부대에서는 회의나 (특정) 시설에 들어가는 경우 휴대전화를 반납하고 있다""고 비판적인 의견을 밝혔다.또한 일과 중 휴대전화를 사용하게 되면 자연스레 업무를 볼 때도 이를 사용하게 될 수 있다. 전 장군은 ""보안사고도 중요한 우려사항이지만 사용자가 인지하지 못하는 사이버 공격을 주의해야 한다""며 ""현 수준에서 사용하는 일이 적절하고, 오히려 사용 요금 할인이나 기기 지원 등에 당국이 관심을 가지면 좋겠다""고 덧붙였다.실제로 현재도 부대 문서 등을 빠르게 공유하기 위해 카카오톡 등 메신저를 사용하는 일이 흔하기 때문인데, 병들까지 대상이 확대된다면 사이버 공격 목표는 더 늘어난다.국방부 부승찬 대변인은 4일 정례브리핑에서 ""일과 중 사용확대 또는 훈련병 대상 허용은 확정된 바 없다""며 ""순기능과 역기능을 종합적으로 검토해 결정할 문제이고, 순기능이 많다면 시범운용 부대를 확대하고 보안과 작전·훈련 시 등을 전반적으로 고려해 결정할 것으로 예정돼 있다""고 설명했다."
