기사날짜,기사제목,네이버 뉴스 url,기사내용
2021.11.16.,"안철수 ""연합뉴스 포털 퇴출, 이중 제재…재고 필요""",https://n.news.naver.com/mnews/article/001/0012795187?sid=100,"""거듭된 규제가 언론자유 위축·침해…언론 통제 항상 경계해야""""언론자유는 절대적 가치…평가·제재 기준 모두가 납득할 수 있어야"" 안철수 대표[연합뉴스 자료사진]     (서울=연합뉴스) 이유미 기자 = 국민의당 안철수 대표는 16일 네이버·카카오 뉴스제휴평가위원회(제평위)의 연합뉴스 뉴스 콘텐츠 제휴 중단 결정에 대해 ""언론의 자유를 침해한다는 우려가 생길 수 있다""고 비판했다.     안 대표는 이날 '연합뉴스 제재, 재고가 필요합니다'라는 제목의 페이스북 글에서 ""연합뉴스는 제평위의 계약 해지로 이달 18일부터 1년간 포털에서 검색 결과 외에는 찾아볼 수 없게 됐다""며 이같이 밝혔다.     그는 ""연합뉴스는 기사형 광고로 인해 이미 32일간의 포털 노출 중단 제재를 받은 바 있다""며 ""처분 기간 연합뉴스는 해당 사업을 했던 부서를 폐지하고 이 사업으로 거둔 수익의 사회 환원을 약속하는 등 재발 방지를 위해 각고의 노력을 다하겠다고 약속했다""고 언급했다.     이어 ""그런데 반성하며 앞으로 소임을 다하겠다는 언론사에, 이미 징계를 받은 동일한 사안에 대해 또다시 중징계가 내려진다면, 이중 제재로 언론의 자유를 침해한다는 우려가 생길 수 있다""고 말했다.     안 대표는 ""언론의 자유는 민주주의 국가에서 존중받아야 할 절대적 가치""라며 ""거듭된 규제가 언론 자유를 위축시켜 결과적으로 언론을 통제하게 되지는 않는지 항상 경계해야 하며, 평가 및 제재는 그 기준에 모두가 납득할 수 있어야 한다""고 강조했다.     또 ""언론 또한 막중한 책임감을 가지고 자정의 노력을 통해 국민들께 신뢰로 인정받을 수 있도록 끊임없이 노력해야 할 것""이라고 밝혔다.     제평위는 연합뉴스가 '기사형 광고'를 내보낸 점을 문제 삼아 지난 12일 뉴스콘텐츠 제휴 해지를 두 포털에 권고했다. 네이버와 카카오는 권고를 받아들여 18일 자로 연합뉴스와의 계약을 해지한다고 통보했다.    연합뉴스는 올해 9월8일부터 10월10일까지 32일 동안 포털 노출 중단 제재를 받은 뒤 대국민 사과를 하고 관련 부서를 폐지했으며 이익의 사회적 환원 등을 약속했지만 사실상 1년간 포털 퇴출이라는 제재를 다시 받게 됐다.    제평위는 언론인 현업단체 8곳, 시민단체 4곳 등 15곳으로 구성된 것으로 알려져 있다. 구성원 과반이 포털에 기사를 제공하는 언론사와 현업 단체 소속이어서 공정성 논란이 끊이지 않았고, 불투명한 운영과 자의적인 권한 행사 등으로 비판을 받아왔다.     이와 관련, 민주당 한준호 의원은 제평위 운영 투명화 등을 골자로 하는 정보통신망법 이용촉진·정보보호법 개정안을 지난달 5일 발의한 바 있다.    yumi@yna.co.kr"
2021.11.16.,"예산군, 카카오 알림서비스 '예산톡' 구축",url없음,<네이버 기사 없음>
2021.11.16.,"카카오게임즈 ‘프린세스 커넥트! 리:다이브’, 신규 캐릭터 ‘레이’ 업데이트",url없음,<네이버 기사 없음>
2021.11.16.,"KRX지수 신규 편입종목, 공매도 타깃 되나",https://n.news.naver.com/mnews/article/014/0004740743?sid=101,"카카오페이·현대重 공매도 급증코스피200 특례편입 후보 꼽혀  12월 한국거래소 KRX 지수 변경을 앞두고 코스피200, 코스닥150 지수 신규 편입 종목에 대한 공매도 가능성이 제기되고 있다.   16일 한국거래소에 따르면 카카오페이의 공매도 거래량은 지난 12일 1044주를 기록하며 전일 대비 23배 넘게 급증했다. 지난 11일 600만원에 불과하던 공매도 거래대금은 12일 1억6000만원으로 크게 늘었다. 현대중공업 역시 지난 11일 300만원이던 공매도 거래대금이 12일 7600만원으로 크게 늘었다.   카카오페이와 현대중공업은 내달 9일 있을 KRX 지수 변경에서 코스피200 특례 편입이 예상되는 종목들이다.   이번 코스피200 정기 변경에서 4개 종목이 편입될 예정이며 코스닥150은 10개 종목의 편출입이 진행된다. 코스피200은 카카오페이, 현대중공업을 포함해 메리츠금융지주, 에스엘의 편입이 예상된다. 코스닥150은 바이오니아, 셀리드, 한국비엔씨, 코미코, 원익QnC, 코나아이, 인터파크, 티케이케미칼, 엠투엔, 나노스 등이 편입 예상 종목이다.   시장 참여자들은 이번 정기 변경에서 공매도 흐름에 주목하고 있다. 공매도가 코스피200, 코스닥150 내 구성종목으로 제한돼 신규 지수 편입 종목은 동시에 공매도 허용 대상이 되기 때문이다.   노동길 신한금융투자 연구원은 ""12월 정기변경 관련 주안점은 공매도""라며 ""공매도가 코스피200, 코스닥150 내 구성 종목으로 제한돼 신규 지수 편입과 동시에 공매도 허용 대상이 된다""고 말했다. 그는 이어 ""반대로 지수 제외 종목군은 공매도 금지에 따른 숏 커버링(공매도 잔고 청산)을 기대할 수 있다""고 덧붙였다."
2021.11.16.,"이삭버거, 카카오TV '런웨이2' 통해 이미주 햄버거 멘토 변신",url없음,<네이버 기사 없음>
2021.11.16.,"안철수 ""연합뉴스 포털 퇴출, 과도한 이중제재…재고 필요""(종합)",https://n.news.naver.com/mnews/article/001/0012795274?sid=100,"""'언론 자유 침해' 과도한 제재 지양해야…언론 통제 항상 경계""""언론 자유 절대적 가치…평가·제재 기준 모두가 납득할 수 있어야"" 안철수 ""연합뉴스 제재, 재고 필요"" (서울=연합뉴스) 국민의당 안철수 대표는 16일 네이버·카카오 뉴스제휴평가위원회(제평위)의 연합뉴스 뉴스 콘텐츠 제휴 중단 결정에 대해 ""언론의 자유를 침해한다는 우려가 생길 수 있다""고 비판했다. 2021.11.16 [안철수 대표 페이스북 캡처] (서울=연합뉴스) 이유미 기자 = 국민의당 안철수 대표는 16일 네이버·카카오 뉴스제휴평가위원회(제평위)의 연합뉴스 뉴스 콘텐츠 제휴 중단 결정에 대해 ""언론의 자유를 침해한다는 우려가 생길 수 있다""고 비판하며 재고를 촉구했다.    안 대표는 이날 '연합뉴스 제재, 재고가 필요합니다 - 언론의 자유를 해칠 우려가 있는 과도한 제재는 지양해야'라는 제목의 페이스북 글에서 ""연합뉴스는 제평위의 계약 해지로 이달 18일부터 1년간 포털에서 검색 결과 외에는 찾아볼 수 없게 됐다""며 이같이 밝혔다.     그는 ""연합뉴스는 기사형 광고로 인해 이미 32일간의 포털 노출 중단 제재를 받은 바 있다""며 ""처분 기간 연합뉴스는 해당 사업을 했던 부서를 폐지하고, 이 사업으로 거둔 수익의 사회 환원을 약속하는 등 재발 방지를 위해 각고의 노력을 다하겠다고 약속했다""고 언급했다.     이어 ""그런데 반성하며 앞으로 소임을 다하겠다는 언론사에, 이미 징계를 받은 동일한 사안에 대해 또다시 중징계가 내려진다면, 이중 제재로 언론의 자유를 침해한다는 우려가 생길 수 있다""고 말했다.     안 대표는 ""언론의 자유는 민주주의 국가에서 존중받아야 할 절대적 가치""라며 ""거듭된 규제가 언론 자유를 위축시켜 결과적으로 언론을 통제하게 되지는 않는지 항상 경계해야 하며, 평가 및 제재는 그 기준에 모두가 납득할 수 있어야 한다""고 강조했다.     그는 ""언론의 자유를 해칠 우려가 있는 과도한 제재는 지양해야 한다""고 밝혔다.     또 ""언론 또한 막중한 책임감을 가지고 자정의 노력을 통해 국민들께 신뢰로 인정받을 수 있도록 끊임없이 노력해야 할 것""이라고 말했다. 국민의당 안철수 대표[연합뉴스 자료사진]     제평위는 연합뉴스가 '기사형 광고'를 내보낸 점을 문제 삼아 지난 12일 뉴스콘텐츠 제휴 해지를 두 포털에 권고했다. 네이버와 카카오는 권고를 받아들여 18일 자로 연합뉴스와의 계약을 해지한다고 통보했다.    연합뉴스는 올해 9월8일부터 10월10일까지 32일 동안 포털 노출 중단 제재를 받은 뒤 대국민 사과를 하고 관련 부서를 폐지했으며 이익의 사회적 환원 등을 약속했지만 사실상 1년간 포털 퇴출이라는 제재를 다시 받게 됐다.    제평위는 언론인 현업단체 8곳, 시민단체 4곳 등 15곳으로 구성된 것으로 알려져 있다. 구성원 과반이 포털에 기사를 제공하는 언론사와 현업 단체 소속이어서 공정성 논란이 끊이지 않았고, 불투명한 운영과 자의적인 권한 행사 등으로 비판을 받아왔다.     이와 관련, 민주당 한준호 의원은 제평위 운영 투명화 등을 골자로 하는 정보통신망법 이용촉진·정보보호법 개정안을 지난달 5일 발의한 바 있다.    yumi@yna.co.kr"
2021.11.16.,"미래에셋증권, ELW 232개 종목 신규 상장",https://n.news.naver.com/mnews/article/018/0005087255?sid=101,"[이데일리 조해영 기자] 미래에셋증권은 주식워런트증권(ELW) 232개 종목의 신규 상장을 완료했다고 16일 밝혔다.이번에 상장하는 종목은 코스피200지수를 기초자산으로 하는 지수형 콜 42종목과 풋 24종목, 종목형 콜 164종목과 풋 2종목이다. 종목형 ELW는 카카오뱅크, 크래프톤, 카카오게임즈 등 다양한 종목을 신규 상장한다. 이를 통해 ELW 투자자들이 다양한 종목을 거래할 수 있게 됐다.ELW는 특정 종목의 주가 또는 주가지수 등을 기초자산으로, 그 변동과 연계해 사전에 미리 정해진 가격으로 사거나 팔 수 있는 권리를 갖는 증권이다. ELW를 거래하려면 금융투자교육원에서 온라인교육을 이수하고 신규고객 기준 1500만원 기본예탁금을 충족해야 한다.미래에셋증권은 ELW 전용 카카오톡 채널을 운영하고 있으며 채널 가입 시 신규 상장 종목 및 전일 종가 기준 ELW 시황정보, 리서치 자료 등 유용한 투자 정보도 매일 받을 수 있다. ELW 매매와 온라인 거래방법에 관련된 문의는 미래에셋증권 고객센터를 통해 확인 가능하다."
2021.11.16.,"네이버·카카오 날아가는데...형제회사 NHN ""우린 구름이라도""[인싸IT]",https://n.news.naver.com/mnews/article/008/0004670847?sid=105,"(왼쪽부터) 이해진 네이버 GIO, 이준호 NHN 회장, 김범수 카카오 의장 /사진=뉴스1네이버·카카오가 최근 4개 분기 연속 사상 최고실적을 경신하고 있다. 일각에서 과도한 플랫폼의 확장에 대한 경계론까지 퍼지는 가운데 이를 우울한 시선으로 지켜보는 회사가 있다. 바로 네이버·카카오의 '형제' 기업이던 NHN이다.  2013년 분사이후 매출규모와 시가총액 등에서 비교가 무의미할 정도로 체급차이가 벌어진 것이다.  IT(정보기술) 업계에서는 확실한 플랫폼의 유무가 운명을 갈랐다는 분석이 나온다.━매출은 3배, 시총은 32~37배 차이…'플랫폼' 유무에 엇갈린 운명━옛 NHN은 네이버·카카오 창업주가 세운 네이버컴과 한게임이 합쳐 세워진 회사다. 김범수 카카오 의장이 2010년 카카오톡을 만든 후 이듬해 NHN을 퇴사하고 이해진 네이버 GIO(글로벌투자책임자)가 2013년 NHN의 검색·플랫폼 부문을 분사하면서 세 기업이 각기 제 갈 길을 갔다.  이준호 NHN 회장이 한게임 등 게임 사업 중심으로 'NHN엔터테인먼트'로 독립한 게  현재의 NHN이다.분사이후 체급차이가 크게 벌어졌다. NHN의 지난해 연매출은 1조6752억원으로 네이버(5조3041억원), 카카오(4조1568억원)의 3분의 1 수준이다. 올들어선 매출 격차가 더 커졌다. 시가총액은 15일 기준 네이버 67조4300억원, 카카오 57조7100억원인 데 비해 NHN는 1조7800억원대로 30배 이상 벌어져있다. 업계에서는 플랫폼이 부재한 NHN의 한계를 지목한다. 네이버는 검색 플랫폼 기반 최대 포털로, 카카오는 국민 메신저 카카오톡을 기반으로한 네트워크 효과를 십분 활용한 반면  NHN의 한게임은 이렇다할 플랫폼으로 성장하지 못했다. 이에 NHN은 △전자지급결제대행(PG) NHN한국사이버결제) △음악 스트리밍(NHN벅스) △웹툰·웹소설(NHN코미코) △예매(NHN티켓링크) △보안(피앤피시큐어) △쇼핑(고도몰) △광고분석(어메이징소프트) 등을 인수하며 신성장동력을 모색중이지만 아직까지 큰 시너지를 내지 못하고 있다.(광주=뉴스1) 박준배 기자 = 이용섭 광주시장이 4일 오전 서구 김대중컨벤션센터 다목적홀에서 열린 국가인공지능 데이터센터 투자협약 및 착수식에 참석해 광주시-NHN㈜-인공지능산업융합사업단간 투자협약을 체결한 뒤 기념촬영을 하고 있다. 왼쪽부터 정우진 NHN㈜ 대표, 이용섭 광주시장, 최기영 과학기술정보통신부 장관, 임차식 인공지능산업융합사업단장.(광주시 제공)2021.2.4/뉴스1  더욱이 주력이던 게임도 부진의 늪에 빠져있다. 한게임 등 게임사업부의 3분기 매출은 전년 동기 대비 4.9% 감소한 955억원으로 집계됐다. 카카오게임 매출이 4631억원으로 NHN의 전체 분기 매출 수준인 것과 대조된다. NHN은 지난해부터 국내 출시할 신작 개발을 중단하고 기존 웹보드 게임과 일본향 신작만 개발하는 것으로 알려졌다.콘텐츠의 또다른 축인 음원서비스 벅스도 사정이 비슷하다.  21년 전통의 국내 최초 음원 서비스라는 명성에 걸맞지 않게 실적부진에 빠져있다.  모바일인덱스에 따르면 지난 10월 MAU(월간순이용자수, 안드로이드+iOS)는 멜론이 816만여명, 네이버 바이브가 86만여명인 데 비해 벅스는 53만명으로 집계됐다. 플랫폼 파워가 큰 멜론(카카오)·유튜브뮤직(구글)·바이브(네이버)뿐 아니라 통신사 고객 기반인 지니뮤직(KT)·플로(SK텔레콤) 등에 확연히 밀린다━플랫폼 영향 덜한 B2B 사업 확장…NHN 체질 개선에 쏠리는 눈━NHN이 반전카드로 삼고있는 것은 B2B 사업이다. 특히 클라우드와 지불결제 분야를 먹거리로 삼고 사업 확대에 나선다. 클라우드 CSP(클라우드서비스 공급) 사업은 후발주자이지만 무서운 속도로 선두권 기업들을 추격하고 있다.  내년 분사를 앞둔 NHN클라우드는  AWS(아마존웹서비스) 등 해외 사업자의 영향력이 덜한 공공 분야에서 네이버와의 맞대결한다. 정우진 NHN 대표는 최근 실적발표 컨퍼런스콜에서 ""(CSP 사업만 따졌을 때) 각 사 내부 매출을 걷어내고 보면 NHN이 네이버 매출의 절반 수준까지는 따라 잡았다""고  말했다. NHN은 경상·전라도 등 남부 지역에서 민간·공공대상 CSP 사업을 확장할 계획이다. 이 역시 수도권을 공략하는 네이버와의 차별화 전략이다. 경남 김해와 광주에 거점 데이터센터를 짓는 것도 이와 무관치않다. 페이코의 경우 간편결제 업계에서 네이버페이·카카오페이와 3강을 형성한다. 특히 페이코는 네이버, 카카오 등 플랫폼과 경쟁하는 제3 인터넷서비스나 오프라인 시장을 중심으로 영향력을 키운다. 실제 페이코 오프라인 결제는 지난 3분기 기준 전년동기 대비 56% 성장했고, 전체 결제액에서 비중도 21%로 늘었다. NHN 관계자는 ""네이버와 카카오에 비해 성장세가 더딘것은 아쉽지만 게임사의 틀을 벗어나 기술기업으로서 차별화를 시도하고있다""면서 ""앞으로 CSP 사업과 두레이 등 클라우드 기반 플랫폼·소프트웨어 사업에다 간편결제 등 신성장동력 육성에 박차를 가할 계획""이라고 말했다."
2021.11.16.,"심야에 택시 잡기 힘들다…수요공급 불일치, 기사 인센티브 필요",https://n.news.naver.com/mnews/article/018/0005087136?sid=105,"카카오T, 하루호출 289만건..코로나전보다 120% 늘어심야 피크시간대 카카오 T 브랜드 택시 호출 수 86% 증가수요 집중 시간대에 오히려 택시 공급 감소심야 운행 자발적 참여 이끌 기사 인센티브 필요[이데일리 김현아 기자]단계적 일상회복에 연말 모임이 겹쳐 저녁 모임이 많아지는 가운데, 심야 택시 대란의 원인은 수요와 공급이 불일치하기 때문으로 나타났다.16일 카카오모빌리티에 따르면 이달 1일부터 시행된 단계적 일상 회복에 따른 이동량 증가로 카카오 T 택시 일 호출 수는 384만건을 기록하며 역대 최고치를 기록하고, 일평균 호출 수도 289만건으로 단계적 일상 회복 시행 직전 2주간 대비 35% 증가했다.하지만, 택시 공급은 수요가 집중되는 심야 피크시간대에 오히려 줄었다. 취객이 많은 심야 운행을 기피하는 경향과 함께, 코로나 19 여파로 법인 택시 기사 수도 감소했기 때문이다.단계적 일상회복 시행 후 일평균 호출 수 변화 (출처: 카카오모빌리티)자정 전후로 수요가 집중단계적 일상회복 시행이후 2주간 카카오T 하루 호출은 289만건으로, 시행 직전 2주간인 10월 18일부터 10월 31일까지와 비교시 120% 늘었다.첫 주말인 11월 6일에는 카카오 T 택시 역대 최대 호출 수를 기록, 하루 동안 384만건의 호출이 발생했다.이 데이터는 전국 기준으로, 일반중형택시부터 카카오 T 블루, 카카오 T 벤티, 카카오 T 블랙 등 브랜드 택시 서비스까지 모두 포함했다. 택시 호출 피크시간대도 이동했다. 사회적 거리두기 기간 동안 22시를 전후로 호출이 집중되는 경향을 보였으나, 단계적 일상회복 시행 후 자정 전후로 수요가 집중돼 심야 피크시간대(22시~02시)의 평균 호출 수는 시행 전 2주간 평균 호출 수와 비교 시 72%가 증가했다. 시간대별 법인/개인 택시 카카오 T 출근 기사 수(2021년 단계적 일상회복 시행 2주간)심야시간 택시공급은 줄어…기사 인센티브 필요그러나 택시 공급은 수요가 집중되는 피크시간대에 오히려 감소했다.택시 공급 부족으로 인한 이용자들의 불편 완화에 ‘목적지 미표기 자동 배차‘ 방식의 카카오 T 블루가 기여하고 있는 것으로 나타났다. 대표적 비선호 호출인 ‘5km 미만 단거리 운행건’에 대해 서울 지역의 경우 카카오 T 블루가 일반 중형 택시보다 15%p 높은 운행 비중을 보였다. 다만, 심야 피크시간대(22시~02시) 전체 카카오 T 브랜드 택시 일평균 호출 수는 86% 증가했다. 이용자들이 일반중형택시를 잡기 어려울 때 다른 서비스로 호출을 시도하는 것으로 보인다.심야 피크시간대(22시~02시)와 새벽시간대(02시~07시)에 카카오 T 블루는 각각 65%와 71%, 카카오 T 벤티는 각각 176%와 212% 증가했다. 프리미엄 택시 서비스 중 가장 요금이 높은 카카오 T 블랙은 심야 시간대 309% 증가했으며, 새벽 시간대에는 무려 2,899% 증가했다.  카카오모빌리티 관계자는 “수요가 폭증하는 상황이기에 목적지 미표기 자동 배차 방식의 브랜드 택시 확대, 모빌리티 기술 활용한 이용자 연속 배차에 노력하지만 한계가 있을 수 밖에 없다“며 “택시 기사들이 수요가 몰리는 심야 및 새벽 시간대에 적극적으로 운행에 참여할 수 있도록 동기 부여를 제공하는 것이 중요하다. 기사 인센티브 등과 같이 자발적 운행 참여율을 높일 수 있는 다양한 제도적 보완이 필요하다”고 말했다."
