기사날짜,기사제목,네이버 뉴스 url,기사내용
2021.11.15.,경찰 “유동규 휴대폰 포렌식 끝나야 검찰과 공유”,https://n.news.naver.com/mnews/article/629/0000116180?sid=102,"대장동 개발 특혜 의혹을 수사 중인 경찰이 유동규 전 성남도시개발공사 휴대폰 포렌식이 끝나야 검찰와 내용 공유가 가능하다고 밝혔다. 사진은 경찰청과 국가수사본부 청사./주현웅 기자요소수 매점매석 등 147건 수사 중…투기 의혹 국회의원 4명 송치 대장동 개발 의혹을 수사 중인 경찰이 유동규 전 성남도시개발공사 휴대폰 포렌식이 끝나야 검찰와 내용 공유가 가능하다고 밝혔다.15일 김창룡 경찰청장은 서면 기자간담회에서 ""유 전 본부장 휴대전화 포렌식이 진행 중""이라며 ""검찰이 포렌식 내용 공유를 요청했으나 수사가 끝나야 검토가 가능하다""고 말했다. 이어 ""증거능력 등을 종합적으로 고려해야 하기 때문""이라고 설명했다.이날 경찰은 요소수 매점매석과 판매 사기 등 관련 사건 147건을 수사 중이라고도 전했다. 각각 물가안정법 위반 10건(매점매석), 대기환경보전법 위반 1건, 온오프라인 판매 사기 136건이다.경찰은 지난주부터 환경부 등 정부 합동단속반과 함께 요소수 매점매석 행위와 불법유통 등을 집중 단속하고 있다. 요소수 온라인 사기를 책임질 수사관서를 지정했으며, 피해 규모가 큰 사건은 시·도청 사이버범죄수사대가 직접 담당한다.전·현직 국회의원의 부동산 투기 의혹 수사와 관련해선 4명을 검찰로 송치했다고 밝혔다. 지난주보다 1명 늘어났으나 대상자와 구체적 혐의는 공개할 수 없다고 했다. 현재까지 신원이 밝혀진 인물은 김경협 더불어민주당 의원, 정찬민 국민의힘 의원, 김승수 국민의힘 의원이다.더팩트는 24시간 여러분의 제보를 기다립니다.▶카카오톡: '더팩트제보' 검색▶이메일: jebo@tf.co.kr▶뉴스 홈페이지: http://talk.tf.co.kr/bbs/report/write"
2021.11.15.,"김기현 “이재명, 여론조작 좌표찍기 지령…후보교체가 순리”",https://n.news.naver.com/mnews/article/016/0001912598?sid=100,"李 “언론환경 매우 나빠…카톡·댓글서 왜곡정보 고치자”“드루킹 생각나…댓글조작 통한 여론조작, 엄연한 범죄”“이재명·민주당, 가짜뉴스 만들고 유통…국민 안속는다”[헤럴드경제=이상섭 기자] 김기현 국민의힘 원내대표가 15일 오전 서울 여의도 국회에서 열린 최고위원회의에 참석해 발언을 하고 있다.[헤럴드경제=정윤희 기자]김기현 국민의힘 원내대표는 15일 이재명 더불어민주당 후보를 겨냥해 “사실상 여론조작 좌표찍기를 하라는 지령을 내렸다”고 강하게 비판하고 나섰다.김 원내대표는 이날 오전 국회서 열린 최고위원회의에서 “이 후보가 지지자들에게 카카오톡, 텔레그램, 댓글, 커뮤니티에서 열심히 상대 후보 잘못을 알리고 왜곡된 정보를 고치자고 했다”며 이같이 말했다.지난 12일 부산을 방문한 이 후보가 “언론 환경이 매우 나빠서 우리는 잘못한 것이 없어도 잘못했을지 모른다는 소문으로 도배가 된다”며 “저들의 잘못을 우리의 카톡으로, 우리의 텔레그램 방으로, 댓글로, 커뮤니티에서 열심히 써서 언론이 묵살하는 진실을 알리고, 우리가 억울하게 왜곡된 정보들을 고치자”고 한 발언을 겨냥한 것이다.김 원내대표는 지난 2017년 대선에서의 ‘드루킹 댓글조작’ 사건을 언급한 뒤 “(이 후보가) 민주당의 후예답게 드루킹의 추억이 새삼 떠오른다”며 “댓글 조작을 통한 여론조작은 엄연한 범죄행위”라고 날을 세웠다.그러면서 “민주당과 문재인 대통령은 댓글 조작의 과실을 나눠먹고 즐기면서 드루킹의 범죄에 대해 제대로 된 사과도 하지 않았다”며 “내가 하면 민심이고 남이 하면 댓글조작이라는 내로남불 정신을 갖고 뻔뻔하게 버틴다고 본다”고 꼬집었다.김 원내대표는 또, “지금 가짜뉴스를 누가 만들고 있나. 다름아닌 이 후보와 민주당”이라며 “이 후보 부인의 (낙상사고로 인한) 이송 당시 구급대원이 상부에 보고하지 않은 일로 질책 받았다는 언론 보도에 대해 민주당은 가짜뉴스 딱지를 붙였지만, 나중에 진짜로 밝혀졌다”고 지적했다.이어 “지난주 제가 대장동 특검 협상을 위한 여야 원내대표 회동을 촉구하면서 국회에 내내 머물렀음에도 민주당은 제가 국회를 떠나 충청도에 갔다는 가짜뉴스를 유통했다”며 “가짜뉴스 생산도 모자라 심지어 민주당 대선후보가 앞장서 여론조작을 지시하더라도 이제 현명한 우리 국민은 더 이상 속지 않는다”고 했다.그는 “지난 5년 다시는 경험해보고 싶지 않은 나라에서 민주당 정권의 거짓과 위선을 낱낱이 본 국민들이 가짜뉴스에 속아 이 후보를 뽑을 것이란 기대는 일찌감치 버리고 하루빨리 후보를 교체하는 것이 순리일 것”이라고 덧붙였다."
2021.11.15.,문재인 대통령의 축하 난 받는 윤석열 [TF사진관],https://n.news.naver.com/mnews/article/629/0000116226?sid=100,"윤석열 국민의힘 대선 후보(오른쪽)가 15일 서울 여의도 중앙당사에서 이철희 청와대 정무수석으로부터 문재인 대통령의 축하 난을 전달받고 있다. /남윤호 기자윤석열 국민의힘 대선 후보(오른쪽)가 15일 서울 여의도 중앙당사에서 이철희 청와대 정무수석으로부터 문재인 대통령의 축하 난을 전달받고 있다.윤석열 후보는 이날 대선 후보 선출 축하 난을 전달한 이철희 수석을 맞아 ""우리 대통령님하고 여사님 다 건강하십니까?""라고 안부를 물으며 환담을 진행했다.이철희 수석은 ""대통령께서 축하 말씀 꼭 드리라 하시고 당신도 두 번이나 대선을 치러봤으니깐 체력 안배를 잘 하시면서 다니시면 좋겠다고 꼭 전해달라고 하셨다""고 말했다.이에 윤석열 후보는 ""감사의 말씀 좀 전해 주시고 사모님과 여사님 두 분 다 건강 잘 좀 챙기시라고 말씀 전해주십시오""라고 답했다.사진영상기획부 더팩트는 24시간 여러분의 제보를 기다립니다.▶카카오톡: '더팩트제보' 검색▶이메일: jebo@tf.co.kr▶뉴스 홈페이지: http://talk.tf.co.kr/bbs/report/write"
2021.11.15.,해외주식 소수점 거래 시대 개막…예탁원 서비스 개시,https://n.news.naver.com/mnews/article/031/0000635910?sid=101,"국내 20개 증권사 전산시스템 구축 일정에 따라 연내 거래 가능 전망한국예탁결제원이 증권사의 해외주식 소수단위 거래를 지원하는 시스템을 구축하고 서비스를 개시한다. 국내 20개 증권사의 전산시스템 구축 일정 등에 따라 연내 증권사를 통한 해외주식의 소수점 단위 거래가 가능해진다.한국예탁결제원이 금융위원회 혁신금융서비스 지정을 계기로 해외주식 소수단위 거래 지원 시스템을 구축하고 서비스를 개시한다. [자료=한국예탁결제원]예탁원은 15일 금융위원회가 정례회의를 통해 혁신금융서비스 신규 지정을 최종 결정함에 따라 각 증권사의 해외주식 소수단위 거래를 지원하는 서비스 구축을 완료했다고 밝혔다.예탁원은 ""투자자는 다양한 증권사를 통한 해외주식 소수단위 거래를 할 수 있게 돼 분산 투자 기회가 확대되고, 증권사 서비스 경쟁에 따른 다양한 금융서비스 등 부가적인 혜택이 기대된다""고 밝혔다.앞서 예탁원은 지난달 증권사 20곳과 함께 금융위의 해외주식 소수단위 거래를 위한 혁신금융서비스 지정을 신청했고, 금융위는 지난 12일 정례회의를 통해 신규 지정을 최종 결정했다.혁신금융서비스를 신청한 증권사는 DB금융투자, KB증권, KTB투자증권, NH투자증권, 교보증권, 대신증권, 메리츠증권, 미래에셋증권, 삼성증권, 신영증권, 신한금융투자, 유안타증권, 유진투자증권, 키움증권, 하나금융투자, 하이투자증권, 한국투자증권, 한화투자증권 등이다. 카카오페이증권과 토스증권 등 빅테크 증권사도 포함됐다.2019년 이미 혁신금융서비스 지정을 받아 해외주식 소수단위 거래 서비스를 제공하고 있는 신한금융투자와 한국투자증권의 경우 투자자들은 기존과 똑같은 경로로 거래를 할 수 있다.증권사는 투자자의 소수단위 주문을 취합 후 온주화 해 매매 후 결제 지시하고, 자기 및 투자자 보유 소수단위 내역을 투자자계좌부에 기재한다. 예를 들어, 투자자가 주문한 애플 2.7주에 증권사 자기재산 0.3주를 합한 총 3주를 예탁결제원에 결제를 요청한다. 예탁원은 3주를 결제·보관 관리하는 방식이다.예탁원은 예탁자계좌부(투자자분)에 '소수단위 전용 예탁계좌'를 신설해 해당 주식을 온주 단위로 결제·보관·권리행사를 관리한다.예탁원 관계자는 ""현재 시스템 개발을 마친 상태이고 앞으로 각 증권사의 요청에 따라 서비스를 지원할 예정""이라며 ""각 증권사는 서비스 준비 단계에 따라 연내 또는 내년 상반기 중대고객 서비스를 개시할 것으로 예상된다""고 덧붙였다.이어 ""이번 서비스 개시로 한정됐던 해외주식 소수단위 거래 채널 기존 두 곳에서 대폭 확대돼 투자자의 편의가 대폭 개선되고, 투자자 수요가 많은 고가의 미국 우량주에 대한 진입장벽을 낮출 것으로 기대한다""고 덧붙였다."
2021.11.15.,"보령해저터널 개통 눈앞…""서해안 관광벨트 속도""",url없음,<네이버 기사 없음>
2021.11.15.,"김대종 세종대 교수, ""플랫폼 대기업과 중소기업 상생 필요하다""",https://n.news.naver.com/mnews/article/029/0002706142?sid=102,"요소수 부족, 중소기업 육성 및 수입 다변화 필요한미통화스와프 12월 31일 만료, 외환위기 대비김대종 세종대 경영학부 교수 '플랫폼 대기업과 중소기업 협력방안 연구'논문 발췌.    세종대학교(총장 배덕효)는 김대종 경영학부 교수가 11월 5일 여의도 중소기업중앙회에서 열린 한국중소기업학회에서 '플랫폼 대기업과 중소기업 협력방안 연구'논문을 발표했다고 밝혔다.이번 추계학술대회는 '신기술혁명과 환경변화, 중소기업의 대응'이라는 주제이다. 김 교수는 ""정부와 국회는 카카오, 네이버 등 플랫폼 대기업에 대한 규제확대는 바람직하지 않다. 중소기업이 플랫폼기업과 상생하고 협력하는 대안이 필요하다""고 말했다. 카카오는 '구독 온'으로 중소기업 정기배송과 매출확대에 기여하고 있다. 한국은 스마트폰 보급률 95%, 통신 인프라, 그리고 전자정부에서 세계1위이다. 김 교수는 ""정부는 중소기업이 온라인플랫폼 이용하여 함께 성장하도록 해야 한다. 온라인쇼핑은  총 소매액 600조원의 60%까지 성장할 것이다""라고 말했다.그는 ""9988이라는 말이 있다. 기업 99%, 근로자 88%는 모두 중소기업이다. 국내 총생산 50%를 차지하는 중소기업을 육성하여 요소수 부족을 해결해야 한다. 대기업이 수 천개 소재와 원료를 모두 수입하거나 생산할 수 없다. 한국은 중국 의존도가 높은 2천여 개 품목에 대하여 수입을 다변화해야 한다. 반도체 에칭가스처럼 전문성을 살려 중소기업을 육성하는 것이 최고의 해결책이다""라고 말했다.2020년 기준 해외직접투자(FDI)는 국내기업 유출(549억 달러)이 유입(110억 달러)보다 5배쯤 많다. 김 교수는 ""정부가 규제를 확대하고, 기업하기 좋은 환경을 만들지 못했다. 이런 이유로 국내기업들이 미국과 베트남 등으로 공장을 계속 이전 하고 있어, 국내 청년고용률은 45%이다""라고 지적했다.김 교수는""국제금융시장을 안정화시키는 것이 정부의 가장 큰 역할이다. 환율이 1,200원 가까이 오르면서 중소기업도 매우 어렵다. 외환위기에 대비해야 한다. 정부는 12월 31일 만료되는 한미통화스와프를 신속히 연장해야 한다. 한국 외환보유고 4,640억 달러는 한국 GDP 2조 달러의 25%에 그친다. 대만90%, 싱가포르123%, 홍콩143%처럼 한국 외환보유고를 9,300억 달러까지 충분히 비축해야 한다""고 강조했다.시가총액을 비교하면 네이버 67조원, 카카오 56조원, 구글 2,000조원이다. 네이버는 구글의 3%에 그친다. 전 세계 주식시장에서 국가별 비중을 보면 미국 60%, 한국은 1.6%이다. 네이버 라인은 2억 명이 사용하며, 일본 1위이다. 카카오는 동남아시아 웹툰 1위이다. 그는 ""정부는 IT 혁신기업을 더욱 발전시켜 세계적인 기업과 경쟁하게 해야 한다. 중소기업이 세계최고 수준인 네이버, 카카오, 쿠팡, 마켓컬리, 오아시스 등 온라인플랫폼과 상생하며 함께 성장해야 한다""고 말했다.정부는 4차 산업혁명 정책을 파지티브(Positive)방식에서 네거티브 방식으로 전환해야 한다. 미국과 중국은 네거티브 방식이다. 국민의 생명과 안전을 해치는 것이 아니면 모든 것을 허용한다. 한국은 우버와 에어비엔비 등 혁신기업이 기존산업을 해친다는 이유로 금지했다. 호주는 우버에서 발생하는 이익의 10%를 기부하는 것으로 택시업계와 상생을 선택했다. 18세기 러다이트 운동으로 일자리를 뺏는 증기기관을 부수는 사건이 있었지만, 인류는 발전해 왔다. 그는 ""국회가 규제강화로 정책을 추진하면, 한국기업만 세계적인 4차 산업혁명에서 소외된다""고 지적했다.김 교수는 ""1876년 개화기 때 세계 역사에 편승하지 못하여 한국은 큰 고초를 겪었다. 국회는 기존 산업보호를 위하여 혁신기업을 규제해서는 안된다. 4차 산업혁명이라는 세상의 큰 흐름을 퇴보시키는 것이다. 규제확대보다는 상생의 대안을 제시해야 한다""고 말했다.김 교수는 ""한국은 AI, 사물인터넷, 전기차 그리고 BBIG(바이오, 밧데리, 인터넷, 게임) 등 4차 산업혁명을 주도하자. 개방과 혁신이라는 세계적인 큰 흐름에 순응하자. 주 52시간 등 규제는 줄이고, 기업하기 좋은 나라를 만들어야 한다""고 강조하여 말했다.세종대학교 김대종 경영학부 교수."
2021.11.15.,"'상생소비지원금' 지급시작…간편결제 통한 대형마트 결제액, 다음달 뱉어내야",https://n.news.naver.com/mnews/article/277/0004999548?sid=101,"상생소비지원금 15일 캐시백간편결제 통한 우회결제 실적다음 달 15일 한번에 정산…소비자 혼란 불가피[이미지출처=연합뉴스]상생소비지원금 캐시백 지급이 15일 시작된 가운데, 정부가 간편결제를 통해 실적제외 업종에서 결제한 카드이용액을 다음 달 캐시백 지급 시 실적에서 빼기로 했다. 형평성 문제로 논란이 일자 급한대로 마련한 고육지책이지만 소비자 혼란은 불가피할 것으로 전망된다.정부와 업계에 따르면, 네이버페이·카카오페이 등 간편결제로 대형마트·백화점 등 실적제외 업종에서 결제한 카드이용액은 다음 달 15일 11월 분 캐시백 지급 시 제외하기로 했다. 이날부터 지급되는 10월분 캐시백은 이 같은 간편결제 실적을 포함해 지급하고 다음 달에 한 번에 정산하는 것이다. 각 카드사들은 이를 10월분 캐시백 지급 시 안내문자를 통해 알리기로 했다.상생소비지원금은 10~11월 두 달 동안 신용·체크카드로 올해 2분기(4∼6월) 월평균 카드 사용액보다 3% 이상 쓰면 초과분의 10%를 최대 20만원까지 현금성 카드포인트로 돌려주는 정책이다.지역 경제 활성화를 위해 대형마트·백화점·대형온라인몰 등은 실적인정 업종에서 제외됐지만, 네이버에 입점한 이마트몰, 홈플러스 등에서 네이버페이로 상품을 구매하면 상생소비지원금 실적으로 인정되면서 논란이 불거졌다. 카카오선물하기를 통해 구입한 명품도 마찬가지다.같은 판매자의 상품을 동일한 가격에 구매했더라도 결제방식에 따라 캐시백 실적 적용 여부가 달라지면서 형평성 문제가 제기됐다. 상생소비지원금의 도입 취지에도 어긋난다는 지적도 나왔다.결제구조상 카드사가 간편결제의 상세 가맹점을 구분할 길이 없어 카드업계는 해결방안을 찾기 위해 골머리를 앓았다. 결국 방법은 찾았지만 시간이 촉박했다. 이에 따라 다음달 15일 캐시백 지급 시 소비자혼란은 불가피할 것으로 보인다. 이 달에 캐시백을 지급받았더라도 간편결제를 통한 우회결제 실적를 제외하면 캐시백 금액이 줄어들거나, 최악의 경우 이미 받은 캐시백 전액을 되돌려줘야 할 가능성도 있기 때문이다.한편, 기획재정부에 따르면 지난달 카드 캐시백 지급액은 3875억원으로 810만명에게 지급될 것으로 보인다. 이는 전체예산 7000억원의 55.4% 수준이다. 현재까지 상생소비지원금 참여를 신청한 사람은 1509만명이다."
2021.11.15.,"오뚜기, 3분기 영업익 530억 원…전년 대비 11%↓",https://n.news.naver.com/mnews/article/629/0000116209?sid=101,"오뚜기는 올해 3분기 영업이익이 전년 동기 대비 11% 줄어든 530억827만 원을 기록했다. /더팩트DB""원재료값 상승 압박으로 영업이익 소폭 하락"" 오뚜기는 올해 3분기 영업이익이 전년 동기 대비 11% 줄어든 530억827만 원을 기록했다고 15일 공시했다.같은 기간 매출액은 7067만7600만 원으로 전년 동기 대비 3.7% 늘었으며 당기순이익은 324억 원으로 190.4% 증가했다.오뚜기 관계자는 ""코로나19 영향으로 즉석밥과 컵밥 등 간편식의 매출이 증가했으나 올해 하반기 대두와 밀가루 등 원재료값 상승 압박으로 영업이익은 소폭 하락했다""며 ""라면 가격 인상 효과로 오는 4분기 실적은 개선될 것으로 기대된다""고 말했다.더팩트는 24시간 여러분의 제보를 기다립니다.▶카카오톡: '더팩트제보' 검색▶이메일: jebo@tf.co.kr▶뉴스 홈페이지: http://talk.tf.co.kr/bbs/report/write"
2021.11.15.,"농심, 3분기 영업익 291억 원…전년 대비 0.7%↓",https://n.news.naver.com/mnews/article/629/0000116216?sid=101,"농심은 올해 3분기 매출액 6729억 원, 영업이익 291억 원을 기록했다. /농심 제공""해외 시장 확대 위한 제반경영비용 상승으로 영업익 감소"" 농심은 올해 3분기 매출액 6729억 원, 영업이익 291억 원을 기록했다고 15일 공시했다. 매출액은 전년 동기 대비 3.3% 증가했지만 영업이익은 0.7% 감소했다.같은 기간 당기순이익은 253억 원으로 전년 동기 대비 14.3% 증가했다.국내법인과 해외법인의 매출은 각각 4826억 원, 1904억 원을 기록했다. 국내법인은 전년 동기 대비 0.6% 감소했으며, 해외법인은 14.7% 증가했다.농심 관계자는 ""해외 시장 확대를 위한 판촉비, 물류비 등 제반경영비용이 상승하면서 영업이익이 다소 감소했다""고 설명했다.더팩트는 24시간 여러분의 제보를 기다립니다.▶카카오톡: '더팩트제보' 검색▶이메일: jebo@tf.co.kr▶뉴스 홈페이지: http://talk.tf.co.kr/bbs/report/write"
2021.11.15.,클럽만 막으면 뭐하나…파티룸·공유숙박 방역에 '구멍 숭숭',https://n.news.naver.com/mnews/article/018/0005086604?sid=102,"밤새 이용하는 '올나잇 패키지' 판매11월 파티룸 검색량 106.66% 늘어나""출입자 전원 명부 작성·QR 체크 없어""성탄절·연말 모임↑…클럽 구멍도 여전[이데일리 조민정 기자] “저녁 7시부터 다음날 아침 9시까지 ‘올나잇 패키지’ 예약 되나요?”백신패스 계도기간이 끝나면서 백신 미접종자의 시설 이용 제한이 본격적으로 시행됐지만, 파티룸 밤샘 파티 같은 ‘풍선 효과’가 나타나고 있다. 대여공간은 대부분 출입자 명부 관리가 제대로 이뤄지지 않는데다 좁은 공간에 사람들이 밀집해 있어 코로나19 감염 위험이 높다. 위드 코로나(단계적 일상회복) 이후 코로나19 이상반응이 폭증하는 상황에서 방역 사각지대가 또 나타는 것 아니냐는 우려가 나온다.공유숙박 플랫폼 ‘에어비앤비’를 통해 지인들과 함께 1박 2일로 머무르며 파티를 하고 있는 모습이다.(사진=독자 제공)“올나잇 파티 즐기자”…파티룸·에어비앤비로백신패스는 백신 미접종자의 유흥시설과 실내체육시설 등 고위험시설 이용을 제한한 제도로 1~2주간 계도기간을 마치고 15일부터 본격 시행에 들어갔다. 클럽과 헌팅포차 등 유흥시설은 유전자증폭(PCR) 음성확인서를 제출해도 백신을 맞지 않았다면 입장 자체가 불가하다. 코로나 백신 2차 접종까지 마치고 14일이 지난 접종 완료자만 유흥시설을 이용할 수 있다.연말과 크리스마스가 다가오면서 파티룸이나 에어비앤비, 펜션을 예약해 밤샘파티를 즐기는 사람들도 늘고 있다. 파티룸 운영자들은 저녁 7시부터 오전 10시까지 이용 가능한 ‘올나잇 패키지’를 홍보하며 판매하고 있고, 사이트에는 “12월 24일 예약가능한가요” 등 문의글도 올라오고 있다. 빅데이터 분석 플랫폼 블랙키위에 따르면 11월 1~14일 ‘파티룸’ 검색량은 3만7200건으로 전월 대비 106.66% 증가했고, 이달 검색량은 전달보다 140.91% 늘어날 것으로 예측됐다. 같은 기간 ‘에어비앤비’ 검색량은 42만4000건으로 전월 대비 2.37% 늘어난 것으로 나타났다. 백신패스 미적용 시설인 숙박업은 온도 체크, 출입명부 작성 등을 거쳐야 이용할 수 있다. 그러나 사실상 숙박업과 같은 형태지만 파티룸(공간대여업), 에어비앤비(외국인관광도시민박업)는 현행법상 숙박업이 아니기 때문에 방역 구멍이 발생할 수 있다는 지적이 나온다. 자정까지만 운영 가능한 유흥시설과 달리 영업시간 제한이 없는데다, 일반적으로 예약자 신상정보만 받고 시설 전체 이용자 명단이나 백신 접종 여부까지 확인할 필요가 없기 때문이다.반드시 명부 작성을 해야 하는 숙박업 중 일부도 이 책임을 방기하고 있는 것으로 나타났다. 지난 주말 친구들과 펜션에서 파티를 즐긴 박모(24)씨는 “예약할 때 같이 가는 친구들의 연락처나 이름을 달라고 하지 않더라”며 “들어갈 때 QR코드를 찍거나 명부 작성을 하는 것도 없었다”고 말했다. 함께 1박 파티를 즐긴 김모(24)씨 또한 “적정 인원만 맞추면 된다고 해서 마음 편히 이용했다”고 설명했다.지난 6일 오전 12시 30분쯤 홍대 클럽거리에서 헌팅포차 등 유흥시설 앞에 사람들이 북적거리고 있다.(사진=조민정 기자)클럽도 ‘사각지대’ 여전…파티룸 등 단속은 미미유흥시설도 방역 구멍이 여전하다. 일부 시설에선 입장 시 백신 접종 여부를 제대로 확인하지 않고 들여보내고 있고, 지인의 카카오톡 계정을 빌려 백신패스를 빠져나가는 경우도 있다. 온라인 커뮤니티에는 “백신패스 믿고 안전하다고 생각하면 안 된다”, “제대로 (백신패스) 확인하지 않고 들여 보내주는 곳도 많다”, “친구 QR코드 빌려서 입장하는 경우도 있더라”라는 게시글이 올라오고 있다.단속을 담당하는 지방자치단체는 해당 시설마다 담당하는 과가 달라 제대로 된 단속이 힘든 상황이다. 출입명부관리 등을 담당하는 위생 관련 부서는 식당과 카페, 유흥시설 등을 관리할 뿐 에어비앤비와 파티룸은 보통 문화 쪽 부서가 담당하고 있다.서울 A구청 관계자는 “유흥시설은 식당과 카페를 단속하는 위생지도팀에서 함께 담당하고 있지만 공유 숙박업은 문화체육 쪽 부서 업무라 완전히 다르다”고 말했다. 공유숙박업 업무를 맡고 있는 B구청 관계자는 “방역점검도 하고 건강진흥법 단속도 하고 있다”면서도 “외국인도시민박업에 대한 인허가를 (주로) 관리하고 있는데 파티룸은 우리 담당이 아니다”라며 말을 아꼈다."
