기사날짜,기사제목,네이버 뉴스 url,기사내용
2021.11.28.,"'고령화·인구감소→식품값 급등'…위기의 韓농업, D.N.A가 필요하다[과학을읽다]",https://n.news.naver.com/mnews/article/277/0005006550?sid=105,"스마트 트렉터. 자료사진.#1. 70대 농부 A씨는 내년부터 사실상 농삿일을 접을 계획이다. 갈수록 힘이 부치면서 한동안은 인력소개소를 통해 외국인 노동자들을 데려다 썼다. 한국인, 특히 젊고 힘 좋은 이들은 고된 농삿일을 하려 하지 않아 눈을 씻고 찾아 봐도 없다. 그런데 코로나19로 이마저 어려워졌다. 외국인들의 입국이 힘들어지면서 일꾼의 하루 일당이 20만원을 훌쩍 넘었기 때문이다. A씨는  ""인건비 때문에 뭘 해도 남는 게 없어서 앞으로는 소일거리로만 작물을 재배할 생각""이라고 말했다.고령화 시대, 코로나19 상황이 겹쳐 일손 찾기가 하늘의 별따기가 된 한국 농촌의 현실이다. 이 때문에 싸기만 했던 한국의 농산물 가격도 최근 급등하는 추세여서 도시 서민들의 생활도 더 어려워지고 있다. '가장 후진적인' 분야로 남아 있는 농업이 최소한의 노동ㆍ에너지를 투입해 생산성 극대화ㆍ고품질화를 위한 '파괴적 혁신'이 절실한 산업 분야가 된 것이다. 이에 D.N.A(데이터, 네트워크, 인공지능)를 활용한 '스파트 팜'이 대세로 떠오르고 있다.◇ '고사' 직전 농촌, 스마트 팜이 대세우리나라 농촌은 현재 괴멸의 위기에 처해 있다. 농ㆍ축산업 인구 고령화, 젊은층 유입감소, 생산 면적 축소에 따라 농민들의 소득은 형편없이 줄어들었고, 수출ㆍ성장률 정체에 따라 산업 전체가 '지속 가능성'을 의심받는 처지다. 농업 인구는 2016년 약 300만명 대 초반에서 2019년 약 200만명으로 대폭 감소했다. 농촌의 65세 이상 고령인구 비율도 2016년 40.3%에서 2019년 46,6%로 매년 늘어나고 있다. 이러자 시설 원예, 축산 등을 중심으로 최소한의 노동ㆍ에너지를 투입해 친환경 농축산품을 생산해내는 스파트 팜 보급이 급증하고 있다. 빅데이터, 인공지능(AI), 무인자동화 등 융합기술을 온실ㆍ축사에 접목해 원격ㆍ자동으로 작물과 가축을 키울 수 있는 지능화된 시설 농장들이 농촌 곳곳에 들어서고 있다.스마트 팜 보급 물량은 2014년 기준 시설원예 405ha, 축산 24가구에 불과했지만 매년 급속히 증가해 2017년엔 시설원예 4010ha, 축산 790가구로 늘어났다. 올해 정부는 시설원예 7000ha, 축산 5750가구 달성을 목표로 하고 있다. 한국은 2018년, 2019년 두차례에 걸쳐 경북 상주시, 전북 김제시, 전남 고흥군, 경남 밀양시 등 4곳을 선정헤 스마트팜 혁신 밸리를 구축, 확산 거점으로 삼고 있다. 전세계적으로도 스파트 팜이 대세가 되고 있다. 2021년 전 세계 스마트 팜 시장 규모는 148억달러 규모로, 2025년에는 220억달러까지 커지는  등 연평균 9.8%의 빠른 속도로 시장이 확대되고 있다. 스마트 팜 산업이 확산되면서 기업들의 관련 투자도 늘어나는 추세다. 첨단기술과 농업을 합성한 '어그테크(Agtech)'의 열풍이 불고 있다. 2010년부터 2019년까지 스마트 팜 및 어그테크에 대한 글로벌 투자 건수는 연 평균 24.5% 씩 증가하고 있다. 2019년 한 해에만 495건의 투자가 이뤄졌는데, 2010년 69건에 비해 7배 이상 증가한 수치다. 국내에서도 투자자들이 친환경 먹거리 생산 및 스마트 팜에 대한 투자가 이뤄지고 있다. 카카오 인베스트먼트가 2015년 만나CEA에 100억원을 투자했고, LG화학이 2016년 동부팜한농을 인수한 게 대표적 사례다.◇ 농업도 D.N.A 시대농업 분야에서도 빅데이터, 즉 기상 변수ㆍ토양 영양소ㆍ환경 조건ㆍGPS 데이터ㆍ작업기록ㆍ수확량ㆍ투입 비료양 등의 데이터들은 필수가 되고 있다. 스마트 시설ㆍ장비에 데이터ㆍ센서가 결합되면서 농업이 첨단 기술 산업으로 변화되고 이로 인해 생산성도 대폭 증가하고 있다. 2006년 미국에서 구글 출신 엔지니어들이 만든 '클라이밋 코퍼레이션'은 농업 현장에서 발생하는 다양한 데이터를 분석해 농가의 의사 결정을 지원해 주는 서비스로 유명하다. 농기계 회사인 존디어사도 2017년 인공지능 벤처 기업 '블루리버 테크놀로지'를 인수해 농업용 빅데이터ㆍ인공지능 기술을 접목하고 있다. 존디어는 데이터를 활용해 효과적인 살포 기법을 개발해 제초제 양을 90% 절감한다거나, 잡초ㆍ작물을 구분해 비료를 주는 장비를 개발하고 있다. 중국도 신장 위구르 자치구의 인구가 급감하자 바이두 위성 항법시스템과 5G 기술을 접복한 자율운행트랙터를 개발해 운영 중이다. 국내에서도 LG유플러스와 LS엠트론이 5G 기반 트렉터 제어시스템을 개발해 2022년 상용화 한다는 목표다.드론도 효과적인 토양 상태 측정, 종자 파종, 비료ㆍ농약 살포, 작황 모니터링 및 병충해 진단 등에 활발히 활용되고 있다. 구글, 인텔, 차이나 모바일 등에서 5G를 활용한 드론을 개발 중이며, 국내에서도 고흥군이 2023년까지 164억원을 들여 5G 통신 기반 무인 드론 운용 시스템을 개발하고 있다.AI도 농업의 난제를 해결하기 위해 활발히 활용되고 있다. AI가 로봇, 무인 항공기, 작물 관리 시스템과 통합해 투입 자원을 최소화하는 동시에 수확ㆍ산출량을 증대시키는 지름길이 되고 있다. 미국에선 구글 모기업 '알파벳'이 설립한 '구글 벤처스'가 스타트업 '파머스 비즈니스 네트워크'에 1500만달러를 투자해 시장 선점에 나서고 있다. 마이크로소프트(MS)도 2050년까지 전세계 식품 생산량을 지금보다 70% 늘리겠다는 'MS 팜비트' 사업을 진행 중이다. 이와 함께 네덜란드는 1992년 세계 최초 로봇 착유 시스템을 상용화해 한국에서도 수입하고 있다. 이탈리아에서도 사물인터넷(IoT) 기반 무선 센서 네트워크를 구축해 농부들에게 물과 양분의 투입 시기를 알려 줘 수확량을 늘리는 기술이 개발되고 있다. 한국의 경우 농촌진흥청에서 '한국형 스마트 팜' 기술을 개발해 보급하고 있다. 최첨단 소재와 신재생에너지를 활용해 에너지 투입을 최소화한다. 로봇과 지능형 농기계를 활용하고 실시간 수집되는 작물 정보를 클라우드의 AI가 분석해 농부들에게 최적의 의사 결정을 하도록 돕는 시스템이다.한국과학기술기획평가원(KISTEP)은 지난달 펴낸 동향 보고서에서 ""스마트 팜 산업 활성화를 위해선 관련 부처간 협업을 통한 법ㆍ제도 정비와 우수 인력 양성이 필요하며 어그테크에 대한 기업들의 적극적인 투자도 중요하다""면서 ""농업환경 전반에 걸쳐 데이터 수집이 가능하도록 시스템ㆍ플랫폼을 확보하는 작업이 선행되어야 한다""고 지적했다."
2021.11.28.,"정희용 의원, 국민의힘 2021 국정감사 우수의원 선정",url없음,<네이버 기사 없음>
2021.11.28.,메타·나이키·네이버도 뛰어든 NFT…1년새 거래액 183배 늘었다,https://n.news.naver.com/mnews/article/015/0004633900?sid=105,"무한복제 디지털 세상서 '유일한 진품'…산업계 대세로NFT 스타트업 투자유치 잇따라대퍼랩스·소라레 등 유니콘 등극글로벌 기업도 속속 사업 진출나이키, 메타버스 신발 특허 신청""가상세계 커질수록 수요 늘 것""""내부거래 많아 가격 거품"" 지적도< 뉴욕 타임스스퀘어서 열린 'NFT NYC'  > 지난 2~4일 글로벌 NFT(대체불가능토큰) 행사 'NFT NYC'가 열린 미국 뉴욕 타임스스퀘어 일대 모습. NFT 관련 이벤트를 알리는 전광판 모습이 이채롭다.   출처 onflux Network 트위터영국 사전 출판사 콜린스가 선정한 ‘올해의 단어’. 메타(옛 페이스북), 비자, 나이키, 구찌, 아마존, 네이버, 카카오가 뛰어든 신사업. 1년 사이 거래액 180배 상승….NFT(Non-Fungible Token·대체불가능토큰)를 설명하는 말들이다. 올초만 해도 ‘암호화폐 투자자들 사이의 은밀한 유행어’ 정도로 치부됐던 NFT가 글로벌 산업 트렌드를 주도하는 키워드로 떠오르고 있다. 최근 들어선 “NFT는 메타버스 같은 디지털 세계의 경제적 기반”이라는 인식이 확산하면서 시대적 대세로 올라섰다는 평가까지 나오고 있다. NFT 스타트업 몸값 ‘천정부지’28일 글로벌 블록체인 데이터 기업 댑레이더에 따르면 지난해 세계 NFT 거래액은 9500만달러 수준이었다. 하지만 올해는 얘기가 완전히 달라졌다. 올 1분기 12억3000만달러이던 거래액은 2분기 12억4000만달러로 덩치를 키웠고, 3분기엔 급기야 106억7000만달러로 ‘퀀텀 점프’를 했다. 지난 10월 한 달에도 42억달러어치가 거래됐다. 1~10월 누적액이 173억4000만달러다. 우리 돈 20조원을 넘는다. 작년 연간 거래액의 183배 수준이다.돈이 집중적으로 흘러들어가는 곳은 스타트업계다. 유망 NFT 스타트업 몸값이 폭발적으로 치솟고 있다. 올 들어서만 대퍼랩스, 소라레, 애니모카브랜즈, 스카이마비스, 미시컬게임즈 등이 수천억원의 투자금을 끌어들여 단박에 ‘유니콘기업(기업가치 1조원 이상 스타트업)’에 등극했다. 애니모카브랜즈를 빼고는 모두 2018년 창업한 어린 기업들이다. 벤처캐피털(VC)업계에서 “전례를 찾기 힘들 정도로 빠른 성장 속도”라는 평가가 나오는 이유다.글로벌 대기업들도 NFT 시장에 속속 얼굴을 내밀고 있다. 메타는 지난달 연례행사인 커넥트 콘퍼런스에서 NFT 사업 진출을 선언했다. 메타는 최근 NFT를 보관할 수 있는 가상자산 지갑 ‘노비’를 선보였다. NFT를 포함한 디지털 상품을 거래할 수 있는 플랫폼 ‘호라이즌 마켓플레이스’도 곧 출시할 계획이다.글로벌 결제서비스 기업 비자도 올 8월 NFT 시장 참전을 공식화했다. 카이 셰필드 비자 부사장은 “NFT는 엄청난 혁신”이라며 “NFT 발행, 거래를 지원하는 서비스를 내놓을 것”이라고 말했다. 패션업계에선 버버리·루이비통·구찌·돌체앤가바나 등 웬만한 글로벌 브랜드는 모두 NFT 사업을 시작했다. 세계 1위 스포츠 브랜드 나이키도 10월 메타버스용 신발·의류 특허권을 출원하며 NFT 시장 진출을 예고했다.아마존의 자회사 AWS는 올 6월 NFT 플랫폼 운영사 오리진 프로토콜과 파트너십을 맺고 NFT 서비스를 지원키로 했다. 여기에 정보통신기술(ICT)업계 ‘구루’로 통하는 젠슨 황 엔비디아 최고경영자(CEO)도 최근 NFT를 메타버스 시대 핵심 요소로 지목했다. 국내에서도 네이버, 카카오, 하이브, SM엔터테인먼트, 엔씨소프트, 위메이드, 한글과컴퓨터 등이 NFT 시장에 뛰어들었다. “개점 효과…거품 많다” 지적도NFT 인기가 갈수록 치솟고 있는 배경에는 “디지털 콘텐츠도 안전하게 거래하고 싶다”는 욕구가 자리잡고 있다는 분석이다. 동영상, 그림파일 등 디지털 콘텐츠는 무한 복제가 가능해 가치를 부여하기 어려웠다. 하지만 블록체인 기술로 특정 콘텐츠에 고유한 인식값을 부여해 ‘원본’을 지정하자 희소한 가치가 생기고 거래가 가능해졌다. 그게 NFT다.디지털 미술품·일러스트, 스포츠 동영상 등을 NFT 상품으로 만드는 사례가 쏟아지기 시작했다. 대퍼랩스는 미국프로농구(NBA)에서 나온 명장면을 NFT로 만들어 판다.메타버스 열풍이 만든 디지털 가상 세계의 확장이 NFT 성장을 가속화시켰다. 메타버스는 가상 세계이고 가상 세계 안의 모든 사물은 디지털 콘텐츠다. NFT가 메타버스 내 콘텐츠를 안전하게 소유하고 거래할 수 있게 해줬다. 김민수 NFT뱅크 대표는 “NFT는 메타버스의 경제 근간이 된다는 점에서 둘은 떼려야 뗄 수 없는 관계”라며 “메타버스가 확장될수록 NFT 수요도 커질 것”이라고 말했다.열풍을 경계하는 우려의 목소리도 커지고 있다. 지금의 NFT 열풍엔 ‘거품’이 끼어 있다는 지적도 만만치 않다. NFT 커뮤니티 안의 ‘내부 거래’로 NFT 가격을 띄우는 경우가 많다는 건 공공연한 비밀이다. 일례로 6930만달러라는 NFT 사상 역대 최고액으로 거래된 디지털 아티스트 비플의 ‘매일 : 첫 5000일’이란 NFT는 업계의 큰손 ‘메타코반’이 매입한 것이었다. 시장 분위기를 달구기 위해 업계 이해관계자끼리 작품을 사고파는 일종의 ‘자전거래’를 한 격이다."
2021.11.28.,[공시줍줍]공모주달력 11월 29일~12월3일,https://n.news.naver.com/mnews/article/648/0000005039?sid=101,"=그래픽/유상연 기자드디어 12월이 코앞으로 다가왔네요! 2021년 올해의 공모주 청약일정도 얼마 남지 않았는데요. 11월 마지막 주에는 어떤 일정이 있는지 알아볼게요. 이번 주에는 기관투자자 의무보유확약 물량이 풀리는 회사들이 많네요. 기관투자자 의무보유확약은 상장에 도전하는 회사에 투자했던 기관투자자들이 상장 이후 일정기간 투자한 회사의 주식을 팔지 않겠다고 대외적으로 약속하는 일인데요. 기관투자자가 확보한 물량이 워낙 많다보니 상장 이후 바로 팔아버리면 주가에 영향을 미치기 때문에 일정기간 팔지 않겠다고 약속함으로써 주가 안정성을 담보하는 것이죠. 이번 주 가장 많은 물량이 풀리는 곳은 지난 11월 3일 유가증권시장에 상장한 카카오페이. 기관투자자들이 1개월 간 팔지 않겠다고 약속한 물량 109만5054주가 오는 3일 시장에 매물로 나올 수 있는 데요.109만5054주는 적지 않은 물량이죠. 물론 카카오페이 총 발행주식수(1억3036만7125주)의 1%도 안 되는 수준이지만 기관투자자 총 의무보유확약 물량(551만6225주)의 약 20%에 달한다는 점을 고려하면 결코 적지 않은 수준.  특히 카카오페이는 공모가격(9만원)대비 현재 주가(26일 종가기준 22만2500원)가 크게 오른 상황이기 때문에 기관투자자들이 차익실현을 위해 시장에 매물로 내놓을 가능성이 높아요.참고로 카카오페이는 내년 5월까지 1개월 마다 기관투자자 의무보유확약 물량이 풀릴 예정. 카카오페이 투자자들은 지속적으로 기관투자자 의무보유확약 해제시점에 관심을 둘 필요가 있어요. 지앤비에스엔지니어링과 리파인은 29일 1개월 간 팔지 않겠다고 약속한 의무보유확약 물량이 풀릴 예정. 지앤비에스엔지니어링은 2만7065주, 리파인은 11만2619주가 시장에 매물로 나올 수 있어요. 그 밖에 엔켐(12만7880주, 1개월), 피코그램(3만8450주, 1개월), 트윔(9313주, 2주), NH올원리츠(5만5347주, 15일)도 기관투자자 의무보유확약 물량이 풀리는데요. 특히 엔켐은 공모가(4만2000원)보다 현재 주가(26일 종가기준 10만5900원)가 많이 올라갔기 때문에 주의 깊게 살펴볼 필요가 있어요. 다음은 상장일정. 지난주 공모주 청약을 진행했던 미래에셋글로벌리츠와 대신밸런스스팩11호가 각각 3일, 2일 유가증권시장과 코스닥시장에 상장할 예정이에요. 참고로 미래에셋글로벌리츠는 공모주 청약 경쟁률 753대1을 기록하면서 역대 리츠 공모주 사상 최고 경쟁률을 기록했어요.이번 주는 공모주 청약을 진행하는 회사가 한 곳인데요. 코넥스 시장에 상장해 있는 기업인 툴젠이 2~3일 공모주 청약을 진행하면서 4번째 코스닥 시장 상장에 도전해요. 툴젠은 유전자 관련 기술을 연구하고 개발하는 생명공학전문 기업. 툴젠의 희망공모가격은 10만원~12만원으로 현재 코넥스시장 주가(26일 기준 13만4000원)보다 다소 낮은 금액이에요. 확정공모가격은 30일 발표할 예정. 지난주 공모주 청약을 진행한 신한서부티엔디리츠는 30일 공모주 배정에 따른 증거금 환불이 이루어질 계획이고요. 마지막으로 공모주 청약을 진행하기에 앞서 기관투자자 수요예측을 진행하는 기업을 알아볼게요. 이번 주는 KTB네트워크와 래몽래인두 곳에서 각각 29~30일, 2~3일 이틀간 기관투자자 수요예측을 진행해요. KTB네트워크는 2008년 KTB투자증권에서 물적분할해 설립한 회사. 이제 막 사업에 도전하는 벤처기업이나 규모가 작아 투자여력이 부족한 중소기업에 투자를 하고 해당 기업이 성장하면 투자자금을 회수해 차익을 확보하는 것이 케이티비네트워크의 주요 사업. KTB네트워크의 희망공모가격은 5800원~7200원. 미래에셋벤처투자 등 투자회사 10곳을 비교대상으로 삼아 희망공모가격을 정했고 최종적으로 기관투자자 수요예측을 거쳐 2일 확정 공모가액을 발표할 계획이에요. 드라마, 예능프로그램 등 방송콘텐츠를 활용한 부가사업(OST, 해외방영, VOD 등)을 하는 래몽래인은 현재 코넥스 시장에 상장해 있는 기업인데요. 드라마 심야식당, 산후조리원을 제작한 곳으로 이번에 코스닥시장 상장에 도전해요. 래몽래인의 희망공모가격은 1만1500원~1만3000원. 현재 코넥스시장 주가는 2만4900원(26일 기준종가)으로 희망공모가격이 현재 주가보다 다소 낮죠. 참고로 드라마 겨울연가, 동백꽃 필 무렵 등을 제작한 팬엔터테인먼트와 드라마 미생, 도깨비를 만든 스튜디오드래곤을 비교대상 회사로 삼아 희망공모가격을 정했어요. *공모주 수요예측 및 청약 일정은 증권신고서 중요내용 정정으로 인한 효력 발생 연기 시 미뤄질 수 있어요. 일정이 바뀌면 본문을 수정한 이후, 바로 아래 공시줍줍 안내 그래픽 밑에 별도로 적어놓습니다."
2021.11.28.,"[DD주간브리핑] 세계 덮친 ‘오미크론’ 공포…SKT 거래재개, 영향은?",https://n.news.naver.com/mnews/article/138/0002114355?sid=105,"- WTO, 4년 만의 각료회의 전격 연기  - AWS ‘리인벤트’, 29일부터 12월3일까지   - 퀄컴, 30일 ‘갤럭시S22’ AP 발표  - SKT·SK스퀘어, 29일 거래재개…1/5 액면분할   [디지털데일리 윤상호 기자] 코로나19의 새 변이 ‘오미크론’의 공포가 이번 주(11월28일~12월4일)를 덮쳤다. 세계 증시는 폭락했다. 입국 통제가 살아났다. 가뜩이나 미국 유럽 등에서 단계적 일상회복(위드 코로나)이 암초를 만난 상태여서 우려가 확산하고 있다. 세계 경제 회복 시점을 확언하기 어려워졌다.   세계무역기구(WTO) 정상화는 미뤄졌다. 30일부터(현지시각) 4년 만에 스위스 제네바에서 열릴 예정이었던 ‘제12차 WTO각료회의’는 전격 연기됐다. 각료회의는 WTO 최고 의사결정기구다. 이번 각료회의에서는 WTO 개혁 방안 등을 논의할 예정이었다. ▲미국과 중국의 갈등 ▲코로나19 등이 촉발한 WTO 무용론이 지속할 전망이다.   코로나19로 손해를 본 곳이 다수지만 정보통신기술(ICT) 업계는 수혜를 입었다. 클라우드도 마찬가지다. 클라우드 선두주자 아마존웹서비스(AWS)의 연례 콘퍼런스 ‘리인벤트’가 올해로 10년을 맞았다. 11월29일부터 12월3일까지(현지시각) 미국 라스베이거스에서 열린다. 아담 셀립스키 AWS 최고경영자(CEO) 공식 등장 무대다. AWS 최신 동향과 이용 사례 등을 소개할 예정이다.   애플리케이션프로세서(AP) 1위 퀄컴은 11월30일부터 12월2일까지 미국 하와이에서 ‘퀄컴 스냅드래곤 테크 서밋 2021’을 개최한다. 삼성전자 ‘갤럭시S22’를 비롯 애플을 제외한 내년 출시 프리미엄 스마트폰 AP를 공개하는 자리다.   국내로 눈을 돌리면 SK에 관심이 쏠린다.   업계는 오는 2일경 SK가 2022년도 임원인사 등을 실시할 가능성이 높다고 보고 있다. SK는 이번 인사를 각 회사별 이사회가 주도토록 했다.   또 SK텔레콤과 SK스퀘어가 29일 각각 변경상장과 재상장한다. 양사는 지난 1일 인적분할을 완료했다. 거래정지 전 마지막 거래일(10월25일) SK텔레콤 종가는 30만9500원이었다. SK텔레콤은 인적분할과 함께 액면분할을 실시했다. 액면가를 500원에서 100원으로 낮췄다. 오미크론 악재를 돌파할지가 관전포인트다.   한편 국내 물류망을 흔들고 있는 요소수 수급 불안을 해소하기 위해 네이버와 카카오가 나섰다. 요소수 재고 정보 검색서비스를 개시한다.   다음은 이번 주 국내외 주요 행사 세부내용이다.   ◆SKT·SK스퀘어, 29일 주식 거래재개=SK텔레콤과 SK스퀘어 주식이 29일부터 거래를 재개한다. 양사는 지난 1일 인적분할을 완료했다. 인적분할 명분은 기업가치를 시장에서 제대로 인정받겠다는 것이었다.    거래정지 전 마지막 거래일(10월25일) SK텔레콤 종가는 30만9500원이다. SK텔레콤은 주식도 액면분할했다. 액면가를 500원에서 100원으로 내렸다.   증권가는 액면분할 등 단기 상승 요인은 충분하다는 평가다. 장기적 관점에서는 SK텔레콤은 배당 SK스퀘어는 자회사 기업공개(IPO)가 변수라고 분석했다. SK스퀘어는 IPO 1번 타자를 원스토어로 낙점했다. 내년 상반기 목표다.   ◆네이버‧카카오, 주유소 요소수 재고 검색 제공=요소수 수급 불안 해소를 위해 네이버와 카카오에서 제공하는 정보가 늘어난다. 이번 주부터 네이버와 카카오는 거점 주유소 요소수 재고 정보 검색을 제공한다. 정보 제공 주기는 1일 2회에서 2시간 1회로 개선했다. 현재 국내 차량용 요소수 일 생산량은 일평균 소비량 60만리터의 2배다.    ◆29일 ‘방송채널 대가산정 개선방안’ 공개 토론회=과학기술정보통신부와 방송통신위원회는 29일 ‘방송채널 대가산정 개선방안’ 관련 공개 토론회를 개최한다.   ▲채널 계약 공정성 향상 시청률 지표 반영 ▲평가결과 공개 ▲평가자료 검증 등을 담은 ‘플랫폼사업자의 채널평가 개선방안’을 제시한다. ▲채널종료 ▲계약시기 ▲분쟁·금지행위 제도개선 ▲콘텐츠 대가지급규모 개선방안 등을 포함한 ‘채널 거래절차 개선방안’을 논의된다.   과기정통부와 방통위는 이번 토론회를 토대로 ▲채널 계약 및 평가 가이드라인 ▲방송채널사용자(PP) 평가 기준 및 절차 표준안 등을 확정할 예정이다.   ◆AWS, 11월29일부터 12월3일까지 ‘리인벤트’=아마존웹서비스(AWS)는 11월29일부터 12월3일까지(현지시각) 미국 라스베이거스에서 ‘리인벤트(re:Invent)’를 진행한다.   리인벤트는 AWS 연계 콘퍼런스다. 올해로 10주년이다. AWS는 클라우드 서비스 확산에 주도적 역할을 했다. 리인벤트를 통해 최신 기술과 활용 사례 등을 공유했다. 특히 이번 행사는 아담 셀립스키 최고경영자(CEO) 데뷔 무대이기도 하다.   ◆퀄컴, 11월30일부터 12월2일까지 ‘스냅드래곤 테크 서밋 2021’=퀄컴이 11월30일부터 12월2일까지(현지시각) 미국 하와이에서 ‘스냅드래곤 테크 서밋 2021’을 연다.   이 행사는 퀄컴의 애플리케이션프로세서(AP) 신제품 공개 자리다. 스마트폰 PC 등 다양한 신제품을 발표한다. 이 행사를 통해 소개한 AP는 이듬해 대다수 프리미엄폰 AP로 적용된다. 삼성전자 스마트폰 ‘갤럭시S22 시리즈’의 성능을 점칠 수 있는 자리다.   ◆넥슨 ‘피파모바일 2021 윈터 쇼케이스’=넥슨코리아는 ‘피파모바일 2021 윈터 쇼케이스’를 12월4일 연다. 이날 낮 12시 서울 잠실 아프리카 콜로세움에서 진행한다. 피파모바일 공식 유튜브 채널과 아프리카TV에서 생중계한다. 업데이트 내용 공개와 스페셜 매치 본선을 치를 예정이다."
