기사날짜,기사제목,네이버 뉴스 url,기사내용
2021.11.26.,잔돈 모아서 테슬라 주주됐다…수익률 `대박` [월급이 모자라],https://n.news.naver.com/mnews/article/215/0000999642?sid=101,"《`월급이 모자라`는 빠듯한 월급으로 소비를 포기해야 했던 직장인들에게 `돈 되는 부업`을 찾아드리는 이지효 기자의 체험기입니다.》""테슬라 주식을 사고 싶은데 왜 이렇게 비싼가요"" 테슬라 같은 인기 주식들은 주당 가격이 수백 만 원에 달할 정도로 비싸기 때문에 한 주도 구매하지 못하는 경우가 많죠. 해외주식에 투자하는 개인을 뜻하는 `서학개미` 열풍은 남의 얘기가 아닌가 싶을 때가 있는 것도 사실입니다.그런데 시장에서 콩나물을 사서 장바구니에 담듯 큰 부담없이 해외 우량주를 살 수 있는 방법이 열렸다고 하는데요. 1만 원도 아니고 단돈 1,000원만 있으면 테슬라 주식도 살 수 있는 겁니다. 네, 그래서 저희 <월급이 모자라>에서는 소액으로 해외주식에 투자해서 돈 버는 부업에 도전해봤습니다.● 테슬라 주식 쪼개서 산다…소수점 거래가 뭐야?소수점 거래는 주식시장에서 주식을 구매할 때 1주가 아닌 소수점 단위로 거래하는 것을 말합니다. 예를 들어 1주에 1만 원짜리 주식을 사려면 액면가에 표시된 1만 원이 있어야 매수할 수 있는데요. 소수점 거래로 구매하면 1,000원에도 0.1주를 살 수 있습니다. 테슬라를 예로 들어볼까요. 서학개미들의 해외 주식 보유 현황에서 테슬라는 여전히 1위인데요. 현재 우리 돈으로 100만 원이 넘게 있어야 테슬라 주식을 살 수 있는데 1,000원, 1만 원 어치를 사서 테슬라 주주가 될 수 있는 길이 열린 겁니다.금융위원회도 증권사의 해외주식 소수점 거래 서비스를 혁신 금융 서비스로 지정했습니다. 증권사들은 이달 말부터 해외 주식의 소수점 이하 구매 서비스를 시작하는데요. 투자자들이 소수점 단위 주문을 하면 증권사가 모아 매매 주문을 체결하는 방식입니다. 주식을 팔 때도 마찬가지로 증권사가 매도 주문을 모아 거래하게 됩니다. 기존 2곳에 불과했던 이 거래는 연내 증권사 20곳에서 시행하게 됐습니다. 현재는 신한금융투자와 후발주자로 참여한 한국투자증권 두 곳만 해외주식 소수점 거래가 가능한 상황입니다.● `개미도 전문가처럼`…소액으로 가능한 `미니스탁`소수점 거래 서비스 초기이기에 체험하고 비교할 수 있는 앱은 다소 제한적입니다. 저희는 부득이 `미니스탁` 이라는 앱을 사용해서 해외주식 소수점 거래에 도전했습니다. 1주 단위로 구매해야 했던 해외주식을 별도의 환전 없이 1,000원 단위로 주문할 수 있는 게 특징인데요. 이렇게 되면 소수점 여섯째 자리까지 매수할 수 있습니다. 가입 방법도 간단합니다. 증권사 앱을 설치한 후에 비대면 계좌를 개설하고 미니스탁 거래를 시작할 수 있고요. 또는 카카오뱅크 앱의 제휴 서비스에서 해외주식 투자 서비스에 가입하면 끝. 저는 이미 해당 증권사 계좌가 있었기 때문에 별도의 절차 없이 손쉽게 진행할 수 있었습니다.저는 일주일 간 생각날 때마다 테슬라 주식 1만원 어치를 사보기로 했는데요. 미니스탁 어플에서 돋보기를 검색한 후에 테슬라를 입력하면 됩니다. 그리고 구매하기 버튼을 누르면 1,000원부터 천원 단위로 주문을 할 수 있는데요. 주문할 금액을 선택하면 예상 수수료와 예상 주식수가 뜨게 됩니다. 이후 바로 구매 버튼을 누르면 테슬라 주주가 되는 겁니다. 미니스탁에는 테마 투자 기능이 있어서 테마 별로 여러 종목을 포트폴리오 형태로 매수할 수 있는데요. 테마만 고르면 관련 종목들을 그룹 형태로 한꺼 번에 사는 기능도 제공합니다.● 소액으로 적금하듯 투자…정말 장점만 있을까?`짠테크` 수단으로 이만한 게 없습니다. 소비하고 싶을 것들을 아낄 때마다 수시로 적립하기 좋기 때문인데요. 택시를 타면 1만원이 나오는데 버스나 지하철을 탔다면 남은 돈으로 테슬라 같은 우량주를 살 수 있는 거죠. 적립할 때는 소액이지만 모으는 재미가 있습니다. 또 `단타병`을 고칠 수 있다는 장점도 있습니다. 시세를 들여다 볼 필요 없이 소액으로 적립을 하다보면 직접 사고 팔 때보다 오히려 수익이 나는 경우도 있죠. 실제로 미니스탁은 자동투자 기능이 있는데요. 1,000원부터 원하는 날에 자동으로 투자되게 설정할 수 있습니다.하지만 단점도 있습니다. 일단 미니스탁은 올해까지 1만 원 이하 거래 수수료는 무료지만 그 이상을 투자하고 싶을 때는 수수료가 0.25%로 꽤 높은 편입니다. 1주를 살 돈이 있다면 일반 증권앱으로 투자하시는 게 더 유리합니다. 또 실시간 거래가 아니고 체결가격을 지정해서 주문할 수 없다는 점도 단점으로 꼽히는데요. 밤 10시까지 접수된 주문을 모두 모아서 한번에 환전 처리를 한 뒤에 미국 거래소가 개장하면 체결 작업을 진행하고 장 종료 후에 주문 금액에 맞춰 배분하는 방식이기 때문입니다. 실제로 체결된 시간이나 체결 가격은 알 수 없습니다. ● 테슬라 주식 5만원 어치 샀다…투자 수익률은 얼마저는 일주일 동안 테슬라 주식을 1만원 어치씩 5번 구매해서 약 5만원 어치를 샀습니다. 그래서 테슬라 주식을 총 0.039014주 보유하게 됐는데요. 테슬라가 갑자기 하락하기 시작해 `천백슬라`, `천슬라` 마저 위태로워지는 고비도 겪었습니다. 1주를 샀다면 마음이 타 들어갔겠지만 고작 몇 천 원 잃은 상태라 마음을 다잡을 수 있었습니다. 그 결과 23일 기준으로 수익률 7%를 넘겨서 3,622원을 벌었는데요. 큰 돈은 아니지만 다른 부업에 비해 노동력이라고는 손가락 하나 움직인 게 전부였다는 점을 높이 사고 싶습니다.기왕 해외주식 소수점 투자를 하시려면 증권사마다 진행하는 이벤트를 활용하는 것도 방법입니다. 가령 월 1만원 이하 거래 10건에 대해서 수수료 면제 혜택을 주거나, 가입자 유치를 위해 주식을 1주씩 선물하는 이벤트가 열리기도 합니다. 예를들어 스타벅스, 애플, 코카콜라 등 해외주식 우량주 가운데 원하는 종목을 6,000원 만큼 받는 식입니다. 제가 이용한 미니스탁의 경우에 테슬라, 나이키, AT&T, 켈로그처럼 관심도가 높은 종목을 2,000원 만큼 랜덤으로 주는데요. 최대 8.000원 어치의 우량주를 받을 수 있다는 말입니다.""우리는 초기 단계지만 미국에서는 소수점 거래를 통한 주식 투자가 활발하게 이뤄지고 있다는데요. 하지만 소수점 거래가 투자자들을 쉽게 주식시장에 접근할 수 있도록 했다는 의견과 증시 거품의 주요 원인이라는 의견이 갈립니다. 여러분들 아시죠. 투자 책임은 본인에게 있다는 것을 기억하시기를 바라겠습니다. 지금까지 이지효였습니다.""▶ <월급이 모자라> `해외주식 소수점 투자`편의 더 자세한 내용은 28일 오후 6시에 유튜브에서 확인하세요. 클릭☞ https://youtu.be/QNKETNN1oZE"
2021.11.26.,"인뱅, 9월말 중금리대출 비중…케뱅 13.7%·카뱅 13.4%",url없음,<네이버 기사 없음>
2021.11.26.,[광화문] 택시대란과 실종된 모빌리티 혁신,https://n.news.naver.com/mnews/article/008/0004675551?sid=110,"=2018년 10월  카카오모빌리티 카풀에 반대해 택시기사들은 단체행동에 나섰다.  2018.10.17/뉴스1  개혁은 혁명보다 어렵다. 비합법적 방식, 때론 무력으로 기존 질서를 깨뜨리는 혁명과 달라서다. 개혁은 합법적 테두리 안에서 이뤄져야하고 사회적 합의를 수반한다. 기득권, 저항 세력을 일일이 설득하고 동참시켜야한다. 때문에 면밀한 계획과 강력한 추진력이 뒷받침 되어야한다. 그렇지 않으면 구호만 요란하고 종국엔 흐지부지된다. 그런데 개혁이 필요한데도 하지 못하면 그 폐해는 고스란히 사회와 구성원, 국가에 돌아간다.  최근 모빌리티 분야의 난맥상은 이와 맞아 떨어진다. 정부가 모빌리티 혁신을 부르짖으며  이른바 '타다 금지법'을 내놓은지 1년 7개월이 지났지만 바뀐게 없다.  카카오T나 우티같은 모바일앱 호출이 확대됐을 뿐 시민불편은 여전하다. 실제 단계적 일상회복이 시작되자 심야시간대 택시잡기 전쟁이 벌어진다. 저녁 모임, 회식을 마치고 귀가하려면 택시 호출앱 30분 대기는 기본이다. 요금이 서너배 높은 프리미엄 택시를 불러야 겨우 잡힌다.  과연 타다가 있었더라면 이같은 대란이 벌어졌을까 반문하게 된다. 택시대란이 심화한 것은 공급이 그만큼 줄어서다. 코로나 확산 사태이후 택시 운전기사는 이전보다 10%가량 줄었다. 사회적 거리두기 여파로 택시 수요가 줄고 사납금 부담과 열악한 처우에 기존 법인택시 운전자가 이탈한 결과다. 배달 플랫폼 일자리가 늘어나니 젊은층의 신규 유입도 줄었다. 배달일이 고되긴 하지만 배달료 인상으로 수입이 짭짤하니 택시운전에 매달릴 이유가 없다. 부랴부랴 서울시가  내년 1월 1일까지 개인택시 운행 3부제를 한시적으로 풀기로 했지만 벌써부터 미봉책이라는 비판이 나온다. 고령층이 대부분인 개인택시 운전자들은 피크 시간대인 밤근무를 생각만큼 선호하지 않아서다.이쯤되면 정부가 그동안 뭐했느냐는 비판이 나오는게 이상하지 않다. 그만큼 정부의 모빌리티 정책은 면밀하지 못했다. 모빌리티 혁신은 수요자가 원하는 시점에 적절한 형태의 서비스를 제공하는 것이 본질이다. 그런데도 정부는 택시 업계의 입김에 밀려 타다를 막는데 급급했을뿐 출퇴근, 늦은밤 피크시간대 수급불안을 해소할 신모빌리티 서비스 도입 등 대안마련은 소홀했다. 당장 정부가 약속했던 '제2의 타다'는 감감 무소식이다.  ICT 규제샌드박스를 받은 3개 스타트업은 아직도 플랫폼 운송사업 면허를 받지못했다.  설령 면허를 받는다 해도 생존할지는 미지수다. 정부가 택시업계와의 상생을 이유로 차량대수 제한에다 매출의 5% 수준인 상생기여금 부과 등 과도한 조건을 내걸어서다. 카카오모빌리티나 우티같은 대형 사업자들 조차 사업성이 없다며 손사레치는 이유다.  오죽하면 정부가 모빌리티 혁신의 싹을 자르는 장본인이라는 비판이 나올까. 모빌리티 혁신이 더딘 것은 택시업계의 거센 저항에도 원인이 있다. 앞서 2013년 우버엑스에 이어 2019년 카카오 모빌리티의 카풀, 2020년 타다가 택시업계의 반발에 무위로 돌아갔다. 신 서비스 등장마다 강력한 단체행동으로 이권을 지켜왔다. 전국적으로 30만명의 종사자, 가족구성원까지 100만명의 표심으로 정부와 정치권을 압박했다. 최근 카카오모빌리티가 스마트 호출을 철회한 것이나 일부지역에서 자율주행 스타트업의 시험운행이 현지 택시업계의 반발로 답보상태인 것도 이와 무관치않다. 그러나 타다와 카카오의 등장이후에야 택시업계가 마지못해 고객 서비스 개선에 나섰듯, 택시업계 스스로 모빌리티 혁신을 이뤄낼 가능성은 없다. 결국 경직된 택시산업의  개혁 없이 혁신도 없다. 변화한 운송 서비스 수요와 산업지형에 걸맞게 혁신서비스의 길을 터줘야한다.  미국에서 택시 운전자가 우버기사를 병행하며 수입을 올리듯 기존 사업자와 혁신사업자가 상생하는 방안도 모색해야한다. 방치와 버티기로 일관하다 자율주행 시대가 도래하면 택시업계가 공멸을 맞을 것이라는 우려가 전혀 이상하지 않다. 조성훈 정보미디어과학부장"
2021.11.26.,"SPC 파리바게뜨, 크리스마트 앞두고 한정판 제품 행사 전개",https://n.news.naver.com/mnews/article/031/0000638951?sid=101,"크리스마스 시즌 맞아 밝고 화려한 디자인 케이크·친환경 굿즈 등 선봬파리바게뜨가 크리스마스를 맞이한 캠페인을 미리 연다.SPC그룹 파리바게뜨는 2021 크리스마스 시즌을 앞두고 '크리스마스, 대반전을 시작하자'라는 주제로 크리스마스 캠페인을 전개한다고 26일 밝혔다.실제 빅데이터 분석 플랫폼인 썸트렌드에 따르면, 크리스마스 언급량이 전년비 약 135% 늘어나며 전년보다 크리스마스 기대감이 커지고 있는 것으로 나타났다.파리바게뜨는 크리스마스를 대표하는 레드 컬러를 과감하게 적용한 2단 케이크부터 화려한 입체케이크, 산타, 루돌프, 트리 등의 오브제를 활용한 케이크까지 40여종의 시즌 제품을 선보인다.파리바게뜨 크리스마스 행사 [사진=SPC]대표 제품은 ▲촉촉한 딸기 시트에 부드러운 생크림과 상큼한 딸기 콩포트를 더하고 신선한 생딸기를 올려 화려하게 완성한 2단 케이크인 '블레싱 레드베리 스페셜' ▲촉촉한 화이트 스폰지와 생크림, 딸기 콩포트가 어우러진 케이크를 산타 얼굴로 구현한 입체 케이크인 '산타 이즈 백' ▲부드러운 화이트 스폰지와 생크림, 딸기 콩포트를 교차로 쌓아 입체 트리 모양으로 구현한 '위싱트리' 등이다.특히, 파리바게뜨는 고객들이 한정 수량으로 선보이는 인기 케이크를 놓치지 않고 구매할 수 있도록 사전예약 프로모션도 진행한다. 오는 12월 17일까지 해피오더, 카카오주문하기, 배달의민족, 요기요 어플리케이션을 통해 원하는 케이크를 최대 25% 혜택 가격으로 사전 예약할 수 있다. 제품은 12월 23일부터 25일까지 주문 시 선택한 매장에서 수령 가능하다.또, 해피오더를 통해 사전예약하는 고객을 대상으로 크리스마스 홈파티용 굿즈 2종도 사전 예약할 수 있는 혜택을 제공한다. 이번 굿즈는 ▲대형 풍선 7종과 레터링 풍선, 3색 고무 풍선 등 화려한 홈파티를 완성하는 다양한 풍선들로 구성한 '파티 데코팩'과 ▲'오늘의집'과 협업해 500ml 페트병 약 300만개를 재활용한 소재로 따뜻한 질감을 구현한 '친환경 부클 러그' 등 2종이다.파리바게뜨 관계자는 ""신종 코로나바이러스 감염증(코로나19)로 힘든 한 해를 보낸 만큼, 분위기를 대반전시켜 따뜻하고 행복한 크리스마스로 즐기자는 주제를 담은 제품과 캠페인을 기획했다""며 ""사전예약을 통해 케이크와 홈파티 굿즈까지 한번에 준비해 행복한 크리스마스 홈파티를 즐기시길 바란다""고 말했다."
2021.11.26.,"""개미는 치킨값이나 벌고 증권사는 실적 파티""…공모주 청약 수수료 '와글와글'",https://n.news.naver.com/mnews/article/009/0004884940?sid=101,"지난 25일 오후 서울 중구 을지로 하나은행 딜링룸에서 직원들이 업무를 보고 있다. 사진은 본 기사와 무관. [사진 출처 = 연합뉴스] 올해부터 도입된 '공모주 균등배정' 방식으로 인해 대부분의 증권사가 공모주 청약 수수료를 부과하면서 투자자들 사이 불만의 목소리가 나온다. 개인 투자자들에 수수료를 걷어 증권사만 배를 불리는 것이 아니냐는 지적이다. 반면 업계에서는 공모주 청약이 전국민 재테크 트렌드로 자리잡은 만큼 수수료 부과가 불가피하단 입장이다.26일 증권가에 따르면 NH투자증권과 신한금융투자, 키움증권, DB금융투자를 제외한 대부분의 증권사는 공모주 균등배정 방식에 따라 공모주 청약 수수료를 일반기준 온라인은 건당 1000원~2000원으로 책정하고 있다. 기존에는 온라인의 경우 수수료를 떼지 않는게 일반적이었다. 증권사별 수수료는 온라인 기준 ▲삼성증권 ▲대신증권 ▲미래에셋증권 ▲하나금융투자 ▲한국투자증권 ▲현대차증권 ▲신영증권 등은 2000원, ▲교보증권 ▲한화투자증권 ▲메리츠증권 ▲이베스트투자증권 등은 1000원이다.일부 투자자들 사이에선 증권사의 공모주 청약 수수료가 과도하다는 불평이 나온다. 공모주 청약 경쟁이 치열해지면서 개인에 배정되는 주식 물량은 제한적인데 수수료를 건 마다 부과하는 것은 부당하다는 것이다. 개인 투자자들에 수수료를 부과해 증권사들의 이익만 높이는 것이 아니냐는 지적도 나온다.투자자 A씨는 한 온라인 주식 커뮤니티에 ""올해부터 시행된 공모주 청약 균등제도로 개미들은 치킨값이나 벌고 증권사들은 막대한 수익을 얻고 있다""며 청와대 국민청원을 게재했다고 밝혔다.해당 청원에서 글쓴이는 ""균등제도로 공모주에 청약하면 어렵게 1주를 받아봐야 1만원 내외인데, 대부분 증권사에선 청약 수수료로 2000원을 내야된다""며 ""1만원 되는 주식을 받아서 2000원 수수료 내면 수수료율만 20%가 되고 상장날 20% 높은 가격에 팔아봤자 본전""이라고 토로했다.실제 올해 동학개미운동 여파로 국내 주요 증권사들의 영업이익은 크게 증가했다. 한국거래소에 따르면 연결재무제표를 제출한 주요 19개 증권사의 올해 3분기 누적 영업이익 합계가 10조원에 달하는 것으로 집계됐다. 특히 대신증권의 경우 3분기 누적 영업이익이 전년 대비 545% 가량 오른 것으로 나타났다.국내 증시 일평균 거래대금 증가에 따른 수익료 수익 증대가 증권사들의 호실적에 긍정적인 영향을 미쳤기 때문이다. KB증권에 의하면 올해 일평균거래대금은 27조1000억원(4분기 22조원 가정)으로 전년대비 17.7% 증가할 것으로 전망되며 신용잔고는 전년대비 21.3% (10월 말 43조3000억원기준) 증가했다.반면 증권사는 공모주 청약 열풍이 불어 닥치면서 그 비용을 감당하기 위해선  최소한의 수수료 부과가 필요하단 입장이다. 거래소에 의하면 올해 코스피 IPO 공모 금액은 17조원으로 역대 최대 규모를 경신했다. 전년(3조3000억원)보다 5배 이상이 불어난 수치다. 종전 IPO 공모금액 최대 규모는 2010년 8조8000원이었다. 특히 올해는 SK IET(2조2000억원)와 크래프톤(4조3000억원), 카카오뱅크(2조6000억원) 등 대형 우량 기업의 공모가 이어졌다.한 증권사 관계자는 ""예전에는 4~6만 계좌만 돼도 공모주 청약에 엄청 몰렸다고 했었는데 올해는 40~60만 계좌가 나오지 않느냐""라며 ""전산 시스템 관리·업데이트하는 비용 뿐 아니라 그에 따른 인력 충원·유지 등도 필요하기 때문에 비용이 계속해서 증가하고 있다""고 했다. 이어 ""공모주 청약이 균등 배정으로 바뀌면서 전국민적인 재테크 수단이 된 만큼 수수료 부과가 필요했던 것""이라고 덧붙였다.다만 아직까지 수수료를 책정하고 있지 않은 증권사들도 있다. 각 증권사의 가격 정책에 따라 수수료를 책정하다보니 고객 유치 전략의 한 방안으로 무료 수수료를 제공하고 있는 것이다. 대표적으로 ▲NH투자증권 ▲신한금융투자 ▲키움증권 ▲DB금융투자 등은 수수료를 부과하지 않고 있다.한편 올해부터 금융위원회는 청약증거금 비례방식에서 벗어나  공모주 균등배정 방식을 도입했다. 이에 따라 증권사는 모든 공모주의 일반청약 물량 중 50% 이상을 의무적으로 균등배정하게 됐다. 자산가들에 집중됐던 공모주 투자 기회를 소액 투자자들에게도 확대 제공하기 위해서다.일례로 지난달 25~26일 공모주 청약을 진행한 카카오페이는 국내 IPO 최초로 100% 균등 배정 방식을 택했다. 청약 증거금 90만원만 있으면 누구나 공모주 청약에 참여, 동등한 물량 배정 기회를 얻을 수 있었다."
2021.11.26.,요소수 재고 알림 변경… 일 2회→ 2시간마다,https://n.news.naver.com/mnews/article/417/0000758724?sid=102,"국내 요소수 재고 정보가 2시간마다 갱신된다. 사진은 지난 15일 경기 평택 한 고속도로 휴게소에서 요소수를 넣기 위해 줄 서있는 트럭들. /사진=뉴시스국내 요소수 재고 정보가 하루 2회씩 제공되던 것에서 2시간마다 갱신되는 방식으로 변경됐다.정부는 26일 정부서울청사에서 '제18차 요소수 수급 관련 범부처 합동 대응 회의'를 열고 새로운 재고 알림 시스템을설명했다.당초 요소수 재고 정보는 하루 2회(오후 2시, 저녁 8시)씩 제공돼 왔지만 이날부터는 T맵에서 2시간마다 갱신해 제공하는 시범 서비스가 도입됐다. 네이버·카카오 등에서도 다음 주부터 유사한 서비스를 제공할 수 있도록 준비하고 있다.지금껏 주유소는 전화나 메신저 등으로 요소수 재고 현황 조사에 응답해야 했다. 하지만 이제는 QR 등을 활용해 보다 편하게 데이터를 입력할 수 있다.더불어 정부는 전체적인 생산 현황을 점검하고 생산량을 늘리기 위해 기존 5대 생산업체 위주로 진행했던 동향 점검을 10대 업체로 확대하기로 했다.정부는 재고가 소진된 주유소로 보다 신속하게 물량이 배분되고 주말에도 적정량이 안정적으로 공급될 수 있도록 주요 공급 업체에 협조를 당부했다. 국내 최대 생산업체 등은 정부 시책에 최대한 협조하기로 했다.해외 수급의 경우 중국과의 계약 물량인 1만8700톤의 수입 일정이 보다 뚜렷해졌다. 12월초까지 중국과 베트남 등지에서 1만6000톤의 차량용 요소수를 국내로 들여올 계획이며 추가 물량 확보에도 공을 들이고 있다. 다음달 일본으로부터 차량용 요소수 1000톤을 반입할 예정이며 베트남에서도 5700톤을 신규로 반입할 예정이다."
2021.11.26.,일요일 오전 송파구 일대 교통 통제…서울마라톤 대회 개최,https://n.news.naver.com/mnews/article/421/0005749216?sid=102,"(사진제공=서울경찰청) © 뉴스1(서울=뉴스1) 김진 기자 = 서울경찰청은 28일 오전 '2021 서울마라톤' 대회가 개최되는 서울 송파구 일대 교통을 통제한다고 26일 밝혔다. 서울시와 대한육상경기연맹, 동아일보사가 공동주최하는 대회는 오전 8시부터 11시30분까지 열린다. 접종완료자 등으로 구성된 선수 등 490여명이 참가한다. 참가자들은 송파구 올림픽공원에서 출발해 올림픽공원을 6회 선회하고 잠실 종합운동장에 도착한다. 경찰은 오전 7시50분부터 11시30분까지 진행방향 또는 반대방향 하위 2개 차로를 교통 통제할 계획이다. 올림픽공원과 가락시장, 잠실역, 종합운동장 주변의 교통 불편이 예상된다. 도착지인 종합운동장사거리부터 삼성교 동단까지 400m 구간은 오전 9시부터 종료 시까지 진행방향 전 차로를 통제한다. 경찰은 교통 혼잡 및 시민 불편을 최소화하기 위해 통제구간 주변에 안내 입간판과 플래카드를 250여개 설치하고, 교통방송과 가로변 문자전광판 등을 이용해 교통상황을 안내할 계획이다. 교통경찰 등 400여명을 배치해 교통관리도 실시할 방침이다.서울청 관계자는 ""행사규모가 작아 순간 교통 통제로 시민 불편을 최소화할 방침이지만 시간대에 따라 장시간 대기하는 사례가 발생할 수 있다""며 마라톤 구간 우회를 당부했다. 행사 시간대 자세한 교통상황은 서울청 교통정부 안내전화(☎ 02-700-5000), 교통정보센터 홈페이지(www.spatic.go.kr), 카카오톡 1:1 문답서비스(서울경찰교통정보)를 통해 확인할 수 있다."
2021.11.26.,판교 알파돔시티 복합시설 준공식 열려,url없음,<네이버 기사 없음>
2021.11.26.,롤 챔피언 '아리' 12월 13일에 열 살 된다,https://sports.news.naver.com/news.nhn?oid=356&aid=0000051010,<구조 다름>
2021.11.26.,2021 서울모빌리티쇼 개막… 열흘간 킨텍스서 미래차 향연,url없음,<네이버 기사 없음>
