기사날짜,기사제목,네이버 뉴스 url,기사내용
2021.11.28.,이번주에만 44%↑…케이카 주가 올린 골드만삭스 보고서 두고 뒷말 무성,https://n.news.naver.com/mnews/article/009/0004885407?sid=101,"[사진 제공 = 케이카] 올해 IPO(기업공개) 시장에서 실패작 중 하나로 언급되던 국내 1위의 중고차 매매 플랫폼 케이카가 뒤늦은 질주를 시작했다. 공모가 부근에서 빌빌 대던 주가가 외국계 증권사의 기업 분석 보고서가 나오자 훌쩍 뛰어오른 것이다. 하지만 증권가 한편에서는 이 외국계 증권사의 보고서에 대해 '애프터 서비스'라며 평가절하하는 시각도 나온다. 26일 증권가에 따르면 케이카는 지난 19일 종가 2만5000원에서 26일 3만6050원으로 이번 한주 동안 44.20% 상승했다.이번주 코스피 시장에서 가장 주가가 많이 오른 종목이 케이카다. 케이카에 이어 카카오페이(30.88%), 쌍방울(18.23%), SK바이오사이언스(17.23%), 대영포장(17.14%) 등이 뒤를 이었다.케이카의 주가 급등은 외국계 증권사 골드만삭스가 지난 23일 내놓은 보고서의 영향이 큰 것으로 분석된다. 이 보고서에서 골드만삭스는 당시 케이카 주가의 3배를 훌쩍 넘는 8만5200원의 목표가를 제시했다. 보고서가 나온 23일 케이카 주가는 상한가를 찍었고, 24일에도 장중 25.64%까지 뛰었다. 앞서 케이카는 지난 10월 13일 코스피에 상장했다. 공모가는 2만5000원 상장 이후 케이카의 주가는 2만2000원에서 2만5000원선을 횡보했다. 급등 이전인 지난 22일까지 29거래일 가운데 케이카 주가가 공모가 2만5000원을 웃돈 날은 8거래일에 그쳤다. 공모가 주변을 맴돌던 주가가 골드만삭스의 보고서 발표 이후 단숨에 40% 넘게 뛴 것이다. 골드만삭스는 ""한국 중고차 시장이 2030년까지 온라인 보급률 등을 바탕으로 48조원 대로 성장할 것""이라며 ""케이카가 사업 모델과 규모에 힘입어 시장 점유율을 계속 장악하고 있다. 케이카의 가치가 재평가되며서 글로벌 동종 업체들과의 격차를 좁힐 것""이라고 밝혔다. 골드만삭스와 같은 글로벌 대형 IB가 당시 시총 1조2000억원대, 코스피 시총 242위였던 케이카를 호평한 데 대해 일종의 애프터 서비스라는 평가도 있다. 골드만삭스는 NH투자증권과 함께 케이카 IPO 공동 대표주관사였다. 최근 1년간 코스피에 신규 상장한 18개 종목 가운데 케이카를 포함해 단 4개 종목만 공모가보다 낮은 주가를 형성하고 있었다. 케이카는 이중에서 유일하게 외국계 증권사가 주관사단에 들어온 회사였다. 케이카 주가가 정말 3배 넘게 상승할 수 있느냐에 대한 의구심도 크다. 미국 증시에서도 대표적인 중고차 관련 종목들의 주가가 오르긴 했지만 상승폭이 그정도 수준은 아니었다. 중고차 시장은 대표적으로 코로나의 반사이익을 본 업종이다. 반도체 수급 문제로 신차 출고가 늦어지면서 중고차로 발길을 돌린 고객이 많았기 때문이다. 하지만 반도체 수급도 조만간 정상화될 것이란 기대감이 커지면서 중고차 매매 플랫폼 업체들의 주가는 최근 조정세를 보이고 있다. 미국 뉴욕증시에서 대표적인 중고차 플랫폼 업체인 카바나(CVNA) 주가는 연초 243달러에서 지난 8월 376달러까지 올랐다가 최근 다시 290달러까지 떨어졌다. 카맥스(KMX)는 연초 94달러에서 155달러까지 올랐다가 최근 140달러선으로 조정을 받고 있다. 국내 증시에서도  SK렌터카는 지난 8월 이후 1만5000원이던 주가가 현재 1만원대로 30% 가량 떨어졌다. 증권업계 관계자는 ""IPO 당시 주관사가 평가한 케이카의 적정한 주당 가치는 5만7000원선이었다""라며 ""당시 주관사에 들어가있던 골드만삭스가 상장 두 달도 안 돼 주당 8만5000원의 목표가를 제시하는 것은 상식적으로 받아들이기 어렵다""고 말했다."
2021.11.28.,[이혜원의 20대 랩소디] 20대가 '금쪽이'보며 눈물 훔치는 이유,https://n.news.naver.com/mnews/article/006/0000110676?sid=102,"'도대체 왜 그러는 거야? 이해 할 수가 없어.' 매일같이 카톡을 주고받는 동네 친구들과의 흔한 대화주제는 바로 '연애'다. 그 중 90%이상이 연애 상담이다. 죽이 척척 잘 맞다가도 도통 여자, 남자친구의 행동을 이해할 수 없는 일들이 일어나고야 말기 때문이다. 집에 일찍 들어가지 않는 여자친구가 걱정되어 잠을 이루지 못하는 남자친구, 퇴근 후 지친 몸을 이끌고 귀가한 후 갑자기 연락이 두절된 남자친구 때문에 속상한 여자친구, 일에 치여 힘들어하는 남자친구를 도와주고 싶어 손을 내밀지만 '알아서 하겠다'는 답변에 속상한 여자친구. '나라면 그렇게 행동하지 않을 텐데' 말하며 서운한 마음을 토로하다 보면 나와 친구들은 서로에게 이렇게 말해주곤 한다. '혹시 너희 엄마가 너에게 했던 행동을 네가 답습하고 있는 건 아니야?' '그 사람과 네가 사랑하는 방식이 서로 달라서 그런 건 아닐까?' '사람은 바꿀 수 없어. 정말 그 사람이 좋다면 있는 그 모습을 받아들일 줄도 알아야 해.' 일명 '꼬리에 꼬리를 무는 질문'을 해보라는 조언이다. 실제로 우리의 카카오톡 단체카톡방 공지에는 비장함을 품은 이런 문장이 적혀있다. '우리의 정신은 앞으로 <꼬꼬무>일세' 연애는 하루에도 희노애락을 전부 느끼는 신비로운 관계이다 보니 친구관계보다 다양한 문제에 봉착하게 되고 그러다보면 나 스스로를 들여다볼 수 있는 기회가 자주 있다. 우리의 연애 상담의 시작은 상대방에 대한 서운함과 못미더움 이었을지라도 끝내 나에 대한 자각과 그로인한 괴로움으로 귀결되곤 한다. 결국 연애에 국한된 문제 뿐 아니라 내 마음속 전쟁터를 발견하는 과정이다. '그래. 내가 과거의 경험 때문에 이런 감정을 느끼는 구나' 우리가 이런 질문을 던질 수 있게 해준 프로그램이 있다. 바로 넷플릭스에서도 유튜브 클립으로도 인기 몰이 중인 <오은영의 금쪽 상담소>(이하 '금쪽이')다. '금쪽이'는 대한민국 '어른이'를 위한 멘탈 케어 프로그램이라는 주제의식을 갖고 있는 프로그램이다. ▲ 채널A '요즘 육아 금쪽같은 내 새끼'. 사진=채널A 홈페이지화려한 조명을 받는 연예인들의 가장 사적이고 솔직한 이야기들을 듣고 있자면 우리의 고민이랑 너무 비슷해서 괜한 동질감이 느껴지기도 한다. 결국 우리 모두가 '금쪽이'구나 싶다. 강형욱 훈련사가 진행했던 <세상에 나쁜 개는 없다>도 마찬가지다. 동물이나 사람이나 이상 행동을 보이거나 관계에서 크고 작은 문제가 벌어지는 데에는 반드시 '이유'가 있다. 그 불편함을 인지하고 인정하는 것부터 해결의 실마리가 될 수 있다는 걸 알 수 있게 해준 프로그램들이다. 20대 중반 쯤 되면 살면서 일어났던 반복적인 일들에 대한 데이터가 쌓이고 그것에 문제가 있다는 걸 조금씩 인식하기 시작한다. 특히 흔히들 말하는 두 번째 사춘기. 스물일곱 즈음이 되면 궁금증이 대폭발한다. '어라? 왜 자꾸 이런 문제가 발생하지?' 가령 친구들끼리 놀다가 늦은 시간에 귀가할 일이 생기면 저마다 처하게 되는 상황이 모두 다르다. 귀가 시간에 전혀 개입하지 않는 부모님도 있고 버럭 화를 내는 부모님도 있다. 나에게 벌어지는 문제나 크고 작은 사건들이 모두에게 보편적으로 일어나는 게 아니라 나에게 한정된 특수한 상황이라는 걸 알게 된다. 우리는 살면서 많은 프레임을 흡수했다. 부모의 양육방식, 제도권 학교의 교육방식, 사회의 인식, 도덕규범 등. 이명박, 박근혜 정권 아래 10대를 보내면서 경쟁을 온 몸으로 흡수하면서도 말이다. 무언가 잘못됨을 느꼈지만 해결할 순 없었다. 어린 시절, 가정환경, 자라면서 놓인 환경의 맥락들을 쭉 거슬러 올라가다 보면 내가 화가 나고 속상하고 서운함을 느껴 괴로운 데에는 나만이 가지고 있는 작은 '알맹이'가 있다는 걸 인식한다. 치열함 속에서 나에 대한 고민을 할 겨를도 없이 순식간에 20대가 됐고 시간을 유예했을 뿐 결국 나를 들여다봐야 할 때를 마주한다. 마땅히 해야 할 의무를 해내며 살았다. '이 시기에는 이런 걸 해야 한다'라는 강박과 '여자'라면 '남자'라면 받아들여야 하는 경험들. 한 시기가 그 시기 자체로 인정받기 보다는 대학생이 되기 위한 청소년기로, 직장인이 되기 위한 대학생으로 존재하며 살았다. 그러다 보니 맥락적 사고보다 결과론적 사고를 길들일 수밖에 없었다. 어쨌든 그렇게 혼란스러운 개인들이 만나 밀접하고 특별하고 완벽한 관계를 맺으려다 보니 자꾸만 잡음이 일어나고, 나를 둘러싸고 존재했던 프레임을 끊임없이 발견하게 되는 건 아닐까. 우리의 연애가 불완전한 이유다. 슬프게도 '나'를 안다고 해서 모든 문제가 깔끔히 해결되는 건 아니다. 또 다른 문제가 비슷하게 응용되어 반복되기 때문이다. 한 구멍을 어떻게 막았는데 몰랐던 또 구멍을 반복하는 식이다. 이런 게 인생인가? 씁쓸해 하다가도 동갑내기 친구들과 다독인다. '이런 게 인생이 아니라 이런 걸 알아가는 게 인생 아닐까?' 20대에게 진정으로 필요한 콘텐츠, 20대를 타겟으로 어떤 콘텐츠를 제작해야 하는가 고민 섞인 글들을 본다. 사실 트렌드가 빠르게 변함에 따라 20대의 관심사나 그들의 취향도 모두 제각각이다. 메타버스, VR, 주식… 정말 이것이 20대에 대한 이야기일까? 오히려, 인생의 전반기를 돌아보고 한 템포 쉬며 자신을 정리할 수 있도록 질문을 던지는 콘텐츠가 아닐까 한다. 지금까지 있지만 없었던 그들 자신에 대해 질문할 수 있도록 하는 콘텐츠. 그게 절실히 필요하지 않을까 생각한다."
2021.11.28.,이르면 2022년 활성화…e-SIM 도입이 반가운 '알뜰폰',https://n.news.naver.com/mnews/article/293/0000037101?sid=105,"국내 e-SIM(이심) 도입이 2022년 본격화될 전망이다. 특히 올해 가입자 수가 급증한 알뜰폰(MVNO) 사업자들은 e-SIM 도입이 이 같은 추세를 더욱 가속할 것으로 기대 중이다. 과학기술정보통신부(이하 과기정통부)는 최근 국내 알뜰폰 가입자 1000만명 돌파를 기념하며 휴대폰 e-SIM 도입 방안을 연내에 마련하겠다고 밝혔다. 유심은 위 사진처럼 탈부착 가능한 가입자 식별모듈이며, 이심은 스마트폰에 내장된 가입자 식별 모듈이다 (사진=LG헬로비전 홈페이지 갈무리)e-SIM은 내장형(Embeded) 가입자 식별 모듈(SIM)의 약자다. USIM(유심, 범용 가입자 식별 모듈)과 달리 카드 탈부착 없이 소프트웨어 방식으로 가입자 정보를 업데이트할 수 있다. 유심과 함께 사용하면 하나의 스마트폰에서 2개의 번호, 2개의 이동통신 서비스 이용도 가능해진다. 두 심에 각기 다른 가입자 정보를 저장할 수 있기 때문이다. 알뜰폰 사업자들이 e-SIM 도입을 반기는 이유도 여기에 있다. 알뜰폰이 기존 이동통신(MNO, SKT·KT·LG유플러스) 3사 대비 경쟁력을 지닌 점은 저렴한 요금과 더 많은 음성·데이터 제공이다. e-SIM이 활성화되면 사용자들은 MNO 혹은 MVNO 요금제를 필요에 따라 전략적으로 조합해 쓸 수 있게 된다. 이 과정에서 MNO만 쓰던 사용자들이 자연스레 MVNO 생태계에 스며들 것이란 기대다.e-SIM은 알뜰폰 서비스 접근성도 개선할 수 있다. 과기정통부는 e-SIM이 활성화되면 기존 온라인 개통 중심의 알뜰폰 개통 과정이 간소화될 것으로 봤다. 오프라인 영업점이 없는 알뜰폰은 온라인 서비스 신청 시 유심을 택배로 수령하고, 콜센터 연결을 거쳐야 하는 등 신청부터 개통까지 수일이 걸리기도 해 서비스 접근성이 낮다는 한계가 있었다. 이를 보완하기 위해 올해 헬로모바일, KT엠모바일 등 일부 알뜰폰이 편의점 유심판매, 셀프개통 서비스를 개시했지만 e-SIM이 도입되면 이런 비대면 개통 절차가 더욱 간소화될 수 있다.국내 알뜰폰 회선 수는 현재도 매년 증가 중이다 (자료=과기정통부) 알뜰폰 사업자들은 e-SIM 도입을 환영하며 적극적인 대응을 예고했다. 카카오의 알뜰폰 계열사인 스테이지파이브는 ""독자적인 e-SIM 인프라 구축안을 포함한 여러 사업방향성을 검토 중이란 입장이다. 회사 관계자는 MNO, MVNO 모두 e-SIM을 사용 중인 일본의 사례를 들며 ""다가올 시장 변화에 발맞춰 구체적인 대비책을 준비 중인 단계""라고 설명했다. 국내 e-SIM 활성화 시기는 이르면 2022년 상반기 중으로 예상된다. 조기 안착을 위해선 이통3사의 적극적인 협력도 요구된다. e-SIM 서비스 개시에는 전용 설비 구축 및 시스템 개발이 필요하다. 이통사가 선제적으로 e-SIM 인프라를 구축해야 중소 알뜰폰 사업자들도 이를 이용한 e-SIM 서비스를 적기에 제공할 수 있다.다만 업계에선 이통사가 e-SIM 활성화를 탐탁지 않아 한다는 시각이 일반적이다. e-SIM 활성화 여파로 알뜰폰에 가입자가 분산되면 ARPU(가입자당매출)가 줄고, 실적 감소로 이어질 수 있기 때문이다. 유심카드 판매 매출도 줄어들 수 있다. 이통사들은 e-SIM 도입에 관해 대체로 말을 아끼는 모습이며 ""정부 기조에 따르겠다""는 입장이다. 한편 국내 알뜰폰 가입자 수는 해마다 빠르게 증가하고 있다. 스마트폰 가격이 매년 높아지고 고가의 5G 요금제가 주류로 떠오르면서 소비자들이 점차 저렴한 알뜰폰으로 눈을 돌리고 있기 때문이다. 과기정통부에 따르면 올해 국내 알뜰폰 후불 가입자는 전년 대비 약 90만명 늘었다. 최근 5년 사이 가장 높은 증가세다."
2021.11.28.,"""지구 살리는 꿀팁 이것""...‘지구회복’ 백일장 열린다",https://n.news.naver.com/mnews/article/092/0002240484?sid=105,"11월29일~12월12일...아이폰13프로·맥북에어·애플워치7·에어팟3 등 증정미국 국립과학재단(NSF)에 따르면 지난 8월 북극에 위치한 그린란드에 사흘간 70억t에 달하는 비가 내린 것으로 관측됐다. 세계은행(WB)은 기후변화 보고서 ‘그라운드스웰 파트2’를 통해 해수면 상승과 물부족, 곡물 생산 감소로 6개 지역에서 기후변화로 인한 강주 이주 사태가 빠르면 2030년부터 나타날 것이라고 결론지었다.이 같은 환경오염으로 인한 이상 기후 현상들이 지구 곳곳에서 나타나자 각 국가들은 석탄발전을 과감히 줄여야 한다는 목소리를 내고, 탄소배출량 감축에 힘을 쏟고 있다. 우리나라의 경우 2030년까지 탄소배출량을 40% 감축하겠다는 상향된 목표를 제시했으며, 정보통신기술(ICT) 기업들이 앞 다퉈 친환경 경영 전략을 발표하고 있다.이에 지디넷코리아는 착한기업들과 함께 ‘지구회복’ 모바일 백일장을 11월29일부터 12월12일까지 진행한다. 인간의 유일한 터전인 지구를 살리기 위한 개인의 소소한 실천 사례를 공유하고, 누구나 일상생활에서 실천할 수 있는 환경보호 아이디어를 작문하면 된다.지구회복 백일장또 주어진 시제로 환경과 관련된 ‘n행시’를 짓거나, 환경보호를 위한 경각심을 일으키는 표어를 지어도 된다. 창의적이고 진정성 있는, 감동적인 작품들을 선별해 아이폰13프로, 맥북에어, 애플워치7, 갤럭시워치4, 에어팟3, 스타벅스 모바일 쿠폰 등을 증정한다. 이벤트 소식 또는 자신의 글을 페이스북, 트위터, 카카오톡 등 소셜네트워크서비스에 공유하는 참여자 중 2명을 뽑아 에어팟3를 선물한다.이벤트 참여는 29일 월요일부터 2주 간 지디넷코리아 [☞지구회복 백일장 이벤트 페이지]를 통해 가능하다. 지디넷코리아 웹페이지 메인 상단 ‘백일장’을 클릭해 들어가거나, 웹페이지에 떠 있는 광고 배너 등을 이동하면 된다. 작문 참여 횟수에는 제한 없으나, 지나친 도배글 또는 특정 인물이나 기업을 비방하거나 비하하는 글은 수상 대상에서 제외된다. 수상자 발표는 12월21일 지디넷홈페이지 공지사항을 통해 이뤄진다.지구회복 백일장 경품지디넷코리아 모바일 백일장은 이번 행사로 3회째를 맞는다. 2019년에는 첫 행사는 n행시 자유 작문 방식으로 진행됐으며, 지난해에는 ‘코로나가 종식된 이후 나에게 쓰는 편지’라는 콘셉트로 타임머신 백일장이 열려 참여열기가 특히 더 뜨거웠다. 올해는 범국가적인 탄소중립 정책과, 기업들의 ESG(환경·사회·지배구조) 경영이 화두로 떠오르면서 ‘지구회복’이라는 환경을 주제로 한 백일장이 마련됐다.지디넷코리아 측은 “환경보호는 더 이상 미룰 수도 없고, 우리 모두가 일상생활에서 실천해야 필수적인 노력”이라며 “지구회복 백일장을 통해 환경보호의 필요성을 다시 한 번 되새기고, 주위 사람들도 건강한 지구 만들기에 동참할 수 있도록 많은 참여 부탁드린다”고 말했다.지디넷코리아와 착한 기업이 함께하는 지구회복 모바일 백일장은 네이버, 롯데홈쇼핑, 우아한형제들(배달의민족), 시지온, 엔에이치엔, 야놀자, 요기요, 위메프, 카카오, 코리아센터, 클룩, 티몬 등이 함께한다. 또 과학커뮤니케이터 ‘궤도’와 ‘과학쿠키’가 응원한다. 보다 자세한 내용은 아래 동영상을 통해 확인할 수 있다."
2021.11.28.,‘단군 이래 IPO 최대魚’라는 LG엔솔···얼마나 크길래 [김민석의 IPO브리핑],https://n.news.naver.com/mnews/article/011/0003990256?sid=101,"시가총액 75조 추산···역대 1위 공모시총 ‘크래프톤’의 3배공모규모도 약13조로 삼성생명(4조 9,000억) 두 배 수준LG엔솔 필두로 1월부터 공모시장 후끈[서울경제] LG(003550)에너지솔루션의 기업공개(IPO) 일정이 가시화되고 있다. 당장 이번 주(29~30일) 거래소로부터 상장 예비 심사 통과증을 받아들 전망이다. 다음 달 초 증권신고서를 제출하고, 1월 중순 기관 투자가 대상 수요예측에 나서면 내년 첫 코스피 상장 기업이 된다. LG엔솔의 증시 입성은 국내 기업 뿐 아니라 거래소에도 새로운 역사다. 상장 기업가치가 75조 원에 육박, IPO 사상 가장 큰 규모 일 뿐 아니라, 공모로 조달하는 자금도 13조 원 가량으로 과거 어느 기업 보다 많기 때문이다.━역대 ‘공모시총 1위’ 크래프톤(259960)의 3배 몸 집투자은행(IB) 업계에 따르면 LG엔솔의 상장 몸 값은 75조 원에 조금 못 미치는 수준이다. 역대 공모시총(공모가 기준 시가총액) 1위 크래프톤(24조 4,000억 원)에 비해 3배나 되는 규모다. 2위는 삼성생명(032830)(22조 원), 3위는 올해 증시에 입성한 카카오뱅크(323410)의 18조 5,000억 원으로 역대 1~3위 기업들의 몸 값을 모두 더해야 LG엔솔 규모가 되는 셈이다. 이미 상장한 기업들과 비교해도 삼성전자와 SK하이닉스에 이은 시가총액 3위의 기업 규모를 자랑한다.IPO 자금 조달 규모도 역대급이다. 여태껏 삼성생명이 공모시장에서 모은 4조 9,000억 원이 최고 기록인데, LG엔솔은 기관·일반 공모주 투자자들로부터 13조 원을 조달할 계획이다. 공모시총 1위 크래프톤의 공모 규모는 4조 3,000억 원이었다.공모 규모가 워낙 크다 보니 투자자들의 관심도 높을 수 밖에 없다. 억 단위 뭉칫돈에도 몇 주 받지 못하는 다른 공모주에 비해 투자자들에 돌아가는 공모주 몫도 비교적 많을 것이란 기대다. 또한 최근 증시에서 큰 인기를 끌고 있는 2차전지 관련주이고, LG전자(066570)·LG화학(051910) 뿐 아니라 제너럴모터스(GM) 등 글로벌 전기차 회사와 협업 관계가 돈독한 점도 투자 포인트다.━내년도 공모시장 ‘후끈’···e커머스 등 IPO 줄줄이 예고LG엔솔이 1월 증시에 입성하면서 2022년에도 IPO 시장에 뭉칫돈이 몰릴 전망이다. 1월에만 최소 13조 원의 공모를 기록하면서 2019년 한해 공모 총액 3조 8,000억을 한 달 만에 3배 이상 넘어선다.뒤이어 코스피 상장 2호 타이틀은 현대엔지니어링이 가져갈 확률이 높다. 지난 9월 거래소에 상장 예비 심사를 청구하며 거래소의 결과만 나오면 증권신고서 제출, 수요예측 등 공모에 나설 수 있기 때문이다. 몸 값이 10조 원까지 평가되는데 정의선 현대차그룹 회장이 지분율 11.72%로 주요주주인 만큼 기업가치에 대한 시장의 관심도 크다.내년 IPO 대어는 두 회사 뿐이 아니다. 이후 e커머스 기업들이 공모의 바통을 잇는다. 마켓컬리와 오아시스가 상장을 추진 중이며 SSG와 CJ올리브영 등 대기업 계열사들도 코스피 시장의 문을 두드린다. 최근 이들이 모두 상장 주관사 선정을 마치며 증시 입성에 대한 기대감을 높이고 있다.지난해 카카오(035720)게임즈를 시작으로 카카오뱅크·카카오페이(377300)로 이어진 카카오의 IPO 본능도 멈추지 않는다. 카카오엔터테인먼트가 최근 거래소와 상장 일정에 대해 논의하고 있는 가운데 카카오모빌리티도 주관사 선정에 다시 나선 것으로 전해졌다."
