기사날짜,기사제목,네이버 뉴스 url,기사내용
2021.11.14.,"댓글공작 잡는 '크라켄' 공개한 이준석 ""민주당 딱하다""",https://n.news.naver.com/mnews/article/047/0002332678?sid=100,"'이재명 부부싸움 루머' 확산 책임 논란 일축... ""이재명은 손가락혁명군으로 상당한 이득 봐""        ▲  국민의힘 이준석 대표가 14일 오후 국회 의원회관에서 열린 '댓글 조작' 대응 프로그램 '크라켄' 공개 시연 기자회견에서 인사말을 하고 있다.             ⓒ 연합뉴스   ""이재명 후보를 위한 서비스를 제공하기 위해 만든 것이 아니다."" 이재명 더불어민주당 대선후보의 배우자 김혜경씨의 낙상사고 루머와 관련 ""제2의 '십알단'처럼 조직적인 음해 유언비어를 확산시키고 있는데, 이준석 대표님은 크라켄 프로그램을 작동해 국민의힘 지지자들 중 혹시 매크로를 돌리는 사람이 있는지 내부 단속을 해주시기 바란다""는 송영길 민주당 대표의 SNS 발언에 대한 이준석 국민의힘 대표의 답변이다. 이 대표는 14일 오후 국회 의원회관에서 댓글공작 등 대선 여론조작 방지를 위한 당의 '크라켄' 프로그램을 공개한 뒤 ""송 대표가 페이스북을 통해 이재명 후보 배우자 낙상 사고 루머와 관련 크라켄을 가동해 달라고 했는데 어떻게 생각하느냐""는 질문을 받고, ""저희(크라켄)가 (댓글) 내용을 보는 게 아니라서""라면서 이같이 말했다. 또 ""왜 남의 당 서비스를 대면서 그걸 요구하는지 딱하다""면서 ""이재명 후보에 대한 여러 의심 가는 여론의 향배가 있어서 테스트를 해보고 싶다면, 민주당이 미리 이런 개발을 준비했으면 지금 효과를 봤을 것이다. 그쪽 선대위가 너무 안일한 것 아니냐""고 꼬집었다. ""이재명, 조직화된 여론조작 방식으로 이득 봐... 민심왜곡 시도 있을 것"" 김씨가 자택에서 낙상사고로 병원에 입원한 것을 두고 '부부싸움' 등 가짜뉴스가 나도는 것에 대한 대응은 민주당이 할 일이지 국민의힘에서 할 일이 아니란 비판이다. 또한 송 대표가 이번 루머를 두고 국민의힘 지지층을 거론하며 자신에게 크라켄 가동을 요구한 것이나, 박찬대 민주당 선대위 수석대변인이 ""조직적인 살포가 아니고서는 이처럼 짧은 시일 동안에 상상할 수 없는 속도로 확산할 수는 없다""며 루머 확산의 배후로 자당을 조준한 것에 대한 반박 역시 깔려 있었다. 이준석 대표는 오히려 이재명 후보 측에서 지지층을 동원해 여론을 조작하고픈 게 아니냐는 취지의 발언도 내놨다. 이 후보가 지난 12일 ""언론 환경이 매우 나빠서 우린 잘못한 것이 없어도 잘못했을지 모른다는 소문으로 도배된다""며 ""우리가 언론사가 돼야 한다""고 주장한 것에 대한 지적이었다. 당시 이 후보는 이같이 말하면서 ""저들의 잘못을 카카오톡으로, 텔레그램으로, 댓글로, 커뮤니티에 열심히 써서 언론이 묵살하는 진실을 알려야 한다""고 말한 바 있다. 이 대표는 관련 질문을 받고 ""이 후보는 본인의 정치행보를 시작하면서 '손가락혁명군(손가혁)'이란 조직화된 여론조작 방식으로 상당한 이득을 얻어서 (여론조작) 유혹을 뿌리치기 어려울 것""이라고 답했다. 아울러, ""(대선 시기) 민심왜곡 시도가 있을 것이라고 본다""면서 ""대선후보의 행보치고는 자잘하고 무엇보다 구태에 가깝다고 생각한다""고 비판했다. ""사찰 아니라 의심 가는 패턴 보는 것... 우리와 반대되는 의견 수집 없다"" 한편, 윤석열 국민의힘 대선후보를 위한 선거비책을 담은 비단주머니 1호로 공개된 '크라켄'은 내년 대선을 앞두고 온라인상의 댓글 공작 행위를 잡아내는 프로그램이다. 11월까지는 성능 테스트 및 시범 서비스를 거칠 예정이고 12월 1일부터 본격적으로 당 공식 캠프 내 설치해 운용할 예정이다. 이에 대해 당 디지털정당위원회 위원장인 이영 의원은 이날 ""동일한 IP가 여러 포털 사이트에 동시접속해 댓글을 달거나 아이디나 닉네임만 바꾼 채 동일한 내용의 댓글을 올리는 의심행위들을 AI 엔진이 수집·분석해 분류하고 전문 분석관 3인의 크로스체크를 거쳐 여론조작 행위로 판단된 댓글에 대해선 선거관리위원회에 신고하는 절차를 밟게 된다""고 설명했다. 이 대표는 ""대선 때마다 반복되는 여론조작 시도를 예방할 수 있는 프로그램""이라고 자신했다. 그는 구체적으로 ""2012년 저희 당의 전신인 새누리당에서 소위 댓글부대로 의심되는 '십알단'이 있었고 김경수 경남지사도 드루킹이란 사람의 제안으로 댓글부대를 운용하려다 본인도 감옥에 가고 문재인 정부의 정통성에 흠집을 낸 바 있다""며 ""대선 결과가 나온 뒤에 이런 것들(댓글공작)을 잡아본들 무슨 영향이 있겠나. '사드(THAAD, 고고도미사일방어체계)'처럼 조기경보시스템을 도입해야 한다는 취지로 크라켄 시스템을 가동하려고 한다""고 밝혔다. 특히 ""민주당에서도 이번 대선에서는 절대 어쭙잖은 여론공작이나 민주주의에 중대한 도전인 민심왜곡을 포기할 것을 권한다""며 ""우리 당은 여론조작을 엄격히 다루고 (크라켄 가동으로) 발견되는 부분은 선관위 고발과 수사의뢰 등 여러 조치를 취할 수 있도록 하겠다""고 강조했다. 이 대표는 ""공당이 인터넷상의 댓글을 감시한다는 위험성이 있지 않느냐""는 질문엔 ""(댓글) 내용을 사찰한다기 보단 의심가는 (댓글) 패턴을 보는 것이다. 한 사람이 일정 갯수 이상의 댓글을 단다는가 충분히 의심되는 정황이 있지 않겠나""라고 답했다. 아울러, ""내용에 비중을 두고 우리와 반대되는 의견을 수집하는 것도 아니다""며 ""공명선거 외 다른 목적엔 활용하지 않을 것이다. 그 부분은 제 양심을 걸고 말하겠다""고 덧붙였다."
2021.11.14.,"은행 이자가 2금융보다 비싸고, 고신용자는 역차별... '요지경' 된 대출시장",https://n.news.naver.com/mnews/article/469/0000641115?sid=101,"당국 대출 조이기 압박에 시중은행 금리가 2금융 웃돌아예금금리 찔끔 은행은 잇속 챙기기""금리 인상기 소비자만 피해""최근 서울 송파구 롯데월드 서울스카이 전망대를 찾은 시민이 아파트 단지가 밀집한 서울시내를 바라보고 있다. 뉴스1정부의 고강도 가계대출 규제가 계속되면서 시장의 상식을 깨는 '대출 기현상'이 속출하고 있다. 시중은행 대출금리가 제2금융권을 웃도는가 하면, 담보가 있는 주택담보대출보다 '무담보' 신용대출 금리가 더 낮은 경우도 생겼다. 은행들이 대출금리는 계속 올리면서,  예금금리 인상에는 인색한 결과 '예대금리차(예금과 대출 금리의 차이)'는 10년 만에 최고로 벌어졌다. 금리 상승기를 맞아 가뜩이나 부담이 늘어난 금융소비자만 피해를 보고 있다는 지적이 높다. ①2금융보다 높아진 은행 대출금리14일 금융권에 따르면, 최근 저신용자가 주로 이용하는 2금융권 대출금리가 시중은행보다 더 낮은 현상이 벌어졌다. 새마을금고중앙회의 지난달 말 기준 아파트 담보 주택구입자금대출 금리(서울 기준)는 연 2.82~3.91%였다. 이는 지난 1일 기준 4대 시중은행(KB국민·신한·하나·우리)의 주택담보대출 금리(변동형·3.31~4.814%)보다  상단이 1%포인트가량 낮은 것이다. 통상 조달금리가 높은 2금융권은 은행권보다 대출금리가 높다. 하지만 금융당국의 대출규제로 시중은행이  가산금리를 올리고 우대금리 혜택은 대폭 깎으면서, 오히려 2금융권 금리를 추월한 것이다.  금융권 관계자는 ""은행들이 마진을 확보하기 위해 우량 차주 위주로 대출금리를 올리면서 이 같은 현상이 벌어졌다""고 말했다.②주담대가 신용대출 금리 역전담보를 잡고 빌려주는 주담대 금리가, 담보 없는 신용대출을 웃도는 현상도 생겨났다.  이미 지난달부터 시중은행의 주담대 금리는 신용대출 금리를 웃돌기 시작했다. 이달 12일 기준 4대 시중은행의 주담대 금리 상단은 4.839%인 데 반해 신용대출 금리는 4.76% 수준이다.  한편에선, 고신용자 대출금리는 오르는 반면 저신용자 금리는 내리는 기현상도 벌어지고 있다. 인터넷전문은행 케이뱅크는 최근 중·저신용자 대상 신용대출 상품 금리를 최대 3.27%포인트 내린 반면, 고신용자 금리는 올렸다.카카오뱅크 역시 중·저신용자 대출 비중을 높이기 위해 올해 들어 신용등급 1·2등급의 신용대출 평균 금리를  1월 2.77%에서 9월 3.52%까지 0.75%포인트나 올렸다. 반면 신용등급 3·4등급과 5·6등급의 경우 같은 기간 0.21%포인트, 0.61%포인트씩 대출금리가 오르는 데 그쳤다.  직장인 A씨는 ""신용점수를 잘 관리한 사람이 되레 역차별받는 황당한 상황""이라고 토로했다.그래픽=강준구 기자③역대 최대로 벌어진 예대금리차 이런 와중에 은행들은 예금금리 인상에는 신경을 쓰지 않는다. 이미 지난 8월 국내은행의 예대금리차는 2.1%포인트로 2010년 이후 가장 많이 벌어졌다. 시중은행이 대출금리는 최대 5%가량까지 민첩하게 올리는 사이 예금금리는 연 1% 초반대에 머물고 있어서다. 예대금리차가 커진다는 건 은행이 예금자에게 혜택을 덜 주는 대신 대출자에게 더 많은 대가를 받고 있다는 뜻이다. 서지용 상명대 경영학부 교수는 ""정부의 총량 규제 등 정책이 대출시장의 기현상을 불러왔다""며 ""기준금리 인상과 맞물려 내년부터 대출금리가 더 가파르게 오르면 기존 차주를 포함한 금융소비자의 부담이 늘어날 가능성이 높은 상황""이라고 우려했다.이정환 한양대 경제금융학부 교수는 ""코로나19 특수 상황에서 시장 원칙에 반하는 현상들이 지속될 가능성이 크다""면서도 ""고신용자에 대한 대출을 줄이되 생계형 대출 등 대출이 꼭 필요한 사람들의 돈줄까지 조이면 안 되는 불가피성을 고려할 필요도 있다"" 지적했다."
2021.11.14.,'메타버스+NFT'로 가는 K-게임,https://n.news.naver.com/mnews/article/014/0004739363?sid=105,"게임업계 '미래 먹거리' 부상투자 확대·M&A 경쟁 치열 크래프톤은 오는 17일부터 열리는 지스타에서 '배틀그라운드 뉴스테이트'를 선보인다. K-게임 패러다임이 빠르게 재편되고 있다. 대체불가능한토큰(NFT) 등 블록체인 기술과 P2E(Play to Earn)로 대표되는 비즈니스모델을 갖춘 메타버스(3차원 가상세계) 플랫폼으로 전환되고 있는 것. 이 과정에서 메타버스 경제를 선점하기 위한 인수합병(M&A) 경쟁도 날로 치열해질 전망이다.   한대훈 SK증권 애널리스트는 이와 관련해 '게임파이(게임과 파이낸스 합성어)'라는 개념을 제시했다. 가상자산 분야 테크핀에 정통한 한 애널리스트는 ""이제 게임도 돈을 써야 이기는 P2W(Play to Win)에서 게임 아이템 고유가치로 돈을 벌 수 있는 P2E(Play to Earn)로 패러다임이 바뀌고 있다""면서 ""이 과정에서 NFT는 게임캐릭터와 아이템 등을 교환하고 거래하는 핵심 역할을 하고 있으며, NFT에서 가장 많이 판매되는 분야는 메타버스""라고 설명했다.   ■메타버스 경제 밸런스가 중요   14일 관련 업계에 따르면 3N(넥슨, 엔씨소프트(엔씨), 넷마블)과 2K(크래프톤, 카카오게임즈)는 NFT 등 블록체인게임을 통해 메타버스 산업을 공략하고 있다. K-게임 글로벌화를 위한 핵심 열쇠로 메타버스를 꺼내든 것이다.   특히 3N이 공격적이다. 게임업계 맏형으로서 비트코인(BTC)과 가상자산거래소 등에 꾸준히 투자해온 넥슨은 최근 '프로젝트 MOD'란 이름의 메타버스 프로젝트를 천명한 상태다.   넥슨 일본법인 오웬 마호니 대표는 ""글로벌 게임 산업은 약 4년 주기로 새로운 메가트렌드를 중심으로 한데 모인다""면서 ""캐주얼 소셜게임, 가상현실(VR), e스포츠 등이 대표적""이라고 전했다. 이어 ""최근 급부상한 메타버스란 가상세계를 만들 때 특히 경제 밸런스가 중요하다""고 덧붙였다. NFT 등 블록체인 기반으로 게임 속 경제가 존재한다면, 게임에 재미를 더하는 한편 가상세계에서도 인플레이션과 디플레이션에 대한 논의가 함께 이뤄져야 한다는 것이다. 그는 ""게임을 통해 힘들게 싸워 얻은 전리품의 게임 속 가치가 떨어진다면, 게임 이용자들은 불만을 느끼고 그만두게 될 것""이라며 ""동시에 새로운 할 일, 볼거리, 모을 아이템 등 콘텐츠 구축이 매우 중요하다""고 강조했다.   ■NFT 기반 메타버스 경제 부상   엔씨와 넷마블 이외에도 K-게임 신흥강자인 크래프톤, 카카오게임즈, 위메이드 등도 NFT 등 블록체인 기반 메타버스에 주력하고 있다. 각사가 보유한 슈퍼 지식재산권(IP) 기반의 다중접속역할수행게임(MMORPG) 아이템을 토큰화한 뒤 고유가치를 지닌 NFT로 활용토록 하는 게 핵심이다.   특히 엔씨는 글로벌 게임, IP, 콘텐츠 분야 M&A을 통해 메타버스 생태계를 확장한다는 방침이다. 최근 국내외 게임업계 M&A 큰손으로 떠오른 크래프톤 역시 인터랙티브 콘텐츠 제작사 '띵스플로우'를 인수했다. 띵스플로우는 기술과 콘텐츠 융합을 통해 캐릭터 IP 기반 채팅형 콘텐츠 플랫폼 '헬로우봇'을 한국과 일본에 선보인 바 있다.   배동근 크래프톤 최고재무책임자(CFO)는 ""크래프톤은 (메타버스 대신) 인터랙티브 버추얼 월드라는 표현을 써왔다""면서 ""인터랙티브 버추얼 월드 구현을 장기 성장의 주요한 축으로 보고 투자와 연구를 진행했다""고 전했다. 이어 ""메타버스가 최근 큰 관심을 받고 관련 시장이 형성되는 걸 보면서 우리가 추구해온 방향이 맞다는 확신이 커져 있다""고 덧붙였다.   김시호 연세대 글로벌융합공학부 교수는 ""메타버스는 가상공간에서 일어나는 경제 및 여가활동들을 지원하는 IT 서비스 플랫폼""이라며 ""여기에 디지털 자산의 소유를 입증하고 거래가 이뤄질 수 있는 방법을 NFT가 지원, NFT와 메타버스가 결합되는 것은 새로운 사이버 경제의 지평을 열게 될 것""이라고 전망했다."
2021.11.14.,"SK텔레콤, 다우존스 지속가능경영지수(DJSI) 편입",https://n.news.naver.com/mnews/article/015/0004628071?sid=105,"대외신인도 상승…해외 자금조달 등 유리사진 로이터SK텔레콤이 세계적인 지속가능성 평가지수 ‘다우존스 지속가능경영지수(DJSI)' 평가에서 글로벌 상위 기업 10%에 들었다. 13일 KPC한국생산성본부 등에 따르면 SK텔레콤은 DJSI 평가에서 상위 10% 기업들이 속하는 DJSI월드지수에 편입됐다. DJSI는 기업의 경영 안정성과 ESG(환경·사회·지배구조) 성과를 종합적으로 평가한다. 세계 최대 금융정보 제공기관 S&P의 S&P다우존스인덱스가 스위스 투자 전문기관 로베코샘과 함께 산정한다. 이중 DJSI월드지수는 유동 시가총액 기준 글로벌 상위 2500대 기업 중 10% 안팎을 지수 기준 기업으로 들인다. 올해는 2544곳 중 12.7%인 322개사가 선정됐다. 기준이 까다로워 해마다 일부 기업이 빠지기도 한다. SK텔레콤은 2019년까지 12년 연속으로 DJSI월드지수에 들었다가 작년에 명단에서 빠졌고, 1년만에 다시 편입됐다. SK텔레콤이 DJSI 월드 지수에 편입된 것은 이번이 13번째다. SK텔레콤은 올해 아시아·오세아니아 지역 상위 600개 기업을 대상으로 하는 DJSI 아시아태평양 지수, DJSI 한국 지수 기준 기업에도 들었다. SK텔레콤은 ""올해 5세대(5G) 비롯 통신 서비스 경쟁력, 환경경영체계와 기후변화대응 전략, 인프라 전력감축을 통한 온실가스 저감 노력, 사회적 약자를 위한 AI 돌봄 서비스·AI 기반 다회용컵 수거 캠페인 등 ICT 기반 사회적가치 창출, 개인정보 보호, 인적자본 개발과 역량강화, 이해관계자 소통 강화 측면에서 높은 평가를 받았다""고 설명했다. DJSI에 편입되면 기업엔 호재다. 지속가능성을 비롯해 경영 안정성을 확보했다는 점을 글로벌 투자자들에게 알릴 수 있어서다. 편입 자체에 따르는 직접적인 혜택이 있는 것은 아니지만 자금 조달·해외 사업 진출 등에 유리한 요소로 작용할 수 있다. SK텔레콤은 앞서도 ESG 성과와 목표를 인정받아 싱가포르 최대 은행 DBS그룹으로부터 여느 회사채 대비 유리한 조건으로 자금을 조달했다. 지난 6월 3년 만기 자금 2000억원에 대해 우대금리를 적용받고 대출 수수료도 할인받았다. 우대금리와 향후 인센티브 등을 모두 적용했을 때 회사채가 아니라 국고채 수준 금리를 적용받은 것으로 알려졌다. 이번 DJSI 평가 결과는 이달 말께 S&P DJSI 펀드를 비롯한 각종 ESG 지수 펀드에 반영된다. SK텔레콤은 올해 SK, 삼성전기, 현대자동차, 카카오 등과 함께 DJSI 월드 지수에 편입됐다."
2021.11.14.,'메타버스+NFT'로 가는 K-게임,https://n.news.naver.com/mnews/article/014/0004739363?sid=105,"게임업계 '미래 먹거리' 부상투자 확대·M&A 경쟁 치열 크래프톤은 오는 17일부터 열리는 지스타에서 '배틀그라운드 뉴스테이트'를 선보인다. K-게임 패러다임이 빠르게 재편되고 있다. 대체불가능한토큰(NFT) 등 블록체인 기술과 P2E(Play to Earn)로 대표되는 비즈니스모델을 갖춘 메타버스(3차원 가상세계) 플랫폼으로 전환되고 있는 것. 이 과정에서 메타버스 경제를 선점하기 위한 인수합병(M&A) 경쟁도 날로 치열해질 전망이다.   한대훈 SK증권 애널리스트는 이와 관련해 '게임파이(게임과 파이낸스 합성어)'라는 개념을 제시했다. 가상자산 분야 테크핀에 정통한 한 애널리스트는 ""이제 게임도 돈을 써야 이기는 P2W(Play to Win)에서 게임 아이템 고유가치로 돈을 벌 수 있는 P2E(Play to Earn)로 패러다임이 바뀌고 있다""면서 ""이 과정에서 NFT는 게임캐릭터와 아이템 등을 교환하고 거래하는 핵심 역할을 하고 있으며, NFT에서 가장 많이 판매되는 분야는 메타버스""라고 설명했다.   ■메타버스 경제 밸런스가 중요   14일 관련 업계에 따르면 3N(넥슨, 엔씨소프트(엔씨), 넷마블)과 2K(크래프톤, 카카오게임즈)는 NFT 등 블록체인게임을 통해 메타버스 산업을 공략하고 있다. K-게임 글로벌화를 위한 핵심 열쇠로 메타버스를 꺼내든 것이다.   특히 3N이 공격적이다. 게임업계 맏형으로서 비트코인(BTC)과 가상자산거래소 등에 꾸준히 투자해온 넥슨은 최근 '프로젝트 MOD'란 이름의 메타버스 프로젝트를 천명한 상태다.   넥슨 일본법인 오웬 마호니 대표는 ""글로벌 게임 산업은 약 4년 주기로 새로운 메가트렌드를 중심으로 한데 모인다""면서 ""캐주얼 소셜게임, 가상현실(VR), e스포츠 등이 대표적""이라고 전했다. 이어 ""최근 급부상한 메타버스란 가상세계를 만들 때 특히 경제 밸런스가 중요하다""고 덧붙였다. NFT 등 블록체인 기반으로 게임 속 경제가 존재한다면, 게임에 재미를 더하는 한편 가상세계에서도 인플레이션과 디플레이션에 대한 논의가 함께 이뤄져야 한다는 것이다. 그는 ""게임을 통해 힘들게 싸워 얻은 전리품의 게임 속 가치가 떨어진다면, 게임 이용자들은 불만을 느끼고 그만두게 될 것""이라며 ""동시에 새로운 할 일, 볼거리, 모을 아이템 등 콘텐츠 구축이 매우 중요하다""고 강조했다.   ■NFT 기반 메타버스 경제 부상   엔씨와 넷마블 이외에도 K-게임 신흥강자인 크래프톤, 카카오게임즈, 위메이드 등도 NFT 등 블록체인 기반 메타버스에 주력하고 있다. 각사가 보유한 슈퍼 지식재산권(IP) 기반의 다중접속역할수행게임(MMORPG) 아이템을 토큰화한 뒤 고유가치를 지닌 NFT로 활용토록 하는 게 핵심이다.   특히 엔씨는 글로벌 게임, IP, 콘텐츠 분야 M&A을 통해 메타버스 생태계를 확장한다는 방침이다. 최근 국내외 게임업계 M&A 큰손으로 떠오른 크래프톤 역시 인터랙티브 콘텐츠 제작사 '띵스플로우'를 인수했다. 띵스플로우는 기술과 콘텐츠 융합을 통해 캐릭터 IP 기반 채팅형 콘텐츠 플랫폼 '헬로우봇'을 한국과 일본에 선보인 바 있다.   배동근 크래프톤 최고재무책임자(CFO)는 ""크래프톤은 (메타버스 대신) 인터랙티브 버추얼 월드라는 표현을 써왔다""면서 ""인터랙티브 버추얼 월드 구현을 장기 성장의 주요한 축으로 보고 투자와 연구를 진행했다""고 전했다. 이어 ""메타버스가 최근 큰 관심을 받고 관련 시장이 형성되는 걸 보면서 우리가 추구해온 방향이 맞다는 확신이 커져 있다""고 덧붙였다.   김시호 연세대 글로벌융합공학부 교수는 ""메타버스는 가상공간에서 일어나는 경제 및 여가활동들을 지원하는 IT 서비스 플랫폼""이라며 ""여기에 디지털 자산의 소유를 입증하고 거래가 이뤄질 수 있는 방법을 NFT가 지원, NFT와 메타버스가 결합되는 것은 새로운 사이버 경제의 지평을 열게 될 것""이라고 전망했다."
2021.11.14.,"SK텔레콤, 다우존스 지속가능경영지수(DJSI) 편입",https://n.news.naver.com/mnews/article/015/0004628071?sid=105,"대외신인도 상승…해외 자금조달 등 유리사진 로이터SK텔레콤이 세계적인 지속가능성 평가지수 ‘다우존스 지속가능경영지수(DJSI)' 평가에서 글로벌 상위 기업 10%에 들었다. 13일 KPC한국생산성본부 등에 따르면 SK텔레콤은 DJSI 평가에서 상위 10% 기업들이 속하는 DJSI월드지수에 편입됐다. DJSI는 기업의 경영 안정성과 ESG(환경·사회·지배구조) 성과를 종합적으로 평가한다. 세계 최대 금융정보 제공기관 S&P의 S&P다우존스인덱스가 스위스 투자 전문기관 로베코샘과 함께 산정한다. 이중 DJSI월드지수는 유동 시가총액 기준 글로벌 상위 2500대 기업 중 10% 안팎을 지수 기준 기업으로 들인다. 올해는 2544곳 중 12.7%인 322개사가 선정됐다. 기준이 까다로워 해마다 일부 기업이 빠지기도 한다. SK텔레콤은 2019년까지 12년 연속으로 DJSI월드지수에 들었다가 작년에 명단에서 빠졌고, 1년만에 다시 편입됐다. SK텔레콤이 DJSI 월드 지수에 편입된 것은 이번이 13번째다. SK텔레콤은 올해 아시아·오세아니아 지역 상위 600개 기업을 대상으로 하는 DJSI 아시아태평양 지수, DJSI 한국 지수 기준 기업에도 들었다. SK텔레콤은 ""올해 5세대(5G) 비롯 통신 서비스 경쟁력, 환경경영체계와 기후변화대응 전략, 인프라 전력감축을 통한 온실가스 저감 노력, 사회적 약자를 위한 AI 돌봄 서비스·AI 기반 다회용컵 수거 캠페인 등 ICT 기반 사회적가치 창출, 개인정보 보호, 인적자본 개발과 역량강화, 이해관계자 소통 강화 측면에서 높은 평가를 받았다""고 설명했다. DJSI에 편입되면 기업엔 호재다. 지속가능성을 비롯해 경영 안정성을 확보했다는 점을 글로벌 투자자들에게 알릴 수 있어서다. 편입 자체에 따르는 직접적인 혜택이 있는 것은 아니지만 자금 조달·해외 사업 진출 등에 유리한 요소로 작용할 수 있다. SK텔레콤은 앞서도 ESG 성과와 목표를 인정받아 싱가포르 최대 은행 DBS그룹으로부터 여느 회사채 대비 유리한 조건으로 자금을 조달했다. 지난 6월 3년 만기 자금 2000억원에 대해 우대금리를 적용받고 대출 수수료도 할인받았다. 우대금리와 향후 인센티브 등을 모두 적용했을 때 회사채가 아니라 국고채 수준 금리를 적용받은 것으로 알려졌다. 이번 DJSI 평가 결과는 이달 말께 S&P DJSI 펀드를 비롯한 각종 ESG 지수 펀드에 반영된다. SK텔레콤은 올해 SK, 삼성전기, 현대자동차, 카카오 등과 함께 DJSI 월드 지수에 편입됐다."
