기사날짜,기사제목,네이버 뉴스 url,기사내용
2021.11.07.,무려 11.1조원…내주 카카오뱅크 크래프톤 SKIET 기관 물량 쏟아진다,https://n.news.naver.com/mnews/article/009/0004875265?sid=101,"[사진 = 연합뉴스] 카카오뱅크, 크래프톤, SK아이이테크놀로지 등 대형 IPO 종목 투자자라면 긴장해야 할 한주가 찾아왔다. 3개월, 6개월 보호예수로 묶여있던 기관 투자자 물량이 풀리기 때문이다. 이번주에 세 종목에서 해제되는 기관 투자자 보유 주식은 SK아이이테크놀로지 8조원 등 11조원을 넘는다.증권가에 따르면 지난 5일 기관 투자자들이 보유한 카카오뱅크 주식 2030만주에 대한 의무보유 제한이 풀렸다.4일 종가 기준으로 1조2200억원 규모다. 이들 주식은 지난 8월 카카오뱅크가 상장할 당시 3개월 의무보유가 걸려있던 물량이다. 2030만주 가운데 기관 투자자들이 받은 공모주가 506만주, 넷마블 761만주, 중국 텐센트의 벤처투자사 스카이블루 럭셔리 인베스트먼트 761만주 등이다. 카카오뱅크 상장 당시 기관 투자자에게 총 3600만주의 주식이 배정됐다. 이 중 59.82%에 의무 보유 제한이 걸려있었다. 15일(7만9000주), 1개월(314만주)는 이미 의무보유 기간이 끝났고 이번에 506만주에 대한 보호예수가 해제되는 것이다. 내년 2월에 풀리는 6개월 의무보유 물량은 1326만주다. 1개월 보호예수가 풀렸던 지난 9월 6일 카카오뱅크는 4%대 약세를 보이기도 했다. 카카오뱅크의 공모가는 3만9000원으로, 5만7000원선인 현 주가는 공모가보다 46.2% 높은 수준이다. 기관 투자자 입장에서는 차익 실현에 대한 욕구가 클 수 있다. 넷마블과 텐센트가 보유 지분을 시장에 내놓을지도 관심사다 넷마블은 보호예수가 없었던 카카오뱅크 주식 762만주를 이미 두 차례에 걸쳐 매도하면서 현금 5600억원을 손에 쥐었다. 이번에 보호예수가 풀리는 주식 761만주도 매도할 가능성이 높다고 증권가는 예상하고 있다. 스카이블루 럭셔리 인베스트먼트의 의중은 아직 오리무중이다. 고경범 유안타증권 연구원은 ""카카오뱅크는 실질 유통물량이 낮아 매도충격이 높을 것""이라며 ""스카이블루 럭셔리 인베스트먼트는 벤쳐캐피탈이지만, 텐센트 자회사로서 우호지분으로 잔류할지 여부는 확인이 필요하다""고 말했다. 카카오뱅크와 나흘 차이로 상장했던 크래프톤도 오는 10일 3개월 의무보유 제한이 풀린다. 405만주, 전일 종가로 1조9000억원 규모다. 크래프톤도 1개월 보호예수가 해제됐던 지난 9월 10일 6% 가까이 주가가 급락했다. 크래프톤은 상장 당시 기관 투자자들의 의무보유 물량 비중이 45%선으로 다른 대어급 IPO 종목보다 낮았다. 이번에 풀리는 3개월 보호예수 물량은 기관 투자자 배정 몫의 23.8%로, 1개월(16.9%), 6개월(3.7%), 15일(0.5%) 등에 비해 가장 많다. 또 투자 수익 회수를 최우선시하는 벤처캐피탈이 보유한 219만주의 물량이 언제 출회되느냐도 관건이다. 크래프톤의 주가는 45만원선으로 공모가 49만8000원을 밑돌고 있다. 크래프톤의 주가가 기대치를 밑돌고 있는 가운데 기관 투자자들이 지분을 당장 현금화를 할지 아니면 주식을 보유하면서 주가 추이를 지켜볼지 고민에 빠질 것으로 보인다. 지난 5월 11일 상장한 SK아이이테크놀로지는 반년 만에 최대의 고비를 만났다. 오는 11일 5293만주, 금액으로는 8조450억원 규모의 물량이 풀린다. 이 중 4363만주는 최대 주주인 SK이노베이션이 보유한 주식이다. 경영권이나 주가 안정화 측면에서 보면 당장 매물로 나올 가능성은 적다. 다만 재무적 투자자(FI)인 2대 주주 프리미어 슈페리어가 보유한 627만주의 의무보유 제한이 풀리면서 대량 물량 출회에 대한 우려를 키울 것으로 보인다. 또 기관 투자자들이 받은 공모주 의무보유 제한 물량도 이번 6개월분이 전체의 24.9%로 가장 많다. 15일은 0.3%, 1개월 22.2%, 3개월은 17.2%였다. 조현렬 삼성증권 연구원은 ""11일이 IPO 6개월 이후 락업물량 해제시점인 것을 감안하면, 수급적 부담이 단기적을 상존한다""라면서 ""하지만 중장기 방향성의 변화가 없기에 11월은 매수하기 좋은 시기가 될 것으로 판단한다""고 말했다."
2021.11.07.,"""이게 무슨 일?""...카카오T 역전한 우티",https://n.news.naver.com/mnews/article/215/0000995252?sid=105,"통합앱 출시와 11월 할인 영향 분석택시호출 앱 '우티'(UT)가 이달초 글로벌 차량호출 앱 '우버'와 통합 서비스를 개시한 이후 다운로드 건수와 사용자 수가 급증한 것으로 나타났다.7일 플랫폼 기업 아이지에이웍스의 빅데이터 분석 솔루션 '모바일인덱스' 분석에 따르면 이달 1∼2일 이틀간 우티 앱 신규 설치건수는 3만6천642건으로 집계됐다. 이는 전월 동기 2천667건의 13.7배이며, 우티가 우버 앱과 통합하기 직전인 지난달 30∼31일 7천630건의 4.8배다.우티 설치가 급증하면서 카카오T와 역전 현상도 벌어졌다.이달 1∼2일 카카오T 앱 신규 설치건수는 3만703건으로 우티보다 5천939건 적었다. 지난달 1∼2일 카카오티 설치건수가 4만4천672건으로 우티의 16.7배였던 것과 비교하면 이례적이다.우티의 일간사용자수(DAU)는 1∼2일 총 10만986명으로, 전월 동기 1만5천934명의 6.3배다. 지난달 1∼2일 우티의 DAU는 카카오T 대비 0.6%에 불과했으나, 이달 1∼2일에는 이 비율이 4.1%로 높아져 우티의 존재감이 커졌다.이는 1일 우버와 통합하면서 앱 가입자가 늘어난데다 11월 한달간 진행되는 '20% 상시 할인' 혜택을 보려는 승객이 몰린 데 따른 것으로 풀이된다. 또 이달부터 위드코로나가 시행되며 각종 모임과 회식이 늘어난 점도 영향을 미친 것으로 보인다.택시 수요가 가장 많은 0시부터 새벽 1시까지 시간대를 보면, 이달 2일과 3일 해당 시간대 타다 콜 수는 1주 전 대비 각각 577%, 450% 증가했다. 이 시간대 사용자가 크게 늘어난 것은 위드코로나 효과로 볼 수 있다. 이에 따라 할인 행사가 끝나고 위드코로나 효과도 약화되면 우티 이용자 증가세가 주춤할 것이라는 관측이 나온다.모빌리티업계 관계자는 ""일시적 할인을 통해 고객을 끌어들인 뒤 2년여간 유지하는 통신업계 등과 달리 택시호출 시장은 순식간에 분위기가 달라진다""고 지적하면서 할인 행사 이후 우티가 지속적으로 혁신할지는 지켜봐야 한다고 말했다.이에 대해 우티는 내년까지 가맹택시를 2만대 이상으로 늘릴 계획인데다가 목적지에 근거해 요금을 정하고 해당 요금에 맞춰 결제하는 '사전 확정 요금제' 등 새로운 서비스를 선보일 예정이라며 고객이 더 늘어날 것이라고 전망했다.우티 관계자는 ""통합 앱 출시 전 우버 앱 베타 테스트 기간 30% 할인을 했기 때문에 최근 이용자 증가가 할인 효과 때문이라고만 볼 수는 없다""며 ""앞으로 계속 서비스가 추가될 예정이므로 이용자가 계속 늘어날 수 있다""고 말했다.(사진=우티)"
2021.11.07.,"망가냐, 웹툰이냐...해외 시장 두드리는 카카오",https://n.news.naver.com/mnews/article/293/0000036874?sid=105,"△카카오는 픽코마의 유럽 진출을 두고 “카카오엔터테인먼트가 보유한 한국형 웹툰부터 일본 망가까지 아우르는 콘텐츠 라이브러리가 될 뿐만 아니라 완성된 유럽시장에 대입해 볼 수 있는 좋은 기회”라고 설명했다.(사진=카카오)카카오가 카카오재팬 사명을 ‘카카오픽코마’로 바꾸고 프랑스 등 유럽 시장에 발을 뻗는다. 앞서 카카오엔터테인먼트가 운영하는 카카오웹툰도 유럽 사업을 검토 중인 것으로 알려진 가운데, 두 회사의 차별화 전략에 관심이 모인다.유럽 가는 카카오픽코마지난 4일 카카오 3분기 실적발표 컨퍼런스콜(전화회의)에서 배재현 카카오 부사장(최고투자책임자·CIO)은 “올해 안에 프랑스에서 픽코마를 출시할 계획”이라면서 이같이 밝혔다. 일본에서의 성공을 발판으로 유럽 등지로 활동범위를 넓혀 세계 시장을 잡겠다는 포부다. “초기 픽코마를 중심으로 (유럽에) 진출하고 카카오엔터테인먼트는 ‘K콘텐츠’를 중심으로 협력 또는 경쟁하는 구도로 유럽 시장을 같이 공략해 나갈 예정”이라고 배 부사장은 말했다.2016년 4월 문을 연 픽코마는 일본 디지털 만화(망가)·웹소설, 한국 웹툰 등을 서비스하고 있다. 첫해 매출은 15억원에 불과했지만 2019년 4분기에는 첫 영업이익을 내는 등 반등에 성공했다. 작년부터 일본 모바일 만화 시장에서 선두를 차지하고 있다. 거래액은 2018년 630억원, 2019년 1440억원, 2020년 4146억원을 기록했다. 지난해 매출은 2398억원, 당기순이익은 143억원으로 첫 연간 흑자를 달성하기도 했다. 올해 5월에는 해외 국부펀드 등으로부터 6000억원 규모의 투자를 유치했다. 당시 평가받은 픽코마의 기업가치는 8조8000억원으로 알려져 있다. 카카오에 따르면 이번 3분기 픽코마의 글로벌 거래액은 1971억원으로 전년동기 대비 52% 늘었다. 일 평균 열람자, 인당 결제액도 두 자릿수 성장을 기록했다.△3분기 카카오의 콘텐츠 부문 매출에서 카카오엔터테인먼트와 픽코마가 각각 차지하는 비중.(사진=카카오)네이버도, 카카오도 프랑스 점 찍은 이유프랑스는 만화 산업에 있어 전략적 요충지로 꼽힌다. 유럽에서 두 번째로 큰 만화시장으로 꼽힌다. 세계 만화 산업에 미치는 영향력도 적지 않다. 경쟁사인 네이버도 지난 2019년부터 네이버웹툰 프랑스어 서비스를 선보이며 프랑스 진출에 공을 들였다. 지난 2019년 네이버웹툰 프랑스어 서비스를 내놓은 데 이어 작년 11월에는 서비스를 유료로 전환했다. 프랑스 구글플레이 만화 부문에서 다운로드·매출 1위를 차지하기도 했다.이 때문에 업계에선 유럽 진출을 검토 중인 카카오웹툰도 프랑스 진출을 계획할 것으로 예상했다. 카카오웹툰이 지난 7월 ‘프랑스 사업팀’ 채용공고를 내면서 프랑스 진출설에 무게가 실렸다. 그러나 픽코마가 시장에 먼저 진입하면서 카카오웹툰의 일정에 변수가 생긴 것으로 추측된다. 카카오웹툰 관계자는 “유럽·북미 사업 진출은 검토 수준이었고 프랑스 진출을 확정한 적은 없다”고 말했다. 당시 채용공고에는 카카오웹툰 프랑스 사업 출시·성장을 주도한다는 업무내용과 함께 코로나 상황이 안정화되면 프랑스 체류가 가능한 이를 우대한다고 적혀 있었다.카카오는 프랑스 시장을 공략하기에는 픽코마가 유리하다고 판단한 것으로 보인다. 프랑스는 ‘종이만화책’ 선호도가 높다. 웹툰도 성장하고 있지만 비주류에 속하는 반면 일본 만화의 위상은 견조하다. 프랑스 만화 시장 매출의 42%가 일본 만화 판매에서 비롯되고 있을 정도(‘프랑스, 웹툰 시장에 주목하다(2021.2)’, 곽미성 프랑스 파리무역관)다. 픽코마는 △일본 현지 출판만화를 디지털화해 선보이고 있고, 세로 스크롤 형태로 보는 △한국형 웹툰도 서비스 중이다. 숫자는 적지만 성공작도 배출됐다. 카카오페이지 웹툰인 ‘나 혼자만 레벨업’은 픽코마에서 유통되면서 일 매출 5억6000만원을 올리는 기록을 세웠다. 카카오는 픽코마를 통해 유럽인들에게 친숙한 일본 만화를 선보이면서 이용자를 확보하는 동시에 한국 웹툰을 ‘영업’하는 방식으로 유럽 시장을 공략할 것으로 예상된다. △웹툰 해외 진출로 인한 투자가 지속되면서 카카오 영업이익도 영향을 받을 것으로 보인다. 카카오는 카카오엔터테인먼트의 동남아, 북미 진출과 픽코마의 일본, 유럽 사업 확대 등에 따른 글로벌 투자 활동으로 3분기 영업이익률이 전분기 대비 소폭 감소한 10% 수준을 기록했다고 밝혔다.(사진=카카오)배재현 부사장은 “프랑스는 일본 망가에 대한 친화도가 높은 문화권이고 콘텐츠의 디지털화도 매우 초기단계인 것으로 알려져 있다”며 “픽코마가 2016년 진출했던 일본 시장과 매우 유사한 구조이기 때문에 프랑스는 픽코마의 글로벌 진출 가능성을 점쳐볼 수 있는 테스트 베드로 매우 적합하다고 판단했다”고 설명했다.여민수 카카오 공동대표도 “픽코마의 성공 방정식을 글로벌 무대로 확장시킬 것”이라면서 “카카오재팬의 유럽진출로 카카오의 전체 스토리 비즈니스는 또 하나의 성장 발판을 마련할 것으로 기대된다”고 말했다.카카오웹툰으로는 ‘한류’가 자리 잡은 지역을 노린다. 모바일 이용률이 높은 국가도 우선순위다. 현재 카카오웹툰이 태국·대만 등 동남아시아 시장에 진출한 이유다. 다만 카카오웹툰도 유럽 진출을 거론하고 있는 만큼 시장이 겹칠 가능성도 있다. 이에 대해 픽코마 관계자는 “카카오공동체이기 때문에 경쟁보다 서로 시너지를 낼 것”이라고 말했다. 카카오웹툰 관계자는 “(픽코마와는) 유기적인 협업을 통해 (카카오엔터테인먼트 IP의) 유럽 진출이 이루어지는 형태가 될 수 있다”며 “같은 지역에 진출하더라도 망가 수요와 웹툰 수요는 확실히 다를 것으로 생각된다”고 말했다.한편 카카오는 인수를 마무리한 북미 타파스·래디쉬 등을 통해 카카오엔터테인먼트가 확보하고 있는 오리지널 IP를 제공하고, 픽코마와의 협력도 진행할 예정이다. 웹툰·웹소설 외에 영상 제작에도 속도를 낸다. 4분기 ‘사내맞선’을 시작으로 내년 1분기 ‘승부’, ‘헌트’, ‘종이의 집’ 등 다양한 영상 콘텐츠를 선보일 계획이다. 배재현 부사장은 “제작된 영상 콘텐츠를 북미 타파스·래디쉬를 통해 유통할 수 있는 가능성과 사업성을 검토 중”이라고 밝혔다."
2021.11.07.,"카카오모빌리티, CEO가 직접 택시·대리기사 상생 챙긴다",https://n.news.naver.com/mnews/article/421/0005706935?sid=105,"CEO 직속 상생협력자문위원회 신설…택시·대리운전 기사와 소통 창구 역할지난 10월8일 오후 서울 여의도 국회에서 열린 국토교통위원회의 한국도로공사, 한국교통안전공단, 한국도로공사서비스(주) 등에 대한 국정감사에서 증인으로 출석한 류긍선 카카오모빌리티 대표가 의원들의 질의에 답하고 있다. 2021.10.8/뉴스1 © News1 이동해 기자(서울=뉴스1) 이기범 기자 = 골목 상권 침해 논란을 촉발한 카카오모빌리티가 CEO 직속 조직을 통해 택시·대리기사들과의 상생 방안을 마련할 방침이다.7일 카카오모빌리티는 지난 5일 국회에 '플랫폼파트너 상생(안)'을 제출했다고 밝혔다. 국회 국토교통위원회 야당 간사인 송석준 의원(국민의힘)이 카카오모빌리티로부터 제출받은 상생안에 따르면 카카오모빌리티는 산업계, 학계 전문가로 구성된 상생협력자문위원회(가칭)를 CEO 직속으로 설치할 계획이다.자문위는 택시, 대리기사 등 서비스 파트너들과의 소통 창구 역할을 한다. 또 상생기금 조성·집행을 비롯해 신규사업 진출 시 관련 산업 영향 분석 및 상생방안 등도 마련한다.앞서 카카오는 지난 9월 카카오택시 웃돈 배차 등을 비롯해 골목 상권 침해 논란이 일자 5년간 상생기금 3000억원을 마련하겠다고 발표했다. 상생기금 조성 및 운용 계획안은 연내 발표할 예정이다. 또 이달 중 카카오T 가맹택시와 관련해 가맹점 협의체 구성을 완료할 계획이다.또한, '콜 몰아주기' 논란이 일었던 택시 배차 알고리즘의 경우 일부 공개 방안을 검토 중이며 가맹점 대상 제휴계약 3개월 갱신 조항 삭제, 카카오T 블루 취소 수수료 배분 비율 조정 등에도 나선다. 내년 상반기에는 전화콜 업체 상생안을 공개할 예정이다.카카오모빌리티 관계자는 ""국회에 상생 관련 실무 기구에 대한 안을 전달한 상황으로, 구체적인 실행 방안을 준비 중이다""며 ""현재 대리단체 교섭을 진행 중이며 택시 쪽과는 가맹협의체 구성을 논의 중인데 업계와 의견을 나누며 구체화된 논의 결과를 만들어나갈 것""이라고 밝혔다."
2021.11.07.,‘돈 안되는 사업 접자’···카카오 때리기 결과는[친절한IB씨],https://n.news.naver.com/mnews/article/011/0003982245?sid=101,"헤어샵 등 일부 사업 중단 알뜰폰 등 사업 축소모빌리티 등 대형 사업은 상생안 추진수익성 낮은 사업 재편 기회라는 분석도[서울경제] 이번 국정감사에서 대장동 의혹 다음으로 최대 이슈는 카카오의 재벌식 확장 논란 이었죠. 혁신 기업 인 줄 알았던 카카오가 실제로는 카카오톡을 기반으로 골목 상권을 침해하고 있었다는 것입니다. 새로운 시장을 만든 게 아니라 기존 시장을 잠식했다는 것이죠. 보통 이런 이슈가 나오면 보수 성향이나 경제 전문 언론은 산업계의 반론을 비중 있게 싣는데요. 이번에는 이런 언론조차 ‘카카오가 좀 심하기는 했다’는 분위기 입니다. 이런 대형 플랫폼 때리기는 미국·중국 등 해외에서도 논란이 되고 있습니다. 플랫폼 사업에 대해 한 번은 되돌아봐야 하는 상황이 된 것이죠.카카오는 자신들의 사업을 크게 셋으로 나눕니다. 카카오톡처럼 핵심 사업은 직접 하고, 성공 여부를 장담하기는 어렵지만, 성장 과정에서 돈이 많이 드는 카카오 모빌리티 같은 사업은 외부 투자를 받습니다. 나머지 부대 사업 중 기대와 달리 수익성이 나지 않는 사업은 매각한다는 것입니다.요즘의 분위기를 반영한 탓인지 카카오를 둘러싼 소문은 인수나 투자유치가 아니라 매각과 투자 철회가 많습니다.카카오는 스테이지파이브를 통해 알뜰폰 사업을 전개하고 있었는데요. 복수의 벤처 투자 관계자에 따르면 최근 알뜰폰 사업을 키우기 위해 투자 유치를 논의 하다가 사실상 중단했다고 합니다. 스테이지파이브는 지난해 정부의 규제 샌드박스를 통해 카카오페이 인증서로 이동통신에 가입할 수 잇는 비대면 통신 가입을 도입한 바 있습니다. 다만 스테이지파이브는 공식적으로 투자 유치를 추진한 바 없다고 밝혔습니다.카카오 알뜰폰은 아이들을 위한 웨어러블 기기 사업에서 출발했습니다. 어린이들 사이에서도 인기가 좋은 카카오의 캐릭터로 파고들고 있습니다.카카오의 미용실 예약과 결제 서비스인 카카오헤어샵도 카카오에서 최근 사업 철수 협의를 시작했습니다. 카카오헤어샵은 최근 480억 원 투자를 받은 상황이라, 투자자들의 반대가 거세지만, 결국 카카오가 일정한 보상을 거쳐 투자자를 설득하지 않겠냐는 전망이 많습니다.카카오 모빌리티는 택시와 대리운전 업계와 갈등하며 이번 논란의 핵심이 된 카카오의 계열사인데요. 구글·LG 등 국내외 대기업, 칼라일·TPG 등 글로벌 사모펀드 등으로부터 1조 원이 넘는 투자를 받은 상태입니다. 카카오 내부적으로는 외부 투자자에 대한 불만도 느껴집니다. 외부 투자자 때문에 무리하게 수익성을 내려는 시도를 하다 이 사달이 났다는 것입니다. 반대로 투자자들은 이사회에서 카카오에 비해 수적으로 적거나 없었기 때문에 의사 결정에 영향이 크지 않다고 반박합니다. 오히려 카카오 모빌리티가 여론 관리에 소홀해 문제를 키웠다고 지적합니다. 아무튼 카카오 모빌리티는 투자 받은 규모가 큰 데다 그 동안 투자의 결과로 모빌리티 플랫폼의 1위를 장악하고 있기 때문에 섣불리 사업 철수나 매각을 하기는 어렵다는 예상이 많습니다.실제 카카오 모빌리티는 지난 6일 상생협력자문위원회를 최고경영자 직속으로 설치하겠다는 계획을 송석준 국민의 힘 의원실에 보고한 것으로 전해졌습니다.가맹택시 콜(승객 호출)몰아주기 비판을 받은 택시 배차 알고리즘을 택시 4개 단체에 설명한다고 합니다. 가맹점과 데이터 수집 및 가맹차량 마케팅 활용 계약 3개월 갱신제도 삭제합니다. 강제배차 서비스인 카카오T블루는 취소 수수료 중 40%를 기사에게 제공합니다. 그 밖에 전화콜 업체와 상생안도 마련한다고 하네요.반면 매각 가능성이 거론되는 후보들도 있습니다. 어린이집을 보내는 학부모라면 익숙한 키즈노트는 카카오 계열사입니다. 어린이집에서 가정으로 손쉽게 사진과 가정통신문 등을 보내는 애플리케이션인데요. 쉽게 성장하거나 수익을 내기 어렵다는 우려가 있습니다. 예를 들어 초등학교 이후에는 이런 플랫폼을 활성화할 각종 정보를 학교, 즉 교육부가 쥐고 있기 때문이죠. 완전한 민간 영역에 두기 어려운 이유입니다.어린이집에 보낼 때는 키즈노트를 편리하게 사용하고 있습니다만, 초등학교에 들어가면 이알리미·하이톡 등 다른 스타트업이 만든 플랫폼을 사용합니다. 결정권은 학교에 있죠.카카오VX도 대상에 오르내립니다. 골프장 예약 서비스와 스크린 골프, 오프라인 골프장을 아우르며 사업의 꿈을 키웠습니다, 하지만 업계 1위인 골프존이 압도적이라는 평가가 많습니다. 골프장 예약 서비스 분야에서는 카카오 VX가 앞서지만 오프라인 골프장에서는 아직 뒤진다는 지적입니다.최근 카카오VX에서 오프라인 골프장 인수에 나섰다고 합니다. 오프라인 골프장에 대한 높은 기대치를 반영한 결과겠죠.겉으로 일방적인 때리기에 당하는 것처럼 보이는 카카오. 하지만 일각에서는 이번 논란이 마냥 카카오에 불리한 게 아니라 오히려 카카오가 성장을 위한 가지치기를 할 수 있게 됐다고 보는 시각도 있습니다. 네이버는 일찌감치 이런 규제 분위기 속에서 인터넷 은행 등 일부 업종은 아예 손 대지 않고 신 사업은 해외에서 사업을 펼치고 있는데요. 카카오의 앞으로 행보는 어떻게 될지 여론은 다시 돌아서게 될 지 궁금해집니다."
