기사날짜,기사제목,네이버 뉴스 url,기사내용
2021.11.23.,279대1 경쟁 ‘네카라쿠배 고시학원’…“매일 12시간 공부도 부족” [팩플],https://n.news.naver.com/mnews/article/025/0003152918?sid=105,"“저는 다른 친구들에 비하면 잠을 많이 자는 거예요. 6시간이면 많이 잤다는 친구들이 많죠.”      지난 5일 서울 강남구의 데이원컴퍼니(전 패스트캠퍼스) 학원. 이곳에서 만난 ‘네카라쿠배(네이버·카카오·라인·쿠팡·배달의민족) 취업완성 스쿨’ 2기 수강생 박바름(32)씨는 이렇게 말했다. 박씨는 올해 7월 ‘네카라쿠배 스쿨’에 합격하면서 다니던 회사를 그만뒀다. 지금은 오전 9시부터 새벽 1시까지, 식사와 이동 시간을 제외하고 하루 최소 10시간은 프로그래밍 공부를 한다. 오전 10시부터 오후 10시까지는 학원에서 수업을 듣거나 동기들과 스터디 모임을 갖고, 집에 가서도 남은 공부를 하다 잠든다. 박씨의 목표는 ‘카카오 입사’다.     네카라쿠배 스쿨 수강생 박바름씨의 일과. 그래픽=김현서 kim.hyeonseo12@joongang.co.kr      ‘네카라쿠배 학원’까지 생겨…입학 경쟁률만 279대1     신종 코로나바이러스 감염증(코로나19)으로 개발 인력 수요가 급증하면서 올해 초 IT업계엔 ‘개발자 몸값 전쟁’이 몰아쳤다. 넥슨·네이버 등 이름 있는 IT기업들은 연봉 인상, 주식 지급 등 임직원 보상 정책을 줄줄이 발표했다. 그중 취업 준비생들이 가장 선호하는 직장은 ‘네카라쿠배’로 불리는 5대 IT 기업. 5000만~6000만원대 초봉, 젊고 유연한 기업문화와 ‘국민 앱’이 가진 친숙한 이미지 덕에 전통 대기업인 ‘삼현엘(삼성·현대·LG)’을 제치고 ‘꿈의 직장’으로 부상했다.      데이원컴퍼니의 '네카라쿠배 스쿨' 포스터. 사진 데이원컴퍼니       공학 비전공자들까지 개발직으로 전환할 만큼 네카라쿠배의 인기가 높아지자, 5개사 입사를 위한 학원까지 생겼다. 직장인 교육업체 데이원컴퍼니는 지난 3월부터 ‘네카라쿠배 취업완성 스쿨’을 열고 프론트엔드 과정과 데이터 사이언스 과정을 무료로 운영하고 있다. 입사 후 2년치 연봉의 1%(인당 최대 100만원)를 기부받는 조건이다. 2~3개월마다 10~20명을 선발해 가르친다. 최종 선발된 학생들 중엔 박씨(국어국문학 전공) 같은 비전공자도 많다.      지난 5일 서울 강남구 데이원컴퍼니 건물에서 인터뷰한 네카라쿠배 프론트엔드 2기 수강생 박바름씨. 사진 데이원컴퍼니           선발 과정은 까다롭다. 지원자는 약 한 달간 데이원컴퍼니가 제공하는 HTML/CSS(웹 페이지에서 시각적인 부분을 구현하는 기술), 파이썬 문법 및 자료구조 기초 영상을 학습하고 1, 2차 테스트를 통과해야 한다. 이후 네카라쿠배 전·현직 개발자의 인성면접이 기다린다. 1기의 경우, 지원자 4185명이 몰려 최종 15명이 선발됐다(경쟁률 279:1).     네카라쿠배 스쿨은...그래픽=김경진 기자 capkim@joongang.co.kr      재수도 불사…“하루 12시간 공부 안하면 네카라쿠배 못가요”     네카라쿠배 스쿨은 6개월간 주 5일 학원에 나와 ‘텐 투 텐(오전 10시~오후 10시)’으로 하루 12시간씩 공부하는, 그야말로 ‘고시학원’이다. 원하는 회사 입사에 실패하면 ‘재수’도 불사한다. 프리랜서 디자이너였던 김모(26)씨가 그런 경우다. 입사 제안은 많이 받았지만, 네이버·카카오에 가고 싶어 거절했다. 학원 동기 10명 중 7명이 네이버·카카오에 입사한 영향이 컸다고 했다. 김씨는 현재 취업 면담과 자기소개서 첨삭 등 사후 관리를 받고 있다.      지난 5일 서울 강남구 데이원컴퍼니 건물에서 인터뷰한 강호준 데이원컴퍼니 스쿨사업부기획팀 팀장. 사진 데이원컴퍼니           중도 포기자도 적지 않다. 1~3기에 선발된 48명 중 11명이 중간에 그만뒀다. 모의고사 점수가 좋지 않아 중단을 권유받았거나, 빡빡한 일정을 견디지 못해 스스로 그만둔 경우다. 이 과정을 기획한 강호준 데이원컴퍼니 스쿨사업기획팀장은 “네카라쿠배는 잠자는 시간 빼고 하루 12시간씩 공부만 해도 갈까 말까한 최상위급 회사”라며 “이 회사들이 지원자 스펙(학벌 등 외형 조건)을 안 본다지만, 요구하는 공부량은 웬만한 ‘초고스펙자’ 못지 않다. 당연히 입시학원처럼 교육할 수밖에 없다”고 말했다.      이들 회사는 지원자의 성별·학력·스펙을 보지 않는 대신, 실력을 본다. 채용 과정 내내 코딩 테스트와 실무 면접이 이어진다. 그래서 수업도 철저하게 실무 중심이다. 교육 과정은 크게 5개. 프로그래밍의 기본 요소를 배우고, 직접 웹 서비스를 구현해보는 실습까지 마쳐야 한다.      수능 앞둔듯 고요하고 진지…실제 수업 들어보니     지난 5일 찾은 서울 강남구 데이원컴퍼니 네카라쿠배 프론트엔드 과정. 3기 수강생들이 HTML/CSS 수업을 듣고 있다. 김정민 기자           실제 수업 분위기는 어떨까. 이날 오후 3시부터 진행된 HTML/CSS 수업 현장. ‘넷플릭스 첫 화면’ 속 로그인 버튼 만들기가 강의 주제다. 로그인 버튼 하나에 들어가는 요소들을 요목조목 뜯어보고 직접 코딩해보는 수업이다. 각자의 노트북에서 수업 화면과 코딩 창이 바쁘게 열리고 닫혔다.      수강생 10명은 모두 편한 티셔츠에 추리닝, 슬리퍼 차림이었다. 책상 위엔 커피와 음료수 캔, 핸드크림, 안경집, 미니 선풍기 같은 ‘수험생 아이템’이 가득했다. 손때 묻은 필기 노트들이 눈에 띄었다. 남녀 성비도 반반. ‘개발자는 대부분 남자’란 말은 옛말이었다. 수능을 앞둔 듯 고요하고 진지한 분위기가 감돌았다.      지난 5일 서울 강남구 데이원컴퍼니 네카라쿠배 프론트엔드 과정을 참관했다. 2기 수강생들이 조별 프로젝트를 발표하고 있다. 김정민 기자           발표 수업이 열리는 다른 반을 찾았다. 좀 더 밝고 활기찬 분위기 속에서 이제껏 배운 걸 활용해 일주일 간 기획·개발한 조별 과제 발표가 이어지고 있었다. ‘마피아 게임’과 ‘라이어 게임(눈치 게임)’을 합쳐 간단한 웹 게임을 개발한 1조의 발표가 끝나자 “이 문제를 어떻게 해결했냐”는 강사의 질문이 이어졌다. 발표 끝엔 조원들이 무엇을 배웠고, 무엇이 아쉬웠는지 돌아가며 말했다.      지난 5일 찾은 서울 강남구 데이원컴퍼니 네카라쿠배 프론트엔드 과정. 2기 수강생들이 발표 수업을 듣고 있다. 김정민 기자           발표 수업을 듣던 박바름씨는 기자에게 “30대에 새로운 도전을 하는 게 두렵기도 하지만, 배울 수 있는 동료가 많은 회사에서 ‘좋은 개발자’가 되는 것이 돌아가는 게 아니라 가장 빠른 길이란 생각이 들더라”고 덧붙였다. 이날도 박씨는 오후 10시가 다 되어서야 학원 문을 나섰다.    취준생 ‘꿈의 직장’이라는 네카라쿠배, 성장의 비밀은 코로나19 이후, 전 세계 정보기술(IT) 기업이 인재와 자본을 빨아들이고 있습니다. 미국엔 GAFA(구글·애플·아마존·페이스북)가 있고, 한국엔 ‘네카라쿠배’가 있죠. 네이버, 카카오, 라인(운영사 라인플러스), 쿠팡, 배달의민족(운영사 우아한형제들)입니다. 이들 중 상장사인 네이버·카카오·쿠팡의 시가총액 합계는 지난 19일 기준 180조원, 시장은 이들의 미래를 현재(2020년 연매출 합계 약 25조원)보다 더 밝게 봅니다.   ㅤ    네카라쿠배의 성장 기반은 ‘인재’입니다. 인재 영입 경쟁이 치열하고, 우수 인재들도 이 기업을 선호합니다. 중앙일보 팩플은 5대 IT 기업의 인사(HR)와 기업문화를 총괄하는 임원들을 만나 이들이 찾는 인재상과 키우는 리더, 평가·보상의 방향 등을 들어봤습니다. 기업문화에 깔린 창업자들의 생각도 짚었습니다. 중앙일보 홈페이지에서 ‘네카라쿠배 성장의 비밀’ 시리즈를 확인해보세요. https://www.joongang.co.kr/digitalspecial/460   ㅤ"
2021.11.23.,"[인터뷰] 생존 FPS 디스테라 ""더 쉽고 편하게 싸우도록 개선""",https://sports.news.naver.com/news.nhn?oid=442&aid=0000142960,<구조 다름>
2021.11.23.,"“코레일 기차 승차권, 이제 카톡으로 예매하세요”",https://n.news.naver.com/mnews/article/018/0005091891?sid=101,"한국철도, 카카오톡 채널서 승차권 예매 서비스 시범운영[이데일리 김나리 기자] 한국철도(코레일)가 ‘카카오톡’으로 열차 승차권을 바로 예매할 수 있는 서비스를 시범 운영한다.(자료=한국철도)23일 한국철도에 따르면 카카오톡 채널에서 ‘코레일 기차’를 추가한 후, 홈 화면이나 대화방에서 ‘승차권 예매’ 버튼을 선택할 경우 바로 승차권을 예매할 수 있다. 별도 앱 설치나 링크연결 없이 간단하게 살 수 있다.  앞서 한국철도는 약 100만 명이 이용하는 ‘코레일 알림톡’ 채널의 이름을 ‘코레일 기차’로 변경하고, 지난 2월부터는 ‘카카오T’ 앱에서 제공하고 있는 승차권 예매 서비스가 카카오톡으로도 연동되도록 준비해왔다. 예매한 승차권은 카카오톡 ‘코레일 기차’ 대화방이나 ‘카카오T’ 앱 이용내역에서 확인할 수 있다. 부정승차 방지를 위해 카카오톡과 카카오T에서 승차권 동시 표출은 불가능하다.정왕국 한국철도 사장직무대행은 “철도 이용객이 보다 편리하게 승차권을 구매할 수 있도록 포털, SNS 등 민간 플랫폼과 협업을 확대해 나가겠다”고 말했다."
2021.11.23.,[#꿀신상#꿀혜택] 롯데 '버추얼런'·오비 '1000만원 기부금'·동아오츠카 '청소년 장학금'·롯데푸드 '1730여만원' 기부· 카카오 '사랑의열매 컬래버 배지'·에이블리 '리프레시 휴가',url없음,<네이버 기사 없음>
2021.11.23.,"'그림자 미녀' 심달기, 미스터리한 방과 후 이중생활···현실 반영 공감 백배",https://n.news.naver.com/mnews/article/011/0003988541?sid=106,<구조 다름>
2021.11.23.,"[SW산업보호대상] 이노레드, 공정거래·저작권 보호 디지털 캠페인 전개",https://n.news.naver.com/mnews/article/029/0002707661?sid=105,"행정안전부 장관상2007년 설립된 광고대행, 디지털마케팅 대행 기업 이노레드는 삼성전자, 현대기아차, 카카오뱅크, 배달의민족 등의 고객을 대상으로 1300건 이상의 디지털 캠페인을 진행하며 성장해 왔다. 구글, 페이스북 등 주요 디지털 미디어를 바탕으로 사업을 전개하는 이 회사는 지식재산 서비스 기업이자 '디지털 네이티브 기업'의 특성을 살려 공정거래와 저작권 보호활동도 다양하게 전개하고 있다. 광고영상을 비롯한 각종 브랜디드 콘텐츠 제작을 하는 창작자의 입장에서 광고저작물 제작에 사용되는 각종 음원, 이미지, 영상, 폰트 등의 라이선스 구입과 저작권 보호뿐 아니라 업무용 정품SW 사용, 전사 차원의 SW라이선스 자산관리 노력을 기울이고 있다. 2017년 SW 자산관리솔루션을 직접 구축해 기기·부서·구성원·SW별 자산내역을 등록·관리하는 한편 매 연말 SW 공급·자산관리 계획을 수립하고 매년 2분기에는 사내 수요조사 결과를 바탕으로 파트너사인 윈테크솔루션과 함께 SW자산관리 정책을 점검하고 SW 구매 발주를 진행한다. SW 라이프사이클에 따른 관리방안도 함께 점검하고 있다."
2021.11.23.,"‘수익률 -44%’ 지석진 “테슬라 주식, 차 대신 샀으면 60억”(개미 뚠뚠)",https://n.news.naver.com/mnews/article/609/0000514408?sid=106,<구조 다름>
2021.11.23.,"2차 테스트 마친 디스테라, 육성은 간소화 전투는 심화",https://n.news.naver.com/mnews/article/356/0000050932?sid=004,"▲ 생존게임 '디스테라'가 지난 16일 2차 테스트를 시작했다 (사진제공: 카카오게임즈)스팀을 비롯한 서양 게임 플랫폼에서 생존게임은 꾸준히 사랑을 받는 장르다. 넓은 맵에서 자유롭게 자신만의 거주지를 구축하고 콘텐츠를 즐길 수 있는 높은 자유도에 경우에 따라선 건슈팅 장르의 재미도 느낄 수 있기 때문이다. 국내 개발사인 리얼리티매직이 개발하고 카카오게임즈가 서비스를 준비하고 있는 '디스테라'도 이런 오픈월드 크래프팅 생존게임으로 이런 기조를 잘 살린 작품이다. 이 디스테라가 지난 16일, 2차 테스트를 진행했다. 지난 3월에 진행했던 알파 테스트를 포함하면 벌써 세 번째 테스트다. 이전에 진행된 테스트는 게임이 제대로 작동하는지를 보는 것에 집중했다면 이번에는 게임의 재미와 콘텐츠의 밀도 등 보다 본질적으로 게임성에 귀결되는 것들을 파악하는 것이 핵심이었다. 이번 테스트의 목표와 출시 계획 등에 대해서 보다 자세히 알아보기 위해 리얼리티매직 김성균 대표와 서면으로 인터뷰를 진행했다.▲ 리얼리티매직 김성균 대표 (사진제공: 카카오게임즈)Q. 지난 테스트 당시 어떤 피드백들이 있었고, 이번 테스트에는 어떻게 반영됐는가?디스테라 고유의 시스템들에 대해 빨리 인지하기 어렵다는 지적과, 플레이어의 기지 방어 및 NPC와의 공방 등 밸런스에 대한 의견들이 많았다. 이번 테스트에서는 시스템 별 중요도를 나눠서 초심자도 점진적으로 익숙해질 수 있는 방향으로 구성했으며, 초기에 더 쉽게 살아남아 충분한 준비를 갖춘 뒤에 다른 플레이어들과 나중에 경쟁할 수 있도록 배치했다. 또 전투에 좀 더 집중할 수 있도록 기지의 관리에 들여야 하는 노력을 대폭 낮췄으며, 티어별 성장 곡선 곡선도 훨씬 빠르게 조정했다.Q. 7월에 진행된 글로벌 테스트 이후 바뀐 부분은 무엇인지? 특히, 크래프팅과 프로토콜 등 육성 시스템에 변경된 부분이 있는지 궁금하다.반복적인 생존 행위보다는 교전을 더욱 즐기게 하는 것에 집중했다. 7월에는 초보자들에게 중요한 시스템에 대한 설명이 다소 미흡했고, 초보자의 단계를 지나더라도 생존에 너무 많은 시간을 써야 했다. 하지만 이번 테스트에선 크래프팅과 육성이 간소화됐다. 예를 들어 기존에는 각 아이템 종류별로 다른 방식으로 제작해야 했지만, 이제는 대부분의 아이템들을 한두가지 방법으로만 제작하면 된다. 또한, 머신암의 육성 방향성이 아이템을 이용한 발전과 다른 방향으로 더 명확해졌다.▲ 이번 테스트에선 보다 본격적으로 건슈팅을 즐길 수 있었다 (사진제공: 카카오게임즈)Q. 이번 테스트의 변경사항 중 하나로 튜토리얼 강화가 있었는데, 지난 테스트와 비교해 어떻게 변화했는지 상세한 설명 부탁한다.지난 테스트에서의 튜토리얼이 주요 기능들을 나열하는 수준이었다면, 이번에는 초심자들도 쉽게 따라가면서 생존을 위해 반드시 필요한 시스템을 학습할 수 있도록 구성했다. 또한 구체적으로 어디에서 무엇을 해야 하는지 좀 더 명확히 알 수 있도록 UX를 개편했다. Q. 지난 테스트를 통해 타 국산 게임에 비해 가혹한 환경을 리얼하게 살린 것을 어필했는데, 그러다 보니 라이트 유저들에게 어필하기 어려워진 것 같다.우선 밤낮의 흐름에 의한 난이도 변화를 많이 줄였기 때문에 가장 어두운 시간대에도 난이도는 크게 높아지지 않을 것이다. 더불어 플레이 초기에 자원을 찾고, 습득하고, 필요 물품을 조달하는 과정을 자연스럽게 익혀갈 수 있도록 초기 가이드 시스템을 구성했다. 또한, 초심자가 다른 플레이어들과 너무 일찍 조우해 난이도 악순환이 생기는 문제를 맵의 지역별 난이도와 인구밀도 재배치를 통해 수정했다. 지난 테스트에서 기지의 공성 밸런스에 대한 의견이 많았던 만큼, 각 무기별 공성 역할에 대해서도 명확히 구분을 했다.▲ 튜토리얼 강화를 비롯해 초보자가 보다 쉽게 적응할 수 있도록 바뀌었다 (사진제공: 카카오게임즈)Q. 유저가 성공적으로 생존해서 하나의 챕터를 마무리한 다음에, 또다시 플레이를 이어갈 수 있게끔 유도하는 특전 등은 고려하고 있지 않은지 궁금하다.기존에는 월드 종말 시 그저 방관하는 수준이었다면 이제는 종말의 시간을 대비해 준비해야 하는 사항들과 월드의 재시작 시에도 연결되는 요소를 배치하였다. 종말 시점의 월드 상태가 동일 서버에서 새로 시작하는 월드의 상태에 영향을 주게 된다. 추후에는 이것이 플레이어의 영속적인 업적에 연계되어, 클랜의 존속에 아주 중요한 시스템으로 발전시킬 예정이다.Q. 스토리 흐름에 따라, 시즌마다 맵이 변화할 수 있는지 궁금하다. 가령 포트나이트나 에이펙스 레전드가 이런 요소를 보여준 바 있다.디스테라는 시즌별로 새로운 지역의 맵 등장을 통해 시나리오가 연속적으로 진행된다. 각 맵에 등장하는 지역과 NPC들이 해당 시즌의 시나리오를 풀어가게 되어, 우주 거주지 오르비스와 파괴된 지구에서의 과거와 현재 사건들을 서술하게 된다.▲ 맵은 서버가 초기화 될 때마다 조금씩 바뀐다 (사진제공: 카카오게임즈)Q. 유저가 커스텀 방을 만들면 어느 수준까지 게임을 설정할 수 있는지 궁금하다.이번 베타테스트에서 커스텀 서버의 첫 형태가 선보이게 되어, 플레이어들은 월드의 설정들을 바꿔서 플레이 할 수 있다. PvP와 PvE의 허용 범위, 각종 전역/아이템별 밸런스 수치, 수용인원 등을 쉽게 설정할 수 있다. 추후에는 월드 각 지역의 세부 사항에 대해서도 조정하고, 새로운 맵과 아이템을 플레이어가 정의할 수 있는 수준까지 제공하고자 한다. 전용 게임 에디터 역시 제공할 계획이다.Q. 발소리가 소음 같은 느낌이라 거리감 인식이 일정치 못할 때가 있던데 개선의 여지가 있을지?사운드, 그래픽 등은 당연히 지속 개선 대상이며 매번 마일스톤이 진행되면서 여러 방향으로 수정되고 있다.Q. 앞서 3월 진행된 1차 테스트와 비교했을 때 유저 지표에서 다른 점이 있다면 무엇인지?이번에는 생존게임에 익숙한 유저와 그렇지 않은 유저들 사이의 패턴 차이, 개발팀이 간과했던 편의성 등을 파악했으며, 이를 바탕으로 이번 테스트에서는 각 지표의 개선점 확인을 중요하게 생각하고 있다. 유저들의 행태와 스트리머들의 방송을 보면서, 개선하고자 했던 부분들이 작동하고 플레이타임이 크게 향상되는 것을 체감하는 중이다.▲ '디스테라' 2차 테스트 공식 트레일러 (영상출처: 카카오게임즈 공식 유튜브)Q. 현재 콘텐츠 완성 단계는 몇% 라고 생각하는지.게임의 시스템적으로 본다면 표현하기 어렵지만, 콘텐츠 분량으로는 최초 계획대비 80% 정도로 생각한다. Q. 향후 개발 방향성은 무엇이며 또 어떤 게임으로 시장에서 부각되길 바라는가?디스테라는 자유도 높은 FPS 플레이를 제공하기 위해서 생존게임의 문법을 채용한 만큼, FPS의 발전 역사에서 샌드박스 플레이 요소들을 잘 엮어낸 제품으로 남기를 희망한다. ▲ 디스테라는 어찌되었건 FPS의 재미를 추구하고 있다 (사진제공: 카카오게임즈)Q. 2차 테스트까지 거치며 완성도가 한층 더 높아진 거 같은데, 출시 목표를 언제로 예정하고 있나?아직 정확한 날짜를 정하지는 않았지만, 내년 초가 될 것으로 예상하고 있다. 출시가 늦어질수록 완성도는 계속 올라갈 것이나, 장르의 특성상 장기로 플레이하는 유저들의 의견을 빨리 듣고 반영하는 것도 중요하다고 생각한다.Q. 해외 서버에서도 즐기는 사람들이 꽤 보이는데, 실제 해외 반응이 어떠한지 궁금하다.처음부터 해외 출시를 염두에 두고 제작했으며, 실제로 해외 유저들이 더욱 쉽게 이해하고 플레이한다는 느낌을 받고 있다. 플레이어의 수나 각종 지표 측면에서 서구권 유저들이 핵심층을 구성하고 있다.▲ 김성균 대표는 ""디스테라가 FPS 역사에서 샌드박스 요소를 잘 채용한 게임으로 남길 바란다""고 밝혔다 (사진제공: 카카오게임즈)"
2021.11.23.,"[SW산업보호대상] 이노레드, 공정거래·저작권 보호 디지털 캠페인 전개",https://n.news.naver.com/mnews/article/029/0002707661?sid=105,"행정안전부 장관상2007년 설립된 광고대행, 디지털마케팅 대행 기업 이노레드는 삼성전자, 현대기아차, 카카오뱅크, 배달의민족 등의 고객을 대상으로 1300건 이상의 디지털 캠페인을 진행하며 성장해 왔다. 구글, 페이스북 등 주요 디지털 미디어를 바탕으로 사업을 전개하는 이 회사는 지식재산 서비스 기업이자 '디지털 네이티브 기업'의 특성을 살려 공정거래와 저작권 보호활동도 다양하게 전개하고 있다. 광고영상을 비롯한 각종 브랜디드 콘텐츠 제작을 하는 창작자의 입장에서 광고저작물 제작에 사용되는 각종 음원, 이미지, 영상, 폰트 등의 라이선스 구입과 저작권 보호뿐 아니라 업무용 정품SW 사용, 전사 차원의 SW라이선스 자산관리 노력을 기울이고 있다. 2017년 SW 자산관리솔루션을 직접 구축해 기기·부서·구성원·SW별 자산내역을 등록·관리하는 한편 매 연말 SW 공급·자산관리 계획을 수립하고 매년 2분기에는 사내 수요조사 결과를 바탕으로 파트너사인 윈테크솔루션과 함께 SW자산관리 정책을 점검하고 SW 구매 발주를 진행한다. SW 라이프사이클에 따른 관리방안도 함께 점검하고 있다."
2021.11.23.,"""보호자 신상 턴다""…초등생 협박해 성착취물 제작한 현역 장병",https://n.news.naver.com/mnews/article/057/0001623364?sid=102,"20대 남성 징역 3년 6개월 법정 구속사진 = 연합뉴스현역 장병이 미성년자를 협박하고 음란물을 제작하다 구속됐습니다.오늘(23일) 법조계에 따르면, 현역 장병인 A(21)씨는 복무 중이던 지난해 11월쯤 부대 내 생활관에서 자신의 휴대전화로 카카오톡 오픈채팅창에 들어갔습니다.자신을 초등학생인 것처럼 소개한 A씨는 10대 초반 여자 아이들을 상대로 가짜 해킹 프로그램 사진을 보낸 뒤 '보호자 신상을 털 수 있다'는 등의 말로 협박해 나체 사진과 동영상을 요구했습니다.A씨는 아동·청소년의 성보호에 관한 법률 위반(성 착취물 제작·배포)과 성폭력범죄의 처벌 등에 관한 특례법 위반(13세 미만 미성년자 강제추행) 등 혐의로 기소됐습니다. A씨는 법정에서 자신의 잘못을 모두 인정한 것으로 전해졌습니다.대전지법 형사11부(박헌행 부장판사)는 A씨에게 3년 6개월을 선고했습니다. 아울러 40시간의 성폭력 치료 프로그램 이수와 아동·청소년 관련 기관 등에 취업제한 5년도 명령했습니다.재판부는 ""미성숙한 피해자를 꾀어내 아무 거리낌 없이 범행해 피해자의 인격 형성에 무정적 영향을 미쳤다""며 ""죄질이 불량하나 사진 등을 유포하거나 개인적으로 소지한 정황은 없는 점을 고려했다""고 설명했습니다."
