기사날짜,기사제목,네이버 뉴스 url,기사내용
2021.11.16.,"코스피, 개인·외인 동반 매수에 상승 전환…3000선 진입",https://n.news.naver.com/mnews/article/018/0005087053?sid=101,"하락 출발 후 이내 상승세 전환 성공, 3000선 장중 돌파업종, 시총상위株는 혼조세[이데일리 권효중 기자] 16일 코스피 지수가 개인의 매수세 확대, 외국인의 매수 전환에 따라 상승 전환, 장중 3000선을 넘어섰다.마켓포인트에 따르면 이날 10시 10분 현재 코스피 지수는 전 거래일 대비 0.17%, 5.00포인트 오른 3004.52를 기록하고 있다. 장 초반 지수는 외국인과 기관의 매도에 눌려 소폭 하락해 출발, 전날에 이어 2990선을 기록했지만 개인이 매수 폭을 확대하면서 상승 전환에 성공했다. 수급별로는 개인이 769억원을, 외국인이 243억원어치를 각각 사고 있다. 기관은 홀로 1031억원을 팔고 있다.  업종별로는 내리는 것과 오르는 것이 거의 반반이다. 운수장비와 건설업종이 1% 넘게 하락하고, 유통업, 철강 및 금속, 통신업, 비금속광물, 전기가스업 등이 1% 미만에서 내리고 있다. 반면 의료정밀 업종은 2%대 오르고 있으며, 섬유의복 역시 1% 넘게 오르고 있다. 화학, 금융업, 기계, 보험 등은 1% 미만에서 오름세다. 시가총액 상위 종목들도 혼조세다. 삼성전자(005930)가 0.84%, SK하이닉스(000660)가 0.45% 오르고 있으며, 삼성바이오로직스(207940)(0.69%), LG화학(051910)(2.09%) 삼성전자우(005935)(0.30%), 삼성SDI(006400)(0.53%) 등도 빨간 불을 켜고 있다. 반면 NAVER(035420)와 카카오(035720)가 1% 미만에서 약세고, 현대차(005380)(-1.20%)와 기아(000270)(-2.43%) 역시 동반 약세를 보이고 있다."
2021.11.16.,분청도자 온ㆍ오프라인 통합판매시설 개관,url없음,<네이버 기사 없음>
2021.11.16.,프로축구 K리그2 시상식 18일 개최…MVP 4파전,https://sports.news.naver.com/news.nhn?oid=003&aid=0010835810,<구조 다름>
2021.11.16.,[겜ㅊㅊ] 절로 눈이 가는 지스타 2021 출전작 7선,https://n.news.naver.com/mnews/article/356/0000050813?sid=004,"※ [겜ㅊㅊ]은 매주 특별한 주제에 맞춰 게이머들이 즐기기 좋은 게임을 추천하는 코너입니다.대한민국 대표 게임쇼 지스타가 2년 만에 오프라인으로 개최됩니다. 방역을 위해 입장객 수를 하루 6,000명으로 제한해 예년보다 덜 왁자지껄한 분위기로 치러질 예정인데다, 코로나19 상황을 지켜보느라 조금 늦게 개최를 결정한 탓에 3N으로 대표되는 대형 게임사들이 빠지고, B2C 부스를 좀 더 드문드문 배치해 출전사 수도 예년 대비 확 줄어들었습니다.그러나 행사 규모 축소에도 불구하고 그만큼 조밀하고 알찬 게임들이 많이 대기하고 있습니다. 올해 라인업을 보면 눈이 번쩍 뜨이는 게임들이 눈에 띄는데요, 게임메카가 지스타 2021 출전작 중 유독 기대되는 작품들을 선별해 봤습니다. 일부는 시연 없이 영상과 이벤트만 열긴 하지만, 그럼에도 불구하고 자꾸 눈이 가네요. 한 번 확인해 보시죠.우마무스메 프리티 더비▲ 한글화된 말딸들이 지스타에 온다 (사진출처: 우마무스메 공식 홈페이지)실제 일본 경주마들을 미소녀로 의인화한 게임으로 선풍적인 인기를 끈 우마무스메 프리티 더비 한국어판이 이번 지스타에서 선보여집니다. 국내 서비스는 카카오게임즈가 맡았으며, 내년 상반기 출시가 예고된 상황입니다. 일본어로 플레이 해왔던 게이머들에게는 희소식이 아닐 수 없겠군요. 다양한 미소녀들의 레이스가 국내에서 펼쳐질 날도 머지 않은 듯합니다.에버소울▲ 일러스트만으로도 합격점을 주고 싶다 (사진제공: 카카오게임즈)수려한 애니메이션풍 일러스트로 시선을 끌었던 모바일 RPG, 에버소울이 이번 지스타에서 그 모습을 공개합니다. 3D 그래픽 기반의 수집형 게임인 에버소울은 다양한 정령 캐릭터를 수집하고 육성해 나가는 게임인데요, 뛰어난 그래픽과 매력있는 캐릭터 스킬을 담은 영상으로 일찍이 주목을 받은 바 있습니다. 여기에 영지를 가꾸거나 호감도 기반 연애 시스템 등 생활과 스토리라인에도 방점을 찍었죠. 카카오게임즈가 선보이는 신작 에버소울, 정말 기대되네요. 니케: 승리의 여신▲ 라이브 2D가 돋보이는 니케: 승리의 여신 (사진출처: 니케: 승리의 여신 공식 홈페이지) ▲ 니케: 승리의 여신 게임플레이 트레일러 (영상출처: 시프트업 공식 유튜브)외계인으로부터 지구를 탈환하기 위해 싸우는 전투 안드로이드 '니케'의 이야기를 담은 시프트업 신작 슈팅 액션게임 '니케: 승리의 여신'도 지스타에서 만나볼 수 있습니다. 꿈도 희망도 없는 지구에서 적과 싸우는 소녀라는 콘셉트가 팬들에게 확실히 각인됐죠. 샷건과 저격총, 유탄 발사기 등 다양한 총기와 이에 따른 그래픽이 구현돼 있으며, 각 캐릭터별 일러스트 및 디테일 역시 수준급이라는 평입니다. 시프트업의 노하우를 듬뿍 쏟아부은 라이브 2D 액션을 활용해 화려함을 끌어올린 니케: 승리의 여신, 과연 지스타에서 어떤 모습을 보여줄까요?   신의 탑M: 위대한 여정▲ 어느덧 연재 10년을 훌쩍 넘긴 신의 탑이 모바일게임으로 나온다 (사진출처: 게임 공식 홈페이지)전 세계 조회수 45억 뷰를 넘긴 전설적인 네이버 웹툰 '신의 탑' IP를 활용한 모바일게임, '신의 탑M: 위대한 여정'이 지스타에 참전합니다. 웹툰 자체 세계관이 방대하고 스토리가 짜임새 있게 준비된 만큼 게임 역시 기대된다는 평이 지배적인데요, 여기에 개발사 엔젤게임즈는 직접 해당 게임을 시연할 수 있는 기회도 마련한다고 합니다. 몰입도 높은 이야기와 수준 높은 액션 연출, 방대한 멀티 콘텐츠를 앞세우는 신의 탑M, 과연 탑을 오르는 비선별인원 '스물다섯번째 밤'의 이야기를 재미있게 풀어낼 수 있을 지 귀추가 주목됩니다.원더러스: 더 아레나▲ 밝고 편안한 색감으로 눈길을 끄는 원더러스: 더 아레나 (사진제공: 엔젤게임즈)앞서 기재한 신의 탑M과 함께 엔젤게임즈가 내놓는 액션 어드벤처 '원더러스: 더 아레나'도 출격을 준비하고 있습니다. 해당 게임은 동화 속 이야기를 현대물로 재해석한 게임으로, 수만 가지로 조합되는 로그라이크형 던전, 배틀로얄 대전 등 다양한 장르를 접목시킨 것이 특징입니다. 아직까지는 티저 사이트에서의 월드 전경 정도만 공개됐지만, 그럼에도 불구하고 젤다 야숨이나 원신 등이 떠오른다는 평가를 받으며 기대작으로 손꼽히고 있습니다. 이번 지스타를 통해 어느 정도 윤곽이 드러날 것 같습니다.아스테리고스▲ 그리스 신화와 소울라이크의 결합? (사진출처: 플레이스테이션 공식 유튜브 영상 갈무리) ▲ 아스테리고스 공식 트레일러 (영상출처: 플레이스테이션 공식 유튜브)그라비티는 이번 지스타에 무려 13종에 달하는 작품을 전시합니다. 다양한 라그나로크 타이틀과 그란디아, 퍼즐앤드래곤 등 개성 넘치는 독특한 게임이 포진돼있죠. 하지만 그중에서도 유독 눈길을 끄는 게임은 3D 액션 RPG 아스테리고스입니다. 실종된 아버지를 찾아 모험을 떠나는 소녀의 이야기를 담은 게임이죠. 고대 그리스 신화를 배경으로 하며, 방대한 스케일과 소울라이크를 떠올리게 하는 특유의 타격감으로 승부한다고 합니다. PC와 PS4, 5로 출시 예정이니만큼 완성도 높은 게임성을 보여줄 것으로 기대됩니다.천애명월도M▲ 과연 천애명월도M은 어떤 모습으로 나올까 (사진제공: 텐센트)텐센트 산하 게임스튜디오인 오로라 스튜디오가 이번 지스타에서 천애명월도의 모바일 버전, '천애명월도M'의 한글판을 최초로 선보입니다. 천애명월도M은 대만의 무협 소설가 고룡의 대표작 천애명월도 IP를 기반으로 한 게임이죠. 많은 게이머들을 감동시킨 스토리와 더불어 최대 100인이 참여하는 서바이벌 PvP 등 매력적인 콘텐츠들로 무장했다고 합니다. 중국 앱스토어 매출 1위에 오른 적도 있었을 만큼 게이머를 몰입시키는 요소가 확실하다고 하는데요, 이번 지스타에서 인게임 영상도 공개된다고 하니 한번 확인해 보는 것도 좋겠습니다."
2021.11.16.,"알렉산더 맥퀸, 윌리엄 블레이크에 영감받은 2022 프리 봄/여름 컬렉션 공개",url없음,<네이버 기사 없음>
2021.11.16.,[겜ㅊㅊ] 절로 눈이 가는 지스타 2021 출전작 7선,https://n.news.naver.com/mnews/article/356/0000050813?sid=004,"※ [겜ㅊㅊ]은 매주 특별한 주제에 맞춰 게이머들이 즐기기 좋은 게임을 추천하는 코너입니다.대한민국 대표 게임쇼 지스타가 2년 만에 오프라인으로 개최됩니다. 방역을 위해 입장객 수를 하루 6,000명으로 제한해 예년보다 덜 왁자지껄한 분위기로 치러질 예정인데다, 코로나19 상황을 지켜보느라 조금 늦게 개최를 결정한 탓에 3N으로 대표되는 대형 게임사들이 빠지고, B2C 부스를 좀 더 드문드문 배치해 출전사 수도 예년 대비 확 줄어들었습니다.그러나 행사 규모 축소에도 불구하고 그만큼 조밀하고 알찬 게임들이 많이 대기하고 있습니다. 올해 라인업을 보면 눈이 번쩍 뜨이는 게임들이 눈에 띄는데요, 게임메카가 지스타 2021 출전작 중 유독 기대되는 작품들을 선별해 봤습니다. 일부는 시연 없이 영상과 이벤트만 열긴 하지만, 그럼에도 불구하고 자꾸 눈이 가네요. 한 번 확인해 보시죠.우마무스메 프리티 더비▲ 한글화된 말딸들이 지스타에 온다 (사진출처: 우마무스메 공식 홈페이지)실제 일본 경주마들을 미소녀로 의인화한 게임으로 선풍적인 인기를 끈 우마무스메 프리티 더비 한국어판이 이번 지스타에서 선보여집니다. 국내 서비스는 카카오게임즈가 맡았으며, 내년 상반기 출시가 예고된 상황입니다. 일본어로 플레이 해왔던 게이머들에게는 희소식이 아닐 수 없겠군요. 다양한 미소녀들의 레이스가 국내에서 펼쳐질 날도 머지 않은 듯합니다.에버소울▲ 일러스트만으로도 합격점을 주고 싶다 (사진제공: 카카오게임즈)수려한 애니메이션풍 일러스트로 시선을 끌었던 모바일 RPG, 에버소울이 이번 지스타에서 그 모습을 공개합니다. 3D 그래픽 기반의 수집형 게임인 에버소울은 다양한 정령 캐릭터를 수집하고 육성해 나가는 게임인데요, 뛰어난 그래픽과 매력있는 캐릭터 스킬을 담은 영상으로 일찍이 주목을 받은 바 있습니다. 여기에 영지를 가꾸거나 호감도 기반 연애 시스템 등 생활과 스토리라인에도 방점을 찍었죠. 카카오게임즈가 선보이는 신작 에버소울, 정말 기대되네요. 니케: 승리의 여신▲ 라이브 2D가 돋보이는 니케: 승리의 여신 (사진출처: 니케: 승리의 여신 공식 홈페이지) ▲ 니케: 승리의 여신 게임플레이 트레일러 (영상출처: 시프트업 공식 유튜브)외계인으로부터 지구를 탈환하기 위해 싸우는 전투 안드로이드 '니케'의 이야기를 담은 시프트업 신작 슈팅 액션게임 '니케: 승리의 여신'도 지스타에서 만나볼 수 있습니다. 꿈도 희망도 없는 지구에서 적과 싸우는 소녀라는 콘셉트가 팬들에게 확실히 각인됐죠. 샷건과 저격총, 유탄 발사기 등 다양한 총기와 이에 따른 그래픽이 구현돼 있으며, 각 캐릭터별 일러스트 및 디테일 역시 수준급이라는 평입니다. 시프트업의 노하우를 듬뿍 쏟아부은 라이브 2D 액션을 활용해 화려함을 끌어올린 니케: 승리의 여신, 과연 지스타에서 어떤 모습을 보여줄까요?   신의 탑M: 위대한 여정▲ 어느덧 연재 10년을 훌쩍 넘긴 신의 탑이 모바일게임으로 나온다 (사진출처: 게임 공식 홈페이지)전 세계 조회수 45억 뷰를 넘긴 전설적인 네이버 웹툰 '신의 탑' IP를 활용한 모바일게임, '신의 탑M: 위대한 여정'이 지스타에 참전합니다. 웹툰 자체 세계관이 방대하고 스토리가 짜임새 있게 준비된 만큼 게임 역시 기대된다는 평이 지배적인데요, 여기에 개발사 엔젤게임즈는 직접 해당 게임을 시연할 수 있는 기회도 마련한다고 합니다. 몰입도 높은 이야기와 수준 높은 액션 연출, 방대한 멀티 콘텐츠를 앞세우는 신의 탑M, 과연 탑을 오르는 비선별인원 '스물다섯번째 밤'의 이야기를 재미있게 풀어낼 수 있을 지 귀추가 주목됩니다.원더러스: 더 아레나▲ 밝고 편안한 색감으로 눈길을 끄는 원더러스: 더 아레나 (사진제공: 엔젤게임즈)앞서 기재한 신의 탑M과 함께 엔젤게임즈가 내놓는 액션 어드벤처 '원더러스: 더 아레나'도 출격을 준비하고 있습니다. 해당 게임은 동화 속 이야기를 현대물로 재해석한 게임으로, 수만 가지로 조합되는 로그라이크형 던전, 배틀로얄 대전 등 다양한 장르를 접목시킨 것이 특징입니다. 아직까지는 티저 사이트에서의 월드 전경 정도만 공개됐지만, 그럼에도 불구하고 젤다 야숨이나 원신 등이 떠오른다는 평가를 받으며 기대작으로 손꼽히고 있습니다. 이번 지스타를 통해 어느 정도 윤곽이 드러날 것 같습니다.아스테리고스▲ 그리스 신화와 소울라이크의 결합? (사진출처: 플레이스테이션 공식 유튜브 영상 갈무리) ▲ 아스테리고스 공식 트레일러 (영상출처: 플레이스테이션 공식 유튜브)그라비티는 이번 지스타에 무려 13종에 달하는 작품을 전시합니다. 다양한 라그나로크 타이틀과 그란디아, 퍼즐앤드래곤 등 개성 넘치는 독특한 게임이 포진돼있죠. 하지만 그중에서도 유독 눈길을 끄는 게임은 3D 액션 RPG 아스테리고스입니다. 실종된 아버지를 찾아 모험을 떠나는 소녀의 이야기를 담은 게임이죠. 고대 그리스 신화를 배경으로 하며, 방대한 스케일과 소울라이크를 떠올리게 하는 특유의 타격감으로 승부한다고 합니다. PC와 PS4, 5로 출시 예정이니만큼 완성도 높은 게임성을 보여줄 것으로 기대됩니다.천애명월도M▲ 과연 천애명월도M은 어떤 모습으로 나올까 (사진제공: 텐센트)텐센트 산하 게임스튜디오인 오로라 스튜디오가 이번 지스타에서 천애명월도의 모바일 버전, '천애명월도M'의 한글판을 최초로 선보입니다. 천애명월도M은 대만의 무협 소설가 고룡의 대표작 천애명월도 IP를 기반으로 한 게임이죠. 많은 게이머들을 감동시킨 스토리와 더불어 최대 100인이 참여하는 서바이벌 PvP 등 매력적인 콘텐츠들로 무장했다고 합니다. 중국 앱스토어 매출 1위에 오른 적도 있었을 만큼 게이머를 몰입시키는 요소가 확실하다고 하는데요, 이번 지스타에서 인게임 영상도 공개된다고 하니 한번 확인해 보는 것도 좋겠습니다."
2021.11.16.,"청양군, 명품 농산물 알리기 '전력'",url없음,<네이버 기사 없음>
2021.11.16.,"코스피, 외인·기관 동반 매도에 소폭 하락세 출발… 2990선",https://n.news.naver.com/mnews/article/018/0005086940?sid=101,"전날 이어 2990선 이어가, 하루 만에 하락 전환업종 전반 약세, 시총상위株는 혼조[이데일리 권효중 기자] 16일 코스피 지수가 외국인과 기관의 동반 매도 속 소폭 하락 출발, 전날에 이어 2990선을 기록하고 있다. 이날 마켓포인트에 따르면 오전 9시 8분 현재 코스피 지수는 전 거래일 대비 0.19%(5.68포인트) 내린 2993.84를 기록중이다. 코스피 지수는 지난 15일 장중 3000선을 웃돌기도 했지만 장 마감까지는 이를 지켜내지 못했다. 이날은 외국인과 기관의 동반 순매도 속 하루 만에 내림세로 전환하며 장을 열었다. 앞서 간밤 미국 뉴욕 증시는 미국 10년물 국채 금리의 오름세 속 증시 고점에 대한 부담이 맞물리며 3대 지수가 혼조세로 마감했다. 다우존스30산업평균지수와 나스닥 지수가 0.04%가량 내리고, 스탠더드앤드푸어스(S&P)500 지수는 제자리걸음을 보였다. 미국 10년물 국채 금리가 1.643%대까지 오르자 지수에도 하방 압력이 가해졌다. 수급별로는 개인이 홀로 661억원을 사들이고 있다. 외국인은 230억원, 기관은 422억원어치를 각각 팔고 있다. 업종별로는 대부분이 하락하고 있다. 건설업과 철강 및 금속 업종이 1% 넘게 내리고, 유통업, 증권, 음식료품, 비금속광물, 종이목재, 기계, 보험, 금융업, 전기전자, 통신업, 의약품 등 대부분의 업종이 1% 미만에서 내리고 있다. 반면 섬유의복과 서비스업, 의료정밀 업종은 1% 미만에서 오름세를 유지하고 있다. 시가총액 상위 종목들은 혼조세다. 삼성전자(005930)가 0.42% 오르고, SK하이닉스(000660)는 0.45% 내리는 등 상반된 흐름을 보이고 있다. NAVER(035420)와 카카오(035720)는 보합권에서 움직이고 있으며, 삼성바이오로직스(207940)는 1.16% 내리고, 현대차(005380)가 0.48%, 기아(000270)가 1.73% 하락하고 있다. 반면 LG화학(051910)은 1.05%, 삼성SDI(006400)는 0.80% 오르는 등 2차 전지 관련 종목들은 강세를 보이고 있다. 종목별로는 일진머티리얼즈(020150)가 주요 고객사들의 북미 및 유럽 지역 증설 모멘텀과 맞물려 생산능력 확대가 기대된다는 증권가 분석에 장 초반 4% 가까운 강세를 보이고 있다."
2021.11.16.,"옥천군, 지방세 전자송달·자동이체 신청하면 600원 세액공제",url없음,<네이버 기사 없음>
2021.11.16.,"CJ제일제당 햇반, '2021 한국PR대상' 2관왕 등극",url없음,<네이버 기사 없음>
2021.11.16.,"지스타, 백신접종 완료 또는 PCR 음성 확인자만 참관 허용한다",https://sports.news.naver.com/news.nhn?oid=442&aid=0000142633,<구조 다름>
2021.11.16.,"코스피, 장초반 소폭 하락세...외인·기관 동반 매도",https://n.news.naver.com/mnews/article/277/0005000106?sid=101,"코스피 지수가 개인과 외국인의 매도에 하락 출발한 16일 서울 을지로 하나은행 딜링룸에서 딜러들이 일하고 있다. 코스피는 전 거래일보다 3.84포인트(0.13%) 내린 2,995.68에 개장했다. /문호남 기자 munonam@16일 장초반 코스피가 소폭 약세를 보이고 있다. 간밤 미국 증시가 국채 금리 상승폭 확대에 기술주 중심으로 매출이 출회되며 약보합세를 보인 영향이 투자자들 심리에 영향을 준 것으로 풀이된다.이날 오전 9시12분 기준 코스피는 전거래일 대비 0.23%(6.91포인트) 내린 2992.61를 기록하고 있다. 이날 지수는 전 거래일 대비 0.13%(3.84포인트) 내린 2995.68로 출발했다.간밤 뉴욕 증시는 국채 금리 상승폭 확대 영향에 소폭 약세를 보였다. 다우존스30산업평균지수는 전 거래일보다 0.04%(12.86포인트) 내린 3만6087.45에 거래를 마쳤다. 스탠더드앤드푸어스(S&P)500지수는 전장보다 0.00%(0.05포인트) 하락한 4682.80에, 나스닥지수는 0.04%(7.11포인트) 내린 1만5853.85에 마감했다.투자주체별로는 외국인과 기관이 각각 298억원, 559억원 순매도 했다. 개인은 851억원 순매수하며 지수를 방어하고 있다.시가총액 상위 종목들은 대부분 내림세다. LG화학(1.05%), 삼성SDI(0.66%) 등은 상승했다. 이외 현대차(-0.96%), 기아(-1.85%), 셀트리온(-1.72%)는 떨어졌다.삼성전자, NAVER, 삼성바이오로직스는 보합세를 보이고 있다.같은 시각 코스닥은 전 거래일 대비 0.01%(0.08포인트) 오른 1029.11를 기록 중이다. 지수는 전거래일보다 0.03%(0.32포인트) 상승한 1029.35에 개장했지만 이내 하락 전환했다. 이후 다시 상승폭을 키우며 현재는 상승세로 돌아섰다.코스닥에서는 코스피와 마찬가지로 개인 나홀로 635억원 순매수했다. 외국인과 기관은 각각 514억원, 110억원 순매도했다.시총 상위 종목 중에서는 대다수 종목이 상승세를 보였다. 셀트리온헬스케어, 에코프로비엠만 각각 1.19%, 0.60% 떨어졌다. 펄어비스(5.67%), 엘앤에프(0.78%), 카카오게임즈(0.51%), 위메이드(0.53%) 등이 올랐다.서상영 미래에셋증권 연구원은 ""미 증시에서 국채 금리 상승 등을 이유로 최근 상승폭이 확대되던 일부 기술주가 부진한 모습을 보인 점은 부담""이라며 ""최근 한국 증시의 상승폭이 컸던 점을 감안 차익 실현 욕구를 자극할 것으로 전망된다""고 말했다."
2021.11.16.,"[생활경제 이슈] 매나테크 코리아, 탈모 케어 ‘디오갠트 샴푸, 컨디셔너’ 출시 外",url없음,<네이버 기사 없음>
2021.11.16.,"코스피, 외인·기관 매도에 약보합 출발…2990선 거래중",url없음,<네이버 기사 없음>
