기사날짜,기사제목,네이버 뉴스 url,기사내용
2021.11.28.,"NFT·메타버스 먹구름?...""이들도 주식 팔았다""",https://n.news.naver.com/mnews/article/215/0000999800?sid=101,"최근 주가가 급등한 일부 NFT(대체불가토큰) 및 메타버스 관련 회사의 임원과 최대주주 특별관계자가 잇따라 고점에 주식을 팔아 이익을 실현했다.28일 금융감독원 전자공시시스템에 따르면 하이브의 윤석준 하이브 아메리카 CEO는 지난 6월 24일과 7월 14일 스톡옵션(주식매수선택권)을 행사해 주당 1천62원에 하이브 주식 총 12만주를 취득했다.이어 이달 16일(이하 결제일 기준) 주당 41만4천527원에 4만137주를, 17일 주당 41만4천86원에 1만9천863주를 각각 장내매도로 처분했다.스톡옵션 행사와 주식 매도로 윤 CEO가 실현한 차익은 총 247억3천542만원 규모다.하이브 주가는 이달 초 NFT 사업 진출 발표 후 급등하며 연일 최고가를 경신했다. 지난 17일에 기록한 역대 장중 고가(42만1천500원)에 근접한 가격에 윤 글로벌 CEO는 주식을 매도했다.고점을 찍은 하이브는 이후 '숨 고르기'에 들어가 지난 26일 종가 기준 37만원대로 밀려났다.한글과컴퓨터의 최대주주 특별관계자인 헤르메스홀딩스 유한회사는 지난 18일 보유 주식 43만3천784주(지분율 1.72%) 전량을 주당 2만9천883원에 장내 매도했다.헤르메스홀딩스가 처분한 한글과컴퓨터 주식은 총 129억6천만원 규모다.또 한글과컴퓨터 비등기임원인 이창주 상무이사는 지난 19일 보유 주식 3천주를 주당 3만원에 장내매도로 처분했다. 매도 주식 평가액은 9천만원이다.메타버스주로 엮인 한글과컴퓨터는 지난 17일 상한가인 2만8천400원에 마감한 이후 고공행진을 이어갔다.싸이월드제트와 합작법인을 설립해 메타버스 생태계 기반 '싸이월드-한컴타운'을 개설하고, 운영에 NFT도 연계한다는 소식이 호재였다.카카오게임즈 남궁훈 대표는 NFT 사업 진행 발표 후인 지난 9일 자사 주식 1천40주를 주당 9만5천900원에 장내매도했다. 9천974만원을 현금화했으며, 지분율은 3.3%에서 3.23%로 줄었다.카카오게임즈는 이달 3일 3분기 실적을 발표하면서 NFT 거래소 개발 계획도 밝혔다. 이에 힘입어 10월 말 7만9천800원이었던 주가는 지난 17일 장중 11만6천원까지 치솟았다.메타버스 플랫폼을 개발하는 바이브컴퍼니의 임원들은 작년 10월 28일 상장 후 1년간의 우리사주 보호예수기간이 끝나자 입고된 주식을 줄줄이 처분했다.이달 들어 박소아 전무(4만원 2천주), 안창원 이사(4만7천495원 1천700주), 이도경 이사(6만5천400원 500주), 박성공 이사(4만5천440원 500주·5만6천200원 200주) 등이 주식을 장내매도했다. 4명이 매도한 주식 평가액은 총 2억2천738만원이다.바이브컴퍼니 주가는 3만원대 초반이던 지난달 초부터 상승세를 타다가 이달 들어 메타버스 열풍을 타고 급등해 지난 18일 장중 6만8천700원까지 올랐다.이처럼 주식시장에서는 종목이 호재를 만나거나 테마에 엮여 급등했을 때 최대주주나 특수관계인, 또는 임원이 지분을 처분해 시세차익을 보는 일이 종종 있다.그러나 회사 경영 상황을 잘 아는 최대주주나 임원의 주식 매도를 시장은 대개 부정적 신호로 받아들인다. 최대주주나 임원의 지분 처분 후 주가가 내리막길을 걷는 경우도 많다.(사진=연합뉴스)"
2021.11.28.,"SK텔레콤, 국민주 된다…주가 힌트는 배당[차민영의 포스트it]",https://n.news.naver.com/mnews/article/277/0005006700?sid=105,"SKT 2.0 시대…2개 회사로 재편SK텔레콤 액분 후 주가 6만원대로존속회사 시총 13조~19.5조 예상SK텔레콤 SKT타워 전경#. 'SKT 2.0 시대' 인공지능(AI)·디지털인프라 전문회사로 변신하는 새로운 SK텔레콤이 5대1 비율 액면분할을 통해 '국민주'에 도전합니다. 분할 이후 배당·신사업 기대감에 주가 전망은 밝습니다. SK텔레콤에서 2개 회사로 재편된 SK텔레콤(존속회사)과 SK스퀘어(신설회사)는 오는 29일 각각 유가증권(코스피)시장에 각각 변경상장, 재상장됩니다. 앞서 SK텔레콤은 10월26일~11월26일 한 달 간 주식 매매거래가 정지됐습니다.5대1 액면분할을 단행하는 SK텔레콤 액면가는 기존 500원에서 100원으로 낮아집니다. 발행 주식 총수도 현재 7206만143주에서 3억6030만715주로 늘어납니다. 가령 SK텔레콤 주식 20주를 가진 주주는 주식분할 이후 5배 늘어난 100주를 갖게 되는 셈입니다. 약 6대 4 분할비율에 따라 존속회사 주식 60주와 신설회사 주식 39주를 각각 받을 수 있습니다. 소수점 이하 단주는 11월 29일 종가로 환산해 현금으로 지급 받습니다.증권가는 변경상장일 주가와 시가총액으로 각 6만1900원, 13조5000억원을 예상했습니다. 매매 정지 전 마지막 거래일 종가는 30만9500원이었습니다. 삼성증권 연구원은 ""액면가액 5대 1 주식분할과 순자산 장부가액 기준으로 산정된 SK텔레콤·SK스퀘어 분할 비율을 고려한 결과""라고 설명했습니다.액면분할은 통상 소액주주 참여를 높이고 유통 물량을 늘리기 위한 용도로 활용됩니다. 이른바 '국민주' 효과입니다. 일례로 삼성전자, 카카오 등이 과거 50대1, 5대1 액면분할을 단행한 바 있습니다. SK텔레콤은 뉴스룸을 통해 ""액면분할을 통해 주주 구성 측면에서 소액주주들의 비중이 크게 늘어날 것으로 기대하고 있다. 주주 구성이 국민주에 가까워질 것으로 예상되는 지점""이라고 밝힌 바 있습니다. 다만 액면분할 자체가 근본적인 기업가치 변화를 의미하는 것은 아닙니다.증권가에서는 배당총액과 신사업 성과에 주목하고 있습니다. 앞서 SK텔레콤은 지난 8월 공시를 통해 ""2021~2023년 존속회사 별도 실적 기준 '법인세·이자·감가상각비 차감 전 영업이익(EBITDA)-설비투자(CAPEX)'의 30~40%로 배당 총액을 결정하겠다""고 밝힌 바 있습니다. CAPEX 규모를 배당 산식에 넣으면서 CAPEX 투자 규모가 배당 변수가 될 가능성도 상존합니다. 올해는 분할과 무관하게 최소 작년(7200억원) 수준을 유지할 방침입니다. SK텔레콤은 지난 2분기부터 분기배당도 도입했습니다.배당 기대감 등에 주가 전망도 밝습니다. 액면분할 이후 SK텔레콤 시총이 이전 대비 늘어날 것이란 반응입니다. 변경 상장 후 SK텔레콤(존속회사) 기준 예상 시총은 ▲삼성증권 14조~16조원 ▲유안타증권 14조~16조원 ▲하나금융투자 13조~18조원 ▲대신증권 19조5000억원 ▲NH투자증권은 16조8000억원입니다. 오는 29일 변경상장일 시가총액이 13조5000억원으로 점쳐졌던 만큼 대체로 상승 여력이 높다고 본 것입니다.최민하 삼성증권 연구원은 ""SK텔레콤의 배당수익률은 2021년 3.4배, 과거 5년 평균 4.2배 등에 비해 5.3배 내외로 높아질 것""이라며 ""신성장원으로 키우는 구독 마케팅, 메타버스, 엔터프라이즈 등의 성과에 따라 밴드가 우상향할 여지는 열려있다""고 말합니다. 김홍식 하나금융투자 연구원은 ""선발 사업자임에도 경쟁사 대비 이익 규모가 크지 않아 총 배당금 가치로 시가 총액을 평가할 가능성이 높다""고 짚었습니다.유영상 신임 대표가 이끄는 SK텔레콤은 'AI·디지털인프라 컴퍼니'를 목표로 3대 핵심 사업인 유·무선 통신, AI 기반, 디지털인프라 서비스에 집중합니다. 2020년 15조 연매출을 2025년 22조원까지 늘린다는 계획입니다. 올해 연결 기준 연매출 컨센서스(추정치 평균)는 약 19조5500억원으로 내년은 20조원을 무난히 돌파할 전망입니다. 산하에는 SK브로드밴드, SK텔링크, 피에스앤마케팅, F&U신용정보, 서비스탑, 서비스에이스, SK오앤에스 등 시너지를 낼 수 있는 자회사들이 배치됐습니다.한편, 반도체·ICT 투자를 전담하는 SK스퀘어는 박정호 대표이사 부회장이 이끕니다. 자회사인 원스토어도 지난 26일부로 한국거래소에 유가증권시장 상장 예비심사를 청구하며 자회사 중 기업공개(IPO) 첫 타자로 출사표를 던졌습니다. 만약 거래소의 상장 적격성 심사를 통과한다면 다음은 공모 과정을 거치게 됩니다. 공모 주식수는 666만주, 상장 주식수는 2622만9925주입니다. 거래소는 청구 후 45영업일 내 상장 적격성 심사를 거쳐 심사 결과를 통보해야 합니다."
2021.11.28.,"은행 ATM·지점 정보, 모바일 앱으로 한 번에",https://n.news.naver.com/mnews/article/008/0004676114?sid=101,"서울 중구 삼성본관에 위치한 한국은행 본부/사진=뉴스1오는 29일부터 금융권이 운영 중인 ATM(현금자동인출기)와 지점 위치, 운영시간 등을 스마트폰 애플리케이션으로 간편하게 확인할 수 있다. 그동안 ATM·지점 정보가 통합 관리되지 않아 어려움을 겪던 금융소비자들의 이용 편의성을 높이겠단 취지다. 한국은행은 28일 ""전 금융기관의 ATM 및 지점의 세부정보를 스마트폰을 통해 확인 가능하게 된다""며 '금융대동여지도' 서비스를 출시한다고 밝혔다. '금융대동여지도' 서비스는 △은행 △비은행예금취급기관(우체국·저축은행·상호금융 등) △증권사 △자동화기기 사업자 등 범 금융권 ATM·지점 관련 최신 정보를 통합 제공한다. 총 38개 기관이 참여하며 은행 중 지점과 ATM이 없는 카카오뱅크, 토스뱅크는 제외됐다. 금융권(금융결제원)에서 제공 중인 기존 '어카운트인포 앱'이나 '모바일현금카드 앱'을 다운로드 받아 이용하면 된다. 이를 통해 위치 등 기본사항 외에도 제공서비스나 수수료, 폐쇄 정보, 장애인 지원기능 등의 다양한 정보를 함께 제공하고 검색기능도 이용할 수 있다. 한은과 금융위원회는 지난해 7월부터 금융권과 공동으로 ATM·지점 정보를 통합한 데이터베이스 및 이를 기반으로 하는 모바일 앱 서비스 구축·개발을 진행해왔다. 한은은 ""수집된 ATM 데이터 분석 등을 바탕으로 은행권과 함께 ATM 운영 공조방안을 논의하고, ATM·지점 대체인프라 활성화 등을 추진할 예정""이라며 ""한은과 금융위는 금융소비자의 현금이용 편의성 및 금융접근성 제고 등 금융포용 확대를 위해 금융권과 함께 지속 노력해 나갈 계획""이라고 밝혔다."
2021.11.28.,"[포토]""미래차를 한눈에""",https://n.news.naver.com/mnews/article/018/0005095523?sid=103,"[이데일리 방인권 기자] 28일 오후 경기도 고양시 일산 킨텍스에서 열린 '2021 서울모빌리티쇼'를 찾은 관람객들이 전시된 완성차를 관람하고 있다.서울모빌리티쇼는 세계자동차산업연합회(OICA)가 공인한 국내 유일의 국제 모터쇼로 1995년 첫 회를 시작으로 격년 단위로 매 홀수 해에 개최된다. 올해는 11월 26일부터 12월 5일까지 킨텍스 제2전시장에서 열리며 관람시간은 평일 오전 10시부터 오후 5시, 주말은 오전 10시부터 오후 6시까지다. 입장권은 카카오 쇼핑하기를 통해 구매할 수 있다."
2021.11.28.,경기도 북한이탈주민 음악회 개최…코로나 블루↓,https://n.news.naver.com/mnews/article/014/0004746419?sid=102,"경기도 25일 ‘2021 코로나 블루 극복 북한이탈주민 가을음악회’ 개최. 사진제공=경기북부청 【파이낸셜뉴스 부천=강근주 기자】 경기도가 ‘2021 코로나 블루 극복 북한이탈주민 가을음악회’를 25일 부천 고려호텔에서 개최했다. 이번 음악회는 북한이탈주민의 심리-정서적 불안을 다양한 문화예술 콘텐츠 제공으로 치유하고 지역사회 연착륙을 도모하고자 마련됐으며, 경기도내 북한이탈주민 50여명이 참여했다.   코미디언 김진수 사회로 진행된 이날 음악회는 먼저 북한이탈주민이 직접 참여하는 ‘북한이탈주민 노래자랑’을 진행했다. 참가자는 저마다 노래실력을 뽐내며 청중들로부터 큰 환호와 호응을 얻었다.   이어 문용현-윤수현 등 유명 트로트 가수가 무대에 올라 ‘잔들어’, ‘함께’, ‘천태만상’, ‘꽃길’ 등을 열창하는 ‘초청가수 특별공연’으로 흥이 넘치는 화합의 장을 만들었다. 이밖에도 퀴즈 이벤트 등으로 행사를 더욱 풍성하게 했다.    경기도 25일 ‘2021 코로나 블루 극복 북한이탈주민 가을음악회’ 개최. 사진제공=경기북부청 이날 음악회는 코로나19 상황을 고려해 카카오TV 생중계를 진행해 북한이탈주민 등을 포함한 다양한 사람이 관람할 수 있도록 하고, 특히 수어 통역을 통해 장애 유무와 상관없이 누구나 행사를 즐길 수 있도록 했다.   오병권 경기도지사 권한대행은 이날 영상축사로 “일상회복을 위한 여정이 시작됐지만, 코로나19 감염병은 희망을 찾아 낯선 곳에 정착한 이들을 더 어렵게 했다”고 북한이탈주민을 위로했다.   이어 “흔히 북한이탈주민을 ‘먼저 온 통일’이라고 하는데, 이제는 편견과 차별을 넘어 배려와 공존이 싹트는 세상을 만드는 것이 중요하다”며 “북한이탈주민이 안정적 삶을 누리도록 다양한 지원 사업을 추진하겠다”고 말했다.    경기도 25일 ‘2021 코로나 블루 극복 북한이탈주민 가을음악회’ 개최. 사진제공=경기북부청 한편 올해 9월말 기준 국내 북한이탈주민은 3만1528명으로, 경기도에는 전국 지자체 중 가장 많은 1만787명이 거주하고 있다. 이에 따라 경기도는 적응지원을 비롯해 △인식개선 및 문화격차 해소 △언어 및 취업교육 △취업지원 △소통과 화합 프로그램 운영 △상담 및 사례관리 등 북한이탈주민의 정착지원을 위한 다양한 정책을 펼치고 있다."
2021.11.28.,'사라진 특판'…은행 예금금리 불만이라면 '인뱅' 주목,https://n.news.naver.com/mnews/article/277/0005006680?sid=101,"토스·케이뱅크 등 수신상품에 2% 금리 제공자영업자 박정욱씨(35·가명)는 최근 모든 은행의 예·적금 상품을 해지했다. 매달 상당한 금액을 저축하고 있는데 금리가 터무니없이 낮다는 생각이 들어서다. 기준금리가 내년 초까지 두 차례 더 오른다는 소식을 접한 박씨는 당분간 모든 돈을 수시입출금 통장에 넣어두기로 했다. 박씨는 지인의 추천을 받아 토스뱅크 수시입출금 통장에 돈을 모두 넣었다. 금리가 연 2%로 기존 예·적금 상품의 두 배에 달해 만족도가 높았다.금리인상기를 맞아 하루가 다르게 급등하는 대출금리와 달리 예금금리는 제자리걸음을 면치 못하고 있어 소비자들의 불만의 목소리가 커지고 있다. 특히 매년 말이면 쏟아지던 은행권 특판(특별판매) 예·적금 상품도 올해는 자취를 감췄다. 이에 한 푼이라도 더 많은 이자를 얻기 위한 소비자들은 인터넷전문은행으로 향하고 있다. 수시입출금 통장의 경우 은행에 비해 최대 20배 가까운 금리를 제공하고 있기 때문이다.28일 금융권에 따르면 토스뱅크는 정기예금이 아닌 수시입출금 통장에도 아무 조건 없이 연 2% 금리를 제공하고 있다. 단 하루를 맡겨도 맡긴 날짜만큼 이자가 제공되고 중간에 해지하더라도 혜택을 누릴 수 있는 것이 특징이다.주요 시중은행의 수시입출금 통장의 금리가 통상 연 0.1%인 점을 감안하면 한마디로 ‘파격적’이다. 지난달 5일 출범한 토스뱅크는 해당 상품에 힘입어 최근 수신 잔액이 10조원을 돌파한 것으로 알려졌다.케이뱅크와 카카오뱅크 등 다른 인터넷은행도 시중은행 대비 높은 금리의 수신상품을 판매하고 있다. 케이뱅크는 그룹 야구단 ‘KT 위즈’의 한국시리즈 우승을 기념한 특판을 내놨다. ‘코드K정기예금’ 1년 만기 상품에 연 2.1% 금리를 제공한다. 별도의 기한 없이 2021억원의 한도가 소진될 때까지 진행된다. 해당 상품은 가입 후 2주 내 금리가 오르면 자동으로 인상된 금리를 적용해주는 ‘금리보장 서비스’도 제공된다.카카오뱅크의 26주적금도 연 2% 금리를 제공한다. 기본금리 연 1.5%에 26주간 적금을 꾸준히 납입하는 데 성공하면 추가로 연 0.5%포인트를 준다. 카카오뱅크의 정기예금 금리도 연 1.5%로 시중은행 대비 높은 수준이다.한편 금융감독원에 따르면 5대 시중은행과 지방은행의 특판 예·적금(2020년 이후 출시) 중 지난해 1월부터 올해 9월까지 만기가 도래한 21개 상품의 경우 실제 고객에 지급된 금리는 가입 때 안내한 최고금리 수준의 평균 78%에 불과한 것으로 나타났다.이는 은행들이 최고금리(기본금리+우대금리) 적용을 위해 오픈뱅킹 등록이나 제휴상품 이용실적 달성, 연금이체 실적 등 복잡하고 달성이 어려운 우대금리 지급 조건을 내걸었기 때문이다."
2021.11.28.,'사라진 특판'…은행 예금금리 불만이라면 '인뱅' 주목,https://n.news.naver.com/mnews/article/277/0005006680?sid=101,"토스·케이뱅크 등 수신상품에 2% 금리 제공자영업자 박정욱씨(35·가명)는 최근 모든 은행의 예·적금 상품을 해지했다. 매달 상당한 금액을 저축하고 있는데 금리가 터무니없이 낮다는 생각이 들어서다. 기준금리가 내년 초까지 두 차례 더 오른다는 소식을 접한 박씨는 당분간 모든 돈을 수시입출금 통장에 넣어두기로 했다. 박씨는 지인의 추천을 받아 토스뱅크 수시입출금 통장에 돈을 모두 넣었다. 금리가 연 2%로 기존 예·적금 상품의 두 배에 달해 만족도가 높았다.금리인상기를 맞아 하루가 다르게 급등하는 대출금리와 달리 예금금리는 제자리걸음을 면치 못하고 있어 소비자들의 불만의 목소리가 커지고 있다. 특히 매년 말이면 쏟아지던 은행권 특판(특별판매) 예·적금 상품도 올해는 자취를 감췄다. 이에 한 푼이라도 더 많은 이자를 얻기 위한 소비자들은 인터넷전문은행으로 향하고 있다. 수시입출금 통장의 경우 은행에 비해 최대 20배 가까운 금리를 제공하고 있기 때문이다.28일 금융권에 따르면 토스뱅크는 정기예금이 아닌 수시입출금 통장에도 아무 조건 없이 연 2% 금리를 제공하고 있다. 단 하루를 맡겨도 맡긴 날짜만큼 이자가 제공되고 중간에 해지하더라도 혜택을 누릴 수 있는 것이 특징이다.주요 시중은행의 수시입출금 통장의 금리가 통상 연 0.1%인 점을 감안하면 한마디로 ‘파격적’이다. 지난달 5일 출범한 토스뱅크는 해당 상품에 힘입어 최근 수신 잔액이 10조원을 돌파한 것으로 알려졌다.케이뱅크와 카카오뱅크 등 다른 인터넷은행도 시중은행 대비 높은 금리의 수신상품을 판매하고 있다. 케이뱅크는 그룹 야구단 ‘KT 위즈’의 한국시리즈 우승을 기념한 특판을 내놨다. ‘코드K정기예금’ 1년 만기 상품에 연 2.1% 금리를 제공한다. 별도의 기한 없이 2021억원의 한도가 소진될 때까지 진행된다. 해당 상품은 가입 후 2주 내 금리가 오르면 자동으로 인상된 금리를 적용해주는 ‘금리보장 서비스’도 제공된다.카카오뱅크의 26주적금도 연 2% 금리를 제공한다. 기본금리 연 1.5%에 26주간 적금을 꾸준히 납입하는 데 성공하면 추가로 연 0.5%포인트를 준다. 카카오뱅크의 정기예금 금리도 연 1.5%로 시중은행 대비 높은 수준이다.한편 금융감독원에 따르면 5대 시중은행과 지방은행의 특판 예·적금(2020년 이후 출시) 중 지난해 1월부터 올해 9월까지 만기가 도래한 21개 상품의 경우 실제 고객에 지급된 금리는 가입 때 안내한 최고금리 수준의 평균 78%에 불과한 것으로 나타났다.이는 은행들이 최고금리(기본금리+우대금리) 적용을 위해 오픈뱅킹 등록이나 제휴상품 이용실적 달성, 연금이체 실적 등 복잡하고 달성이 어려운 우대금리 지급 조건을 내걸었기 때문이다."
2021.11.28.,[포토]북적이는 서울모빌리티쇼,https://n.news.naver.com/mnews/article/018/0005095516?sid=103,"[이데일리 방인권 기자] 28일 오후 경기도 고양시 일산 킨텍스에서 열린 '2021 서울모빌리티쇼'를 찾은 관람객들이 전시된 완성차를 관람하고 있다.서울모빌리티쇼는 세계자동차산업연합회(OICA)가 공인한 국내 유일의 국제 모터쇼로 1995년 첫 회를 시작으로 격년 단위로 매 홀수 해에 개최된다. 올해는 11월 26일부터 12월 5일까지 킨텍스 제2전시장에서 열리며 관람시간은 평일 오전 10시부터 오후 5시, 주말은 오전 10시부터 오후 6시까지다. 입장권은 카카오 쇼핑하기를 통해 구매할 수 있다."
