기사날짜,기사제목,네이버 뉴스 url,기사내용
2021.11.14.,돈버는 게임으로 전환…'MBN 전략' 통할까,https://n.news.naver.com/mnews/article/009/0004878862?sid=105,"K게임 수익모델 변화 예고'돈써야 이기는 게임' 벗어나메타버스 블록체인 NFT 활용캐릭터 육성후 현금화 가능한새로운 패러다임 전환 경쟁관련법 개정·사행성 논란 변수일단 해외시장부터 공략나서 # 최근 전 세계 게임 업계에 휘몰아친 '돈 버는(플레이투언·P2E) 게임' 열풍은 블록체인 기반 게임 '엑시인피니티'에서 시작됐다. 베트남 스타트업 스카이마비스가 개발한 엑시인피니티는 게임에서 얻은 캐릭터를 육성해 판매하고 자체 코인을 현금화하는 것이 가능하다. 게임 업계 패러다임 전환을 주도하면서 P2E 열풍을 전 세계로 확산시키고 있다. 특히 블록체인(가상화폐)과 대체불가능토큰(NFT) 기술을 접목하고 게임 내 경제 시스템(메타버스)까지 구축해 새로운 비즈니스 모델을 만들어냈다는 평가다. 베트남이나 필리핀 같은 곳에선 아예 엑시인피니티를 직업으로 삼은 이들이 대거 생겨나면서 코로나19로 어려워진 서민경제를 지탱해주는 역할까지 하고 있다. 엑시인피니티 가상화폐(AXS)의 시가총액(최대 공급 기준)은 391억달러(약 46조1184억원)에 육박하는데, 이는 국내 게임사 시총 1위인 크래프톤(약 26조원)을 뛰어넘은 수치다.국내 게임 업계에도 지각변동이 일어나고 있다. 중형 게임사뿐 아니라 메이저 게임사(엔씨소프트·넷마블)까지 일제히 열풍에 올라탄 모양새다. '돈을 쓰는(돈을 쓸수록 이기는 구조·P2W) 게임'에서 P2E로 패러다임이 빠르게 전환되면서 게임사 수익 체계 변화도 예상된다. 일각에선 2004년 논란을 일으켰던 '바다이야기'까지 소환되며 P2E 게임의 사행성을 우려하는 목소리가 작지 않아 국내 시장 확대에 장벽이 될 것이란 분석도 나온다.실제 국내 주요 게임사들은 최근 진행한 3분기 실적 발표 과정에서 미래 먹거리로 메타버스, 블록체인, NFT를 낙점하고 이들을 결합한 P2E 게임 서비스를 출시하기 위한 개발과 연구를 진행하고 있다고 공개했다. 엔씨소프트는 내년 중 NFT와 블록체인을 결합한 새로운 게임을 선보이겠다고 밝혔다. 리니지의 경우 음지에서 아이템이 거래되는 등 게임 내 경제 시스템이 구축된 상태다. 엔씨 입장에서는 아이템 거래를 양지로 끌어올리면 막대한 수수료 수익을 챙길 수 있는 기회다. 배동근 크래프톤 최고재무책임자(CFO)는 ""게임 내 가상세계 안에 있는 재화나 콘텐츠가 의미를 가지려면 게임 자체의 경쟁력이 담보돼야 한다""고 강조했다. 당분간 NFT 상품 출시보다는 가치 있는 지식재산(IP) 확대에 중점을 두겠다는 얘기다. 카카오게임즈는 게임의 기술력에 스포츠·통신장비를 결합한 분야에서 먹거리를 찾으며 차별화에 나섰다. 이를 위해 스포츠, 게임, 메타버스에 특화된 NFT 거래소도 개발하고 있다. 위메이드는 위믹스를 기축통화로 하는 블록체인 게임 100개를 출시해 자체 블록체인 생태계를 구축하겠다는 전략을 내놨고, 컴투스는 메타버스 출시를 예고했다.다만 P2E 게임 대중화에는 규제와 투기·사행성 논란을 비롯한 상당한 장벽이 있어 현재의 열기가 과열됐다는 지적도 나온다. 국내에서 게임을 출시하기 위해선 등급 분류가 필요한데 게임물관리위원회는 현금 환급이 가능한 게임의 사행성을 우려해 관련 게임에 등급을 내주지 않고 있다. 토큰 발행 자체가 어렵다는 얘기다. '게임폐인' 양성 등 각종 부작용과 채굴 집중 현상 등 사행성 논란도 넘어야 할 과제다. 게임이 생계 수단이 되면 사회문제로까지 비화될 소지가 있다. 엔씨소프트는 ""위험이나 비판 요소가 제기될 수 있어 위험 요인을 관리하면서 설계할 수 있을지 논의하고 있다""고 밝히기도 했다. 게임 업계 관계자는 ""선점 효과가 중요하기 때문에 국내 게임사의 해외 진출이 더 활발해질 것으로 본다""고 말했다."
2021.11.14.,"이준석, '킹크랩' 잡는 '크라켄' 발표…""與, 여론공작 포기하길""",https://n.news.naver.com/mnews/article/008/0004670194?sid=100,"[[the300]](서울=뉴스1) 이동해 기자 = 이준석 국민의힘 대표가 14일 국회 의원회관 제2소회의실에서 열린 ‘20대 대선 여론조작 방지를 위한 온라인 싸드, 크라켄 공개’행사에서 인사말을 하고 있다. 2021.11.14/뉴스1  국민의힘이 댓글 조작 의심 행위를 포착하는 자체 개발 프로그램인 '크라켄'을 14일 공개했다. 이준석 국민의힘 대표는 ""더불어민주당은 이번 대통령 선거에서는 어쭙잖은 여론 공작이나 민심 왜곡에 대한 투자를 포기하기를 바란다""고 경고했다. 국민의힘은 이날 오후 국회 의원회관 소회의실에서 크라켄 프로그램 공개 기자회견을 열었다. 이 대표와 디지털정당위원회(디정위) 위원장인 이영 국민의힘 의원 등이 참석했다. 크라켄은 이 대표의 대선 비책인 '비단주머니' 1호 프로젝트다. 지난 대선에서 논란을 일으킨 매크로(자동실행 불법프로그램) 등을 이용한 댓글 조작 프로그램 '킹크랩'을 의식해 이름을 붙였다. 상상 속 바다 괴물인 크라켄으로 킹크랩을 먹어버리겠다는 뜻을 담았다. 이날 회견에서는 크라켄 프로그램의 작동 과정 설명, 실제 시연 등이 이뤄졌다. 이영 의원은 ""다들 아시겠지만 2017년 대통령 선거와 2018년 지방 선거 때 민주당은 댓글 조작 프로그램인 킹크랩을 이용해 무려 118만개의 댓글과 8840만개가 넘는 기사 추천으로 여론을 조작했다""며 ""대한민국의 대표적인 당이 이렇게 조직적으로 여론 조작을 해서 선거에 영향을 미쳤다는 것 자체가 굉장히 부끄러운 일이 아닐 수 없다""고 말했다. 이어 ""다시 한번 대한민국 정치사에 이런 일이 있어서는 안 되겠다는 게 국민의힘 입장""이라며 ""그래서 디정위는 디지털로 된 무기와 도구를 개발했다. 도구는 후보가 좀 더 빛날 수 있게 하는 서비스이고 무기는 공격에 대한 방어를 하는 것이다. 그 무기 중 하나가 바로 크라켄""이라고 소개했다. (서울=뉴스1) 이동해 기자 = 이준석 국민의힘 대표와 이영 디지털소통위원장이 14일 오후 서울 여의도 국회의원회관에서 비단주머니 1호인 '크라켄'을 공개하고 있다. 2021.11.14/뉴스1  이 의원은 ""크라켄은 주요 키워드를 가지고 포털들의 기사 댓글들을 크롤링(Crawling·웹상의 각종 정보를 자동화된 방법으로 수집해 분류하는 기술)한다. 그리고 크롤링한 데이터들은 AI(인공지능)를 기반으로 이상 행위를 자동 분석한다""며 ""이후 전문 모니터링을 할 수 있는 요원에 전달한다. 전문가인 분석관 3명이 실제로 크로스체크(교차점검)를 한 다음에 부정 댓글임이 확실시되면 선거관리위원회에 신고하는 구조""라고 설명했다. 또 ""보통 동일한 IP(인터넷프로토콜)에서 다수의 사이트에 동시에 접속돼 댓글을 올리는 경우라거나 아니면 동일 사이트에서 닉네임은 같은데 같은 문장의 댓글이 동시다발로 생기면 의심스럽게 본다""며 ""50개씩 뽑아내 그중 의심스러운 계정들이 현재 어떤 활동들을 하는지 알아낸다""고 밝혔다. 국민의힘은 12월부터 본격적으로 크라켄을 가동할 계획이다. 이 의원은 ""아직 당내에 대선 캠프가 제대로 만들어지지 않아서 지금은 성능 테스트 등을 하고 있다""며 ""11월까지는 시범 서비스를, 12월1일부터 본격 설치할 예정""이라고 밝혔다. 이 대표는 이날 크라켄 가동의 상징성을 강조하며 '드루킹 댓글 조작 사건'을 상기시키고 현 정권의 정통성을 문제 삼았다. 이 대표는 모두발언에서 ""대선 때마다 반복되는 여론 조작 시도야말로 민주주의에 대한 중대한 도전""이라며 ""문재인 정부는 대통령의 최측근이라고 알려진 김경수 전 경남도지사가 드루킹의 제안으로 댓글 부대를 운영하다가 본인이 감옥 가고 정부 정통성에 큰 흠집을 냈다. 저는 대선이 끝난 뒤 이런 사람들을 잡아 벌주는 것은 약하다고 생각한다""고 말했다.이어 ""(크라켄으로 댓글 조작을) 거의 완벽하게 잡아낼 수 있다고 자신한다""며 ""여론 조작 부분을 매우 엄격히 다루고 발견한 부분에 대해서는 선관위 고발, 수사 요구 등 여러 조치를 취하겠다""고 했다. 이 대표는 또 송영길 민주당 대표가 이재명 대선 후보의 부인 김혜경씨의 낙상 사고 관련 루머들을 두고 '크라켄 프로그램을 작동해 국민의힘 지지자들 중 혹시 매크로를 돌리는 사람이 있는지 단속해달라'고 말한 것에는 ""이 후보를 위해 만든 게 아니다""며 ""그럴 거면 알아서 만들어라. 딱하다""고 맞받았다. 또 이 후보의 '우리가 언론사다'라는 발언과 관련해서는 ""본인이 여론 조작으로 이득을 봤기 때문에 그것을 종용하려는 의혹을 뿌리치기 힘들 것""이라며 ""그래서 민심 왜곡 시도가 있을 거라 보는데 저는 구태에 가깝다고 생각한다""고 말했다. 매타버스(매주 타는 민생버스) 행사를 진행 중인 이 후보는 전날 부산에서 시민들과 만나 ""(언론의 영향 등으로) 상대방은 엄청나게 나쁜 짓을 해도 아무 문제가 없는 것처럼 넘어간다. 우리가 언론사가 돼야 한다""며 ""저들의 잘못을 우리의 카카오톡으로, 텔레그램방으로, 댓글로, 커뮤니티에서 열심히 쓰자""고 말했다."
2021.11.14.,"SSG닷컴, '윈터 패션위크'…겨울 옷 대규모 할인",https://n.news.naver.com/mnews/article/119/0002547791?sid=101,"ⓒSSG닷컴[데일리안 = 이나영 기자] SSG닷컴은 오는 15일부터 28일까지 2주간 스포츠 브랜드부터 백화점, 명품 브랜드를 아우르는 패션 아이템을 최대 80%까지 할인하는 ‘윈터 패션위크’ 행사를 연다.우선 15일부터 1주일간 열리는 ‘스포츠 위크’는 겨울 아웃도어 의류, 스포츠 용품 등을 중심으로 진행한다. 대표적으로 K2의 다운 자켓을 최대 75% 할인한 가격에 선보인다. 복고를 재해석한 뉴트로가 유행하면서 짧은 기장의 겉옷이 인기를 끌 것으로 예상됨에 따라 숏패딩과 플리스 상품군도 대폭 늘렸다. 이 기간 동안 SSG닷컴은 스포츠 카테고리 상품 20만원 이상 구매 고객을 대상으로 SSG머니 1만원 페이백 혜택을 제공한다.이와 함께 스포츠 용품 할인 행사도 진행한다. 대표 기획전으로는 카카오프렌즈 골프 골픽 데이 시즌오프 기획전을 마련, 골프 용품을 최대 60% 할인가에 선보이고, 최대 12% 할인 쿠폰 혜택을 제공한다.이어 22일부터는 백화점 브랜드 의류와 명품 패션 상품 위주의 ‘패션·잡화 위크’를 연다. 빈폴 레이디스 여성 의류를 최대 64% 할인한 가격에 판매하며, 랄프로렌, 올젠 등의 인기 상품을 브랜드별 특가에 선보이는 ‘백화점 남성패션 대전’도 진행한다.인기 명품 브랜드도 최대 60% 할인한 가격에 선보인다. 에르노 숏 다운패딩자켓과 몽클레어 헤르미네 여성 패딩 자켓 등 다운 점퍼부터 아크네 로고 오버사이즈 울 머플러와 같은 인기 브랜드 방한 용품이 대표적이다.이 밖에도 22일부터 1주일간 패션·잡화 카테고리 누적 주문금액이 10만원 이상인 고객은 아웃백 스테이크 기프티콘, 20만원 이상인 고객은 신세계백화점 상품권 등을 받을 수 있는 이벤트도 펼친다. 응모 후 추첨을 통해 총 200명에게 증정한다.이재은 SSG닷컴 통합마케팅팀장은 “급격히 추워진 날씨로 겨울 옷 쇼핑을 고민하는 소비자가 늘어나고 있다는 점을 감안해 행사를 진행하기로 결정했다”며 “트렌드를 반영한 다채로운 겨울 상품과 풍부한 혜택으로 꾸민 이번 행사가 소비자들에게 한 발 빠른 득템의 기회가 되기를 바란다”고 말했다."
2021.11.14.,돈버는 게임으로 전환…'MBN 전략' 통할까,https://n.news.naver.com/mnews/article/009/0004878862?sid=105,"K게임 수익모델 변화 예고'돈써야 이기는 게임' 벗어나메타버스 블록체인 NFT 활용캐릭터 육성후 현금화 가능한새로운 패러다임 전환 경쟁관련법 개정·사행성 논란 변수일단 해외시장부터 공략나서 # 최근 전 세계 게임 업계에 휘몰아친 '돈 버는(플레이투언·P2E) 게임' 열풍은 블록체인 기반 게임 '엑시인피니티'에서 시작됐다. 베트남 스타트업 스카이마비스가 개발한 엑시인피니티는 게임에서 얻은 캐릭터를 육성해 판매하고 자체 코인을 현금화하는 것이 가능하다. 게임 업계 패러다임 전환을 주도하면서 P2E 열풍을 전 세계로 확산시키고 있다. 특히 블록체인(가상화폐)과 대체불가능토큰(NFT) 기술을 접목하고 게임 내 경제 시스템(메타버스)까지 구축해 새로운 비즈니스 모델을 만들어냈다는 평가다. 베트남이나 필리핀 같은 곳에선 아예 엑시인피니티를 직업으로 삼은 이들이 대거 생겨나면서 코로나19로 어려워진 서민경제를 지탱해주는 역할까지 하고 있다. 엑시인피니티 가상화폐(AXS)의 시가총액(최대 공급 기준)은 391억달러(약 46조1184억원)에 육박하는데, 이는 국내 게임사 시총 1위인 크래프톤(약 26조원)을 뛰어넘은 수치다.국내 게임 업계에도 지각변동이 일어나고 있다. 중형 게임사뿐 아니라 메이저 게임사(엔씨소프트·넷마블)까지 일제히 열풍에 올라탄 모양새다. '돈을 쓰는(돈을 쓸수록 이기는 구조·P2W) 게임'에서 P2E로 패러다임이 빠르게 전환되면서 게임사 수익 체계 변화도 예상된다. 일각에선 2004년 논란을 일으켰던 '바다이야기'까지 소환되며 P2E 게임의 사행성을 우려하는 목소리가 작지 않아 국내 시장 확대에 장벽이 될 것이란 분석도 나온다.실제 국내 주요 게임사들은 최근 진행한 3분기 실적 발표 과정에서 미래 먹거리로 메타버스, 블록체인, NFT를 낙점하고 이들을 결합한 P2E 게임 서비스를 출시하기 위한 개발과 연구를 진행하고 있다고 공개했다. 엔씨소프트는 내년 중 NFT와 블록체인을 결합한 새로운 게임을 선보이겠다고 밝혔다. 리니지의 경우 음지에서 아이템이 거래되는 등 게임 내 경제 시스템이 구축된 상태다. 엔씨 입장에서는 아이템 거래를 양지로 끌어올리면 막대한 수수료 수익을 챙길 수 있는 기회다. 배동근 크래프톤 최고재무책임자(CFO)는 ""게임 내 가상세계 안에 있는 재화나 콘텐츠가 의미를 가지려면 게임 자체의 경쟁력이 담보돼야 한다""고 강조했다. 당분간 NFT 상품 출시보다는 가치 있는 지식재산(IP) 확대에 중점을 두겠다는 얘기다. 카카오게임즈는 게임의 기술력에 스포츠·통신장비를 결합한 분야에서 먹거리를 찾으며 차별화에 나섰다. 이를 위해 스포츠, 게임, 메타버스에 특화된 NFT 거래소도 개발하고 있다. 위메이드는 위믹스를 기축통화로 하는 블록체인 게임 100개를 출시해 자체 블록체인 생태계를 구축하겠다는 전략을 내놨고, 컴투스는 메타버스 출시를 예고했다.다만 P2E 게임 대중화에는 규제와 투기·사행성 논란을 비롯한 상당한 장벽이 있어 현재의 열기가 과열됐다는 지적도 나온다. 국내에서 게임을 출시하기 위해선 등급 분류가 필요한데 게임물관리위원회는 현금 환급이 가능한 게임의 사행성을 우려해 관련 게임에 등급을 내주지 않고 있다. 토큰 발행 자체가 어렵다는 얘기다. '게임폐인' 양성 등 각종 부작용과 채굴 집중 현상 등 사행성 논란도 넘어야 할 과제다. 게임이 생계 수단이 되면 사회문제로까지 비화될 소지가 있다. 엔씨소프트는 ""위험이나 비판 요소가 제기될 수 있어 위험 요인을 관리하면서 설계할 수 있을지 논의하고 있다""고 밝히기도 했다. 게임 업계 관계자는 ""선점 효과가 중요하기 때문에 국내 게임사의 해외 진출이 더 활발해질 것으로 본다""고 말했다."
2021.11.14.,얼굴 합성 딥페이크·온라인 그루밍 '학교폭력' 예방…'스쿨벨' 운영,https://n.news.naver.com/mnews/article/018/0005085358?sid=102,"서울시교육청·경찰청, 15일부터 '스쿨벨' 운영신종 학교폭력 정보 신속 안내 체제 구축[이데일리 오희나 기자] 서울시교육청은 서울경찰청과 협력해 선제적으로 학교폭력을 예방하기 위해 ‘신종 학교폭력 안내-스쿨벨 시스템’을 오는 15일부터 운영하기로 했다고 14일 밝혔다. 스쿨벨은 최근 들어 사회적으로 크게 문제가 되는 얼굴 합성 딥페이크, 온라인 그루밍 등 신종 학교폭력을 서울시교육청 소속 초·중·고 학생, 학부모, 교사에게 신속하게 안내해 학교폭력을 선제적으로 예방하기 위한 프로그램이다. 스쿨벨의 명칭은‘학교종이 울리면 학생·학부모·교사 모두 주의를 기울인다는 의미’로 학생 및 SPO 공모를 통해 선정됐다.서울시교육청과 서울경찰청은 새로운 유형의 학교폭력 피해 사례가 빠르게 증가하는 데 비해 학생들이 유사 사례를 알지 못해 추가 피해가 발생하거나, 피해가 확산된 이후에 대책을 마련하는 등의 문제점을 해결하기 위해 고심했다. 그 대응책으로 스쿨벨을 통해 학생들의 눈높이에 맞게 다양한 사례들을 신속하게 제공하는 방안을 마련했다.  스쿨벨 TF팀에서 2개월마다 서울시교육(지원)청·117 신고센터·SPO 활동 등에서 확인한 다양한 학교폭력 사례 중 신속하게 전파해야 하는 내용 중심으로 공유사례를 선정하고, 학생 눈높이에 맞고 온·오프라인 활용이 가능한 카드뉴스 및 포스터 형식의 자료로 제작한다. 학교는 스쿨벨 자료를 학교 홈페이지, 학교 e-가정통신문 등을 통해 학생 및 학부모에게 안내할 예정이다. 서울시경찰청에서는 학교 전담 경찰관(SPO)과 협조해 학교 방문 시 홍보 자료로 활용하고, SNS 채널을 개설(카카오톡 채널 ‘스쿨벨’)해 자료 탑재·실시간 소통과 홍보를 가능하도록 했다.서울시교육청은 “이번 사업이 지속적으로 이어져 학교 구성원들에게 학교폭력에 대한 이해와 경각심을 높이고 선제적으로 학교폭력을 예방하는 대표적인 협업 사례로 자리잡기를 기대한다”고 밝혔다."
2021.11.14.,"이준석, '킹크랩' 잡는 '크라켄' 발표…""與, 여론공작 포기하길""",https://n.news.naver.com/mnews/article/008/0004670194?sid=100,"[[the300]](서울=뉴스1) 이동해 기자 = 이준석 국민의힘 대표가 14일 국회 의원회관 제2소회의실에서 열린 ‘20대 대선 여론조작 방지를 위한 온라인 싸드, 크라켄 공개’행사에서 인사말을 하고 있다. 2021.11.14/뉴스1  국민의힘이 댓글 조작 의심 행위를 포착하는 자체 개발 프로그램인 '크라켄'을 14일 공개했다. 이준석 국민의힘 대표는 ""더불어민주당은 이번 대통령 선거에서는 어쭙잖은 여론 공작이나 민심 왜곡에 대한 투자를 포기하기를 바란다""고 경고했다. 국민의힘은 이날 오후 국회 의원회관 소회의실에서 크라켄 프로그램 공개 기자회견을 열었다. 이 대표와 디지털정당위원회(디정위) 위원장인 이영 국민의힘 의원 등이 참석했다. 크라켄은 이 대표의 대선 비책인 '비단주머니' 1호 프로젝트다. 지난 대선에서 논란을 일으킨 매크로(자동실행 불법프로그램) 등을 이용한 댓글 조작 프로그램 '킹크랩'을 의식해 이름을 붙였다. 상상 속 바다 괴물인 크라켄으로 킹크랩을 먹어버리겠다는 뜻을 담았다. 이날 회견에서는 크라켄 프로그램의 작동 과정 설명, 실제 시연 등이 이뤄졌다. 이영 의원은 ""다들 아시겠지만 2017년 대통령 선거와 2018년 지방 선거 때 민주당은 댓글 조작 프로그램인 킹크랩을 이용해 무려 118만개의 댓글과 8840만개가 넘는 기사 추천으로 여론을 조작했다""며 ""대한민국의 대표적인 당이 이렇게 조직적으로 여론 조작을 해서 선거에 영향을 미쳤다는 것 자체가 굉장히 부끄러운 일이 아닐 수 없다""고 말했다. 이어 ""다시 한번 대한민국 정치사에 이런 일이 있어서는 안 되겠다는 게 국민의힘 입장""이라며 ""그래서 디정위는 디지털로 된 무기와 도구를 개발했다. 도구는 후보가 좀 더 빛날 수 있게 하는 서비스이고 무기는 공격에 대한 방어를 하는 것이다. 그 무기 중 하나가 바로 크라켄""이라고 소개했다. (서울=뉴스1) 이동해 기자 = 이준석 국민의힘 대표와 이영 디지털소통위원장이 14일 오후 서울 여의도 국회의원회관에서 비단주머니 1호인 '크라켄'을 공개하고 있다. 2021.11.14/뉴스1  이 의원은 ""크라켄은 주요 키워드를 가지고 포털들의 기사 댓글들을 크롤링(Crawling·웹상의 각종 정보를 자동화된 방법으로 수집해 분류하는 기술)한다. 그리고 크롤링한 데이터들은 AI(인공지능)를 기반으로 이상 행위를 자동 분석한다""며 ""이후 전문 모니터링을 할 수 있는 요원에 전달한다. 전문가인 분석관 3명이 실제로 크로스체크(교차점검)를 한 다음에 부정 댓글임이 확실시되면 선거관리위원회에 신고하는 구조""라고 설명했다. 또 ""보통 동일한 IP(인터넷프로토콜)에서 다수의 사이트에 동시에 접속돼 댓글을 올리는 경우라거나 아니면 동일 사이트에서 닉네임은 같은데 같은 문장의 댓글이 동시다발로 생기면 의심스럽게 본다""며 ""50개씩 뽑아내 그중 의심스러운 계정들이 현재 어떤 활동들을 하는지 알아낸다""고 밝혔다. 국민의힘은 12월부터 본격적으로 크라켄을 가동할 계획이다. 이 의원은 ""아직 당내에 대선 캠프가 제대로 만들어지지 않아서 지금은 성능 테스트 등을 하고 있다""며 ""11월까지는 시범 서비스를, 12월1일부터 본격 설치할 예정""이라고 밝혔다. 이 대표는 이날 크라켄 가동의 상징성을 강조하며 '드루킹 댓글 조작 사건'을 상기시키고 현 정권의 정통성을 문제 삼았다. 이 대표는 모두발언에서 ""대선 때마다 반복되는 여론 조작 시도야말로 민주주의에 대한 중대한 도전""이라며 ""문재인 정부는 대통령의 최측근이라고 알려진 김경수 전 경남도지사가 드루킹의 제안으로 댓글 부대를 운영하다가 본인이 감옥 가고 정부 정통성에 큰 흠집을 냈다. 저는 대선이 끝난 뒤 이런 사람들을 잡아 벌주는 것은 약하다고 생각한다""고 말했다.이어 ""(크라켄으로 댓글 조작을) 거의 완벽하게 잡아낼 수 있다고 자신한다""며 ""여론 조작 부분을 매우 엄격히 다루고 발견한 부분에 대해서는 선관위 고발, 수사 요구 등 여러 조치를 취하겠다""고 했다. 이 대표는 또 송영길 민주당 대표가 이재명 대선 후보의 부인 김혜경씨의 낙상 사고 관련 루머들을 두고 '크라켄 프로그램을 작동해 국민의힘 지지자들 중 혹시 매크로를 돌리는 사람이 있는지 단속해달라'고 말한 것에는 ""이 후보를 위해 만든 게 아니다""며 ""그럴 거면 알아서 만들어라. 딱하다""고 맞받았다. 또 이 후보의 '우리가 언론사다'라는 발언과 관련해서는 ""본인이 여론 조작으로 이득을 봤기 때문에 그것을 종용하려는 의혹을 뿌리치기 힘들 것""이라며 ""그래서 민심 왜곡 시도가 있을 거라 보는데 저는 구태에 가깝다고 생각한다""고 말했다. 매타버스(매주 타는 민생버스) 행사를 진행 중인 이 후보는 전날 부산에서 시민들과 만나 ""(언론의 영향 등으로) 상대방은 엄청나게 나쁜 짓을 해도 아무 문제가 없는 것처럼 넘어간다. 우리가 언론사가 돼야 한다""며 ""저들의 잘못을 우리의 카카오톡으로, 텔레그램방으로, 댓글로, 커뮤니티에서 열심히 쓰자""고 말했다."
