기사날짜,기사제목,네이버 뉴스 url,기사내용
2021.04.23.,[주요 신문 사설](23일 조간),https://n.news.naver.com/mnews/article/001/0012348657?sid=110,"▲ 경향신문 = 기후회의서 약속한 온실가스 감축 목표, 반드시 실천해야                  정치적 의사표시 옥죄는 선거법 조항, 이번엔 꼭 없애야                  최숙현 선수 죽음 산재 인정이 스포츠계에 던진 과제    ▲ 국민일보 = 안전성 담보되면 러시아산 백신 도입 적극 검토하길                  여당 지도부의 성추행 사과, 더 이상 아픔 줘선 안 돼                  전직 대통령 사면, 국민 공감대 속에 추진돼야    ▲ 서울신문 = 미국에도 이롭지 않은 반인권적 '백신이기주의'                  탄핵불복론까지 국민의힘은 '도로 새누리당'인가                  궤변·협박 이상직, 의원직부터 내놔야    ▲ 세계일보 = 안전성 검증 안 된 러시아 백신 도입 서두를 일 아니다                  재보선 승리 보름 만에 퇴행 조짐 보이는 국민의힘                  외교수장이 ""北 GP 총격, 굉장히 절제했다""고 말해서야    ▲ 아시아투데이 = 정부, 백신 안전과 물량 확보에 올인해야                      文, 북·중에 대해서도 비핵화 협력 촉구해야    ▲ 조선일보 = 바이든에게 ""트럼프 계승하라""며 백신 지원 기대할 수 있겠나                  이번엔 北 총격이 ""사소"", 말 事故 주워 담기 바쁜 鄭 외교                  수사권 조정 넉 달, 권력에 대한 수사권 해체로 가고 있다    ▲ 중앙일보 = 한·미 정상회담 앞두고 동맹 흔드는 발언 할 땐가                  대통령의 '백신 약속'조차 이젠 못 믿겠다    ▲ 한겨레 = 기후정상회의, 한국의 공허한 온실가스 감축 약속                백신 확보, 모든 가능성 열어놓고 전방위 대응을                쿠팡 '동일인', 실제로 지배하는 김범석 지정해야    ▲ 한국일보 = 국민의힘, 선거 승리 후 벌써 과거로 회귀하나                  백신 접종 후유증, 정부가 책임진다는 자세 가져야                  온실가스 감축 확대, 피하기 어려운 선택이다    ▲ 디지털타임스 = 정부, 백신약속 믿어달란식으론 국민불안 해소 못한다                      AI 발목잡는 법 정비 없인 '4차산업 선도' 몽상이다    ▲ 매일경제 = 한탕주의가 부른 코인 투기광풍, 누군가에겐 폭탄이 될 것                  백신 확보에 민간 네트워크 100% 활용하라                  文정부 마지막 최저임금 협상, 정치목표 아닌 경제현실 봐야    ▲ 서울경제 = 선거 패배 탓하며 금리 낮추라는 몰염치 정치금융                  암호화폐 광풍…민관 공동 가이드라인 만들어라                  ""北, GP 총격 굉장히 절제했다""는 외교 수장의 궤변    ▲ 이데일리 = 대출금리 내리라고 압박하는 여당, 시대착오 아닌가                  연금개혁, 말풍선만 날리는 정부와 국회 모두 문제다    ▲ 전자신문 = 카카오 마이데이터 족쇄, 빨리 풀어야                  '제2 벤처 붐' 만들어 보자    ▲ 한국경제 = 美, 백신 지원 '쿼드國 우선'…냉엄한 현실 직시해야                  국민 75% ""조세 불공정""…'큰 정부'가 자초한 신뢰 위기다                  ""北, 굉장히 절제한 도발""이라니 대한민국 장관이 할 소린가    ▲ e대한경제 = 文 정부의 '중국 우선' 전략에 더욱 불안해진 북핵·백신·오염수                   재건축 규제 완화하되 토지거래허가제로 부작용 최소화해야(서울=연합뉴스)▶네이버에서도 뉴스는 연합뉴스[구독 클릭]▶[팩트체크] 강원도에 차이나타운 건설?▶제보하기<저작권자(c) 연합뉴스(https://www.yna.co.kr/), 무단 전재-재배포 금지>"
2021.04.23.,"[제보는 MBC] ""장애아들 찾아달라"" 파출소 갔다가 '생이별' 위기",https://n.news.naver.com/mnews/article/214/0001114490?sid=102,"[뉴스데스크]◀ 앵커 ▶제보는 MBC입니다.발달 장애를 앓고 있는 아이가 실종돼서 필리핀 출신 엄마가 경찰에 도움을 청하러 갔는데 오히려 이 엄마가 '미등록 외국인'이라는 이유로 붙잡혔습니다.아이는 집으로 돌아왔지만 이제, 엄마가 집에 없는 겁니다.엄마는 강제로 쫓겨날 처지였다가 조금 전, 풀려났는데요.과연 이게, 법대로 할 일인지 그럼 정말, 법대로 했는지 김건휘 기자가 취재했습니다.◀ 리포트 ▶어제 오후, 필리핀인 엄마 A씨는 다급한 연락을 받았습니다.발달장애가 있는 6학년 아이가 사라져 학교가 경찰에 신고했다는 겁니다.엄마는 바로 파출소로 달려 갔습니다.경찰은 아이에 대해 묻던 중 갑자기 서류에 서명을 하라고 했습니다. 통역도 없는 상황에서 서명하지 않으면 체포할거라고 했습니다. 실종된 아이를 찾으러 온 여성은, 이곳에서 경찰차에 태워져 출입국 외국인청으로 끌려갔습니다.A 씨가 미등록 외국인이었기 때문입니다.A씨의 두 아이는 모두 발달장애가 있는 초등학생. 엄마와 떨어진 적 없던 아이들은 불안에 떨고 있습니다.[강다영/미등록 이주민 활동가]""경찰 아저씨는 원래 착한 사람으로 알고 있는데 왜 엄마를 괴롭히지?…둘째같은 경우는 하루 종일 그날 잠도 안 자고 울었다고 하더라고요…""갑자기 혼자 두 아이를 돌보게 된 아빠도 난감한 상황입니다.아빠 역시 미등록 외국인이란 게 드러나면서 일자리를 잃게 됐습니다. [아이 아버지]""우리 아이들은 발달 장애가 있어요. 정신 연령은 3살 수준이고, 아무 것도 몰라요…엄마에게 무슨 일이 생겼는지도 몰라요.""경찰은 안타까운 상황이긴 하지만 지침 대로 했을 뿐이라는 입장입니다.하지만 엄마를 체포할 때 경찰이 법을 위반했다는 지적도 나왔습니다.A씨는 통역이 가능한 활동가와 함께 조사 받게 해달라고 했지만, 파출소 안에 들어오지도 못하게 했다는 겁니다. [강다영/미등록 이주민 활동가]""(제가) 제3자이기 때문에 (출국 서약서가) 기밀문서이기 때문에 알려줄 수 없다 하고 내쫓았고. 문을 잠가버리셨거든요. 들어가지 못 하게.""미란다 원칙도 제때, 제대로 된 방식으로 고지하지 않았고, 통역 없이 조사를 받게 한 건 국제법 위반이란 의견도 있습니다.[신희석 국제법 박사/연세대 법학연구원 전문연구원]""비엔나 협약 36조에 따르면, 외국인을 구금할 경우에는 자국 영사관의 보호를 받을 권리가 있고…경찰이나 당국에서 본인한테 알려줘야 합니다.""오전까지만 해도 A씨의 구금해제는 절대 불가능하다던 출입국외국인청은 MBC 보도가 결정되자 조금전 아무런 설명없이 A씨를 풀어줬습니다. MBC뉴스 김건휘입니다. (영상취재 : 고헌주 / 영상편집 : 신재란)MBC 뉴스는 24시간여러분의 제보를 기다립니다. ▷ 전화 02-784-4000▷ 이메일 mbcjebo@mbc.co.kr▷ 카카오톡 @mbc제보김건휘 기자(gunning@mbc.co.kr)[저작권자(c) MBC (https://imnews.imbc.com) 무단복제-재배포 금지]▶ 네이버 홈에서 [MBC뉴스] 채널 구독하기▶ 새로움을 탐험하다. ""엠빅뉴스""▶ [공개가 곧 감시] 2021 국회의원 재산공개Copyright(c) Since 1996, MBC&iMBC All rights reserved."
2021.04.23.,"유럽, 백신 공급 지연 소송…일부 봉쇄 완화",https://n.news.naver.com/mnews/article/214/0001114282?sid=104,"[뉴스투데이]◀ 앵커 ▶코로나19 백신 공급이 당초 계획보다 늦춰지면서 유럽연합이 아스트라제네카를 상대로 소송 절차에 돌입했습니다.이런 가운데 프랑스와 이탈리아 등 일부 유럽국가는 3차 유행의 정점이 지났다는 판단 아래 봉쇄를 조금씩 풀기로 했습니다.전재홍 기자가 보도합니다.◀ 리포트 ▶유럽연합 집행위원회가 아스트라제네카를 상대로 코로나19 백신 공급 지연과 관련한 소송에 착수했습니다.올 1분기까지 1억 회분의 백신을 유럽연합에 공급하기로 했지만, 30%인 3천만 회분만 전달됐기 때문입니다.[케이르스마커/EU 집행위 보건분야 대변인]""중요한 건 아스트라제네카가 계약된 기간에 충분한 수량을 공급해야 한다는 것입니다.""집행위는 소송을 위해 며칠 동안 회원국들로부터 소송 동의 서명을 받아 법적 절차를 밟을 계획인데, 이미 다수의 회원국들은 지지 의사를 표명한 상황입니다.'역외 수출 금지' 카드까지 꺼내 들며 공급량을 맞추라고 요구해 온 유럽연합 입장에선 소송의 실효성 보다 아스트라제네카에 대한 압박 수위를 한층 더 높인 것이라는 분석입니다.이런 가운데, 프랑스 등 유럽 일부 국가들은 이동 제한 조치를 완화하고 나섰습니다.프랑스는 주거지에서 반경 10㎞ 이상의 이동을 금지한 조치를 5월 3일부터 해제하고 중학교와 고등학교에 대한 등교도 재개할 예정입니다.하지만, 오후 7시부터 다음날 오전 6시까지의 통행금지 조치는 유지한다고 밝혔습니다.[장 카스텍스/프랑스 총리]""프랑스의 보건 상황은 개선되고 있습니다. 지난 열흘 동안 바이러스 전파가 현저히 줄어들었습니다.""이탈리아도 전면 금지됐던 주 단위간 이동을 오는 26일부터 바이러스 확산 위험이 낮은 지역 사이에는 허용한다고 밝혔습니다.다만, 오후 10시부터 다음날 새벽 5시까지 적용되는 야간 통행금지는 현행대로 유지하기로 했습니다.이탈리아 내부에선 하루 사망자가 3백여 명에 달할 만큼 바이러스 확산세가 이어지는 가운데, 정부가 거꾸로 규제를 완화하며 안일하게 대응하는 것 아니냐는 비판의 목소리가 나오고 있습니다.MBC뉴스 전재홍입니다.MBC 뉴스는 24시간 여러분의 제보를 기다립니다. ▷ 전화 02-784-4000▷ 이메일 mbcjebo@mbc.co.kr▷ 카카오톡 @mbc제보전재홍 기자(bobo@mbc.co.kr)[저작권자(c) MBC (https://imnews.imbc.com) 무단복제-재배포 금지]▶ 네이버 홈에서 [MBC뉴스] 채널 구독하기▶ 새로움을 탐험하다. ""엠빅뉴스""▶ [공개가 곧 감시] 2021 국회의원 재산공개Copyright(c) Since 1996, MBC&iMBC All rights reserved."
2021.04.23.,줄이겠다고 했지만…수치는 못 내놓은 '세계 9위' 한국,https://n.news.naver.com/mnews/article/214/0001114487?sid=100,"[뉴스데스크]◀ 앵커 ▶어제 정상 회의에는 문재인 대통령도 참석해서 한국도 더 많은 온실 가스를 줄이겠다고 선언 했습니다. 하지만 다른 나라들과 달리 구체적인 목표 수치를 내놓지 못해서, 국제적 흐름에 뒤쳐지고 있다는 비판이 나오고 있습니다.이어서 남상호 기자가 취재했습니다.◀ 리포트 ▶기후변화 정상회의에 참석한 각국 정상들. 온실가스 감축 목표치를 경쟁적으로 높여 내놨습니다.영국은 68%에서 78%로, 일본은 26%에서 46%로, 미국도 2005년보다 50% 이상 줄이겠다고 밝혔습니다.한국은 어땠을까?[문재인]""한국은 2030 국가 온실가스 감축목표, NDC를 추가 상향하여 올해 안에 UN에 제출할 것입니다.""구체적인 수치를 내놓지 못했습니다.그냥 올해 안에 제출하겠다고만 했습니다.한국의 온실가스 배출 1위 기업은 포스코. 2위부터 6위까지는 남동발전, 동서발전 등 모두 발전회사들입니다.전체 탄소 배출량의 30% 이상이 석탄화력발전에서 나옵니다.국제 사회의 압박이 이어지자, 한국도 신규 석탄발전소 건설과, 해외 석탄투자를 중단하겠다고 선언했습니다.하지만 이미 계약이 체결된 인도네시아와 베트남의 석탄발전소 투자, 그리고 국내에 짓고 있는 7개의 초대형 석탄화력발전소는 중단하지 않기로 했습니다.[김주진/기후솔루션 대표]""우리 기후 위기, 우리나라의 국제적 위상을 고려해봤을 때 즉시 중단해야 될 것으로 보이는데, 정부가 이 상황을 수수방관하는 것은 안타까운 상황입니다.""탄소 감축은 이제 생존과 경쟁력 문제가 됐습니다. 미국과 유럽은 생산 과정에서 온실가스를 많이 배출한 제품에는 '탄소국경세'를 매기기로 했습니다.새로운 무역장벽이 생기는 겁니다.배터리가 첫 대상이 될 것으로 보여, 한국 기업들이 타격을 입을 수 있습니다.[정귀일/무역협회 연구위원]""제품의 전 주기 탄소 배출량을 점검하고 온실가스 감축방안을 마련하는 한편, 탄소 저감 노력이 기업 생존과 직결된다고 인식을 해야되고요.""한국의 온실가스 배출량은 2019년 기준 세계 9위입니다.MBC뉴스 남상호입니다.(영상취재: 송록필/영상편집: 최승호)MBC 뉴스는 24시간여러분의 제보를 기다립니다. ▷ 전화 02-784-4000▷ 이메일 mbcjebo@mbc.co.kr▷ 카카오톡 @mbc제보남상호 기자(porcorosso@mbc.co.kr)[저작권자(c) MBC (https://imnews.imbc.com) 무단복제-재배포 금지]▶ 네이버 홈에서 [MBC뉴스] 채널 구독하기▶ 새로움을 탐험하다. ""엠빅뉴스""▶ [공개가 곧 감시] 2021 국회의원 재산공개Copyright(c) Since 1996, MBC&iMBC All rights reserved."
2021.04.23.,"바이든의 압박에 맞받아친 시진핑…""선진국 책임 더 커""",https://n.news.naver.com/mnews/article/214/0001114486?sid=104,"[뉴스데스크]◀ 앵커 ▶최근 사사건건 부딪치고 있는 미국의 바이든 대통령과 중국 시진핑 주석이 화상으로 열린 기후정상회의에서 처음으로 마주했습니다.두 나라, 탄소 배출량 세계 1, 2위 이기도 한데요.바이든 대통령은 ""큰 나라가 앞장서야 한다""면서 중국을 압박했고, 시진핑 주석은 ""서방 선진국의 책임이 더 크다""면서 맞받아쳤습니다.베이징 김희웅 특파원이 취재했습니다.◀ 리포트 ▶회의를 주재한 바이든 대통령은 개막 연설에서 탄소 배출 감축 목표치를 기존의 두 배까지 끌어올렸습니다.[바이든/미국 대통령]""미국은 온실가스를 십 년 안에 반으로 줄이는 것을 목표로 하고 있습니다.""그러면서 탄소 배출 1위인 중국을 압박했습니다.[바이든/미국 대통령]""특히 세계에서 경제규모가 가장 큰 국가들이 앞장서야 합니다.""미국에 동조해 일본, 유럽연합, 캐나다 등도 기존보다 목표치를 높여 제시했습니다.중국 시진핑 주석도 협력하겠다고 밝혔지만, 목표치를 높이지는 않았습니다.오히려 미국 같은 선진국들과는 차별화된 기준을 적용받아야 한다고 주장했습니다.[시진핑/중국 국가주석]""공동의 의무지만 책임은 차별화돼야 합니다. 기후문제에 대한 개발도상국의 공헌을 인정해줘야 합니다.""서방 선진국이 먼저 시작한 산업화 과정에서 이미 더 많은 탄소를 배출해온 만큼, 지금 발전 단계에 있는 국가들이 같은 수준의 의무를 요구받는 건 부당하다는 겁니다.다만 미국이 탄소 중립을 목표로 하는 데 43년을 제시했는데, 중국은 더 짧은 30년 안에 이뤄 내겠다고 제시했습니다.그를 위해 최대 에너지원인 석탄 발전을 엄격하게 통제하겠다고 밝혔습니다.미국이 인권 문제처럼 기후 문제로 중국을 정치적으로 공격하는 것에 대한 견제에 나선 겁니다. 기후 협력에 있어서도 미국에 끌려다니지 않겠다는 의지를 드러낸 것으로, 향후 구체적 실행 과정에서의 미중 간 갈등이 예고돼 있다는 해석입니다.베이징에서 MBC뉴스 김희웅입니다.(영상편집: 김태우)MBC 뉴스는 24시간 여러분의 제보를 기다립니다. ▷ 전화 02-784-4000▷ 이메일 mbcjebo@mbc.co.kr▷ 카카오톡 @mbc제보김희웅 기자(hwoong@imbc.com)[저작권자(c) MBC (https://imnews.imbc.com) 무단복제-재배포 금지]▶ 네이버 홈에서 [MBC뉴스] 채널 구독하기▶ 새로움을 탐험하다. ""엠빅뉴스""▶ [공개가 곧 감시] 2021 국회의원 재산공개Copyright(c) Since 1996, MBC&iMBC All rights reserved."
2021.04.23.,"""다 바꾼다더니""…알맹이 없는 여야 '쇄신'",https://n.news.naver.com/mnews/article/214/0001114405?sid=100,"[뉴스외전]◀ 앵커 ▶재보선이 끝나고 2주가 넘게 지났지만 나란히 쇄신을 공언했던 여야 정치권의 혁신 속도가 더디다는 평가가 나오고 있습니다.이학수 기자입니다.◀ 리포트 ▶민주당 초선 의원들이 재보선 참패 13일만에 당 쇄신안을 지도부에 제시했습니다. [고영인/더불어민주당 초선 의원 모임 운영위원장]""당 지도부에 당의 근본적이고 지속적인 쇄신안 마련을 위한 당 쇄신위원회를 구성할 것을 요구한다.""당정청 관계에서 민심이 반영되도록 당이 주도성을 발휘하고, 당내 민주주의 강화 요구도 덧붙였습니다.2주 가까이 논의한 결론치고는 원론적이라는 평가가 나왔습니다.관심을 모은 부동산 정책과 검찰개혁 등의 방향과 속도, 그리고 이른바 조국사태와 강성 지지층 문제 등 민감한 현안에 대한 입장은 없었습니다.[권인숙/더불어민주당 의원]""어떤 수위에서 다뤄지는 게 좋을지에 대해서 지금은 논의중인 부분이어서 아직 결론이 난 부분은 아닙니다.""유일하게 구체적인 건 박원순·오거돈 전 시장의 성 비위 사건에 대해 진정성 있는 사과를 촉구한 대목이었습니다.마침 현충원을 참배한 윤호중 원내대표가 ""피해자님께 진심으로 사과드린다""고 적었지만, 일부 피해자가 ""도대체 왜 현충원에서 사과를 하냐""며 ""너무나 모욕적""이라고 반발해 사과 의미조차 일단 퇴색됐습니다.당대표 선거에 나선 주자들도 구체적인 노선 제시는 없이 '민생', '개혁', '다 바꾼다' 같은 추상적인 구호만 반복하고 있다는 평가입니다.역시 지도부 교체를 앞둔 국민의힘도 어수선하기는 마찬가집니다. 때마침 불거진 전직 대통령 사면론에 원내대표 후보 4명이 모두 동조하고 나섰는데, 제안의 시점과 우선 순위에서 모두 부적절하다는 우려가 당내에서도 나왔습니다. [김웅/국민의힘 의원]""현안이 산적한 상태에서 사면론을 지금 꺼내는 것은 국민들의 어려운 민생이나 이런 부분들 하고는 잘 안맞는다고 생각해요.""무소속 홍준표 의원까지 ""부끄러운 조상도 내 조상""이라며 사면을 촉구하자, ""탄핵 부정이나 사면 요구가 최선은 아니""라는 청년 비대위원의 반박이 나오는 등 논란이 커지고 있습니다. MBC뉴스 이학수입니다. MBC 뉴스는 24시간 여러분의 제보를 기다립니다. ▷ 전화 02-784-4000▷ 이메일 mbcjebo@mbc.co.kr▷ 카카오톡 @mbc제보이학수 기자(tchain@mbc.co.kr)[저작권자(c) MBC (https://imnews.imbc.com) 무단복제-재배포 금지]▶ 네이버 홈에서 [MBC뉴스] 채널 구독하기▶ 새로움을 탐험하다. ""엠빅뉴스""▶ [공개가 곧 감시] 2021 국회의원 재산공개Copyright(c) Since 1996, MBC&iMBC All rights reserved."
2021.04.23.,"바닷물 방사능 감시 강화…""더 자주, 더 빨리""",https://n.news.naver.com/mnews/article/214/0001114284?sid=102,"[뉴스투데이]◀ 앵커 ▶일본 정부가 후쿠시마 오염수를 방류하기로 결정하면서 우리나라를 비롯해 국제 사회의 우려가 커지고 있죠.과학계도 서둘러 대응 방안을 내놨습니다.일본에서 우리나라로 유입되는 바닷물의 감시체계를 강화하고 오염수의 방사성 물질을 신속하게 분석하는 기술을 활용해 대응할 계획입니다. 이승섭 기자입니다.◀ 리포트 ▶한국원자력안전기술원 해양방사능분석실.우리나라 해역 32개 지점에서 채취한 바닷물 시료에서 방사능 농도를 측정하고 있습니다. 한국원자력안전기술원은 지난해 일본 정부가 후쿠시마 오염수 방류를 검토하기 시작한 이후 최대 1년이었던 바닷물 방사능 측정 주기를 2주로 앞당겼습니다.바닷물은 물론, 해양 생물과 해저 퇴적물을 분석해 우리 해역에서의 방사능 농도 변화를 예의주시하고 있습니다.[김대지/한국원자력안전기술원 환경방사능평가실장]""과거 5년 정도의 농도 범위에서 5배를 초과한다든지 또는 현재까지 검출되지 않았던 방사능이 검출된다든지 그런 경우에는 (정부에 보고합니다.)""바닷물 감시의 핵심은 일본의 오염수에 함유된 1급 발암물질인 세슘과 스트론튬을 찾는 것.스트론튬 검출은 3주 넘게 걸릴 정도로 분석이 까다로운데, 국내 연구진은 이를 이틀 만에 확인하는 기술까지 확보했습니다. 정부는 과학 기술을 활용해 일본 후쿠시마 오염수 방류를 대비한 감시 체계를 더 촘촘히 가동한다는 계획입니다.[용홍택/과학기술정보통신부 제1차관, 지난 20일]""(기존 분석법에) 스트론튬-90 신속 분석법을 병행해서 적용하는 방법 등 우리 해역에 대한 방사능 감시와 추적을 신속하게 이행하는 방안에 대한 (검토를 하겠습니다.)""또 일본 정부에 오염수의 세부 정보를 지속적으로 요구하고, 이에 대응하기 위한 연구개발 투자도 강화하기로 했습니다. MBC뉴스 이승섭입니다.MBC 뉴스는 24시간 여러분의 제보를 기다립니다.▷ 전화 02-784-4000▷ 이메일 mbcjebo@mbc.co.kr▷ 카카오톡 @mbc제보이승섭 기자[저작권자(c) MBC (https://imnews.imbc.com) 무단복제-재배포 금지]▶ 네이버 홈에서 [MBC뉴스] 채널 구독하기▶ 새로움을 탐험하다. ""엠빅뉴스""▶ [공개가 곧 감시] 2021 국회의원 재산공개Copyright(c) Since 1996, MBC&iMBC All rights reserved."
2021.04.23.,"광주은행, 우수 창구직원과 소통의 시간 가져",url없음,<네이버 기사 없음>
