기사날짜,기사제목,네이버 뉴스 url,기사내용
2021.04.15.,美 최대 가상화폐거래소 ‘코인베이스’ 나스닥 데뷔…첫날 31% 급등,https://n.news.naver.com/mnews/article/020/0003351383?sid=101,"미국 최대 가상화폐 거래소 ‘코인베이스’가 뉴욕증시 상장 첫날 30% 넘게 급등하며 가상화폐 제도권 진입의 첫발을 성공적으로 내딛었다. 하지만 한국, 미국 등 중앙은행 수장들은 가상화폐 투자 과열에 대한 우려를 나타내며 “가치가 없다”고 재차 강조했다.  14일(현지 시간) 코인베이스는 기업공개(IPO)를 거치지 않고 직접 주식을 매도하는 방식으로 나스닥시장에 직상장했다. 직상장 공모가에 해당하는 준거 가격(250달러)에 비해 31.3% 상승한 328.38달러에 거래를 마쳤다. 이날 코인베이스는 381달러에 거래를 시작해 장 초반 429.54달러까지 치솟기도 했다.  상장 첫날 시가총액은 857억8000만 달러(약 95조7000억 원)로 불었다. 코인베이스가 2018년 자금을 유치했을 때 기업가치 80억 달러를 평가받은 것을 고려하면 3년 만에 기업가치는 10배 이상으로 치솟은 셈이다.  미국 가상화폐 거래소 중 최초로 증시에 상장한 코인베이스는 2012년 설립돼 전 세계 100개 이상 국가에 5600만 명이 넘는 이용자를 두고 있다. 이날 코인베이스 창업자이자 최고경영자(CEO)인 브라이언 암스트롱의 재산도 약 19조 원으로 늘어났다.   한국의 ‘서학개미’들도 이날 코인베이스 주식을 2592만 달러어치 순매수하며 주가 상승세에 동참했다. 미래에셋대우, NH투자증권, 삼성증권, 신한금융투자, 하나금융투자, 키움증권 등 6개 증권사에서 국내 투자자들이 사들인 코인베이스 주식은 4866만 달러어치이며, 이중 2274만 달러를 매도한 것으로 집계됐다.  코인베이스가 나스닥시장에 화려하게 입성하면서 그동안 제도권 밖에 머물렀던 가상화폐에 대한 기대감은 더욱 커지고 있다. 정민기 삼성증권 연구원은 “페이팔, 테슬라, 스타벅스 등 글로벌 기업이 가상화폐 결제를 기능을 탑재하고 제도권 운용사들이 비트코인 상장지수펀드(ETF) 출시를 준비하고 있다”며 “코인베이스의 상장은 가상화폐의 제도권 편입이라는 ‘메가 트렌드’의 첫 이정표로 작용할 것”이라고 강조했다.   코인베이스 외에도 미국 크라켄, 이스라엘 이토로 등 가상화폐 거래소가 상장 계획을 밝혔다. 국내에서도 가상화폐 거래소 업비트를 운영하는 두나무가 나스닥 상장을 추진하고 있다. 15일 코인베이스 반사 효과로 국내 증시에서는 두나무 지분을 보유한 카카오, 한화투자증권 등의 주가가 크게 뛰었다.   하지만 코인베이스의 상장 첫날 미 연방준비제도(Fed·연준)의 제롬 파월 의장은 워싱턴경제클럽과의 인터뷰에서 “가상화폐는 투기를 위한 수단이며 결제수단으로 활발히 사용되고 있지 못하다”고 지적했다. 파월 의장은 지난달에도 “가상화폐는 변동성이 커 가치저장 수단으로 유용하지 않다. 달러화보다 금의 대체재인 투기적 자산에 가깝다”고 밝힌 바 있다.  이주열 한국은행 총재도 15일 기자간담회에서 “비트코인 등 암호자산(가상화폐)이 지급 수단으로 사용되는 데에는 제약이 아주 많고 또 내재가치가 없다는 입장은 변한 게 없다”고 강조했다. 그러면서 “암호자산에 대한 투자가 과도해진다면 투자자들에 대한 관련 대출이 부실화될 가능성이 있고, 금융 안정 측면에서도 리스크가 큰 것이 사실”이라고 덧붙였다.  금융위원회도 이날 국내 일부 가상화폐 거래소가 폐업할 가능성이 있다며 주의를 당부했다. 또 가상화폐 투자 설명회를 통한 투자 사기에도 유의하라고 강조했다. 박희창기자 ramblas@donga.com김민기자 kimmin@donga.com▶ 네이버에서 [동아일보] 채널 구독하기▶ 당신의 소중한 순간을 신문으로 만들어 드립니다▶ 멀티미디어 스토리텔링 ‘The Original’ⓒ 동아일보 & donga.com, 무단 전재 및 재배포 금지"
2021.04.15.,"미래에셋증권, ELW 141개 종목 신규 상장",https://n.news.naver.com/mnews/article/421/0005290089?sid=101,"미래에셋증권 본사가 위치한 서울 중구 수하동 미래에셋 센터원 빌딩. 2016.12.30/뉴스1 © News1 유승관 기자(서울=뉴스1) 박응진 기자 = 미래에셋증권은 주식워런트증권(ELW) 141개 종목의 신규 상장을 완료했다고 15일 밝혔다.이번에 상장한 종목은 코스피200지수를 기초자산으로 하는 지수형 콜 43개 종목과 풋 36개 종목, 삼성전자·SK하이닉스·현대차 등을 기초자산으로 하는 종목형 콜 45개 종목과 풋 17개 종목이다. 미래에셋증권 관계자는 ""이번 신규 상장으로 ELW 투자자들이 이전보다 다양한 선택권을 갖고 많은 종목을 거래할 수 있게 됐다""고 했다. 미래에셋증권은 ELW 전용 카카오톡 채널을 통해 신규 상장 종목과 전날 종가 기준 ELW 시황정보, 리서치 자료 등을 발송하고 있다.pej86@news1.kr▶ 네이버 메인에서 [뉴스1] 구독하기!▶  뉴스1&BBC 한글 뉴스 ▶  터닝포인트 2021 © 뉴스1코리아(news1.kr), 무단 전재 및 재배포 금지"
2021.04.15.,정인이에게 집은 지옥이었다…검찰이 밝힌 ‘일상적 학대’,https://n.news.naver.com/mnews/article/018/0004902084?sid=102,"검찰, ‘정인양 양부모’ 결심 공판에서 여러 증거 제시‘물건 잡듯 들어 올리는 영상’, ‘몸무게 추이’ 등 공개아이 사망 날엔 ‘어묵 공동구매’…메시지 삭제 정황도양모 측 “손바닥으로 세게 때리긴 했지만, 밟진 않아”[이데일리 박순엽 기자] “엄마에게 폭행을 당해 아픈 몸을 이끌고 등원한 유일한 안식처인 어린이집에서 몸을 회복한 다음, 저녁때가 돼서 다시 지옥이나 마찬가지였을 가정으로 돌아가자고 찾아온 아빠를 피해자는 얼마나 원망했을지 또는 얼마나 무서워했을지 그 마음을 짐작해본다.”검찰은 지난해 입양 이후 지속적인 학대로 생후 16개월 여아 정인(입양 전 본명)양을 숨지게 한 혐의로 구속 기소된 양어머니에 대해 법정 최고형인 사형을 구형하면서 정인양에게 가정은 지옥이나 마찬가지였을 것이라고 주장했다. 검찰은 이를 뒷받침하고자 정인양이 받아온 일상적 학대의 모습을 추정케 하는 다양한 증거들을 법정에서 공개했다. 입양한 생후 16개월 된 딸을 학대치사한 혐의를 받고 있는 장모씨가 지난해 11월 서울 양천구 서울남부지방법원에서 열린 구속 전 피의자 심문(영장실질심사)에 출석하고 있다. (사진=뉴시스)물건 잡듯 들고, 안 먹는다고 때리고…檢, 증거 제시 서울남부지법 형사합의13부(재판장 이상주) 심리로 지난 14일 진행된 정인양 양어머니 장모(35)씨와 양아버지 안모(38)씨에 대한 결심 공판에서 검찰은 장씨가 일상적으로 저지른 학대의 정황이 담긴 증거를 제시했다. 다만, 장씨는 지난 공판과 마찬가지로 폭행과 학대 사실은 인정하면서도 아이를 숨지게 할 의도는 없었다고 주장했다. 이날 검찰이 제시한 폐쇄회로(CC)TV 영상 등의 증거에선 장씨가 목이나 한쪽 손목만 잡아서 물건을 잡듯 정인양을 들어 올리고, 엘리베이터 안 좁은 손잡이에 정인양을 앉혀둔 채 자신의 머리를 손질하는 장면이 등장했다. 검찰은 “정서적 학대를 넘어서 장씨가 피해자에 대한 신체적 완전성을 무시하는 태도를 보이고 있었다는 증거”라고 설명했다. 검찰은 또 정인양의 몸무게 추이를 토대로 정인양이 심각한 영양실조 상태였다는 점을 강조했다. 검찰은 “입양 전이었던 지난해 1월 아이 몸무게는 8.9kg이었는데, 그해 9월엔 아이가 생후 5개월 수준인 8.5kg에 불과했다”며 “세계보건기구(WHO) 기준을 따져 봐도 아이 몸무게는 성장하면서 지속적으로 증가하지 줄어들지 않는다”고 지적했다. 장씨는 피고인 신문에서 이른바 ‘이유식 거부 시기’여서 정인양이 제대로 밥을 먹지 않아 몸무게가 줄어들었다고 이유를 설명했지만, 검찰은 지난해 9월 양부 안씨가 장씨에게 보낸 “(아이가) 씹는 거에 트라우마 생긴 건 아니겠지?”라는 휴대전화 메시지를 증거로 제시하며 정인양이 밥을 먹지 않게 된 계기가 장씨의 학대에 있을 가능성을 제기했다. 결국 검찰이 재차 장씨에게 “(정인양이) 씹지 않는다고 폭행하거나 학대한 적이 없느냐”고 물어보자 장씨는 “아이를 때린 적이 있고, 화도 냈다”며 “열심히 만든 음식을 먹지 않아 반항하는 것 같아 화가 났다”고 트라우마가 자신의 행위에서 비롯됐을 수 있다고 진술했다. 그는 사망 당일 정인양을 폭행한 것도 밥을 제대로 먹지 않았기 때문이라고 털어놓았다. 양부모의 학대 끝에 숨진 16개월 된 입양 딸 ‘정인이’의 양부모의 결심 공판이 열린 지난 14일 오후 서울 양천구 서울남부지방법원 입구에서 시민들이 양모가 탑승한 것으로 보이는 호송차를 향해 손피켓을 들고 항의하고 있다. (사진=뉴시스)일상적 방치…사망 날에도 ‘어묵 공동구매’ 참여검찰은 이들 양부모가 정인양을 내버려두는 상황도 수시로 반복됐다고 말했다. 최대 4시간까지 집에 홀로 있기도 했다. 검찰은 “일반적인 보호자라면 아이를 이런 식으로 대하는 건 상상도 할 수 없다”며 “피해자 건강과 안전에 대한 관심도 없고, 무책임하게 아이가 어떻게 되든 상관없다는 생각했기 때문”이라고 비판했다. 정인양이 사망하던 날에도 방치는 이어졌다. 장씨는 사망 당일 ‘정인양 양팔을 흔들고 배와 등을 손바닥으로 세게 내려친 뒤 아이를 들어 올려 세게 흔들다가 떨어뜨렸다’고 진술했는데, 검찰은 “치명적인 폭행 이후 상태가 좋지 않은 걸 알면서도 첫째 아이 어린이집 등원을 시키며 피해자를 방치한 점을 돌이켜보면 장씨에게 살인죄의 미필적 고의가 인정된다”고 말했다. 검찰은 정인양의 사망 이후 장씨 모습에도 주목했다. 장씨는 의사에게서 정인양이 숨질 수 있다는 얘기를 들었는데도 온라인 커뮤니티 어묵 공동구매 글에 댓글을 달았다. 또 사망 다음 날엔 다른 아기 엄마를 만나 첫째 아이와 놀고, 추가 어묵 공동구매를 추진하기도 했다. 3차 아동학대 신고 이후와 압수수색 당일 수백건의 카카오톡 메시지를 삭제한 정황도 드러났다. 아울러 장씨는 아이 사망 이튿날 지인에게 “하나님이 천사 하나가 더 필요하셨나 봐요”라는 메시지를 보내기도 한 것으로 조사됐다. 검찰은 “자신의 행위로 아이가 사망했는데도 ‘하나님’ 핑계를 대면서 마치 운명으로 돌리는 태도를 보였다”며 “범행을 부인하고, 죄를 뉘우치지 않는다”고도 지적했다.양부모의 학대 끝에 숨진 16개월 된 입양 딸 ‘정인이’의 양부모의 결심 공판이 열린 지난 14일 오후 서울 양천구 서울남부지방법원 입구에서 시민들이 양모가 탑승한 것으로 보이는 호송차를 향해 팻말을 들고 항의하고 있다. (사진=뉴시스)양모 측 “때리긴 했지만, 발로 밟지 않아…고의 없어”장씨는 일부 학대와 폭행 사실을 인정하면서도 검찰 주장처럼 아이를 발로 밟은 일은 없다고 주장했다. 그는 “아이에게 소리도 많이 지르고, 머리나 어깨, 배도 많이 때렸다”면서도 “주먹으로 때리거나 아이를 던지거나 밟은 사실은 없다”고 말했다. 또 사망 당일 내버려뒀다는 주장에 대해서도 “그땐 그렇게 위중한 상태라고 생각하지 못했다”고 반박했다. 장씨는 정인양을 숨지게 할 의도는 전혀 없었다는 점을 강조하기도 했다. 그는 “사망 당일에도 아이가 힘들어했지만, 아이를 미워하거나 잘못되길 바란 점은 맹세코 없다”며 “상상도 못할 일이라 (아이가) 죽든 말든 (상관없다고) 생각한 적도 없다”고 말했다. 장씨는 이어 학대 사실을 남편에게도 숨겼으며 남편에게 배신감을 안겨줘 미안하다고도 울먹였다.장씨 측 변호인은 “장씨가 아이를 죽이겠다고 마음을 먹거나 살인의 고의를 가진 적은 없다”며 “염치없는 주장인 건 알지만, 장씨는 당시 (아이의) 사망 가능성을 몰랐던 것 같다”고 변론했다. 변호인은 “장씨가 악마로 묘사되고 있지만, 악한 심성의 사람이 아니다”라며 다른 재판과 형평성을 고려해 선처해달라고 재판부에 부탁했다. 한편 장씨는 지난해 6월부터 정인양을 상습 폭행·학대하고, 그해 10월 13일 정인양 등 쪽에 강한 힘을 가해 정인양을 숨지게 한 혐의로 기소됐다. 검찰은 또 양부 안씨에 대해선 지난해 3월부터 10월까지 부인의 방치와 폭행으로 정인양의 몸이 극도로 쇠약해졌다는 걸 알면서도 부인의 기분만을 살피면서 아무런 조치를 하지 않은 혐의 등을 적용했다.박순엽 (soon@edaily.co.kr)▶ #24시간 빠른 #미리보는 뉴스 #eNews+▶ 네이버에서 '이데일리 뉴스'를 만나보세요▶ 빡침해소, 청춘뉘우스 '스냅타임'＜ⓒ종합 경제정보 미디어 이데일리 - 무단전재 & 재배포 금지＞"
2021.04.15.,"하이브·SK바사, 보호예수물량 대거 시장에 풀린다",https://n.news.naver.com/mnews/article/001/0012329857?sid=101,"기관 의무보유 물량 등 해제…주가 영향 '촉각'하이브 심볼[하이브 제공. 재판매 및 DB 금지]    (서울=연합뉴스) 김아람 기자 = 공모주로 인기몰이를 한 하이브와 SK바이오사이언스의 보호예수물량이 잇따라 해제돼 주가 향방에 이목이 쏠린다.    15일 금융감독원 전자공시시스템에 따르면 지난해 10월 15일 유가증권시장에 상장한 하이브(구 빅히트)는 공모주식 713만주 가운데 428만2천309주를 기관 투자자에게 배정했다.    기관 배정 물량의 24.83%인 106만3천100주가 6개월 의무보유 확약을 했다. 따라서 기관은 이날부터 6개월 확약분을 매도할 수 있다.    하이브 최대주주인 방시혁 의장과 방탄소년단(BTS) 멤버 7명이 보유한 총 1천285만6천32주 등도 15일 자로 보호예수가 풀린다.    하이브 주가는 상장 후 내리막길을 걷다가 최근 미국 레이블 이타카 홀딩스 인수 등 호재에 힘입어 상장일 시초가 27만원을 약 6개월 만에 회복했다.    그러나 보호예수 물량 해제와 이타카 홀딩스 인수를 위한 대규모 유상증자를 앞두고 다시 주가는 반락했다.    최근 5거래일간 주가가 14.67% 하락한 만큼 투자자들은 보호예수 물량이 풀리고 나서 주가 흐름이 어떻게 될지 주목하고 있다.SK바이오사이언스 백신공장 안동 L하우스[SK바이오사이언스 홈페이지 캡처]    지난달 18일 상장한 SK바이오사이언스도 기관 보유 물량이 대거 시장에 나올 예정이어서 주가에 미칠 영향에 투자자들이 촉각을 곤두세우고 있다.    SK바이오사이언스는 오는 18일 자로 기관의 1개월 의무보유 확약 물량 311만8천610주가 시장에 풀린다. 이는 공모 당시 기관에 배정된 물량의 24.71% 규모다.    투자자들의 기대가 컸던 SK바이오사이언스는 상장 첫날 시초가가 공모가의 2배로 결정되고서 상한가인 16만9천원까지 올랐으나 이후 주가는 약세를 이어갔다.    주가는 한때 상장일 시초가인 13만원을 밑돌았으며 14일 종가는 13만5천500원으로 13만원을 소폭 웃도는 수준이다.    기관 투자자는 공모주를 많이 배정받는 조건으로 상장 이후 일정 기간 공모주를 의무 보유해야 한다.    그러나 의무 보유 기간이 끝나고 기관 물량이 한꺼번에 시장에 쏟아지면 수급 충격이 발생해 주가에 악재로 작용하기도 한다.    하이브가 종가 기준으로 상장 이후 최저가인 14만2천원을 기록한 작년 10월 30일은 기관의 15일 확약 물량 20만5천463주가 시장에 풀린 날이었다.    앞서 카카오게임즈와 SK바이오팜 등도 기관 물량이 시장에 나오면서 주가가 큰 폭으로 내린 바 있다.    rice@yna.co.kr▶네이버에서도 뉴스는 연합뉴스[구독 클릭]▶[팩트체크]日오염수 우리바다 유입 가능성은▶제보하기<저작권자(c) 연합뉴스(https://www.yna.co.kr/), 무단 전재-재배포 금지>"
2021.04.15.,"미래에셋증권, ELW 141개 종목 신규 상장",https://n.news.naver.com/mnews/article/421/0005290089?sid=101,"미래에셋증권 본사가 위치한 서울 중구 수하동 미래에셋 센터원 빌딩. 2016.12.30/뉴스1 © News1 유승관 기자(서울=뉴스1) 박응진 기자 = 미래에셋증권은 주식워런트증권(ELW) 141개 종목의 신규 상장을 완료했다고 15일 밝혔다.이번에 상장한 종목은 코스피200지수를 기초자산으로 하는 지수형 콜 43개 종목과 풋 36개 종목, 삼성전자·SK하이닉스·현대차 등을 기초자산으로 하는 종목형 콜 45개 종목과 풋 17개 종목이다. 미래에셋증권 관계자는 ""이번 신규 상장으로 ELW 투자자들이 이전보다 다양한 선택권을 갖고 많은 종목을 거래할 수 있게 됐다""고 했다. 미래에셋증권은 ELW 전용 카카오톡 채널을 통해 신규 상장 종목과 전날 종가 기준 ELW 시황정보, 리서치 자료 등을 발송하고 있다.pej86@news1.kr▶ 네이버 메인에서 [뉴스1] 구독하기!▶  뉴스1&BBC 한글 뉴스 ▶  터닝포인트 2021 © 뉴스1코리아(news1.kr), 무단 전재 및 재배포 금지"
2021.04.15.,"박서준, 데뷔 10주년 팬미팅 연다 [공식]",https://n.news.naver.com/mnews/article/312/0000477516?sid=106,<구조 다름>
2021.04.15.,"롯데제과, 카스타드 플라스틱 완충재 종이로 대체",https://n.news.naver.com/mnews/article/018/0004902539?sid=101,"엄마손파이·칸쵸도 포장 개선 검토연간 470t 플라스틱 사용량 줄인다[이데일리 김보경 기자] 롯데제과는 카스타드에 사용되는 플라스틱 완충재를 전량 종이 재질로 변경한다고 15일 밝혔다. 롯데제과는 최근 주요 경영진들이 참석한 회의에서 카스타드 등에 사용되는 플라스틱 완충재의 필요 여부에 대해 논의하고 완충재를 종이 등의 친환경 소재로 변경하기로 했다. 최근 더욱 중요시되고 있는 환경 문제에 적극 대응하면서도 소비자에게 제공하는 제품의 품질은 최고 수준으로 유지하기 위한 결정이다. 롯데제과는 오는 9월 이전에 카스타드의 대용량 제품에 쓰이는 플라스틱 완충재의 생산을 전면 중단하고 모두 종이 소재의 완충재로 대체할 예정이며 이를 위해 빠른 시일 내에 생산 설비 도입에 나서기로 했다. 이를 통해 연간 350t 이상의 플라스틱을 줄일 수 있을 것으로 예상된다.또한 롯데제과는 카스타드 외에도 엄마손파이에 사용되는 완충재와 칸쵸와 씨리얼의 컵 제품에 사용되는 플라스틱 용기도 종이로 변경하는 방안에 대해 검토 중이며 연내로 추진할 예정이다.롯데제과는 친환경 경영의 일환으로 과자 패키지에 사용되는 대표 환경 오염 물질인 유기용제, 잉크, 플라스틱의 사용량을 줄이기 위해 다양한 방식으로 포장재 개선 작업을 진행하고 있다. 작년부터 빼빼로, 몽쉘, 야채크래커, 롯샌, ABC초코쿠키, 목캔디, 애니타임, 초코파이, 하비스트 등에 유기용제 대신 에탄올 잉크 등 친환경 잉크를 사용하고 인쇄 도수를 축소하는 한편 포장 디자인을 단순화했다. 쥬시후레쉬 등 판껌 10종에도 껌 종이의 인쇄 잉크 도수를 절반 정도로 축소, 잉크 사용을 줄였다. 또한 작년 9월에는 마가렛트에 농림축산식품부와 녹색인증사무국으로부터 인증 받은 포장 기법인 ‘녹색인증 포장’을 적용하기도 했다. 롯데제과는 현재까지 친환경 포장을 통해 연간 약 470t의 유기용제 및 잉크 사용을 줄일 수 있으며 플라스틱도 연간 470t 이상 줄일 수 있을 것으로 예상하고 있다.이외에도 롯데제과는 최근 한솔제지와 함께 카카오 부산물로 친환경 종이 포장재 ‘카카오판지’를 개발하여 가나 초콜릿의 제품 포장재에 적용하기도 했다. 친환경 프로젝트 중 하나인 ‘스마트 리사이클’을 적용한 제품도 현재까지 150여개에 달한다. ‘스마트 리사이클’은 재활용을 간편하게 할 수 있도록 포장재를 쉽게 뜯고 쉽게 접을 수 있도록 개선한 포장법이다.김보경 (bkkim@edaily.co.kr)▶ #24시간 빠른 #미리보는 뉴스 #eNews+▶ 네이버에서 '이데일리 뉴스'를 만나보세요▶ 빡침해소, 청춘뉘우스 '스냅타임'＜ⓒ종합 경제정보 미디어 이데일리 - 무단전재 & 재배포 금지＞"
2021.04.15.,지난해 보이스피싱 피해액 65% 감소… 가족 사칭은 되레 늘어,https://n.news.naver.com/mnews/article/366/0000702296?sid=101,"지난해 보이스피싱 피해액이 65% 감소한 것으로 나타났다. 하지만 가족 등을 사칭한 보이스피싱은 되레 늘어 피해액수가 커졌다.15일 금융감독원에 따르면 지난해 보이스피싱 피해 금액은 2353억원, 피해 건수는 2만5859건으로 2019년(6720억원·7만2488건)에 비해 액수와 건수 모두 약 65% 줄었다.특히 피해 금액 2353억원 중 1141억원을 피해자에게 돌려줘, 환급률은 역대 최대인 48%를 기록했다. 2017년부터 3년간 20%대였던 환급률이 크게 개선됐다. 금감원은 보이스피싱 피해가 줄어든 이유로 ""그동안의 예방 대책이 효과를 냈고 코로나19로 사기 조직의 활동이 제한된 것도 영향을 미친 것으로 보인다""고 설명했다.금융감독원 제공다만 보이스피싱 수법이 진화하며 사칭형 메신저 피싱 피해는 크게 늘었다. 2018년 216억원이었던 메신저 피싱 피해액수는 지난해 373억원으로 뛰었다. 대출빙자형 메신저 피싱 피해액수가 같은 기간 3093억원에서 1566억원으로 절반 가까이 줄어든 것과는 정반대다. 메신저 피싱은 주로 자녀를 사칭해 ""휴대전화를 분실했다""며 신분증 촬영본과 계좌번호, 신용카드 번호 등을 요구하는 방식으로 이뤄진다. 사기 조직은 이렇게 얻어낸 피해자의 신분증을 활용해 피해자 명의로 휴대전화 비대면 계좌를 개설한 뒤 대출을 받아 가로챈다. ""휴대전화가 고장 나서 전화를 받을 수 없고 카카오톡만 가능하다""고 속이거나 ""카드 비밀번호 오류로 돈이 보내지지 않는다""며 타인 계좌로 이체해달라고 요구하는 경우도 있다. 지연 인출 제도를 회피하기 위해 100만원 미만의 금액을 요청하거나 100만원 미만으로 쪼개서 여러 번 보내 달라고 요청하는 것이 특징이다. 메신저 피싱 등 사칭형 피싱 피해자는 여성의 비중이 65.5%로 남성(35.5%)보다 높았다. 연령까지 고려하면 피해자 중 50대 여성과 60대 여성이 각각 28%, 27%를 차지했다. 반면 대출빙자형 피싱은 피해자의 61%가 남성이었으며 특히 40~50대 남성이 가장 취약한 것으로 나타났다. 금감원은 자녀가 휴대전화가 고장났다며 계좌 이체나 신분증 촬영을 요구한다면 즉시 문자 대화를 중단하고 통화로 목소리를 확인해야 한다고 당부했다. 낯선 애플리케이션(앱) 설치를 요구한다면 무조건 거절하고, 이미 앱을 설치했다면 삭제한 뒤 스마트폰을 초기화해야 한다. 신분증을 이미 보냈다면 금감원 금융소비자 정보 포털의‘개인정보 노출자 사고예방 시스템’을 통해 도용된 신분증을 사용할 수 없도록 조치할 수 있다.[이상빈 기자 seetheunseen@chosunbiz.com] ▶네이버에서 '명품 경제뉴스' 조선비즈를 구독하세요▶포스코 따라 현대제철·동국제강도 '어닝 서프라이즈' 기대▶K방역 자랑하던 한국… 백신전쟁 시작하자 경제 '빨간불'	저작권자 ⓒ 조선비즈, 무단 전재 및 재배포 금지"
