기사날짜,기사제목,네이버 뉴스 url,기사내용
2021.04.06.,"전남도 ""농업인 대상 정부 재난지원금 신청하세요""",https://n.news.naver.com/mnews/article/014/0004615183?sid=102,"소규모 농가 30만원·농업 피해 집중 5대 분야 농가당 100만원  【파이낸셜뉴스 무안=황태종 기자】전남도는 정부의 제4차 재난지원금에 포함된 농업 분야 지원금 지급을 시작했다고 6일 밝혔다.   지원금은 소규모 농가에 30만원씩 지급하는 '한시 경영지원 바우처'와 코로나19 피해 집중 5대 분야에 농가당 100만원씩 지급하는 '코로나 극복 영농지원 바우처' 2가지다.   '한시 경영지원 바우처'는 경작 면적 0.5ha 이하 등 소규모 농가 요건을 갖춘 농가가 대상이다. 다만 지난해 소규모 농가 직접지불금(소농직불금)을 수령한 사람 중 공고일(4월 1일) 기준 농업경영체 등록정보에 등록돼 있어야 한다. 전남지역 7만 6950농가가 해당된다.   농식품부는 지난 2일 지원 대상자에게 문자메시지나 카카오톡을 활용해 개별 안내했다. 대상 농가는 오는 30일까지 농지 소재지의 지역 농·축협은행을 직접 방문하거나 농협카드 누리집에서 온라인으로 신청하면 된다. 30만원 상당의 바우처는 농협 신용카드 또는 체크카드에 포인트 충전 방식으로 지급된다.   '코로나 극복 영농지원 바우처' 지원 대상자는 지난해 매출이 전년보다 감소한 화훼·겨울수박·학교급식 납품 친환경농산물 생산 농가, 말 사육 농가 및 농촌체험휴양마을 등이다. 도내 화훼 1216농가, 학교급식 납품 친환경농산물 생산 5838농가, 말 사육 4농가, 농촌체험휴양마을 169농가 등 총 7227농가에 지원된다.   신청 기간은 온라인은 오는 12일, 방문신청은 14일부터 시작하며, 30일까지 신청해야 한다.   출하실적증명서, 통장입금내역서 등 매출을 확인할 수 있는 증빙서류를 준비해 코로나 극복 영농지원 바우처 누리집 또는 농지 소재지 읍·면·동 주민센터에 신청하면 된다.   지급 대상자로 확정되면 선불카드로 농가당 100만원을 지급한다. 선불카드는 오는 9월 31일까지 사용할 수 있다.   소영호 전남도 농축산식품국장은 ""전남도의 주도적인 역할로 이번 제4차 재난지원금 지원에 농업인이 포함됐다""며 ""코로나19로 어려움을 겪는 농가의 생활안정에 보탬이 되길 기대한다""고 말했다.   한편 전남도는 그동안 전국 시·도 중 가장 앞서 재난지원금 지급 대상에 농업인을 포함해줄 것을 정부와 국회에 지속적으로 건의했다.    hwangtae@fnnews.com 황태종 기자   ▶ 헉! 소리나는 스!토리 뉴스 [헉스]▶ '아는 척'하고 싶은 당신을 위한 [두유노우]▶ 날로먹고 구워먹는 금융이슈 [파인애플]  ※ 저작권자 ⓒ 파이낸셜뉴스. 무단 전재-재배포 금지"
2021.04.06.,"코스피, 외인 '사자'에 나흘째 올라…3,120대 마감(종합)",https://n.news.naver.com/mnews/article/001/0012310850?sid=101,"(서울=연합뉴스) 박동주 기자 = 6일 오전 서울 중구 을지로 기업은행 IBK파이낸스타워 딜링룸 모습. 2021.4.6 pdj6635@yna.co.kr(서울=연합뉴스) 박원희 기자 = 코스피가 외국인 순매수에 힘입어 나흘 연속 상승했다.    6일 코스피는 전날보다 6.25포인트(0.20%) 높은 3,127.08에 마감했다.    지수는 전장보다 2.97포인트(0.10%) 오른 3,123.80으로 시작해 오전 한때 3,110선까지 밀렸으나 이후 상승 흐름을 되찾았다.    유가증권시장에서는 외국인이 5천709억원을 순매수하며 나흘째 매수 우위를 보였다. 외국인이 4거래일 연속 순매수한 경우는 작년 12월 초(1∼4일) 이후 처음이다.    반면 개인은 279억원, 기관은 5천143억원을 각각 순매도했다.    이경민 대신증권 연구원은 ""경제 지표 호조에 미국 경기 회복세에 힘이 실리며 코스피는 장 초반 3,130선을 상회하기도 했다""며 ""다만 미국 경제 지표 개선은 일정 부분 선반영됐다는 점과 장중 외국인의 선물 매도에 따른 금융투자의 현물 순매도세에 상승 폭을 일부 반납했다""고 분석했다.    시가총액 상위 종목 중에서는 카카오(8.37%)가 두나무 재평가에 대한 기대감에 급등하며 신고가를 새로 썼다. 카카오는 가상거래소 업비트의 운영사인 두나무의 지분 8.1%를 보유하고 있다. 두나무 지분 6.2%를 보유한 한화투자증권은 가격제한폭까지 상승했다. 증시 상장을 앞둔 미국 최대 가상화폐 거래소 코인베이스의 기업가치가 100조원에 육박할 것이란 관측이 나오면서다.     LG전자(3.56%), 네이버(3.05%), 삼성전자(0.70%) 등도 강세로 마감했다.    반면 현대모비스(-2.30%), 삼성SDI(-1.98%), 포스코(-1.79%) 등은 약세를 보였다.    업종별로 보면 증권(3.72%)이 강세를 보였다.    반면 전날 급등한 철강·금속(-1.10%)은 차익 실현의 영향을 받는 모습이었다.    유가증권시장 거래량은 12억6천460만주, 거래대금은 13조4천978억원이었다.코스피 상승 출발…3,130대(서울=연합뉴스) 박동주 기자 = 코스피가 상승세로 출발한 6일 오전 서울 중구 을지로 기업은행 IBK파이낸스타워 딜링룸 모습. 2021.4.6 pdj6635@yna.co.kr코스닥지수는 전날보다 1.14포인트(0.12%) 내린 968.63에 마쳤다.    지수는 전장보다 1.34포인트(0.14%) 높은 971.11에 개장했으나 약세로 돌아섰다.    코스닥시장에서는 외국인이 1천630억원, 기관이 133억원을 각각 순매도했다. 개인은 2천86억원을 순매수했다.    시총 상위권에서는 리노공업(3.50%), 스튜디오드래곤(2.62%), 펄어비스(2.33%) 등이 오르고 원익IPS(-2.74%), 에이치엘비(-1.81%), 셀트리온제약(-1.50%) 등은 하락했다.    코스닥시장 거래량은 23억8천243만주, 거래대금은 12조3천808억원 수준이었다.    encounter24@yna.co.kr▶네이버에서도 뉴스는 연합뉴스[구독 클릭]▶[팩트체크] 박영선-오세훈 TV토론 말말말▶제보하기<저작권자(c) 연합뉴스(https://www.yna.co.kr/), 무단 전재-재배포 금지>"
2021.04.06.,"지상파 3사, 7일 재·보궐 선거 개표방송",https://n.news.naver.com/mnews/article/144/0000728722?sid=106,<구조 다름>
2021.04.06.,"뚜레쥬르, 어몽어스 제품 모바일 쿠폰 최대 20% 할인",https://n.news.naver.com/mnews/article/014/0004615057?sid=101,"[파이낸셜뉴스] CJ푸드빌이 운영하는 베이커리 뚜레쥬르가 인기 게임 어몽어스 협업 제품 출시를 기념해 모바일 쿠폰 할인 이벤트를 진행한다고 6일 밝혔다.   이번 이벤트는 어몽어스 게임을 즐기는 젊은 고객층에게 색다른 재미를 선사하고 있는 '뚜레쥬르 어몽어스 제품'을 합리적인 가격에 선보이기 위해 마련됐다. 4월 중순까지 카카오톡 선물하기, 티몬, 위메프 세 곳에서 순차적으로 진행하며, 간편하고 안전하게 선물을 주고받을 수 비대면 선물로도 활용할 수 있다.   먼저 카카오톡 선물하기에서는 4월 18일까지 어몽어스 제품 모바일 교환권 할인 혜택을 제공한다. 케이크 2종을 15~20%, 그 외 어몽어스 제품 1종은 15% 할인해 판매한다.   티몬에서는 4월 12일부터 13일까지 어몽어스 제품 3종을, 위메프에서는 4월 14일부터 18일까지 어몽어스 제품 2종 모바일 제품 교환권을 최대 20% 할인된 가격에 구매할 수 있다. 모든 행사는 한정 물량으로 조기 소진될 수 있다.   뚜레쥬르는 어몽어스 게임 배경인 신비한 우주와 개성 있는 캐릭터를 모티프로 한 케이크, 빵 등 이색 제품을 선보였다. 대표 제품은 레드 크루를 그대로 표현한 레드 글라사주 케이크 속에 진한 초코 가나슈 생크림과 크런치 초코볼을 샌드해 반전 매력을 선사하는 '어몽어스 임포스터 쇼콜라', 우주 행성 모양의 빅 쇼콜라 볼 케이크를 귀여운 어몽어스 크루들이 탐험하는 스토리를 담은 '어몽어스 빅 쇼콜라 볼' 등이다. 이 외에도 '그레인 쿠키샌드', '겹겹이 치즈스틱', '휭거 마드레느' 등에 어몽어스 캐릭터를 더해 디저트로 즐길 수 있는 빵 제품도 출시했다.  gmin@fnnews.com 조지민 기자   ▶ 헉! 소리나는 스!토리 뉴스 [헉스]▶ '아는 척'하고 싶은 당신을 위한 [두유노우]▶ 날로먹고 구워먹는 금융이슈 [파인애플]  ※ 저작권자 ⓒ 파이낸셜뉴스. 무단 전재-재배포 금지"
2021.04.06.,"달성군, 비슬산 참꽃 개화상황 실시간으로 중계",https://n.news.naver.com/mnews/article/081/0003176673?sid=102,"210406_달성군, 비슬산 참꽃 군락지 개화 상황 실시간 중계 실시대구 달성군은 6일부터 25일까지 비슬산 참꽃군락지의 참꽃 개화 상황을 실시간으로 중계한다.유서 깊은 사찰인 대견사와 문화유적들이 산재되어 있는 비슬산 정상에 위치한 30만 평에 달하는 참꽃 군락지에는 해마다 봄이면 참꽃이 만개해 진분홍의 화원을 만들어낸다.올해로 25회를 맞으며 매년 전국에서 10만 명 이상의 관광객을 불러 모았던 비슬산 참꽃문화제는 작년과 올해 전면 취소됐지만, 올해는 비슬산을 찾지 못하는 관광객들도 달성군청 유튜브와 페이스북, 카카오톡 채널을 통해 실시간으로 비슬산 참꽃의 절경을 볼 수 있게 됐다.김문오 군수는 “코로나19가 길어지면서 군민 여러분의 지친 마음을 탁 트인 참꽃 군락지를 보며 달래길 바란다”라며, “실시간으로 중계되는 비슬산 참꽃 군락지 개화 상황을 달성군청 유튜브와 페이스북, 카카오톡 채널 등을 통해 많은 시청을 부탁드린다”고 말했다.대구 한찬규 기자 cghan@seoul.co.kr▶ 네이버에서 서울신문 구독하기 클릭!  ▶ [인터랙티브] 코로나 청년 잔혹사   ▶ [나우뉴스] 세상에 이런 일이ⓒ 서울신문(www.seoul.co.kr), 무단전재 및 재배포금지"
2021.04.06.,‘범 내려온다’ 춤에 증강현실까지…개표방송 뭘 볼까,https://n.news.naver.com/mnews/article/028/0002539295?sid=103,"지상파 3사, 4·7 재보선 방송에서 시청자 시선잡기 나서<에스비에스> 선거 개표 방송. 에스비에스 제공7일 치러지는 재보궐선거 후보들의 경쟁 못지않게 지상파 방송사들의 개표 방송 경쟁 또한 뜨겁다. 서울과 부산 시장을 뽑는 선거가 ‘대선 전초전’으로 일컬어지며 귀추가 주목되는 가운데, 지상파 3사는 갖가지 데이터와 전문가들을 동원해 시선 잡기에 나섰다.<에스비에스>(SBS)는 이번 선거에 대한 20대의 관심이 여느 때보다 높다는 점에 착안해 젊은 유권자들을 사로잡기 위한 재미있는 구성을 앞세운다. 퓨전 국악 밴드 이날치의 ‘범 내려온다’ 뮤직비디오에서 중독성 강한 춤으로 화제를 모은 앰비규어스댄스컴퍼니가 함께한 독특한 영상으로 개표 방송을 알릴 예정이다. 세밀한 정보 제공도 강점으로 내세운다. <에스비에스> 데이터저널리즘팀 ‘마부작침’은 역대 선거 결과를 심층 분석해 서울과 부산 유권자 지도를 만들었다. 표심과 권역별 판세, 최종 결과가 항상 일치했던 ‘족집게 동네’ 등을 찾아간다.<한국방송1> 선거 개표 방송. 한국방송 제공<한국방송1>(KBS1)은 서울과 부산을 오가는 4원 개표 방송을 선보인다. 서울 본사와 부산총국 스튜디오, 서울광장 인근과 부산 광안대교 인근에 설치한 야외 스튜디오를 오간다. 국내 개표 방송에서는 처음으로 증강현실(AR) 카메라를 탑재한 아르시(RC)카가 서울시청 등을 누비며 실시간 투·개표 데이터를 그래픽으로 전달한다. 민심을 바로 읽을 수 있는 현장감, 다양한 곳의 정보를 한눈에 볼 수 있는 입체감 등을 장점으로 내세운다. 유튜브, 틱톡, 카카오톡 등으로는 티브이보다 두시간 빠른 오후 5시부터 모바일 개표 방송을 별도로 진행한다.<문화방송> 선거 개표 방송. 문화방송 제공<문화방송>(MBC)은 대형 발광다이오드(LED) 화면을 활용한 시각화에 집중해 표심과 결과를 한눈에 보기 쉽게 만든다. <문화방송> 쪽은 “출구조사 결과, 실시간 개표 현황, 판세 분석 등을 한눈에 파악할 수 있도록 할 예정”이라고 밝혔다. 이를 위해 컴퓨터그래픽을 깨알같이 활용해 이해력을 높이고 보는 재미를 더한다는 계획이다. 당일 여야 정치인들의 발언과 선거 이모저모를 정리하는 ‘선거 이슈톡’ 등 다양한 꼭지를 준비했다.출구조사는 3사가 공동으로 실시해 저녁 8시15분께 발표한다. 3사 모두 개표 방송 이후에는 여야 국회의원, 선거 전문가 등이 출연해 이번 선거의 의미와 결과, 민심 분석, 대선 전망 등을 다루는 토론 프로그램을 방송한다. 남지은 기자 myviollet@hani.co.kr▶더불어 행복한 세상을 만드는 언론, 한겨레 구독하세요!▶esc 기사 보기▶4.7 재·보궐선거 기사 보기[ⓒ한겨레신문 : 무단전재 및 재배포 금지]"
2021.04.06.,'담원 기아 VS 젠지' LCK 스프링 결승 대진 완성…MSI 진출 팀은 어디?,https://sports.news.naver.com/news.nhn?oid=311&aid=0001283987,<구조 다름>
2021.04.06.,"뚜레쥬르, 카톡·티몬·위메프 어몽어스 제품 최대 20% 할인",https://n.news.naver.com/mnews/article/018/0004893912?sid=101,"[이데일리 전재욱 기자] CJ푸드빌이 운영하는 베이커리 뚜레쥬르가 인기 게임 ‘어몽어스(Among Us)’ 협업 제품 출시를 기념해 모바일 쿠폰 할인 이벤트를 진행한다고 6일 밝혔다.이벤트는 어몽어스 게임을 즐기는 젊은 고객층에게 색다른 재미를 선사하고 있는 ‘뚜레쥬르 어몽어스 제품’을 합리적인 가격에 선보이기 위해 마련됐다.4월 중순까지 카카오톡 선물하기, 티몬, 위메프 세 곳에서 순차적으로 진행하며, 간편하고 안전하게 선물을 주고받을 수 비대면 선물로도 활용할 수 있다.카카오톡 선물하기에서 이달 18일까지 어몽어스 제품 모바일 교환권 할인 혜택을 제공한다. 케이크 2종을 15~20%, 그 외 어몽어스 제품 1종은 15% 할인해 판매한다.티몬에서는 오는 12~13일 어몽어스 제품 3종을, 위메프에서는 14~18일까지 어몽어스 제품 2종 모바일 제품 교환권을 최대 20% 할인된 가격에 구매할 수 있다. 모든 행사는 한정 물량으로 조기 소진될 수 있다.뚜레쥬르는 어몽어스 게임 배경인 신비한 우주와 개성 있는 캐릭터를 모티프로 한 케이크, 빵 등 이색 제품을 선보였다. 대표 제품은 레드 크루를 그대로 표현한 레드 글라사주 케이크 속에 진한 초코 가나슈 생크림과 크런치 초코볼을 샌드해 반전 매력을 선사하는 ‘어몽어스 임포스터 쇼콜라’, 우주 행성 모양의 빅 쇼콜라 볼 케이크를 귀여운 어몽어스 크루들이 탐험하는 스토리를 담은 ‘어몽어스 빅 쇼콜라 볼’ 등이다. 이 외에도 ‘그레인 쿠키샌드’, ‘겹겹이 치즈스틱’, ‘휭거 마드레느’ 등에 어몽어스 캐릭터를 더해 디저트로 즐길 수 있는 빵 제품도 만나볼 수 있다.전재욱 (imfew@edaily.co.kr)▶ #24시간 빠른 #미리보는 뉴스 #eNews+▶ 네이버에서 '이데일리 뉴스'를 만나보세요▶ 빡침해소, 청춘뉘우스 '스냅타임'＜ⓒ종합 경제정보 미디어 이데일리 - 무단전재 & 재배포 금지＞"
2021.04.06.,"1200여명 불필요한 세무서 방문 없게…국세청, 적극행정 공무원 표창",https://n.news.naver.com/mnews/article/123/0002243701?sid=101,"◆…27일 세종시 국세청사에서 열린 적극행정 우수공무원 시상식에서 표창을 받은 국세공무원들.(사진 국세청)#. 서초세무서 설정란 조사관은 지방자치단체(강남구)에서 지급하는 경영안전지원금을 납세자(택시사업자 등)가 신청할 때, 사업장 소재지가 강남구가 아닌 납세자가 세무서를 방문해 사업자등록을 정정해야 하는 불편함이 있다고 생각했다.그는 지자체와 협업해 개인택시 등 일부 업종이 강남지부 소속 조합원이면, 사업장 소재기가 강남구 외(外)인 경우에도 지원금 혜택을 받을 수 있도록 신청요건을 손질했다. 국세청은 이러한 행정으로 1200여명의 세무서 방문인원을 축소한 것으로 추정했다. #. 북광주세무서 강용구 조사관은 증명발급을 위해 납세자가 장시간 대기하는 모습을 보고, 국민이 익숙한 민간채널인 카카오톡을 이용해서 이를 해결해야겠다고 생각했다. 이후 납세자가 카카오톡으로 민원증명 발급을 신청하면, 원하는 시간에 서류를 찾아갈 수 있도록 하는 '카카오톡 민원증명 신청 서비스' 구현을 이끌어냈다. 국세청은 6일 이들처럼 납세자의 편익을 높이기 위해 적극행정을 펼친 우수공무원 9명을 선정해 표창했다.설 조사관은 최우수상을 받았고, 강 조사관을 비롯해 전년과 동일한 신고서는 간단한 동의 절차로 신고를 마칠 수 있도록 지원한 의정부세무서 류자영 조사관, 주택양도 관련 세금상담을 위해 양도소득세 비과세·중과세 판정 프로그램을 직접 제작·배포한 중부지방국세청 박성배 조사관 등 3명이 우수상을 받았다.북부산세무서 손성웅 조사관(탈세제보 포상금 배분 관련 납세자간 분쟁해결), 광산세무서 조성재 조사관(청각장애인을 위한 영상 수어 상담 시스템 설치), 영월세무서 김태범 조사관(잘못된 세금신고로 고액체납자가 된 농민 구제), 대구지방국세청 박무성 조사관(세무서 구비서류 없이 소상공인 지원사업 심사 가능하도록 지원), 대전세무서 유병민 조사관(부가가치세 감면세액 자동계산 프로그램 개발) 등은 장려상을 받았다. 김대지 국세청장은 이날 시상식에서 ""코로나19로 인해 모두가 어려운 때에 납세자 입장에서 능동적으로 업무를 수행한 우수공무원에게 감사드린다""며 ""국민이 더욱 편안하게 납세서비스를 이용할 수 있도록 앞으로도 적극행정을 위한 노력을 지속해달라""고 당부했다.국세청은 9명의 적극행정 우수공무원에게 기존의 포상금, 포상휴가·성과급(연봉) 최고등급 외에 내부 성과평가에서도 가점을 부여하는 등 파격적인 특전을 확대·제공할 예정이다. ▶ 조세일보 홈페이지 / 정회원 가입▶ 조세일보 네이버 뉴스스탠드 구독(종합/경제)강상엽(yubyoup@joseilbo.com)저작권자 ⓒ 조세일보(http://www.joseilbo.com). 무단전재 및 재배포 금지"
2021.04.06.,'담원 기아 VS 젠지' LCK 스프링 결승 대진 완성…MSI 진출 팀은 어디?,https://sports.news.naver.com/news.nhn?oid=311&aid=0001283987,<구조 다름>
2021.04.06.,"""KIA타이거즈 이모저모 웹툰으로 즐겨요""",https://n.news.naver.com/mnews/article/079/0003488993?sid=102,"'익뚜의 기아 스토리' 매주 월요일 홈페이지·앱 등에 연재[광주CBS 조시영 기자]기아타이거즈 제공KIA타이거즈가 선수단 및 경기, 구단 소식 등을 소재로 한 웹툰 '익뚜의 기아스토리 2021'을 연재한다.주간 경기 분석 및 각종 에피소드, 이벤트 소식 등이 담긴 '익뚜의 기아스토리 2021'은 지난 3월 29일 첫 회를 시작으로 매주 월요일 구단 홈페이지와 앱, 카카오 1boon, 다음스포츠 카툰란에 업데이트 된다.스포츠 웹툰 작가 김익수 씨가 그림과 글을 맡은 '익뚜의 기아스토리'는 지난해 9월 처음 선보여 팬들의 호응을 얻었다.KIA타이거즈 설진규 마케팅 팀장은 ""다양한 온라인 콘텐츠로 팬과 소통하기 위해 올 시즌에도 웹툰을 연재한다""면서 ""웹툰을 통해 색다른 관점의 경기 분석과 에피소드를 전달해 팬 여러분에게 즐거움을 안겨드릴 것""이라고 말했다.▶ 확 달라진 노컷뉴스▶ 클릭 한 번이면 노컷뉴스 구독!▶ 보다 나은 세상, 노컷브이와 함께cla80@naver.com저작권자 © CBS 노컷뉴스 무단전재 및 재배포 금지"
2021.04.06.,"쿠팡, '총수없는 대기업집단' 된다...美 국적 김범석, 동일인 미지정",https://n.news.naver.com/mnews/article/030/0002937571?sid=101,"[제공=박지호 전자신문 기자]공정거래위원회가 이달말 쿠팡을 총수가 없는 대기업집단으로 지정한다. 당국은 외국 국적 기업 총수를 동일인으로 지정한 바 없어 미국 국적의 쿠팡 창업주 김범석 의장을 동일인(총수)로 정하지 않을 것으로 예측된다.6일 업계와 정부에 따르면 공정위는 쿠팡을 공시대상기업집단(대기업집단)으로 지정한다. 다만 '동일인'(총수)을 창업주인 김범석 의장이 아닌 법인으로 지정하기로 잠정적으로 결론을 내렸다.공정위는 대기업의 경제력 집중을 억제하기 위해 자산총액이 5조원 이상인 그룹을 공시대상기업집단으로 지정해 총수일가 사익편취 규제, 대규모 내부거래 공시의무 등을 부과한다.당국은 현재 물류센터 부지 가격 상승 등을 고려해 쿠팡의 자산이 5조원을 넘어선 것으로 보고 있다.동일인은 기업의 실질적인 지배자로 대기업집단 지정 자료와 관련된 모든 책임을 진다. 동일인에 따라 해당 기업집단의 특수관계인, 총수일가 사익편취 제재대상이 결정된다.우선 공정위는 지배력을 행사하는지를 기준으로 동일인을 결정한다. 쿠팡의 실질적 오너는 창업자인 김 의장인데, 그는 쿠팡 지분 10.2%를 갖고 있으며 차등의결권을 적용할 경우 76.7%의 의결권을 보유하고 있다.다만 공정위가 외국인을 동일인으로 지정한 사례가 전문해 미국 국적인 김 의장이 동일인으로 지정하지 않을 것으로 보인다.공정위 관계자는 “외국인이 동일인으로 지정된 사례는 없다”며 “자연인이 동일인으로 지정되지 않더라도 공정거래법 23조 7항의 적용을 받기 때문에 규제 공백이 발생하는 것은 아니다”고 말했다.해당 법조항은 특수관계인 또는 다른 회사에 상품, 부동산 등을 제공하거나 상당히 유리한 조건으로 거래하는 행위를 금지하고 있다. 김 의장이 동일인으로 지정되지 않더라도 특수관계인 일환으로 규제할 수 있다는 설명이다.따라서 쿠팡 도 개인이 아니라 법인이 동일인을 맡는 포스코나 KT처럼 법인이 될 전망이다.이 밖에 김범수 카카오 의장, 이해진 네이버 글로벌투자책임자(GIO)는 '동일인'으로 지정돼 있다.유재희기자 ryuj@etnews.com▶ ""코리아 RPA 그랜드 웨비나 2021"" 14일 생방송▶ 네이버 홈에서 [전자신문] 구독하기 [Copyright ⓒ 전자신문 & 전자신문인터넷, 무단전재 및 재배포 금지]"
2021.04.06.,"전남도, 농업인 대상 재난지원금 지급",url없음,<네이버 기사 없음>
