기사날짜,기사제목,네이버 뉴스 url,기사내용
2021.04.23.,[팩플] 카카오에 “배트맨 웹툰 좀…” 부탁한 DC코믹스의 계산,https://n.news.naver.com/mnews/article/025/0003096072?sid=105,"배트맨, 슈퍼맨, 원더우먼. 미국의 대표 히어로 만화가 한국형 웹툰으로 다시 태어난다. DC코믹스의 작품 기반 웹툰은 세계 최초. 카카오엔터테인먼트(이하 카카오엔터)는 23일 ""DC코믹스의 대표작 배트맨(24일), 저스티스리그(27일), 원더우먼(5월 4일), 슈퍼맨(5월 9일)을 순차적으로 카카오의 콘텐트 플랫폼 카카오페이지에서 서비스할 예정""이라고 밝혔다. 그런데 북미의 대표적인 콘텐트 기업 DC코믹스는 왜 카카오에 이걸 맡긴 것일까. 그 배경과 속내를 분석했다.     저스트리그 웹툰 포스터. 카카오엔터테인먼트        먼저 손 내민 DC, 북미 노리는 카카오엔터     이번 협력을 통해 DC코믹스는 기존 만화책의 웹툰화 전환 가능성을 타진하고, 카카오엔터는 DC코믹스 팬 확보와 북미 웹툰시장 경쟁력 확보를 노린다.      · 협업을 제안한 쪽은 DC코믹스다. 2019년 한국에 온 DC관계자는 카카오를 찾아 웹툰 샘플 원고를 내밀었다고 한다. 당시 카카오가 구체적이고 꼼꼼하게 피드백을 보내면서 일이 일사천리로 진행됐다. 23일 카카오엔터 관계자는 ""한국이 웹툰 종주국이긴 하지만, 출판 만화를 웹툰으로 전환하는 노하우를 가진 곳은 많지 않다""며 ""DC가 카카오의 '기다무'(기다리면 무료) 등 비지니스 모델에도 관심이 높았다""고 말했다.     · 카카오엔터는 이번 DC 웹툰을 통해 국내 DC팬의 카카오페이지 유입을 기대하고 있다. 만화책 구하기가 쉽지 않고 언어장벽도 불편했던 DC팬들을 이참에 카카오페이지에 붙들겠단 계획. 장기적으론 카카오엔터의 북미 진출에도 도움될 것으로 본다. DC코믹스 작품을 웹툰으로 전환하며 쌓인 경험과 인맥 등 유·무형의 자산을 북미 진출 발판으로 활용하겠다는 전략.       · 북미는 카카오엔터가 최근 투자를 확대하는 시장이다. 북미 웹소설 플랫폼 '래디쉬'와 웹툰 플랫폼 '타파스' 인수를 추진 중이다. 카카오엔터가 지분 40.4%를 보유한 타파스미디어 편집장이 DC코믹스 출신이란 점도 카카오엔터로선 반가운 조건. DC코믹스의 모회사인 워너브라더스와 카카오엔터의 영상 분야 협력 가능성도 열려 있다.      '출판만화→웹툰' 전환 노하우가 자산      미국 만화는 글이 많고, 그림체도 한국과 달라 리메이크가 쉽지 않은 것으로 알려져 있다. 이번 DC와 협업으로 카카오페이지는 출판만화의 디지털 전환 분야에서 특별한 노하우를 쌓았다.      · 이번 프로젝트는 카카오엔터 산하의 노블코믹스(황현수 대표)가 주도했다. 웹소설을 웹툰이나 영상·애니메이션 등으로 가공하는 2차 창작이 주력인 곳. 웹툰 '나혼자만 레벨업', '김비서가 왜 이럴까' 등이 노블코믹스 손을 거쳐 대박이 났다. 그런 노블코믹스도 이번 DC코믹스와 협업은 쉽지 않았다고 한다. 카카오엔터 관계자는 ""DC의 경우 제작 가이드가 많고 엄격해 작업이 쉽지 않았다""며 ""이번에 경험을 쌓은 노블코믹스가 향후 명작 만화를 웹툰으로 선보이는 등 다양한 모델을 발굴할 것""이라고 말했다.        한국선 협력하지만, 한국 밖에선…           DC코믹스와 추가 협력 가능성은 얼마나 될까. 이에 대해 카카오엔터 측은 ""이번에 공개할 4종 외에 추가로 선보일 DC코믹스 작품은 없다""고 했다.      오히려 DC코믹스가 한국에서 웹툰 제작·유통 노하우를 배워, 북미에서 카카오·네이버의 경쟁자가 될 가능성도 있다. 실제로 DC코믹스 측은 카카오엔터가 제작한 웹툰 4종의 유통 지역을 한국으로 제한했다. 제작 난이도가 가장 높았던 세로형 스크롤 전환이 해결됐고 번역 검수도 끝났지만, 북미 시장 등 한국 이외 지역 웹툰 판권은 DC가 보유했기 때문. 업계 관계자는 ""DC도 자체 모바일 플랫폼을 보유 중인 만큼 북미에선 자체적으로 웹툰 서비스를 할 가능성이 크다""고 말했다.        정원엽 기자 jung.wonyeob@joongang.co.kr    요즘 뜨는 기업 궁금하세요    ㅤ       이메일로 구독 신청하세요.    요즘 핫한 테크기업 소식을 입체적으로 뜯어보는 ‘기사 +α’가 찾아갑니다.    구독신청 → https://url.kr/factpl    QR코드를 찍으면 팩플 구독 신청을 할 수 있습니다.   ▶ 소름돋게 잘 맞는 초간단 정치성향테스트▶ 넌 뉴스를 찾아봐? 난 뉴스가 찾아와!▶ 당신이 궁금한 코로나, 여기 다 있습니다ⓒ중앙일보(https://joongang.co.kr), 무단 전재 및 재배포 금지"
2021.04.23.,"카카오 그라운드X, 컨센시스 손잡고 CBDC 사업 본격화",https://n.news.naver.com/mnews/article/014/0004626355?sid=105,"이더리움 인프라 개발사 컨센시스와 기술협력프라이버시, 확장성, 연결성 등 기술 역량 보완  [파이낸셜뉴스] 카카오의 블록체인 플랫폼 클레이튼이 올 하반기 한국은행에서 시범 구축 예정인 중앙은행 디지털화폐(CBDC, Central Bank Digital Currency) 사업에 대응하겠다며 플랫폼 성능 강화에 나선다.   이르면 다음달 한국은행 CBDC 시범 플랫폼 구축사업 공고가 발표될 것으로 예상되는데, 이 과제에 참여하기 위해 선제적으로 기술 성능을 높이겠다는 목적이다.    23일 카카오 블록체인 기술 자회사 그라운드X는 이더리움 블록체인 대표 인프라 개발사인 컨센시스와 기술 협력을 전개한다고 밝혔다. 23일 카카오 블록체인 기술 자회사 그라운드X는 이더리움 블록체인 대표 인프라 개발사인 컨센시스와 기술 협력을 맺고 본격 CBDC 사업 준비에 나선다고 밝혔다. 그라운드X는 컨센시스와 함께 퍼블릭 블록체인 클레이튼을 비롯해 현재 그라운드X에서 개발중인 프라이빗 버전의 클레이튼 블록체인 성능 향상을 위해 협력하기로 합의했다.   구체적으로 검토되고 있는 기능은 △최근 일반 및 금융 기업들의 정보보호에 대한 높아진 관심을 반영한 개인정보 보호 기술 △블록체인 속도 저하 없이 다수의 이용자를 수용할 수 있도록 한 확장성 △서로 다른 블록체인과 자유로운 연결을 보장하기 위한 호환성 등이다. 이는 올 하반기 한국은행이 시험적으로 구축하고자 하는 CBDC 플랫폼을 고사양화 하는데 필요한 기능이라는게 그라운드X측 설명이다.   컨센시스는 이더리움의 공동 창업자인 조셉 루빈이 설립한 블록체인 기술 솔루션 회사로, 이더리움 개인 지갑인 메타마스크와 스마트 컨트랙트(조건부자동계약체결) 개발도구인 트러플 등 이더리움 기반 인프라를 개발한 바 있다. 컨센시스는 기존 이더리움과 호환성이 큰 프라이빗 블록체인인 쿼럼을 활용해 싱가포르, 호주, 태국 등 주요국의 CBDC 사업을 주도적으로 진행하고 있다.   그라운드X 한재선 대표는 “이더리움 네트워크의 대표 인프라 개발사인 컨센시스와의 기술 협력을 통해 클레이튼 성능을 대폭 강화하여 CBDC를 발행하고 유통할 수 있는 플랫폼으로 발전할 것”이라며 “지속적인 기술적 교류를 통해 이더리움과 클레이튼의 이종 체인 간의 호환성 역시 강화할 계획”이라 전했다.   컨센시스 찰스 도시 아태지역 상무 이사는 “한국을 넘어 아시아를 대표하는 핵심 퍼블릭 블록체인 플랫폼 클레이튼과의 기술 협업을 바탕으로 큰 시너지를 낼 것”이라며 “컨센시스는 다수의 글로벌 CBDC 사업 경험이 있는 바, 클레이튼의 기술 파트너로서 클레이튼이 한국은행의 CBDC 사업에 참여하는 데에 많은 기여할 것”이라 말했다.  #카카오 #이더리움 #그라운드X #클레이튼   srk@fnnews.com 김소라 기자   ▶ 헉! 소리나는 스!토리 뉴스 [헉스] / ▶ 너 그거 아니? [두유노우]▶ 날로먹고 구워먹는 금융이슈 [파인애플] / ▶ 모(毛)아 모아 [모아시스]  ※ 저작권자 ⓒ 파이낸셜뉴스. 무단 전재-재배포 금지"
2021.04.23.,"안산시민 ""카카오T바이크 요금 비싸다""",https://n.news.naver.com/mnews/article/003/0010463019?sid=102,"[안산=뉴시스]천의현 기자=안산시청 전경.2021.04.16.mypdya@newsis.com.[안산=뉴시스]천의현 기자 = 공유 전기자전거 ‘카카오T바이크’를 이용한 안산시민 상당수가 비싼 요금에 대한 불만이 큰 것으로 조사됐다.시는 이달 6~19일 온라인 설문 웹사이트 ‘생생소통방’을 통해 이용만족도 조사를 한 결과, 이같이 나왔다고 23일 밝혔다.해당 설문은 카카오T바이크 증차 500대 기념으로 진행됐다.설문에 참여한 시민 400명 가운데 140명(35%)은 한 달에 1회 이내, 70명(17.5%)은 주 1회, 31명(7.8%)은 주3회, 10명(2.5%)은 매일 이용한다고 답하는 등 전체 응답자의 절반이 넘는 251명(63.0%)이 카카오T바이크를 이용한 경험이 있었다.연령별로는 30~40대가 235명(59%)으로 가장 많았고, 10~20대가 103명(26%), 50~60대가 62명(15%)으로 뒤를 이었다.카카오T바이크의 장점(중복 응답)은 ‘별도 대여소 반납이 필요 없는 점’을 가장 많은 219명(55%)이 꼽았다.또 ‘애매한 거리를 쉽고 빠르게 이동’ 126명(31%), ‘힘 들이지 않고 구동’ 118명(30%), ‘어플로 내 위치와 바이크 찾기’ 62명(15%) 등의 순으로 나타났다.반대로 카카오T바이크의 불편사항은 ‘이용요금이 비싸 가격조정이 필요하다’는 의견이 214명(54%)으로 가장 많았다.이와 함께 ‘거리 방치에 따른 통행 불편, 공유주차 존 설정 필요’ 175명(44%), ‘빠른 배터리 충전시스템 필요’ 73명(18%), ‘청결한 관리’ 64명(16%), ‘자전거 추가 배치’ 54명(13%) 등의 의견도 있었다.안산시민은 지난달 말 기준으로 하루 평균 1407회, 1회 평균 2.1㎞를 카카오T바이크로 이동한 것으로 나타났다.한편, 시는 카카오T바이크의 거리 방치 문제를 개선하기 위해 ▲초지역 ▲중앙역 ▲고잔NC백화점 ▲안산센트럴푸르지오아파트 ▲상록수역 ▲한대앞역 ▲한양대정문사거리 ▲그랑시티자이 ▲고대안산병원 등 9곳을 주차존으로 정하고, 주차존 이용 시민에게 인센티브를 제공하기로 했다.☞공감언론 뉴시스 mypdya@newsis.com▶ 네이버에서 뉴시스 구독하기▶ K-Artprice, 유명 미술작품 가격 공개▶ 뉴시스 빅데이터 MSI 주가시세표 바로가기<ⓒ 공감언론 뉴시스통신사. 무단전재-재배포 금지>"
2021.04.23.,내 취향저격 간식이 사무실로 온다…스낵포·카카오 '맞손',https://n.news.naver.com/mnews/article/008/0004577275?sid=101,"[머니투데이 최태범 기자] 사무실 간식 커머스 기업 스낵포가 카카오모빌리티와 함께 기업 전용 서비스를 출시한다고 23일 밝혔다. 스낵포는 인공지능(AI)과 전문 큐레이터가 간식을 선별해 사무실로 제공하는 서비스를 운영 중이다. 기존 공급자 중심의 유통 방식에서 벗어나 신청자의 기호에 맞는 간식을 정기 배송한다. 이번 사업은 카카오모빌리티와 체결한 '카카오 T 비즈니스 서비스 확대를 위한 상생 협력 업무 협약'의 일환이다. 청년기업을 통해 높은 수준의 서비스를 제공하고 카카오T 비즈니스 서비스 고객 3만여명에게 노출해 동반성장을 모색한다. 간식 배송 서비스는 '카카오T' 앱에서 이용 가능하다. 비즈니스 회원 가입 후 비즈니스 탭에서 간식 메뉴로 진입해 배송지와 선호하는 맛 등 취향 정보를 남기면 맞춤형 간식을 받아볼 수 있다. 회원 가입한 임직원들은 개별적으로도 구매할 수 있다.이웅희 스낵포 대표는 ""카카오T 서비스를 통해 스낵포 서비스를 이용하는 고객사들의 만족도가 높아질 것으로 예상한다""며 ""많은 고객들이 안전하게 간식을 받고 업무효율을 높일 수 있도록 최선을 다할 것""이라고 밝혔다. 최태범 기자 bum_t@mt.co.kr▶부동산 투자는 [부릿지]▶주식 투자는 [부꾸미TALK]▶부자되는 뉴스, 머니투데이 구독하기 <저작권자 ⓒ '돈이 보이는 리얼타임 뉴스' 머니투데이, 무단전재 및 재배포 금지>"
2021.04.23.,온플법에 전상법까지…규제 쓰나미에 속끓는 네이버·카카오,https://n.news.naver.com/mnews/article/119/0002487411?sid=105,"온라인 플랫폼 규제 두고 정부부처 경쟁 격화전문가들, 온라인 플랫폼 규제 전면 재검토 주장…중복 규제 우려 커플랫폼 업계 ""모호한 규제 우려 시장 위축 우려…혁신 저해할 것""왼쪽부터 경기도 성남시 분당구 네이버 그린팩토리 본사(왼쪽)와 제주도 카카오 본사.ⓒ각사각종 정부부처에서 온라인 플랫폼 사업자에 대한 규제 칼날을 빼들면서 네이버, 카카오, 쿠팡, 배달의 민족 등 국내 플랫폼 기업들의 혼란이 커지고 있다. 학계와 전문가들도 온라인 플랫폼 규제의 문제점을 지적하고 전면 재검토해야 한다며 주장하고 나섰다.23일 업계에 따르면 방송통신위원회의 '온라인플랫폼 이용자 보호에 관한 법'(이용자보호법) ,공정거래위원회의 '전자상거래법 개정안'(전상법)과 '온라인플랫폼 중개거래에의 공정화에 관한 법'(공정화법) 등 온라인 플랫폼사업자에 대한 법안이 추진되고 있다.이중 이용자보호법과 공정화법은 중복 규제인데다가 부처 간의 규제 주도권 싸움이 팽팽하게 벌어지고 있어 논란이 일고 있다. 공정화법은 플랫폼이 입점 판매자에게 재화·용역 구입 강제, 손해 전가 등 ’갑질‘을 막는 게 골자다. 이용자보호법은 플랫폼의 검색 알고리즘 조작, 수수료 강요 등을 방지하는 게 핵심이다.이에 더해 공정위가 지난달 7일 입법 예고한 전자상거래법 개정안도 온라인 플랫폼에서의 소비자 보호라는 명목으로 추진됐다. 다만 제29조에서는 소비자 대 소비자(C2C) 플랫폼 사업자는 개인 판매자와 소비자 사이에 분쟁이 발생할 경우 개인판매자의 신용정보를 확인·제공하도록 하고 있어 개인정보침해 우려가 제기되고 있다.◆온라인 플랫폼 급성장에 시장 격변…규제 권한 둘러싸고 정부부처 싸움 지속세종시 어진동 정부세종청사 공정거래위원회.ⓒ공정거래위원회신종 코로나바이러스감염증(코로나19)로 비대면 소비 증가로 네이버와 카카오를 비롯해 쿠팡, 배달의 민족, 컬리 등 온라인 플랫폼 기업들은 가파르게 성장했다. 실제 네이버와 카카오는 코스피 시가총액 각각 3위, 7위를 차히자며 국내 산업 주류로 올라섰다.시장의 성장과 함께 소비자피해도 지속적으로 발생하고 있다. 한국소비자연맹에 따르면 지난해 소비자단체가 운영하는 1372소비자상담센터에 접수된 전자상거래 소비자피해는 총 21만4872건이다.이에 플랫폼 시장에 대한 규제 필요성이 제기되면서 정부부처들이 각종 규제를 내놓았지만 결국 규제 주도권 경쟁으로 번지고 있다.‘이용자보호법’은 오는 27일 국회 과학기술정보방송통신위원회 소위원회에 상정될 예정이다. 그런데 공정위가 제안하고 국무회의를 통과했던 ‘공정화법’은 앞서 정무위 소위에 상정됐고, 지난 22일엔 공청회도 진행했다. 비슷한 내용의 법안이 부처 사이에 조율되지 않고 수개월째 표류하고 있다.◆플랫폼 업계 ""과도한 규제 공정한 경쟁 질서·혁신 저해할 것""23일 오전 한국인터넷기업협회와 서강대 ICT법경제연구소와 공동으로 개최한 '최근 온라인 플랫폼 규제동향을 분석한다' 토론회에서 토론자들이 발언하고 있다.ⓒ한국인터넷기업협회상황이 이렇자 국내 IT, 인터넷 기업 등 플랫폼 업계는 여러 규제가 몰려들면서 혼란이 가중되고 있다. 특히 규제의 적용 대상 기준이 명확하지 않고, 시장의 성장을 저해할 수 있다는 점에서 우려를 표하고 있다.플랫폼 업계 관계자는 “수수료가 갑질 요소라면, 우리는 사업을 하지 말란 얘긴가 자연스럽게 생각이 든다”며“전상법 온플법에 나머지 15개 법안이 붙어있는데 정부의 신중함이 필요하다. 10년 20년 뒤 국가 산업을 봤을 때 플랫폼 사업자가 주요 경제 주체라 생각한다면 더 무게감을 갖고 접근해야 한다”고 강조했다.학계 전문가들도 현재 법제화가 추진되고 있는 온라인 플랫폼 규제들이 부처 간 중복 적용, 사전규제, 신규 규제 도입 등으로 시장에 미칠 영향을 고려하지 않고 있다고 비판하며 전면 재검토를 주장하고 있는 상황이다.김현경 서울과학기술대 IT정책전문대학원 교수는 23일 한국인터넷기업협회(이하 인기협)는 서강대 ICT법경제연구소와 공동으로 '최근 온라인 플랫폼 규제 동향을 분석한다'라는 주제로 열린 토론회에서 “현재 국회논의중인 모든 온라인 플랫폼 법안들의 입법추진은 전면적으로 제고돼야 한다”고 강조했다.다른 학계 전문가 역시 현재 온플법 관련 논의가 모두 원점 재검토돼야 한다고 입을 모았다.정혜련 경찰대 법학과 교수는 공정위 안에 관해 ""플랫폼 자체의 이익 외에 다른 참가자들의 이해관계를 적절히 반영하지 못하고 있다""며 “일률적인 규제에서 탈피해 플랫폼의 종류, 규모, 영향력에 따른 개별 규제가 필요하다”고 제언했다.서희석 부산대 법학전문대학원 교수는 “온라인 플랫폼 법들이 비즈니스 모델을 제대로 이해하지 못했고 플랫폼은 평면적으로 보고 있는 게 문제“라며”정부와 국회가 입법을 위한 입법을 하는 게 아닌지, 전문가 논의를 고려해 재검토해야 한다”고 말했다.데일리안 최은수 기자 (sinpausa@dailian.co.kr)▶ 데일리안 네이버 구독하기▶ 데일리안 만평보기▶ 제보하기ⓒ (주)데일리안 - 무단전재, 변형, 무단배포 금지"
2021.04.23.,"카카오페이, 올 하반기 코스피 상장 가닥…10조원 가치 기대",https://n.news.naver.com/mnews/article/018/0004910356?sid=105,"이달 내 거래소에 코스피 상장예비심사 신청…이르면 7월 입성올해 거래액 100조원 예상…""연간 영업손익 BEP 돌파할 것""하반기 증권 MTS 출시하고, 디지털 손해보험사도 설립 추진[이데일리 이후섭 기자] 카카오페이가 올해 하반기 유가증권시장(코스피)에 상장할 전망이다. 10조원이 넘는 기업가치가 기대되는 만큼 하반기 기업공개(IPO) 시장 포문을 열며 흥행을 이끌 것으로 보인다. 카카오페이는 간편결제 서비스를 넘어 증권·보험 등으로 금융 영역을 넓히고 있다. 23일 관련 업계에 따르면 카카오페이는 이달 내 한국거래소에 코스피 상장예비심사를 신청할 계획이다. 카카오페이는 삼성증권, 골드만삭스, JP모건을 대표 주관사로, 대신증권을 공동 주관사로 선정하고 IPO 절차를 진행하고 있다.카카오뱅크가 앞서 지난 15일 코스피 상장을 위해 상장예비심사를 청구했기에 카카오페이는 코스닥 시장 상장이 점쳐지기도 했지만, 10조원 몸값에 맞게 코스피에 상장하기로 가닥을 잡은 것으로 알려졌다. 약 2개월 걸리는 심사기간을 거쳐 승인을 받으면 바로 공모 절차를 시작해 이르면 7월 코스피에 입성할 수 있을 전망이다.증권가에서는 카카오페이의 기업가치가 10조원에 이를 것으로 내다보고 있다. 카카오페이는 비대면 문화 확산으로 거래액이 급증하면서 적자폭을 대폭 축소시키고 있다. 지난 2019년 48조원이었던 카카오페이의 거래액은 지난해 67조원으로 40% 가까이 늘었다. 이에 힘입어 카카오페이의 영업수익은 2019년 1411억원에서 지난해 2844억원으로 2배가량 뛰었고, 영업손실은 653억원에서 179억원으로 줄었다. 지난해 3분기에는 손익분기점(BEP) 수준에 도달하기도 했다. 전체 거래액의 80%를 차지했던 송금 비중이 50%대로 완화되면서 수익성이 개선됐다는 분석이 나온다.카카오페이 기업가치 추정.(자료=이베스트투자증권 리서치센터)카카오페이의 올해 거래액은 100조원에 육박할 것으로 전망된다. 메리츠증권은 카카오페이의 거래액이 올해 1분기 21조5000억원에서 2분기 24조5000억원, 3분기 26조원, 4분기 28조원 수준으로 꾸준히 증가할 것으로 예상했다. 이를 기반으로 메리츠증권은 카카오페이의 기업가치를 9조6000억원 규모로 산정했고, NH투자증권과 교보증권은 10조3000억원, SK증권은 10조7000억원으로 제시했다. 이베스트투자증권은 카카오페이의 기업가치를 무려 18조원으로 평가했다.성종화 이베스트투자증권 연구원은 “카카오페이는 온라인결제, 금융서비스 중심의 폭발적 성장이 지속되고 있고, 하반기에는 마이데이터 사업(아직 사업자 선정은 안됐으나 사업은 준비 중), 모바일트레이딩시스템(MTS), 디지털손해보험 등으로 성장성은 더욱 가팔라질 것”이라며 “올해는 영업손익의 구조적인 BEP 돌파가 예상된다”고 내다봤다.카카오페이는 지난해 자회사 카카오페이증권을 성공적으로 출범시켜 펀드 투자를 선보인데 이어 올해에는 국내외 주식매매를 위한 모바일트레이딩시스템(MTS)을 출시할 계획이다. 카카오페이증권은 지난 3월기준 누적 계좌 개설자 수가 400만명을 돌파했고 주식투자 펀드 3종, EMP 펀드 3종, 채권투자 펀드 2종 등 총 8개의 펀드 라인업을 구축하고 있다.또 카카오페이는 지난 1월 금융당국에 디지털 손해보험사 설립을 위한 예비인가를 신청했다. 지난 2019년부터 삼성화재와 함께 디지털 손해보험사 설립을 추진해왔으나 합작 설립이 무산된 카카오페이는 독자 설립을 추진해 올 하반기 출범을 목표로 예비인가 승인, 법인 설립, 본허가 승인 등의 절차를 밟을 예정이다. 카카오페이는 법인보호대리점(GA) `인바이유`와 함께 보험 상품을 선보여 온 것에서 한 단계 더 나아가 디지털 손해보험사 설립을 통해 합리적이고 차별화된 보험 밸류체인을 구축해 나갈 계획이다.이후섭 (dlgntjq@edaily.co.kr)▶ #24시간 빠른 #미리보는 뉴스 #eNews+▶ 네이버에서 '이데일리 뉴스'를 만나보세요▶ 빡침해소, 청춘뉘우스 '스냅타임'＜ⓒ종합 경제정보 미디어 이데일리 - 무단전재 & 재배포 금지＞"
