기사날짜,기사제목,네이버 뉴스 url,기사내용
2021.04.15.,"코스피 3200선 바짝…카카오, 액면 분할 효과 ‘톡톡’",https://n.news.naver.com/mnews/article/374/0000240950?sid=101,"[앵커]코스피가 석 달 만에 장중 3200선을 회복했습니다.나흘 만에 거래가 재개된 카카오는 '액면분할' 효과를 톡톡히 봤습니다.자세히 알아봅니다.김창섭 기자, 오늘(15일) 코스피 얼마에 마감했나요?[기자]장중 3,200선을 돌파했던 코스피는 상승 폭을 점차 줄이더니 결국 어제보다 소폭 오른 3,194.33에 거래를 마쳤습니다.개인과 외국인이 순매수에 나섰지만 기관이 5,800억 원 넘게 팔면서 상승 폭을 줄였습니다.외국인은 오늘까지 코스피에서 3거래일 연속 순매수를 보이고 있는데요.외국인이 이달 1일부터 오늘까지 코스피와 코스닥 등 국내 증시에서 순매수한 금액은 2조 8천억 원에 달합니다.[앵커]카카오가 주식 액면가액을 일정하게 나눠 주식을 불리는 '액면분할'로 관심을 모았는데, 주가가 좀 올랐습니까?[기자]그렇습니다.카카오는 액면분할 전보다 7.59% 오른 12만 500원에 거래를 마쳤습니다.1주당 가격이 5분의 1수준으로 바뀌면서 특히 개인투자자의 거래 부담이 줄어들며 '사자세'가 몰린 겁니다.실제로 오늘 개인은 카카오를 코스피와 코스닥시장을 합쳐 가장 많은 4300억원을 사들였습니다.[앵커]최근 코스닥 흐름도 좋은데, 오늘은 어땠습니까?[기자]어제까지 6거래일 연속 올랐던 코스닥은 오늘은 소폭 하락하며 1,013.90에 마감했습니다.개인이 1,400억 원 가까이 샀지만, 외국인과 기관이 '팔자'에 나서며  힘을 잃었습니다. 서울 외환시장에서 원달러 환율은 어제보다 1원 오른 1,117원 60전에 거래를 마치며 하루 만에 반등했습니다.한편  이 시간 현재 뉴욕증시 3대 지수선물은 모두 오르고 있습니다.SBS Biz 김창섭입니다.김창섭 기자(cskim@sbs.co.kr) ▶ 돈 세는 남자의 기업분석 '카운트머니' [네이버TV]▶ 경제를 실험한다~ '머니랩' [네이버TV] 저작권자 SBS미디어넷 & SBS I&M 무단전재-재배포 금지"
2021.04.15.,"[특징주] 카카오, 액면분할 후 첫 거래일 급등",url없음,<네이버 기사 없음>
2021.04.15.,"카카오, 액면분할 효과…7%대 상승 마감, 시총 5위 등극",https://n.news.naver.com/mnews/article/057/0001568330?sid=101,"카카오가 액면분할 후 첫 거래일인 오늘(15일) 큰 폭으로 올랐습니다.오늘 유가증권시장에서 카카오는 전 거래일보다 7.59% 오른 12만500원에 거래를 마쳤습니다.장 초반 한때 18% 오른 13만2천500원까지 상승하기도 했습니다.개인이 4천348억원어치를 순매수했으며 카카오의 개인 순매수 금액은 유가증권시장과 코스닥을 통틀어 1위였습니다.반면 기관과 외국인은 각각 2천774억원, 1천441억원을 순매도했습니다.종가 기준 시가총액은 53조4천790억원으로 코스피 종목 중 5위에 올랐습니다.카카오는 주식 액면가를 500원에서 100원으로 쪼개는 분할(1주→5주)을 마치고 사흘간 거래정지를 거쳐 오늘 거래를 재개했습니다.액면분할을 앞두고 카카오는 가상화폐 거래소 업비트 운영사인 두나무 지분가치 등이 부각되며 신고가 행진을 이어왔습니다.오늘 증권가에서는 카카오 목표주가를 줄줄이 상향 조정했습니다. 목표주가를 올린 증권사는 이베스트투자증권(13만2천원→15만2천원), NH투자증권(12만원→14만원), 신한금융투자(11만7천원→13만5천원), KTB투자증권(11만원→13만원) 등이 있습니다.이문종 신한금융투자 연구원은 ""카카오커머스, 카카오모빌리티 등 자회사의 가치를 소폭 상향했으며 두나무 가치도 신규 반영했다""며 ""모든 자회사가 고성장 구간이며 상장 모멘텀도 있다""고 설명했습니다.이어 ""액면분할 자체는 기업자치에 영향은 없으나 개인 투자자 접근성 확대 측면에서 긍정적""이라고 말했습니다.[디지털뉴스부]▶ 네이버에서 'MBN뉴스'를 구독하세요!▶ 김주하 앵커 'MBN 종합뉴스' 저녁 7시 20분 진행▶ MBN 무료 고화질 온에어 서비스 GO!< Copyright ⓒ MBN(www.mbn.co.kr) 무단전재 및 재배포 금지 >"
2021.04.15.,"'액면분할 완료' 카카오, 오늘 거래 재개…증권가 예측은?",https://n.news.naver.com/mnews/article/057/0001568152?sid=101,"5대 1 액면분할을 통해 국민주 변신을 꾀하는 카카오의 주가 향방에 눈길이 쏠리고 있습니다. 최근 액면분할 이후 주가가 부진한 사례가 많았음에도 증권가에서는 카카오에 대해 '더 간다'는 예측을 드러내고 있습니다.금융투자업계에 따르면 카카오는 오늘(15일) 액면분할을 완료하고 주당 11만1600원에 변경 상장할 예정입니다. 지난 9일 종가였던 55만8000원에서 5분의 1로 낮아진 것입니다. 카카오는 액면분할을 위해 12일부터 어제(14일)까지 사흘 간 주식 거래를 중지했습니다.앞서 지난 2월 카카오 측은 유통주식수 확대를 위해 5대 1 액면분할을 결정했습니다. 이에 따라 발행주식수는 총 8870만4620주에서 4억4352만3100주로 늘어났습니다.액면분할은 기업가치에 전혀 영향이 없지만 주가에는 긍정적 재료로 여겨집니다. 수십만 원에 달하던 주가가 수만 원대로 가격이 낮아지기 때문에 투자자의 접근성이 높아지는 때문입니다.특히 주가의 그림자로 여겨지는 거래량 또한 늘어날 가능성이 커 주가에 호재로 작용하는 경우가 많습니다.액면분할 계획이 전해진 이후 카카오의 주가는 기대감을 반영해 15.2% 상승했습니다. 같은 기간 코스피 상승률인 2.2%를 크게 웃돕니다. 4월 들어서만 12% 가량 오른 주가는 상장 이후 최고가를 기록 중입니다.물론 액면분할 이후 주가가 부진한 경우도 많습니다.금융정보업체 에프앤가이드에 따르면 2018년 이후 3년 간 액면분할을 결정한 기업 71곳 중 한 달 뒤 주가가 오른 상장사는 24곳으로 약 3분의 1에 불과했습니다. 대표적으로 삼성전자는 2018년 주당 260만 원에 달하던 주식을 50대 1로 분할했지만 이후 한동안 4만~5만 원대에서 횡보하며 부진했습니다.증권가에선 최근 주가가 액면분할 기대감을 반영해 랠리를 펼쳐오긴 했지만, 밸류에이션은 여전히 부담 없는 수준이란 의견도 나옵니다. 이민아 대신증권 연구원은 ""2015~2017년 카카오의 주가수익비율(PER)은 86~91배 수준에 형성됐는데, 당시 영업이익은 정체 또는 감익 추세였다""면서 ""올해 PER는 75배(지배지분 기준)로 과거 대비 부담 낮아진 반면 영업이익 성장률은 76%에 달한다. 올해도 신고가 경신을 지속할 전망""이라고 설명했습니다.여기에 카카오 계열사들이 대거 증시에 상장할 예정인 점도 주가를 밀어 올리는 요인입니다. 올해 카카오페이와 카카오뱅크가 기업공개(IPO)를 예정하고 있으며 카카오엔터테인먼트 역시 내년 미국 증시 상장을 검토 중인 것으로 알려졌습니다.김동희 메리츠증권 연구원은 ""카카오의 지배구조는 유기적으로 변화하며 성장하고 있다""면서 ""특히 하반기 카카오페이의 IPO가 구체화될 가능성이 있는데, 현재 카카오페이의 기업가치는 10조 원 안팎""이라고 설명했습니다.이밖에 가상화폐 시장의 활황과 거래대금 상승으로 블록체인 및 핀테크 전문기업 '두나무' 관련 지분법 이익과 지분가치도 모두 큰 폭으로 상승할 전망입니다.이동륜 KB증권 연구원은 ""비트코인 거래액 급증으로 두나무 지분가치가 부각되고 있는 가운데 4월 현재 카카오의 두나무 지분율은 21.3%""이라며 ""가상화폐 시장의 변동성이 높은 만큼 최근 주가 급등이 부담스러울 수 있으나, 중장기 성장 로드맵이 구체화되고 있어 장기적 측면에서의 매수 관점은 여전히 유효하다""고 말했습니다.[디지털뉴스부]▶ 네이버에서 'MBN뉴스'를 구독하세요!▶ 김주하 앵커 'MBN 종합뉴스' 저녁 7시 20분 진행▶ MBN 무료 고화질 온에어 서비스 GO!< Copyright ⓒ MBN(www.mbn.co.kr) 무단전재 및 재배포 금지 >"
2021.04.15.,"(특징주)카카오, 액면분할 후 주가 급등…삼바 제치고 시총 5위",url없음,<네이버 기사 없음>
2021.04.15.,[시그널] 'IPO 대어' 카카오뱅크 드디어 출격···이르면 7월 코스피 입성,https://n.news.naver.com/mnews/article/011/0003897819?sid=101,"거래소에 상장 예비심사 청구장외 시총 30조 훌쩍, KB금융 시총도 넘어서고평가 논란에도 IPO 공모는 흥행 관측윤호영 카카오뱅크 대표가 지난 2월 2일 열린 온라인 간담회에서 올해 성장 목표를 설명하고 있다. /사진 제공=카카오뱅크[서울경제] 카카오(035720)뱅크가 이르면 오는 7월 코스피에 입성한다. 장외 시가총액이 30조 원을 훌쩍 넘어선 기업공개(IPO) 대어로 고평가 논란 속에서도 실적 성장세를 앞세워 공모에 흥행할지 관심이 쏠린다.카카오뱅크는 15일 거래소에 상장 예비 심사를 청구했다고 밝혔다. 심사가 예정대로 진행될 경우 6월 공모, 7월 코스피 입성도 가능할 것으로 전망된다. 상장 주관사는 KB증권과 크레디트스위스다.카카오뱅크는 시중은행에 비해 빠른 성장세로 주목을 받고 있다. 지난해 말 기준 누적 가입자가 1,360만 명에 달한다. 지난해 영업수익 8,042억 원, 영업이익 1,226억 원, 당기순이익 1,136억 원을 기록했다. 지난 2019년의 매출 6,649억 원, 영업이익 133억 원, 당기순이익 137억 원에 비해 크게 늘었다.기업 가치는 지난해 유상증자 당시 9조 3,000억 원이었다. 현재 장외 시가총액이 30조 원을 웃돈다. 장외가 기준으로는 국내 은행 지주 1위인 KB금융의 시가총액(22조 4,536억 원)도 넘어섰다. 지난해 KB금융의 당기순이익은 3조 5,022억 원. 카카오뱅크의 정보통신기술(ICT) 역량과 빠른 성장세를 고려해도 다소 고평가됐다는 지적도 있다.다만 IPO 투자자들은 카카오뱅크가 상장 일정을 서두르면서 공모 성공 가능성이 높아졌다고 진단한다. 올해 최대어로 꼽히는 LG에너지솔루션에 앞서 공모에 나서는 점이 공모 흥행에 긍정적이라는 판단이다. 이경준 혁신투자자문 대표는 “올해 최대어로 꼽히는 LG에너지솔루션 청약에 기관들이 대거 참여하면 기관 자금이 묶이게 된다”며 “LG에너지솔루션·카카오페이·현대엔지니어링 등 초대형 대어에 앞서 공모하는 점이 수요예측 흥행에 도움이 될 수 있다”고 말했다. 최근 대어들의 상장 이후 주가가 하락하는 경향이 있어 상장 직후 공모가 대비 지나치게 높은 가격으로 추격 매수하는 것은 유의해야 한다는 지적도 덧붙였다./김민석 기자 seok@sedaily.com▶ 상위 1% 투자자 픽! [주식 초고수는 지금]▶ 서울경제 더 폴리틱스 뉴스를 만나보세요!▶ 네이버 채널에서 '서울경제' 구독해주세요!저작권자 ⓒ 서울경제, 무단 전재 및 재배포 금지"
2021.04.15.,"카카오게임즈, '오딘: 발할라 라이징' 28일 사전예약 시작",https://n.news.naver.com/mnews/article/003/0010448367?sid=101,"모바일·PC 동시 구현 가능한 버전으로 막바지 개발 중[서울=뉴시스] 오동현 기자 = 글로벌 멀티플랫폼 게임 기업 카카오게임즈가 신작 모바일 MMORPG '오딘: 발할라 라이징'의 사전 예약을 오는 28일부터 시작한다.라이온하트 스튜디오가 개발 중인 '오딘'은 블레이드' 시리즈로 유명한 김재영 대표를 비롯해 '삼국블레이드'의 이한순 PD와 '마비노기 영웅전' 등으로 유명한 김범 AD가 참여한 작품이다.'오딘'은 모바일과 PC온라인에서 모두 플레이가 가능한 멀티플랫폼 게임으로 개발 중이며, '언리얼 엔진4'와 '3D 스캔', '모션 캡쳐' 기술 등을 사용해 새로운 차원의 그래픽을 구사할 전망이다.카카오게임즈는 대규모 전투 장면을 담은 인게임 시네마틱 티징 영상도 공개하며 기대감을 높이고 있다.  상반기 출시를 예고하고 있는 '오딘'은 ▲북유럽 신화의 세계관 ▲거대한 대륙을 구현한 오픈월드 ▲캐릭터 간의 유기적 역할 수행 ▲대규모 전쟁 등 방대한 콘텐츠를 선보일 예정이다.☞공감언론 뉴시스 odong85@newsis.com▶ 네이버에서 뉴시스 구독하기▶ K-Artprice, 유명 미술작품 가격 공개▶ 뉴시스 빅데이터 MSI 주가시세표 바로가기<ⓒ 공감언론 뉴시스통신사. 무단전재-재배포 금지>"
2021.04.15.,"김범수 카카오 의장, 5000억 지분 팔아 재단 설립",url없음,<네이버 기사 없음>
2021.04.15.,"카카오, 올해 첫 대규모 개발자 채용 ...채용연계형 인턴십 모집 오늘 개시",url없음,<네이버 기사 없음>
2021.04.15.,"""카카오, 자회사 가치 부각‥액분 후 목표가 13만5,000원""",https://n.news.naver.com/mnews/article/011/0003897431?sid=101,"[신한금융투자 보고서]자회사 고성장..상장 모멘텀도 존재액면분할, 접근성 확대 측면서 긍정적[서울경제] 신한금융투자는 자회사 가치가 부각되고 있다며 15일 액면분할해 후 거래가 재개된 카카오(035720)의 목표주가로 13만5,000원을 제시했다.이문종 신한금융투자 연구원은 “커머스, 모빌리티 두나무 등 모든 자회사들이 고성장 구간이며 상장 모멘텀도 존재한다”며 ""액면분할 자체는 기업가치에 영향은 없으나 개인투자자 접근성 확대 측면에서 긍정적""이라고 평가했다. 부문별로 보면 카카오커머스에 대해 “거래액은 약 6조원 수준으로 추정되나 영업이익은 전년 동기 대비 110.8% 증가한 1,595억원에 달한다”며 “매각 진행 중인 이베이코리아의 거래액 대비 영업이익(거래액 20조원,영업이익 850억원)과 비교해 보면 카카오 플랫폼의 가치는 더욱 부각된다”고 평가했다.카카오모빌리티는 택시기사 대상 유료 멤버십(월 9만9,000원)을 출시하는 등 수익구조가 다양화하고 있어 연내 흑자 전환이 기대되며, 카카오페이는 결제 및 금융거래액 확대에 적자폭이 대폭 축소됐다고 있다고 평가했다.연내 상장이 예상된 카카오페이와 카카오뱅크, 미국 시장 상장을 검토 중인 카카오엔터테인먼트도 이 과정에서 재평가기 이뤄질 것으로 전망했다.최근 가상화폐 투자 붐에 암호화폐 거래소를 운영하는 두나무(21.3% 보유)의 가치 재평가도 이뤄질 것으로 기대했다. 이 연구원은 “올 1분기 두나무 영업이익은 4,000억원 이상으로 추정된다”며 “미국거래소 코인베이스 상장에 따라 객관적인 평가도 가능해질 전망”이라고 설명했다. 신한금투는 카카오의 1분기 매출을 1조2,500억원, 영업이익을 1,602억원으로 전망했다. 각각 전년 동기 대비 43.8%, 81.6% 증가한 수치로 시장 기대치에 부합하는 수준이다. 한편 이날 오전 9시 33분 현재 유가증권 시장에서 카카오는 전일보다 9.82%(1만1,000원) 오른 12만3,000원에 거래되고 있다. 개장 직후는 13만2,500원까지 치솟기도 했다. /양사록 기자 sarok@sedaily.com▶ 상위 1% 투자자 픽! [주식 초고수는 지금]▶ 서울경제 더 폴리틱스 뉴스를 만나보세요!▶ 네이버 채널에서 '서울경제' 구독해주세요!저작권자 ⓒ 서울경제, 무단 전재 및 재배포 금지"
2021.04.15.,"카카오, 올해 첫 대규모 개발자 채용 ...채용연계형 인턴십 모집 오늘 개시",url없음,<네이버 기사 없음>
2021.04.15.,"""카카오, 자회사 가치 부각‥액분 후 목표가 13만5,000원""",https://n.news.naver.com/mnews/article/011/0003897431?sid=101,"[신한금융투자 보고서]자회사 고성장..상장 모멘텀도 존재액면분할, 접근성 확대 측면서 긍정적[서울경제] 신한금융투자는 자회사 가치가 부각되고 있다며 15일 액면분할해 후 거래가 재개된 카카오(035720)의 목표주가로 13만5,000원을 제시했다.이문종 신한금융투자 연구원은 “커머스, 모빌리티 두나무 등 모든 자회사들이 고성장 구간이며 상장 모멘텀도 존재한다”며 ""액면분할 자체는 기업가치에 영향은 없으나 개인투자자 접근성 확대 측면에서 긍정적""이라고 평가했다. 부문별로 보면 카카오커머스에 대해 “거래액은 약 6조원 수준으로 추정되나 영업이익은 전년 동기 대비 110.8% 증가한 1,595억원에 달한다”며 “매각 진행 중인 이베이코리아의 거래액 대비 영업이익(거래액 20조원,영업이익 850억원)과 비교해 보면 카카오 플랫폼의 가치는 더욱 부각된다”고 평가했다.카카오모빌리티는 택시기사 대상 유료 멤버십(월 9만9,000원)을 출시하는 등 수익구조가 다양화하고 있어 연내 흑자 전환이 기대되며, 카카오페이는 결제 및 금융거래액 확대에 적자폭이 대폭 축소됐다고 있다고 평가했다.연내 상장이 예상된 카카오페이와 카카오뱅크, 미국 시장 상장을 검토 중인 카카오엔터테인먼트도 이 과정에서 재평가기 이뤄질 것으로 전망했다.최근 가상화폐 투자 붐에 암호화폐 거래소를 운영하는 두나무(21.3% 보유)의 가치 재평가도 이뤄질 것으로 기대했다. 이 연구원은 “올 1분기 두나무 영업이익은 4,000억원 이상으로 추정된다”며 “미국거래소 코인베이스 상장에 따라 객관적인 평가도 가능해질 전망”이라고 설명했다. 신한금투는 카카오의 1분기 매출을 1조2,500억원, 영업이익을 1,602억원으로 전망했다. 각각 전년 동기 대비 43.8%, 81.6% 증가한 수치로 시장 기대치에 부합하는 수준이다. 한편 이날 오전 9시 33분 현재 유가증권 시장에서 카카오는 전일보다 9.82%(1만1,000원) 오른 12만3,000원에 거래되고 있다. 개장 직후는 13만2,500원까지 치솟기도 했다. /양사록 기자 sarok@sedaily.com▶ 상위 1% 투자자 픽! [주식 초고수는 지금]▶ 서울경제 더 폴리틱스 뉴스를 만나보세요!▶ 네이버 채널에서 '서울경제' 구독해주세요!저작권자 ⓒ 서울경제, 무단 전재 및 재배포 금지"
2021.04.15.,"[특징주] 카카오, 액면분할 첫 날 주가 8% 오르며 강세",url없음,<네이버 기사 없음>
2021.04.15.,"몸값 20兆 '노란 메기'가 온다…카카오뱅크, 이르면 7월 상장",https://n.news.naver.com/mnews/article/015/0004530988?sid=101,"예비심사 청구…최소 2조 조달月 1335만명 이용 '뱅킹앱 1위'순이익 1년새 8배 늘며 급성장자본확충 땐 '규모의 대출' 가능카카오뱅크가 기업공개(IPO) 절차에 들어갔다. 국내 인터넷은행 중 상장을 시도하는 첫 사례다. 이 회사는 이번 상장을 통해 2조~5조원을 조달할 전망이다. 증시 입성을 계기로 ‘챌린저 뱅크’(새로 설립된 모험적 성격의 은행)였던 카카오뱅크가 ‘게임 체인저’로 변모할 것이란 분석이 나온다. 슈퍼 플랫폼으로 고속 성장15일 투자은행(IB)업계에 따르면 카카오뱅크는 이날 한국거래소에 유가증권시장 상장을 위한 예비심사를 청구했다. 6월께 승인받은 뒤 청약 절차를 밟아 이르면 7월 상장할 것으로 보인다. 상장주관사는 KB증권·크레디트스위스(CS)가 맡는다.카카오뱅크는 기업가치를 20조원 이상으로 인정받겠다는 목표를 세웠다. 지난해 말 외국계 사모펀드(PEF) TPG캐피털과 앵커에쿼티파트너스로부터 2500억원을 투자 유치할 때만 해도 9조3000억원으로 평가받았다. 그러나 세계적으로 핀테크 기업의 몸값이 치솟고 있어 투자 유치 당시보다 기업가치가 두 배가량 상승할 것으로 기대하고 있다.전문가들은 카카오뱅크가 카카오그룹의 대표적 수익창출 모델로 성장할 것으로 예상하고 있다. 출범 3년 만에 흑자 전환하며 세계 인터넷은행 중 괄목할 만한 성공 사례를 보여주고 있다는 점에서다. 카카오뱅크의 지난해 순이익(1136억원)은 전년 대비 8배 이상 늘었다. 지점 운영 대신 플랫폼인 카카오톡을 활용한 비대면 채널을 활용해 수익성을 극대화했다는 평가다. 지난해 처음으로 65억원의 수수료 수익도 거뒀다. 현금자동입출금기(ATM) 수수료와 중도상환 수수료 등을 무료로 한 탓에 적자가 지속됐지만 이용자가 늘면서 수익을 내는 구조로 바뀐 것이다. 카카오뱅크의 앱 월간 순이용자(MAU)는 1335만 명으로 뱅킹 앱 중 1위다. 플랫폼 역량 앞세워 ‘공격 앞으로’카카오뱅크는 카카오의 친숙한 브랜드 파워와 강력한 플랫폼 역량을 앞세워 ‘메가금융 플랫폼’으로 거듭날 계획이다. 공모로 마련한 실탄을 통해 공격적으로 사업을 확장할 것으로 예상된다. 우선 고신용자 신용대출에 치우쳤던 대출상품 포트폴리오를 확대한다. 이르면 올 3분기에 4등급 이하 중·저신용자 전용 대출을 선보인다. 보증서 없이 카카오뱅크의 자체 신용만으로 대출을 내주는 상품이다.미개척 영역이던 기업금융과 주택담보대출 시장에도 진출한다. 올 하반기에는 보증 심사와 대출 실행의 모든 단계를 비대면으로 전환한 개인사업자 대출을, 내년 이후에는 출범 이후부터 준비해온 ‘카뱅표’ 주택담보대출 상품을 내놓을 전망이다. 금융권의 한 관계자는 “카카오뱅크가 기업공개로 자본을 확충해 국제결제은행(BIS) 기준 자기자본비율을 높이면 다른 시중은행처럼 ‘규모의 대출’을 할 수 있을 것”이라고 말했다. 시중은행들의 견제 심화 우려그러나 제도권 시중은행들의 견제로 폭발적인 성장은 어려울 것이란 분석도 있다. 급여통장 중심의 ‘주거래은행’ 개념이 확실한 한국에서 카카오뱅크는 주거래 소비자 기반이 약하다는 지적이다. 30대 이상 금융소비자는 시중은행을 주거래로, 인터넷은행을 보조 은행으로 거래하는 경우가 많다는 것이다.기업가치 고평가 논란도 제기된다. 자산 규모에 비해 기업가치가 지나치게 부풀려졌다는 것이다. 장외시장에서 카카오뱅크의 시가총액은 34조원에 달한다. 국내 은행지주 1위인 KB금융(약 22조원)과 2위인 신한지주(19조원)의 시가총액을 넘어섰다. 카카오뱅크가 20조원의 기업가치로 상장한다면 주당순자산비율(PBR)은 10배에 육박한다. 국내 금융지주사의 PBR은 0.3~0.4배다.증권가에서는 카카오뱅크를 단순히 금융지주사와 비교해서는 안 된다는 주장이 나온다. 세계적으로 테크핀 기업이 높은 가치로 평가받고 있어서다. 중국 알리바바의 금융 자회사 앤트파이낸셜의 기업가치는 세계 최대 은행인 중국 공상은행의 시가총액(250조원)을 뛰어넘는 것으로 추정된다. 텐센트 산하 중국 최대 디지털은행인 위뱅크(WeBank)는 2018년 소수 지분 매각 과정에서 PBR 12배를 인정받았다.전문가들은 카카오뱅크가 상장 이후 플랫폼 기업으로서 선도적인 지위를 구축할 수 있느냐에 따라 은행업계 판도가 좌우될 것으로 보고 있다. 일례로 쿠팡은 지난달 뉴욕증시 상장으로 5조원을 끌어모은 뒤 물류 시스템에 공격적인 투자를 단행하면서 전자상거래시장의 선두 자리를 굳혔다. 신우석 베인앤드컴퍼니 금융부문 파트너는 “카카오뱅크가 빅테크 DNA를 바탕으로 중금리 대출, 주담대 등 새로운 시장에서 표준을 새로 만드는 혁신을 보여줘야 한다”고 말했다.전예진/빈난새 기자 ace@hankyung.com▶ 경제지 네이버 구독 첫 400만, 한국경제 받아보세요▶ 한국경제앱 다운받고 ‘암호화폐’ 받아가세요▶ 한국경제 구독신청-구독료 10% 암호화폐 적립 ⓒ 한국경제 & hankyung.com, 무단전재 및 재배포 금지"
