기사날짜,기사제목,네이버 뉴스 url,기사내용
2021.07.11.,"""기사 평점 낮으면 배차 혜택 못 준다"" 카카오 택시 약관 변경",https://n.news.naver.com/mnews/article/001/0012516943?sid=105,"승객이 매긴 평점, 기준치 미달하면 '프로 멤버십' 해지…카카오 종속 심화 우려""사실상 카카오가 택시기사 생명줄 쥐고 마음대로 하겠다는 것"" 반발[연합뉴스 자료사진]    (서울=연합뉴스) 홍지인 기자 = 앞으로 카카오 택시 기사는 승객으로부터 받은 평점이 낮으면 배차 혜택을 받지 못하게 된다.     11일 카카오모빌리티에 따르면 22일부터 카카오 T 택시 유료 요금제 '프로 멤버십'에 새로운 약관이 적용된다.     새 약관은 기사 평점이 회사가 별도 공지한 멤버십 가입 기준 평점보다 낮은 경우 '프로 멤버십' 가입을 승낙하지 않거나 해지할 수 있도록 하는 내용을 골자로 한다. 시행일 이후에 '프로 멤버십'에 신규 가입한 기사에게 새 약관이 적용된다.    카카오 택시는 승객이 이용 후 해당 기사에 대해 별 5개 만점으로 친절도 등을 평가할 수 있다. 지금까지는 이 평점이 택시를 부를 때 단순히 참고용이었다면, 앞으로는 카카오가 평점을 근거로 가입 택시를 관리하겠다는 얘기다.    평점 관리의 첫 대상이 된 '프로 멤버십'은 택시 기사가 월 9만9천 원을 내면 여러 가지 배차 혜택을 주는 프로그램이다.     택시 기사가 원하는 목적지의 콜을 빠르게 확인하는 '목적지 부스터' 기능과 주변의 실시간 콜 수요 지도, 단골 승객 배차 혜택 등이 포함된다.    카카오모빌리티는 앞으로 '프로 멤버십'에 신규 기능을 추가하는 등 업그레이드를 할 예정으로, 이를 위해 가입·갱신 기준을 마련했다는 입장이다.     회사 관계자는 ""카카오 T 택시에서 우수한 서비스 품질을 제공해오신 기사님들께 더욱더 많은 혜택을 제공하는 방향으로 업그레이드할 예정""이라며 ""기사님들의 반응을 지켜보며 지속해서 향상해 나갈 것""이라고 말했다.    그러나 택시 측의 반발이 변수다.    택시 단체들은 '프로 멤버십'이 처음 나올 때부터 이를 '강제 유료화'로 간주하고 거세게 반발해오고 있다.    국내 택시 호출 시장에서 카카오의 점유율은 80%가 넘는 것으로 추산되는데, 택시 수요가 한정적이란 점을 고려하면 웬만큼 비싸더라도 배차 혜택을 주는 요금제에 가입하지 않기란 어렵기 때문이다.    여기에 앞으로 카카오가 평점으로 기사를 관리하기 시작하면 종속이 더욱 심화할 것이란 우려가 나온다.    한 60대 개인택시 기사는 이번 약관 변경에 대해 ""사실상 카카오가 택시 기사 생명줄을 쥐고 마음대로 하겠다는 것 아니냐""라고 말했다.    ljungberg@yna.co.kr"
2021.07.11.,"[동학개미 멘토 박세익]①""7만전자는 매력적…지금 카카오는 고점""",https://n.news.naver.com/mnews/article/421/0005469811?sid=101,"""이기는 주식투자는 좋은 기업 주식을 좋은 가격에 사는 것""""10년 재무제표와 주가차트 보는 게 유용…변화사냥꾼 돼야""박세익 체슬리자문 전무가 지난 6일 서울 여의도 중소기업중앙회 빌딩에 위치한 사무실에서 뉴스1과 인터뷰를 하고 있다. 2021.7.6/뉴스1 © News1 이성철 기자(서울=뉴스1) 정은지 기자,전민 기자 = '동학개미들의 멘토'로 불리는 박세익 체슬리투자자문 전무는 이기는 주식 투자를 위해서는 좋은 주식을 좋은 가격에 사야 한다고 누누이 강조해 왔다. 아무리 위대한 기업 주식을 샀더라도 투자 시점에 따라 수익률이 천차 만별이기 때문이다. 대표적인 사례가 대장주 삼성전자다. 지난해 삼성전자 주식을 산 투자자라면 수십%의 짭짤한 수익률을 올렸겠지만 주가가 급등했던 올해 1월에 산 투자자라면 마이너스 수익률에 허망할 수밖에 없다.그렇다면 지금은 삼성전자를 살 때일까. <뉴스1>은 지난 6일 서울 여의도 체슬리투자자문 본사에서 박 전무를 만나 직접 물어봤다. ◇""삼성전자 7만원대라면 매력적…카카오 PBR 고점 수준""-삼성전자가 '7만전자'로 내려오면 사도 되나.▶주식이든, 빌딩이든 가격이 싸다는 것만큼 호재는 없다. 삼성전자의 주당 배당금이 지난해 수준인 2000원이라고 가정했을 때 8만원에 산 투자자의 배당수익률은 2.5%지만 9만원이나 10만원에서 사면 배당수익률은 달라진다. 현재 지분 약 55%를 보유하고 있는 외국인들은 꾸준한 배당을 요구하고 있어 삼성전자는 앞으로 배당을 늘릴 것이다. 또한 이재용 부회장 체제가 유지되기 위해서는 삼성전자의 고배당정책이나 자사주 매입과 같은 주주환원 정책이 없으면 안된다. 삼성전자의 배당 성향, 현 수준의 금리 등을 고려했을 때 삼성전자 주가가 7만원대라면 아주 매력적인 수준이라고 판단된다.-삼성전자 때문에 마음고생하는 투자자도 많은데.▶ 삼성전자 등 반도체 기업 주가는 지난해 11월부터 3개월간 70~80%나 올랐기 때문에 지금은 쉬고 있는 구간으로 보고있다. 삼성전자가 조정을 받았을 때 샀던 투자자들에겐 70%의 수익을 안겨줬지만 주가가 70% 오른 이후 삼성전자라는 위대한 기업 주식을 산 사람들은 지금 굉장히 짜증스러울거다. 좋은 기업을 좋은 가격에 사야한다.  -그렇다면 카카오는 어떤가.▶작년 이맘때만 하더라도 카카오 PBR(주가순자산비율)은 3배 수준에 불과했다. 그때는 이렇게 독점적 지위를 갖고 있는 기업의 밸류에이션으로는 말도 안되게 낮다고 생각했다. 그러나 지금 카카오의 PBR은 11배다. 대부분의 혁신기업들의 주가는 PBR 11배~12배 정도에서 멈췄었다. 이런 측면에서 지금 카카오를 사기에는 좋은 가격은 아니다. 그 좋은 가격의 기준은 PBR이 8배 미만일 때라고 생각한다. 만약에 좋은 가격이 오면 적극적으로 매수해야 한다. -코스피는 역대 최고인 3300을 넘었는데도, 개미들은 힘들다. ▶외국인들이 올해 상반기 산 주식을 보면 통신, 은행 등 배당수익률이 3~4%인 고배당 주식이 많았다. 조달금리가 1%도 안되는 자금으로 한국에서 3~4%의 수익률이 나오는 안정적인 배당주 투자가 더 낫다고 생각한 것이다. 여기서 우리가 힌트를 얻을 필요가 있다. 특히 하반기에는 평균을 내더라도 어려운 장(9~10월 조정장)이기 때문에 이제는 지키는 전략을 구사할 때다.박세익 체슬리자문 전무. 2021.7.6/뉴스1 © News1 이성철 기자◇""주식은 정확한 예측에 대한 보상…변화 사냥꾼 돼야""-좋은 주식을 고르려면 어떤 지표를 봐야 하나.▶10년간의 재무제표를 보는 것이 중요하다. 10년치 재무제표와 이 기간의 주가 차트를 봐야 한다. 이익 모멘텀(전환국면)이 나왔을 때 주가가 얼마나 올라가는지를 알 수 있다. -최근엔 이익이 나도 주가가 안오른다. ▶지금 이익이 한창 많이 나오고 있다고 해서 주식이 올라가는 것은 아니라고 본다. 항상 6개월, 1년 뒤의 이익을 당겨오면서 주식이 거래된다. 이 때문에 6개월 뒤, 1년 뒤에는 어떨까와 같은 생각을 하면서 매매하는 것이 중요하다. 만약 6개월 뒤에 어떻게 해야 할지 모르겠다와 같은 예측 가능성이 떨어지는 주식이 있다면 이 주식부터 비중을 줄여야 한다. -미래는 불확실하다. 그래도 투자해야 하나. ▶눈에 보이지 않는 미래를 정확하게 예측하면 보상을 준다. 미래는 불확실하기 때문에 주식 시장에 먹을게 있다는 것이다. 미래를 정확하게 예측만 하면 엄청난 돈을 벌 수 있는 게 주식 시장의 매력이다. -미래를 예측하는 노하우가 있나.▶새로운 트렌드와 변화의 시작점을 잡아야 한다. 한마디로 주식투자자는 변화 사냥꾼이 돼야한다. 소비 트렌드 변화만 제대로 잡아도 주식으로 큰돈을 벌 수 있다. 6개월, 1년 뒤 이 기업은 어떻게 될지 합리적인 상상을 즐기자.박세익 체슬리자문 전무. 2021.7.6/뉴스1 © News1 이성철 기자"
2021.07.11.,"[IT돋보기] '협약체결 네버엔딩'…카카오모빌리티, 끝없는 질주",https://n.news.naver.com/mnews/article/031/0000609858?sid=105,"신사업 진출 과정에서 파트너십 적극 나서…핵심은 '플랫폼' 쏟아지는 정보통신기술(ICT) 현안을 잠시 멈춰 서서 좀 더 깊숙히 들여다봅니다.  'IT돋보기'를 통해 멈춘 걸음만큼 보다 심층적으로 분석하되, 알기 쉽게 풀어쓰겠습니다. [편집자주] 카카오모빌리티가 분야를 가리지 않고 다양한 업체들과 잇따라 업무협약(MOU)을 맺으며 사업 보폭을 확대하고 있다.특히 신사업 진출 과정에서 여러 기업들과의 파트너십을 통해 경쟁력을 강화하는 것이 눈에 띈다. 이 과정에서 카카오모빌리티가 갖춘 플랫폼 등 각종 기반들을 적극 활용하고 있다.11일 업계에 따르면 카카오모빌리티는 올해만 10건이 넘는 업무협약을 체결했다. 파트너십을 맺은 기업들의 면면도 다양하다. 완성차, 전동킥보드, 고속버스 등 모빌리티 관련 업체는 물론 한국전력, 신한은행 등 모빌리티와는 다소 거리가 멀어 보이는 업체들과도 협력하기로 했다.업무협약 중 상당수는 카카오모빌리티의 사업영역 확장과 연결됐다. 카카오모빌리티가 운영하는 앱인 카카오 T와 카카오내비에 기능이 추가되는 형태로 이용자들에게 신규 서비스를 제공했다.이 중 가장 눈에 띄는 것은 지난 3월 초 복수의 차량정비·세차·중고차 전문기업들과 맺은 업무협약이다. 불스원·케이카 등 총 13개 업체가 이를 통해 카카오모빌리티와 손잡았고, 카카오모빌리티는 카카오내비에 '내 차 관리' 서비스를 제공하기 시작했다. 방문형 세차·정비는 물론 내 차 시세조회·내 차 팔기 등 자동차 애프터카 전반에 걸친 서비스를 제공했다. 카카오모빌리티가 지난달 말 카카오 T 앱을 개편하면서 카카오 T에서도 서비스를 이용할 수 있게 됐다. [사진=아이뉴스DB]4월에는 청년 사업가들과 상생협력 업무협약을 맺었다. 이를 통해 카카오모빌리티는 기업용 커머스 서비스를 개시했다. 기업이 필요로 하는 다양한 업무용 물품의 판매·배달을 카카오 T 비즈니스 플랫폼에서 서비스하는 것으로, 카카오모빌리티는 이들 물품을 제공하는 업체들과 손잡고 꽃·간식·건강 간편식 등의 상품을 주문할 수 있도록 했다. 해당 서비스는 카카오모빌리티가 처음으로 물류 사업에 손을 뻗었다는 점에서 의미가 있다.6월 '카카오 T 항공'을 론칭했을 때도 온라인 여행서비스 업체인 타이드스퀘어와 손잡았다. 타이드스퀘어는 전세계 항공권 실시간 검색 서비스를 제공하는 '투어비스' 운영사로, 카카오모빌리티는 항공권 검색·예매·발권 등에 투어비스의 서비스를 활용한다. 우선 국내 7개 항공사에 대한 국내선 예매 서비스를 내놓았고, 향후 국제선 예약 및 연계 교통수단 예약 등으로 서비스를 확대할 예정이다.같은 달 IMS모빌리티와 '렌터카 중개서비스 업무협약식'을 열기도 했다. IMS모빌리티는 모빌리티 매니지먼트 플랫폼으로, 이번 업무협약을 계기로 렌터카 중개서비스에 나선다. 카카오모빌리티의 플랫폼과 IMS모빌리티와 렌터카 사업자용 관리 시스템을 바탕으로 협업하겠다는 계획이다. 마침 카카오모빌리티가 지난 3월 현대캐피탈의 렌터카 중개 업체 '딜카' 영업양수도 계약을 체결한 적이 있어 향후 렌터카 중개 관련 사업 진출도 예상되는 상황이다.카카오모빌리티가 미래 사업으로 주목하고 있는 친환경 전기차 관련 사업 확대 과정에서도 다양한 업체들과 협약을 체결했다. 우선 기아차와는 친환경 전기차 보급 활성화를 위해 제휴했다. 택시업계에 전기차가 빠르게 보급될 수 있도록 전기차 구매 할인, 전기차 충전 편의 제공 등을 지원하는 방식에 대해 논의하기로 했다. 나아가 기아차의 전기차 관련 각종 기술과 카카오모빌리티의 플랫폼 인프라·솔루션을 접목한 신규 성장동력 발굴에도 전념한다.한국전력과는 새로운 전기차 충전 서비스 제공을 위해 노력한다. 카카오내비와 한전의 로밍 플랫폼을 연계해 내비게이션에서 운행경로상 최적의 충전소를 찾아가고 결제까지 가능한 '차징플래너' 서비스를 제공한다. 또 이용자가 희망하는 시간에 충전할 수 있는 충전예약 기능도 제공하며, 전기차 주차요금 할인 간편결제 서비스 개발 과정에서도 양사가 협력할 예정이다.업무협약이 기존 자사 서비스 강화로 이어지기도 한다. 지난 4월 신한은행과 전략적 파트너십을 맺고 모빌리티 시장에 특화된 금융 서비스 모델을 구축하기로 한 것이 대표적이다. 양사는 카카오모빌리티 직영 운수업체 소속 택시기사 및 임직원에게 대출 금리 우대 프로그램을 제공하기로 했다. 카카오 T 블루 가맹형 택시기사들을 위한 전용 금융 서비스도 개발할 예정이다. 가맹택시 기사들에게 금융 혜택을 제공함으로써 전반적인 서비스 질 향상까지 고려하는 것이다.또 지난 6일 택시 플랫폼 업체들과 맺은 업무협약은 카카오모빌리티의 택시 호출 플랫폼 입지를 더욱 공고히 할 수 있다. '마카롱택시' 운영사인 KST모빌리티와 '반반택시' 운영사인 코나투스가 카카오모빌리티와 손잡았는데, 이를 통해 마카롱택시·반반택시 가맹택시들이 카카오 T 택시 호출도 정식으로 받을 수 있게 됐다. 협약으을 통해 각 업체 플랫폼 간 호출 병행 수행에 필요한 시스템과 서비스 품질 기준 등도 구축하기로 했다.이 밖에 금호익스프레스와는 셔틀 서비스 협력을 위해 손잡았고, 프로야구팀인 엔씨 다이노스와는 창원NC파크를 오가는 야구팬들이 카카오 T 호출을 통해 셔틀버스를 타고 이동할 수 있도록 했다. 지난 5월 카카오 T 앱 내에 론칭한 'T 포인트 타운' 역시 모바일 포인트 플랫폼 기업 엔비티와 카카오모빌리티 간 협업의 결과물이다. 또 전동킥보드 업체인 피유엠피, 지바이크와도 협업해 두 업체가 제공하는 서비스를 카카오 T 앱에서 이용할 수 있게 됐다.이처럼 다양한 업무협약을 통해 카카오모빌리티는 빠르게 사업 보폭을 확대하고 있다. 특히 이전과 비교하면 올해 들어 모빌리티 기반 신사업 확장을 위한 업무협약이 부쩍 늘었다는 것이 눈에 띈다. 카카오모빌리티가 카카오 T를 통해 모빌리티를 축으로 한 종합 플랫폼으로 나아가는 것으로 풀이된다.업계 한 관계자는 ""카카오모빌리티는 새로운 서비스를 시작할 때 '채널링' 전략을 많이 활용하는데 이 과정에서 자연스럽게 여러 업체들과 업무협약을 맺는 것으로 보인다""며 ""카카오모빌리티의 플랫폼과 경쟁력 있는 여러 업체들의 서비스가 결합, 플랫폼을 축으로 더욱 빠르고 안정적으로 서비스를 시작할 수 있다는 장점이 부각되고 있다""고 말했다."
2021.07.11.,카카오 성장에 놀란 KB·우리…화두는 MZ세대,https://n.news.naver.com/mnews/article/008/0004614449?sid=101,"KB금융그룹이 지난 9일 화상회의 방식으로 하반기 그룹 경영전략회의를 열었다. 윤종규 회장이 경영진과 대화를 나누는 모습./사진제공=KB금융우리금융그룹이 지난 9일 '2021년 하반기 그룹 경영전략 워크숍'을 진행했다. 손태승 우리금융 회장은 ""MZ세대(1980년대 초반~2000년대 초반 출생)가 공감하는 기업문화를 만들자""고 당부했다./사진제공=우리금융KB금융그룹과 우리금융그룹이 하반기 경영 키워드로 MZ세대(1980년대 초반~2000년대 초반 출생)를 꼽았다. 디지털 시대 중심에 선 MZ세대를 집중 타깃한 카카오뱅크 등 경쟁자가 비약적으로 성장하자 미래고객과 공감해야 살아남을 수 있다는 판단에서다. KB·우리금융은 9일 이러한 내용으로 각각 하반기 그룹 경영전략회의·워크숍을 열었다고 11일 밝혔다. 두 그룹 모두 비대면 방식으로 진행했다. KB금융에서는 윤종규 회장을 비롯한 계열사 대표 등 경영진이 화상회의 방식으로 참여했다. 인도네시아, 중국, 캄보디아 등 해외법인의 경영진도 함께 했다. 우리금융의 경우 손태승 회장과 그룹사 MZ세대 대표 직원이 유튜브, 줌으로 만났다. 윤 회장은 디지털과 관련한 발빠른 변화를 주문하면서 MZ세대의 의견이 중요하다고 강조했다. 그는 ""디지털 시대 주역인 MZ세대 목소리에 더욱 귀를 기울이고 KB의 강점을 바탕으로 혜택, 편의, 즐거움을 제공하는 '넘버원 금융 플랫폼'이 돼야 한다""고 말했다. 그러면서 ""과거에 영광을 누렸던 거대 기업들 중 변화에 기민하게 대응하지 못해 시장에서 사라진 사례가 많다""고 했다. 손 회장은 ""MZ세대는 그룹의 미래가 아닌 현재를 이끄는 주축""이라며 ""MZ세대가 공감할 수 있는 새로운 기업문화를 만들어가자""고 말했다. 손 회장은 MZ세대 직원들과 세대공감을 주제로 퀴즈를 풀고 이야기를 나눴다. 구정우 성균관대 사회학과 교수를 초청해 MZ세대와 소통하는 방법을 배우기도 했다. KB금융은 또다른 경영전략 키워드로 'ESG(환경·사회지배구조)', '디지털' 등을 언급했다. 윤 회장은 ""환경과 사회, 주주와 고객에 대한 사명감을 가지고 ESG 경영을 한층 업그레이드해야 한다""고 말했다. ESG 경영에 대한 기대치가 높아진 데 따른 것이다. 우리금융은 하반기 경영 키워드로 '속도'와 '기업문화'를 내세웠다. 기업문화의 중심엔 MZ세대가 있다. 속도와 관련, 손 회장은 ""코로나19 상황 속에서 디지털 혁신이 가속화되면서 모든 생활 양식이 급변하고 시장 예측이 불가능해졌다""며 ""하반기 모든 사업에서 최고의 속도를 내고 획기적인 전략으로 시장의 판을 흔드는 '게임 체인저(game changer)'가 되자""고 했다."
2021.07.11.,"카카오, '클럽하우스' 잡긴 했지만···대중 관심은 시들",https://n.news.naver.com/mnews/article/011/0003935064?sid=105,"'음' 하루 이용자 5,908명 불구소셜 오디오 성장세 기대 못미쳐[서울경제] 카카오(035720)가 선보인 소셜 오디오 플랫폼 ‘음(mm)’ 국내 이용자가 ‘원조’ 클럽하우스를 넘어섰다. 초대장이 필요 없고, 카카오톡을 통해 접속 가능하다는 장점을 바탕으로 출시 한 달 만에 사용자 수에서 클럽하우스를 제친 것이다. 다만 클럽하우스가 선보였을 때처럼 폭발적인 인기를 끌고 있지는 못한 것으로 나타났다.11일 모바일인덱스에 따르면 음이 출시된 지난 6월 7일부터 7월 6일까지 한 달간 하루 활성이용자(DAU·안드로이드와 iOS 합산) 평균치는 음 5,908명, 클럽하우스 5,561명으로 나타났다. DAU는 중복 접속을 제외한 실제 앱 이용자를 뜻한다.카카오는 유명인사를 영입해 이용자를 더 확대할 계획이다. 마크 저커버그 페이스북 창업자, 일론 머스크 테슬라 최고경영자(CEO), 정용진 신세계 부회장 등 ‘셀럽’들이 참여해 화제를 모았던 클럽하우스를 벤치마킹한 전략이다. 카카오는 지난 7일부터 반려견 훈련사 강형욱이 등장하는 '강형욱의 댕댕이 라이브'를 진행하고 있다. 지난 9일에는 최태원 대한상공회의소 회장, 이우현 서울상공회의소 부회장, 이한주 베스핀글로벌 대표 등이 참여해 ‘우리가 바라는 기업’을 주제로 오디오 라이브 토크쇼를 열기도 했다. 업계 한 관계자는 “유명인사들이 단발성이 아니라 정기적으로 참여해야 이용자 확대 효과가 있을 것”이라며 “장기적으로는 이용자들이 유명인 마케팅 보다 음성 소셜 오디오 자체를 즐길 수 있도록 해야 할 것""이라고 말했다.하지만 음을 포함해 클럽하우스 등 소셜 오디오 플랫폼의 성장세는 당초 기대보다 못하다. 국내에 첫 소개됐을 당시에 비해 관심도가 크게 줄었다. 클럽하우스가 안드로이드 버전을 출시하고, 카카오가 음을 출시했지만 각 앱 하루 실제 이용자는 6,000명에도 못 미쳤다. 음 접속자가 가장 많았던 날은 출시 소식을 공식적으로 알린 6월 8일로 이날 DAU는 8,803명을 기록했다. 음 출시 후 클럽하우스는 DAU가 4,000명대로 줄었지만 10여일이 지난 후에는 회복해 음과 클럽하우스 모두 평일에는 5,000명대를, 주말에는 6,000명대를 오갔다.업계는 클럽하우스와 음의 이용자 수치가 오디오 플랫폼의 한계를 드러낸다고 지적한다. 실제 클럽하우스는 올 초 실리콘밸리를 중심으로 열풍을 일으켰지만 이내 인기가 사그라들었다. 트위터가 ‘스페이스’, 스포티파이가 ‘그린룸’, 페이스북이 ‘라이브 오디오룸’ 등 유사 서비스를 선보였지만 인상적인 성과는 없었다. 업계 한 관계자는 “대화에 집중해야 한다는 피로감, 특정 스피커만 주목받는다는 소외감 등 오디오 플랫폼 특유의 단점이 발목을 잡았다”며 “클럽하우스 열풍에 주목한 기업들이 유사 서비스를 급히 준비했지만 관심은 급격히 줄고 경쟁만 치열해지고 있다”고 말했다."
