기사날짜,기사제목,네이버 뉴스 url,기사내용
2021.07.11.,"[TF비즈토크<상>] 현대백화점發 집단감염, 연쇄 감염 원인은 공용공간?",https://n.news.naver.com/mnews/article/629/0000094154?sid=101,"현대백화점 무역센터점발 첫 확진자가 지난 4일 발생한 가운데 9일 기준 누적 확진자는 92명으로 늘어났다. 사진은 현대백화점 집단 감염 여파로 지난 8일 임시선별진료소를 찾은 시민들 모습. /임영무 기자경제는 먹고사는 일과 관련된 분야입니다. 한 나라의 경제가 발전하면 국민의 삶의 질이 높아지는 것도 이런 이유에서이지요. [TF비즈토크]는 갈수록 중요성이 커지고 있는 경제 분야를 취재하는 기자들이 모여 한 주간 흥미로운 취재 뒷이야기들을 생생하게 전달하기 위해 만든 코너입니다. 우리 경제 이면에서 벌어지고 있는 다양한 사건들을 들여다보기 위해 현장을 누비고 있는 <더팩트> 성강현·최승진·장병문·서재근·황원영·이성락·윤정원·문수연·최수진·정소양·이민주·한예주·박경현 기자·최승현 인턴기자가 나섰습니다. 지난 한 주 동안 미처 기사에 담지 못한 경제계 취재 뒷이야기를 지금 시작합니다. <편집자 주>중대재해처벌법 시행령 제정안 입법예고…경제단체들 반발 -코로나19 4차 대유행이 시작된 가운데 현대백화점 무역센터점발 확진자가 나날이 늘어나고 있습니다. 지난 9일에만 10명이 추가되면서 누적 확진자는 92명이 됐는데요. 탈의실과 직원용 화장실, 식품관 냉장창고 등에서 연쇄 감염이 이뤄진 것으로 추정되는 가운데 대규모 유행 진원지가 될 수 있다는 지적이 나오고 있습니다.-재계에서는 정부의 중대재해처벌법 시행령 제정안 입법예고 소식에 경제단체들이 ""불분명한 기준""이라며 반발하고 나서 잡음이 일었습니다. 금융권에서는 신한라이프 TV광고가 화제를 모았는데요. 국내 최초의 가상 인플루언서 '로지'를 광고 모델로 기용해 파격적이라는 반응을 얻었습니다. 증권업계에서는 카카오게임즈가 셀트리온제약을 누르고 시가총액 2위로 올라서 눈길을 끌었습니다.현대백화점 무역센터점발 누적 확진자 수가 점점 늘어나면서 탈의실과 창고 등 공용공간이 감염 확산에 연결고리가 있다는 주장이 제기되고 있다. 사진은 집단감염이 발생한 현대백화점 무역센터점에 입구에 임시 휴점 안내문이 설치된 모습. /임영무 기자◆ 현대百 무역센터점發 집단감염 '계속'…문제는 공용공간?-유통가 소식을 들어보겠습니다. 현대백화점 무역센터점발 코로나19 확진자가 누적 90명을 넘어섰다고요.-네 맞습니다. 현대백화점 무역센터점과 관련한 첫 확진자는 지난 4일 발생했는데요. 이후 지난 9일 기준 확진자는 92명으로 늘어났습니다.-방역당국은 추가 확산 장소로 어디를 꼽았나요?-확진된 직원 대다수가 지하 1층 식품관에서 일하는 협력업체 직원들로 알려져 방역당국은 이들이 주로 사용하는 탈의실과 직원용 화장실, 식품관 냉장창고 등에서 연쇄 감염이 이뤄진 것으로 보고 있습니다. 일부 직원들이 날씨가 더워지자 식품 창고 안에 있는 냉장실에 들어가 쉬며 마스크를 쓰지 않고 대화를 나누고 간식을 먹은 것으로 조사된 점에도 주목했습니다.-그렇군요. 백화점업계 노동조합에서는 예견된 일이었다는 반응을 내놓고 있다고요.-맞습니다. 백화점 내 탈의실 사물함도 다닥다닥 붙어있는 데다 지하에 있어 환기가 열악한 경우가 많다는 점 때문입니다. 다만, 현대백화점 측은 ""탈의실도 다른 공간과 마찬가지로 10분에 1회씩 공조 시설을 통한 환기를 진행했다""며 ""고객이 앉아 쉬는 휴게 공간도 거리 두기를 하듯 직원 공용 공간도 방역 지침을 지켜야 하기 때문에 공간이 협소하다고 느낄 수는 있다""고 해명했습니다.-그렇군요. 방문객 중에는 확진자가 없나요?-9일까지 6명이 확진된 것으로 확인되고 있습니다. 방역 당국은 백화점 방문자들에게 검사를 받도록 안내하고 있어, 손님 중 코로나19 감염이 확인되는 사례가 더 늘어날 수도 있습니다. 지난달 26일부터 이달 6일까지 이 백화점을 방문한 인원은 약 19만 명으로 추산되며, 중복을 제외하더라도 약 10만 명 수준에 이를 것으로 추정됩니다.-현대백화점은 어떤 조치를 취하고 있나요?-현대백화점 무역센터점은 오는 12일까지 임시 휴점할 예정이며 휴점 기간 방역당국과의 긴밀한 협조를 통해 자체 방역과 위생 관리에 총력을 기울이겠다고 밝혔습니다.-네. 유동인구가 많은 특성상 감염이 확산할 경우 대규모 유행 진원지(클러스터)가 될 수 있다는 지적이 끊이지 않고 있는데요. 하루빨리 이 사태가 진정되길 바라봅니다.정부가 중대재해처벌법 시행령 제정안에 대한 입법예고 계획을 밝히자 경제단체들이 ""기준이 모호하다""며 우려를 표하고 나섰다. 사진은 브리핑을 하는 장상윤 국무조정실 사회조정실장. /임영무 기자◆ ""중대재해법, 너무 모호해"" 경제단체들 한목소리 내는 이유는-재계 소식을 들어보겠습니다. 지난 9일 정부의 중대재해처벌법 시행령 제정안 입법예고 소식에 대한상공회의소(대한상의) 등 경제단체들은 ""산업 현장에 혼란이 생길 수 있다""고 한목소리를 냈는데요. 무슨 이유로 이처럼 재계가 반발하고 나섰는지 들어보겠습니다.-먼저 경제단체들이 어떠한 내용으로 우려를 표했는지 살펴보도록 하죠. 대한상의를 포함해 전국경제인연합회, 한국경영자총협회(경총) 등은 불분명한 기준과 처벌 중심의 법안 내용이 문제라고 지적했습니다.-경제단체들은 ""경영 책임자 정의와 의무 등의 내용이 시행령을 통해 구체화돼야 한다"", ""의무 등 많은 부분이 여전히 포괄적이고 불분명해 어느 수준까지 의무를 준수해야 처벌을 면하는지 알 수 없다"", ""의무 범위가 적정한 예산, 충실한 업무 등으로 모호하게 규정됐다"", ""직업상 질병과 관련해 중증도와 치료 기간의 제한이 없어 경미한 부상도 중대재해에 해당할 우려가 있다"", ""재해의 근원적 예방보다 처벌에 중점을 두고 있다"" 등의 반응을 내놨죠.-한마디로 어느 정도가 적정한지 다양한 해석이 가능해 혼란스럽다는 이야기군요.-맞습니다. 중대재해처벌법은 안전 확보 의무를 위반해 1명 이상 사망자가 발생하면 중대재해로 보는데, 사업주나 경영 책임자가 1년 이상 징역 또는 10억 원 이하의 벌금형에 처합니다. 부상(같은 사고로 6개월 이상 치료가 필요한 2명 이상)과 직업성 질병자(1년 내 같은 요인 3명 이상) 발생에 따른 처벌도 있죠.-여기에서 의무만 제시하고, 경영 책임자의 범위가 구체화되지 않은 데다 처벌 기준이 되는 안전 보건 관리(인력·예산) 비용 등의 '적정 수준'이 구체적으로 명시되지 않아 논란이 빚어지고 있는데요. 이외에도 열사병, 매독, 에이즈 등 업무와 인과관계가 미약한 질병들도 정부가 규정한 직업성 질병에 포함되기도 했고, 개인 부주의로 생긴 재해에 대한 면책 규정도 없어 우려가 나오는 것이죠.-논란이 일고 있는 만큼 구체화를 위한 조치가 필요해 보이는데요.-재계도 중대재해를 줄여야 한다는 데에는 공감하고 있습니다. 다만 실효적 방안 마련을 요구하고 있죠. 기준이 모호하면 대응책을 마련하기 어렵고, 관리 비용 또한 늘어날 수밖에 없습니다. 조만간 재계는 법안 구체화를 위한 적극적인 의견 개진에 나설 것으로 보이는데요. 제정안은 다음 달 23일까지 국민 의견을 수렴한 뒤 확정될 예정입니다. 경총은 ""산업계 의견을 종합적으로 수렴한 경제계 공동 건의서를 빠른 시간 내 정부 부처에 제출할 것""이라고 밝혔습니다.☞<하>편에서 계속"
2021.07.11.,"‘아는 형님’ 이진호, '대리 출석'으로 남다른 존재감 뽐내",https://n.news.naver.com/mnews/article/018/0004981118?sid=106,<구조 다름>
2021.07.11.,"[TF비즈토크<상>] 현대백화점發 집단감염, 연쇄 감염 원인은 공용공간?",https://n.news.naver.com/mnews/article/629/0000094154?sid=101,"현대백화점 무역센터점발 첫 확진자가 지난 4일 발생한 가운데 9일 기준 누적 확진자는 92명으로 늘어났다. 사진은 현대백화점 집단 감염 여파로 지난 8일 임시선별진료소를 찾은 시민들 모습. /임영무 기자경제는 먹고사는 일과 관련된 분야입니다. 한 나라의 경제가 발전하면 국민의 삶의 질이 높아지는 것도 이런 이유에서이지요. [TF비즈토크]는 갈수록 중요성이 커지고 있는 경제 분야를 취재하는 기자들이 모여 한 주간 흥미로운 취재 뒷이야기들을 생생하게 전달하기 위해 만든 코너입니다. 우리 경제 이면에서 벌어지고 있는 다양한 사건들을 들여다보기 위해 현장을 누비고 있는 <더팩트> 성강현·최승진·장병문·서재근·황원영·이성락·윤정원·문수연·최수진·정소양·이민주·한예주·박경현 기자·최승현 인턴기자가 나섰습니다. 지난 한 주 동안 미처 기사에 담지 못한 경제계 취재 뒷이야기를 지금 시작합니다. <편집자 주>중대재해처벌법 시행령 제정안 입법예고…경제단체들 반발 -코로나19 4차 대유행이 시작된 가운데 현대백화점 무역센터점발 확진자가 나날이 늘어나고 있습니다. 지난 9일에만 10명이 추가되면서 누적 확진자는 92명이 됐는데요. 탈의실과 직원용 화장실, 식품관 냉장창고 등에서 연쇄 감염이 이뤄진 것으로 추정되는 가운데 대규모 유행 진원지가 될 수 있다는 지적이 나오고 있습니다.-재계에서는 정부의 중대재해처벌법 시행령 제정안 입법예고 소식에 경제단체들이 ""불분명한 기준""이라며 반발하고 나서 잡음이 일었습니다. 금융권에서는 신한라이프 TV광고가 화제를 모았는데요. 국내 최초의 가상 인플루언서 '로지'를 광고 모델로 기용해 파격적이라는 반응을 얻었습니다. 증권업계에서는 카카오게임즈가 셀트리온제약을 누르고 시가총액 2위로 올라서 눈길을 끌었습니다.현대백화점 무역센터점발 누적 확진자 수가 점점 늘어나면서 탈의실과 창고 등 공용공간이 감염 확산에 연결고리가 있다는 주장이 제기되고 있다. 사진은 집단감염이 발생한 현대백화점 무역센터점에 입구에 임시 휴점 안내문이 설치된 모습. /임영무 기자◆ 현대百 무역센터점發 집단감염 '계속'…문제는 공용공간?-유통가 소식을 들어보겠습니다. 현대백화점 무역센터점발 코로나19 확진자가 누적 90명을 넘어섰다고요.-네 맞습니다. 현대백화점 무역센터점과 관련한 첫 확진자는 지난 4일 발생했는데요. 이후 지난 9일 기준 확진자는 92명으로 늘어났습니다.-방역당국은 추가 확산 장소로 어디를 꼽았나요?-확진된 직원 대다수가 지하 1층 식품관에서 일하는 협력업체 직원들로 알려져 방역당국은 이들이 주로 사용하는 탈의실과 직원용 화장실, 식품관 냉장창고 등에서 연쇄 감염이 이뤄진 것으로 보고 있습니다. 일부 직원들이 날씨가 더워지자 식품 창고 안에 있는 냉장실에 들어가 쉬며 마스크를 쓰지 않고 대화를 나누고 간식을 먹은 것으로 조사된 점에도 주목했습니다.-그렇군요. 백화점업계 노동조합에서는 예견된 일이었다는 반응을 내놓고 있다고요.-맞습니다. 백화점 내 탈의실 사물함도 다닥다닥 붙어있는 데다 지하에 있어 환기가 열악한 경우가 많다는 점 때문입니다. 다만, 현대백화점 측은 ""탈의실도 다른 공간과 마찬가지로 10분에 1회씩 공조 시설을 통한 환기를 진행했다""며 ""고객이 앉아 쉬는 휴게 공간도 거리 두기를 하듯 직원 공용 공간도 방역 지침을 지켜야 하기 때문에 공간이 협소하다고 느낄 수는 있다""고 해명했습니다.-그렇군요. 방문객 중에는 확진자가 없나요?-9일까지 6명이 확진된 것으로 확인되고 있습니다. 방역 당국은 백화점 방문자들에게 검사를 받도록 안내하고 있어, 손님 중 코로나19 감염이 확인되는 사례가 더 늘어날 수도 있습니다. 지난달 26일부터 이달 6일까지 이 백화점을 방문한 인원은 약 19만 명으로 추산되며, 중복을 제외하더라도 약 10만 명 수준에 이를 것으로 추정됩니다.-현대백화점은 어떤 조치를 취하고 있나요?-현대백화점 무역센터점은 오는 12일까지 임시 휴점할 예정이며 휴점 기간 방역당국과의 긴밀한 협조를 통해 자체 방역과 위생 관리에 총력을 기울이겠다고 밝혔습니다.-네. 유동인구가 많은 특성상 감염이 확산할 경우 대규모 유행 진원지(클러스터)가 될 수 있다는 지적이 끊이지 않고 있는데요. 하루빨리 이 사태가 진정되길 바라봅니다.정부가 중대재해처벌법 시행령 제정안에 대한 입법예고 계획을 밝히자 경제단체들이 ""기준이 모호하다""며 우려를 표하고 나섰다. 사진은 브리핑을 하는 장상윤 국무조정실 사회조정실장. /임영무 기자◆ ""중대재해법, 너무 모호해"" 경제단체들 한목소리 내는 이유는-재계 소식을 들어보겠습니다. 지난 9일 정부의 중대재해처벌법 시행령 제정안 입법예고 소식에 대한상공회의소(대한상의) 등 경제단체들은 ""산업 현장에 혼란이 생길 수 있다""고 한목소리를 냈는데요. 무슨 이유로 이처럼 재계가 반발하고 나섰는지 들어보겠습니다.-먼저 경제단체들이 어떠한 내용으로 우려를 표했는지 살펴보도록 하죠. 대한상의를 포함해 전국경제인연합회, 한국경영자총협회(경총) 등은 불분명한 기준과 처벌 중심의 법안 내용이 문제라고 지적했습니다.-경제단체들은 ""경영 책임자 정의와 의무 등의 내용이 시행령을 통해 구체화돼야 한다"", ""의무 등 많은 부분이 여전히 포괄적이고 불분명해 어느 수준까지 의무를 준수해야 처벌을 면하는지 알 수 없다"", ""의무 범위가 적정한 예산, 충실한 업무 등으로 모호하게 규정됐다"", ""직업상 질병과 관련해 중증도와 치료 기간의 제한이 없어 경미한 부상도 중대재해에 해당할 우려가 있다"", ""재해의 근원적 예방보다 처벌에 중점을 두고 있다"" 등의 반응을 내놨죠.-한마디로 어느 정도가 적정한지 다양한 해석이 가능해 혼란스럽다는 이야기군요.-맞습니다. 중대재해처벌법은 안전 확보 의무를 위반해 1명 이상 사망자가 발생하면 중대재해로 보는데, 사업주나 경영 책임자가 1년 이상 징역 또는 10억 원 이하의 벌금형에 처합니다. 부상(같은 사고로 6개월 이상 치료가 필요한 2명 이상)과 직업성 질병자(1년 내 같은 요인 3명 이상) 발생에 따른 처벌도 있죠.-여기에서 의무만 제시하고, 경영 책임자의 범위가 구체화되지 않은 데다 처벌 기준이 되는 안전 보건 관리(인력·예산) 비용 등의 '적정 수준'이 구체적으로 명시되지 않아 논란이 빚어지고 있는데요. 이외에도 열사병, 매독, 에이즈 등 업무와 인과관계가 미약한 질병들도 정부가 규정한 직업성 질병에 포함되기도 했고, 개인 부주의로 생긴 재해에 대한 면책 규정도 없어 우려가 나오는 것이죠.-논란이 일고 있는 만큼 구체화를 위한 조치가 필요해 보이는데요.-재계도 중대재해를 줄여야 한다는 데에는 공감하고 있습니다. 다만 실효적 방안 마련을 요구하고 있죠. 기준이 모호하면 대응책을 마련하기 어렵고, 관리 비용 또한 늘어날 수밖에 없습니다. 조만간 재계는 법안 구체화를 위한 적극적인 의견 개진에 나설 것으로 보이는데요. 제정안은 다음 달 23일까지 국민 의견을 수렴한 뒤 확정될 예정입니다. 경총은 ""산업계 의견을 종합적으로 수렴한 경제계 공동 건의서를 빠른 시간 내 정부 부처에 제출할 것""이라고 밝혔습니다.☞<하>편에서 계속"
2021.07.11.,"법원, 소개팅女 주거침입 시도 20대男에 벌금형",https://n.news.naver.com/mnews/article/119/0002510054?sid=102,"집까지 따라와 허락 없이 들어가고 택시비 요구소개팅 어플리케이션으로 만난 여성의 집에 허락 없이 들어갔다가 쫓겨나고 택시비를 요구한 20대 남성에게 법원이 벌금형을 선고했다.ⓒ뉴시스소개팅 애플리케이션(앱)으로 만난 여성의 집에 허락 없이 들어갔다가 쫓겨나자 택시비를 요구한 20대 남성에게 벌금형이 선고됐다.11일 법조계에 따르면 광주지방법원 형사7단독(재판장 이호산)은 주거침입과 공갈협박 혐의로 기소된 A(29)씨에게 벌금 300만원을 선고했다.A씨는 지난해 12월 29일 10씨쯤 소개팅 앱으로 만난 여성 B씨와 전남 나주의 한 식당에서 함께 식사를 한 뒤 집에 데려다주겠다며 B씨의 집 앞까지 따라왔다.A씨는 B씨가 집 안으로 들어서려는 순간 뒤따라 들어왔고 놀란 B씨가 집에서 나가달라고 요구하자 A씨는 다시 밖으로 나갔다.하지만 A씨는 문 앞에 서서 B씨에게 '도저히 안 될까?'라는 카카오톡 메시지를 보냈고 B씨는 다시 거부했다.그러자 A씨는 ""그럼 나 택시 타고 갈 건데 택시비 줘. 한 4만5000원 나오거든""이라는 메시지를 보냈고 B씨는 결국 계좌이체로 돈을 송금했다.재판부는 ""피고인은 피해자의 허락 없이 주거에 침입하고 택시비를 요구하는 등의 행동으로 피해자에게 적잖은 정신적 충격을 줬다""고 양형 이유를 설명했다.다만 ""피고인이 초범인 점과 피고인이 이 사건으로 회사에서 징계를 받기도 한 점 등 모든 양형 조건들을 종합적으로 참작해 형을 정했다""고 판시했다."
2021.07.11.,"‘아는 형님’ 이진호, '대리 출석'으로 남다른 존재감 뽐내",https://n.news.naver.com/mnews/article/018/0004981118?sid=106,<구조 다름>
2021.07.11.,"몸값 낮춘 크래프톤, 고평가 논란 여전",url없음,<네이버 기사 없음>
2021.07.11.,미국은 ‘빅테크’ 선전포고 한창인데…국내는 ‘제자리걸음’,https://n.news.naver.com/mnews/article/028/0002552079?sid=101,"<한겨레> 자료사진  조 바이든 미국 대통령의 ‘미국 경제 경쟁 촉진’ 행정명령은 경쟁당국의 ‘빅테크 전쟁’에 힘을 실어주는 성격이 크다. 지난달 연방거래위원회 위원장에 ‘아마존 저격수’ 리나 칸을 앉힌 데 이어 재차 반독점 규제 강화를 주문한 것이다. 최근 미국 하원에서 발의한 플랫폼 반독점 법안 패키지와도 맥을 같이한다. 반면 국내는 입법은 물론 관련 논의도 미비한 실정이어서 플랫폼 독과점 문제에 대한 준비가 부족하다는 지적이 나온다. 11일 행정명령 전문을 보면, 바이든 대통령은 주요 경쟁당국인 연방거래위원회와 법무부를 각각 17번, 16번 언급했다. 그러면서 “인터넷 플랫폼 같은 신산업과 신기술로 인해 나타난 과제를 해결하기 위해 반독점법을 집행하는 게 현 행정부의 방침”이라고 강조했다. 또 이를 위해 법무부 반독점국과 연방거래위원회가 함께 기업결합 심사 가이드라인을 재검토하라고 권고했다. 두 경쟁당국도 백악관 발표 직후 성명을 내고 그러겠다고 화답했다. 미국 행정부와 의회가 한목소리로 플랫폼의 독과점에 제동을 거는 모양새다. 이는 최근 수년간 정계와 학계에서 진행된 연구·조사를 토대로 한다는 점에서 더욱 의미가 크다. 미국 하원 반독점소위원회는 지난해 10월 ‘GAFA’(구글·아마존·페이스북·애플)의 경쟁제한적 행위를 조사한 450쪽짜리 보고서를 발표한 데 이어, 지난달에는 이런 문제를 해결하기 위한 법안 5가지를 내놨다. 보고서에는 당시 컬럼비아대 로스쿨 교수였던 리나 칸 연방거래위원장이 자문으로 참여한 바 있다. 국내 상황과는 괴리가 큰 셈이다. 국내에서는 플랫폼과 관련된 2가지 주요 법안 모두 정체 상태다. 온라인 플랫폼 공정화법(온플법)의 경우 공정거래위원회가 마련한 법안이 올해 초 정부발의안으로 확정됐지만, 방송통신위원회에서 규제 권한을 주장하고 나서면서 여전히 진통을 겪고 있다. 온플법도 본격적인 규제라고 보기 힘든 점을 감안하면 많이 뒤처진 셈이다. 온플법의 뼈대는 플랫폼과 입점업체 간에 표준계약서를 도입하고 플랫폼의 거래상 지위 판단 기준을 명시하는 것이다. 하도급법이나 가맹사업법 등과 유사한 수준에 그친다. 플랫폼과 소비자 간의 관계를 규율하는 전자상거래법 전부개정안도 아직 교통 정리가 안 된 상태다. 플랫폼의 독점력 남용을 어떻게 규율할 것인지에 대한 경쟁당국 내 합의도 부족하다. 올해 초 공정위는 상반기 안에 관련 심사지침을 마련하겠다고 밝혔으나 최근 이를 다시 하반기로 미룬 상태다. 심사지침에는 매출액 기준 점유율이 낮은 플랫폼도 데이터 양이나 가입자 수가 많으면 시장지배적 사업자로 보는 방안 등이 담길 것으로 알려진 바 있다. 국내 플랫폼의 성장 속도를 염두에 두면 발빠른 대응이 필요하다는 지적이 나온다. 온라인 플랫폼의 양대 강자인 카카오와 네이버는 코로나19 이후 더욱 가파른 성장세를 보이고 있다. 지난 4월 공정위 발표를 보면, 대기업집단 순위에서 카카오는 지난해보다 5계단, 네이버는 14계단 올랐다. 쿠팡도 처음으로 자산이 5조원을 넘어 공시대상기업집단에 지정됐다."
