기사날짜,기사제목,네이버 뉴스 url,기사내용
2021.05.13.,"윤석헌 없는 금감원, 은행권 제재심·분조위 영향은",https://n.news.naver.com/mnews/article/277/0004902140?sid=101,"금감원, 강경 일변도식 제재·감독 수위 기류 변화오나키코·사모펀드 제재심·종합검사 등 표류 가능성↑금감원 ""윤 전 원장과 무관…원리·원칙대로 처리""[이미지출처=연합뉴스][아시아경제 김진호 기자] ""금감원장이 재임 시절 칼을 너무 많이 휘둘렀다는 목소리가 금융권은 물론 당국 내에서도 흘러나오고 있습니다. 새 수장이 오기 전까지는 그간의 강경 기조가 한풀 꺾이지 않을까 싶습니다.(금융당국 관계자 A씨)""지난 3년간 고수해온 금융감독원의 강경 일변도식 금융사 제재 및 감독 수위에 기류 변화가 생길 것이란 전망이 제기된다. 윤석헌 전 금감원장이 떠난 만큼 금감원의 강경 기조도 변화가 불가피해졌다는 분석이다.13일 금융권에 따르면 주요 시중은행과 금융지주사는 향후 진행될 분쟁조정위원회(분조위)와 제재심의위원회(제재심)에서 감지될 금감원의 기류 변화에 촉각을 곤두세우고 있다. 윤 전 원장이 떠나고 금융위 출신인 김근익 수석부원장 대행 체제로 전환된 만큼 최고경영자 징계 등 금융권을 겨눈 칼날을 유지하지 못할 것이라는 목소리가 나오고 있기 때문이다.특히 윤 전 원장 퇴임으로 가장 먼저 영향을 받게 된 것은 은행권의 외환파생상품 키코(KIKO) 배상 이슈다. 키코 사건은 2008년 수출기업들이 환율 변동 위험을 피하고자 가입한 뒤 약 3조원에 달하는 막대한 피해를 입은 사건이다. 대법원이 키코의 사기성에 무혐의 판결까지 내렸지만 윤 전 원장은 취임 후 강하게 밀어붙여 끝내 분조위까지 갔다.2019년 금감원 분조위는 불완전 판매를 이유로 들어 우리·신한·하나·KDB산업·씨티·대구은행 등 6개 은행을 상대로 4개 기업에 255억원을 배상하라고 권고를 내렸지만 결국 6개 은행 중 우리은행만 권고안을 수용하고 나머지는 자율 조정을 진행해왔다.하지만 윤 전 원장이 자리에서 물러남에 따라 키코 이슈는 사실상 추진 동력을 잃었다는 평가가 나온다. 배임 우려 등으로 결정을 쉽사리 내리지 못했던 은행들 입장에서는 더 이상 금감원의 눈치를 보지 않아도 됐기 때문이다. 은행권 관계자는 ""윤 전 원장의 퇴임으로 더는 논의 자체가 안될 가능성도 배제할 수 없다""고 내다봤다.사모펀드 제재심 수위 꺾이나…종합검사 지속 여부 안갯속라임 등 사모펀드 판매와 관련한 은행의 제재심도 관심사다. 하나·부산·산업·경남·농협은행 등이 제재심을 앞두고 있다. 현재 가장 먼저 제재심을 앞둔 곳은 하나은행이다. 우리·신한은행 사례처럼 경징계가 예상되는 가운데 사모펀드 사태를 진두지휘했던 윤 전 원장이 부재한 만큼 징계 수위가 더 낮아질 수 있다는 전망도 흘러나오고 있다.금융당국의 한 관계자는 ""은행·지주 최고경영자에 잇따른 중징계를 강행했던 윤 전 원장이 자리를 비운 만큼 강도가 앞선 사례보다 더 낮아질 수 있다""고 했다.윤 전 원장이 부활시킨 종합검사의 지속 여부에도 관심이 쏠린다. 금감원은 당장 폐지를 검토하지 않는다는 입장이지만 후임 금감원장 성향 등에 따라 검사나 제재 수위가 크게 낮아질 수 있다는 분석이다. 은행권에선 올해 종합검사 대상으로 우리금융·우리은행과 KB금융·KB국민은행, 카카오뱅크, 한국씨티은행 등이 거론되고 있다.다만 금감원은 윤 전 원장의 부재와 무관하게 원리·원칙에 따라 제재심·분조위 등을 수행해나간다는 방침이다. 금감원 관계자는 ""일각에서 기류 변화를 예상하는 목소리도 나오지만 섣부른 예단은 없으면 한다""며 ""(제재심·분조위 등에 대해) 이미 대부분 조사가 끝난 사안이고 형평성을 고려해서라도 원리·원칙을 고수할 것""이라고 했다.김진호 기자 rplkim@asiae.co.kr▶ 속 시원한 풀이! 2021년 정통사주·운세·토정비결▶ 직장인을 위한 '빅데이터 분석' 국비 특화과정 모집▶ 투자 성공의 핵심은 기업분석! 'CORE' 바로가기<ⓒ경제를 보는 눈, 세계를 보는 창 아시아경제 무단전재 배포금지>"
2021.05.13.,우려가 현실로…진도지코인 개발자 '먹튀'에 97% 폭락,https://n.news.naver.com/mnews/article/586/0000024284?sid=101,"11일 유니스왑 상장 직후 국내 커뮤니티서 홍보·투자인증 글 쏟아져13일 오전 1시 개발자 15% 매각 후 SNS 폐쇄하고 잠적진도지코인 심볼 ⓒ진도지코인도지코인을 패러디한 진도지(JINDOGE)코인 개발자가 13일 오전 1시에 전체 물량의 15%에 해당하는 코인을 한꺼번에 매도한 뒤 공식 홈페이지와 트위터 등을 모두 폐쇄하고 달아났다. -97%에 이르는 급락에 피해자가 속출 했다.진도지코인은 가상화폐에 대한 풍자로 만들어진 후 일론 머스크가 언급하며 유명해진 도지코인의 패러디인 밈(Meme) 코인을 표방하며 11일 발행을 시작했다. 발행과 동시에 국내 코인 커뮤니티에 홍보물과 매수했음을 알리는 글들이 올라왔다.이더리움 기반 토큰의 거래내역을 확인할 수 있는 이더스캔으로 확인하면 진도지코인의 전체 물량은 100조 개다. 그러나 진도지코인 개발자가 발행 때 밝힌 발행구조 중 일반 투자자들이 사용처를 알 수 없는 350조 개, 전체의 35%에 이르는 물량이 12일에 이미 소각된 것으로 드러났다.가상화폐 소각은 프로젝트 운영진이나 구성원이 가격 부양을 위해 실시한다. 그러나 이번 사태에서 진도지코인 개발자는 자신의 물량을 매도하기 직전 가격을 부양하기 위해 소각을 진행한 것으로 추정된다.현재 진도지코인 사태로 발생한 피해자의 수와 규모는 추정되지 않는다. 다만 13일 오후 12시 현재 카카오톡 오픈채팅방에 개설된 진도지코인 피해자 단체 채팅방에는 248명이 참여 중이다. 피해자들은 수십만원 대에서 수천만원대에 이르는 규모의 피해를 봤다고 호소하는 것으로 알려졌다.11일부터 13일까지 진도지코인 거래 차트 ⓒ유니스왑 캡처현재로써는 가상화폐 조작과 관련해 개발자를 잡더라도 처벌하거나 피해 금액을 돌려받을 방법이 없다. 가상화폐 거래소 관계자는 ""암호화폐 시장이 호황인 만큼 처음부터 '먹튀'를 계획하고 발행하는 스캠 코인을 주의해야 한다""며 ""발행 후 하락 없는 상승세를 이어가고 해외 거래소 상장을 미루거나 뚜렷한 성과 공개가 없는 코인에 투자할 때는 각별히 주의해야 한다""고 조언했다.한편 지난 3월에도 '얼랏코인'이 단 1분만에 만에 99% 폭락하며 피해자를 대거 만들었다. 당시 얼랏코인은 중년층에 집중적으로 하루 4% 수익률을 낼 수 있다는 소문이 돌면서 많은 투자자들을 모았다. 실제로 85일간 해당 코인은 단 한 번도 하락하지 않고 상승했으나 현재는 모든 거래소에서 상장폐지 된 상태다.김서현 디지털팀 기자 seoh298@gmail.com<저작권자 ⓒ 시사저널, 무단 전재 및 재배포 금지>☞ 네이버에서 시사저널 뉴스를 받아 보세요 ▶ 시사저널 최신호 보기"
2021.05.13.,"금융위, '금발심 퓨처스' 출범…""정책에 청년 의견 반영""",https://n.news.naver.com/mnews/article/031/0000598441?sid=101,"금융업계 종사자 등 18명으로 구성돼금융위원회의 금융발전심의회(금발심)가 주요 금융정책의 수요자로 등장한 젊은 층의 의견에 귀를 기울이고자 특별위원회로 청년분과, '금발심 퓨처스(Futures)'를 설치하고 첫번째 회의를 개최했다. 이 자리에서 은성수 금융위원장(가운데)가 발언을 하고 있다.  [사진=금융위원회][아이뉴스24 이효정 기자] 금융위원회의 금융발전심의회(금발심)가 주요 금융정책의 수요자로 등장한 젊은 층의 의견에 귀를 기울이고자 특별위원회로 청년분과, '금발심 퓨처스(Futures)'를 설치하고 첫번째 회의를 개최했다고 13일 밝혔다.'금발심 Futures'는 20~30대 금융업 종사자, 청년창업가, 대학원생 등 각계각층 남자 11명, 여자 7명의 청년층 18명으로 구성됐으며 모두 금발심의 청년 특별위원으로 위촉됐다.1987년생인 김동호 한국신용데이터 대표, 1984년생 김서준 해시드 대표, 1994년생 레드윗 대표를 비롯해 1994년생 등 동국대 대학원 석사과정 학생 등도 포함됐다. 이외에도 미래에셋증권 애널리스트나 현대해상,·KB국민카드·신한은행·카카오뱅크·핀다 등 금융권 종사자들도 참여했다.'금발심 Futures'는 최근 20~30대 젊은층은 주식투자, 주택금융, 벤처창업 등 경제현안에 대한 관심이 높고 향후 핀테크 등 금융산업 변화를 주도하는 주체가 될 것이라는 기대에 따라 발족됐다.금융위원회는 ""청년 특별위원들은 앞으로 경제·금융 현안 중 청년층의 관심도가 높은 주제에 대해 격의 없는 토론을 이어나갈 것""이라며 ""다양한 청년층의 생생한 목소리를 정책수립과정에 전달하는 소통 채널로서 역할을 해 나갈 것""이라고 밝혔다. [표=금융위원회]지난 12일 개최된 '금발심 Futures'에는 12명의 특별위원과 금융위 가계부채 담당 사무관, 금융위의 20~30대 직원 등이 참석해 주택금융과 청년층의 주거 사다리에 대해 논의했다.청년 특별위원들은 이 자리에서 다양한 의견을 제시했다. 그동안 빠른 속도의 주택가격 상승 등으로 사회에 진출하려는 청년들의 주거불안과 자산 형성의 어려움도 비례해 증가한 만큼, 청년층이 마음 놓고 학업, 취업 등 미래준비에 집중하도록 종합적이고 적극적인 지원이 필요하다는 의견이 나왔다.대출규제와 관련해서도 집값 상승에도 대출규제가 너무 엄격해 청년층의 내집 마련 희망이 점점 사라져간다며, 현재 무주택·서민 실수요자들에 대해서는 대출규제를 일부 완화하는 등 지원이 필요하다고 강조했다.은성수 금융위원장은 1차 회의에 참석해 모두 발언으로 ""금발심 Futures가 이 시대 청년층의 고민과 관심을 공유하는 깊이 있는 소통의 장이 되길 기대한다""며 ""금융위는 청년층이 처한 경제여건과 입장을 생생하게 파악하기 위해 청년층과의 적극적인 소통 노력을 계속할 것""이라고 밝혔다.비슷한 고민을 하는 금융위의 젊은 직원들과 격의 없이 소통하며 머리를 맞대 청년층의 삶에 실질적인 도움이 되는 세심한 정책들을 만들어 내기를 기대한다고 언급하기도 했다.1차 회의 주제인 주택금융과 청년층 주거사다리와 관련해 은 위원장은 ""정부는 높은 가계부채 수준이 국가경제에 위험을 초래할 수 있고, 개인에게도 마냥 '빚'을 장려할 수만은 없어 가계부채를 일정수준 이내로 관리하고 있다""며 ""그 과정에서 현재 소득수준이 낮은 청년층, 사회 초년생들에게 의도치 않은 불이익이 발생하는 것은 안타까운 일""이라고 전했다.그러면서 금발심 Futures에서 청년층의 불이익을 최소화할 수 있는 다양한 방안에 대해 논의해 줄 것을 당부했다./이효정 기자(hyoj@inews24.com)▶네이버 채널에서 '아이뉴스24'를 구독해주세요.▶재밌는 아이뉴스TV 영상보기 ▶아이뉴스24 바로가기[ⓒ 아이뉴스24 무단전재 및 재배포 금지]"
2021.05.13.,"[문화소식] 뮤지컬 배우 민우혁·배다해, 제주도 홍보대사 위촉",https://n.news.naver.com/mnews/article/001/0012390769?sid=103,"공연시장 분석한 '월간 공연전산망' 발간뮤지컬 배우 민우혁[이음컴퍼니 제공. 재판매 및 DB 금지]    (서울=연합뉴스) 임동근 기자 = ▲ 뮤지컬 배우 민우혁·배다해, 제주도 홍보대사 위촉 = 뮤지컬 배우 민우혁과 배다해가 제주도 홍보대사로 위촉됐다.    기획사 이음컴퍼니는 민우혁과 배다해가 12일 제주돌문화공원 오백장군 갤러리에서 열린 제주도 홍보대사 위촉식에서 위촉패를 받았다고 13일 밝혔다.    이들은 ""제주의 숨겨진 보물, 돌문화공원과 함께 제주도를 널리 알리기 위해 열심히 노력하겠다""고 밝혔다.     한편 민우혁이 출연 중인 뮤지컬 '광주'는 오는 15∼16일 광주광역시 빛고을시민문화관에서 시즌 마지막 무대를 올린다.[예술경영지원센터 제공]    ▲ 공연시장 분석한 '월간 공연전산망' 발간 = 문화체육관광부와 예술경영지원센터는 시의성 있는 공연시장 현안과 담론을 담은 '월간 공연전산망'을 13일부터 선보인다고 밝혔다.     '월간 공연전산망'은 예술경영지원센터에서 운영하는 공연예술통합전산망(KOPIS) 및 유관기관, 예매처 등의 협조를 받아 공연시장 데이터를 쉽고 포괄적으로 해설하기 위해 기획됐다.    공연시장 현안에 대한 좌담과 데이터를 제공하는 '공연시장 돋보기', 공연 관련 실무자 인터뷰를 통한 마케팅 경험을 공유하는 '마케터 인터뷰', 공연 관객층 이해를 위해 다양한 연구 결과를 제공하는 '공연소비자, 관객', 공연시장에 관한 심층기획인 'KOPIS 테마기획'으로 구성된다.    '월간 공연전산망'은 매월 둘째 주 중 발행되며, 공연예술통합전산망 공식 누리집에서 열람할 수 있다. 또 카카오채널 'KOPIS' 친구 추가 시 알림 서비스를 받을 수 있다.    dklim@yna.co.kr▶네이버에서도 뉴스는 연합뉴스[구독 클릭]▶[팩트체크] 산재 사고 사망자 영국의 10배?▶제보하기<저작권자(c) 연합뉴스(https://www.yna.co.kr/), 무단 전재-재배포 금지>"
2021.05.13.,"띵작 드라마 '쌈, 마이웨이', 4년 만에 웹툰으로 돌아온다",url없음,<네이버 기사 없음>
2021.05.13.,오늘 밤 '백상예술대상'...봉준호·고현정·유재석 시상자로,https://n.news.naver.com/mnews/article/003/0010495406?sid=106,<구조 다름>
2021.05.13.,친누나 살해 석모도 농수로 시신유기 20대 구속기소,https://n.news.naver.com/mnews/article/005/0001438855?sid=102,"친누나를 살해한 뒤 인천 강화군 석모도 농수로에 시신을 유기했다가 4개월 만에 검거된 20대 남동생이 구속된 상태로 재판에 넘겨졌다.인천지검 형사3부(김태운 부장검사)는 살인 및 사체유기 혐의로 A씨(27)를 구속 기소했다고 13일 밝혔다.검찰은 A씨가 지난 4일 경찰에서 송치된 이후 보강 수사를 했고, 10일인 구속기간을 추가로 연장하지 않고 재판에 넘겼다.A씨는 지난해 12월 중순쯤 인천시 남동구 한 아파트에서 누나인 30대 B씨를 흉기로 여러 차례 찔러 살해한 혐의를 받고 있다.그는 누나의 시신을 10일간 아파트 옥상에 방치했다가 같은달 말 렌터카를 이용해 인천시 강화군 삼산면 석모도에 있는 한 농수로에 버린 것으로 조사됐다.A씨는 올해 2월 14일 부모가 경찰에 누나의 가출 신고를 하자 조작한 카카오톡 메시지를 경찰 수사관들에게 보내 속였다.그는 누나의 휴대전화 유심(가입자 식별 모듈·USIM)을 다른 기기에 끼운 뒤 메시지를 혼자서 주고받아 마치 누나가 살아있는 것처럼 꾸몄다.또 같은 방식으로 부모마저 속여 지난달 1일 경찰에 접수된 가출 신고를 취소하게 했다.A씨는 모바일 뱅킹을 이용해 B씨 명의의 은행 계좌에서 자신의 계좌로 돈을 이체한 뒤 식비 등 생활비로 쓰기도 했다.B씨의 시신은 농수로에 버려진 지 4개월 만인 지난달 21일 발견됐고, A씨는 같은 달 29일 경찰에 체포됐다.A씨는 경찰 조사에서 혐의를 인정하면서도 우발적인 범행이었다고 주장했다.그는 경찰에서 “누나와 성격이 안 맞았고 평소 생활 태도와 관련해 사소한 다툼이 있었다”며 “(범행 당일도) 늦게 들어왔다고 누나가 잔소리를 했고 말다툼을 하다가 우발적으로 범행했다”고 진술했다.A씨는 추가 조사에서 “할 말이 없을 정도로 잘못했다”며 “부모님에게도 사죄한다”고 말했다.인천=정창교 기자 jcgyo@kmib.co.kr▶ 네이버에서 국민일보를 구독하세요(클릭)▶ 국민일보 홈페이지 바로가기▶ ‘치우침 없는 뉴스’ 국민일보 신문 구독하기(클릭)GoodNews paper ⓒ 국민일보(www.kmib.co.kr), 무단전재 및 수집, 재배포금지"
2021.05.13.,"딘딘, 보이스피싱 범죄에 분노 ""버러지들 벌 받아라"" [TD#]",url없음,<네이버 기사 없음>
2021.05.13.,"한은 ""암호화폐 연계계좌 모니터링 검토""",https://n.news.naver.com/mnews/article/003/0010495554?sid=101,"개별계좌 아닌 전체 입출금 규모 모니터링[서울=뉴시스]조수정 기자 = 대표적인 알트 암호화폐 이더리움 가격이 연일 신고가를 경신하고 있는 3일 오후 서울 강남구 암호화폐 거래소 업비트 라운지에 설치된 전광판에 비트코인과 이더리움 가격이 표시되고 있다. 2021.05.03. chocrysytal@newsis.com[서울=뉴시스] 류난영 기자 = 한국은행이 암호화폐 거래와 연동된 은행 계좌를 모니터링하는 방안을 검토하고 있다. 한국은행 관계자는 13일 ""가상자산(암호화폐)이 금융안정에 위험을 초래할 수 있는 요인이 있는 금융기관에 대한 자료제출 요구권을 활용해 가상자산 거래 관련 은행계좌 입출금 규모 등을 모니터링하는 방안을 검토하고 있다""며 ""개별 계좌가 아니라 전체 입출금 규모를 모니터링 하겠다는 것""이라고 말했다. 아직 구체적인 시기 등은 정해지지 않았다.  한은은 암호화폐가 가격변동성이 매우 크고 실물 경제 여건과 무관하게 이슈에 따라 급등락 하는 등 안정성이 떨어지는 데다 암호화폐 시장이 빠르게 성장하고 있어 금융시스템 안정에 부정적 영향을 미칠 가능성이 있다고 보고 있다. 한은은 그러나 암호화폐 가격이 급격히 하락해도 금융시스템 안정을 저해할 가능성은 제한적인 것으로 판단했다.   국내 금융기관은 암호화폐 매입이 금지돼 있는 데다 암호화폐 관련기업에 대한 익스포저(위험 노출액)도 작기 때문이다. 실제로 사업구조상 암호화폐가 차지하는 비중이 작은 네이버, 카카오 등을 제외한 암호화폐 관련 국내 상장기업에 대한 금융기관 대출금액은 2000억원에 불과하다. 이는 전체 상장기업 대출액의 0.1% 수준이다.☞공감언론 뉴시스 you@newsis.com▶ 네이버에서 뉴시스 구독하기▶ K-Artprice, 유명 미술작품 가격 공개▶ 뉴시스 빅데이터 MSI 주가시세표 바로가기<ⓒ 공감언론 뉴시스통신사. 무단전재-재배포 금지>"
2021.05.13.,"바람의나라: 연, 대규모 로드맵 공개, ""신규 직업 격투가 & 용궁 추가한다""",https://sports.news.naver.com/news.nhn?oid=439&aid=0000022043,<구조 다름>
2021.05.13.,경주마 경매시장의 봄은 언제쯤?,https://sports.news.naver.com/news.nhn?oid=144&aid=0000736474,<구조 다름>
2021.05.13.,"나뚜렐, 코인 모양 자연 조미료 '육수뚝딱' 정식 출시",https://n.news.naver.com/mnews/article/018/0004928563?sid=101,"[이데일리 김범준 기자] 나뚜렐은 국산 자연재료로 맛을 낸 ‘코인’ 형태 조미료 ‘육수뚝딱’을 정식 출시했다고 13일 밝혔다.‘코인’ 형태 조미료 ‘육수뚝딱’.(사진=나뚜렐 제공)육수뚝딱은 쉽고 간편하게 육수를 만들 수 있는 코인 형태의 조미료다. MSG, 향미증진제, 착향료, 유화제, 보존료를 첨가하지 않고 멸치, 다시마, 대파, 우엉, 표고버섯 등 엄선한 12가지 국산 자연재료를 각 재료의 특성에 맞게 동결·진공·분무건조해 제조한 복합 조미식품이다.나뚜렐은 지난 2월 육수뚝딱을 시범적으로 시장에 선보였다. 이후 상표권 획득과 함께 소비자 및 시식단의 좋은 반응이 이어지자 이번에 정식 출시했다. 유기농 아가베에서 추출한 원료인 아가베 분말과 아가베 이눌린을 함유해 건강한 감칠맛을 더했다.육수뚝딱은 첨가물 없이 자연에서 유래한 원료만을 사용, 화학조미료 맛이 아닌 깊고 구수한 자연 그대로의 국물 맛을 내는 것이 특징이다. 재료 준비부터 음식쓰레기 처리까지 손이 많이 가는 육수 제조 과정을 줄여주면서 요리 초보자들에게도 인기를 얻고 있다.나뚜렐은 이번 육수뚝딱 정식 출시에 맞춰 이달15일까지 22%할인 이벤트도 진행한다. 나뚜렐 공식홈페이지와 네이버 스마트스토어, 카카오톡스토어 등에서 구매할 수 있다. 신규가입 및 스토어찜, 채널추가를 통해 추가 할인도 해준다.윤장훈 나뚜렐 대표는 “간편함과 건강함을 키워드로 요리를 쉽게 도와주는 제품들이 인기를 얻고 있다”며 “육수뚝딱은 간단한 사용법과 휴대성으로 요리 초보자는 물론 캠핑이나 낚시 등 야외활동에서도 사용하기 좋은 활용도 높은 제품”이라고 말했다.김범준 (yolo@edaily.co.kr)▶ #24시간 빠른 #미리보는 뉴스 #eNews+▶ 네이버에서 '이데일리 뉴스'를 만나보세요▶ 빡침해소, 청춘뉘우스 '스냅타임'＜ⓒ종합 경제정보 미디어 이데일리 - 무단전재 & 재배포 금지＞"
