기사날짜,기사제목,네이버 뉴스 url,기사내용
2021.05.16.,개인 순매수 51조원…국내증시 동학개미 주도,https://n.news.naver.com/mnews/article/029/0002673975?sid=101,"올해 5월14일까지 개인 순매수 51조 육박개인 순매수에 코스피 3150선 유지…""작년 이후 개인 불패""올해 국내 유가증권시장의 개인 순매수 규모가 약 51조원으로, 지난해 연간 규모 수준을 넘어섰다. 개인투자자 주도의 장세가 이어질 지 주목된다.16일 금융투자업계에 따르면 올해 1월 1일부터 5월14일까지 유가증권시장에서 개인 순매수 규모는 50조9836억원으로 집계됐다. 이는 지난해 개인투자자의 연간 순매수 금액(47조4907억원)을 넘어선 수치다.월별로 보면 코스피가 사상 처음 3000선을 돌파했던 지난 1월, 개인은 유가증권시장에서 22조3384억원을 순매수했다. 올해 전체 순매수 규모의 43.8%를 차지한다. 이후 지수가 박스권에 갇히면서 2월 8조4381억원, 3월 6조9402억원, 4월 5조8355억원 등으로 순매수 규모는 줄고 있다. 이달에는 코스피 지수가 종가 기준 3250선(3249.30)에 육박하며 개인 순매수가 늘어났다. 개인투자자는 이달 들어 보름 만에 7조269억원을 순매수했다.특히 코스피가 사상 최고점을 찍었던 지난 10일 이후 11일부터 사흘 연속 1%대 급락하는 동안 개인은 오히려 총 7조9922억원어치를 사들였다.개인과 달리 외국인과 기관이 올해 50조원을 순매도했지만, 코스피 지수는 3150선을 유지하고 있다.개인이 국내 증시를 이끌고 있다고 해도 과언이 아니다. 개인의 투자 행보가 향후 증시의 방향에도 큰 영향을 미칠 전망이다.정명지 삼성증권 투자정보팀장은 ""기업공개(IPO) 시장에서 새로운 종목들이 공모할 때마다 새로운 자금이 시장에 들어오고 있다""며 ""앞으로 카카오뱅크 등 대어들이 청약을 앞두고 있어 자금 유입은 더 이어질 것""이라고 전망했다.이와 관련해 지난 3월 SK바이오사이언스 일반 공모주 청약에는 63조6000억원의 증거금이 몰렸다. 또한 지난달 SK아이이테크놀로지(SKIET) 청약에는  80조9017억원이 몰린 것으로 집계됐다. SKIET 청약 이후인 지난 4일 증시 대기 자금인 투자자예탁금은 사상 최대인 78조원에 육박하기도 했다. 지난 13일 기준으로는 71조원에 달하고 있다.여기에 미국과 중국 등 해외 시장의 상승이 주춤하면서, 해외 투자에서 국내로 돌아온 개인 자금이 늘어날 것으로 보인다. 다만 국내 증시도 몇 달간 횡보를 이어오면서 상황이 달라질 수 있다는 관측도 나온다.정명지 연구원은 ""개인들은 작년 이후 주가가 오를 때에는 팔고 내릴 때는 매수하면서 한 번도 패배하지 않았다""며 ""하지만 시장이 하락 이후 이른 시간 안에 반등하지 않고 길게 횡보하면 개인들이 주식시장에 회의적인 시각을 가질 수도 있다""고 우려했다.김병탁기자 kbt4@dt.co.kr(출처 : 금융투자협회, 단위 : 억원)     ▶[ 네이버 메인에서 디지털타임스 구독 ] / ▶[ 뉴스스탠드 구독 ]▶디지털타임스 홈페이지 바로가기"
2021.05.16.,"윤석열 ""5.18 현재도 진행 중…어떤 형태 독재든 저항해야""",https://n.news.naver.com/mnews/article/009/0004794830?sid=100,"윤석열 전 검찰총장이 4·7 재·보궐선거 사전투표 첫날인 2일 오전 서울 서대문구 남가좌1동 주민센터에 마련된 사전투표소에서 투표를 하고 있다. [한주형 기자] 5·18 광주민주화운동 41주년을 이틀 앞둔 가운데 범야권 유력 대선 주자로 꼽히는 윤석열 전 검찰총장이 메시지를 냈다.윤 전 총장은 16일 언론 인터뷰에서 ""5.18은 현재도 진행중인 살아있는 역사""라며 ""자유민주주의 헌법정신이 우리 국민들 가슴 속에 활활 타오르는 것을 증명하는 것""이라고 밝혔다.이어 ""어떠한 형태의 독재와 전제든 이에 대한 강력한 거부와 저항을 명령하는 것""이라고 강조했다.앞서 그는 지난해 2월 총장 재직 시절 광주고검·지검을 방문해 직원들과의 비공개 간담회에서 ""광주민주화운동의 역사적 의미와 민주주의를 위한 희생정신을 깊이 새기고 현안 사건 공소유지에 사명감을 갖고 최선을 다해달라""고 당부한 바 있다. 현안 사건은 고(故) 조비오 신부에 대한 사자명예훼손 혐의로 기소된 전두환 전 대통령 사건을 뜻한다.정치권에서는 윤 전 총장이 이르면 5월 말이나 늦어도 7월엔 대권행보에 나설 것이란 말이 나온다. 국민의힘 새 지도부가 마무리되는 6월 초 이후부턴 여야가 모두 대선 레이스에 돌입할 가능성이 크기 때문이다.정치권과 법조계 등에 따르면 윤 전 총장은 사퇴 후 주로 서울 서초동 자택에 머물며 대권 준비를 위해 경제를 비롯해 외교·안보, 노동, 복지 등 다양한 분야에 대한 공부를 하고 있는 것으로 알려졌다.그는 최근 외교통상부 제2차관을 지낸 김성한 고려대 국제대학원 교수와 수차례 토론을 하며 '외교안보 과외'를 받은 것으로 알려졌다. 윤 전 총장의 카카오톡 프로필 메시지는 'Be calm and strong(침착하고 강하게)'라는 문구가 적혀있다. 이는 소설 '노인과 바다'에 나오는 문구로, 노인이 청새치를 잡기 위해 승부를 벌이며 스스로를 격려하며 외친 말이다. [맹성규 매경닷컴 기자 sgmaeng@mk.co.kr]▶ '경제 1위' 매일경제, 네이버에서 구독하세요▶ 이 제품은 '이렇게 만들죠' 영상으로 만나요▶ 부동산의 모든것 '매부리TV'가 펼칩니다[ⓒ 매일경제 & mk.co.kr, 무단전재 및 재배포 금지]"
2021.05.16.,가상화폐 거래소 수시로 먹통…”투자자 보호법 시급”,https://n.news.naver.com/mnews/article/088/0000703142?sid=101,"빗썸 나흘에 한번 매매·입금 지연…업비트도 월 1회 '긴급 서버 점검'전문가 ""감독·강제할 기관 지정을""14일 빗썸 강남센터 라운지 전광판에 가상화폐 시세가 표시돼 있다. 연합뉴스법 바깥에 있는 가상화폐 거래소가 나흘에 한번 꼴로 매매·입금 지연 사고를 일으켜 투자자 불만이 하늘을 찌른다. 각 거래소 주문·입금체계의 안정성과 투자자 보호 조치 수준을 감독하고 강제할 기관과 법이 시급하다는 지적이다.국내 가상화폐 거래소 업계에 따르면 '빗썸'은 지난달부터 이달 15일까지 모두 11건의 '지연 안내'를 홈페이지에 게시했다. 한달 보름 동안 나흘에 한번 꼴로 사고가 난 셈이다.종류별로 보면 ▷매매·체결 지연 3회 ▷원화 출금 지연 3회 ▷접속 지연 2회 ▷차트 갱신 지연 1회 ▷비트코인 신규 입금주소 생성 지연 1회 ▷카카오톡 서비스 장애에 따른 알림톡 인증 지연 1회 등으로 나타났다.빗썸과 함께 국내 가상화폐 양대 거래소로 꼽히는 업비트 역시 월 1회가량 각종 문제를 이유로 '긴급 서버 점검'을 실시하고 있다.거래소 업계는 사실상 사고 사후 조치에 손을 놨다. 약관에도 '매매 중단이나 지연 등 피해가 거래소 측의 고의, 과실에 따른 것으로 입증되지 않는 한 보상 책임이 없다'고 밝히고 있다. 이 탓에 거래사고 때 투자자가 보상받을 길은 없다시피 하다.16일 비트코인, 이더리움, 도지코인 등 주요 가상화폐 가격이 약세를 보이고 있다. 이날 오전 9시 국내 가상화폐 거래소 빗썸에서 1비트코인 가격은 5천802만원이었다. 24시간 전 가격과 비교해 5% 이상 낮은 수준이다. 연합뉴스금융계 전문가들은 가상화폐 거래소의 사고가 잦은 핵심 이유로, 거래소를 안정적으로 운영토록 하는 법과 담당 기관(부처)이 없다는 점을 꼽는다.박상현 하이투자증권 연구위원은 ""(매매·입출금 지연 등의 사고가) 주식시장에서 발생했다면 대형 사고지만, 관련 법과 제도가 마련돼 있어 거래소나 증권회사 등 누군가는 책임을 지고 피해자에게 보상하게끔 돼 있다""고 설명했다.그는 ""현재 법과 규제에는 사실상 가상화폐 시장과 관련한 내용이 공백인 만큼 이런 사고에 대한 투자자 보호를 기대하기 어렵다""고 지적했다.시중은행들은 개정된 특정금융거래정보법에 따라 사실상 가상화폐 거래소를 검증하는 역할을 맡았다. 은행권은 오는 9월부터 가상화폐 거래소가 은행에 실명계좌 발급을 신청할 때 해당 거래소의 사고와 처리 이력, 투자자 보호 노력 등을 꼼꼼히 따질 방침이다.현행 가상화폐 거래소의 불안한 시스템을 무시한 채 실명계좌를 발급해 줬다가 자칫 은행이 거래소 금융사고에 대한 책임론에 처할 위험이 있어서다.한 시중은행 관계자는 ""매매·거래 시스템의 안전성은 기본 중 기본이다. 이것마저 지키지 못한다면 가상화폐 거래소가 운영하는 자금세탁방지 모니터링 시스템의 적정성도 검증할 수 없을 것""이라고 말했다.홍준헌 기자 hjh@imaeil.com▶ 네이버에서 매일신문 구독하기▶ 매일신문 네이버TV 바로가기▶ 나눔의 기적, 매일신문 이웃사랑ⓒ매일신문 - www.imaeil.com"
2021.05.16.,"울산경찰, 안전속도5030 시민 인증 챌린지 전개",https://n.news.naver.com/mnews/article/003/0010500805?sid=102,"[울산=뉴시스]울산경찰청이 오는 17일부터 30일까지 울산시민을 대상으로 안전속도 5030 인증 챌린지 '나부터 선서합니다'를 전개한다. (사진=울산경찰청 제공) photo@newsis.com *재판매 및 DB 금지[울산=뉴시스] 안정섭 기자 = 울산경찰청은 오는 17일부터 30일까지 울산시민을 대상으로 안전속도 5030 인증 챌린지 '나부터 선서합니다'를 전개한다고 16일 밝혔다.이 행사는 참여자 스스로 안전속도 5030을 준수할 것을 다짐하고 평소 자신의 운전습관을 돌아보는 계기를 마련하고자 기획됐다.참여를 원하는 시민은 안전속도 5030을 다짐하는 문구와 함께 손바닥을 펴고 선서 포즈를 취해 인증샷을 찍으면 된다.이어 카카오톡 플러스친구에서 '울산광역시경찰청'을 검색해 채널추가한 뒤 일대일 채팅창으로 인증샷을 전송하면 된다.경찰은 인증샷을 전송한 시민 중 85명을 추첨해 텀블러, 에코백, 우산 등 소정의 기념품을 증정할 예정이다.경찰 관계자는 ""안전속도 5030은 보행자 중심의 교통문화를 정착시키기 위한 정책""이라며 ""내 가족과 우리 이웃의 안전을 위해 적극 동참해 줄 것""을 당부했다.안전속도 5030은 교통사고 예방과 보행자 안전을 위해 시내 주요 도로의 제한속도를 시속 30∼50㎞ 수준으로 강화한 교통정책으로 지난달 17일부터 본격 시행 중이다.☞공감언론 뉴시스 yohan@newsis.com▶ 네이버에서 뉴시스 구독하기▶ K-Artprice, 유명 미술작품 가격 공개▶ 뉴시스 빅데이터 MSI 주가시세표 바로가기<ⓒ 공감언론 뉴시스통신사. 무단전재-재배포 금지>"
2021.05.16.,수익율 89%...공모주 상장 첫날 팔아야 '이익 최대',https://n.news.naver.com/mnews/article/032/0003074440?sid=101,"[경향신문] SK아이이테크놀로지(SKIET)가 유가증권시장에 상장한 지난 11일 오전 서울 종로구 연합인포맥스에 설치된 화면에 SKIET 시간대별 주가 그래프가 표시되어 있다./연합뉴스올 상장 30개 기업 평균 매도 단가현재까지 보유한 경우엔 평균 41%올해 공모주 청약에 참여한 투자자들은 상장 첫날 공모주를 매도했을 때 수익률이 가장 높고 오래 보유할수록 수익률이 줄어든 것으로 나타났다. 공모주 열풍 등으로 올해 국내 유가증권시장에서 개인 투자자의 순매수 규모는 이미 지난해 전체 순매수 규모를 넘어섰다.올해 기업공개(IPO)를 통해 유가증권시장과 코스닥시장에 신규 상장한 기업은 30개(스펙 제외)다. 16일 이들 30개 기업의 상장 첫날 개인 투자자들의 평균 매도 단가(매도 거래대금을 매도 거래량으로 나눈 값)를 공모가와 비교하는 방식으로 추산한 결과, 상장 첫날 매도 수익률은 평균 89.0%로 집계됐다.지난 2월 코스닥시장에 상장한 로봇플랫폼 기업 레인보우로보틱스가 수익률 159.9%로 가장 높았다. 이어 자이언트스텝(158.6%), SK바이오사이언스(158.5%), 오로스테크놀로지(153.3%), 선진뷰티사이언스(151.2%), 모비릭스(146.6%), 해성티피씨(142.7%) 등의 순으로 나타났다. 모두 종가 기준으로 ‘따상’(시초가가 공모가 대비 두 배로 형성되고 당일 상한가 기록)에 성공했다.지난 11일 유가증권시장에 상장한 SK아이이테크놀로지(SKIET)의 경우 상장 첫날 ‘따상’에는 실패했으나 개인 투자자의 평균 매도 단가는 약 16만9000원으로 공모가(10만5000원) 대비 60.8%의 수익률을 보였다. 한국거래소에 따르면 30개 기업 중 13곳이 종가 기준으로 주가가 가장 높았던 때가 상장 첫날이었다. 에이치피오(지난 14일 상장)를 제외한 29곳 중 21곳은 상장 후 사흘 안에 고점을 형성했다.반면 현재까지 공모주를 매도하지 않은 경우에는 수익률이 평균 41%로 떨어졌다. 박종선 유진투자증권 연구원은 “유동성이 풍부하고 상장 첫날 공모주를 노리는 사람들이 많다 보니 주가가 강하게 오르는 경향이 있다”며 “이익 실현 물량, 의무보유 해제 물량 등이 나오면서 몇 달 사이에 조정이 이뤄지는 경우가 많다”고 말했다.개인 투자자들의 주식투자가 지속되면서 올해 들어 지난 14일까지 유가증권시장에서 개인 투자자들이 순매수한 금액은 50조9836억원에 달했다. 불과 4개월 반 만에 지난해 전체 개인의 유가증권시장 순매수 금액(47조4907억원)을 넘어섰다. 개인의 이 같은 매수세가 앞으로도 지속될지 관심인데, 카카오뱅크 등 ‘IPO 대어’들의 청약을 앞두고 있어 자금 유입이 이어질 가능성이 높아 보인다. 정원식 기자 bachwsik@kyunghyang.com▶ [인터랙티브] 김진숙을 만나다▶ 경향신문 바로가기▶ 경향신문 프리미엄 유료 콘텐츠가 한 달간 무료~©경향신문(www.khan.co.kr), 무단전재 및 재배포 금지"
2021.05.16.,사실상 ‘해고’ 당해도…플랫폼 노동자는 ‘노동자’가 아닌가요,https://n.news.naver.com/mnews/article/028/0002544677?sid=102,"회사랑 언쟁했다고 ‘계약 해지’ 여당 발의 보호법안도 ‘사각지대’ 약관 따르면 부당해고 못막아… “계약변경·해지사유 제한해야”플랫폼 청소업체 ‘당신의집사’ 화면과 플랫폼 노동자의 모습. 게티이미지뱅크  ㄱ씨는 지난 2월 플랫폼 청소업체 ‘당신의집사’를 통해 ‘청소 전문가’(클리너)로 일을 시작했다. 코로나19로 본업이 어려워지면서 여러 플랫폼 노동을 전전하다 당신의집사를 알게 됐다. 간단한 심사를 거쳐 애플리케이션(앱)에 가입하자 간단한 방 청소 순서와 청소도구 정리 지침 등이 안내사항으로 떴다. 등록한 뒤 이틀이 채 지나지 않아 카카오톡 알림이 울렸다. ‘업무가 들어 왔습니다. 고객님께 방문 인사를 해 주세요.’ 그에게 주어진 첫 번째 일이었다. 일은 어렵지 않았다. 청소에 자신이 있었고 짧은 시간 안에 고객들에게 좋은 평가도 받았다. ㄱ씨를 환영하는 단골도 생겼다. 다만 ㄱ씨는 일할수록 자신이 자영업자가 아니라 당신의집사에 소속된 ‘노동자’라고 생각하게 됐다. 당신의집사는 청소 한 건당 수입 3만5천원(정기고객은 3만2천원)의 18∼25%(6천∼9천원)를 수수료로 가져갔고, 일주일 동안 일한 돈을 합쳐 주급으로 지급했으며, 이따금 전화를 걸어와 업무를 추천했다. 플랫폼의 지침을 따르지 않으면 불이익도 받을 수 있었다. 당신의집사는 클리너와 맺는 ‘근무 정책 서약서’에 ‘배정된 예약을 일방적으로 취소하거나 결근하면 소득에서 차감될 수 있다’고 적었다. 클리너가 업무를 시작하거나 종료할 땐 회사로 알림이 가도록 앱 버튼을 눌러야 했다. 조금이라도 예정 시각보다 이르거나 늦게 도착하면 ‘고객님께 연락하셨나요?’와 같은 경고 메시지가 왔다. ㄱ씨는 “1분이라도 예정 시각보다 이르거나 늦게 도착하면 ‘고객님께 연락하셨나요?’와 같은 경고 메시지가 왔다”고 말했다. 돌발 상황이 생긴 건 지난달이었다. ㄱ씨가 회사 쪽에 일감 조정을 요구하는 과정에서 상담사와 언쟁이 붙자 상담사가 “함께 일할 수 없으니 오늘까지만 근무하는 걸로 하겠다”며 전화를 끊은 것이다. ㄱ씨가 휴대전화를 열자 예약돼 있던 청소 업무가 모두 해지돼 있었다. ㄱ씨는 배정돼 있던 고객들에게 양해를 구하고 집으로 돌아와야 했다. 하루 아침에 일자리를 잃게 된 것이다.하루 아침에 일자리 잃은 ‘청소 전문가’ 더불어민주당이 정부의 정책을 반영해 지난 3월 ‘플랫폼 종사자 보호 및 지원 등에 관한 법률안’(플랫폼 종사자 보호법안)을 발의했지만, 이 법안이 플랫폼 노동자의 권리를 보호하는 데는 사각지대가 여전하다는 지적이 나온다. 플랫폼으로부터 사실상 지휘·감독을 받는 노동자인데도 플랫폼 기업이 일방적으로 정하는 약관에 따라 계약 해지 등을 하면 노동자가 이에 대응할 수단이 마땅치 않기 때문이다. ㄱ씨의 경우 업무 형태를 봤을 때 자영업자가 아닌 당신의집사로부터 지휘·감독을 받는 노동자라고 볼 여지가 있다. 타다 기사의 부당 해고 사건을 대리한 신인수 전국민주노동조합총연맹(민주노총) 법률원 변호사는 “프리랜서인지 노동자인지 판단하는 기준은 계약의 형식이 아니라 사용자가 실질적으로 노동자를 감독했다고 볼 정황이 있는 지인데 ㄱ씨의 경우 업체의 업무 지시와 서약서상에 적은 불이익 규정, 수수료 비율 등을 봤을 때 노동자로 볼 여지가 있다”고 봤다. 윤애림 서울대 고용복지법센터 연구위원도 “자영업자의 가장 큰 특징이 ‘일을 스스로 선택하고 시장을 개척할 재량이 있는지’인데 이 업체의 경우 클리너가 고객을 직접 선택할 수도 없고 불이익 때문에 일을 거절하기도 어려워 자영업자가 아닌 노동자로 볼 여지가 크다”고 말했다. 하지만 ㄱ씨가 실제로 노동자로서의 권리를 인정받는 데는 많은 어려움이 따른다. ㄱ씨가 상담사와 언쟁이 있었던 이튿날 로그인을 시도하니 애플리케이션이 처음 깔았던 상태로 초기화돼 있었고 계정도 삭제됐다. 두어달동안 했던 ㄱ씨의 모든 업무기록과 회사와 나눈 대화도 모두 사라졌다. 업무기록을 확보하기 어려우니 노동위원회에 부당 해고 구제를 신청하더라도 노동자성을 입증하기가 만만치 않다. 윤 연구위원은 “노동위원회 단계에선 구제를 신청한 노동자가 부당 해고를 입증하게 돼 있다”며 “동료의 업무기록을 대신 제출하는 등의 조처를 취할 순 있겠지만 자기 자신에 대한 자료를 제출할 수 없다는 점은 불리한 요소”라고 말했다. 당신의집사 쪽은 “ㄱ씨가 통화하는 중에 화를 많이 내서 회사 상담사가 원론적으로 경고한 것일 뿐 실제로 계약을 해지하려 한 것은 아니었다”며 “그런데 ㄱ씨가 ‘그럼 나도 일 안 하겠다’고 답하길래 상담사는 계약이 종료된 줄 알고 해지한 것”이라고 설명했다. ㄱ씨에게 출퇴근을 알림으로 보고하도록 한 데 대해선 “청소가 제대로 되는지 확인하기 위한 최소한의 방법일 뿐”이라며 ㄱ씨가 노동자가 아닌 자영업자라는 점을 강조했다. 이에 대해 ㄱ씨는 “회사가 대체자를 찾기 어려운 당일 업무만 남기고 해지했길래 그럴거면 남은 것도 해지하라고 항의한 것”이라며 계약 해지 자체를 받아들일 수 없다는 의사를 회사 쪽에 여러 차례 전달했다고 반박했다. 플랫폼 종사자 보호법안이 제정되면 ㄱ씨처럼 불씨에 자신의 기록이 사라지는 경우는 막을 수 있다. 플랫폼 기업이 계약을 변경하거나 해지하려면 미리 약관에 정한 사유에 한해 최소 15일 전에 종사자에게 통지하도록 법이 정하고 있어서다. 플랫폼 기업이 이를 지키지 않으면 500만원 이하의 과태료를 물린다. 종사자는 보름 남짓한 시간 동안 계약 해지에 대응해 관련 자료를 모을 수 있는 여유가 있는 셈이다. 그러나 플랫폼 기업이 계약 해지를 남발하는 것 자체는 막지 못할 것으로 보인다. 법은 약관에 정한 사유라면 자유로운 계약 변경·해지가 가능하다고 보는데 이 사유를 정할 때 여전히 플랫폼이 힘의 우위에 서 있다. 현재도 형식만 갖춘 채 계약을 변경하거나 해지하는 경우는 많다. 배달기사를 쓰는 쿠팡이츠는 배달 콜을 자주 거절하는 배달원에 며칠간 일감을 주지 않거나 아예 계약을 해지할 때 자사 약관 3조5항을 근거로 든다. 이는 ‘회사가 정한 배달 절차를 고의적으로 위반하는 경우’나 ‘서비스품질 유지를 위해 필요하다고 판단되는 경우’ 등 10가지 시정조치 및 계약해지 사유를 정한 조항이다. ‘과도한 콜 거절’의 기준이 뭔지, 계약 해지 사유로 볼 수 있는지 논쟁의 여지가 있지만 일단 회사가 앱 접속을 막으면 쿠팡이츠 기사들은 대응할 방법이 없다. 박경수 민주노총 서비스연맹 법률원장(노무사)은 “플랫폼 노동은 일을 하려는 사람이 앱에 가입해 일감을 맡는 형태라 종사자가 플랫폼 계약에 이의를 제기하기 어려운 구조”며 “법이 시행돼도 사실상 앱에 약관이 이미 나와 있고 그에 맞춰 일할 사람은 가입하고 아니면 안 하는 식이 될 것”이라고 말했다.공정위가 적극 개입할 가능성도 작아 노동자가 약관을 확보해 공정거래위원회를 찾아가는 방법도 있지만 노동계는 이 역시 쉽지 않다고 본다. 독과점 등 시장 구조 개선에 초점을 맞추는 공정위가 개별 계약서의 약관 관련 분쟁에 주도적으로 개입할 가능성이 작아서다. 공정위 관계자는 “구체적으로 민원이 들어와야 판단할 수 있겠지만 사적 자치를 규율하는 약관을 공정위가 적극적으로 개입해서 약관법을 적용하는 덴 한계가 있다”고 말했다.  이 때문에 플랫폼 기업들이 일단 계약 해지를 통보하면 노동자는 ‘복직’을 위한 기나긴 싸움을 시작해야 한다. 대리기사 ㅈ씨는 2011년부터 약 9년 동안 대리기사 애플리케이션 ‘핸들포유’에 소속돼 일했지만 2019년 3월 내부 규정 위반을 이유로 계약 해지 통보를 받았고 더 이상 앱에 접속할 수 없었다. 회사를 거치지 않고 고객 접수 건을 동료 기사에게서 직접 넘겨받았다는 이유에서였다. ㅈ씨는 곧바로 회사를 상대로 소송을 제기했으나 2년 넘는 시간 동안 소송비를 감당해야 했고 업계에 좋지 않은 소문도 퍼지면서 구직에 어려움을 겪었다고 했다. 이 때문에 노동계와 전문가들은 기존의 노동법을 확장해 플랫폼 노동자를 보호하거나 최소한 플랫폼 종사자 보호법안의 사각지대를 보완해야 한다고 지적한다. 정흥준 서울과기대 교수(경영학)는 “아무런 생산기반 없이 노무만을 제공해 보수를 받는 사람들은 기존의 민법상의 권리로는 불충분하고 일정 부분 노동자로서의 권리를 보호해야 하는 게 맞다”며 “국회에 발의된 플랫폼 종사자 보호법안이 이런 점을 반영해 계약 변경·해지의 사유를 제한하거나 사회보험을 플랫폼 기업 쪽이 일정 부분 책임지게 하는 등 노동자로서의 권리를 보완할 필요가 있다”고 말했다.신다은 기자 downy@hani.co.kr▶한겨레가 ‘세번째 벗’을 찾아갑니다, 서포터즈 ‘벗’▶더불어 행복한 세상을 만드는 언론, 한겨레 구독하세요!▶코로나19 기사 보기[ⓒ한겨레신문 : 무단전재 및 재배포 금지]"
