기사날짜,기사제목,네이버 뉴스 url,기사내용
2021.05.16.,구독 어디까지 해봤니…구독경제 전방위 확산,https://n.news.naver.com/mnews/article/382/0000910124?sid=101,"“가전 렌탈부터 디지털 콘텐츠, 식음료까지” 구독경제가 대중화 되고 있다. 구독경제는 일정금액을 내면 상품이나 서비스를 주기적으로 받아 볼 수 있는 것을 말한다. 신문이나 우유 배달이 대표적 예다. 가전 렌탈도 그 중 하나다. 요즘엔 동영상이나 클라우드 게임 등 다양한 영역으로 확장되고 있다. 유통기업들도 앞 다퉈 식재료나 식음료 관련 서비스를 내놓으며 구독경제에 공을 들이고 있다. 최근에는 통신 기업이나 인터넷 포털 등 가입자 기반의 서비스·플랫폼 강자들이 이 시장에 적극 진출하고 있어 관심이 모아진다. 강력한 플랫폼 영향력과 마케팅 노하우를 앞세워 다른 기업들의 서비스까지 품고 나섰다. 심지어 경쟁사의 서비스까지 도입하고 있다. 다양한 서비스로 더 많은 충성 이용자를 확보해 그 생태계 안에 머무르게 하는 이른바 ‘록인’ 효과를 겨냥한 전략이다. KT경제경영연구소에 따르면 국내 구독경제 시장은 2016년 25조9000억 원에서 지난해 40조1000억 원으로 약 55% 증가한 것으로 보인다. 관련 업계는 2025년 100조 원 규모로 성장할 것으로 전망하고 있다.네이버·카카오도 확장 인터넷 강자들도 연이어 이 시장에 진출했다. 네이버는 지난해부터 ‘네이버플러스 멤버십’을 운영 중이다. 월 4900원을 내면 결제 금액의 최대 5%를 적립해주고, 웹툰이나 영화 등 디지털 콘텐츠 이용권을 제공하는 서비스다. 네이버는 올해 초 기존 보다 더 낮은 가격(월 3900원)에 이용할 수 있는 상품인 ‘연간 멤버십’을 출시하고, 콘텐츠 혜택에 티빙도 추가했다. 카카오는 카카오톡 채널에서 렌탈, 정기배송을 신청할 수 있는 상품구독 서비스를 운영 중이다. 카카오톡 채널에서 가전과 가구, 공기청정기 필터 등 다양한 상품에 대한 렌탈·정기배송정보 등을 한눈에 확인할 수 있다. 상품 구독에 필요한 정보를 알림으로 받아보고 상담과 결제도 가능하다. 비즈니스 파트너에게는 관리 플랫폼도 제공한다. 양사는 최근 구독 분야를 콘텐츠까지 확장하기로 했다. 네이버는 창작자 누구나 쉽게 콘텐츠를 제작하고, 유료로 판매할 수 있는 ‘프리미엄콘텐츠’ 플랫폼의 비공개시범테스트를 시작했다. 중소상공인(SME)들이 활동하고 있는 스마트스토어와 구조가 비슷하다. 창작자가 콘텐츠를 제작하고 유료로 판매할 수 있도록 네이버가 툴과 데이터를 제공한다. 판매 방식은 창작자가 단건, 월간 구독권, 그룹 이용권 등 다양한 옵션 중 선택할 수 있다. 카카오도 이르면 상반기 중 카카오톡에 콘텐츠 구독탭을 개설할 것으로 보인다.  SKT “구독형 마케팅 컴퍼니” 구독형 가입자 기반 서비스 운영과 마케팅 노하우를 갖춘 통신 기업들도 구독경제에 큰 관심을 보이고 있다. 동영상이나 게임은 물론 교육, 가전 렌탈 등 다양한 기업들과 손을 잡고 구독 상품을 내놓고 있다. 가장 적극적인 기업은 SK텔레콤이다. 인공지능(AI) 기반 구독형 마케팅 컴퍼니로의 변화를 준비하며 올 초부터 다양한 기업들과 협력해 관련 상품을 판매하고, 통신비 등 할인혜택을 담은 구독형 상품 서비스에 나섰다. 2월에는 웅진씽크빅과 교육 구독상품 ‘웅진스마트올’을 선보였고, 3월엔 SK매직 렌탈 상품을 대리점에서 판매하기 시작했다. 파리바게뜨와 베이커리 구독 서비스도 운영한다. 이 외에도 여행, 모빌리티 등 생활 전반의 다양한 영역에 대해 순차적 상품 출시를 검토 중이다. 하반기에는 통합형 구독 서비스도 내놓을 예정이다. 기존 T멤버십을 전국민이 쓸 수 있는 구독 마케팅 플랫폼으로 진화시켜 선보인다는 방침이다. 한명진 SK텔레콤 구독형상품컴퍼니장은 “정보통신기술(ICT) 생활밀접영역에서 다양한 구독상품을 준비 중이다”며 “기본적으로는 아마존프라임처럼 통합 구독 상품으로 월 구독료를 받는 것을 고려하고 있다”고 밝혔다. 2025년까지 가입자 3500만 명, 매출 1조5000억 원이 목표다.김명근 기자 dionys@donga.com▶ 연예현장 진짜 이야기  / 스타들의 아찔한 순간▶ 나의 아이돌을 픽♥ 해주세요. / 이번 주는 누가 1위?- Copyrights ⓒ 스포츠동아 무단 전재 및 재배포 금지 -"
2021.05.16.,"계속되는 가상화폐 거래소 사고···""거래소 감독 법·기관 갖춰야""",https://n.news.naver.com/mnews/article/011/0003910589?sid=101,"지난 13일 역삼동의 한 가상화폐 거래소 에서 투자자가 심각한 표정으로 하락하고 있는 시황판을 살피고 있다./이호재 기자[서울경제] 대형 가상화폐 거래소에서 나흘에 한 번꼴로 매매·입금 등 지연 사고가 반복되면서 시스템 안정성과 투자자 보호 측면에서 심각한 문제가 드러나고 있다. 근본적으로는 가상화폐 거래소 주문·입금 체계의 안정성이나 투자자 보호 조치 등을 감독하고 강제할 주무 부처와 법이 꼭 필요하다는 지적이 나온다. 16일 국내 가상화폐 거래소 '빗썸'의 홈페이지 공지사항을 보면 4월 이후 이달 15일까지 모두 11건의 '지연 안내'가 게시됐다. 한 달 보름 동안 거의 나흘에 한 번꼴로 지연 사고가 발생한 셈이다. 개별 코인과 관련해 수시로 올라오는 “네트워크 이슈로 입출금이 일시 중지됐다”는 안내 공지를 빼고도 이 정도다. 지연 종류별 빈도는 △매매·체결 지연 3회 △원화 출금 지연 3회 △접속 지연 2회 △차트 갱신 지연 1회 △비트코인 신규 입금주소 생성 지연 1회 △카카오톡 서비스 장애에 따른 알림톡 인증 지연 1회 등이었다. 지난 14일 오후 6시 42분에도 “접속자 급증에 따른 트래픽 증가로 모바일 웹, 앱을 통한 사이트 접속이 지연되고 있으니 PC를 통한 이용을 부탁드린다”고 긴급 공지가 올라왔다.거래대금 기준으로 빗썸과 함께 국내 가상화폐 양대 거래소 중 하나인 업비트도 상대적으로 빈도는 낮지만 한 달에 한 번 정도는 각종 문제로 긴급 서버 점검에 나서고 있다. 업비트는 이달 11일 오전 10시 16분과 58분 각 “시세 표기 중단 문제로 긴급 서버 점검을 진행한다”, “서버 점검 완료로 원화, BTC(비트코인) 마켓의 거래가 재개됐다”고 공지했다. 이 시간대 업비트 거래소 화면에서는 시세 등 숫자가 움직이지 않는 오류가 나타났다.수조 원 거래가 이뤄지는 주문·체결·입출금 시스템에 반복적으로 문제가 생긴다는 사실 자체도 심각하지만 투자자 보상이나 재발 방지와 관련한 규정도 거의 없는 상태다. 빗썸의 지난 11일 사고의 경우 수 분간 체결이 지연됐다는 것은 초 단위로 시세가 변하는 가상화폐 거래 특성상 투자자가 당초 의도한 시점과 가격에 거래하지 못했을 가능성이 크다는 뜻이다. 하지만 빗썸 관계자는 “아직 보상은 내부적으로 논의되고 있지 않다”고 전했다. 빗썸 측은 매매 중단이나 지연 등 피해가 거래소 측의 고의, 과실에 따른 것으로 입증되지 않는 한 보상 책임이 없다는 취지의 약관에 따른 판단이라고 설명했다. 다만 업비트는 비슷한 내용의 약관에도 불구하고 도의적 책임 차원에서 11일 시세 표기 중단 사고에 대해 보상을 검토하고 있다. 업비트 관계자는 “서비스에 장애가 생기면 기본적으로 업비트의 과실이 입증되지 않아도 정책에 따라 손해액을 보상할 것”이라고 설명했다.바뀐 특정금융거래정보법(특금법)에 따라 가상화폐 거래소에 대한 종합 검증 역할을 떠안게 된 시중은행들도 최근 잇단 가상화폐 거래소 사고를 주시하고 있다. 특금법은 자금세탁 방지 관련 전산·조직·인력을 갖추라는 것이지만, 매매 지연·중단 현상이 빈발하고 외부 자동 프로그램을 이용한 주문 폭주에 대응하지 못하는 현행 가상화폐 거래소의 불안한 시스템을 방치한 채 실명계좌를 발급해주기 어렵기 때문이다. 은행권 관계자는 “은행연합회가 외부 컨설팅을 거쳐 최근 은행권에 공통적으로 제시한 자금세탁방지 위험평가 방법론 지침에도 'ISMS(정보보호관리체계 인증) 여부' 등 전산시스템 안전성·보안 항목이 주요 기준으로 제시됐다”며 “은행은 실명계좌 발급을 신청한 거래소를 검증할 때 시스템 사고와 처리 이력 등도 당연히 볼 수밖에 없을 것”이라고 전했다.가상화폐 거래소의 사고가 잦은 근본 원인으로 거래소의 안정적 운영을 위한 법과 주무 기관(부처)이 없다는 점도 문제로 꼽힌다. 한 시중은행 관계자는 “입출금 지연 등은 은행으로 보자면 매우 중요한 운영 리스크 관리 문제”라며 “은행에서 이런 종류의 전산 사고나 행정 사고가 나면 반드시 금융감독원이 검사하고 제재나 조치를 취하는데 가상화폐 거래소의 경우 감독하거나 제재할 기관 자체가 없으니 사고가 반복될 수밖에 없다”고 말했다. /김현진 기자 stari@sedaily.com▶ [지구용] 투명해진 맥주병, 그런데 말입니다...▶ 서울경제 더 폴리틱스 뉴스를 만나보세요!▶ 미슐랭 가이드처럼 알찬 부동산 뉴스 '집슐랭'저작권자 ⓒ 서울경제, 무단 전재 및 재배포 금지"
2021.05.16.,"[종합] '스트레이트' 진짜 ESG 경영은? ""이미지 재고가 목적 아냐""",url없음,<네이버 기사 없음>
2021.05.16.,이달만 7번…코인가격 떨어지면 멈추는 거래소,https://n.news.naver.com/mnews/article/029/0002674004?sid=101,"5월5일·7일·11일 코인 가격 하락할 때마다 '매매·체결 지연'세 번이나 발생했는데 ""접속한도 조절하겠다"" 단순 대응만암호화폐 거래소에서 발생한 오류 현상은 이달에만 7건이었다. <빗썸>    국내 암호화폐 거래소 빗썸에서 또 매매·입금 지연 사고가 발생됐다. 이달만 일곱 번째로 잦은 오류 발생에 투자자 보호 측면에서 심각한 문제가 드러나고 있다는 평가가 나온다. 특히 이 같은 오류는 암호화폐 시세가 급락할 때마다 발생했다는 점에서 투자자들의 우려를 더하고 있다. 16일 금융권에 따르면 암호화폐 거래소 빗썸에서 발생한 오류 현상은 이달에만 7건이었다. 개별 코인에 대한 입출금 일시 중지까지 포함하면 10건이 넘는다. 보름 동안 거의 매일 지연 사고가 발생한 셈이다. 지연 종류별 빈도는 ▲매매·체결 지연(3회) ▲접속 지연(1회) ▲차트 갱신 지연(1회) ▲비트코인 신규 입금주소 생성 지연(1회) ▲카카오톡 알림톡 인증 지연(1회) 등이었다.이밖에 원화 출금 지연도 지난달에만 3차례 발생하는 등 빈번하게 발생하고 있고, 네트워크 문제로 개별 코인에 대한 입출금 일시 중단 현상도 수시로 발생하고 있다. 거래대금 기준으로 빗썸과 함께 국내 가상화폐 양대 거래소 중 하나인 업비트도 상대적으로 빈도는 낮지만 한 달에 한 번 정도는 각종 문제로 '긴급 서버 점검'에 나서는 상황이다.업비트는 이달 11일 오전 10시 16분과 58분 각 ""시세 표기 중단 문제로 긴급 서버 점검을 진행한다"", ""서버 점검 완료로 원화, BTC(비트코인) 마켓의 거래가 재개됐다""고 공지했다. 이 시간대 업비트 거래소 화면에서는 시세 등 숫자가 움직이지 않는 오류가 나타났다.문제는 이들 거래소의 오류 현상은 암호화폐 가격이 전반적으로 하락세를 보일 때마다 발생했다는 점이다. 이는 초 단위로 시세가 변하는 암호화폐 거래 특성상 오류 발생 시 투자자가 의도한 시점과 가격에 거래하지 못했을 가능성도 키운다. 실제 빗썸에서 지난 5일 새벽에 발생한 '매매 주문 시 체결 지연' 현상 당시 암호화폐 시세는 비트코인의 5%대 급락으로 하락세를 보였다. 당일 비트코인 가격은 코인마켓캡에서 24시간 전보다 4.86% 급락한 5만4343달러를 기록했다. 국내 거래소 업비트에서도 24시간 전보다 2.80% 하락한 6803만4000원에 거래됐다. 이틀 뒤인 7일 접속 및 주문량 폭증으로 매매 주문 시 체결 지연 현상이 다시 발생했을 당시에도 비트코인 가격은 전일 7000만원까지 올라갔다가 6700만원대로 3%가까이 하락 중이었다. 나흘 뒤인 11일에도 비트코인 가격이 3.5% 하락세를 보였고, 빗썸에서는 동일한 오류가 발생했었다. 빗썸은 오류 때마다 API(응용프로그램 인터페이스) 기반 자동 주문 프로그램을 통한 접속과 주문이 급증했기 때문으로 분석하고 ""API 레이트 한도를 조절하겠다""는 것 이외에 특별한 대응책을 마련하고 있지는 않다. 거래소는 접속 급증에 따른 단순 지연 상황이라는 설명이지만, 투자자들은 잦은 오류, 그것도 매매 주문 체결이라는 민감한 사안이 코인 가격 하락 시기와 지나치게 자주 맞물리고 있다는 점을 우려하고 있다. 한 암호화폐 투자자는 ""급격한 가격변동으로 접속자가 몰려 오류가 발생할 수 있다지만, 같은 상황이 자주 반복되는 건 의심스럽다""며 ""코인 가격 하락 때마다 발생하는 오류가 과연 우연인지 의문이다""라고 말했다. 이윤형기자 ybro@dt.co.kr ▶[ 네이버 메인에서 디지털타임스 구독 ] / ▶[ 뉴스스탠드 구독 ]▶디지털타임스 홈페이지 바로가기"
2021.05.16.,"한강공원 사망 대학생 동기 추정 인물, ""네가 죽인 거야""",https://n.news.naver.com/mnews/article/119/0002493429?sid=102,"""시간 지나면 멀쩡하게 곱게 살 수 있을 것 같냐""ⓒ손현 블로그서울 한강공원에서 실종됐다가 숨진 채로 발견된 손정민(22)씨와 사건 당일 함께 술을 마신 친구 A씨를 겨냥한 글이 올라왔다.지난 13일 유튜브 채널 '신의한수'는 정민씨가 다녔던 대학교 의대생이 쓴 글로 추정된다며 대학교 익명 커뮤니티에 올라온 게시글을 공개했다.작성자 B씨는 ""나 오늘부터 중립 아니다. 참는 데도 한계가 있다""고 적었다. 그러면서 ""사건 시작 때부터 단체 카카오톡방에 너에 대한 근거 없는 이야기가 많았다. 그러니까 '조심하자 조용하자'는 얘기가 계속 올라왔고 내 생각에도 아직 밝혀진 것도 없는데 네가 욕먹는 게 안타까웠다""고 말했다.B씨는 ""그래도 오래 본 동기니까 X 같은 이유로 조금이나마 너의 편에 있었던 내가 XX 같다""며 ""아직도 이렇게 하는 게 맞는 거냐. 너는 내 눈앞에 절대 띄지 마라""고 썼다. 이어 ""일말의 양심도 없는 X. 믿었던 우리가 한심하지. 그냥 자퇴하라""고 비판했다.B씨는 ""혹시나 병원이든 의대든 나타날 생각하지 마""라며 ""네가 한 짓 덮어놓고 시간 좀 지나면 멀쩡하게 곱게 살 수 있을 것 같냐""라고 되물었다. 그는 ""웃기지 마. 네가 조금이라도 그럴 기미 보인다면 가만히 있지 않을 사람 많다""며 ""학교 명예랑 상관없이 넌 (의사) 선서할 자격도 없는 X이야""라고 저격했다.그러면서 ""사람 그렇게 보냈으면 제발 의대 근처에도 오지 마라. 진심으로 역겹고 화가 치미니까""라며 ""네가 안 죽였다고? XX 마. 네가 죽인 거야""라고 강조했다.데일리안 김하나 기자 (hanakim@dailian.co.kr)▶ 데일리안 네이버 구독하기★ 구독만 해도 스타벅스쿠폰이 쏟아진다!▶ 제보하기ⓒ (주)데일리안 - 무단전재, 변형, 무단배포 금지"
2021.05.16.,[화제의 분양단지] '두산위브더제니스 양산' 견본주택 가보니,https://n.news.naver.com/mnews/article/014/0004639518?sid=101,"실수요자 입장서 '알파룸' '드레스룸' 꾸며 매력 만점  양산시 물금읍 범어리 2715-20에 마련된 '두산위브더제니스 양산' 아파트 견본주택을 찾은 예비 청약자들이 대단지 메리트에 큰 관심을 보이고 있다. 사진=두산건설 제공  [파이낸셜뉴스] 대도시 부산과 울산의 신흥 베드타운으로 급부상한 양산시 상북면에 분양 중인 '두산위브더제니스 양산' 견본주택에 실수요자들의 발길이 줄을 이어 화제를 모으고 있다.   경남 양산시 물금읍 범어리 2715-20에 마련된 이 아파트 견본주택에는 지난 15일 주말 내내 비가 내리는 가운데서도 사전예약도 없이 실물을 보기 위한 방문객들까지 몰렸다.   '두산위브더제니스 양산' 견본주택을 찾은 방문객들은 대단지 브랜드 아파트답게 실수요자들의 입장에서 꼼꼼하게 공간을 활용한 내부를 보고 또 한번 더 놀랐다는 반응을 보였다.    '두산위브더제니스 양산' 전용면적 84㎡형에 식탁자리 옆 4번째 방으로 예쁘게 꾸며진 '알파룸'.  부산 해운대에 사는 박 모씨(55·여)는 ""전용면적 84㎡형을 둘러보면서 방 3개에다 건강을 생각한 신발살균기, 방마다 마련된 드레스룸, 식탁자리 부근에 아이들의 공부방이나 주부 독서공간으로 활용할 수 있는 '알파룸'까지 마련된 것이 마음을 사로잡았다""며 ""실수요자들의 입장에서 편의를 제공하기 위해 오랫동안 준비한 흔적을 엿볼 수 있었다""고 소감을 말했다.   양산시 산막공단에 있는 회사원인 최 모씨(33·남)도 ""현재 울산에서 출퇴근을 하고 있는데 양산으로 이사하기 위해 견본주택을 찾았다""면서 ""아직 신혼이라 59㎡형을 관심있게 봤는데 작은 평형답지 않게 방 3개에다 화장실까지 2개를 배치하는 세심함이 돋보여 계약을 결심하게 됐다""고 전하기도 했다.   이처럼 '두산위브더제니스 양산'에 실수요자들의 관심을 집중시키고 있는 것은 어디에서도 접근이 쉬운 사통팔달의 광역교통망 호재에다 전생활이 보장되는 대단지 브랜드 아파트의 매력, 부동산 비규제지역으로 대출이 쉽고 무제한 전매가 가능하다는 이점까지 모두 갖고 있기 때문이다.   아파트가 들어서는 양산 상북면 일대가 '부동산 핫플레이스'로 주목받는 이유는 광역교통망의 요충지로 떠오르고 있다는데 있다.   부동산 규제지역으로 묶인 부산에서는 경부고속도로 구서동 부산톨게이트에서 10분대면 도달할 수 있는 하나의 생활권이나 다름없다. 울산에서도 최근 부분 개통된 울산~함양고속도로를 이용하면 막힘없이 도달할 수 있는 거리에 위치한다.      여기에다 광역도시철도망으로 5~10분대에 도달하는 KTX울산역과 KTX진영역, 부산·울산·경남 창원을 순환할 수 있는 정부의 '제4차 국가철도망 구축 계획안'까지 발표되면서 개발호재에 따른 투자가치도 더해져 관심을 집중시키고 있다. 이미 공사에 들어간 양산시 북정역과 부산도시철도 1호선 종점인 노포역을 연결하는 '도시철도 양산선'은 오는 2024년 개통될 예정이다. 북정역과는 5km 정도의 거리에 아파트가 위치한다. 아파트가 완공되면 입주민들의 교통편의를 위해 45인승 셔틀버스 4대도 통학·통근용으로 자체 운행될 예정이다.   이 때문에 삼성SDI 등 양산에 있는 크고 작은 기업 직원들이나 부산·울산지역 젊은 맞벌이 부부, 포스트 코르나 시대 힐링생활을 원하는 퇴직자 등이 선호하는 최적의 '워라밸·힐링 신흥 주거지'로 관심을 받고 있다.   양산시 상북면 석계리 57-1 일원에 지하 2층~지상 30층, 10개동 총 1368가구로 조성되는 '두산위브더제니스 양산'은 17일 특별공급에 이어 18일 1순위, 20일 2순위 청약을 받는다. 전용면적별로는 △59㎡A 337가구, △59㎡B 158가구, △59㎡C 179가구, △84㎡A 526가구, △84㎡B 84가구, △84㎡C 84가구로 구성돼 있다.      대단지 브랜드 아파트인데도 내집 마련 꿈을 실현하고자 하는 실수요자들의 욕구에 맞게 '착한 가격'으로 분양가를 책정해 더욱 선호도를 높여주고 있다. 지상 2층부터 지상 30층까지 공동주택이 배치되는 이 아파트 분양가는 지상 2층이 평당(3.3㎡) 778만원, 지상 29~30층이 평균 900만원대로 급등하는 주변 아파트 시세와 비교할 때 파격적인 편이다.   부동산 규제지역으로 묶이지 않은 곳이라 부동산 담보대출이 용이하고 무제한 전매까지 허용된다는 점에서 실수요자는 물론 투자자들의 관심도 끌고 있다.   부동산 비규제지역인데다 지방광역시에도 해당되지 않아 대출자격 요건이 까다롭지 않은 데다가 취득세, 양도세 같은 세금에 대한 부담을 덜 수 있다는 점도 이점으로 작용하고 있다. 계약 후 바로 전매가 가능하다는 점도 투자매력을 더해준다.      '두산위브더제니스 양산'는 '나의 살던 고향은 꽃피는 산골~'로 시작되는 동요를 지은 아동문학가 이원수가 태어난 바로 그 땅에서 지어진다는 점에서 '고향의봄 아파트'라는 스토리텔링과 함께 '애칭'까지 붙어 있다.   아파트 뜰에 '문학의 향기'가 흐르고 이에 걸맞게 조경에도 신경을 쏟아 복숭아꽃, 살구꽃이 만발하고 피톤치드 편백나무 숲길을 거닐 수 있도록 꾸며 주 5일 근무제 정착에 이은 포스트 코로나 시대 가장 이상적인 '워라밸(Work-life balance) 힐링 아파트'를 표방한다. 일반 아파트에서는 보기 드물게 젊은 맞벌이 부부와 퇴직자 등 입주민들을 위해 상가 2층에 호텔급 조식 뷔페까지 운영하기로 해 매력을 더해주고 있다.      이 아파트는 낙동강 하구물이 아닌 맑은 1급수 밀양댐물을 식수로 제공한다는 점도 건강을 생각하는 실수요자들에게 인기를 끌 것으로 보인다.   '두산위브더제니스 양산'은 인공지능(AI) 기반의 스마트 홈네트워크 시스템을 총망라한 '똑똑한 아파트'로 편리함을 더해준다.   스마트 홈시스템을 통해 카카오홈 사물인터넷 연동으로 가전제품을 이용할 수 있도록 장치한다. 안면인식·지문·손금이나 카드없이 휴대폰 어플로 공동 현관 문을 열어 엘리베이트를 이용하고 안방과 거실· 침실 전등과 온도조절기 네트워크 스위치도 휴대폰으로 컨트롤 가능하도록 설계돼 있다.   지하 주차장의 경우도 200만 화소 고화질 CCTV와 번호판 인식 주차관제, 주차알림시스템이 적용된다. 아파트 내부는 특화 빌트인과 친환경 에코시스템으로 시공된다. 고급시트 패널이 적용된 거실 벽면과 대형 아트월, 워크인 드레스룸, 다용도 팬트리, 안방 시스템장, 주방 TV, 부부 욕실, 하이브리드 인덕션, 복합광파오븐, 신발 살균기, LG 스타일러를 발코니 확장때 기본으로 제공한다. 에너지 1등급 친환경 보일러와 LOW-E 복층유리, 절수형 패달, 천장형 공기 청정기(옵션), 빗물 이용 시스템, 각방 난방제어 시스템 등 친환경 에코시스템이 적용된다.      분양 관계자는 ""대단지 브랜드 아파트로 조성되면서도 '착한 분양가'로 책정됐다는 점과 비규제지역 프리미엄, 경남 진영과 울산까지 이어질 '제4차 국가철도망 구축 계획안'까지 중장기 호재로 작용해 높은 청약 경쟁률이 기대된다""고 전했다.    roh12340@fnnews.com 노주섭 기자   ▶ 날로먹고 구워먹는 금융이슈 [파인애플]▶ 모(毛)아 모아 [모아시스]▶ 헉! 소리나는 스!토리 뉴스 [헉스]  ※ 저작권자 ⓒ 파이낸셜뉴스. 무단 전재-재배포 금지"
2021.05.16.,"""안전속도 5030, 나부터 선서합니다""",url없음,<네이버 기사 없음>
