기사날짜,기사제목,네이버 뉴스 url,기사내용
2021.05.13.,[장외주식] 제주맥주 이틀 연속 상승,https://n.news.naver.com/mnews/article/008/0004587153?sid=101,"[머니투데이 피스탁 ] 13일 코스피시장(3122.11pt)은 개인은 매수했으나 외국인의 매도에 지수는 1.25% 하락하며 마감됐고 코스닥시장(951.77pt)은 개인은 매수했으나 기관과 외국인의 매도로 지수는 1.59% 하락하며 장을 마쳤다.공모가가 3200원으로 확정된 제주맥주는 1.89% 오른 5400원의 호가로 이틀 연속 상승했으며 내일까지 일반공모를 진행하며 기관수요예측 경쟁률은 1,356.43대1 이었고 26일 코스닥 시장에 상장할 예정이다.청구기업 카카오뱅크는 1.96% 내린 10만원의 호가로 이틀 연속 하락했으나 승인기업 에스디바이오센서는 1.96% 오른 13만원의 호가로 이틀 연속 상승했다.내일 코스닥 시장에 상장하는 에이치피오는 공모가 2만2200원으로 청약경쟁률은 95.01대1 이었고 기관수요예측 경쟁률은 252.13대1 이었으며 시초가 결정수준에 따른 장중 대응으로 수익율이 엇갈릴 것으로 추정된다.장외주요종목중 대기업계열주는 대부분 하락했고 바이오 관련주는 하락한 종목이 많았으며 남북경협주는 상승세를 이어갔다.바디프랜드는 1.54% 내린 1만6000원의 호가로 소폭 하락했으나 현대아산(1만7050원,+0.59%)은 나흘 연속 상승했다.SK건설은 2.68% 내린 7만2500원의 호가로 사흘 연속 하락했고 비보존은 2.46% 내린 1만9850원의 호가로 6거래일 상승후 사흘 연속 하락하며 조정을 보였다.바이오시밀러 업체 에이프로젠은 1.79% 오른 2만8500원의 호가로 이틀 연속 상승했으나 폴루스는 1.16% 내린 4250원의 호가로 소폭 하락하며 조정을 보였다.엔지노믹스는 3.03% 내린 6만4000원의 호가로 조정을 보였고 시각화솔루션 업체 엔쓰리엔은 1.37% 내린 3600원의 호가로 최저가를 재차 경신했다.진단업체 솔젠트는 1.36% 내린 1만850원의 호가로 소폭 하락했고 필러업체 아크로스는 1.54% 내린 12만8000원의 호가로 3주여만에 조정을 보였다.오비고(2만4750원), 한국증권금융(1만1800원), 현대엔지니어링(127만원), 현대오일뱅크(4만4000원), 제너럴바이오(9500원), 한국코러스(10만1500원), 지아이이노베이션(5만4500원), 비씨켐(5만3000원), 노바셀테크놀로지(1만750원) 등 장외종목은 주가변동없이 장을 마감했다.피스탁  ▶부동산 투자는 [부릿지]▶주식 투자는 [부꾸미TALK]▶부자되는 뉴스, 머니투데이 구독하기 <저작권자 ⓒ '돈이 보이는 리얼타임 뉴스' 머니투데이, 무단전재 및 재배포 금지>"
2021.05.13.,"[종합주가지수] 코스피, 오늘도 등돌린 외인에 3100 위험…개미는 받았다",url없음,<네이버 기사 없음>
2021.05.13.,코린이의 ICO 참여 '피말랐던 2개월',url없음,<네이버 기사 없음>
2021.05.13.,"'시민 소통강화'…속초시, SNS 채널로 이벤트 실시",url없음,<네이버 기사 없음>
2021.05.13.,"한류콘텐츠와 국내 中企, 새로운 만남을 캐스팅(CAST:ING)하다",https://n.news.naver.com/mnews/article/025/0003101352?sid=101,"다양한 장르의 한류콘텐츠가 가진 소프트 파워와 경쟁력을 갖춘 국내 중소기업이 만나면 어떨까? 문화체육관광부(장관 황희)와 한국국제문화교류진흥원(원장 정길화, 이하 진흥원)은 〈한류연계 협업콘텐츠 기획개발 지원 사업, ‘캐스트(CAST: Connect, Accompany to make Synergy and Transformation)’〉(이하 CAST 사업)를 통해 이 새로운 만남을 지원하고 있다.      CAST 사업은 대중예술은 물론 순수예술과 전통, 생활문화를 아우르는 여러 장르의 한류 IP를 연계한 중소기업 상품의 기획·개발, 홍보, 유통 전 과정을 지원하는 사업으로, 2020년에는 약 60여개 기업이 참여해 220개의 제품과 콘텐츠를 개발하였다. 오는 5월 14일부터 28일까지 약 2주간 복합 온라인 프로모션 “캐스팅(CAST:ING)”을 통해 개발 상품과 사업에 담긴 이야기를 공개하며 국내외 소비자에게 더 가까이 다가선다.      브레이브걸스를 주인공으로 한 웹툰 등 다양한 상품 선보여            2020 CAST 사업에서는 역주행의 신화 브레이브걸스를 주인공으로 창작한 웹툰 '용감한 언니가 도와줄게’, 모모랜드와 카드(KARD), 에이티즈(ATEEZ) 등이 함께한 ‘모던 패션 한복’, 인기 웹툰 ‘유미의 세포들’과 함께한 퍼즐게임 ‘마이 드림 하우스’ 등이 탄생하였다. 국내 최고의 이스포츠 구단 디알엑스(DRX) 선수들이 기획개발부터 제작에 참여한 게이밍 의류, 철권 챔피언 배재민 선수의 전략을 담은 조이스틱 ‘무릎 레버(KNEE Lever)’는 이스포츠와 연관 산업의 동반성장 가능성을 제시하였다. 또한 방탄소년단의 캐릭터인 ‘타이니탄’을 연계한 데스크 용품, 인기 캐릭터이자 소방청 홍보대사인 코코몽의 이야기를 담은 가방시리즈 등은 국내외 소비자들의 마음을 사로잡아 큰 반응을 얻고 있다.      SSG닷컴, 카카오, 쇼피(Shopee) 등 국내외 유통 플랫폼 및 카카오페이지를 통한 분야별 기획전 및 온라인 포럼, 개발 스토리 영상 콘텐츠 공개 등 복합 온라인 프로모션 “캐스팅(CAST:ING)”      이번 프로모션은 국내외 온라인 커머스 연계 기획전과 카카오페이지 단독 기획전, 온라인 포럼과 상품 기획개발 스토리를 만날 수 있는 영상 콘텐츠 등 글로벌 소비와 유통의 기반을 마련하기 위한 뜨거운 장이 펼쳐질 예정이다.      5월 14일 오후 2시 사업 공식 유튜브 채널을 통해 송출되는 온라인 포럼 “캐스팅 온 라이브(CAST:ING ON LIVE)”에서는 공게임즈, 코팬글로벌, 카카오커머스, SSG닷컴, 쇼피코리아 등 IP 및 유통 분야의 전문가들이 한류 콘텐츠와 협업을 통한 콘텐츠 분야 가치 창출 사례, 언택트 시대 글로벌 유통 전략 등을 총 3부에 걸쳐 소개한다. 마지막 4부에서는 사업에 참여자들의 분야별 우수 사례 공유가 이어지며, 업계 종사자들은 물론 한류의 지속 가능성에 대해 관심 있는 누구나 즐길 수 있는 세션으로 구성된다.      5월 17일부터 28일까지 SSG닷컴, 카카오 그리고 쇼피(Shopee)에서 진행되는 온라인 커머스 연계 기획전은 디자인과 기능을 고루 갖춘 전통, 뷰티, 패션, 생활용품 분야의 약 30여개 기업 제품과 제품에 담긴 한류콘텐츠 연계 스토리도 만나볼 수 있다. 뿐만 아니라 실제 구매까지 가능하여 국내외 한류에 관심 있는 소비자들의 관심이 주목된다.      공공 분야 최초로 시도되는 카카오페이지 기획전에서는 사업을 통해 제작한 웹툰 작품 7편을 소개한다. 신진 케이팝 아티스트를 주인공으로 제작한 다양한 장르의 웹툰이 독자들에게 더 가깝게 다가갈 수 있도록 다양한 이벤트가 함께 진행된다. 특히 브레이브걸스를 필두로 에이스(A.C.E.), 머스트비, 버스터즈, 투포케이(24K), 썸(XUM), 소녀주의보 등 내일이 기대되는 신진 케이팝 아티스트를 주인공으로 한 웹툰의 신선한 협업은 많은 케이팝 팬들의 마음을 설레게 할 것으로 기대된다.      사업 공식 유튜브 채널에서는 게임(이스포츠)분야 상품 소개와 개발 과정 이야기가 순차적으로 공개된다. 사업을 통해 출시된 5편의 게임을 최근 국내외 많은 팬을 모으고 있는 케이팝 그룹 ‘위아더원(W.A.O.)’과 개발자들이 직접 게임을 소개하고 시연한다. 게임에 담겨있는 한류 콘텐츠와 게임 플레이를 위한 주요 포인트를 함께 소개할 예정이다. 또한 사업에 참여한 디알엑스(DRX)와 배재민 선수, 2018 자카르타-팔렘방 아시안게임 시범종목으로 도입된 이스포츠 분야 첫 금메달리스트 조성주 선수가 기업 담당자들과 함께 개발 스토리를 소개하고 정보를 제공하여 상품의 전문적인 정보를 제공해 소비자들의 마음을 훔칠 예정이다.      진흥원 정길화 원장은 ""본 사업과 이번 프로모션이 국내 중소기업을 지원하고 다양한 한류콘텐츠의 가능성을 소개하는 유익한 기회가 될 것으로 기대한다""며, ""사업에 참여한 분들이 좋은 결실을 맺고, 나아가 더 많은 우리의 자랑스러운 한류콘텐츠와 국내 중소기업이 지속적인 해외진출의 발판을 마련할 수 있도록 더 좋은 사례를 발굴하고 확장하도록 노력하겠다""고 전하였다. 자세한 사항은 사업 공식 온라인 누리집을 통해 확인할 수 있다.  온라인 중앙일보  ▶ 그가 들려주는 이야기, 이상언의 '더 모닝'▶ 건강한 주식 맛집, 앤츠랩이 차린 메뉴▶ '실검'이 사라졌다, 이슈는 어디서 봐?ⓒ중앙일보(https://joongang.co.kr), 무단 전재 및 재배포 금지"
2021.05.13.,공매도만 1조원...코스피 견뎌낼까,url없음,<네이버 기사 없음>
2021.05.13.,"감사 습관 들이기, 하루를 마무리하는 ‘감사일기’로 시작해볼까",url없음,<네이버 기사 없음>
2021.05.13.,[플랫폼의 갑질]“독식보다 공존”…수수료 인하 앞장서는 기업들,https://n.news.naver.com/mnews/article/277/0004902187?sid=105,"기획 - 코로나 시대 플랫폼의 갑질 (下)수수료 인하 움직임, 시장경쟁 활성화 마중물 돼야국회서도 플랫폼 승자독식 예의주시[아시아경제 조슬기나 기자]과도한 수수료, 광고비 압박 등 거대 플랫폼의 승자독식에 따른 문제점이 두드러지자, 도리어 수수료 인하를 앞장 서서 결정하는 기업들이 주목받고 있다.'앱마켓 공룡' 구글 플레이가 이른바 ‘30% 앱통행세’로 논란에 휩싸인 사이, 중소기업을 대상으로 한 파격적인 수수료 감면 정책을 결정한 원스토어의 행보가 대표적이다. 위메프, 티몬 등 이커머스 업계에서는 셀러(판매자) 영입을 위한 최저가 수수료 경쟁도 불붙었다. 이는 모두 막강한 영향력을 자랑하는 플랫폼 공룡에 대항해 시장 입지를 확대하는 동시, ‘상생’을 통한 생태계 발전을 도모하려는 움직임으로 해석된다.▶관련기사 5월12일자 2면 < [플랫폼의 갑질 (上)]거대 플랫폼의 그림자…잡지도 놓지도 못하는 소상공인>▶관련기사 5월12일자 1면 < [플랫폼의 갑질 (上)]'야놀자'의 수수료 바가지…방값 30% 꿀꺽>◆ 수수료 낮추는 플랫폼 기업들13일 관련 업계에 따르면 국내 시장점유율 10%대인 원스토어는 2018년부터 앱마켓 수수료를 낮춘 데 이어 작년 10월부터 월 거래액 500만원 이하 사업자에게 수수료를 절반으로 감면해주는 정책을 펴고 있다. 이는 게임, 앱 등 원스토어에 입점한 모든 콘텐츠를 대상으로 하며 수혜 기업만 1만6000곳 이상이다. 특히 원스토어의 행보는 세계적으로 구글, 애플 등 글로벌 앱마켓 공룡들의 앱 수수료가 과도하다는 논란이 일고 있는 가운데 나와 더욱 화제가 됐다. 2016년 출범한 토종 앱마켓 원스토어의 앱 수수료(20%)는 애플 앱스토어·구글 플레이(30%)보다 훨씬 낮다. 통행세 논란이 붙은 인앱결제(앱 내 결제)도 강요하지 않는다. 도리어 개발사가 자체 결제 시스템을 사용할 경우 수수료를 5%로 인하하는 파격적 정책도 시행하고 있다. 글로벌 기업인 마이크로소프트(MS) 역시 오는 8월부터 윈도 모바일을 위한 MS판 앱마켓인 MS스토어에 입점하는 게임 수수료를 기존 30%에서 12%로 인하하기로 했다.경쟁이 치열한 국내 이커머스 업계에서도 최근 들어 수수료 인하 전쟁이 불붙은 상태다. 가장 공격적인 곳은 티몬이다. 점유율 기준 업계 7위인 티몬은 지난달 1일부터 ‘마이너스 수수료’ 정책에 돌입했다. 단품 등록 카테고리에 올라온 상품을 대상으로 3%대인 결제 대행 수수료를 감면해주는 데 그치지 않고, 판매자에게 1%를 추가로 환급해 준다. 위메프 또한 지난달 21일부터 판매 수수료를 2.9%로 고정하는 정책을 시행하고 있다. 수수료율을 업계 평균(13.6%) 대비 5분의 1 수준으로 낮춘 것이다. 기존 오픈마켓 사업자들이 상품 카테고리별로 수수료율을 차등해 받는 관행에서 벗어나 정률 수수료 정책으로 변경했다. 한시적 프로모션이 아닌 고정 모델로 운영 중이다.이밖에 여행플랫폼 트랩비토즈 등도 코로나19 장기화 상황에서 숙박업계와의 고통 분담, 상생을 위해 예약대행 수수료를 추가 인하했다. 국회 과방위 국민의힘 간사인 박성중 의원은 ""플랫폼 대기업의 과도한 수수료로 곳곳에서 갈등이 거센 가운데 일부 기업들의 수수료 인하 행보는 시장 경쟁 회복을 위한 좋은 현상""이라고 평가했다.◆독점 플랫폼 맞선 수수료 경쟁 확산될까 업계 안팎에서는 일부 플랫폼 기업들로 시작된 수수료 인하 움직임이 시장 경쟁 활성화로 이어지는 것이 중요하다고 입을 모은다. 앱 통행세 논란 이후 원스토어를 대안으로 한 기업 문의가 잇따른 것도 동일한 맥락이다. 원스토어의 올해 1분기 성장률은 35.2%로 다른 앱마켓 성장률 7.9%에 비해 약 4.5배 높았다. 작년 초만해도 10% 초반이던 원스토어의 국내 시장 점유율은 앱 통행세 논란이 확산한 하반기 들어 본격적으로 급등, 20%에 육박하고 있다.만약 원스토어가 구글, 애플과 동일한 수수료를 받았다면 연간 추가 수입은 1000억원 이상일 것으로 추산된다. 앞서 이재환 원스토어 대표는 ""업체 입장에서 수수료 부담이 크다""며 수수료 인하 결정이 생태계 상생 차원이라는 점을 강조했다.위메프도 즉각적인 시장 반응을 확인하고 있다. 새 수수료 정책 발표 이후 열흘간 신규 입점업체는 전년 같은 기간 대비 33.2% 증가했다. 전체 입점업체 수도 1년 전보다 22.2% 늘었다. 위메프 관계자는 ""새로운 수수료 정책은 쇼핑 플랫폼으로 진화하는 과정""이라며 ""단기 성과에 연연하지 않고 장기적 선순환 안착에 힘쓰겠다""고 말했다.거대 플랫폼의 승자독식 부작용은 국회에서도 관심을 두고 있는 현안이다. 박 의원은 ""독점 플랫폼이 있어서 시장 경쟁이 어렵다는 게 문제""라며 ""폭리를 취해선 안된다""고 꼬집었다. 그는 ""많은 중소업체, 자영업자들이 높은 수수료에 불만이 많고 입점업체에 대한 플랫폼 행보도 계속 확인되고 있어 (국회에서도) 이 부분을 들여다 보고 있다""며 네이버, 카카오 등 국내 대표 기업들이 개선에 앞장설 것을 촉구했다. 한준호 더불어민주당 의원 역시 ""플랫폼 비즈니스는 좋은 서비스를 소비자와 연결하는 ‘장’이다. 하지만 거대 플랫폼 기업은 갑이 돼가고 있다""며 ""(거대 플랫폼 기업들이) 시장 장악 이후 폭리를 취하기보다 더 좋은 서비스를 제공하는 서비스 측면에서 접근해야 할 것""이라고 지적했다. 조슬기나 기자 seul@asiae.co.kr김보경 기자 bkly477@asiae.co.kr▶ 속 시원한 풀이! 2021년 정통사주·운세·토정비결▶ 직장인을 위한 '빅데이터 분석' 국비 특화과정 모집▶ 투자 성공의 핵심은 기업분석! 'CORE' 바로가기<ⓒ경제를 보는 눈, 세계를 보는 창 아시아경제 무단전재 배포금지>"
2021.05.13.,"AHC, AI 기반 디지털 피부 진단 'SIA by AHC' 론칭",url없음,<네이버 기사 없음>
2021.05.13.,"원자력환경공단, 코로나19 피해업종 돕기 영수증 이벤트",https://n.news.naver.com/mnews/article/022/0003580501?sid=102,"쿠폰 지급 통해 경기 활성화 나서    한국원자력환경공단 전경.원자력환경공단 제공    한국원자력환경공단은 신종 코로나바이러스 감염증(코로나19) 여파로 피해를 입은 숙박업소, 외식업소 등 6개 업종의 소비를 진작시키기 위해 영수증 이벤트를 한다고 12일 밝혔다.   원자력환경공단은 관광객이 경북 경주에서 2일 이내 사용한 총 합산금액 10만원 이상 영수증 사진을 공단 SNS에 보내면 1000명에게 1만5000원 상당의 경주 특산품인 경주빵을 교환할 수 있는 쿠폰을 지급한다.   영수증 이벤트 대상 업종은 숙박, 외식, 관광, 문화, 농·수산물, 화훼 분야 등이다.   카카오톡에서 ‘KORAD 관광소비진작 영수증 이벤트’를 찾아서 영수증 사진을 보내면 된다.   차성수 공단 이사장은 “코로나19로 침체된 지역경기에 1억원 이상 소비진작 효과가 창출될 것으로 기대한다”고 말했다.   경주=이영균 기자 lyg0203@segye.comⓒ 세상을 보는 눈, 세계일보"
2021.05.13.,‘막 오른’ 일양약품 오너 3세 승계 플랜,url없음,<네이버 기사 없음>
2021.05.13.,"넥슨, ‘바람의나라: 연’ 신규 직업 ‘격투가’ 업데이트 사전 예약 실시",url없음,<네이버 기사 없음>
2021.05.13.,"결혼정보회사 노블레스 수현, 부산지사 전격 오픈",url없음,<네이버 기사 없음>
2021.05.13.,머스크의 배신? 비트코인 결제 중단에… 가상화폐 관련주 급락,https://n.news.naver.com/mnews/article/417/0000693202?sid=101,"12일(현지시각) 일론 머스크 테슬라 최고경영자(CEO)가 비트코인을 사용한 테슬라 차의 구매 결제 허용을 중단한다고 밝히면서  국내 가상화폐 관련주가 일제히 약세다./사진=로이터(뉴스1)테슬라가 비트코인 결제를 중단한다는 소식에 국내 가상화폐 관련주가 약세다.  13일 오후 1시 39분 우리기술투자는 전 거래일 대비 1050원(9.25%) 하락한 1만300원에 거래되고 있다. 우리기술투자는 가상화폐 거래소 두나무 지분을 8.03% 보유해 관련주로 분류된다. 마찬가지로 두나무 지분을 보유한 에이티넘인베스트(-9.17%) 대성창투(-7.14%) 한화투자증권(-6.47%) 카카오(-3.10%)도 동반 하락세다. 가상화폐 거래소 빗썸코리아 관련주인 비덴트와 위지트도 각각 7.00%와 5.64% 하락중이다. 일론 머스크 테슬라 최고경영자(CEO)는 12일(현지시각) 트위터를 통해 비트코인을 사용한 테슬라 차의 구매 결제 허용을 돌연 중단한다고 밝혔다. 머스크 CEO는 ""비트코인 채굴을 위해 컴퓨터를 대량 가동하면서 전기가 많이 들고 있다""며 ""이로 인해 화석 연료 사용이 급격하게 증가하고 있다""고 배경을 밝혔다. 머스크 CEO는 지난 2월 테슬라의 비트코인 투자(15억 달러 규모)를 발표하며 가상화폐 시장을 띄우는 데 결정적인 역할을 했다. 비트코인으로 전기차 구매를 허용하는 시스템까지 도입한 바 있다.조승예 기자 csysy24@mt.co.kr▶뜨거운 증시, 오늘의 특징주는?  ▶여론확인 '머니S설문' ▶머니S, 네이버 메인에서 보세요 <저작권자 ⓒ '성공을 꿈꾸는 사람들의 경제 뉴스' 머니S, 무단전재 및 재배포 금지>"
2021.05.13.,[길섶에서] 동전/전경하 논설위원,https://n.news.naver.com/mnews/article/081/0003186080?sid=110,"집 근처 은행 자동화기기센터에 동전교환기가 있다는 걸 얼마 전에 알았다. 동전교환기는 오래전부터 있었는데, 이용 시간을 평일 하루로 줄인다는 안내문이 붙어서 인식했다.몇 년째 동전을 모아둔 돼지저금통을 부쉈다. 동전교환기를 처음 써 봤는데 도와준 은행원이 없었다면 시간이 제법 걸렸거나, 은행원을 불러야 했을 거다. 오전 9시부터 가동됐는데 2시간 만에 ‘동전이 꽉 차 동전통을 비우고 있으니 잠시 기다리라’고 말한 은행원을 만난 건 행운이었다. 은행원이 반환되는 동전을 여러 번 다시 넣었으나 이물질이 묻어 못 읽는다는 500원짜리 동전 2개가 남았다.동전교환기를 가동하면 중간중간 점검을 해야 하고, 처음 쓰면서 묻는 사람도 있어서 은행 지점들이 이용시간을 줄이고 있단다. 동전은 고객에게는 계륵인데 동전교환기는 은행 지점에는 애물단지가 아닐까. 코로나19로 지폐뿐만 아니라 동전도 만지기를 꺼리다 보니 동전을 주고받은 기억이 어렴풋하다. 신용카드를 쓰거나 제로페이, 카카오페이 등 이런저런 앱으로 지불하지만 여전히 가게에서 동전으로 거스름돈을 주고받는 풍경도 본다. ‘동전 없는 사회’는 언제쯤 올까. 생산량이 적은 발행 연도의 동전은 비싸다던데 동전도 동전 나름인 모양이다.lark3@seoul.co.kr▶ 네이버에서 서울신문 구독하기 클릭!  ▶ [인터랙티브] 코로나 청년 잔혹사   ▶ [나우뉴스] 세상에 이런 일이ⓒ 서울신문(www.seoul.co.kr), 무단전재 및 재배포금지"
2021.05.13.,"코스피, 미국발 인플레 공포에 하락",url없음,<네이버 기사 없음>
2021.05.13.,"[경기일보 독자권익위 회의] ""집창촌, 평택항 통관장...기획취재 돋보여""",url없음,<네이버 기사 없음>
2021.05.13.,10년간 쉼 없이 달려온 박서준… 비대면 팬미팅서 팬들과 소통,url없음,<네이버 기사 없음>
2021.05.13.,"성년의 날, 센언니들 ‘사랑받기 좋은 날’ 문화살롱",url없음,<네이버 기사 없음>
2021.05.13.,강릉서 동거녀 숨지게 한 50대 검거,url없음,<네이버 기사 없음>
2021.05.13.,"삼성, LG 등 대기업 줄줄이 ‘백신 유급 휴가’ 도입...재계로 확대될까?",url없음,<네이버 기사 없음>
