기사날짜,기사제목,네이버 뉴스 url,기사내용
2021.05.13.,"LGU+ '유샵', 하나카드 제휴 통해 최대 62% 할인",https://n.news.naver.com/mnews/article/003/0010497498?sid=101,"6월 7일까지 고객 감사 'U+투게더 땡스티벌' 진행가입 고객 대상 갤럭시폰1+1, 안마의자 등 경품 추첨[서울=뉴시스] 오동현 기자 = LG유플러스는 공식 온라인몰 ‘유샵(U+Shop)’을 통해 6월 7일까지 고객 감사 이벤트 ‘U+투게더 땡스티벌’을 실시한다고 13일 밝혔다.U+투게더 땡스티벌은 ‘U+투게더 결합’과 ‘Thanks(감사)’, ‘Festival(축제)’를 조합한 단어로, 유샵과 함께하는 고객을 위한 감사 이벤트다. 모바일 가입 고객 및 홈 서비스 가입 고객을 대상으로 별도로 진행된다.LG유플러스 디지털사업담당 김남수 상무는 “통신사 최초로 가족이 아니어도 결합할인을 받을 수 있는 U+투게더 결합 요금제 이벤트를 통해 LG유플러스 이용고객 모두가 가족이라는 의미로 확장하고자 한다”고 말했다.◇모바일 가입 이벤트LG유플러스는 갤럭시S21, Z플립 5G, Z폴드2 5G, 노트20, A42, A32 등 삼성전자 기종 6종 중 1종을 구매하는 고객을 대상으로 룰렛 이벤트와 퀴즈 이벤트를 진행한다.즉석에서 경품을 확인할 수 있는 룰렛 이벤트는 ▲폰1+1(기종 당 6명, 총 36명) ▲50만원 상당 롯데 시그니엘 1박 호텔숙박권(45명) ▲20만원 상당 차박텐트(45명) ▲4만원 상당 외식 상품권(300명) ▲2만원 상당 주유 상품권(800명)을 증정한다.퀴즈 이벤트는 정답자 수가 많아질수록 경품이 많아진다. 정답자가 500명이 모이면 투게더 아이스크림을, 1000명이 모이면 투게더 아이스크림과 1만원 상당 쿠팡이츠 쿠폰을, 1500명이 모이면 투게더 아이스크림, 1만원 상당 쿠팡이츠 쿠폰과 함께 스타벅스 세트 기프티콘을 모두 증정한다.이와 별도로 갤럭시 S21, Z폴드2 5G, Z플립 5G, 노트 20 중 1종 구매 고객은 ‘이름 시 배경화면’ 이벤트에 자동 응모된다. LG유플러스를 이용해주는 고객들에게 감사의 의미로 특별한 선물인 ‘이름’을 이용한 ‘시’를 만들어 그린 캘리그라피 배경화면을 추첨을 통해 100명에게 전달한다.앞서 유샵은 지난 3일 하나금융그룹과 함께 유샵 전용 제휴카드인 ‘U+Family 하나카드’를 출시, 신규 발급 후 통신요금 자동이체를 등록하는 고객 대상 통신요금 납부금액의 25% 청구할인 혜택을 제공한다. 카드 전월 실적 기준 70만원 이상 월 최대 2만5000원으로, 24개월 환산 시 60만원 할인 받는 것이다.유샵 전용 ‘U+Family 하나카드’를 사용하면서 U+투게더 결합을 하게 되면 최대 62% 할인폭을 누릴 수 있다. 예를 들어 월 8만5000원(이하 VAT포함) 데이터 무제한 요금제를 4명이 이용 시 선택약정, U+투게더 결합, U+Family 하나카드, LTE 그대로 약정 등 할인혜택을 모두 적용하면, 실제 4인 합산 기준 월 34만원에서 총 62% 할인된 12만9000원만 납부하면 된다. 2년 최대 126만원을 할인받는 셈이다.따라서 5G 프리미어 에센셜(월 8만5000원) 4명 이용 기준, 갤럭시 S21는 월 7만6520원, Z플립 5G는 9만2000원, Z폴드2 5G는 11만6010원, 노트20은 8만5330원, A42는 5만2170원에, LTE 프리미어 에센셜(월 8만5000원) 4명 이용 기준, A32는 4만8800원에 이용할 수 있다.‘유샵 전용 제휴팩’ 혜택도 제공한다. 유샵 전용 다이렉트 요금제에 가입 시, 제휴처에서 사용이 가능한 최대 7500원 할인쿠폰을 24개월간 매월 제공하는 혜택이다. 24개월간 총 18만원 혜택을 제공받는 셈이다. 네이버페이, 스마일캐시, GS25, 마켓컬리, 요기요, 카카오T, GS프레시, 하나머니 등 총 8개 제휴처 중 1개 선택이 가능하다.◇인터넷, IPTV 등 홈 가입 이벤트인터넷과 IPTV 신규 가입 고객 대상으로도 모바일과 동일하게 룰렛 이벤트를 진행, 즉석에서 추첨을 통해 ▲세라젬 안마의자(1명) ▲갤럭시S21(2명) ▲닌텐도 링피트 어드벤처(5명) ▲20만원 상당 한샘 가구상품권(10명) ▲2만원 상당 쿠팡이츠 쿠폰(1000명) ▲투게더 아이스크림 교환권(2000명)을 증정한다.웰컴선물로 온 오프라인에서 사용이 가능한 상품권도 마련했다. 인터넷+IPTV+펫케어 결합 가입하면 최대 46만원 상품권을, 인터넷+IPTV 결합 가입하면 최대 44만원 상품권을 증정한다. 신세계(이마트), 스마일캐시, 홈플러스 상품권 중 1종 선택이 가능하다.유샵 단독 매월 7% 추가 요금할인을 통해 인터넷과 IPTV를 보다 합리적인 가격에 이용이 가능하다. 예를 들어, 월 9만2000원으로 인터넷 스마트 기가안심(1GB)와 IPTV 프라임라이트 이용 시 매월 7% 유샵 할인, 3년 약정할인, 인터넷+IPTV 결합할인, 휴대폰 1개 결합할인, 제휴카드(현대카드M) 최대할인을 적용하면 월 8만4500원 할인된 월 7850원만 납부하면 된다. 3년간 최대 304만원을 할인 받는 셈이다.또한 U+tv 프라임라이트 요금제 가입 시 ‘U+아이들나라’ 전용 리모콘 ‘유삐펜’을 무료로 증정하고, 5500원 VOD 쿠폰을 별도 공지까지 매월 제공한다.☞공감언론 뉴시스 odong85@newsis.com▶ 네이버에서 뉴시스 구독하기▶ K-Artprice, 유명 미술작품 가격 공개▶ 뉴시스 빅데이터 MSI 주가시세표 바로가기<ⓒ 공감언론 뉴시스통신사. 무단전재-재배포 금지>"
2021.05.13.,美 '인플레 공포'에 코스피 1%대 하락세(종합),https://n.news.naver.com/mnews/article/001/0012390550?sid=101,"(서울=연합뉴스) 김태종 기자 = 13일 코스피가 미국발 인플레이션 공포에 장 초반 1%대 하락세다.    이날 오전 9시 6분 현재 코스피는 전날보다 37.01포인트(1.17%) 하락한 3,124.65를 나타냈다.    코스피는 14.69포인트(0.46%) 내린 3,146.97에 출발한 뒤 하락 폭이 커졌다.    외국인이 591억원을 순매도 중인 가운데 개인도 1천217억원을 순매도하고 있다. 기관은 1천834억원을 순매수하고 있다.    12일(현지시간) 발표된 미국 소비자물가지수(CPI)가 13년 만에 전년 동월 대비 최대 상승률을 기록했다는 소식에 투자심리가 위축된 모습이다.     전날 뉴욕증시도 3대 지수가 2% 안팎으로 급락했다.     다우존스30 산업평균지수는 1.99%, 스탠더드앤드푸어스(S&P)500 지수는 2.14% 하락했고, 기술주 중심의 나스닥 지수는 2.67% 내렸다.    미국 노동부는 4월 소비자물가지수(CPI)가 전년 동월보다 4.2%, 전월보다 0.8% 각각 올랐다고 발표했다. 전년 동월 대비 상승률은 2008년 이후, 전월 대비 상승률은 2009년 이후 각각 최대폭이다. 이에 미 국채 10년물 금리도 1.61%대에서 1.69%대로 급등했다.     한지영 키움증권 연구원은 ""4월 소비자물가 서프라이즈로 많은 시장참여자가 연방준비제도(Fed·연준)의 물가 전망에 대해서 의구심을 갖는 모습을 보였다""며 ""리처드 클라리다 연준 부의장이 4월 소비자물가가 놀랍지만 일시적일 가능성이 크고 지속적인 인플레이션 출현 시 연준이 행동에 나설 것이라고 언급했음에도 시장에는 별다른 영향을 주지 못했다""고 분석했다.    시가총액 상위 종목 가운데에는 전날 화이자 백신 위탁생산설이 나온 삼성바이오로직스(1.17%)가 상승 중이고, 셀트리온(0.95%)도 소폭 올랐다.     반면, 삼성전자(-1.25%)와 SK하이닉스(-1.67%), LG화학(-1.74%), 네이버(-1.75%), 현대차(-1.10%) 등 대부분의 종목이 하락 중이다.     업종별로는 은행(2.90%)이 2% 이상 강세를 보이고 있고, 통신업(0.85%)과 보험(0.41%)도 오르고 있다.     이를 제외하면 건설업(-1.96%), 운송장비(-1.72%), 철강·금속(-2.19%)과 기계(-1.81%), 전기·전자(-1.87%), 운송장비(-1.70%), 운수창고(-0.94%) 등은 1% 이상 내리고 있다.     같은 시간 코스닥지수는 13.54포인트(1.40%) 내린 953.56이다.     지수는 3.79포인트(0.39%) 하락한 963.31에 출발했다.     개인이 623억원을 순매도하고 있고, 외국인이 624억원을 순매수 중이다. 기관은 15억원 순매수를 나타냈다.     시가총액 상위 주 가운데에는 셀트리온헬스케어(0.09%)와 셀트리온제약(0.15%)이 강보합을 보인 가운데 펄어비스(-1.05%)와 카카오게임즈(-1.38%) 등은 하락세다.     taejong75@yna.co.kr▶네이버에서도 뉴스는 연합뉴스[구독 클릭]▶[팩트체크] 산재 사고 사망자 영국의 10배?▶제보하기<저작권자(c) 연합뉴스(https://www.yna.co.kr/), 무단 전재-재배포 금지>"
2021.05.13.,"국회 찾은 최태원 회장 ""ESG에 기업 생존 달려""(종합)",https://n.news.naver.com/mnews/article/003/0010497443?sid=101,"[서울=뉴시스]최동준 기자 = 최태원 대한상공회의소 회장이 13일 서울 여의도 국회 의장실에서 박병석 국회의장을 예방해 기념촬영을 하고 있다. (공동취재사진) 2021.05.13. photo@newsis.com[서울=뉴시스] 박정규 김지현 윤해리 최서진 기자 = 최태원 대한상공회의소 회장이 13일 국회를 찾아 박병석 국회의장 및 여야 지도부를 예방했다. 정치권과 최 회장은 ESG(환경·사회·지배구조)와 기업가정신의 필요성에 대해 공감을 표했다.최 회장은 이날 오후 국회를 방문해 박 의장과 만나 환담을 나눴다. 대한상의 회장에 취임한 이후 최 회장이 국회를 방문한 것은 이번이 처음이다.박 의장은 ""2대에 걸쳐서 우리나라 대표적인 경제단체의 장을 맡은 것을 축하드린다""며 ""산업과 통상, 에너지 전환 모두 어려운 과제인데 기업가 정신을 가지고 미래 먹거리를 잘 창조해주길 바란다""고 밝혔다.그는 ""2년 전 보아오 포럼(BFA)에서 연설하신 것이 인상적이었다""며 ""당시 사회적 경영 가치에 대해 강조해줬는데, ESG 경영이 기업에 필수 요건이라고 말씀해주신 것 같다. ESG 경영을 늘 강조해주셨으니 국민들에게 사랑 받는 기업이 되길 바란다""고 강조했다. 이에 최 회장은 ""이제 ESG라는게 따로 떨어져서 적당히 돈 버는 용도의 포장만 하면 된다는 정도는 아니다. 거기에 위배되거나 잘못되면 더 이상 기업의 생존이 왔다 갔다할 수 있다""며 ""외국은 ESG가 이미 상식이 됐다""고 동감했다. 박 의장과 최 회장은 기업인들의 경영 활력 제고를 위한 규제 완화 필요성에 대해서도 공감대를 형성했다. 박 의장은 ""미중 갈등이 기술경쟁에서 출발해 무역전쟁으로, 무역 전쟁에서 외교·안보를 포함한 포괄적 패권으로 가기 때문에 경제적으로 미국과 중국을 각각 중심으로 한 글로벌 체인에서 어떻게 살아나느냐 문제가 있다""며 ""기업과 국회, 정부가 따로 갈 수 없다. 필요한 분야에서 규제 완화 문제도 국회가 진지하게 고려할 것""이라고 말했다. 최 회장은 ""샌드박스를 쭉 진행해오면서 규제를 실제로 풀었을 때 어떠한 현상이 일어나는지를 관찰해서 필요한 건 풀고, 그렇지 못한 건 계속 규제돼야 하는 것""이라며 ""규제 완화에 대한 새로운 방법론을 찾기 위해 많은 노력을 하고 있다""고 했다.최 회장은 이어 송영길 더불어민주당 신임 대표와 김기현 국민의힘 대표 권한대행 겸 원내대표 등과도 잇달아 만남을 가졌다.[서울=뉴시스]김진아 기자 = 송영길(왼쪽) 더불어민주당 대표가 13일 서울 여의도 국회에서 최태원 대한상공회의소 회장과 접견하며 인사말을 하고 있다. (공동취재사진) 2021.05.13. photo@newsis.com송 대표는 먼저 ""최 회장 취임 후 대한상의의 위상과 대외적인 이미지가 역동적으로 변화되고 있다는 말씀을 자주 듣는다""며 ""특히 이번에 김택진 NC소프트 대표, 김범수 카카오 의장과 장병규 크래프톤 이사회 의장 등 젊고 유능한 기업인들이 대거 합류했다고 들었다""고 기대감을 나타냈다.그러면서 ""코로나 국난 조기 극복을 위해 각자 위치에서 역할을 깊이 고민하고 국가, 국민, 미래를 위해 더 나은 선택이 무엇인지 머리를 맞대고 함께 풀어갔으면 좋겠다""며 ""오늘 만남을 계기로 초심을 늘 새기고 활발히 소통해서 민생과 경제의 조화로운 발전을(위해) 서로 의기투합하자""고 당부했다.특히 ""최 회장은 경제적 가치뿐만 아니라 기업의 사회적 가치의 중요성을 적극 설명하고 있다. '기업의 사회적 가치의 전도사'라는 말을 들을 정도""라며 ""새로운 기업가 정신을 통해 새로운 기업의 변화를 추동할 수 있기를 기대한다. 저도 재계의 변화를 적극 응원드리고 함께 돕겠다""고 밝혔다. 이에 최 회장은 ""대한상의를 비롯한 재계에서도 포스트 코로나, 포스트 팬데믹 시대에 어떻게 나라의 발전과 경제의 발전을 이룰 수 있는지 고민해야 한다고 생각하고 있다""며 ""무엇보다 소통과 공감이 필요한 시대라고 생각한다""고 화답했다.그러면서 ""많은 의견과 조언을 청취하겠다. 반성할 것은 반성하고 고칠 것은 고치고, 계승·발전시킬 것은 무엇인지, 이걸 통해서 새로운 기업가정신이 무엇인지 찾아내고 이에 맞는 토대와 문화를 구축하는 것이 꼭 필요하다""며 ""소프트웨어가 잘 정리되면 하드웨어도 나름대로 갖춰져서 국민과 소통할 수 있는 경제계가 되지 않을까 희망하고 있다""고 말했다.김기현 국민의힘 원내대표 겸 대표 권한대행은 ""요즘 기업하기 어려운 환경이란 소식도 들리고, 실제로 과도한 규제가 계속되고 있다""며 규제 개혁을 강조했다.그는 ""국회에서 입법 활동이 활발해지면 대체로 기업 규제가 많아지는 추세를 보이는 것에 대해 매우 안타까운 마음""이라며 ""앞으로 이런 부분에 대한 규제를 사전에 거르는 장치를 해야 되는 것 아니냐는 생각을 갖는다""고 안타까움을 표했다.아울러 ""앞으로 대한상의가 이런 기업가정신을 고취시키고, 기업인이 좀 더 좋은 환경에서 좋은 일자리 만들어내서 노사가 함께 공생하는 토대를 만드는 데 앞장서달라""고 부탁했다.[서울=뉴시스]최동준 기자 = 국민의힘 김기현 대표 권한대행 겸 원내대표가 13일 서울 여의도 국회에서 최태원 대한상공회의소 회장을 접견해 인사말을 하고 있다. (공동취재사진) 2021.05.13. photo@newsis.com최 회장은 ""많은 분들의 생각과 조언을 들어야 된다고 생각한다""며 ""저희가 어떻게 가는 게 좋은가를 듣기 위해 더 귀를 열고 국회, 국민의 여론이 상당히 함축되게 오기 때문에 이곳에서 많은 걸 듣고 반영해야 된다""고 화답했다.또 ""저희가 모든 것을 잘했다고 생각은 하지 않는다. 반성해야 될 부분은 반성하고 새롭게 유지하고 더욱 계승하고 발전할 것을 추려서 새로운 기업가 정신을 만들려고 하는 게 당면과제""라고 말했다.최 회장은 ""저희도 기업가정신을 고취해야 한다는 생각을 갖고 있다""며 ""새로운 시대와 조류에 맞는 기업가정신을 통해 기업이 새로 거듭나야 한다""고 덧붙였다.이날 고용진 더불어민주당 수석대변인은 간담회 뒤 기자들과 만나 ""송 대표는 '반도체, 자동차 분야 생태계 관련 산업이 적극 추진돼서 1차, 2차 벤더들이 혜택을 누릴 수 있으면 좋겠다, 삼성이 수익 얼마 난다고 할 때 하청업체들까지 잘 됐으면 하는 바람을 갖는다'고 했다""며 ""그래야 정부도 지원을 더 활발하게 할 수 있지 않느냐는 명분""이라고 전했다.이어 ""최 회장은 '반도체와 관련해 여러 장비들을 일본이 안 만들고 있기 때문에 우리 벤더들이 잘 공급하고 있고 상장회사는 많아지고 있다'고 했다""고 말했다.다만 재계의 관심사항인 이재용 삼성전자 부회장 사면 및 중대재해처벌법 관련 논의는 없었던 것으로 전해졌다. 고 수석대변인은 ""오늘은 예방 차원이다. 재계 이슈는 없었다""고 밝혔다.☞공감언론 뉴시스 pjk76@newsis.com, fine@newsis.com, bright@newsis.com, westjin@newsis.com▶ 네이버에서 뉴시스 구독하기▶ K-Artprice, 유명 미술작품 가격 공개▶ 뉴시스 빅데이터 MSI 주가시세표 바로가기<ⓒ 공감언론 뉴시스통신사. 무단전재-재배포 금지>"
2021.05.13.,"'친누나 살해 후 농수로 유기' 남동생, 구속 기소",https://n.news.naver.com/mnews/article/003/0010495660?sid=102,"[인천=뉴시스] 김동영 기자 = 살인 및 사체유기 혐의로 구속영장이 신청된 남동생 A(27)씨가 2일 오후 1시45분 인천지방법원에 들어서고 있다. 2021. 05.02. dy0121@newsis.com[인천=뉴시스] 김동영 기자 = 누나를 살해한 뒤 인천 강화군 석모도의 농수로에 유기한 남동생이 재판에 넘겨졌다.인천지검 형사3부(부장검사 김태운)는 살인 및 사체유기 혐의로 남동생 A(27)씨를 구속기소했다고 13일 밝혔다. 검찰은 보강 수사를 거쳐 구속기간 열흘을 연장하지 않은 채 재판에 넘겼다. A씨는 지난해 12월 중순 인천 남동구의 아파트에서 누나 B(30대)씨를 흉기로 수차례 찔러 살해한 뒤 시신을 인천 강화군 석모도의 농수로에 유기한 혐의 등을 받고 있다. B씨의 시신을 10일 동안 아파트 옥상에 방치하고 지난해 12월 말 시신을 여행용 가방에 넣은 뒤 렌터카에 싣고 석모도의 농수로에 유기한 것으로 파악됐다. 남매의 어머니는 남동경찰서 관할 지구대에 지난 2월14일 딸 B씨의 가출신고를 했으나 A씨가 누나로 위장해 보낸 카카오톡 메시지를 받고 지난달 1일 가출신고를 취소했다. 조사결과 A씨는 범행 후 누나 B씨의 카카오톡 계정을 이용해 자신과 부모에게 메시지를 보내고 누나가 살아있는 것처럼 위장, 가출 신고를 취소하게 했다.남동생은 최근 B씨의 장례식에서 자신이 살해한 누나의 영정도 들고나오는 등 경찰과 가족에게 범행을 은폐한 것으로 드러났다. 인천경찰청 수사전담반은 지난달 21일 농수로에서 숨진 채 발견된 B씨의 통신·금융 기록을 분석한 결과, 유력 용의자를 남동생 A씨로 특정하고 같은달 29일 오후 4시39분 경북 안동에서 검거했다. 경찰은 최근 법원으로부터 통신 및 금융계좌추적용 영장을 발부받아 용의자를 추적했으며 B씨의 재산이 A씨의 계좌로 들어간 정황 등을 포착했다. B씨는 남동생과 함께 인천 남동구의 아파트에서 지낸 것으로 확인됐다. 농수로에서 발견될 당시 B씨는 물에 잠겨 부푼 상태였다.국립과학수사연구원은 최근 경찰에 “흉기에 의한 대동맥 손상”이라는 정밀 검사 결과를 전달했다. 경찰은 범죄분석관을 투입해 A씨에 대한 사이코패스 진단 및 분석을 진행했으나 특이점은 확인되지 않았다.경찰 관계자는 ""A씨가 최근 경찰 조사에서 '부모님께 죄송하다. 선처를 부탁드린다'고 진술했다”고 전했다.☞공감언론 뉴시스 dy0121@newsis.com▶ 네이버에서 뉴시스 구독하기▶ K-Artprice, 유명 미술작품 가격 공개▶ 뉴시스 빅데이터 MSI 주가시세표 바로가기<ⓒ 공감언론 뉴시스통신사. 무단전재-재배포 금지>"
2021.05.13.,오늘부터 네이버 댓글 쓰면 프로필 사진 뜬다는데…‘악플과의 전쟁’ 이번엔 통할까,https://n.news.naver.com/mnews/article/366/0000716875?sid=105,"13일부터 뉴스 댓글 작성자 프로필 사진 공개댓글 이력 공개·연예 댓글 폐지에도 문제 여전“실효성 없어”vs“작성자 책임감 느끼게 해”일러스트=김도원 화백⋅조선일보DB        13일 오후 3시부터 네이버 뉴스 기사에 댓글을 쓰면 작성자의 프로필 사진이 공개된다. 작성자의 신원이 좀 더 노출되면 악플(악성 댓글)도 더 근절될 거라는 기대에서 나온 조치다. 네이버가 1년 넘게 ‘악플과의 전쟁’을 벌이고 있는 가운데, 이번 조치가 효과를 발휘할지를 두고 의견이 분분하다.네이버는 최근 “(원래) 기사 댓글에는 프로필 대신 마스킹(가림) 처리된 아이디 앞 4자리만 남겨져 있어 사용자 인지가 어렵다는 의견이 있어 왔다”며 “댓글 사용자를 쉽게 알 수 있도록 13일부터 기사 댓글 목록에서도 작성자 본인이 설정한 프로필 사진을 함께 서비스한다”고 밝혔다.인터넷 실명제까지는 아니지만, 작성자의 신원을 더 특정할 수 있는 환경을 만들어 댓글 작성자가 자기 댓글에 대해 책임감을 가질 수 있도록 하겠다는 취지다. 네이버 관계자는 “프로필 사진을 공개함으로써 누리꾼 사이에서 댓글 자정 움직임이 만들어져 책임 있는 댓글 문화를 형성할 것으로 기대한다”고 말했다.네이버가 ‘악플과의 전쟁’을 본격화한 지 1년이 넘었지만 여전히 악플 문제는 해결되지 않고 있다. 2019년 10월 가수 겸 배우 고(故) 설리(본명 최진리)가 악플에 시달리다가 극단적 선택을 한 것을 계기로, 인터넷 포털업체도 악플 방치의 책임을 피할 수 없게 됐다.네이버는 지난해 3월 연예인을 겨냥한 악플이 빈번하던 연예뉴스 기사의 댓글을 폐지했다. 또 댓글 작성자가 지금까지 작성한 모든 댓글, 최근 30일간 받은 댓글 공감 비율, 스스로 삭제한 댓글 비율 등의 ‘댓글 이력’을 다른 모든 사용자가 볼 수 있도록 시스템을 개편했다.지난해 7월 프로배구 고유민 선수가 극단적 선택을 하는 일이 다시 발생하자 네이버는 한 달 뒤인 지난해 8월 스포츠뉴스 기사 댓글도 폐지했다. 올해 들어서는 지난 1월 인공지능(AI) 기반 악플 차단 프로그램인 ‘AI 클린봇’이 욕설뿐만 아니라 성적 불쾌감을 일으킬 수 있는 표현까지 차단할 수 있도록 업그레이드했다.포털 사이트 다음을 운영하는 카카오(035720)도 2019년 10월과 지난해 8월 각각 연예뉴스와 스포츠뉴스 기사 댓글을 폐지했다. 앞서 2017년 7월엔 악플 표현을 음표(♪)로 바꿔 표시하는 기능을 도입하는 등 일찍이 악플 잡기에 나선 바 있다.네이버 기사의 댓글 작성자 프로필 사진을 공개하는 13일에도 여전히 기사 댓글란에 악플이 달리고 있다. /네이버 캡처        하지만 연예·스포츠뉴스 외 일반 뉴스 기사에서 특정 계층, 개인, 정치인 등을 겨냥해, 일부러 맞춤법이 틀리거나 은유적으로 표현하는 악플이 여전히 성행하고 있어, 포털업체 입장에서는 추가 조치를 해야 하는 상황이다.이 가운데 나온 ‘프로필 사진 공개’의 실효성에 대해선 반응이 엇갈리고 있다. 포털업계의 한 관계자는 “사용자의 신원이 특정되는 소셜미디어(SNS) 기반으로 로그인하는 방식이라면 프로필 사진 공개가 실효성이 있을 것으로 본다”며 “하지만 네이버는 그런 방식이 아니기 때문에 사용자가 프로필에 아무 사진이나 올려놓으면 실효성이 크지 않을 것으로 본다”고 말했다. 반면 다른 관계자는 “프로필은 자기 사진이 아니더라도 자신의 개성을 드러내는 만큼 사용자가 보다 책임감 있게 댓글을 쓰게 될 것으로 본다”고 했다.프라이버시 침해 우려도 나온다. 성동규 중앙대 미디어커뮤니케이션학부 교수는 “사용자가 자기 얼굴 사진을 프로필에 설정해 놓을 경우 이것을 네이버가 노출시키면 초상권이 침해될 수도 있기 때문에 오히려 실명보다도 프로필 사진 공개가 더 민감한 프라이버시 문제가 될 수 있다”고 말했다.[김윤수 기자 kysme@chosunbiz.com] ▶네이버에서 '명품 경제뉴스' 조선비즈를 구독하세요▶관광객 2배 늘어난 이곳, 車 렌트 '하늘의 별따기'▶광안리서 상어 낚시를?… '이 고글'만 쓰면 된다	저작권자 ⓒ 조선비즈, 무단 전재 및 재배포 금지"
